id,sitzung,wahlperiode,in_writing,speaker,speaker_cleaned,speaker_fp,sequence,text,filename,type,speaker_party
2359052,23,17,0,Dr. Dagmar Enkelmann [DIE LINKE],Dr. Dagmar Enkelmann,dagmar-enkelmann,311,Der Katalog wird also durch die Bundesregierung fortgesetzt?,data/txt/17023.txt,poi,linke
2359053,23,17,0,"Hans-Joachim Fuchtel, Parl. Staatssekretär bei der Bundesministerin für Arbeit und Soziales",Hans-Joachim Fuchtel,hans-joachim-fuchtel,312,,data/txt/17023.txt,speech,
2359054,23,17,0,Vizepräsidentin Gerda Hasselfeldt,Gerda Hasselfeldt,gerda-hasselfeldt,313,"Sie haben nur zwei Zusatzfragen, Frau Kollegin. Sie kennen die Geschäftsordnung.

Die Frage 37 der Kollegin Dr. Enkelmann wird aufgrund von Nr. 2 Abs. 2 der Richtlinien für die Fragestunde schriftlich beantwortet. Die Frage 38 der Kollegin Katja Dörner wird ebenfalls schriftlich beantwortet, genauso wie die Frage 39 des Kollegen Dr. Ilja Seifert und die Fragen 40 und 41 der Kollegin Sabine Zimmermann.

Damit kommen wir zur Frage 42 der Kollegin Silvia Schmidt:

Wird die Bundesagentur für Arbeit aufgrund der nunmehr durch ein neues Verfahren möglichen Identifizierung bisher nicht zur Schwerbehindertenausgleichsabgabe zahlungsverpflichteter Arbeitgeber bei bisher nicht erfassten Arbeitgebern die Schwerbehindertenausgleichsabgabe nacherheben, und für wie viele Jahre wird die Nacherhebung festgesetzt?",data/txt/17023.txt,chair,
2359055,23,17,0,"Hans-Joachim Fuchtel, Parl. Staatssekretär bei der Bundesministerin für Arbeit und Soziales",Hans-Joachim Fuchtel,hans-joachim-fuchtel,314,"Die Frage darf ich wie folgt beantworten: Arbeitgeber mit mindestens 20 Arbeitsplätzen sind verpflichtet, auf wenigstens 5 Prozent der Arbeitsplätze schwerbehinderte Menschen zu beschäftigen. Wer seiner Beschäftigungspflicht nicht nachkommt, hat pro unbesetztem Pflichtarbeitsplatz eine Ausgleichsabgabe zu entrichten. Wie Ihnen die Bundesregierung bereits auf Ihre schriftliche Frage 53 auf Bundestagsdrucksache 17/639 mitgeteilt hat, schreibt die Bundesagentur für Arbeit jährlich die Arbeitgeber an, bei denen eine Beschäftigungspflicht vorliegen könnte. Auch die Integrationsämter der Länder können dabei potenziell beschäftigungspflichtige Arbeitgeber benennen, die nach der Datenlage der Bundesagentur für Arbeit nicht als solche identifiziert wurden. Auch diese werden dann von der Bundesagentur angeschrieben. Zurzeit läuft das Anzeigeverfahren für das Jahr 2009. Die Verfahren für die früheren Jahre sind abgeschlossen.",data/txt/17023.txt,speech,
2359056,23,17,0,Vizepräsidentin Gerda Hasselfeldt,Gerda Hasselfeldt,gerda-hasselfeldt,315,"Ihre Zusatzfrage, bitte.",data/txt/17023.txt,chair,
2359057,23,17,0,Silvia Schmidt (Eisleben) (SPD),Silvia Schmidt,silvia-schmidt,316,"Sehr verehrter Kollege, Herr Staatssekretär, das ist mir bekannt. Ich hatte darüber hinaus gefragt, wie damit in Zukunft umgegangen wird.

Es gibt einen Antrag des Landes Baden-Württemberg, der auf der Arbeits- und Sozialministerkonferenz, also auf der ASMK, im November einstimmig angenommen wurde, in dem das Bundesministerium für Arbeit und Soziales aufgefordert wird, unverzüglich festzustellen, wie viele Arbeitgeber in den vergangenen drei Jahren ihrer Anzeigepflicht nicht nachgekommen sind und um welche Beträge es sich handelt, die im Rahmen der Ausgleichsabgabe noch nachgefordert werden können. Dazu ist noch einmal darzulegen, auf welcher rechtlichen Grundlage eine nachträgliche Beschäftigungsanzeige bzw. eine Nachforderung wegen der fälligen Ausgleichsabgabe erfolgen kann und ob darauf verzichtet werden kann. Außerdem ist mitzuteilen, welche Maßnahmen unternommen werden, damit die Arbeitgeber künftig fristgerecht und entsprechend den gesetzlichen Bestimmungen ihrer Anzeige- und Zahlungspflicht nachkommen. Als Termin für die Stellungnahme der BA wurde der 31. Dezember 2009 genannt. Ist das geschehen und, wenn ja, in welcher Art?",data/txt/17023.txt,speech,spd
2359058,23,17,0,"Hans-Joachim Fuchtel, Parl. Staatssekretär bei der Bundesministerin für Arbeit und Soziales",Hans-Joachim Fuchtel,hans-joachim-fuchtel,317,"Eine Pflicht des Arbeitgebers, der Bundesagentur für Arbeit die im Zusammenhang mit Beschäftigungspflicht und Ausgleichsabgabe erforderlichen Daten anzuzeigen, besteht nach geltender Gesetzeslage - § 80 Abs. 2 Satz 1 SGB IX - jeweils jährlich zum 31. März nur für das vorangegangene Kalenderjahr. So ist die momentane Rechtslage. Ziel ist, möglichst alle beschäftigungspflichtigen Arbeitgeber zu erfassen, nicht zuletzt aus Gerechtigkeitserwägungen. Das ist sicher richtig. Die Ausgleichsabgabe dient aber nicht der Erzielung von Einnahmen, sondern hat im Kern die Funktion, Arbeitgeber zur Beschäftigung schwerbehinderter Menschen zu bewegen. Diesem Hauptziel wird entgegengewirkt, wenn neu als beschäftigungspflichtig ermittelte Arbeitgeber gleich mit Nachzahlungen konfrontiert würden; denn dies würde ihre Bereitschaft, in Zukunft schwerbehinderte Menschen zu beschäftigen, eher mindern als heben.

Eventuelle Mehreinnahmen dürften sich in Grenzen halten, weil es sich häufig um Kleinbetriebe knapp über der Grenze von 20 Beschäftigten handeln dürfte. Diese zahlen ohnehin nur sehr geringe Abgaben. Teilweise werden sie auch einen schwerbehinderten Menschen beschäftigen, sodass gar keine Abgabe anfällt. Auch die Möglichkeit, Aufträge an Werkstätten für behinderte Menschen auf die Abgabeschuld anzurechnen, wird eventuelle Mehreinnahmen mindern. Auch ist nicht jeder neu ermittelte Arbeitgeber wirklich neu. Grund für die erneute Ermittlung bereits in der Vergangenheit erfasster Arbeitgeber sind häufig Ausgliederung, Namensänderung oder Sitzverlegung. Schließlich wird man nicht davon ausgehen können, dass ausschließlich Fälle von Böswilligkeit oder Verschweigen vorliegen. In vielen Fällen ist es so, dass die Grenze von 20 Beschäftigten überschritten wurde. Das ist zwar keine Entschuldigung für den Arbeitgeber, sollte aber nicht unberücksichtigt bleiben, wenn man eine positive Einstellung der Arbeitgeber zur Beschäftigung behinderter Menschen anstrebt.

Deshalb hält es die Bundesregierung für wesentlich effektiver, wenn die Integrationsämter der Länder auf neue beschäftigungspflichtige Arbeitgeber zugehen, sie mit den Fördermöglichkeiten vertraut machen und es ihnen dadurch erleichtern, ihre Beschäftigungspflicht zu erfüllen. Von einer solchen Vorgehensweise würden vor allem schwerbehinderte Menschen profitieren, die einen Arbeitsplatz suchen.

So viel zur grundsätzlichen Einstellung des Ministeriums zu diesem Fragenkomplex.

Die konkrete Frage, was aufgrund der Beschlüsse, die Sie hier zitiert haben, geschehen ist, muss ich Ihnen schriftlich beantworten; denn dazu liegen mir gegenwärtig keine eigenen Erkenntnisse vor.",data/txt/17023.txt,speech,
2359059,23,17,0,Vizepräsidentin Gerda Hasselfeldt,Gerda Hasselfeldt,gerda-hasselfeldt,318,Haben Sie eine weitere Zusatzfrage?,data/txt/17023.txt,chair,
2359060,23,17,0,Silvia Schmidt (Eisleben) (SPD),Silvia Schmidt,silvia-schmidt,319,"Er kann meine Frage ja nicht beantworten. Deshalb würde ich mich freuen, eine schriftliche Antwort vom Staatssekretär zu bekommen.",data/txt/17023.txt,speech,spd
2359061,23,17,0,Vizepräsidentin Gerda Hasselfeldt,Gerda Hasselfeldt,gerda-hasselfeldt,320,"Wir kommen damit zur Frage 43 der Kollegin Silvia Schmidt:

In wessen Verantwortung wird die Rehabilitation schwerbehinderter Menschen im Rahmen der geplanten getrennten Aufgabenwahrnehmung im SGB II künftig stehen, und wie werden die Verantwortungsbereiche des Rehaverfahrens künftig unter den Trägern der Grundsicherung und der Bundesagentur aufgeteilt?",data/txt/17023.txt,chair,
2359062,23,17,0,"Hans-Joachim Fuchtel, Parl. Staatssekretär bei der Bundesministerin für Arbeit und Soziales",Hans-Joachim Fuchtel,hans-joachim-fuchtel,321,"Ich darf die Frage wie folgt beantworten: Für die gesetzliche Regelung der Neuorganisation der Grundsicherung für Arbeitsuchende hat die Bundesministerin für Arbeit und Soziales in Form der Arbeitsentwürfe eines Gesetzes zur Einführung der eigenverantwortlichen und kooperativen Aufgabenwahrnehmung in der Grundsicherung für Arbeitsuchende und eines Gesetzes zur Verstetigung der Option einen Vorschlag unterbreitet, der eine Gestaltung im Rahmen der bestehenden staatlichen Ordnung, also ohne Änderung des Grundgesetzes und ohne Verschiebungen der Finanzierungslasten zwischen Bund, Ländern und Kommunen, vorsah. Derzeit werden, wie das Haus weiß, Gespräche geführt, die zum Ziel haben, eine Grundgesetzänderung als Basis für die Neuorganisation der Grundsicherung für Arbeitsuchende vorzuschlagen. Je nach Erfolg dieser Gespräche werden die vorgelegten Arbeitsentwürfe nicht weiterverfolgt.

Ich weise darauf hin, dass die Zuständigkeit für die Leistungen zur Teilhabe am Arbeitsleben für schwerbehinderte erwerbsfähige Hilfebedürftige von der Frage der Rehazuständigkeit nach dem SGB IX zu trennen ist. Die Erbringung von Leistungen zur Teilhabe schwerbehinderter Menschen am Arbeitsleben ist alleinige Aufgabe der zuständigen Leistungsträger nach dem SGB II, sofern es sich um erwerbsfähige Hilfebedürftige handelt. Erst wenn eine Behinderung nach dem SGB IX festgestellt wurde, stellt sich die Frage nach dem verantwortlichen Rehabilitationsträger. Zuständig zur Erbringung von Leistungen zur Teilhabe behinderter Menschen sind die zuständigen Leistungsträger nach dem SGB IX. Inwieweit aufgrund der Neuorganisation der Grundsicherung für Arbeitsuchende Anpassungen notwendig sind, ist im Rahmen des Gesetzgebungsverfahrens zu entscheiden.",data/txt/17023.txt,speech,
2359063,23,17,0,Vizepräsidentin Gerda Hasselfeldt,Gerda Hasselfeldt,gerda-hasselfeldt,322,"Haben Sie eine Nachfrage, Frau Kollegin?",data/txt/17023.txt,chair,
2359064,23,17,0,Silvia Schmidt (Eisleben) (SPD),Silvia Schmidt,silvia-schmidt,323,"Ja, ich habe eine Nachfrage. - Bis jetzt war es immer so gewesen: Wenn jemand im Rechtskreis SGB II war und Behinderter bzw. Rehabilitand war, wurde gemäß SGB III das Arbeitsamt beauftragt, hierzu einige Feststellungen zu treffen, wie stark die Behinderung und wie groß der Rehabedarf ist und wie man die Eingliederung mit dem jeweiligen Betroffenen vorantreibt. Die BA hat dann die Aufgabe der jeweiligen Optionskommune oder des Eigenbetriebes mit übernommen; der Eigenbetrieb hat das höchstens kontrolliert und es auch finanziert. Wie soll das jetzt in Zukunft aussehen? Das konnte ich jetzt nicht nachvollziehen; die schwerbehinderten Menschen haben selbstverständlich einen Anspruch darauf, auch in Zukunft zu wissen, an wen sie sich zu wenden haben, egal in welchem Rechtskreis.",data/txt/17023.txt,speech,spd
2359065,23,17,0,"Hans-Joachim Fuchtel, Parl. Staatssekretär bei der Bundesministerin für Arbeit und Soziales",Hans-Joachim Fuchtel,hans-joachim-fuchtel,324,"Ich habe mit meinem letzten Satz der Antwort auf die Frage zu erklären versucht, dass dies wohl von der Gesetzesgestaltung und davon abhängt, wie sie für die Zukunft ausgeformt wird. Wie wir wissen, ist diese Sache voll in Verhandlungen. Diesen Verhandlungen kann man mit Sicherheit an dieser Stelle hier am heutigen Tag nicht vorgreifen.

Ich weise aber darauf hin: Nach den Erkenntnissen der Bundesregierung läuft das Verfahren bislang weitgehend reibungslos. Die Bundesagentur für Arbeit unterrichtet die zuständige Arbeitsgemeinschaft oder den zugelassenen kommunalen Träger und den Hilfebedürftigen zunächst einmal schriftlich über den festgestellten Rehabilitationsbedarf und die demgemäß ergehenden Eingliederungsvorschläge. Der Grundsicherungsträger entscheidet über den Eingliederungsvorschlag im Rahmen seiner Leistungsverantwortung innerhalb von drei Wochen. Die durch die Schnittstellen im Rahmen dieses Verfahrens gegebenen Schwierigkeiten, insbesondere bei der Identifizierung des Rehabilitationsbedarfs, konnten in den letzten Jahren deutlich verringert werden. So ist die Situation.

Sicherlich ist es das Ziel jeder weiteren Gesetzgebung, dass dieser Zustand so erhalten bleibt und dass diese Gesetzesformulierungen so gefasst werden, dass sie den entsprechenden Zwecken Rechnung tragen.",data/txt/17023.txt,speech,
2359066,23,17,0,Vizepräsidentin Gerda Hasselfeldt,Gerda Hasselfeldt,gerda-hasselfeldt,325,"Wollen Sie noch einmal nachfragen? - Ich weise aber darauf hin, dass wir am Ende der Zeit für die Fragestunde sind.

Herr Staatssekretär, ich danke Ihnen. Wir sind am Ende der Fragestunde. Die noch offenen Fragen werden schriftlich beantwortet werden.

Ich rufe nun den Zusatzpunkt 1 auf:

Aktuelle Stunde

auf Verlangen der Fraktion BÜNDNIS 90/DIE GRÜNEN

Schweigen der Bundeskanzlerin zur Sozialpolitik der Bundesregierung

Ich eröffne die Aussprache. Als erste Rednerin erteile ich das Wort der Kollegin Renate Künast für die Fraktion Bündnis 90/Die Grünen.",data/txt/17023.txt,chair,
2359067,23,17,0,Renate Künast (BÜNDNIS 90/DIE GRÜNEN),Renate Künast,renate-kunast,326,"Frau Präsidentin! Meine Damen und Herren! Diese Aktuelle Stunde ist notwendig, weil die Bundeskanzlerin schweigt",data/txt/17023.txt,speech,gruene
2359068,23,17,0,,,,327,Beifall beim BÜNDNIS 90/DIE GRÜNEN und bei der SPD,data/txt/17023.txt,poi,
2359069,23,17,0,Renate Künast (BÜNDNIS 90/DIE GRÜNEN),Renate Künast,renate-kunast,328,"und damit die Bundesregierung schweigt: Was ist eigentlich die Linie bei der sozialen Gerechtigkeit?

Ich meine, dass der Bundestag, dass die Öffentlichkeit das Recht hat, hier und jetzt zu erfahren, wohin die Reise eigentlich gehen soll. Frau Merkel lässt manchmal ganz gnädig über ihren Pressesprecher mitteilen, dass der Duktus des wahlkämpfenden Vizekanzlers nicht ihrer sei. Das hätten wir auch gar nicht gedacht.

Aber es geht gar nicht um die sprachliche Note. Wir sind ja hier nicht in Vancouver, bei der A- und B-Note, bei der Frage, ob sozusagen die Art der künstlerischen Vorführung ein besonders guter Duktus gewesen sei. Nein, es geht an dieser Stelle um die Frage: Wohin soll die Reise gehen? Wie sieht im 21. Jahrhundert in Deutschland soziale Gerechtigkeit aus?",data/txt/17023.txt,speech,gruene
2359070,23,17,0,,,,329,Beifall beim BÜNDNIS 90/DIE GRÜNEN und bei der SPD,data/txt/17023.txt,poi,
2359071,23,17,0,Renate Künast (BÜNDNIS 90/DIE GRÜNEN),Renate Künast,renate-kunast,330,Dazu kann ich nur sagen: Schauen Sie auf die Bänke der Regierung! Das ist der Hinweis auf Führungslosigkeit.,data/txt/17023.txt,speech,gruene
2359072,23,17,0,,,,331,Beifall beim BÜNDNIS 90/DIE GRÜNEN und bei der SPD,data/txt/17023.txt,poi,
2359073,23,17,0,Renate Künast (BÜNDNIS 90/DIE GRÜNEN),Renate Künast,renate-kunast,332,"Frau Merkel lässt die Dinge treiben, statt von ihrer Richtlinienkompetenz Gebrauch zu machen. Schauen Sie auf die beiden Stühle von Kanzlerin und Vizekanzler! Sie haben es nicht nötig, zu kommen, und das in einer Zeit, in der in diesem Land 5 Millionen Menschen Arbeit suchen und sich Millionen Menschen fragen, wie die Zukunft ihrer Kinder aussieht, in der 1,8 Millionen Kinder Leistungen nach Hartz IV beziehen, in der die Zeitungen mit diesem Klamauk, mit dieser Riesenwelle von einem Westerwelle gefüllt sind. Herr Westerwelle sagt: Führen wir doch eine Generaldebatte im Deutschen Bundestag! Aber der Mann hat es nicht nötig, sich hier hinzusetzen, geschweige denn, eine Generaldebatte zu initiieren.",data/txt/17023.txt,speech,gruene
2359074,23,17,0,,,,333,Beifall beim BÜNDNIS 90/DIE GRÜNEN und bei der SPD,data/txt/17023.txt,poi,
2359075,23,17,0,Elke Ferner [SPD],Elke Ferner,elke-ferner,334,Er traut sich nicht!,data/txt/17023.txt,poi,spd
2359076,23,17,0,Dr. Heinrich L. Kolb [FDP],Dr. Heinrich L. Kolb,heinrich-kolb,335,"Das ist keine Generaldebatte, sondern eine Aktuelle Stunde!",data/txt/17023.txt,poi,fdp
2359077,23,17,0,Renate Künast (BÜNDNIS 90/DIE GRÜNEN),Renate Künast,renate-kunast,336,"Wahrscheinlich kann Herr Westerwelle nicht hier sein, weil der Vizekanzler auf einer Riesenwelle aus wildem Populismus irgendwie versucht, den 9. Mai in Nordrhein-Westfalen zu erreichen.

An dieser Stelle räume ich einen Fehler der Grünen ein.",data/txt/17023.txt,speech,gruene
2359078,23,17,0,,,,337,Beifall bei der FDP,data/txt/17023.txt,poi,
2359079,23,17,0,Renate Künast (BÜNDNIS 90/DIE GRÜNEN),Renate Künast,renate-kunast,338,"- Gut, dass gerade die FDP klatscht. - Wissen Sie, was der Fehler war? Der Fehler war: Wir haben immer gedacht, mit Herrn Kinkel sei der außenpolitische Tiefstand in der Tradition einer Genscher-FDP erreicht.",data/txt/17023.txt,speech,gruene
2359080,23,17,0,,,,339,Heiterkeit beim BÜNDNIS 90/DIE GRÜNEN und bei der SPD,data/txt/17023.txt,poi,
2359081,23,17,0,Renate Künast (BÜNDNIS 90/DIE GRÜNEN),Renate Künast,renate-kunast,340,Wir haben uns geirrt. Das gestehe ich ein. Es geht noch tiefer.,data/txt/17023.txt,speech,gruene
2359082,23,17,0,,,,341,Beifall beim BÜNDNIS 90/DIE GRÜNEN und bei der SPD,data/txt/17023.txt,poi,
2359083,23,17,0,Renate Künast (BÜNDNIS 90/DIE GRÜNEN),Renate Künast,renate-kunast,342,"Vielleicht könnte sich Herr Westerwelle mit Friedenstiften und anderen Aufgaben beschäftigen, statt den inneren Frieden zu gefährden.

Das Bundesverfassungsgericht hat ein weitreichendes Urteil gefällt. Wenn Karlsruhe ein solches Urteil fällt, wäre es angemessen, zu sagen, wohin die Reise gehen soll.",data/txt/17023.txt,speech,gruene
2359084,23,17,0,Peter Weiß [Emmendingen] [CDU/CSU],Peter Weiß,peter-weiß,343,Das war doch euer Gesetz!,data/txt/17023.txt,poi,cducsu
2359085,23,17,0,Renate Künast (BÜNDNIS 90/DIE GRÜNEN),Renate Künast,renate-kunast,344,"Stattdessen lässt es die Bundeskanzlerin zu, dass der Vizekanzler in niederträchtigster Art und Weise die Armen gegen die Ärmsten ausspielt.",data/txt/17023.txt,speech,gruene
2359086,23,17,0,Paul Lehrieder [CDU/CSU],Paul Lehrieder,paul-lehrieder,345,Oh weia!,data/txt/17023.txt,poi,cducsu
2359087,23,17,0,Renate Künast (BÜNDNIS 90/DIE GRÜNEN),Renate Künast,renate-kunast,346,Herr Westerwelle spaltet. Er hat keinen einzigen neuen Job geschaffen.,data/txt/17023.txt,speech,gruene
2359088,23,17,0,Elke Ferner [SPD],Elke Ferner,elke-ferner,347,Doch! In den Ministerien!,data/txt/17023.txt,poi,spd
2359089,23,17,0,Renate Künast (BÜNDNIS 90/DIE GRÜNEN),Renate Künast,renate-kunast,348,"Er hat in dieser Regierung durch keine einzige Maßnahme für mehr Gerechtigkeit gesorgt. Dann sagt er auch noch: Wir können auch anders. Herr Westerwelle, ich frage mich nicht, ob Sie anders können, sondern ich frage mich, ob Sie überhaupt können, und ich habe Millionen Deutsche hinter mir.",data/txt/17023.txt,speech,gruene
2359090,23,17,0,,,,349,Beifall beim BÜNDNIS 90/DIE GRÜNEN und bei der SPD,data/txt/17023.txt,poi,
2359091,23,17,0,Renate Künast (BÜNDNIS 90/DIE GRÜNEN),Renate Künast,renate-kunast,350,"Soziale Gerechtigkeit: Wie wäre es mit dem beherzten Kauf von Steuer-CDs, wenn Sie sich schon soziale Gerechtigkeit auf die Fahne schreiben?",data/txt/17023.txt,speech,gruene
2359092,23,17,0,Zurufe von der CDU/CSU und der FDP,e von der CDU/CSU und der FDP,e-cdu-csu-und-der-fdp,351,Oh!,data/txt/17023.txt,poi,cducsu:fdp
2359093,23,17,0,Renate Künast (BÜNDNIS 90/DIE GRÜNEN),Renate Künast,renate-kunast,352,Stattdessen werden von FDP und CDU/CSU als Allererstes die Hoteliers bedient. Die finanzstarke Wirtschaft darf sich für nur 6 000 Euro - ein echtes Schnäppchen - ein Gespräch mit Nordrhein-Westfalens Ministerpräsidenten Herrn Rüttgers kaufen.,data/txt/17023.txt,speech,gruene
2359094,23,17,0,Elke Ferner [SPD],Elke Ferner,elke-ferner,353,Für den ist das ziemlich teuer!,data/txt/17023.txt,poi,spd
2359095,23,17,0,Renate Künast (BÜNDNIS 90/DIE GRÜNEN),Renate Künast,renate-kunast,354,"Es gibt viele andere Dinge, für die man noch mehr Geld ausgibt. Ist das Gerechtigkeit oder vielleicht eher spätrömische Dekadenz, um bei diesem Begriff zu bleiben?",data/txt/17023.txt,speech,gruene
2359096,23,17,0,,,,355,Beifall beim BÜNDNIS 90/DIE GRÜNEN und bei der SPD,data/txt/17023.txt,poi,
2359097,23,17,0,Renate Künast (BÜNDNIS 90/DIE GRÜNEN),Renate Künast,renate-kunast,356,"Meine Damen und Herren von Schwarz-Gelb, Sie haben ein Problem mit der politischen Hygiene, und dieses Land hat zurzeit das Problem, dass es ohne Kanzlerin und ohne Vizekanzler ist.",data/txt/17023.txt,speech,gruene
2359098,23,17,0,,,,357,Beifall beim BÜNDNIS 90/DIE GRÜNEN und bei der SPD,data/txt/17023.txt,poi,
2359099,23,17,0,Dr. Heinrich L. Kolb [FDP],Dr. Heinrich L. Kolb,heinrich-kolb,358,Das ist doch Unsinn! Den Redenschreiber würde ich rausschmeißen!,data/txt/17023.txt,poi,fdp
2359100,23,17,0,Renate Künast (BÜNDNIS 90/DIE GRÜNEN),Renate Künast,renate-kunast,359,"Die zentrale Frage lautet: Was ist Gerechtigkeit, und wie stellen wir Gerechtigkeit her? Gerechtigkeit hängt eng mit Freiheit zusammen. Das gehört zueinander.",data/txt/17023.txt,speech,gruene
2359101,23,17,0,Dr. Heinrich L. Kolb [FDP],Dr. Heinrich L. Kolb,heinrich-kolb,360,Das brauchen Sie uns nicht zu sagen!,data/txt/17023.txt,poi,fdp
2359102,23,17,0,Renate Künast (BÜNDNIS 90/DIE GRÜNEN),Renate Künast,renate-kunast,361,"- Das braucht man Ihnen nicht sagen. Trotzdem tun Sie das Gegenteil. Guten Morgen, FDP! - Gerechtigkeit heißt Freiheit für alle. Dafür muss man die sozialen Blockaden in der Gesellschaft aufheben. Dafür muss man für Teilhabe an Bildung, Arbeit und Gesundheit und für die entsprechenden Einkommen sorgen. Dafür muss man nicht im Sinne des Freiheitsbegriffs die Steuern für die Reichen senken, sondern man muss allen Menschen in dieser Gesellschaft durch gute, finanzstarke Kommunen die Möglichkeit geben, teilzuhaben und sich zu entwickeln. Man muss funktionierende Jobcenter aufbauen. Das tun Sie nicht.",data/txt/17023.txt,speech,gruene
2359103,23,17,0,,,,362,Beifall beim BÜNDNIS 90/DIE GRÜNEN und bei der SPD,data/txt/17023.txt,poi,
2359104,23,17,0,Dr. Heinrich L. Kolb [FDP],Dr. Heinrich L. Kolb,heinrich-kolb,363,Wer hat denn das Gesetz gemacht? Das waren doch Sie!,data/txt/17023.txt,poi,fdp
2359105,23,17,0,Renate Künast (BÜNDNIS 90/DIE GRÜNEN),Renate Künast,renate-kunast,364,"Man muss die Alleinerziehenden in dieser Gesellschaft unterstützen. Man muss nicht sagen, Gerechtigkeit wird durch Schneeschippen gewährleistet, um damit andere Geringverdiener rauszukicken. Vielmehr muss man erstens für ein soziokulturelles Existenzminimum sorgen und zweitens eine gute Infrastruktur aufbauen, von der auch die Mitte dieser Gesellschaft profitieren würde. Ich sage Ihnen in Abwandlung eines Satzes von Ihnen ganz klar: Gerechtigkeit heißt gute Löhne, damit sich Arbeit wieder lohnt.",data/txt/17023.txt,speech,gruene
2359106,23,17,0,,,,365,Beifall beim BÜNDNIS 90/DIE GRÜNEN und bei der SPD,data/txt/17023.txt,poi,
2359107,23,17,0,Renate Künast (BÜNDNIS 90/DIE GRÜNEN),Renate Künast,renate-kunast,366,,data/txt/17023.txt,speech,gruene
2359108,23,17,0,Vizepräsidentin Gerda Hasselfeldt,Gerda Hasselfeldt,gerda-hasselfeldt,367,"Frau Kollegin, kommen Sie zum Schluss.",data/txt/17023.txt,chair,
2359109,23,17,0,Renate Künast (BÜNDNIS 90/DIE GRÜNEN),Renate Künast,renate-kunast,368,"Mein letzter Satz. - Gerechtigkeit heißt Lohnnebenkosten von Geringverdienern übernehmen, einen Bildungssoli für den Aufbau einer besseren Bildung, den Einstieg in die Kindergrundsicherung und die systematische Qualifikation Erwerbsloser.",data/txt/17023.txt,speech,gruene
2359110,23,17,0,Heinz Lanfermann [FDP],Heinz Lanfermann,heinz-lanfermann,369,Sie hätten es doch reinschreiben können!,data/txt/17023.txt,poi,fdp
2359111,23,17,0,Renate Künast (BÜNDNIS 90/DIE GRÜNEN),Renate Künast,renate-kunast,370,"Ich hätte es für richtiger befunden, wenn wir hier über diese Konzepte diskutiert hätten, statt auf Ihre Eckpunkte zu warten.",data/txt/17023.txt,speech,gruene
2359112,23,17,0,Gitta Connemann [CDU/CSU],Gitta Connemann,gitta-connemann,371,Wieso haben Sie es 2003 hineingeschrieben?,data/txt/17023.txt,poi,cducsu
2359113,23,17,0,Dr. Heinrich L. Kolb [FDP],Dr. Heinrich L. Kolb,heinrich-kolb,372,"Ein schwerer Fall von Gedächtnisverlust, Frau Künast!",data/txt/17023.txt,poi,fdp
2359114,23,17,0,Renate Künast (BÜNDNIS 90/DIE GRÜNEN),Renate Künast,renate-kunast,373,"Ich sage Ihnen eines: Dass es nur um Wahlkampfklamauk geht, sieht man an der Abwesenheit der Kanzlerin und des Vizekanzlers. Die Antwort darauf wird es am 9. Mai geben.",data/txt/17023.txt,speech,gruene
2359115,23,17,0,,,,374,Beifall beim BÜNDNIS 90/DIE GRÜNEN und bei der SPD,data/txt/17023.txt,poi,
2359116,23,17,0,Renate Künast (BÜNDNIS 90/DIE GRÜNEN),Renate Künast,renate-kunast,375,,data/txt/17023.txt,speech,gruene
2359117,23,17,0,Vizepräsidentin Gerda Hasselfeldt,Gerda Hasselfeldt,gerda-hasselfeldt,376,Nächster Redner ist der Kollege Dr. Carsten Linnemann für die CDU/CSU-Fraktion.,data/txt/17023.txt,chair,
2359118,23,17,0,,,,377,Beifall bei der CDU/CSU,data/txt/17023.txt,poi,
2359119,23,17,0,Vizepräsidentin Gerda Hasselfeldt,Gerda Hasselfeldt,gerda-hasselfeldt,378,,data/txt/17023.txt,chair,
2359120,23,17,0,Dr. Carsten Linnemann (CDU/CSU),Dr. Carsten Linnemann,carsten-linnemann,379,"Frau Präsidentin! Liebe Kolleginnen und Kollegen! Meine sehr verehrten Damen! Meine Herren! Deutschland befindet sich mitten in einer strukturellen Wirtschaftskrise, das Ausland schaut, ausgestattet mit viel Neid, auf unser Sozialsystem, darauf, dass wir das Sozialsystem in der Krise nachhaltig auf hohem Niveau halten, und Sie haben nichts anderes im Kopf, als eine Aktuelle Stunde über eine angeblich schweigende Kanzlerin einzuberufen. Nichts anderes haben Sie im Kopf.",data/txt/17023.txt,speech,cducsu
2359121,23,17,0,,,,380,Beifall bei Abgeordneten der CDU/CSU,data/txt/17023.txt,poi,
