id,sitzung,wahlperiode,in_writing,speaker,speaker_cleaned,speaker_fp,sequence,text,filename,type,speaker_party
2410965,52,17,0,Dr. Mathias Middelberg (CDU/CSU),Dr. Mathias Middelberg,mathias-middelberg,439,"Ich würde den Beschluss, die Haushaltsdefizite bis 2013 zu halbieren, auch nicht kleinreden, selbst wenn es nicht sanktionsbewehrt ist. Aber man muss schon sagen, es ist ein entscheidender Unterschied, ob wir mit noch mehr Verschuldung weiter in Richtung Abgrund fahren - Herr Wissing hat eben zu Recht auf das Beispiel Griechenland verwiesen, das ja eine Finanzkrise ausgelöst hat - oder ob wir es geschafft haben, diesen verfehlten Kurs zu drehen, und jetzt in die richtige Richtung unterwegs sind.",data/txt/17052.txt,speech,cducsu
2410966,52,17,0,,,,440,Beifall bei der CDU/CSU und der FDP,data/txt/17052.txt,poi,
2410967,52,17,0,Dr. Mathias Middelberg (CDU/CSU),Dr. Mathias Middelberg,mathias-middelberg,441,"Ich sage zum Thema Finanztransaktionsteuer: Natürlich hätten wir uns gewünscht, wenn wir da international eine Vereinbarung zustande bekommen hätten; das muss man ganz klar sagen. Ich hätte mich auch persönlich darüber gefreut. Aber wir müssen auch zur Kenntnis nehmen - das hat Herr Bundesminister Schäuble sehr nachvollziehbar dargelegt -, dass wir nicht allein auf der Welt sind, sondern dass es noch andere gibt, darunter viele, die mit dem Thema Finanz- und Wirtschaftskrise keine Probleme haben, die ganz andere Fragen stellen und ganz andere Interessen haben, die kein Interesse an einer Finanztransaktionsteuer haben. Das muss man als Realität zur Kenntnis nehmen, wenn man Politik verantwortlich gestaltet.

Wolfgang Schäuble hat zu Recht gesagt, wir konzentrieren uns jetzt auf die europäische Ebene und verfolgen dieses Thema dort konsequent weiter. Aber ich sage auch, wir sollten den Menschen nichts vormachen und ihnen keinen Sand in die Augen streuen. Die Finanztransaktionsteuer kann ein Beitrag sein, die Verursacher an den Kosten der Krise zu beteiligen.",data/txt/17052.txt,speech,cducsu
2410968,52,17,0,Ulla Lötzer [DIE LINKE],Ulla Lötzer,ulla-lotzer,442,Und die Spekulation zu begrenzen!,data/txt/17052.txt,poi,linke
2410969,52,17,0,Dr. Mathias Middelberg (CDU/CSU),Dr. Mathias Middelberg,mathias-middelberg,443,"Sie wird aber nicht der entscheidende Beitrag dafür sein, künftige Krisen zu vermeiden.",data/txt/17052.txt,speech,cducsu
2410970,52,17,0,Christine Scheel [BÜNDNIS 90/DIE GRÜNEN],Christine Scheel,christine-scheel,444,Das hat auch keiner gesagt!,data/txt/17052.txt,poi,gruene
2410971,52,17,0,Dr. Mathias Middelberg (CDU/CSU),Dr. Mathias Middelberg,mathias-middelberg,445,"Darüber müssen wir uns im Klaren sein; denn die Krisen, die wir gehabt haben, die Subprimekrise aus den USA oder die Verschuldungskrise aus Griechenland, wären nicht verhindert worden, wenn wir eine Finanztransaktionsteuer gehabt hätten.",data/txt/17052.txt,speech,cducsu
2410972,52,17,0,Lothar Binding [Heidelberg] [SPD],Lothar Binding,lothar-binding,446,Hat das denn jemals jemand behauptet?,data/txt/17052.txt,poi,spd
2410973,52,17,0,Dr. Mathias Middelberg (CDU/CSU),Dr. Mathias Middelberg,mathias-middelberg,447,"- Ich will nur die Schwerpunkte betonen. Dass Sie das nicht behauptet haben, ist eine ganz andere Frage. Zu den Schwerpunkten gehört die Regulierung des Finanzmarkts im Hinblick auf vorbeugende Mechanismen. Über einen dieser Mechanismen haben wir heute Morgen gesprochen, nämlich das Verbot ungedeckter Leerverkäufe und das Verbot ungedeckter Kreditausfallversicherungen, der Spekulationen damit. Das ist schon ein wichtiger Beitrag.

Wir haben eben auch über das Thema Ratingagenturen gesprochen. Das ist Ihnen irgendwie durchgerutscht, Frau Lötzer.",data/txt/17052.txt,speech,cducsu
2410974,52,17,0,Ulla Lötzer [DIE LINKE],Ulla Lötzer,ulla-lotzer,448,Nein!,data/txt/17052.txt,poi,linke
2410975,52,17,0,Dr. Mathias Middelberg (CDU/CSU),Dr. Mathias Middelberg,mathias-middelberg,449,Zu dem Thema haben wir hier nämlich schon einen Beschluss gefasst. Das Thema Ratingagenturen und verschärfte Aufsicht über die Ratingagenturen ist hier bereits geklärt worden und durch.,data/txt/17052.txt,speech,cducsu
2410976,52,17,0,Nicolette Kressl [SPD],Nicolette Kressl,nicolette-kressl,450,Nein!,data/txt/17052.txt,poi,spd
2410977,52,17,0,Ulla Lötzer [DIE LINKE],Ulla Lötzer,ulla-lotzer,451,Genau so unzureichend wie die Regelung heute Morgen!,data/txt/17052.txt,poi,linke
2410978,52,17,0,Dr. Mathias Middelberg (CDU/CSU),Dr. Mathias Middelberg,mathias-middelberg,452,"Der nächste Punkt ist das Restrukturierungsgesetz, was die mögliche Insolvenz, die Abwicklung von Banken angeht, die damit verbundene Bankenabgabe, der Selbstbehalt bei Verbriefungen, die Anhebung der Eigenkapitalanforderungen nach Basel II+ oder Basel III.

Wichtig finde ich auch, dass wir ein Gesetz zur Vergütung für Manager in Banken und Versicherungen beschlossen haben. Auch das ist ein Punkt, den man hier betonen sollte, gerade gegenüber den Zuschauern. Es sind zwar im Moment leider keine hier; aber sicherlich sitzen Zuschauer zu Hause an den Fernsehschirmen. So haben wir in diesem Vergütungsgesetz zum Beispiel festgeschrieben, dass es demnächst höchstens 50 Prozent flexible Vergütung geben darf. Ferner darf es nicht nur eine Bonusvergütung geben, sondern in Zukunft muss es auch Malusregelungen geben. All diese Dinge werden demnächst in Vorstandsverträgen, in Managerverträgen festgelegt sein müssen. Dafür stehen die Aufsichtsräte ein. Aufsichtsräte, die demnächst andere Verträge beschließen, die diese Punkte nicht enthalten, haften. Das sind ganz wichtige Punkte, um auch menschliche Regungen wie Gier und Gewinnstreben am Kapitalmarkt einzuschränken. Das sind wichtige Beiträge, um im Vorfeld - vorbeugend - den Finanzmarkt zu regulieren. Da sind wir wesentlich weiter gekommen, als Sie das hier dargestellt haben.

Herr Kollege Wissing hat auf die übrigen Erfolge dieser Bundesregierung verwiesen, mit einer soliden und eben nicht schuldengetriebenen Wachstumspolitik dieses Land auf einen vernünftigen Kurs zu bringen. Sie sehen, dass die Zahl der Arbeitslosen von Monat zu Monat immer mehr sinkt. Sie wird unter die 3-Millionen-Grenze fallen. Das ist der entscheidende Beitrag. 100 000 Ar-beitslose weniger in diesem Land entlasten unsere Sozialkassen um 1,8 Milliarden Euro. Wenn wir es schaffen, durch unsere solide Politik 500 000 Menschen mehr in diesem Jahr in Beschäftigung zu bekommen, dann haben wir alleine dadurch schon fast 10 Milliarden Euro Sparleistung erbracht. Das ist die Politik, für die diese Regierung steht. Dafür kann man eigentlich nur um Unterstützung bitten.

Danke.",data/txt/17052.txt,speech,cducsu
2410979,52,17,0,,,,453,Beifall bei der CDU/CSU und der FDP,data/txt/17052.txt,poi,
2410980,52,17,0,Dr. Mathias Middelberg (CDU/CSU),Dr. Mathias Middelberg,mathias-middelberg,454,,data/txt/17052.txt,speech,cducsu
2410981,52,17,0,Vizepräsident Dr. h. c. Wolfgang Thierse,Dr. h. c. Wolfgang Thierse,wolfgang-thierse,455,Das Wort hat die Kollegin Nicolette Kressl von der SPD-Fraktion.,data/txt/17052.txt,chair,
2410982,52,17,0,,,,456,Beifall bei der SPD,data/txt/17052.txt,poi,
2410983,52,17,0,Vizepräsident Dr. h. c. Wolfgang Thierse,Dr. h. c. Wolfgang Thierse,wolfgang-thierse,457,,data/txt/17052.txt,chair,
2410984,52,17,0,Nicolette Kressl (SPD),Nicolette Kressl,nicolette-kressl,458,"Sehr geehrter Herr Präsident! Liebe Kolleginnen und Kollegen! In der Regel lohnt es ja nicht, Reden von Herrn Wissing zu kommentieren.",data/txt/17052.txt,speech,spd
2410985,52,17,0,Dr. h. c. Hans Michelbach [CDU/CSU],Dr. h. c. Hans Michelbach,hans-michelbach,459,Das ist aber weniger freundlich!,data/txt/17052.txt,poi,cducsu
2410986,52,17,0,Nicolette Kressl (SPD),Nicolette Kressl,nicolette-kressl,460,"Aber heute war das die entlarvendste Rede, die ich seit langem hier gehört habe. Ich will Ihnen das deutlich machen: Herr Wissing hat sich hier hingestellt - nachdem Bundesminister Schäuble gesagt hat, die Regierung sei mit dem festen Vorsatz nach Toronto gefahren, die Finanztransaktionsteuer durchzusetzen -",data/txt/17052.txt,speech,spd
2410987,52,17,0,Dr. Volker Wissing [FDP],Dr. Volker Wissing,volker-wissing,461,In der Tat!,data/txt/17052.txt,poi,fdp
2410988,52,17,0,Nicolette Kressl (SPD),Nicolette Kressl,nicolette-kressl,462,"und gesagt, es würde hier niemanden interessieren, was ein sozialdemokratischer Ortsverein beschließt. Uns interessiert das übrigens. Aber bemerkenswert ist der Vergleich: Das hat kein sozialdemokratischer Ortsverein beschlossen, sondern das hat die Bundesregierung beschlossen, und Sie haben diesen Beschluss hier diskreditiert.",data/txt/17052.txt,speech,spd
2410989,52,17,0,,,,463,Beifall bei der SPD und dem BÜNDNIS 90/ DIE GRÜNEN sowie bei Abgeordneten der LINKEN,data/txt/17052.txt,poi,
2410990,52,17,0,Nicolette Kressl (SPD),Nicolette Kressl,nicolette-kressl,464,"Sie haben gesagt, das sei völlig unerheblich. Sie haben es als Erfolg beschrieben, dass sie in Toronto nicht beschlossen worden ist.",data/txt/17052.txt,speech,spd
2410991,52,17,0,Dr. Mathias Middelberg [CDU/CSU],Dr. Mathias Middelberg,mathias-middelberg,465,Da haben Sie aber nicht richtig zugehört!,data/txt/17052.txt,poi,cducsu
2410992,52,17,0,Dr. h. c. Hans Michelbach [CDU/CSU],Dr. h. c. Hans Michelbach,hans-michelbach,466,"Das haben Sie heute Nacht geträumt, oder was?",data/txt/17052.txt,poi,cducsu
2410993,52,17,0,Christian Lange [Backnang] [SPD],Christian Lange,christian-lange,467,Schwarz-gelbes Chaos!,data/txt/17052.txt,poi,spd
2410994,52,17,0,Nicolette Kressl (SPD),Nicolette Kressl,nicolette-kressl,468,"Herr Minister, ich will Sie fragen: Warum wundern Sie sich noch, dass wir hier konstatieren - und das hat Herr Duin vorhin auch getan -, dass die Bundesregierung ihre Durchsetzungskraft auf internationalen Konferenzen - sie war nicht plötzlich schlecht - Stück für Stück verloren hat, dass alle international nachlesen können, dass Sie mit einer Position zu den Konferenzen fahren, die national von den Sie tragenden Fraktionen gar nicht mitgetragen wird? Dann ist es doch logisch, dass da keine Durchsetzungskraft mehr da ist.",data/txt/17052.txt,speech,spd
2410995,52,17,0,,,,469,Beifall bei der SPD,data/txt/17052.txt,poi,
2410996,52,17,0,Jörn Wunderlich [DIE LINKE],Jörn Wunderlich,jorn-wunderlich,470,Das nennt Herr Wissing Handlungsfähigkeit!,data/txt/17052.txt,poi,linke
2410997,52,17,0,Christian Lange [Backnang] [SPD],Christian Lange,christian-lange,471,"Chaos-Regierung, schwarz-gelbes Chaos!",data/txt/17052.txt,poi,spd
2410998,52,17,0,Nicolette Kressl (SPD),Nicolette Kressl,nicolette-kressl,472,"Ich will einen zweiten Punkt nennen und kann Ihnen, Herr Wissing, die Frage nicht ersparen: Welchen Neuanfang müssen wir machen? Ich glaube, es wäre an der Zeit, sich in Sachen Neuanfänge und Neustarts klar und deutlich zu äußern.",data/txt/17052.txt,speech,spd
2410999,52,17,0,,,,473,Beifall bei der SPD,data/txt/17052.txt,poi,
2411000,52,17,0,Nicolette Kressl (SPD),Nicolette Kressl,nicolette-kressl,474,"Lassen Sie mich eine dritte Bemerkung machen: Ich halte es für eine Unverschämtheit, hier nicht die Wahrheit zu sagen. Mit Minister Steinbrück wären wir 2011 in einen Haushalt ohne Neuverschuldung gegangen. Das ist völlig klar.",data/txt/17052.txt,speech,spd
2411001,52,17,0,,,,475,Beifall bei der SPD,data/txt/17052.txt,poi,
2411002,52,17,0,Nicolette Kressl (SPD),Nicolette Kressl,nicolette-kressl,476,"Wir mussten uns wegen der konjunkturellen Lage stärker verschulden. Wir müssen da wieder zurück, darüber sind wir uns einig. Aber hier die Unwahrheit darzustellen, zeugt nicht von ernsthaftem Arbeiten, und darum geht es, nicht um Fairness. Diesen Grundregeln sollten Sie als Ausschussvorsitzender sich eigentlich auch unterwerfen.",data/txt/17052.txt,speech,spd
2411003,52,17,0,,,,477,Beifall bei der SPD und der LINKEN,data/txt/17052.txt,poi,
2411004,52,17,0,Dr. Volker Wissing [FDP],Dr. Volker Wissing,volker-wissing,478,Sie fordern doch heute immer noch Steuererhöhungen für die Mitte!,data/txt/17052.txt,poi,fdp
2411005,52,17,0,Nicolette Kressl (SPD),Nicolette Kressl,nicolette-kressl,479,"Dann will ich Ihnen noch einen Punkt im Zusammenhang mit Toronto deutlich machen. Die Jahre 2008 und 2009 waren von großen Rettungspaketen geprägt. Das haben wir für die Menschen und ihre Arbeitsplätze gemacht, das will ich deutlich sagen, und nicht für die Banken. Dennoch ist es eine Tatsache, dass bisher ausschließlich die Steuerzahlerinnen und Steuerzahler an den Kosten beteiligt werden. Deshalb wäre es auch so wichtig gewesen, aus Toronto ein weiteres Signal dafür zu bekommen, die Steuerzahler nicht alleinzulassen, sondern die Verursacher der Krise mitzubeteiligen.",data/txt/17052.txt,speech,spd
2411006,52,17,0,Leo Dautzenberg [CDU/CSU],Leo Dautzenberg,leo-dautzenberg,480,Das muss man aber auch machen!,data/txt/17052.txt,poi,cducsu
2411007,52,17,0,Nicolette Kressl (SPD),Nicolette Kressl,nicolette-kressl,481,"Ich will Ihnen sagen: Die Bankenabgabe, die Sie hier immer wieder nennen, führt nicht dazu, dass sich die Verursacher auch nur mit einem einzigen Cent an den Kosten der Krise beteiligen. Das ist ein Vorsorgetopf. - Ich habe interessiert gelesen, dass Sie auch noch darüber diskutieren, dass diese Ausgaben, anders als im Regierungsentwurf vorgesehen, womöglich bei der Steuer geltend gemacht werden können.",data/txt/17052.txt,speech,spd
2411008,52,17,0,Manfred Zöllmer [SPD],Manfred Zöllmer,manfred-zollmer,482,"Ja, so ist es!",data/txt/17052.txt,poi,spd
2411009,52,17,0,Nicolette Kressl (SPD),Nicolette Kressl,nicolette-kressl,483,"Dadurch wollen Sie die Steuerzahler noch einmal an den Kosten beteiligen. Das, was Sie hier machen, ist doch absurd.",data/txt/17052.txt,speech,spd
2411010,52,17,0,,,,484,Beifall bei der SPD und der LINKEN,data/txt/17052.txt,poi,
2411011,52,17,0,Christian Lange [Backnang] [SPD],Christian Lange,christian-lange,485,Ein echter Witz!,data/txt/17052.txt,poi,spd
2411012,52,17,0,Nicolette Kressl (SPD),Nicolette Kressl,nicolette-kressl,486,"Es ist völlig klar: Für die Märkte müssen Regeln erlassen werden, durch die wir weitere Barrieren gegen die Spekulation auf Kosten anderer erhalten. - Ich persönlich und viele andere, wie ich glaube, sind bestürzt. Eigentlich konnten wir davon ausgehen, dass international ein Zeitfenster vereinbart wird, innerhalb dessen man diese Regeln vereinbaren kann, aber wir mussten feststellen: Dieses Zeitfenster schließt sich schneller, als wir uns das erhofft haben.

Damit komme ich zur Durchsetzungsfähigkeit zurück. Eine gewichtige deutsche Stimme wäre gut, um dieses Zeitfenster länger offen zu halten. Diese haben wir aber, wie gesagt, leider nicht mehr.

Wenn Sie es sich genau anschauen, dann sehen Sie: Der G-20-Gipfel in Toronto war für die Finanzmarktregulierung ein Rückschlag. Ich habe die Befürchtung, dass wir, wenn wir auf diesem Weg weitergehen, den Menschen nicht mehr erklären können, warum diejenigen, die in Regierungsverantwortung stehen, zwar immer sagen: ""Wir müssen das tun"", hinterher aber nichts passiert.",data/txt/17052.txt,speech,spd
2411013,52,17,0,Zuruf von der CDU/CSU,von der CDU/CSU,von-der-cdu-csu,487,"Wer war denn Staatssekretärin, Frau Kressl?",data/txt/17052.txt,poi,cducsu
2411014,52,17,0,Nicolette Kressl (SPD),Nicolette Kressl,nicolette-kressl,488,"Schauen Sie sich einmal genau an, was in Toronto beschlossen worden ist. Es gab keine konkreten Festlegungen im Hinblick auf die Eigenkapitalregeln. Statt der bisherigen Umsetzungsfrist - bis Ende 2012 - wird eine reine Zielsetzung formuliert. Das ist keine Verstärkung der Regulierung, sondern eine Abschwächung der Regulierung.

Wir haben das vorhin besprochen: Hinsichtlich der Verbesserung des außerbörslichen Handels halten wir alle die Transparenz für außerordentlich wichtig. Bis 2012 sollten - das ist in Pittsburgh beschlossen worden - alle standardisierten Derivate über Börsen- oder Handelsplattformen gehandelt werden. Hierzu gab es in Toronto keinen Fortschritt und keinerlei konkrete Festlegung. Ich habe es schon erwähnt: In Toronto wurden keinerlei Beschlüsse über eine internationale Finanztransaktionsteuer oder über eine Bankenabgabe gefasst.

Ich will hier noch einmal auf die Einigkeit und Durchsetzungskraft zurückkommen. Sie haben hier über Monate hinweg nicht einmal genau gewusst, ob wir über eine Finanzaktivitätsteuer, eine Finanztransaktionsteuer oder eine Bankenabgabe als Vorsorge sprechen. Bei dieser Bankenabgabe können sich die Banken sicher sein, dass die Steuerzahler wieder ergänzend zahlen müssen, wenn das Gesammelte nicht ausreicht; dafür gibt es ja auch nette Formulierungen in dem Referentenentwurf.

Wenn Sie sich dieses Hin und Her über Wochen hinweg anschauen, dann ist völlig klar: Wir werden international nicht durchsetzungsfähig, wenn Sie sich nicht endlich dazu entschließen, klare und überzeugende Linien zu entwickeln. - Ich sage Ihnen: Wenn wir erkennen könnten, dass Sie das auf den Weg bringen, und wenn die FDP nicht wieder alles relativieren würde, was der andere Teil der Regierungskoalition sagt, dann würden wir Sie unterstützen.",data/txt/17052.txt,speech,spd
2411015,52,17,0,Dr. Volker Wissing [FDP],Dr. Volker Wissing,volker-wissing,489,"Fragen Sie doch einmal Herrn Steinbrück! Er hat doch seine Erfahrungen damit! Er kann es Ihnen erklären, Frau Kressl!",data/txt/17052.txt,poi,fdp
2411016,52,17,0,Nicolette Kressl (SPD),Nicolette Kressl,nicolette-kressl,490,"Bei diesem Rumgeeiere, das uns national und international schadet, können wir aber leider nicht mitmachen.

Vielen Dank.",data/txt/17052.txt,speech,spd
2411017,52,17,0,,,,491,Beifall bei der SPD,data/txt/17052.txt,poi,
2411018,52,17,0,Christian Lange [Backnang] [SPD],Christian Lange,christian-lange,492,Schwarz-gelbes Chaos,data/txt/17052.txt,poi,spd
2411019,52,17,0,,,,493,wie immer!,data/txt/17052.txt,poi,
2411020,52,17,0,Nicolette Kressl (SPD),Nicolette Kressl,nicolette-kressl,494,,data/txt/17052.txt,speech,spd
2411021,52,17,0,Vizepräsident Dr. Hermann Otto Solms,Dr. Hermann Otto Solms,hermann-otto-solms,495,Das Wort hat der Kollege Thilo Hoppe von Bünd-nis 90/Die Grünen.,data/txt/17052.txt,chair,
2411022,52,17,0,Thilo Hoppe (BÜNDNIS 90/DIE GRÜNEN),Thilo Hoppe,thilo-hoppe,496,"Herr Präsident! Liebe Kolleginnen und Kollegen! Ich möchte gerne einen Aspekt ansprechen, der in der Debatte bisher zu kurz gekommen ist. Wenn man nämlich einen Perspektivwechsel vornimmt und auf die Ergebnisse der beiden Gipfel der G 8 und der G 20 aus Sicht der Entwicklungsländer schaut, dann kann man das nur mit der Schlagzeile der taz vom Montag zusammenfassen: ""Krümel für die Welt"".

Die Ankündigung der G-8-Staaten, im Kampf gegen Kinder- und Müttersterblichkeit etwas mehr als 5 Milliarden US-Dollar zur Verfügung zu stellen, klingt erst einmal gut, aber angesichts der 30 Milliarden US-Dollar, die nach Berechnungen der UNO notwendig wären, ist das doch ein sehr bescheidener Betrag. Ganz besonders bescheiden hat sich Deutschland gezeigt, das pro Jahr 80 Millionen Euro geben will. Das ist deutlich weniger als das, was die ganze Konferenz in Toronto gekostet hat.

Aber das, was noch schwerer wiegt als diese ""Geiz-ist-geil""-Mentalität, ist der Abschied von den Versprechungen von Gleneagles. Können Sie sich noch erinnern: großes Kino Gleneagles, Tony Blair, umrahmt von Bob Geldof und Bono, und das großartige Versprechen, 50 Milliarden Euro mehr bis 2010? - Versprochen, gebrochen!

Maximal zwei Drittel dieser Beträge, die versprochen wurden, feierlich zugesagt worden sind, sind überhaupt gezahlt worden. Nach Berechnungen von ONE, einer Entwicklungshilfeorganisation, hat Deutschland gerade mal 25 Prozent seiner Versprechungen auch wirklich eingehalten und umgesetzt.

In Heiligendamm hat die Kanzlerin noch die anderen ermahnt, die Ärmsten der Armen nicht im Stich zu lassen und die Versprechungen einzuhalten. Jetzt braucht sie nur in den Spiegel zu schauen, um festzustellen, wer nicht Wort gehalten hat.",data/txt/17052.txt,speech,gruene
2411023,52,17,0,,,,497,Beifall beim BÜNDNIS 90/DIE GRÜNEN sowie bei Abgeordneten der SPD und der LINKEN,data/txt/17052.txt,poi,
2411024,52,17,0,Thilo Hoppe (BÜNDNIS 90/DIE GRÜNEN),Thilo Hoppe,thilo-hoppe,498,"Wie gesagt, bisher hat man immer noch beteuert, das ist unsere Verpflichtung. Das ist jetzt im Schatten der anderen Krisen heimlich, still und leise aus den Dokumenten verschwunden.

Noch etwas fehlt in den Abschlusskommuniqués der beiden Gipfeltreffen. Es gab immer so eine Stereotype: Die WTO-Welthandelsrunde muss auch im Sinne der Entwicklungsländer zum Erfolg führen. Die fehlt diesmal völlig. Die Entwicklungsländer sind außen vor. Jetzt setzt man auf bilaterale Freihandelsabkommen. Bei diesen bilateralen Freihandelsabkommen werden die Schwächsten natürlich wieder unter die Räder kommen. Auch dort gibt es eine Rückkehr zum Egoismus.

G 8 und G 20 sind diesen Krisen nicht gewachsen, sie können diesen Krisen nicht wirklich begegnen. Das haben schon einige gesagt. Die Vereinten Nationen müssen stärker an Bedeutung gewinnen. In diesem Zusammenhang - das wird Sie vielleicht wundern - möchte ich einmal die Kanzlerin loben, nicht für ihr jetziges Auftreten, sondern für das, was sie vor zwei Jahren zur großen Überraschung in Davos gesagt hat. Da hat sie eine UN-Charta für nachhaltiges Wirtschaften gefordert und eine starke Rolle der Vereinten Nationen.",data/txt/17052.txt,speech,gruene
2411025,52,17,0,,,,499,Zuruf von der SPD,data/txt/17052.txt,poi,
2411026,52,17,0,Thilo Hoppe (BÜNDNIS 90/DIE GRÜNEN),Thilo Hoppe,thilo-hoppe,500,"Da haben viele Zeitungen getitelt:

Merkel fordert eine ""Wirtschafts-UN"".

Doch leider sind diesen großen Worten keine Taten gefolgt. Wir haben viele Anfragen gestellt. - Nichts, aber auch gar nichts.",data/txt/17052.txt,speech,gruene
2411027,52,17,0,Garrelt Duin [SPD],Garrelt Duin,garrelt-duin,501,Kommt ja öfter vor!,data/txt/17052.txt,poi,spd
2411028,52,17,0,Thilo Hoppe (BÜNDNIS 90/DIE GRÜNEN),Thilo Hoppe,thilo-hoppe,502,"G 8 und G 20 sind gescheitert. Aber diese Ankündigung ""Was nicht ist, kann ja noch werden"" bringt uns dazu, die Kanzlerin zu ermutigen, die Papiere, die Herr Weidmann damals geschrieben hat, endlich mit Leben zu erfüllen, ihnen endlich zum Durchbruch zu verhelfen.",data/txt/17052.txt,speech,gruene
2411029,52,17,0,,,,503,Beifall beim BÜNDNIS 90/DIE GRÜNEN,data/txt/17052.txt,poi,
2411030,52,17,0,Thilo Hoppe (BÜNDNIS 90/DIE GRÜNEN),Thilo Hoppe,thilo-hoppe,504,"G 20 muss sich reformieren! G 20 ist in der Krise, und ein Herauskommen ist nur denkbar, wenn G 20 näher an die Vereinten Nationen heranrückt, wenn beide Reformprozesse zusammengeführt werden. Zeigen Sie uns, dass diese Äußerungen von Davos nicht nur ein Mediengag waren!

Danke.",data/txt/17052.txt,speech,gruene
2411031,52,17,0,,,,505,Beifall beim BÜNDNIS 90/DIE GRÜNEN sowie bei Abgeordneten der SPD und der LINKEN,data/txt/17052.txt,poi,
2411032,52,17,0,Thilo Hoppe (BÜNDNIS 90/DIE GRÜNEN),Thilo Hoppe,thilo-hoppe,506,,data/txt/17052.txt,speech,gruene
2411033,52,17,0,Vizepräsident Dr. Hermann Otto Solms,Dr. Hermann Otto Solms,hermann-otto-solms,507,Als letzter Redner zu diesem Tagesordnungspunkt hat jetzt der Kollege Peter Aumer von der CDU/CSU-Fraktion das Wort.,data/txt/17052.txt,chair,
2411034,52,17,0,,,,508,Beifall bei der CDU/CSU,data/txt/17052.txt,poi,
2411035,52,17,0,Vizepräsident Dr. Hermann Otto Solms,Dr. Hermann Otto Solms,hermann-otto-solms,509,,data/txt/17052.txt,chair,
2411036,52,17,0,Peter Aumer (CDU/CSU),Peter Aumer,peter-aumer,510,"Herr Präsident! Meine sehr geehrten Damen und Herren! ""Merkel setzt sich gegen Obama durch"",",data/txt/17052.txt,speech,cducsu
2411037,52,17,0,,,,511,Lachen bei der SPD,data/txt/17052.txt,poi,
2411038,52,17,0,Peter Aumer (CDU/CSU),Peter Aumer,peter-aumer,512,"so titelte das Handelsblatt am vergangenen Montag über das Verhandlungsergebnis von Toronto. - Das Lachen der Opposition, denke ich, kommt an einigen Stellen zu Recht, aber insgesamt sollte man doch die Ergebnisse wahrnehmen, die erzielt worden sind. Ich denke, diese sind richtig und wertvoll.

Wesentliche Themenfelder standen im Mittelpunkt des Treffens der G-20-Länder.",data/txt/17052.txt,speech,cducsu
2411039,52,17,0,Christian Lange [Backnang] [SPD],Christian Lange,christian-lange,513,Im Handelsblatt steht etwas anderes!,data/txt/17052.txt,poi,spd
2411040,52,17,0,Peter Aumer (CDU/CSU),Peter Aumer,peter-aumer,514,"- Ja, heute. Das war am Montag, kurz nach dem Gipfel. Ich denke, dass das doch das Entscheidende ist, oder?",data/txt/17052.txt,speech,cducsu
2411041,52,17,0,,,,515,Beifall bei der CDU/CSU,data/txt/17052.txt,poi,
2411042,52,17,0,Peter Aumer (CDU/CSU),Peter Aumer,peter-aumer,516,Die Frage des Wachstums und des gleichzeitigen Schuldenabbaus war ein wesentlicher - -,data/txt/17052.txt,speech,cducsu
2411043,52,17,0,Garrelt Duin [SPD],Garrelt Duin,garrelt-duin,517,Dieser Handelsblatt-Artikel hier ist auch von Montag!,data/txt/17052.txt,poi,spd
2411044,52,17,0,Peter Aumer (CDU/CSU),Peter Aumer,peter-aumer,518,"- Ja, dann schauen Sie bitte auf Seite eins. Da steht genau das, was ich Ihnen vorher zitiert habe.",data/txt/17052.txt,speech,cducsu
2411045,52,17,0,Leo Dautzenberg [CDU/CSU],Leo Dautzenberg,leo-dautzenberg,519,Das haben die in Niedersachsen noch nicht mitbekommen!,data/txt/17052.txt,poi,cducsu
