id,sitzung,wahlperiode,in_writing,speaker,speaker_cleaned,speaker_fp,sequence,text,filename,type,speaker_party
2410744,52,17,0,,,,218,Beifall bei der CDU/CSU und der FDP,data/txt/17052.txt,poi,
2410745,52,17,0,Ralph Brinkhaus (CDU/CSU),Ralph Brinkhaus,ralph-brinkhaus,219,"Aber zum Gesetzentwurf. Meine Damen und Herren von der Opposition, Sie haben den Gesetzentwurf in Ihren Debattenbeiträgen teilweise kritisiert. Herr Binding, Ihr physikalisch-semantischer Ausflug durch die Zeitzonen diente vielleicht mehr der Heiterkeit.",data/txt/17052.txt,speech,cducsu
2410746,52,17,0,Leo Dautzenberg [CDU/CSU],Leo Dautzenberg,leo-dautzenberg,220,Das war Chaos!,data/txt/17052.txt,poi,cducsu
2410747,52,17,0,Ralph Brinkhaus (CDU/CSU),Ralph Brinkhaus,ralph-brinkhaus,221,"Frau Höll, Sie haben im Grunde genommen fast ein Plädoyer für diesen Gesetzentwurf gehalten. Er geht Ihnen nur nicht weit genug; so habe ich es verstanden. Herr Schick hat gelobt, dass jetzt die nötige Transparenz geschaffen wird. Das nehmen wir positiv zur Kenntnis. Herr Zöllmer, von Ihnen würde ich mir wünschen, dass Sie ein bisschen mehr in den technischen Diskurs einsteigen und auch konstruktive Vorschläge unterbreiten, wie ein solcher Entwurf besser gemacht werden kann.",data/txt/17052.txt,speech,cducsu
2410748,52,17,0,,,,222,Beifall bei Abgeordneten der CDU/CSU und der FDP,data/txt/17052.txt,poi,
2410749,52,17,0,Iris Gleicke [SPD],Iris Gleicke,iris-gleicke,223,Und was haben die Schüler jetzt für Noten gekriegt?,data/txt/17052.txt,poi,spd
2410750,52,17,0,Ralph Brinkhaus (CDU/CSU),Ralph Brinkhaus,ralph-brinkhaus,224,"Aber als Opposition ist es Ihr gutes Recht, zu kritisieren. Deswegen werde ich versuchen, auf den einen oder anderen Punkt einzugehen, Ihre Kritik zu entkräften und Sie zu bewegen, diesem Gesetzentwurf vielleicht doch noch zuzustimmen.

Erstens. Sie haben kritisiert, dass der Gesetzentwurf sehr schnell auf den Weg gebracht worden ist.",data/txt/17052.txt,speech,cducsu
2410751,52,17,0,Dr. Gerhard Schick [BÜNDNIS 90/DIE GRÜNEN],Dr. Gerhard Schick,gerhard-schick,225,"""Schnell"" ist nicht die Kritik! Unkoordiniert und chaotisch!",data/txt/17052.txt,poi,gruene
2410752,52,17,0,Ralph Brinkhaus (CDU/CSU),Ralph Brinkhaus,ralph-brinkhaus,226,"Ich habe bereits im Ausschuss gesagt, dass das nicht Standard werden soll. Ich denke, dass wir das bei anderer Gelegenheit besser machen werden. Aber es ist auch der Situation geschuldet gewesen, dass man schnell handelt.

Zweitens. Von mehreren Rednern ist kritisiert worden, dass wir einen deutschen Alleingang gemacht haben. Das ist nicht ganz falsch. Ich würde es allerdings nicht als Alleingang bezeichnen, sondern als Vorweggehen.",data/txt/17052.txt,speech,cducsu
2410753,52,17,0,,,,227,Beifall bei der CDU/CSU und der FDP,data/txt/17052.txt,poi,
2410754,52,17,0,Ralph Brinkhaus (CDU/CSU),Ralph Brinkhaus,ralph-brinkhaus,228,"Es gibt Situationen, in denen ein solches Vorweggehen notwendig ist. Wir alle haben in Toronto gesehen, wie schwierig es ist, einen internationalen Konsens zu erzielen. Ich befürchte, das wird auch auf europäischer Ebene so sein. Deswegen haben die Bundesregierung und die Koalitionsfraktionen die Initiative ergriffen und sind an dieser Stelle vorweg gegangen. Wir haben gesehen, dass das ein wichtiger Impuls für die europäische Diskussion war; der Kollege Michelbach ist bereits darauf eingegangen. Ich denke, dieser Diskurs auf europäischer Ebene wird auch Ergebnisse zeitigen.

Wir haben trotz dieses nationalen Alleingangs versucht, die Balance zu halten und den Finanzplatz Deutschland nicht zu beschädigen. Das ist ein Drahtseilakt; aber ich glaube, er ist uns mit diesem Gesetzentwurf gelungen. Insofern kann ich es gar nicht als negativ einschätzen, Herr Schick, wenn die Branche sagt, dass sie mit diesem Gesetz leben könne. Am Ende des Tages leben wir nämlich auch von dieser Branche, von den Steuern, die von dieser Branche gezahlt werden, und von den Arbeitsplätzen, die von dieser Branche geschaffen werden.",data/txt/17052.txt,speech,cducsu
2410755,52,17,0,Dr. Gerhard Schick [BÜNDNIS 90/DIE GRÜNEN],Dr. Gerhard Schick,gerhard-schick,229,So viel Steuern zahlen die aber nicht!,data/txt/17052.txt,poi,gruene
2410756,52,17,0,Ralph Brinkhaus (CDU/CSU),Ralph Brinkhaus,ralph-brinkhaus,230,"Wir sollten deswegen immer sehr vorsichtig sein und nicht mit dem Knüppel auf die Menschen schlagen, die uns am Ende des Tages finanzieren.",data/txt/17052.txt,speech,cducsu
2410757,52,17,0,,,,231,Beifall bei der CDU/CSU und der FDP,data/txt/17052.txt,poi,
2410758,52,17,0,Ralph Brinkhaus (CDU/CSU),Ralph Brinkhaus,ralph-brinkhaus,232,"Zum Thema ""nationaler Alleingang"" vielleicht noch eine Bemerkung: Ich bin davon überzeugt, dass wir, um Bewegung in die Diskussion über die Regulierung der Finanzmärkte zu bringen, noch sehr viel mehr nationale Alleingänge machen müssen, vorangehen müssen; denn das ist unsere Aufgabe als große, verlässliche, starke europäische Volkswirtschaft. Diesen Weg werden wir als christlich-liberale Koalition weitergehen.",data/txt/17052.txt,speech,cducsu
2410759,52,17,0,Dr. Axel Troost [DIE LINKE],Dr. Axel Troost,axel-troost,233,Fangt doch mal mit der Finanzmarkttransaktionsteuer an!,data/txt/17052.txt,poi,linke
2410760,52,17,0,Ralph Brinkhaus (CDU/CSU),Ralph Brinkhaus,ralph-brinkhaus,234,"- Das ist eine gute Bemerkung, Herr Troost. Finanzmarkttransaktionsteuer - schön, dass Sie mir dieses Stichwort geben. In dem Fall fordern Sie ein Vorweggehen; hier kritisieren Sie es. Damit wird das Thema doch auch zu einer Frage der Glaubwürdigkeit der Opposition.",data/txt/17052.txt,speech,cducsu
2410761,52,17,0,,,,235,Beifall bei der CDU/CSU und der FDP,data/txt/17052.txt,poi,
2410762,52,17,0,Ralph Brinkhaus (CDU/CSU),Ralph Brinkhaus,ralph-brinkhaus,236,"Drittens ist die Herausnahme der Intraday-Geschäfte, der untertägigen Geschäfte, kritisiert worden. Da ist der BDI als Kronzeuge genannt worden. Sie müssen allerdings fairerweise dazusagen, dass alle anderen Experten anderer Meinung waren. Wenn Sie die Herausnahme kritisieren, stehen Sie in der Pflicht, nachzuweisen, dass diese Intraday-Geschäfte tatsächlich schädlich sind. Das können Sie nicht nachweisen. Insofern ist diese Kritik haltlos. Ohne die Herausnahme schaffen wir vielmehr Probleme, wenn Liquidität in die Märkte gebracht werden soll. Deswegen ist es richtig, dass wir die Intraday-Geschäfte herausgenommen haben.",data/txt/17052.txt,speech,cducsu
2410763,52,17,0,,,,237,Beifall bei der CDU/CSU und der FDP,data/txt/17052.txt,poi,
2410764,52,17,0,Ralph Brinkhaus (CDU/CSU),Ralph Brinkhaus,ralph-brinkhaus,238,"Viertens. Herr Schick, Sie kritisieren, dass die Ermächtigung an das BMF, bestimmte Geschäfte durch Verordnungen zu verbieten, weggefallen ist. Ich glaube - bei allem Respekt -, Sie haben diese Thematik nicht ganz verstanden. Es gibt einen zweistufigen Mechanismus. Die BaFin kann schnell, hart und durchschlagskräftig reagieren. Sie kann bestimmte Geschäfte verbieten, wenn die Marktstabilität gefährdet ist. In der ersten Stufe kann sie das über zwölf Monate tun und dies noch einmal um zwölf Monate verlängern. Wenn das nicht reicht und wir feststellen, dass eine bestimmte Geschäftsart nachhaltig schädlich ist, dann sind wir in der zweiten Stufe als Parlament am Zug. Ich kann nicht verstehen, dass gerade Sie von den Grünen das dem Ministerium ohne parlamentarische Kontrolle überlassen wollen. Es ist schon verwunderlich, dass wir als Regierungsfraktion das einfordern müssen.",data/txt/17052.txt,speech,cducsu
2410765,52,17,0,,,,239,Beifall bei der CDU/CSU und der FDP,data/txt/17052.txt,poi,
2410766,52,17,0,Dr. Gerhard Schick [BÜNDNIS 90/DIE GRÜNEN],Dr. Gerhard Schick,gerhard-schick,240,Erst war es ja im Gesetz vorgesehen!,data/txt/17052.txt,poi,gruene
2410767,52,17,0,Ralph Brinkhaus (CDU/CSU),Ralph Brinkhaus,ralph-brinkhaus,241,"Es ist weiterhin kritisiert worden, dass bestimmte Dinge - andere Währungen, ausländische Börsenplätze, nichtregulierte Produkte - nicht einbezogen werden. Wir können nur das regeln, was tatsächlich unserer Regelungsmacht unterliegt. Das muss man an dieser Stelle ganz klar sagen. Es steht auch im Koalitionsvertrag",data/txt/17052.txt,speech,cducsu
2410768,52,17,0,Manfred Zöllmer [SPD],Manfred Zöllmer,manfred-zollmer,242,Was denn?,data/txt/17052.txt,poi,spd
2410769,52,17,0,Ralph Brinkhaus (CDU/CSU),Ralph Brinkhaus,ralph-brinkhaus,243,"- vielleicht können Sie das noch einmal nachlesen -, dass wir nichtregulierte Produkte in regulierte Märkte überführen wollen.",data/txt/17052.txt,speech,cducsu
2410770,52,17,0,,,,244,Beifall bei der CDU/CSU sowie bei Abgeordneten der FDP,data/txt/17052.txt,poi,
2410771,52,17,0,Manfred Zöllmer [SPD],Manfred Zöllmer,manfred-zollmer,245,Doch nicht durch dieses Gesetz! Das machen Sie doch gar nicht!,data/txt/17052.txt,poi,spd
2410772,52,17,0,Ralph Brinkhaus (CDU/CSU),Ralph Brinkhaus,ralph-brinkhaus,246,"Ein letzter Kritikpunkt, der allenthalben laut wurde, war, dass es sich bei diesem Gesetzentwurf um Symbolpolitik handele. Ich glaube, Sie sagten das, Herr Zöllmer.",data/txt/17052.txt,speech,cducsu
2410773,52,17,0,Manfred Zöllmer [SPD],Manfred Zöllmer,manfred-zollmer,247,Nicht nur ich!,data/txt/17052.txt,poi,spd
2410774,52,17,0,Ralph Brinkhaus (CDU/CSU),Ralph Brinkhaus,ralph-brinkhaus,248,"Natürlich handelt es sich um Symbolpolitik. Es ist manchmal wichtig, nicht nur Fakten zu schaffen, sondern auch Symbole und Zeichen zu setzen.",data/txt/17052.txt,speech,cducsu
2410775,52,17,0,Lothar Binding [Heidelberg] [SPD],Lothar Binding,lothar-binding,249,Die richtigen Symbole!,data/txt/17052.txt,poi,spd
2410776,52,17,0,Ralph Brinkhaus (CDU/CSU),Ralph Brinkhaus,ralph-brinkhaus,250,"Wir wissen sehr gut, dass es noch Geschäfte gibt, die wir mit diesem Gesetz nicht erschlagen. Ja, wir wissen, dass es viele Geschäfte gibt, die wir noch gar nicht kennen und die vielleicht erst im nächsten oder übernächsten Jahr die Stabilität der Finanzmärkte beschädigen. Wir müssen aber doch jetzt das tun, was uns möglich ist. Was uns jetzt möglich ist, ist, bestimmte Geschäfte zu verbieten, der BaFin ein scharfes Schwert in die Hand zu geben, um schnell zu reagieren, und insbesondere - Herr Schick, Sie haben das ausgeführt - Transparenz zu schaffen, damit wir wissen, wo wir zukünftig regulieren müssen.

Ich fasse zusammen: Wir haben auf europäischer Ebene Bewegung in die Regulierung von Leerverkäufen gebracht; das ist ohne Zweifel richtig. Wir haben gegenüber den Finanzmärkten Handlungsfähigkeit gezeigt, und wir werden aufgrund der strengeren Transparenz- und Meldevorschriften mehr über die Märkte wissen und können von daher besser reagieren.

Meine Damen und Herren, dieser Gesetzentwurf orientiert sich wie alle Maßnahmen, die wir bisher auf den Weg gebracht haben - der Kollege Michelbach hat dazu eben umfangreich ausgeführt -, an vier grundsätzlichen Eckpfeilern der neuen, besseren Finanzmarktarchitektur, die wir in dieser Welt brauchen. Wir brauchen erstens Transparenz, zweitens eine Kopplung von Haftung und Risiko, drittens starke Aufsichtsbehörden und viertens eine Beteiligung des Finanzsektors an den Kosten der Krise. Der vorliegende Gesetzentwurf fügt sich perfekt in diese Architektur ein. Deswegen können Sie diesem Gesetzentwurf eigentlich nur zustimmen.

Danke schön.",data/txt/17052.txt,speech,cducsu
2410777,52,17,0,,,,251,Beifall bei der CDU/CSU und der FDP,data/txt/17052.txt,poi,
2410778,52,17,0,Ralph Brinkhaus (CDU/CSU),Ralph Brinkhaus,ralph-brinkhaus,252,,data/txt/17052.txt,speech,cducsu
2410779,52,17,0,Vizepräsident Dr. h. c. Wolfgang Thierse,Dr. h. c. Wolfgang Thierse,wolfgang-thierse,253,"Ich schließe die Aussprache.

Wir kommen zur Abstimmung über den von den Fraktionen der CDU/CSU und FDP eingebrachten Entwurf eines Gesetzes zur Vorbeugung gegen missbräuchliche Wertpapier- und Derivategeschäfte. Der Finanzausschuss empfiehlt unter Buchstabe a seiner Beschlussempfehlung auf Drucksache 17/2336, den Gesetzentwurf der Fraktionen der CDU/CSU und der FDP auf Drucksache 17/1952 in der Ausschussfassung anzunehmen. Ich bitte diejenigen, die dem Gesetzentwurf in der Ausschussfassung zustimmen wollen, um das Handzeichen. - Wer stimmt dagegen? - Enthaltungen? - Der Gesetzentwurf ist damit in zweiter Beratung mit den Stimmen von CDU/CSU und FDP gegen die Stimmen der SPD bei Enthaltung der Linken und der Grünen angenommen.

Dritte Beratung

und Schlussabstimmung. Ich bitte diejenigen, die dem Gesetzentwurf zustimmen wollen, sich zu erheben. - Wer stimmt dagegen? - Enthaltungen? - Der Gesetzentwurf ist damit mit den gleichen Mehrheitsverhältnissen wie zuvor angenommen.

Wir kommen zur Beschlussempfehlung des Finanzausschusses zu dem Antrag der Fraktion Die Linke mit dem Titel ""Banken regulieren - Spekulationsblasen verhindern"". Der Ausschuss empfiehlt unter Buchstabe b seiner Beschlussempfehlung auf Drucksache 17/2336, den Antrag der Fraktion Die Linke auf Drucksache 17/1151 abzulehnen. Wer stimmt für diese Beschlussempfehlung? - Wer stimmt dagegen? - Enthaltungen? - Die Beschlussempfehlung ist mit den Stimmen von CDU/CSU, FDP und Grünen gegen die Stimmen der Linken bei Enthaltung der SPD angenommen.

Wir kommen zur Beschlussempfehlung des Finanzausschusses zu dem Antrag der Fraktion Die Linke mit dem Titel ""Kreditausfallversicherungen (CDS) und deren Handel vollständig verbieten"". Der Ausschuss empfiehlt in seiner Beschlussempfehlung auf Drucksache 17/2097, den Antrag der Fraktion Die Linke auf Drucksache 17/1733 abzulehnen. Wer stimmt für diese Beschlussempfehlung? - Wer stimmt dagegen? - Enthaltungen? - Die Beschlussempfehlung ist mit den Stimmen von CDU/CSU, SPD und FDP gegen die Stimmen der Linken bei Enthaltung der Grünen angenommen.

Liebe Kolleginnen und Kollegen, ich rufe die Tagesordnungspunkte 20 a und 20 b auf:

a)	Beratung der Großen Anfrage der Abgeordneten Garrelt Duin, Carsten Schneider (Erfurt), Hubertus Heil (Peine), weiterer Abgeordneter und der Fraktion der SPD

Umsetzung der Ergebnisse im Bereich der Wirtschafts- und Finanzpolitik der G-8- und G-20-Gipfel durch die Bundesregierung

- Drucksachen 17/1796, 17/2295 -

b)	Beratung des Antrags der Abgeordneten Ulla Lötzer, Dr. Barbara Höll, Eva Bulling-Schröter, weiterer Abgeordneter und der Fraktion DIE LINKE

G-20-Gipfel in Toronto für eine demokratische Kontrolle der Finanzmärkte und eine Wende zur nachhaltigen Regulierung der Weltwirtschaft nutzen

- Drucksache 17/2232 -

Überweisungsvorschlag:

Finanzausschuss (f)

Rechtsausschuss

Ausschuss für Wirtschaft und Technologie

Ausschuss für wirtschaftliche Zusammenarbeit und Entwicklung

Nach einer interfraktionellen Vereinbarung ist für die Aussprache eine Stunde vorgesehen. - Ich höre keinen Widerspruch. Dann ist das so beschlossen.

Ich eröffne die Aussprache und erteile dem Kollegen Garrelt Duin für die SPD-Fraktion das Wort.",data/txt/17052.txt,chair,
2410780,52,17,0,,,,254,Beifall bei der SPD,data/txt/17052.txt,poi,
2410781,52,17,0,Vizepräsident Dr. h. c. Wolfgang Thierse,Dr. h. c. Wolfgang Thierse,wolfgang-thierse,255,,data/txt/17052.txt,chair,
2410782,52,17,0,Garrelt Duin (SPD),Garrelt Duin,garrelt-duin,256,"Vielen Dank, Herr Präsident. - Liebe Kolleginnen und Kollegen! Ich habe bereits gestern im Anschluss an die Regierungserklärung von Minister Brüderle darauf hingewiesen, dass wir erwartet haben, zu den Gipfeln von G 8 und G 20 in Toronto eine Regierungserklärung der Kanzlerin zu hören. Das wäre der Tragweite angemessen gewesen. Wir haben zumindest eine Regierungserklärung des Bundesfinanzministers erwartet. Er wird sich immerhin, da wir zu diesem Thema eine Große Anfrage gestellt haben, in der Debatte gleich zu Wort melden.

Welche Erwartungen hat die weltweite Öffentlichkeit mit diesen Gipfeln von G 8 und G 20 verbunden? Nicht erst seit dem 15. September 2008, aber seitdem verschärft, haben die Menschen weltweit das Gefühl, dass wegen mangelnder Regulierung etwas aus dem Ruder gelaufen ist. In vielen Ländern der Erde haben die Menschen konkret gespürt - davor haben sie von Anfang an Angst gehabt -, dass nicht diejenigen, die das Chaos auf den Finanzmärkten verursacht und die entsprechenden Auswirkungen auf die Realwirtschaft zu verantworten haben, die Zeche dafür zahlen, sondern dass sie selbst die Zeche dafür zahlen. Deswegen waren die Erwartungen so groß, und deswegen war nach dem Gipfel in Pittsburgh im September des Jahres 2009 Erleichterung zu spüren. Dort sind Vereinbarungen getroffen worden, mit denen das richtige Ziel verfolgt wurde. Diese Vereinbarungen bezogen sich auf eine Koordinierung der Wirtschaftspolitiken der beteiligten Länder weltweit, beinhalteten aber auch klare Verabredungen für neue Regeln auf den Finanzmärkten.

Das, was damals auf den Weg gebracht worden ist, hätte jetzt in Toronto zu Ende gebracht werden sollen. Es ging darum, feste Regeln zu vereinbaren. Nichts davon ist in Toronto Realität geworden, und das wirkt weit über die betroffene Branche hinaus. Das lässt Menschen an den Institutionen der Demokratie und an der Handlungsfähigkeit der Politik zweifeln. Das ist das schlimme Ergebnis dieser Gipfel.",data/txt/17052.txt,speech,spd
2410783,52,17,0,,,,257,Beifall bei der SPD,data/txt/17052.txt,poi,
2410784,52,17,0,Garrelt Duin (SPD),Garrelt Duin,garrelt-duin,258,"Sehr geehrter Herr Bundesfinanzminister, ich will als Beispiel die Finanzmarkttransaktionsteuer herausgreifen. Als wir zu Beginn dieses Jahres hier über Griechenland und die Euro-Stabilisierung gesprochen haben, gab es ein klares Nein. Man sagte, die Bundesregierung wolle dieses Instrument nicht. Danach hörte man ein Vielleicht. Dann hat die Bundeskanzlerin erklärt, ja, man könne dieses Instrument ins Auge fassen; wenn alle dafür seien, wolle sie sich dem nicht verweigern. Der Höhepunkt war der Auftritt der Bundeskanzlerin beim DGB, als sie gesagt hat, wenn die Gewerkschaften das in allen G-20-Ländern organisiert hätten, würde sie das eventuell mittragen. Wie glaubwürdig ist das eigentlich? Mit welcher Kraft kann man auf einem solchen Gipfel dann noch auftreten? Das Ergebnis ist natürlich das Scheitern in dieser Frage: Man verzagt und vertagt. Jetzt sagt man: In Seoul wollen wir noch einmal darüber sprechen.

Das ist die falsche Strategie, und die hat eine Ursache: Diese Bundesregierung und insbesondere diese Bundeskanzlerin werden ihrer Führungsaufgabe innerhalb der Europäischen Union nicht gerecht. Das ist ein großes Drama.",data/txt/17052.txt,speech,spd
2410785,52,17,0,,,,259,Beifall bei der SPD und der LINKEN,data/txt/17052.txt,poi,
2410786,52,17,0,Garrelt Duin (SPD),Garrelt Duin,garrelt-duin,260,"Stattdessen sagen Sie - das steht in Ihrer Antwort auf die Frage 17; diese Antwort kam zwei Tage vor dem Gipfel -:

Die Bundesregierung nimmt dabei eine aktive Rolle ein.

Herzlichen Glückwunsch! Weiter heißt es: Aus Sicht der Bundesregierung ist es von zentraler Bedeutung, dass ein starkes, nachhaltiges und ausgeglichenes Wachstum berücksichtigt wird, insbesondere durch Verfolgung einer nachhaltigen Konsolidierungsstrategie. - Wir haben gestern über Nachhaltigkeit diskutiert. Allein durch Sparen, und erst recht nicht durch Sparen an der falschen Stelle, werden Sie weder in Deutschland noch in Europa noch in der Welt ein nachhaltiges Wachstum generieren können. Der Weg, auf den Sie sich gemacht haben, ist der falsche Weg.",data/txt/17052.txt,speech,spd
2410787,52,17,0,,,,261,Beifall bei der SPD sowie bei Abgeordneten der LINKEN und des BÜNDNISSES 90/DIE GRÜNEN,data/txt/17052.txt,poi,
2410788,52,17,0,Garrelt Duin (SPD),Garrelt Duin,garrelt-duin,262,"Es geht im Übrigen nicht darum - Sie sollten diesen Pappkameraden gar nicht erst aufbauen -,",data/txt/17052.txt,speech,spd
2410789,52,17,0,Leo Dautzenberg [CDU/CSU],Leo Dautzenberg,leo-dautzenberg,263,Sie bauen den doch auf!,data/txt/17052.txt,poi,cducsu
2410790,52,17,0,Garrelt Duin (SPD),Garrelt Duin,garrelt-duin,264,"durch neue Verschuldung Exporte aus den USA zu finanzieren. Es kann doch nicht angehen, dass wir hier über Wachstum reden, und das Einzige, das Ihnen einfällt, ist ein Konsolidierungspaket, durch das Sie bei den Schwächsten unserer Gesellschaft sparen. Wie soll dadurch Wachstum generiert werden? Das funktioniert weder in Deutschland noch in Europa oder weltweit.",data/txt/17052.txt,speech,spd
2410791,52,17,0,,,,265,Beifall bei der SPD und der LINKEN,data/txt/17052.txt,poi,
2410792,52,17,0,Garrelt Duin (SPD),Garrelt Duin,garrelt-duin,266,"Um von den Sparvorschlägen, die Sie gemacht haben, wegzukommen: Das Dramatische ist, dass Ihr Scheitern in Toronto kein Einzelfall ist. Wenn wir uns Kopenhagen in Erinnerung rufen - dort ging es um den Klima-schutz -, sehen wir, dass diese Bundesregierung auch dort nichts auf die Reihe bekommen hat. Es geht ja nicht nur um den Klimawandel im engeren Sinne, sondern es geht auch darum, intelligente Lösungen zu finden, um ein nachhaltiges Wachstum durch einen verstärkten Einsatz von erneuerbaren Energien, von Effizienztechnologien zu bewerkstelligen. In beiden Fällen - in Kopenhagen wie in Toronto - gab es keine Einigung, keine klare Linie der deutschen Bundesregierung. Es kann sehr hilfreich sein, wenn ein Christdemokrat wie Jean-Claude Juncker in manchen Fragen vorangeht. Aber wir wissen aus der Geschichte, dass es notwendig ist, dass die Führung der deutschen Bundesregierung, dass die Bundeskanzlerin gemeinsam mit Franzosen, Briten und anderen auf dieser Ebene stärker auftritt, als das zuletzt der Fall gewesen ist.

Ich möchte deutlich betonen: Die Enttäuschung der Menschen über die Nichtergebnisse dieses Gipfels ist eine riesige Gefahr für das Vertrauen in die Demokratie, in die Handlungsfähigkeit unserer Institutionen. Wenn Sie sich im Internet ein bisschen umschauen - Sie müssen gar nicht erst auf die Seiten von Attac gehen, sondern Sie können sich von der Mitte der Gesellschaft besuchte Seiten anschauen -, wenn Sie sich die Kommentare zu den Ergebnissen dieses Gipfels ansehen, dann erkennen Sie eine Radikalisierung außerhalb der gewohnten parlamentarischen Strukturen. Die Menschen werden verzweifelter.",data/txt/17052.txt,speech,spd
2410793,52,17,0,Leo Dautzenberg [CDU/CSU],Leo Dautzenberg,leo-dautzenberg,267,"Wenn sie Ihren Beitrag hören, kann das der Fall sein!",data/txt/17052.txt,poi,cducsu
2410794,52,17,0,Gegenruf des Abg. Hubertus Heil [Peine] [SPD],Hubertus Heil,hubertus-heil,268,Getroffene Hunde bellen!,data/txt/17052.txt,poi,spd
2410795,52,17,0,Garrelt Duin (SPD),Garrelt Duin,garrelt-duin,269,"Das Problem besteht nicht nur in Deutschland, sondern weltweit. Wir erleben nicht nur Menschen, die bei Gipfeln Randale machen - denen möchte ich hier als Allerletzter das Wort reden; davon bin ich weit entfernt -, sondern wir erleben auch, dass Menschen sich überlegen, ob unsere Institutionen und Strukturen eigentlich noch in der Lage sind, dieses riesige Problem in den Griff zu bekommen. Wenn wir dieser Radikalisierung etwas entgegensetzen wollen, dann brauchen wir klarere, verbindlichere Entscheidungen.

Sehr geehrter Herr Bundesminister Schäuble, Sie haben von Ihrem Vorgänger im Amt, Peer Steinbrück, nach Pittsburgh ein ausgezeichnet bestelltes Feld internationaler Zusammenarbeit übernommen.",data/txt/17052.txt,speech,spd
2410796,52,17,0,,,,270,Beifall bei der SPD sowie bei Abgeordneten des BÜNDNISSES 90/DIE GRÜNEN,data/txt/17052.txt,poi,
2410797,52,17,0,Garrelt Duin (SPD),Garrelt Duin,garrelt-duin,271,"Jetzt finden wir eine Brache vor. Das ist ein wirkliches Drama; das habe ich hier beschrieben. Hoffentlich ändern Sie das bald.

Herzlichen Dank.",data/txt/17052.txt,speech,spd
2410798,52,17,0,,,,272,Beifall bei der SPD,data/txt/17052.txt,poi,
2410799,52,17,0,Garrelt Duin (SPD),Garrelt Duin,garrelt-duin,273,,data/txt/17052.txt,speech,spd
2410800,52,17,0,Vizepräsident Dr. h. c. Wolfgang Thierse,Dr. h. c. Wolfgang Thierse,wolfgang-thierse,274,Das Wort hat nun Bundesminister Wolfgang Schäuble.,data/txt/17052.txt,chair,
2410801,52,17,0,,,,275,Beifall bei der CDU/CSU und der FDP,data/txt/17052.txt,poi,
2410802,52,17,0,Vizepräsident Dr. h. c. Wolfgang Thierse,Dr. h. c. Wolfgang Thierse,wolfgang-thierse,276,,data/txt/17052.txt,chair,
2410803,52,17,0,"Dr. Wolfgang Schäuble, Bundesminister der Finanzen",Dr. Wolfgang Schäuble,wolfgang-schauble,277,"Herr Präsident! Meine Damen und Herren! Herr Kollege Duin, um die Prozesse, die Sie beschrieben haben, nicht zu befördern, sollten wir uns darauf verständigen, dass Global Governance, also eine Welt, die immer stärker vernetzt ist, in der sich Entwicklungen, Entscheidungen und Probleme in einem Teil der Welt in allen anderen Teilen der Welt auswirken, von einer ungeheuren Komplexität ist. Diese Probleme können von keinem Land allein gelöst werden. Die Bundeskanzlerin der Bundesrepublik Deutschland ist eine der wichtigsten politischen Führungsfiguren in der Welt, aber nicht sie allein trifft die Entscheidungen für die 7 Milliarden Menschen auf dieser Welt.

Die Verhandlungen der G 20 sind außergewöhnlich schwierig. Ich habe großen Respekt; aber wenn Sie sagen, nach dem Ende der Amtszeit meines geschätzten Vorgängers sei alles gut gewesen und seitdem sei alles schlechter geworden, machen Sie sich eher lächerlich.",data/txt/17052.txt,speech,
2410804,52,17,0,,,,278,Beifall bei der CDU/CSU und der FDP,data/txt/17052.txt,poi,
