id,sitzung,wahlperiode,in_writing,speaker,speaker_cleaned,speaker_fp,sequence,text,filename,type,speaker_party
1929550,76,17,0,,,,610,"- Das war die Aussage der Bundesregierung.

Jetzt stelle ich fest: Genau das passiert nicht. Die Abschreckung hat nicht funktioniert. Sie werden nächste Woche kommen und sagen: Irland braucht Geld. Wie wir uns verhalten werden, hängt davon ab, welche Konditionen Sie dort ausgehandelt haben werden. Die Fragen sind: Werden die Finanzmärkte gezähmt? Wer zahlt eigentlich die Zeche für die Krise? Ist unlauterer Steuerwettbewerb in der Europäischen Union weiterhin Konsens?

Es bleibt also festzuhalten, dass dieser große Schirm, die Macht der großen Zahlen, an dessen Zustandekommen Sie nur gering beteiligt waren, den Sie dann aber letztendlich hier mit einer Woche Beratungszeit durchgepeitscht haben, nicht funktioniert hat.

Deswegen, meine Damen und Herren von der Bundesregierung, Herr Finanzminister, gilt: Sie sind und bleiben Getriebene und Gehetzte der Märkte. Wir haben nicht das Primat der Politik, im Gegenteil. Auch wenn die Bundeskanzlerin das am Mittwoch behauptet hat, ist es de facto nicht so. Jede neue Ausweitung der Spreads, jede Ausweitung der Zinsspanne, führt zu Verunsicherung.",data/txt/17076.txt,speech,
1929551,76,17,0,Otto Fricke [FDP],Otto Fricke [FDP],otto-fricke-fdp,611,"Da siehst du mal, wohin uns elf Jahre SPD gebracht haben!",data/txt/17076.txt,poi,fdp
1929552,76,17,0,,,,612,"Es hilft nichts - ich weiß, dass Ihnen das wehtut, Herr Fricke -,",data/txt/17076.txt,speech,
1929553,76,17,0,Otto Fricke [FDP],Otto Fricke [FDP],otto-fricke-fdp,613,"Nein, ich bin traurig über die SPD!",data/txt/17076.txt,poi,fdp
1929554,76,17,0,,,,614,"hier immer wieder mit der Tröpfchentaktik zu kommen. Das wird zu keiner Beruhigung führen, weil nach Irland Portugal folgen wird. Das ist vollkommen klar. Danach wird man sich die Nächsten herausbrechen.",data/txt/17076.txt,speech,
1929555,76,17,0,Otto Fricke [FDP],Otto Fricke [FDP],otto-fricke-fdp,615,Wissen Sie das?,data/txt/17076.txt,poi,fdp
1929556,76,17,0,,,,616,Es werden Spanien oder Italien sein. Die FAZ spekuliert darüber. Damit ist vollkommen klar: Dieser Schirm wird nicht ausreichen.,data/txt/17076.txt,speech,
1929557,76,17,0,Otto Fricke [FDP],Otto Fricke [FDP],otto-fricke-fdp,617,Haben Sie darüber Kenntnisse?,data/txt/17076.txt,poi,fdp
1929558,76,17,0,,,,618,"Deswegen ist es so, dass Sie, meine Damen und Herren von der Koalition, bei der Regulierung der internationalen Finanzmärkte versagt haben. Nichts ist in Seoul durchgesetzt worden: keine Finanztransaktionsteuer auf europäischer Ebene, keine stärkere Bankenaufsicht. Es gab auch keine Antworten auf die elementaren Fragen, wie es insgesamt mit dem Euro weitergeht.

Meine Damen und Herren, das ist ernüchternd und erschütternd.",data/txt/17076.txt,speech,
1929559,76,17,0,Dr. Michael Meister [CDU/CSU],Dr. Michael Meister [CDU/CSU],michael-meister-cdu-csu,619,Ihre Rede ist ernüchternd und erschütternd!,data/txt/17076.txt,poi,cducsu
1929560,76,17,0,,,,620,"Wir brauchen hier aber eine Bundesregierung, die weiß, was sie will, die einen klaren Fahrplan hat und die nicht so ungeschickt agiert, dass sie redet, bevor sie weiß, was sie will, was ja zu noch stärkerer Verunsicherung führt. Wir brauchen eine Bundesregierung, die führt. Ich hoffe, dass zumindest die Partner auf europäischer Ebene das Notwendige durchsetzen werden.

Vielen Dank.",data/txt/17076.txt,speech,
1929561,76,17,0,,,,621,Beifall bei der SPD,data/txt/17076.txt,poi,
1929562,76,17,0,,,,622,"Vizepräsidentin Katrin Göring-Eckardt:

Norbert Barthle hat jetzt das Wort für die CDU/CSU-Fraktion.",data/txt/17076.txt,speech,
1929563,76,17,0,,,,623,Beifall bei der CDU/CSU und der FDP,data/txt/17076.txt,poi,
1929564,76,17,0,,,,624,"Norbert Barthle (CDU/CSU):

Sehr verehrte Frau Präsidentin! Liebe Kolleginnen und Kollegen! In der Schlussrunde dieser Haushaltsdebatte will ich zuallererst einen ganz herzlichen Dank an die Mitarbeiterinnen und Mitarbeiter des Haushaltsausschusses, aber auch in unseren Büros richten. Wir haben tatsächlich arbeitsreiche Wochen hinter uns. Diesen Dank haben sie verdient.",data/txt/17076.txt,speech,
1929565,76,17,0,,,,625,"Beifall bei der CDU/CSU und der FDP sowie bei Abgeordneten der SPD, der LINKEN und des BÜNDNISSES 90/DIE GRÜNEN",data/txt/17076.txt,poi,
1929566,76,17,0,Otto Fricke [FDP],Otto Fricke [FDP],otto-fricke-fdp,626,So ist das fair!,data/txt/17076.txt,poi,fdp
1929567,76,17,0,,,,627,"Ich will auch einen Dank an die Kolleginnen und Kollegen im Haushaltsausschuss richten, und zwar nicht nur an die aus der Koalition, sondern auch an die aus der Opposition, die zumindest weitestgehend konstruktiv mitgearbeitet haben. Ich kann es mir aber nicht verkneifen, noch einmal daran zu erinnern, dass in der Bereinigungssitzung der letzte und raffiniert eingefädelte Versuch, die Koalition zum Kippen zu bringen, gescheitert ist.",data/txt/17076.txt,speech,
1929568,76,17,0,,,,628,Beifall des Abg. Otto Fricke [FDP],data/txt/17076.txt,poi,
1929569,76,17,0,,,,629,Lachen bei der LINKEN,data/txt/17076.txt,poi,
1929570,76,17,0,,,,630,"Selbst nachts um drei war die Koalition arbeitsfähig, widerstandsfähig und geschlossen und hat die Mehrheit gestellt.",data/txt/17076.txt,speech,
1929571,76,17,0,,,,631,Lachen bei der SPD und bei der LINKEN,data/txt/17076.txt,poi,
1929572,76,17,0,,,,632,Selbst um diese Uhrzeit sind noch Anträge abgelehnt worden. Auch das hat ein Lob verdient.,data/txt/17076.txt,speech,
1929573,76,17,0,,,,633,Beifall bei der CDU/CSU und der FDP,data/txt/17076.txt,poi,
1929574,76,17,0,Dr. Peter Danckert [SPD],Dr. Peter Danckert [SPD],peter-danckert-spd,634,"Sagen Sie mal, worum es ging!",data/txt/17076.txt,poi,spd
1929575,76,17,0,Stephan Kühn [BÜNDNIS 90/ DIE GRÜNEN],Stephan Kühn [BÜNDNIS 90/ DIE GRÜNEN],stephan-kuhn-bundnis-90-die-grunen,635,"Bezeichnend, dass Sie das extra noch einmal sagen müssen!",data/txt/17076.txt,poi,gruene
1929576,76,17,0,,,,636,Weitere Zurufe vom BÜNDNIS 90/DIE GRÜNEN,data/txt/17076.txt,poi,
1929577,76,17,0,,,,637,"Nun ist am Freitag bei der abschließenden Beratung des Haushaltes auch Zeit, die Woche nochmals Revue passieren zu lassen.

Die Haushaltswoche und die hier gehörten Reden kann man zum Beispiel Revue passieren lassen, indem man einen Blick in die Presselandschaft wirft; dieser lohnt sich wirklich. Es reicht, die Überschriften zu lesen. Ich zitiere mit Erlaubnis der Frau Präsidentin. Die Welt schreibt als Kopfnote für die Kanzlerin: ""Note 1"". Bravo! Die Sächsische Zeitung schreibt: ""Wo ist eigentlich die SPD geblieben?"" Die Süddeutsche Zeitung beantwortet das: ""Die SPD, ein erloschener Vulkan"". Die Neue Zürcher Zeitung schreibt: Die Unionsparteien im Aufwind. - Bei einer solchen Presselandschaft sind wir Haushälter sehr zufrieden.",data/txt/17076.txt,speech,
1929578,76,17,0,,,,638,Beifall bei der CDU/CSU,data/txt/17076.txt,poi,
1929579,76,17,0,Dr. Peter Danckert [SPD],Dr. Peter Danckert [SPD],peter-danckert-spd,639,Wo bleibt die FDP? Bei wie viel Prozent?,data/txt/17076.txt,poi,spd
1929580,76,17,0,,,,640,"Daraus erklärt sich aber auch ein Stück weit die aggressiv vorgetragene und falsche Rede des Kollegen von der SPD. Wenn man so dasteht, dann wird man nervös, dann wird man aggressiv.

Wenn ich die Woche weiter Revue passieren lasse, komme ich zu der Feststellung, dass uns zunächst einmal vorgeworfen wurde, wir würden zu wenig sparen. Diese Behauptung wird allein schon durch das reine Zahlenwerk widerlegt. Im Vergleich zu 2010 wurde der Etat von 319 auf 305 Milliarden Euro zurückgeführt. Das ist eine Hausnummer: fast 14 Milliarden Euro weniger an Ausgaben gegenüber dem Haushalt 2010, aber auch weniger Ausgaben gegenüber dem Regierungsentwurf. Das war die Leistung der Parlamentarier. Gegenüber dem Regierungsentwurf haben wir weitere Einsparungen vorgenommen und konnten so die Nettokreditaufnahme noch einmal um mehr als 9 Milliarden Euro senken. Auch das darf nicht verschwiegen werden.",data/txt/17076.txt,speech,
1929581,76,17,0,,,,641,Beifall bei der CDU/CSU sowie bei Abgeordneten der FDP,data/txt/17076.txt,poi,
1929582,76,17,0,,,,642,"Gleichzeitig hören wir vonseiten der Opposition als Kritik bei jedem Einzelplan und bei vielen Einzelposten, das sei unteretatisiert bzw. unterfinanziert. Sie müssen sich einmal darüber im Klaren werden, was eigentlich gilt.

An dieser Stelle bitte ich uns alle, noch einmal sorgfältig nachzudenken. Immer dann, wenn bei der Beratung eines Einzelplans oder einer bestimmten Maßnahme über Mehrausgaben, über mehr Geld berichtet wird, klatscht das ganze Haus. Wenn sich die Opposition darüber beschwert, dass irgendwo gespart wird, dann klatscht die gesammelte Opposition. Darüber sollten wir ernsthaft nachdenken, meine Damen und Herren. Denn eines ist doch klar: Wer nach Europa blickt, wer in die Welt blickt, sieht, dass die Zeit der Ausgabenzuwächse, der wachsenden Haushalte, der Möglichkeit, mehr Geld auszugeben, vorbei ist. Wenn man mehr Geld ausgeben will, hat man eigentlich nur zwei Möglichkeiten. Erstens kann man die Einnahmeseite verbessern.",data/txt/17076.txt,speech,
1929583,76,17,0,Dr. Dietmar Bartsch [DIE LINKE],Dr. Dietmar Bartsch [DIE LINKE],dietmar-bartsch-die-linke,643,Sehr richtig!,data/txt/17076.txt,poi,linke
1929584,76,17,0,Weitere Zurufe von der LINKEN,Weitere e von der LINKEN,weitere-e-linken,644,Richtig!,data/txt/17076.txt,poi,linke
1929585,76,17,0,,,,645,"- Da kommt sofort Beifall von der Linken. Auch die SPD ist immer noch auf dem Trip. Auch die Grünen, die gern vom neuen Denken fabulieren, sind noch genau in dieser Denkweise verhaftet;",data/txt/17076.txt,speech,
1929586,76,17,0,Fritz Kuhn [BÜNDNIS 90/DIE GRÜNEN],Fritz Kuhn [BÜNDNIS 90/DIE GRÜNEN],fritz-kuhn-bundnis-90-die-grunen,646,Quatsch!,data/txt/17076.txt,poi,gruene
1929587,76,17,0,,,,647,"Einnahmeseite verbessern, mehr Geld bei den Bürgerinnen und Bürgern holen, um dann wieder verteilen zu können.",data/txt/17076.txt,speech,
1929588,76,17,0,Fritz Kuhn [BÜNDNIS 90/DIE GRÜNEN],Fritz Kuhn [BÜNDNIS 90/DIE GRÜNEN],fritz-kuhn-bundnis-90-die-grunen,648,Quatsch!,data/txt/17076.txt,poi,gruene
1929589,76,17,0,Alexander Bonde [BÜNDNIS 90/ DIE GRÜNEN],Alexander Bonde [BÜNDNIS 90/ DIE GRÜNEN],alexander-bonde-bundnis-90-die-grunen,649,"Solider Mix! Subventionsabbau, da war doch mal was bei euch!",data/txt/17076.txt,poi,gruene
1929590,76,17,0,,,,650,"Das ist der falsche Weg.

Neues Denken heißt, strukturell zu sparen. Strukturell zu sparen, heißt, auf der Ausgabenseite zu sparen. Genau das machen wir, macht die Koalition aus CDU/CSU und FDP; denn dieses Sparen ist auf Dauer wirksam, ist nachhaltig, nicht gestützt auf konjunkturelle Effekte. Genau das machen wir.",data/txt/17076.txt,speech,
1929591,76,17,0,,,,651,Beifall bei der CDU/CSU sowie bei Abgeordneten der FDP,data/txt/17076.txt,poi,
1929592,76,17,0,Dr. Dietmar Bartsch [DIE LINKE],Dr. Dietmar Bartsch [DIE LINKE],dietmar-bartsch-die-linke,652,Sie sparen bei den Schwächsten! Das ist das Problem!,data/txt/17076.txt,poi,linke
1929593,76,17,0,,,,653,"Meine Damen und Herren, wenn Sie sich die verschiedenen Politikbereiche anschauen, stellen Sie fest, dass das geht. Denn das ist genau das, was die Bundeskanzlerin immer meint, wenn sie sagt: Wir müssen, Priorität Nummer eins, konsolidieren.",data/txt/17076.txt,speech,
1929594,76,17,0,Bettina Hagedorn [SPD],Bettina Hagedorn [SPD],bettina-hagedorn-spd,654,Tun Sie aber nicht!,data/txt/17076.txt,poi,spd
1929595,76,17,0,,,,655,"Das ist das, was der Finanzminister meint, wenn er sagt: wachstumsorientiertes Sparen. Wenn Sie sich anschauen, was der Herr zu Guttenberg mit seiner Bundeswehrreform macht, stellen Sie fest, dass das genau dies ist.",data/txt/17076.txt,speech,
1929596,76,17,0,Alexander Bonde [BÜNDNIS 90/DIE GRÜNEN],Alexander Bonde [BÜNDNIS 90/DIE GRÜNEN],alexander-bonde-bundnis-90-die-grunen,656,Oh ja! Da fehlen noch 3 Milliarden zum Finanzplan! Spannende Frage!,data/txt/17076.txt,poi,gruene
1929597,76,17,0,,,,657,"Wenn Sie sich angucken, was der Kollege Niebel macht, stellen Sie fest: Es ist genau dies. Wenn Sie sich anschauen, was die Frau Schröder macht,",data/txt/17076.txt,speech,
1929598,76,17,0,Zuruf von der SPD,von der SPD,von-der-spd,658,"In der Jungen Union, oder wie?",data/txt/17076.txt,poi,spd
1929599,76,17,0,,,,659,"stellen Sie fest: Es ist genau dies.

Denn die Zeiten, in denen wir in der Denkweise verharren können: ""Wir brauchen mehr Geld, um Politik zu gestalten"", sind vorbei. Politikgestaltung der Zukunft heißt, mit dem gleichen Geld oder gar mit weniger Geld gestalten und Besseres machen. Das ist der Grundansatz, dem wir nachfolgen und den wir in realistische Politik umsetzen.",data/txt/17076.txt,speech,
1929600,76,17,0,,,,660,Beifall bei der CDU/CSU sowie bei Abgeordneten der FDP,data/txt/17076.txt,poi,
1929601,76,17,0,Dr. Dietmar Bartsch [DIE LINKE],Dr. Dietmar Bartsch [DIE LINKE],dietmar-bartsch-die-linke,661,Konsequent das Geld abschaffen!,data/txt/17076.txt,poi,linke
1929602,76,17,0,,,,662,"Da ist das für die Öffentlichkeit mit dem Haushalt eine ganz einfache Sache. Heute früh haben wir den Landwirtschaftsetat beraten. Jeder Landwirt, jeder Weinbauer, jeder Obstbauer weiß es: Wer gute Früchte ernten will, muss zuvor den Wildwuchs beschneiden. Wer schöne Äpfel ernten will, muss die wilden Zweige entfernen. Die muss man wegschneiden. Dann gibt es eine gute Ernte. Das machen wir. Mit unserem Haushalt schaffen wir die Voraussetzungen für Wachstum, für wirtschaftlichen Erfolg, für Investitionen, für ein gutes Klima in diesem Land. Denn dieses Klima hängt davon ab, dass wir verlässliche Staatsfinanzen haben, eine verlässliche Währung. Dafür setzen wir uns ein.",data/txt/17076.txt,speech,
1929603,76,17,0,,,,663,Beifall bei der CDU/CSU und der FDP,data/txt/17076.txt,poi,
1929604,76,17,0,,,,664,"Nun lassen Sie mich noch auf die von dem Kollegen aus der SPD immer wieder vorgetragene Kritik an der Schuldenbremse eingehen. Er beruft sich auf den Bundesrechnungshof, auf den Sachverständigenrat, auf die Bundesbank.",data/txt/17076.txt,speech,
1929605,76,17,0,Dr. Peter Danckert [SPD],Dr. Peter Danckert [SPD],peter-danckert-spd,665,Das ist ja sehr beachtlich!,data/txt/17076.txt,poi,spd
1929606,76,17,0,,,,666,"Wenn man das genau nachliest, stellt man sehr schnell fest, dass alle drei an keiner Stelle sagen, es bestehe eine rechtliche Verpflichtung, die Schuldenbremse ständig neu anzupassen. Nirgendwo! Im Gegenteil, Sie appellieren lediglich",data/txt/17076.txt,speech,
1929607,76,17,0,Carsten Schneider [Erfurt] [SPD],Carsten Schneider [Erfurt] [SPD],carsten-schneider-erfurt-spd,667,"""Lediglich"" ist gut!",data/txt/17076.txt,poi,spd
1929608,76,17,0,,,,668,"an uns, so viel wie irgend möglich zu sparen. Und genau das tun wir, meine Damen und Herren.",data/txt/17076.txt,speech,
1929609,76,17,0,Carsten Schneider [Erfurt] [SPD],Carsten Schneider [Erfurt] [SPD],carsten-schneider-erfurt-spd,669,Nein!,data/txt/17076.txt,poi,spd
1929610,76,17,0,,,,670,"Wir unterschreiten die Höchstgrenze der Nettokreditaufnahme um über 4 Milliarden Euro,",data/txt/17076.txt,speech,
1929611,76,17,0,Carsten Schneider [Erfurt] [SPD],Carsten Schneider [Erfurt] [SPD],carsten-schneider-erfurt-spd,671,Nein!,data/txt/17076.txt,poi,spd
1929612,76,17,0,,,,672,selbst unter Einberechnung der Konjunkturkomponente. Wir brauchen diese Appelle von Ihnen also überhaupt nicht.,data/txt/17076.txt,speech,
1929613,76,17,0,,,,673,Beifall bei der CDU/CSU und der FDP,data/txt/17076.txt,poi,
1929614,76,17,0,,,,674,Zurufe von der SPD,data/txt/17076.txt,poi,
1929615,76,17,0,,,,675,"Denn es ist schon unsere Denkweise, dass wir nicht so viele Schulden machen, wie erlaubt ist, sondern nur so wenig Schulden wie irgend möglich. So denken wir. Da brauchen wir Ihre Ratschläge überhaupt nicht.",data/txt/17076.txt,speech,
1929616,76,17,0,Zuruf vom BÜNDNIS 90/DIE GRÜNEN,vom BÜNDNIS 90/DIE GRÜNEN,vom-bundnis-90-die-grunen,676,Na also! Gehen wir heim!,data/txt/17076.txt,poi,gruene
1929617,76,17,0,,,,677,"Jetzt muss ich noch etwas zur Denkweise der SPD sagen. Die Denkweise der SPD wird an der Stelle demaskiert. Der Kollege Schneider hat dieses tolle Schaubild, diese Sprungschanze gezeigt und dem Finanzminister vorgeworfen, er erarbeite sich eine Kriegskasse, indem er Verschuldungsspielräume ausnutze.",data/txt/17076.txt,speech,
1929618,76,17,0,,,,678,Beifall bei Abgeordneten der SPD,data/txt/17076.txt,poi,
1929619,76,17,0,Bettina Hagedorn [SPD],Bettina Hagedorn [SPD],bettina-hagedorn-spd,679,Genau! Das tun Sie!,data/txt/17076.txt,poi,spd
1929620,76,17,0,Weiterer Zuruf von der SPD,von der SPD,von-der-spd,680,Das ist die Wahrheit!,data/txt/17076.txt,poi,spd
1929621,76,17,0,,,,681,Genau so denken Sie. So denken wir aber nicht.,data/txt/17076.txt,speech,
1929622,76,17,0,,,,682,Lachen bei der SPD,data/txt/17076.txt,poi,
1929623,76,17,0,,,,683,"Wir nutzen die Verschuldungsspielräume, die eventuell bestehen, nicht aus, sondern wir machen so wenig Schulden wie irgend möglich. Das demaskiert Ihre Denkweise, und das unterscheidet Sie von uns.",data/txt/17076.txt,speech,
1929624,76,17,0,,,,684,Beifall bei der CDU/CSU und der FDP,data/txt/17076.txt,poi,
1929625,76,17,0,Joachim Poß [SPD],Joachim Poß [SPD],joachim-poß-spd,685,"Er hat Schwierigkeiten, sein Grinsen zu unterdrücken!",data/txt/17076.txt,poi,spd
1929626,76,17,0,,,,686,"Ich muss ein Thema aufgreifen, das in dieser Woche immer wieder eine Rolle gespielt hat - das sei mir gestattet, da ich insofern persönlich vorbelastet bin -: die Olympiaverweigerung der Grünen.",data/txt/17076.txt,speech,
1929627,76,17,0,Fritz Kuhn [BÜNDNIS 90/DIE GRÜNEN],Fritz Kuhn [BÜNDNIS 90/DIE GRÜNEN],fritz-kuhn-bundnis-90-die-grunen,687,"Gut, dass das mal wieder jemand bringt!",data/txt/17076.txt,poi,gruene
1929628,76,17,0,,,,688,"Ich schließe mich an dieser Stelle dem Appell des Sportministers an. Er hat klipp und klar gesagt: Es wäre schön, wenn dieses Haus geschlossen diese Bewerbung unterstützen würde.",data/txt/17076.txt,speech,
1929629,76,17,0,Fritz Kuhn [BÜNDNIS 90/DIE GRÜNEN],Fritz Kuhn [BÜNDNIS 90/DIE GRÜNEN],fritz-kuhn-bundnis-90-die-grunen,689,Stellen Sie doch einen Antrag!,data/txt/17076.txt,poi,gruene
1929630,76,17,0,,,,690,"Er muss nämlich im Juni des kommenden Jahres nach Durban zur Vergabe der Olympischen Winterspiele. Wenn dort entschieden wird, soll Münchens Olympiabewerbung erfolgreich sein. Die Erfolgschancen dieser Bewerbung wären viel größer, wenn er sagen könnte: Das gesamte Parlament unterstützt diese Bewerbung.",data/txt/17076.txt,speech,
1929631,76,17,0,Jan van Aken [DIE LINKE],Jan van Aken [DIE LINKE],jan-van-aken-die-linke,691,Das wäre nicht wahr!,data/txt/17076.txt,poi,linke
1929632,76,17,0,,,,692,Doch die Grünen verweigern sich und sind dagegen.,data/txt/17076.txt,speech,
1929633,76,17,0,Jan van Aken [DIE LINKE],Jan van Aken [DIE LINKE],jan-van-aken-die-linke,693,Wir auch!,data/txt/17076.txt,poi,linke
1929634,76,17,0,Fritz Kuhn [BÜNDNIS 90/DIE GRÜNEN],Fritz Kuhn [BÜNDNIS 90/DIE GRÜNEN],fritz-kuhn-bundnis-90-die-grunen,694,Stellen Sie doch einen Antrag!,data/txt/17076.txt,poi,gruene
1929635,76,17,0,,,,695,"Am 27. März kommenden Jahres wird in Baden-Württemberg der Landtag neu gewählt. Die Grünen wollen, dass man dabei über Stuttgart 21 abstimmt.",data/txt/17076.txt,speech,
1929636,76,17,0,Fritz Kuhn [BÜNDNIS 90/DIE GRÜNEN],Fritz Kuhn [BÜNDNIS 90/DIE GRÜNEN],fritz-kuhn-bundnis-90-die-grunen,696,Merkel!,data/txt/17076.txt,poi,gruene
1929637,76,17,0,,,,697,"Ich werde allen meinen Skifahrern sagen: Ihr stimmt auch über die Olympiabewerbung 2018 ab. Jeder soll wissen, worüber er abstimmt.",data/txt/17076.txt,speech,
1929638,76,17,0,,,,698,Beifall bei der CDU/CSU und der FDP sowie des Abg. Fritz Kuhn [BÜNDNIS 90/DIE GRÜNEN],data/txt/17076.txt,poi,
1929639,76,17,0,,,,699,"Nebenbei bemerkt: Ich bin ehrenamtlicher Präsident des Verbandes für das Skilehrwesen. Schneesportlehrer gibt es allein in Deutschland mehr, als die Grünen Mitglieder haben. Diese Lehrer sind gute Multiplikatoren; auch das sollten Sie sich vor Augen führen. Sie haben Ihrem sportpolitischen Sprecher Winnie Hermann schon die Füße weggeschlagen. Korrigieren Sie diesen Lapsus! Dann kommen wir uns näher.",data/txt/17076.txt,speech,
1929640,76,17,0,Zurufe,e,e,700,Ah!,data/txt/17076.txt,poi,
1929641,76,17,0,,,,701,Jetzt ist die Katze aus dem Sack!,data/txt/17076.txt,poi,
1929642,76,17,0,,,,702,"Abschließend möchte ich auf eine Anzeige der Initiative Neue Soziale Marktwirtschaft eingehen. Sie hat die Überschrift: ""Wer seinen Haushalt im Griff hat, verdient Respekt."" Wir erwarten uns von der Öffentlichkeit weder Lobeshymnen noch Schimpftiraden, auch von der Opposition nicht. Wir erwarten lediglich Respekt. Ich glaube, den haben wir verdient.

Herzlichen Dank.",data/txt/17076.txt,speech,
1929643,76,17,0,,,,703,Beifall bei der CDU/CSU und der FDP,data/txt/17076.txt,poi,
1929644,76,17,0,,,,704,"Vizepräsidentin Katrin Göring-Eckardt:

Ich erteile das Wort dem Kollegen Steffen Bockhahn für die Fraktion Die Linke.",data/txt/17076.txt,speech,
1929645,76,17,0,,,,705,Beifall bei der LINKEN,data/txt/17076.txt,poi,
1929646,76,17,0,,,,706,"Steffen Bockhahn (DIE LINKE):

Frau Präsidentin! Meine sehr geehrten Damen und Herren! 48,4 Milliarden Euro neue Schulden! Das ist der Haushalt, den uns die schwarz-gelbe Koalition vorlegt, und das ist der Haushalt, für den sie ein Lob haben will. 48,4 Milliarden Euro neue Schulden, das ist die zweithöchste Neuverschuldung, die es in der Geschichte der Bundesrepublik Deutschland je gegeben hat. Dafür wollen Sie ein Lob haben. Das ist unglaublich.",data/txt/17076.txt,speech,
1929647,76,17,0,,,,707,Beifall bei der LINKEN sowie bei Abgeordneten der SPD und des BÜNDNISSES 90/DIE GRÜNEN,data/txt/17076.txt,poi,
1929648,76,17,0,,,,708,"Sie sagen, Sie seien ganz stolz darauf, dass Sie viele Ausgaben gekürzt haben und dass Sie einen Schritt in Richtung Haushaltskonsolidierung machen. Es ist wahr: Sie haben Ausgaben gekürzt. Das Dramatische dabei ist: Sie kürzen die Ausgaben so, dass Sie weitere neue Einnahmen für die Staatskasse verhindern. Das ist doppelt kontraproduktiv. Es besagt, wie die Neuverschuldung künftig aussehen wird: Sie wird infolge Ihrer Politik steigen, weil die Einnahmen verloren gehen.

Was meine ich damit ganz konkret? Sie kürzen wieder und wieder bei den sozial Benachteiligten,",data/txt/17076.txt,speech,
1929649,76,17,0,Zuruf von der LINKEN,von der LINKEN,von-der-linken,709,Pfui!,data/txt/17076.txt,poi,linke
1929650,76,17,0,,,,710,"bei den Menschen, die ohnehin schon wenig Kaufkraft haben, bei denen, die jeden Monat überlegen müssen, wie sie die täglichen Ausgaben überhaupt finanzieren können; ihnen greifen Sie erneut in die Tasche. Das ist tatsächlich treffsichere Politik, allerdings nur dann, wenn Sie die Binnenkonjunktur, die Kaufkraft abwürgen wollen. Das hat nämlich zur Folge, dass Sie sich der Steuereinnahmen berauben, die Sie dringend brauchen, um den Haushalt zu konsolidieren.",data/txt/17076.txt,speech,
1929651,76,17,0,,,,711,Beifall bei der LINKEN,data/txt/17076.txt,poi,
1929652,76,17,0,,,,712,"Sie kürzen Ausgaben, indem Sie bei sozial Benachteiligten streichen oder ihnen neue Lasten auferlegen, zum Beispiel bei der Kopfpauschale im Gesundheitssystem. Machen wir uns doch nichts vor: Wir als Bundestagsabgeordnete mit einem entsprechenden Einkommen könnten die Kopfpauschale ohne Probleme bezahlen. Die meisten von Ihnen sind vermutlich privat versichert; insofern trifft Sie das nicht so sehr. Auch die freiwillig gesetzlich Krankenversicherten, die etwa unser Einkommen haben, können sich das durchaus leisten. Es wird keinen Einfluss darauf haben, ob sie sich zu Weihnachten dieses oder jenes noch extra kaufen, ob sie in den Urlaub fahren, ob sie im Einzelhandel vor Ort einkaufen gehen; denn ihr Einkommen reicht insgesamt.

Aber was machen Sie bei den Geringverdienenden in Deutschland? Was machen Sie bei der Krankenschwester? Was machen Sie bei der Verkäuferin? Sie greifen schamlos in deren Portemonnaie und Sie vernichten damit weitere Arbeitsplätze, weil Sie die Kaufkraft gefährden. Diese Euros fließen in schwarze Löcher der Pharmalobby etc. pp., aber nicht dahin, wohin sie gehören, in den Handel usw., also dorthin, wo Arbeitsplätze geschaffen werden.",data/txt/17076.txt,speech,
1929653,76,17,0,,,,713,Beifall bei der LINKEN sowie bei Abgeordneten der SPD und des Abg. Sven-Christian Kindler [BÜNDNIS 90/DIE GRÜNEN],data/txt/17076.txt,poi,
1929654,76,17,0,,,,714,"Es ist schlimm genug, dass Sie in der Breite so vorgehen. Aber dazu ist es auch noch regional alles andere als ausgewogen. Die entsprechenden Zahlen stammen nicht von mir; der Paritätische Wohlfahrtsverband, der wahrlich nicht als Lobbyorganisation der FDP gilt - er darf trotzdem wahrgenommen werden -, hat ausgerechnet, dass die durch Ihr Kürzungspaket verursachte Pro-Kopf-Belastung im Osten der Republik 76 Euro beträgt, im Westen 37 Euro.",data/txt/17076.txt,speech,
1929655,76,17,0,Dr. Peter Danckert [SPD],Dr. Peter Danckert [SPD],peter-danckert-spd,715,Schamlos!,data/txt/17076.txt,poi,spd
1929656,76,17,0,,,,716,"Das heißt, ein weiteres Mal verschärfen Sie die Konflikte im Einkommensbereich zwischen Ost und West. Ein weiteres Mal tun Sie nicht etwas für die Einheit dieses Landes, sondern Sie spalten.",data/txt/17076.txt,speech,
1929657,76,17,0,,,,717,Beifall bei der LINKEN sowie bei Abgeordneten der SPD,data/txt/17076.txt,poi,
