id,sitzung,wahlperiode,in_writing,speaker,speaker_cleaned,speaker_fp,sequence,text,filename,type,speaker_party
2460607,79,17,0,Dr. Dagmar Enkelmann [DIE LINKE],Dr. Dagmar Enkelmann,dagmar-enkelmann,843,Aber knapp!,data/txt/17079.txt,poi,linke
2460608,79,17,0,Vizepräsidentin Gerda Hasselfeldt,Gerda Hasselfeldt,gerda-hasselfeldt,844,"So weit zu den Ergebnissen der namentlichen Abstimmungen.

Jetzt können wir in der Debatte fortfahren. Das Wort hat die Kollegin Elisabeth Winkelmeier-Becker für die CDU/CSU-Fraktion.",data/txt/17079.txt,chair,
2460609,79,17,0,,,,845,Beifall bei Abgeordneten der CDU/CSU und der FDP,data/txt/17079.txt,poi,
2460610,79,17,0,Vizepräsidentin Gerda Hasselfeldt,Gerda Hasselfeldt,gerda-hasselfeldt,846,,data/txt/17079.txt,chair,
2460611,79,17,0,Elisabeth Winkelmeier-Becker (CDU/CSU),Elisabeth Winkelmeier-Becker,elisabeth-winkelmeier-becker,847,"Frau Präsidentin! Liebe Kolleginnen und Kollegen! Dies ist die erste Lesung dieses Gesetzentwurfs; aber es ist bei weitem nicht das erste Mal, dass wir uns mit dem Thema ""Frauen in Führungspositionen"" hier im Plenum beschäftigen. Dieses Thema stand auch in der vergangenen Sitzungswoche auf der Tagesordnung, und ich habe selber dazu gesprochen. Daher ist es kein Geheimnis - ich brauche nicht darum herumzureden -, dass ich mir durchaus vorstellen kann, dass wir dazu kommen, eine verbindliche Quote für Frauen in Führungspositionen, speziell in Aufsichtsräten, zu beschließen.",data/txt/17079.txt,speech,cducsu
2460612,79,17,0,,,,848,Beifall beim BÜNDNIS 90/DIE GRÜNEN sowie bei Abgeordneten der CDU/CSU und der SPD,data/txt/17079.txt,poi,
2460613,79,17,0,Elisabeth Winkelmeier-Becker (CDU/CSU),Elisabeth Winkelmeier-Becker,elisabeth-winkelmeier-becker,849,"Ich habe schon in der letzten Sitzungswoche gesagt, dass wir, die Kolleginnen in der Unionsfraktion, zunächst noch für ein anderes Modell stehen. Wir haben eine Beschlusslage, für die wir kämpfen, aber eben auch noch kämpfen müssen; auch das sei zugegeben. Unsere Beschlusslage zielt darauf ab, dass nach den nächsten Aufsichtsratswahlen - in den meisten Unternehmen stehen im Jahr 2013 Aufsichtsratswahlen an - 30 Prozent der Aufsichtsratssitze von Frauen eingenommen werden. Zunächst soll dem noch auf freiwilliger Basis nachgekommen werden. Wir behalten uns aber vor, dass ab dem darauffolgenden Turnus, also ab 2018, eine Quote von 30 Prozent verbindlich vorgeschrieben ist, wenn sich bis dahin signifikant nichts geändert hat. Darüber, dass hier Änderungsbedarf besteht, herrscht Konsens.

Die Zahlen hat Frau Künast bereits genannt. Was die Anzahl der Frauen in Vorständen angeht, sind die Zahlen einstellig. Unter 10 Prozent der Mitglieder der Aufsichtsräte sind Frauen. Dem stellen wir den Befund gegenüber, dass über die Hälfte der Hochschulabsolventen Frauen sind. Ihre Ergebnisse sind im Durchschnitt häufig besser als die der Männer. Es kann also nicht das Ergebnis der Bestenauslese sein, dass weniger als 10 Prozent oder sogar nur 3 Prozent der einflussreichen und auch lukrativen Positionen in Unternehmen von Frauen besetzt werden. Es stellt sich schon die Frage, wieso wir uns das eigentlich weiter leisten können, wieso die Unternehmen sich das leisten können. Es gibt Studien, die belegen, dass Unternehmen mit Frauen in Führungspositionen häufig bessere Ergebnisse erzielen. Die Forderungen, den jetzigen Zustand rasch und nachhaltig zu ändern, werden deshalb immer zahlreicher. Dieses Anliegen wird über Fraktionsgrenzen hinweg verfolgt; auch im Koalitionsvertrag ist es explizit genannt.

Wenn wir uns anschauen, wo die Gründe für den Mangel an Frauen in Führungspositionen liegen, um daraus Konsequenzen zu ziehen, dann begegnen wir zunächst einmal altbekannten Erklärungsmustern. Frauen geraten an die schon erwähnte gläserne Decke, weil sie traditionell immer noch eine andere Kombination von Familien- und Berufsaufgaben übernehmen. Das wird oft auch erwartet. Schon die Erwartungshaltung weckt eine gewisse Dynamik.",data/txt/17079.txt,speech,cducsu
2460614,79,17,0,Iris Gleicke [SPD],Iris Gleicke,iris-gleicke,850,Leider wahr!,data/txt/17079.txt,poi,spd
2460615,79,17,0,Elisabeth Winkelmeier-Becker (CDU/CSU),Elisabeth Winkelmeier-Becker,elisabeth-winkelmeier-becker,851,"Frauen üben seltener technische Berufe aus, also Berufe, in denen es viele Führungsaufgaben gibt. So weit die Fakten.

Daraus ist die Konsequenz zu ziehen, dass die Überwindung all der beschriebenen Kausalitäten hilft, auf dem Weg voranzukommen, mehr Frauen in Führungspositionen zu bringen. Ich denke an die Unterstützung von Frauen in MINT-Berufen und an die Förderung der Vereinbarkeit von Beruf und Familie. Ausreichend ist das aber nicht; beides darf nicht gegeneinander gesetzt werden. Es darf nicht so sein, dass wir sagen: Die benötigte Kinderbetreuung ist vorhanden, und deshalb haben Frauen demnächst die gleichen Chancen. Beispielsweise die Betreuung unter Dreijähriger - so richtig sie ist - hilft natürlich nicht denjenigen Frauen, die jetzt an der Reihe wären, in Aufsichtsräte einzuziehen.",data/txt/17079.txt,speech,cducsu
2460616,79,17,0,,,,852,Beifall bei Abgeordneten der CDU/CSU und des BÜNDNISSES 90/DIE GRÜNEN,data/txt/17079.txt,poi,
2460617,79,17,0,Elisabeth Winkelmeier-Becker (CDU/CSU),Elisabeth Winkelmeier-Becker,elisabeth-winkelmeier-becker,853,"Mit Blick auf die Vereinbarkeit von Beruf und Familie muss aber auch das Zeitmanagement verbessert werden. Durchaus sinnvoll, richtig und wichtig ist deshalb die Initiative der Ministerin und der IHK zur Verbesserung des Zeitmanagements von Führungskräften. Zu klären ist, ob Meetings wirklich erst nach 17 Uhr beginnen sollen, ob es richtig ist, dass der engagierteste und beste Mitarbeiter noch am Abend am Schreibtisch sitzt; vielleicht hat er den Nachmittag einfach nur verschlafen.

Die aktuelle Diskussion trägt schon Früchte: Es ist letztlich so, dass sich die Vorstände Berichte vorlegen lassen und Konzepte entwickeln, wie sie Frauenförderung im eigenen Unternehmen voranbringen können. In diesem Zusammenhang wird immer wieder die Telekom zitiert; wir erwähnen sie immer wieder gerne. Ich wundere mich, ob eigentlich niemand anders wegen eines vorzeigbaren Projektes genannt werden möchte.",data/txt/17079.txt,speech,cducsu
2460618,79,17,0,,,,854,Beifall bei Abgeordneten der CDU/CSU,data/txt/17079.txt,poi,
2460619,79,17,0,Elisabeth Winkelmeier-Becker (CDU/CSU),Elisabeth Winkelmeier-Becker,elisabeth-winkelmeier-becker,855,"Wir würden hier gern auch für andere Unternehmen Werbung machen.

All diese Maßnahmen sind wichtig und sinnvoll - mit und ohne Quote. Wir müssen uns aber eben auch Gedanken darüber machen, ob wir zu einer verbindlichen Vorgabe kommen wollen. Auch hier gibt es ja zunehmend Zustimmung.

Die EU-Kommission hat gesagt, dass sie bis 2011 Geduld hat. Wenn sich bis dahin nichts geändert hat, will auch Kommissarin Reding zur Tat schreiten. Sie stellt sich einen Frauenanteil von 30 Prozent bis 2015 und 40 Prozent bis 2020 vor.",data/txt/17079.txt,speech,cducsu
2460620,79,17,0,,,,856,Beifall der Abg. Dr. Eva Högl [SPD],data/txt/17079.txt,poi,
2460621,79,17,0,Elisabeth Winkelmeier-Becker (CDU/CSU),Elisabeth Winkelmeier-Becker,elisabeth-winkelmeier-becker,857,"Auch im europäischen Vergleich sind wir mit dem Status quo bald wirklich einsam. Norwegen, Österreich, Frankreich, Belgien, die Niederlande: Das alles sind Länder, in denen Quotenregelungen verabschiedet oder auf den Weg gebracht worden sind.

Von denjenigen, die es nicht so spannend finden, etwas zu verändern, wird gerne auf Art. 3 des Grundgesetzes rekurriert. Es wird zuweilen eingewandt, dass es doch nicht angehen könne, dass, wenn im Einzelfall dann einmal ein Mann genauso gut oder besser qualifiziert ist, er nicht zum Zuge kommt, weil die Quote dem entgegensteht. Es ist eigentlich schade, dass niemand aus diesen Kreisen diese Frage gestellt hat, solange es darum ging, dass 97 Prozent der Frauen nicht zum Zuge kamen. Praktisch haben wir doch eine Männerquote.",data/txt/17079.txt,speech,cducsu
2460622,79,17,0,,,,858,"Beifall bei Abgeordneten der CDU/CSU, der SPD und des BÜNDNISSES 90/DIE GRÜNEN",data/txt/17079.txt,poi,
2460623,79,17,0,Mechthild Rawert [SPD],Mechthild Rawert,mechthild-rawert,859,Haben Sie das alles Ihrer Ministerin auch schon erzählt?,data/txt/17079.txt,poi,spd
2460624,79,17,0,Elisabeth Winkelmeier-Becker (CDU/CSU),Elisabeth Winkelmeier-Becker,elisabeth-winkelmeier-becker,860,- Das habe ich auch meiner Ministerin erzählt.,data/txt/17079.txt,speech,cducsu
2460625,79,17,0,Hubertus Heil [Peine] [SPD],Hubertus Heil,hubertus-heil,861,Und was sagt sie?,data/txt/17079.txt,poi,spd
2460626,79,17,0,Elisabeth Winkelmeier-Becker (CDU/CSU),Elisabeth Winkelmeier-Becker,elisabeth-winkelmeier-becker,862,"Man darf wirklich einmal die Frage an den Anfang stellen, ob die Qualifikation bisher wirklich immer das entscheidende Kriterium war.",data/txt/17079.txt,speech,cducsu
2460627,79,17,0,Renate Künast [BÜNDNIS 90/DIE GRÜNEN],Renate Künast,renate-kunast,863,Nein!,data/txt/17079.txt,poi,gruene
2460628,79,17,0,Elisabeth Winkelmeier-Becker (CDU/CSU),Elisabeth Winkelmeier-Becker,elisabeth-winkelmeier-becker,864,"Die Zahlen, wonach es ein extremes Ungleichgewicht gibt, sprechen hier wirklich eine andere Sprache. 40 zu 60, 35 zu 65: Das alles wären Zahlen, die man vielleicht auch auf die unterschiedliche Berufswahl zurückführen könnte. Bei 97 zu 3 versagen diese Erklärungsmuster aber.

Wir hören aus dem Kreis der Beteiligten ja auch, dass ganz andere Dinge mitentscheidend sind, nämlich die Loyalitäten des einen gegenüber dem anderen, die Gemeinsamkeiten in der Denkart und die Netzwerke, die schon lange bestehen.",data/txt/17079.txt,speech,cducsu
2460629,79,17,0,Rita Pawelski [CDU/CSU],Rita Pawelski,rita-pawelski,865,So ist es!,data/txt/17079.txt,poi,cducsu
2460630,79,17,0,Elisabeth Winkelmeier-Becker (CDU/CSU),Elisabeth Winkelmeier-Becker,elisabeth-winkelmeier-becker,866,Das will man sich natürlich nicht durcheinanderbringen lassen.,data/txt/17079.txt,speech,cducsu
2460631,79,17,0,Rita Pawelski [CDU/CSU],Rita Pawelski,rita-pawelski,867,Ja!,data/txt/17079.txt,poi,cducsu
2460632,79,17,0,Elisabeth Winkelmeier-Becker (CDU/CSU),Elisabeth Winkelmeier-Becker,elisabeth-winkelmeier-becker,868,"Zurück zur Frage, ob das mit Art. 3 Grundgesetz vereinbar wäre. Dort steht der Satz:

Der Staat fördert die tatsächliche Durchsetzung der Gleichberechtigung von Frauen und Männern und wirkt auf die Beseitigung bestehender Nachteile hin.

Auf europäische Ebene gibt es Art. 23 der Charta der Grundrechte der Europäischen Union und Art. 157 des Vertrags über die Arbeitsweise der Europäischen Union, worin ganz klar gesagt wird, dass Regeln, durch die eine bestehende Benachteiligung eines Geschlechtes kompensiert wird, damit vereinbar und zulässig sind.",data/txt/17079.txt,speech,cducsu
2460633,79,17,0,,,,869,"Beifall bei Abgeordneten der CDU/CSU, der SPD und des BÜNDNISSES 90/DIE GRÜNEN",data/txt/17079.txt,poi,
2460634,79,17,0,Elisabeth Winkelmeier-Becker (CDU/CSU),Elisabeth Winkelmeier-Becker,elisabeth-winkelmeier-becker,870,"Niemand sollte sich also darauf verlassen, dass irgendein höherwertiges Recht dem entgegensteht. Ganz im Gegenteil!",data/txt/17079.txt,speech,cducsu
2460635,79,17,0,Caren Marks [SPD],Caren Marks,caren-marks,871,Auch die Regierung nicht!,data/txt/17079.txt,poi,spd
2460636,79,17,0,Elisabeth Winkelmeier-Becker (CDU/CSU),Elisabeth Winkelmeier-Becker,elisabeth-winkelmeier-becker,872,"Ich sagte, wie unser Konzept aussieht. Wir würden es nach wie vor lieber sehen, dass es zu einer Kooperation mit der Wirtschaft kommt und wir nicht eine aufoktroyierte Regelung gegen die Wirtschaft wählen müssen, obwohl wir uns eine solche vorbehalten wollen; denn wir nehmen natürlich zur Kenntnis, dass die freiwillige Vereinbarung aus dem Jahre 2001 tatsächlich nichts gebracht hat.",data/txt/17079.txt,speech,cducsu
2460637,79,17,0,Rita Pawelski [CDU/CSU],Rita Pawelski,rita-pawelski,873,So ist es!,data/txt/17079.txt,poi,cducsu
2460638,79,17,0,Elisabeth Winkelmeier-Becker (CDU/CSU),Elisabeth Winkelmeier-Becker,elisabeth-winkelmeier-becker,874,"Hier muss ich den Ball wirklich ein Stück weit zurückspielen. Ich denke, wir sollten uns gemeinsam darum kümmern, wie wir das besser hinkriegen und den Fehler korrigieren können.

Ich glaube, ein entscheidender Webfehler in der damaligen Vereinbarung war, dass sich niemand davon angesprochen gefühlt hat. Es war keiner wirklich zuständig. Auch in den Unternehmen war niemand zuständig; niemand hat sich angesprochen gefühlt, das in die Hand zu nehmen und umzusetzen.",data/txt/17079.txt,speech,cducsu
2460639,79,17,0,Christel Humme [SPD],Christel Humme,christel-humme,875,Und jetzt?,data/txt/17079.txt,poi,spd
2460640,79,17,0,Elisabeth Winkelmeier-Becker (CDU/CSU),Elisabeth Winkelmeier-Becker,elisabeth-winkelmeier-becker,876,Wir wollen natürlich schnell zu Ergebnissen kommen. Wahlen finden nur alle fünf Jahre statt. Deshalb haben wir hier jetzt wirklich nicht mehr viel Zeit.,data/txt/17079.txt,speech,cducsu
2460641,79,17,0,Dr. Eva Högl [SPD],Dr. Eva Högl,eva-hogl,877,Vier Jahre!,data/txt/17079.txt,poi,spd
2460642,79,17,0,Elisabeth Winkelmeier-Becker (CDU/CSU),Elisabeth Winkelmeier-Becker,elisabeth-winkelmeier-becker,878,"- Nein; denn es kommt die Zeit bis zur nächsten Hauptversammlung hinzu. Das sind dann summa summarum knapp fünf Jahre, was die Sache nicht besser macht. - Wir müssen also dafür sorgen, dass wir bis 2013 schon ein deutlich besseres Ergebnis erzielt haben.",data/txt/17079.txt,speech,cducsu
2460643,79,17,0,Hubertus Heil [Peine] [SPD],Hubertus Heil,hubertus-heil,879,So ist es!,data/txt/17079.txt,poi,spd
2460644,79,17,0,Elisabeth Winkelmeier-Becker (CDU/CSU),Elisabeth Winkelmeier-Becker,elisabeth-winkelmeier-becker,880,"Wenn das Ergebnis kein messbarer Anteil von 20 bis 30 Prozent sein wird, dann müssen wir wirklich zur Quote greifen.",data/txt/17079.txt,speech,cducsu
2460645,79,17,0,Renate Künast [BÜNDNIS 90/DIE GRÜNEN],Renate Künast,renate-kunast,881,Stimmen Sie doch zu!,data/txt/17079.txt,poi,gruene
2460646,79,17,0,Elisabeth Winkelmeier-Becker (CDU/CSU),Elisabeth Winkelmeier-Becker,elisabeth-winkelmeier-becker,882,"- Ja, aber wir wollen ja die ganze Fraktion einbeziehen.",data/txt/17079.txt,speech,cducsu
2460647,79,17,0,Renate Künast [BÜNDNIS 90/DIE GRÜNEN],Renate Künast,renate-kunast,883,Dann warten Sie bis 2100!,data/txt/17079.txt,poi,gruene
2460648,79,17,0,Elisabeth Winkelmeier-Becker (CDU/CSU),Elisabeth Winkelmeier-Becker,elisabeth-winkelmeier-becker,884,"Was kann jetzt helfen, und was machen wir jetzt als Erstes? Zunächst führen wir Berichtspflichten ein.",data/txt/17079.txt,speech,cducsu
2460649,79,17,0,Monika Lazar [BÜNDNIS 90/DIE GRÜNEN],Monika Lazar,monika-lazar,885,Peinlich!,data/txt/17079.txt,poi,gruene
2460650,79,17,0,Elisabeth Winkelmeier-Becker (CDU/CSU),Elisabeth Winkelmeier-Becker,elisabeth-winkelmeier-becker,886,"Ich glaube, dass das nicht zu unterschätzen ist. Wir brauchen ein Ranking und damit auch einen Anreiz für das Kind im Manne, das im Unternehmen sitzt. Wir brauchen ein Ranking, aus dem sich ergibt, wer dieses Kriterium am besten erfüllt.",data/txt/17079.txt,speech,cducsu
2460651,79,17,0,Mechthild Rawert [SPD],Mechthild Rawert,mechthild-rawert,887,Kinderförderung findet woanders statt!,data/txt/17079.txt,poi,spd
2460652,79,17,0,Elisabeth Winkelmeier-Becker (CDU/CSU),Elisabeth Winkelmeier-Becker,elisabeth-winkelmeier-becker,888,"Wer schafft das am besten? Frauenförderung ist ein Gradmesser für gute Unternehmensführung. Deshalb ist sie ein Maßstab dafür, wie gut man ist und wo man jetzt steht. Ich denke, das wird einen gewissen Anreiz bringen.

Ich denke, wir sollten uns bereits für 2013 einen weiteren Vorschlag überlegen. Wir sollten nicht die Gleichheit im Ergebnis vorschreiben, aber die Gleichheit im Verfahren anstreben. Wir müssen die Aufsichtsräte verpflichten, schon bei den nächsten anstehenden Aufsichtsratswahlen dafür zu sorgen, dass ein entsprechendes Angebot an qualifizierten Frauen vorgehalten wird und dass die Hauptversammlungen die Möglichkeit haben, 30 Prozent - gerne auch 40 Prozent - Frauen in den Aufsichtsrat zu wählen.",data/txt/17079.txt,speech,cducsu
2460653,79,17,0,,,,889,Beifall bei der CDU/CSU,data/txt/17079.txt,poi,
2460654,79,17,0,Elisabeth Winkelmeier-Becker (CDU/CSU),Elisabeth Winkelmeier-Becker,elisabeth-winkelmeier-becker,890,"Wenn dann der Einwand kommt: ""Wir finden ja keine"", dann sollen sich die Herrschaften mit FidAR, mit dem Verband deutscher Unternehmerinnen oder mit dem Deutschen Juristinnenbund in Verbindung setzen. Oder sie sollten - vielleicht wäre das noch besser - einen eigenen Bewerberinnenpool für qualifizierte Kandidatinnen aufmachen.",data/txt/17079.txt,speech,cducsu
2460655,79,17,0,,,,891,Beifall bei der CDU/CSU,data/txt/17079.txt,poi,
2460656,79,17,0,Elisabeth Winkelmeier-Becker (CDU/CSU),Elisabeth Winkelmeier-Becker,elisabeth-winkelmeier-becker,892,"Ich denke, das könnten gute Stufen eines Stufenplanes sein, mit dem wir dem gemeinsamen Ziel, Frauen in Führungspositionen zu bringen, ein Stück näher kommen.

Vielen Dank.",data/txt/17079.txt,speech,cducsu
2460657,79,17,0,,,,893,Beifall bei der CDU/CSU,data/txt/17079.txt,poi,
2460658,79,17,0,Elisabeth Winkelmeier-Becker (CDU/CSU),Elisabeth Winkelmeier-Becker,elisabeth-winkelmeier-becker,894,,data/txt/17079.txt,speech,cducsu
2460659,79,17,0,Vizepräsidentin Gerda Hasselfeldt,Gerda Hasselfeldt,gerda-hasselfeldt,895,Nächste Rednerin ist die Kollegin Christel Humme für die SPD-Fraktion.,data/txt/17079.txt,chair,
2460660,79,17,0,,,,896,Beifall bei der SPD,data/txt/17079.txt,poi,
2460661,79,17,0,Vizepräsidentin Gerda Hasselfeldt,Gerda Hasselfeldt,gerda-hasselfeldt,897,,data/txt/17079.txt,chair,
2460662,79,17,0,Christel Humme (SPD),Christel Humme,christel-humme,898,"Frau Präsidentin! Liebe Kollegen, liebe Kolleginnen! Frau Winkelmeier-Becker, es würde mir gut gefallen, wenn mehr Frauen wie Sie in der CDU-Fraktion wären. Ich glaube, dann kämen wir einen großen Schritt weiter.",data/txt/17079.txt,speech,spd
2460663,79,17,0,,,,899,Beifall bei der SPD und dem BÜNDNIS 90/ DIE GRÜNEN,data/txt/17079.txt,poi,
2460664,79,17,0,Christel Humme (SPD),Christel Humme,christel-humme,900,"Sie haben natürlich völlig recht. Ich will eine Kollegin zitieren, an die Sie sich gerne zurückerinnern dürfen. Ich meine Frau Rita Süssmuth, die gesagt hat: Wer die Quote nicht will, der muss beweisen, dass er ohne sie auskommt.

Vor zehn Jahren hat die Wirtschaft genau dieses versucht. Sie hat versucht, mit ihrer freiwilligen Vereinbarung den Beweis anzutreten, dass wir weder ein Gesetz noch eine Quote brauchen. Wir sehen heute allerdings ganz eindeutig, dass diese freiwillige Vereinbarung - und Freiwilligkeit an sich - gescheitert ist.",data/txt/17079.txt,speech,spd
2460665,79,17,0,,,,901,Beifall bei der SPD und dem BÜNDNIS 90/ DIE GRÜNEN,data/txt/17079.txt,poi,
2460666,79,17,0,Christel Humme (SPD),Christel Humme,christel-humme,902,"Darum fordern wir ganz eindeutig innerhalb eines großen Konzeptes zur Arbeitsmarktpolitik den Baustein einer 40-Prozent-Quote für den Aufsichtsrat und - hier gehen wir weiter als die Grünen - auch für den Vorstand.

Frau Künast, 2017 ist eine schönes Jahreszahl. Wenn ich aber zehn Jahre zurückdenke und sieben Jahre nach vorne denke, dann sind es insgesamt 17 Jahre, die wir verlieren würden. Wir haben gerade von Frau Winkelmeier-Becker gehört, dass im Jahr 2013 Aufsichtsratswahlen stattfinden werden. Warum kann es nicht bereits heute ein Gesetz mit der Verpflichtung, es zwei Jahre freiwillig auszuprobieren, geben? - Dann könnte man sagen: Wenn die Quote 2013 nicht stimmt, gilt die gesetzliche Regelung. - Dann wäre es so wie in Norwegen, und das wäre meiner Meinung nach der richtige Weg.",data/txt/17079.txt,speech,spd
2460667,79,17,0,,,,903,Beifall bei der SPD und dem BÜNDNIS 90/ DIE GRÜNEN,data/txt/17079.txt,poi,
2460668,79,17,0,Christel Humme (SPD),Christel Humme,christel-humme,904,"Liebe Kollegen, liebe Kolleginnen, in der Wirtschaft hat es sich natürlich bereits herumgesprochen, dass es früher oder später gesetzliche Regelungen geben wird. Selbst konservative Regierungen wie in Norwegen, Belgien, den Niederlanden, in Frankreich, Spanien und sogar Island machen mit ihren gesetzlichen Initiativen zur Quote längst mehr Tempo als Deutschland.

Also hat sich die deutsche Wirtschaft gedacht: ""Da müssen wir etwas tun"" und im Mai ihren Kodex ergänzt. Sie hat neue Empfehlungen in diesen Kodex hineingeschrieben - ich zitiere; das ist nämlich wunderbar -:

Mehr Vielfalt in Aufsichtsräten durch Frauen und internationale Experten.

Angemessene Berücksichtigung von Frauen auch in Führungsfunktionen und Vorständen.

Die Betonung liegt hierbei auf ""angemessene Berücksichtigung"". Damit - das kann ich daraus nur ableiten - soll vorgemacht werden: Da tut sich was, und daher ist ein Gesetz nicht erforderlich.

Ja, die Telekom hat schon etwas gemacht; Sie haben es erwähnt, Frau Winkelmeier-Becker. Die Telekom hat sich bewegt. Vorgestern fand eine Veranstaltung des Deutschen Juristinnenbundes statt. Dort wurde eindeutig gesagt - und das ist erstaunlich -, dass Herr Sattelberger sehr starke Anfeindungen seitens seiner männlichen Kollegen erfährt, weil er nach vorne geprescht ist. Das gibt mir zu denken. Ich glaube, dass dieses Unternehmen wahrscheinlich das einzige Unternehmen bleibt, wenn es bei Freiwilligkeit bleibt.

Ich denke, wir sollten uns mit diesen vagen Formulierungen nicht zufrieden geben. Denn diese Selbstverpflichtung, die nun im Kodex steht, ist sicherlich genauso verbindlich wie die Vereinbarung von vor zehn Jahren. Darum glaube ich nicht, dass es zu einer Änderung kommt, und daher meinen wir, dass ein Gesetz die richtige Lösung ist.

Ich möchte Sie in diesem Zusammenhang auch darauf hinweisen, wer diesen Kodex aufstellt. Es ist eine Regierungskommission, die aus zwölf Köpfen besteht - elf Männer und eine Frau. Mehr brauche ich dazu nicht zu sagen.

Gleichzeitig gibt es eine öffentliche Debatte, die uns ebenfalls weismachen will, dass die Quote nicht erforderlich ist. Das erste Argument, das vorgebracht wird, lautet: Frauen wollen gar nicht in die Führungsebene. Begründung: Den 70-Stunden-Tag tue ich mir gar nicht erst an.

Die Frauenministerin setzt noch einen drauf. In der Süddeutschen Zeitung hat sie diese Woche gesagt, sie wolle die Frauen nicht umerziehen. Man höre genau hin. Was heißt das denn? Das heißt, die natürliche Bestimmung der Frau ist die Mutter, und am besten bleibt die Frau gleich zu Hause.",data/txt/17079.txt,speech,spd
2460669,79,17,0,Caren Marks [SPD],Caren Marks,caren-marks,905,Dann kann Frau Schröder doch gleich selber zu Hause bleiben!,data/txt/17079.txt,poi,spd
2460670,79,17,0,Christel Humme (SPD),Christel Humme,christel-humme,906,"So werden alte Rollenbilder zementiert: Der Mann als Haupternährer der Familie ist nur in einem 70-Stunden-Job und mit einer Frau erfolgreich, die ihm zu Hause den Rücken freihält.",data/txt/17079.txt,speech,spd
2460671,79,17,0,Caren Marks [SPD],Caren Marks,caren-marks,907,Das ist das Weltbild der Union!,data/txt/17079.txt,poi,spd
2460672,79,17,0,Christel Humme (SPD),Christel Humme,christel-humme,908,"Ich denke, das ist nicht unser Bild von einem gleichberechtigten Erwerbsleben. Das ist auch nicht unser Bild von einem gleichberechtigten Familienleben. Jede Veränderung in einem Betrieb hin zu familienfreundlichen Arbeitszeiten ist ein Gewinn für die Frauen, aber auch für die Männer, die mehr Zeit mit ihren Kindern verbringen wollen.",data/txt/17079.txt,speech,spd
2460673,79,17,0,,,,909,Beifall bei Abgeordneten der SPD,data/txt/17079.txt,poi,
2460674,79,17,0,Christel Humme (SPD),Christel Humme,christel-humme,910,"Flexiblere Arbeitszeiten und eine neue Unternehmenskultur: Ich denke, darum geht es. Freiwillig bewegt sich da offensichtlich nichts. Nur durch mehr Frauen in Führungspositionen, und zwar gesetzlich geregelt, werden die Veränderungen in den Betrieben bewirkt.",data/txt/17079.txt,speech,spd
2460675,79,17,0,,,,911,Beifall bei Abgeordneten der SPD,data/txt/17079.txt,poi,
2460676,79,17,0,Christel Humme (SPD),Christel Humme,christel-humme,912,"Das zweite Argument, das in letzter Zeit immer wieder zu hören ist - das hat auch Frau Künast gesagt -, lautet: Es gibt nicht genug gut ausgebildete Frauen; außerdem geht es nicht um die Quote, sondern um Qualität. Das ist ein sehr fragwürdiges Argument. Ich finde es auch sehr traurig, wenn Frauen selber dieses Argument vortragen.",data/txt/17079.txt,speech,spd
2460677,79,17,0,,,,913,Beifall bei Abgeordneten des BÜNDNIS-SES 90/DIE GRÜNEN,data/txt/17079.txt,poi,
2460678,79,17,0,Christel Humme (SPD),Christel Humme,christel-humme,914,"Sie haben zu Recht gesagt, Frau Künast, dass mehr Frauen als Männer die Unis nach einem betriebswirtschaftlichen Studium mit einem Abschluss verlassen.",data/txt/17079.txt,speech,spd
2460679,79,17,0,Rita Pawelski [CDU/CSU],Rita Pawelski,rita-pawelski,915,Sie sind besser!,data/txt/17079.txt,poi,cducsu
