id,sitzung,wahlperiode,in_writing,speaker,speaker_cleaned,speaker_fp,sequence,text,filename,type,speaker_party
1929850,76,17,0,,,,910,"- Das sagt Frau Koch-Mehrin, und wenn das schon vom Koalitionspartner gesagt wird, wird sicherlich etwas dran sein.

In unserem Lande gefragt: Wo bleibt denn die freiwillige Beteiligung der Banken und der Versicherungen an den Kosten der Krise?",data/txt/17076.txt,speech,
1929851,76,17,0,Petra Merkel [Berlin] [SPD],Petra Merkel [Berlin] [SPD],petra-merkel-berlin-spd,911,Ja!,data/txt/17076.txt,poi,spd
1929852,76,17,0,,,,912,"Herr Bundesfinanzminister, ich habe Sie schon im Mai dieses Jahres, nein, im September dieses Jahres gefragt",data/txt/17076.txt,speech,
1929853,76,17,0,Otto Fricke [FDP],Otto Fricke [FDP],otto-fricke-fdp,913,Wann denn nun?,data/txt/17076.txt,poi,fdp
1929854,76,17,0,,,,914,"- im September, Herr Kollege Fricke, Herr Oberlehrer Fricke; danke schön -,",data/txt/17076.txt,speech,
1929855,76,17,0,,,,915,Beifall bei der SPD,data/txt/17076.txt,poi,
1929856,76,17,0,,,,916,"wie viel Geld von den Banken und Versicherungen in diesen Fonds eingegangen ist. Ich warte auf eine Aussage dazu; denn ich habe noch immer keine Antwort auf die Frage bekommen, welche Summe eingegangen ist.

Wie will denn die Bundesregierung - das ergibt sich nämlich daraus - auf EU-Ebene glaubwürdig die Beteiligung des Finanzsektors einfordern, wenn sie noch nicht einmal die Hausaufgaben bei uns im Lande gemacht hat und die Beteiligung der Banken und Versicherungen, die ja gezockt haben, gar nicht deutlich wird? Das ist das, was ich einfordere und was geschehen muss.",data/txt/17076.txt,speech,
1929857,76,17,0,,,,917,Beifall bei der SPD,data/txt/17076.txt,poi,
1929858,76,17,0,,,,918,"Herr Finanzminister, wann legen Sie denn das Konzept für die angekündigte Finanztransaktionsteuer vor? Am Sankt-Nimmerleins-Tag oder wann? Das müssen wir doch betrachten.

Sehr geehrte Frau Bundeskanzlerin, Sie haben am Mittwoch gesagt: Die Politik hat das Primat und nicht die Wirtschaft.",data/txt/17076.txt,speech,
1929859,76,17,0,Joachim Poß [SPD],Joachim Poß [SPD],joachim-poß-spd,919,Immer nur Sprüche!,data/txt/17076.txt,poi,spd
1929860,76,17,0,,,,920,"Dieser Satz ist völlig richtig. Den kann auch ich unterschreiben.

Was werden Sie jetzt aber tun - das ist auch in Ihrer Regierungserklärung am Mittwoch nicht deutlich geworden -, um diesen richtigen Gedanken durchzusetzen? Die Bürgerinnen und Bürger haben doch das Gefühl, dass die Banker, die gezockt haben, verschont bleiben und dass sie, nämlich die Menschen draußen, die Arbeitnehmerinnen und Arbeitnehmer, die Kosten zu tragen haben. Wenn die nächste Krise kommt, dann wird es nämlich wieder heißen: ""Wir müssen den Banken helfen"", weil sie too big to fail sind, also zu groß, um sie kaputtgehen zu lassen.

Irland - ich zitiere jetzt den CSU-Abgeordneten Ferber aus dem Europäischen Parlament - war das Zockerparadies. Er sagte, das irische Staatsdefizit sei hausgemacht, weil man bewusst weggeschaut und keine Kontrolle durchgeführt habe.

Wer muss denn nun zahlen? Wir sehen in den Konzepten - man muss fragen: Stimmen die Konzepte? -, dass in allererster Linie die Arbeitnehmer in Irland zu bezahlen haben, dass das Kindergeld gekürzt wird, dass die Mehrwertsteuer erhöht wird und dass andere soziale Leistungen eingeschränkt werden. Das hören wir auch von Portugal und Griechenland. Ist das wirklich das Europa, das wir wollen,",data/txt/17076.txt,speech,
1929861,76,17,0,Dr. Dietmar Bartsch [DIE LINKE],Dr. Dietmar Bartsch [DIE LINKE],dietmar-bartsch-die-linke,921,Nein!,data/txt/17076.txt,poi,linke
1929862,76,17,0,,,,922,"nämlich ein unsoziales Europa, nur weil hier einige gezockt haben? Dem kann ich hier nicht folgen.",data/txt/17076.txt,speech,
1929863,76,17,0,,,,923,Beifall bei der SPD und der LINKEN,data/txt/17076.txt,poi,
1929864,76,17,0,,,,924,"Ein unsoziales Europa sollten wir ablehnen; denn das kann ja auch zur Radikalisierung in den Ländern führen. Ob es einer Exportnation wie Deutschland guttut, wenn es hier zur Radikalisierung kommt und wenn die Binnennachfrage nachlässt? Die Menschen haben ja unsere Produkte gekauft. Ich frage mich, ob wir hier auf dem richtigen Weg sind.

Noch einmal: Ich möchte ein soziales Europa. Das möchte ich hier unterstreichen.",data/txt/17076.txt,speech,
1929865,76,17,0,,,,925,Beifall bei der SPD,data/txt/17076.txt,poi,
1929866,76,17,0,Florian Toncar [FDP],Florian Toncar [FDP],florian-toncar-fdp,926,Was heißt das jetzt konkret?,data/txt/17076.txt,poi,fdp
1929867,76,17,0,Otto Fricke [FDP],Otto Fricke [FDP],otto-fricke-fdp,927,Was machen wir?,data/txt/17076.txt,poi,fdp
1929868,76,17,0,,,,928,"Ein Satz, den Jean-Claude Juncker, seines Zeichens luxemburgischer Ministerpräsident und Vorsitzender der Euro-Gruppe, im Rheinischen Merkur gesagt hat, gibt mir sehr zu denken. Er sagte:

Dass in Deutschland Bund und Kommunen das europäische Gemeinwohl langsam aus den Augen verlieren, das macht mir schon Sorgen.

Wenn ein so besonnener Mann, der zu Ihrer Parteifamilie gehört, Frau Bundeskanzlerin, so spricht, dann müssen wir uns wirklich fragen: Sind wir in der Europapolitik auf dem richtigen Weg? Denn es fehlt ein klares Konzept, das verständlich, nachvollziehbar und transparent ist. Das wird auch in der Presse immer wieder herausgestellt - ich zitiere -: ""Merkel provoziert Anstieg der Risikoaufschläge"". Die Welt spricht vom ""Merkel-Crash"" und das Handelsblatt vom ""Merkel-Aufschlag"". Wo sind die Konzepte, die jetzt vorgelegt werden müssen?",data/txt/17076.txt,speech,
1929869,76,17,0,,,,929,Beifall bei der SPD,data/txt/17076.txt,poi,
1929870,76,17,0,,,,930,"Ich möchte noch einmal Frau Koch-Mehrin zitieren. Sie scheint den Durchblick zu haben, sonst wäre sie nicht im Präsidium der FDP. Frau Koch-Mehrin sagt:

Im Augenblick muss man sich Merkels

- damit ist die Bundeskanzlerin gemeint -

Haltung zur Euro-Krise regelrecht zusammenklauben.

Daran muss auch etwas sein.",data/txt/17076.txt,speech,
1929871,76,17,0,Dr. Michael Meister [CDU/CSU],Dr. Michael Meister [CDU/CSU],michael-meister-cdu-csu,931,Das ist eine tiefschürfende Analyse!,data/txt/17076.txt,poi,cducsu
1929872,76,17,0,,,,932,"Lassen Sie mich zum Schluss noch einen Punkt ansprechen.

Vizepräsidentin Katrin Göring-Eckardt:

Vielleicht nur noch einen Satz.

Klaus Hagemann (SPD):

Wir haben große Aufgaben vor uns. Wir müssen den Haushalt der Europäischen Union für 2011 im Blick haben, der noch streitig ist. Bisher ist noch keine Einigung gefunden worden, weil keine geeigneten Vorschläge in Sicht sind.

Ich sehe das Zeichen.

Vizepräsidentin Katrin Göring-Eckardt:

Das ist gut. Es reicht aber nicht.

Klaus Hagemann (SPD):

Wir müssen uns insbesondere auch auf die finanzielle Vorausschau ab 2014 vorbereiten. Auch hierzu liegen keine abgestimmten Konzepte der Koalition vor.

Vielen Dank.",data/txt/17076.txt,speech,
1929873,76,17,0,,,,933,Beifall bei der SPD,data/txt/17076.txt,poi,
1929874,76,17,0,,,,934,"Vizepräsidentin Katrin Göring-Eckardt:

Das Wort hat Otto Fricke für die FDP-Fraktion.",data/txt/17076.txt,speech,
1929875,76,17,0,,,,935,Beifall bei der FDP sowie bei Abgeordneten der CDU/CSU,data/txt/17076.txt,poi,
1929876,76,17,0,,,,936,"Otto Fricke (FDP):

Frau Präsidentin! Meine lieben Kolleginnen und Kollegen! Herr Kollege Hagemann, das mit dem Oberlehrer will ich der Hitze der Diskussion zuschreiben.",data/txt/17076.txt,speech,
1929877,76,17,0,,,,937,Widerspruch bei der SPD und der LINKEN,data/txt/17076.txt,poi,
1929878,76,17,0,,,,938,"Ich habe es immer so verstanden, dass wir als Haushälter nicht Lehrende, sondern immer und in diesen Zeiten erst recht Lernende sind. Das heißt auch, dass wir uns jeweils an die Situation mit ihren Zahlen, Daten und Fakten anpassen. Dafür brauchen wir Mitarbeiter. Weil schon vielen gedankt worden ist, will ich das auch tun. Sie sind diejenigen, die nachts in den Büros unsere Anträge umschreiben, Berechnungen machen, die Zahlen stellen und uns helfen, an vielen Stellen unsere Arbeit zu leisten: in den Abgeordnetenbüros, in den Ministerien und im Haushaltsausschuss, an vielen Stellen.",data/txt/17076.txt,speech,
1929879,76,17,0,Bartholomäus Kalb [CDU/CSU],Bartholomäus Kalb [CDU/CSU],bartholomaus-kalb-cdu-csu,939,Arbeitsgruppen!,data/txt/17076.txt,poi,cducsu
1929880,76,17,0,,,,940,"Ohne sie könnten wir unsere Arbeit nicht machen. Das ist eine Gesamtaufgabe. Deshalb von unserer Seite ausdrücklich herzlichen Dank. Ich glaube, das gilt für alle.",data/txt/17076.txt,speech,
1929881,76,17,0,,,,941,Beifall bei der FDP und der CDU/CSU sowie bei Abgeordneten der SPD und der LINKEN,data/txt/17076.txt,poi,
1929882,76,17,0,,,,942,"Bei dem, was der Kollege Schneider zum Verständnis des Haushaltsausschusses gesagt hat, folge ich dem, was der Kollege Barthle gesagt hat. Wir haben, wie wir wissen, ein kollegiales Verhältnis, weil wir nächtelang zusammenarbeiten. Dass es kleinere Scharmützel gibt, gehört dazu; das hat es immer schon gegeben. Herr Kollege Schneider, wenn Sie sagen, dass das Königsrecht des Parlaments wegfallen würde, wie erklären Sie sich dann, dass diese Koalition und heute auch dieses Parlament beim Haushalt eine Rekordveränderung gegenüber der Planung der Regierung vornimmt?",data/txt/17076.txt,speech,
1929883,76,17,0,Carsten Schneider [Erfurt] [SPD],Carsten Schneider [Erfurt] [SPD],carsten-schneider-erfurt-spd,943,Weil es gut läuft! Von selbst!,data/txt/17076.txt,poi,spd
1929884,76,17,0,,,,944,"- Sagen Sie nicht, weil es so gut läuft. Es ist auch schon in anderen Regierungszeiten gut gelaufen. Auch in Ihrer Regierungszeit ist es gut gelaufen, auch wenn ich immer noch nicht weiß, warum.

Wir machen das.",data/txt/17076.txt,speech,
1929885,76,17,0,Carsten Schneider [Erfurt] [SPD],Carsten Schneider [Erfurt] [SPD],carsten-schneider-erfurt-spd,945,2 Milliarden Euro mehr Schulden macht ihr!,data/txt/17076.txt,poi,spd
1929886,76,17,0,,,,946,"Es ist ein starkes Parlament, das der Regierung selbstbewusst begegnet, aber auch vertrauensvoll mit ihr zusammenarbeitet. Das müssen Sie akzeptieren, statt zu versuchen, den Parlamentarismus weiter nach unten zu ziehen.",data/txt/17076.txt,speech,
1929887,76,17,0,,,,947,Beifall bei der FDP sowie bei Abgeordneten der CDU/CSU,data/txt/17076.txt,poi,
1929888,76,17,0,,,,948,"Jetzt komme ich zu dieser Woche. Vielleicht erinnert sich die Opposition noch daran, wie es früher einmal hieß, sowohl in Zeiten von Rot-Grün als auch in Zeiten der Großen Koalition: Die Haushaltswoche ist eine Woche der Generalabrechnung der Opposition mit der Regierung. Können Sie mir verraten, wann in dieser Woche Ihre Generalabrechnung stattgefunden hat?",data/txt/17076.txt,speech,
1929889,76,17,0,Patrick Kurth [Kyffhäuser] [FDP],Patrick Kurth [Kyffhäuser] [FDP],patrick-kurth-kyffhauser-fdp,949,Da war nichts!,data/txt/17076.txt,poi,fdp
1929890,76,17,0,,,,950,"Da war nichts. Es gab Reden über Details und Bigotterie über die Frage, was richtiges Sparen ist. Es gab juristisch wahnsinnig interessante Ausführungen, Kollege Schneider, zu unterschiedlichen Ansätzen für Konjunkturkomponenten und volkswirtschaftlich wahnsinnig interessante Diskussionen über die Frage, ob in der Frage, wie Konjunktur im Aufstieg zu bewerten ist und was Struktur ist, das HP-Verfahren oder irgendein anderes Verfahren verwendet wird.",data/txt/17076.txt,speech,
1929891,76,17,0,Bettina Hagedorn [SPD],Bettina Hagedorn [SPD],bettina-hagedorn-spd,951,"Es geht darum, dass Sie tricksen! Sie tricksen, Sie sparen gar nicht!",data/txt/17076.txt,poi,spd
1929892,76,17,0,,,,952,"Herr Schneider, das Problem, das Sie und die gesamte Opposition haben,",data/txt/17076.txt,speech,
1929893,76,17,0,Bettina Hagedorn [SPD],Bettina Hagedorn [SPD],bettina-hagedorn-spd,953,Das Problem sind Sie!,data/txt/17076.txt,poi,spd
1929894,76,17,0,,,,954,"ist, dass die Bürger wissen und merken: Es muss gespart werden. Es geht nicht anders.",data/txt/17076.txt,speech,
1929895,76,17,0,Bettina Hagedorn [SPD],Bettina Hagedorn [SPD],bettina-hagedorn-spd,955,Das ist richtig! Aber Sie sparen nicht!,data/txt/17076.txt,poi,spd
1929896,76,17,0,,,,956,"Alle Vorschläge der SPD, der Linken erst recht, aber auch der Grünen, die Ausgaben hochzufahren, sind zwar fromme Wünsche, aber sie entsprechen nicht der Realität, und sie widersprechen im Gegensatz zu unseren Vorschlägen der Verfassung.",data/txt/17076.txt,speech,
1929897,76,17,0,,,,957,Beifall bei der FDP und der CDU/CSU,data/txt/17076.txt,poi,
1929898,76,17,0,Alexander Bonde [BÜNDNIS 90/DIE GRÜNEN],Alexander Bonde [BÜNDNIS 90/DIE GRÜNEN],alexander-bonde-bundnis-90-die-grunen,958,Was?,data/txt/17076.txt,poi,gruene
1929899,76,17,0,,,,959,"Meine Damen und Herren, ich finde, man muss es noch einmal für den Bürger festhalten: Der Kurswechsel in der Haushaltspolitik ist vollzogen. Wir gehen an die Ausgaben ran, die Ausgabenkurve zeigt das deutlich. Was in elf Jahren SPD-Finanzministerium nicht gelungen ist, machen wir jetzt. Wir haben in diesem Jahr eine Rekordabsenkung - in diesem Umfang ist sie noch nie zuvor einer Koalition, einer Regierung gelungen -",data/txt/17076.txt,speech,
1929900,76,17,0,Zuruf von der SPD,von der SPD,von-der-spd,960,"Sie machen eine Rekordverschuldung! Das ist es, was Sie machen!",data/txt/17076.txt,poi,spd
1929901,76,17,0,,,,961,"um 30 Milliarden Euro gegenüber dem Ansatz. Ich darf daran erinnern, dass Sie im Rahmen der Haushaltsdiskussion im Frühjahr des Jahres noch angezweifelt haben, ob die 80 Milliarden Euro überhaupt ausreichen.",data/txt/17076.txt,speech,
1929902,76,17,0,,,,962,Zuruf von der SPD,data/txt/17076.txt,poi,
1929903,76,17,0,,,,963,"Wir haben dies in Rekordzeit geschafft, und das ist der erste Teil einer Wende in der Haushaltspolitik.",data/txt/17076.txt,speech,
1929904,76,17,0,,,,964,Beifall bei der FDP,data/txt/17076.txt,poi,
1929905,76,17,0,,,,965,"Kommen wir zum zweiten Teil der Wende. Vergleichen wir doch einmal die Zahlen, die für das Jahr 2011 geplant waren. Trotz all der Risiken besteht immer noch die Möglichkeit, dass wir auch im Jahr 2011 den Ansatz senken. Dann liegen wir 30 Milliarden Euro unter der Planung Ihres letzten Finanzministers Peer Steinbrück.",data/txt/17076.txt,speech,
1929906,76,17,0,Alexander Bonde [BÜNDNIS 90/DIE GRÜNEN],Alexander Bonde [BÜNDNIS 90/DIE GRÜNEN],alexander-bonde-bundnis-90-die-grunen,966,Das ist ausschließlich Konjunktur!,data/txt/17076.txt,poi,gruene
1929907,76,17,0,,,,967,"Das ist der zweite Beweis dafür, dass wir eine Wende in der Haushaltspolitik geschafft haben.",data/txt/17076.txt,speech,
1929908,76,17,0,,,,968,Beifall bei der FDP,data/txt/17076.txt,poi,
1929909,76,17,0,,,,969,"Darüber hinaus ist der Haushalt in die Zukunft gerichtet. Er stärkt die Stärken - das gilt für die Bereiche Forschung, Bildung und Mittelstand -",data/txt/17076.txt,speech,
1929910,76,17,0,Zuruf von der LINKEN,von der LINKEN,von-der-linken,970,Investitionen!,data/txt/17076.txt,poi,linke
1929911,76,17,0,,,,971,"und wird gleichzeitig der Verantwortung einer sozialen Marktwirtschaft gerecht, indem er die Sozialquote auf einem Niveau hält, das Rot-Grün nie erreicht hat.",data/txt/17076.txt,speech,
1929912,76,17,0,,,,972,Beifall bei Abgeordneten der FDP,data/txt/17076.txt,poi,
1929913,76,17,0,,,,973,"Das ist der Unterschied zwischen Ihrem Reden und unserem Handeln. Wir machen das, was diese soziale Marktwirtschaft von uns verlangt, und Sie sind - ich glaube, auch da wird die SPD von den Grünen irgendwann übernommen - nur dagegen.",data/txt/17076.txt,speech,
1929914,76,17,0,,,,974,Beifall bei der FDP,data/txt/17076.txt,poi,
1929915,76,17,0,,,,975,"Meine Damen und Herren, kommen wir zu der Frage, ob man der Opposition nicht doch ein bisschen glauben kann, obwohl es ihr nicht gelingt, eine Generalabrechnung vorzunehmen. Schließlich sind es auch kluge Menschen.",data/txt/17076.txt,speech,
1929916,76,17,0,Zuruf von der FDP,von der FDP,von-der-fdp,976,Woher wissen Sie das?,data/txt/17076.txt,poi,fdp
1929917,76,17,0,,,,977,"Da kann man sagen: Na ja, gut, vielleicht machen sie es da, wo sie es können, anders. Sie kennen meinen Hinweis darauf, dass die Kernbotschaft dieser Woche eigentlich wie folgt lautet: Hier im Bund, wo christlich regiert wird, wird",data/txt/17076.txt,speech,
1929918,76,17,0,Bettina Hagedorn [SPD],Bettina Hagedorn [SPD],bettina-hagedorn-spd,978,Wird Klientelpolitik betrieben!,data/txt/17076.txt,poi,spd
1929919,76,17,0,,,,979,"die Verschuldung abgebaut, und in Nordrhein-Westfalen, dem größten und stärksten Land der Bundesrepublik Deutschland, wird die Verschuldung aufgebaut. Das ist die Realität, und an dieser müssen Sie sich messen lassen.",data/txt/17076.txt,speech,
1929920,76,17,0,,,,980,Beifall bei der FDP und der CDU/CSU,data/txt/17076.txt,poi,
1929921,76,17,0,,,,981,"Aber keine Angst! Es geht mit Nordrhein-Westfalen weiter. Ich weiß nicht, ob Sie schon die neuen rot-grünen Ideen aus Nordrhein-Westfalen kennen. Also, die NRW-Landesregierung will die Sparvorgaben für die Gemeinden lockern. Es heißt, dass man ein Gesetz plant, das es den Gemeinden erlaubt, den Konsolidierungszeitraum, der auf drei Jahre festgelegt ist, schlichtweg zu ignorieren.",data/txt/17076.txt,speech,
1929922,76,17,0,Zuruf von der SPD,von der SPD,von-der-spd,982,Sie haben doch überhaupt keine Ahnung!,data/txt/17076.txt,poi,spd
1929923,76,17,0,,,,983,"Rot-Grün sagt zu dem, was in Nordrhein-Westfalen gemacht werden soll, nichts anderes, als dass dort die Schuldenaufnahme gebremst werden soll. Zur Frage des Abbaus der Verschuldung sagt die rot-grüne Landesregierung: Das müsst ihr nicht beachten.",data/txt/17076.txt,speech,
1929924,76,17,0,Zuruf von der SPD,von der SPD,von-der-spd,984,Wo leben Sie überhaupt?,data/txt/17076.txt,poi,spd
1929925,76,17,0,,,,985,"Genau dasselbe würden Sie tun, wenn Sie hier an der Regierung wären. Sie würden sagen: Es ist alles so schrecklich. Es tut uns leid, aber wir können es nicht anders. - Das ist Ihre Argumentation.",data/txt/17076.txt,speech,
1929926,76,17,0,,,,986,Beifall bei der FDP und der CDU/CSU,data/txt/17076.txt,poi,
1929927,76,17,0,,,,987,"Zum Primat der Politik; das will ich am Schluss doch noch sagen. Sie sagen, der Primat der Politik gelte nicht. Dazu kann ich nur sagen: Wer elf Jahre lang im Finanzministerium dafür gesorgt hat, dass der Primat der Politik nicht gilt, dass ein Markt nicht existiert, weil man keinen Rahmen setzt, weil man nicht kontrolliert und weil man nicht zuschlägt, der kann hier nicht sagen: Wenn ihr als christlich-liberale Koalition die Aufgabe übernehmt, die Finanzmärkte wieder zu Märkten zu machen, dann macht ihr es falsch.

Wir räumen euren Mist weg, und wir machen es gerne. Denn das ist es, wofür uns der Bürger seine Stimme gegeben hat und auch wieder geben wird.

Herzlichen Dank.",data/txt/17076.txt,speech,
1929928,76,17,0,,,,988,Beifall bei der FDP und der CDU/CSU,data/txt/17076.txt,poi,
1929929,76,17,0,Zuruf von der LINKEN,von der LINKEN,von-der-linken,989,5 Prozent!,data/txt/17076.txt,poi,linke
1929930,76,17,0,,,,990,"Vizepräsidentin Katrin Göring-Eckardt:

Barbara Höll hat das Wort für die Fraktion die Linke.",data/txt/17076.txt,speech,
1929931,76,17,0,,,,991,Beifall bei der LINKEN,data/txt/17076.txt,poi,
1929932,76,17,0,,,,992,"Dr. Barbara Höll (DIE LINKE):

Sehr geehrte Frau Präsidentin! Liebe Kolleginnen und Kollegen! Liebe Besucher und Besucherinnen auf der Besuchertribüne, insbesondere aus Mecklenburg-Vorpommern!",data/txt/17076.txt,speech,
1929933,76,17,0,,,,993,Beifall bei der LINKEN,data/txt/17076.txt,poi,
1929934,76,17,0,Zuruf von der CDU/CSU,von der CDU/CSU,von-der-cdu-csu,994,Gruß an die Heimat!,data/txt/17076.txt,poi,cducsu
1929935,76,17,0,,,,995,"Selten ist ein so unausgeglichener Haushalt vorgelegt worden wie dieser. 30,3 Milliarden Euro wollen Sie die nächsten Jahre allein im Sozialbereich kürzen - aber nicht bei den Reichen und Vermögenden. Sie finden das alles toll und sind stolz darauf, dass Sie bei den Menschen kürzen, die jeden Cent umdrehen müssen. Wir lehnen das ab.",data/txt/17076.txt,speech,
1929936,76,17,0,Leo Dautzenberg [CDU/CSU],Leo Dautzenberg [CDU/CSU],leo-dautzenberg-cdu-csu,996,"Jeder zweite Euro, Frau Kollegin, für Soziales!",data/txt/17076.txt,poi,cducsu
1929937,76,17,0,,,,997,Sie müssen endlich auch die Verursacher der Finanzkrise heranziehen.,data/txt/17076.txt,speech,
1929938,76,17,0,,,,998,Beifall bei der LINKEN,data/txt/17076.txt,poi,
1929939,76,17,0,,,,999,"Sie machen eines: Sie nutzen die krisenhafte Situation schamlos aus, um die Gesellschaft weiter zu spalten. Das ist verantwortungsloses Handeln. Erst verlängern Sie gegen die Mehrheit der Bevölkerung die Laufzeiten der Atomkraftwerke, kürzen unter anderem bei der beruflichen Bildung, schaffen das Elterngeld für ALG-II-Bezieher ab,",data/txt/17076.txt,speech,
1929940,76,17,0,Zuruf von der FDP,von der FDP,von-der-fdp,1000,"Aber Sie wissen doch, warum!",data/txt/17076.txt,poi,fdp
1929941,76,17,0,,,,1001,"streichen den Heizkostenzuschuss beim Wohngeld, schaffen den befristeten Zuschlag beim ALG II ab, und obendrein zocken Sie die Menschen im Gesundheitssystem durch Ihre Kopfpauschale und die Praxisgebühr ab. Das sind rosige Zukunftsaussichten zumindest für Ihre finanzstarken Lobbygruppen, Atomindustrie und Pharmaindustrie!",data/txt/17076.txt,speech,
1929942,76,17,0,,,,1002,Beifall bei der LINKEN,data/txt/17076.txt,poi,
1929943,76,17,0,,,,1003,"Zappenduster wird es hingegen bei der Bevölkerung, während Ihre Politik im wahrsten Sinne des Wortes strahlt.

Eine Woche Haushaltsdebatte, viele gute Alternativvorschläge - auch von uns, der Linken -, aber Sie bleiben stur. Selbst die neueste Steuerschätzung bringt Sie nicht dazu, wenigstens einmal nachzudenken und vielleicht einen Teil der Sozialkürzungen zurückzunehmen; denn das würde - das sagte schon mein Vorredner Steffen Bockhahn - zu weiteren Belastungen in der Zukunft führen. Nein, das geht nicht. Aber beim ermäßigten Mehrwertsteuersatz für das Hotel- und Gaststättengewerbe waren Sie ganz schnell. Da sind Sie stur und halten daran fest, obwohl angeblich kein Geld da ist. Hier tut sich Ihr Mantra auf: Wir haben kein Geld und müssen sparen. - Dabei beschneiden Sie zugunsten von Einzelinteressen die Lebensqualität und die Lebensperspektiven von Millionen Menschen. Auch die Kommunen lassen Sie am ausgestreckten Arm verhungern. Aber genau dort spielt sich das Leben der meisten Menschen ab.",data/txt/17076.txt,speech,
1929944,76,17,0,Halina Wawzyniak [DIE LINKE],Halina Wawzyniak [DIE LINKE],halina-wawzyniak-die-linke,1004,Da kommen die nie hin!,data/txt/17076.txt,poi,linke
1929945,76,17,0,,,,1005,"Statt über eine gerechte Steuer- und Ausgabenpolitik nachzudenken, bedienen Sie eben nur die Interessen von starken Lobbygruppen und führen dann noch eine Steuerdiskussion, die völlig sinnlos ist. Aber nutzt dies der Mehrzahl der Menschen? Nein, insbesondere denen nicht, die - auch aufgrund Ihrer Politik - zu Minilöhnen arbeiten und trotz Arbeit zum Amt gehen müssen, um ihre Löhne aufzustocken.

Die Linke fordert einen Mindestlohn. In 20 von 27 EU-Ländern existiert dieser, ohne dass es zum Verlust von Arbeitsplätzen kam.",data/txt/17076.txt,speech,
1929946,76,17,0,,,,1006,Beifall bei der LINKEN,data/txt/17076.txt,poi,
1929947,76,17,0,,,,1007,"Viele Probleme könnten gelöst sein. Ein Mindestlohn hätte auch positive finanzielle Auswirkungen. Allein 2009 wurden 11 Milliarden Euro Steuergelder verbraten, um Löhne aufzustocken. Sie laden die Unternehmen förmlich dazu ein, Hungerlöhne zu zahlen. Für uns ist es vor allem eine Frage der Würde, Mindestlöhne zu zahlen, damit die Menschen von ihrer Hände Arbeit leben können. Aber Ihnen ist das völlig egal.",data/txt/17076.txt,speech,
1929948,76,17,0,,,,1008,Beifall bei der LINKEN,data/txt/17076.txt,poi,
1929949,76,17,0,,,,1009,"Damit treiben Sie die Spaltung der Gesellschaft immer weiter voran.

Sie wissen, dass im Jahre 2008 jeder sechste Haushalt - ein Drittel dieser Gruppe sind Alleinerziehende - von Armut bedroht war und dass derzeit 1,4 Millionen Menschen - 1,4 Millionen! - ihre Löhne aufstocken müssen, da diese zum Leben nicht reichen. Sie wissen auch, dass gleichzeitig die Anzahl der Vermögensmillionäre wieder rasant nach oben geschnellt ist, und zwar von 809 700 im Jahr 2008 auf 861 500 im Jahr 2009. All das wissen Sie. Aber Sie handeln nicht. Ich sage Ihnen auch, warum: Sie wollen es einfach nicht. Geld ist genug da. Sie müssten genau hinschauen und handeln.",data/txt/17076.txt,speech,
1929950,76,17,0,,,,1010,Beifall bei der LINKEN,data/txt/17076.txt,poi,
1929951,76,17,0,,,,1011,"Während Sie den Verursachern der Krise flugs einen Rettungsschirm von 480 Milliarden Euro aufgespannt haben und schon wieder dicke Boni wie eh und je gezahlt werden, Spekulanten so weitermachen wie zuvor, lassen Sie nur die Bürgerinnen und Bürger blechen. Wir würden uns wünschen, dass Sie einmal willens wären, innerhalb einer Woche Milliarden auch für Kitaplätze, für Kommunen und für Programme zur sozialen Stadtentwicklung zur Verfügung zu stellen.",data/txt/17076.txt,speech,
1929952,76,17,0,,,,1012,Beifall bei der LINKEN,data/txt/17076.txt,poi,
1929953,76,17,0,,,,1013,"Durch die Bankenabgabe, als Krisenvorsorge gedacht, wollen Sie nur 1,2 Milliarden Euro jährlich einnehmen. Danach darf die nächste Krise erst in 70 bis 150 Jahren kommen. Nein, sie wird eher kommen. Dann werden wieder die Steuerzahlerinnen und Steuerzahler, die Bürgerinnen und Bürger blechen müssen. Es muss Schluss sein mit Ihrer Politik ""Gewinne privatisieren und Verluste sozialisieren"".",data/txt/17076.txt,speech,
1929954,76,17,0,,,,1014,Beifall bei der LINKEN,data/txt/17076.txt,poi,
