id,sitzung,wahlperiode,in_writing,speaker,speaker_cleaned,speaker_fp,sequence,text,filename,type,speaker_party
2459764,79,17,0,Vizepräsident Dr. Hermann Otto Solms,Dr. Hermann Otto Solms,hermann-otto-solms,0,"Guten Morgen, liebe Kolleginnen und Kollegen! Die Sitzung ist eröffnet.

Interfraktionell ist vereinbart worden, den bisher als letzten Punkt unserer heutigen Tagesordnung zur Beratung vorgesehenen Antrag der Fraktion Die Linke ""Stuttgart 21 - Bau- und Vergabestopp"" im Anschluss an den jetzt gleich folgenden ersten Tagesordnungspunkt aufzurufen und darüber ohne Aussprache sofort abzustimmen.

Ich darf schon jetzt darauf hinweisen, dass auch zu diesem Tagesordnungspunkt eine namentliche Abstimmung verlangt wurde. Wir werden nachher dann also insgesamt sechs namentliche Abstimmungen haben.

Sind Sie mit der Änderung der Tagesordnung einverstanden? - Das ist der Fall. Dann ist das so beschlossen.

Ich rufe die Tagesordnungspunkte 30 a bis 30 d auf:

a)	-	Zweite und dritte Beratung des von den Fraktionen der CDU/CSU und der FDP eingebrachten Entwurfs eines Gesetzes zur Ermittlung von Regelbedarfen und zur Änderung des Zweiten und Zwölften Buches Sozialgesetzbuch

- Drucksache 17/3404 -

-	Zweite und dritte Beratung des von der Bundesregierung eingebrachten Entwurfs eines Gesetzes zur Ermittlung von Regelbedarfen und zur Änderung des Zweiten und Zwölften Buches Sozialgesetzbuch

- Drucksachen 17/3958, 17/3982 -

Beschlussempfehlung und Bericht des Ausschusses für Arbeit und Soziales (11. Ausschuss)

- Drucksachen 17/4032, 17/4095 -

Berichterstattung:

Abgeordnete Gabriele Hiller-Ohm

-	Bericht des Haushaltsausschusses (8. Ausschuss) gemäß § 96 der Geschäftsordnung

- Drucksache 17/4058 -

Berichterstattung:

Abgeordnete Axel E. Fischer (Karlsruhe-Land)

Bettina Hagedorn

Dr. Claudia Winterstein

Dr. Gesine Lötzsch

Alexander Bonde

b)	Beratung der Beschlussempfehlung und des Berichts des Ausschusses für Arbeit und Soziales (11. Ausschuss)

-	zu dem Antrag der Abgeordneten Gabriele Hiller-Ohm, Anette Kramme, Elke Ferner, weiterer Abgeordneter und der Fraktion der SPD

Das Urteil des Bundesverfassungsgerichtes durch eine transparente Bemessung der Regelsätze und eine Förderung der Teilhabe von Kindern umsetzen

-	zu dem Antrag der Abgeordneten Katja Kipping, Matthias W. Birkwald, Diana Golze, weiterer Abgeordneter und der Fraktion DIE LINKE

Maßnahmen zur Gewährleistung eines menschenwürdigen Existenz- und Teilhabeminimums

-	zu dem Antrag der Abgeordneten Fritz Kuhn, Markus Kurth, Brigitte Pothmer, weiterer Abgeordneter und der Fraktion BÜNDNIS 90/DIE GRÜNEN

Menschenwürdiges Dasein und Teilhabe für alle gewährleisten

- Drucksachen 17/3648, 17/2934, 17/3435, 17/4032, 17/4095 -

Berichterstattung:

Abgeordnete Gabriele Hiller-Ohm

c)	-	Zweite und dritte Beratung des von der Bundesregierung eingebrachten Entwurfs eines Siebten Gesetzes zur Änderung des Zweiten Buches Sozialgesetzbuch

- Drucksachen 17/3631, 17/3683 -

Beschlussempfehlung und Bericht des Ausschusses für Arbeit und Soziales (11. Ausschuss)

- Drucksachen 17/4033, 17/4094 -

Berichterstattung:

Abgeordnete Katja Kipping

-	Bericht des Haushaltsausschusses (8. Ausschuss) gemäß § 96 der Geschäftsordnung

- Drucksache 17/4059 -

Berichterstattung:

Abgeordnete Axel E. Fischer (Karlsruhe-Land)

Bettina Hagedorn

Dr. Claudia Winterstein

Dr. Gesine Lötzsch

Alexander Bonde

d)	Beratung der Beschlussempfehlung und des Berichts des Ausschusses für Arbeit und Soziales (11. Ausschuss) zu dem Antrag der Abgeordneten Britta Haßelmann, Markus Kurth, Alexander Bonde, weiterer Abgeordneter und der Fraktion BÜNDNIS 90/DIE GRÜNEN

Leistungskürzungen bei den Unterkunftskosten im Arbeitslosengeld II verhindern - Vermittlungsverfahren mit den Ländern unverzüglich aufnehmen

- Drucksachen 17/3058, 17/4033, 17/4094 -

Berichterstattung:

Abgeordnete Katja Kipping

Zu dem Entwurf eines Gesetzes zur Ermittlung von Regelbedarfen liegen zwei Änderungsanträge der Fraktion Die Linke, neun Änderungsanträge der Fraktion Bündnis 90/Die Grünen, ein Entschließungsantrag der Fraktion der SPD sowie zwei Entschließungsanträge der Fraktion Die Linke vor.

Namentlich abstimmen werden wir später über zwei Änderungsanträge der Fraktion Bündnis 90/Die Grünen, über einen Änderungsantrag der Fraktion Die Linke, über den Entwurf eines Gesetzes zur Ermittlung von Regelbedarfen sowie über den Entschließungsantrag der Fraktion der SPD.

Nach einer interfraktionellen Vereinbarung sind für die Aussprache eineinviertel Stunden vorgesehen. Gibt es Widerspruch? - Das ist nicht der Fall. Dann ist das so beschlossen.

Ich eröffne die Aussprache und erteile als erstem Redner das Wort dem Kollegen Karl Schiewerling von der CDU/CSU-Fraktion.",data/txt/17079.txt,chair,
2459765,79,17,0,,,,1,Beifall bei der CDU/CSU und der FDP,data/txt/17079.txt,poi,
2459766,79,17,0,Vizepräsident Dr. Hermann Otto Solms,Dr. Hermann Otto Solms,hermann-otto-solms,2,,data/txt/17079.txt,chair,
2459767,79,17,0,Karl Schiewerling (CDU/CSU),Karl Schiewerling,karl-schiewerling,3,"Herr Präsident! Meine Damen und Herren! Liebe Kolleginnen und Kollegen! Mit dem Gesetz zur Ermittlung von Regelbedarfen und zur Änderung des Zweiten und Zwölften Buches Sozialgesetzbuch, dessen Entwurf in zweiter und dritter Lesung zur Verabschiedung ansteht, kommen die Koalitionsfraktionen der Union und der FDP dem Auftrag des Bundesverfassungsgerichts nach. Die Regelsätze werden insgesamt neu und transparent gestaltet.",data/txt/17079.txt,speech,cducsu
2459768,79,17,0,Elke Ferner [SPD],Elke Ferner,elke-ferner,4,Das glauben Sie ja selber nicht!,data/txt/17079.txt,poi,spd
2459769,79,17,0,Karl Schiewerling (CDU/CSU),Karl Schiewerling,karl-schiewerling,5,Die Regelsätze für die Kinder werden eigenständig ermittelt.,data/txt/17079.txt,speech,cducsu
2459770,79,17,0,,,,6,Beifall bei Abgeordneten der CDU/CSU und der FDP,data/txt/17079.txt,poi,
2459771,79,17,0,Karl Schiewerling (CDU/CSU),Karl Schiewerling,karl-schiewerling,7,"Vor allem aber eröffnen wir mit diesem Gesetz den Kindern neue Chancen auf Bildung und gesellschaftliche Teilhabe.

Das Bundesverfassungsgericht hat ausdrücklich die Einkommens- und Verbrauchsstichprobe als Methode akzeptiert und hat in seinem Urteil am 9. Februar gleichzeitig konzediert, dass die aktuellen Zahlen erst im Herbst dieses Jahres vorliegen werden. Daraus hat sich ein kurzer Zeitraum zur Ermittlung der Bedarfe ergeben.

Ausdrücklich hat das Bundesverfassungsgericht dem Gesetzgeber Ermessensspielräume gegeben und ihm Wertentscheidungen zugestanden. Wenn nun die neuen Bedarfssätze mehr Geld für Internetnutzung - weil auf diesem Weg leichter Arbeitsstellen zu finden sind - und kein Geld für Tabak und Alkohol vorsehen, dann sind das Wertentscheidungen, in deren Fokus Vermittlung und Arbeitsaufnahme stehen.",data/txt/17079.txt,speech,cducsu
2459772,79,17,0,,,,8,Beifall bei der CDU/CSU und der FDP,data/txt/17079.txt,poi,
2459773,79,17,0,Fritz Kuhn [BÜNDNIS 90/DIE GRÜNEN],Fritz Kuhn,fritz-kuhn,9,Weltfremd!,data/txt/17079.txt,poi,gruene
2459774,79,17,0,Karl Schiewerling (CDU/CSU),Karl Schiewerling,karl-schiewerling,10,"Wenn wir unter Beachtung der Erfordernisse im ländlichen Raum die Mittel für Mobilität erhöhen, dann tragen wir damit der Flexibilität Rechnung, die nicht nur im Zusammenhang mit dem Bildungsbedarf der Kinder, sondern auch für den Bereich der Erwerbsarbeit erforderlich ist. Darauf setzen wir die Akzente im Zweiten Buch Sozialgesetzbuch.

Es geht auch um die Veränderung der Hinzuverdienstgrenzen, um in einem zugegeben bescheidenen Maße - man muss immer darauf achten, was die Haushaltslage erlaubt -",data/txt/17079.txt,speech,cducsu
2459775,79,17,0,Elke Ferner [SPD],Elke Ferner,elke-ferner,11,Um noch mehr Leute in die Bedürftigkeit zu drängen!,data/txt/17079.txt,poi,spd
2459776,79,17,0,Karl Schiewerling (CDU/CSU),Karl Schiewerling,karl-schiewerling,12,"Hinzuverdienste zu ermöglichen, die anrechnungsfrei bleiben.

Mit dem Bildungspaket erfüllen wir nicht nur die Vorgaben des Bundesverfassungsgerichts, sondern wir übertreffen sie sogar, zum Beispiel dadurch, dass wir die Kosten für das Essen in der Schule übernehmen oder bezuschussen.",data/txt/17079.txt,speech,cducsu
2459777,79,17,0,Elke Ferner [SPD],Elke Ferner,elke-ferner,13,10 Prozent!,data/txt/17079.txt,poi,spd
2459778,79,17,0,Karl Schiewerling (CDU/CSU),Karl Schiewerling,karl-schiewerling,14,"Die Umsetzung des Bildungspakets geht nur - das sage ich sehr deutlich - im Zusammenspiel von Bund, Ländern und Kommunen. Das Zusammenspiel von Bund, Ländern und Kommunen ist auch bei den Sonderbedarfen - ich nenne als Beispiel die Teilnahme an Klassenfahrten - oder bei der Umsetzung des Schulstarterpakets erforderlich. Wir sind sehr zufrieden mit der hervorragenden Kooperation mit dem Bundesarbeitsministerium. Alle Spitzenverbände der Kommunen und die Bundesländer haben sich äußerst dankbar dafür gezeigt,",data/txt/17079.txt,speech,cducsu
2459779,79,17,0,Elke Ferner [SPD],Elke Ferner,elke-ferner,15,Von welchen Bundesländern reden Sie denn da überhaupt?,data/txt/17079.txt,poi,spd
2459780,79,17,0,Karl Schiewerling (CDU/CSU),Karl Schiewerling,karl-schiewerling,16,"dass ihnen nun durch das Bildungspaket Möglichkeiten eröffnet werden, gerade die Kinder zu fördern, die sie vorher nicht fördern konnten.",data/txt/17079.txt,speech,cducsu
2459781,79,17,0,,,,17,Beifall bei der CDU/CSU sowie bei Abgeordneten der FDP,data/txt/17079.txt,poi,
2459782,79,17,0,Karl Schiewerling (CDU/CSU),Karl Schiewerling,karl-schiewerling,18,"Das Ganze geschieht sehr wohl in enger Abstimmung und mit möglichst wenig Bürokratie,",data/txt/17079.txt,speech,cducsu
2459783,79,17,0,,,,19,Lachen bei der SPD,data/txt/17079.txt,poi,
2459784,79,17,0,Elke Ferner [SPD],Elke Ferner,elke-ferner,20,Das ist ja klasse!,data/txt/17079.txt,poi,spd
2459785,79,17,0,Karl Schiewerling (CDU/CSU),Karl Schiewerling,karl-schiewerling,21,"möglichst unkompliziert, möglichst praxisgenau und sehr zielgerichtet.",data/txt/17079.txt,speech,cducsu
2459786,79,17,0,,,,22,Beifall bei der CDU/CSU sowie bei Abgeordneten der FDP,data/txt/17079.txt,poi,
2459787,79,17,0,Karl Schiewerling (CDU/CSU),Karl Schiewerling,karl-schiewerling,23,"Dass das, Frau Kollegin Ferner, nicht ohne Bürokratie geht, hängt damit zusammen, dass die Hilfen unmittelbar bei den Kindern ankommen müssen. Das Bundesverfassungsgericht hat in sein Urteil eine Formulierung geschrieben, die uns sehr viel Anstrengungen und Aufgaben auferlegt, nämlich die Formulierung ""individuelle Förderung"" und ""individuelle Rechtsansprüche"". Wenn jemand individuelle Rechtsansprüche hat, dann muss der Gesetzgeber nachweisen, dass die Leistungen bei dem Individuum ankommen. Das schaffen Sie nicht mit einem Sacharbeiter beim Bundesarbeitsministerium; man muss vielmehr die Hilfe zwangsläufig möglichst nahe an den Menschen organisieren. Das geht nicht ohne personellen Aufwand.",data/txt/17079.txt,speech,cducsu
2459788,79,17,0,,,,24,Beifall bei der CDU/CSU sowie bei Abgeordneten der FDP,data/txt/17079.txt,poi,
2459789,79,17,0,Karl Schiewerling (CDU/CSU),Karl Schiewerling,karl-schiewerling,25,"In die Regelungen beziehen wir auch die Kinder mit ein, die einen Kinderzuschuss erhalten.",data/txt/17079.txt,speech,cducsu
2459790,79,17,0,Elke Ferner [SPD],Elke Ferner,elke-ferner,26,"""Zuschlag"" heißt das, Herr Schiewerling!",data/txt/17079.txt,poi,spd
2459791,79,17,0,Karl Schiewerling (CDU/CSU),Karl Schiewerling,karl-schiewerling,27,"Der Kinderzuschuss ist insbesondere deshalb eingeführt worden, um Familien zu unterstützen, damit sie nicht wegen der Kinder von Hartz IV abhängig werden. Auch diese Kinder beziehen wir mit ein.",data/txt/17079.txt,speech,cducsu
2459792,79,17,0,,,,28,Beifall bei der CDU/CSU sowie bei Abgeordneten der FDP,data/txt/17079.txt,poi,
2459793,79,17,0,Karl Schiewerling (CDU/CSU),Karl Schiewerling,karl-schiewerling,29,"Ich will nicht verheimlichen, dass mir die Situation der Kinder, deren Eltern, Großeltern und Urgroßeltern bereits von Sozialhilfe gelebt haben und noch leben, große Sorge bereitet, weil die Gefahr besteht, dass diese Kinder denselben Weg nehmen werden, wenn wir nicht alle Anstrengungen unternehmen, um sie aus diesem Teufelskreis herauszuholen.",data/txt/17079.txt,speech,cducsu
2459794,79,17,0,,,,30,Beifall bei Abgeordneten der CDU/CSU und der FDP,data/txt/17079.txt,poi,
2459795,79,17,0,Karl Schiewerling (CDU/CSU),Karl Schiewerling,karl-schiewerling,31,"Ich will auch nicht verschweigen, dass das vorliegende Bildungspaket genau für diese Zielgruppe, die wir in dem großstädtischen Milieu antreffen, möglicherweise nicht ausreicht. Darin besteht aber die Herausforderung, der wir uns gemeinsam stellen müssen. Wir müssen uns gerade diesen Kindern zuwenden. Wir dürfen kein Kind aufgeben. Jeder hat Begabungen, und jeder hat Fähigkeiten. Wir brauchen jedes Kind für die Zukunft unseres Landes.",data/txt/17079.txt,speech,cducsu
2459796,79,17,0,,,,32,Beifall bei der CDU/CSU und der FDP,data/txt/17079.txt,poi,
2459797,79,17,0,Karl Schiewerling (CDU/CSU),Karl Schiewerling,karl-schiewerling,33,"Mit dem Gesetz sorgen wir für mehr Flexibilität im Bereich der Kosten der Unterkunft. Das ist vor allen Dingen ein Anliegen der Kommunen. Ob die Kommunen eine Satzungslösung wollen oder nicht, entscheiden sie gemeinsam mit ihrem Bundesland. Es ist keine Pflichtvorschrift. Es ist eine Möglichkeit, die wir ihnen jetzt einräumen. Übrigens haben das auch nicht wenige Sozialrichter ausdrücklich empfohlen, um die Flut der Klagen gerade in diesem Bereich stärker einzudämmen.

Meine Damen und Herren, es bleibt dabei: In der Grundsicherung für Arbeitsuchende geht es um Fordern und Fördern. Dass wir hier alle Perspektiven haben und dass es gute Entwicklungen gibt, zeigen die Zahlen für den Arbeitsmarkt, auch wenn zugegebenermaßen primär die Menschen davon profitieren, die im Arbeitslosengeld-I-Bezug sind, also kurzfristig arbeitslos sind. Aber es stimmt hoffnungsfroh, dass auch weit über 100 000 Menschen, die bisher im Arbeitslosengeld-II-Bezug waren, den Weg wieder in eine reguläre sozialversicherungspflichtige Beschäftigung gefunden haben. Ich glaube, dass wir diesen Weg miteinander gut weitergehen können. Die Lösungen, die wir gefunden haben, werden dabei passgenau helfen.",data/txt/17079.txt,speech,cducsu
2459798,79,17,0,,,,34,Beifall bei der CDU/CSU und der FDP,data/txt/17079.txt,poi,
2459799,79,17,0,Karl Schiewerling (CDU/CSU),Karl Schiewerling,karl-schiewerling,35,"Wir schließen mit diesem Gesetzgebungsvorhaben, das heute vor dem Abschluss steht, den zweiten Teil der Neuorganisation, der Neuplanung, der Neugestaltung des Zweiten Buches Sozialgesetzbuch ab. Der erste Teil war die Organisationsreform. Dies ist der zweite Teil, der emotionalste Teil. Der dritte Teil wird folgen, wenn wir die arbeitsmarktpolitischen Instrumente im Frühjahr des kommenden Jahres flexibilisieren und präzisieren, um sie dann möglichst passgenau vor Ort einsetzen zu können.

Ich möchte wiederholen, was ich in früheren Debatten gesagt habe: Dass wir auf der Grundlage von zwei Verfassungsgerichtsurteilen das Zweite Buch Sozialgesetzbuch jetzt so ändern müssen, hat auch etwas damit zu tun, wie die Entscheidungen 2004 gefallen sind.",data/txt/17079.txt,speech,cducsu
2459800,79,17,0,Elke Ferner [SPD],Elke Ferner,elke-ferner,36,Da waren Sie ja mit beteiligt im Vermittlungsausschuss!,data/txt/17079.txt,poi,spd
2459801,79,17,0,Karl Schiewerling (CDU/CSU),Karl Schiewerling,karl-schiewerling,37,"Deswegen lade ich die damals Beteiligten, die SPD und die Grünen, ausdrücklich ein, mit uns gemeinsam die Dinge jetzt in Ordnung zu bringen.",data/txt/17079.txt,speech,cducsu
2459802,79,17,0,,,,38,Beifall bei der CDU/CSU sowie bei Abgeordneten der FDP,data/txt/17079.txt,poi,
2459803,79,17,0,Karl Schiewerling (CDU/CSU),Karl Schiewerling,karl-schiewerling,39,"Das Gesetz, das wir auf den Weg bringen, ist klar, transparent und dient den Menschen. Ich hoffe sehr, dass es mehr Klarheit bringt.

Herzlichen Dank.",data/txt/17079.txt,speech,cducsu
2459804,79,17,0,,,,40,Beifall bei der CDU/CSU und der FDP,data/txt/17079.txt,poi,
2459805,79,17,0,Karl Schiewerling (CDU/CSU),Karl Schiewerling,karl-schiewerling,41,,data/txt/17079.txt,speech,cducsu
2459806,79,17,0,Vizepräsident Dr. Hermann Otto Solms,Dr. Hermann Otto Solms,hermann-otto-solms,42,Ich erteile jetzt das Wort der Kollegin Elke Ferner von der SPD-Fraktion.,data/txt/17079.txt,chair,
2459807,79,17,0,,,,43,Beifall bei der SPD,data/txt/17079.txt,poi,
2459808,79,17,0,Vizepräsident Dr. Hermann Otto Solms,Dr. Hermann Otto Solms,hermann-otto-solms,44,,data/txt/17079.txt,chair,
2459809,79,17,0,Elke Ferner (SPD),Elke Ferner,elke-ferner,45,"Herr Präsident! Liebe Kollegen und Kolleginnen! Sehr geehrte Frau von der Leyen, Ihr Gesetzentwurf ist mehr Schein als Sein. Sie haben eine Zeitverzögerung hineingebracht. Das Verfassungsgerichtsurteil datiert vom 9. Februar. Sie haben den Gesetzentwurf Ende Oktober eingebracht. Sie hätten die Zeit dazwischen nutzen müssen - nicht nur können, müssen! -, um die organisatorischen Dinge mit den Kommunen und den Ländern zu klären. Das haben Sie nicht getan. Sie haben den Entwurf so spät eingebracht, dass ohne Fristverzicht durch den Bundesrat der Gesetzentwurf noch nicht einmal am 17. Dezember im Bundesrat zu behandeln wäre. Sie versuchen - das werden Sie nachher auch wieder tun -, uns die Verantwortung dafür zuzuschieben, dass das Gesetz nicht mehr in diesem Jahr ins Gesetzblatt kommt.

Das hätte man erreichen können, wenn das Gesetz die Vorgaben des Verfassungsgerichts erfüllen würde. Aber das ist nicht der Fall. In keinem einzigen Punkt werden die Vorgaben des Verfassungsgerichts erfüllt. Das hat die Anhörung eindrucksvoll ergeben. Herr Schiewerling, Sie können hier noch so lange sagen: ""Die Regelsätze sind in einem transparenten, in einem nachvollziehbaren Verfahren ermittelt worden"" - es stimmt nicht!",data/txt/17079.txt,speech,spd
2459810,79,17,0,,,,46,Beifall bei der SPD sowie bei Abgeordneten der LINKEN und des BÜNDNISSES 90/DIE GRÜNEN,data/txt/17079.txt,poi,
2459811,79,17,0,Karl Schiewerling [CDU/CSU],Karl Schiewerling,karl-schiewerling,47,Es stimmt wohl! Es ist verfassungsrechtlich in Ordnung!,data/txt/17079.txt,poi,cducsu
2459812,79,17,0,Elke Ferner (SPD),Elke Ferner,elke-ferner,48,"Sie, Frau von der Leyen, versuchen, durch Zahlenkolonnen dem Ganzen einen seriösen Anstrich zu geben. Wenn man einmal einen Blick hinter die Zahlen wirft, dann erkennt man aber - dafür braucht man auch kein Grundseminar in Statistik besucht zu haben -, dass Sie tricksen, und zwar am laufenden Band.

Am Beispiel der Kinderregelsätze wird das am allerdeutlichsten. Wenn man sich die Tabellen zu den Kinderregelsätzen anschaut, stellt man fest: Es wimmelt von Strichen und Klammern. Was bedeutet das? Die Striche bedeuten: Weniger als 25 Haushalte liegen zugrunde. Die Klammern bedeuten: Weniger als 100 Haushalte liegen zugrunde. Wenn man sich dann einmal anschaut, wie viel Prozent des Regelsatzes auf diesen statistisch unvaliden Daten beruhen, dann stellt man fest: Je älter die Kinder, umso weniger valide ist die Berechnungsgrundlage für die Regelsätze. Der Regelsatz für die 14- bis 18-Jährigen beruht noch nicht einmal zu 44 Prozent auf statistisch validen Daten. Das ist nicht rea-litätsgerecht, das ist nicht transparent, und das ist schon gar nicht nachvollziehbar.",data/txt/17079.txt,speech,spd
2459813,79,17,0,,,,49,Beifall bei der SPD sowie bei Abgeordneten des BÜNDNISSES 90/DIE GRÜNEN,data/txt/17079.txt,poi,
2459814,79,17,0,Elke Ferner (SPD),Elke Ferner,elke-ferner,50,"Bei den Erwachsenenregelsätzen haben Sie auch getrickst: Sie haben ohne eine stichhaltige Begründung - Sie haben überhaupt gar keine Begründung genannt - die Referenzgruppe von 20 Prozent auf 15 Prozent reduziert. Das ist das Erste. Sie haben dann Wertungen vorgenommen; das kann man machen. Man kann Tabak und Alkohol herausrechnen. Aber wenn man das macht, dann muss man das methodisch sauber durchführen. Das haben Sie nicht getan. Sie haben einfach nur herausgerechnet. Ich will Ihnen das deutlich machen, damit jeder es versteht: 1 664 Haushalte sind in der Abteilung Nahrungsmittel, Getränke, Tabakwaren enthalten. In diesen Haushalten sind im Durchschnitt 11 Euro für Tabak ausgegeben worden. Aber nur etwas über 440 haben überhaupt Tabakausgaben gehabt; die haben 41 Euro ausgegeben. Sie kürzen um 11 Euro. Was heißt das denn? Sie nehmen den Leuten, die keinen Tabak konsumieren, 11 Euro weg, die die bisher für etwas anderes ausgegeben haben. Den Rauchern lassen Sie 30 Euro. Was ist das für eine Methode? Das ist die blanke Willkür. Und auch das wird vor dem Verfassungsgericht keinen Bestand haben.",data/txt/17079.txt,speech,spd
2459815,79,17,0,,,,51,Beifall bei der SPD und dem BÜNDNIS 90/ DIE GRÜNEN sowie bei Abgeordneten der LINKEN,data/txt/17079.txt,poi,
2459816,79,17,0,Elke Ferner (SPD),Elke Ferner,elke-ferner,52,Sie argumentieren immer mit dem Lohnabstandsgebot. Das Lohnabstandsgebot ist seit diesem Verfassungsgerichtsurteil passé.,data/txt/17079.txt,speech,spd
2459817,79,17,0,Matthias W. Birkwald [DIE LINKE],Matthias W. Birkwald,matthias-birkwald,53,So ist es!,data/txt/17079.txt,poi,linke
2459818,79,17,0,Elke Ferner (SPD),Elke Ferner,elke-ferner,54,"Das gibt es so nicht mehr. Es kann nicht sein, dass sich die Regelsätze am niedrigsten Schmutzlohn orientieren, sondern es muss in Zukunft so sein, dass das Existenzminimum auch bedarfsgerecht ermittelt wird und dass das Existenzminimum plus x die Höhe der Löhne darstellt, die Menschen bekommen müssen, damit sie bei Vollzeitarbeit ein Einkommen über dem Existenzminimum haben.

Wenn man die 8,50 Euro Mindestlohn, die wir und der DGB fordern, auf eine Vollzeitarbeitsstelle hochrechnet, kommt man auf 1 462 Euro brutto. Das sind dann netto je nach Steuerklasse zwischen 1 058 und 1 160 Euro. Alle Alleinstehenden, alle Paare und auch die meisten Paare mit einem Kind würden dann ohne ergänzende Sozialleistungen auskommen können. Aber das verweigern Sie den Menschen in diesem Land.",data/txt/17079.txt,speech,spd
2459819,79,17,0,,,,55,Beifall bei der SPD und dem BÜNDNIS 90/ DIE GRÜNEN sowie bei Abgeordneten der LINKEN,data/txt/17079.txt,poi,
2459820,79,17,0,Elke Ferner (SPD),Elke Ferner,elke-ferner,56,"Auch Ihr Teilhabepaket, Frau von der Leyen, ist eine Mogelpackung. Sie schreiben eine Zahl ins Gesetz - etwas mehr als 600 Millionen Euro -, die jetzt für die Teilhabe ausgegeben werden sollen. Sie verschweigen aber, dass darin schon das Schulbedarfspaket, das wir in der Großen Koalition durchgesetzt haben, und die mehrtägigen Klassenfahrten enthalten sind.",data/txt/17079.txt,speech,spd
2459821,79,17,0,,,,57,Zuruf der Abg. Ingrid Fischbach [CDU/ CSU],data/txt/17079.txt,poi,
2459822,79,17,0,Elke Ferner (SPD),Elke Ferner,elke-ferner,58,"Natürlich kommt etwas hinzu, aber was? 10 Euro im Monat für Vereinsbeiträge. Auch da kann man sagen: Politik trifft Wirklichkeit - schönen guten Tag! Es gibt nämlich bei den Vereinen längst Familienbeiträge und symbolische Beiträge für Kinder aus armen Familien. Was wird denn passieren? Dieses Geld darf nur für Vereinsbeiträge verwandt werden. Die Schuhe, die Trikots und das Weitere, das man zum Sport braucht, können davon nicht finanziert werden.",data/txt/17079.txt,speech,spd
2459823,79,17,0,Ingrid Fischbach [CDU/CSU],Ingrid Fischbach,ingrid-fischbach,59,Wo leben Sie denn? Unglaublich!,data/txt/17079.txt,poi,cducsu
2459824,79,17,0,Elke Ferner (SPD),Elke Ferner,elke-ferner,60,"Davon werden die Kinder nicht viel haben. Vor allen Dingen muss es erst einmal beantragt werden. Sie bauen mit Ihrem Gutscheinsystem eine Bürokratie auf, die ihresgleichen sucht. Sie geben 33 Euro pro 120 bis 150 Euro, die ausgegeben werden sollen, allein für Verwaltungskosten aus. Das ist völlig absurd.",data/txt/17079.txt,speech,spd
2459825,79,17,0,,,,61,Beifall bei der SPD sowie bei Abgeordneten des BÜNDNISSES 90/DIE GRÜNEN,data/txt/17079.txt,poi,
2459826,79,17,0,Elke Ferner (SPD),Elke Ferner,elke-ferner,62,"Ich kann Ihnen nur sagen: Ihr Herbst der Entscheidungen ist ein Herbst der Fehlentscheidungen. Wir werden uns an diesen Fehlentscheidungen nicht beteiligen. Deshalb werden wir dieses Gesetz heute ablehnen. Wenn Sie im Vermittlungsausschuss nicht zu verfassungskonformen Regelsätzen, einem Teilhabepaket, das den Namen auch verdient, und zu einem Einstieg in den gesetzlichen Mindestlohn bereit sind, werden Sie auch da keine Zustimmung von uns bekommen.

Schönen Dank.",data/txt/17079.txt,speech,spd
2459827,79,17,0,,,,63,Beifall bei der SPD und dem BÜNDNIS 90/ DIE GRÜNEN,data/txt/17079.txt,poi,
2459828,79,17,0,Peter Weiß [Emmendingen] [CDU/CSU],Peter Weiß,peter-weiß,64,"Wer hat das verfassungswidrige Gesetz gemacht? Das war doch die SPD, Frau Ferner!",data/txt/17079.txt,poi,cducsu
2459829,79,17,0,Elke Ferner (SPD),Elke Ferner,elke-ferner,65,,data/txt/17079.txt,speech,spd
2459830,79,17,0,Vizepräsident Dr. Hermann Otto Solms,Dr. Hermann Otto Solms,hermann-otto-solms,66,Das Wort hat jetzt der Kollege Pascal Kober von der FDP-Fraktion.,data/txt/17079.txt,chair,
2459831,79,17,0,,,,67,Beifall bei der FDP und der CDU/CSU,data/txt/17079.txt,poi,
2459832,79,17,0,Vizepräsident Dr. Hermann Otto Solms,Dr. Hermann Otto Solms,hermann-otto-solms,68,,data/txt/17079.txt,chair,
