id,sitzung,wahlperiode,in_writing,speaker,speaker_cleaned,speaker_fp,sequence,text,filename,type,speaker_party
1929312,76,17,0,Bärbel Höhn [BÜNDNIS 90/DIE GRÜNEN],Bärbel Höhn [BÜNDNIS 90/DIE GRÜNEN],barbel-hohn-bundnis-90-die-grunen,372,Genau! Immer dieselben!,data/txt/17076.txt,poi,gruene
1929313,76,17,0,,,,373,"Sie sind zwar nicht angewiesen auf die 16 Millionen Euro, die im Bundesprogramm ""Ökolandbau"" stecken. Aber wenn diese 16 Millionen Euro Forschungsmittel in ihre Projekte fließen, kann man den Ökolandbau empfindlich treffen. Das ist dann gleich am 17. November eingeleitet worden.

Noch am 15. und 16. November fand übrigens ein großer Workshop beim vTI in Braunschweig zur Evaluation des Bundesprogramms statt. Da zogen die Experten eine sehr positive Bilanz des Bundesprogramms ""Ökolandbau"", und sie unterstrichen die Notwendigkeit der Fortsetzung des Programms.",data/txt/17076.txt,speech,
1929314,76,17,0,,,,374,Beifall beim BÜNDNIS 90/DIE GRÜNEN,data/txt/17076.txt,poi,
1929315,76,17,0,,,,375,"Dann kommt am 17. eben der Stopp der Förderanträge, unter denen eigentlich nur noch die Unterschrift fehlte. Herr Haustein, zur angeblichen Nichtausnutzung der Finanzmittel: Nach Angaben der BLE, die das Programm verwaltet, wurde das Bundesprogramm in der Vergangenheit zu 90 bis 100 Prozent ausgeschöpft. Lediglich haushaltsrechtliche Vergabebestimmungen setzten der Mittelverwendung Grenzen. Ich könnte Ihnen jetzt aufzählen, wie da getrickst worden ist. Viele förderwürdige Anträge wurden abgelehnt, weil angeblich keine ausreichenden Finanzmittel da waren. Aber das können Sie alles nachlesen.

Die Kanzlerin sprach jüngst vom Herbst der Entscheidungen. Dann wird in diesem Herbst die Sense eben einmal an den Ökolandbau angelegt. Aber, liebe Kolleginnen und Kollegen von der Koalition, es wird Ihnen auf Dauer nicht gelingen, den Ökolandbau am Wachsen zu hindern. Spätestens im nächsten Frühling wird es grün im Land, und besonders im ökologischen Landbau. Da können Sie ganz sicher sein.",data/txt/17076.txt,speech,
1929316,76,17,0,,,,376,Beifall beim BÜNDNIS 90/DIE GRÜNEN,data/txt/17076.txt,poi,
1929317,76,17,0,,,,377,"Präsident Dr. Norbert Lammert:

Peter Bleser ist der nächste Redner für die CDU/ CSU-Fraktion.",data/txt/17076.txt,speech,
1929318,76,17,0,,,,378,Beifall bei der CDU/CSU,data/txt/17076.txt,poi,
1929319,76,17,0,,,,379,"Peter Bleser (CDU/CSU):

Herr Präsident! Meine Damen und Herren! Auch bei einer Agrardebatte gilt es, den Überblick über die Gesamtsituation des Landes zu behalten. Da muss man schon feststellen, dass wir insgesamt ein enormes Einsparpotenzial zu realisieren hatten und haben, um dieses Land nicht in eine Situation zu bringen, in die Griechenland und vielleicht einige andere Staaten geraten sind oder geraten könnten.",data/txt/17076.txt,speech,
1929320,76,17,0,Ulrike Höfken [BÜNDNIS 90/DIE GRÜNEN],Ulrike Höfken [BÜNDNIS 90/DIE GRÜNEN],ulrike-hofken-bundnis-90-die-grunen,380,Da muss der Ökolandbau dran glauben!,data/txt/17076.txt,poi,gruene
1929321,76,17,0,,,,381,"Für uns war es natürlich nicht schön, dass der Finanzminister auch unserem Haushalt Einsparungen abverlangt hat. 6 Prozent weniger. 350 Millionen Euro mussten zugeordnet werden. Wir haben ganz klar gesagt: Wir wollen keine Kürzungen in einkommenswirksamen Bereichen für die Landwirte.",data/txt/17076.txt,speech,
1929322,76,17,0,Ulrike Höfken [BÜNDNIS 90/DIE GRÜNEN],Ulrike Höfken [BÜNDNIS 90/DIE GRÜNEN],ulrike-hofken-bundnis-90-die-grunen,382,Aber wieso Ökolandbau?,data/txt/17076.txt,poi,gruene
1929323,76,17,0,,,,383,"Wir haben gesagt: Wir wollen keine Kürzung in die Zukunft, nämlich bei Forschung.",data/txt/17076.txt,speech,
1929324,76,17,0,Zuruf von der CDU/CSU,von der CDU/CSU,von-der-cdu-csu,384,Richtig!,data/txt/17076.txt,poi,cducsu
1929325,76,17,0,,,,385,"Und wir haben gesagt: Wir müssen Akzente setzen, zum einen den Verbraucherschutz stärken, 10 Millionen Euro mehr in die Stiftung,",data/txt/17076.txt,speech,
1929326,76,17,0,Ulrich Kelber [SPD],Ulrich Kelber [SPD],ulrich-kelber-spd,386,Ihr kürzt beim Zuschuss!,data/txt/17076.txt,poi,spd
1929327,76,17,0,,,,387,und zum anderen die wettbewerbsfähige Landwirtschaft weiter fördern. Alle diese Grundsatzziele sind mit diesem Haushalt eingehalten worden.,data/txt/17076.txt,speech,
1929328,76,17,0,,,,388,Beifall bei der CDU/CSU,data/txt/17076.txt,poi,
1929329,76,17,0,Ulrich Kelber [SPD],Ulrich Kelber [SPD],ulrich-kelber-spd,389,Eigentlich muss er schon lachen über seine Argumente!,data/txt/17076.txt,poi,spd
1929330,76,17,0,,,,390,"Meine Damen und Herren, ich gebe ganz offen zu: Wir hatten über viele Monate eine Deckungslücke von über 100 Millionen Euro. Dass man sich dann jeden Haushaltstitel anschaut, ist doch völlig normal. Dass man dann unter den genannten Prämissen auf den Titel ""Ökolandbau"" zu sprechen kommt, ist auch logisch, zumal -",data/txt/17076.txt,speech,
1929331,76,17,0,Ulrich Kelber [SPD],Ulrich Kelber [SPD],ulrich-kelber-spd,391,Für dich schon!,data/txt/17076.txt,poi,spd
1929332,76,17,0,,,,392,"darüber möchte ich das geneigte Publikum einmal in Kenntnis setzen - hier Propagandamittel ausgegeben werden für eine bestimmte Produktionsrichtung,",data/txt/17076.txt,speech,
1929333,76,17,0,Ulrike Höfken [BÜNDNIS 90/DIE GRÜNEN],Ulrike Höfken [BÜNDNIS 90/DIE GRÜNEN],ulrike-hofken-bundnis-90-die-grunen,393,Das war sein Lebensziel!,data/txt/17076.txt,poi,gruene
1929334,76,17,0,,,,394,"die ich überhaupt nicht negativ beurteile. Ganz im Gegenteil. Die Entscheidung, ob diese im Markt platziert wird, soll der Verbraucher treffen. Aber wenn hier für Karstadt 47 000 Euro für Kochinformationsveranstaltungen ausgegeben werden, wenn für Hoffahrten von Schulklassen nur für Ökobetriebe 27 000 Euro ausgegeben werden,",data/txt/17076.txt,speech,
1929335,76,17,0,Ulrich Kelber [SPD],Ulrich Kelber [SPD],ulrich-kelber-spd,395,Was ist an Information für Kinder falsch?,data/txt/17076.txt,poi,spd
1929336,76,17,0,,,,396,"wenn Millionen für Informationsmaterial ausgegeben werden, das eindeutig politisch orientiert ist, dann kann man doch fragen: Ist das in Zeiten knapper Haushaltsmittel noch notwendig, oder ist die PR in diesem Bereich in den öffentlichen Medien längst ausreichend? Das war unsere Intention.",data/txt/17076.txt,speech,
1929337,76,17,0,,,,397,Beifall bei der CDU/CSU und der FDP,data/txt/17076.txt,poi,
1929338,76,17,0,Ulrich Kelber [SPD],Ulrich Kelber [SPD],ulrich-kelber-spd,398,Schulfahrten von Kindern sind rot-grüne Propaganda! Das ist interessant!,data/txt/17076.txt,poi,spd
1929339,76,17,0,,,,399,"- Wissen Sie, Herr Kelber, nachdem Sie hier geredet haben, war ich mir wieder einmal sicher, dass unsere Position in der Agrarpolitik richtig ist, was mich wiederum erfreut.

Zurück. Wir haben deswegen gesagt, wir wollen den Titel nicht streichen, wir weiten ihn auf. Das ist auch gelungen. Ich habe auch mit dem Vorsitzenden des BÖLW, des Bundes der Ökologischen Lebensmittelwirtschaft, gesprochen. Wir haben die Wogen wieder geglättet.",data/txt/17076.txt,speech,
1929340,76,17,0,Ulrich Kelber [SPD],Ulrich Kelber [SPD],ulrich-kelber-spd,400,Das sieht Herr Löwenstein etwas anders!,data/txt/17076.txt,poi,spd
1929341,76,17,0,,,,401,"Ich rate uns allen dazu, hier die Schärfe herauszunehmen. Fakt ist: Nicht ein einziger Euro ist einem ökologisch wirtschaftenden Landwirt verloren gegangen, nicht ein einziger. Es geht hier um PR-Mittel und nichts anderes.",data/txt/17076.txt,speech,
1929342,76,17,0,,,,402,Beifall bei der CDU/CSU und der FDP,data/txt/17076.txt,poi,
1929343,76,17,0,,,,403,"Zu Recht ist heute darauf hingewiesen worden, dass im Haushalt des Ministeriums für Ernährung, Landwirtschaft und Verbraucherschutz die entsprechenden Mittel zur Verfügung gestellt werden. Erlauben Sie mir, dass ich heute einmal mehr auf den Verbraucherschutz eingehe.",data/txt/17076.txt,speech,
1929344,76,17,0,Waltraud Wolff [Wolmirstedt] [SPD],Waltraud Wolff [Wolmirstedt] [SPD],waltraud-wolff-wolmirstedt-spd,404,Weil ihr in der Landwirtschaft nur gestrichen habt!,data/txt/17076.txt,poi,spd
1929345,76,17,0,,,,405,"Er ist in den letzten Monaten in der Tat zu einem ganz wichtigen Thema geworden. Frau Ministerin, ich bedanke mich sehr dafür, dass Sie in vielen Bereichen Vorreiterin waren und mit Ihrer Staatssekretärin Klöckner wirklich Maßstäbe gesetzt haben, wie wir sie sonst in Europa nicht finden. Herzlichen Dank dafür!",data/txt/17076.txt,speech,
1929346,76,17,0,,,,406,Beifall bei der CDU/CSU und der FDP,data/txt/17076.txt,poi,
1929347,76,17,0,,,,407,"Es war zum Beispiel nur durch den Einsatz der Ministerin - ohne Gesetzesvorhaben - möglich, dass bei Google Street View die Privatsphäre geschützt werden kann, indem Widerspruchsmöglichkeiten geschaffen worden sind. Das ist etwas, was andere überhaupt nicht gemerkt haben. Herr Kelber, das gilt insbesondere für Ihre Fraktion.

Wir sind dabei, die Ergebnisse unserer Aktion ""sauberes Telefon"" in Gesetzestexte zu gießen.",data/txt/17076.txt,speech,
1929348,76,17,0,Ulrich Kelber [SPD],Ulrich Kelber [SPD],ulrich-kelber-spd,408,"Dann kriegt jeder ein Reinigungstuch, oder wie?",data/txt/17076.txt,poi,spd
1929349,76,17,0,,,,409,"Die Novellierung des Telekommunikationsgesetzes wird jetzt auf den Weg gebracht. Wir sind uns in der Koalition schon einig, Herr Kollege Schweickert: Warteschleifen, bis eine menschliche Stimme ertönt, werden zukünftig kostenfrei sein. Dergleichen haben Sie in den letzten Jahren nicht zustande gebracht.",data/txt/17076.txt,speech,
1929350,76,17,0,,,,410,Beifall bei der CDU/CSU und der FDP,data/txt/17076.txt,poi,
1929351,76,17,0,Ulrich Kelber [SPD],Ulrich Kelber [SPD],ulrich-kelber-spd,411,"Weil du das blockiert hast in der Großen Koalition! Du warst doch dagegen in der Großen Koalition! Am Sonntag gehst du wieder beichten, und die Lügen sind alle vergeben!",data/txt/17076.txt,poi,spd
1929352,76,17,0,,,,412,"Wir werden eine Preisansagepflicht bei Anbieterwechsel einführen. Auch im Mobilfunkbereich werden wir eine Widerspruchsmöglichkeit einführen, damit dort endlich die Abzocke beendet wird. Sie hat zu großer Verärgerung geführt; denn viele sind über den Tisch gezogen worden.",data/txt/17076.txt,speech,
1929353,76,17,0,,,,413,Beifall bei der CDU/CSU und der FDP,data/txt/17076.txt,poi,
1929354,76,17,0,,,,414,"Frau Ministerin hat es schon gesagt: Unter dem Beratungsprotokoll müssen künftig zwei Unterschriften stehen. Der Kunde weiß dann, in welcher Weise er beraten worden ist. Er kann das später dokumentieren. Missbrauch - er ist in der Tat häufig vorgekommen - wird so reduziert. Das alles sind Dinge, die im Bereich des Verbraucherschutzes auf den Weg gebracht worden sind.

Wir gehen weiter. Frau Ministerin hat angekündigt, dass sie nächstes Jahr ein Verbraucherportal ""Wahrheit und Klarheit"" bei der Verbraucherschutzzentrale in Hessen einrichtet.",data/txt/17076.txt,speech,
1929355,76,17,0,Ulrich Kelber [SPD],Ulrich Kelber [SPD],ulrich-kelber-spd,415,Gegen das du bist!,data/txt/17076.txt,poi,spd
1929356,76,17,0,,,,416,- Dagegen bin ich nicht.,data/txt/17076.txt,speech,
1929357,76,17,0,Ulrich Kelber [SPD],Ulrich Kelber [SPD],ulrich-kelber-spd,417,Hast du in der Sitzung gesagt!,data/txt/17076.txt,poi,spd
1929358,76,17,0,,,,418,"- Nein, das stimmt überhaupt nicht. Ich bin der größte Unterstützer dieses Vorhabens und lasse mich da von niemandem übertreffen.",data/txt/17076.txt,speech,
1929359,76,17,0,,,,419,Lachen bei der SPD,data/txt/17076.txt,poi,
1929360,76,17,0,Waltraud Wolff [Wolmirstedt] [SPD],Waltraud Wolff [Wolmirstedt] [SPD],waltraud-wolff-wolmirstedt-spd,420,"Peter, dich kriegen wir! Gehst du am Sonntag beichten?",data/txt/17076.txt,poi,spd
1929361,76,17,0,Ulrich Kelber [SPD],Ulrich Kelber [SPD],ulrich-kelber-spd,421,Nächstes Mal nehme ich eine Videokamera mit in die Sitzung!,data/txt/17076.txt,poi,spd
1929362,76,17,0,,,,422,"Es gibt in der Lebensmittelbranche einige Dinge, die im buchstäblichen Sinne über den guten Geschmack hinausgehen. Ich verweise auf den Analogkäse, der mit Käse nichts zu tun hat. Es gibt den Klebeschinken, der kein richtiger Schinken ist. Außerdem gibt es Hühnersuppe, die auch nicht im Entferntesten etwas mit Hühnern zu tun hat. Wir müssen dem Verbraucher ermöglichen, dass er sich bei solchen Fragestellungen, die nach Recht und Gesetz nicht zu beanstanden sind - oft ist das Kleingedruckte entscheidend -, an ein Portal wenden kann, um Aufklärung zu erhalten. Dieses Portal wird keine Prangerfunktion haben, sondern letztlich hoffentlich dazu dienen, dass wir das Deutsche Lebensmittelbuch verbessern.",data/txt/17076.txt,speech,
1929363,76,17,0,Ulrich Kelber [SPD],Ulrich Kelber [SPD],ulrich-kelber-spd,423,"Deine Fraktionskollegen verkneifen sich ein Lachen, weil sie deine Position kennen! Das ist unglaublich!",data/txt/17076.txt,poi,spd
1929364,76,17,0,,,,424,"Herr Kelber, wir haben das Verbraucherinformationsgesetz",data/txt/17076.txt,speech,
1929365,76,17,0,Waltraud Wolff [Wolmirstedt] [SPD],Waltraud Wolff [Wolmirstedt] [SPD],waltraud-wolff-wolmirstedt-spd,425,"Ist deine Erfindung, wir wissen das alle!",data/txt/17076.txt,poi,spd
1929366,76,17,0,,,,426,"nach fünf Jahren endlich durchgebracht. Wir werden es jetzt verbessern. Wir denken darüber nach - die ersten Entscheidungen sind schon getroffen -, bestandskräftige Ermittlungen oder Feststellungen bei Gesetzesverstößen gleich ins Netz zu stellen. Wer Fragen hat, kann sich gleich im Internet informieren.",data/txt/17076.txt,speech,
1929367,76,17,0,Ulrich Kelber [SPD],Ulrich Kelber [SPD],ulrich-kelber-spd,427,Das hat bisher doch auch Peter Bleser persönlich verhindert!,data/txt/17076.txt,poi,spd
1929368,76,17,0,,,,428,"Das sind Verbesserungen, die ebenfalls zu einer Erleichterung führen werden.

Ich möchte noch den Teil Ernährung ansprechen. Die Ernährung ist mittlerweile zu einem großen Problem in der Welt geworden; der Hunger nimmt nicht ab, er nimmt zu. Wir haben zwei Delegationsreisen durchgeführt. Die Kollegen Max Lehmer, Röring und Holzenkamp waren mit in Äthiopien. Wir waren letzte Woche mit der Frau Ministerin in Indien. Die Frage der Welternährung wird eine zentrale Zukunftsfrage sein. Wenn wir dieses Problem nicht lösen, werden wir über alle anderen Bereiche nicht sprechen müssen.

Aufgrund der Bevölkerungsentwicklung müssen bis 2050 70 Prozent der Nahrungsmittel erzeugt werden. Da sind die Bedarfe für Energie, für Rohstoffe für die Industrie noch nicht eingerechnet. Ohne Effizienzsteigerungen wird es in diesem Bereich nicht gehen.",data/txt/17076.txt,speech,
1929369,76,17,0,Georg Schirmbeck [CDU/CSU],Georg Schirmbeck [CDU/CSU],georg-schirmbeck-cdu-csu,429,So ist es!,data/txt/17076.txt,poi,cducsu
1929370,76,17,0,,,,430,"Wir müssen alles daransetzen, unser gesamtes wissenschaftliches Know-how und unsere fähigsten Köpfe zu mobilisieren, um dieses Problem anzugehen. Das ist eine Aufgabe, die auch wir, die Abgeordneten des deutschen Parlaments, bewältigen müssen. Deswegen werden wir - das ist mit der Koalition abgesprochen, Herr Kollege Goldmann und Frau Happach-Kasan - im Frühjahr eine Anhörung zum Thema Welternährung durchführen. Das bietet uns die Gelegenheit, einmal darüber zu diskutieren, ob die europäische Agrarpolitik in der von der Kommission gewünschten neuen Ausrichtung richtig ist.

Präsident Dr. Norbert Lammert:

Herr Kollege.

Peter Bleser (CDU/CSU):

Ich kann da nur eines sagen - das muss ich ablesen; da will ich sehr präzise sein - -

Präsident Dr. Norbert Lammert:

Ja, wenn es bei dem einen bleibt, wäre das gerade noch im Toleranzbereich.

Peter Bleser (CDU/CSU):

Herr Präsident, ich habe noch 26 Sekunden Redezeit. - Wenn die Kommission bei ihrer These bleibt und in der ersten Säule ein sogenanntes Screening einführt - das heißt, Produktionsreduzierung ist erwünscht -, dann betreibt sie eine Politik, die die Subventionierung des Hungers in der Welt zur Folge hat.",data/txt/17076.txt,speech,
1929371,76,17,0,Cornelia Behm [BÜNDNIS 90/DIE GRÜNEN],Cornelia Behm [BÜNDNIS 90/DIE GRÜNEN],cornelia-behm-bundnis-90-die-grunen,431,"So ein Unsinn! Peter, du hast es immer noch nicht verstanden!",data/txt/17076.txt,poi,gruene
1929372,76,17,0,,,,432,"Das dürfen wir nicht durchgehen lassen. Ich fasse zusammen: Wir lehnen die Neuausrichtung in der jetzigen Form ab.

Ich will zum Schluss noch einmal unsere Grundsätze nennen.

Präsident Dr. Norbert Lammert:

Nein, nein!

Peter Bleser (CDU/CSU):

Wir wollen - Herr Präsident - mehr Menschen in der Agrarwirtschaft halten.

Präsident Dr. Norbert Lammert:

Wer das beim ersten Vortrag nicht begriffen hat, möge das im Protokoll nachlesen.

Peter Bleser (CDU/CSU):

Wir möchten, dass unsere Natur nachhaltig bewirtschaftet wird. Dies haben wir in diesem Haushalt in Zahlen gegossen.

Herzlichen Dank.",data/txt/17076.txt,speech,
1929373,76,17,0,,,,433,Beifall bei der CDU/CSU und der FDP,data/txt/17076.txt,poi,
1929374,76,17,0,,,,434,"Präsident Dr. Norbert Lammert:

Das Wort erhält jetzt die Kollegin Waltraud Wolff für die SPD-Fraktion.",data/txt/17076.txt,speech,
1929375,76,17,0,,,,435,Beifall bei der SPD,data/txt/17076.txt,poi,
1929376,76,17,0,,,,436,"Waltraud Wolff (Wolmirstedt) (SPD):

Sehr geehrter Herr Präsident! Liebe Kolleginnen und Kollegen! Liebe Zuschauerinnen und Zuhörer! Die Märchenstunde des Peter B. ist vorbei;",data/txt/17076.txt,speech,
1929377,76,17,0,Georg Schirmbeck [CDU/CSU],Georg Schirmbeck [CDU/CSU],georg-schirmbeck-cdu-csu,437,Das hat eben schon einer gesagt! Das müssen Sie nicht wiederholen!,data/txt/17076.txt,poi,cducsu
1929378,76,17,0,Weiterer Zuruf von der CDU/ CSU,von der CDU/ CSU,von-der-cdu-csu,438,Schneewittchen sind Sie jedenfalls nicht!,data/txt/17076.txt,poi,cducsu
1929379,76,17,0,,,,439,"wir wenden uns wieder dem Haushalt zu.

Es ist noch kein Jahr her, dass Sie, Frau Ministerin, in der ersten Lesung zum Haushalt 2010 die Gemeinschaftsaufgabe ""Verbesserung der Agrarstruktur und des Küstenschutzes"" in den höchsten Tönen gelobt haben:

Es handelt sich um gut eingesetztes Geld, es fließt in den ländlichen Raum ...

Der agrarpolitische Sprecher der CDU/CSU-Fraktion, Kollege Bleser - er hat hier gerade gesprochen -, hat die Aufstockung der Mittel für die GAK in einer Pressemitteilung als Teil der verlässlichen Agrarpolitik von Union und FDP bezeichnet. Damals wurden die Mittel für die GAK aufgestockt, heute wird gekürzt. Das heißt, mit dem vorliegenden Haushalt wird deutlich: Alles Sonntagsreden, alles, wie es gerade passt.",data/txt/17076.txt,speech,
1929380,76,17,0,,,,440,Beifall bei der SPD sowie der Abg. Cornelia Behm [BÜNDNIS 90/DIE GRÜNEN],data/txt/17076.txt,poi,
1929381,76,17,0,Georg Schirmbeck [CDU/CSU],Georg Schirmbeck [CDU/CSU],georg-schirmbeck-cdu-csu,441,"Frau Kollegin, Sie waren wohl lange im Ausland! Von der Wirtschaftskrise haben Sie nichts gehört!",data/txt/17076.txt,poi,cducsu
1929382,76,17,0,,,,442,"Fakt ist: Die Mittel für die Gemeinschaftsaufgabe ""Verbesserung der Agrarstruktur und des Küstenschutzes"" werden gekürzt. Die ländlichen Räume stehen bei dieser Koalition auf dem Abstellgleis. Das ist die Verlässlichkeit, die die Landwirte und der ländliche Raum haben. Die GAK scheint zum Pingpongball des Agrarhaushalts zu werden, heute so und morgen anders.

Frau Aigner, Sie haben bei der Einbringung des Haushaltes 2011 von der Herausforderung gesprochen, die Maßnahmen der GAK zu überdenken und ihre Prioritäten neu zu setzen, in Richtung einer nachhaltigen Bewirtschaftung, einer wettbewerbsfähigen Landwirtschaft und einer Schaffung von Arbeitsplätzen im ländlichen Raum. Sie haben gesagt:

Das Prinzip der Nachhaltigkeit kommt ... aus der Forstwirtschaft. Deshalb ist es auch nicht verwunderlich, dass gerade mein Haus das nachhaltige Regierungshandeln ganz extrem unterstützt.

Dieser Haushalt spricht doch wohl eine ganz andere Sprache: Sie streichen und kürzen all das, was nachhaltig ist.",data/txt/17076.txt,speech,
1929383,76,17,0,,,,443,Beifall bei der SPD,data/txt/17076.txt,poi,
1929384,76,17,0,,,,444,"Das Bundesprogramm ""Ökolandbau"" ist schon angesprochen worden. Warum müssen Sie sich das heute öfter anhören? Ganz einfach: weil es sinnbildlich für die schwarz-gelbe Agrarpolitik steht.",data/txt/17076.txt,speech,
1929385,76,17,0,,,,445,Beifall bei der SPD und dem BÜNDNIS 90/ DIE GRÜNEN,data/txt/17076.txt,poi,
1929386,76,17,0,,,,446,"Nicht alle Landwirte können Biobauern werden; das wissen wir. Aber wir wissen auch: Die Landwirtschaft wird nachhaltiger produzieren müssen. Wenn Sie nun die Mittel für das Bundesprogramm ""Ökolandbau"" kürzen - wir haben darüber gesprochen -, muss man einmal konstatieren: Der Ökolandbau hat in der Vergangenheit doch eindeutig bewiesen, dass anderes Wirtschaften möglich ist und sogar erfolgreich sein kann. Das wollen Sie von der Koalition einfach nicht wahrhaben; darum ist der Ökolandbau Ihnen ein Dorn im Auge. Das ist doch die Wahrheit.",data/txt/17076.txt,speech,
1929387,76,17,0,,,,447,Beifall bei der SPD,data/txt/17076.txt,poi,
1929388,76,17,0,Hans-Michael Goldmann [FDP],Hans-Michael Goldmann [FDP],hans-michael-goldmann-fdp,448,So ein Blödsinn!,data/txt/17076.txt,poi,fdp
1929389,76,17,0,,,,449,"Es ist aber nicht nur der Ökolandbau. Vorgestern hat Frau Merkel an dieser Stelle den Grünen vorgehalten, ""ziemlich fest mit dem Wort dagegen' verbandelt"" zu sein. Vielleicht hätte sich die Bundeskanzlerin einmal in die Arbeitsgruppen von FDP und Union setzen und zuhören sollen; denn da war alles gegen den Ökolandbau,",data/txt/17076.txt,speech,
1929390,76,17,0,Peter Bleser [CDU/CSU],Peter Bleser [CDU/CSU],peter-bleser-cdu-csu,450,Falsche Behauptung!,data/txt/17076.txt,poi,cducsu
1929391,76,17,0,,,,451,"gegen eine nachhaltigere europäische Agrarpolitik, gegen mehr Klimaschutz in der Landwirtschaft, gegen mehr Tierschutz durch einen Tierschutz-TÜV, gegen die Interessen der Verbraucherinnen und Verbraucher bei der Grünen Gentechnik.",data/txt/17076.txt,speech,
1929392,76,17,0,Hans-Michael Goldmann [FDP],Hans-Michael Goldmann [FDP],hans-michael-goldmann-fdp,452,Wo war das?,data/txt/17076.txt,poi,fdp
1929393,76,17,0,,,,453,"Weil die Kanzlerin von der Adventszeit gesprochen hat, gegen die die Grünen sein sollen, muss ich der Wahrheit halber hinzufügen, dass die Union und die FDP dagegen sind, das Spielzeug, das Weihnachten unter dem Christbaum liegt, für unsere Kinder sicherer zu machen. Vielen herzlichen Dank im Namen aller deutschen Kinder!",data/txt/17076.txt,speech,
1929394,76,17,0,,,,454,Beifall bei der SPD sowie bei Abgeordneten der LINKEN und des BÜNDNISSES 90/DIE GRÜNEN,data/txt/17076.txt,poi,
1929395,76,17,0,Georg Schirmbeck [CDU/CSU],Georg Schirmbeck [CDU/CSU],georg-schirmbeck-cdu-csu,455,Das ist unglaublich!,data/txt/17076.txt,poi,cducsu
1929396,76,17,0,Johannes Singhammer [CDU/CSU],Johannes Singhammer [CDU/CSU],johannes-singhammer-cdu-csu,456,Das Gegenteil ist richtig!,data/txt/17076.txt,poi,cducsu
1929397,76,17,0,Gegenruf der Abg. Dr. Kirsten Tackmann [DIE LINKE],Dr. Kirsten Tackmann [DIE LINKE],kirsten-tackmann-die-linke,457,Die Wahrheit tut weh!,data/txt/17076.txt,poi,linke
1929398,76,17,0,,,,458,"Meine Damen und Herren, ich kritisiere hier nicht nur. Wir als SPD haben gute Vorschläge gemacht. Wir haben Sie aufgefordert, das Bundesprogramm ""Ökologischer Landbau"" aufzustocken. Wir haben sogar vorgeschlagen, zusätzlich ein Bundesprogramm zur Förderung der nachhaltigen Landwirtschaft aufzulegen. Das wäre klug gewesen. Wir haben Sie auch aufgefordert, die drastischen Kürzungen bei der Gemeinschaftsaufgabe zurückzunehmen. Alles ist abgelehnt worden.",data/txt/17076.txt,speech,
1929399,76,17,0,Georg Schirmbeck [CDU/CSU],Georg Schirmbeck [CDU/CSU],georg-schirmbeck-cdu-csu,459,Aber Schulden machen für die Kinder mit dem Spielzeug!,data/txt/17076.txt,poi,cducsu
1929400,76,17,0,,,,460,"Frau Aigner hat von der Aufgabe gesprochen, die Prioritäten für die Gemeinschaftsaufgabe neu zu setzen. Ich frage mich: Wo sind denn die Vorschläge? Es gibt sie einfach nicht.

Präsident Dr. Norbert Lammert:

Frau Kollegin, gestatten Sie eine Zwischenfrage des Kollegen Goldmann?

Waltraud Wolff (Wolmirstedt) (SPD):

Ja, gerne. - Bitte schön.

Hans-Michael Goldmann (FDP):

Frau Kollegin Wolff, ich musste das erst einmal einen Moment verdauen. Deswegen melde ich mich erst jetzt. - Mein Sohn und seine Frau haben uns einen kleinen Bubi geschenkt. Er ist zwei Jahre alt. Eigentlich gebe ich mir Mühe, dem Kind gerecht zu werden.

Sie haben vorhin gesagt, dass ich mit Verantwortung dafür trage, dass wir nach wie vor Kinderspielzeug auf dem Markt haben, das diesem Kind möglicherweise Schaden zufügt.",data/txt/17076.txt,speech,
1929401,76,17,0,Waltraud Wolff [Wolmirstedt] [SPD],Waltraud Wolff [Wolmirstedt] [SPD],waltraud-wolff-wolmirstedt-spd,461,Aber sicher!,data/txt/17076.txt,poi,spd
1929402,76,17,0,,,,462,"- Langsam, Frau Wolff. Ein bisschen vorsichtig! - Sind Sie nicht auch der Meinung, dass wir hier, im Plenum, einen Antrag verabschiedet haben, in dem wir uns ganz entschieden dagegen wenden, dass Kinderspielzeug, das die Kinder natürlich auch in den Mund nehmen, den Kindern schadet? Erinnern Sie sich vielleicht daran, dass wir uns fraktionsübergreifend im Ausschuss darum bemüht haben, auf europäischer Ebene eine Regelung zu erwirken, die in besonderer Weise dazu beiträgt, dass Kinderspielzeug in der Europäischen Gemeinschaft besser geschützt wird, als das bis jetzt der Fall ist? Würden Sie daher nicht doch sagen, dass die von Ihnen eben benutzte Formulierung eine wirkliche Beleidigung eines jeden in Sachen Kinderspielzeug verantwortlich handelnden Politikers ist?",data/txt/17076.txt,speech,
1929403,76,17,0,,,,463,Beifall bei der CDU/CSU und der FDP,data/txt/17076.txt,poi,
