id,sitzung,wahlperiode,in_writing,speaker,speaker_cleaned,speaker_fp,sequence,text,filename,type,speaker_party
1959447,96,17,0,,,,762,"Dabei kommt die Frage auf: Wo bleiben denn die Anträge in der 14. und 15. Wahlperiode? Da haben Sie regiert; da hätten Sie die Mehrheit gehabt, um das ""Übel"" - aus Ihrer Sicht - zu beseitigen.",data/txt/17096.txt,speech,
1959448,96,17,0,Volker Beck [Köln] [BÜNDNIS 90/DIE GRÜNEN],Volker Beck [Köln] [BÜNDNIS 90/DIE GRÜNEN],volker-beck-koln-bundnis-90-die-grunen,763,Das Verfassungsgerichtsurteil ist von 2008! Seitdem gibt es den Auftrag an den Gesetzgeber!,data/txt/17096.txt,poi,gruene
1959449,96,17,0,,,,764,Sie haben die Möglichkeit nicht genutzt. Man muss also ganz sachlich und neutral festhalten: Das Thema war Ihnen jedenfalls zu jener Zeit nicht ganz so wichtig.,data/txt/17096.txt,speech,
1959450,96,17,0,,,,765,Beifall bei der CDU/CSU und der FDP,data/txt/17096.txt,poi,
1959451,96,17,0,,,,766,"Ich habe grundsätzlich Verständnis dafür, dass Sie dieses Anliegen heute im Deutschen Bundestag vortragen. In der Tat: Die Frist drängt; sie läuft Mitte des Jahres aus.",data/txt/17096.txt,speech,
1959452,96,17,0,Wolfgang Wieland [BÜNDNIS 90/DIE GRÜNEN],Wolfgang Wieland [BÜNDNIS 90/DIE GRÜNEN],wolfgang-wieland-bundnis-90-die-grunen,767,"Wir haben darauf gewartet, dass Sie etwas vorlegen!",data/txt/17096.txt,poi,gruene
1959453,96,17,0,,,,768,"Wir können uns jetzt natürlich gegenseitig mangelnden Fleiß oder mangelnden Willen bei der Lösung des Problems vorwerfen. Aber ich glaube, wir müssen bei einer ehrlichen Betrachtung der Sache zugeben, dass das nicht den Kern der Sache trifft. Das Problem ist hochkomplex, und wer das nicht einsieht, zeigt, dass er sich mit der Sache nicht hinreichend befasst hat.",data/txt/17096.txt,speech,
1959454,96,17,0,Hans-Christian Ströbele [BÜNDNIS 90/DIE GRÜNEN],Hans-Christian Ströbele [BÜNDNIS 90/DIE GRÜNEN],hans-christian-strobele-bundnis-90-die-grunen,769,Wir haben dauernd etwas vorgelegt!,data/txt/17096.txt,poi,gruene
1959455,96,17,0,,,,770,"2008 hat die große Mehrheit des Deutschen Bundestages, einschließlich der Kollegen der SPD, das geltende Wahlrecht inklusive des negativen Stimmgewichts in Karlsruhe verteidigt. Wir wussten genau, dass dieses negative Stimmgewicht kein Betriebsunfall, kein Schönheitsfehler des Wahlrechts ist, sondern die unmittelbare, fast logische Konsequenz der besonderen Verknüpfung von Direktwahl und Listenwahl in unserem Wahlrecht. Man kann ein anderes Wahlrecht wollen. Man kann ein Mehrheitswahlrecht oder ein reines Verhältniswahlrecht wollen. Dann würde dieses Problem nicht auftauchen. Ich glaube aber, dass diese Verknüpfung richtig ist - ich denke, darüber sind wir uns im Grundsatz einig -, auch wenn sie systembedingt in Einzelfällen zu einem negativen Stimmgewicht führt.

Am Beginn dieser Wahlperiode haben wir uns mit einigen Kollegen - die Kollegen Ruppert, Uhl und andere waren dabei - intensiv Gedanken darüber gemacht, welche Lösungen es gibt. Die Sache ist komplex und kompliziert.",data/txt/17096.txt,speech,
1959456,96,17,0,Wolfgang Wieland [BÜNDNIS 90/DIE GRÜNEN],Wolfgang Wieland [BÜNDNIS 90/DIE GRÜNEN],wolfgang-wieland-bundnis-90-die-grunen,771,"Lange gebrütet, aber kein Ei gelegt!",data/txt/17096.txt,poi,gruene
1959457,96,17,0,Gegenruf des Abg. Dr. Hans-Peter Uhl [CDU/ CSU],Dr. Hans-Peter Uhl [CDU/ CSU],hans-peter-uhl-cdu-csu,772,Noch nicht!,data/txt/17096.txt,poi,cducsu
1959458,96,17,0,,,,773,"Wir haben festgestellt, dass die meisten Lösungen, die angeboten werden, entweder noch schlimmere Folgen haben - das gilt auch für Ihren Vorschlag; darauf komme ich gleich noch zu sprechen - oder das negative Stimmgewicht gar nicht oder nur zu einem geringen Teil beseitigen.

Hätte es eines Beweises bedurft, dass die Sache schwierig und nicht einfach zu lösen ist, so haben Sie diesen Beweis, Herr Kollege Beck, mit diesem wirklich sehr dürftigen Gesetzentwurf erbracht.",data/txt/17096.txt,speech,
1959459,96,17,0,Dr. Stefan Ruppert [FDP],Dr. Stefan Ruppert [FDP],stefan-ruppert-fdp,774,Ärmlich!,data/txt/17096.txt,poi,fdp
1959460,96,17,0,Wolfgang Wieland [BÜNDNIS 90/DIE GRÜNEN],Wolfgang Wieland [BÜNDNIS 90/DIE GRÜNEN],wolfgang-wieland-bundnis-90-die-grunen,775,"Selber nichts vorlegen, aber 19 Minu-ten unseren madig machen!",data/txt/17096.txt,poi,gruene
1959461,96,17,0,,,,776,"Ihr Gesetzentwurf lässt - das ist mein erster Kritikpunkt - jegliche Auseinandersetzung mit alternativen Lösungsansätzen vermissen. Wenn der Gesetzgeber, gerade wenn es um die eigene Sache geht, zwischen gänzlich verschiedenen Lösungen auswählen muss, dann ist es auch im Licht der aktuellen Rechtsprechung des Bundesverfassungsgerichts in Karlsruhe geboten, dass er dabei ein Mindestmaß an Rationalität und Transparenz erkennen lässt. Genau das fehlt aber bei Ihrem Gesetzentwurf. Sie haben auf etwa einer halben Seite eine dünne Analyse - das ist eher eine Nacherzählung - des Urteils des Bundesverfassungsgerichts in Karlsruhe vorgenommen.

Es gibt keine Auseinandersetzung mit Alternativen. Insbesondere fehlt eine Auseinandersetzung mit einer Alternative, die sich geradezu aufdrängt, wenn man danach fragt, welches die Ursache für das negative Stimmgewicht ist. Die Ursache haben Sie gar nicht angesprochen. Die Ursache ist die Verknüpfung der Landeslisten, die Reststimmenverwertung. Es ist doch naheliegend, sich damit auseinanderzusetzen. Wenn das Problem die Verbindung der Landeslisten ist, könnte die Trennung der Landeslisten doch die Lösung sein. Es ist immer gut, wenn die Lösung etwas mit dem Problem zu tun hat. Das gilt nicht nur, aber insbesondere in diesem Fall.",data/txt/17096.txt,speech,
1959462,96,17,0,,,,777,Beifall bei der CDU/CSU sowie des Abg. Dr. Stefan Ruppert [FDP],data/txt/17096.txt,poi,
1959463,96,17,0,,,,778,"Dieses Modell ist immerhin in den ersten beiden Bundestagswahlen erfolgreich angewendet worden. Insofern hätte man sich damit zumindest auseinandersetzen müssen. Mehr verlange ich von Ihnen gar nicht. Ich glaube, das ist nicht zu viel verlangt.

Ihr Gesetzentwurf - diesen Vorwurf kann ich Ihnen leider nicht ersparen - ist auch handwerklich miserabel.",data/txt/17096.txt,speech,
1959464,96,17,0,Dr. Stefan Ruppert [FDP],Dr. Stefan Ruppert [FDP],stefan-ruppert-fdp,779,Armselig!,data/txt/17096.txt,poi,fdp
1959465,96,17,0,,,,780,"Ich will aus der Begründung zitieren: ""Alternativ wäre die Fraktion"", also Sie, ""gesprächsbereit"", auch eine andere ""Lösung zu unterstützen"". Das können Sie in einem Brief oder einer E-Mail an mich schreiben. Das können Sie auch in einem Telefonat mit mir sagen. Das steht aber in einem Dokument,",data/txt/17096.txt,speech,
1959466,96,17,0,Dr. Stefan Ruppert [FDP],Dr. Stefan Ruppert [FDP],stefan-ruppert-fdp,781,Gesetz!,data/txt/17096.txt,poi,fdp
1959467,96,17,0,,,,782,"das aus Ihrer Sicht die amtliche Begründung eines Gesetzes der Bundesrepublik Deutschland werden soll. Wir machen uns doch lächerlich, wenn wir so etwas in diesem Hause zur Gesetzesbegründung erheben.",data/txt/17096.txt,speech,
1959468,96,17,0,,,,783,Beifall bei der FDP sowie bei Abgeordneten der CDU/CSU,data/txt/17096.txt,poi,
1959469,96,17,0,,,,784,"Da Sie zu diesem Thema schon öfter etwas vorgelegt haben, wäre es gut, wenn Sie die Sache das nächste Mal einem Juristen überlassen oder einen Juristen zumindest einmal drübergucken lassen - Sie haben in Ihrer Fraktion ja kompetente Kollegen -, bevor wir uns hier damit befassen.",data/txt/17096.txt,speech,
1959470,96,17,0,Dr. Konstantin von Notz [BÜNDNIS 90/DIE GRÜNEN],Dr. Konstantin von Notz [BÜNDNIS 90/DIE GRÜNEN],konstantin-notz-bundnis-90-die-grunen,785,Herr Krings!,data/txt/17096.txt,poi,gruene
1959471,96,17,0,,,,786,"Ich komme zum dritten, vielleicht entscheidenden Kritikpunkt. Das, was Sie in diesem Gesetzentwurf vorschlagen, ist unter regionalen und föderalen Gesichtspunkten in hohem Maße ungerecht und unfair. Ihr Vorschlag basiert im Kern darauf, dass Überhangmandate, die in einem Bundesland entstehen, in einem anderen Bundesland kompensiert werden. Für Überhangmandate sollen in einem anderen Bundesland Listenmandate weggenommen werden. Abgeordneten, die nach dem Wahlergebnis eines Bundeslandes bereits gewählt sind, soll das Mandat also entzogen werden, um Überhangmandate zu kompensieren. Schon heute sind - das ist richtig - die Länder, in denen es relativ viele Überhangmandate gibt, in föderaler Hinsicht im Vorteil; denn sie haben aufgrund der Überhangmandate auf Bundesebene ein größeres politisches Gewicht. Was wäre die Folge Ihres Vorschlages? Dieses Problem würde verschärft.

Die Länder, in denen üblicherweise keine Überhangmandate anfallen, hätten dadurch einen Nachteil. Ich komme aus einem solchen Bundesland. Nordrhein-Westfalen hatte noch nie ein Überhangmandat. Wir haben ein ausgewogenes Verhältnis von Erst- und Zweitstimmen. Hier gibt es Hochburgen beider großen Parteien. Wir sind bereits tendenziell im Nachteil, weil wir nie Überhangmandate bekommen können. Das kann man als Teil dieses Wahlsystems akzeptieren. Aber wir wären dann doppelt im Nachteil, weil wir zusätzlich quasi als Steinbruch für andere Bundesländer mit Überhangmandaten herhalten müssten. Diese föderale Ungerechtigkeit taucht in Ihrer Begründung nicht einmal auf. Sie ist meines Erachtens der Hauptkritikpunkt und das Hauptproblem bei Ihrem Vorschlag. Ich frage mich auch, ob es wirklich demokratisch und föderal fair wäre, wenn beispielsweise ein sächsisches Überhangmandat dazu führte, dass ein bereits in Nordrhein-Westfalen oder im kleinen Saarland gewählter Abgeordneter sein Mandat verlieren müsste.

Wenn man das ganz nüchtern auf die letzte Bundestagswahl anwendet, sieht man: Das führt zu grotesken Ergebnissen. In Brandenburg hat knapp ein Viertel der Wähler bei der letzten Bundestagswahl der CDU das Vertrauen ausgesprochen. Nach Ihrer Lösung würde nur ein einziger Abgeordneter für Brandenburg im Deutschen Bundestag sitzen. Das hätte bedeutet, dass etwa 330 000 CDU-Wähler in Brandenburg",data/txt/17096.txt,speech,
1959472,96,17,0,Dr. Stefan Ruppert [FDP],Dr. Stefan Ruppert [FDP],stefan-ruppert-fdp,787,342 000!,data/txt/17096.txt,poi,fdp
1959473,96,17,0,,,,788,von einem einzigen Abgeordneten im Deutschen Bundestag vertreten würden. Im Durchschnitt vertritt in der Republik ein Abgeordneter etwa 65 000 Wähler. Dieses eklatante Missverhältnis ist wirklich nicht mehr begründbar und nicht mehr darstellbar.,data/txt/17096.txt,speech,
1959474,96,17,0,,,,789,Beifall bei der CDU/CSU und der FDP,data/txt/17096.txt,poi,
1959475,96,17,0,,,,790,"Man kann das weiter durchspielen. Bei realistischen Szenarien sind durchaus Extremfälle denkbar, zum Beispiel dass ein Land knapp die Hälfte der ihm zustehenden Mandate verliert, dass es statt der üblichen 20 Mandate nur noch 11, 12 oder 13 Mandate hat. Das ist eine eklatante Benachteiligung von bestimmten Bundesländern. Es ist nicht zu akzeptieren, dass ein Drittel oder ein Viertel der Menschen in einem Bundesland eine Partei wählt, diese Partei dann aber ohne ein Mandat ausgeht. In Brandenburg hätte nur ein Wahlkreis verloren werden müssen, und dann wären die 330 000 CDU-Wähler ohne jegliche Vertretung im Deutschen Bundestag gewesen. Das ist das Gegenteil von Demokratie, und das ist nicht akzeptabel.",data/txt/17096.txt,speech,
1959476,96,17,0,,,,791,Beifall bei der CDU/CSU und der FDP,data/txt/17096.txt,poi,
1959477,96,17,0,,,,792,"Vizepräsident Dr. Hermann Otto Solms:

Herr Kollege Krings, erlauben Sie eine Zwischenfrage des Kollegen Beck?

Dr. Günter Krings (CDU/CSU):

Ich habe ausreichend Redezeit; die brauche ich nicht zu verlängern.

Vizepräsident Dr. Hermann Otto Solms:

Die Redezeit wird angehalten.

Dr. Günter Krings (CDU/CSU):

Das ist ein ganz reizendes Angebot. Aber das ist nicht notwendig. Vielen Dank.",data/txt/17096.txt,speech,
1959478,96,17,0,Volker Beck [Köln] [BÜNDNIS 90/DIE GRÜNEN],Volker Beck [Köln] [BÜNDNIS 90/DIE GRÜNEN],volker-beck-koln-bundnis-90-die-grunen,793,Sie wollen sich also jetzt zu Ihren Vorschlägen äußern!,data/txt/17096.txt,poi,gruene
1959479,96,17,0,,,,794,"Meine Damen und Herren von den Grünen, Ihr Vorschlag ist - das wird vielleicht noch deutlicher, wenn Sie es im Zusammenhang hören - ein besonderes Beispiel für Willkür. Wenn hier Preise für Willkür und für mangelnde demokratische Reife eines Vorschlags",data/txt/17096.txt,speech,
1959480,96,17,0,,,,795,Lachen des Abg. Wolfgang Wieland [BÜNDNIS 90/DIE GRÜNEN],data/txt/17096.txt,poi,
1959481,96,17,0,Dr. Dieter Wiefelspütz [SPD],Dr. Dieter Wiefelspütz [SPD],dieter-wiefelsputz-spd,796,Machen Sie mal einen Vorschlag!,data/txt/17096.txt,poi,spd
1959482,96,17,0,,,,797,"zu verteilen gewesen wären, hätten Sie beide Preise spielend abgeräumt.

Interessant ist auch, dass Ihnen die wissenschaftlichen Unterstützer Ihres Vorschlags so langsam, aber sicher ausgehen. Es gab in der letzten Wahlperiode bei Ihnen eine Anhörung mit dem Mathematiker Pukelsheim, der versucht hat, Ihnen da ein wenig auf die Sprünge zu helfen. Er hat sich inzwischen offenbar von Ihrem Gesetzentwurf distanziert. Sie zitieren ihn auch gar nicht mehr. Er hat offenbar andere Präferenzen und hat erkannt, dass es eine föderale Unwucht in ihrem Vorschlag gibt.",data/txt/17096.txt,speech,
1959483,96,17,0,Dr. Dieter Wiefelspütz [SPD],Dr. Dieter Wiefelspütz [SPD],dieter-wiefelsputz-spd,798,Der redet nur noch mit euch!,data/txt/17096.txt,poi,spd
1959484,96,17,0,Volker Beck [Köln] [BÜNDNIS 90/DIE GRÜNEN],Volker Beck [Köln] [BÜNDNIS 90/DIE GRÜNEN],volker-beck-koln-bundnis-90-die-grunen,799,Wo ist Ihr Vorschlag?,data/txt/17096.txt,poi,gruene
1959485,96,17,0,,,,800,"Ich freue mich daher, dass die Einwände gegen diese föderale Ungerechtigkeit, die in der letzten Wahlperiode nur ich hier im Deutschen Bundestag kritisiert habe, zumindest in der Wissenschaft auf fruchtbaren Boden gefallen sind. Die Lernkurve bei den Grünen ist wieder einmal etwas ungünstiger.",data/txt/17096.txt,speech,
1959486,96,17,0,Wolfgang Wieland [BÜNDNIS 90/DIE GRÜNEN],Wolfgang Wieland [BÜNDNIS 90/DIE GRÜNEN],wolfgang-wieland-bundnis-90-die-grunen,801,Professor Meyer hat uns unterstützt! Der Verfassungsrichter Simon hat uns unterstützt! Viele!,data/txt/17096.txt,poi,gruene
1959487,96,17,0,,,,802,"Meine Damen und Herren, vollends lächerlich - jetzt wird es ganz bitter für Sie - und absurd ist § 7 Abs. 6 Ihres Gesetzentwurfs. Wenn ich darf, zitiere ich:

Erzielt eine Partei bei der Zuteilung mehr Direktmandate, als ihr Sitze nach Absatz 5 zustehen, so werden die überzähligen Wahlkreissitze der Kandidaten dieser Partei mit dem geringsten prozentualen Stimmenanteil nicht besetzt; ...

Ich will der Mehrheit Ihrer Fraktion zugutehalten, dass sie diese Vorschrift vielleicht nicht gelesen hat, dass sie der eine oder andere vielleicht auch nicht verstanden hat. Das mag sein - es ist eine komplizierte Materie -, aber ich möchte gern Ihre Fraktionskollegen bösgläubig machen. Das ist der erste Vorschlag in der Geschichte des Wahlrechts der Bundesrepublik Deutschland - man könnte auch bis zu den Reichstagswahlen zurückgehen -, nach dem einem in einem Wahlkreis direkt gewählten Abgeordneten sein Mandat verweigert wird. Was daran demokratisch sein soll, möchte ich einmal wissen. Jedenfalls ist es Gift für die demokratische Akzeptanz und für das Vertrauen der Menschen in die Integrität des Wahlvorgangs. Diese hanebüchene Regelung kann durchaus - ich habe zuerst gar nicht glauben wollen, dass man so etwas ernsthaft vorschlägt; ich habe es dreimal lesen müssen - dazu beizutragen, dass das Vertrauen der Menschen in den Wahlvorgang abnimmt. Ich glaube kaum, dass jemand, der als Wähler Opfer Ihrer Regelung geworden ist, dann noch freudig zur nächsten Bundestagswahl geht. Ihr Vorschlag ist nichts anderes als ein großes Programm zur Reduzierung der Wahlbeteiligung in unserem Land.

Das ist natürlich auch für einen Kandidaten misslich. Er hat einen spannenden Wahlkampf geführt - es kommt ja gerade in den Wahlkreisen zum Tragen, wo es zwischen zwei oder drei großen Parteien knapp wird -, er hat, vielleicht knapp, gesiegt, und dann zieht er nicht in den Bundestag ein. Diese Perspektive des Kandidaten halte ich aber für gar nicht so wichtig. Ich betrachte das mehr aus der Perspektive des Wählers - Sie würden sagen: der Wählerinnen und Wähler - in einem Wahlkreis.",data/txt/17096.txt,speech,
1959488,96,17,0,Wolfgang Wieland [BÜNDNIS 90/DIE GRÜNEN],Wolfgang Wieland [BÜNDNIS 90/DIE GRÜNEN],wolfgang-wieland-bundnis-90-die-grunen,803,Aha! Wieder etwas gelernt!,data/txt/17096.txt,poi,gruene
1959489,96,17,0,,,,804,"Es könnte zu folgendem Fall kommen: In einem Wahlkreis hat sich die Mehrheit für einen bestimmten Kandidaten entschieden, und dann müssen die Wähler am nächsten Tag in der Zeitung lesen, dass der Kandi-dat, der ihre Interessen in Berlin vertreten soll, nicht in den Bundestag einrücken kann, weil irgendwo 500 Kilo-meter weiter weg so viele Überhangmandate angefallen sind, dass sein Mandat sozusagen als Kompensationsmasse, als Steinbruch benutzt wird. Das hätte zwei mögliche Folgen.

Folge eins: Der Kandidat, der gewählt worden ist, kommt nicht in den Bundestag, aber ein anderer Kandidat, der auf einer Liste abgesichert ist, kommt in den Bundestag und kann die Wahlkreisinteressen vertreten. Der Gewinner bleibt dann draußen, und der Verlierer kommt rein. Das wäre geradezu die Verkehrung des Wahlergebnisses in einem Wahlkreis in sein Gegenteil. Auch das Gegenteil von demokratischer Akzeptanz wäre die Folge.",data/txt/17096.txt,speech,
1959490,96,17,0,,,,805,Beifall bei der CDU/CSU sowie bei Abgeordneten der FDP,data/txt/17096.txt,poi,
1959491,96,17,0,,,,806,"Folge zwei träte ein, wenn keiner der Kandidaten auf der Landesliste abgesichert ist. Es ist ja möglich, dass im Wahlkreis keiner der Kandidaten auf einer Liste abgesichert ist. Dann wäre dieser Wahlkreis ohne jegliche Vertretung im Deutschen Bundestag. Ich frage auch hier, ob das demokratisch ist.

Gestatten Sie mir diese Bemerkung: Es mag ja sein, dass eine Fraktion, Herr Beck, die als einzigen direkt gewählten Kandidaten den Kollegen Ströbele hat,",data/txt/17096.txt,speech,
1959492,96,17,0,Dr. Konstantin von Notz [BÜNDNIS 90/DIE GRÜNEN],Dr. Konstantin von Notz [BÜNDNIS 90/DIE GRÜNEN],konstantin-notz-bundnis-90-die-grunen,807,Das werden immer mehr!,data/txt/17096.txt,poi,gruene
1959493,96,17,0,,,,808,"es vielleicht nicht ganz so wichtig findet, dass viele über Direktmandate in den Bundestag kommen - das müssen sie unter sich ausmachen; vielleicht haben Sie auch ein Problem mit direkt gewählten Kandidaten -,",data/txt/17096.txt,speech,
1959494,96,17,0,,,,809,Beifall bei Abgeordneten der FDP,data/txt/17096.txt,poi,
1959495,96,17,0,Wolfgang Wieland [BÜNDNIS 90/DIE GRÜNEN],Wolfgang Wieland [BÜNDNIS 90/DIE GRÜNEN],wolfgang-wieland-bundnis-90-die-grunen,810,Bei unseren Direktwahlergebnissen würde der nie runterfallen!,data/txt/17096.txt,poi,gruene
1959496,96,17,0,,,,811,"aber das, was Sie vorschlagen, wäre nicht gut für die Demokratie, nicht gut für die Akzeptanz des Wahlvorganges.

Was ich hier angesprochen habe, ist keine blanke Theorie. Bei der letzten Bundestagswahl wären drei CSU-Abgeordnete nicht in den Deutschen Bundestag gekommen, obwohl sie in ihren Wahlkreisen gewählt wurden. Das wäre nicht in Ordnung.",data/txt/17096.txt,speech,
1959497,96,17,0,Wolfgang Wieland [BÜNDNIS 90/DIE GRÜNEN],Wolfgang Wieland [BÜNDNIS 90/DIE GRÜNEN],wolfgang-wieland-bundnis-90-die-grunen,812,Doch! Das hätte die Demokratie verkraftet!,data/txt/17096.txt,poi,gruene
1959498,96,17,0,Volker Beck [Köln] [BÜNDNIS 90/ DIE GRÜNEN],Volker Beck [Köln] [BÜNDNIS 90/ DIE GRÜNEN],volker-beck-koln-bundnis-90-die-grunen,813,Überhangmandat ist auch nicht in Ordnung!,data/txt/17096.txt,poi,gruene
1959499,96,17,0,,,,814,"Das hätte die Wähler vor Ort nicht motiviert, zur Wahl zu gehen. Das hätte die Wahlbeteiligung bei der nächsten Bundestagswahl bestimmt nicht gesteigert.

Hätte die CDU deutschlandweit in einem der 16 Bundesländer nur einen Wahlkreis mehr gewonnen, wäre auch bei ihr ein Direktmandat abgezogen worden. Dann wäre der gleiche Effekt auch bei der CDU eingetreten.

Insofern betrifft das Phänomen des Abzuges nicht nur die CSU, wie Sie es in der Begründung Ihres Gesetzentwurfs fälschlicherweise schreiben, sondern es betrifft alle Volksparteien.",data/txt/17096.txt,speech,
1959500,96,17,0,Claudia Roth [Augsburg] [BÜNDNIS 90/DIE GRÜNEN],Claudia Roth [Augsburg] [BÜNDNIS 90/DIE GRÜNEN],claudia-roth-augsburg-bundnis-90-die-grunen,815,So viele gibt es ja nicht!,data/txt/17096.txt,poi,gruene
1959501,96,17,0,,,,816,"Alle Volksparteien, deren Kandidaten Direktmandate in ihren Wahlkreisen gewinnen können, sind von diesem Problem betroffen.

Wir haben den Gesetzentwurf der Grünen gewogen und für zu leicht befunden. Er beweist, wie kompliziert die Aufgabe ist. Dies erklärt auch, warum wir von den Koalitionsfraktionen leider - das sage ich bewusst - heute noch keinen Gesetzentwurf vorlegen können. Mir ist es aber lieber, dass wir die Frist des Verfassungsgerichts notfalls bis zur Neige ausschöpfen, als dass wir dem Deutschen Bundestag ein dürftiges Machwerk vorlegen, wie Sie es heute getan haben.",data/txt/17096.txt,speech,
1959502,96,17,0,,,,817,Beifall bei der CDU/CSU und der FDP,data/txt/17096.txt,poi,
1959503,96,17,0,Volker Beck [Köln] [BÜNDNIS 90/DIE GRÜNEN],Volker Beck [Köln] [BÜNDNIS 90/DIE GRÜNEN],volker-beck-koln-bundnis-90-die-grunen,818,Hochmut kommt vor dem Fall!,data/txt/17096.txt,poi,gruene
1959504,96,17,0,,,,819,"Das Wahlrecht - das haben, glaube ich, auch Sie betont, Herr Beck - ist die Grundlage der Demokratie. Das erfordert, dass die Menschen Vertrauen in die Integrität des Wahlvorganges haben. Ein Wahlsystem muss daher für den Bürger nachvollziehbar und durchschaubar sein. Es darf nicht willkürlich erscheinen. Ich glaube, ich habe eben hinreichend deutlich gemacht, wie willkürlich das von Ihnen vorgeschlagene Wahlsystem dem Bürger vor Ort erscheinen würde. Ein Wahlsystem muss die Sitzverteilung zwischen den Parteien, aber auch zwischen den Landeslisten dem Wählerwillen gemäß abbilden. Auch das wird mit Ihrem Gesetzentwurf in föderaler Hinsicht nicht erreicht. Sie haben die beiden zentralen Probleme der Wahlrechtsreform nicht gelöst.

Ich stimme Ihnen zu: Wir müssen mit Hochdruck weiterarbeiten und miteinander reden, um die Sache zu regeln. Aber tun Sie sich bitte selber einen Gefallen: Ersparen Sie sich die Peinlichkeit und ziehen Sie Ihren Gesetzentwurf zurück, ehe ihn noch mehr Leute lesen!

Vielen Dank.",data/txt/17096.txt,speech,
1959505,96,17,0,,,,820,Beifall bei der CDU/CSU und der FDP,data/txt/17096.txt,poi,
