id,sitzung,wahlperiode,in_writing,speaker,speaker_cleaned,speaker_fp,sequence,text,filename,type,speaker_party
1960618,96,17,0,,,,1933,Beifall bei der FDP,data/txt/17096.txt,poi,
1960619,96,17,0,,,,1934,"Der ESM darf kein Superkreditinstrument werden. Zur Disziplinierung der Regierungen mit Blick auf übergroßes Schuldenmachen bedarf es wirksamer, sanktionsbewehrter Schuldenschranken im Stabilitätspakt und im jeweiligen nationalen Recht. Die FDP-Fraktion unter-streicht deshalb ausdrücklich - das wird auch in dem Koalitionsantrag deutlich -, dass wir im Bereich der automatisierten Sanktionen vorankommen müssen. Das sehen wir übrigens ebenso wie unsere Kollegen im Europäischen Parlament. Die sehr guten Vorschläge von Kommissar Rehn zur sogenannten Reverse Majority - Rückholbarkeit von Sanktionen nur innerhalb von zehn Tagen mit umgekehrter Mehrheit - zielen aus unserer Sicht in die richtige Richtung. Dadurch geraten wir erst gar nicht in die Verschuldungskrise.

Viel wichtiger als der ESM und die darin enthaltenen Reparaturinstrumente ist die Vorsorge. In den nächsten Wochen und Monaten müssen wir diesbezüglich - das sage ich an die Adresse der Bundesregierung - noch intensiv arbeiten, damit wir zu automatisierten Sanktionen kommen können.",data/txt/17096.txt,speech,
1960620,96,17,0,,,,1935,Beifall bei der FDP sowie bei Abgeordneten der CDU/CSU,data/txt/17096.txt,poi,
1960621,96,17,0,,,,1936,"Die Erfahrung hat gezeigt, dass Regeln wie die des Stabilitätspakts bei entsprechendem Willen politisch so interpretiert werden können, dass sie ihre Wirksamkeit faktisch verlieren. Deshalb ist es ganz wichtig, dass wir die Kontrollfunktion der Märkte wirken lassen. Die Anleger müssen mit ihren Anlagen im Risiko stehen. Nur dann lassen sie bei der Kreditvergabe Vorsicht walten. Nur dann werden Zinsen verlangt, die dem Risiko des jeweiligen Schuldners entsprechen, um sich gegen den Verlust der Forderungen abzusichern. Nur durch risikogerechte Zinsen wird das Schuldenmachen auf ein für das jeweilige Land erträgliches Maß begrenzt. Dieser Mechanismus funktioniert automatisch und besser, als jeder Pakt es jemals könnte.

Eine zentrale Forderung der Koalition war deshalb immer, dass eine absehbare und kalkulierbare obligatorische Begleitbeteiligung der Gläubiger erfolgt. Das ist in dem ESM-Verfahren enthalten. Wir hätten uns das durchaus noch stärker vorstellen können - das sage ich auch ganz deutlich -, aber wir wissen, dass man bei europäischen Lösungen natürlich auch immer gewisse Kompromisse eingehen muss. Umso klarer muss sein - dies sage ich insbesondere mit Blick auf das Bundesfinanzministerium und die letzten Verhandlungsschritte bei der Euro-Gruppe am 21. März -, dass wir an diesem Punkt keinerlei Aufweichungen mehr zulassen dürfen.",data/txt/17096.txt,speech,
1960622,96,17,0,,,,1937,Beifall bei der FDP sowie bei Abgeordneten der CDU/CSU,data/txt/17096.txt,poi,
1960623,96,17,0,,,,1938,"Präsident Dr. Norbert Lammert:

Herr Kollege Link, lassen Sie Zwischenfragen zu?

Michael Link (Heilbronn) (FDP):

Gern.

Präsident Dr. Norbert Lammert:

Bitte schön.

Dr. Gerhard Schick (BÜNDNIS 90/DIE GRÜNEN):

Herr Kollege, Sie haben zur Gläubigerbeteiligung gesprochen. Ich würde mich dafür interessieren, wie die Position Ihrer Fraktion dazu ist, dass die irische Regierung der Auffassung ist, dass es bei den irischen Banken eine Gläubigerbeteiligung geben kann, die anderen europäischen Regierungen das aber bisher in der Sache ablehnen, also gerade die Gläubigerbeteiligung, die Sie einfordern, konkret verhindert wird. Wie steht Ihre Fraktion dazu?

Michael Link (Heilbronn) (FDP):

Die Dinge, die jetzt zur Gläubigerbeteiligung in dem Beschluss stehen - darin stehen sehr lange Passagen zur Gläubigerbeteiligung -, sind in der Theorie sehr gut. Bleiben sie allerdings Rhetorik, dann droht dieser gesamte ESM so, wie wir ihn jetzt machen, zu scheitern. Die Gläubigerbeteiligung muss effizient sein und darf - deshalb habe ich das gerade vorhin gesagt - politisch nicht manipuliert werden. Die Weiche zwischen temporär zahlungsunfähig und dauerhaft insolvent darf nicht immer wieder von der Euro-Gruppe in die Richtung gestellt werden, dass es keine Gläubigerbeteiligung gibt und dass man sich anders durchwurschteln kann. Das wollen wir dezidiert nicht.

Wir wollen aber auch nicht - das ist ja auch Teil Ihrer Frage, Herr Kollege Schick - die Art von Gläubigerbeteiligung, wie sie beispielsweise in dem Teil Sekundärmarktaufkauf, Buy-back-Aktionen angelegt war. Diese Art von Gläubigerbeteiligung ist für uns keine wirkliche, sie ist keine harte Gläubigerbeteiligung. Sie ist letztlich etwas, was aus unserer Sicht auch gegen das No-bail-out-Gebot verstoßen würde.

Ich würde jetzt gern mit meiner Rede fortfahren.",data/txt/17096.txt,speech,
1960624,96,17,0,Dr. Gerhard Schick [BÜNDNIS 90/DIE GRÜNEN],Dr. Gerhard Schick [BÜNDNIS 90/DIE GRÜNEN],gerhard-schick-bundnis-90-die-grunen,1939,Ich habe die Antwort noch nicht gehört!,data/txt/17096.txt,poi,gruene
1960625,96,17,0,,,,1940,"Es ist für uns extrem wichtig - ich habe das Bail-out-Verbot erwähnt -, dass wir das No-bail-out-Gebot in den Verhandlungen sichern konnten. Das No-bail-out-Gebot gilt, und der neue Art. 136 AEUV wird nicht eine Art Spezialgesetz, eine Lex specialis, zum Art. 125. Es wird keine Relativierung des Bail-out-Verbots, jedenfalls nicht mit unserem Koalitionsantrag, den wir heute vorlegen, geben. Deshalb erwarten wir auch, dass dort, wo noch Fragen sind - zum Beispiel bei den Primärmarktanleihen -, bei der Umsetzungsgesetzgebung entsprechende Präzisierungen erfolgen. Es muss deutlich werden, dass es auch bei diesen Primärmarktanleihen nicht um organisierte große Programme geht, sondern um Ausnahmefälle unter Konditionen und dadurch auch ein klarer Abstand sowohl zum Bail-out-Verbot gewahrt ist als auch umgekehrt das Ultima-Ratio-Prinzip gewährleistet ist. Denn es war für uns auch ein absolut zentraler Punkt, dass alle Hilfsmaßnahmen, gerade wenn es um Darlehen des ESM geht, nur als Ultima Ratio erfolgen.",data/txt/17096.txt,speech,
1960626,96,17,0,,,,1941,Beifall bei der FDP und der CDU/CSU,data/txt/17096.txt,poi,
1960627,96,17,0,,,,1942,"Kolleginnen und Kollegen, wir haben im Koalitionsantrag sehr deutlich gemacht - wir werden auch auf dem weiteren Weg der Umsetzung darauf achten -, dass es notwendig ist, dass der Bundestag vor jeder Aktivierung des ESM im Wege seiner Zustimmungspflicht konstitutiv beteiligt wird, das heißt, ein Parlamentsvorbehalt gesetzt wird. Betroffen ist hierbei nicht mehr und nicht weniger als das Königsrecht des Parlaments, die Haushaltssouveränität.

Betroffen ist auch - das Verfassungsgericht hat immer wieder darauf hingewiesen - Art. 20 des Grundgesetzes, das Demokratiegebot. Wir werden deshalb großen Wert darauf legen, dass die Ratifizierung der Vertragsänderung, zu der wir heute das Einvernehmen erteilen wollen, und die Umsetzungsgesetzgebung in einem Schritt erfolgen, um dadurch immer ein ganz konkretes Kontroll- und Mitwirkungsrecht des Bundestages zu gewährleisten.

Im Übrigen wünschen wir, dass wir den Pakt - das möchte ich nur einflechten - so gestalten, dass wir den Staaten, die heute noch nicht Teil der Euro-Zone sind, den Beitritt erleichtern können. Ich erinnere immer wieder daran: Europäische Integration lebt auch davon, dass wir alle 27 mitnehmen. Ich weiß, es gibt diesbezüglich große Bedenken bei den Partnern. Wir müssen deshalb unbedingt immer darauf achten, dass wir es auch denjenigen, die heute noch nicht am Pakt und an der Euro-Zone teilnehmen, ermöglichen, noch aufzuspringen. Wir müssen das leicht und erreichbar machen.

Mit der Verabschiedung des Antrags der Koalition und unter den in ihm formulierten Rahmenbedingungen stellen wir das gesetzlich gebotene Einvernehmen mit der Bundesregierung für die Änderung des Art. 136 AEUV her und werden unserer Integrationsverantwortung gerecht. Wir danken insbesondere der Frau Bundeskanzlerin, dem Bundesaußenminister und dem Bundesminister der Finanzen für den in den Verhandlungen bisher zurückgelegten weiten Weg und für die erreichten Ergebnisse. Wir wissen, dass diese Verhandlungen schwer sind und herausfordernd bleiben. Wir werden als FDP-Fraktion die Verhandlungen deshalb weiterhin aktiv unterstützen und begleiten.

Ich danke für Ihre Aufmerksamkeit.",data/txt/17096.txt,speech,
1960628,96,17,0,,,,1943,Beifall bei der FDP sowie bei Abgeordneten der CDU/CSU,data/txt/17096.txt,poi,
1960629,96,17,0,,,,1944,"Präsident Dr. Norbert Lammert:

Michael Roth ist der nächste Redner für die SPD-Fraktion.",data/txt/17096.txt,speech,
1960630,96,17,0,,,,1945,Beifall bei der SPD,data/txt/17096.txt,poi,
1960631,96,17,0,,,,1946,"Michael Roth (Heringen) (SPD):

Herr Präsident! Liebe Kolleginnen und Kollegen! Europäischer Stabilitätsmechanismus - was für ein technokratisches Wort. Worum geht es? Es geht um Solidarität im wohlverstandenen Sinne, nicht nur im wohlverstandenen europäischen Sinne, sondern auch im wohlverstandenen nationalen Sinne. Es geht um Solidarität, weil wir als Exportnation ein Interesse an stabilen Märkten haben müssen, weil wir an Wohlstand und sozialer Stabilität in allen europäischen Mitgliedstaaten ein Interesse haben müssen, weil wir an einem starken Euro und an einer Europäischen Union, die sich nicht ständig mit sich selbst beschäftigt, sondern auch in der Lage ist, ihrer internationalen Verantwortung gerecht zu werden, ein Interesse haben müssen.",data/txt/17096.txt,speech,
1960632,96,17,0,,,,1947,Beifall bei der SPD,data/txt/17096.txt,poi,
1960633,96,17,0,,,,1948,"Insofern hat mich die Diskussion der vergangenen Monate, die maßgeblich auf das Konto von CDU/CSU und FDP geht, befremdet. Wenn wir von Solidaritätsunion sprechen, sprechen Sie von Transferunion. Sie flirten mit dem Boulevard nach dem Motto: Gutes deutsches Geld hat in Griechenland, in Spanien und in Irland nichts zu suchen. Die sollen sich gefälligst selbst um ihre Probleme kümmern und sie selbst lösen.

Es ist uns nicht leichtgefallen, Ihren Weg, den Sie eben als lang beschrieben haben, zu verfolgen. Das war eher ein Zickzackkurs.",data/txt/17096.txt,speech,
1960634,96,17,0,Dr. Rainer Stinner [FDP],Dr. Rainer Stinner [FDP],rainer-stinner-fdp,1949,Das liegt an Ihnen!,data/txt/17096.txt,poi,fdp
1960635,96,17,0,,,,1950,"Die berühmte Springprozession ist nichts dagegen. Sie haben einmal erklärt, dass es überhaupt keinen Rettungsschirm geben soll. Dann haben Sie sich nach langem Ach und Weh für einen Rettungsschirm ausgesprochen. Dann hat die Bundeskanzlerin erklärt: Ja, Rettungsschirm schon, aber er ist zeitlich befristet bis 2013.",data/txt/17096.txt,speech,
1960636,96,17,0,Michael Link [Heilbronn] [FDP],Michael Link [Heilbronn] [FDP],michael-link-heilbronn-fdp,1951,Ist er ja auch!,data/txt/17096.txt,poi,fdp
1960637,96,17,0,,,,1952,"Jetzt wurde ein Stabilitätsmechanismus, also ein Rettungsschirm, implementiert, der über 2013 hinaus dauerhaft gilt. Sie haben lang und breit erklärt - das findet sich auch in Ihren Anträgen -, der ESM, der Rettungsschirm, dürfe um keinen einzigen Euro aufgestockt werden. Jetzt wird der ESM aufgestockt; aus Sicht der SPD geschieht dies aus guten Gründen.

Bei Ihnen weiß man nie, was Sie eigentlich wollen. Sie müssen einmal klären: Werden Sie Ihrer eigenen Tradition als europafreundliche Partei gerecht, die in Europa nicht einen Teil des Problems, sondern einen Teil der Lösung sieht,",data/txt/17096.txt,speech,
1960638,96,17,0,Michael Link [Heilbronn] [FDP],Michael Link [Heilbronn] [FDP],michael-link-heilbronn-fdp,1953,Ja! Genau das machen wir!,data/txt/17096.txt,poi,fdp
1960639,96,17,0,,,,1954,"oder wollen Sie weiterhin mit dem Boulevard, mit der Bild-Zeitung flirten, weil Sie meinen, Sie könnten dadurch Ihr populistisches Mütchen kühlen, liebe Kolleginnen und Kollegen von CSU, FDP und leider auch Teilen der CDU?",data/txt/17096.txt,speech,
1960640,96,17,0,,,,1955,Beifall bei der SPD und dem BÜNDNIS 90/ DIE GRÜNEN,data/txt/17096.txt,poi,
1960641,96,17,0,,,,1956,Man muss deutlich sagen: Es gibt nur noch wenige Europaparteien hier in diesem Parlament. Das sind die Sozialdemokratische Partei Deutschlands,data/txt/17096.txt,speech,
1960642,96,17,0,,,,1957,Lachen bei Abgeordneten der CDU/CSU und der FDP,data/txt/17096.txt,poi,
1960643,96,17,0,,,,1958,und sicherlich auch die Partei Bündnis 90/Die Grünen. Sie hingegen haben sich von Ihrer eigenen Verantwortung verabschiedet.,data/txt/17096.txt,speech,
1960644,96,17,0,,,,1959,Beifall bei der SPD sowie bei Abgeordneten des BÜNDNISSES 90/DIE GRÜNEN,data/txt/17096.txt,poi,
1960645,96,17,0,,,,1960,"Sie müssen nur in ein einziges Nachbarland fahren, um das zu sehen. Das deutsch-französische Tandem funktioniert nicht mehr. Sprechen Sie einmal mit Ihrem Parteifreund Jean-Claude Juncker. Er wird Ihnen ins Stammbuch schreiben, wie das früher lief und wie es heute unter Bundeskanzlerin Merkel läuft. Ich appelliere an Sie: Werden Sie Ihrer eigenen Tradition gerecht. Dann kann etwas Gutes daraus werden. Aber, Kollege Link, erklären Sie uns nicht in acht Minuten nur, was Sie nicht wollen. Sagen Sie uns doch einfach einmal, was Sie wollen und wo Sie Europa konstruktiv mitgestalten wollen.",data/txt/17096.txt,speech,
1960646,96,17,0,,,,1961,Beifall bei der SPD und dem BÜNDNIS 90/ DIE GRÜNEN,data/txt/17096.txt,poi,
1960647,96,17,0,,,,1962,"Dazu habe ich in Ihrem Redebeitrag leider - das sage ich trotz aller persönlichen Wertschätzung - relativ wenig gehört.

Präsident Dr. Norbert Lammert:

Es gibt den Wunsch zu Zwischenfragen, Herr Kollege Roth.

Michael Roth (Heringen) (SPD):

Okay.

Präsident Dr. Norbert Lammert:

Bitte schön.

Dr. Daniel Volk (FDP):

Herr Kollege Roth, ist Ihre Partei bzw. Ihre Fraktion ihrer europäischen Verantwortung dadurch gerecht geworden, dass sie sich bei den Beschlussfassungen im Zusammenhang mit den Rettungsaktionen im Falle Griechenlands hier im Hause verantwortungslos enthalten hat, oder wie wurde sie ihrer Verantwortung gerecht?",data/txt/17096.txt,speech,
1960648,96,17,0,,,,1963,Beifall bei der FDP sowie bei Abgeordneten der CDU/CSU,data/txt/17096.txt,poi,
1960649,96,17,0,Gerd Bollmann [SPD],Gerd Bollmann [SPD],gerd-bollmann-spd,1964,"Stehen bleiben, bitte!",data/txt/17096.txt,poi,spd
1960650,96,17,0,,,,1965,"Michael Roth (Heringen) (SPD):

Lieber Herr Kollege, da fragen Sie den Falschen. Ich habe der Griechenland-Hilfe nämlich zugestimmt.",data/txt/17096.txt,speech,
1960651,96,17,0,,,,1966,Beifall bei der SPD und dem BÜNDNIS 90/ DIE GRÜNEN,data/txt/17096.txt,poi,
1960652,96,17,0,Dr. Daniel Volk [FDP],Dr. Daniel Volk [FDP],daniel-volk-fdp,1967,Und Ihre Fraktion?,data/txt/17096.txt,poi,fdp
1960653,96,17,0,,,,1968,"Ich habe aber großes Verständnis für meine Fraktion, die es sich in dieser Frage nicht leicht gemacht hat.",data/txt/17096.txt,speech,
1960654,96,17,0,Dr. Rainer Stinner [FDP],Dr. Rainer Stinner [FDP],rainer-stinner-fdp,1969,"Ja, ja! Da war die SPD wieder mal gespalten!",data/txt/17096.txt,poi,fdp
1960655,96,17,0,,,,1970,"- Mir ist eine aufrechte Position als frei gewählter Abgeordneter lieber,",data/txt/17096.txt,speech,
1960656,96,17,0,Patrick Döring [FDP],Patrick Döring [FDP],patrick-doring-fdp,1971,Oh! Sehr gut!,data/txt/17096.txt,poi,fdp
1960657,96,17,0,,,,1972,"als in Ihrem Windschatten bei der Harakiripolitik, die von der Bundeskanzlerin betrieben wurde, mit unterzugehen.",data/txt/17096.txt,speech,
1960658,96,17,0,,,,1973,Beifall bei der SPD,data/txt/17096.txt,poi,
1960659,96,17,0,Patrick Döring [FDP],Patrick Döring [FDP],patrick-doring-fdp,1974,"Aha! Ich denke, Sie haben zugestimmt! Was denn nun?",data/txt/17096.txt,poi,fdp
1960660,96,17,0,,,,1975,"- Ich persönlich habe zugestimmt, auch wenn es mir, lieber Herr Kollege, weniger darum ging, der Bundeskanzlerin den Weg zu ebnen. Mir war wichtiger, dass die Europäische Union eine Solidaritätsunion ist und dass Partner, die in eine Krise geraten sind, Hilfe bekommen, allerdings nicht einfach so, sondern mit einer entsprechenden Konditionierung, mit Bedingungen.

Die Bundesregierung hat meine und unsere Zustimmung auch bei einer anderen mehr als berechtigten Forderung, nämlich im Hinblick auf Zinsvergünstigungen für Irland. Irland kann nur dann Solidarität von der Europäischen Union erwarten, wenn man endlich bereit ist, die FDP-Politik in Irland zu beenden und die Körperschaftsteuer von 12,5 Prozent im Interesse des Landes und im Interesse der Bürgerinnen und Bürger angemessen zu erhöhen.",data/txt/17096.txt,speech,
1960661,96,17,0,,,,1976,Beifall bei Abgeordneten der SPD,data/txt/17096.txt,poi,
1960662,96,17,0,Patrick Döring [FDP],Patrick Döring [FDP],patrick-doring-fdp,1977,Dafür ist aber nicht der Bundestag zuständig! Dafür sind die Länder selbst zuständig!,data/txt/17096.txt,poi,fdp
1960663,96,17,0,,,,1978,"Liebe Kolleginnen und Kollegen, wir sind bereit, diesen Europäischen Stabilitätsmechanismus vom Grundsatz her mitzutragen. Deswegen werden wir dem Antrag der Bundesregierung auf Einvernehmensherstellung heute zustimmen. Aber wir knüpfen unsere Zustimmung an die Erfüllung bestimmter Erwartungen. Wir erwarten, dass die Bundesregierung ihrer Verpflichtung gegenüber dem Deutschen Bundestag endlich gerecht wird und den Bundestag in EU-Angelegenheiten frühestmöglich und umfassend unterrichtet. An dieser Stelle will ich ein Dankeschön an den Bundestagspräsidenten aussprechen,",data/txt/17096.txt,speech,
1960664,96,17,0,,,,1979,Beifall bei Abgeordneten der SPD,data/txt/17096.txt,poi,
1960665,96,17,0,,,,1980,"der im Interesse aller im Deutschen Bundestag vertretenen Parteien deutlich gemacht hat, dass das Armutszeugnis, das sich die Bundesregierung beim sogenannten Pakt für Wettbewerbsfähigkeit selbst ausgestellt hat, nicht der Maßstab im Hinblick auf ihre Pflichten zur Unterrichtung des Bundestages sein kann und darf.",data/txt/17096.txt,speech,
1960666,96,17,0,,,,1981,Beifall bei der SPD und dem BÜNDNIS 90/ DIE GRÜNEN,data/txt/17096.txt,poi,
1960667,96,17,0,,,,1982,"In allen Hauptstädten und allen EU-Institutionen wird über einen Pakt für Wettbewerbsfähigkeit diskutiert, und die Medien berichten breit darüber. Aber die Bundesregierung stellt sich hin und sagt: Wir können Ihnen keine Informationen zukommen lassen, weil es diesen Pakt gar nicht gibt. - Inzwischen gibt es auch einen Pakt für den Euro. Wir sind am 11. März dieses Jahres erstmals darüber unterrichtet worden. Ich weiß, dass es Kolleginnen und Kollegen in der FDP-Fraktion, aber auch bei CDU und CSU gibt, die mit uns einer Meinung sind. Insofern habe ich Ihren Beifall gerade vermisst, liebe Kolleginnen und Kollegen.",data/txt/17096.txt,speech,
1960668,96,17,0,,,,1983,Beifall bei der SPD sowie bei Abgeordneten des BÜNDNISSES 90/DIE GRÜNEN,data/txt/17096.txt,poi,
1960669,96,17,0,,,,1984,"Darüber hinaus sind wir der Auffassung: Der Stabilitätsmechanismus ist notwendig. Auch die Aufstockung ist notwendig. Aber dies allein reicht nicht:

Erstens. Wir brauchen eine angemessene Parlamentsbeteiligung. Wir müssen auch die Lehren aus der verheerenden Unterrichtungspolitik der Bundesregierung in den vergangenen Wochen und Monaten ziehen. Ich appelliere an CDU/CSU und FDP, hier eine interfraktionelle Verständigung herbeizuführen. Wir sind zu Gesprächen bereit. Wir sollten auch die richtigen Konsequenzen aus dem Status quo ziehen. Hier haben Sie uns auf Ihrer Seite.

Zweitens. Wir brauchen nicht nur einen Pakt für den Euro, sondern auch einen Pakt für Wachstum und soziale Stabilität.",data/txt/17096.txt,speech,
1960670,96,17,0,,,,1985,Beifall bei Abgeordneten der SPD,data/txt/17096.txt,poi,
1960671,96,17,0,,,,1986,"Eine Konsolidierung kann nur mit nachhaltigem Wachstum erfolgreich sein. Ich bin beeindruckt, was die griechische Regierung den Bürgerinnen und Bürgern zuzumuten und welch hohen Preis sie dafür zu zahlen bereit ist. Aber wir erkennen doch schon jetzt, dass all die Anstrengungen, die wir in Bundesrat und Bundestag wahrscheinlich niemals durchbekämen, nicht ausreichen, um dieses Land aus der Krise zu führen.

Insofern darf eine notwendige Konsolidierung nicht zu einer Austeritätspolitik führen, die jegliches Wachstum hemmt, die die Länder in einen Teufelskreislauf führt und die diese Länder weiterhin zum sozialen Schlusslicht der Europäischen Union werden lässt. Hier brauchen wir eine andere Politik, die den sozialen Bereich in den Blickpunkt nimmt, die Wachstum in den Blickpunkt nimmt und die auch die soziale Stabilität in den Blickpunkt nimmt.",data/txt/17096.txt,speech,
1960672,96,17,0,,,,1987,Beifall bei der SPD,data/txt/17096.txt,poi,
1960673,96,17,0,,,,1988,"Des Weiteren fordern wir eine Beteiligung der Krisenverursacher. Deshalb nehmen wir Sie, liebe Bundesregierung, beim Wort. In den Schlussforderungen zum Gipfel steht zu lesen, dass die europäische Finanztransaktionsteuer sondiert wird. Wir erwarten einen entsprechenden Vorschlag der EU-Kommission. Darüber hinaus erwarten wir, dass sich die Bundesregierung vorbehaltlos hinter das Ziel einer europäischen Finanztransaktionsteuer stellt und dass diejenigen, die diese Krise maßgeblich verursacht haben, stärker in die Pflicht genommen werden, liebe Kolleginnen und Kollegen.",data/txt/17096.txt,speech,
1960674,96,17,0,,,,1989,Beifall bei der SPD und dem BÜNDNIS 90/ DIE GRÜNEN,data/txt/17096.txt,poi,
1960675,96,17,0,,,,1990,"Gleichermaßen brauchen wir eine entsprechende Gläubigerbeteiligung. Ich gebe es offen zu: Diesbezüglich sind wir mit unseren Diskussionen in allen Fraktionen noch nicht am Ende angelangt. Hier wäre sicherlich ein bisschen mehr Fürsorge und ein bisschen mehr Sensibilität auch gegenüber den Bürgerinnen und Bürgern durchaus angebracht. Denn diese sagen zu Recht: Es kann ja nicht angehen, dass nur die Steuerzahlerinnen und Steuerzahler sowie die Staaten für das aufzukommen haben, was andere verursacht haben, die Gläubiger und Banken aber weitgehend ungeschoren davonkommen. - Das ist mit unseren Vorstellungen von Solidarität in der Europäischen Union auch in Bezug auf den europäischen Stabilitätsmechanismus unvereinbar.",data/txt/17096.txt,speech,
1960676,96,17,0,,,,1991,Beifall bei der SPD,data/txt/17096.txt,poi,
1960677,96,17,0,,,,1992,Ein Letztes - und das ist für uns als ein wirtschaftlich sehr starkes Land sicherlich nicht ganz einfach -: Auch die Länder mit einem Leistungsbilanzüberschuss stehen in der Verantwortung.,data/txt/17096.txt,speech,
1960678,96,17,0,Dr. Axel Troost [DIE LINKE],Dr. Axel Troost [DIE LINKE],axel-troost-die-linke,1993,In der Tat!,data/txt/17096.txt,poi,linke
1960679,96,17,0,,,,1994,"Es kann nicht angehen, dass die Lohnentwicklung mit der Produktivitätsentwicklung nicht mehr in ein Verhältnis zu setzen ist. Es kann für die gesamte Europäische Union nicht gut sein, dass die Bundesrepublik Deutschland in den letzten zehn Jahren eine Nettolohnentwicklung von minus 4 Prozent hatte, der EU-Durchschnitt aber bei rund 20 Prozent Plus liegt. Daher muss deutlich werden: Wohlstand und nachhaltiges Wachstum können nur erreicht werden, wenn auch die Arbeitnehmerinnen und Arbeitnehmer sowie die sozial Schwächeren von diesem Wachstumsmodell profitieren.

Insofern erwarten wir von der Bundesregierung eine bessere Beteiligung des Parlaments. Wir erwarten, dass Sie nicht nur Nein sagen, dass Sie nicht nur zögern und zaudern, sondern dass Sie in den EU-Institutionen wieder das Maß an Überzeugungsfähigkeit erreichen können, das Ihre Vorgängerregierungen vorbildlich erreicht haben. Hier arbeiten Sie weit unter den Möglichkeiten Deutschlands -

Präsident Dr. Norbert Lammert:

Herr Kollege, Sie hätten kurz vor - -

Michael Roth (Heringen) (SPD):

- und weit unter den Möglichkeiten, die einer deutschen Bundesregierung zustünden.

Vielen Dank.",data/txt/17096.txt,speech,
1960680,96,17,0,,,,1995,Beifall bei der SPD,data/txt/17096.txt,poi,
1960681,96,17,0,,,,1996,"Präsident Dr. Norbert Lammert:

Ich wollte Ihnen noch die Gelegenheit einer informellen Verlängerung der Redezeit durch Zulassung einer Zusatzfrage zuschustern.",data/txt/17096.txt,speech,
1960682,96,17,0,,,,1997,Zurufe von der CDU/CSU und der FDP,data/txt/17096.txt,poi,
1960683,96,17,0,,,,1998,Nun hat das Wort der Kollege Michael Meister für die CDU/CSU-Fraktion.,data/txt/17096.txt,speech,
1960684,96,17,0,,,,1999,Beifall bei der CDU/CSU und der FDP,data/txt/17096.txt,poi,
1960685,96,17,0,,,,2000,"Dr. Michael Meister (CDU/CSU):

Herr Präsident! Liebe Kolleginnen und Kollegen! Wir sollen heute unser Einverständnis",data/txt/17096.txt,speech,
1960686,96,17,0,Manuel Sarrazin [BÜNDNIS 90/DIE GRÜNEN],Manuel Sarrazin [BÜNDNIS 90/DIE GRÜNEN],manuel-sarrazin-bundnis-90-die-grunen,2001,"Nein, Einvernehmen!",data/txt/17096.txt,poi,gruene
1960687,96,17,0,,,,2002,"zur Änderung der europäischen Verträge zur Errichtung des europäischen Stabilitätspaktes erteilen. Ich will zunächst einmal feststellen: Wir als Unionsfraktion sind der Meinung, dass wir einen dauerhaft stabilen Euro haben wollen. Dies bedeutet: Wir bekennen uns zum Euro. Wir bekennen uns zum stabilen Euro, und wir bekennen uns zur Dauerhaftigkeit dieser Währung.",data/txt/17096.txt,speech,
1960688,96,17,0,,,,2003,Beifall bei der CDU/CSU und der FDP,data/txt/17096.txt,poi,
1960689,96,17,0,,,,2004,"Ich glaube, es ist richtig, dass wir an dieser Stelle Solidarität nicht missverstehen, Kollege Roth, indem wir sagen: Falsche Strukturen werden wir mit viel Geld dauerhaft aufrechterhalten.",data/txt/17096.txt,speech,
1960690,96,17,0,Michael Roth [Heringen] [SPD],Michael Roth [Heringen] [SPD],michael-roth-heringen-spd,2005,Das hat doch keiner gesagt!,data/txt/17096.txt,poi,spd
