id,sitzung,wahlperiode,in_writing,speaker,speaker_cleaned,speaker_fp,sequence,text,filename,type,speaker_party
2494426,98,17,0,Vizepräsidentin Katrin Göring-Eckardt,Katrin Göring-Eckardt,katrin-goring-eckardt,156,"Es gibt schon jetzt eine ganze Reihe von Fragestellerinnen und Fragestellern. Ich erinnere noch an die Ankündigung des Präsidenten von vorhin, dass wir die Regierungsbefragung heute vielleicht nicht allzu weit ausdehnen sollten, und gebe zunächst der Kollegin Daðdelen das Wort zur Frage.",data/txt/17098.txt,chair,
2494427,98,17,0,Sevim Daðdelen (DIE LINKE),Sevim Daðdelen,sevim-daðdelen,157,"Vielen Dank, Frau Präsidentin. - Frau Ministerin Schavan, ich würde gerne wissen, ob aufgrund des im Gesetzentwurf und in der Begründung angedachten Anspruchs, für mehr Transparenz und Vereinfachung zu sorgen, auch vorgesehen ist, eine einheitliche Datenbank zu errichten - zum Beispiel auf der Grundlage einer gesetzlichen Regelung -, um ungleiche Bewertungsergebnisse bei gleichen Qualifikationen in den Bundesländern zu vermeiden.

In diesem Zusammenhang ist es mir auch wichtig, zu fragen, ob man mehr Transparenz und Vereinfachung dadurch erreichen kann, dass man es den Kammern überlässt, die Anerkennungsverfahren durchzuführen, da es dann 16 unterschiedliche Anlaufstellen in 16 unterschiedlichen Bundesländern gibt.",data/txt/17098.txt,speech,linke
2494428,98,17,0,Vizepräsidentin Katrin Göring-Eckardt,Katrin Göring-Eckardt,katrin-goring-eckardt,158,Frau Ministerin.,data/txt/17098.txt,chair,
2494429,98,17,0,"Dr. Annette Schavan, Bundesministerin für Bildung und Forschung",Dr. Annette Schavan,annette-schavan,159,"Es sind diverse Maßnahmen geplant, um Daten und Informationen speziell zu Drittstaaten, deren Abschlüsse bei uns bislang noch nicht so bekannt sind, zu sammeln. Ich nenne zum Beispiel die zentrale Plattform beim Bundeswirtschaftsministerium, die zurzeit aufgebaut wird. Damit wird es eine gemeinsame Daten- und Informationsbasis geben. Damit wir sichergestellt, dass die im Gesetz festgelegten Kriterien nicht unterschiedlich angewandt werden. Deshalb sagen uns sowohl die Handwerks- als auch die Industrie- und Handelskammern: Es wird nicht, wie bislang, jede Kammer für sich entscheiden, sondern wir wollen Kompetenzzentren einrichten. - Beim Industrie- und Handelskammertag wird überlegt, eine große Stelle in einer Stadt in Deutschland einzurichten, sodass nicht unterschiedliche Stellen die gleichen Kriterien anwenden, sondern das nur an einer Stelle erfolgen muss.

Das Einzige, was wir nicht wollen, ist, eine neue zentrale Stelle jenseits der Kammern und der bisherigen Behörden aufzubauen. Das heißt aber nicht, dass die Kräfte nicht gebündelt werden. Es werden nicht mehr 400 Stellen in Deutschland sein, die die Anerkennungsverfahren durchführen.",data/txt/17098.txt,speech,
2494430,98,17,0,Vizepräsidentin Katrin Göring-Eckardt,Katrin Göring-Eckardt,katrin-goring-eckardt,160,Die nächste Frage stellt Kollege Kamp.,data/txt/17098.txt,chair,
2494431,98,17,0,Heiner Kamp (FDP),Heiner Kamp,heiner-kamp,161,"Vielen Dank, Frau Präsidentin. - Frau Ministerin, angesichts des Mangels an qualifiziertem Personal im Gesundheitsbereich frage ich Sie, welche Auswirkungen das Gesetz auf die Anerkennung von Abschlüssen ausländischer Ärzte, Krankenpfleger, Physiotherapeuten, Ergotherapeuten, Hebammen, MTAs und PTAs haben wird und ob Sie eine Gefahr sehen, dass der Standard der anerkannten Abschlüsse, ob Hochschulabschlüsse oder Berufsausbildung, eventuell gefährdet sein könnte. Anders gefragt: Könnten diese Abschlüsse dadurch entwertet werden?",data/txt/17098.txt,speech,fdp
2494432,98,17,0,Vizepräsidentin Katrin Göring-Eckardt,Katrin Göring-Eckardt,katrin-goring-eckardt,162,"Frau Ministerin, bitte.",data/txt/17098.txt,chair,
2494433,98,17,0,"Dr. Annette Schavan, Bundesministerin für Bildung und Forschung",Dr. Annette Schavan,annette-schavan,163,"Die Gefahr der Entwertung sehe ich nicht. Ich bin davon überzeugt, dass die Stellen, die für die Anerkennung zuständig sind, die deutschen Referenzqualifikationen sehr genau kennen und bei der Qualität unserer Ausbildungen ansetzen werden.

Was die Mediziner und die sonstigen Heilberufe angeht, steht in dem Bereich der Patientenschutz besonders im Vordergrund. Deshalb würde ich nach heutigem Stand sagen: Das, was im Gesetzentwurf vorgesehen ist, ist ein guter erster Schritt, aber es ist durchaus eine Weiterentwicklung denkbar.

Der wichtigste Schritt in dem Bereich ist, dass nicht mehr die Staatsangehörigkeit darüber entscheidet, ob jemand eine Approbation oder den Berufszugang bekommt. Bisher ist dafür in vielen Bereichen die deutsche Staatsangehörigkeit die Voraussetzung. Das gilt selbst für den türkischen Arzt oder die Ärztin, die in Deutschland geboren und ausgebildet sind, aber ihre türkische Staatsangehörigkeit behalten. Hier ist eine entscheidende Änderung erfolgt. Jetzt ist nur noch die Qualifikation Voraussetzung für die Anerkennung. Ich glaube, dass das ein erster wichtiger Schritt ist. Eine Weiterentwicklung ist denkbar und vermutlich auch notwendig, wenn wir uns gezielt - Kollege Rösler hat in dieser Woche davon gesprochen - außerhalb der EU um Mediziner bemühen wollen.",data/txt/17098.txt,speech,
2494434,98,17,0,Vizepräsidentin Katrin Göring-Eckardt,Katrin Göring-Eckardt,katrin-goring-eckardt,164,Frau Sager.,data/txt/17098.txt,chair,
2494435,98,17,0,Krista Sager (BÜNDNIS 90/DIE GRÜNEN),Krista Sager,krista-sager,165,"Frau Ministerin, das Eckpunktepapier der Bundesregierung hat noch die Einrichtung dezentraler Erstanlaufstellen in Aussicht gestellt. Eine Internetplattform ist kein Ersatz für Beratung und Begleitung. Warum regelt der Gesetzentwurf nicht den Anspruch auf Beratung und Begleitung durch dezentrale Stellen vor Ort?",data/txt/17098.txt,speech,gruene
2494436,98,17,0,Vizepräsidentin Katrin Göring-Eckardt,Katrin Göring-Eckardt,katrin-goring-eckardt,166,Frau Ministerin.,data/txt/17098.txt,chair,
2494437,98,17,0,"Dr. Annette Schavan, Bundesministerin für Bildung und Forschung",Dr. Annette Schavan,annette-schavan,167,"Das, was mit der Erstanlaufstelle beabsichtigt ist, wird in unter anderem durch die zentrale Hotline gewährleistet. Der entscheidende Punkt ist: Jemand, der seine Qualifikation prüfen lassen will, muss sich nicht an zehn Adressen wenden, sondern an eine zentrale Nummer. Da nennt man ihm nicht einfach eine weitere Telefonnummer, sondern er erhält eine gezielte Beratung, an wen er sich mit seinem Antrag wenden kann.

Beratung bzw. Begleitung ist uns sehr wichtig. Das gilt vor allem in den Fällen, in denen eine Anerkennung nicht ausgesprochen werden kann, und sich die Frage stellt, welche zusätzliche Qualifikation notwendig ist, um eine Anerkennung zu erreichen.

Hierfür sind regionale Stellen vorgesehen. Eine untergesetzliche Regelung ist in Arbeit.",data/txt/17098.txt,speech,
2494438,98,17,0,Vizepräsidentin Katrin Göring-Eckardt,Katrin Göring-Eckardt,katrin-goring-eckardt,168,Herr Rupprecht.,data/txt/17098.txt,chair,
2494439,98,17,0,Albert Rupprecht (Weiden) (CDU/CSU),Albert Rupprecht,albert-rupprecht,169,"Frau Ministerin, der Entwurf des Anerkennungsgesetzes ist aus unserer Sicht ein Meilenstein auf dem Weg zu mehr Integration. Respekt hierfür! Viele haben lange darüber geredet; diese Regierung bringt es auf den Weg.

Nichtsdestotrotz geht es um die Qualität, die wir gewährleistet haben wollen. Ich frage Sie meinerseits zum einen: Wie schaffen wir es, dass die dezentral getroffenen Entscheidungen auf vergleichbare Weise zustande kommen? Zum anderen frage ich Sie, die Frage des Kollegen von der FDP vertiefend: Wie gewährleisten wir über den medizinischen Bereich hinaus, dass die hohe Qualität des deutschen Ausbildungssystems aufrechterhalten wird?",data/txt/17098.txt,speech,cducsu
2494440,98,17,0,"Dr. Annette Schavan, Bundesministerin für Bildung und Forschung",Dr. Annette Schavan,annette-schavan,170,"Wir gewährleisten das auf zweifache Weise: erstens indem die Prüfungen durch die Industrie- und Handelskammern oder Handwerkskammern oder sonstige berufsnahe Stellen erfolgen - sie erfolgen nicht bei einer neuen staatlichen Behörde, sondern da, wo Ausbildungsverordnungen mit uns entwickelt werden, da, wo Kompetenz hinsichtlich der Erstausbildung und der Weiterbildung sitzt. Und zweitens macht das Gesetz sehr deutlich, dass deutsche Qualitätsstandards der Referenzpunkt und Maßstab sind, mit dem die ausländischen Qualifikationen und Zertifikate geprüft werden. Es geht immer um Gleichwertigkeit und Vergleichbarkeit: Ist das, was vorgelegt wird, vergleichbar mit dem Berufsbild, um das es geht?

Ich bin fest davon überzeugt: Es liegt im Interesse von allen Berufsbranchen, ihren Qualitätslevel zu halten. Ich füge allerdings hinzu: Ich glaube nicht, dass es in der Welt nicht auch andere Orte gibt, an denen eine qualitätsbewusste Ausbildung erfolgt und Berufserfahrung gewonnen wird. Indem wir keine neue Behörde schaffen, sondern die Kompetenzen, die da sind, nutzen, wird das Ganze - davon bin ich überzeugt - nicht zu einem Absinken der Qualität führen.",data/txt/17098.txt,speech,
2494441,98,17,0,Vizepräsidentin Katrin Göring-Eckardt,Katrin Göring-Eckardt,katrin-goring-eckardt,171,Der Kollege Schulz.,data/txt/17098.txt,chair,
2494442,98,17,0,Swen Schulz (Spandau) (SPD),Swen Schulz,swen-schulz,172,"Schönen Dank, Frau Präsidentin. - Verehrte Frau Bundesministerin, ich habe leider den Beginn Ihrer Ausführungen nicht verfolgen können, weil die SPD-Fraktion noch getagt hat. Deswegen verzeihen Sie, wenn ich jetzt möglicherweise nach etwas frage, das Sie schon ausgeführt haben.

Der Gesetzentwurf beinhaltet Regelungen für nur einen Teil der Ausbildungen, nämlich diejenigen, die sozusagen durch Bundesrecht zu regeln sind. Aber es gibt noch eine ganze Menge mehr. Deswegen die Frage: Wie gestaltet sich der Prozess? Engagiert sich die Bundesregierung gemeinsam mit den Bundesländern, eine Regelung hinzubekommen, die tatsächlich eine Verbesserung für alle Ausbildungen, alle Berufe darstellt?",data/txt/17098.txt,speech,spd
2494443,98,17,0,Vizepräsidentin Katrin Göring-Eckardt,Katrin Göring-Eckardt,katrin-goring-eckardt,173,"Frau Ministerin, bitte.",data/txt/17098.txt,chair,
2494444,98,17,0,"Dr. Annette Schavan, Bundesministerin für Bildung und Forschung",Dr. Annette Schavan,annette-schavan,174,"Selbstverständlich. Ich will kurz die Zahlen, die ich vorhin genannt habe, wiederholen, weil man sich dann ein Bild davon machen kann, wer wie stark betroffen sein wird. Wir gehen von etwa 285 000 interessierten Personen in Deutschland aus. Davon haben rund 250 000 eine Lehre oder eine Art berufsqualifizierende Ausbildung abgeschlossen. Die große Gruppe der 350 Ausbildungsberufe ist also sozusagen das Herzstück der neuen Regelungen. Der Anteil derer, die einen Hochschul- oder Fachhochschulabschluss mitbringen und die zum Teil - wie beispielsweise Lehrer - in die Regelungszuständigkeit der Länder fallen, ist vergleichsweise gering. Wir haben in den letzten Monaten konstruktive Gespräche mit den Ländern geführt, damit entsprechende Veränderungen auch in den Ländern vorgenommen werden. Mit keinem der 16 Länder gibt es Dissens darüber, dass nicht nur gesetzliche Änderungen vorzunehmen sind, sondern dass auch die Praxis der Anerkennung zu verbessern ist; denn so wichtig das Gesetz ist, so wichtig ist auch die Praxis, bis hin zu dem Punkt, den ich eingangs genannt hatte, nämlich dass mit der Anerkennung in einem Land zugleich die Anerkennung in Deutschland insgesamt gewährleistet sein muss.",data/txt/17098.txt,speech,
2494445,98,17,0,Vizepräsidentin Katrin Göring-Eckardt,Katrin Göring-Eckardt,katrin-goring-eckardt,175,"Ich möchte gerne darauf hinweisen, dass wir ausdrücklich die Nachricht aus der Geschäftsführung der SPD-Fraktion hatten, dass wir mit der Regierungsbefragung beginnen sollen.",data/txt/17098.txt,chair,
2494446,98,17,0,Christian Lange [Backnang] [SPD],Christian Lange,christian-lange,176,Das ist nicht der Fall! Dies bestreite ich hiermit!,data/txt/17098.txt,poi,spd
2494447,98,17,0,Vizepräsidentin Katrin Göring-Eckardt,Katrin Göring-Eckardt,katrin-goring-eckardt,177,- Ich kann das nur so sagen.,data/txt/17098.txt,chair,
2494448,98,17,0,Christian Lange [Backnang] [SPD],Christian Lange,christian-lange,178,Hier sitzt die Geschäftsführung!,data/txt/17098.txt,poi,spd
2494449,98,17,0,Vizepräsidentin Katrin Göring-Eckardt,Katrin Göring-Eckardt,katrin-goring-eckardt,179,Jetzt gebe ich das Wort zu einer Frage dem Kollegen Feist.,data/txt/17098.txt,chair,
2494450,98,17,0,Dr. Thomas Feist (CDU/CSU),Dr. Thomas Feist,thomas-feist,180,"Vielen Dank, Frau Präsidentin. - Frau Ministerin, ich bin mir sicher, dass die Menschen, über die Sie vorhin gesprochen haben - 285 000 waren das -, dieses Gesetz mit großer Spannung erwartet haben. Ich weiß das auch von Organisationen aus meiner Heimatstadt Leipzig. Für mich wäre interessant, zu erfahren, wie es gewährleistet worden ist, dass die Verbände der Betroffenen in das Erstellen des Gesetzes eingebunden worden sind. Gibt es schon erste Reaktionen von diesen darauf?",data/txt/17098.txt,speech,cducsu
2494451,98,17,0,Vizepräsidentin Katrin Göring-Eckardt,Katrin Göring-Eckardt,katrin-goring-eckardt,181,Frau Ministerin.,data/txt/17098.txt,chair,
2494452,98,17,0,"Dr. Annette Schavan, Bundesministerin für Bildung und Forschung",Dr. Annette Schavan,annette-schavan,182,"Es hat in den vergangenen Monaten enorm viele Reaktionen der Gruppen, der Verbände - aus unterschiedlichsten Branchen -, der Kammern und der Länder gegeben. Mein Eindruck ist: Es gibt einen überwältigenden Konsens, dass dieses Vorhaben wichtig und ist und dass die Staatsangehörigkeit kein Kriterium für die Zulassung zu bestimmten Berufen sein kann. Der Teufel steckt im Detail. Natürlich hat jeder Berufsverband deutlich gemacht, dass ihm Qualität wichtig ist. Das ist aber auch unbestritten. Deshalb sagen wir: Wenn die Anerkennung nicht gleich möglich ist, dann muss die Stelle, die geprüft hat, deutlich sagen - das ist eine Frage der Transparenz -, warum die Anerkennung nicht möglich ist. Sie darf nicht rein gefühlsmäßig entscheiden, dass eine Qualifikation nicht reicht. Neu ist also, dass es eine transparente Information darüber geben muss, welche Qualifikationsbestandteile noch erbracht werden müssen. Ich glaube, dass eines der wichtigsten Signale an die betroffenen Gruppen ist, dass es um faire Kriterien und Transparenz geht und nicht um eine gefühlte Akzeptanz oder Nichtakzeptanz.

Mit Blick auf den Aufbau der Strukturen, die erforderlich sind, um die Anerkennungsverfahren zügig durchzuführen - drei Monate ist ein anspruchsvolles Ziel -, gab es eine sehr gute Zusammenarbeit mit diesen vielen Partnern, die im Zusammenhang mit der Änderung von 60 Berufsgesetzen gefordert waren.",data/txt/17098.txt,speech,
2494453,98,17,0,Vizepräsidentin Katrin Göring-Eckardt,Katrin Göring-Eckardt,katrin-goring-eckardt,183,"Frau Kollegin Hein, bitte.",data/txt/17098.txt,chair,
2494454,98,17,0,Dr. Rosemarie Hein (DIE LINKE),Dr. Rosemarie Hein,rosemarie-hein,184,"Frau Ministerin, ich bin, ehrlich gesagt, aus dem, was Sie vorhin gesagt haben, und der Antwort, die Sie eben Herrn Schulz gegeben haben, nicht so richtig schlau geworden. Ich möchte deshalb gerne nachfragen. Sind nun mit diesem Gesetz auch Berufe erfasst, für die die Ausbildungszuständigkeit bei den Ländern liegt, oder nicht? Zum Zweiten: Sie haben gesagt, es gebe einheitliche Verfahrensregeln. Nun werden Sie sicherlich zugeben, dass man einheitliche Verfahrensregeln unterschiedlich auslegen kann. Können Sie ausschließen, dass die Kammern eine unterschiedliche Bewertung von vorgelegten Nachweisen vornehmen und eine Anerkennung vielleicht davon abhängig machen, ob es in dem betreffenden Beruf gerade einen Bedarf gibt oder nicht? Können Sie eine solche Einheitlichkeit im Verfahren mit diesem Gesetz tatsächlich garantieren?",data/txt/17098.txt,speech,linke
2494455,98,17,0,Vizepräsidentin Katrin Göring-Eckardt,Katrin Göring-Eckardt,katrin-goring-eckardt,185,"Frau Ministerin, bitte.",data/txt/17098.txt,chair,
2494456,98,17,0,"Dr. Annette Schavan, Bundesministerin für Bildung und Forschung",Dr. Annette Schavan,annette-schavan,186,"Zu Ihrer ersten Frage möchte ich klarmachen, was vom Gesetz erfasst ist. Erfasst sind sämtliche 350 Ausbildungsberufe, alle Heilberufe, Juristen, Fahrlehrer und weitere bundesrechtlich geregelte Berufe. Auf der Ebene der Länder zu regeln ist zum Beispiel die Anerkennung der Ausbildungsnachweise von Lehrern, Ingenieuren und Erziehern. Die Länder haben zugesagt, die entsprechenden Gesetze zu liefern. Deshalb habe ich eben gesagt: Das hat den Vorzug, dass es etwa bei den Lehrern nicht mehr nur um die Frage geht, ob jemand aus dem Ausland in Deutschland Lehrer werden darf; vielmehr wird die Debatte zwischen den Ländern sein: Was sind die Kriterien für die wechselseitige Anerkennung von Abschlüssen? Das Bundesgesetz deckt die allermeisten Anerkennungsfälle ab, zumal das Gros der hier lebenden Menschen mit Auslandsqualifikation - 250 000 von den von mir genannten 285 000 Personen - eine Art Lehre und sonstigen berufsqualifizierenden Abschluss hat, und damit in jedem Fall unter das Gesetz fällt. Das Allermeiste ist also geregelt. Dort, wo die Länder zuständig sind, sind Gesetze angekündigt.

Ich bin davon überzeugt, dass das Gesetz ein gutes Instrument ist, um bundesweite Vergleichbarkeit herzustellen. Wenn die Anerkennung ausgesprochen ist, kann nicht an anderer Stelle gesagt werden: Bei uns gilt das nicht.

Auch der Umgang mit vorgelegten Zertifikaten wird eingeübt werden müssen; das ist gar keine Frage. Da wird es manche interne Diskussion geben. Der Rechtsanspruch bedeutet aber, dass es einen Anspruch darauf gibt, dass geprüft wird und dass am Ende transparent erklärt wird, wie die Anerkennung oder die Nichtanerkennung zustande kommt.",data/txt/17098.txt,speech,
2494457,98,17,0,Vizepräsidentin Katrin Göring-Eckardt,Katrin Göring-Eckardt,katrin-goring-eckardt,187,Herr Kollege Weinberg.,data/txt/17098.txt,chair,
2494458,98,17,0,Marcus Weinberg (Hamburg) (CDU/CSU),Marcus Weinberg,marcus-weinberg,188,"Vielen Dank, Frau Präsidentin. - Frau Ministerin, Kollege Rupprecht hat schon gesagt, dass dies für die Zielgruppe des Gesetzentwurfs, für die hier lebenden rund 300 000 Migranten, unter arbeitsmarkt- und integrationspolitischen Gesichtspunkten ein Meilenstein ist. In zwei Nebensätzen haben Sie schon angesprochen, dass damit natürlich die Frage einhergeht, was in Zukunft mit den Menschen passiert, die nach Deutschland kommen.

Meine Frage ist, inwieweit man überlegt hat, ob es in Zukunft eine Beratungsmöglichkeit bereits im Ursprungsland geben soll, und inwieweit man mit den Außenhandelskammern, mit den Botschaften und mit den Konsulaten im Gespräch ist, damit diese Beratungsfunktion für die Menschen, die nach Deutschland kommen und das Anerkennungsverfahren bereits frühzeitig durchführen wollen, auch in Zukunft gewährleistet ist.",data/txt/17098.txt,speech,cducsu
2494459,98,17,0,Vizepräsidentin Katrin Göring-Eckardt,Katrin Göring-Eckardt,katrin-goring-eckardt,189,Frau Ministerin.,data/txt/17098.txt,chair,
2494460,98,17,0,"Dr. Annette Schavan, Bundesministerin für Bildung und Forschung",Dr. Annette Schavan,annette-schavan,190,"Ein Antrag auf Prüfung der Anerkennung kann in der Tat auch vom Ausland aus gestellt werden. Man muss also nicht schon in Deutschland sein. Das wird in den weiteren Debatten über Fachkräfte ein interessanter Punkt werden: Welche Rolle spielt, dass jemand bereits im Ausland einen Antrag gestellt hat, dieser bearbeitet wurde und die Anerkennung ausgesprochen wurde? Das erleichtert hier natürlich vieles.

Ich gehe davon aus, dass die Botschaften bzw. Konsulate eine zentrale Anlaufstelle sein werden und die Vermittlung zur Hotline oder zu den Anerkennungsstellen organisieren werden. Und auch innerhalb Deutschlands wird es regionale Stellen geben, die Beratung anbieten und Verbindungen herstellen werden.",data/txt/17098.txt,speech,
2494461,98,17,0,Vizepräsidentin Katrin Göring-Eckardt,Katrin Göring-Eckardt,katrin-goring-eckardt,191,Kollege Kilic.,data/txt/17098.txt,chair,
2494462,98,17,0,Memet Kilic (BÜNDNIS 90/DIE GRÜNEN),Memet Kilic,memet-kilic,192,"Vielen Dank, Frau Präsidentin. - Sehr verehrte Bildungsministerin, Sie haben in der Öffentlichkeit verkündet, dass Sie nicht wollen, dass Ärzte als Taxifahrer beschäftigt werden. Diesen Ansatz haben wir begrüßt. Ihr erster Arbeitsentwurf machte auch große Hoffnungen. Darin haben Sie festgelegt, dass Sie den Immigranten zu ihren Berufen adäquate Beschäftigungen ermöglichen wollen. Aus meiner Sicht wird dieses Ziel im Gesetzentwurf allerdings ein bisschen verwässert. Dort ist von berufsnahen Beschäftigungen die Rede. Ist das so zu verstehen, dass man sich damit zufriedengeben wird, wenn ein Arzt als Krankenpfleger oder eine Krankenschwester als Altenpflegerin arbeitet? Das wäre schade.

Außerdem wäre es besser gewesen, wenn Sie die Regelungen, die sich auf Verfahren beziehen, für die Länder als verbindlich erklärt hätten. Das haben Sie bewusst nicht getan. Die Länder können jetzt eigene Verfahrensregelungen schaffen. Es wäre aber schade, wenn wir bundesweit 16 unterschiedliche Regelungen hätten.",data/txt/17098.txt,speech,gruene
2494463,98,17,0,Vizepräsidentin Katrin Göring-Eckardt,Katrin Göring-Eckardt,katrin-goring-eckardt,193,"Frau Ministerin, bitte.",data/txt/17098.txt,chair,
2494464,98,17,0,"Dr. Annette Schavan, Bundesministerin für Bildung und Forschung",Dr. Annette Schavan,annette-schavan,194,"Es liegt nicht in der Kompetenz der Länder, Regelungen zu den Heilberufen zu schaffen. Die Regelungszuständigkeit für sämtliche Heilberufe liegt beim Bund.

Neben dem Ingenieurberuf wird vor allem der Arztberuf schon jetzt als Mangelberuf angesehen. Das wird zunehmen. Dann wird es schlicht ein großes Interesse daran geben, dass diejenigen, die Ärzte sind, auch als Ärzte arbeiten können.

Zweitens machen wir kein Gesetz zur Vermittlung in berufsadäquate Beschäftigung, sondern ein Gesetz, das endlich die erforderlichen Voraussetzungen dafür schafft. Bezogen auf den Arztberuf heißt das, dass nicht mehr die Staatsangehörigkeit über die Approbation entscheidet, sondern die Qualifikation. Das ist ein ganz wichtiger Punkt, wenn man an die Ärzteversorgung in der Fläche denkt.

Ich kann niemandem vorschreiben, Menschen mit anerkanntem Abschluss zu beschäftigen. Aber klar ist: Wenn die Anerkennung des Abschlusses erfolgt ist, bringt derjenige, der sich um eine adäquate Beschäftigung bewirbt, die dafür notwendigen Voraussetzungen mit. Er kann nicht abgewiesen werden mit der Begründung, die Voraussetzungen lägen nicht vor. Das ist ein entscheidender Schritt, gleichsam die rechtliche Voraussetzung, um sich bewerben zu können.",data/txt/17098.txt,speech,
2494465,98,17,0,Vizepräsidentin Katrin Göring-Eckardt,Katrin Göring-Eckardt,katrin-goring-eckardt,195,Frau Kollegin Kolbe.,data/txt/17098.txt,chair,
2494466,98,17,0,Daniela Kolbe (Leipzig) (SPD),Daniela Kolbe,daniela-kolbe,196,"Vielen Dank, Frau Präsidentin. - Frau Bundesministerin, Sie haben recht: Es gibt schon seit langem einen Konsens darüber, dass wir ein Anerkennungsgesetz brauchen. Ich freue mich darüber, dass jetzt ein Entwurf dazu vorliegt. Allerdings: Dass es weiterhin ein Wirrwarr von Anlaufstellen gibt und dass Sie sich nicht Gedanken darüber gemacht haben, wie man den Menschen weiterhilft, die keine Anerkennung oder nur eine Teilanerkennung bekommen, denen der große Schritt zu einer wirklichen Anerkennung also fehlt, betrübt mich sehr. Sie als Bildungsministerin wissen ja, dass viele der Menschen, die schon jetzt ein Recht auf Feststellung der Anerkennung haben, mit dem, was sie erhalten, zum Beispiel eine Ablehnung, nicht weiterkommen. Ich hätte mir gewünscht, dass die Bundesregierung für diese Menschen Wege aufzeigt, sodass ein solches Ergebnis nicht zustande kommt. Das ist nicht geschehen.

Insgesamt habe ich den Eindruck, dass die Bundesregierung versucht hat, hier möglichst unter der Prämisse ""Es darf nichts kosten"" zu agieren. Genau dazu die Frage. Sie schreiben in dem Gesetz zum Thema Kosten, dass Anpassungsmaßnahmen für Menschen, die zum Beispiel über die Argen, die Jobcenter betreut werden, aus dem Topf der aktiven Arbeitsmarktförderung finanziert werden sollen. Diesen Topf hat die Bundesregierung aber schon massiv gekürzt. Können Sie mir dazu eine Zahl sagen? Mit welcher Größenordnung rechnen Sie in diesem Feld? Ich halte diese Maßnahmen für sinnvoll. Allerdings ist die Frage, ob die Größe des Topfes angemessen ist.

Eine zweite Frage. Vergleichbarkeit setzt Wissen voraus. Man muss wissen, welches Wissen für bestimmte Berufe in Uganda oder in anderen Staaten notwendig ist. Auch über das Sammeln und Verwalten von Wissen dazu steht in Ihrem Gesetz nichts. Das hat mich sehr enttäuscht.",data/txt/17098.txt,speech,spd
2494467,98,17,0,Vizepräsidentin Katrin Göring-Eckardt,Katrin Göring-Eckardt,katrin-goring-eckardt,197,Frau Ministerin.,data/txt/17098.txt,chair,
2494468,98,17,0,"Dr. Annette Schavan, Bundesministerin für Bildung und Forschung",Dr. Annette Schavan,annette-schavan,198,"Wenn ich Sie wäre, dann wäre ich jetzt eher ein bisschen betrübt darüber, dass niemand in den früheren Bundesregierungen auf die Idee gekommen ist, ein solches Gesetz vorzulegen.",data/txt/17098.txt,speech,
2494469,98,17,0,Albert Rupprecht [Weiden] [CDU/CSU],Albert Rupprecht,albert-rupprecht,199,So ist es!,data/txt/17098.txt,poi,cducsu
