id,sitzung,wahlperiode,in_writing,speaker,speaker_cleaned,speaker_fp,sequence,text,filename,type,speaker_party
2494560,98,17,0,Katja Keul (BÜNDNIS 90/DIE GRÜNEN),Katja Keul,katja-keul,290,"Vielen Dank. - Herr Staatssekretär Schmidt, es ist ja etwas verwirrend. Deswegen nochmals die Nachfrage, um zu sehen, ob ich das auch richtig verstanden habe. Sie sagen, bis zum 19. März sind die AWACS und die entsprechenden Schiffe in einem Bereich eingesetzt gewesen, in dem sie unter anderem libyschen Luftraum mit überwacht haben, weil das zum allgemeinen Mandat dazugehörte. Am 19. März, also mit Beginn des Einsatzes der Koalition der Willigen, haben sich die AWACS und die Schiffe mit deutschen Besatzungen, wie Sie sagen, irgendwo in einen Bereich im Mittelmeer zurückgezogen, in dem sie außerhalb des Bereichs waren, von dem aus sie libyschen Luftraum überwachen konnten. Habe ich das richtig verstanden und, wenn ja, wohin sind sie denn gefahren? Wo waren sie dann außerhalb der Reichweite?",data/txt/17098.txt,speech,gruene
2494561,98,17,0,"Christian Schmidt, Parl. Staatssekretär beim Bundesminister der Verteidigung",Christian Schmidt,christian-schmidt,291,"Ich darf das für die AWACS-Flugzeuge sagen. Wir haben ja einen Teil dieser Flugzeuge mit den Pilzen drauf, die sehr augenfällig sind und die unter NATO-Kommando stehen - das ist eine Zahl von, ich glaube, 16 oder 17 Flugzeugen -, und dann nationale Flugzeuge amerikanischer, britischer und französischer Herkunft. Es gibt dann noch einige weitere andere Typen. Aber ich nehme einmal diese drei Nationen, weil sie ja die Hauptträger der Umsetzung der Resolution 1973 sind. In der Tat wurde das Luftlagebild Libyens ab dem 19. März von nationalen AWACS-Flugzeugen und nicht mehr von NATO-Flugzeugen erstellt.

Ich kann Ihnen die Flugrouten der AWACS-Flugzeuge der NATO nun nicht genau nennen. Aber wenn man davon ausgeht - ich mag mich korrigieren, wenn ich jetzt etwas Falsches sage -, dass die Eindringtiefe eines AWACS-Flugzeuges sichtmäßig 400 Kilometer beträgt - ich glaube, das ist sogar etwas zu weit -, dann zeigt sich, dass das Mittelmeer durchaus auch Räume hat, von denen aus man, wenn man dort fliegt, keinen Einblick in diese Region mehr hat.

Es wurde hier aufgeschrieben: das zentrale Mittelmeer. Ich würde einmal sagen, dass es das Gebiet nördlich des Einzugsgebiets Große Syrte usw. vor Libyen ist. Wie groß die Entfernung genau ist, kann ich Ihnen nicht sagen. Ich weiß auch nicht, ob das genau rekonstruierbar ist; aber sie sind mit erheblichem Sicherheitsabstand geflogen.",data/txt/17098.txt,speech,
2494562,98,17,0,Vizepräsidentin Petra Pau,Petra Pau,petra-pau,292,"Danke, Herr Staatssekretär.

Wir kommen zum Geschäftsbereich des Bundesministeriums für Ernährung, Landwirtschaft und Verbraucherschutz.

Die dringliche Frage 7 der Abgeordneten Vogler wird schriftlich beantwortet.

Nachdem die dringlichen Fragen aufgerufen und beantwortet worden sind, rufe ich jetzt die Fragen auf Drucksache 17/5120 in der üblichen Reihenfolge auf.

Wir kommen zum Geschäftsbereich des Bundesministeriums für Wirtschaft und Technologie.

Die Frage 1 des Abgeordneten Tom Koenigs, die Frage 2 des Abgeordneten Andrej Hunko, die Frage 3 des Abgeordneten Garrelt Duin, die Fragen 4 und 5 der Abgeordneten Ingrid Nestle und die Frage 6 der Abgeordneten Bärbel Höhn werden schriftlich beantwortet.

Wir kommen damit zum Geschäftsbereich des Bundesministeriums für Arbeit und Soziales. Zur Beantwortung der Fragen steht der Parlamentarische Staatssekretär Hans-Joachim Fuchtel zur Verfügung.

Ich rufe die Frage 7 des Kollegen Barchmann auf:

In welcher Form werden die Instrumente und Programme des Bundes, die zur Überwindung von migrationsspezifischen Hindernissen bei der Integration in Ausbildung, Arbeit oder Selbstständigkeit dienen, von Einsparungen im Bundeshaushalt und bei der Bundesagentur für Arbeit aktuell und mittelfristig betroffen sein?

Bitte, Herr Staatssekretär.",data/txt/17098.txt,chair,
2494563,98,17,0,"Hans-Joachim Fuchtel, Parl. Staatssekretär bei der Bundesministerin für Arbeit und Soziales",Hans-Joachim Fuchtel,hans-joachim-fuchtel,293,"Herr Kollege, wenn Sie einverstanden sind, würde ich die Fragen 7 und 8 gern gemeinsam beantworten.",data/txt/17098.txt,speech,
2494564,98,17,0,Heinz-Joachim Barchmann [SPD],Heinz-Joachim Barchmann,heinz-joachim-barchmann,294,Bin ich!,data/txt/17098.txt,poi,spd
2494565,98,17,0,"Hans-Joachim Fuchtel, Parl. Staatssekretär bei der Bundesministerin für Arbeit und Soziales",Hans-Joachim Fuchtel,hans-joachim-fuchtel,295,- Vielen Dank.,data/txt/17098.txt,speech,
2494566,98,17,0,Vizepräsidentin Petra Pau,Petra Pau,petra-pau,296,"Dann rufe ich die Frage 8 des Abgeordneten Barchmann auf:

Welche inhaltlichen Veränderungen bei den Instrumenten und Programmen des Zweiten und Dritten Buches Sozialgesetzbuch mit migrationsspezifischen Anteilen bzw. den Instrumenten und Programmen, an denen Personen mit Migrationshintergrund besonders partizipieren, sind angesichts der von der Bundesregierung geplanten Reform der arbeitsmarktpolitischen Instrumente derzeit geplant?",data/txt/17098.txt,chair,
2494567,98,17,0,"Hans-Joachim Fuchtel, Parl. Staatssekretär bei der Bundesministerin für Arbeit und Soziales",Hans-Joachim Fuchtel,hans-joachim-fuchtel,297,"Zunächst einmal zu dem Zweiten und Dritten Sozialgesetzbuch und den darin geregelten Instrumentarien. Nach dem Aufbau des Sozialgesetzbuchs wird keine spezifische Zielgruppe herausgegriffen, sondern es geht um das Instrument insgesamt. Bei dem Instrument geht es darum, zu erreichen, generell Langzeitarbeitslosigkeit zu vermeiden oder auch zu beseitigen und individuelle Beschäftigungsfähigkeiten wiederherzustellen. In diesem Zusammenhang bemüht man sich natürlich auch sehr stark darum, individuelle migrationsspezifische Hemmnisse zu beseitigen. Anfängliche Defizite in der Ausbildung der Mitarbeiter wurden in der Zwischenzeit durch viele Bemühungen der Bundesagentur und der Jobcenter behoben.

Insoweit werden die Kürzungen auch davon abhängen, wie die Arbeitsmarktinstrumente in der Zukunft aussehen. Die Abstimmung hierüber haben wir in der Bundesregierung noch nicht abgeschlossen, sodass ich am heutigen Tage auch noch keine spezielle Aussage dazu machen kann. Ich erwarte, dass wir in der nächsten Zeit recht viel mehr dazu sagen können.

Ein besonderes Programm ist das Netzwerk ""Integration durch Qualifizierung"", IQ. Hierbei geht es um die berufliche Integration und die Beratung von Zuwanderern. Dieses Netzwerk soll nach dem derzeitigen Stand fortgesetzt werden. Im Jahre 2011 ist es mit 10 Millionen Euro dotiert, wobei 7 Millionen Euro aus dem Etat des Bundesministeriums für Arbeit und Soziales und 3 Millionen Euro aus dem Etat des Bundesministeriums für Bildung und Forschung kommen. Die Bundesregierung plant, dieses Netzwerk wenigstens bis Ende 2014 fortzusetzen.",data/txt/17098.txt,speech,
2494568,98,17,0,Vizepräsidentin Petra Pau,Petra Pau,petra-pau,298,Sie haben die Möglichkeit zu insgesamt vier Nachfragen. Bitte.,data/txt/17098.txt,chair,
2494569,98,17,0,Heinz-Joachim Barchmann (SPD),Heinz-Joachim Barchmann,heinz-joachim-barchmann,299,Ich verzichte auf Nachfragen.,data/txt/17098.txt,speech,spd
2494570,98,17,0,Vizepräsidentin Petra Pau,Petra Pau,petra-pau,300,"Sie verzichten. - Herzlichen Dank, Herr Staatssekretär.

Die Fragen 9 und 10 des Abgeordneten Stefan Schwartze, die Fragen 11 und 12 des Abgeordneten Markus Kurth, die Frage 13 des Abgeordneten Dr. Ilja Seifert und die Frage 14 der Abgeordneten Sabine Zimmermann sollen schriftlich beantwortet werden.

Damit kommen wir zum Geschäftsbereich des Bundesministeriums für Ernährung, Landwirtschaft und Verbraucherschutz.

Die Fragen 15 und 16 der Abgeordneten Kerstin Tack sollen ebenfalls schriftlich beantwortet werden.

Wir kommen zum Geschäftsbereich des Bundesministeriums der Verteidigung. Zur Beantwortung der Fragen steht wiederum der Parlamentarische Staatssekretär Christian Schmidt zur Verfügung.

Ich rufe die Frage 17 des Kollegen Hans-Christian Ströbele auf:

Nach welchen Kriterien, Bezug nehmend auf meine mündlichen Fragen auf Bundestagsdrucksache 17/4812 und 17/5015 - vergleiche Plenarprotokoll 17/92 und 17/95 -, wählen Bundeswehr-Scharfschützen in Afghanistan Zielpersonen aus, die sie aus dem Hinterhalt nach oft langem getarnten Warten aus mehreren 100 Metern Entfernung militärisch bekämpfen, also töten, auch wenn diese nicht ""unmittelbar an Feindseligkeiten beteiligt"" sind, sondern sich auf Wegen oder Feldern bewegen und nichtsahnend ungedeckt ins freie Schussfeld treten, und wenn somit eine vom Scharfschützen nur durchs Fernglas aktuell beobachtete unmittelbare Beteiligung der einzelnen Personen an Feindseligkeiten als Auswahlkriterium faktisch entfällt, nach welchen sonstigen Kriterien, Fotos, Beschreibungen oder Ähnlichem erkennen die Scharfschützen ""ihre Zielperson"" sonst und schließen versehentlichen tödlichen militärischen Einsatz gegen nicht unmittelbar an Feindseligkeiten beteiligte, also unbeteiligte, harmlose Zivilpersonen wirkungsvoll aus?

Bitte, Herr Staatssekretär.",data/txt/17098.txt,chair,
2494571,98,17,0,"Christian Schmidt, Parl. Staatssekretär beim Bundesminister der Verteidigung",Christian Schmidt,christian-schmidt,301,"Vielen Dank, Frau Präsidentin. - Herr Kollege Ströbele, die Entscheidung zur Bekämpfung eines legitimen militärischen Ziels ist nach den jeweiligen Umständen des Einzelfalls zu bewerten. Ausgangspunkt ist dabei regelmäßig die Beurteilung, ob es sich um eine Person handelt, die sich unmittelbar an Feindseligkeiten beteiligt. Zur Vermeidung der Gefährdung von unbeteiligten Zivilpersonen muss dies vor der Anwendung militärischer Gewalt durch entsprechende Beobachtungen sichergestellt sein.

Scharfschützen der Bundeswehr in Afghanistan stehen keine Befugnisse zur Anwendung militärischer Gewalt zu, die über die Befugnisse der anderen Kräfte des deutschen Einsatzkontingents ISAF hinausgehen. Auf der Grundlage der völkerrechtlichen Ermächtigung durch den Sicherheitsrat der Vereinten Nationen und des Mandates des Deutschen Bundestages gelten das internationale operative ISAF-Regelwerk und auch die Taschenkarte für den deutschen Anteil an ISAF.",data/txt/17098.txt,speech,
2494572,98,17,0,Vizepräsidentin Petra Pau,Petra Pau,petra-pau,302,"Ihre erste Nachfrage, bitte.",data/txt/17098.txt,chair,
2494573,98,17,0,Hans-Christian Ströbele (BÜNDNIS 90/DIE GRÜNEN),Hans-Christian Ströbele,hans-christian-strobele,303,"Herr Staatssekretär, das ist die graue Theorie. Ich bedanke mich zunächst einmal bei Ihnen - das ist ja die dritte Frage, die ich zu diesem Thema gestellt habe -, dass Sie mir jetzt noch einmal schriftlich beantwortet haben, wie viele Scharfschützen die Bundeswehr in den letzten Jahren bis heute in Afghanistan eingesetzt hat. Ich habe zur Kenntnis genommen, dass sich die Anzahl von 2008 bis 2010 verdreifacht hat. Dadurch wird diese Anfrage, die ich hier jetzt noch einmal gestellt habe, besonders dringlich.

Sie wissen - darauf habe ich mich ja bezogen -, dass der Stern von einem Scharfschützen berichtet hat, der in Afghanistan eingesetzt ist, und er hat auch darüber berichtet, dass noch mehrere solcher Scharfschützen mit einem solchen Auftrag dort sind. Der Auftrag soll darin bestehen, dass sich der Scharfschütze an einer Durchgangsstraße postiert und möglicherweise ein bis zwei Tage im Gras liegt und wartet, bis ein vermutlicher, feindlicher Kämpfer auftaucht, um ihn dann aus großer Entfernung - 800 Meter oder ähnlich weit entfernt - zu bekämpfen, das heißt, zu erschießen.

Alle meine Fragen zielen darauf hin: Nach welchen Kriterien entscheiden Scharfschützen - nicht allgemein; das könnte ich auch nachlesen -, wenn sie alleine dort warten, sich also nicht in einer Kampfhandlung befinden - sie warten dort, bis jemand kommt -, ob es sich bei der Person, die sie an bzw. auf der Straße sehen - meinetwegen einen jungen Mann, der sich vielleicht an der Straße zu schaffen macht -, um eine Person handelt, gegen die sie militärisch, das heißt, durch Töten, vorgehen?

Ich habe besonderen Anlass zu dieser Frage: Ich habe den Spiegel von dieser Woche gelesen, dessen Lektüre ich Ihnen dringend empfehlen kann. Er enthält einen längeren Artikel über US-amerikanische NATO-Soldaten, die sich geradezu einen Spaß daraus gemacht haben, dort Unschuldige, also Nichtkämpfer, zu töten und sich anschließend, indem sie die Köpfe der Getöteten hochhalten, als Trophäenjäger zu präsentieren. Vor diesem Hintergrund frage ich Sie: Wie kann man ausschließen, dass durch diese Scharfschützen auch Unschuldige getroffen werden, die nicht an Kampfhandlungen beteiligt sind?",data/txt/17098.txt,speech,gruene
2494574,98,17,0,"Christian Schmidt, Parl. Staatssekretär beim Bundesminister der Verteidigung",Christian Schmidt,christian-schmidt,304,"Sehr geehrter Kollege Ströbele, diesen Spiegel-Artikel haben sicherlich viele Kollegen im Haus gelesen. Wir alle teilen die Abscheu gegenüber dem, was an völlig inakzeptablen und auch rechtlich in keiner Weise zu rechtfertigenden menschenverachtenden Handlungen dort stattgefunden hat. Wenn ich richtig informiert bin, bezieht sich der Artikel auf ein Gerichtsverfahren gegen die betroffenen amerikanischen Soldaten. Soweit ich weiß, hat sich die Regierung der Vereinigten Staaten von Amerika bereits entschuldigt und davon distanziert. Ob schon eine Verurteilung erfolgt ist, ist mir nicht bekannt.

Im Zusammenhang mit der Frage der Völkerrechtsmäßigkeit von militärischen Handlungen, die Sie angesprochen haben, gehe ich davon aus, dass wir sehr scharf zwischen Angelegenheiten trennen müssen, die die amerikanische Armee innerhalb ihrer Verantwortlichkeiten zu behandeln hat, und dem nach Recht und Gesetz abgesicherten Verhalten von Soldaten der Bundeswehr. Falls hier ein Zusammenhang hergestellt werden sollte, würde ich ihn in aller Schärfe zurückweisen.

Die von Ihnen gestellte Frage hat auch damit zu tun, inwieweit man das Völkerrecht in extenso nutzt. Das Völkerrecht sieht vor, dass bei einer direkten Beteiligung an Feindseligkeiten eine Person, die aufgrund ihrer Rolle und Funktion bei den gegnerischen Kräften dauerhaft an den Feindseligkeiten beteiligt ist - das ist mit ""continuous combat function"" gemeint -, auch außerhalb der Teilnahme an konkreten Feindseligkeiten ein legitimes militärisches Ziel ist. Landläufig heißt das, dass die Anführer, die Rädelsführer auch dann bekämpft werden können, wenn es keine unmittelbaren Kampfhandlungen und Gefechte gibt.

Das ist eine der Grundlagen im Zusammenhang mit dem sogenannten Targeted Killing. Wir haben bei anderer Gelegenheit in diesem Hause darüber gesprochen, dass sich die Bundeswehr an dem Targeted Killing nicht beteiligt. Ziel und Auftrag der Bundeswehr ist es nicht, die auf der Liste genannten Personen - sie ist als ""JPEL list"" bekannt - zu töten, sondern sie zu verhaften und festzusetzen.

Scharfschützen haben - das habe ich bereits angedeutet - über Aufgaben und Funktion der Bundeswehr insgesamt im ISAF-Einsatz und innerhalb des nationalen und völkerrechtlichen Regelwerkes hinaus keine Befugnisse. Sie haben deshalb nur die Befugnis, bei einer unmittelbaren Verknüpfung mit Kampfhandlungen tätig zu werden.

Ich weiß nicht, wo die Bilder, die Sie im Zusammenhang mit dem Artikel im Stern ansprechen, entstanden sind und wer dafür verantwortlich ist. Ich kann Ihnen aber versichern, dass es nach Ausbildung, Ausrüstung und Befehlslage Scharfschützen, die in schwierigen Gefechtssituationen durchaus zum Einsatz kommen und die auch benötigt werden, nicht erlaubt ist, nur dazuliegen und so lange zu warten, bis einer vorbeikommt, der ein Gegner sein könnte. Dies ist nach dem nationalen Regelwerk für die deutschen Soldaten ausgeschlossen.",data/txt/17098.txt,speech,
2494575,98,17,0,Vizepräsidentin Petra Pau,Petra Pau,petra-pau,305,"Kollege Ströbele, bevor Sie Ihre zweite Nachfrage stellen, erlaube ich mir den Hinweis, dass wir noch zwei Minuten in der Fragestunde haben. Es wäre also schön, wenn wir es schafften, Frage und Antwort in ein angemessenes zeitliches Verhältnis zu stellen.",data/txt/17098.txt,chair,
2494576,98,17,0,Hans-Christian Ströbele (BÜNDNIS 90/DIE GRÜNEN),Hans-Christian Ströbele,hans-christian-strobele,306,"Meine zweite Nachfrage ist noch kürzer. - Herr Staatssekretär Schmidt, die Scharfschützen, von denen ich rede - die Tätigkeit eines Scharfschützen ist im Stern beschrieben -, befinden sich nicht in aktuellen Kampfhandlungen, sondern liegen friedlich oder nicht friedlich im Gras - genau so, wie ich es beschrieben habe -, ohne dass um sie herum Kampfhandlungen stattfinden, und warten so lange, bis Personen auftauchen. Über diese Personen wissen sie nichts. Sie kennen weder ihre Herkunft noch ihre Tätigkeit. Allein von der visuellen Feststellung her gehen sie gegen diese vor. So wird das von einem der Scharfschützen beschrieben. Wollen Sie ausschließen, dass solche Scharfschützen auch gegen Unschuldige, an Kampfhandlungen nicht Beteiligte mit militärischen Mitteln vorgehen bzw. diese töten?",data/txt/17098.txt,speech,gruene
2494577,98,17,0,"Christian Schmidt, Parl. Staatssekretär beim Bundesminister der Verteidigung",Christian Schmidt,christian-schmidt,307,"Frau Präsidentin, im Rahmen der nationalen Regularien ist es den Scharfschützen der Bundeswehr in Afghanistan untersagt, Personen, die sich dauerhaft an bewaffneten Auseinandersetzungen beteiligen, also die genannte ""continuous combat function"" innehaben, außerhalb einer Situation, an der sie an konkreten Feindseligkeiten teilnehmen, durch gezielte Waffenwirkung zu bekämpfen.",data/txt/17098.txt,speech,
2494578,98,17,0,Vizepräsidentin Petra Pau,Petra Pau,petra-pau,308,"Danke, Herr Staatssekretär.

Wir sind damit am Ende der Fragestunde. Die übrigen Fragen werden schriftlich beantwortet.

Ich rufe den Zusatzpunkt 3 auf:

Aktuelle Stunde

auf Verlangen der Fraktion DIE LINKE

Konkrete Anforderungen insbesondere des Bundesumweltministeriums für die Sicherheitsüberprüfung deutscher Atomkraftwerke

Ich eröffne die Aussprache. Das Wort hat die Kollegin Dorothee Menzner für die Fraktion Die Linke.",data/txt/17098.txt,chair,
2494579,98,17,0,,,,309,Beifall bei der LINKEN,data/txt/17098.txt,poi,
2494580,98,17,0,Vizepräsidentin Petra Pau,Petra Pau,petra-pau,310,,data/txt/17098.txt,chair,
2494581,98,17,0,Dorothee Menzner (DIE LINKE),Dorothee Menzner,dorothee-menzner,311,"Frau Präsidentin! Werte Kolleginnen und Kollegen! Meine sehr geehrten Damen und Herren! Wir erleben seit Monaten - und im Moment mit wachsender Geschwindigkeit - eine Achterbahnfahrt in Sachen Atomenergie und energetischer Nutzung von Atomtechnik. Ich möchte Sie an den 28. Oktober letzten Jahres erinnern. Da haben wir in diesem Haus trotz massiver Bedenken vieler Kolleginnen und Kollegen mehrheitlich die Laufzeiten verlängert. Wir haben die Laufzeiten nach einem Verfahren verlängert, das mit den Produzenten, den Atomkonzernen ausgekungelt war. Man hätte meinen können, dass eine Sicherheitsüberprüfung der Kraftwerke vorgenommen worden wäre, bevor man zu einem solchen Schritt kommt. Am 11. März haben wir dann die unfassbare dreifache Katastrophe von Japan erlebt, nicht nur Erdbeben und Tsunami, sondern auch die atomare Katastrophe in Fukushima. Ich möchte betonen, auch wenn sie heute nicht mehr die Headline in allen Nachrichten bestimmt: Diese Katastrophe ist beileibe nicht beendet. Wir kennen bis heute nicht ihren Ausgang.

Gregor Gysi sagte letzte Woche: Die Vorkommnisse in Fukushima sind ""eine Zäsur, ein Zivilisationsbruch in der Geschichte des industriell-kapitalistischen Zeitalters"". - Er hat recht. Zu diesem Schluss komme ich, wenn ich tagtäglich die Nachrichten, die noch immer reich an Hiobsbotschaften sind, verfolge. Das Ganze hat einen ungewissen Ausgang und auf jeden Fall fatale Folgen für viele Japanerinnen und Japaner.

Jetzt liegt ein Papier vor, erstellt im Zusammenhang mit dem dreimonatigen sogenannten Moratorium. Die Arbeitsgruppe Reaktorsicherheit hat erste Überlegungen angestellt. So weit, so gut. In dem Papier steht viel Vernünftiges. Bei manchem frage ich mich allerdings, wieso man das nicht schon längst im Vorfeld des Oktobers auf die Tagesordnung gesetzt hat.",data/txt/17098.txt,speech,linke
2494582,98,17,0,,,,312,Beifall bei der LINKEN sowie bei Abgeordneten der SPD und des Abg. Oliver Krischer [BÜNDNIS 90/DIE GRÜNEN],data/txt/17098.txt,poi,
2494583,98,17,0,Dorothee Menzner (DIE LINKE),Dorothee Menzner,dorothee-menzner,313,"Es steht dort zum Beispiel, dass eine Erdbebenauslegung oder eine Hochwasserauslegung nach dem Stand von Wissenschaft und Technik erfolgen soll. Was ist denn, bitte schön, daran so Besonderes? Weiter hinten liest man, dass eine Notsteuerstelle selbst im Falle einer atomaren Kontamination betretbar und bedienbar sein muss. Ich behaupte: Das ist eigentlich etwas Normales. Das erwarten die Menschen mit Fug und Recht.",data/txt/17098.txt,speech,linke
2494584,98,17,0,,,,314,Beifall bei der LINKEN sowie bei Abgeordneten der SPD und des Abg. Oliver Krischer [BÜNDNIS 90/DIE GRÜNEN],data/txt/17098.txt,poi,
2494585,98,17,0,Dorothee Menzner (DIE LINKE),Dorothee Menzner,dorothee-menzner,315,"Wie gesagt, in diesem Papier steht viel Vernünftiges. Es wird auch angemerkt, dass man die Ereignisse von Fukushima abwarten, vielleicht nachsteuern und noch das eine oder andere aufnehmen muss. Aber eines wird auch deutlich: Selbst wenn man alles, was in diesem Papier aufgeführt ist, wirklich eins zu eins umsetzen würde, und nicht alles wieder weichspült und das eine oder andere herausstreicht, weil die Maßnahme ach so teuer wird, weil sie nicht leistbar ist oder weil sie die Gewinne der Konzerne schmälert, bleibt die energetische Nutzung von Atomenergie ein unsicheres Verfahren;",data/txt/17098.txt,speech,linke
2494586,98,17,0,,,,316,Beifall bei der LINKEN,data/txt/17098.txt,poi,
2494587,98,17,0,Dorothee Menzner (DIE LINKE),Dorothee Menzner,dorothee-menzner,317,"denn Menschen sind nun einmal fehlbar, und zwar sowohl bei der Planung als auch bei der Umsetzung von Dingen, sie sind fehlbar in ihrem Handeln. Daher kann uns das beste Sicherheitskonzept - die Japaner hatten Sicherheitskonzepte, die uns immer als beispielgebend hingestellt wurden - nicht davor bewahren, dass es zu solch unfassbaren Katastrophen kommt. Wenn man sich die Geschichte atomarer Unfälle anschaut, dann stellt man fest, dass es meistens Lappalien oder Dinge, auf die kein Mensch vorher gekommen ist, waren, die zu den Unfällen geführt haben.

Auch wenn Sie jetzt solche engagierten Papiere in Ihrem Haus erarbeiten, was ich, wie gesagt, zuerst einmal gut finde, frage ich mich schon: Wieso müssen wir wochenlang bohren und fragen, was es mit der Auffälligkeit im Kühlkreislauf des Kraftwerks Grafenrheinfeld auf sich hat, wo Ultraschallaufnahmen gezeigt haben, dass es einen Riss in den Rohren geben könnte? Es behauptet niemand, dass es tatsächlich einen Riss gibt, aber es könnte einen geben. Es dauerte Monate, bis Sie das AKW heruntergefahren haben, um genauer nachzuschauen. Ich möchte weiterhin an die Probleme in Philippsburg in den letzten anderthalb Jahren erinnern, die heute deutlich wurden.

Die Frage wird sein, wie wir nach dem dreimonatigen Moratorium damit umgehen und wie es weitergeht. Die Menschen erwarten klare Positionen. Sie wollen aus der Atomenergie aussteigen, und zwar unverzüglich und unumkehrbar.",data/txt/17098.txt,speech,linke
2494588,98,17,0,,,,318,Beifall bei der LINKEN sowie bei Abgeordneten der SPD und des BÜNDNISSES 90/DIE GRÜNEN,data/txt/17098.txt,poi,
2494589,98,17,0,Dorothee Menzner (DIE LINKE),Dorothee Menzner,dorothee-menzner,319,"Dass Sie es mit viel Gegenwind zu tun haben, erleben Sie im Moment Montag für Montag bei den Mahnwachen, und das werden Sie am kommenden Samstag bei den Großdemos erleben. Sie erleben es auch dadurch, dass heute die Bravo nach 55 Jahren zum ersten Mal in ihrer Geschichte ein Poster mit einem politischen Inhalt bringt.",data/txt/17098.txt,speech,linke
2494590,98,17,0,,,,320,Beifall bei der LINKEN sowie bei Abgeordneten der SPD und des BÜNDNISSES 90/DIE GRÜNEN,data/txt/17098.txt,poi,
2494591,98,17,0,Dorothee Menzner (DIE LINKE),Dorothee Menzner,dorothee-menzner,321,"Wir werden die Proteste auf jeden Fall begleiten und weiter Druck machen.

Ich danke.",data/txt/17098.txt,speech,linke
2494592,98,17,0,,,,322,Beifall bei der LINKEN sowie bei Abgeordneten der SPD und des BÜNDNISSES 90/DIE GRÜNEN,data/txt/17098.txt,poi,
2494593,98,17,0,Dorothee Menzner (DIE LINKE),Dorothee Menzner,dorothee-menzner,323,,data/txt/17098.txt,speech,linke
2494594,98,17,0,Vizepräsidentin Petra Pau,Petra Pau,petra-pau,324,Das Wort hat die Parlamentarische Staatssekretärin Ursula Heinen-Esser.,data/txt/17098.txt,chair,
2494595,98,17,0,,,,325,Beifall bei Abgeordneten der CDU/CSU und der FDP,data/txt/17098.txt,poi,
2494596,98,17,0,Vizepräsidentin Petra Pau,Petra Pau,petra-pau,326,,data/txt/17098.txt,chair,
