id,sitzung,wahlperiode,in_writing,speaker,speaker_cleaned,speaker_fp,sequence,text,filename,type,speaker_party
2489744,95,17,0,Dr. Rainer Stinner (FDP),Dr. Rainer Stinner,rainer-stinner,129,"Erstens hat unsere Fraktion das AWACS-Urteil erstritten.

Zweitens haben wir zu Zeiten der rot-grünen Koalition ein Bundestagsbeteiligungsgesetz vorgelegt, das Sie leider abgelehnt haben. Hätten wir heute das Gesetz, das wir damals vorgeschlagen haben, wäre das Beteiligungsrecht des Parlaments deutlicher definiert und wir wären besser dran. Es war Ihr Fehler, unter dem Sie heute leiden.",data/txt/17095.txt,speech,fdp
2489745,95,17,0,,,,130,Beifall bei der FDP,data/txt/17095.txt,poi,
2489746,95,17,0,Dr. Rainer Stinner (FDP),Dr. Rainer Stinner,rainer-stinner,131,"Wir haben uns die Entscheidung nicht einfach gemacht. Wir haben sorgfältig geprüft, und nach Abwägung aller Aspekte kommen wir zu dem eindeutigen Schluss - mich beeindruckt insbesondere eine Seite des AWACS-Urteils -, dass das Vorgehen der Bundesregierung in diesem Fall völlig richtig war und eine Mandatierung nicht notwendig ist.

Dennoch, lieber Herr Mützenich, ist es natürlich im Interesse der Bundesregierung und der sie tragenden Parteien, die Opposition möglichst umfassend in Entscheidungsprozesse mit einzubeziehen. Das ist im Vorhinein durch die Information der Fraktionsvorsitzenden und im Nachhinein durch die Information der Obleute geschehen. Herr Mützenich, die Bundesregierung hat ein großes Interesse daran, bei kritischen Einsätzen, die dem deutschen Interesse dienen - in diesem Fall wurde der Einsatz zum Glück gut ausgeführt -, weiter kooperativ zusammenzuarbeiten. Es ist in unserem Interesse, -",data/txt/17095.txt,speech,fdp
2489747,95,17,0,Vizepräsidentin Katrin Göring-Eckardt,Katrin Göring-Eckardt,katrin-goring-eckardt,132,Herr Kollege.,data/txt/17095.txt,chair,
2489748,95,17,0,Dr. Rainer Stinner (FDP),Dr. Rainer Stinner,rainer-stinner,133,"- dass wir mit den Oppositionsparteien eng zusammenarbeiten, auch wenn die rechtliche Situation uns nicht dazu zwingt.",data/txt/17095.txt,speech,fdp
2489749,95,17,0,Wolfgang Gehrcke [DIE LINKE],Wolfgang Gehrcke,wolfgang-gehrcke,134,Antrag vorlegen!,data/txt/17095.txt,poi,linke
2489750,95,17,0,Dr. Rainer Stinner (FDP),Dr. Rainer Stinner,rainer-stinner,135,"Das dient unserem Interesse, und das dient vor allem dem Interesse der betroffenen Menschen.

Vielen Dank.",data/txt/17095.txt,speech,fdp
2489751,95,17,0,,,,136,Beifall bei der FDP,data/txt/17095.txt,poi,
2489752,95,17,0,Dr. Rainer Stinner (FDP),Dr. Rainer Stinner,rainer-stinner,137,,data/txt/17095.txt,speech,fdp
2489753,95,17,0,Vizepräsidentin Katrin Göring-Eckardt,Katrin Göring-Eckardt,katrin-goring-eckardt,138,"Herr Kollege, ich wollte Sie gar nicht stoppen, sondern Sie fragen, ob Sie eine Zwischenfrage zulassen wollen. Das ist aber jetzt nicht mehr möglich, denn die Redezeit ist leider überschritten.

Ich gebe dem Kollegen Frithjof Schmidt für Bünd-nis 90/Die Grünen das Wort.",data/txt/17095.txt,chair,
2489754,95,17,0,Dr. Frithjof Schmidt (BÜNDNIS 90/DIE GRÜNEN),Dr. Frithjof Schmidt,frithjof-schmidt,139,Frau Präsidentin! Liebe Kolleginnen und Kollegen! Wir sind Zeugen eines historischen Umbruchs. Millionen Menschen in der arabischen Welt stehen auf gegen Unterdrückung und stehen auf gegen ihre korrupten Herrscher. Diese Menschen kämpfen unter Einsatz ihres Lebens für Freiheit und Demokratie. Ihnen gehört unsere Hochachtung und Solidarität.,data/txt/17095.txt,speech,gruene
2489755,95,17,0,,,,140,"Beifall beim BÜNDNIS 90/DIE GRÜNEN, bei der SPD und der LINKEN sowie bei Abgeordneten der CDU/CSU und der FDP",data/txt/17095.txt,poi,
2489756,95,17,0,Dr. Frithjof Schmidt (BÜNDNIS 90/DIE GRÜNEN),Dr. Frithjof Schmidt,frithjof-schmidt,141,"Diese demokratische Revolution kam, glaube ich, für uns alle überraschend. Deutschland und die Europäische Union haben in dieser Region Politik nach den Prinzipien ""Für Stabilität sorgen"" und ""Kampf gegen den islamistischen Terrorismus"" gemacht. Deshalb hat der Westen einseitig auf enge Bündnisse mit autoritären Regimen gesetzt. Demokratische Bewegungen wurden nicht ausreichend unterstützt.

Ehrlicherweise müssen wir deshalb Selbstkritik üben. Das betrifft alle Regierungen der letzten zehn Jahre.",data/txt/17095.txt,speech,gruene
2489757,95,17,0,,,,142,Beifall beim BÜNDNIS 90/DIE GRÜNEN sowie bei Abgeordneten der LINKEN,data/txt/17095.txt,poi,
2489758,95,17,0,Dr. Frithjof Schmidt (BÜNDNIS 90/DIE GRÜNEN),Dr. Frithjof Schmidt,frithjof-schmidt,143,"Herr Außenminister, diese Selbstkritik hätte ich heute auch von Ihnen erwartet.",data/txt/17095.txt,speech,gruene
2489759,95,17,0,Claudia Roth [Augsburg] [BÜNDNIS 90/DIE GRÜNEN],Claudia Roth,claudia-roth,144,Ja!,data/txt/17095.txt,poi,gruene
2489760,95,17,0,Dr. Frithjof Schmidt (BÜNDNIS 90/DIE GRÜNEN),Dr. Frithjof Schmidt,frithjof-schmidt,145,"Ich finde es schade, dass Sie nicht die Kraft aufgebracht haben, sich das für Ihr Regierungshandeln einzugestehen.

Auch ein selbstkritisches Wort von der Frau Bundeskanzlerin wäre durchaus angebracht. Die Fehlkonstruktion der Union für das Mittelmeer geht maßgeblich auf das Konto von Präsident Sarkozy und das von Frau Merkel. Sie haben sich damals dafür feiern lassen. Das hat alle bisherigen Fehler der europäischen Politik in Nordafrika verschärft. Das fand damals bereits Kritik; diese aber haben Sie ignoriert.",data/txt/17095.txt,speech,gruene
2489761,95,17,0,,,,146,Beifall beim BÜNDNIS 90/DIE GRÜNEN sowie bei Abgeordneten der SPD und der LINKEN,data/txt/17095.txt,poi,
2489762,95,17,0,Dr. Frithjof Schmidt (BÜNDNIS 90/DIE GRÜNEN),Dr. Frithjof Schmidt,frithjof-schmidt,147,"Auch die Reaktionen der Europäischen Union, aber auch der Bundesregierung auf den Umbruch waren zu Beginn von Zaudern und Zögern geprägt. Herr Außenminister, auch Sie haben lange gebraucht, um sich eindeutig auf die Seite der Demokratiebewegung in Tunesien und Ägypten zu stellen. Ich meine, zu lange.",data/txt/17095.txt,speech,gruene
2489763,95,17,0,Claudia Roth [Augsburg] [BÜNDNIS 90/DIE GRÜNEN],Claudia Roth,claudia-roth,148,Münchener Sicherheitskonferenz!,data/txt/17095.txt,poi,gruene
2489764,95,17,0,Dr. Frithjof Schmidt (BÜNDNIS 90/DIE GRÜNEN),Dr. Frithjof Schmidt,frithjof-schmidt,149,"In diesen Ländern ist es gelungen, Machthaber zum Rücktritt zu zwingen, die bis vor kurzem noch als unantastbar galten. Dieser Erfolg hat in diesen Ländern zwar auch vielen Menschen das Leben gekostet, aber Armee und Teile der Sicherheitskräfte haben sich dort auf die Seite der Demonstranten gestellt und so ein schlimmeres Blutbad verhindert.

In anderen Ländern sieht das gerade leider nicht so aus. In Libyen, wo Gaddafi mit großer Brutalität gegen die eigene Bevölkerung vorgeht, spitzt sich die Lage zu, aber auch in Bahrain. Mit dem Einmarsch von etwa 1 000 saudi-arabischen Soldaten hat der Golfkooperationsrat dort eine neue, sehr gefährliche Stufe der Eskalation eingeleitet.",data/txt/17095.txt,speech,gruene
2489765,95,17,0,,,,150,Beifall beim BÜNDNIS 90/DIE GRÜNEN sowie bei Abgeordneten der SPD,data/txt/17095.txt,poi,
2489766,95,17,0,Dr. Frithjof Schmidt (BÜNDNIS 90/DIE GRÜNEN),Dr. Frithjof Schmidt,frithjof-schmidt,151,"Auch im Jemen sucht die Regierung die Konfrontation. Das schreckliche Beispiel von Oberst Gaddafi strahlt bereits aus. Wenn wir die Bilder aus Libyen sehen, fühlen wir wohl alle Wut und Entsetzen.

Ja, es ist klar: Gaddafi muss weg. Und es ist gut, dass sich die internationale Gemeinschaft darin einig ist. Es war ein wichtiger Schritt, den Internationalen Strafgerichtshof einzuschalten. Ebenso wichtig war es, Sanktionen zu verabschieden. All diese Schritte waren gut, aber nicht ausreichend. Mir ist es völlig unverständlich, dass es noch immer nicht gelungen ist, Gaddafi den Geldhahn zuzudrehen.",data/txt/17095.txt,speech,gruene
2489767,95,17,0,,,,152,Beifall der Abg. Wolfgang Gehrcke [DIE LINKE],data/txt/17095.txt,poi,
2489768,95,17,0,Dr. Frithjof Schmidt (BÜNDNIS 90/DIE GRÜNEN),Dr. Frithjof Schmidt,frithjof-schmidt,153,"Noch immer gibt es keinen Bann gegen Ölfirmen, die libysches Öl kaufen oder verkaufen. Es gibt nicht einmal eine Liste.",data/txt/17095.txt,speech,gruene
2489769,95,17,0,,,,154,Beifall beim BÜNDNIS 90/DIE GRÜNEN sowie bei Abgeordneten der SPD und der LINKEN,data/txt/17095.txt,poi,
2489770,95,17,0,Dr. Frithjof Schmidt (BÜNDNIS 90/DIE GRÜNEN),Dr. Frithjof Schmidt,frithjof-schmidt,155,"Noch immer fließt Ölgeld nach Libyen und füllt Gaddafis Kriegskasse. Das ist skandalös, und damit muss Schluss sein.

Auch bei der Stärkung der libyschen Opposition ist nicht genug getan worden. Sie, Herr Außenminister, haben Vertreter der Opposition hier in Berlin noch nicht einmal empfangen. Das verstehe ich nicht. Oder haben Sie sonst etwas getan, um die Opposition in Libyen zu stärken? Ich sehe da nichts.

Es zerreißt einen innerlich, wenn man Gaddafis Vormarsch sieht. Er hat gut ausgebildete Truppen mit neuen Waffen, die in den letzten Jahren geliefert wurden: aus Frankreich, aus Italien, aus Großbritannien. Auch Deutschland hat seit der Aufhebung des Waffenembargos 2004 Rüstungsgüter im Wert von über 112 Millionen Euro an Libyen geliefert, darunter auch Hubschrauber. Das war unverantwortlich.",data/txt/17095.txt,speech,gruene
2489771,95,17,0,,,,156,Beifall beim BÜNDNIS 90/DIE GRÜNEN und bei der LINKEN sowie bei Abgeordneten der SPD,data/txt/17095.txt,poi,
2489772,95,17,0,Dr. Frithjof Schmidt (BÜNDNIS 90/DIE GRÜNEN),Dr. Frithjof Schmidt,frithjof-schmidt,157,"Wir alle haben schlimme Befürchtungen, was in Libyen passiert, sollte Gaddafi weitere Städte der Opposition einnehmen. Über Sanktionen hinaus wird ja auch die Einrichtung einer Flugverbotszone diskutiert, um Gaddafi zu stoppen. Ich halte eine solche Prüfung für richtig, wenn die Arabische Liga dies fordert. Es ist richtig, alle Optionen der UN-Charta zu prüfen, die helfen könnten, die Menschen im Osten Libyens vor Gaddafis möglicher Rache zu schützen.",data/txt/17095.txt,speech,gruene
2489773,95,17,0,,,,158,Beifall bei Abgeordneten des BÜNDNIS-SES 90/DIE GRÜNEN,data/txt/17095.txt,poi,
2489774,95,17,0,Dr. Frithjof Schmidt (BÜNDNIS 90/DIE GRÜNEN),Dr. Frithjof Schmidt,frithjof-schmidt,159,"Der Einsatz von Militär ist aber die Ultima Ratio und setzt für uns zwingend ein UN-Mandat voraus. Darüber hinaus teile ich in diesem Punkt die Skepsis der Bundesregierung hinsichtlich der militärischen Durchsetzbarkeit und der Wirkung eines Flugverbotes am Boden. Wir dürfen aus dem verständlichen Wunsch nach schneller Hilfe nicht Dinge tun, die militärisch nicht funktionieren und kontraproduktiv sind. Auch das muss gesagt werden.",data/txt/17095.txt,speech,gruene
2489775,95,17,0,,,,160,Beifall beim BÜNDNIS 90/DIE GRÜNEN sowie bei Abgeordneten der LINKEN,data/txt/17095.txt,poi,
2489776,95,17,0,Dr. Frithjof Schmidt (BÜNDNIS 90/DIE GRÜNEN),Dr. Frithjof Schmidt,frithjof-schmidt,161,"Liebe Kolleginnen und Kollegen, wir müssen die demokratischen Kräfte in der Region stärken. Selbst in Tunesien und Ägypten ist die weitere Entwicklung noch offen. Es gibt immer noch starke Kräfte, die weitreichende Veränderungen verhindern wollen. Die Uhren dürfen hier nicht zurückgedreht werden. Diese Völker brauchen Unterstützung, und sie wollen Unterstützung. Dass aus diesen Ländern erfolgreiche Demokratien werden, liegt nicht zuletzt auch im strategischen Interesse der Europäischen Union. Da geht es um Hilfe beim Aufbau von Parteien und Gewerkschaften und um Unterstützung zivilgesellschaftlicher Akteure; zentral ist die Stärkung der Rolle der Frauen in der Gesellschaft; da geht es um eine Ausweitung der Entwicklungszusammenarbeit, erweiterten Handelszugang, Hochschulkooperationen und vieles mehr.

Es ist schon gesagt worden: Es geht um nicht weniger als eine Neugestaltung der europäischen Nachbarschaftspolitik. Europa muss aber auch grundsätzliche Lehren aus der arabischen Revolution ziehen: Nie wieder und nirgendwo dürfen Demokratie und Stabilität so gegeneinander ausgespielt werden, wie wir es in Nordafrika gemacht haben.",data/txt/17095.txt,speech,gruene
2489777,95,17,0,,,,162,Beifall beim BÜNDNIS 90/DIE GRÜNEN sowie bei Abgeordneten der SPD und der LINKEN,data/txt/17095.txt,poi,
2489778,95,17,0,Dr. Frithjof Schmidt (BÜNDNIS 90/DIE GRÜNEN),Dr. Frithjof Schmidt,frithjof-schmidt,163,"Die Absage an autoritäre Herrschaft und der Glaube an die Kraft der demokratischen Bewegung müssen zum Leitmotiv europäischer Außenpolitik werden, und zwar nicht nur im arabischen Raum.

Danke für die Aufmerksamkeit.",data/txt/17095.txt,speech,gruene
2489779,95,17,0,,,,164,Beifall beim BÜNDNIS 90/DIE GRÜNEN sowie bei Abgeordneten der SPD,data/txt/17095.txt,poi,
2489780,95,17,0,Dr. Frithjof Schmidt (BÜNDNIS 90/DIE GRÜNEN),Dr. Frithjof Schmidt,frithjof-schmidt,165,,data/txt/17095.txt,speech,gruene
2489781,95,17,0,Vizepräsidentin Katrin Göring-Eckardt,Katrin Göring-Eckardt,katrin-goring-eckardt,166,Philipp Mißfelder hat das Wort für die CDU/CSU-Fraktion.,data/txt/17095.txt,chair,
2489782,95,17,0,,,,167,Beifall bei der CDU/CSU sowie bei Abgeordneten der FDP,data/txt/17095.txt,poi,
2489783,95,17,0,Vizepräsidentin Katrin Göring-Eckardt,Katrin Göring-Eckardt,katrin-goring-eckardt,168,,data/txt/17095.txt,chair,
2489784,95,17,0,Philipp Mißfelder (CDU/CSU),Philipp Mißfelder,philipp-mißfelder,169,"Frau Präsidentin! Meine sehr verehrten Damen und Herren! Am 17. Dezember vergangenen Jahres hat sich der tunesische Gemüsehändler Bouazizi vor lauter Verzweiflung selbst verbrannt, nachdem er seinen Gemüsestand verloren hat und von den Gerichten gedemütigt worden ist. Der Funke des Protestes, der sich daran anschloss und darin kulminierte, dass das Regime von Ben Ali gestürzt wurde, sprang nach Ägypten und auf die ganze Region über. Erst seitdem beschäftigen wir uns - das gehört zur Ehrlichkeit in dieser Debatte dazu - im notwendigen Maße und in angemessener Weise mit diesem Thema.

Ich begrüße zunächst einmal, dass unser Außenminister in den vergangenen Monaten nachhaltige Akzente gesetzt und deutlich gemacht hat, dass sich die Bundesregierung dieses Themas mehr annimmt, als es vorher der Fall war, und vor allem eine neue Aufgabenteilung in der Europäischen Union gefordert hat. Man muss selbstkritisch sagen: Themen, die die arabische Welt und den Mittelmeerraum insgesamt angingen, sind in der Europäischen Union viel zu lang früheren Kolonialmächten überlassen worden, die zum Teil aus nicht nachvollziehbaren Gründen politische Forderungen erheben, welche nach unseren Maßstäben nicht umsetzbar sind und deren Umsetzung aus unserer Sicht auch nicht erstrebenswert ist.

Vor diesem Hintergrund ist es dringend notwendig, dass sich die nördlicheren Länder in der Europäischen Union mehr einbringen; das hat der Außenminister gemacht. Ich möchte deshalb, Herr Minister, Ihre beiden erfolgreichen Reisen ansprechen: zum einen die Reise nach Tunis am 12. Februar und zum anderen die Reise nach Kairo am 23./24. Februar, von der Sie selbst berichtet haben. Beide Reisen waren ein Beitrag dazu, den Demonstranten und den neu aufkommenden politischen Kräften eine politische Perspektive zu bieten. Diesen Weg sollten wir weitergehen. Deshalb haben Sie, Herr Minister, unsere volle Unterstützung auf dem Weg des Dialogs.",data/txt/17095.txt,speech,cducsu
2489785,95,17,0,,,,170,Beifall bei der CDU/CSU und der FDP,data/txt/17095.txt,poi,
2489786,95,17,0,Philipp Mißfelder (CDU/CSU),Philipp Mißfelder,philipp-mißfelder,171,"Vielfach habe ich allerdings den Eindruck, dass es zu Begriffsverschiebungen gekommen ist. Wenn für Freiheit demonstriert wird, dann müssen wir immer auch kritisch fragen: Für welche Freiheit wird dort demonstriert? Wer steckt dahinter? Welche Interessen verbinden sich unter Umständen damit? Ich habe gerade gehört - Rainer Stinner hat es gesagt -, dass in Ägypten 23 Parteien politisch aktiv werden wollen. Sicherlich sind einige darunter, die unter Freiheit nicht universelle Freiheit verstehen und auch nicht für universelle Menschenrechte eintreten, sondern zum Beispiel die Rolle der Frau einschränken wollen. Wir lesen in den Berichten von ""Freiheit"" und der ""Befreiung des Volkes"". Dazu sage ich deutlich: Einer der wichtigsten Punkte unserer wertegebundenen Politik im Hinblick auf diese Region ist die universelle Durchsetzung aller Menschenrechte und auch aller Freiheitsrechte; dazu gehört auch die Freiheit der Frau.

Wir müssen Radikalismus entgegentreten. Deshalb müssen wir die politische Dimension des Wandels viel stärker auf unsere Tagesordnung heben, als es in der Vergangenheit der Fall war, und in der Europäischen Union viel geschlossener agieren, als dies in den vergangenen zwei Wochen geschah.",data/txt/17095.txt,speech,cducsu
2489787,95,17,0,,,,172,Beifall bei Abgeordneten der CDU/CSU,data/txt/17095.txt,poi,
2489788,95,17,0,Philipp Mißfelder (CDU/CSU),Philipp Mißfelder,philipp-mißfelder,173,"Ich glaube nicht, dass Gaddafi und seine Schergen von dem Vorgehen der Europäischen Union in den letzten Wochen beeindruckt sind.

Ich glaube auch nicht, dass wir uns auf Dauer eine öffentliche Diskussion über das Für und Wider von Optionen leisten können. Ich glaube vielmehr, dass wir eigene Akzente setzen müssen. Ich denke, dass wir auf die Forderung der Arabischen Liga nach Einrichtung einer Flugverbotszone - Andreas Schockenhoff hat das zu Recht gesagt; ich stimme dem zu - reagieren müssen. Wir müssen dafür werben, dass sich die Mitglieder der Arabischen Liga in die Pflicht nehmen lassen.",data/txt/17095.txt,speech,cducsu
2489789,95,17,0,,,,174,Beifall bei Abgeordneten der CDU/CSU,data/txt/17095.txt,poi,
2489790,95,17,0,Philipp Mißfelder (CDU/CSU),Philipp Mißfelder,philipp-mißfelder,175,"Dann wird sich auch Deutschland seiner Verantwortung nicht entziehen können und auch nicht entziehen wollen. In der Debatte ist schon mehrfach zu Recht gesagt worden, dass ein solches Flugverbot von der Afrikanischen Union, von der UNO und der Arabischen Liga mitgetragen und letztendlich auch gemeinsam durchgesetzt werden muss.

All dies sind allerdings im weitesten Sinne Nachhutgefechte; denn leider ist es so - das ist unser Kenntnisstand am heutigen Tag -, dass sich die Situation der Freiheitskämpfer in Libyen verschlechtert hat. Über Maßnahmen, über die wir noch vor einer Woche diskutiert haben, müssen wir heute eventuell gar nicht mehr streiten, weil sie unter Umständen wirkungslos geworden sind. Ich bedauere es sehr, dass eine Chance verpasst worden ist, durch ein entschlosseneres, einheitlicheres Auftreten der Europäischen Union mehr zu erreichen.

Angesichts dessen, was sich zurzeit in Libyen vollzieht, müssen wir uns sehr große Sorgen machen. Die Mittelmeerregion gehört zu unserer Nachbarschaft. Wir müssen dafür werben, dass es dort jetzt nicht zu einer Abrechnung mit der Opposition kommt, dass jetzt kein weiteres Blutvergießen stattfindet. Im Einvernehmen mit den Vereinten Nationen sollten wir alle politischen und weiteren Möglichkeiten dahin gehend prüfen, wie weiteres Blutvergießen verhindert werden kann.",data/txt/17095.txt,speech,cducsu
2489791,95,17,0,,,,176,Beifall bei Abgeordneten der CDU/CSU und der FDP,data/txt/17095.txt,poi,
2489792,95,17,0,Philipp Mißfelder (CDU/CSU),Philipp Mißfelder,philipp-mißfelder,177,"Diese ganze Region ist für uns wichtig. Deutschland und Europa haben nicht nur, aber auch wirtschaftliche Interessen. Wir müssen das auch selbstkritisch sagen; dieses Thema ist vorhin schon angesprochen worden. Firmen, die sich in der Vergangenheit in dieser Region betätigt haben, fordere ich ausdrücklich auf, bei einem zukünftigen Engagement darauf zu achten, dass dadurch nicht nur die Herrscherfamilie an wirtschaftlichem Wohlstand gewinnt, sondern auch in die Ausbildung der jungen Menschen investiert wird, sodass diese eine Zukunftsperspektive erhalten.",data/txt/17095.txt,speech,cducsu
2489793,95,17,0,,,,178,Beifall bei der CDU/CSU sowie bei Abgeordneten der FDP,data/txt/17095.txt,poi,
2489794,95,17,0,Philipp Mißfelder (CDU/CSU),Philipp Mißfelder,philipp-mißfelder,179,"In den vergangenen Wochen haben wir von eindrücklichen Beispielen gehört. Man kann zwar sagen, dass die Wirtschaftsbeziehungen zwischen Deutschland und Ägypten gut sind und die Wirtschaftsbeziehungen zwischen Deutschland und Tunesien ausgebaut wurden, man kann sogar sagen, dass die Wirtschaftsbeziehungen zwischen Deutschland und Libyen im vergangenen Jahrzehnt massiv ausgebaut wurden, aber das gilt nur auf dem Papier. Ich habe nämlich zunehmend den Eindruck, dass den normalen Bürgern in diesen Ländern, auch weil wir Fehler gemacht haben, dadurch kaum eine Perspektive eröffnet und auch keine Teilhabe am Wohlstand ermöglicht wurde. Ich fordere die deutsche Wirtschaft deshalb dazu auf, bei ihrem weiteren Engagement darauf zu achten, dass sie mehr ausbildet und damit auch den jungen Menschen - das ist gerade vor dem Hintergrund der demografischen Entwicklung in diesen Ländern wichtig - eine bessere Perspektive bietet und damit auch Zuversicht für die Zukunft mit auf den Weg gibt.

Die Situation in Bahrain, Saudi-Arabien und im Jemen ist je unterschiedlich. Jeder Fall birgt aber große Risiken für uns und tangiert unsere Interessen, auch unsere vitalen wirtschaftlichen Interessen, und darf uns deshalb politisch nicht ruhen lassen. Es hat sich herausgestellt, dass im Jemen in der Vergangenheit viele Aktivitäten geplant worden sind, die im Zusammenhang mit dem internationalen Terrorismus zu sehen sind. Sollte es dort zu einer weiteren Verschlechterung der politischen Situation kommen, wird das nicht spurlos an uns vorbeigehen.

Wir stehen vor einem wirklichen Neubeginn, vor einer Neuausrichtung unserer Nordafrikapolitik, aber auch unserer Politik bezüglich des gesamten arabischen Raums. Wir bewegen uns dabei in dem klassischen Spannungsfeld von wertegebundener Außenpolitik und interessengeleiteter Außenpolitik. Selbstkritisch müssen wir sagen, dass wir in der Vergangenheit bei den Kooperationen, die wir mit einzelnen Regimeführern eingegangen sind, vielleicht ein Stück weit zu viel Realpolitik betrieben haben und den Bedürfnissen der Menschen in den einzelnen Ländern vielleicht nicht immer gerecht geworden sind.

Herzlichen Dank.",data/txt/17095.txt,speech,cducsu
2489795,95,17,0,,,,180,Beifall bei der CDU/CSU und der FDP,data/txt/17095.txt,poi,
2489796,95,17,0,Wolfgang Gehrcke [DIE LINKE],Wolfgang Gehrcke,wolfgang-gehrcke,181,"Da fängt einer an, nachzudenken!",data/txt/17095.txt,poi,linke
2489797,95,17,0,Philipp Mißfelder (CDU/CSU),Philipp Mißfelder,philipp-mißfelder,182,,data/txt/17095.txt,speech,cducsu
2489798,95,17,0,Vizepräsidentin Katrin Göring-Eckardt,Katrin Göring-Eckardt,katrin-goring-eckardt,183,Günter Gloser hat das Wort für die SPD-Fraktion.,data/txt/17095.txt,chair,
2489799,95,17,0,,,,184,Beifall bei der SPD,data/txt/17095.txt,poi,
2489800,95,17,0,Vizepräsidentin Katrin Göring-Eckardt,Katrin Göring-Eckardt,katrin-goring-eckardt,185,,data/txt/17095.txt,chair,
