id,sitzung,wahlperiode,in_writing,speaker,speaker_cleaned,speaker_fp,sequence,text,filename,type,speaker_party
2494674,98,17,0,Michael Kauch (FDP),Michael Kauch,michael-kauch,404,"Diese Koalition hat verstanden, dass wir den Bereich Kernkraftwerke überdenken müssen, dass es zu neuen Regelwerken kommen muss. Es ist richtig, dass diese Koalition eine Kommission mit unabhängigen Experten eingesetzt hat - auch mit solchen, die mit der Beaufsichtigung des jeweiligen Kraftwerks bisher nicht betraut waren.

Wenn ein Kraftwerk nicht den neuen Sicherheitsanforderungen entspricht, gibt es die Möglichkeit, es nachzurüsten. Falls eine solche Nachrüstung nicht möglich oder wirtschaftlich nicht sinnvoll ist, wird dieses Kernkraftwerk aus Sicherheitsgründen abgeschaltet. Das wird das Ergebnis des Moratoriums sein.

Meine Damen und Herren, Sie sollten hier weniger mit Schaum vor dem Mund reden",data/txt/17098.txt,speech,fdp
2494675,98,17,0,Hans-Josef Fell [BÜNDNIS 90/DIE GRÜNEN],Hans-Josef Fell,hans-josef-fell,405,Das sagt genau der Richtige!,data/txt/17098.txt,poi,gruene
2494676,98,17,0,Christian Lange [Backnang] [SPD],Christian Lange,christian-lange,406,Hier im Raum redet eigentlich nur einer!,data/txt/17098.txt,poi,spd
2494677,98,17,0,Michael Kauch (FDP),Michael Kauch,michael-kauch,407,"und mehr darüber, welche Sicherheitsanforderungen tatsächlich erfüllt werden müssen. Auch unter den Gesichtspunkten, die die SPD hier in den Raum gestellt hat, würden diese Kernkraftwerke noch zehn Jahre laufen, und Sie hätten die gleiche Verpflichtung, zur Sicherheitsdiskussion beizutragen. Sie haben sich jahrelang nur mit dem Thema Abschalten beschäftigt, aber nicht mit der Frage, welches Sicherheitsniveau in diesen zehn Jahren notwendig ist.",data/txt/17098.txt,speech,fdp
2494678,98,17,0,Ulrich Kelber [SPD],Ulrich Kelber,ulrich-kelber,408,"Andere für die eigenen Fehler zu beschimpfen, ist primitiv!",data/txt/17098.txt,poi,spd
2494679,98,17,0,Michael Kauch (FDP),Michael Kauch,michael-kauch,409,"Das ist genauso unsere Verantwortung.

In diesem Zusammenhang geht es nicht nur um Laufzeiten, sondern auch um die Sicherheit der Kraftwerke, die in der Übergangszeit noch laufen müssen,",data/txt/17098.txt,speech,fdp
2494680,98,17,0,,,,410,Beifall bei der FDP und der CDU/CSU,data/txt/17098.txt,poi,
2494681,98,17,0,Michael Kauch (FDP),Michael Kauch,michael-kauch,411,weil wir eben nicht von heute auf morgen aus der Kernkraft herauskommen.,data/txt/17098.txt,speech,fdp
2494682,98,17,0,Christian Lange [Backnang] [SPD],Christian Lange,christian-lange,412,Jetzt kommt's raus: doch kein Ausstieg!,data/txt/17098.txt,poi,spd
2494683,98,17,0,Michael Kauch (FDP),Michael Kauch,michael-kauch,413,"Wer das der Bevölkerung weismachen will, der lügt die Bevölkerung an.",data/txt/17098.txt,speech,fdp
2494684,98,17,0,,,,414,Beifall bei der FDP und der CDU/CSU,data/txt/17098.txt,poi,
2494685,98,17,0,Ulrich Kelber [SPD],Ulrich Kelber,ulrich-kelber,415,Das tun Sie in der Tat!,data/txt/17098.txt,poi,spd
2494686,98,17,0,Michael Kauch (FDP),Michael Kauch,michael-kauch,416,,data/txt/17098.txt,speech,fdp
2494687,98,17,0,Vizepräsidentin Petra Pau,Petra Pau,petra-pau,417,Für die Fraktion Bündnis 90/Die Grünen hat der Kollege Krischer das Wort.,data/txt/17098.txt,chair,
2494688,98,17,0,Oliver Krischer (BÜNDNIS 90/DIE GRÜNEN),Oliver Krischer,oliver-krischer,418,"Frau Präsidentin! Liebe Kolleginnen und Kollegen! Herr Kauch, Sie haben durch die Japan-Katastrophe überhaupt nichts verstanden.",data/txt/17098.txt,speech,gruene
2494689,98,17,0,,,,419,"Beifall beim BÜNDNIS 90/DIE GRÜNEN, bei der SPD und der LINKEN",data/txt/17098.txt,poi,
2494690,98,17,0,Oliver Krischer (BÜNDNIS 90/DIE GRÜNEN),Oliver Krischer,oliver-krischer,420,"Sie halten hier die gleiche Rede wie vor vier Monaten, statt die Größe zu haben, zu sagen: Wir haben uns geirrt; wir haben vielleicht eine falsche Einschätzung gehabt. - Sie haben schlicht und ergreifend nichts verstanden.",data/txt/17098.txt,speech,gruene
2494691,98,17,0,,,,421,"Beifall beim BÜNDNIS 90/DIE GRÜNEN, bei der SPD und der LINKEN",data/txt/17098.txt,poi,
2494692,98,17,0,Oliver Krischer (BÜNDNIS 90/DIE GRÜNEN),Oliver Krischer,oliver-krischer,422,"Gestatten Sie mir eine weitere Vorbemerkung. Für die heutige Fragestunde waren 30 Fragen zur Sicherheit der Atomkraftwerke und zu konkreten Sicherheitsproblemen eingereicht worden. Diese Fragen wurden nicht zugelassen. Das mag nach der Geschäftsordnung korrekt sein; aber es zeigt, dass sich die Bundesregierung, genauso wie heute Morgen im Umweltausschuss, weigert, in eine Debatte über die konkreten Probleme in den Atomkraftwerken einzutreten. Daran wird deutlich: Das Vertuschen und Wegdrücken geht schon wieder los.",data/txt/17098.txt,speech,gruene
2494693,98,17,0,,,,423,"Beifall beim BÜNDNIS 90/DIE GRÜNEN, bei der SPD und der LINKEN",data/txt/17098.txt,poi,
2494694,98,17,0,Dr. Michael Paul [CDU/CSU],Dr. Michael Paul,michael-paul,424,"Komm, hör auf!",data/txt/17098.txt,poi,cducsu
2494695,98,17,0,Oliver Krischer (BÜNDNIS 90/DIE GRÜNEN),Oliver Krischer,oliver-krischer,425,"Meine Damen und Herren, wir haben vorhin gehört, dass für das Auftreten eines GAUs in Form einer Kernschmelze eine Wahrscheinlichkeit von ein paar Hunderttausend Jahren gilt. Jetzt haben wir schon zwei innerhalb von 25 Jahren erlebt. Wer angesichts dessen nicht anfängt, nachzudenken, und nicht die Größe hat, zu sagen: ""Wir haben uns geirrt; wir müssen etwas ändern"", der hat wirklich nichts verstanden.",data/txt/17098.txt,speech,gruene
2494696,98,17,0,,,,426,Beifall beim BÜNDNIS 90/DIE GRÜNEN sowie bei Abgeordneten der SPD und der LINKEN,data/txt/17098.txt,poi,
2494697,98,17,0,Dr. Maria Flachsbarth [CDU/CSU],Dr. Maria Flachsbarth,maria-flachsbarth,427,"Meinen Sie, wir haben die Atomkraftwerke nur so abgeschaltet?",data/txt/17098.txt,poi,cducsu
2494698,98,17,0,Oliver Krischer (BÜNDNIS 90/DIE GRÜNEN),Oliver Krischer,oliver-krischer,428,"Der Vorfall hat sich jetzt nicht in einem untergehenden System wie der damaligen Sowjetunion, sondern im Hightechland Japan ereignet. Wir alle sitzen erschrocken und schockiert vor den Fernsehbildschirmen und sehen zu, wie man hilflos versucht, die Reaktoren mit Wasser aus Wasserschläuchen und von Hubschraubern aus zu kühlen. Die Hilflosigkeit zeigt doch eigentlich nur eines: Diese Technologie ist unbeherrschbar, und sie verzeiht keine Fehler. Deshalb müssen wir sie schnellstmöglich hinter uns lassen.",data/txt/17098.txt,speech,gruene
2494699,98,17,0,,,,429,"Beifall beim BÜNDNIS 90/DIE GRÜNEN, bei der SPD und der LINKEN",data/txt/17098.txt,poi,
2494700,98,17,0,Oliver Krischer (BÜNDNIS 90/DIE GRÜNEN),Oliver Krischer,oliver-krischer,430,"Was im Moment in Japan passiert, ist auch in Deutschland vorstellbar. Denn die eigentliche Ursache der Vorfälle in den Reaktoren waren nicht der Tsunami oder das Erdbeben, sondern der Ausfall der Stromversorgung und damit der Kühlung. Dafür sind sehr viele Auslöser vorstellbar, auch in Deutschland, zum Beispiel ein Flugzeugabsturz, eine Überschwemmung oder auch anderes, worüber wir heute noch gar nicht reden können. Aber all das war auch schon im Oktober letzten Jahres bekannt, als Sie die Laufzeitverlängerung beschlossen haben und nicht über dieses Thema reden wollten.",data/txt/17098.txt,speech,gruene
2494701,98,17,0,,,,431,"Beifall beim BÜNDNIS 90/DIE GRÜNEN, bei der SPD und der LINKEN",data/txt/17098.txt,poi,
2494702,98,17,0,Dr. Maria Flachsbarth [CDU/CSU],Dr. Maria Flachsbarth,maria-flachsbarth,432,Das war auch schon vor fünf oder zehn Jahren bekannt! Meine Güte!,data/txt/17098.txt,poi,cducsu
2494703,98,17,0,Oliver Krischer (BÜNDNIS 90/DIE GRÜNEN),Oliver Krischer,oliver-krischer,433,"Ein weiteres Versäumnis hat der Kollege Miersch bereits angesprochen. Es gibt ein kerntechnisches Regelwerk; aber Sie weigern sich beharrlich, es in Kraft zu setzen. Ich kann das nicht nachvollziehen. Obwohl es dieses Regelwerk gibt, ziehen Sie es vor, das Regelwerk der 60er- und 70er-Jahre anzuwenden. Dafür gibt es eine Erklärung: Wenn Sie das neue kerntechnische Regelwerk in Kraft setzen würden, würde das erhebliche Sicherheitsauflagen bedeuten, und damit würden etliche Anlagen zusätzlich zu den alten vom Netz gehen. Genau das wollen Sie nicht, weil Sie immer noch an den Atomkonzernen kleben.",data/txt/17098.txt,speech,gruene
2494704,98,17,0,,,,434,Beifall beim BÜNDNIS 90/DIE GRÜNEN und bei der SPD sowie bei Abgeordneten der LINKEN,data/txt/17098.txt,poi,
2494705,98,17,0,Oliver Krischer (BÜNDNIS 90/DIE GRÜNEN),Oliver Krischer,oliver-krischer,435,"Ich könnte hier über viele Schwachstellen und Sicherheitsmängel in Atomkraftwerken berichten: über fehlenden Feuerschutz, fehlenden Erdbebenschutz, fehlende Notstandswarte. All das ist Realität in deutschen Atomkraftwerken.",data/txt/17098.txt,speech,gruene
2494706,98,17,0,Michael Kauch [FDP],Michael Kauch,michael-kauch,436,Das war Realität unter Trittin!,data/txt/17098.txt,poi,fdp
2494707,98,17,0,Oliver Krischer (BÜNDNIS 90/DIE GRÜNEN),Oliver Krischer,oliver-krischer,437,"Die Kollegen im Umweltausschuss haben heute zur Kenntnis nehmen müssen, dass es noch nicht einmal ein meldepflichtiges Ereignis ist, wenn unbemerkt 10 Prozent des Kühlmittels verloren gehen. Das ist offensichtlich ein völlig normaler Vorgang. Ich mag mir gar nicht ausmalen, was sonst noch alles in Atomkraftwerken passiert, ohne dass Behörden und Öffentlichkeit davon erfahren.",data/txt/17098.txt,speech,gruene
2494708,98,17,0,,,,438,Beifall beim BÜNDNIS 90/DIE GRÜNEN und bei der SPD sowie bei Abgeordneten der LINKEN,data/txt/17098.txt,poi,
2494709,98,17,0,Oliver Krischer (BÜNDNIS 90/DIE GRÜNEN),Oliver Krischer,oliver-krischer,439,"Sie wissen, dass Sie mit dieser fragwürdigen Atomnummer nicht mehr durchkommen. Deshalb gibt es jetzt das fragwürdige dreimonatige Moratorium. Ich frage mich: Was wollen Sie in drei Monaten herausfinden? Die Überprüfung dauert viel länger. Wenn Ihr Vorhaben seriös sein sollte, müssten Sie einen viel längeren Zeitraum vorsehen.

Außerdem soll die Überprüfung - das ist wirklich der Gipfel - unter der Federführung von Herrn Hennenhöfer - er sitzt hinter der Regierungsbank -, Exlobbyist der Atomkraft, heute der oberste Atomaufseher, stattfinden.",data/txt/17098.txt,speech,gruene
2494710,98,17,0,Dr. Hermann Ott [BÜNDNIS 90/DIE GRÜNEN],Dr. Hermann Ott,hermann-ott,440,Pfui!,data/txt/17098.txt,poi,gruene
2494711,98,17,0,Ute Vogt [SPD],Ute Vogt,ute-vogt,441,Von unseren Steuergeldern bezahlt!,data/txt/17098.txt,poi,spd
2494712,98,17,0,Oliver Krischer (BÜNDNIS 90/DIE GRÜNEN),Oliver Krischer,oliver-krischer,442,"Wenn Sie es mit der Sicherheitsüberprüfung ernst meinen würden, dann müssten wir Ihnen sagen: Sie haben den Frosch beauftragt, den Sumpf trockenzulegen.",data/txt/17098.txt,speech,gruene
2494713,98,17,0,,,,443,"Beifall beim BÜNDNIS 90/DIE GRÜNEN, bei der SPD und der LINKEN",data/txt/17098.txt,poi,
2494714,98,17,0,Dr. Hermann Ott [BÜNDNIS 90/DIE GRÜNEN],Dr. Hermann Ott,hermann-ott,444,Er hat den Bock zum Gärtner gemacht!,data/txt/17098.txt,poi,gruene
2494715,98,17,0,Oliver Krischer (BÜNDNIS 90/DIE GRÜNEN),Oliver Krischer,oliver-krischer,445,"Jetzt wurde eine sogenannte Ethikkommission eingesetzt. Ich muss ehrlich sagen: Als ich gestern die entsprechende Meldung gelesen habe, habe ich das nicht geglaubt. Ist die gesellschaftliche Debatte der letzten 30 Jahre eigentlich an Ihnen vorbeigegangen? Haben Sie nicht gelesen, was Kirchen, Verbände und Institutionen zum Thema ""Atomkraft und Ethik"" gesagt haben? Nein, haben Sie offensichtlich nicht. Das Einzige, was Sie mit der Einsetzung der Ethikkommission bezwecken wollen, ist: Sie wollen herausfinden, wie viel Atomkraft man dem deutschen Volk zumuten kann, damit die Union und die FDP noch so gerade an der Macht bleiben können. Das ist der wahre Zweck dieser Ethikkommission.",data/txt/17098.txt,speech,gruene
2494716,98,17,0,,,,446,Beifall beim BÜNDNIS 90/DIE GRÜNEN und bei der SPD sowie bei Abgeordneten der LINKEN,data/txt/17098.txt,poi,
2494717,98,17,0,Christian Lange [Backnang] [SPD],Christian Lange,christian-lange,447,"Sinn und Zweck ist nur, über den Sonntag zu kommen, sonst nichts!",data/txt/17098.txt,poi,spd
2494718,98,17,0,Oliver Krischer (BÜNDNIS 90/DIE GRÜNEN),Oliver Krischer,oliver-krischer,448,,data/txt/17098.txt,speech,gruene
2494719,98,17,0,Vizepräsidentin Petra Pau,Petra Pau,petra-pau,449,"Kollege Krischer, achten Sie bitte auf die Zeit.",data/txt/17098.txt,chair,
2494720,98,17,0,Oliver Krischer (BÜNDNIS 90/DIE GRÜNEN),Oliver Krischer,oliver-krischer,450,"Ich komme zum Schluss. - Letzter Satz: Entscheiden Sie sich zusammen mit uns, die sieben ältesten AKW sofort vom Netz zu nehmen, das kerntechnische Regelwerk in Kraft zu setzen, eine hinreichende Sicherheitsüberprüfung zu starten, die Laufzeitverlängerung zurückzunehmen sowie den Ausbau der erneuerbaren Energien und die Erhöhung der Energieeffizienz wirklich und ehrlich voranzubringen.

Ich danke Ihnen.",data/txt/17098.txt,speech,gruene
2494721,98,17,0,,,,451,Beifall beim BÜNDNIS 90/DIE GRÜNEN und bei der SPD,data/txt/17098.txt,poi,
2494722,98,17,0,Oliver Krischer (BÜNDNIS 90/DIE GRÜNEN),Oliver Krischer,oliver-krischer,452,,data/txt/17098.txt,speech,gruene
2494723,98,17,0,Vizepräsidentin Petra Pau,Petra Pau,petra-pau,453,Für die Unionsfraktion hat der Kollege Dr. Nüßlein das Wort.,data/txt/17098.txt,chair,
2494724,98,17,0,,,,454,Beifall bei Abgeordneten der CDU/CSU und der FDP,data/txt/17098.txt,poi,
2494725,98,17,0,Vizepräsidentin Petra Pau,Petra Pau,petra-pau,455,,data/txt/17098.txt,chair,
2494726,98,17,0,Dr. Georg Nüßlein (CDU/CSU),Dr. Georg Nüßlein,georg-nußlein,456,"Frau Präsidentin! Meine Damen und Herren! Lieber Herr Krischer, man müsste an Ihrer Rede korrigieren, dass der ""oberste Atomaufseher"" - anders als Sie es gesagt haben - nicht Herr Hennenhöfer ist, sondern Herr Röttgen.",data/txt/17098.txt,speech,cducsu
2494727,98,17,0,Oliver Krischer [BÜNDNIS 90/DIE GRÜNEN],Oliver Krischer,oliver-krischer,457,Das ist ja noch schlimmer!,data/txt/17098.txt,poi,gruene
2494728,98,17,0,Dr. Georg Nüßlein (CDU/CSU),Dr. Georg Nüßlein,georg-nußlein,458,"Man könnte das zu einer Abhandlung ausbauen, um zu zeigen, welche Unwahrheiten Sie an dieser Stelle verbreiten.

Ich will mit einem Begriff anfangen, der in den Vorreden mehrfach aufgetaucht ist, nämlich mit dem Wort ""Konsens"". Ich möchte herausstellen, was man, wenn man redlich ist, als Konsens in diesem Parlament beschreiben muss:",data/txt/17098.txt,speech,cducsu
2494729,98,17,0,"Erstens. Es gibt einen Konsens, dass wir aus der Kernenergie aussteigen wollen. In unserem Koalitionsvertrag steht klipp und klar","Erstens. Es gibt einen Konsens, dass wir aus der Kernenergie aussteigen wollen. In unserem Koalitionsvertrag steht klipp und klar",erstens-es-gibt-einen-konsens-dass-wir-aus-der-kernenergie-aussteigen-wollen-in-unserem-koalitionsvertrag-steht-klipp-und-klar,459,"Die Kernenergie ist eine Brückentechnologie, bis sie durch erneuerbare Energien verlässlich ersetzt werden kann.

Es geht also um einen Ausstieg. Dort steht auch:

Das Neubauverbot ... bleibt bestehen.",data/txt/17098.txt,speech,
2494730,98,17,0,Dr. Hermann Ott [BÜNDNIS 90/DIE GRÜNEN],Dr. Hermann Ott,hermann-ott,460,"Aussteigen, aber verlängern! Toll!",data/txt/17098.txt,poi,gruene
2494731,98,17,0,"Erstens. Es gibt einen Konsens, dass wir aus der Kernenergie aussteigen wollen. In unserem Koalitionsvertrag steht klipp und klar","Erstens. Es gibt einen Konsens, dass wir aus der Kernenergie aussteigen wollen. In unserem Koalitionsvertrag steht klipp und klar",erstens-es-gibt-einen-konsens-dass-wir-aus-der-kernenergie-aussteigen-wollen-in-unserem-koalitionsvertrag-steht-klipp-und-klar,461,"Ich gehe davon aus, dass Sie das genauso sehen. Das ist nur eine Frage der - -",data/txt/17098.txt,speech,
2494732,98,17,0,Katja Keul [BÜNDNIS 90/DIE GRÜNEN],Katja Keul,katja-keul,462,Der Dauer!,data/txt/17098.txt,poi,gruene
2494733,98,17,0,"Erstens. Es gibt einen Konsens, dass wir aus der Kernenergie aussteigen wollen. In unserem Koalitionsvertrag steht klipp und klar","Erstens. Es gibt einen Konsens, dass wir aus der Kernenergie aussteigen wollen. In unserem Koalitionsvertrag steht klipp und klar",erstens-es-gibt-einen-konsens-dass-wir-aus-der-kernenergie-aussteigen-wollen-in-unserem-koalitionsvertrag-steht-klipp-und-klar,463,"Die Frage ist: Wie lange dauert der Übergang? Wie lang muss diese Brücke sein?

Zweitens. Wenn ich von den Grünen wäre, würde ich nicht ganz so laut schreien. Denn Sie haben es im Jahr 2000 offenbar genauso gesehen, dass es nämlich eine Übergangsfrist geben muss.",data/txt/17098.txt,speech,
2494734,98,17,0,Hans-Josef Fell [BÜNDNIS 90/DIE GRÜNEN],Hans-Josef Fell,hans-josef-fell,464,Aber nicht eine so lange wie bei Ihnen!,data/txt/17098.txt,poi,gruene
2494735,98,17,0,"Erstens. Es gibt einen Konsens, dass wir aus der Kernenergie aussteigen wollen. In unserem Koalitionsvertrag steht klipp und klar","Erstens. Es gibt einen Konsens, dass wir aus der Kernenergie aussteigen wollen. In unserem Koalitionsvertrag steht klipp und klar",erstens-es-gibt-einen-konsens-dass-wir-aus-der-kernenergie-aussteigen-wollen-in-unserem-koalitionsvertrag-steht-klipp-und-klar,465,Sie sind im Wahlkampf 1998 mit der Forderung nach einem sofortigen Ausstieg angetreten; die Nutzung der Kernkraft sei unverantwortlich.,data/txt/17098.txt,speech,
2494736,98,17,0,Hans-Josef Fell [BÜNDNIS 90/DIE GRÜNEN],Hans-Josef Fell,hans-josef-fell,466,Die alte Leier wieder!,data/txt/17098.txt,poi,gruene
2494737,98,17,0,"Erstens. Es gibt einen Konsens, dass wir aus der Kernenergie aussteigen wollen. In unserem Koalitionsvertrag steht klipp und klar","Erstens. Es gibt einen Konsens, dass wir aus der Kernenergie aussteigen wollen. In unserem Koalitionsvertrag steht klipp und klar",erstens-es-gibt-einen-konsens-dass-wir-aus-der-kernenergie-aussteigen-wollen-in-unserem-koalitionsvertrag-steht-klipp-und-klar,467,Diese Forderung kramen Sie heute wieder heraus. Dann haben Sie unter dem Eindruck der Annehmlichkeiten von Dienstwagen gesagt:,data/txt/17098.txt,speech,
2494738,98,17,0,,,,468,Widerspruch bei der SPD und dem BÜNDNIS 90/DIE GRÜNEN,data/txt/17098.txt,poi,
2494739,98,17,0,Ute Vogt [SPD],Ute Vogt,ute-vogt,469,Billig!,data/txt/17098.txt,poi,spd
2494740,98,17,0,"Erstens. Es gibt einen Konsens, dass wir aus der Kernenergie aussteigen wollen. In unserem Koalitionsvertrag steht klipp und klar","Erstens. Es gibt einen Konsens, dass wir aus der Kernenergie aussteigen wollen. In unserem Koalitionsvertrag steht klipp und klar",erstens-es-gibt-einen-konsens-dass-wir-aus-der-kernenergie-aussteigen-wollen-in-unserem-koalitionsvertrag-steht-klipp-und-klar,470,"Wenn es dem Erhalt von Ministerämtern dient, dann kann man eine längere Laufzeit verantworten.",data/txt/17098.txt,speech,
2494741,98,17,0,,,,471,Beifall bei der CDU/CSU und der FDP,data/txt/17098.txt,poi,
2494742,98,17,0,"Erstens. Es gibt einen Konsens, dass wir aus der Kernenergie aussteigen wollen. In unserem Koalitionsvertrag steht klipp und klar","Erstens. Es gibt einen Konsens, dass wir aus der Kernenergie aussteigen wollen. In unserem Koalitionsvertrag steht klipp und klar",erstens-es-gibt-einen-konsens-dass-wir-aus-der-kernenergie-aussteigen-wollen-in-unserem-koalitionsvertrag-steht-klipp-und-klar,472,"Liebe Freunde von der SPD, noch schlimmer war, dass sich der frühere Umweltminister, Herr Gabriel, in der letzten Debatte dazu hinreißen ließ, zu sagen, er habe schon immer gewusst, dass von den alten Anlagen, die wir jetzt vom Netz genommen haben, eine Gefahr für Leib und Leben ausgehe. Da frage ich mich: Was war das für ein Minister, der das wusste, der die Verantwortung dafür tragen musste, aber nicht zurückgetreten ist? Meine Damen und Herren, an der Stelle müssen wir doch überhaupt nicht über Redlichkeit diskutieren.",data/txt/17098.txt,speech,
2494743,98,17,0,,,,473,Beifall bei Abgeordneten der CDU/CSU und der FDP,data/txt/17098.txt,poi,
2494744,98,17,0,"Erstens. Es gibt einen Konsens, dass wir aus der Kernenergie aussteigen wollen. In unserem Koalitionsvertrag steht klipp und klar","Erstens. Es gibt einen Konsens, dass wir aus der Kernenergie aussteigen wollen. In unserem Koalitionsvertrag steht klipp und klar",erstens-es-gibt-einen-konsens-dass-wir-aus-der-kernenergie-aussteigen-wollen-in-unserem-koalitionsvertrag-steht-klipp-und-klar,474,"Es muss eine Übergangsfrist geben. Wir haben über die Frage diskutiert, wie lang diese sein muss; darüber werden wir im Rahmen des Moratoriums sicherlich neu diskutieren.",data/txt/17098.txt,speech,
2494745,98,17,0,Hans-Josef Fell [BÜNDNIS 90/DIE GRÜNEN],Hans-Josef Fell,hans-josef-fell,475,"Ich dachte, Sie wollen aussteigen! Jetzt wollen Sie darüber ""neu diskutieren""!",data/txt/17098.txt,poi,gruene
2494746,98,17,0,"Erstens. Es gibt einen Konsens, dass wir aus der Kernenergie aussteigen wollen. In unserem Koalitionsvertrag steht klipp und klar","Erstens. Es gibt einen Konsens, dass wir aus der Kernenergie aussteigen wollen. In unserem Koalitionsvertrag steht klipp und klar",erstens-es-gibt-einen-konsens-dass-wir-aus-der-kernenergie-aussteigen-wollen-in-unserem-koalitionsvertrag-steht-klipp-und-klar,476,"Auch muss man Ihnen deutlich sagen - Kollege Kauch hatte damit schon angefangen -: Konsens bestand hinsichtlich des Sicherheitsniveaus. Man muss klarstellen, dass es offenbar ein gemeinsames Verständnis hinsichtlich Sicherheit und Vertretbarkeit gibt. Im Übrigen steht nichts anderes in Ihrem sogenannten Ausstiegsvertrag. Dort heißt es explizit, dass die Anlagen auf einem im internationalen Vergleich hohen Sicherheitsniveau betrieben werden. Die Einschätzung des Sicherheitsniveaus, die dem bisherigen Betrieb zugrunde lag, ist gemeinsam erfolgt. Ich würde das an Ihrer Stelle nicht bestreiten. Wenn Sie es anders sehen, dann stellt sich nämlich die Frage: Warum sind Sie damals nicht ausgestiegen?",data/txt/17098.txt,speech,
2494747,98,17,0,,,,477,Beifall bei der CDU/CSU und der FDP,data/txt/17098.txt,poi,
2494748,98,17,0,"Erstens. Es gibt einen Konsens, dass wir aus der Kernenergie aussteigen wollen. In unserem Koalitionsvertrag steht klipp und klar","Erstens. Es gibt einen Konsens, dass wir aus der Kernenergie aussteigen wollen. In unserem Koalitionsvertrag steht klipp und klar",erstens-es-gibt-einen-konsens-dass-wir-aus-der-kernenergie-aussteigen-wollen-in-unserem-koalitionsvertrag-steht-klipp-und-klar,478,"Lassen Sie mich zu dem seltsamen Deal kommen, der schon angesprochen wurde. Das Ganze ärgert Sie immer wieder; das weiß ich. Sie haben in dem Ausstiegsvertrag mit den Versorgern niederlegt:

Die Bundesregierung wird keine Initiative ergreifen, um diesen

- den gerade beschriebenen -

Sicherheitsstandard und die diesem zugrunde liegende Sicherheitsphilosophie zu ändern.",data/txt/17098.txt,speech,
2494749,98,17,0,Ute Vogt [SPD],Ute Vogt,ute-vogt,479,Sicherheit nach Stand von Wissenschaft und Technik! Das war unsere Grundlage!,data/txt/17098.txt,poi,spd
2494750,98,17,0,"Erstens. Es gibt einen Konsens, dass wir aus der Kernenergie aussteigen wollen. In unserem Koalitionsvertrag steht klipp und klar","Erstens. Es gibt einen Konsens, dass wir aus der Kernenergie aussteigen wollen. In unserem Koalitionsvertrag steht klipp und klar",erstens-es-gibt-einen-konsens-dass-wir-aus-der-kernenergie-aussteigen-wollen-in-unserem-koalitionsvertrag-steht-klipp-und-klar,480,"Wenn man das so niederlegt, ist man meiner Ansicht nach in der Defensive.",data/txt/17098.txt,speech,
2494751,98,17,0,Frank Schwabe [SPD],Frank Schwabe,frank-schwabe,481,Wir sind in der Defensive? Lenken Sie doch nicht ab!,data/txt/17098.txt,poi,spd
2494752,98,17,0,"Erstens. Es gibt einen Konsens, dass wir aus der Kernenergie aussteigen wollen. In unserem Koalitionsvertrag steht klipp und klar","Erstens. Es gibt einen Konsens, dass wir aus der Kernenergie aussteigen wollen. In unserem Koalitionsvertrag steht klipp und klar",erstens-es-gibt-einen-konsens-dass-wir-aus-der-kernenergie-aussteigen-wollen-in-unserem-koalitionsvertrag-steht-klipp-und-klar,482,- Warten Sie es ab. - Man muss sich Folgendes vor Augen führen:,data/txt/17098.txt,speech,
2494753,98,17,0,Christian Lange [Backnang] [SPD],Christian Lange,christian-lange,483,Jetzt entschuldigen Sie sich doch tatsächlich für Ihre Atompolitik in den letzten Jahrzehnten! Eine Entschuldigung gegenüber dem deutschen Volk wäre angesagt! Das ist ja unglaublich!,data/txt/17098.txt,poi,spd
2494754,98,17,0,"Erstens. Es gibt einen Konsens, dass wir aus der Kernenergie aussteigen wollen. In unserem Koalitionsvertrag steht klipp und klar","Erstens. Es gibt einen Konsens, dass wir aus der Kernenergie aussteigen wollen. In unserem Koalitionsvertrag steht klipp und klar",erstens-es-gibt-einen-konsens-dass-wir-aus-der-kernenergie-aussteigen-wollen-in-unserem-koalitionsvertrag-steht-klipp-und-klar,484,"Wenn das, was Sie mit den Versorgern vereinbart haben, was wir geändert haben, weiterhin gelten würde, dann brauchten wir jetzt nicht über ein Moratorium, eine Änderung der Politik und all das zu diskutieren. Wir diskutieren darüber, weil Sie damals etwas anderes vereinbart haben. Das muss man einmal in aller Deutlichkeit sagen.",data/txt/17098.txt,speech,
2494755,98,17,0,,,,485,Beifall bei der CDU/CSU und der FDP,data/txt/17098.txt,poi,
2494756,98,17,0,,,,486,Lachen bei der SPD und dem BÜNDNIS 90/DIE GRÜNEN,data/txt/17098.txt,poi,
2494757,98,17,0,Christian Lange [Backnang] [SPD],Christian Lange,christian-lange,487,Eine Entschuldigung fehlt!,data/txt/17098.txt,poi,spd
