id,sitzung,wahlperiode,in_writing,speaker,speaker_cleaned,speaker_fp,sequence,text,filename,type,speaker_party
1959952,96,17,0,,,,1267,"Deswegen lese ich einmal vor, was Rot-Grün damals vorgeschlagen hat - ich zitiere aus der Drucksache 15/1521, Seite 1 -:

Der Gesetzentwurf

- zur Steueramnestie -

soll dazu beitragen, durch eine attraktive Regelung für die Vergangenheit einen Anreiz zu bieten, in die Steuerehrlichkeit zurückzukehren und damit einen Beitrag zum Rechtsfrieden zu leisten.

So steht es im Gesetzentwurf von Rot-Grün.

Das zweite Zitat - ich habe noch eine ganze Reihe dabei - lautet folgendermaßen: Dieses in die Zukunft gerichtete Angebot zur Rückkehr in die Steuerehrlichkeit sei gegenüber denjenigen, die in der Vergangenheit Steuern hinterzogen hätten, äußerst fair. Gleichzeitig könne der ehrliche Steuerzahler mit dieser Regelung leben, weil die fiskalische Belastung zukünftig auf eine höhere Anzahl Steuerpflichtiger verteilt werde.

Darum geht es. Wir wollen diejenigen, die Steuern hinterzogen haben, dazu bewegen, sich selbst anzuzeigen, damit sie in die Steuerehrlichkeit zurückfinden und anschließend wieder Steuern in diesem Staat zahlen. Das ist der Inhalt des Gesetzes, und das haben Sie damals auch so gesehen. Deswegen bin ich überrascht, dass Sie, Herr Gerster, nicht nur unsere Verfahrensweise angreifen und inhaltlich wenig sagen, sondern auch eine neue Position vortragen, die bisher nicht Ihre Position gewesen ist und die dem, was Praktiker, Wissenschaftler und die Finanzverwaltung sagen, völlig entgegensteht.",data/txt/17096.txt,speech,
1959953,96,17,0,,,,1268,Beifall bei der CDU/CSU und der FDP,data/txt/17096.txt,poi,
1959954,96,17,0,,,,1269,"Das ist einfach eine populistische Wende. Normalerweise müssten Sie rote Ohren bekommen; denn Ihre Amnestie ging weit über das hinaus, was heute durch die strafbefreiende Selbstanzeige geschehen soll. Bei einer strafbefreienden Selbstanzeige haben wir folgende Situation: Die Betroffenen zahlen die Steuern für bis zu zehn Jahre zuzüglich 6 Prozent Zinsen für jedes Jahr nach, demnächst außerdem noch einen Zuschlag von 5 Prozent.

Allein die Steuer-CDs - es hieß ja nur, die CD ist gekauft worden - haben im vergangenen Jahr 26 400 Steuerzahler dazu bewogen, sich selbst anzuzeigen. Im Durchschnitt mussten sie 80 000 Euro Steuern und Zinsen nachzahlen. Es waren insgesamt 2 Milliarden Euro, die in die Kassen von Bund, Ländern und Gemeinden gekommen sind. Deswegen waren auch die Länder an einer solchen Lösung interessiert: Sie haben in diesem Fall allein 850 Millionen Euro bekommen, die Kommunen 300 Millionen Euro.",data/txt/17096.txt,speech,
1959955,96,17,0,,,,1270,Beifall bei Abgeordneten der CDU/CSU,data/txt/17096.txt,poi,
1959956,96,17,0,,,,1271,"Vizepräsidentin Katrin Göring-Eckardt:

Herr Kollege, möchten Sie eine Zwischenfrage des Kollegen Schick zulassen?

Klaus-Peter Flosbach (CDU/CSU):

Zu Ihrem Antrag von damals? - Bitte.",data/txt/17096.txt,speech,
1959957,96,17,0,Lothar Binding [Heidelberg] [SPD],Lothar Binding [Heidelberg] [SPD],lothar-binding-heidelberg-spd,1272,"Nein, zu den Ministerpräsidenten, die die nicht kaufen wollten!",data/txt/17096.txt,poi,spd
1959958,96,17,0,,,,1273,"Dr. Gerhard Schick (BÜNDNIS 90/DIE GRÜNEN):

Herr Flosbach, meinen Sie, dass ein schlechtes Gesetz der Vergangenheit es rechtfertigt, heute ein schlechtes Gesetz vorzulegen? Ich habe das damalige Gesetz nicht für richtig gehalten, aber Ihr heutiges Gesetz ist schlecht, und darum geht es.

Klaus-Peter Flosbach (CDU/CSU):

Vielen Dank. - Das ist ein ausgesprochen gutes Gesetz. Sie müssen nur auf die Praktiker aus der Anhörung hören, die deutlich gesagt haben: Das ist genau der richtige Weg. Machen Sie nicht, wie von Herrn Gerster vorgeschlagen, den Fehler, die Selbstanzeige abzuschaffen. Das gibt ein Chaos im Steuerrecht. Behalten Sie die Selbstanzeige bei. Sie ist die einzige Möglichkeit, wieder zur Steuerehrlichkeit zurückzufinden. Sonst müssen Sie möglicherweise, wie von Herrn Pitterle vorgeschlagen - Sie hätten wahrscheinlich am liebsten alle hinter Mauern -, Tausende und Abertausende von Fahndern einsetzen.

Wir wollen die Leute in die Steuerehrlichkeit zurückführen, und das ist der zentrale Punkt dieses Gesetzes.",data/txt/17096.txt,speech,
1959959,96,17,0,,,,1274,Beifall bei der CDU/CSU und der FDP,data/txt/17096.txt,poi,
1959960,96,17,0,,,,1275,"Liebe Kollegen von der SPD, wir haben 2007, 2008 und 2009 viele gute Dinge gemacht, von der Telefonüberwachung über die Verlängerung der Verjährungsfrist bei Steuerhinterziehung auf zehn Jahre bis hin zu den Auskunftsabkommen mit Luxemburg und Liechtenstein; jetzt kommt noch eines mit der Schweiz hinzu. Wir sind auf dem richtigen Weg, das Risiko zu erhöhen. Das wollen wir doch auch. Wir wollen das Risiko der Entdeckung erhöhen. Deswegen sollten wir aber trotzdem nicht die strafbefreiende Selbstanzeige abschaffen.

Wir haben im Rahmen der Diskussion erfahren, dass es immer noch Lücken im Gesetz gibt. Deswegen haben wir drei zentrale Änderungen - auch nach dem BGH-Urteil - vorgenommen.

Wir haben gesagt: Wenn der Prüfer vor der Tür steht, ist es zu spät. Dann gibt es keine Selbstanzeige mehr. Bisher war es so: Wenn eine Prüfungsanordnung erfolgte, hatte der Steuerpflichtige immer noch die Chance, sich selbst anzuzeigen. Das schaffen wir ab. Wenn die Prüfungsanordnung erfolgt ist, ist die Chance zur Selbstanzeige nicht mehr gegeben. Das heißt, wir verschärfen hier drastisch.

Das Zweite ist die Teilselbstanzeige. Wenn einer in die Schweiz Geld verschoben hat und dazu eine Selbstanzeige macht, gleichzeitig beispielsweise nach Luxemburg Geld verschoben, sich dafür aber nicht selbst angezeigt hat, gilt für diesen Tatbestand die Selbstanzeige nicht. Er ist nach wie vor strafrechtlich zu verfolgen.

Drittens gibt es den neuen Strafzuschlag ab einem Betrag von 50 000 Euro - so hat der BGH die besonders schweren Fälle bezeichnet -, mit dem wir weitere 5 Prozent kassieren.

Wir haben in der Koalition festgehalten: Es soll teuer werden. Es soll teurer werden im Vergleich zu allen, die bisher pünktlich ihre Steuern gezahlt haben.

Wer die Anhörung aufmerksam verfolgt hat, wird auch mitbekommen haben, dass der Vertreter der Oberfinanzdirektion deutlich gesagt hat: Es geht hier um Einkünfte aus Kapitalvermögen. Es geht nicht um die Kfz-Steuer, Hundesteuer oder andere. - Das ist der Punkt. Hier geht es darum, die größeren Beträge für diesen Staat zu erhalten. Gerade die Praktiker aus Steuerverwaltung und Finanzverwaltung haben gesagt: Versucht nicht, fahrlässige Steuerverkürzungen oder Fehler zu kriminalisieren! Es geht darum, denjenigen, die Fehler machen, auch die Möglichkeit zu geben, durch eine Berichtigung ihrer Steuererklärung in der Veranlagung wieder zur Steuerehrlichkeit zurückzufinden oder ihren Fehler einzugestehen. Sie müssen nicht strafrechtlich verfolgt werden.",data/txt/17096.txt,speech,
1959961,96,17,0,Lothar Binding [Heidelberg] [SPD],Lothar Binding [Heidelberg] [SPD],lothar-binding-heidelberg-spd,1276,Das wollen wir alle!,data/txt/17096.txt,poi,spd
1959962,96,17,0,,,,1277,"- Das freut mich, dass auch Sie das wollen. Dann wäre es gut, wenn Sie unserem Gesetz zustimmten.",data/txt/17096.txt,speech,
1959963,96,17,0,,,,1278,Beifall bei der CDU/CSU und der FDP,data/txt/17096.txt,poi,
1959964,96,17,0,,,,1279,"Es ist wichtig, dass auch die Länder dem zustimmen wollen. Es geht hier auch darum, wie wir unseren Staat finanzieren. Es ist eine wichtige Maßnahme dieses Gesetzes, dass wir Steuersündern die Rückkehr in die Steuerehrlichkeit ermöglichen wollen.

Wir brauchen die damit zu erzielenden Steuereinnahmen, etwa für die Familien. Wir haben Anfang letzten Jahres die Familien um 4,6  Milliarden Euro entlastet. 1,6 Milliarden Euro wurden im Rahmen von Hartz IV für die Bildungsangebote bereitgestellt. All dies müssen wir finanzieren. Dazu brauchen wir eben auch diejenigen, die beispielsweise bisher Steuern hinterzogen haben, aber in Zukunft ihre Steuern wieder zahlen wollen und damit einen Beitrag für diesen Staat leisten.

Wer in diesem Wirtschaftssystem die Chance nutzt, Geld zu verdienen, wer in diesem Sozialsystem lebt, wer Rechte in diesem Staat für sich in Anspruch nimmt, -

Vizepräsidentin Katrin Göring-Eckardt:

Herr Kollege.

Klaus-Peter Flosbach (CDU/CSU):

- ist verpflichtet, seinen Beitrag für diesen Staat zu leisten.

Vielen Dank.",data/txt/17096.txt,speech,
1959965,96,17,0,,,,1280,Beifall bei der CDU/CSU und der FDP,data/txt/17096.txt,poi,
1959966,96,17,0,,,,1281,"Vizepräsidentin Katrin Göring-Eckardt:

Ich schließe die Aussprache.

Wir kommen zur Abstimmung über den von den Fraktionen der CDU/CSU und FDP eingebrachten Gesetzentwurf zur Verbesserung der Bekämpfung von Geldwäsche und Steuerhinterziehung. Der Finanzausschuss empfiehlt unter Buchstabe a seiner Beschlussempfehlung auf Drucksache 17/5067 (neu), den Gesetzentwurf auf Drucksache 17/4182 in der Ausschussfassung anzunehmen. Diejenigen, die zustimmen wollen, bitte ich um das Handzeichen. - Die Gegenstimmen! - Enthaltungen? - Damit ist der Gesetzentwurf in zweiter Beratung angenommen.

Dritte Beratung

und Schlussabstimmung. Wenn Sie zustimmen wollen, mögen Sie bitte aufstehen. - Die Gegenstimmen! - Enthaltungen? - Damit ist der Gesetzentwurf in dritter Beratung bei Zustimmung durch die Koalitionsfraktionen und Gegenstimmen der Oppositionsfraktionen angenommen.

Wir kommen jetzt zur Abstimmung über den Entschließungsantrag der Fraktion der SPD auf Drucksache 17/5085. Wer stimmt für den Entschließungsantrag? - Wer stimmt dagegen? - Wer enthält sich? - Damit ist der Entschließungsantrag gegen die Stimmen von SPD, Linkspartei und Bündnis 90/Die Grünen abgelehnt.

Wir kommen zur Abstimmung über die Beschlussempfehlung des Finanzausschusses zu dem Gesetzentwurf der Bundesregierung zur Verbesserung der Bekämpfung von Geldwäsche und Steuerhinterziehung. Der Finanzausschuss empfiehlt unter Buchstabe b in seiner Beschlussempfehlung auf Drucksache 17/5067 (neu), den Gesetzentwurf der Bundesregierung auf Drucksache 17/4802 für erledigt zu erklären. Wer stimmt für diese Beschlussempfehlung? - Wer stimmt dagegen? - Enthaltungen? - Sie ist einstimmig angenommen.

Dann komme ich zur Abstimmung über den Gesetzentwurf der Fraktion der SPD zur Änderung der Abgabenordnung (Abschaffung der strafbefreienden Selbstanzeige bei Steuerhinterziehung). Der Finanzausschuss empfiehlt unter Buchstabe c seiner Beschlussempfehlung auf Drucksache 17/5067 (neu), den Gesetzentwurf auf Drucksache 17/1411 abzulehnen. Ich bitte diejenigen, die dem Gesetzentwurf zustimmen wollen, um das Handzeichen. - Wer stimmt dagegen? - Enthaltungen? - Der Gesetzentwurf ist abgelehnt. Zugestimmt haben die SPD und die Fraktion Die Linke; die übrigen Fraktionen des Hauses haben abgelehnt. Damit entfällt die dritte Beratung.

Wir setzen die Abstimmungen über die Beschlussempfehlungen des Finanzausschusses fort.

Der Ausschuss empfiehlt unter Buchstabe d seiner Beschlussempfehlung die Annahme des Antrags der Fraktionen der CDU/CSU und FDP auf Drucksache 17/1755 mit dem Titel ""Steuerhinterziehung wirksam und zielgenau bekämpfen"". Wer stimmt für diese Beschlussempfehlung? - Wer stimmt dagegen? - Wer enthält sich? - Die Beschlussempfehlung ist angenommen. Zugestimmt haben CDU/CSU und FDP, abgelehnt SPD, Linke und Bündnis 90/Die Grünen.

Unter Buchstabe e empfiehlt der Ausschuss die Ablehnung des Antrags der Fraktion der SPD auf Drucksache 17/4670 mit dem Titel ""Instrumente zur Bekämpfung der Steuerhinterziehung nutzen und ausbauen"". Wer stimmt für die Beschlussempfehlung? - Wer stimmt dagegen? - Enthaltungen? - Die Beschlussempfehlung ist angenommen. Zugestimmt haben CDU/CSU und FDP, dagegen SPD und Bündnis 90/Die Grünen. Die Fraktion Die Linke hat sich enthalten.

Weiterhin empfiehlt der Ausschuss unter Buchstabe f seiner Beschlussempfehlung die Ablehnung des Antrags der Fraktion Die Linke auf Drucksache 17/1149 mit dem Titel ""Den Kampf gegen Steuerhinterziehung nicht dem Zufall überlassen"". Wer stimmt für die Beschlussempfehlung? - Wer stimmt dagegen? - Enthaltungen? - Die Beschlussempfehlung wurde angenommen. Die Fraktion Die Linke hat dagegen gestimmt, die übrigen Fraktionen dafür.

Schließlich empfiehlt der Ausschuss unter Buchstabe g seiner Beschlussempfehlung die Ablehnung des Antrags der Fraktion Bündnis 90/Die Grünen auf Drucksache 17/1765 mit dem Titel ""Steuerhinterziehung wirksam bekämpfen"". Wer stimmt für die Beschlussempfehlung? - Was war jetzt bei der SPD: War nur eine dafür oder alle? - Seid ihr zu faul? Ich frage also noch einmal: Wer stimmt für die Beschlussempfehlung? - Wer stimmt dagegen? - Wer enthält sich?",data/txt/17096.txt,speech,
1959967,96,17,0,,,,1282,Heiterkeit bei Abgeordneten der SPD,data/txt/17096.txt,poi,
1959968,96,17,0,Zuruf von der CDU/CSU,von der CDU/CSU,von-der-cdu-csu,1283,Chaotischer Verein!,data/txt/17096.txt,poi,cducsu
1959969,96,17,0,Dr. Gerhard Schick [BÜNDNIS 90/DIE GRÜNEN],Dr. Gerhard Schick [BÜNDNIS 90/DIE GRÜNEN],gerhard-schick-bundnis-90-die-grunen,1284,Im Ausschuss haben sie sich enthalten!,data/txt/17096.txt,poi,gruene
1959970,96,17,0,,,,1285,Wollt ihr eine Auszeit? - Also: Die Beschlussempfehlung wurde angenommen. Die Koalitionsfraktionen sowie die SPD haben der Beschlussempfehlung im Wesentlichen zugestimmt.,data/txt/17096.txt,speech,
1959971,96,17,0,,,,1286,Heiterkeit bei der SPD,data/txt/17096.txt,poi,
1959972,96,17,0,,,,1287,Beifall der Abg. Petra Ernstberger [SPD],data/txt/17096.txt,poi,
1959973,96,17,0,,,,1288,"Bündnis 90/Die Grünen haben dagegen gestimmt. Die Fraktion Die Linke hat sich enthalten.

Ich rufe jetzt die Tagesordnungspunkte 8 a bis c auf:

a)	Beratung des Antrags der Abgeordneten Uwe Beckmeyer, Sören Bartol, Martin Burkert, weiterer Abgeordneter und der Fraktion der SPD

Stillstand in der Verkehrspolitik überwinden - Zukunftskommission zur Reform der Infrastrukturfinanzierung einrichten

- Drucksache 17/5022 -

Überweisungsvorschlag:

Ausschuss für Verkehr, Bau und Stadtentwicklung (f)

Finanzausschuss

Ausschuss für Wirtschaft und Technologie

Ausschuss für Umwelt, Naturschutz und Reaktorsicherheit

Haushaltsausschuss

b)	Beratung der Beschlussempfehlung und des Berichts des Ausschusses für Verkehr, Bau und Stadtentwicklung (15. Ausschuss) zu dem Antrag der Abgeordneten Uwe Beckmeyer, Sören Bartol, Martin Burkert, weiterer Abgeordneter und der Fraktion der SPD

Erhalt und Ausbau der Verkehrsinfrastruktur sichern - Deutschland braucht eine moderne Zukunftsstrategie zur Infrastrukturfinanzierung

- Drucksachen 17/782, 17/1479 -

Berichterstattung:

Abgeordneter Reinhold Sendker

c)	Beratung der Beschlussempfehlung und des Berichts des Ausschusses für Verkehr, Bau und Stadtentwicklung (15. Ausschuss) zu dem Antrag der Abgeordneten Uwe Beckmeyer, Sören Bartol, Martin Burkert, weiterer Abgeordneter und der Fraktion der SPD

Mobilität nachhaltig gestalten - Erfolgreichen Ansatz der integrierten Verkehrspolitik fortentwickeln

- Drucksachen 17/1060, 17/2226 -

Berichterstattung:

Abgeordneter Steffen Bilger

Nach einer interfraktionellen Verabredung ist für die Aussprache hierzu eine Dreiviertelstunde vorgesehen. - Dazu höre ich keinen Widerspruch. Dann ist das so beschlossen.

Ich eröffne die Aussprache und gebe als Erstem dem Kollegen Uwe Beckmeyer für die SPD-Fraktion das Wort.

Uwe Beckmeyer (SPD):

Verehrte Frau Präsidentin! Sehr geehrte Damen und Herren! Wir Sozialdemokraten haben unseren Antrag mit dem Satz überschrieben: ""Stillstand in der Verkehrspolitik überwinden - Zukunftskommission zur Reform der Infrastrukturfinanzierung einrichten"". Das ist unser Ziel.

Wir stellen im Hinblick auf den Erhalt und Ausbau einen steigenden Investitionsbedarf fest. Wir erleben, dass Schwarz-Gelb den Stillstand organisiert. Dabei brauchen wir eine gesellschaftliche Reformdebatte; sie ist dringend notwendig.

Wir müssen die Basis der wirtschaftlichen Prosperität in Deutschland mit einer guten Infrastruktur sichern. Wir wollen Mobilität sozial gerecht und ökologisch sinnvoll organisieren. Wir wollen die umweltfreundlichen Verkehrsträger Schiene und Wasserstraße weiter stärken, und wir wollen Bundesstraßen mit nachgeordneter Bedeutung abstufen, was eine alte Forderung der Reformkommission ist. Wir wollen deutlich mehr Geld für Lärmschutzmaßnahmen an Straßen und Schienenwegen ausgeben. Wir brauchen die Akzeptanz der Menschen in unserem Land für Investitionen in die Infrastruktur. Jeder von uns, der mit den Menschen draußen im Land redet, weiß, dass diese Menschen fragen: Was macht ihr, um uns vor Lärm zu schützen? Habt ihr spezielle Programme? Weitet ihr die Programme aus? Wann sind Lärmschutzmaßnahmen bei uns dran? - Wir wollen die Menschen früher am Planungsprozess beteiligen - diese Lehre haben wir aus den Erfahrungen im letzten Jahr gezogen -, aber wir wissen auch, dass wir die Planungszeiten verkürzen müssen. Außerdem wollen wir, dass die Bundesregierung dem Bundestag turnusmäßig einen verkehrsträgerübergreifenden Netzzustandsbericht vorlegt. Der letzte Punkt ist: Wir brauchen eine bedarfsgerechte Finanzierung der Investitionen in die Infrastruktur. Eine Finanzierung nach Kassenlage ist gerade für die Verkehrsinfrastruktur fatal.

Herr Minister, ich freue mich, dass Sie an dieser Debatte teilnehmen. Wir erwarten, dass Sie noch in dieser Legislaturperiode ein Konzept zur Sicherung der Infrastrukturfinanzierung vorlegen. Wir müssen - das ist die Voraussetzung - gemeinsam mit der Gesellschaft ein Leitbild für die Mobilität im 21. Jahrhundert erarbeiten. Wir erwarten, dass Sie, der verantwortliche Minister, eine Zukunftskommission zur Weiterentwicklung der Infrastrukturfinanzierung in Deutschland einsetzen.

Herr Bundesminister Ramsauer, was ist Ihr Ziel? Vor einigen Tagen charakterisierte jemand Ihre Politik folgendermaßen - ich will das gerne zitieren -: Ohne Ziel stimmt jede Richtung.",data/txt/17096.txt,speech,
1959974,96,17,0,Gustav Herzog [SPD],Gustav Herzog [SPD],gustav-herzog-spd,1289,Sehr richtig!,data/txt/17096.txt,poi,spd
1959975,96,17,0,,,,1290,"Das ist die Situation. Dabei wissen wir doch alle, dass nur eine gute Verkehrsinfrastruktur wirtschaftliches Wachstum, Beschäftigung und Wohlstand in Deutschland voranbringt. Wir haben einen steigenden Investitionsbedarf. Wer will das eigentlich leugnen? Der von Ihnen verantwortete Haushalt zeigt, dass der Bereich der Verkehrsinfrastruktur unterfinanziert ist, auch wenn Sie über die Presse bekunden, dass das Haushaltsvolumen nun bei über 10 Milliarden Euro liegt. Das ist gegenüber 9,75 Milliarden Euro eine Steigerung. Wir wissen aber, dass dieser Zuwachs durch Preissteigerungen fast komplett aufgefressen wird.

Das bedeutet, dass wir etwas tun müssen. Ich erwarte von Ihnen, dass Sie bald etwas tun. Diese Legislaturperiode dauert schon anderthalb Jahre. Dafür ist zu wenig geschehen. Wenn wir uns anschauen, was Sie von Schwarz-Gelb in Ihren Koalitionsvertrag geschrieben haben, und überlegen, welche Projekte umgesetzt wurden - wir haben der Bundesregierung entsprechende Fragen gestellt -, stellen wir fest, dass dabei nichts herausgekommen ist. Wir haben das Ergebnis der Bemühungen der Koalitionsfraktionen wie folgt abgefragt:

Erstens. Wie sieht es mit der Kreditfähigkeit der VIFG aus? - Die Prüfung ist noch nicht abgeschlossen, ist die Antwort.

Zweitens. Wie sieht es mit den Direktzuweisungen der Lkw-Mauteinnahmen an die VIFG im Haushalt 2010 aus? - Sie sind nicht vorgesehen.

Drittens. Wie sieht es mit dem Finanzierungskreislauf aus? - Er verfehlt bei sinkenden Mauteinnahmen und zusätzlichen Steuermitteln, die auch weiter benötigt werden, seine Wirkung.

Viertens. Gibt es Prioritäten bei der Umsetzung von Verkehrsprojekten? - Es werden keine Prioritäten gesetzt.

Fünftens. Ist eine Ausweitung der ÖPP vorgesehen? - Fehlanzeige, keine Initiative. Die Bundesregierung, so heißt es, erarbeitet derzeit keine diesbezügliche Gesetzesinitiative.

Sechstens. Wie sieht es mit der zweiten Staffel der ÖPP-Projekte aus? - Man tritt auf der Stelle. Ausschreibungen sind noch nicht erfolgt.

Siebtens. Was ist mit der Abstufung bei den Bundesfernstraßen, die in dem Beschluss von Bundestag und Bundesrat vorgesehen ist? - Sie ist zurzeit nicht vorgesehen. Die Gespräche sind noch nicht abgeschlossen, heißt es.

Achtens. Gibt es eine Kappung der Gewinnabführungsverträge zwischen DB Holding und DB Netz? Das ist nicht unsere Position, aber Ihre. Bundesminister Ramsauer verkündet per Interview mit der Nachrichtenagentur Reuters, diese Pläne seien vom Tisch. In der offiziellen Antwort der Bundesregierung heißt es: Ergebnisse liegen noch nicht vor.

Neuntens. Was ist mit der LuFV Straße? - Diese ist derzeit nicht geplant.

Meine sehr geehrten Damen und Herren, was planen Sie denn? Es herrscht Schweigen. Es kommt nichts. Wir haben zurzeit kein Konzept der schwarz-gelben Regierung zur Finanzierung der Infrastruktur, zur Steigerung der Finanzierungsmöglichkeiten in diesem Land vorliegen, und das ist ein Problem, weil uns das zurückwirft. Sie haben unseren Antrag im Ausschuss mit Ihrer schwarz-gelben Mehrheit abgelehnt. Das kann ich noch nachvollziehen. Dass aber die eigene Bundesregierung dem Auftrag der schwarz-gelben Mehrheit - und den Antrag haben Sie selber beschlossen - nicht nachkommt, ihn gar ignoriert, ist erstaunlich und ein bemerkenswerter Vorgang.

Herr Minister, Sie sind ein Getriebener der Not und, wie ich manchmal den Eindruck habe, ein wenig zu mutlos. Ich hoffe, dass das nicht auch in Ideenlosigkeit mündet. Ich habe den Wunsch und die Bitte, dass Sie alles tun, damit hier in Deutschland ein gesamtgesellschaftlicher Konsens gefunden werden kann.

Vizepräsidentin Katrin Göring-Eckardt:

Herr Kollege!

Uwe Beckmeyer (SPD):

Ja, ich komme zum Schluss, sehr geehrte Frau Präsidentin.

Man erzählt sich, dass Sie ein Klavierspieler sind und das Klavierspiel beherrschen. Wenn man Ihre Politik anschaut und sie mit dem Musizieren vergleicht, sage ich nur: Mit den kleinen Musikstücken - französisch: Bagatellen - sind Sie nun wirklich am Ende. Ich glaube, Sie müssen jetzt langsam zum Konzert kommen; -

Vizepräsidentin Katrin Göring-Eckardt:

Herr Kollege!

Uwe Beckmeyer (SPD):

- denn das ist gerade in der Verkehrspolitik absolut notwendig.

Herzlichen Dank.",data/txt/17096.txt,speech,
1959976,96,17,0,,,,1291,Beifall bei der SPD,data/txt/17096.txt,poi,
1959977,96,17,0,,,,1292,"Vizepräsidentin Katrin Göring-Eckardt:

Der Kollege Patrick Schnieder hat jetzt das Wort für die CDU/CSU-Fraktion.",data/txt/17096.txt,speech,
1959978,96,17,0,,,,1293,Beifall bei der CDU/CSU sowie bei Abgeordneten der FDP,data/txt/17096.txt,poi,
1959979,96,17,0,,,,1294,"Patrick Schnieder (CDU/CSU):

Frau Präsidentin! Meine sehr geehrten Damen und Herren! Liebe Kolleginnen und Kollegen! Wir befinden uns, verehrter Herr Kollege Beckmeyer - so dachte ich jedenfalls nach Lektüre des Antrags und zu Beginn Ihrer Rede -, auf der gleichen Linie, nämlich dass die Verkehrsinfrastruktur in Deutschland eine herausragende Bedeutung hat, dass sie, wie Sie beschrieben haben, die Lebensader für Gesellschaft und Wirtschaft ist, Voraussetzung für Wohlstand und Chancen in unserem Land, und dass wir kräftig investieren müssen. Allerdings muss ich feststellen, dass Sie diesem Anspruch, den Sie mit dem, was Sie hier vorgetragen haben, formulieren, in keinster Weise gerecht werden.",data/txt/17096.txt,speech,
1959980,96,17,0,,,,1295,Beifall bei der CDU/CSU und der FDP,data/txt/17096.txt,poi,
1959981,96,17,0,,,,1296,"Dem wird auch der Antrag, den Sie vorgelegt haben, in keinster Weise gerecht. Es werden Wahrheiten formuliert, die wir alle kennen, Wahrheiten, die wir benannt haben, die wir auch freimütig einräumen, nämlich dass wir gern noch mehr Geld hätten, um es in die Verkehrsinfrastruktur zu stecken. Aber Sie suggerieren, wir würden die Investitionen zurückfahren. Auf der ersten Seite Ihres Antrags heißt es:

Das Investitionsvolumen ist ausgehend von rund 12 Milliarden Euro im Jahr 2009 auf 9,75 Milliarden Euro im Jahr 2011 gesunken.

Damit wollen Sie uns weismachen, dass wir die Leistungen zurückfahren. Das Gegenteil ist der Fall. Unsere Investitionen sind so hoch wie in den vergangenen Jahren nicht mehr, und das perspektivisch bis 2014. Ich darf daran erinnern, dass in den Jahren 2001 bis 2008 die Investitionslinien deutlich darunter lagen, und da waren sozialdemokratische Verkehrsminister für den Etat verantwortlich.",data/txt/17096.txt,speech,
1959982,96,17,0,,,,1297,Beifall bei der CDU/CSU und der FDP,data/txt/17096.txt,poi,
1959983,96,17,0,,,,1298,"Sie blenden bei dieser Diskussion vollkommen aus, wie es um unsere finanzielle Situation bestellt ist. Sie ignorieren die Schuldenbremse. Ich erinnere mich noch gut an die Haushaltsdebatte, die wir hier geführt haben. Wir haben als Koalition dafür gekämpft - und sind auch erfolgreich gewesen; der Minister hat hervorragend verhandelt -, dass wir das Investitionsvolumen auf diesem Stand beibehalten können. Wir haben dennoch Mut gezeigt - hier werden wir unserer Verantwortung gerecht - und nehmen die notwendigen Einsparungen im Etat vor, um die Voraussetzungen der Schuldenbremse einzuhalten. Dafür haben wir in anderen Bereichen Prügel kassiert. Man kann aber nicht so tun, als hätten wir im Verkehrsbereich nichts geplant und nur Einsparungen vorgenommen.",data/txt/17096.txt,speech,
1959984,96,17,0,Uwe Beckmeyer [SPD],Uwe Beckmeyer [SPD],uwe-beckmeyer-spd,1299,Messen Sie sich doch mal an Ihren eigenen Ansprüchen!,data/txt/17096.txt,poi,spd
