id,sitzung,wahlperiode,in_writing,speaker,speaker_cleaned,speaker_fp,sequence,text,filename,type,speaker_party
2489977,95,17,0,"Dr. Ralf Brauksiepe, Parl. Staatssekretär bei der Bundesministerin für Arbeit und Soziales",Dr. Ralf Brauksiepe,ralf-brauksiepe,362,"Vielen Dank, Frau Präsidentin. - Frau Kollegin Crone, grundsätzlich gilt, dass zuverlässige statistische Aussagen zur Lage von Personen mit Migrationshintergrund im deutschen Arbeitsmarkt noch nicht getroffen werden können, da das Merkmal Migrationshintergrund in der Statistik der Bundesagentur für Arbeit derzeit noch nicht erfasst wird. Deshalb beziehen sich alle folgenden Aussagen auf Ausländer.

Seit dem Jahr 2006, in dem der erste Integrationsgipfel der Bundeskanzlerin stattfand, hat sich die Arbeitsmarktlage von Ausländern insgesamt positiv entwickelt. So sank die Zahl der arbeitslosen Ausländer zwischen 2006 und 2010 von circa 645 000 auf rund 502 000. Die Arbeitslosenquote der Ausländer bezogen auf abhängige zivile Erwerbspersonen sank in diesem Zeitraum von 23,7 Prozent auf 18,2 Prozent. Gleichzeitig stieg die Zahl der sozialversicherungspflichtig beschäftigten Ausländer um rund 200 000 von rund 1,78 Millionen auf etwa 1,93 Millionen an.

Die Anzahl der ausländischen erwerbsfähigen Hilfebedürftigen sank zwischen Juni 2006 und Juni 2010 ebenfalls spürbar, von 1,01 Millionen auf 984 000. Die Zahl der jährlichen Abgänge von Ausländern aus Arbeitslosigkeit in Erwerbstätigkeit stieg von rund 354 000 im Jahr 2007 auf circa 379 000 im Jahr 2010. Im gleichen Zeitraum erhöhte sich die Zahl der jährlichen Abgänge von Ausländern in Ausbildung und in sonstige Maßnahmen von 182 000 auf rund 329 000.

Die positive Entwicklung der Arbeitsmarktsituation von ausländischen Erwerbspersonen in Deutschland ist erfreulich und zeigt deutlich, dass auch die Ausländerinnen und Ausländer von der stabilen wirtschaftlichen Erholung und dem kräftigen Aufschwung am deutschen Arbeitsmarkt profitieren. Dennoch liegt die Arbeitslosenquote von Ausländern noch immer signifikant höher als die der Deutschen. Sie betrug im Januar 2011 15,9 Prozent gegenüber 7,3 Prozent.

Auch im Bereich der Ausbildungsbeteiligung von Jugendlichen mit Migrationshintergrund gibt es weiterhin Handlungsbedarf. Im Jahr 2009 lag die Ausbildungsbeteiligungsquote junger Ausländer mit 31,4 Prozent deutlich unter der der deutschen jungen Menschen mit 64,3 Prozent. Die Bundesregierung wird deshalb trotz teilweise positiver Trends in ihren vielfältigen Anstrengungen für eine verbesserte Ausbildungs- und Arbeitsmarktintegration von Migrantinnen und Migranten nicht nachlassen.",data/txt/17095.txt,speech,
2489978,95,17,0,Vizepräsidentin Katrin Göring-Eckardt,Katrin Göring-Eckardt,katrin-goring-eckardt,363,Gibt es eine Nachfrage?,data/txt/17095.txt,chair,
2489979,95,17,0,Petra Crone (SPD),Petra Crone,petra-crone,364,"Ja. - Herr Staatssekretär, welche Bedeutung misst die Bundesregierung angesichts der Situation von Personen mit Migrationshintergrund Diversity-Management-Modellen in Betrieben zu?",data/txt/17095.txt,speech,spd
2489980,95,17,0,"Dr. Ralf Brauksiepe, Parl. Staatssekretär bei der Bundesministerin für Arbeit und Soziales",Dr. Ralf Brauksiepe,ralf-brauksiepe,365,"Frau Kollegin, es kann, glaube ich, nicht darum gehen, bestimmte Maßnahmen oder Programme in ein Ranking einzuordnen. Die weitere Bekämpfung der Arbeitslosigkeit hat trotz der unbestreitbar erzielten großen Erfolge auf dem Arbeitsmarkt für die Bundesregierung nach wie vor oberste Priorität. Das gilt für arbeitslose Menschen mit und ohne Migrationshintergrund gleichermaßen. Uns stehen in diesem Bereich verschiedene Maßnahmen zur Verfügung.",data/txt/17095.txt,speech,
2489981,95,17,0,Vizepräsidentin Katrin Göring-Eckardt,Katrin Göring-Eckardt,katrin-goring-eckardt,366,Eine weitere Nachfrage? - Bitte schön.,data/txt/17095.txt,chair,
2489982,95,17,0,Dr. Carsten Sieling (SPD),Dr. Carsten Sieling,carsten-sieling,367,"Vielen Dank. - Herr Staatssekretär, Sie haben in Ihrer Antwort die unterschiedliche Ausbildungsbeteiligung angesprochen. Ich würde Sie gerne fragen, welche Gründe die Bundesregierung dafür sieht, dass die Beteiligung und die Chancen von Personen mit Migrationshintergrund so viel geringer sind. Vor allem bitte ich Sie, etwas konkreter als in Ihrer vorigen Antwort deutlich zu machen, welche Maßnahmen Sie ergreifen, um hier gegenzusteuern.",data/txt/17095.txt,speech,spd
2489983,95,17,0,"Dr. Ralf Brauksiepe, Parl. Staatssekretär bei der Bundesministerin für Arbeit und Soziales",Dr. Ralf Brauksiepe,ralf-brauksiepe,368,"Herr Kollege, dieses Problem wird vermutlich nicht monokausal zu erklären sein. Für die Bundesregierung steht im Vordergrund, Maßnahmen zu ergreifen, um Menschen in Ausbildung und Arbeit zu bringen. Ich will in diesem Zusammenhang darauf hinweisen, dass es im Hinblick auf die Beschäftigung von Menschen, bei dem Versuch, Menschen in Ausbildung und Arbeit zu bringen, nicht darum gehen darf, in Schubladen zu denken nach dem Motto: hier die Menschen mit Migrationshintergrund, dort die Menschen ohne Migrationshintergrund. Vielmehr richten sich die umfangreichen Anstrengungen, die die Bundesregierung, die Bundesagentur für Arbeit und die anderen Akteure wie Wirtschaft und Gewerkschaften unternehmen, um Menschen in Ausbildung zu bringen, an alle ausbildungswilligen und ausbildungsfähigen Menschen. Ich denke, dies muss im Mittelpunkt stehen. Wir haben ein umfangreiches Instrumentarium. Es geht darum, die individuell ganz unterschiedlichen Hemmnisse zu beseitigen, unabhängig davon, welches Hemmnis in diesem oder jenem Einzelfall besteht.",data/txt/17095.txt,speech,
2489984,95,17,0,Vizepräsidentin Petra Pau,Petra Pau,petra-pau,369,"Danke, Herr Staatssekretär.",data/txt/17095.txt,chair,
2489985,95,17,0,Dr. Carsten Sieling [SPD],Dr. Carsten Sieling,carsten-sieling,370,Noch eine Nachfrage?,data/txt/17095.txt,poi,spd
2489986,95,17,0,Vizepräsidentin Petra Pau,Petra Pau,petra-pau,371,"- So wie ich es sehe, ist Ihr Fragerecht aufgebraucht.",data/txt/17095.txt,chair,
2489987,95,17,0,Dr. Carsten Sieling [SPD],Dr. Carsten Sieling,carsten-sieling,372,Schade!,data/txt/17095.txt,poi,spd
2489988,95,17,0,Vizepräsidentin Petra Pau,Petra Pau,petra-pau,373,"Jetzt rufe ich die Frage 18 des Kollegen Dr. Ilja Seifert auf:

Inwieweit teilt die Bundesregierung die Forderungen des Beauftragten der Bundesregierung für die Belange behinderter Menschen, Hubert Hüppe, nach einer schnellen Überprüfung der Regelsätze für erwerbsgeminderte behinderte Menschen über 25 Jahre und einer Zahlung des vollen Regelsatzes an diesen Personenkreis in Höhe von 364 Euro statt 291 Euro, da es nach seiner Auffassung weder nachvollziehbar noch gerecht ist, dass behinderte Menschen schlechtergestellt werden als über 25-jährige Hartz-IV-Bezieher, die noch bei den Eltern wohnen (siehe ""Behinderte bei Hartz IV gleichstellen"" im Tagesspiegel vom 7. März 2011)?",data/txt/17095.txt,chair,
2489989,95,17,0,"Dr. Ralf Brauksiepe, Parl. Staatssekretär bei der Bundesministerin für Arbeit und Soziales",Dr. Ralf Brauksiepe,ralf-brauksiepe,374,"Herr Kollege Seifert, ich beantworte Ihre Frage wie folgt: Nach der im Rahmen des Vermittlungsverfahrens abgegebenen Protokollerklärung ist zu prüfen, ob für behinderte Menschen, die keinen eigenen Haushalt führen, weil sie im Haushalt ihrer Eltern leben, anstelle der Regelbedarfsstufe 3 die Regelbedarfsstufe 1 gelten kann. Der zugrunde liegende Sachverhalt ist vielschichtig und bedarf einer eingehenden Prüfung. Insbesondere sind mögliche Folgewirkungen in die Prüfung einzubeziehen. Die Bundesregierung kann dem Ergebnis der erforderlichen Prüfung deshalb nicht vorgreifen.",data/txt/17095.txt,speech,
2489990,95,17,0,Vizepräsidentin Petra Pau,Petra Pau,petra-pau,375,Danke schön. - Ihre erste Nachfrage.,data/txt/17095.txt,chair,
2489991,95,17,0,Dr. Ilja Seifert (DIE LINKE),Dr. Ilja Seifert,ilja-seifert,376,"Herr Staatssekretär, ich kann Ihre Antwort nicht so recht verstehen. Sie haben die Regelbedarfsstufe 3 gerade erst eingeführt. Gleichzeitig sagen Sie, Sie wollten sie überprüfen mit der Zielstellung der Abschaffung. Sie hätten sie doch gar nicht erst einführen müssen; dann wäre die ganze Prüferei nicht notwendig. Insofern lautet meine Frage, wie Sie die Anregung Ihres eigenen Behindertenbeauftragten, dies möglichst schnell zu tun, aufgreifen. Oder hat er überhaupt nichts zu sagen?",data/txt/17095.txt,speech,linke
2489992,95,17,0,"Dr. Ralf Brauksiepe, Parl. Staatssekretär bei der Bundesministerin für Arbeit und Soziales",Dr. Ralf Brauksiepe,ralf-brauksiepe,377,"Herr Kollege Seifert, Ihre Frage beruht auf einer falschen Voraussetzung, nämlich darauf, dass wir die Regelbedarfsstufe 3 erst jetzt eingeführt hätten. Davon kann keine Rede sein.",data/txt/17095.txt,speech,
2489993,95,17,0,Dr. Ilja Seifert [DIE LINKE],Dr. Ilja Seifert,ilja-seifert,378,Für die Betroffenen!,data/txt/17095.txt,poi,linke
2489994,95,17,0,"Dr. Ralf Brauksiepe, Parl. Staatssekretär bei der Bundesministerin für Arbeit und Soziales",Dr. Ralf Brauksiepe,ralf-brauksiepe,379,"Es ist seit langem so - dies wurde vom Bundesverfassungsgericht ausdrücklich als berechtigt und angemessen anerkannt -, dass bei erwachsenen Leistungsberechtigten eine Unterscheidung getroffen wird, je nachdem, ob allein ein eigener Haushalt geführt wird, ob gemeinsam mit einem Partner ein eigener Haushalt geführt wird oder ob kein eigener Haushalt geführt wird. Diese Unterscheidung ist nicht neu und hat mit den von Bundestag und Bundesrat jüngst beschlossenen Maßnahmen nichts zu tun.",data/txt/17095.txt,speech,
2489995,95,17,0,Dr. Ilja Seifert [DIE LINKE],Dr. Ilja Seifert,ilja-seifert,380,Nein!,data/txt/17095.txt,poi,linke
2489996,95,17,0,"Dr. Ralf Brauksiepe, Parl. Staatssekretär bei der Bundesministerin für Arbeit und Soziales",Dr. Ralf Brauksiepe,ralf-brauksiepe,381,"Danach richten sich die Regelbedarfsstufen schon seit Jahren. Erwachsene Leistungsberechtigte, die alleine einen Haushalt führen, bekommen 100 Prozent des Regelsatzes, solche, die gemeinsam mit einem Partner einen Haushalt führen, 90 Prozent, und solche, die keinen eigenen Haushalt führen, erhalten 80 Prozent des Regelsatzes.

Die Rechtslage ist seit Jahren so, dass Personen über 25 Jahren im Rechtskreis des SGB II 100 Prozent des Regelsatzes gewährt werden; im Rechtskreis des SGB XII ist dies nicht der Fall. Es hat Gerichtsentscheidungen gegeben, die notwendigerweise Einzelfallentscheidungen waren, in denen Menschen ein Regelsatz von 100 Prozent zugesprochen worden ist, weil das Gericht moniert hat, dass die Gründe, weswegen der Gesetzgeber im SGB II anders verfährt als im SGB XII, nicht hinreichend deutlich geworden sind.

Im Rahmen des jetzt abgeschlossenen Gesetzgebungsverfahrens hat der Gesetzgeber diese Gründe deutlich gemacht, indem er insbesondere darauf hingewiesen hat, dass von Menschen im Rechtskreis des SBG II, die erwerbsfähig sind, im Rahmen des Förderns und Forderns auch Anstrengungen zur Aufnahme einer Erwerbstätigkeit erwartet werden, die mit Kosten verbunden sein können. Vor diesem Hintergrund muss ich noch einmal die in Ihrer Frage angelegte Behauptung zurückweisen, dass eine solche Regelbedarfsstufe neu eingeführt worden sei. Es hat sie schon vorher gegeben.",data/txt/17095.txt,speech,
2489997,95,17,0,Vizepräsidentin Petra Pau,Petra Pau,petra-pau,382,Ihre zweite Nachfrage.,data/txt/17095.txt,chair,
2489998,95,17,0,Dr. Ilja Seifert (DIE LINKE),Dr. Ilja Seifert,ilja-seifert,383,"Ich habe das hier verkürzt dargestellt; das gebe ich gerne zu. Allerdings haben Sie die Menschen mit Behinderung, die nicht erwerbsfähig sind, neu in die Regelbedarfsstufe 3 hineingenommen. Das wird wohl nicht zu bestreiten sein; denn vorher sind bei diesen Personen die 20 Prozent nicht abgezogen worden.

Ich will auf Folgendes hinweisen: Hier im Plenum gab es, als ich diese Frage bereits während des Gesetzgebungsverfahrens stellte - und das wurde beispielsweise von Kollegin Ulla Schmidt von der SPD unterstützt -, relativ großes Verständnis dafür, dass man es so eigentlich nicht machen sollte. Darüber ist in dem Moment natürlich nicht abgestimmt worden; aber das war ziemlich deutlich. Dann haben Sie diese merkwürdige Protokollnotiz gemacht, in der im Grunde steht: Wir sehen, dass diesbezüglich ein Problem besteht, und werden das überprüfen und lösen mit dem Ziel - das steht in der Protokollnotiz sinngemäß -, wieder auf 100 Prozent zu kommen.

Unter diesen Umständen frage ich Sie, wie Sie oder Ihre Beamten - wer auch immer sich das ausgedacht hat - dazu kommen, dass Menschen, die nicht erwerbstätig sein können und zum Beispiel im Haushalt ihrer Eltern wohnen und schon 25 Jahre alt sind, weniger Geld brauchen als andere. Diese Menschen brauchen eher mehr Geld; denn sie müssen Assistenz und sonstige Hilfe bezahlen. Das ist die Frage, die dahintersteckt. Ihr Behindertenbeauftragter - darauf bezog sich meine ursprüngliche Frage - steht auf dem gleichen Standpunkt. Auch er fragt sich, warum Sie diese Menschen schlechterstellen als andere, die die gleichen Bedürfnisse haben.",data/txt/17095.txt,speech,linke
2489999,95,17,0,"Dr. Ralf Brauksiepe, Parl. Staatssekretär bei der Bundesministerin für Arbeit und Soziales",Dr. Ralf Brauksiepe,ralf-brauksiepe,384,"Herr Kollege Seifert, ich korrigiere Sie zwar nur ungern, muss aber gleichwohl noch einmal darauf hinweisen, dass das Lebensalter von 25 Jahren schon vor den jüngsten Beschlüssen des Vermittlungsausschusses von Bundestag und Bundesrat eine relevante Größe im SGB II gewesen ist - aber auch nur im SGB II, nicht im SGB XII. Die Grundsicherung im Alter und bei Erwerbsminderung, auf die Menschen mit Behinderung vom vollendeten 18. Lebensjahr an dem Grunde nach Anspruch haben, kennt die Altersgrenze von 25 Jahren nicht. Das will ich noch einmal betonen. Deswegen ist Ihre Darstellung, sofern sie diesen Sachverhalt ausschließt, unzutreffend.

Ich möchte Sie im Zusammenhang mit dieser Frage darauf hinweisen, dass die Bundesregierung den Arbeitsauftrag aus dem Vermittlungsausschuss, wie er sich in der Protokollerklärung dokumentiert, selbstverständlich mitnimmt, dass sie aber nicht in der Lage ist, sozusagen aus der Lamäng heraus den Gleichheitsgrundsatz zu ignorieren. Denn dieser bedeutet nicht nur, dass Gleiches gleich behandelt werden muss, sondern auch, dass Ungleiches ungleich behandelt werden muss. Deswegen sind in diesem Zusammenhang viele Aspekte zu beachten, Herr Kollege Seifert.

Es gibt, wie Sie selbst sehr wohl wissen, im Rechtskreis des SGB XII nicht nur Menschen, die behindert sind, sondern darüber hinaus auch solche, die aufgrund anderer Umstände nicht erwerbsfähig sind. Wenn eine Regelung ausschließlich für Menschen über 25 Jahre eingeführt werden soll, stellt sich unter dem Aspekt der Gleichbehandlung die Frage, warum diese Regelung nur für über 25-Jährige, nicht aber auch für über 18-Jährige gelten soll. Im SGB XII gibt es diese Unterscheidung zwischen über 18-Jährigen und über 25-Jährigen bisher nicht; im SGB II gibt es sie.

Es stellt sich also die Frage, ob der Rechtskreis SGB II oder der Rechtskreis SGB XII maßgebend ist. Es stellt sich die Frage, ob das auch schon für Menschen über 18 oder erst für Menschen über 25 Jahre gelten soll. Bezüglich derjenigen im Rechtskreis SGB XII stellt sich die Frage, ob sie aufgrund einer Behinderung oder aus anderen Gründen nicht erwerbsfähig sind. In all diesen Fällen muss man prüfen, ob gleiche Sachverhalte vorliegen, die gleich zu behandeln sind, oder ob es sich um ungleiche Sachverhalte handelt, die ungleich zu behandeln sind. Von daher ist die Frage, wie man hier zu einer gerechten Lösung kommt, nicht einfach mit dem Hinweis darauf zu beantworten, dass wir speziell für Menschen mit Behinderungen ab einem Alter von 25 Jahren die Regelbedarfsstufe 3 durch die Regelbedarfsstufe 1 ersetzen. Das ist eine denkbare Lösung am Ende eines Prüfprozesses, der andauert und dessen Lösung ich hier nicht vorgreifen kann.",data/txt/17095.txt,speech,
2490000,95,17,0,Vizepräsidentin Petra Pau,Petra Pau,petra-pau,385,"Danke, Herr Staatssekretär. - Die Fragen 20 und 21 des Kollegen Michael Groß, die Fragen 22 und 23 der Kollegin Ute Kumpf sowie die Fragen 24 und 25 der Kollegin Aydan Özoðuz sollen schriftlich beantwortet werden.

Wir kommen damit zur Frage 26 des Kollegen Rüdiger Veit:

Aus welchem Grund hat die Bundesregierung der Tatsache nicht systematisch entgegengewirkt, dass in den Grundsicherungsstellen nur vereinzelt Strategien und Konzepte zum Umgang mit migrationsspezifischen Problemen existieren, obwohl rund 30 Prozent der erwerbsfähigen Hilfebedürftigen einen Migrationshintergrund aufweisen, und wie werden Optionskommunen eingebunden, wenn es darum geht, Strategien und Konzepte zum Umgang mit migrationsspezifischen Problemen zu entwerfen und in die Praxis umzusetzen?

Bitte, Herr Staatssekretär.",data/txt/17095.txt,chair,
2490001,95,17,0,"Dr. Ralf Brauksiepe, Parl. Staatssekretär bei der Bundesministerin für Arbeit und Soziales",Dr. Ralf Brauksiepe,ralf-brauksiepe,386,"Vielen Dank. - Frau Präsidentin, sehr geehrter Herr Kollege Veit, mit Ihrem Einverständnis möchte ich die Fragen 26 und 27, die in einem engen Zusammenhang stehen, gerne gemeinsam beantworten.",data/txt/17095.txt,speech,
2490002,95,17,0,Vizepräsidentin Petra Pau,Petra Pau,petra-pau,387,"Dann rufe ich zusätzlich die Frage 27 des Kollegen Veit auf:

In wie vielen Jobcentern bzw. Optionskommunen existieren derzeit Integrationsbeauftragte, und welche Tätigkeiten verrichten diese?",data/txt/17095.txt,chair,
2490003,95,17,0,"Dr. Ralf Brauksiepe, Parl. Staatssekretär bei der Bundesministerin für Arbeit und Soziales",Dr. Ralf Brauksiepe,ralf-brauksiepe,388,"Herr Kollege, ich antworte Ihnen auf Ihre Fragen wie folgt: In der Grundsicherung für Arbeitsuchende gilt der Grundsatz der dezentralen Aufgabenwahrnehmung und Verantwortung. Dies betrifft grundsätzlich auch den Umgang mit spezifischen Problemlagen, wie sie bei der Arbeitsmarktintegration von erwerbsfähigen hilfebedürftigen Menschen mit einem Migrationshintergrund auftreten können. Strategien und Konzepte zum Umgang mit migrationsspezifischen Problemen werden grundsätzlich lokal entwickelt und praktisch umgesetzt. Dies gilt sowohl für gemeinsame Einrichtungen als auch für Optionskommunen. Die Bundesregierung unterstützt die lokalen Handlungsansätze entsprechend den Festlegungen im nationalen Integrationsplan.

Auch über die Frage, ob und inwieweit die Arbeit vor Ort dadurch unterstützt werden soll, dass besondere Beauftragte benannt werden, wird von den vor Ort Verantwortlichen entschieden. Sie befinden auch darüber, mit welchen konkreten Aufgaben die Beauftragten betraut werden. Die Bundesregierung führt insoweit keine Übersichten.",data/txt/17095.txt,speech,
2490004,95,17,0,Vizepräsidentin Petra Pau,Petra Pau,petra-pau,389,Sie haben jetzt insgesamt vier Nachfragemöglichkeiten. Bitte schön.,data/txt/17095.txt,chair,
2490005,95,17,0,Rüdiger Veit (SPD),Rüdiger Veit,rudiger-veit,390,"Zwei werden möglicherweise reichen.

Herr Staatssekretär, können Sie mir sagen, wie jenseits dieser dezentralen, lokalen Aufgabenwahrnehmung aus der Sicht der Bundesregierung die spezifische Beratung gerade von Menschen mit Migrationshintergrund in den Jobcentern und bei den Argen unterstützt wird?",data/txt/17095.txt,speech,spd
2490006,95,17,0,"Dr. Ralf Brauksiepe, Parl. Staatssekretär bei der Bundesministerin für Arbeit und Soziales",Dr. Ralf Brauksiepe,ralf-brauksiepe,391,"Herr Kollege Veit, ich habe bei der Beantwortung einer anderen Frage schon darauf hingewiesen, dass die Bundesregierung nicht versucht, Schubladen für bestimmte Personengruppen zu bilden, sondern dass wir mit dem umfangreichen arbeitsmarktpolitischen Instrumentarium, das wir haben, versuchen, jedem einzelnen Arbeitslosen in seiner spezifischen Problemlage gerecht zu werden.

Der Migrationshintergrund mag in dem einen Fall mehr und in dem anderen Fall weniger problematisch sein. Er kann auch in unterschiedlichem Maße mit Sprachproblemen einhergehen. Ich habe auch schon darauf hingewiesen, dass wir eine Vielzahl von Maßnahmen haben, die nicht speziell auf Menschen mit Migrationshintergrund ausgerichtet sind, ihnen aber in besonderer Weise zugutekommen. Denken Sie nur an den Rechtsanspruch auf das Nachholen eines Hauptschulabschlusses, den wir in der letzten Legislaturperiode gemeinsam eingeführt haben und der sehr hilfreich ist, um auf dem Arbeitsmarkt Fuß zu fassen. Wenn Sie sehen, wie groß der Anteil von Menschen mit Migrationshintergrund an Hauptschülern ist, dann erkennen Sie, dass von dieser Maßnahme, die nicht speziell auf Menschen mit Migrationshintergrund ausgerichtet ist, diese Personengruppe in der Praxis überproportional profitiert. So ist das auch in anderen Bereichen.

Wir haben vorgeschaltete Maßnahmen, beispielsweise Sprachkurse, die vom Bundesamt für Migration und Flüchtlinge administriert werden, um bei Menschen mit Migrationshintergrund häufig auftretende Sprachbarrieren zu beseitigen. Wenn mit der Beseitigung dieser Sprachbarrieren die Integration in den Arbeitsmarkt noch nicht gelingt, können die für alle Arbeitslosen zugänglichen Instrumente der Arbeitsmarktpolitik genutzt werden. Auf diese Weise versuchen wir, mit dem umfangreichen Instrumentarium, das wir haben, jeweils passgerechte Lösungen zu finden.",data/txt/17095.txt,speech,
2490007,95,17,0,Vizepräsidentin Petra Pau,Petra Pau,petra-pau,392,Ihre zweite Nachfrage.,data/txt/17095.txt,chair,
2490008,95,17,0,Rüdiger Veit (SPD),Rüdiger Veit,rudiger-veit,393,"Haben Sie Erkenntnisse darüber, inwieweit die Möglichkeit, durch die erwähnten Kurse beim BAMF Sprach-erwerb nachzuholen, von den Betroffenen ausgeschlagen bzw. nicht genutzt wird?",data/txt/17095.txt,speech,spd
2490009,95,17,0,"Dr. Ralf Brauksiepe, Parl. Staatssekretär bei der Bundesministerin für Arbeit und Soziales",Dr. Ralf Brauksiepe,ralf-brauksiepe,394,"Mir ist bekannt, dass diese Instrumente von zahlreichen Personen genutzt werden. Eine prozentuale Aufstellung, inwieweit solche Angebote ausgeschlagen werden, um Ihre Formulierung aufzugreifen, ist mir nicht bekannt.",data/txt/17095.txt,speech,
2490010,95,17,0,Vizepräsidentin Petra Pau,Petra Pau,petra-pau,395,Sie haben die Möglichkeit zu einer weiteren Nachfrage.,data/txt/17095.txt,chair,
2490011,95,17,0,Rüdiger Veit (SPD),Rüdiger Veit,rudiger-veit,396,Danke sehr.,data/txt/17095.txt,speech,spd
2490012,95,17,0,Vizepräsidentin Petra Pau,Petra Pau,petra-pau,397,"Dann danke ich dem Staatssekretär.

Die Frage 28 des Kollegen Oliver Kaczmarek, die Frage 29 der Kollegin Bärbel Bas, die Fragen 30 und 31 des Kollegen Michael Gerdes, die Frage 32 der Kollegin Doris Barnett sowie die Fragen 33 und 34 der Kollegin Sabine Zimmermann sollen schriftlich beantwortet werden.

Ich rufe den Geschäftsbereich des Bundesministeriums für Ernährung, Landwirtschaft und Verbraucherschutz auf. Die Fragen 35 und 36 der Kollegin Kerstin Tack, die Fragen 37 und 38 der Kollegin Dr. Kirsten Tackmann sowie die Fragen 39 und 40 der Kollegin Rita Schwarzelühr-Sutter sollen ebenfalls schriftlich beantwortet werden.

Ich rufe nun den Geschäftsbereich des Bundesministeriums der Verteidigung auf. Zur Beantwortung der Fragen steht der Parlamentarische Staatssekretär Christian Schmidt zur Verfügung.",data/txt/17095.txt,chair,
2490013,95,17,0,Wir kommen zu Frage 41 der Kollegin Inge Höger,Wir kommen zu Frage 41 der Kollegin Inge Höger,wir-kommen-zu-frage-41-der-kollegin-inge-hoger,398,"Welche Erkenntnisse hat die Bundesregierung über die Verstrickung der Bundeswehr in Vorfälle im afghanischen Distrikt Chahar Darreh am Mittwoch, dem 9. März 2011, die nach Medienangaben zum Tod einer Frau sowie der Verletzung einer zweiten führten?

Bitte, Herr Staatssekretär.",data/txt/17095.txt,speech,
