id,sitzung,wahlperiode,in_writing,speaker,speaker_cleaned,speaker_fp,sequence,text,filename,type,speaker_party
2494270,98,17,0,Präsident Dr. Norbert Lammert,Dr. Norbert Lammert,norbert-lammert,0,"Die Sitzung ist eröffnet. Nehmen Sie bitte Platz.

Liebe Kolleginnen und Kollegen! Ich begrüße Sie herzlich zu unserer 98. Plenarsitzung.

Interfraktionell ist vereinbart worden, die heutige Tagesordnung um die Wahl eines Vizepräsidenten sowie um die Beratung des Antrags der Bundesregierung zur Beteiligung deutscher Streitkräfte am AWACS-Einsatz in Afghanistan zu erweitern. Nach der Regierungsbefragung und der Fragestunde ist später am Nachmittag eine von der Fraktion Die Linke beantragte Aktuelle Stunde zu den Anforderungen für Sicherheitsüberprüfungen bei deutschen Atomkraftwerken vorgesehen. Sind Sie mit den vorgesehenen Ergänzungen und Änderungen einverstanden? - Das ist offensichtlich der Fall. Dann ist das so beschlossen.

Ich rufe den Zusatzpunkt 1 auf:

Wahl eines Stellvertreters des Präsidenten

- Drucksache 17/5168 -

Die Kollegin Gerda Hasselfeldt hat ihr Amt als Vizepräsidentin niedergelegt. Sie weiß, dass ich das bedauere; aber das hat sie offenkundig nicht hinreichend beeindruckt. Ich nutze die Gelegenheit gerne, ihr nicht nur im Namen der übrigen Mitglieder des Präsidiums, sondern sicher auch in Ihrer aller Namen herzlichen Dank für ihre langjährige Amtsführung als Mitglied des Präsidiums auszusprechen.",data/txt/17098.txt,chair,
2494271,98,17,0,,,,1,Beifall,data/txt/17098.txt,poi,
2494272,98,17,0,Präsident Dr. Norbert Lammert,Dr. Norbert Lammert,norbert-lammert,2,"Liebe Frau Hasselfeldt, ich bin nicht völlig sicher, ob es im neuen Amt so schön wird, wie es im alten war.",data/txt/17098.txt,chair,
2494273,98,17,0,,,,3,Heiterkeit,data/txt/17098.txt,poi,
2494274,98,17,0,Renate Künast [BÜNDNIS 90/ DIE GRÜNEN],Renate Künast,renate-kunast,4,Kann gar nicht sein!,data/txt/17098.txt,poi,gruene
2494275,98,17,0,Gegenruf des Abg. Volker Kauder [CDU/CSU],Volker Kauder,volker-kauder,5,Wir sind ja nicht bei den Grünen! Bei uns ist es noch schön!,data/txt/17098.txt,poi,cducsu
2494276,98,17,0,Präsident Dr. Norbert Lammert,Dr. Norbert Lammert,norbert-lammert,6,Umso herzlicher sind meine guten Wünsche für die übernommene neue Aufgabe.,data/txt/17098.txt,chair,
2494277,98,17,0,,,,7,Beifall,data/txt/17098.txt,poi,
2494278,98,17,0,Präsident Dr. Norbert Lammert,Dr. Norbert Lammert,norbert-lammert,8,"Als Nachfolger schlägt die Fraktion der CDU/CSU den Abgeordneten Eduard Oswald als Stellvertreter des Präsidenten vor. Werden weitere Vorschläge gemacht? - Das ist offenbar nicht der Fall.

Dann darf ich jetzt einige Hinweise zum Ablauf der Wahl geben. Gewählt ist, wer die Stimmen der Mehrheit der Mitglieder des Bundestages erhält. Für die Wahl benötigen Sie Ihren blauen Wahlausweis, den Sie, soweit noch nicht geschehen, den Stimmkartenfächern in der Lobby entnehmen können. Die blaue Stimmkarte sowie der Wahlumschlag werden von den Schriftführerinnen und Schriftführern an den Ausgabetischen vor den Wahlkabinen ausgegeben. Sie dürfen Ihre Stimmkarte nur in der Wahlkabine ankreuzen und müssen die Stimmkarte ebenfalls noch in der Wahlkabine in den Umschlag legen. Gültig sind nur Stimmkarten mit einem Kreuz bei ""ja"" oder ""nein"" oder ""enthalte mich"". Stimmkarten, die kein Kreuz oder mehr als ein Kreuz, andere Namen oder Zusätze enthalten, sind ungültig.

Bevor Sie die Stimmkarte in die Wahlurne werfen, müssen Sie dem Schriftführer an der Wahlurne Ihren blauen Wahlausweis übergeben. Die Abgabe des Wahlausweises dient zugleich als Nachweis für die Beteiligung an der Wahl. Kontrollieren Sie daher bitte, ob der Wahlausweis Ihren Namen trägt. Die drei Wahlurnen sind neben den Sitzreihen der Bundesregierung und des Bundesrates sowie vor dem Rednerpult aufgestellt; das haben wir oft genug geübt. Um einen reibungslosen Ablauf der Wahl zu gewährleisten, bitte ich Sie, von Ihren Plätzen aus über die seitlichen Zugänge und möglichst nicht durch den Mittelgang zu den Ausgabetischen zu gehen.

Ich darf nun darum bitten, dass die Schriftführerinnen und Schriftführer die vorgesehenen Plätze einnehmen. - Sind die Schriftführerinnen und Schriftführer an den vorgesehenen Plätzen? - Das ist offensichtlich der Fall. Ich eröffne den Wahlgang.

Liebe Kolleginnen und Kollegen, ist ein Mitglied des Hauses anwesend, das seine Stimmkarte noch nicht abgegeben hat? - Das ist nicht der Fall. Ich schließe den Wahlgang und bitte die Schriftführerinnen und Schriftführer, mit der Auszählung zu beginnen.

Bis zum Vorliegen des Ergebnisses werden wir die Sitzung für einige Minuten unterbrechen.",data/txt/17098.txt,chair,
2494279,98,17,0,,,,9,Unterbrechung von 13.27 bis 13.46 Uhr,data/txt/17098.txt,poi,
2494280,98,17,0,Präsident Dr. Norbert Lammert,Dr. Norbert Lammert,norbert-lammert,10,,data/txt/17098.txt,chair,
2494281,98,17,0,Präsident Dr. Norbert Lammert,Dr. Norbert Lammert,norbert-lammert,11,"Die unterbrochene Sitzung ist wieder eröffnet. Nehmen Sie bitte Platz.

Ich komme zurück zum Zusatzpunkt 1 und gebe Ihnen das von den Schriftführerinnen und Schriftführern ermittelte Ergebnis der Wahl eines Vizepräsidenten bekannt: abgegebene Stimmen 570. Alle abgegebenen Stimmen waren gültig. Mit Ja haben gestimmt 504 Mitglieder des Deutschen Bundestages.1",data/txt/17098.txt,chair,
2494282,98,17,0,,,,12,Beifall im ganzen Hause,data/txt/17098.txt,poi,
2494283,98,17,0,Präsident Dr. Norbert Lammert,Dr. Norbert Lammert,norbert-lammert,13,"Mit Nein haben 39 Mitglieder gestimmt. 27 Kolleginnen und Kollegen haben sich der Stimme enthalten. Damit ist der Kollege Eduard Oswald mit der erforderlichen Mehrheit zum Vizepräsidenten des Deutschen Bundestages gewählt.

Ich darf Sie fragen, Herr Kollege Oswald: Nehmen Sie die Wahl an?",data/txt/17098.txt,chair,
2494284,98,17,0,Eduard Oswald (CDU/CSU),Eduard Oswald,eduard-oswald,14,Herr Präsident! Liebe Kolleginnen und Kollegen! Ich nehme die Wahl an und bedanke mich sehr herzlich für das Vertrauen.,data/txt/17098.txt,speech,cducsu
2494285,98,17,0,,,,15,Beifall im ganzen Hause,data/txt/17098.txt,poi,
2494286,98,17,0,,,,16,Abg. Volker Kauder [CDU/CSU] und Gerda Hasselfeldt [CDU/CSU] überreichen dem Vizepräsidenten Eduard Oswald Blumensträuße,data/txt/17098.txt,poi,
2494287,98,17,0,,,,17,Abgeordnete aller Fraktionen beglückwünschen den Vizepräsidenten Eduard Oswald,data/txt/17098.txt,poi,
2494288,98,17,0,Eduard Oswald (CDU/CSU),Eduard Oswald,eduard-oswald,18,,data/txt/17098.txt,speech,cducsu
2494289,98,17,0,Präsident Dr. Norbert Lammert,Dr. Norbert Lammert,norbert-lammert,19,"Lieber Kollege Oswald, bevor Sie jetzt eine beachtlich große Zahl von einzelnen Glückwünschen entgegennehmen, wäre ich Ihnen dankbar, wenn Sie die durch mich stellvertretend für alle Mitglieder des Hauses zum Ausdruck gebrachten guten Wünsche für das neue Amt entgegennähmen. Wir freuen uns auf gute Zusammenarbeit. Ich wünsche Ihnen für dieses ebenso schöne wie anspruchsvolle Amt Erfolg und Gottes Segen. Herzlichen Glückwunsch!",data/txt/17098.txt,chair,
2494290,98,17,0,,,,20,Beifall im ganzen Hause,data/txt/17098.txt,poi,
2494291,98,17,0,Präsident Dr. Norbert Lammert,Dr. Norbert Lammert,norbert-lammert,21,"Meine Damen und Herren, im Interesse einer Beherrschung der Abwicklung der weiteren Tagesordnungspunkte bin ich allen Kolleginnen und Kollegen dankbar, die sich entschlossen haben, ihre persönlichen Glückwünsche irgendwann im weiteren Verlauf des Tages dem Kollegen Oswald zu überbringen.",data/txt/17098.txt,chair,
2494292,98,17,0,,,,22,Beifall bei Abgeordneten der CDU/CSU und der SPD,data/txt/17098.txt,poi,
2494293,98,17,0,Präsident Dr. Norbert Lammert,Dr. Norbert Lammert,norbert-lammert,23,"Man kann das notfalls auch schriftlich erledigen. Deswegen möchte ich hiermit diesen Teil der Gratulationscour gerne für beendet erklären und unseren nächsten Tagesordnungspunkt aufrufen.

Wir kommen zum Zusatzpunkt 2:

Beratung des Antrags der Bundesregierung

Beteiligung deutscher Streitkräfte am Einsatz von NATO-AWACS im Rahmen der Internationalen Sicherheitsunterstützungstruppe in Afghanistan (International Security Assistance Force, ISAF) unter Führung der NATO auf Grundlage der Resolution 1386 (2001) und folgender Resolutionen, zuletzt Resolution 1943 (2010) vom 13. Oktober 2010 des Sicherheitsrates der Vereinten Nationen

- Drucksache 17/5190 -

Überweisungsvorschlag:

Auswärtiger Ausschuss (f)

Innenausschuss

Rechtsausschuss

Verteidigungsausschuss

Ausschuss für Menschenrechte und Humanitäre Hilfe

Ausschuss für wirtschaftliche Zusammenarbeit

und Entwicklung

Haushaltsausschuss gemäß § 96 GO

Nach einer interfraktionellen Vereinbarung ist für die Aussprache eine Dreiviertelstunde vorgesehen. - Wir können ganz offenkundig so verfahren.

Ich eröffne die Aussprache. Das Wort erhält zunächst der Bundesminister des Auswärtigen, Dr. Guido Westerwelle.",data/txt/17098.txt,chair,
2494294,98,17,0,,,,24,Beifall bei der FDP sowie bei Abgeordneten der CDU/CSU,data/txt/17098.txt,poi,
2494295,98,17,0,Präsident Dr. Norbert Lammert,Dr. Norbert Lammert,norbert-lammert,25,,data/txt/17098.txt,chair,
2494296,98,17,0,"Dr. Guido Westerwelle, Bundesminister des Auswärtigen",Dr. Guido Westerwelle,guido-westerwelle,26,"Herr Präsident! Meine sehr geehrten Damen und Herren! Kolleginnen und Kollegen! Am 17. März hat der Sicherheitsrat der Vereinten Nationen die Resolution 1973 beschlossen. Sie ist nach der Entscheidung in New York geltendes, verbindliches Völkerrecht. Wir unterstützen die Ziele dieser Resolution, aber bei den Mitteln ist die Bundesregierung zu einer anderen Bewertung gekommen als die Mehrheit des Sicherheitsrats. In einer schwierigen Abwägung der Risiken, auch der Eskalationsrisiken, sind wir zu dem Ergebnis gekommen, dass wir uns nicht mit der Bundeswehr an diesem Einsatz beteiligen werden. Die Bundeswehr wird nicht nach Libyen geschickt. Das heißt nicht, dass wir neutral wären. Wir teilen das Ziel des Schutzes der Zivilbevölkerung und natürlich auch das Ziel, dass dem Diktator Einhalt geboten werden muss.",data/txt/17098.txt,speech,
2494297,98,17,0,,,,27,Beifall bei der FDP und der CDU/CSU,data/txt/17098.txt,poi,
2494298,98,17,0,"Dr. Guido Westerwelle, Bundesminister des Auswärtigen",Dr. Guido Westerwelle,guido-westerwelle,28,"Wir respektieren die Entscheidung der internationalen Staatengemeinschaft, und ich wiederhole: Sie ist geltendes Recht. Wir wollen dementsprechend auch ihren Erfolg. Deswegen hat die Bundesregierung beschlossen, unsere Verbündeten zu entlasten, ohne dass wir uns selbst mit der Bundeswehr in Libyen militärisch engagieren.",data/txt/17098.txt,speech,
2494299,98,17,0,Renate Künast [BÜNDNIS 90/DIE GRÜNEN],Renate Künast,renate-kunast,29,Können Sie mir das mal erklären?,data/txt/17098.txt,poi,gruene
2494300,98,17,0,"Dr. Guido Westerwelle, Bundesminister des Auswärtigen",Dr. Guido Westerwelle,guido-westerwelle,30,"Die internationale Gemeinschaft ist in Afghanistan seit dem Strategiewechsel des vergangenen Jahres auf dem richtigen Weg. Wir haben auf den Afghanistan-Konferenzen in London und in Kabul und dann auf der Tagung in Lissabon einen Strategiewechsel beschlossen. Wir setzen auf eine politische Lösung.

Bei all den schrecklichen Rückschlägen, die wir sehen, dürfen aber auch Fortschritte nicht übersehen werden. Gestern hat Staatspräsident Hamid Karzai drei Provinzen und vier Städte genannt, die für den Beginn des Übergabeprozesses reif sind. Darunter ist Masar-i-Scharif im deutschen Verantwortungsbereich im Norden. Das zeigt den Erfolg des Strategiewechsels in Afghanistan, für den die Bundesregierung von Anfang an geworben hat. Die Abzugsperspektive ist sichtbar geworden. Wir sind und bleiben der Überzeugung: Der Einsatz in Afghanistan ist richtig, aber es ist auch richtig, dass der Prozess der Übergabe der Verantwortung gestern begonnen hat.",data/txt/17098.txt,speech,
2494301,98,17,0,,,,31,Beifall bei der FDP sowie bei Abgeordneten der CDU/CSU und des Abg. Dr. h. c. Gernot Erler [SPD],data/txt/17098.txt,poi,
2494302,98,17,0,"Dr. Guido Westerwelle, Bundesminister des Auswärtigen",Dr. Guido Westerwelle,guido-westerwelle,32,"Dass die Afghanen mehr und mehr in der Lage sind, für die eigene Sicherheit zu sorgen, ist auch ein Erfolg der neuen Schwerpunkte, die auf Aussöhnung, Eingliederung und Wiederaufbau gesetzt sind. Es ist ein Erfolg der Ausbilder unserer Polizei aus Bund und Ländern, es ist ein Erfolg der Bundeswehrausbilder. Man kann sagen: Die Ausbildung durch die internationale Gemeinschaft und uns Deutsche wirkt. Der zivile Aufbau kommt voran. Die Menschen sehen mehr und mehr eine echte Zukunftsperspektive für sich und ihre Familien.

Ich unterstreiche erneut: Die Rückschläge werden nicht übersehen. Die Opfer, die wir oft genug zu beklagen haben, werden nicht vergessen werden. Darüber besteht überhaupt kein Zweifel. Deswegen werde ich auch diese Debatte nutzen, an dieser Stelle all den Frauen und Männern, die in Afghanistan für unsere Freiheit und unsere Sicherheit eintreten, ob in Uniform oder nicht, ein Dankeschön im Namen der Bundesregierung und, dessen bin ich sicher, auch im Namen des Deutschen Bundestages zu sagen.",data/txt/17098.txt,speech,
2494303,98,17,0,,,,33,Beifall bei der FDP und der CDU/CSU sowie bei Abgeordneten der SPD und des BÜNDNISSES 90/DIE GRÜNEN,data/txt/17098.txt,poi,
2494304,98,17,0,"Dr. Guido Westerwelle, Bundesminister des Auswärtigen",Dr. Guido Westerwelle,guido-westerwelle,34,"Meine Damen und Herren, deshalb bleibt es auch bei unserem Ziel, dass wir bis zum Jahr 2014 die endgültige Übergabe der Verantwortung schaffen wollen. Aber wir halten hier fest: Wir müssen auch danach noch unsere Verantwortung für Frieden und Entwicklung in Afghanistan kennen und uns weiter engagieren.

Zehn Jahre nachdem der Afghanistan-Einsatz begonnen wurde, ist durch die gestrige Übergabe der ersten Verantwortung ein wichtiger Fortschritt gemacht worden. Ich sage aber ausdrücklich: Wir wollen eine Übergabe der Verantwortung in Verantwortung. Ein kopfloser Abzug ist nicht das Richtige. Deswegen werden wir dies auch nicht dem Deutschen Bundestag vorschlagen.

Der AWACS-Einsatz ist aus unserer Sicht militärisch notwendig. Er ist übrigens auch schon auf Antrag der vorherigen Bundesregierung seinerzeit vom Deutschen Bundestag beschlossen worden. Er lief dann aus, weil objektive Rechtskriterien - Überflugrechte und Weiteres mehr - nicht erfüllt waren. Deshalb hat die Bundesregierung entschieden, dass gewissermaßen ein leeres Mandat nicht erneut beantragt wird, sondern erst dann ein Mandat beantragt wird, wenn die Lage tatsächlich den Erfordernissen entspricht.

Der AWACS-Einsatz ist militärisch notwendig, weil er die Operation der NATO unterstützt und die Sicherheit der Soldatinnen und Soldaten sowie der afghanischen Bevölkerung erhöht. AWACS liefern zuverlässige Lagebilder und unterstützen auch die medizinische Luftrettung. Der AWACS-Einsatz ist zivil notwendig, weil er die Sicherheit der zivilen Luftfahrt schützt. Afghanistan liegt auf der Flugroute von Südostasien nach Europa. AWACS verbessern die Flugsicherheit auch für Linien- und Frachtflüge. Der AWACS-Einsatz ist außerdem Ausdruck unserer Bündnissolidarität und unserer Solidarität mit dem afghanischen Volk. Dass wir selbstverständlich unverändert daran arbeiten, dass die Afghanen mittelfristig selbst den eigenen Luftraum auch technisch kontrollieren können, das unterstreiche ich hier noch einmal nachdrücklich.

Meine Damen und Herren, als die Verlängerung des Bundestagsmandats Anfang des Jahres anstand, hatte die Bundesregierung auf die Beantragung des Einsatzes von AWACS verzichtet, weil wir den Schwerpunkt unserer Kräfte in Abstimmung mit General David Petraeus auf die Ausbildung gelegt haben. Zugleich versicherten die militärischen Experten der NATO, der AWACS-Einsatz sei auch ohne deutsche Soldaten möglich. Im Dezember hat die Bundesregierung gesagt: Solange die NATO ohne uns die AWACS betreiben kann, brauchen wir kein Mandat. - Jetzt sage ich: Die Lage in Libyen hat auch die Lage insgesamt verändert.

Ich weise darauf hin, dass wir die Obergrenze für die Zahl der Soldatinnen und Soldaten unverändert lassen. An der Obergrenze, die der Deutsche Bundestag beschlossen hat, wird nichts verändert. Es bleibt bei den bereits vom Deutschen Bundestag beschlossenen 5 350 Soldatinnen und Soldaten als Obergrenze. Die deutschen AWACS-Besatzungen werden auf die Obergrenze angerechnet. Die Bundesregierung wird auf die flexible Reserve nur im Rahmen dieser Obergrenze zurückgreifen.

Die Bundesregierung bleibt zuversichtlich, im Zuge der Übergabe der Sicherheitsverantwortung die Präsenz der Bundeswehr ab 2011 reduzieren zu können. Dabei sind wir auf einem guten Weg. Wir bitten Sie, diesen Weg der Übergabe der Verantwortung in diesem Haus gemeinsam mit der Bundesregierung zu gehen.

Ich danke für Ihre Aufmerksamkeit.",data/txt/17098.txt,speech,
2494305,98,17,0,,,,35,Beifall bei der FDP und der CDU/CSU,data/txt/17098.txt,poi,
2494306,98,17,0,"Dr. Guido Westerwelle, Bundesminister des Auswärtigen",Dr. Guido Westerwelle,guido-westerwelle,36,,data/txt/17098.txt,speech,
2494307,98,17,0,Präsident Dr. Norbert Lammert,Dr. Norbert Lammert,norbert-lammert,37,Das Wort erhält nun der Kollege Dr. Gernot Erler für die SPD-Fraktion.,data/txt/17098.txt,chair,
2494308,98,17,0,,,,38,Beifall bei der SPD,data/txt/17098.txt,poi,
2494309,98,17,0,Präsident Dr. Norbert Lammert,Dr. Norbert Lammert,norbert-lammert,39,,data/txt/17098.txt,chair,
2494310,98,17,0,Dr. h. c. Gernot Erler (SPD),Dr. h. c. Gernot Erler,gernot-erler,40,"Herr Präsident! Liebe Kolleginnen und Kollegen! Dies ist in erster Linie eine Afghanistan-Debatte. Leider hatten wir in den vergangenen Jahren viele solcher Debatten, dabei aber selten Gelegenheit, über gute Nachrichten zu sprechen. Heute ist das jedoch der Fall.

Die SPD-Fraktion begrüßt ausdrücklich die gestrige Erklärung von Präsident Karzai mit der Benennung von sieben Provinzen und Städten, in denen ab Juli dieses Jahres die Transition starten soll, also die Verantwortungsübergabe an die afghanische Polizei und die afghanischen Streitkräfte. Genannt werden die Provinz Kabul mit Ausnahme des Bezirks Surobi, die Provinzen Pandschschir und Bamiyan sowie die Provinzhauptstädte Masar-i-Scharif, Mehtar Lam, Lashkar Gah und ein Großteil von Herat.

In Masar-i-Scharif befinden sich das zentrale Feldlager der deutschen Einsatzkräfte und das Nordkommando. Damit wird der Start der Transition auch im deutschen Einsatzgebiet stattfinden. Das begrüßen wir ebenfalls ausdrücklich.

Der gestern verkündeten Entscheidung ist eine sorgfältige Prüfung vorausgegangen. Die Ermutigung liegt bereits darin, dass ein verabredetes Verfahren tatsächlich im Zeitplan umgesetzt und nicht immer wieder aufgeschoben wird, wie wir das in der Vergangenheit schon häufiger erlebt haben. Es passt gut dazu, dass wir in letzter Zeit öfter auch Informationen über Fortschritte bei der Ausbildung sowohl von Polizei wie auch von Streitkräften bekommen haben. Beides, die Verantwortungsübergabe und der Fortschritt bei der Ausbildung, gehört engstens zusammen. Erst der Aufwuchs der afghanischen Sicherheitskräfte ermöglicht den Inteqal-Prozess, wie die Transition auf Paschtunisch genannt wird.

Natürlich wissen wir, dass der Härtetest in den drei Provinzen und den vier Städten noch bevorsteht. Wir wissen auch, dass es noch ein langer Weg sein wird, bis alle Städte und alle Provinzen in die afghanische Sicherheitsverantwortung übergehen werden. Aber nach vielen Rückschlägen signalisiert die Ankündigung von gestern doch, dass es jetzt mit der Umsetzung der neuen Afghanistan-Strategie konkret wird und damit auch die Chancen wachsen, dass bis Ende des Jahres erste Kontingente der Bundeswehr zurückgezogen werden können, ohne dass dies zu einer Gefährdung im Lande führt. Das ist gut. Ich freue mich, dass Sie das auch so sehen, Herr Außenminister. Für die SPD ist das ein wirklich wichtiger Punkt. So steht es im Mandat vom Januar dieses Jahres. Das erwartet auch die Öffentlichkeit.

Heute, liebe Kolleginnen und Kollegen, haben wir hier über die Beteiligung deutscher Streitkräfte am Einsatz von NATO-AWACS im Rahmen von ISAF zu beraten. Dieses Thema wurde nachträglich in die Tagesordnung dieser Woche hineingequetscht. Wir sind gezwungen, über diesen Einsatz in Sondersitzungen der Ausschüsse quasi im Schweinsgalopp bis zum Freitag dieser Woche abschließend zu beraten. Ich finde, das ist eine Zumutung,",data/txt/17098.txt,speech,spd
2494311,98,17,0,,,,41,Beifall bei der SPD und dem BÜNDNIS 90/ DIE GRÜNEN,data/txt/17098.txt,poi,
2494312,98,17,0,Dr. h. c. Gernot Erler (SPD),Dr. h. c. Gernot Erler,gernot-erler,42,zumal dies überhaupt nichts mit der Entwicklung in Afghanistan zu tun hat.,data/txt/17098.txt,speech,spd
2494313,98,17,0,Dr. Gesine Lötzsch [DIE LINKE],Dr. Gesine Lötzsch,gesine-lotzsch,43,Richtig! Das ist der Punkt!,data/txt/17098.txt,poi,linke
2494314,98,17,0,Dr. h. c. Gernot Erler (SPD),Dr. h. c. Gernot Erler,gernot-erler,44,"Es geht stattdessen um ein Problem in einer ganz anderen Weltgegend, das sich die Bundesregierung selber geschaffen hat - durch ihre Enthaltung bei dem UN-Beschluss zur Einrichtung einer Flugverbotszone und zum Schutz der Zivilbevölkerung in Libyen",data/txt/17098.txt,speech,spd
2494315,98,17,0,,,,45,Beifall bei Abgeordneten der SPD und des BÜNDNISSES 90/DIE GRÜNEN,data/txt/17098.txt,poi,
2494316,98,17,0,Dr. h. c. Gernot Erler (SPD),Dr. h. c. Gernot Erler,gernot-erler,46,"sowie durch die politische Isolierung innerhalb der Europäischen Union, die sie damit verursacht hat.",data/txt/17098.txt,speech,spd
2494317,98,17,0,,,,47,Beifall bei Abgeordneten der SPD und des BÜNDNISSES 90/DIE GRÜNEN,data/txt/17098.txt,poi,
2494318,98,17,0,Dr. h. c. Gernot Erler (SPD),Dr. h. c. Gernot Erler,gernot-erler,48,"Jetzt sucht sie händeringend nach Maßnahmen, die diese politische Isolierung abschwächen oder wenigstens irgendwie hinter den Vorhang schieben.

Ein einseitiger und schnöder Abzug der deutschen AWACS-Besatzungen im Rahmen der Operation Active Endeavour über dem Mittelmeer hätte allerdings tatsächlich das fatale Bild des deutschen Sonderweges noch verstärkt. Jetzt wird großzügig Tausch angeboten: Wir ziehen aus dem Mittelmeer ab, gehen sofort nach Afghanistan und ermöglichen damit US-Kräften, ihrerseits nun wieder nach Libyen zu gehen. - Aber jeder, der sich mit der Materie auskennt, weiß, dass das nicht nur ein Nullsummenspiel ist, sondern dass das obendrein eine politische Mogelpackung ist.",data/txt/17098.txt,speech,spd
2494319,98,17,0,,,,49,Beifall bei Abgeordneten der SPD,data/txt/17098.txt,poi,
2494320,98,17,0,Dr. h. c. Gernot Erler (SPD),Dr. h. c. Gernot Erler,gernot-erler,50,"Herr Außenminister, Sie haben eben selber erwähnt, dass wir schon im Juli 2009 über einen AWACS-Einsatz im Rahmen von ISAF eine Entscheidung getroffen haben, nämlich zugestimmt haben. Wegen des Streits mit Paris und wegen der Überflugrechte ist es aber zu keiner Umsetzung dieses Beschlusses gekommen. Nach einem Jahr verfiel sozusagen das Haltbarkeitsdatum dieses Mandats.

Als die Hindernisse endlich ausgeräumt waren und die NATO am 15. Januar dieses Jahres mit dem AWACS-Einsatz beginnen wollte, haben Sie sich nicht getraut - so muss man das ausdrücken -, das noch auf das ohnehin zu verlängernde Afghanistan-Mandat draufzusatteln, und haben den Verbündeten nahegelegt, doch nach drei Monaten noch einmal nachzufragen. Die sind notgedrungen darauf eingegangen und haben den Job für 90 Tage erst einmal selber gemacht. Am 15. April endet diese Frist. Dann hätten wir hier allerdings ohne jede Hast und ohne Sondersitzungen sowieso über die deutsche Beteiligung bei den AWACS-Besatzungen zu diskutieren und zu entscheiden gehabt.",data/txt/17098.txt,speech,spd
2494321,98,17,0,Renate Künast [BÜNDNIS 90/DIE GRÜNEN],Renate Künast,renate-kunast,51,Aber das ist nach dem 27. März!,data/txt/17098.txt,poi,gruene
2494322,98,17,0,Dr. h. c. Gernot Erler (SPD),Dr. h. c. Gernot Erler,gernot-erler,52,"Die Mogelpackung besteht darin, dass Sie den frustrierten Alliierten jetzt, im März, eine in Geschenkpapier verpackte Leistung als Ausgleich anbieten, für die Sie für April dieses Jahres sowieso schon eine Zusage in Aussicht gestellt haben. Das ist Ihre Art, Bündnissolidarität zu organisieren.",data/txt/17098.txt,speech,spd
2494323,98,17,0,,,,53,Beifall bei der SPD und dem BÜNDNIS 90/ DIE GRÜNEN,data/txt/17098.txt,poi,
2494324,98,17,0,Dr. h. c. Gernot Erler (SPD),Dr. h. c. Gernot Erler,gernot-erler,54,"Ich weiß nicht, wie Sie zu der Hoffnung kommen, dass niemand diesen billigen Trick durchschaut. Es wäre jedenfalls ein weiterer Fehler, anzunehmen, dass der höfliche Dank der frustrierten Alliierten so zu deuten ist, dass sie nicht kapiert haben, wie das Spiel hier läuft.

Wir haben hier im Deutschen Bundestag einen anderen Schaden. Sie belasten die deutsche Afghanistan-Politik, die doch schwierig genug ist und bei der es die vernünftige Tradition gibt, nach möglichst viel Gemeinsamkeit und Konsens zu suchen, fahrlässig mit dem schweren Gepäck aus Ihrer scheiternden UN- und Libyen-Politik.",data/txt/17098.txt,speech,spd
2494325,98,17,0,,,,55,Beifall bei Abgeordneten der SPD und des BÜNDNISSES 90/DIE GRÜNEN,data/txt/17098.txt,poi,
