id,sitzung,wahlperiode,in_writing,speaker,speaker_cleaned,speaker_fp,sequence,text,filename,type,speaker_party
2489615,95,17,0,Präsident Dr. Norbert Lammert,Dr. Norbert Lammert,norbert-lammert,0,"Die Sitzung ist eröffnet.

Liebe Kolleginnen und Kollegen, ich darf Sie bitten, sich von Ihren Plätzen zu erheben.",data/txt/17095.txt,chair,
2489616,95,17,0,,,,1,Die Anwesenden erheben sich,data/txt/17095.txt,poi,
2489617,95,17,0,Präsident Dr. Norbert Lammert,Dr. Norbert Lammert,norbert-lammert,2,"Meine Damen und Herren! Liebe Kolleginnen und Kollegen! Wir alle stehen unter dem Eindruck der schrecklichen Ereignisse in Japan, nach denen es kein einfaches Eintreten in die Tagesordnung geben kann. Die Nachrichten über die Lage im Katastrophengebiet halten die Welt in Atem, auch die Menschen in unserem Land. Die geradezu apokalyptischen Bilder aus der betroffenen Region hätte sich fast niemand von uns auch nur vorstellen können, und wir wissen nicht einmal, ob das Schlimmste nun überstanden ist. Mit Bestürzung und Anteilnahme verfolgen wir alle die Folgen der gewaltigen Naturkatastrophe, die Japan und den gesamten pazifischen Raum ereilt hat. Das Ausmaß der immer deutlicher werdenden Verheerungen erschüttert uns alle. Die Auswirkungen auf die Menschen, auf die Umwelt, aber auch auf die Weltwirtschaft sind noch unabsehbar.

Im Namen des Deutschen Bundestages habe ich bereits am vergangenen Freitag meinem japanischen Amtskollegen unser tiefes Mitgefühl übermittelt. Auch wenn uns derzeit vor allem die atomare Bedrohungslage umtreibt, gedenken wir in diesem Augenblick insbesondere der Opfer, die das heftige Erdbeben und die reißenden Fluten des Tsunami gekostet haben, der Tausenden Toten und ihrer Hinterbliebenen, der unzähligen Verletzten und der Hunderttausenden, die ihr Hab und Gut - nicht wenige vielleicht auch in schierer Verzweiflung den Lebensmut - verloren haben und die nicht wissen, wie es jetzt weitergehen soll. Ihrer wollen wir morgen auch in der täglichen ökumenischen Besinnung im Andachtsraum des Bundestages in besonderer Weise gedenken.

Auf der Ehrentribüne hat der japanische Botschafter in Deutschland, Herr Dr. Takahiro Shinyo, Platz genommen, den ich herzlich begrüße. Sehr geehrter Herr Botschafter, unsere Gedanken sind beim japanischen Volk, das sich in diesen Tagen mit bewundernswerter Ruhe und beispielloser Disziplin den Auswirkungen der Katastrophe entgegenstemmt. Wir denken in dieser Stunde auch an unsere japanischen Mitbürgerinnen und Mitbürger in Deutschland, die fern der Heimat vielfach noch im Ungewissen über das Schicksal ihrer Verwandten und Freunde im Katastrophengebiet sind. Sie alle können mit unserer Solidarität und unserer Unterstützung bei der Bewältigung der Katastrophe rechnen, bei den Sofortmaßnahmen wie beim längerfristigen Wiederaufbau, schon gar in einem Jahr, in dem wir gemeinsam an 150 Jahre diplomatische Beziehungen zwischen unseren beiden Ländern erinnern. Ich weiß, dass viele Menschen in Deutschland helfen wollen, und bin mir sicher, dass der Spendenaufruf des Bundespräsidenten auf offene Ohren stößt.

Liebe Kolleginnen und Kollegen, wir haben in Japan einmal mehr die unbändige Kraft von Naturgewalten erlebt. Sie haben eine unfassbare Spur der Verwüstung hinterlassen. Wir erfahren aber auch die Risiken unserer Zivilisation, einer hochindustrialisierten und -technisierten Welt. Die Angst vor der atomaren Katastrophe hinterlässt Spuren in der internationalen Staatengemeinschaft, auch in Deutschland.

Zivilisationsrisiken sind in anderer Weise als Naturereignisse kalkulierbar. Wir müssen aber immer wieder neu fragen, ob und unter welchen Bedingungen wir sie eingehen wollen. Die Sorgen vieler Menschen um ihre Sicherheit nehmen wir sehr ernst. Dies erfordert, scheinbare Gewissheiten neu zu hinterfragen. Alle Aspekte, die sich aus der Nutzung unterschiedlicher Energieressourcen ergeben, müssen erneut geprüft und neu bewertet werden.

Ich wünsche mir und bin überzeugt, dass wir im Deutschen Bundestag die Kraft aufbringen, mit dem nötigen Ernst und der angemessenen Sachlichkeit über die sich neu stellenden Fragen der Energie- wie der Umweltpolitik zu sprechen. Dazu wird morgen früh Gelegenheit sein.

Sie haben sich im Andenken und zur Würdigung der Opfer von Ihren Plätzen erhoben. Ich danke Ihnen.

Ich rufe den Tagesordnungspunkt 1 auf:

Eidesleistung des Bundesministers des Innern

Der Herr Bundespräsident hat mir mit Schreiben vom 3. März 2011 mitgeteilt, dass er am selben Tage gemäß Art. 64 Abs. 1 des Grundgesetzes für die Bundesrepublik Deutschland auf Vorschlag der Frau Bundeskanzlerin den Bundesminister der Verteidigung, Herrn Karl-Theodor Freiherr zu Guttenberg, und den Bundesminister des Innern, Herrn Dr. Thomas de Maizière, aus ihren Ämtern als Bundesminister entlassen und Herrn Dr. Thomas de Maizière zum Bundesminister der Verteidigung und Herrn Dr. Hans-Peter Friedrich zum Bundesminister des Innern ernannt hat.

Nach Art. 64 Abs. 2 des Grundgesetzes leistet ein Bundesminister bei der Amtsübernahme den in Art. 56 vorgesehenen Eid.

Herr Dr. Friedrich, ich darf Sie zur Eidesleistung zu mir bitten.",data/txt/17095.txt,chair,
2489618,95,17,0,,,,3,Die Anwesenden erheben sich,data/txt/17095.txt,poi,
2489619,95,17,0,Präsident Dr. Norbert Lammert,Dr. Norbert Lammert,norbert-lammert,4,"Sehr geehrter Herr Bundesminister, ich möchte Sie bitten, den im Grundgesetz vorgesehenen Eid zu leisten.",data/txt/17095.txt,chair,
2489620,95,17,0,"Dr. Hans-Peter Friedrich, Bundesminister des Innern",Dr. Hans-Peter Friedrich,hans-peter-friedrich,5,"Ich schwöre, dass ich meine Kraft dem Wohle des deutschen Volkes widmen, seinen Nutzen mehren, Schaden von ihm wenden, das Grundgesetz und die Gesetze des Bundes wahren und verteidigen, meine Pflichten gewissenhaft erfüllen und Gerechtigkeit gegen jedermann üben werde. So wahr mir Gott helfe.",data/txt/17095.txt,speech,
2489621,95,17,0,Präsident Dr. Norbert Lammert,Dr. Norbert Lammert,norbert-lammert,6,"Herr Bundesminister, Sie haben den in der Verfassung vorgesehenen Eid geleistet. Ich darf Ihnen für die übernommene Aufgabe alles Gute, Erfolg und Gottes Segen wünschen.",data/txt/17095.txt,chair,
2489622,95,17,0,"Dr. Hans-Peter Friedrich, Bundesminister des Innern",Dr. Hans-Peter Friedrich,hans-peter-friedrich,7,"Vielen Dank, Herr Präsident.",data/txt/17095.txt,speech,
2489623,95,17,0,,,,8,Anhaltender Beifall bei der CDU/CSU und der FDP,data/txt/17095.txt,poi,
2489624,95,17,0,,,,9,"Beifall bei der SPD, der LINKEN und dem BÜNDNIS 90/DIE GRÜNEN",data/txt/17095.txt,poi,
2489625,95,17,0,,,,10,Abg. Volker Kauder [CDU/CSU] und Gerda Hasselfeldt [CDU/CSU] überreichen Bundesminister Dr. Hans-Peter Friedrich Blumensträuße,data/txt/17095.txt,poi,
2489626,95,17,0,,,,11,Abgeordnete aller Fraktionen beglückwünschen den Bundesminister Dr. Hans-Peter Friedrich,data/txt/17095.txt,poi,
2489627,95,17,0,"Dr. Hans-Peter Friedrich, Bundesminister des Innern",Dr. Hans-Peter Friedrich,hans-peter-friedrich,12,,data/txt/17095.txt,speech,
2489628,95,17,0,Präsident Dr. Norbert Lammert,Dr. Norbert Lammert,norbert-lammert,13,"Liebe Kolleginnen und Kollegen, ich möchte auch dem neuen Bundesminister der Verteidigung, Herrn Dr. Thomas de Maizière, im Namen des ganzen Hauses für seine Aufgabe alles Gute und viel Erfolg wünschen.",data/txt/17095.txt,chair,
2489629,95,17,0,,,,14,Beifall im ganzen Hause,data/txt/17095.txt,poi,
2489630,95,17,0,Präsident Dr. Norbert Lammert,Dr. Norbert Lammert,norbert-lammert,15,Zugleich danke ich dem ausgeschiedenen Bundesminister Karl-Theodor Freiherr zu Guttenberg für seine Tätigkeit in diesem Amt.,data/txt/17095.txt,chair,
2489631,95,17,0,,,,16,Beifall bei der CDU/CSU und der FDP,data/txt/17095.txt,poi,
2489632,95,17,0,Präsident Dr. Norbert Lammert,Dr. Norbert Lammert,norbert-lammert,17,"Ich rufe nun den Tagesordnungspunkt 2 auf:

Abgabe einer Regierungserklärung durch den Bundesminister des Auswärtigen

Umbruch in der Arabischen Welt

Hierzu liegt ein Entschließungsantrag der Fraktion Die Linke vor.

Nach einer interfraktionellen Vereinbarung sind für die Aussprache im Anschluss an die Regierungserklärung eineinviertel Stunden vorgesehen. - Ich höre keinen Widerspruch. Dann können wir so verfahren.

Das Wort zur Abgabe einer Regierungserklärung hat der Bundesminister des Auswärtigen, Herr Dr. Guido Westerwelle.",data/txt/17095.txt,chair,
2489633,95,17,0,,,,18,Beifall bei der FDP sowie bei Abgeordneten der CDU/CSU,data/txt/17095.txt,poi,
2489634,95,17,0,Präsident Dr. Norbert Lammert,Dr. Norbert Lammert,norbert-lammert,19,,data/txt/17095.txt,chair,
2489635,95,17,0,"Dr. Guido Westerwelle, Bundesminister des Auswärtigen",Dr. Guido Westerwelle,guido-westerwelle,20,"Herr Präsident! Meine sehr geehrten Damen und Herren! Nordafrika und die arabische Welt erleben eine historische Zäsur. Die Freiheitsbewegung, die als Jasmin-Revolution auf den Straßen Tunesiens begann, hat viele andere Staaten erreicht. Als Demokraten stehen wir an der Seite von Demokraten. Wir Deutschen haben das Glück, eine friedliche Revolution im eigenen Land erlebt zu haben, die zur Einheit unseres Landes und zur Vereinigung Europas geführt hat. Unser Land ist auf den Werten der Freiheit gebaut. Es sind diese freiheitlichen Werte, nach denen jetzt Millionen Menschen im nördlichen Afrika und in der arabischen Welt verlangen. Wir werden diese Völker dabei als Bundesrepublik Deutschland unterstützen.",data/txt/17095.txt,speech,
2489636,95,17,0,,,,21,Beifall bei der FDP und der CDU/CSU sowie bei Abgeordneten der SPD,data/txt/17095.txt,poi,
2489637,95,17,0,"Dr. Guido Westerwelle, Bundesminister des Auswärtigen",Dr. Guido Westerwelle,guido-westerwelle,22,"Die Sehnsucht nach Freiheit ist nicht begrenzt auf eine Kultur, auf eine Region oder gar auf eine Religion. Es ist ein Irrglaube, es gebe Kulturen, in denen der Mensch auf Dauer unfrei sein müsse. Es gibt keine Kultur der Unfreiheit. Unfreiheit ist Ausdruck von Unkultur. Eine weitere Erkenntnis können wir aus dieser Entwicklung gewinnen: Nicht eine autokratische Regierung macht ein Land stabil, sondern eine stabile Gesellschaft ist die Voraussetzung für die Stabilität eines Landes. Wir wollen stabile Demokratien und demokratische Stabilität.",data/txt/17095.txt,speech,
2489638,95,17,0,,,,23,Beifall bei der FDP und der CDU/CSU,data/txt/17095.txt,poi,
2489639,95,17,0,"Dr. Guido Westerwelle, Bundesminister des Auswärtigen",Dr. Guido Westerwelle,guido-westerwelle,24,"Meine Damen und Herren, liebe Kolleginnen und Kollegen, in Marokko hat König Mohammed VI. vor wenigen Tagen eine Verfassungsreform eingeleitet, die viele Forderungen aus der Gesellschaft aufgreift. Das macht Mut, aber es werden die Taten zählen. Das Beispiel Marokko zeigt, wie eine Regierung den Weg zur Öffnung und zur Demokratisierung der Gesellschaft einschlagen kann.

Mit großer Sorge blicken wir nach Jemen, wo ein von breiten Schichten der Gesellschaft getragener Protest immer gewaltsamer niedergeschlagen wird. Bereits vor einem Jahr, bei meinem Besuch im Jemen, habe ich Präsident Salih eindringlich darauf hingewiesen, wie notwendig der friedliche gesellschaftliche Ausgleich für die Stabilität des Jemen ist. Heute müssen wir feststellen: Die Zeit wurde nicht genutzt, und die Lage im Jemen hat sich dramatisch verschlechtert.

Mit Sorge verfolgen wir auch die alarmierenden Nachrichten aus Bahrain. Wir rufen alle Beteiligten im Land selbst zum Dialog auf, und wir rufen die Länder in der Region zur Zurückhaltung auf. Die Eskalation der Gewalt muss ein Ende haben und einem ernsthaften Dialog, einem nationalen Dialog zwischen Regierung und Opposition Platz machen. Eine Lösung muss im Land selbst gefunden werden.",data/txt/17095.txt,speech,
2489640,95,17,0,,,,25,Beifall bei der FDP sowie bei Abgeordneten der CDU/CSU,data/txt/17095.txt,poi,
2489641,95,17,0,"Dr. Guido Westerwelle, Bundesminister des Auswärtigen",Dr. Guido Westerwelle,guido-westerwelle,26,"Im Iran geht die Führung in diesen Tagen erneut mit äußerster Härte gegen die Opposition vor. Die iranische Regierung will mit diesem Vorgehen Stärke demonstrieren, sie offenbart aber nur Schwäche.",data/txt/17095.txt,speech,
2489642,95,17,0,,,,27,Beifall des Abg. Dr. h. c. Jürgen Koppelin [FDP],data/txt/17095.txt,poi,
2489643,95,17,0,"Dr. Guido Westerwelle, Bundesminister des Auswärtigen",Dr. Guido Westerwelle,guido-westerwelle,28,"Wir fordern die iranische Führung auf, die Unterdrückung der Opposition unverzüglich zu beenden und dem iranischen Volk die ihm zustehenden Freiheitsrechte zu gewähren.",data/txt/17095.txt,speech,
2489644,95,17,0,,,,29,"Beifall bei der FDP sowie bei Abgeordneten der CDU/CSU, der SPD, der LINKEN und des BÜNDNISSES 90/DIE GRÜNEN",data/txt/17095.txt,poi,
2489645,95,17,0,"Dr. Guido Westerwelle, Bundesminister des Auswärtigen",Dr. Guido Westerwelle,guido-westerwelle,30,"Die Sehnsucht nach Freiheit und Teilhabe, nach Würde und Gerechtigkeit wächst auch in vielen anderen Ländern des Mittleren Ostens von Tag zu Tag und bricht sich Bahn. Die Lage in der Region ist von Land zu Land verschieden. Deshalb brauchen wir maßgeschneiderte politische Antworten. Eines aber haben alle diese Aufbrüche gemeinsam: den unbedingten Willen zu Freiheit, zu Teilhabe und zu neuen Chancen.

Ich danke den Frauen und Männern der Bundeswehr, den Angehörigen des Auswärtigen Dienstes und den vielen Hilfsorganisationen für ihre Leistung bei der Evakuierung deutscher Staatsangehöriger aus Libyen und für ihren Beitrag, zahlreiche ägyptische Flüchtlinge wieder in ihre Heimat zu ihren Familien zu bringen. Wenn alles gut gegangen ist, denkt man, dass es einfach war. Aber ich weiß, dass es alles andere als einfach war. Deswegen möchte ich vor diesem Hohen Hause - ich hoffe, in Ihrer aller Namen - diesen Dank ausdrücklich aussprechen.",data/txt/17095.txt,speech,
2489646,95,17,0,,,,31,"Beifall bei der FDP, der CDU/CSU, der SPD und dem BÜNDNIS 90/DIE GRÜNEN sowie bei Abgeordneten der LINKEN",data/txt/17095.txt,poi,
2489647,95,17,0,"Dr. Guido Westerwelle, Bundesminister des Auswärtigen",Dr. Guido Westerwelle,guido-westerwelle,32,"In Libyen führt ein Diktator Krieg gegen das eigene Volk. Im Angesicht dieses Verbrechens ist sich die internationale Staatengemeinschaft einig: Der Diktator muss gehen. Mit seinen Taten stellt sich Oberst Gaddafi außerhalb der Völkergemeinschaft. Er hat jede Legitimation verwirkt. An dieser frühzeitig eingenommenen eindeutigen und entschiedenen Haltung der Bundesregierung ändern auch vergiftete Freundlichkeiten des Diktators nichts.

Wir haben mit unserer Forderung nach raschen Sanktionen breite Unterstützung im Sicherheitsrat der Vereinten Nationen und in der Europäischen Union erhalten. Die Auslandsvermögen der Herrscherfamilie wurden eingefroren. Reiseverbote sind in Kraft. Wir sind uns im Sicherheitsrat, in der Europäischen Union und auch unter den G-8-Staaten - das hat gestern das Treffen der Außenminister gezeigt - einig, dass der Diktator für diesen Feldzug gegen sein eigenes Volk zur Verantwortung gezogen werden muss. Das wird Aufgabe des Internationalen Strafgerichtshofs sein. Wir setzen uns in New York dafür ein, den politischen Druck weiter zu erhöhen, bis dieses Ziel erreicht ist. Wir werden im Sicherheitsrat der Vereinten Nationen heute und in den kommenden Tagen das weitere Vorgehen abstimmen. Die Bundesregierung wirbt in New York nachdrücklich für noch umfassendere Wirtschafts- und Finanzsanktionen. Wir wollen die Geldflüsse in das System Gaddafi, soweit irgend möglich, stoppen. Wir wollen dem Regime die Grundlage seines Handelns und seines Krieges gegen das eigene Volk entziehen.

Die Bilder und die Nachrichten von vorrückenden Truppen Gaddafis, von blutiger Gewalt und von gefallenen Städten in Ostlibyen bedrücken uns. Aber die vermeintlich einfache Lösung einer Flugverbotszone wirft mehr Fragen und Probleme auf, als sie zu lösen verspricht. Die Flugverbotszone - darüber kann auch das Wort nicht hinwegtäuschen - ist eine militärische Intervention, bei der nicht einmal klar ist, dass sie in einem Land wie Libyen wirkungsvoll sein kann. Ich darf darauf aufmerksam machen, dass Libyen ein Land ist, das etwa viermal so groß ist wie die Bundesrepublik Deutschland.

Am Ende darf nicht genau das Gegenteil dessen stehen, was wir politisch erreichen wollen. Am Ende darf unser Handeln nicht zu mehr Gewalt - statt zu mehr Freiheit und zu Frieden - führen. Ein solches Ergebnis würde die demokratischen Bewegungen in ganz Nordafrika schwächen und nicht stärken. Jeder Schritt muss auch vor dem Hintergrund bewertet werden, welche Folgen er für die Staaten in Nordafrika hätte, die sich seit der Jasmin-Revolution in Richtung Demokratie, in Richtung von mehr Freiheit auf den Weg gemacht haben.

Die Folgen eines Militäreinsatzes würden nicht nur Libyen betreffen, sondern in die gesamte nordafrikanische Region und in die gesamte arabische Welt ausstrahlen. Wir verstehen, dass alle Möglichkeiten geprüft werden. Das Durchsetzen einer Flugverbotszone aber ist eine militärische Intervention. Niemand soll sich der Illusion hingeben, es gehe lediglich um das Aufstellen eines Verkehrsschildes. Um ein Flugverbot durchzusetzen, müsste zunächst die libysche Flugabwehr militärisch ausgeschaltet werden. Die Bundesregierung betrachtet deshalb ein militärisches Eingreifen in Form einer Flugverbotszone mit großer Skepsis. Wir wollen und dürfen nicht Kriegspartei in einem Bürgerkrieg in Nordafrika werden. Wir wollen nicht auf eine schiefe Ebene geraten, an deren Ende dann deutsche Soldaten Teil eines Krieges in Libyen sind.",data/txt/17095.txt,speech,
2489648,95,17,0,,,,33,"Beifall bei der FDP, der CDU/CSU und der LINKEN",data/txt/17095.txt,poi,
2489649,95,17,0,Wolfgang Gehrcke [DIE LINKE],Wolfgang Gehrcke,wolfgang-gehrcke,34,Da hat er recht! Das muss Ihnen nicht peinlich sein!,data/txt/17095.txt,poi,linke
2489650,95,17,0,"Dr. Guido Westerwelle, Bundesminister des Auswärtigen",Dr. Guido Westerwelle,guido-westerwelle,35,"- Ich wünschte, meine Damen und Herren von der Linksfraktion, Sie wären auch bei anderen Fragen so entschieden, wenn es um Demokratie und Freiheit geht.",data/txt/17095.txt,speech,
2489651,95,17,0,,,,36,Beifall bei der FDP und der CDU/CSU,data/txt/17095.txt,poi,
2489652,95,17,0,"Dr. Guido Westerwelle, Bundesminister des Auswärtigen",Dr. Guido Westerwelle,guido-westerwelle,37,"Aber was geschieht, wenn die Angriffe am Boden weitergehen? Müssen wir Gaddafis Panzer dann aus der Luft bekämpfen? Und wenn das nicht reicht, müssen wir dann Bodentruppen schicken? Die Alternative ist nicht Tatenlosigkeit, sondern sind gezielte Sanktionen, die den Druck auf Gaddafi erhöhen. In den vergangenen Tagen haben wir zudem erste Kontakte mit dem Nationalen Übergangsrat geknüpft. Wir sehen in ihm einen wichtigen politischen Ansprechpartner.

Die Entscheidung über den richtigen Weg im Angesicht menschenverachtender Gewalt ist alles andere als einfach. Als Mitglied des Sicherheitsrates trägt Deutschland in dieser schwierigen Lage besondere Verantwortung für die internationale Sicherheit. Wir respektieren und begrüßen den Beschluss der Arabischen Liga vom vergangenen Wochenende. Aber wir sehen die Verantwortung für das weitere Handeln der internationalen Staatengemeinschaft zuerst bei den Staaten der Region. Dies wird auch unsere Haltung bei den Beratungen in New York bestimmen.

Herr Präsident, meine sehr geehrten Damen und Herren, eine stabile Demokratie entsteht nicht über Nacht. Ein solcher Prozess kann Jahre, manchmal Jahrzehnte dauern. Wir wollen die Länder Nordafrikas dabei unterstützen, eine feste, tragfähige Demokratie in einer starken Zivilgesellschaft zu verankern. Wir stehen in der arabischen Welt vor einem Neubeginn voller Chancen. Aber nicht nur die Völker der Region, sondern auch wir brauchen einen langen Atem. Dieser arabische Frühling ist eine historische Chance für Frieden und Wohlstand in der gesamten Region mit positiven Folgen weltweit. Deutschland und Europa stehen als Partner bereit, damit der demokratische Aufbruch in Nordafrika und anderen Teilen der arabischen Welt tatsächlich gelingen kann.

Der Umbruch in Tunesien und Ägypten ging von der Mitte der Gesellschaft aus, und er wurde von ihr getragen. Wir haben größten Respekt vor dem Mut all jener, die friedlich und ohne Waffen auf die Straße gegangen sind, um sich den Herrschenden in ihren Ländern entgegenzustellen. In den Straßen von Tunis können die jungen Frauen und Männer vielleicht zum ersten Mal in ihrem Leben völlig frei reden. Sie haben vielleicht zum ersten Mal in ihrem Leben das Gefühl, ihre eigene Zukunft in den Händen zu halten. Sie spüren, dass sie selber entscheiden können, wie sie leben wollen.

Was sich die Menschen in Tunesien wünschen, was sie sich erträumen, ist unseren Wünschen und unseren Träumen sehr nah. Die Hoffnung auf ein Leben in Freiheit, in Würde und Gerechtigkeit verbindet uns über das Mittelmeer und über alle Grenzen hinweg. Gleichzeitig erreichen uns die Bilder von Flüchtlingsbooten vor Lampedusa. Klar ist: Wir können nicht alle Menschen aus Nordafrika in Europa aufnehmen. Wir wollen vielmehr dabei helfen, dass die Menschen im eigenen Land eine gute Zukunft für sich sehen. Jetzt zu handeln, jetzt vor Ort zu helfen, ist die beste Politik, um Flüchtlingsströme einzudämmen.",data/txt/17095.txt,speech,
2489653,95,17,0,,,,38,Beifall bei der FDP und der CDU/CSU,data/txt/17095.txt,poi,
2489654,95,17,0,"Dr. Guido Westerwelle, Bundesminister des Auswärtigen",Dr. Guido Westerwelle,guido-westerwelle,39,"Der Aufbruch, dessen Zeuge wir sind, ist eine große Chance für beide Seiten. Es ist die Chance auf ein neues, produktives Miteinander der Länder nördlich und südlich des Mittelmeers. Er ist auch eine Chance für Deutschland. Wenn diese Gesellschaften in neuer Freiheit ihre ganze Kreativität und ihre Talente entfalten, können neue Mittelschichten in Nordafrika unsere kommenden Partner - auch Wirtschaftspartner - werden. Umgekehrt können wir durch Investitionen und Handels-austausch die wirtschaftlichen Chancen für die Menschen und gerade auch für die jungen Menschen dort verbessern.

Es bleibt ein unvergessliches Erlebnis, das ich auf dem Tahrir-Platz gewissermaßen stellvertretend für Sie und für viele andere Staatsbürgerinnen und Staatsbürger hatte, als auf dem Tahrir-Platz in Kairo Hunderte spontan zusammenkamen, weil sie erfuhren, dass eine deutsche Delegation dort ist, und sie riefen: Es lebe Ägypten, es lebe Deutschland! - Das war Ausdruck des hohen Ansehens, das wir uns in Ägypten erworben haben. Es zeigt, dass unsere Politik der Parteinahme für den demokratischen Aufbruch, ohne dabei die ägyptische Souveränität dieses stolzen Volkes infrage zu stellen, richtig war. Es war aber auch Ausdruck der enormen Erwartungen gerade der ägyptischen Jugend an unser Land.

Wir haben Tunesien und Ägypten sehr früh eine Transformationspartnerschaft angeboten, weil wir den Aufbruch zu Demokratie von Beginn an nach besten Kräften unterstützen wollten. Das jetzt beschlossene Konzept der Europäischen Union für eine Partnerschaft für Demokratie und gemeinsamen Wohlstand trägt in weiten Teilen die Handschrift der Bundesregierung.",data/txt/17095.txt,speech,
2489655,95,17,0,,,,40,Beifall bei der FDP sowie bei Abgeordneten der CDU/CSU,data/txt/17095.txt,poi,
