id,sitzung,wahlperiode,in_writing,speaker,speaker_cleaned,speaker_fp,sequence,text,filename,type,speaker_party
2489861,95,17,0,Volker Beck (Köln) (BÜNDNIS 90/DIE GRÜNEN),Volker Beck,volker-beck,246,"Frau Präsidentin! Die Bundesregierung hat in der heutigen Kabinettssitzung sicher auch über das Atommoratorium gesprochen. Über die Presse haben wir erfahren, dass aufgrund § 19 Abs. 3 des Atomgesetzes die vorübergehende Stilllegung von sieben Atomkraftwerken vorgesehen ist. § 19 Abs. 3 dieses Gesetzes lässt dies zu, wenn die Vorgaben des Satzes 1 des Abs. 3 erfüllt sind. Dort heißt es:

Die Aufsichtsbehörde kann anordnen, daß ein Zustand beseitigt wird, der den Vorschriften dieses Gesetzes oder der auf Grund dieses Gesetzes erlassenen Rechtsverordnungen, den Bestimmungen des Bescheids über die Genehmigung oder allgemeine Zulassung oder einer nachträglich angeordneten Auflage widerspricht oder aus dem sich durch die Wirkung ionisierender Strahlen Gefahren für Leben, Gesundheit oder Sachgüter ergeben können.

Vor dem Hintergrund, dass es eine rechtswirksame Stilllegung sein muss, weil ansonsten Entschädigungsforderungen auf die Bundesregierung zukommen könnten, möchte ich Sie bitten, uns zu erklären, welcher der in § 19 Abs. 3 Satz 1 aufgeführten Tatbestände von der Bundesregierung bei den sieben Atomkraftwerken als erfüllt angenommen wird.",data/txt/17095.txt,speech,gruene
2489862,95,17,0,Vizepräsidentin Katrin Göring-Eckardt,Katrin Göring-Eckardt,katrin-goring-eckardt,247,"Wer antwortet für die Bundesregierung? - Bitte schön, Herr von Klaeden.",data/txt/17095.txt,chair,
2489863,95,17,0,"Eckart von Klaeden, Staatsminister bei der Bundeskanzlerin",Eckart von Klaeden,eckart-klaeden,248,"Herr Kollege Beck, ich beantworte Ihre Frage, weil sie sich auf die heutige Kabinettssitzung bezieht.

Die Bundesregierung ist der Auffassung, dass § 19 des Atomgesetzes eine Rechtsgrundlage für ein entsprechendes Verhalten der Landesaufsichtsbehörden für die Kernkraftwerke bietet. Deswegen ist eine Stellungnahme oder eine Festlegung der Bundesregierung nicht erforderlich. Für die Aufsicht über die Kernkraftwerke und die entsprechenden rechtlichen Maßnahmen, insbesondere die Verwaltungsakte, sind die Landesregierungen zuständig. An diese sind dann auch die entsprechenden Fragen zu richten.",data/txt/17095.txt,speech,
2489864,95,17,0,Volker Beck [Köln] [BÜNDNIS 90/DIE GRÜNEN],Volker Beck,volker-beck,249,Dazu hätte ich eine Nachfrage!,data/txt/17095.txt,poi,gruene
2489865,95,17,0,"Eckart von Klaeden, Staatsminister bei der Bundeskanzlerin",Eckart von Klaeden,eckart-klaeden,250,,data/txt/17095.txt,speech,
2489866,95,17,0,Vizepräsidentin Katrin Göring-Eckardt,Katrin Göring-Eckardt,katrin-goring-eckardt,251,"Die Kollegin Dorothee Menzner, bitte.",data/txt/17095.txt,chair,
2489867,95,17,0,Dorothee Menzner (DIE LINKE),Dorothee Menzner,dorothee-menzner,252,"Frau Präsidentin! Ich frage die Bundesregierung, ob in der heutigen Kabinettssitzung im Zusammenhang mit dem dreimonatigen Moratorium, wie immer es dann rechtlich gestrickt ist, auch darüber nachgedacht wurde, international tätig zu werden: zum einen auf der Ebene der Vereinten Nationen in Form eines Gespräches über die Frage der zivilen und militärischen Nutzung von Atomenergie und zum anderen im Hinblick auf zumindest eine zeitweise Aussetzung und ein Überdenken der deutschen Importe von atomarer Technik und atomaren Anlagen, was perspektivisch vielleicht zu der Erkenntnis führt, dass der Import dieser Technik nicht sinnvoll und deshalb dauerhaft einzustellen ist.",data/txt/17095.txt,speech,linke
2489868,95,17,0,"Eckart von Klaeden, Staatsminister bei der Bundeskanzlerin",Eckart von Klaeden,eckart-klaeden,253,"Frau Kollegin, die Bundesregierung wird dieses Moratorium nutzen - dazu ist es auch gedacht -, die Sicherheit unserer Kernkraftwerke vor dem Hintergrund der Ereignisse in Japan nochmals einer grundlegenden Prüfung zu unterziehen. Die Ergebnisse dieser Prüfung sind abzuwarten; sie können nicht vorweggenommen werden.

Zu Ihrer Frage zum internationalen Vorgehen will ich nur darauf verweisen, dass auch auf europäischer Ebene eine Überprüfung der Sicherheit der Kernkraftwerke stattfindet. Darüber wurde in der Presse unter dem Stichwort ""Stresstest"" berichtet.",data/txt/17095.txt,speech,
2489869,95,17,0,Vizepräsidentin Katrin Göring-Eckardt,Katrin Göring-Eckardt,katrin-goring-eckardt,254,Der Kollege Ulrich Kelber.,data/txt/17095.txt,chair,
2489870,95,17,0,Ulrich Kelber (SPD),Ulrich Kelber,ulrich-kelber,255,"Vielen Dank, Frau Präsidentin. - Nach Aussage von Bundesminister Röttgen und der Frau Parlamentarischen Staatssekretärin Reiche ist heute im Kabinett auch über die verschiedenen Möglichkeiten zur Erhöhung der Sicherheit in deutschen Atomkraftwerken gesprochen worden. Ist in dem Zusammenhang auch darüber gesprochen worden, das seit dem Jahr 2004 entwickelte und in den Jahren 2009 und 2010 erprobte neue Kerntechnische Regelwerk anzuwenden? Das Kerntechnische Regelwerk legt fest, in welcher Form erhöhte Sicherheitsanforderungen an Atomkraftwerke gegenüber dem alten Regelwerk aus den 70er-Jahren gestellt werden. Das ist nicht nur sicherheitstechnisch, sondern auch finanziell relevant. RWE hat angekündigt, die Regelungen bei Biblis A rechtlich zu überprüfen. Wenn die Sicherheitsanforderungen höher und die Gewinnmöglichkeiten also geringer sind, sind auch mögliche Schadenersatzzahlungen geringer. Wir haben nachgefragt, ob dieses Regelwerk sofort in Kraft gesetzt werden kann. Antwort war, es gebe keine Vereinbarung mit den Ländern.

Nun meine Frage. Auf dem Webserver des Umweltministeriums findet sich - zumindest war das bis heute 12 Uhr der Fall - eine vom 4. Juni 2009 stammende Vereinbarung zwischen dem Bund und den Ländern mit Unterschrift der zuständigen Landesminister, in der steht:

Die Erprobungsphase beginnt am 1. Juli 2009 und wird am 31. Oktober 2010 abgeschlossen. ... Erst am Ende des Verfahrens erfolgt die Veröffentlichung durch das Bundesumweltministerium im Bundesanzeiger ...

Dieses Dokument war dem Minister und der Staatssekretärin nicht bekannt. Ist es dem Rest der Bundesregierung bekannt?",data/txt/17095.txt,speech,spd
2489871,95,17,0,"Eckart von Klaeden, Staatsminister bei der Bundeskanzlerin",Eckart von Klaeden,eckart-klaeden,256,"Zunächst einmal, Herr Kollege Kelber, bin ich beeindruckt, in welcher Weise Sie in der Lage sind, verschiedene Sachverhalte in einer Frage zusammenzufassen. Prinzipiell ist der Bundesregierung alles bekannt, was auf ihren Webservern steht. Ich kann Ihnen jetzt allerdings nicht bestätigen, was Sie gerade dargelegt haben, weil ich nicht in der Lage bin, mir einen ständigen Überblick über das zu verschaffen, was die Bundesregierung an Informationen im Internet anbietet. Deshalb gestatten Sie, dass ich die Frage schriftlich beantworte.",data/txt/17095.txt,speech,
2489872,95,17,0,Vizepräsidentin Katrin Göring-Eckardt,Katrin Göring-Eckardt,katrin-goring-eckardt,257,Frau Kotting-Uhl.,data/txt/17095.txt,chair,
2489873,95,17,0,Sylvia Kotting-Uhl (BÜNDNIS 90/DIE GRÜNEN),Sylvia Kotting-Uhl,sylvia-kotting-uhl,258,"Vielen Dank, Frau Präsidentin. - Ich möchte die Bundesregierung noch einmal zu § 19 Atomgesetz befragen, auf den der Kollege Beck sich schon bezogen hat. Wenn ich das juristische Deutsch einmal allgemeinverständlich übersetze, dann steht in Abs. 3, auf den sich die Bundesregierung bei der Abschaltung der sieben alten Reaktoren bezieht, dass es zwei Gründe gibt, weswegen ein Atomkraftwerk abgeschaltet werden kann. Der eine ist, dass ein Atomkraftwerk nicht dem gesetzlichen Sicherheitsstandard entspricht; der andere ist, dass Gefahr für Leben und Gesundheit befürchtet wird. Herr Minister Röttgen hat heute im Umweltausschuss gesagt, dass es nicht um akute Gefahrenabwehr gehe. Dann bleibt nach § 19 Abs. 3 nur die Begründung, dass ein Atomkraftwerk nicht dem gesetzlichen Sicherheitsstandard entspricht.

Meine Frage an die Bundesregierung lautet: Welche konkreten Sicherheitsmängel oder Gefahren bestehen in diesen sieben alten Atomkraftwerken heute, die vor wenigen Wochen oder Tagen noch nicht bestanden haben?",data/txt/17095.txt,speech,gruene
2489874,95,17,0,"Eckart von Klaeden, Staatsminister bei der Bundeskanzlerin",Eckart von Klaeden,eckart-klaeden,259,"Frau Kollegin, ich muss auf meine Antwort auf die Frage des Kollegen Beck verweisen. Die verbindliche Anwendung von § 19 Atomgesetz obliegt den Ländern, die die Atomaufsicht führen. Ich werde hier jetzt keine verbindliche Interpretation dieser Vorschrift vornehmen können.

Richtig ist, dass den Ländern, die entsprechende Maßnahmen im Zusammenhang mit diesem Moratorium getroffen haben oder noch treffen werden, die Möglichkeit gegeben wird, die Sicherheit unserer Kernkraftwerke und die Einhaltung des entsprechenden Regelwerkes vor dem Hintergrund der Ereignisse in Japan grundlegend zu überprüfen.",data/txt/17095.txt,speech,
2489875,95,17,0,Vizepräsidentin Katrin Göring-Eckardt,Katrin Göring-Eckardt,katrin-goring-eckardt,260,Jetzt ist die Kollegin Heidrun Dittrich an der Reihe.,data/txt/17095.txt,chair,
2489876,95,17,0,Heidrun Dittrich (DIE LINKE),Heidrun Dittrich,heidrun-dittrich,261,"Vielen Dank, Frau Präsidentin. - Hat sich die Bundesregierung in ihrer heutigen Kabinettssitzung damit befasst, welche Position sie im Sicherheitsrat der Vereinten Nationen einnehmen möchte, um weltweit Hilfe für die japanische Bevölkerung zu organisieren, die es beispielsweise ermöglicht, Familien mit Kindern, die der Strahlung ausgesetzt waren, auszufliegen?",data/txt/17095.txt,speech,linke
2489877,95,17,0,"Eckart von Klaeden, Staatsminister bei der Bundeskanzlerin",Eckart von Klaeden,eckart-klaeden,262,"Mir ist eine solche Initiative im Sicherheitsrat nicht bekannt. Klar ist, dass die Bundesregierung der japanischen Regierung umfassende Hilfe angeboten hat. Die ersten Hilfsmaßnahmen, wie zum Beispiel die Entsendung von Experten des Technischen Hilfswerks, sind angelaufen. Deutschland ist das erste Land gewesen, das Japan in dieser Weise geholfen hat. Das ist in Japan entsprechend gewürdigt worden.",data/txt/17095.txt,speech,
2489878,95,17,0,Vizepräsidentin Katrin Göring-Eckardt,Katrin Göring-Eckardt,katrin-goring-eckardt,263,Der Kollege Matthias Miersch.,data/txt/17095.txt,chair,
2489879,95,17,0,Dr. Matthias Miersch (SPD),Dr. Matthias Miersch,matthias-miersch,264,"Auch ich habe eine Frage zu dem sogenannten Moratorium die Atomkraft betreffend. Sie haben ja nicht nur das Atomgesetz als Grundlage, sondern nach wie vor den Vertrag, den die Bundesregierung mit den vier großen Energiekonzernen geschlossen hat. Können Sie uns darüber Auskünfte geben, ob es derzeit Gespräche der Bundesregierung mit diesen vier Energiekonzernen über das weitere Prozedere, über die Anwendung und über die Modifizierung bzw. Kündigung dieses Vertrages gibt?",data/txt/17095.txt,speech,spd
2489880,95,17,0,"Eckart von Klaeden, Staatsminister bei der Bundeskanzlerin",Eckart von Klaeden,eckart-klaeden,265,"Dazu kann ich Ihnen keine konkrete Auskunft geben. Ich gehe aber davon aus, dass die Bundesregierung und auch die Landesregierungen im ständigen Kontakt mit den Energiekonzernen stehen.",data/txt/17095.txt,speech,
2489881,95,17,0,Vizepräsidentin Katrin Göring-Eckardt,Katrin Göring-Eckardt,katrin-goring-eckardt,266,Die Kollegin Hönlinger.,data/txt/17095.txt,chair,
2489882,95,17,0,Ingrid Hönlinger (BÜNDNIS 90/DIE GRÜNEN),Ingrid Hönlinger,ingrid-honlinger,267,"Vielen Dank, Frau Präsidentin. - Meine Frage bezieht sich ebenfalls auf das Moratorium. Ich möchte gerne wissen, um welche Sicherheitsmerkmale es sich handelt, die zur Einstellung des Betriebs der ältesten AKWs geführt haben. Inwieweit unterschieden sich diese Sicherheitsmerkmale von denen der weiterlaufenden AKWs?",data/txt/17095.txt,speech,gruene
2489883,95,17,0,"Eckart von Klaeden, Staatsminister bei der Bundeskanzlerin",Eckart von Klaeden,eckart-klaeden,268,"Frau Kollegin, das ist wiederum eine Frage, die sich an die für die Kernkraftwerke zuständigen Aufsichtsbehörden richten müsste, also an die jeweiligen Landesregierungen.",data/txt/17095.txt,speech,
2489884,95,17,0,Volker Beck [Köln] [BÜNDNIS 90/DIE GRÜNEN],Volker Beck,volker-beck,269,"Also weiß die Bundesregierung gar nicht, ob die Abschaltung stattfindet?",data/txt/17095.txt,poi,gruene
2489885,95,17,0,"Eckart von Klaeden, Staatsminister bei der Bundeskanzlerin",Eckart von Klaeden,eckart-klaeden,270,"Die Bundesregierung ist dafür nicht zuständig. Ich verweise auf die Verteilung der Zuständigkeiten nach unserem Grundgesetz und bitte um Verständnis, dass ich Ihre Frage deswegen nicht beantworten kann.",data/txt/17095.txt,speech,
2489886,95,17,0,Volker Beck [Köln] [BÜNDNIS 90/DIE GRÜNEN],Volker Beck,volker-beck,271,"Wie haben Sie es dann geschafft, das Ergebnis zu verkünden?",data/txt/17095.txt,poi,gruene
2489887,95,17,0,"Eckart von Klaeden, Staatsminister bei der Bundeskanzlerin",Eckart von Klaeden,eckart-klaeden,272,,data/txt/17095.txt,speech,
2489888,95,17,0,Vizepräsidentin Katrin Göring-Eckardt,Katrin Göring-Eckardt,katrin-goring-eckardt,273,Die nächste Frage stellt der Kollege Weinberg.,data/txt/17095.txt,chair,
2489889,95,17,0,Harald Weinberg (DIE LINKE),Harald Weinberg,harald-weinberg,274,"Vielen Dank, Frau Präsidentin. - Bei dem betroffenen Reaktorblock 3 in Japan werden sogenannte Mischoxid-Brennelemente eingesetzt mit einem hohen Anteil an hochgiftigem Plutonium. Auch im Kernkraftwerk Grohnde sollen MOX-Brennelemente eingesetzt werden. Fällt der Einsatz dieser Elemente unter das dreimonatige Moratorium? Würde das nicht Sinn machen?",data/txt/17095.txt,speech,linke
2489890,95,17,0,"Eckart von Klaeden, Staatsminister bei der Bundeskanzlerin",Eckart von Klaeden,eckart-klaeden,275,"Herr Kollege, ich kann Ihnen diese technische Frage jetzt nicht beantworten und kann deswegen die Wertung, die Sie in Ihrer Frage vorgenommen haben, nicht bestätigen. Klar ist aber, dass im Rahmen dieses dreimonatigen Moratoriums vor dem Hintergrund der Ereignisse in Japan eine grundlegende Überprüfung auch der Sicherheitsbestimmungen bei uns stattfinden wird.",data/txt/17095.txt,speech,
2489891,95,17,0,Vizepräsidentin Katrin Göring-Eckardt,Katrin Göring-Eckardt,katrin-goring-eckardt,276,Die Kollegin Höhn.,data/txt/17095.txt,chair,
2489892,95,17,0,Bärbel Höhn (BÜNDNIS 90/DIE GRÜNEN),Bärbel Höhn,barbel-hohn,277,"Es wundert mich schon, dass die Kanzlerin die Idee eines Moratoriums verkünden konnte, ohne mit den Ländern gesprochen zu haben; denn nach dem, was Sie eben gesagt haben, sind eigentlich die Länder zuständig. Aber das will ich einmal dahingestellt sein lassen.

Angesichts eines solchen Moratoriums und angesichts der Tatsache, dass die ältesten Atomkraftwerke drei Monate vom Netz genommen werden - einige wie beispielsweise Neckarwestheim und Isar 1 will man sogar für immer stilllegen; das steht zumindest in der Zeitung -, frage ich Sie: Werden die Laufzeiten dieser Atomkraftwerke auf neuere übertragen? Was haben Sie dazu im Kabinett entschieden?",data/txt/17095.txt,speech,gruene
2489893,95,17,0,"Eckart von Klaeden, Staatsminister bei der Bundeskanzlerin",Eckart von Klaeden,eckart-klaeden,278,"Dazu ist im Kabinett nichts entschieden worden. Auch das wäre ja eine Vorwegnahme der Ergebnisse der Untersuchung, die stattfinden soll.

Ich muss aber Ihren Einleitungssatz korrigieren: Selbstverständlich hat die Bundeskanzlerin, hat die Bundesregierung mit den betroffenen Ländern gesprochen.",data/txt/17095.txt,speech,
2489894,95,17,0,Bärbel Höhn [BÜNDNIS 90/DIE GRÜNEN],Bärbel Höhn,barbel-hohn,279,Nachdem sie das verkündet hatte!,data/txt/17095.txt,poi,gruene
2489895,95,17,0,Gegenruf des Abg. Dr. h. c. Jürgen Koppelin [FDP],Dr. h. c. Jürgen Koppelin,jurgen-koppelin,280,Nein! Das stimmt doch überhaupt nicht!,data/txt/17095.txt,poi,fdp
2489896,95,17,0,"Eckart von Klaeden, Staatsminister bei der Bundeskanzlerin",Eckart von Klaeden,eckart-klaeden,281,"- Nein, es hat ein Gespräch der Bundeskanzlerin mit den Ministerpräsidenten der betroffenen Länder gegeben. Dann sind diese Entscheidungen verkündet worden.",data/txt/17095.txt,speech,
2489897,95,17,0,Dr. h. c. Jürgen Koppelin [FDP],Dr. h. c. Jürgen Koppelin,jurgen-koppelin,282,So ist das!,data/txt/17095.txt,poi,fdp
2489898,95,17,0,"Eckart von Klaeden, Staatsminister bei der Bundeskanzlerin",Eckart von Klaeden,eckart-klaeden,283,"Darüber hinaus hat es natürlich Stellungnahmen gegeben. Es ist schnell und nachvollziehbar auf die Ereignisse in Japan reagiert worden. Ich möchte mich gar nicht auf die Überlegung einlassen, wie Ihre Kritik aussehen würde, wenn es entsprechende Äußerungen und Entscheidungen der Kanzlerin und der Bundesregierung nicht gegeben hätte.",data/txt/17095.txt,speech,
2489899,95,17,0,Dr. Dagmar Enkelmann [DIE LINKE],Dr. Dagmar Enkelmann,dagmar-enkelmann,284,Das war eine ziemliche Eierei!,data/txt/17095.txt,poi,linke
2489900,95,17,0,"Eckart von Klaeden, Staatsminister bei der Bundeskanzlerin",Eckart von Klaeden,eckart-klaeden,285,,data/txt/17095.txt,speech,
2489901,95,17,0,Vizepräsidentin Katrin Göring-Eckardt,Katrin Göring-Eckardt,katrin-goring-eckardt,286,Herr Kollege Kelber.,data/txt/17095.txt,chair,
2489902,95,17,0,Ulrich Kelber (SPD),Ulrich Kelber,ulrich-kelber,287,"Die Bundeskanzlerin hat gestern gesagt, dass es im Rahmen des Moratoriums keine Genehmigung für die Übertragung von Restlaufzeiten von älteren Atomkraftwerken aus den 70er-Jahren auf neuere aus den 80er-Jahren geben werde. Auf Nachfrage hat der Bundesumweltminister in der Sondersitzung des Umweltausschusses heute erklärt, das Moratorium selbst sei natürlich nur ein politisches Instrument, damit sei die Laufzeitverlängerung als ein Rechtsinstrument nicht ausgesetzt, was durch die Exekutive ja auch gar nicht möglich ist. Damit haben die Atomkraftwerksbetreiber allerdings die Möglichkeit, ohne Genehmigung - einfach durch Anmel-dung - Restlaufzeiten von den derzeit stillgelegten sieben Atomkraftwerken dauerhaft auf die neueren zu übertragen. Sie hätten bis in die 40er-Jahre einen Rechtsanspruch mit entsprechenden Entschädigungen, falls sich aus der Sicherheitsüberprüfung eine Stilllegung ergibt.

Ist heute im Kabinett darüber gesprochen worden, wie man mit diesem sehr großen, mehrere Milliarden Euro umfassenden Problem umgehen möchte?",data/txt/17095.txt,speech,spd
2489903,95,17,0,"Eckart von Klaeden, Staatsminister bei der Bundeskanzlerin",Eckart von Klaeden,eckart-klaeden,288,"Nein, Herr Kollege Kelber, das ist im Kabinett nicht besprochen worden. Aber es ist durchaus denkbar, dass eine Folge der von mir schon mehrfach erwähnten grundlegenden Überprüfung auch gesetzgeberischer Handlungsbedarf ist.",data/txt/17095.txt,speech,
2489904,95,17,0,Vizepräsidentin Katrin Göring-Eckardt,Katrin Göring-Eckardt,katrin-goring-eckardt,289,Herr Kollege Koppelin.,data/txt/17095.txt,chair,
2489905,95,17,0,Dr. h. c. Jürgen Koppelin (FDP),Dr. h. c. Jürgen Koppelin,jurgen-koppelin,290,"Herr Staatsminister, Sie haben schon dargestellt, dass erst das Gespräch bei der Kanzlerin stattgefunden hat und dann die Erklärung der Kanzlerin abgegeben worden ist. Ist meine Information richtig, dass der Bundesumweltminister die entsprechenden Fachminister aus den betroffenen Ländern gestern ebenfalls informiert und mit ihnen ein Gespräch geführt hat?

Ist es weiterhin richtig, dass auf der morgigen Tagesordnung eine Regierungserklärung der Bundeskanzlerin zu diesem Thema steht? Man muss sich wundern, dass die Befragung der Bundesregierung dazu vorhin abgebrochen und ein völlig neues Thema aufgerufen wurde.",data/txt/17095.txt,speech,fdp
2489906,95,17,0,Dr. Dagmar Enkelmann [DIE LINKE],Dr. Dagmar Enkelmann,dagmar-enkelmann,291,Das ist völlig geschäftsordnungsgemäß!,data/txt/17095.txt,poi,linke
2489907,95,17,0,Dr. h. c. Jürgen Koppelin (FDP),Dr. h. c. Jürgen Koppelin,jurgen-koppelin,292,,data/txt/17095.txt,speech,fdp
2489908,95,17,0,"Eckart von Klaeden, Staatsminister bei der Bundeskanzlerin",Eckart von Klaeden,eckart-klaeden,293,"Herr Kollege Koppelin, die Tagesordnung des Bundestages ist mir in der Form, wie Sie sie gerade zitiert haben, bekannt. Auch Ihre Schilderung des Ablaufs ist zutreffend. Zusätzlich will ich erwähnen, dass die Kanzlerin am Wochenende zunächst mit dem Vizekanzler besprochen hat, wie auf diese Situation zu reagieren ist, und dass beide eng das weitere Vorgehen abgestimmt haben.",data/txt/17095.txt,speech,
2489909,95,17,0,Vizepräsidentin Katrin Göring-Eckardt,Katrin Göring-Eckardt,katrin-goring-eckardt,294,Der Kollege Ott.,data/txt/17095.txt,chair,
2489910,95,17,0,Dr. Hermann Ott (BÜNDNIS 90/DIE GRÜNEN),Dr. Hermann Ott,hermann-ott,295,"Vielen Dank, Frau Präsidentin. - Angesichts der wunderbaren Geschmeidigkeit des Vertreters der Bundesregierung in der Regierungsbefragung",data/txt/17095.txt,speech,gruene
2489911,95,17,0,Jens Spahn [CDU/CSU],Jens Spahn,jens-spahn,296,Kein Neid!,data/txt/17095.txt,poi,cducsu
2489912,95,17,0,Dr. Hermann Ott (BÜNDNIS 90/DIE GRÜNEN),Dr. Hermann Ott,hermann-ott,297,"und seiner Fähigkeit, allen klaren und konkreten Antworten aus dem Wege zu gehen, verzichte ich auf weitere Fragen zu § 19 Atomgesetz und möchte eine Frage von allgemeinem Interesse stellen.

Allen in diesem Hause geht es wahrscheinlich ähnlich, dass sie sich darüber beklagen, wie wenige Informationen über Strahlungswerte eigentlich bekannt sind. Die Betreiberfirma Tepco ist diesbezüglich sehr zurückhaltend. Es gibt allerdings eine internationale Einrichtung, die konstant Daten im gesamten pazifischen Raum misst und diese an die Regierungen weitergibt. Es handelt sich um das Sekretariat des Nuclear Test Ban Treaty.

Ich bin mir nicht sicher, ob das Sekretariat beim BMU oder beim Auswärtigen Amt angebunden ist. Ist Ihnen das bekannt? Können vielleicht die Vertreter und Vertreterinnen der jeweiligen Ministerien dazu Stellung nehmen und prüfen, ob diese Informationen weitergegeben werden können? Das Sekretariat hat erklärt, ihm seien leider die Hände gebunden, es könne diese Informationen selbst nicht weitergeben.",data/txt/17095.txt,speech,gruene
2489913,95,17,0,"Eckart von Klaeden, Staatsminister bei der Bundeskanzlerin",Eckart von Klaeden,eckart-klaeden,298,"Zunächst einmal gehen wir dieser Anregung gerne nach. Vielleicht können die Kolleginnen und Kollegen beantworten, ob das bereits der Fall ist.

Auf eines möchte ich hinweisen: Für uns alle gilt, dass die Ereignisse in Japan unvorhersehbar waren und eine Zäsur darstellen; auch in der Frage, welche Schwerpunktsetzungen und welche Abwägungen für die Energieversorgung unseres Landes zu treffen sind. Daher bitte ich um Verständnis, dass wir, wenn wir eine solche grundlegende Überprüfung seriös durchführen wollen, nicht wenige Stunden oder Tage nach den Ereignissen - womöglich parallel dazu - bereits Ergebnisse präsentieren können, die eine solche Untersuchung im Grunde vorwegnehmen.

Der Kollege Hoyer möchte zu der Frage nach dem Sekretariat des Nuclear Test Ban Treaty etwas sagen.",data/txt/17095.txt,speech,
2489914,95,17,0,Vizepräsidentin Katrin Göring-Eckardt,Katrin Göring-Eckardt,katrin-goring-eckardt,299,"Herr Hoyer, bitte schön.",data/txt/17095.txt,chair,
2489915,95,17,0,"Dr. Werner Hoyer, Staatsminister im Auswärtigen Amt",Dr. Werner Hoyer,werner-hoyer,300,"Herr Kollege, ich würde diese Frage gerne befriedigend beantworten, kann es aber nicht. Der Sache gehe ich aber gerne nach. Ich kann Ihnen nur versichern, dass wir, seitdem wir seit dem Wochenende im Krisenreaktionszentrum des Auswärtigen Amtes teilweise rund um die Uhr damit beschäftigt sind, die Kommunikationsaufgabe im Zusammenhang mit dieser Krise in den Griff zu bekommen, uns um nichts mehr bemühen als darum, möglichst objektive Daten zu sammeln.

Das ist ein ganz wesentlicher Punkt, um Vertrauen bei der Bevölkerung und bei den Menschen zu generieren, die wir mit der Bewältigung der Situation vor Ort betrauen. Denn das ist der entscheidende Punkt: dass wir deutlich machen, dass wir gegenüber unserer eigenen Bevölkerung mit einem Höchstmaß an Offenheit und Transparenz handeln. Deswegen nehme ich Ihre Anregung sehr gerne auf.",data/txt/17095.txt,speech,
2489916,95,17,0,Dr. Hermann Ott [BÜNDNIS 90/DIE GRÜNEN],Dr. Hermann Ott,hermann-ott,301,Melden Sie sich bei mir? Sagen Sie mir Bescheid?,data/txt/17095.txt,poi,gruene
2489917,95,17,0,"Dr. Werner Hoyer, Staatsminister im Auswärtigen Amt",Dr. Werner Hoyer,werner-hoyer,302,,data/txt/17095.txt,speech,
2489918,95,17,0,Vizepräsidentin Katrin Göring-Eckardt,Katrin Göring-Eckardt,katrin-goring-eckardt,303,Die Kollegin Heinen-Esser wollte der Beantwortung noch etwas hinzufügen. - Bitte schön.,data/txt/17095.txt,chair,
2489919,95,17,0,"Ursula Heinen-Esser, Parl. Staatssekretärin beim Bundesminister für Umwelt, Naturschutz und Reaktorsicherheit",Ursula Heinen-Esser,ursula-heinen-esser,304,"Alle Informationen, die wir erhalten - auch zu möglichen Strahlenbelastungen und zu Radioaktivitätswerten -, werden veröffentlicht, und zwar auf den Internetseiten des BMU, der Gesellschaft für Reaktorsicherheit und unserer nachgeordneten Behörde, dem Bundesamt für Strahlenschutz. Der Präsident, Wolfram König, nimmt dazu regelmäßig Stellung, sodass alle Informationen, die wir erhalten, sehr schnell der Öffentlichkeit zugänglich gemacht werden.",data/txt/17095.txt,speech,
2489920,95,17,0,Vizepräsidentin Katrin Göring-Eckardt,Katrin Göring-Eckardt,katrin-goring-eckardt,305,Jetzt die Frage der Kollegin Bulling-Schröter.,data/txt/17095.txt,chair,
