id,sitzung,wahlperiode,in_writing,speaker,speaker_cleaned,speaker_fp,sequence,text,filename,type,speaker_party
2616592,171,17,0,"Katherina Reiche, Parl. Staatssekretärin beim Bundesminister für Umwelt, Naturschutz und Reaktorsicherheit",Katherina Reiche,katherina-reiche,267,"Zunächst einmal: Ursprünglich waren 100 Millionen Euro für die Innovationsallianz Photovoltaik angekündigt. Diese Summe wird voraussichtlich sogar übertroffen. Insofern kann man sehen, dass wir, wenn wir uns etwas vornehmen, es richtig und gründlich tun.

Zum Zweiten. Die Unternehmen, die jetzt in Schwierigkeiten sind, haben möglicherweise mit Fehlern aus der Vergangenheit zu kämpfen. Forschung und Innovation müssen sich permanent im Budget eines Unternehmens abbilden. Rückfragen haben ergeben, dass in den einzelnen Unternehmen oftmals gar nicht bekannt war, wie hoch der Forschungsetat ist; auf jeden Fall betrug er nicht die 7 bis 10 Prozent, die mindestens notwendig sind, um bei der Produktentwicklung weiterhin vorne zu sein.

Seitens der Regierung fangen wir nun mit zusätzlichen Forschungsmitteln zumindest einen Teil von dem auf, was auf der Seite der Unternehmen im Bereich Forschung versäumt wurde. Wir alle sind uns einig: Wir wollen die Photovoltaikindustrie in Deutschland halten. Der Markt muss sich weltweit entwickeln. Es ist nun einmal so, dass die Unternehmen in Fernost nicht geschlafen haben. Das müssen wir jetzt ausgleichen, und zwar nicht nur über Regelungen des EEG, sondern auch über die laufenden Forschungsvorhaben. Aber kein -Forschungsvorhaben kann so umfangreich sein, dass es eigene Forschungsleistung im Unternehmen ersetzen kann.",data/txt/17171.txt,speech,
2616593,171,17,0,Vizepräsidentin Petra Pau,Petra Pau,petra-pau,268,"Danke, Frau Staatssekretärin.",data/txt/17171.txt,chair,
2616594,171,17,0,,,,269,Beifall bei der CDU/CSU und der FDP,data/txt/17171.txt,poi,
2616595,171,17,0,Vizepräsidentin Petra Pau,Petra Pau,petra-pau,270,"Wir kommen nun zum Geschäftsbereich des Bundesministeriums für Bildung und Forschung. Zur Beantwortung steht der Parlamentarische Staatssekretär Dr. Helge Braun zur Verfügung. Die Fragen 28 und 29 der Kollegin Marianne Schieder werden schriftlich beantwortet, ebenso die Fragen 30 und 31 des Kollege Michael Gerdes.

Wir kommen zur Frage 32 des Kollegen Willi Brase, welcher allerdings nicht im Raum ist. Dann verfahren wir nach unserer Geschäftsordnung.

Die Frage 33 des Kollegen Klaus Hagemann wird schriftlich beantwortet.

Damit bedanke ich mich schon beim Herrn Staats-sekretär für seine Bereitschaft, hier Rede und Antwort zu stehen.",data/txt/17171.txt,chair,
2616596,171,17,0,,,,271,Beifall bei der CDU/CSU und der LINKEN,data/txt/17171.txt,poi,
2616597,171,17,0,Vizepräsidentin Petra Pau,Petra Pau,petra-pau,272,"Wir kommen zum Geschäftsbereich des Bundesministeriums für wirtschaftliche Zusammenarbeit und Entwicklung. Die Frage 34 der Kollegin Heike Hänsel wird schriftlich beantwortet.

Wir kommen zum Geschäftsbereich der Bundeskanzlerin und des Bundeskanzleramtes. Die Frage 35 des Kollegen Thomas Jarzombek wird ebenfalls schriftlich beantwortet.

Damit kommen wir zum Geschäftsbereich des Bundesministeriums für Wirtschaft und Technologie. Zur Beantwortung steht der Parlamentarische Staatssekretär Hans-Joachim Otto zur Verfügung. Die Frage 36 des Kollegen Frank Schwabe und die Frage 37 des Kollegen Dr. Konstantin von Notz sollen schriftlich beantwortet werden.

Wir kommen zum Geschäftsbereich des Auswärtigen Amtes. Zur Beantwortung der Fragen steht der Staats-minister Michael Link zur Verfügung. Die Frage 38 des Kollegen Hans-Joachim Hacker soll schriftlich beantwortet werden.

Ich rufe die Frage 39 des Kollegen Wolfgang Gehrcke auf:

Ist die Bundesregierung bereit, mit den Teilnehmerinnen und Teilnehmern der diesjährigen Ostermärsche der Kriegsgegner in einen Dialog über die deutschen Positionen beim kommenden NATO-Gipfel in Chicago einzutreten?

Bitte, Herr Staatsminister.",data/txt/17171.txt,chair,
2616598,171,17,0,"Michael Link, Staatsminister im Auswärtigen Amt",Michael Link,michael-link,273,"Frau Präsidentin! Liebe Kolleginnen und Kollegen! Die Frage des Kollegen Gehrcke beantworte ich wie folgt: Die Bundesregierung steht zu einer Vielzahl von Themenbereichen in einem regelmäßigen und engen -Dialog mit der Zivilgesellschaft. Wie allen Bundesbürgerinnen und Bundesbürgern stehen auch den Teilnehmerinnen und Teilnehmern der Ostermärsche mehrere Wege zum Dialog mit der Bundesregierung offen. Dazu gehört unter anderem die Möglichkeit, Anfragen an die Bundesministerien zu richten. Die demokratische Mehrheitsfindung findet, wie wir alle wissen, im Deutschen Bundestag statt. Auch hier haben zivilgesellschaftliche Vertreter jederzeit die Möglichkeit, durch den Dialog mit Abgeordneten auf die Willensbildung einzuwirken. Das gilt für die Abgeordneten genauso wie für die Bundes-regierung.",data/txt/17171.txt,speech,
2616599,171,17,0,Vizepräsidentin Petra Pau,Petra Pau,petra-pau,274,Der Kollege Gehrcke hat das Wort zur ersten Zusatzfrage.,data/txt/17171.txt,chair,
2616600,171,17,0,Wolfgang Gehrcke (DIE LINKE),Wolfgang Gehrcke,wolfgang-gehrcke,275,"Herr Staatsminister, ich freue mich über Ihre Antwort. Ich habe natürlich nicht erwartet, dass die Bundesregierung die Bevölkerung dazu aufruft, am Ostermarsch teilzunehmen; das mache ich schon selber. Ich habe aber zum ersten Mal erlebt, dass ein Vertreter der Bundes-regierung erklärt, dass die Bundesregierung Wert auf einen Dialog mit denjenigen legt, die seit Jahren auf die Straße gehen und zu diesen Themen demonstrieren. Ich finde, das ist ein Fortschritt.

Wenn es so ist, wie Sie sagen: Sieht sich die Bundesregierung nicht in der Pflicht - ich frage Sie das, weil Sie gerade selbst auf die Gewaltenteilung aufmerksam gemacht haben -, den Bundestag besser darüber zu informieren, mit welchem Konzept die Bundesregierung zum NATO-Gipfel in Chicago fährt und um welchen Inhalt es dort gehen wird, um auch hier im Parlament für Transparenz zu sorgen?",data/txt/17171.txt,speech,linke
2616601,171,17,0,"Michael Link, Staatsminister im Auswärtigen Amt",Michael Link,michael-link,276,"Herr Kollege Gehrcke, natürlich: Was den NATO-Gipfel, der Ende Mai dieses Jahres in Chicago stattfinden wird, betrifft, ist die Bundesregierung selbst-verständlich bereit, den Bundestag ausführlichst zu informieren. Nur: Man kann nicht jedes Ergebnis vorwegnehmen. Die Bundesregierung ist zu Gesprächen bereit, sowohl in den zuständigen Ausschüssen - dort verfügen wir auch über die notwendigen Rahmenbedingungen, um tiefer in die Debatte einzusteigen, länger zu diskutieren und auf Nachfragen zu antworten - als auch hier im Plenum. Selbstverständlich stehen wir - das möchte ich ganz ausdrücklich sagen - auch außerhalb des Bundestages für Gespräche zur Verfügung. Bisher gibt es aber, wie schon gesagt, noch keine konkreten Anfragen.",data/txt/17171.txt,speech,
2616602,171,17,0,Vizepräsidentin Petra Pau,Petra Pau,petra-pau,277,"Ihre zweite Nachfrage, bitte.",data/txt/17171.txt,chair,
2616603,171,17,0,Wolfgang Gehrcke (DIE LINKE),Wolfgang Gehrcke,wolfgang-gehrcke,278,"Wir nähern uns allmählich dem Kern der Probleme. - Sie sagten, dass die Bundesregierung bereit ist, im Bundestag umfänglich Auskunft zu geben. Wenn das so ist, halte ich eine Regierungserklärung zum NATO-Gipfel für notwendig. Ich möchte Sie fragen, ob die Bundes-regierung das erwogen hat und möglicherweise dazu -bereit ist, und zwar nicht erst nach dem Gipfel. Mich interessiert nämlich, mit welcher Konzeption die Bundesregierung zu diesem NATO-Gipfel, in dessen Zentrum die Situation in Afghanistan und die Frage des Rückzugs aus Afghanistan stehen werden, fahren wird. Diese Information muss vorher erfolgen, damit man auf den Inhalt Einfluss nehmen kann.",data/txt/17171.txt,speech,linke
2616604,171,17,0,"Michael Link, Staatsminister im Auswärtigen Amt",Michael Link,michael-link,279,"Zur Frage einer möglichen Regierungserklärung gibt es bisher keinerlei Überlegungen. Auf Ihre Frage zu -Afghanistan - ich vermute, das ist auch Gegenstand Ihrer nächsten Frage - würde ich gerne bei der Beantwortung der nächsten Frage eingehen, da ich mich nicht wiederholen will.",data/txt/17171.txt,speech,
2616605,171,17,0,Wolfgang Gehrcke (DIE LINKE),Wolfgang Gehrcke,wolfgang-gehrcke,280,Okay; schlau ausgedacht.,data/txt/17171.txt,speech,linke
2616606,171,17,0,Vizepräsidentin Petra Pau,Petra Pau,petra-pau,281,"Dann kommen wir schon zur nächsten Frage. Ich rufe die Frage 40 des Kollegen Wolfgang Gehrcke auf:

Welche Schlussfolgerungen zieht die Bundesregierung aus der Erklärung des Leiters des Zentrums für Strategische Studien in Den Haag, Rob de Wijk: Der Krieg ist für das westliche Bündnis verloren. Jetzt geht es nur noch darum, einen Grund dafür zu finden, um sich selbst zum Sieger erklären zu können (www.n-tv.de/politik/Nato-Berater-Krieg-ist-verloren- article5774981.html)?

Bitte, Herr Staatsminister.",data/txt/17171.txt,chair,
2616607,171,17,0,"Michael Link, Staatsminister im Auswärtigen Amt",Michael Link,michael-link,282,"Danke, Frau Präsidentin. - Herr Kollege Gehrcke, Ihre Frage beantwortet die Bundesregierung wie folgt: Die Bundesregierung teilt die von Herrn de Wijk zum Ausdruck gebrachte Meinung, der Krieg sei für das westliche Bündnis verloren etc. - aus Zeitgründen erspare ich mir, das gesamte Zitat vorzutragen -, ausdrücklich nicht. Klar ist aber, dass die Aufgabe der von den Vereinten Nationen mandatierten ISAF-Truppe noch nicht vollständig erfüllt ist und dass Afghanistan auch nach dem Ende des Einsatzes internationaler Kampftruppen, also auch nach 2014, noch lange internationale Unterstützung benötigen wird. Dies wurde auf der Bonner Afghanistan-Konferenz von allen teilnehmenden Nationen anerkannt, und entsprechend wurde diese Unterstützung für die Transformationsdekade 2015 bis 2024 auch zugesichert.",data/txt/17171.txt,speech,
2616608,171,17,0,Vizepräsidentin Petra Pau,Petra Pau,petra-pau,283,"Die erste Nachfrage, bitte.",data/txt/17171.txt,chair,
2616609,171,17,0,Wolfgang Gehrcke (DIE LINKE),Wolfgang Gehrcke,wolfgang-gehrcke,284,"Wenn es so ist: Müsste die Bundesregierung dann nicht in ganz anderer Art und Weise zum Beispiel auf die Vorstellung des afghanischen Präsidenten Karzai eingehen, der ja gebeten hat, alle Truppen - ohne Unterscheidung zwischen Kampftruppen und Nichtkampftruppen - bereits 2013 abzuziehen? Wenn man ernsthaft von einer Übergabe in Verantwortung spricht, dann muss doch der Wunsch des afghanischen Präsidenten zu einer öffentlichen Erörterung führen und Grundlage der Entscheidung auch für die Bundesregierung sein.",data/txt/17171.txt,speech,linke
2616610,171,17,0,Vizepräsidentin Petra Pau,Petra Pau,petra-pau,285,"Bitte, Herr Staatsminister.",data/txt/17171.txt,chair,
2616611,171,17,0,"Michael Link, Staatsminister im Auswärtigen Amt",Michael Link,michael-link,286,"Herr Kollege Gehrcke, Präsident Karzai hat lediglich das gefordert, was bereits beschlossen ist. Die Transition ist bereits jetzt in der Hälfte des afghanischen Territo-riums in vollem Gange. Mitte 2013 soll der Transformationsprozess in allen Gebieten Afghanistans begonnen haben.

Die Rolle von ISAF wird sich dann vom derzeitigen Partnering hin zur unterstützenden und befähigenden Rolle verändern. Das wissen wir; wir haben darüber im Ausschuss geredet und können das gerne auch vor dem Gipfel noch einmal vertiefen. ISAF zieht sich dann in die zweite Reihe zurück. Die afghanischen Sicherheitskräfte sollen dann die operative Führung übernehmen. Dieser Transitionsprozess soll bis Ende 2014 abgeschlossen sein.

Das ist der Inhalt der in Lissabon zwischen ISAF und Afghanistan - das hat Karzai nur wiederholt und bekräftigt - vereinbarten Transitionsstrategie, die auf der Internationalen Afghanistan-Konferenz in Bonn ebenfalls noch einmal bestätigt wurde. Deshalb kann ich hier keinen Strategiewechsel erkennen.",data/txt/17171.txt,speech,
2616612,171,17,0,Vizepräsidentin Petra Pau,Petra Pau,petra-pau,287,Ihre nächste Nachfrage.,data/txt/17171.txt,chair,
2616613,171,17,0,Wolfgang Gehrcke (DIE LINKE),Wolfgang Gehrcke,wolfgang-gehrcke,288,"Ich finde, es gibt schon einen Unterschied zwischen der Aussage des afghanischen Präsidenten Karzai, der von 2013 und allen Truppen gesprochen hat, und dem, was die NATO und auch die Bundesregierung angeboten haben.

Unabhängig davon: In Chicago soll ein neues strategisches Konzept der NATO vereinbart werden. Das ist ja die Auskunft. Wenn es zu einem neuen strategischen Konzept der NATO kommt: Muss dieser Deutsche Bundestag, der jetzt elf Jahre lang Truppen für Afghanistan gestellt hat, nicht darauf bestehen, dass dieses Konzept vorher hier im Deutschen Bundestag erörtert wird, sodass man pro und kontra Stellung nehmen kann?",data/txt/17171.txt,speech,linke
2616614,171,17,0,"Michael Link, Staatsminister im Auswärtigen Amt",Michael Link,michael-link,289,"Die Bundesregierung wird selbstverständlich gerne alle Fragen eines strategischen Konzeptes mit dem Bundestag erörtern, aber nicht in der Form, wie zum Beispiel bei der Euro-Stabilisierung, wo es in Teilbereichen gesetzliche Vorschriften über vorherige Zustimmungs-erfordernisse gibt, sondern im Wege der Debatte und der Befassung im Ausschuss und dann natürlich auch im Lichte der Ereignisse. Kollege Gehrcke, wir wissen beide: Bei dem Gipfel werden selbstverständlich auch vor Ort noch Dinge auf den Tisch kommen, die vorher im Einzelfall gar nicht klar zu sehen sind.

Die Debatte in den Ausschüssen und auch vertiefte Gespräche vorher in den geeigneten Formaten bieten wir also gerne an. Ich bin mir sicher, dass der Bundestag - er ist Herr seiner eigenen Tagesordnung - auch im Plenum über die NATO-Strategie debattieren wird.",data/txt/17171.txt,speech,
2616615,171,17,0,Wolfgang Gehrcke [DIE LINKE],Wolfgang Gehrcke,wolfgang-gehrcke,290,Sie haben unseren Antrag vorweggeahnt! Ich bedanke mich!,data/txt/17171.txt,poi,linke
2616616,171,17,0,"Michael Link, Staatsminister im Auswärtigen Amt",Michael Link,michael-link,291,,data/txt/17171.txt,speech,
2616617,171,17,0,Vizepräsidentin Petra Pau,Petra Pau,petra-pau,292,"Die Frage 41 der Kollegin Inge Höger, die Fragen 42 und 43 des Kollegen Tom Koenigs, die Frage 44 der Kollegin Katja Keul, die Frage 45 des Kollegen Andrej Hunko und die Frage 46 des Kollegen Dr. Ilja Seifert sollen schriftlich beantwortet werden. Auch die Frage 47 der Kollegin Viola von Cramon-Taubadel, die Frage 48 der Kollegin Heike Hänsel und die Frage 49 des Kollegen Oliver Kaczmarek werden schriftlich beantwortet.

Wir sind damit am Ende des Geschäftsbereichs des Auswärtigen Amtes. Herzlichen Dank, Herr Staatsminister.

Wir kommen zum Geschäftsbereich des Bundes-ministeriums des Innern. Die Frage 50 des Kollegen Oliver Kaczmarek, die Frage 51 des Kollegen Dr. Anton -Hofreiter und die Frage 52 des Kollegen Dr. Konstantin von Notz sollen schriftlich beantwortet werden. Das Gleiche gilt für die Frage 53 des Kollegen Andrej Hunko, auch sie wird schriftlich beantwortet.

Damit sind wir im Geschäftsbereich des Bundes-ministeriums der Finanzen. Die Fragen 54 und 55 des Kollegen Dr. Gerhard Schick sollen schriftlich beantwortet werden wie auch die Frage 56 des Kollegen Hans--Joachim Hacker. Die Frage 57 des Kollegen Frank Schwabe wird schriftlich beantwortet wie auch die Frage 58 des Kollegen Klaus Hagemann.

Geschäftsbereich des Bundesministeriums für Arbeit und Soziales. Die Fragen 59 und 60 der Kollegin Sabine Zimmermann werden schriftlich beantwortet wie auch die Fragen 61 und 62 des Kollegen Markus Kurth.

Mir liegen keine weiteren Fragen vor. Wir sind damit am Ende der Fragestunde.

Ich unterbreche die Sitzung des Deutschen Bundestags bis 15.30 Uhr. Ich bitte, die abweichende Sitzungszeit zu beachten. Wir setzen die Sitzung um 15.30 Uhr fort mit der Aktuellen Stunde zum Thema Wettbewerbsnachteile für deutsche Unternehmen wegen Nichterfüllung der Frauenquote bei den Führungskräften.

Die Sitzung ist unterbrochen.",data/txt/17171.txt,chair,
2616618,171,17,0,,,,293,Unterbrechung von 15.11 bis 15.30 Uhr,data/txt/17171.txt,poi,
2616619,171,17,0,Vizepräsidentin Petra Pau,Petra Pau,petra-pau,294,,data/txt/17171.txt,chair,
2616620,171,17,0,Vizepräsidentin Petra Pau,Petra Pau,petra-pau,295,"Die unterbrochene Sitzung ist wieder eröffnet.

Ich rufe auf den Zusatzpunkt 1:

Aktuelle Stunde

auf Verlangen der Fraktion BÜNDNIS 90/DIE GRÜNEN

Wettbewerbsnachteile für deutsche Unternehmen wegen Nichterfüllung der Frauenquote bei den Führungskräften

Ich eröffne die Aussprache. Das Wort hat die Kollegin Renate Künast für die Fraktion Bündnis 90/Die Grünen. - Ich sehe die Wortmeldung zur Geschäftsordnung der Kollegin Haßelmann. Ich hatte allerdings vor, den Kollegen Lindner zu fragen,",data/txt/17171.txt,chair,
2616621,171,17,0,Jürgen Trittin [BÜNDNIS 90/DIE GRÜNEN],Jürgen Trittin,jurgen-trittin,296,Wo ist denn die Ministerin?,data/txt/17171.txt,poi,gruene
2616622,171,17,0,Vizepräsidentin Petra Pau,Petra Pau,petra-pau,297,ob wir jetzt mit der Debatte beginnen können.,data/txt/17171.txt,chair,
2616623,171,17,0,Dr. Martin Lindner [Berlin] [FDP],Dr. Martin Lindner,martin-lindner,298,"Sehr gerne, Frau Präsidentin!",data/txt/17171.txt,poi,fdp
2616624,171,17,0,Vizepräsidentin Petra Pau,Petra Pau,petra-pau,299,- Das freut mich.,data/txt/17171.txt,chair,
2616625,171,17,0,Britta Haßelmann (BÜNDNIS 90/DIE GRÜNEN),Britta Haßelmann,britta-haßelmann,300,"Sehr geehrte Frau Präsidentin! Ich sehe, dass das Haus der Frauenministerin nicht vertreten ist. Wir sind natürlich konsterniert darüber, dass es die Ministerin nicht für nötig hält, an einer Debatte zum Thema Frauenquote teilzunehmen.",data/txt/17171.txt,speech,gruene
2616626,171,17,0,,,,301,"Beifall beim BÜNDNIS 90/DIE GRÜNEN, bei der SPD und der LINKEN",data/txt/17171.txt,poi,
2616627,171,17,0,Britta Haßelmann (BÜNDNIS 90/DIE GRÜNEN),Britta Haßelmann,britta-haßelmann,302,"Aber dass sie wirklich die Chuzpe besitzt, noch nicht einmal einen Staatssekretär zu schicken, halten wir für unerträglich. Deshalb bitte ich, jetzt sofort dafür Sorge zu tragen, dass dieses Haus erscheint.",data/txt/17171.txt,speech,gruene
2616628,171,17,0,,,,303,"Beifall beim BÜNDNIS 90/DIE GRÜNEN, bei der SPD und der LINKEN",data/txt/17171.txt,poi,
2616629,171,17,0,Jürgen Trittin [BÜNDNIS 90/DIE GRÜNEN],Jürgen Trittin,jurgen-trittin,304,Lieber Kues als Schröder!,data/txt/17171.txt,poi,gruene
2616630,171,17,0,Britta Haßelmann (BÜNDNIS 90/DIE GRÜNEN),Britta Haßelmann,britta-haßelmann,305,,data/txt/17171.txt,speech,gruene
2616631,171,17,0,Vizepräsidentin Petra Pau,Petra Pau,petra-pau,306,"Ich gehe davon aus, dass wir nicht das Haus, sondern eine Vertreterin oder einen Vertreter des Hauses um das Erscheinen bitten.",data/txt/17171.txt,chair,
2616632,171,17,0,Renate Künast [BÜNDNIS 90/DIE GRÜNEN],Renate Künast,renate-kunast,307,Gute Präzisierung!,data/txt/17171.txt,poi,gruene
2616633,171,17,0,Vizepräsidentin Petra Pau,Petra Pau,petra-pau,308,Deshalb frage ich erst einmal die Bundesregierung. - Der Herr Staatssekretär ist erschienen. Ist damit diesem Wunsch Rechnung getragen?,data/txt/17171.txt,chair,
2616634,171,17,0,Britta Haßelmann [BÜNDNIS 90/DIE GRÜNEN],Britta Haßelmann,britta-haßelmann,309,"Jetzt weiß ja die Öffentlichkeit, dass es die Ministerin nicht für nötig hält, zu kommen!",data/txt/17171.txt,poi,gruene
2616635,171,17,0,Gegenruf des Abg. Dr. Martin Lindner [Berlin] [FDP],Dr. Martin Lindner,martin-lindner,310,Die Millionen Zuschauer haben es registriert!,data/txt/17171.txt,poi,fdp
2616636,171,17,0,Manfred Grund [CDU/CSU],Manfred Grund,manfred-grund,311,Dann können wir ja die Veranstaltung abbrechen! Dann ist ja Ihr Ziel erfüllt!,data/txt/17171.txt,poi,cducsu
2616637,171,17,0,Vizepräsidentin Petra Pau,Petra Pau,petra-pau,312,"Das Ministerium ist jetzt vertreten.

Das Wort hat die Kollegin Renate Künast für die Fraktion Bündnis 90/Die Grünen.",data/txt/17171.txt,chair,
2616638,171,17,0,Renate Künast (BÜNDNIS 90/DIE GRÜNEN),Renate Künast,renate-kunast,313,"Frau Präsidentin! Meine Damen und Herren! Heute findet diese Aktuelle Stunde aufgrund eines peinlichen Anlasses statt, und der heißt: Blockadehaltung der Bundesregierung, speziell der Bundesministerin für Frauen, bei der Herstellung von Wettbewerbsfähigkeit für Deutschland.",data/txt/17171.txt,speech,gruene
2616639,171,17,0,,,,314,Beifall bei Abgeordneten des BÜNDNISSES 90/DIE GRÜNEN und der SPD,data/txt/17171.txt,poi,
2616640,171,17,0,Renate Künast (BÜNDNIS 90/DIE GRÜNEN),Renate Künast,renate-kunast,315,- Bitte.,data/txt/17171.txt,speech,gruene
2616641,171,17,0,Zuruf von der CDU/CSU,von der CDU/CSU,von-der-cdu-csu,316,Alle oder keiner!,data/txt/17171.txt,poi,cducsu
2616642,171,17,0,Renate Künast (BÜNDNIS 90/DIE GRÜNEN),Renate Künast,renate-kunast,317,"Wir stellen eines fest: Im Auswärtigen Amt analysiert ein Schreiben bestehende und drohende Wettbewerbsnachteile für deutsche Unternehmen. Warum? Weil deutsche Unternehmen im Führungsbereich durchgehend männlich sind - teilweise bis zu 100 Prozent -, können sie sich in Ländern, die Ausschreibungen an einen Frauenanteil in den Vorständen und Aufsichtsräten knüpfen, nicht bewerben. Die Feststellung lautet an dieser Stelle, dass viele Länder - zum Beispiel Frankreich, zum Beispiel Spanien und einige andere - längst vorgeschrieben haben, dass bei der Besetzung von Vorständen und Aufsichtsräten bis 2015 eine Frauenquote zu erreichen ist.",data/txt/17171.txt,speech,gruene
2616643,171,17,0,,,,318,Beifall beim BÜNDNIS 90/DIE GRÜNEN und bei der SPD,data/txt/17171.txt,poi,
2616644,171,17,0,Renate Künast (BÜNDNIS 90/DIE GRÜNEN),Renate Künast,renate-kunast,319,"Es gibt vier oder fünf Mitgliedstaaten der Europäischen Union, die das zumindest für die öffentlichen Unternehmen festgelegt haben. Deshalb muss ich eines festhalten: Schwarz-Gelb hat immer behauptet, die Koalition zu sein, die Regierung zu bilden, die die meiste Wirtschaftskompetenz hat. Ich sage Ihnen: Diese Behauptung ist nicht wahr.",data/txt/17171.txt,speech,gruene
2616645,171,17,0,,,,320,Beifall beim BÜNDNIS 90/DIE GRÜNEN und bei der SPD,data/txt/17171.txt,poi,
2616646,171,17,0,Renate Künast (BÜNDNIS 90/DIE GRÜNEN),Renate Künast,renate-kunast,321,"Wahr ist: Sie sorgen für wirtschaftliche Nachteile für Deutschland, und das ist schlecht für unser Land.

Aber es geht nicht nur um diese Ausschreibungen, an denen deutsche Unternehmen nicht teilnehmen können und für die sie nicht den Zuschlag bekommen. Vielmehr stelle ich fest: Sie machen das in allen Bereichen.",data/txt/17171.txt,speech,gruene
2616647,171,17,0,Miriam Gruß [FDP],Miriam Gruß,miriam-gruß,322,Was ist mit der Arbeitslosenquote in dieser Zeit?,data/txt/17171.txt,poi,fdp
2616648,171,17,0,Renate Künast (BÜNDNIS 90/DIE GRÜNEN),Renate Künast,renate-kunast,323,"Was die Innovationsfähigkeit der deutschen Wirtschaft, das Leben in einer Wissensgesellschaft angeht, wenn es darum geht, die Kreativszene zu unterstützen und neue Kommunikationstechnologien reinzuholen, tun Sie faktisch nichts. Bei der Frage der ökologischen Ausrichtung der Wirtschaft, dem sparsamen Umgang mit Rohstoffen und Energie, um wettbewerbsfähig zu sein, tun Sie faktisch nichts.

Bei der Frage, Fachkräfte nach Deutschland reinzuholen, geben Sie heute mit einer Regelung an, die besagt: Der Zuzug von Fachkräften ist ab einem Gehalt von 44 000 Euro möglich; in einigen Berufen ab einem Gehalt von 33 000 Euro. Meine Damen und Herren, das ist auch nicht viel mehr als nichts. Welcher Ingenieur, welche Ingenieurin bekommt denn diese 44 000 Euro oder jedenfalls mehr als 33 000 Euro?",data/txt/17171.txt,speech,gruene
2616649,171,17,0,,,,324,Beifall beim BÜNDNIS 90/DIE GRÜNEN sowie bei Abgeordneten der SPD,data/txt/17171.txt,poi,
2616650,171,17,0,Renate Künast (BÜNDNIS 90/DIE GRÜNEN),Renate Künast,renate-kunast,325,Zudem gibt es nur ein Aufenthaltsrecht für zwei Jahre.,data/txt/17171.txt,speech,gruene
2616651,171,17,0,Dr. Matthias Heider [CDU/CSU],Dr. Matthias Heider,matthias-heider,326,Thema!,data/txt/17171.txt,poi,cducsu
2616652,171,17,0,,,,327,Zuruf des Abg. Dr. Martin Lindner [Berlin] [FDP],data/txt/17171.txt,poi,
2616653,171,17,0,Renate Künast (BÜNDNIS 90/DIE GRÜNEN),Renate Künast,renate-kunast,328,"Welchen Mann oder, besser noch, welche Frau wollen Sie damit in dieses Land locken, Herr Lindner, dass man für zwei Jahre ein Aufenthaltsrecht in Deutschland bekommt?",data/txt/17171.txt,speech,gruene
2616654,171,17,0,Manfred Grund [CDU/CSU],Manfred Grund,manfred-grund,329,Das Thema reicht nicht mal für zwei Sätze!,data/txt/17171.txt,poi,cducsu
2616655,171,17,0,Renate Künast (BÜNDNIS 90/DIE GRÜNEN),Renate Künast,renate-kunast,330,"Wenn ich Frau im Ausland wäre, würde ich sagen: Angesichts dieser Regelung und wegen fehlender Frauenförderung bewerbe ich mich gleich woanders.",data/txt/17171.txt,speech,gruene
2616656,171,17,0,,,,331,Beifall beim BÜNDNIS 90/DIE GRÜNEN,data/txt/17171.txt,poi,
2616657,171,17,0,Dr. Martin Lindner [Berlin] [FDP],Dr. Martin Lindner,martin-lindner,332,In Saudi-Arabien!,data/txt/17171.txt,poi,fdp
2616658,171,17,0,Manfred Grund [CDU/CSU],Manfred Grund,manfred-grund,333,"Ich denke, wir haben eine Frauenquote!",data/txt/17171.txt,poi,cducsu
