id,sitzung,wahlperiode,in_writing,speaker,speaker_cleaned,speaker_fp,sequence,text,filename,type,speaker_party
2079283,179,17,0,,,,929,"Petra Crone (SPD):

Frau Präsidentin! Meine lieben Kollegen und Kolleginnen! Meine Damen und Herren! Etwa 20 000 ältere Menschen, aktiv, wissbegierig, engagiert, sind in der letzten Woche in Hamburg auf dem 10. Deutschen Se-niorentag gewesen. Da konnte man ein ganz riesiges -Potenzial des Alters erleben, ein äußerst positives Altersbild.",data/txt/17179.txt,speech,
2079284,179,17,0,,,,930,"Beifall bei Abgeordneten der SPD, der LINKEN und des BÜNDNISSES 90/DIE GRÜNEN",data/txt/17179.txt,poi,
2079285,179,17,0,,,,931,"Es sprühte nur so von Ideen und Tatkraft. Auch gab es wertvolle Impulse, zum Beispiel beim bürgerschaftlichen Engagement. Doch was machen Sie daraus, Frau Ministerin? Auf jede Frage antworten Sie mit einem Hinweis auf den Bundesfreiwilligendienst. In einigen Fällen mag das hinkommen, aber das ist nicht passgenau.

Ein richtiges Motto lautet: Einmal engagiert, immer engagiert. Ich fordere Sie auf, Frau Schröder: Sorgen Sie dafür, dass auch Jugendliche neben der Schule Zeit finden, sich zu engagieren - ohne Gegenleistung. Geben Sie ihnen eine Chance, sich im Ehrenamt zu üben.",data/txt/17179.txt,speech,
2079286,179,17,0,,,,932,Beifall bei der SPD,data/txt/17179.txt,poi,
2079287,179,17,0,,,,933,"Der Bundesfreiwilligendienst, Ihr Liebling, ist ein Vollzeitdienst, den nicht jeder und jede leisten kann. Frau Ministerin, Sie wollen sich mit dem bürgerschaftlichen Engagement profilieren. Warum behandeln Sie ausgerechnet die Freiwilligendienste aller Generationen so stiefmütterlich? Warum verhindern Sie nicht, dass Ihre Regierung die Kommunen immer weiter ausbluten lässt? Denn sie sind es doch, die passgenaue Angebote fördern.",data/txt/17179.txt,speech,
2079288,179,17,0,,,,934,Beifall bei der SPD,data/txt/17179.txt,poi,
2079289,179,17,0,Ewa Klamt [CDU/CSU],Ewa Klamt [CDU/CSU],ewa-klamt-cdu-csu,935,"Man muss sich fragen, in welchem Film man sich befindet!",data/txt/17179.txt,poi,cducsu
2079290,179,17,0,,,,936,"Egal ob jung oder älter, ob Schüler, Arbeitnehmer oder Rentner: Die Freiwilligkeit muss im Mittelpunkt stehen. Niemand soll das Gefühl haben, sich engagieren zu müssen. Unsere Aufgabe ist es, Lust darauf zu machen.

Der Deutsche Seniorentag hat aber auch sehr deutlich gemacht, dass es Themen gibt, die im Sechsten Altenbericht der Bundesregierung unterrepräsentiert sind und von Ihnen, Frau Ministerin, mehr oder weniger elegant umgangen werden.",data/txt/17179.txt,speech,
2079291,179,17,0,Dagmar Ziegler [SPD],Dagmar Ziegler [SPD],dagmar-ziegler-spd,937,Weniger elegant!,data/txt/17179.txt,poi,spd
2079292,179,17,0,Caren Marks [SPD],Caren Marks [SPD],caren-marks-spd,938,Eher weniger!,data/txt/17179.txt,poi,spd
2079293,179,17,0,,,,939,"Das Thema Altersarmut ist eines der dringendsten Generationenprobleme. Es betrifft nicht nur die Älteren, die schon im Ruhestand sind, sondern genauso auch unsere Kinder und Enkel. Die brauchen gute Vorbilder und das Gefühl, dass Arbeit sich lohnt und mit einer Vollzeitstelle der Lebensunterhalt gedeckt werden kann. Es ist doch beschämend für unser reiches Land, dass dies nicht gewährleistet ist.",data/txt/17179.txt,speech,
2079294,179,17,0,,,,940,Beifall bei der SPD sowie bei Abgeordneten des BÜNDNISSES 90/DIE GRÜNEN,data/txt/17179.txt,poi,
2079295,179,17,0,,,,941,"Liebe Kollegen und Kolleginnen der Regierungsfraktion, von Ihnen wird dagegen nichts unternommen.",data/txt/17179.txt,speech,
2079296,179,17,0,Jens Ackermann [FDP],Jens Ackermann [FDP],jens-ackermann-fdp,942,Der Bundesrat kann doch zustimmen!,data/txt/17179.txt,poi,fdp
2079297,179,17,0,,,,943,"Das Übel muss doch an der Wurzel gepackt werden. Ist Ihre Antwort darauf die Einführung des Betreuungsgeldes?

Was wir dringend brauchen, sind flächendeckende Mindestlöhne,",data/txt/17179.txt,speech,
2079298,179,17,0,,,,944,Beifall bei der SPD sowie bei Abgeordneten der LINKEN,data/txt/17179.txt,poi,
2079299,179,17,0,,,,945,"eine höhere Beschäftigungsquote vor allen Dingen für Frauen, mehr Kinderbetreuung in den Regionen und vieles mehr.",data/txt/17179.txt,speech,
2079300,179,17,0,Ingrid Fischbach [CDU/CSU],Ingrid Fischbach [CDU/CSU],ingrid-fischbach-cdu-csu,946,Dann können wir auch die Kitaplätze in NRW nehmen! Darüber können wir auch sprechen! Wir haben Zahlen auf Lager!,data/txt/17179.txt,poi,cducsu
2079301,179,17,0,,,,947,"Liebe Kollegen und Kolleginnen von der Linksfraktion, in Ihrem Antrag sind einige interessante Forderungen enthalten, die wir zum Teil auch unterstützen können. Aber ich vermisse bei Ihnen den konkreten Bezug zum Sechsten Altenbericht. Ihr Entschließungsantrag - es ist immerhin ein Entschließungsantrag - ist vielmehr eine Zusammenfassung von seniorenpolitischen Zielen.

Die generelle Kritik am Altenbericht kann ich nicht nachvollziehen. Sie sprechen ihm gar die Substanz ab. In einem ähnlichen Maße, in dem Sie der Bundesregierung und den Sachverständigen die Ökonomisierung der Altersbilder vorwerfen, zeichnen Sie ein umfassendes negatives Altersbild, geleitet vom sozialen Abstieg. Das ist genauso falsch.

Liebe Kollegen und Kolleginnen, zum Schluss möchte ich den regelrechten Hype um die stets fitten Senioren und Seniorinnen kritisieren. Es ist natürlich schön und ein tolles Ergebnis, dass wir alle älter werden und immer länger gesund bleiben. Die Altersbilder insgesamt sollen positiver werden. Aber Achtung: Wir dürfen sie auch nicht mit Kitsch überlagern. Damit werden nur Ängste vor Hilfs- und Pflegebedürftigkeit und auch vor dem Sterben geschürt. Das darf nicht sein.",data/txt/17179.txt,speech,
2079302,179,17,0,,,,948,Beifall bei der SPD sowie bei Abgeordneten des BÜNDNISSES 90/DIE GRÜNEN,data/txt/17179.txt,poi,
2079303,179,17,0,,,,949,"Jeder und jede muss wissen, dass wir uns um eine würdevolle Betreuung, Pflege und auch um Sterbebegleitung kümmern. Dafür hat die SPD-Bundestagsfraktion ein umfassendes Konzept erarbeitet.

Das Thema Demenz hat in Zukunft eine sehr große Wichtigkeit. Wo bleiben da die Taten der schwarz-gelben Regierung? Reförmchen des Ministers Bahr helfen nicht weiter.",data/txt/17179.txt,speech,
2079304,179,17,0,Jens Ackermann [FDP],Jens Ackermann [FDP],jens-ackermann-fdp,950,Das ist ja unerhört! Was haben Sie denn da gemacht?,data/txt/17179.txt,poi,fdp
2079305,179,17,0,,,,951,"Bei all dem ist das Miteinander der Generationen entscheidend, in der Gesellschaft und in der Politik, solidarisch und verantwortungsvoll. Für die SPD-Bundestagsfraktion ist Teilhabe kein leeres Wort. Sie beinhaltet zwei Forderungen: das Recht auf Bildung für jedes Alter und die Förderung von Freiwilligenengagement von und für alle Generationen.

Ich danke Ihnen.",data/txt/17179.txt,speech,
2079306,179,17,0,,,,952,Beifall bei der SPD sowie bei Abgeordneten des BÜNDNISSES 90/DIE GRÜNEN,data/txt/17179.txt,poi,
2079307,179,17,0,,,,953,"Vizepräsidentin Katrin Göring-Eckardt:

Das Wort hat die Kollegin Sibylle Laurischk für die FDP-Fraktion.",data/txt/17179.txt,speech,
2079308,179,17,0,,,,954,Beifall bei der FDP sowie bei Abgeordneten der CDU/CSU,data/txt/17179.txt,poi,
2079309,179,17,0,,,,955,"Sibylle Laurischk (FDP):

Frau Präsidentin! Meine Damen und Herren! Heute Morgen war ich kurz zu Gast bei einer Seniorenorganisation einer Gewerkschaft. Was ich dort mitgenommen habe, ist die Klage, dass die ältere Generation innerhalb der Gewerkschaft nicht mehr voll mitwirkungsberechtigt ist. Es gibt also durchaus Felder im traditionell eher linken politischen Bereich, bei denen man sich überlegen muss, ob man das richtige Augenmaß hat.",data/txt/17179.txt,speech,
2079310,179,17,0,,,,956,Beifall bei der FDP,data/txt/17179.txt,poi,
2079311,179,17,0,Paul Lehrieder [CDU/CSU],Paul Lehrieder [CDU/CSU],paul-lehrieder-cdu-csu,957,So ist es! In Schleswig-Holstein haben sie es schon gemerkt!,data/txt/17179.txt,poi,cducsu
2079312,179,17,0,,,,958,"So viel als Randbemerkung zu dem, was ich an einem Tag in Berlin im Rahmen meiner Abgeordnetentätigkeit mitnehme.

Der Sechste Altenbericht ist ein Wegweiser für uns alle; denn er zeigt auf, dass nicht mehr die Belastungen des Alters das ausschließliche Thema, das man mit dem Alter verbindet, sein sollen, sondern dass auch die Chancen einer alternden Gesellschaft begriffen und genutzt werden müssen. Frau Scharfenberg, ich habe Ihren Redebeitrag sehr genau verfolgt und halte es für völlig verfehlt, nur darauf zu setzen, dass wir in Berlin es schon regeln werden. Da sind wir in der Bundesrepublik Deutschland insgesamt, in den verschiedenen Ländern und Kommunen, schon sehr viel weiter.",data/txt/17179.txt,speech,
2079313,179,17,0,,,,959,Beifall bei der FDP sowie bei Abgeordneten der CDU/CSU,data/txt/17179.txt,poi,
2079314,179,17,0,,,,960,"Ich komme aus der Kommunalpolitik. Als ich vor 18 Jahren frischgebackene Stadträtin war, haben wir in Offenburg ein Seniorenbüro eingerichtet. Das war sozusagen eine Freiwilligenagentur. Damals nannte man das noch nicht so, aber nichts anderes war es. Es war ein Experiment, damals auch vom Bund gefördert. Es ist ein Knüller geworden. Mittlerweile gibt es dort eine Selbstorganisation von älteren Menschen, die das soziale Gefüge, den Alltag und das Miteinander der Stadt auf eine ganz interessante Weise prägen. Auch wenn die Menschen nicht mehr im Berufsleben stehen, sagen sie ganz klar: Wir spielen eine Rolle. Wir sind wichtig; wir sind dabei. Wir sind nicht ausgegrenzt. - Das ist für das Klima in einer Kommune ganz wichtig.",data/txt/17179.txt,speech,
2079315,179,17,0,,,,961,Beifall bei der FDP und der CDU/CSU,data/txt/17179.txt,poi,
2079316,179,17,0,,,,962,"Ein Beispiel für die konkreten Tätigkeiten der dort lebenden Senioren: Sie arbeiten mit ausländischen Studenten an der Fachhochschule zusammen und bieten ihnen an, als Wegweiser in der Stadt zu fungieren und Behördengänge zu erledigen. Dadurch haben die Senioren Kontakt zu Menschen, die aus ganz anderen Lebensverhältnissen stammen. Das ist sehr belebend und hochinteressant.

Eine ähnliche Entwicklung gibt es in der Gemeinde Eichstetten am Kaiserstuhl. Die hier betriebene engagierte Kommunalpolitik trägt der Situation der Alten vor Ort Rechnung und sorgt dafür, dass sie sich sowohl in der Pflege als auch im bürgerschaftlichen Engagement wiederfinden, mitarbeiten und ein Austausch stattfindet. Niemand muss den Ort aus Altersgründen oder wegen Pflegebedürftigkeit verlassen. Jeder kann bleiben.

Damit sind wir bei einem ganz wesentlichen Thema, das mir in dieser Debatte völlig fehlt. Viele Menschen leben im Alter alleine. Die Familien ziehen weg. Die Kinder sind berufsbedingt ganz woanders. Die Familien sind nicht mehr so eng beieinander. Unter Umständen bleibt man im Alter allein. Die Angst vor dem Alleinsein ist ein wichtiges Thema, dem wir uns widmen müssen. Mir persönlich ist wichtig, neue Wohnformen im Alter zu entwickeln. Diesem Thema widmet man sich mittlerweile auch im Rahmen des bürgerschaftlichen Engagements. Ich kenne etliche Vereine, die dieses Thema in den jeweiligen Kommunen vorantreiben wollen. Es geht nicht allein um Wohngemeinschaften, sondern auch um ein Miteinander, ein vernetztes Wohnen. Nicht alleine und vereinzelt zu sein, das ist wichtig, damit wir auch im Alter den Austausch haben, um fit zu bleiben, uns gegenseitig zu unterstützen, eventuell einer Pflegebedürftigkeit vorzubeugen, gemeinsames Lernen zu organisieren - denn auch das hält jung - sowie letztendlich ein Miteinander in positiver Stimmung - ich habe leider viel zu wenig Zeit, um das weiter auszuführen - zu gestalten und das Lachen nicht zu verlernen. So bleiben wir jung.",data/txt/17179.txt,speech,
2079317,179,17,0,,,,963,Beifall bei der FDP und der CDU/CSU,data/txt/17179.txt,poi,
2079318,179,17,0,,,,964,"Vizepräsidentin Katrin Göring-Eckardt:

Die Bundesministerin Dr. Kristina Schröder hat jetzt das Wort.",data/txt/17179.txt,speech,
2079319,179,17,0,,,,965,Beifall bei der CDU/CSU und der FDP,data/txt/17179.txt,poi,
2079320,179,17,0,,,,966,"Dr. Kristina Schröder, Bundesministerin für Familie, Senioren, Frauen und Jugend:

Frau Präsidentin! Liebe Kolleginnen und Kollegen! Das Alter ist vielfältiger und facettenreicher geworden. Der Sechste Altenbericht, für den ich der Sachverständigenkommission unter dem Vorsitz von Professor Dr. Andreas Kruse ganz herzlich danke, fordert uns dazu auf, die Seniorenpolitik auf die Vielfalt des Alters auszurichten. Er stellt dabei die Chancen, die der demografische Wandel bietet, in den Mittelpunkt.

Man muss sich bewusst machen: Wir haben es mit einer historisch neuen Lebensphase zu tun. Jahrtausendelang war das Leben des Menschen im Grunde durch drei Lebensphasen bestimmt: Da war die Kindheit und die Jugend als erste Lebensphase, dann kam die Zeit der Berufstätigkeit und des Kümmerns um die Familie, und dann kam das Alter; aber das war ganz schnell von Krankheit und Gebrechen geprägt. Als Bismarck die Rentenversicherung eingeführt hat, lag die Lebens-arbeitszeitgrenze bei 70 Jahren, die durchschnittliche Lebenserwartung lag bei unter 60 Jahren. Die Phase, die wir das junge Alter nennen, also die Lebensphase zwischen 65 und 85 Jahren, ist etwas Neues, das es in der Geschichte der Menschheit so noch nicht gab. Die meisten Menschen erreichen glücklicherweise gesundheitlich relativ fit ein hohes Alter und haben sich viel Erfahrung, Wissen und Gelassenheit angeeignet, die ein langes Leben schenkt. Das ist ein riesiger Schatz für unsere Gesellschaft. Wir stehen noch am Anfang bei dem Versuch, diesen Schatz zu heben.",data/txt/17179.txt,speech,
2079321,179,17,0,,,,967,Beifall bei der CDU/CSU sowie bei Abgeordneten der FDP,data/txt/17179.txt,poi,
2079322,179,17,0,,,,968,"Deshalb - das unterstreicht der Antrag der Koalitionsfraktionen -: Wir brauchen die Erfahrung und die Tatkraft älterer Menschen in der Familie, in der Arbeitswelt und im Ehrenamt. Schauen wir einmal in die Familie. Die meisten Menschen erleben doch, dass der Zusammenhalt in den Familien, insbesondere der Zusammenhalt zwischen den Generationen, riesengroß ist, trotz Scheidungen und trotz Mobilität. Letzteres gibt es, aber dennoch: Wenn es darauf ankommt, dann halten in den meisten Fällen die Generationen zusammen.",data/txt/17179.txt,speech,
2079323,179,17,0,,,,969,Beifall bei der CDU/CSU sowie bei Abgeordneten der FDP,data/txt/17179.txt,poi,
2079324,179,17,0,,,,970,Zum Beispiel spielen die Großeltern eine riesige Rolle bei der Betreuung der Enkelkinder und damit auch bei der Vereinbarkeit von Familie und Beruf der mittleren Generation.,data/txt/17179.txt,speech,
2079325,179,17,0,,,,971,Zuruf von der SPD,data/txt/17179.txt,poi,
2079326,179,17,0,,,,972,- Krippen können keine Großeltern ersetzen. Das ist nun einmal nicht so einfach.,data/txt/17179.txt,speech,
2079327,179,17,0,,,,973,Beifall bei Abgeordneten der CDU/CSU und der FDP,data/txt/17179.txt,poi,
2079328,179,17,0,,,,974,"Deshalb wollen wir den Zusammenhalt in den Familien durch die Einführung einer Großelternzeit stärken. Wir wollen auch berufstätigen Großeltern die Möglichkeit geben, sich um die Betreuung der Enkel zu kümmern.

Umgekehrt: Zwei Drittel der 2,3 Millionen pflegebedürftigen Menschen in Deutschland werden zu Hause in ihren Familien gepflegt. Sie werden vom Partner und den eigenen Kindern gepflegt. Deshalb haben wir mit der Einführung der Familienpflegezeit zum 1. Januar 2012 die Familie als Verantwortungsgemeinschaft gestärkt.",data/txt/17179.txt,speech,
2079329,179,17,0,,,,975,Beifall bei der CDU/CSU sowie bei Abgeordneten der FDP,data/txt/17179.txt,poi,
2079330,179,17,0,,,,976,"Ein weiterer Punkt. Der Bundesfreiwilligendienst ist ein riesiger Erfolg. Was gab es doch für Katastrophen-szenarien und Skepsis? Jetzt stellen wir fest: Fast 20 Prozent der Bufdis, die wir in Deutschland haben, sind über 50 Jahre alt. Der Schreinermeister im Ruhestand geht in die Kitas und Kindergärten und baut mit den Kindern Vogelhäuser, die pensionierte Grundschullehrerin kümmert sich um Kinder mit Migrationshintergrund und hilft ihnen bei den Hausaufgaben. Das ist ein Riesengewinn für unsere Gesellschaft.",data/txt/17179.txt,speech,
2079331,179,17,0,,,,977,Beifall bei der CDU/CSU und der FDP,data/txt/17179.txt,poi,
2079332,179,17,0,,,,978,"Wir sollten uns aber dessen bewusst sein - da bin ich bei Ihnen, Frau Crone -, dass es in der Seniorenpolitik nicht nur um die Generation 60 plus geht; denn die Alten von morgen sind die Jungen von heute. Deshalb brauchen wir eine vorsorgende Seniorenpolitik, zum Beispiel auch, wenn es um die Folgen familienbedingter Auszeiten und Teilzeitphasen im Beruf geht. Dafür zahlen im Rentenalter insbesondere die Frauen. Ihre Alterseinkommen liegen im Moment rund 60 Prozent unter denen der Männer.

Deswegen heißt vorsorgende Seniorenpolitik auch, bei den Ursachen dafür anzusetzen, die früher im Leben liegen.",data/txt/17179.txt,speech,
2079333,179,17,0,Elisabeth Scharfenberg [BÜNDNIS 90/DIE GRÜNEN],Elisabeth Scharfenberg [BÜNDNIS 90/DIE GRÜNEN],elisabeth-scharfenberg-bundnis-90-die-grunen,979,Da bin ich gespannt!,data/txt/17179.txt,poi,gruene
2079334,179,17,0,,,,980,Ich mache mir zum Beispiel Sorgen über das Ausufern von Minijobs.,data/txt/17179.txt,speech,
2079335,179,17,0,,,,981,Beifall der Abg. Ingrid Fischbach [CDU/CSU],data/txt/17179.txt,poi,
2079336,179,17,0,,,,982,"Für Studenten und Rentner haben Minijobs ihre Berechtigung, aber für Mütter entwickeln sie sich oft zu einer Sackgasse, die zu Altersarmut führt. Deshalb halte ich auch nichts davon, dem Drängen der Arbeitgeber nachzugeben, die nach einer weiteren Flexibilisierung rufen. Wir müssen hier sehr genau gucken, welche Anreize wir setzen.",data/txt/17179.txt,speech,
2079337,179,17,0,,,,983,Beifall bei der CDU/CSU,data/txt/17179.txt,poi,
2079338,179,17,0,,,,984,"Auch im Arbeitsrecht gibt es Regelungen, für die Frauen erst mit schlechteren beruflichen Chancen, dann mit schlechteren Einkommen und schließlich mit niedrigeren Renten bezahlen. Deshalb brauchen wir zum Beispiel endlich mehr Möglichkeiten, flexibel zwischen Vollzeit und Teilzeit, insbesondere auch von Teilzeit wieder in Vollzeit, zu wechseln. Das sind Beispiele für eine vorsorgende Politik für die Lebensphase Alter.

Beides gehört in der Seniorenpolitik zusammen: eine Politik, die die Vielfalt des Alters berücksichtigt, und eine Politik, die die Vielfalt des Älterwerdens berücksichtigt. Da ist es ein bisschen wie mit der gesundheitsbewussten Lebensweise: Man muss früh damit anfangen. Auch daran sollten wir denken, wenn es um Teilhabechancen für ältere Menschen geht.",data/txt/17179.txt,speech,
2079339,179,17,0,,,,985,Beifall bei der CDU/CSU und der FDP,data/txt/17179.txt,poi,
2079340,179,17,0,,,,986,"Vizepräsidentin Katrin Göring-Eckardt:

Jetzt hat Sabine Bätzing-Lichtenthäler das Wort für die SPD-Fraktion.",data/txt/17179.txt,speech,
2079341,179,17,0,,,,987,Beifall bei der SPD,data/txt/17179.txt,poi,
2079342,179,17,0,,,,988,"Sabine Bätzing-Lichtenthäler (SPD):

Vielen Dank. - Sehr geehrte Frau Präsidentin! Liebe Kolleginnen und Kollegen! Frau Ministerin, vielleicht hätten Sie weniger Bücher und dafür mehr Gesetzentwürfe für eine bessere Politik für ältere Menschen schreiben sollen.",data/txt/17179.txt,speech,
2079343,179,17,0,,,,989,Beifall bei der SPD,data/txt/17179.txt,poi,
2079344,179,17,0,Zurufe von der FDP,e von der FDP,e-fdp,990,Oh!,data/txt/17179.txt,poi,fdp
2079345,179,17,0,,,,991,"Denn zu dem, was uns hier vorliegt, muss man wohl sagen: Fehlanzeige! Auch beim Thema Alter klaffen Wunsch und Wirklichkeit in der Koalition wieder einmal auseinander.

So habe ich im schwarz-gelben Koalitionsvertrag zu diesem Thema drei konkrete Vorhaben für diese Legislaturperiode gefunden, erstens eine breit angelegte Initiative zum Thema Alter neu denken. - Okay. Nur, was haben wir bekommen? Bekommen haben wir das Programm Altersbilder, mitnichten eine breite Initiative und mitnichten neues Denken. Zweitens ist da die Innovationspartnerschaft Gesundheit im Alter. Was haben wir bekommen? Ein Pflegereförmchen. Drittens wurde das Gesetz zur Förderung des bürgerschaftlichen Engagements angekündigt. Davon ist weit und breit überhaupt nichts zu sehen.

Dieses Vorgehen erinnert mich an das Motto: Vorwärts, liebe Freunde, wir gehen zurück! - Damit ist keine gute Politik für ältere Menschen zu schaffen.",data/txt/17179.txt,speech,
2079346,179,17,0,,,,992,Beifall bei Abgeordneten der SPD,data/txt/17179.txt,poi,
2079347,179,17,0,,,,993,"Das einzige, was man findet, sind Plagiate, wie etwa Ihr Antrag zu den Potenzialen des Alters. Es ist nicht das erste Mal, dass Sie damit auffallen.

Liebe Kolleginnen und Kollegen, lassen Sie uns aber über die Potenziale des Alters und die neuen Altersbilder sprechen. Lebenserfahrung, Berufserfahrung und erworbene Kompetenzen, das sind die Potenziale älterer Menschen. Potenziale fallen aber niemandem in den Schoß, Potenziale sind erarbeitet, und man muss sie wecken, fördern, hegen und pflegen. Gleichzeitig darf man sie aber auch nicht überstrapazieren. Denn ältere Menschen wollen zwar weiterhin gebraucht, aber nicht missbraucht oder aufgebraucht werden.",data/txt/17179.txt,speech,
2079348,179,17,0,,,,994,Beifall bei Abgeordneten der SPD,data/txt/17179.txt,poi,
2079349,179,17,0,Paul Lehrieder [CDU/CSU],Paul Lehrieder [CDU/CSU],paul-lehrieder-cdu-csu,995,Das wissen wir!,data/txt/17179.txt,poi,cducsu
2079350,179,17,0,,,,996,"Für uns bedeutet das erstens: Bürgerschaftliches Engagement ist und bleibt freiwillig und lässt Kreativitäts- und Handlungsspielräume für die Helfer. Zweitens setzt bürgerschaftliches Engagement eine soziale Absicherung voraus, das heißt gute Renten basierend auf guten Löhnen, abgesichert durch einen echten Mindestlohn.",data/txt/17179.txt,speech,
2079351,179,17,0,,,,997,Beifall bei Abgeordneten der SPD,data/txt/17179.txt,poi,
2079352,179,17,0,,,,998,"Drittens setzt bürgerschaftliches Engagement Zeit voraus. Das heißt weniger Zeitdruck für Schülerinnen und Schüler, Berufsanfänger und Eltern sowie kreative Ideen für Zeitspenden von älteren Menschen.

Viertens hilft bürgerschaftliches Engagement gegen Einsamkeit. Das heißt, wir dürfen Kranke und ältere Menschen mit ihren Sorgen und Hoffnungen nicht allein lassen. Das hilft Helfern und Geholfenen und ist Markenzeichen für eine soziale Gesellschaft. Deswegen brauchen wir soziale Netzwerke und dürfen diese wie zum Beispiel das Programm Soziale Stadt nicht kaputtsparen. Aber auch da haben wir keinen Widerspruch von der zuständigen Ministerin gehört.",data/txt/17179.txt,speech,
2079353,179,17,0,,,,999,Beifall bei der SPD und dem BÜNDNIS 90/DIE GRÜNEN,data/txt/17179.txt,poi,
2079354,179,17,0,Caren Marks [SPD],Caren Marks [SPD],caren-marks-spd,1000,"Das kennt sie wahrscheinlich gar nicht! Das ist das erste Mal, dass sie davon gehört hat!",data/txt/17179.txt,poi,spd
2079355,179,17,0,,,,1001,"Schließlich fünftens. Bürgerschaftliches Engagement verdient Respekt und Anerkennung. Da sind wir uns, glaube ich, hier im Haus alle einig.

Die Organisation von freiwilligem Engagement vor Ort zur Erschließung der Potenziale ist aber alles andere als ein Selbstläufer. Dafür müssen wir vor allem die Zugänge organisieren. Gebraucht werden Information, Beratung und Vernetzung. Dafür muss selbstverständlich auch Geld in die Hand genommen werden. Da es um einen gesamtgesellschaftlichen Gewinn geht, muss auch klar sein, dass Kommunen, Länder und Bund gemeinsam gefragt sind.

So wie es ein Miteinander in der Politik geben muss, um die Potenziale des Alters auszuschöpfen, so braucht es auch ein Miteinander der Generationen, damit sich diese Potenziale entfalten können.

Gerade älteren Menschen liegt das besonders am Herzen. Ein besseres Miteinander der Generationen könnte dazu beitragen, Zeitdruck von jüngeren Menschen zu nehmen und älteren Menschen neue Betätigungsfelder zu geben. Die Potenziale des Alters kämen hier wunderbar zum Tragen, etwa durch verschiedene Patenschaften in Schule, Familie oder Wohnumfeld.

Meine Kolleginnen und Kollegen, es kommt nicht darauf an, wie alt wir werden, sondern wie wir alt werden. Deshalb lassen Sie uns die Potenziale des Alters erschließen. Ihre Vorhaben im Koalitionsvertrag ließen Hoffnung aufkeimen, in der Realpolitik wurde diese jedoch jäh zerstört.

Meine Damen und Herren, Frau Ministerin, liefern Sie endlich!

Danke schön.",data/txt/17179.txt,speech,
2079356,179,17,0,,,,1002,Beifall bei der SPD und dem BÜNDNIS 90/DIE GRÜNEN,data/txt/17179.txt,poi,
2079357,179,17,0,Ingrid Fischbach [CDU/CSU],Ingrid Fischbach [CDU/CSU],ingrid-fischbach-cdu-csu,1003,Das war ein Plagiat!,data/txt/17179.txt,poi,cducsu
2079358,179,17,0,,,,1004,"Vizepräsidentin Katrin Göring-Eckardt:

Paul Lehrieder hat jetzt das Wort für die CDU/CSU-Fraktion.",data/txt/17179.txt,speech,
2079359,179,17,0,,,,1005,Beifall bei der CDU/CSU und der FDP,data/txt/17179.txt,poi,
2079360,179,17,0,,,,1006,"Paul Lehrieder (CDU/CSU):

Sehr geehrte Frau Präsidentin! Liebe Kolleginnen! Liebe Kollegen! Ich darf zunächst meiner Freude darüber Ausdruck verleihen, dass die Frauenquote im Präsidium des Bundestages heute in herausragender Weise erfüllt ist.",data/txt/17179.txt,speech,
2079361,179,17,0,,,,1007,Beifall bei der CDU/CSU und der FDP sowie bei Abgeordneten der LINKEN,data/txt/17179.txt,poi,
