id,sitzung,wahlperiode,in_writing,speaker,speaker_cleaned,speaker_fp,sequence,text,filename,type,speaker_party
2616737,171,17,0,Jörg von Polheim (FDP),Jörg von Polheim,jorg-polheim,412,"Herzlichen Glückwunsch zu der Einsicht, dass die Politik der Wirtschaft sogar helfen kann, auch wenn dies im aktuellen Fall gar nicht nötig ist.

Mit dieser Aktuellen Stunde möchten Sie skandalisieren, dass sich deutsche Unternehmen, wollen sie an Ausschreibungen im Ausland teilnehmen, an die Gesetze des jeweiligen Landes halten müssen.",data/txt/17171.txt,speech,fdp
2616738,171,17,0,Jürgen Trittin [BÜNDNIS 90/DIE GRÜNEN],Jürgen Trittin,jurgen-trittin,413,"Ja, aber wollen Sie jetzt sagen, dass der Herr Westerwelle unrecht hat? Das fördert das Auswärtige Amt! Ihr Außenminister, Herr Kollege! Ich bin erschüttert! Hat der Westerwelle gar nichts mehr zu sagen?",data/txt/17171.txt,poi,gruene
2616739,171,17,0,Jörg von Polheim (FDP),Jörg von Polheim,jorg-polheim,414,"- Hören Sie doch einfach mal zu, dann wird es einfacher. - Daraus einen Vorwurf an die Bundesregierung zu kon-struieren, zeugt von einer Chuzpe, die wiederum zu Ihrer sonstigen Wirtschaftspolitik passt. Die FDP-Fraktion weist die immer bizarrer werdenden Belehrungen von EU-Kommissarin Viviane Reding wegen einer angeblich fehlenden Frauenquote in Deutschland zurück. Die Unterstellung, dass deutsche Unternehmen wegen einer fehlenden Quote keine Aufträge mehr erhalten, ist unnötige Panikmache. Das sollte Frau Reding wissen, und Sie, meine Damen und Herren von den Grünen, auch. Dieser Anwurf dient nur dazu, die Bundesfrauenministerin Kristina Schröder plump unter Druck zu setzen.",data/txt/17171.txt,speech,fdp
2616740,171,17,0,Zurufe von der SPD und dem BÜNDNIS 90/DIE GRÜNEN,e von der SPD und dem BÜNDNIS 90/DIE GRÜNEN,e-spd-und-dem-bundnis-90-die-grunen,415,Oh!,data/txt/17171.txt,poi,gruene:spd
2616741,171,17,0,Jürgen Trittin [BÜNDNIS 90/DIE GRÜNEN],Jürgen Trittin,jurgen-trittin,416,"Nee, das müssen wir nicht mehr! Das ist vorbei!",data/txt/17171.txt,poi,gruene
2616742,171,17,0,Renate Künast [BÜNDNIS 90/DIE GRÜNEN],Renate Künast,renate-kunast,417,"Wie soll denn das gehen, Herr Polheim?",data/txt/17171.txt,poi,gruene
2616743,171,17,0,Jörg von Polheim (FDP),Jörg von Polheim,jorg-polheim,418,Wir Liberalen im Bundestag unterstützen die Ministerin in ihrer Auffassung,data/txt/17171.txt,speech,fdp
2616744,171,17,0,,,,419,Zurufe vom BÜNDNIS 90/DIE GRÜNEN,data/txt/17171.txt,poi,
2616745,171,17,0,Jörg von Polheim (FDP),Jörg von Polheim,jorg-polheim,420,"- einfach einmal ausreden lassen; dann wird es einfacher -, dass die Europäische Kommission der Bundesrepublik keine Quote vorschreiben kann.",data/txt/17171.txt,speech,fdp
2616746,171,17,0,Renate Künast [BÜNDNIS 90/DIE GRÜNEN],Renate Künast,renate-kunast,421,Aber die Spanier!,data/txt/17171.txt,poi,gruene
2616747,171,17,0,Jörg von Polheim (FDP),Jörg von Polheim,jorg-polheim,422,"Im Übrigen ist es längst nicht sicher, ob derart marktabschottende Ausschreibungsbedingungen mit EU-Recht vereinbar sind. Die Bundesregierung prüft das und wird gegebenenfalls Schritte einleiten, sollte sich herausstellen, dass diese Rahmenbedingungen gegen EU-Recht verstoßen. Denn dann gilt es, sich wirklich für die deutsche Wirtschaft einzusetzen, und zwar nicht nur polemisch, wie Sie, meine Damen und Herren der Grünen, es tun.

Zur Klarstellung. Derzeit dürfen EU-Partnerländer, in denen eine nationalgesetzliche Frauenquote existiert, deutsche Firmen bei öffentlichen Ausschreibungen wegen der Nichteinhaltung dieser Frauenquote nicht benachteiligen. Derartige Fälle sind auch nicht bekannt - Quelle: DIHK.",data/txt/17171.txt,speech,fdp
2616748,171,17,0,,,,423,Beifall bei der FDP sowie bei Abgeordneten der CDU/CSU,data/txt/17171.txt,poi,
2616749,171,17,0,Zuruf von der FDP,von der FDP,von-der-fdp,424,So ist es!,data/txt/17171.txt,poi,fdp
2616750,171,17,0,Jörg von Polheim (FDP),Jörg von Polheim,jorg-polheim,425,"Durch das EU-Vergaberecht erübrigt sich eine gesetzlich vorgeschriebene deutsche Frauenquote ohnehin. Es liegt im Verantwortungsbereich der einzelnen Unternehmen, sich so aufzustellen, dass sie die Vorgaben erfüllen, um nicht von Ausschreibungen in Spanien oder Frankreich ausgeschlossen zu werden. Die FDP-Fraktion lehnt weiterhin eine Quote ab, weil wir damit nur an Symptomen herumdoktern.",data/txt/17171.txt,speech,fdp
2616751,171,17,0,,,,426,Beifall bei Abgeordneten der FDP,data/txt/17171.txt,poi,
2616752,171,17,0,Renate Künast [BÜNDNIS 90/DIE GRÜNEN],Renate Künast,renate-kunast,427,-Tosender Applaus bei der gesamten FDP--Fraktion!,data/txt/17171.txt,poi,gruene
2616753,171,17,0,Jörg von Polheim (FDP),Jörg von Polheim,jorg-polheim,428,"Wir wollen keine Fehlentwicklungen wie in Norwegen, wo die Quote lediglich dafür gesorgt hat, dass die -gleichen Frauen in mehr Aufsichtsräten sitzen. Goldene Röcke helfen niemandem.",data/txt/17171.txt,speech,fdp
2616754,171,17,0,Renate Künast [BÜNDNIS 90/DIE GRÜNEN],Renate Künast,renate-kunast,429,Was? Goldene Röcke?,data/txt/17171.txt,poi,gruene
2616755,171,17,0,,,,430,Weitere Zurufe von der SPD und dem BÜNDNIS 90/DIE GRÜNEN,data/txt/17171.txt,poi,
2616756,171,17,0,Jörg von Polheim (FDP),Jörg von Polheim,jorg-polheim,431,"- Goldene Röcke, ja. Erkundigen Sie sich einmal!",data/txt/17171.txt,speech,fdp
2616757,171,17,0,Britta Haßelmann [BÜNDNIS 90/DIE GRÜNEN],Britta Haßelmann,britta-haßelmann,432,Jetzt geht es aber los!,data/txt/17171.txt,poi,gruene
2616758,171,17,0,Ingo Egloff [SPD],Ingo Egloff,ingo-egloff,433,Wer hat denn die ganzen Aufsichtsratsmandate?,data/txt/17171.txt,poi,spd
2616759,171,17,0,Jörg von Polheim (FDP),Jörg von Polheim,jorg-polheim,434,- Ich nicht.,data/txt/17171.txt,speech,fdp
2616760,171,17,0,Britta Haßelmann [BÜNDNIS 90/DIE GRÜNEN],Britta Haßelmann,britta-haßelmann,435,Ich würde mich für Sie fremdschämen!,data/txt/17171.txt,poi,gruene
2616761,171,17,0,Dr. Eva Högl [SPD],Dr. Eva Högl,eva-hogl,436,Da könnten auch die Frauen aus der FDP mal was sagen!,data/txt/17171.txt,poi,spd
2616762,171,17,0,Jörg von Polheim (FDP),Jörg von Polheim,jorg-polheim,437,"Ich möchte an dieser Stelle nicht wieder alle sozial-politischen Maßnahmen der Bundesregierung zur Verbesserung der Situation der Frauen im Berufsleben aufzählen. Nur wer für eine bessere Vereinbarkeit von Beruf und Familie sowie Beruf und Pflege sorgt, kämpft erfolgreich für die gerechte Teilhabe von Frauen an Führungspositionen in der deutschen Wirtschaft. Das liegt im Übrigen auch im Interesse der deutschen Wirtschaft. Die Selbstverpflichtung der Wirtschaft ist zwar der schwierigere, dafür aber der nachhaltigere Weg. Die deutsche Wirtschaft ist auf dem richtigen Weg, auch wenn dieser Weg noch lange nicht am Ende ist.

Vielen Dank.",data/txt/17171.txt,speech,fdp
2616763,171,17,0,,,,438,Beifall bei der FDP,data/txt/17171.txt,poi,
2616764,171,17,0,Renate Künast [BÜNDNIS 90/DIE GRÜNEN],Renate Künast,renate-kunast,439,Der Redner ist am Ende! Das war er aber schon vor Ablauf der Redezeit!,data/txt/17171.txt,poi,gruene
2616765,171,17,0,Jürgen Trittin [BÜNDNIS 90/DIE GRÜNEN],Jürgen Trittin,jurgen-trittin,440,"Ein Glück, dass gleich Frau -Pawelski kommt!",data/txt/17171.txt,poi,gruene
2616766,171,17,0,Jörg von Polheim (FDP),Jörg von Polheim,jorg-polheim,441,,data/txt/17171.txt,speech,fdp
2616767,171,17,0,Vizepräsidentin Petra Pau,Petra Pau,petra-pau,442,"Bevor wir fortfahren, nur eine kurze Information an diejenigen, die uns zuhören oder zuschauen: Wir sind in einer Aktuellen Stunde, deshalb äußern Kolleginnen und Kollegen ihre Zustimmung oder Nichtzustimmung -sowie ihre Meinung zu den Redebeiträgen durch Zwischenrufe, haben aber nicht die Chance, Fragen zu stellen oder zu intervenieren.",data/txt/17171.txt,chair,
2616768,171,17,0,Britta Haßelmann [BÜNDNIS 90/DIE GRÜNEN],Britta Haßelmann,britta-haßelmann,443,Da kann man nur froh sein!,data/txt/17171.txt,poi,gruene
2616769,171,17,0,Jürgen Trittin [BÜNDNIS 90/DIE GRÜNEN],Jürgen Trittin,jurgen-trittin,444,Das war Artenschutz für Herrn von Polheim!,data/txt/17171.txt,poi,gruene
2616770,171,17,0,Vizepräsidentin Petra Pau,Petra Pau,petra-pau,445,"Das war eine Erklärung an die Zuhörenden zu dem Vorgang gerade.

Nun hat die Kollegin Yvonne Ploetz für die Fraktion Die Linke das Wort.",data/txt/17171.txt,chair,
2616771,171,17,0,,,,446,Beifall bei der LINKEN,data/txt/17171.txt,poi,
2616772,171,17,0,Vizepräsidentin Petra Pau,Petra Pau,petra-pau,447,,data/txt/17171.txt,chair,
2616773,171,17,0,Yvonne Ploetz (DIE LINKE),Yvonne Ploetz,yvonne-ploetz,448,"Frau Präsidentin! Liebe Kolleginnen und Kollegen! In China erobern Frauen das Weltall, in Deutschland noch nicht einmal den Chefsessel. Ich finde echt abenteuerlich, was hier gerade passiert.",data/txt/17171.txt,speech,linke
2616774,171,17,0,,,,449,Beifall bei der LINKEN,data/txt/17171.txt,poi,
2616775,171,17,0,Yvonne Ploetz (DIE LINKE),Yvonne Ploetz,yvonne-ploetz,450,"In China erklärt man einfach, dass künftig eines von drei Besatzungsmitgliedern eines Raumschiffs eine Frau sein soll - und in Deutschland streitet die Frauenministerin gegen so etwas Läppisches wie eine Frauenquote. Ganz ehrlich: Ich muss mich hier wirklich manchmal schämen.",data/txt/17171.txt,speech,linke
2616776,171,17,0,,,,451,Beifall bei der LINKEN und dem BÜNDNIS 90/DIE GRÜNEN,data/txt/17171.txt,poi,
2616777,171,17,0,Yvonne Ploetz (DIE LINKE),Yvonne Ploetz,yvonne-ploetz,452,"Anscheinend kommen auf Frau Schröder gerade ganz einsame Zeiten zu. Selbst in ihrer eigenen Partei ist die Flexiquote mehr und mehr umstritten. Annegret Kramp-Karrenbauer zum Beispiel, die gerade wiedergewählte CDU-Ministerpräsidentin im Saarland, hat schon vor Monaten gefordert, bei der gesetzlichen Frauenquote endlich Nägel mit Köpfen zu machen. Selbst bei ihren männlichen Kollegen scheint der Widerstand gegen die Quote zu schwinden. Das sicherlich prominenteste Beispiel ist unser Bundestagspräsident Norbert Lammert.",data/txt/17171.txt,speech,linke
2616778,171,17,0,,,,453,"Beifall bei der LINKEN, der SPD und dem BÜNDNIS 90/DIE GRÜNEN",data/txt/17171.txt,poi,
2616779,171,17,0,Yvonne Ploetz (DIE LINKE),Yvonne Ploetz,yvonne-ploetz,454,"- Das hat auch Applaus verdient.

Frau Schröder hat im Spiegel gesagt, dass ihr - ich -zitiere - das Denken in Geschlechterkollektiven fremd sei. Für eine amtierende Frauenministerin ist das ein wirklich sehr, sehr bedenkliches Zitat, wie ich finde. Es zeigt nämlich eindeutig, dass ihr jede Sensibilität im Hinblick auf die Benachteiligung von Frauen fehlt.",data/txt/17171.txt,speech,linke
2616780,171,17,0,,,,455,Beifall bei der LINKEN,data/txt/17171.txt,poi,
2616781,171,17,0,Dr. Martin Lindner [Berlin] [FDP],Dr. Martin Lindner,martin-lindner,456,Sehr souverän ist die Ministerin!,data/txt/17171.txt,poi,fdp
2616782,171,17,0,Yvonne Ploetz (DIE LINKE),Yvonne Ploetz,yvonne-ploetz,457,"Gerade erst hat EU-Kommissarin Viviane Reding die seltsame Gleichstellungspolitik dieser Bundesregierung kritisiert: Mit dem Betreuungsgeld setze sie völlig falsche Anreize, die Kinderbetreuung in Deutschland sei mangelhaft und die freiwillige Quote gescheitert. Deshalb fordert Brüssel nun die deutsche Quote, gesetzlich, verbindlich, für Aufsichtsräte und Vorstände. Das ist der richtige Weg. Dass die Bundesregierung jedoch eine solche Belehrung braucht, ist wirklich peinlich.",data/txt/17171.txt,speech,linke
2616783,171,17,0,,,,458,Beifall bei der LINKEN sowie bei Abgeordneten des BÜNDNISSES 90/DIE GRÜNEN,data/txt/17171.txt,poi,
2616784,171,17,0,Yvonne Ploetz (DIE LINKE),Yvonne Ploetz,yvonne-ploetz,459,"Dabei gibt es doch richtig gute Beispiele für den Erfolg einer Quote. Norwegen hat als erstes europäisches Land eine 40-Prozent-Quote eingeführt. Den Erfolg machten - neben sehr empfindlichen Sanktionen - zum Beispiel Projekte wie ein Mentoringprogramm aus. Im Rahmen dieses Programms wurden weibliche Nachwuchskräfte gemeinsam mit ihren zukünftigen Kollegen und mit ihren Chefs über Monate hinweg geschult, und zwar in Sachen Führungsstärke, Unternehmenskultur und Genderkompetenz.

Das sorgte für ein echtes Umdenken, nicht nur in den Unternehmen, sondern auch in der gesamten Gesellschaft. Plötzlich ist so etwas wie eine Kinderbetreuungszeit oder eine Familienzeit ganz selbstverständlicher Arbeitsalltag. Das sind doch wunderbare Akzente, von denen wir wirklich viel lernen können und sollten.",data/txt/17171.txt,speech,linke
2616785,171,17,0,,,,460,Beifall bei der LINKEN,data/txt/17171.txt,poi,
2616786,171,17,0,Yvonne Ploetz (DIE LINKE),Yvonne Ploetz,yvonne-ploetz,461,"Aber Quoten alleine reichen nicht aus, und schon gar nicht uns Linken. Uns geht es um die ganze Frauenfrage. Frauenquoten sagen nämlich noch gar nichts darüber aus, wie es Frauen in Unternehmen wirklich geht; da spielen noch ganz andere Faktoren eine Rolle. Uns geht es unter anderem auch darum, dass Armutsfallen wie Minijobs, Niedriglöhne und Lohnunterschiede zwischen Mann und Frau endlich bekämpft werden.",data/txt/17171.txt,speech,linke
2616787,171,17,0,,,,462,Beifall bei der LINKEN,data/txt/17171.txt,poi,
2616788,171,17,0,Yvonne Ploetz (DIE LINKE),Yvonne Ploetz,yvonne-ploetz,463,Altbackene Unternehmenskulturen müssen verändert werden. Wir brauchen Individualbesteuerungen statt eines Ehegattensplittings. Die Frauen müssen bei ihrer sogenannten ehrenamtlichen Gratisarbeit in den Bereichen Pflege und Erziehung endlich vom Staat und von den Männern entlastet werden. Darüber hinaus muss die Arbeitszeit verkürzt werden. Außerdem brauchen wir einen gesetzlichen Mindestlohn von 10 Euro.,data/txt/17171.txt,speech,linke
2616789,171,17,0,,,,464,Beifall bei der LINKEN,data/txt/17171.txt,poi,
2616790,171,17,0,Yvonne Ploetz (DIE LINKE),Yvonne Ploetz,yvonne-ploetz,465,"Liebe Kolleginnen und Kollegen, ich finde es schon ziemlich merkwürdig, dass immer dann, wenn es um die Gleichstellung von Mann und Frau geht, wenn es um Gehalt, Macht und Einkommen geht, auf Freiwilligkeit gesetzt wird. Ich sage Ihnen eines: Das liegt daran, dass hinter jeder erfolgreichen Frau mindestens ein Mann steht, der die Frauenquote zum Teufel jagen möchte.",data/txt/17171.txt,speech,linke
2616791,171,17,0,,,,466,Beifall bei der LINKEN,data/txt/17171.txt,poi,
2616792,171,17,0,Yvonne Ploetz (DIE LINKE),Yvonne Ploetz,yvonne-ploetz,467,"Ich glaube, genau diese Männer brauchen die Frauenquote dringender als jede Frau, und zwar auf Augenhöhe; sie beträgt 50 Prozent.",data/txt/17171.txt,speech,linke
2616793,171,17,0,,,,468,Beifall bei der LINKEN,data/txt/17171.txt,poi,
2616794,171,17,0,Yvonne Ploetz (DIE LINKE),Yvonne Ploetz,yvonne-ploetz,469,"Eines möchte ich auch noch anmerken: Es darf bei der Quotendebatte doch nicht darum gehen, die Profite von Unternehmen zu vermehren. Es geht bei der Frauenquote darum, Geschlechtergerechtigkeit herzustellen, soziale Gerechtigkeit herzustellen und Verfassungsaufgaben zu erfüllen. Sie ist von Grund auf ein ganz demokratisches Projekt, das Frauen und eben nicht dem Kapital Vorteile bringen soll.",data/txt/17171.txt,speech,linke
2616795,171,17,0,,,,470,Beifall bei der LINKEN,data/txt/17171.txt,poi,
2616796,171,17,0,Yvonne Ploetz (DIE LINKE),Yvonne Ploetz,yvonne-ploetz,471,,data/txt/17171.txt,speech,linke
2616797,171,17,0,"Liebe Kolleginnen und Kollegen, die Frauenrechtlerin Hedwig Dohm sagte bereits 1910","Liebe Kolleginnen und Kollegen, die Frauenrechtlerin Hedwig Dohm sagte bereits 1910",liebe-kolleginnen-und-kollegen-die-frauenrechtlerin-hedwig-dohm-sagte-bereits-1910,472,"Glaube nicht, es muß so sein, weil es so ist und immer so war. Unmöglichkeiten sind Ausflüchte steriler Gehirne. Schaffe Möglichkeiten.

Ich glaube, genau das sollte endlich zum Leitsatz dieser Regierung werden.

Danke schön.",data/txt/17171.txt,speech,
2616798,171,17,0,,,,473,Beifall bei der LINKEN sowie der Abg. Dr. Eva Högl [SPD] und Britta Haßelmann [BÜNDNIS 90/DIE GRÜNEN],data/txt/17171.txt,poi,
2616799,171,17,0,"Liebe Kolleginnen und Kollegen, die Frauenrechtlerin Hedwig Dohm sagte bereits 1910","Liebe Kolleginnen und Kollegen, die Frauenrechtlerin Hedwig Dohm sagte bereits 1910",liebe-kolleginnen-und-kollegen-die-frauenrechtlerin-hedwig-dohm-sagte-bereits-1910,474,,data/txt/17171.txt,speech,
2616800,171,17,0,Vizepräsidentin Petra Pau,Petra Pau,petra-pau,475,Die Kollegin Rita Pawelski hat nun für die Unionsfraktion das Wort.,data/txt/17171.txt,chair,
2616801,171,17,0,,,,476,Beifall bei der CDU/CSU sowie bei Abgeordneten der FDP,data/txt/17171.txt,poi,
2616802,171,17,0,Vizepräsidentin Petra Pau,Petra Pau,petra-pau,477,,data/txt/17171.txt,chair,
2616803,171,17,0,Rita Pawelski (CDU/CSU),Rita Pawelski,rita-pawelski,478,"Frau Präsidentin! Liebe Kolleginnen und Kollegen! Ja, es bewegt sich etwas. Die deutschen Unternehmen beginnen, zu begreifen. Seit etwa zwei Jahren brechen die männlichen Monokulturen in den Chefetagen auf. Im vergangenen Jahr wurden 16 Prozent der neu zu besetzenden DAX-Vorstände von Frauen besetzt.",data/txt/17171.txt,speech,cducsu
2616804,171,17,0,Ingo Egloff [SPD],Ingo Egloff,ingo-egloff,479,Von 12 auf 14 Prozent! Nur 2 Prozentpunkte mehr!,data/txt/17171.txt,poi,spd
2616805,171,17,0,Rita Pawelski (CDU/CSU),Rita Pawelski,rita-pawelski,480,"Aber was sich so gigantisch anhört, ist bei genauem Hinsehen ziemlich bescheiden:",data/txt/17171.txt,speech,cducsu
2616806,171,17,0,,,,481,Beifall der Abg. Dr. Eva Högl [SPD],data/txt/17171.txt,poi,
2616807,171,17,0,Rita Pawelski (CDU/CSU),Rita Pawelski,rita-pawelski,482,"Die Zahl stieg real von drei auf acht Frauen, acht Frauen von insgesamt 187 DAX-Vorständen. Na ja.",data/txt/17171.txt,speech,cducsu
2616808,171,17,0,Jürgen Trittin [BÜNDNIS 90/DIE GRÜNEN],Jürgen Trittin,jurgen-trittin,483,Hört! Hört!,data/txt/17171.txt,poi,gruene
2616809,171,17,0,Rita Pawelski (CDU/CSU),Rita Pawelski,rita-pawelski,484,"In den Aufsichtsräten wuchs der Anteil der Frauen um sagenhafte 2,8 Prozentpunkte, von 10 auf 12,8 Prozent. Sie sehen, es bewegt sich etwas, allerdings im Tempo einer Schnecke. Unsere Wirtschaft leistet sich ein Schneckentempo ausgerechnet bei der wichtigen Frage: Wie mache ich in Zeiten des demografischen Wandels mein Unternehmen fit für die Zukunft? Meine Damen und Herren, die CDU hat einen sehr guten Slogan: Ohne Frauen ist kein Staat zu machen.",data/txt/17171.txt,speech,cducsu
2616810,171,17,0,,,,485,Beifall bei Abgeordneten der CDU/CSU,data/txt/17171.txt,poi,
2616811,171,17,0,Rita Pawelski (CDU/CSU),Rita Pawelski,rita-pawelski,486,Ich formuliere diesen Satz einmal um: Ohne Frauen ist kein Unternehmen wettbewerbsfähig.,data/txt/17171.txt,speech,cducsu
2616812,171,17,0,,,,487,"Beifall bei der CDU/CSU, der SPD, der FDP und dem BÜNDNIS 90/DIE GRÜNEN sowie bei Abgeordneten der LINKEN",data/txt/17171.txt,poi,
2616813,171,17,0,Rita Pawelski (CDU/CSU),Rita Pawelski,rita-pawelski,488,"Jetzt heißt es, dass deutsche Unternehmen bei Ausschreibungen in der EU womöglich mit Nachteilen zu rechnen hätten. Es steht in allen Zeitungen; ich habe hier die FAZ. Wenn es wirklich solch ein Papier gibt, dann müssen wir darüber diskutieren. Ich wüsste übrigens gerne, ob es so ist.",data/txt/17171.txt,speech,cducsu
2616814,171,17,0,,,,489,Beifall bei der SPD und dem BÜNDNIS 90/DIE GRÜNEN sowie bei Abgeordneten der CDU/CSU,data/txt/17171.txt,poi,
2616815,171,17,0,Renate Künast [BÜNDNIS 90/DIE GRÜNEN],Renate Künast,renate-kunast,490,"Ja, es gibt ein solches Papier!",data/txt/17171.txt,poi,gruene
2616816,171,17,0,Rita Pawelski (CDU/CSU),Rita Pawelski,rita-pawelski,491,"Es kann nicht sein, dass es Pamphlete oder anonyme Unterlagen aus einer Behörde gibt, in denen - wenn es denn stimmt - jetzt schon klar gesagt wird, dass Unternehmen Nachteile haben werden, wenn sie nicht über genug Frauen verfügen. Ich sage Ihnen: Frankreich oder Spanien, die hier zitiert werden, werden sich nicht darum kümmern, ob es uns recht ist oder nicht; sie werden ihre Gesetze voranstellen, nicht unser Denken und Wünschen.",data/txt/17171.txt,speech,cducsu
2616817,171,17,0,Dr. Eva Högl [SPD],Dr. Eva Högl,eva-hogl,492,Genau!,data/txt/17171.txt,poi,spd
2616818,171,17,0,Rita Pawelski (CDU/CSU),Rita Pawelski,rita-pawelski,493,"Ich bitte das Auswärtige Amt, hier wirklich für Klarheit zu sorgen. Ich möchte wissen, ob es das Papier gibt.",data/txt/17171.txt,speech,cducsu
2616819,171,17,0,,,,494,"Beifall bei der SPD, der LINKEN und dem BÜNDNIS 90/DIE GRÜNEN sowie bei Abgeordneten der CDU/CSU",data/txt/17171.txt,poi,
2616820,171,17,0,Rita Pawelski (CDU/CSU),Rita Pawelski,rita-pawelski,495,"Meine Damen und Herren, es darf nicht sein, dass unsere Wirtschaft mit Nachteilen zu rechnen hat, wenn sie die Quote nicht erfüllt. Darum ist für mich ganz klar: Wir brauchen mehr Tempo in der Frauenfrage. Dazu müssen wir aus dem langsamen Oldtimer aus- und in den schnellen Formel-1-Boliden einsteigen.",data/txt/17171.txt,speech,cducsu
2616821,171,17,0,,,,496,Beifall bei Abgeordneten des BÜNDNISSES 90/DIE GRÜNEN,data/txt/17171.txt,poi,
2616822,171,17,0,Rita Pawelski (CDU/CSU),Rita Pawelski,rita-pawelski,497,"Wir müssen auch den Treibstoff wechseln, weg von der wirkungslosen freiwilligen Verpflichtung, die seit 2001 nur ein Stück Papier ist.",data/txt/17171.txt,speech,cducsu
2616823,171,17,0,,,,498,Beifall bei der LINKEN sowie bei Abgeordneten der SPD und des BÜNDNISSES 90/DIE GRÜNEN,data/txt/17171.txt,poi,
2616824,171,17,0,Rita Pawelski (CDU/CSU),Rita Pawelski,rita-pawelski,499,"Ich sage ganz deutlich: Wenn die Unternehmen das, was sie damals unter Kanzler Schröder unterzeichnet haben, auch nur ansatzweise erfüllt hätten, würden wir heute nicht über dieses Thema sprechen.",data/txt/17171.txt,speech,cducsu
2616825,171,17,0,,,,500,"Beifall bei der SPD, der LINKEN und dem BÜNDNIS 90/DIE GRÜNEN sowie bei Abgeordneten der CDU/CSU",data/txt/17171.txt,poi,
2616826,171,17,0,Rita Pawelski (CDU/CSU),Rita Pawelski,rita-pawelski,501,"Aber die Unternehmen haben bis 2010 nichts getan. Es gibt da ein Sprichwort:

Wer einmal lügt, dem glaubt man nicht, auch wenn er dann die Wahrheit spricht.",data/txt/17171.txt,speech,cducsu
2616827,171,17,0,,,,502,Beifall des Abg. Sönke Rix [SPD],data/txt/17171.txt,poi,
2616828,171,17,0,,,,503,Lachen des Abg. Jürgen Trittin [BÜNDNIS 90/DIE GRÜNEN],data/txt/17171.txt,poi,
2616829,171,17,0,Rita Pawelski (CDU/CSU),Rita Pawelski,rita-pawelski,504,"Diese Diskussion haben nicht wir zu verantworten, sondern die Unternehmen, die sich nicht an ihre eigenen -Zusagen, an die schriftlich gegebenen Versprechen, gehalten haben; sie haben sich diese Diskussion selber zuzuschreiben.",data/txt/17171.txt,speech,cducsu
2616830,171,17,0,,,,505,"Beifall bei der SPD, der LINKEN und dem BÜNDNIS 90/DIE GRÜNEN sowie bei Abgeordneten der CDU/CSU und der Abg. Sibylle Laurischk [FDP]",data/txt/17171.txt,poi,
2616831,171,17,0,Rita Pawelski (CDU/CSU),Rita Pawelski,rita-pawelski,506,"Am Ziel sollen mindestens 30 Prozent Frauen in den Spitzengremien der börsennotierten Unternehmen vertreten sein. Frauen in den Chefetagen bringen den Unternehmen Erfolg. Sie sind ein Wettbewerbsvorteil. Das beweisen zahlreiche Studien. Ich weiß, dass jetzt jeder die Studie herausholt, die ihm gerade passt. So werden Experten zu Kronzeugen. Ich habe auch einen Kronzeugen, nämlich das renommierte Beratungsunternehmen Ernst & Young. Dessen Analyse ergab, dass Unternehmen mit Vorständen, in denen Frauen vertreten sind, beim Umsatz um 20 Prozent, beim Gewinn um 22 Prozent und beim Börsenwert um 7 Prozent besser sind als Unternehmen ohne Frauen im Vorstand. Das sind doch Signale, die verstanden werden müssen.",data/txt/17171.txt,speech,cducsu
2616832,171,17,0,,,,507,"Beifall bei der CDU/CSU, der SPD und dem BÜNDNIS 90/DIE GRÜNEN sowie bei Abgeordneten der FDP und der LINKEN",data/txt/17171.txt,poi,
2616833,171,17,0,Rita Pawelski (CDU/CSU),Rita Pawelski,rita-pawelski,508,"Das macht deutlich: Es geht hier ganz konkret darum, wirtschaftliche Potenziale zu nutzen und Wettbewerbsnachteile für unsere Unternehmen in Deutschland, aber möglicherweise auch in der Europäischen Union zu verhindern.

Wer jetzt sagt, wir hätten nicht genügend erfahrene weibliche Kandidaten, der verschließt die Augen vor der Wirklichkeit. Kienbaum oder Headhunter wie Heiner Thorborg haben festgestellt: Wenn die Unternehmen wirklich Frauen finden wollen, dann finden sie diese Frauen auch in Deutschland. - Es gibt also genügend Frauen, die können und wollen. Dass die Chefetagen dennoch unter einem Frauenmangel leiden, zeigt doch, dass Leistung, Kompetenz und Einsatz nicht immer ausreichen, um die Tür zu Führungspositionen aufzustoßen. Was anscheinend reicht, sind - außer Kompetenz und Leistung - Netzwerke und Seilschaften. Da sind die Old Boys halt routinierter und erfahrener. Aber ich verspreche Ihnen: Wir lernen.",data/txt/17171.txt,speech,cducsu
2616834,171,17,0,,,,509,"Beifall bei der CDU/CSU, der SPD, der LINKEN und dem BÜNDNIS 90/DIE GRÜNEN",data/txt/17171.txt,poi,
2616835,171,17,0,Rita Pawelski (CDU/CSU),Rita Pawelski,rita-pawelski,510,"Lassen Sie mich zum Schluss eines sagen: Es macht keinen Sinn, dass wir uns gegenseitig Fehler vorhalten. Hier sitzen einige, die 2001 aus Angst oder aus Disziplin - wie auch immer - verhindert haben, dass es ein entsprechendes Gesetz gibt, und hier sitzen welche, die möchten kein Gesetz. Sich gegenseitig Naivität und Passivität vorzuwerfen, bringt gar nichts.",data/txt/17171.txt,speech,cducsu
2616836,171,17,0,,,,511,Beifall bei Abgeordneten der SPD und des BÜNDNISSES 90/DIE GRÜNEN sowie des Abg. Jörn Wunderlich [DIE LINKE],data/txt/17171.txt,poi,
