id,sitzung,wahlperiode,in_writing,speaker,speaker_cleaned,speaker_fp,sequence,text,filename,type,speaker_party
2616456,171,17,0,Präsident Dr. Norbert Lammert,Dr. Norbert Lammert,norbert-lammert,131,"Frau Kolbe, eine Nachfrage.",data/txt/17171.txt,chair,
2616457,171,17,0,Daniela Kolbe (Leipzig) (SPD),Daniela Kolbe,daniela-kolbe,132,"Herr Dr. Kues, dem möchte ich zunächst einmal widersprechen. Es ist schon eine bewusste Entscheidung, mit einer ganzen Gruppe von rechtsextremistisch orientierten Jugendlichen zu arbeiten. Man muss schon ein großes Vertrauen in die Trainer haben, wenn man glaubt, dass man das bewältigt.

Sie haben jetzt Mittel für das Modellprogramm Dortmund den Dortmundern bewilligt. Soweit ich informiert bin, sollen in dieses Programm 300 000 Euro fließen. Im Rahmen dieses Programms wird mit einer ganzen Gruppe von etwa 20 organisierten autonomen Nationalisten gearbeitet werden. Ich möchte Sie schon fragen, was für eine Zielstellung Sie damit verfolgen. Was glauben Sie in den Köpfen von 20 autonomen Na-tionalisten, die in ein und demselben Raum sitzen, bewegen zu können? Auf welcher Ebene - Einstellungsebene, Verhaltensebene - glauben Sie etwas bewegen zu können?",data/txt/17171.txt,speech,spd
2616458,171,17,0,"Dr. Hermann Kues, Parl. Staatssekretär bei der Bundesministerin für Familie, Senioren, Frauen und Jugend",Dr. Hermann Kues,hermann-kues,133,"Wir müssen uns über dieses Projekt im Einzelnen unterhalten. Wie Sie wissen, führen wir es zusammen mit der Stadt Dortmund durch. Sie hat ein Interesse daran bekundet, auch was eine methodische Auswertung angeht. Die Stadt Dortmund hat sich nach einer politischen Debatte aus diesem Projekt zurückgezogen. Wir werden uns damit noch im Einzelnen zu beschäftigen haben.

Beispielsweise im Falle von Fußballfans, bei denen man den Verdacht hat, dass es in ihr rechtsextremistisch ausgerichtete Jugendliche gibt, arbeitet man im Rahmen einer Gruppe. Man geht davon aus, dass man dabei die entsprechenden Fragestellungen aufwerfen und bei dem einen oder anderen Nachdenklichkeit hervorrufen kann.",data/txt/17171.txt,speech,
2616459,171,17,0,Präsident Dr. Norbert Lammert,Dr. Norbert Lammert,norbert-lammert,134,Eine weitere Zusatzfrage.,data/txt/17171.txt,chair,
2616460,171,17,0,Daniela Kolbe (Leipzig) (SPD),Daniela Kolbe,daniela-kolbe,135,"Ich habe verschiedene Wissenschaftler darauf angesprochen. Es gibt ja erfolgreiche Projekte, zum Beispiel das Violence Prevention Network, bei dem mit rechts-extrem eingestellten Personen, die in Gefängnissen sind, gearbeitet wird. Wenn man die Mitarbeiter solcher Projekte fragt, was sie von diesem Projekt halten, bei dem es um eine ganze Gruppe von rechtsextremen Jugendlichen geht, dann antworten sie: Die Wahrscheinlichkeit des Scheiterns ist extrem hoch; es ist sogar möglich, dass man damit in die falsche Richtung wirkt, dass Rechts-extreme noch stärker in die Szene hineinrutschen und dass man ihnen Räume öffnet. Was entgegnen Sie denen, die das behaupten?",data/txt/17171.txt,speech,spd
2616461,171,17,0,"Dr. Hermann Kues, Parl. Staatssekretär bei der Bundesministerin für Familie, Senioren, Frauen und Jugend",Dr. Hermann Kues,hermann-kues,136,"Wir müssen die Methoden derjenigen, die solche Projekte durchführen, immer wieder überprüfen und dahin gehend auswerten, ob sie geeignet sind oder nicht. Wir lassen uns bei solchen Projekten auch von Fachleuten beraten; das wissen Sie. Das ist für uns letztlich die Grundlage für die Entscheidung, ob wir solche Projekte weiter durchführen.

Ich gebe gerne zu, dass sich ein solches Projekt und auch die Bedingungen, unter denen es abläuft, weiterentwickeln; schließlich sammeln wir Erfahrungen in diesem Bereich. Wir haben mittlerweile einen Schwerpunkt entwickelt, der über das hinausgeht, was in den vergan-genen Jahren passiert ist. Wir werden immer wieder zu hinterfragen haben, ob unser Vorgehen hinreichend ist. Dafür muss man über die einzelnen Projekte reden. Da-rüber tauschen wir uns auch mit Fachleuten aus, und aus diesem Austausch ziehen wir Konsequenzen.

Im Übrigen handelt es sich nicht um alleinige Entscheidungen der Bundesregierung; vielmehr erfolgt unser Handeln in der Regel in enger Abstimmung mit den Landesjugendämtern und den Jugendbehörden.",data/txt/17171.txt,speech,
2616462,171,17,0,Präsident Dr. Norbert Lammert,Dr. Norbert Lammert,norbert-lammert,137,Kollege Beck.,data/txt/17171.txt,chair,
2616463,171,17,0,Volker Beck (Köln) (BÜNDNIS 90/DIE GRÜNEN),Volker Beck,volker-beck,138,"Noch einmal zur Klarstellung: Die Amadeu-Antonio-Stiftung kritisiert diese Extremismusklausel ebenfalls, obgleich sie sie unterzeichnet hat.",data/txt/17171.txt,speech,gruene
2616464,171,17,0,"Dr. Hermann Kues, Parl. Staatssekretär bei der Bundesministerin für Familie, Senioren, Frauen und Jugend",Dr. Hermann Kues,hermann-kues,139,Sie hat sie aber unterschrieben.,data/txt/17171.txt,speech,
2616465,171,17,0,Volker Beck (Köln) (BÜNDNIS 90/DIE GRÜNEN),Volker Beck,volker-beck,140,"Ja. Trotzdem wollen wir hier nicht so tun, als ob eine Unterschrift eine Zustimmung zur Methode wäre.

Da ich ein schlichtes Gemüt habe, wollte ich Sie einfach fragen, wie sich der Wortlaut der von Ihnen geforderten Erklärung mit dieser Art von Projekten verträgt. Ich will gar nicht in Abrede stellen, dass ein solches Vorgehen sinnvoll sein kann. In dem zu unterschreibenden Text heißt es:

Als Träger der geförderten Maßnahme haben wir zudem im Rahmen unserer Möglichkeiten  und auf eigene Verantwortung dafür Sorge zu tragen, dass die als Partner ausgewählten Organisationen, Referenten etc. sich ebenfalls zu den Zielen des Grundgesetzes verpflichten. Uns ist bewusst, dass keinesfalls der Anschein erweckt werden darf, dass einer Unterstützung extremistischer Strukturen durch die Gewährung materieller oder immaterieller Leistungen Vorschub geleistet wird.

Das ist selbst bei einem erfolgreichen Projekt in der Anfangsphase schlechterdings nicht zu machen.",data/txt/17171.txt,speech,gruene
2616466,171,17,0,"Dr. Hermann Kues, Parl. Staatssekretär bei der Bundesministerin für Familie, Senioren, Frauen und Jugend",Dr. Hermann Kues,hermann-kues,141,"Herr Beck, ich möchte Ihnen zunächst nicht bestätigen, dass Sie ein schlichtes Gemüt sind, sondern ausdrücklich das Gegenteil betonen.",data/txt/17171.txt,speech,
2616467,171,17,0,Volker Beck [Köln] [BÜNDNIS 90/DIE GRÜNEN],Volker Beck,volker-beck,142,Ich fühle mich von der Bundes-regierung geschmeichelt!,data/txt/17171.txt,poi,gruene
2616468,171,17,0,"Dr. Hermann Kues, Parl. Staatssekretär bei der Bundesministerin für Familie, Senioren, Frauen und Jugend",Dr. Hermann Kues,hermann-kues,143,"Sie haben allerdings selbst vorgelesen, dass es um die Organisation geht.",data/txt/17171.txt,speech,
2616469,171,17,0,Volker Beck [Köln] [BÜNDNIS 90/DIE GRÜNEN],Volker Beck,volker-beck,144,Referenten etc.!,data/txt/17171.txt,poi,gruene
2616470,171,17,0,"Dr. Hermann Kues, Parl. Staatssekretär bei der Bundesministerin für Familie, Senioren, Frauen und Jugend",Dr. Hermann Kues,hermann-kues,145,- Da ist von Organisationen und Referenten die Rede.,data/txt/17171.txt,speech,
2616471,171,17,0,Volker Beck [Köln] [BÜNDNIS 90/DIE GRÜNEN],Volker Beck,volker-beck,146,Referenten etc.!,data/txt/17171.txt,poi,gruene
2616472,171,17,0,"Dr. Hermann Kues, Parl. Staatssekretär bei der Bundesministerin für Familie, Senioren, Frauen und Jugend",Dr. Hermann Kues,hermann-kues,147,"Es sagt nichts darüber aus, ob man mit extremistisch ausgerichteten Jugendlichen zusammenarbeitet bzw. ob man sie mit einbezieht oder nicht. Wenn Sie es also genau lesen - Sie haben es ja richtig zitiert - und richtig deuten, dann wissen Sie, dass es kein Problem ist.",data/txt/17171.txt,speech,
2616473,171,17,0,Volker Beck [Köln] [BÜNDNIS 90/DIE GRÜNEN],Volker Beck,volker-beck,148,Es darf nicht der Eindruck der Unterstützung entstehen! Ich habe es ja vorgelesen!,data/txt/17171.txt,poi,gruene
2616474,171,17,0,"Dr. Hermann Kues, Parl. Staatssekretär bei der Bundesministerin für Familie, Senioren, Frauen und Jugend",Dr. Hermann Kues,hermann-kues,149,,data/txt/17171.txt,speech,
2616475,171,17,0,Präsident Dr. Norbert Lammert,Dr. Norbert Lammert,norbert-lammert,150,"Frau Kollegin Pau, die sicherlich auch kein schlichtes Gemüt ist, hat nun das Wort. Bitte schön.",data/txt/17171.txt,chair,
2616476,171,17,0,Petra Pau (DIE LINKE),Petra Pau,petra-pau,151,Davon gehe ich aus.,data/txt/17171.txt,speech,linke
2616477,171,17,0,,,,152,Heiterkeit bei der LINKEN und der SPD,data/txt/17171.txt,poi,
2616478,171,17,0,Petra Pau (DIE LINKE),Petra Pau,petra-pau,153,"Ich möchte auf die zweite Nachfrage der Kollegin Kolbe eingehen. Sie hat den Titel des Dortmunder Projektes hier genannt; ich möchte es nicht wiederholen. Da bei der Beantragung des Projekts nicht aufgefallen ist, dass in dem Titel eine Problematik steckt, möchte ich wissen, wie die Bundesregierung aus heutiger Sicht die Tatsache beurteilt, dass sich nach Veröffentlichung dieses Projekts mehrere Nationalisten auf einschlägigen Internetseiten bereit erklärten, sich der Diskussion zu stellen, um dem breiten politisch interessierten Publikum vor Augen zu führen, warum ein radikaler Politikwechsel in unserem Land unumgänglich ist. Das heißt, hier bieten sich Referenten und Diskutanten aus der bekanntermaßen gewaltbereiten rechtsextremen Szene an, die Plattform, die ihnen hier geboten wird, zu nutzen, um ihre menschenverachtenden Positionen nun im Rahmen dieses Programmes zu propagieren. Ich wüsste gerne, wie die Bundesregierung das bewertet und welche Konsequenzen gezogen werden.",data/txt/17171.txt,speech,linke
2616479,171,17,0,"Dr. Hermann Kues, Parl. Staatssekretär bei der Bundesministerin für Familie, Senioren, Frauen und Jugend",Dr. Hermann Kues,hermann-kues,154,"Ich will mich gerne noch einmal genauer informieren. Mein Kenntnisstand ist, dass die Grundlage für diese Entscheidung der aus der Problemlage resultierende Handlungsbedarf, die Erfahrungen des Trägers in diesem Tätigkeitsbereich und ein fachliches Votum gewesen sind. Das heißt, Fachleute sind gebeten worden, das Ganze zu beurteilen. Beispielsweise ist das Jugendamt Dortmund um eine Einschätzung gebeten worden, ob das Programm vom fachlichen und auch methodischen Vorgehen her geeignet sei. Darüber hinaus ging es um die Modellhaftigkeit und den Innovationsgehalt. All das wurde mit berücksichtigt.

Sie sagen jetzt, eine rechts bzw. nationalistisch aus-gerichtete Gruppe habe das als Aufhänger genommen, um ihre Dienste anzubieten. Ich muss das erst einmal so zur Kenntnis nehmen; gelesen habe ich das auch. Bis jetzt hatte ich keinen Anlass, anzunehmen, dass es falsch sei. Um dieses Projekt, das so bewertet worden ist, jetzt schon abzubrechen, müsste man zu Erkenntnissen kommen, die in die Richtung gehen, die Sie gerade angedeutet haben. Aber ich will das gerne noch einmal überprüfen.",data/txt/17171.txt,speech,
2616480,171,17,0,Präsident Dr. Norbert Lammert,Dr. Norbert Lammert,norbert-lammert,155,"Weitere Wortmeldungen sehe ich hierzu nicht. Damit sind wir am Ende dieses Geschäftsbereichs. Vielen Dank, Herr Staatssekretär.

Wir kommen damit zum Geschäftsbereich des Bundesministeriums für Gesundheit. Die Fragen 8 und 9 der Kollegin Kathrin Vogler werden schriftlich beantwortet.

Nun kommen wir zum Geschäftsbereich des Bundesministeriums für Verkehr, Bau und Stadtentwicklung. Die Frage 10 des Kollegen Dr. Anton Hofreiter, die Fragen 11 und 12 des Kollegen Stephan Kühn, die Fra-gen 13 und 14 des Kollegen Gustav Herzog sowie die Fragen 15 und 16 des Kollegen Sören Bartol werden schriftlich beantwortet.

Ich rufe die Frage 17 des Kollegen Seifert auf:

Inwieweit hält die Bundesregierung angesichts des Anteils von nur 1,6 Prozent barrierefreien bzw. barrierearmen Wohnungen am Gesamtbestand von 40,5 Millionen Wohnungen (siehe Antwort der Bundesregierung auf meine mündliche Frage 35, Plenarprotokoll 17/167, Seite 19848 A) ihre eigenen Aktivitäten zur Schaffung von barrierefreien Wohnungen im Neubau und zum Abbau von Barrieren im Wohnungs-bestand für ausreichend, und was wird sie tun, um sich - auch mit Blick auf Art. 31, Statistik und Datensammlung, der UN-Behindertenrechtskonvention - einen besseren Überblick über Fragen der Barrierefreiheit bei Wohnungen in Deutschland zu verschaffen?

Ich bitte den Kollegen Ferlemann um Beantwortung.",data/txt/17171.txt,chair,
2616481,171,17,0,"Enak Ferlemann, Parl. Staatssekretär beim Bundesminister für Verkehr, Bau und Stadtentwicklung",Enak Ferlemann,enak-ferlemann,156,,data/txt/17171.txt,speech,
2616482,171,17,0,Sehr geehrter Herr Präsident! Ich gebe folgende Antwort,Sehr geehrter Herr ! Ich gebe folgende Antwort,sehr-geehrter-herr-ich-gebe-folgende-antwort,157,"Die Ausweitung des Angebots an barrierefreien bzw. barrierereduzierten Wohnungen ist ein wichtiges Anliegen der Bundesregierung. Sie ist daher bemüht, die Eigentümer und Investoren sowie die bauplanenden und bauausführenden Berufe für den Abbau von Barrieren im Bestand sowie für die Vermeidung von Barrieren beim Neubau zu sensibilisieren. Dazu dienen unter anderem das KfW-Programm Altersgerecht Umbauen sowie die hierzu geförderten Modellprojekte. Die Bundesregierung geht davon aus, dass auch die Länder, auf die im Rahmen der Föderalismusreform I die Zuständigkeit für die Wohnungsbauförderung ab 2007 vollständig übergegangen ist, das gleiche Anliegen verfolgen.

Um Fortschritte bei der Anpassung des Wohnungsbestandes festzustellen, stehen der Bundesregierung verschiedene Möglichkeiten zur Verfügung. So gaben 2007 in einer repräsentativen BBR-Bevölkerungsumfrage 30 Prozent der befragten Haushalte an, in einer barrierefrei erreichbaren Wohnung zu leben.

Ferner hat die Bundesregierung zum Beispiel beim DIW dafür geworben, das Thema Barrierefreiheit in das Erhebungsprogramm des Soziooekonomischen Panels aufzunehmen. Seit dem Jahr 2009 werden dort Anpassungsmaßnahmen für barrierefreies, altengerechtes Wohnen sowie das Vorhandensein eines Aufzugs erfasst. Ergebnis: 8 Prozent der Haushalte hatten im Jahr 2010 einen Aufzug/Fahrstuhl im Haus zur Verfügung. Bei 0,4 Prozent der Eigentümer- und Mieterhaushalte sind seit Anfang 2009 in den Wohnungen Anpassungsmaßnahmen für barrierefreies, altengerechtes Wohnen vorgenommen worden.

Art. 31 der UN-Behindertenrechtskonvention verpflichtet die Vertragsstaaten zur Sammlung geeigneter Informationen zur Situation von Menschen mit Behinderungen. Im Nationalen Aktionsplan zur Umsetzung dieser Konvention hat die Bundesregierung beschlossen, einen neuen Bericht über die Lebenslagen von Menschen mit Behinderungen zu konzipieren. Der Bericht soll ein solides Datenfundament bereitstellen, das die tatsächliche Situation von Menschen mit Behinderungen anhand von ausgewählten Lebenslagen darstellt. Der indikatorengestützte Bericht wird zukünftig die Grundlage für zielgerichtetes politisches Handeln im Bericht zur Teilhabe von Menschen mit Behinderungen sein. In diesem Zusammenhang wird auch das Thema Wohnen für Menschen mit Behinderungen eine Rolle spielen.",data/txt/17171.txt,speech,
2616483,171,17,0,Präsident Dr. Norbert Lammert,Dr. Norbert Lammert,norbert-lammert,158,Kollege Seifert.,data/txt/17171.txt,chair,
2616484,171,17,0,Dr. Ilja Seifert (DIE LINKE),Dr. Ilja Seifert,ilja-seifert,159,"Vielen Dank, Herr Staatssekretär, für die Zahlen. Einige muss ich mir im Protokoll noch einmal in Ruhe ansehen.

Ich darf darauf hinweisen, dass es beim Thema Bar-rierefreie Bauten nicht nur darum geht, wo Menschen mit Behinderungen jetzt wohnen, sondern unter anderem auch darum, wohin sie in Zukunft ziehen können, sowie darum, wie erreicht werden kann, dass Menschen, die jetzt noch gar nicht in der Situation sind, mit irgendwelchen Mobilitätseinschränkungen zu tun zu haben, wohnen bleiben können, wenn sie einmal in diese Situation kommen. Insofern verstehe ich nicht, wieso Sie nur an-regen und darauf hinwirken wollen, das zu berücksichtigen. Es geht doch darum, gesetzlich festzulegen, dass zukünftig keine neuen Barrieren mehr errichtet werden dürfen.

Wir bräuchten auch ein Programm, um bestehende Barrieren zu beseitigen. Sie haben auf das KfW-Programm Altersgerecht Umbauen hingewiesen. Aber die Mittel werden immer weiter heruntergefahren. Da ist nicht gerade ein Fortschritt, sondern eher ein Rückschritt zu erkennen. Was wollen Sie konkret gesetzlich tun, dass zukünftig keine neuen Barrieren mehr errichtet werden, und welche Programme haben Sie, bestehende Barrieren zu beseitigen?",data/txt/17171.txt,speech,linke
2616485,171,17,0,"Enak Ferlemann, Parl. Staatssekretär beim Bundesminister für Verkehr, Bau und Stadtentwicklung",Enak Ferlemann,enak-ferlemann,160,"Sehr geehrter Kollege, ich habe schon darauf hingewiesen: Die Zuständigkeit für die Wohnungsbauförderung ist komplett auf die Bundesländer übergegangen. Das ist ein Ergebnis der Föderalismusreform I. Nun kann man darüber diskutieren, ob das sinnhaft war oder nicht; aber die Entscheidungen sind so gefallen. Mithin sind die Bundesländer für die Umsetzung der Programme verantwortlich. Wir geben Geld aus dem Haushalt des BMVBS, und die Länder entscheiden in eigener Zuständigkeit darüber, wie sie dies in der Wohnungsbauförderung einsetzen.

Gleichwohl ist es natürlich so, dass wir versuchen, an vielen Punkten Auflagen durchzubringen. Denken Sie an all die Programme im Bereich der Mobilität, die wir unterstützen und fördern; das ist Ihnen ja bekannt. Natürlich weisen wir die Bundesländer in den gemeinsamen Bauministerbesprechungen darauf hin, dass wir auf dieses Thema großen Wert legen. Das hängt vor allem damit zusammen, dass wir im Zuge der demografischen Entwicklung - da haben Sie vollkommen recht - in Zukunft deutlich mehr Wohnungen brauchen, die barrierefrei gebaut sind. Deswegen fordern wir die Länder immer wieder auf, einen besonderen Schwerpunkt darauf zu setzen.",data/txt/17171.txt,speech,
2616486,171,17,0,Präsident Dr. Norbert Lammert,Dr. Norbert Lammert,norbert-lammert,161,Weitere Zusatzfrage?,data/txt/17171.txt,chair,
2616487,171,17,0,Dr. Ilja Seifert (DIE LINKE),Dr. Ilja Seifert,ilja-seifert,162,"Ja, gern, Herr Präsident. - Gegen die Einführung der Kleinstaaterei kann ich momentan nichts tun. Das ist Geschichte; da haben Sie recht. Das ändert aber nichts an der Tatsache, dass es ein Baugesetzbuch gibt. Niemand in diesem Lande käme auf den Gedanken, ein Haus ohne Blitzableiter oder ohne Brandschutzmaßnahmen zu bauen; denn das ist im Baugesetzbuch festgelegt. Warum schreiben Sie nicht ins Baugesetzbuch, dass es verboten ist, so zu bauen, dass damit Barrieren verbunden sind? Es ist ja nicht so, dass der Bund überhaupt keine Möglichkeiten hätte, lenkend einzugreifen und etwas verbindlich zu machen.

Im Übrigen fehlt mir immer noch die Aussage zu Maßnahmen, Programmen oder wie auch immer, die Sie über die Länder abwickeln und die das Ziel haben, bestehende Barrieren abzubauen. Das sind ja zwei verschiedene Bereiche. Das eine ist, zu verhindern, dass neue Barrieren entstehen - das müsste ab sofort zu 100 Prozent machbar sein -, und das andere ist, bestehende Barrieren zu beseitigen. Es geht momentan um den Wohnungsbestand. Ich rede nicht vom Verkehrswesen. Das ist ein anderes Thema; dort gibt es aber ähnliche Pro-bleme.",data/txt/17171.txt,speech,linke
2616488,171,17,0,"Enak Ferlemann, Parl. Staatssekretär beim Bundesminister für Verkehr, Bau und Stadtentwicklung",Enak Ferlemann,enak-ferlemann,163,Ich muss Sie leider enttäuschen und wieder darauf hinweisen: Für die Wohnraumförderung sind wir nicht zuständig.,data/txt/17171.txt,speech,
2616489,171,17,0,Dr. Ilja Seifert [DIE LINKE],Dr. Ilja Seifert,ilja-seifert,164,Aber für die Gesetzgebung doch!,data/txt/17171.txt,poi,linke
2616490,171,17,0,"Enak Ferlemann, Parl. Staatssekretär beim Bundesminister für Verkehr, Bau und Stadtentwicklung",Enak Ferlemann,enak-ferlemann,165,"Wir können den Ländern in dem Sinne keine Vorgaben machen. Das ist Ausfluss der Föderalismusreform.

Zu Ihrer Frage, ob wir im Baugesetzbuch solche Regelungen aufnehmen: Nein, das machen wir grundsätzlich nicht. Das wird untergesetzlich geregelt, auch in -einzelnen Baunutzungsverordnungen, die die Länder erlassen, im Zuge von Baugenehmigungen sogar auch von den kommunalen Behörden.

Wie ich aus eigener Anschauung weiß, wird zumindest bei öffentlichen Gebäuden sehr stark darauf geachtet, dass die Auflagen eingehalten werden. Es wird aber auch bei vielen Neubauten darauf geachtet und hingewirkt, diese Auflagen einzuhalten.",data/txt/17171.txt,speech,
2616491,171,17,0,Präsident Dr. Norbert Lammert,Dr. Norbert Lammert,norbert-lammert,166,Frau Enkelmann.,data/txt/17171.txt,chair,
2616492,171,17,0,Dr. Dagmar Enkelmann (DIE LINKE),Dr. Dagmar Enkelmann,dagmar-enkelmann,167,"In vielen Kommunen gibt es einen Beschluss zum barrierefreien Bauen. So gibt es in meiner Heimatstadt Bernau das Projekt Bernau Barrierefrei; Ähnliches gibt es auch in vielen anderen Städten. Das schließt den Wohnungsbau und die Infrastruktur ein. Wäre es nicht denkbar, zur Unterstützung solcher Initiativen ein Bundesförderprogramm aufzulegen, um Kommunen zu helfen, denen es schwer fällt - so etwas kostet natürlich mehr, als wenn man einfach nur drauflosbaut -, entsprechende Beschlüsse zu fassen?",data/txt/17171.txt,speech,linke
2616493,171,17,0,"Enak Ferlemann, Parl. Staatssekretär beim Bundesminister für Verkehr, Bau und Stadtentwicklung",Enak Ferlemann,enak-ferlemann,168,"Sehr geehrte Frau Kollegin, denkbar wäre ein solches Programm.",data/txt/17171.txt,speech,
2616494,171,17,0,Dr. Ilja Seifert [DIE LINKE],Dr. Ilja Seifert,ilja-seifert,169,Dann tun Sie es doch!,data/txt/17171.txt,poi,linke
2616495,171,17,0,"Enak Ferlemann, Parl. Staatssekretär beim Bundesminister für Verkehr, Bau und Stadtentwicklung",Enak Ferlemann,enak-ferlemann,170,Dafür braucht man nur erhebliche zusätzliche Bundesmittel.,data/txt/17171.txt,speech,
2616496,171,17,0,Dr. Dagmar Enkelmann [DIE LINKE],Dr. Dagmar Enkelmann,dagmar-enkelmann,171,"Oder eine Umverteilung! Gut, wir verteilen um!",data/txt/17171.txt,poi,linke
2616497,171,17,0,"Enak Ferlemann, Parl. Staatssekretär beim Bundesminister für Verkehr, Bau und Stadtentwicklung",Enak Ferlemann,enak-ferlemann,172,,data/txt/17171.txt,speech,
2616498,171,17,0,Präsident Dr. Norbert Lammert,Dr. Norbert Lammert,norbert-lammert,173,Weitere Wortmeldungen außer lautstarken Appellen kann ich im Augenblick nicht registrieren.,data/txt/17171.txt,chair,
2616499,171,17,0,"Enak Ferlemann, Parl. Staatssekretär beim Bundesminister für Verkehr, Bau und Stadtentwicklung",Enak Ferlemann,enak-ferlemann,174,"Herr Präsident, wenn ich auf die Zwischenrufe eingehen darf: Es steht nicht der Bundesregierung zu, dieses Geld bereitzustellen. Das ist Sache des Bundestages. Da können Sie, Frau Kollegin, gerne einen entsprechenden Antrag stellen.",data/txt/17171.txt,speech,
2616500,171,17,0,Dr. Ilja Seifert [DIE LINKE],Dr. Ilja Seifert,ilja-seifert,175,Sie müssen es aber befürworten!,data/txt/17171.txt,poi,linke
2616501,171,17,0,,,,176,Weiterer Zuruf der Abg. Dr. Dagmar Enkelmann [DIE LINKE],data/txt/17171.txt,poi,
2616502,171,17,0,"Enak Ferlemann, Parl. Staatssekretär beim Bundesminister für Verkehr, Bau und Stadtentwicklung",Enak Ferlemann,enak-ferlemann,177,,data/txt/17171.txt,speech,
2616503,171,17,0,Präsident Dr. Norbert Lammert,Dr. Norbert Lammert,norbert-lammert,178,"Hier werden qua Zuruf wechselseitig interessante Anregungen ausgetauscht. Diese gehen alle zu Protokoll, und wir warten einmal ab, wer sie wann in welcher Weise aufgreift.

Ich bedanke mich, Herr Staatssekretär Ferlemann.

Ich rufe nun den Geschäftsbereich des Ministeriums für Umwelt, Naturschutz und Reaktorsicherheit auf.

Wenn ich es richtig sehe, ist der Kollege Nink nicht da. Seine beiden Fragen 18 und 19 werden schriftlich beantwortet.

Ich rufe die Frage 20 der Kollegin Sylvia Kotting-Uhl auf:

Welche aktuellen bzw. aus den letzten Jahren stammenden gemessenen Strahlenhöchstwerte/Ortsdosisleistungen bei Kavernenlagern/Lagern für mittelradioaktive Abfälle von AKW-Standorten (in Betrieb und in Stilllegung) sind dem Bundesministerium für Umwelt, Naturschutz und Reaktorsicherheit, BMU, durch schriftliche oder mündliche Auskünfte seitens Länder und/oder Betreiber bekannt (bitte je Lager möglichst mit Auskunfts- und Messdatum)?

Ich bitte die Kollegin, Frau Staatssekretärin Reiche, um Beantwortung.",data/txt/17171.txt,chair,
2616504,171,17,0,"Katherina Reiche, Parl. Staatssekretärin beim Bundesminister für Umwelt, Naturschutz und Reaktorsicherheit",Katherina Reiche,katherina-reiche,179,"Sehr geehrter Herr Präsident! Frau Kollegin Kotting-Uhl, ich beantworte Ihre Frage wie folgt: Dem Bundesumweltministerium ist durch die Veröffentlichung auf der Internetseite des Ministeriums für Justiz, Gleichstellung und Integration des Landes Schleswig-Holstein ein Messwert von 500 Millisievert pro Stunde in einer Kaverne des Kernkraftwerks Brunsbüttel zwischen den dort lagernden Fässern bekannt. Sperrbereiche wie die -Kavernen und Lagerstätten sind gemäß Strahlenschutzverordnung grundsätzlich nicht zugänglich. Durch Abschirmungen wird sichergestellt, dass außerhalb der Sperrbereiche gefahrlos gearbeitet werden kann. Zur Vermeidung von Gesundheitsgefährdungen werden in Kontrollbereichen Ortsdosisleistungen von fest installierten Messeinrichtungen permanent überwacht. Diese Daten liegen den Aufsichtsbehörden der Länder vor.",data/txt/17171.txt,speech,
2616505,171,17,0,Präsident Dr. Norbert Lammert,Dr. Norbert Lammert,norbert-lammert,180,"Bitte sehr, Zusatzfrage.",data/txt/17171.txt,chair,
