id,sitzung,wahlperiode,in_writing,speaker,speaker_cleaned,speaker_fp,sequence,text,filename,type,speaker_party
2078945,179,17,0,,,,591,"Ihnen geht es nur darum, schnell etwas mit der heißen Nadel zu stricken und ein bisschen Wahlkampf zu betreiben. Dabei spielen Sie mit den Ängsten der Menschen.",data/txt/17179.txt,speech,
2078946,179,17,0,Florian Pronold [SPD],Florian Pronold [SPD],florian-pronold-spd,592,Bei der Wohnraumförderung fördern wir ärmere Haushalte und ärmere Vermieter!,data/txt/17179.txt,poi,spd
2078947,179,17,0,,,,593,"- Das können Sie gleich alles erzählen, Herr Pronold. Hören Sie noch kurz zu; dann können Sie vielleicht noch etwas lernen.

Zur Heizkostenersparnis. Es geht nicht um die Nettokaltmiete, sondern es geht darum, dass die Heizkosten reduziert werden. Die energetische Sanierung eines Gebäudes kann in einzelnen Schritten umgesetzt werden: Da werden die Fenster oder die Heizungsanlage ausgewechselt, eine Gebäudedämmung wird angebracht, das Dach wird neu isoliert. Dann reduzieren sich die Heizkosten. Wer profitiert davon?",data/txt/17179.txt,speech,
2078948,179,17,0,Iris Gleicke [SPD],Iris Gleicke [SPD],iris-gleicke-spd,594,"Dann handelt es sich nicht um Modernisierung, sondern um Instandsetzung! Sie haben keine Ahnung!",data/txt/17179.txt,poi,spd
2078949,179,17,0,,,,595,"Ist es der private Vermieter? Es sind die Mieter, die an dieser Stelle profitieren; denn bei denen reduzieren sich die Nebenkosten. Unterhalten Sie sich doch einmal mit einem Mieter; ich glaube, Sie haben davon keine Ahnung.",data/txt/17179.txt,speech,
2078950,179,17,0,,,,596,Beifall bei der FDP und der CDU/CSU,data/txt/17179.txt,poi,
2078951,179,17,0,,,,597,"Ich möchte Ihnen zu Ihrem anderen Antrag auch noch etwas aufzeigen: Im Rahmen der Föderalismusreform haben wir eine neue Regelung getroffen; darüber verhandeln derzeit der Bund und die Länder. Es wird geprüft, wie man ein Gesamtpaket schnüren kann, um die Bindung hinsichtlich der Ausgleichszahlungen fortzuführen, die nur bis 2014 läuft. Insofern kann ich Ihnen an dieser Stelle zustimmen. Es gilt, die Aufgabenerfüllung bis 2019 oder darüber hinaus sicherzustellen. Ich bin zuversichtlich, dass das gelingen wird.

Ansonsten finden sich in diesem Antrag lediglich Lippenbekenntnisse, die zu nichts führen werden. Auch hier habe ich Ihnen eine Zahl aus dem größten deutschen Bundesland herausgesucht: Ihr heutiger Antrag ist schon deshalb bemerkenswert, weil die rot-grüne Landesregierung 2011, gerade erst ins Amt gekommen, direkt die Wohnraumförderung um 20 Prozent gekürzt hat, obwohl in Ihrem Wahlprogramm noch eine Festschreibung auf 1 Milliarde Euro stand.

So viel zur Glaubwürdigkeit der Sozialdemokraten.",data/txt/17179.txt,speech,
2078952,179,17,0,Petra Merkel [Berlin] [SPD],Petra Merkel [Berlin] [SPD],petra-merkel-berlin-spd,598,Ach Quatsch!,data/txt/17179.txt,poi,spd
2078953,179,17,0,,,,599,"Deshalb werden wir die Anträge, die Sie vorgelegt haben, kraftvoll ablehnen.

Danke schön.",data/txt/17179.txt,speech,
2078954,179,17,0,,,,600,Beifall bei der FDP und der CDU/CSU,data/txt/17179.txt,poi,
2078955,179,17,0,Iris Gleicke [SPD],Iris Gleicke [SPD],iris-gleicke-spd,601,Oje!,data/txt/17179.txt,poi,spd
2078956,179,17,0,,,,602,"Vizepräsident Dr. h. c. Wolfgang Thierse:

Das Wort hat nun Daniela Wagner für die Fraktion Bündnis 90/Die Grünen.

Daniela Wagner (BÜNDNIS 90/DIE GRÜNEN):

Herr Präsident! Verehrte Kolleginnen und Kollegen! Die Situation auf dem deutschen Wohnungsmarkt ist schnell umrissen - in vielen Punkten sind wir uns relativ einig -: Auf der einen Seite gibt es Probleme durch zunehmenden Leerstand, auf der anderen Seite gibt es absurde Preisentwicklungen in bestimmten Ballungsräumen, zum Beispiel im Rhein-Main-Gebiet, im Großraum München, im Großraum Stuttgart und in Teilen Berlins. Das sind die Probleme, auf die wir im Moment reagieren müssen. Es gibt zudem eine Zunahme der Zahl von Haushalten, die sich aufgrund ihrer Einkommensverhältnisse nicht mehr mit Wohnungen über den freien Wohnungsmarkt versorgen können.

Die entscheidenden Herausforderungen bilden die Energiewende und der demografische Wandel. Grundsätzlich ist festzuhalten: Die umfassende energetische Gebäudesanierung ist kein Selbstzweck, sondern sie ist angesichts der stetig steigenden Energiekosten notwendig, damit das Wohnen bezahlbar bleibt und der Klimawandel aufgehalten werden kann.",data/txt/17179.txt,speech,
2078957,179,17,0,,,,603,Beifall beim BÜNDNIS 90/DIE GRÜNEN,data/txt/17179.txt,poi,
2078958,179,17,0,,,,604,"Aber auch für die Eigentümerinnen und Eigentümer sowie Vermieterinnen und Vermieter muss die Bereitstellung von Wohnraum finanzierbar bleiben. Deswegen müssen die mietrechtlichen Schrauben so gestellt werden, dass die energetische Gebäudesanierung einerseits befördert wird und auf der anderen Seite die Mieterinnen und Mieter vor Verdrängungseffekten geschützt werden.",data/txt/17179.txt,speech,
2078959,179,17,0,,,,605,Beifall beim BÜNDNIS 90/DIE GRÜNEN sowie der Abg. Iris Gleicke [SPD] und Johanna Voß [DIE LINKE],data/txt/17179.txt,poi,
2078960,179,17,0,,,,606,"Dabei darf das Mietrecht nicht isoliert betrachtet werden; denn es ist nicht seine primäre Aufgabe, die energetische Gebäudesanierung voranzutreiben, es darf ihr lediglich nicht im Weg stehen.

Die energetische Gebäudesanierung muss in erster Linie durch entsprechende Förderprogramme und gegebenenfalls durch das Ordnungsrecht sichergestellt werden. Bei Förderprogrammen liegt die Betonung vor allen Dingen auf verlässlich. Es darf nicht sein, dass es jedes Jahr neue Wasserstandsmeldungen gibt, dass das, was man im Januar geplant hat, schon im September Makulatur sein kann, weil es keine Fördermittel mehr gibt. Verlässlichkeit heißt, dass der Bürger genau weiß, dass er auch noch in einem Jahr damit rechnen kann, dass die Zuschüsse zur energetischen Gebäudesanierung fließen.",data/txt/17179.txt,speech,
2078961,179,17,0,,,,607,Beifall beim BÜNDNIS 90/DIE GRÜNEN,data/txt/17179.txt,poi,
2078962,179,17,0,,,,608,"Das Mietrecht ist lediglich dazu da, die unterschiedlichen und auf Mieterseite auch berechtigten Interessen auszugleichen. Der Antrag der SPD bezieht sich hauptsächlich auf den Referentenentwurf der Bundesregierung vom Oktober 2011, der wie in der Echternacher Springprozession seltsam vor- und zurückrückt, aber nie so richtig den Sprung in den Plenarsaal schafft. Vielleicht schaffen Sie es ja noch vor der nächsten Bundestagswahl, wenn nicht, lassen Sie es einfach bleiben.",data/txt/17179.txt,speech,
2078963,179,17,0,,,,609,Beifall der Abg. Lisa Paus [BÜNDNIS 90/DIE GRÜNEN],data/txt/17179.txt,poi,
2078964,179,17,0,Florian Pronold [SPD],Florian Pronold [SPD],florian-pronold-spd,610,Das wäre besser!,data/txt/17179.txt,poi,spd
2078965,179,17,0,,,,611,"Sie lehnen die Aufhebung des Mietminderungsrechts für drei Monate bei energetischen Sanierungen ab. Das sehen wir ähnlich, insbesondere auch auf der Grundlage der rechtspolitischen Unsicherheiten; denn das Recht auf Mietminderung stellt auf das Vorhandensein von bestimmten Eigenschaften des Wohnraums bei Vertragsabschluss und auf seinen Nutzwert ab und weniger auf die gute Motivation des Vermieters. Wir meinen, wenn der Nutzwert gemindert ist - aus welchen Gründen auch immer -, dann ist das Mietminderungsrecht das Instrument der Wahl, natürlich auch in den ersten drei Monaten.",data/txt/17179.txt,speech,
2078966,179,17,0,,,,612,Beifall beim BÜNDNIS 90/DIE GRÜNEN sowie bei Abgeordneten der SPD,data/txt/17179.txt,poi,
2078967,179,17,0,,,,613,"Sie wollen, dass den Kommunen ein Interventionsrecht gegen Maßnahmen zur Wohnwertsteigerung eingeräumt wird, um prekäre Mietsituationen zu vermeiden. Ich nehme stark an, Sie meinen in diesem Zusammenhang Luxussanierungen und Gentrifizierungsprozesse. Allerdings unterlassen Sie es, die Instrumentarien zu benennen. Wir halten zwei Instrumente zur Begrenzung von Wieder- und Neuvertragsmieten für notwendig. Wir wollen im BauGB bei der Ausweisung von Sanierungs- und Milieuschutzgebieten wieder Mietobergrenzen nach §§ 142 und 144 - Sanierungssatzung - und § 172 - Erhaltungssatzung - ermöglichen.

Außerdem wollen wir im BGB die Landesregierungen ermächtigen, in Kommunen oder deren Teilgebieten Mietobergrenzen einzuführen, wenn in einem bestimmten Quartier ein Wohnraummangel vorherrschend ist. Ich denke, das sind geeignete Instrumente, um punktuell und situationsgerecht Abhilfe zu schaffen.",data/txt/17179.txt,speech,
2078968,179,17,0,,,,614,Beifall beim BÜNDNIS 90/DIE GRÜNEN,data/txt/17179.txt,poi,
2078969,179,17,0,,,,615,"Sie wollen ebenso wie wir die Modernisierungsumlage nach § 559 BGB von 11 auf 9 Prozent absenken. Sie schlagen die Prüfung einer zeitlichen Begrenzung vor. Wir haben uns lange mit der zeitlichen Begrenzung befasst, sind aber zu dem Schluss gekommen, dass das in der Praxis sehr schwierig zu realisieren ist; denn Sie müssten die Miete theoretisch irgendwann wieder inflationsbereinigt absenken. Das könnte unter Umständen sehr kompliziert werden und an der Praxis scheitern. Der Gedanke ist natürlich nicht ganz von der Hand zu weisen.

Für uns ist entscheidend, dass die Mieterinnen und Mieter durch die Modernisierungsumlage eine Entlastung bzw. Wohnwertsteigerung erhalten und dass sie nicht zu unnötigen Luxusmodernisierungen führt. Deswegen wollen auch wir die Umlagemöglichkeit der Höhe nach begrenzen. Wir wollen sie darüber hinaus aber auch auf die energetische Sanierung und den altersgerechten Umbau begrenzen. Das ist aus unserer Sicht vordringlich. Das muss finanziert werden. Alles andere kann unterbleiben, weil es sich dabei schlicht und ergreifend um Luxusmodernisierungen handelt, die sich der Mieter leisten können muss. Solche Modernisierungen muss der Vermieter nicht vom Mieter erstattet bekommen.

In Ihrem Antrag fehlt uns eine energiepolitische Weichenstellung. Sie haben zum Beispiel nicht gefordert, die energetische Gebäudebeschaffenheit im Rahmen der ortsüblichen Vergleichsmiete zu berücksichtigen, also so etwas wie einen ökologischen Mietspiegel. Das wäre aber richtig.",data/txt/17179.txt,speech,
2078970,179,17,0,,,,616,Beifall beim BÜNDNIS 90/DIE GRÜNEN,data/txt/17179.txt,poi,
2078971,179,17,0,Sebastian Körber [FDP],Sebastian Körber [FDP],sebastian-korber-fdp,617,Stimmt nicht!,data/txt/17179.txt,poi,fdp
2078972,179,17,0,,,,618,"Es ist richtig, Zuschläge für einen hervorragenden Gebäudezustand vorzusehen. Bei einer schlechten energetischen Gebäudebeschaffenheit müssen auch Abschläge möglich sein oder gegebenenfalls beides in Kombination. Das wäre im Rahmen von Mietspiegel und ortsüblicher Vergleichsmiete ein richtiges Instrument, um dem Ziel näherzukommen. Es gibt inzwischen ein paar Städte, die einen ökologischen Mietspiegel haben. Das funktioniert.

Die Kappungsgrenze wollen Sie von 20 auf 15 Prozent absenken. Das sehen wir auch so.

Weiterhin wollen wir den Klimaschutz in die Interessenabwägung nach § 554 BGB aufnehmen.

Zum Thema Contracting. Wenn es mehr als zwei Vertragspartner gibt, ist das nicht ganz unkompliziert. Deswegen sagen wir nur so viel: Die wirtschaftlichen Vorteile, die der Vermieter aus einem Vertrag mit dem Contractor zieht, sollten auch dem Mieter bzw. der Mieterin zugutekommen.",data/txt/17179.txt,speech,
2078973,179,17,0,,,,619,Beifall beim BÜNDNIS 90/DIE GRÜNEN,data/txt/17179.txt,poi,
2078974,179,17,0,,,,620,"Zu Ihren Einlassungen zu Mietnormaden: Das sehen wir ähnlich. Zu den Einlassungen der Bundesregierung: Das halten wir für falsch. Wir sind der Meinung, dass wir nicht den Rechtsschutz aller Mieterinnen und Mieter wegen einer verschwindend geringen Anzahl von Fällen einschränken dürfen. Wir sind der Auffassung, dass das geltende Recht vollkommen ausreicht.

Lassen Sie mich zum Schluss noch ein Wort zur sozialen Wohnraumförderung, zu der Sie auch einen Antrag gestellt haben, sagen. Eingangs ist von anderen Rednern schon betont worden, dass der Anteil derjenigen, die sich auf dem freien Wohnungsmarkt aufgrund ihres Einkommens nicht mehr mit Wohnraum versorgen können, ständig wächst. Wir sind der Auffassung, dass es besorgniserregend wäre, wenn die Entflechtungsmittel ab 2013 auslaufen sollten und wir dann allein auf die Bemühungen der Länder angewiesen wären. Bis jetzt gibt es nur in sieben Bundesländern Wohnraumförderungsgesetze. Wir wissen nicht, was aus der Wohnraumförderung wird. Wir wissen aber, dass im Moment jährlich etwa 100 000 Wohnungen aus der Sozialbindung fallen. Deswegen muss dringend dafür Sorge getragen werden, dass die soziale Wohnraumförderung über 2013, am besten über 2019 hinaus verstetigt wird, damit nicht ein wachsender Anteil der Bevölkerung überhaupt keinen Wohnraum mehr findet.

Wir halten es für ganz besonders wichtig, dass Anreize geschaffen werden, damit private Eigentümer in ihren Quartieren oder, wie man in Berlin so schön sagt, in ihren Kiezen sozialgebundenen Wohnraum durch Verkauf von Belegungsrechten an die Stadt oder an den Bezirk zur Verfügung stellen. Es erscheint uns als ganz besonders wichtig, dafür zu sorgen, dass in den schönen Kiezen nicht nur Oberstu-dienräte und Bundestagsabgeordnete wohnen und am Stadtrand in den Plattenbausiedlungen - meist in schlecht isolierten Wohnungen - diejenigen, die auf dem Wohnungsmarkt kaum mehr reüssieren können, die sich sogar schon bei mittleren Einkommen im Grunde genommen nicht mehr mit adäquatem Wohnraum versorgen können.

Das war der Grund, warum einmal die vereinbarte Förderung erfunden worden ist. Die Krankenschwester ist zu reich für den sozialen Wohnungsbau, aber auch viel zu arm für den freien Wohnungsmarkt. Es ist ganz wichtig, dass eine soziale Mischung dadurch geschaffen wird, dass der Rückkauf von Belegungsbindungen attraktiv wird. Dazu brauchen wir den Fortbestand der Entflechtungsmittel über das Jahr 2019 hinaus.

Ich danke Ihnen für Ihre Aufmerksamkeit.",data/txt/17179.txt,speech,
2078975,179,17,0,,,,621,Beifall beim BÜNDNIS 90/DIE GRÜNEN,data/txt/17179.txt,poi,
2078976,179,17,0,,,,622,"Vizepräsident Dr. h. c. Wolfgang Thierse:

Das Wort hat nun Gero Storjohann für die CDU/CSU-Fraktion.",data/txt/17179.txt,speech,
2078977,179,17,0,,,,623,Beifall bei der CDU/CSU und der FDP,data/txt/17179.txt,poi,
2078978,179,17,0,,,,624,"Gero Storjohann (CDU/CSU):

Herr Präsident! Meine sehr verehrten Damen und Herren! Liebe Kolleginnen und Kollegen! Soziales Mietrecht erhalten und klimagerecht verbessern - jawohl. Soziale Wohnraumförderung durch Bund und Länder bis 2019 fortführen - jawohl. Ich glaube, hier im Hause besteht eine große Einigkeit.",data/txt/17179.txt,speech,
2078979,179,17,0,Florian Pronold [SPD],Florian Pronold [SPD],florian-pronold-spd,625,Das haben andere Redner vorher nicht so gezeigt!,data/txt/17179.txt,poi,spd
2078980,179,17,0,,,,626,"Hier wird der Eindruck vermittelt, dass etwas anderes geplant ist. Mit Ihren Anträgen möchten Sie - vergeblich - den Eindruck erwecken, dass kein Mietrechtsänderungsgesetz auf dem Weg ist. Über dieses gute Mietrechtsänderungsgesetz wird hier sehr kurzfristig wieder debattiert werden.",data/txt/17179.txt,speech,
2078981,179,17,0,Zurufe von der SPD und dem BÜNDNIS 90/DIE GRÜNEN,e von der SPD und dem BÜNDNIS 90/DIE GRÜNEN,e-spd-und-dem-bundnis-90-die-grunen,627,Wann denn?,data/txt/17179.txt,poi,gruene:spd
2078982,179,17,0,,,,628,- Das wird der Präsident im Ältestenrat festlegen.,data/txt/17179.txt,speech,
2078983,179,17,0,Florian Pronold [SPD],Florian Pronold [SPD],florian-pronold-spd,629,Dazu muss es einen Gesetzentwurf geben!,data/txt/17179.txt,poi,spd
2078984,179,17,0,,,,630,Unser gutes soziales Mietrecht werden wir als Koalition weiter verbessern.,data/txt/17179.txt,speech,
2078985,179,17,0,Florian Pronold [SPD],Florian Pronold [SPD],florian-pronold-spd,631,Nee!,data/txt/17179.txt,poi,spd
2078986,179,17,0,,,,632,Nach unserer Auffassung bestehen Regelungslücken. Diese werden wir schließen.,data/txt/17179.txt,speech,
2078987,179,17,0,,,,633,Beifall bei Abgeordneten der CDU/CSU und der FDP,data/txt/17179.txt,poi,
2078988,179,17,0,,,,634,"Der Wohnungs- und Immobilienmarkt in Deutschland ist stabil. Er war in den letzten Jahren ein stabilisierender Faktor der deutschen Konjunktur, und das auch in Zeiten der internationalen Wirtschaftskrise. Mit ihrem Antrag zur sozialen Wohnraumförderung schrammt die SPD-Fraktion an den Vorgaben des Grundgesetzes nicht nur zielgenau vorbei, sondern vermittelt auch noch einen falschen Eindruck.

Die christlich-liberale Koalition",data/txt/17179.txt,speech,
2078989,179,17,0,Caren Marks [SPD],Caren Marks [SPD],caren-marks-spd,635,Oh! Schwarz-Gelb!,data/txt/17179.txt,poi,spd
2078990,179,17,0,Florian Pronold [SPD],Florian Pronold [SPD],florian-pronold-spd,636,"Das müssen Sie jetzt vorlesen, damit Sie es fehlerfrei herausbekommen!",data/txt/17179.txt,poi,spd
2078991,179,17,0,,,,637,ist sich ihrer Verantwortung für die soziale Wohnraumförderung in Deutschland sehr wohl bewusst. Bekanntlich ist die Kompetenz für die soziale Wohnraumförderung durch die Föderalismusreform vom Bund auf die Länder übertragen worden.,data/txt/17179.txt,speech,
2078992,179,17,0,,,,638,Zuruf des Abg. Florian Pronold [SPD],data/txt/17179.txt,poi,
2078993,179,17,0,,,,639,"Das, Herr Pronold, haben wir in der Großen Koalition sogar gemeinsam beschlossen.",data/txt/17179.txt,speech,
2078994,179,17,0,,,,640,Lachen der Abg. Caren Marks [SPD],data/txt/17179.txt,poi,
2078995,179,17,0,,,,641,"Es wurde vereinbart, dass der Bund den Ländern hierfür jährlich bis 2013 über 500 Millionen Euro Kompensa-tionsleistungen zahlt.",data/txt/17179.txt,speech,
2078996,179,17,0,Daniela Wagner [BÜNDNIS 90/DIE GRÜNEN],Daniela Wagner [BÜNDNIS 90/DIE GRÜNEN],daniela-wagner-bundnis-90-die-grunen,642,Dagegen hat auch niemand etwas!,data/txt/17179.txt,poi,gruene
2078997,179,17,0,,,,643,"Derzeit verhandelt der Bund mit den Ländern über die Fortzahlung. Ab 2019 sollen die Zahlungen endgültig enden. Frau Wagner hat hier vorgeschlagen, diese Zahlungen über 2019 hinaus fortzuführen. Ich glaube, wir sollten uns an das halten, was wir gemeinsam vereinbart haben. Die CDU/CSU steht zu den Ergebnissen der Föderalismusreform",data/txt/17179.txt,speech,
2078998,179,17,0,,,,644,Beifall bei Abgeordneten der CDU/CSU,data/txt/17179.txt,poi,
2078999,179,17,0,,,,645,"und den sie begleitenden Übergangsregelungen. Wir nehmen aber auch die Unterstützung sozial schwächerer Haushalte bei der Wohnraumversorgung sehr ernst. Wesentliche Maßnahmen sind hier das Wohngeld und die Wohnraumförderung; die Verantwortung hierfür liegt seit der Föderalismusreform allein bei den Ländern.

Es ist Ausdruck des Sozialstaatsprinzips, dass der Staat den Menschen Unterstützung gewährt, die sich nicht aus eigener Kraft angemessen mit Wohnraum versorgen können. Wir wollen dafür sorgen, dass würdevolles Wohnen auch in Zukunft möglich ist. Die Gründe, aus denen Menschen soziale Wohnraumförderung in Anspruch nehmen, sind vielfältig: Das Haushaltseinkommen ist zu niedrig. Kinderreiche Haushalte benötigen besonders große Wohnungen. Menschen mit Behinderungen sind auf barrierefreie Wohnungen angewiesen. Diese besonderen Bedürfnisse werden durch den Markt mitunter noch nicht ausreichend bzw. nicht zu vertretbaren Preisen befriedigt.

Sozial benachteiligte Menschen profitieren besonders von unseren Anstrengungen im Bereich der sozialen Wohnraumförderung. Ihnen werden auf diese Weise preiswerte Wohnungen zur Verfügung gestellt. Traditionell hatte der soziale Wohnungsbau das Ziel, Wohnungsmangel zu beheben. Der Fokus hat sich jetzt verständlicherweise verschoben. Die soziale Wohnraumförderung ist besonders geeignet, unsere Stadtentwicklung wesentlich mitzugestalten, vor allem in den benachteiligten Stadtvierteln.

Die CDU/CSU-Fraktion setzt sich dafür ein, dass Wohnraum bezahlbar bleibt. Sie setzt sich dafür ein, dass die energetische Sanierung des Wohnungsbestandes, auch des sozialen Wohnraumbestandes, erfolgen kann. Die Bundesregierung hat dafür Planungssicherheit geschaffen. In den nächsten Jahren werden 1,5 Milliarden Euro für die CO2-Gebäudesanierung zur Verfügung gestellt. Damit das Wohnen bezahlbar bleibt, sind auch ausgewogene Änderungen des bestehenden Mietrechts notwendig. In Kürze wird von uns ein Mietrechtsänderungsantrag vorgelegt. Ich gehe fest davon aus, noch im Mai.",data/txt/17179.txt,speech,
2079000,179,17,0,Florian Pronold [SPD],Florian Pronold [SPD],florian-pronold-spd,646,In diesem Jahr oder im nächsten? Welcher Mai?,data/txt/17179.txt,poi,spd
2079001,179,17,0,,,,647,"- Der Mai ist ja immer der schönste Monat. Ich gehe davon aus, in diesem Mai.",data/txt/17179.txt,speech,
2079002,179,17,0,Florian Pronold [SPD],Florian Pronold [SPD],florian-pronold-spd,648,Der ist schon!,data/txt/17179.txt,poi,spd
2079003,179,17,0,Ingo Egloff [SPD],Ingo Egloff [SPD],ingo-egloff-spd,649,Wir haben doch schon Mai!,data/txt/17179.txt,poi,spd
2079004,179,17,0,Caren Marks [SPD],Caren Marks [SPD],caren-marks-spd,650,Selbst den Mai hat die Regierung verschlafen!,data/txt/17179.txt,poi,spd
2079005,179,17,0,,,,651,"- Sie haben ja sehr deutlich gemacht, Herr Egloff, dass Sie alle notwendigen Änderungen im Mietrecht ablehnen; das entnehme ich Ihrem vorliegenden Antrag.

Die Koalition verfolgt zwei Ziele. Wir wollen den Mietbestand sanieren, um unsere Klimaschutzziele zu erreichen. Hierdurch gelingt es uns, die immer weiter steigenden Nebenkosten für die Energieversorgung für die Mieter zu begrenzen. Das ist unverzichtbar; denn Wohnraum muss bezahlbar bleiben.",data/txt/17179.txt,speech,
2079006,179,17,0,Caren Marks [SPD],Caren Marks [SPD],caren-marks-spd,652,Na ja! Das hört sich ja nicht gerade überzeugend an!,data/txt/17179.txt,poi,spd
2079007,179,17,0,,,,653,"Darüber hinaus soll durch Änderungen im Mietrecht Mietbetrügern das Handwerk gelegt werden. Ich habe das hier schon einmal ausgeführt: Mein Vermieter ist von einem Mietnomaden massiv betroffen, und das, obwohl er sich verhältnismäßig professionell verhält. Das heißt, er hat jedes Mal Titel für eine Räumung erwirkt, wenn nicht gezahlt wurde. Jedes Mal gab es ein Untermietverhältnis. Nachdem die Mehrfachuntervermietung innerhalb der Familie oder innerhalb des Bekanntenkreises nachgewiesen wurde, hat er versucht, den Porsche aus der Tiefgarage zu bekommen. Auch in der Tiefgarage wurde ein Untervermietungsverhältnis nachgewiesen. Und das alles im schönen Hamburg, Herr Egloff! Ich bin gerne bereit, mit Ihnen über diesen Fall zu sprechen, damit Sie wenigstens einmal erkennen, dass es hier ein Problem gibt, das mit der jetzigen Rechtslage nicht zu lösen ist - oder es liegt an der Richterschaft; ich weiß es nicht.",data/txt/17179.txt,speech,
2079008,179,17,0,,,,654,Beifall bei der CDU/CSU und der FDP,data/txt/17179.txt,poi,
2079009,179,17,0,Ingo Egloff [SPD],Ingo Egloff [SPD],ingo-egloff-spd,655,"Aber das ist doch kein Massenphänomen, Herr Kollege! Und Sie treffen damit alle Mieter!",data/txt/17179.txt,poi,spd
2079010,179,17,0,,,,656,"Die Frage ist doch: Will die SPD kriminelle Mieter zukünftig weiterhin schützen? Wir meinen, dies ist ein Thema, das wir anpacken müssen.",data/txt/17179.txt,speech,
2079011,179,17,0,,,,657,Beifall bei der CDU/CSU,data/txt/17179.txt,poi,
2079012,179,17,0,,,,658,Widerspruch bei der SPD,data/txt/17179.txt,poi,
2079013,179,17,0,Burkhard Lischka [SPD],Burkhard Lischka [SPD],burkhard-lischka-spd,659,Aber dieses Problem sollen bei Ihnen Millionen von Mietern ausbaden! Unglaublich!,data/txt/17179.txt,poi,spd
2079014,179,17,0,Weiterer Zuruf von der SPD,von der SPD,von-der-spd,660,Das sind doch Einzelfälle!,data/txt/17179.txt,poi,spd
2079015,179,17,0,,,,661,"Die Fraktion der CDU/CSU wird das nicht tatenlos hinnehmen. Wir bleiben dabei, dass wir hier dringenden Handlungsbedarf sehen.

Die SPD-Fraktion schreibt sich auch den Umweltschutz auf die Fahnen. Aber wenn es beim Mietrecht konkret wird, dann ducken Sie sich natürlich weg. Wir verfolgen das Ziel, den Wärmebedarf im Gebäudebereich bis zum Jahr 2020 um 20 Prozent zu senken. Dafür brauchen wir ein Anreizsystem; denn das passiert nicht von alleine. Investitionshemmende Regelungen im Mietrecht müssen entschärft werden, damit die Vermieter überhaupt eine energetische Sanierung vornehmen. Wir streiten ja nur darüber, was letzten Endes hilft. Ich glaube, wir sollten generell dazu übergehen, solche Hemmnisse abzubauen.",data/txt/17179.txt,speech,
2079016,179,17,0,Ingo Egloff [SPD],Ingo Egloff [SPD],ingo-egloff-spd,662,"Aber es muss noch sozial verträglich sein, Herr Kollege!",data/txt/17179.txt,poi,spd
2079017,179,17,0,,,,663,"- Selbstverständlich. Es gehört ja zur Sozialverträglichkeit, dafür zu sorgen, dass die Nebenkosten im Hinblick auf den Wärmebedarf geringer werden. Wir sind auf dem Weg, dies auszutarieren. Aber zu sagen, dass das nicht passieren soll, ist, glaube ich, keine Lösung. Ich denke, das wollen Sie im Ergebnis auch nicht. Also: Wir laden Sie ein, hier auf uns zuzugehen.",data/txt/17179.txt,speech,
2079018,179,17,0,,,,664,Lachen des Abg. Florian Pronold [SPD],data/txt/17179.txt,poi,
