id,sitzung,wahlperiode,in_writing,speaker,speaker_cleaned,speaker_fp,sequence,text,filename,type,speaker_party
2078656,179,17,0,,,,302,"Aber klar ist: Der deutsch-französische Motor wird trotz einiger Misstöne im Wahlkampf weiterlaufen. Die Vergangenheit hat gezeigt, dass über Parteigrenzen -hinweg gut zusammengearbeitet wird, ob es Giscard dEstaing und Schmidt waren, Kohl und Mitterrand oder Schröder und Chirac. Das ist im Interesse beider Länder dringend notwendig und unabdingbar für den Erfolg Europas. Die deutsch-französische Freundschaft ist Staatsräson in Deutschland und in Frankreich, und das ist auch gut so.",data/txt/17179.txt,speech,
2078657,179,17,0,,,,303,Beifall bei Abgeordneten der SPD,data/txt/17179.txt,poi,
2078658,179,17,0,,,,304,"Helmut Kohl sagte einmal: Ich weiß nicht, was der französische Staatspräsident denkt, aber ich denke dasselbe. Dieser Satz ist heute vielleicht nicht mehr wahr. Auch das müssen wir ansprechen und diskutieren. Gerade wenn es um den Euro geht, gibt es konzeptionell große Unterschiede. Wir stehen vor einer großen europapolitischen Herausforderung.

Wenn Herr Hollande - wie auch Herr Sarkozy - Wachstum auf Pump finanzieren will, eine andere EZB als die Koalition und eine Aufweichung der Stabilitätsregeln will, muss darüber nachgedacht werden. In der griechischen Innenpolitik berufen sich die Parteien auf die Gedanken des neuen Präsidenten und wollen die Schuldenrückzahlungen kippen. Das hilft den Griechen nicht weiter, und es ist nicht verhandelbar. Ich hoffe, dass der neue französische Präsident diesen Fehler korrigiert.

Sie haben eben gesagt, man dürfe die Politik kritisieren; das haben Sie bei Sarkozy gemacht. Der Wahlsieg von François Hollande basiert auf Versprechungen, die so nicht einzuhalten sind: Senkung der Mehrwertsteuer, Renteneintrittsalter mit 60, Einfrieren der Benzinpreise. Er lehnt die Schuldenbremse ab - ich hoffe, dass sich die SPD hierzu einmal positioniert - und will sie nicht in die nationale Verfassung übernehmen. Ich halte das für einen Fehler.

Ich hoffe, dass er nicht den gleichen Fehler macht wie François Mitterrand in den 80er-Jahren, der nach zwei Jahren völlig verfehlter Schuldenpolitik erst im Jahr 1983 die Wende geschafft hat. Diese unbequeme Botschaft müssen wir mit unseren französischen Freunden diskutieren. Frankreich muss Partner bleiben, wenn es darum geht, wieder eine Stabilitätskultur in Europa zu etablieren. Alleine schaffen wir das nicht. Dazu brauchen wir unsere französischen Freunde. Wir stehen jetzt vor einer zentralen europapolitischen Herausforderung.",data/txt/17179.txt,speech,
2078659,179,17,0,,,,305,Beifall bei der FDP und der CDU/CSU,data/txt/17179.txt,poi,
2078660,179,17,0,,,,306,"Nicht nur die Wahlen in Frankreich zeigen deutlich, welchen Einfluss die Politik anderer Länder mittlerweile auf Europa, den Euro und damit auch auf uns hat, wenn mühsam ausgehandelte Verträge wieder aufgeschnürt werden. Auch in Griechenland wurde am Sonntag gewählt. Dort gestaltet sich die Regierungsbildung leider äußerst schwierig. Die einstigen Volksparteien wurden abgestraft; beide haben das Land an die Wand gefahren und damit die Krise der Währungsunion mit ausgelöst.

In Griechenland steht für Europa viel auf dem Spiel. Wir müssen uns angesichts des instabilen politischen Systems Sorgen machen; denn dadurch wird das wackelige Wirtschaftssystem nicht gerade stabilisiert. Das eigentliche Problem besteht darin, dass viele Griechen bei der Stimmabgabe gedacht haben, die harten Sparauflagen könnten nachverhandelt werden. Das fordern jetzt auch alle Parteien. Dabei muss Griechenland in jedem Fall sparen, weil das strukturelle Defizit schon ohne Zinszahlungen riesengroß ist.

Die Zeit drängt. Ich glaube, es ist gut und richtig, dass sowohl die Europäische Kommission als auch die deutsche Bundesregierung klar gesagt haben, dass Verträge eingehalten werden müssen. Solidarität ist keine Einbahnstraße. Vertragstreue ist ein zentraler europäischer Wert; immerhin leben wir in Europa in einer Gemeinschaft des Rechts.

Das Kernproblem liegt darin, dass 80 Prozent der griechischen Bevölkerung, also eine große Mehrheit, den Euro wollen, aber keine Parteien wählen, die diesen Kurs unterstützen. Wir haben großes Interesse daran, dass Griechenland auf europäischem Kurs bleibt. Es muss klarer gesagt werden, was die Konsequenzen einer unkontrollierten Staatspleite in Griechenland wären.

Ich bin der festen Überzeugung, dass die neue griechische Regierung sowie das griechische Volk eine Grundsatzentscheidung treffen müssen, denn ein Ja zum Euro, aber ein Nein zu den verabredeten Auflagen passen nicht zusammen. Diese Frage muss in Griechenland klar beantwortet werden.

Die Krise des Euro ist im Kern eine Staatsschuldenkrise. Da hilft die vulgäre Kapitalismuskritik nur wenig weiter. Die Staaten müssen sich unabhängiger von den Finanzmärkten machen, indem sie weniger Schulden haben. Neben dem Sparkurs brauchen wir eine nachhaltige Wachstumspolitik, das ist völlig klar. Das Ganze muss aber auf finanzpolitischer Solidität aufbauen, denn weder der Euro noch der Markt zerstören die Fundamente in Europa. Vielmehr ist es das süße Gift der Schulden. Es muss uns gelingen, den Euro zu stabilisieren; denn sonst wird in allen Ländern Europas nicht nur der Euro, sondern auch das europäische Projekt infrage gestellt.

Präsident Dr. Norbert Lammert:

Herr Kollege.

Oliver Luksic (FDP):

Ich komme zum Schluss. - Deswegen ist es wichtig, liebe Kolleginnen und Kollegen von SPD und Grünen, dass Sie in Bezug auf den ESM und den Fiskalpakt nicht wieder den gleichen Fehler machen wie 2010, als Sie sich wegen der NRW-Wahl beim ersten Griechenlandpaket aus der Verantwortung gestohlen haben. Machen Sie jetzt in Bezug auf den ESM und den Fiskalpakt nicht den gleichen Fehler!

Herzlichen Dank.",data/txt/17179.txt,speech,
2078661,179,17,0,,,,307,Beifall bei der FDP sowie bei Abgeordneten der CDU/CSU,data/txt/17179.txt,poi,
2078662,179,17,0,,,,308,"Präsident Dr. Norbert Lammert:

Für die Fraktion Die Linke erhält jetzt der Kollege Hunko das Wort.",data/txt/17179.txt,speech,
2078663,179,17,0,,,,309,Beifall bei der LINKEN,data/txt/17179.txt,poi,
2078664,179,17,0,,,,310,"Andrej Hunko (DIE LINKE):

Herr Präsident! Meine Damen und Herren! Der Titel dieser Debatte heute lautet: Europas Weg aus der Krise. Nach der Regierungserklärung, Herr Westerwelle, die ich eben gehört habe, muss ich sagen, der Titel sollte heißen: Europas Weg immer tiefer in die Krise; denn das ist die Konsequenz Ihres Programms, das Sie vorgestellt haben.

Herr Westerwelle, Sie sind in Ihrem Beitrag gar nicht auf die Signale eingegangen, die am Wochenende aus Griechenland und aus Frankreich gekommen sind. Die Signale bedeuten, dass Ihre Politik gescheitert ist, dass die Politik nicht nur sozial ungerecht ist, dass sie nicht nur ökonomisch irrsinnig ist, sondern dass sie in Europa politisch nicht mehr durchsetzbar ist. Das ist die Botschaft der Wahlen in Griechenland und in Frankreich.",data/txt/17179.txt,speech,
2078665,179,17,0,,,,311,Beifall bei der LINKEN,data/txt/17179.txt,poi,
2078666,179,17,0,,,,312,"Nicht nur die Menschen in vielen europäischen Ländern lehnen diese Art der Krisenbewältigung ab. Es gibt auch von Tag zu Tag mehr Ökonomen, die sich kritisch zu der Krisenbewältigung äußern, die Sie auch heute vorgestellt haben. Ich könnte viele zitieren. Herr Heil hat vorhin Paul Krugman erwähnt. Ihn will ich zitieren. Es lohnt sich wirklich, genau hinzuhören, was der Wirtschaftsnobelpreisträger von 2008 sagt:

Europas große Täuschung besteht in dem Glauben, dass die Krise durch unverantwortliche Haushaltsführung zustande kam.

Weiter heißt es:

Doch viele europäische Verantwortliche, allen voran deutsche Politiker, die Führung der Europäischen Zentralbank und die Meinungsführer in der Finanzwelt, wiederholen gebetsmühlenartig die große Täuschung und lassen sich auch von handfesten Gegenbeweisen nicht erschüttern. Sie kleiden das Problem gern in ein moralisches Gewand: Die betroffenen Länder haben gesündigt, und nun müssten sie büßen - ein ganz schlechter Ansatz zur Lösung der eigentlichen Probleme des Kontinents.",data/txt/17179.txt,speech,
2078667,179,17,0,,,,313,Beifall bei der LINKEN sowie der Abg. Lisa Paus [BÜNDNIS 90/DIE GRÜNEN],data/txt/17179.txt,poi,
2078668,179,17,0,,,,314,"Was meint er zum Beispiel mit handfesten Beweisen? Nehmen wir die Staatsverschuldung. Die Staatsverschuldung in der Euro-Zone ist vom Jahr 2000 bis Mitte 2008 im Durchschnitt tendenziell rückläufig gewesen, von etwa 72 Prozent auf etwa 67 Prozent.",data/txt/17179.txt,speech,
2078669,179,17,0,Otto Fricke [FDP],Otto Fricke [FDP],otto-fricke-fdp,315,"Nicht nur in Griechenland, sondern auch in Spanien und Portugal!",data/txt/17179.txt,poi,fdp
2078670,179,17,0,,,,316,"Das sind alles Zahlen, die man offiziell bei der EZB einsehen kann. Erst Mitte 2008 ist die Staatsverschuldung deutlich auf über 80 Prozent angestiegen. Was war die Ursache? Unverantwortliche Haushaltsführung durch Sozialausgaben oder durch Leben über die Verhältnisse? Nein, die Bankenrettungspakete sind für den Anstieg verantwortlich und nicht etwa unverantwortliche Sozialausgaben.

Die zentralen Projekte dieser Bundesregierung sind der Fiskalpakt und der ESM, die jetzt ratifiziert werden sollen. Damit wird eine falsche Grundannahme in einen Pakt gegossen, der Ewigkeitscharakter haben soll und die Krise unnötig verschärfen wird. Der Fiskalpakt bedeutet in der Konsequenz genau die gleiche Politik, die jetzt Griechenland und anderen südeuropäischen Ländern auferlegt wird. Deswegen sagen wir Nein zum Fiskalpakt, deswegen sagen wir Nein zum ESM.",data/txt/17179.txt,speech,
2078671,179,17,0,,,,317,Beifall bei der LINKEN,data/txt/17179.txt,poi,
2078672,179,17,0,Zuruf von der FDP,von der FDP,von-der-fdp,318,Ihr sagt immer Nein!,data/txt/17179.txt,poi,fdp
2078673,179,17,0,,,,319,"Es stehen noch Kollegen von SPD und Grünen auf der Rednerliste. Mich würde schon interessieren: Werden Sie dem Fiskalpakt am Ende zustimmen - dazu braucht man in Deutschland eine Zweidrittelmehrheit in Bundestag und Bundesrat -, oder werden Sie ihn ablehnen? Wir plädieren für die Ablehnung.",data/txt/17179.txt,speech,
2078674,179,17,0,,,,320,Beifall bei der LINKEN,data/txt/17179.txt,poi,
2078675,179,17,0,Hubertus Heil [Peine] [SPD],Hubertus Heil [Peine] [SPD],hubertus-heil-peine-spd,321,Wir sind für Wachstum!,data/txt/17179.txt,poi,spd
2078676,179,17,0,,,,322,"Ich beende meine Reden hier im Bundestag meistens mit dem Satz: Europa wird sozial sein, oder es wird nichts sein. Das ist natürlich weiterhin richtig. Ich will aber heute angesichts der dramatischen Situation in Griechenland folgendermaßen enden:

???????????????????????????????????????????????????????????????????????????????????????????Die Veränderungen am Wochenende in Griechenland sind ein Signal für Europa, für ein Europa der Menschen, der Völker und nicht der Banken und Konzerne.

Vielen Dank.",data/txt/17179.txt,speech,
2078677,179,17,0,,,,323,Beifall bei der LINKEN,data/txt/17179.txt,poi,
2078678,179,17,0,Michael Roth [Heringen] [SPD],Michael Roth [Heringen] [SPD],michael-roth-heringen-spd,324,Wenn es immer so einfach wäre! Meine Güte!,data/txt/17179.txt,poi,spd
2078679,179,17,0,,,,325,"Präsident Dr. Norbert Lammert:

Der Kollege Sarrazin erhält nun das Wort für die Fraktion Bündnis 90/Die Grünen.

Manuel Sarrazin (BÜNDNIS 90/DIE GRÜNEN):

Vielen Dank, Herr Präsident. - Ich möchte am Anfang meiner Rede kurz auf die Einführungsvorlesung von Herrn Westerwelle eingehen. Herr Westerwelle - er sitzt gar nicht auf der Regierungsbank, sondern spricht mit Herrn Ramsauer -, Sie sind als einen der sechs Punkte auf die Connecting Europe Facility eingegangen. Ich glaube, dass man ein grundsätzliches Problem Ihrer Europapolitik benennen kann: Als die Kommission im letzten Herbst Vorschläge zu Projektbonds gemacht hat, ist aus Ihren Reihen viel über Herrn Barroso geschimpft worden, weil Sie das mit Euro-Bonds verwechselt haben.",data/txt/17179.txt,speech,
2078680,179,17,0,,,,326,Beifall beim BÜNDNIS 90/DIE GRÜNEN und bei der SPD,data/txt/17179.txt,poi,
2078681,179,17,0,,,,327,"Und jetzt stellen Sie hier Ihr Aktionsprogramm vor. - Mögen Sie mir noch zuhören? - Dieses Aktionsprogramm besteht - das ist auch bei anderen Dingen der Fall - aus einem Vorschlag, den die Kommission schon im März vorgelegt hat. Abschreiben und Abkupfern reicht nicht für die Europapolitik Deutschlands!",data/txt/17179.txt,speech,
2078682,179,17,0,,,,328,Beifall beim BÜNDNIS 90/DIE GRÜNEN sowie des Abg. Hubertus Heil [Peine] [SPD],data/txt/17179.txt,poi,
2078683,179,17,0,,,,329,"Das andere ist - das muss man in dieser Debatte und nach dieser Vorlesung sagen - -

Präsident Dr. Norbert Lammert:

Sie haben die Lage richtig wahrgenommen. Der Kollege Spatz möchte Ihnen gerne eine Zwischenfrage stellen. Darf er das?

Manuel Sarrazin (BÜNDNIS 90/DIE GRÜNEN):

Klar.

Joachim Spatz (FDP):

Dem Kollegen Heil, der behauptet hat, wir hätten alternativlos abgelehnt, habe ich das auch schon gesagt: Wenn Sie sich ein bisschen intensiver mit den Details befassen würden, zum Beispiel mit den Vorschlägen, die in unserer Stellungnahme zum MFR enthalten sind, die der Bundestag auf Antrag der Koalition beschlossen hat! Darin steht, dass wir eine andere Form von Projektanleihen wollen. Wir wollen keine Projektanleihen, bei denen einfach nur öffentliches Geld ausgegeben wird, ohne dass zusätzliches privates Geld mobilisiert wird. Es mag ja sein, dass Sie das ablehnen. Aber die Behauptung, wir hätten alternativlos abgelehnt, ist schlicht falsch.

Manuel Sarrazin (BÜNDNIS 90/DIE GRÜNEN):

Verehrter Herr Spatz, wenn Sie den Kommissionsentwurf bezüglich Connecting Europe Facility vom März lesen, dann wird Ihnen ganz klar, was die Kommission vorschlägt. Das ist eine Fazilität, die dafür sorgen soll, dass mithilfe öffentlicher Mittel, mit Mitteln aus Strukturfonds aus anderen Bereichen gehebelt und mehr privates Kapital mobilisiert werden kann. Da hat nie jemand etwas anderes vorgeschlagen, auch Herr Barroso damals nicht.",data/txt/17179.txt,speech,
2078684,179,17,0,,,,330,Beifall bei Abgeordneten des BÜNDNISSES 90/DIE GRÜNEN und der SPD,data/txt/17179.txt,poi,
2078685,179,17,0,,,,331,"Das Problem an Ihrer Europapolitik ist, dass Sie nicht in der Lage sind, konstruktive, vorausdenkende Vorschläge zu machen. Sie müssen sich immer hinter den fehlenden Mehrheiten in Ihren Reihen verstecken.",data/txt/17179.txt,speech,
2078686,179,17,0,Joachim Spatz [FDP],Joachim Spatz [FDP],joachim-spatz-fdp,332,Nein!,data/txt/17179.txt,poi,fdp
2078687,179,17,0,,,,333,"Das nimmt Stärke. Ihnen fehlt Stärke, um in Europa voranzugehen.",data/txt/17179.txt,speech,
2078688,179,17,0,,,,334,Beifall bei Abgeordneten des BÜNDNISSES 90/DIE GRÜNEN und der SPD,data/txt/17179.txt,poi,
2078689,179,17,0,Hubertus Heil [Peine] [SPD],Hubertus Heil [Peine] [SPD],hubertus-heil-peine-spd,335,James Bond! Euro-Bonds! Projektbonds!,data/txt/17179.txt,poi,spd
2078690,179,17,0,,,,336,"Eines muss man sagen - die Schuman-Erklärung ist schon genannt worden -: Schuman hat damals geschrieben:

Der Friede der Welt kann nicht gewahrt werden ohne schöpferische Anstrengungen, die der Größe der Bedrohung entsprechen.

Wenn wir diesen Satz als Blaupause nehmen und uns das, was Herr Westerwelle gerade gesagt hat, und Ihre Beiträge in dieser Debatte vor Augen führen, dann ist, glaube ich, die Analyse relativ klar.

Die große Frage in dieser Krise ist doch, Herr Spatz und Herr Westerwelle, die integrationspolitische Demokratiefrage. Warum kommt von Herrn Westerwelle und aus Ihren Reihe zu dieser großen Frage dieser Krise so wenig, um nicht zu sagen: gar nichts?",data/txt/17179.txt,speech,
2078691,179,17,0,,,,337,Beifall beim BÜNDNIS 90/DIE GRÜNEN sowie des Abg. Hubertus Heil [Peine] [SPD],data/txt/17179.txt,poi,
2078692,179,17,0,,,,338,"Es ist doch bezeichnend, dass bei diesem Kernpunkt der Europapolitik das Auswärtige Amt gar nicht präsent ist.

Ich muss Ihnen noch eines sagen - der Schuman-Plan ist schon genannt worden -: Was war die große Idee von Schuman neben dem, was Herr Krichbaum gewürdigt hat? Es war die Hohe Behörde, die die gemeinsame Montanunion verwaltet. Die Europapolitik dieser Regierung bricht mit dem Erbe von Schuman, weil Frau Merkel in Brügge mit der Unionsmethode zum Angriff auf die Kommission und das Europäische Parlament geblasen hat.",data/txt/17179.txt,speech,
2078693,179,17,0,Joachim Spatz [FDP],Joachim Spatz [FDP],joachim-spatz-fdp,339,Quatsch!,data/txt/17179.txt,poi,fdp
2078694,179,17,0,,,,340,"Sie brechen mit einer großen Tradition, indem Sie reine Regierungspolitik machen und die Gemeinschaftsinstitutionen in dieser Krise schwächen.",data/txt/17179.txt,speech,
2078695,179,17,0,,,,341,Beifall beim BÜNDNIS 90/DIE GRÜNEN sowie bei Abgeordneten der SPD,data/txt/17179.txt,poi,
2078696,179,17,0,,,,342,"Sie wissen, dass ich über die Geringschätzung der Parlamente im Rahmen dieser Unionsmethode viel zu sagen hätte. Deswegen haben wir in Karlsruhe geklagt. Diesbezüglich haben wir in diesem Haus gemeinsame Anliegen gegenüber der Regierung. Darüber werden wir sprechen.

Ich möchte sagen, dass es aus meiner Sicht eine deutsche Aufgabe ist, den Mut, die Verträge zu ändern, zu adressieren. Wir können ganz klar sagen, dass die Analyse in der Erklärung von Laeken, dass die Europäische Union für die Herausforderungen der Globalisierung nicht ausreichend gewappnet ist und dass die nationalen Politiken besser koordiniert werden müssen, noch stimmt. In dem Aktionsprogramm, das Herr Westerwelle hier gerade genannt und vorgestellt hat, fehlt dieser Punkt. Dort fehlt der deutsche Anspruch, dass wir die Vordenker- und Vorreiterrolle in Europa übernehmen müssen, wenn es darum geht, das Mehr an Europa konkret zu machen und über Vertragsänderungen zu reden, und zwar mit einer Methode, die demokratisch und transparent ist, also im Rahmen eines europäischen Konvents und nicht in den Hinterzimmern von Regierungskonferenzen.",data/txt/17179.txt,speech,
2078697,179,17,0,,,,343,Beifall beim BÜNDNIS 90/DIE GRÜNEN sowie bei Abgeordneten der SPD,data/txt/17179.txt,poi,
2078698,179,17,0,,,,344,"Ich möchte meine letzten Sekunden Redezeit nutzen, um etwas zu Griechenland zu sagen. Wenn ich mir die Presselage ansehe - vieles von dem, was hier heute gesagt wurde, hebt sich positiv davon ab -, habe ich das Gefühl, dass manche in Ihren Reihen noch nicht verstanden haben, für wen sie Stichwortgeber sein können, ob willentlich oder aus Versehen. Ich frage mich manchmal: Für wen machen Sie eigentlich Wahlkampf? Sie erwecken den Eindruck, es wäre möglich, Griechenland aus der europäischen Schicksalsgemeinschaft auszuschließen, es wäre keine politische Wertentscheidung, die Euro-Zone mit 17 Staaten zusammenzuhalten. Alle acht Wochen wird aus den Reihen der Koalition diese politische Wertentscheidung infrage gestellt. Das ist ein Zeichen von politischer Schwäche. Diese politische Schwäche Ihrer Koalition und Ihrer Regierung ist mit ein Grund für die Krise.

Vielen Dank.",data/txt/17179.txt,speech,
2078699,179,17,0,,,,345,Beifall beim BÜNDNIS 90/DIE GRÜNEN sowie bei Abgeordneten der SPD,data/txt/17179.txt,poi,
2078700,179,17,0,,,,346,"Präsident Dr. Norbert Lammert:

Jürgen Hardt ist der nächste Redner für die CDU/CSU-Fraktion.",data/txt/17179.txt,speech,
2078701,179,17,0,,,,347,Beifall bei der CDU/CSU und der FDP,data/txt/17179.txt,poi,
2078702,179,17,0,,,,348,"Jürgen Hardt (CDU/CSU):

Herr Präsident! Liebe Kolleginnen und Kollegen! Wir Europapolitiker und Außenpolitiker sind hier jetzt, da die Debatte schon etwas fortgeschritten ist, relativ unter uns. Ich freue mich trotzdem, dass der Präsident der -Europäischen Investitionsbank auf der Besuchertribüne Platz genommen hat.",data/txt/17179.txt,speech,
2078703,179,17,0,,,,349,Beifall,data/txt/17179.txt,poi,
2078704,179,17,0,,,,350,"Ich glaube, wir alle setzen große Hoffnungen in die Möglichkeiten und Perspektiven - diese gibt es zum Teil aufgrund der neuen Ausgestaltung des finanziellen Rahmens der Europäischen Union -, die Instrumente, die uns zur Verfügung stehen, zu schärfen und zu verbessern. Denn offensichtlich haben die Methoden, mit -denen wir in den vergangenen Jahren und Jahrzehnten versucht haben, Impulse für Wirtschaftswachstum zu setzen, nicht ganz und nicht in allen Ländern den Erfolg gehabt, den wir uns gewünscht haben.

Ich möchte in dieser Debatte ganz konkret auf die Rede von Kollegen Roth eingehen - ich sehe ihn leider gerade nicht -, der hier vorhin ein ziemlich düsteres Bild Europas gemalt hat, um dann in den letzten zehn Sekunden seiner Rede die Regierung zu mahnen, sie solle doch nicht alles so negativ malen und so schlecht sehen. Ich möchte einen Beitrag dazu leisten, dass wir die Chancen sehen, die vor uns liegen.

Wenn wir auf das zurückblicken, was wir in den letzten zwei Jahren in der Europapolitik erlebt haben, sehen wir, dass wir viele Erschütterungen erlebt haben. Wir haben viele Dinge erlebt, die wir uns so nicht vorstellen konnten, aber wir haben natürlich auch erlebt, dass wir in den letzten 24 Monaten ganz gut um die vielen Klippen herumgeschifft sind, die uns im Weg standen.

Wir hören immer wieder Ratschläge von außen. Wenn ich mir vorstelle, wir hätten vor 24 Monaten den Ratschlag angenommen, die Griechenland-Illiquidität, die praktische Insolvenz dieses Staates, einfach hinzunehmen und nicht zu helfen, weil man als guter Kaufmann dem schlechten kein gutes Geld hinterherwirft - das war nur einer der Sprüche, die uns gesagt wurden -, dann hätten wir einen enormen Schaden für Europa produziert, der weit über das hinausgeht, was man sich vorstellen kann.

Wir hätten selbst im günstigsten Fall auf das Wirtschaftswachstum der letzten zwei Jahre verzichtet, das 100 Milliarden Euro in die öffentlichen Kassen von Bund, Ländern und Gemeinden gespült hat. All denjenigen, die uns vorwerfen, dass wir die Rettung des Euro und die Rettung Griechenlands mit zu viel Geld, mit zu viel gutem Willen und mit zu vielen Bürgschaften angehen, sei gesagt: Wenn wir diesen Vorschlag angenommen hätten, wäre die Situation heute schlagartig schlechter, und es wäre für uns mit Sicherheit auch teurer.",data/txt/17179.txt,speech,
2078705,179,17,0,,,,351,Beifall bei der CDU/CSU sowie bei Abgeordneten der FDP,data/txt/17179.txt,poi,
2078706,179,17,0,,,,352,"Ein möglicher Weg wäre damals gewesen, den Dingen einfach ihren Lauf zu lassen und das Auseinanderbrechen der Euro-Zone hinzunehmen. Diesen haben wir zum Glück nicht eingeschlagen. Es gab einen anderen extremen Vorschlag, über den man auch nachdenken musste. Die Staats- und Regierungschefs hätten am Abend des Ausbruchs der Staatsschuldenkrise sagen können: Wir haften alle gemeinsam für alles. - Das hätte die Märkte möglicherweise sogar beruhigt. Es hätte das Problem der übermäßigen Verschuldung aber nicht gelöst. Deswegen bin ich der Bundesregierung dankbar, dass sie diesen Weg nicht eingeschlagen hat, sondern gesagt hat: Wir versuchen, einen mühsamen, einen schwierigen, aber gleichwohl erfolgversprechenden Weg zu gehen, der insgesamt vier Elemente beinhaltet: erstens faire Chancen für die Staaten, die in Schwierigkeiten sind, zweitens die Absicherung unserer Verflechtungen innerhalb der Europäischen Union, damit das Finanzsystem nicht zusammenbricht, drittens die Stärkung der rechtlichen Verbindlichkeit im Hinblick auf solide Haushaltspolitik und viertens die Zähmung der ungehemmten Finanzmärkte.

Ich möchte auf den dritten Punkt, nämlich die Frage, wie wir Haushaltsdisziplin innerhalb der Europäischen Union verwirklichen wollen, näher eingehen. Da finde ich die Haltung der Opposition, offen gesagt, etwas ambivalent. Sie hat uns monatelang vorgehalten: Das, was die deutsche Regierung in Europa will, ist undurchsetzbar; das ist wieder das typisch deutsche Wir wissen alles besser, und wir machen alles besser. - Dann ist es zu einem Fiskalpakt gekommen, der in seinem Umfang, sowohl was die Zahl der teilnehmenden Staaten als auch seine Elemente angeht, beachtlich ist und deutlich weiter geht als das, was viele erwartet haben. Jetzt heißt es plötzlich: Das ist alles viel zu streng. Das ist alles viel zu sehr auf Austerität ausgerichtet. - Also: Sie müssen sich schon entscheiden, ob Sie einen stabilen Euro mit soliden Staatsfinanzen wollen oder ob Sie weiterhin auf Pump scheinbaren Wohlstand finanzieren wollen. Ich persönlich bin der Meinung, die Bundesregierung hat an diesem Punkt alles richtig gemacht, und sie verdient unsere volle Unterstützung, wenn es in den nächsten Wochen und Monaten in diesem Hause darum geht, die entsprechenden Entscheidungen zu treffen.",data/txt/17179.txt,speech,
2078707,179,17,0,,,,353,Beifall bei der CDU/CSU und der FDP,data/txt/17179.txt,poi,
2078708,179,17,0,,,,354,"Ein Blick auf die Hilfen für Griechenland. Es ist nicht an uns im Deutschen Bundestag, dem griechischen Volk Ratschläge zu geben, die Wahl zu kommentieren und zu analysieren und dabei Kritik am Wählervotum zu äußern.",data/txt/17179.txt,speech,
2078709,179,17,0,,,,355,Beifall des Abg. Manuel Sarrazin [BÜNDNIS 90/DIE GRÜNEN],data/txt/17179.txt,poi,
2078710,179,17,0,Andrej Hunko [DIE LINKE],Andrej Hunko [DIE LINKE],andrej-hunko-die-linke,356,Dann lassen Sie es doch!,data/txt/17179.txt,poi,linke
