id,sitzung,wahlperiode,in_writing,speaker,speaker_cleaned,speaker_fp,sequence,text,filename,type,speaker_party
2100385,194,17,0,,,,210,"und sein Optimismus gilt vor allem der Kompromissbereitschaft im Bundesrat, dessen Handeln momentan von SPD-geführten Ländern und auch von grünen Landes-regierungen maßgeblich bestimmt und beeinflusst wird. Insofern erwarten und hoffen wir - darauf richtet sich sein Optimismus -, dass am Ende des Tages die allgemeine Einsicht zustande kommt, dass die steuerliche Abschreibung energetischer Sanierungsmaßnahmen äußerst sinnvoll und eine wichtige Ergänzung zu anderen Förderprogrammen des Bundes ist.

Wir haben im gesamten Vermittlungsverfahren viele Vorschläge gemacht, man ist aufeinander zugegangen; aber tatsächlich ist es schwierig, nachzuvollziehen, wieso die Hebelwirkung von eins zu zwölf - sprich: 1 vom Bund investierter Euro löst am Ende 12 Euro an privaten Investitionen aus - nicht auch durch den Bundesrat anerkannt wird. Ich finde das schade. Ich meine und hoffe - auch der -Minister ist, wie gesagt, optimistisch -, dass wir zu einer Einigung kommen können.

Vizepräsident Dr. Hermann Otto Solms:

Weitere Nachfrage? - Bitte.

Lisa Paus (BÜNDNIS 90/DIE GRÜNEN):

Habe ich Sie jetzt richtig verstanden, dass es kein weiteres Angebot der Bundesregierung geben wird, sondern dass das, was auf dem Tisch liegt, für die Bundes-regierung das letzte Wort ist? Auf dieser Grundlage muss es einen Kompromiss geben, weil es sonst keinen gibt? Habe ich Sie richtig verstanden? Es gibt keine -weiteren Initiativen oder Angebote seitens der Bundes-regierung?

Katherina Reiche, Parl. Staatssekretärin beim Bundesminister für Umwelt, Naturschutz und Reaktorsicherheit:

Wir führen derzeit Gespräche. Diese Gespräche führen wir so, dass wir am Ende des Tages hoffentlich zu einer gemeinsamen Lösung kommen werden.

Vizepräsident Dr. Hermann Otto Solms:

Die Frage 19 der Abgeordneten Dr. Martina Bunge wird schriftlich beantwortet. - Vielen Dank, Frau Staatssekretärin.

Die Fragen 20 bis 30 zum Geschäftsbereich des Bundesministeriums für Bildung und Forschung werden schriftlich beantwortet. Es handelt sich um die Fragen 20 und 21 des Kollegen René Röspel, die Fragen 22 und 23 der Kollegin Marianne Schieder, die Frage 24 des Kollegen Klaus Hagemann, die Frage 25 des Kollegen Oliver Kaczmarek, die Fragen 26 und 27 des Kollegen Michael Gerdes, die Frage 28 des Kollegen Dr. Ernst Dieter Rossmann sowie die Fragen 29 und 30 des Kollegen Swen Schulz.

Wir kommen damit zum Geschäftsbereich des Bundesministeriums für wirtschaftliche Zusammenarbeit und Entwicklung. Zur Beantwortung steht die Parlamentarische Staatssekretärin Gudrun Kopp zur Verfügung.

Ich rufe die Frage 31 des Abgeordneten Uwe Kekeritz auf:

Welche geförderten Zeitschriften lässt sich das Bundes-ministerium für wirtschaftliche Zusammenarbeit und Entwicklung, BMZ, vor der Veröffentlichung zur Prüfung vorlegen, und, neben dem jetzt bekannt gewordenen Fall im Zusammenhang mit einem Artikel der Zeitschrift Südlink (vergleiche www.inkota.de/material/suedlink-inkota-brief/161-unternehmensverantwortung/christina-felschen-greenwashing), in welchen weiteren Fällen wurde auf die Veröffentlichung einzelner Artikel Einfluss genommen?

Gudrun Kopp, Parl. Staatssekretärin beim Bundesminister für wirtschaftliche Zusammenarbeit und Entwicklung:

Vielen Dank, Herr Präsident. - Herr Kollege Kekeritz, über das Förderprogramm Entwicklungspolitische Bildung werden Mittel an staatliche und nichtstaatliche Organisationen für entwicklungspolitische Bildungsmaßnahmen im Inland zur Verfügung gestellt. Darunter fallen auch, wie in diesem Fall, Publikationen. Voraussetzung für die Förderung von Maßnahmen mit Mitteln aus diesem Programm ist, dass sie einem Bildungsanspruch, und zwar einem entwicklungspolitischen Bildungsanspruch genügen. Vor diesem Hintergrund wird der Zuschussempfänger laut Fördervertrag verpflichtet, im Falle von Publikationen eine Übersicht über die Inhalte von Drucklegungen vorzulegen. Von diesem Recht macht das BMZ Gebrauch, wenn es Anlass zu der -Befürchtung hat, dass die Förderkriterien nicht eingehalten werden. Insbesondere die Finanzierung von Kampagnenarbeit ist durch das genannte Programm nicht gedeckt. Das ist den Zuschussempfängern bekannt. Das wird in kritischen Fällen mit dem Zuschussempfänger regelmäßig und detailliert erörtert.

Vizepräsident Dr. Hermann Otto Solms:

Nachfrage? - Bitte schön.

Uwe Kekeritz (BÜNDNIS 90/DIE GRÜNEN):

Danke sehr, Frau Staatssekretärin. Ich muss mich jetzt etwas wundern. Die Antwort, die Sie mir eben gegeben haben, haben Sie mir bereits auf eine andere schriftliche Frage gegeben. Insofern hatte Ihre Antwort keinen neuen Gehalt.

Es geht hier um die Frage, ob das BMZ Zensur ausübt oder nicht. Ich habe extra nachgelesen: Zensur ist ein politisches Verfahren, um Inhalte zu kontrollieren. Wenn das BMZ an einen Verleger oder Journalisten herantritt und sagt: Wenn du das veröffentlichst, kürzen wir dir die Mittel, ist das per Definition Zensur. Es stellt sich die Frage: Wie kommt das BMZ überhaupt dazu, einer Zeitschrift wie Südlink - es geht um die 161. Ausgabe; es gibt diese Zeitschrift also schon sehr lange - Gelder zu genehmigen, wenn Sie davon ausgehen, dass in dieser Zeitschrift bedenkliche Texte veröffentlicht werden? Ich denke, dass das nicht legitim ist. Gerade für Politiker der FDP, einer Partei, die das Liberale im Titel trägt, sollten die Meinungsfreiheit und die Pressefreiheit ganz hoch angesiedelt sein.

Gudrun Kopp, Parl. Staatssekretärin beim Bundesminister für wirtschaftliche Zusammenarbeit und Entwicklung:

Herr Kollege Kekeritz, genau das ist unser Anspruch. Es geht nicht um eine Zensur, sondern es geht darum, dass wir staatliche Gelder, also Steuermittel, an einen Verein geben, der sich mit seiner Unterschrift und aufgrund der Tatsache, dass er Steuermittel erhält - 100 000 Euro und es gibt einen Antrag auf Aufstockung der Mittel -, verpflichtet, bestimmte Kriterien -einzuhalten. Das BMZ finanziert keine Polemik auf Staatskosten, sondern Publikationen, die einen Bildungsauftrag haben. Dafür gibt es Geld. Dieser Bildungsauftrag bedingt - davon gehen wir aus - eine ausgewogene und sachliche Berichterstattung, in der ein Problemfeld aus verschiedenen Blickwinkeln dargestellt wird. Es darf nicht einseitig berichtet werden. In der letzten Ausgabe war das aber so. Wir haben über Engagement Global - das ist ja auch der direkte Ansprechpartner von Südlink - darauf hingewiesen, dass sie doch ihre eigene Sichtweise auf eigene Kosten veröffentlichen können, aber bitte nicht auf Staatskosten.

Vizepräsident Dr. Hermann Otto Solms:

Der Fragesteller hat noch eine Nachfrage. - Bitte schön.

Uwe Kekeritz (BÜNDNIS 90/DIE GRÜNEN):

Danke, Frau Staatssekretärin. Sie haben in der Begründung, warum Sie diesen Artikel nicht veröffentlicht haben wollen, den Begriff Verunglimpfung Dritter verwendet. Ich habe diesen Artikel gelesen. Er ist sauber recherchiert und entspricht den normalen Anforderungen einer vernünftigen journalistischen Arbeit. Wenn Sie Zeitung lesen und Radio hören, dann werden Sie in den letzten sechs Monaten mindestens 100 solcher ähnlichen Berichte und Dokumentationen vernommen haben. Es ist für mich nicht begreiflich, warum sich das Entwicklungsministerium plötzlich auf die Füße stellt und sagt, das dürfe man in dieser Form nicht mehr machen. In dieser Form passiert es zurzeit hundertfach, nicht, weil es darum geht, irgendjemanden zu diffamieren, sondern weil damit einfach die Realität tatsächlich souverän und präzise abgebildet wird.

Gudrun Kopp, Parl. Staatssekretärin beim Bundesminister für wirtschaftliche Zusammenarbeit und Entwicklung:

Herr Kollege Kekeritz, noch einmal: Die Gewährung von Steuermitteln für die Publikation ist an eine ausgewogene, sachlich differenziert dargestellte Problematik gebunden. Die Ausgabe, die Sie eben zitiert haben, enthält eben keine Ausgewogenheit,",data/txt/17194.txt,speech,
2100386,194,17,0,Uwe Kekeritz [BÜNDNIS 90/DIE GRÜNEN],Uwe Kekeritz [BÜNDNIS 90/DIE GRÜNEN],uwe-kekeritz-bundnis-90-die-grunen,211,Doch!,data/txt/17194.txt,poi,gruene
