id,sitzung,wahlperiode,in_writing,speaker,speaker_cleaned,speaker_fp,sequence,text,filename,type,speaker_party
2100401,194,17,0,,,,226,"Wenn wir über Weißrussland reden, dann gilt aber auch: Die Länder, die mit Weißrussland zusammenarbeiten, müssen ihr Verhältnis zu Weißrussland prüfen. -Gerade Russland ist dazu aufgerufen, seine ideelle Unterstützung gegenüber dem weißrussischen Regime, die oftmals deutlich wird, zu hinterfragen. Auch andere Akteure müssen sich mit den Zuständen in Weißrussland auseinandersetzen. Taube Ohren sind keine Option. Das gilt nicht nur für die Länder in dieser Region, für den Kulturkreis, an den wir immer denken, sondern auch für die Demokratien im Westen.

2014 soll in Weißrussland die Eishockey-WM stattfinden. Wir haben hier im Plenum schon darüber ge-sprochen. Ich habe gemeinsam mit meinem Kollegen Djir-Sarai dem Präsidenten der Internationalen Eishockey-Föderation, Herrn Dr. Fasel, geschrieben. Wir wiesen auf die dramatische Lage in Weißrussland hin. Wir haben unsere Befürchtung geäußert, dass das belarussische Regime unter Lukaschenko die Eishockey-WM für seine eigenen Ziele und Zwecke propagandistisch missbraucht. In Anbetracht der anhaltenden Repression der eigenen Bevölkerung durch das Regime haben wir darauf hingewiesen, dass wir keine unangebrachte internationale Aufwertung für den weißrussischen Präsidenten wollen.

Herr Dr. Fasel antwortete uns auf unseren Brief und erklärte, dass eine Einmischung der Politik in sportliche Veranstaltungen Schaden für die Athleten, für den Sport als solchen und auch für die friedlichen Ziele der olympischen Bewegung bedeuten würde. Ich fand die Antwort in diesem Zusammenhang unangemessen.

In seiner Eröffnungsrede beim 134. Kongress der Eishockey-Föderation im Mai 2012 setzte er noch eins drauf. Er erklärte, mit einem Boykott der Eishockey-WM in Weißrussland würden sich die Verantwortlichen der Sportverbände zu Marionetten der Politik machen.",data/txt/17194.txt,speech,
2100402,194,17,0,Dr. Johann Wadephul [CDU/CSU],Dr. Johann Wadephul [CDU/CSU],johann-wadephul-cdu-csu,227,Schlimm!,data/txt/17194.txt,poi,cducsu
2100403,194,17,0,,,,228,"Meine Damen und Herren, ich glaube, ich spreche hier für viele, wenn ich sage, dass wir diesen Marionettenvergleich entschieden zurückweisen.",data/txt/17194.txt,speech,
2100404,194,17,0,,,,229,Beifall bei der FDP und der CDU/CSU,data/txt/17194.txt,poi,
2100405,194,17,0,,,,230,"Der Wahlverlauf bestätigte die von uns damals gehegten Bedenken. Herr Fasel hat jetzt am Wochenende, nach der Wahl, erklärt, er habe von den politischen Zuständen in Belarus nichts mitbekommen.",data/txt/17194.txt,speech,
2100406,194,17,0,,,,231,Lachen des Abg. Karl-Georg Wellmann [CDU/CSU],data/txt/17194.txt,poi,
2100407,194,17,0,,,,232,"Meine Damen und Herren, das ist nun wirklich nicht mehr erklärbar. Man kann es Zweckignoranz nennen, man kann es vielleicht auch fragwürdige Verantwortung nennen; auf jeden Fall ist das ein Vorgehen, das wir so nicht mittragen.

Gerade angesichts der bevorstehenden WM muss die Eishockey-Föderation fortan - wir fordern noch einmal dazu auf - gewissenhafter mit diesem Thema umgehen. Der Präsident eines der wichtigsten Sportweltverbände darf die Augen hier nicht verschließen; ebenso sind alle anderen dazu aufgerufen, hier die Augen nicht zu verschließen.

Wir setzen uns für Weltoffenheit, für Werteorientiertheit und für die Einhaltung der Grundrechte ein. Wir unterstützen die Länder, die mit ihren Reformbestrebungen ihren guten Willen zur Umsetzung von Rechtsstaatlichkeit und Demokratie zeigen. Aber die völlige Ignoranz in Bezug auf Menschenrechte und internationale Standards bei Wahlen ist für uns völlig inakzeptabel. Die verhängten europäischen Sanktionen, unter anderem das Einreiseverbot für Lukaschenko, sind der richtige Weg; wir unterstreichen das. Es ist gerade für uns Deutsche nicht akzeptabel, dass massive Menschenrechtsverletzungen in unserer unmittelbaren Nachbarschaft noch immer stattfinden.

Ich bedanke mich sehr herzlich.",data/txt/17194.txt,speech,
2100408,194,17,0,,,,233,Beifall bei der FDP und der CDU/CSU,data/txt/17194.txt,poi,
2100409,194,17,0,,,,234,"Vizepräsident Eduard Oswald:

Vielen Dank, Kollege Kurth. - Nächster Redner in unserer Aktuellen Stunde ist für die Fraktion der Sozialdemokraten unser Kollege Dr. Rolf Mützenich. Bitte schön, Kollege Rolf Mützenich.

Dr. Rolf Mützenich (SPD):

Vielen Dank. - Herr Präsident! Liebe Kolleginnen und Kollegen! Das ist ausdrücklich keine Aktuelle Stunde, die sich gegen die Menschen in Weißrussland richtet;",data/txt/17194.txt,speech,
2100410,194,17,0,,,,235,"Beifall bei der SPD, der CDU/CSU, der FDP und dem BÜNDNIS 90/DIE GRÜNEN sowie der Abg. Karin Binder [DIE LINKE]",data/txt/17194.txt,poi,
2100411,194,17,0,,,,236,"im Gegenteil: Wir wollen von dieser Stelle aus deutlich machen, dass viele in Weißrussland - mutige junge Menschen, Frauen, Oppositionelle - in den letzten Jahren versucht haben, dem Regime zu widerstehen. Wir wollen alle Aufmerksamkeit genau auf diese Menschen richten, die so viel Mut aufgebracht haben, diesen Machenschaften des Regimes zu widerstehen. Deswegen, glaube ich, ist diese Aktuelle Stunde heute angebracht.

Ich will auch sehr deutlich sagen: Weißrussland gehört zum europäischen Kulturraum. Es hat große Beiträge zur Ideengeschichte geliefert; das gilt auch für die Menschen selbst. Weißrussland - das müssen wir deutlich machen - wollen wir sozusagen in unserer europäischen Familie wissen, und deswegen machen wir uns große Sorgen.

In der Tat, Kollege Kurth: Der Weg zu demokratischen Verhältnissen, gerade auch nach diesen Erfahrungen einer gefälschten Parlamentswahl, wird wahrscheinlich lang sein, aber er ist nicht ohne Chance. Wir sollten den Menschen Mut machen, weiterhin alles dafür zu unternehmen, dass dieser demokratische Weg gelingt. Ich glaube, das können wir nur gemeinsam mit den Partnern in der Europäischen Union und mit Partnern, die an unserer Seite für demokratische Grundrechte eintreten.

Mit dieser Aktuellen Stunde wollen wir aber auf die Machenschaften des Regimes und auf die gefälschten Wahlen hinweisen. Wir müssen daran erinnern, dass die Präsidentschaftswahlen vor zwei Jahren nicht nur gefälscht waren, sondern dass mutige Politiker, die zu diesen Wahlen angetreten sind, bis heute im Gefängnis sitzen. Wir wollen auch heute von dieser Stelle aus an das Regime appellieren, sofort alle politischen Gefangenen bzw. alle, die aus politischen Gründen verurteilt worden sind, freizulassen. Ich erinnere zum Beispiel an den sozialdemokratischen Präsidentschaftskandidaten Statkevich, dessen Familie in den letzten Wochen mehrmals bei uns, in den verschiedenen Fraktionen, war und auf die hu-manitären Bedingungen hingewiesen hat, unter denen Statkevich im Gefängnis sitzt. Er ist mit Inhaftierten zusammen, die an Tuberkulose leiden, und mit einem Gefangenen, der wegen Mordes verurteilt worden ist. Das sind Bedingungen, die nicht hinnehmbar sind. Wir vonseiten des Deutschen Bundestages fordern dieses Regime auf, Herrn Statkevich und andere, die mutig für ihre Rechte eingetreten sind, sofort freizulassen.",data/txt/17194.txt,speech,
2100412,194,17,0,,,,237,Beifall im ganzen Hause,data/txt/17194.txt,poi,
2100413,194,17,0,,,,238,"Wir sollten auch an die Verantwortlichen außerhalb Weißrusslands appellieren, die Einfluss auf dieses Regime haben. Das ist in der Tat Russland, die russische Regierung. Wir sollten gerade den Verantwortlichen in Moskau gegenüber deutlich machen, dass man, wenn man auf diejenigen setzt, die von der Geschichte längst überholt sind, schnell selbst überholt werden kann. Instabilität an den Grenzen zu Russland ist weder in unserem Interesse, noch kann es im Interesse Russlands und der russischen Regierung sein. Deswegen wäre es klug, wenn die russische Regierung in den nächsten Wochen einsähe, dass die Unterstützung des Regimes Lukaschenko nicht weiterhin tragbar ist. Wir sollten das vonseiten des deutschen Parlaments, aber auch vonseiten der deutschen Regierung vorantreiben.

Herr Kollege Kurth, Sie haben in diesem Zusammenhang auf die Eishockeyweltmeisterschaft hingewiesen. Wir sollten gerade den Funktionären gegenüber noch einmal deutlich machen, dass nicht nur nach den Präsidentschaftswahlen, sondern gerade nach den Parlamentswahlen ein neues Überlegen notwendig ist. Damit würden wir vielen Sportlern entgegenkommen; denn sie wollen sich vom Regime Lukaschenko, das von den Eishockeyweltmeisterschaften letztendlich auch profitiert, nicht missbrauchen lassen. Ich glaube, der Verband würde den Sportlern entgegenkommen, wenn er seine Position an dieser Stelle überdenkt.",data/txt/17194.txt,speech,
2100414,194,17,0,,,,239,"Beifall bei der SPD, der CDU/CSU und der FDP",data/txt/17194.txt,poi,
2100415,194,17,0,,,,240,"Zum Schluss möchte ich sagen: Auch vonseiten der Bundesregierung wird, glaube ich, alles unternommen, um auf das Regime einzuwirken. Aber vielleicht - das ist meine Anregung - können wir noch etwas mehr tun. Wir sollten durchaus noch einmal erörtern, was im Rahmen von Visaerleichterungen möglich ist,",data/txt/17194.txt,speech,
2100416,194,17,0,,,,241,Beifall bei Abgeordneten der SPD sowie des Abg. Wolfgang Gehrcke [DIE LINKE],data/txt/17194.txt,poi,
2100417,194,17,0,,,,242,"insbesondere im Hinblick auf Stipendien für junge Menschen, die auf der einen Seite bereit sind, für Weißrussland einzutreten, die aber auf der anderen Seite eine gute Ausbildung wollen. All das kann vorangebracht werden. Ich hoffe, dass die Aktuelle Stunde mit dazu beiträgt.

Vielen Dank.",data/txt/17194.txt,speech,
2100418,194,17,0,,,,243,"Beifall bei der SPD, der CDU/CSU, der FDP und dem BÜNDNIS 90/DIE GRÜNEN",data/txt/17194.txt,poi,
2100419,194,17,0,,,,244,"Vizepräsident Eduard Oswald:

Vielen Dank, Kollege Rolf Mützenich. - Nächster Redner für die Fraktion der CDU/CSU ist unser Kollege Karl-Georg Wellmann. Bitte schön, Kollege Wellmann.",data/txt/17194.txt,speech,
2100420,194,17,0,,,,245,Beifall bei der CDU/CSU und der FDP,data/txt/17194.txt,poi,
2100421,194,17,0,,,,246,"Karl-Georg Wellmann (CDU/CSU):

Herr Präsident! Meine Damen und Herren! Die Zustände in Belarus im Zusammenhang mit den Wahlen sind hinlänglich bekannt. Die OSZE hatte eine Wahlbeobachtermission dort. Die Wahl war weder fair noch frei. Ich habe bei den letzten Wahlen selbst erlebt, wie gefälscht wurde, wie Studentenkolonnen, Polizisten, Militärangehörige da hineingetrieben wurden. Auch das Umfeld war alles andere als demokratisch, wie man an der nicht vorhandenen Pressefreiheit und Meinungsfreiheit sieht. Die Führer der Opposition sind fast samt und sonders im Zuchthaus gelandet, in zum Teil beängstigenden Verhältnissen; einige kamen menschlich gebrochen zurück. Das ist furchtbar. Der Staatschef macht sich lustig über die Opposition: Er sagt, das seien Feiglinge. Ich empfinde das als zynisch und abstoßend, und das sollten wir hier noch einmal deutlich hervorheben.",data/txt/17194.txt,speech,
2100422,194,17,0,,,,247,"Beifall bei der CDU/CSU, der SPD, der FDP und dem BÜNDNIS 90/DIE GRÜNEN sowie bei Abgeordneten der LINKEN",data/txt/17194.txt,poi,
2100423,194,17,0,,,,248,"Was bedeutet das Ganze für uns? Dieses Regime hat die Chance verpasst, das Land zu modernisieren. Es hat verpasst, die gesellschaftlichen Kräfte dieses sympathischen belarussischen Volkes zu mobilisieren. Und es hat verpasst, das Land in die europäische Moderne zu führen. Stattdessen haben wir eine Kommandowirtschaft sowjetischer Prägung mit all den Nachteilen wie Ineffizienz und fehlender Wettbewerbsfähigkeit. Statt politischer Teilhabe haben wir Unterdrückung und Bevormundung. In der Tat: Das ist eine Tragödie, wie es jemand von der Bundesregierung gesagt hat. - Das Gedränge auf der Regierungsbank nimmt ja beängstigte Ausmaße an. Ich finde es gut, dass wenigstens einer anwesend ist.",data/txt/17194.txt,speech,
2100424,194,17,0,Manfred Grund [CDU/CSU],Manfred Grund [CDU/CSU],manfred-grund-cdu-csu,249,Unsere Fangemeinde ist auch nicht besonders groß!,data/txt/17194.txt,poi,cducsu
2100425,194,17,0,,,,250,"Es ist eine europäische Tragödie, und das auch deshalb, weil die Besten, vor allem die guten jungen Leute, das Land in Scharen verlassen. Was bleibt zurück? Bei uns bleibt so etwas wie Ratlosigkeit zurück. Herr Mützenich, ich erinnere mich an unsere letzte Belarus-Debatte. Die Erkenntnis ist vorhanden, dass Sanktionen kaum noch etwas ausrichten bei einem Regime, das aus Gründen des blanken Machterhalts sagt: Das ist uns alles egal. - Es nimmt die Nachteile, die mit dieser Diktatur verbunden sind, in Kauf und schneidet das Land von der europäischen Wohlstandsentwicklung ab.

Was können wir tun? Noch mehr Sanktionen? Ich habe Zweifel, ob dies Wirkungen hat, ob das wirklich Änderungen herbeiführt. Wir haben, Herr Mützenich, in diesem Kreis ganz richtig gesagt: Wir müssen mehr für Studenten tun; wir müssen mehr Geld für Stipendien aufbringen. Der DAAD muss zum Teil Studenten mit einem Notendurchschnitt von 1,2 zurückweisen, weil es nicht genug Studienplätze gibt. Ich danke dem Kanzleramtsminister, der leider nicht anwesend ist. Er hat mir neulich gesagt, dass sie, zusammen mit dem Auswärtigen Amt, darüber nachdenken, wenigstens ein paar Millionen Euro zu mobilisieren. Ein Stipendium kostet für einen Studenten im Jahr 10 000 Euro. Die Hochschulen in Deutschland nehmen uns die Studenten mit Kusshand ab.

Über das Regime Lukaschenko wird die Geschichte hinweggehen, wie die Geschichte über all die -Honeckers, Breschnews und Ceausescus hinweggegangen ist. Ich habe keinen Zweifel daran, dass es irgendwann eine demokratische Entwicklung geben wird, früher oder später. Aber wir sollten auch etwas anderes bedenken. Ich empfehle sehr den Artikel von Konrad Schuller in der FAZ vom 10. September, der gesagt hat: Lasst uns aufpassen, dass wir über die Prinzipienreiterei nicht unsere strategischen Interessen vergessen und am Ende mit leeren Händen dastehen. - Dies hat er nicht in Bezug auf Belarus, sondern auf die Ukraine gesagt.",data/txt/17194.txt,speech,
2100426,194,17,0,Viola von Cramon-Taubadel [BÜNDNIS 90/DIE GRÜNEN],Viola von Cramon-Taubadel [BÜNDNIS 90/DIE GRÜNEN],viola-cramon-taubadel-bundnis-90-die-grunen,251,Ukraine! Genau! Das ist auch was anderes!,data/txt/17194.txt,poi,gruene
2100427,194,17,0,,,,252,"Das aber sollte für uns ein Ansporn sein, uns zum Beispiel mehr um die Ukraine zu kümmern und unsere strategischen Ziele nicht zu vernachlässigen.

Zum Schluss möchte ich - das passt in die Zeit - Altbundeskanzler Kohl zitieren. Helmut Kohl hat seinerzeit mit Erich Honecker Verträge ausgehandelt. Er wurde wild kritisiert, dass er mit Diktaturen überhaupt verhandelt, anstatt Sanktionen zu erlassen. Er hat gesagt, das sei nicht wichtig. Wichtig ist, was den Menschen hilft. Daran sollten wir uns auch in dieser Sache orientieren.

Danke für die Aufmerksamkeit.",data/txt/17194.txt,speech,
2100428,194,17,0,,,,253,Beifall bei der CDU/CSU und der FDP sowie bei Abgeordneten der SPD und des BÜNDNISSES 90/DIE GRÜNEN,data/txt/17194.txt,poi,
2100429,194,17,0,,,,254,"Vizepräsident Eduard Oswald:

Vielen Dank, Herr Kollege. - Nächster Redner in unserer Aktuellen Stunde ist für die Fraktion Die Linke unser Kollege Wolfgang Gehrcke. Bitte schön, Kollege Wolfgang Gehrcke.",data/txt/17194.txt,speech,
2100430,194,17,0,,,,255,Beifall bei der LINKEN,data/txt/17194.txt,poi,
2100431,194,17,0,,,,256,"Wolfgang Gehrcke (DIE LINKE):

Danke sehr. - Herr Präsident! Liebe Kolleginnen und Kollegen! Man wäre versucht, zu spotten, wenn man sieht, wie Lukaschenko das Wahlergebnis in der Öffentlichkeit darstellt. Ich finde ein Parlament ohne einen einzigen Abgeordneten der Opposition völlig absurd. Darauf noch stolz zu sein, ließe auf eine gewisse Verwirrung im oberen Körperteil schließen. Trotzdem bleibt mir der Spott im Halse stecken. Ich schaue auf Belarus, auf Weißrussland, und weiß, welche Opfer dieses Land unter der deutschen Besatzung, also im Faschismus, gebracht hat. Ich weiß, dass wir für dieses Land eine Mitverantwortung haben. Das spüre ich auch. Ich möchte nicht von oben herab über dieses Land reden. Ich möchte, dass wir uns immer wieder in Erinnerung rufen: Das ist Europa und gehört zu Europa. Man muss einen Weg finden, wie man beides ausdrückt: Verachtung für Lukaschenko und Offenheit für die Bürgerinnen und Bürger des Landes.",data/txt/17194.txt,speech,
2100432,194,17,0,,,,257,Beifall bei der LINKEN,data/txt/17194.txt,poi,
2100433,194,17,0,,,,258,"Die Bürgerinnen und Bürger Weißrusslands sind nicht Lukaschenko, ganz im Gegenteil. Ich möchte nicht, dass sie in diese Ecke gedrängt werden. Das hat bisher dankenswerterweise keiner gemacht.

Wir sollten trotzdem festhalten: Es waren Wahlen der Ungleichheit und der Unfreiheit, ohne freie Presse, ohne öffentliche Veranstaltungen, die man, wenn man es möchte, hätte durchführen können. Es waren Wahlen mit großem Druck auf diejenigen, die kandidieren wollten oder die kandidiert haben.

In diesem Zusammenhang ist mir ein Gedanke sehr wichtig: Sterben Freiheiten wie Freiheit der Presse oder Freiheit der Politik und werden Parlamente, die man so auch nur nennt, nur noch einberufen, um das zu bestätigen, was zuvor festgelegt wurde, dann stirbt die Demokratie, und dann stirbt das gesamte gesellschaftliche Leben.

Dieser Weg ist in Belarus leider vorgezeichnet. Bei dieser Form von Politik erstirbt das gesellschaftliche Leben, eine Eiszeit kehrt ein. Das schlägt dann auf alle zurück. Der schöne Gedanke: Sterben diese Freiheiten, dann stirbt das gesellschaftliche Leben stammt übrigens nicht von mir, sondern von Rosa Luxemburg. Bei ihr kann man das - in besserer Formulierung - noch einmal nachlesen.

Für uns stellt sich nun die nicht einfach zu beantwortende Frage: Was tun? Nur die Tatbestände an sich zu beschreiben - vielleicht sind wir uns in der Beschreibung sogar einig -, hilft nicht weiter. Ich denke in ähnlicher Art und Weise wie der Kollege Wellmann: Man sollte einmal ausloten: Was ist bisher gelaufen, und was ist wirksam gewesen? Wir können ja nicht sagen: Wir machen immer weiter so.

Ich finde, dass im Großen und Ganzen Sanktionen, der Druck auf das Regime etc. nicht das erbracht haben, was ich mir davon erhofft hatte. Es ist kein Wandel eingetreten - ganz im Gegenteil. Daher stelle ich mir die Frage: Muss man vielleicht die eigene Taktik, wie man an das Problem herangeht, verändern? Hier kann man zu unterschiedlichen Schlussfolgerungen kommen.

Ich bin dafür, dass wir maximale Kontakte in das Land Belarus hinein entwickeln, inklusive der Eishockeyweltmeisterschaft, jedoch ohne dass wir so tun, als hätte Politik mit Sport nichts zu tun. Meine These heißt: Wenn an die Mumie Luft kommt, zerfällt die Mumie. Ich möchte, dass die Mumie Lukaschenko, der schon sein kleines Kind als seinen Nachfolger präsentiert, zerfällt.

Deswegen schlage ich vor, etwa darüber nachzudenken: Wie kann man beispielsweise die Kontakte zu Belarus vervielfältigen? Das fängt bereits bei der Visafrage an. Wer nach Deutschland kommen möchte, soll kommen. Da müssen die Türen offenstehen,",data/txt/17194.txt,speech,
2100434,194,17,0,,,,259,Beifall bei der LINKEN sowie bei Abgeordneten der SPD und des Abg. Karl-Georg Wellmann [CDU/CSU],data/txt/17194.txt,poi,
2100435,194,17,0,,,,260,"da muss es eine Willkommenskultur geben. Wir müssen auch überlegen, welche Möglichkeiten sich in beiden Ländern im kulturellen Bereich ergeben.

Ich frage mich: Was passiert eigentlich mit den Städtepartnerschaften? Es gibt eine Menge Städtepartnerschaften zwischen Städten in Deutschland und in Weißrussland. Kann man diese Städtepartnerschaften nutzen, um auf eine andere Politik, einen anderen geistigen Atem hinzuwirken? Was können deutsche Abgeordnete bewirken, wenn sie vor Ort fordern: Wir wollen Zugang zu den Gefängnissen haben!?",data/txt/17194.txt,speech,
2100436,194,17,0,Patrick Kurth [Kyffhäuser] [FDP],Patrick Kurth [Kyffhäuser] [FDP],patrick-kurth-kyffhauser-fdp,261,Die werden nicht reingelassen! Gehen Sie doch mal nach Weißrussland!,data/txt/17194.txt,poi,fdp
2100437,194,17,0,,,,262,"Wir wollen wissen, was mit unseren Kolleginnen und Kollegen, die kandidiert haben, in diesen Gefängnissen passiert. Das alles sind Möglichkeiten, wie die politischen Verhältnisse verändert werden können. Hierüber müssen wir nachdenken.

Diese Fragen dürfen auch in den Gesprächen mit Russland nicht ausgespart werden, die für beide Seiten nicht immer ganz einfach sind. Russland kann Einfluss nehmen, und Russland muss Einfluss nehmen. Das bedeutet, dass Putin dazu gebracht werden muss, über sein eigenes Verhalten nachzudenken.",data/txt/17194.txt,speech,
2100438,194,17,0,,,,263,Beifall bei Abgeordneten der LINKEN,data/txt/17194.txt,poi,
2100439,194,17,0,,,,264,"Auch das gehört zum Problem dazu.

Ich kann nur vorschlagen, dass wir auf diese Art und Weise versuchen, eine andere Form der Politik in Belarus durchzusetzen. Ich wiederhole noch einmal: Weißrussland ist nicht Lukaschenko, und Lukaschenko spricht nicht für Weißrussland.

Danke sehr.",data/txt/17194.txt,speech,
2100440,194,17,0,,,,265,Beifall bei der LINKEN sowie bei Abgeordneten der SPD und des BÜNDNISSES 90/DIE GRÜNEN,data/txt/17194.txt,poi,
2100441,194,17,0,,,,266,"Vizepräsident Eduard Oswald:

Vielen Dank, Kollege Wolfgang Gehrcke. - Nächste Rednerin in unserer Aktuellen Stunde ist für die Fraktion Bündnis 90/Die Grünen unsere Kollegin Frau Viola von Cramon-Taubadel. Bitte schön, Frau Kollegin.

Viola von Cramon-Taubadel (BÜNDNIS 90/DIE GRÜNEN):

Herr Präsident! Liebe Kolleginnen und Kollegen! Ich vertrete heute Marieluise Beck, die auf einer besonderen Mission unterwegs war, leider erfolglos. Sie hat versucht, Herrn Chodorkowski im nordrussischen Strafgefangenenlager zu besuchen. Das ist ihr, wie man fast erwarten konnte, leider nicht geglückt. Aber ich glaube, es war trotzdem gut, dass sie sich auf die Reise gemacht hat.

Zurück zur Bewertung der Wahl. Ich kann mich dem Kollegen Mützenich nur anschließen: Natürlich ist diese Aktuelle Stunde zur Unterstützung der Menschen, der Zivilgesellschaft in Belarus gedacht.

Lukaschenko hat in einer Atmosphäre von Repression und Angst ein Theaterstück abgezogen. Das hatte mit einer Wahl überhaupt nichts zu tun. Von Anfang an wurde nichts dem Zufall überlassen. Die Opposition wurde aus den Wahlkommissionen herausgehalten; sie stellten 0,09 Prozent der Kommissionsmitglieder. Die Auszählung konnte deshalb unmöglich überprüft werden. So wurde ein dem Diktator genehmes Ergebnis garantiert. Wir haben es schon von Herrn Wellmann gehört: Bewohner von Studentenwohnheimen, Soldaten und Arbeitskollektive wurden wie in alter sowjetischer Zeit zur vorzeitigen Stimmabgabe genötigt. Hierbei ist die Manipulation der Urnen besonders einfach. Das gibt es in anderen postsowjetischen Staaten auch, aber - das muss man einfach sagen - nicht ganz so drastisch wie in Weißrussland. Oppositionelle wurden unter Druck gesetzt, festgenommen und zum Teil an Leib und Leben bedroht.

Jetzt kommt der Punkt: Einzig eine Wahlbeteiligung unter 50 Prozent hätte die Wahl ungültig gemacht. Auch deshalb gab es Nötigungen von Wählern. Auch deshalb wurden Wurst und Alkohol in den Wahllokalen verkauft; vielleicht ist es eine Möglichkeit, um auch hier die Wahlbeteiligung zu erhöhen.",data/txt/17194.txt,speech,
2100442,194,17,0,Patrick Kurth [Kyffhäuser] [FDP],Patrick Kurth [Kyffhäuser] [FDP],patrick-kurth-kyffhauser-fdp,267,"Das sagen die Grünen? Also, was ist denn hier los?",data/txt/17194.txt,poi,fdp
