id,sitzung,wahlperiode,in_writing,speaker,speaker_cleaned,speaker_fp,sequence,text,filename,type,speaker_party
2100318,194,17,0,,,,143,"Bartholomäus Kalb (CDU/CSU):

Lieber geschätzter Kollege Danckert, ich will Folgendes festhalten:

Erstens. Das Bundesverfassungsgericht hat Ihre -Anträge auf Erlass einer einstweiligen Anordnung ab-gelehnt; das habe ich gerade ausgeführt.",data/txt/17194.txt,speech,
2100319,194,17,0,Norbert Barthle [CDU/CSU],Norbert Barthle [CDU/CSU],norbert-barthle-cdu-csu,144,Und zwar klar und deutlich!,data/txt/17194.txt,poi,cducsu
2100320,194,17,0,,,,145,"Zweitens. Das Bundesverfassungsgericht hat fest--gestellt, dass die von uns beschlossenen Maßnahmen mit der Verfassung in Einklang stehen.

Drittens. Wir, die wir den ESM-Verträgen zugestimmt haben, fühlen uns in keiner Weise beschwert, sondern, ganz im Gegenteil, im Hinblick auf das, was wir im Rahmen des ESM-Finanzierungsgesetzes bereits beschlossen haben, durch das Bundesverfassungsgericht sogar bestätigt. Man kann es nur begrüßen, wenn das auf Anregung bzw. Anordnung des Bundesverfassungsgerichts sogar völkerrechtlich abgesichert wird.

Wir haben im ESM-Finanzierungsgesetz festgelegt, was zu tun ist. Die Haftungssumme wurde auf 190 Milliarden Euro und ein paar Zerquetschte beschränkt, und sie darf nicht erhöht werden - das ist der feine Unterschied zu mancher Interpretation -, wenn nicht das -Parlament erneut darüber befindet. Wir haben im ESM-Finanzierungsgesetz auch festgelegt, dass der deutsche Vertreter an den jeweiligen Sitzungen teilnehmen muss, dass er sich nicht enthalten darf und folgerichtig mit Nein stimmen muss, wenn es im Hinblick auf Entscheidungen, die den Haftungsrahmen betreffen könnten, kein entsprechendes parlamentarisches Votum gibt.

Ich denke, hier hat das Bundesverfassungsgericht uns voll und ganz recht gegeben. Es hat angeordnet, dass das, was wir hinsichtlich der Innenbindung festgelegt haben, auch den Vertragspartnern völkerrechtlich bindend mitgeteilt werden muss.",data/txt/17194.txt,speech,
2100321,194,17,0,Norbert Barthle [CDU/CSU],Norbert Barthle [CDU/CSU],norbert-barthle-cdu-csu,146,Genau! Dafür hätte es keine Klage gebraucht!,data/txt/17194.txt,poi,cducsu
2100322,194,17,0,,,,147,"Nicht mehr und nicht weniger wird durch das, was hier und heute Gegenstand der Debatte ist, getan. Ich denke, damit ist das allermeiste zu dem ganzen Thema gesagt.

Vizepräsident Dr. Hermann Otto Solms:

Herr Kollege Kalb, auch der Herr Kollege Stinner würde Ihnen gerne eine Zwischenfrage stellen, wenn Sie möchten.

Bartholomäus Kalb (CDU/CSU):

Ja.

Vizepräsident Dr. Hermann Otto Solms:

Bitte.",data/txt/17194.txt,speech,
2100323,194,17,0,Manuel Sarrazin [BÜNDNIS 90/DIE GRÜNEN],Manuel Sarrazin [BÜNDNIS 90/DIE GRÜNEN],manuel-sarrazin-bundnis-90-die-grunen,148,Warum nicht bei mir?,data/txt/17194.txt,poi,gruene
2100324,194,17,0,,,,149,Heiterkeit beim BÜNDNIS 90/DIE GRÜNEN,data/txt/17194.txt,poi,
2100325,194,17,0,,,,150,"Bartholomäus Kalb (CDU/CSU):

Die mögen mich mehr.

Dr. Rainer Stinner (FDP):

Vielen Dank, sehr geehrter Herr Kollege Kalb. - -Teilen Sie meinen Eindruck, dass die Einlassung des Kollegen Danckert, SPD, bezüglich des heute zu verhandelnden Themas völlig kontrovers zu der Einlassung des Kollegen Schneider, SPD, war?",data/txt/17194.txt,speech,
2100326,194,17,0,Dr. Diether Dehm [DIE LINKE],Dr. Diether Dehm [DIE LINKE],diether-dehm-die-linke,151,Das ist aber eine tolle Frage!,data/txt/17194.txt,poi,linke
2100327,194,17,0,,,,152,"Teilen Sie auch meinen Eindruck, dass damit ein -weiteres Mal bewiesen ist, dass die SPD offensichtlich gespalten und in dieser Situation nicht handlungsfähig ist?",data/txt/17194.txt,speech,
2100328,194,17,0,,,,153,Beifall bei der FDP und der CDU/CSU,data/txt/17194.txt,poi,
2100329,194,17,0,,,,154,-Lachen bei der SPD,data/txt/17194.txt,poi,
2100330,194,17,0,,,,155,"Bartholomäus Kalb (CDU/CSU):

Herr Kollege, ich bin Ihnen ausdrücklich dankbar für diesen Hinweis. Ich teile diesen Ihren Eindruck vollumfänglich, weil wir gerade bei all diesen Fragen immer wieder feststellen müssen, dass der Kollege Schneider hier so redet, wie er gelegentlich redet und wie wir ihn kennen, während seine Partei und seine Fraktion eine ganz andere Linie vertreten.",data/txt/17194.txt,speech,
2100331,194,17,0,Stefan Müller [Erlangen] [CDU/CSU],Stefan Müller [Erlangen] [CDU/CSU],stefan-muller-erlangen-cdu-csu,156,-Typisch!,data/txt/17194.txt,poi,cducsu
2100332,194,17,0,,,,157,Ich muss fast sagen: In den grundsätzlichen Dingen vertreten die Führungen seiner Partei und seiner Fraktion vielleicht sogar eine klarere Linie als der Kollege Schneider.,data/txt/17194.txt,speech,
2100333,194,17,0,,,,158,Beifall bei CDU/CSU und der FDP,data/txt/17194.txt,poi,
2100334,194,17,0,,,,159,"Ich denke, damit ist das Wesentliche zu dem heute gegenständlichen Punkt gesagt. Die Fragen, die mir gestellt worden sind, haben mir Gelegenheit gegeben, all das unterzubringen, was ich ohnehin gerne angebracht hätte. Insofern darf ich mich beim Kollegen Stinner, aber auch beim Kollegen Danckert ganz herzlich bedanken.

Vizepräsident Dr. Hermann Otto Solms:

Auch der Herr Kollege Sarrazin würde Ihnen gerne noch eine Frage stellen. Das ist dann aber die letzte. Danach sind wir am Schluss dieses Tagesordnungspunktes.

Bartholomäus Kalb (CDU/CSU):

Da er so viel Mitleid hat mit mir und meine Redezeit verlängern möchte, gerne.

Vizepräsident Dr. Hermann Otto Solms:

Sie haben eigentlich noch zwei Minuten Redezeit.",data/txt/17194.txt,speech,
2100335,194,17,0,,,,160,Lachen bei der SPD und der LINKEN,data/txt/17194.txt,poi,
2100336,194,17,0,Dr. Dagmar Enkelmann [DIE LINKE],Dr. Dagmar Enkelmann [DIE LINKE],dagmar-enkelmann-die-linke,161,Er hat keinen Text mehr!,data/txt/17194.txt,poi,linke
2100337,194,17,0,,,,162,"Manuel Sarrazin (BÜNDNIS 90/DIE GRÜNEN):

Ich kann mich ja schnell wieder setzen. - Verehrter Herr Kollege Kalb, teilen Sie meinen Eindruck, dass Herr Gauweiler, wenn er sich heute gemeldet hätte, hier eine Position vertreten hätte, die nicht derjenigen entspricht, die Sie vorgetragen haben, womit deutlich wird, dass die Koalition in dieser Frage zerstritten und nicht handlungsfähig ist?",data/txt/17194.txt,speech,
2100338,194,17,0,,,,163,Beifall beim BÜNDNIS 90/DIE GRÜNEN,data/txt/17194.txt,poi,
2100339,194,17,0,Gunther Krichbaum [CDU/CSU],Gunther Krichbaum [CDU/CSU],gunther-krichbaum-cdu-csu,164,Was ist mit Herrn Ströbele? Wollen wir doch einmal den Ströbele hören!,data/txt/17194.txt,poi,cducsu
2100340,194,17,0,,,,165,"Bartholomäus Kalb (CDU/CSU):

Letzteres nicht. Es gibt abweichende Meinungen.",data/txt/17194.txt,speech,
2100341,194,17,0,Dr. Diether Dehm [DIE LINKE],Dr. Diether Dehm [DIE LINKE],diether-dehm-die-linke,166,"Die Einzigen, die einheitlich sind, sind wir!",data/txt/17194.txt,poi,linke
2100342,194,17,0,,,,167,"Die Debatte hätte dann vielleicht länger gedauert, aber die Meinung der Mehrheit ist vollkommen klar. Die -Koalition ist nicht zerstritten. Wir müssen auch abweichende Meinungen akzeptieren.

Kollege Gauweiler ist übrigens anwesend. Wir beide diskutieren sehr oft",data/txt/17194.txt,speech,
2100343,194,17,0,Dr. Diether Dehm [DIE LINKE],Dr. Diether Dehm [DIE LINKE],diether-dehm-die-linke,168,Das ist gut!,data/txt/17194.txt,poi,linke
2100344,194,17,0,,,,169,"und sehr gegensätzlich. Ich finde: Auch wenn man die Meinung nicht teilt, sollte man dem anderen den Respekt nicht versagen und anhören, was er zu sagen hat.",data/txt/17194.txt,speech,
2100345,194,17,0,Christian Lange [Backnang] [SPD],Christian Lange [Backnang] [SPD],christian-lange-backnang-spd,170,Das gilt dann für den Kollegen Danckert erst recht!,data/txt/17194.txt,poi,spd
2100346,194,17,0,,,,171,"Danach muss es im demokratischen Verfahren zu einer Meinungsbildung und zur Entscheidung kommen, so wie wir mit ganz großer Mehrheit hier in diesem Hause zu einer Entscheidung gekommen sind. Dass hier abweichende Meinungen bestehen bleiben, liegt in der Natur der Sache.",data/txt/17194.txt,speech,
2100347,194,17,0,,,,172,Beifall bei der CDU/CSU sowie bei Abgeordneten der FDP,data/txt/17194.txt,poi,
2100348,194,17,0,,,,173,"Vizepräsident Dr. Hermann Otto Solms:

Vielen Dank. - Ich schließe die Aussprache.

Die Fraktion Die Linke wünscht die Überweisung der Unterrichtung auf Drucksache 17/10767 zur federführenden Beratung an den Haushaltsausschuss und zur Mitberatung an den Innenausschuss, an den Rechtsausschuss, an den Finanzausschuss, an den Ausschuss für Wirtschaft und Technologie und an den Ausschuss für die Angelegenheiten der Europäischen Union. Die Fraktionen der CDU/CSU, SPD, FDP und Bündnis 90/Die Grünen wünschen hingegen, die Behandlung der Unterrichtung heute durch Kenntnisnahme abzuschließen.

Wer stimmt für den Antrag der Fraktion Die Linke auf Überweisung? - Wer stimmt dagegen? - Das ist offenkundig die Mehrheit. Enthaltungen? - Keine Enthaltungen. Damit ist der Überweisungsvorschlag abgelehnt. Die Unterrichtung ist somit zur Kenntnis genommen.

Damit sind wir am Ende dieses Tagesordnungspunktes.

Wir kommen zum Tagesordnungspunkt 1:

Befragung der Bundesregierung

Die Bundesregierung hat als Thema der heutigen Kabinettssitzung mitgeteilt: Bericht der Bundesregierung zum Stand der Deutschen Einheit 2012.

Das Wort für den einleitenden fünfminütigen Bericht hat der Bundesminister des Innern, Herr Dr. Hans-Peter Friedrich.

Dr. Hans-Peter Friedrich, Bundesminister des Innern:

Vielen Dank, Herr Präsident. - Meine sehr verehrten Damen und Herren Kollegen! Wir legen den Bericht, der heute im Bundeskabinett verabschiedet worden ist, dem Parlament vor. Wir haben uns dabei in diesem Jahr im Wesentlichen auf zwei Schwerpunkte konzentriert, nämlich auf die Konvergenz im Bereich der wirtschaftlichen Entwicklung und des Arbeitsmarktes sowie auf die Frage der demografischen Herausforderung, die nicht nur in den neuen Ländern, aber dort vor allem, schon seit längerer Zeit zu beobachten ist.

Die erfreulichste Botschaft vorweg: Die Arbeitslosigkeit ist in den neuen Ländern auf einem historischen Tiefstand. Wir haben in Ostdeutschland eine Arbeits--losenquote von 10,3 Prozent. Das ist historisch niedrig. Aber das ist - das wissen wir alle - natürlich erheblich über der Marke von 6 Prozent, die wir in den alten Bundesländern, also in Westdeutschland, haben.

Wir stellen als Herausforderung besonderer Art - das ist der erste Punkt - eine nach wie vor unterentwickelte Innovationsfähigkeit in den neuen Ländern im Bereich der Wirtschaft fest, die im Wesentlichen darauf zurückzuführen ist, dass wir es dort mit einer sehr kleinteiligen Wirtschaftsstruktur und mit zum Teil nicht nur mittelständischen, sondern auch sehr kleinen Unternehmen zu tun haben, die, was ihre Innovationskraft angeht, Unterstützung brauchen und durch staatliche Hilfen natürlich auch bekommen.

Ein zweiter Punkt, der ebenfalls mit dieser Kleinteiligkeit zusammenhängt, ist die noch ausbaufähige Exporttätigkeit und Exportorientierung der Wirtschaft in den neuen Ländern. Auch hier versuchen wir, mit sehr gezielten Programmen dafür zu sorgen, dass dieser Nachteil für die Wirtschaft in den ostdeutschen Ländern ausgeglichen wird.

Wir müssen insgesamt feststellen, dass wir im Grunde den Wirtschaftsraum neue Länder in dieser allgemeinen Form gar nicht mehr haben. Wir haben vielmehr sehr unterschiedliche Entwicklungen in den verschiedenen Regionen und auch sehr unterschiedliche Entwicklungen in den einzelnen Wirtschaftszentren. Es gibt Boomregionen und strukturschwache Gebiete, die eine einheitliche Beurteilung des Wirtschaftsraums Ost mit allgemeinen Aussagen gar nicht zulassen.

Wir sehen aber einen Punkt, der gerade in den neuen Ländern flächendeckend sehr stark zum Tragen kommt, nämlich die demografische Entwicklung. Das Abnehmen der Geburtenrate - in den 90er-Jahren gab es eine Halbierung - und auch die Abwanderung haben in den neuen Ländern besondere Herausforderungen mit sich gebracht. Das ist auch der Grund dafür, dass sich der Beauftragte der Bundesregierung für die Neuen Bundesländer zusammen mit mir für eine Nachfolgeregelung bei der EU-Förderung für die neuen Länder mit sehr großer Kraft einsetzt.

Wir wissen, dass das in der nächsten Förderperiode durchaus schwierig wird. Aber wir sind der Meinung, dass ein Sicherheitsnetz von zwei Dritteln des jetzigen Förderniveaus geschaffen werden muss. Ich kann sagen, dass die Verhandlungen des Beauftragten in Brüssel auf einem sehr guten Weg sind. Ich glaube, das ist wichtig, um diesen demografischen Herausforderungen Rechnung tragen zu können.

Der letzte Punkt, den ich ansprechen möchte - das ist eine besondere Herausforderung, die sich in ganz Deutschland abzeichnet, aber in den neuen Ländern besonders stark zum Vorschein kommt -, ist der drohende Fachkräftemangel. Deswegen gibt es auch an dieser Stelle eine sehr gezielte Politik der Bundesregierung: Förderung der Ausbildung und Fachkräfteausbildung, gerade um die kleinen und mittelständischen Unternehmen flankierend zu unterstützen. Ich denke, auch mit dieser Offensive sind wir auf einem guten Weg.

Das zunächst zur Einleitung, Herr Präsident. Ich stehe zur Beantwortung von Fragen ebenso wie der Beauftragte der Bundesregierung, der neben mir sitzt, zur Verfügung. Falls Sie unmittelbar Fragen an ihn haben, bitte ich, mir das dann, mit Ihrer Erlaubnis, Herr Präsident, zu signalisieren.

Vizepräsident Dr. Hermann Otto Solms:

Vielen Dank, Herr Friedrich. - Die erste Frage hierzu stellt Herr Volker Beck von den Grünen.",data/txt/17194.txt,speech,
2100349,194,17,0,Volker Beck [Köln] [BÜNDNIS 90/DIE GRÜNEN],Volker Beck [Köln] [BÜNDNIS 90/DIE GRÜNEN],volker-beck-koln-bundnis-90-die-grunen,174,"Nein, zur Kabinettssitzung!",data/txt/17194.txt,poi,gruene
2100350,194,17,0,,,,175,"- Entschuldigung, ich rufe Ihre Frage dann später auf. - Ralph Lenkert ist der erste Fragesteller.

Ralph Lenkert (DIE LINKE):

Vielen Dank, Herr Präsident. - Herr Bundesminister, die Bundesrepublik ist noch Eigentümer von mehr als 11 000 Wohnungen in Ostdeutschland, die der TLG gehören. Diese soll jetzt privatisiert werden. Welche Aussagen macht der Jahresbericht zum Stand der deutschen Einheit zu dieser Privatisierung, und warum wurde die Bietergenossenschaft Fairwohnen vom Bundesministerium der Finanzen aus dem Bieterverfahren ausgeschlossen? Können Sie als Minister diese Privatisierung noch verhindern?

Dr. Hans-Peter Friedrich, Bundesminister des Innern:

Zunächst einmal ist zu sagen, dass auch die Bundesregierung eine solche Privatisierung nicht verhindern kann. Ich habe vorhin gesagt, dass wir uns bei dem -Bericht im Wesentlichen auf die Fragen der wirtschaftlichen Konvergenz und des Arbeitsmarktes konzentriert haben. Die speziellen Fragen der Wohnungsbauentwicklung in den neuen Ländern, die Sie angesprochen haben, haben wir übrigens ebenso wie Fragen der Infrastruktur in einem Bericht gebündelt, den der Bauminister vorlegen wird. Insofern enthält der Bericht keine Antwort auf diese speziellen Fragen, die Sie gestellt haben.

Vizepräsident Dr. Hermann Otto Solms:

Die nächste Frage stellt Dr. Martina Bunge.

Dr. Martina Bunge (DIE LINKE):

Danke, Herr Präsident. - Herr Minister, Sie haben über wirtschaftliche Fragen, den Arbeitsmarkt und die demografische Entwicklung gesprochen. Ich hoffe, der Bericht zur deutschen Einheit enthält auch etwas zum Stand der sozialen Einheit. In diesem Zusammenhang frage ich Sie, ob es bei den bisherigen Aussagen bleibt - der Ostbeauftragte Bergner hat sich gestern Abend dazu schon fast traditionell in den Medien geäußert -, dass die in der Koalitionsvereinbarung verabredete und als Wahlversprechen der Bundeskanzlerin auf dem Senio-rentag 2009 in Leipzig explizit angekündigte Angleichung von Ost- und Westrenten nicht mehr kommt, und ob das auch so in dem Bericht festgehalten ist.

Ich frage Sie, welche Perspektive sich aus dem Umstand ergibt - dazu gibt es eine entsprechende Zeitungsmeldung -, dass die Renten den Löhnen wie bisher folgen sollen. 1991 hat man gedacht, die Angleichung dauert fünf Jahre; inzwischen sind es 20 Jahre. Die Differenz bei den Renten vergrößert sich immer weiter und beträgt jetzt 142 Euro. Das sind keine Peanuts. Es gibt Berechnungen, dass die Angleichung so 160 Jahre dauern würde. Sollen die Menschen in den neuen Ländern darauf vertrauen?

Dr. Hans-Peter Friedrich, Bundesminister des Innern:

Frau Kollegin, der Ostbeauftragte hat sich gestern -geäußert, weil er gefragt worden ist. Es entspricht den Regeln der Höflichkeit, zu antworten, wenn eine Frage gestellt wird.

Zu der Rentenproblematik allgemein: Wir wollen eine Angleichung des Rentensystems in Ost und West. Das ist nicht nur in der Koalitionsvereinbarung so festgehalten, sondern es ist auch unser fester Wille. Wir haben aber auch immer gesagt: Wir werden das nicht gegen den Willen und die Auffassung der Regierungen in den neuen Ländern tun. Es gibt bisher keine einheitliche Haltung der Landesregierungen in den neuen Ländern in der Frage der Angleichung des Rentensystems.

Man sollte nicht den Eindruck erwecken, dass es automatisch eine Rentenerhöhung für alle wäre, wenn wir das Rentensystem angleichen würden. Es wäre für einige eine Rentenabsenkung, und das macht die Sache so kompliziert und so schwierig. Aber wir werden den besonderen Verhältnissen - Sie haben sie angesprochen - wie den immer noch relativ niedrigen Löhnen dadurch gerecht, dass wir eine Höherbewertung der Arbeitsverdienste vornehmen. Das würde bei einer Angleichung der Rentensysteme wegfallen. Ich glaube, das ist auch nicht in Ihrem Interesse.

Vizepräsident Dr. Hermann Otto Solms:

Nächste Frage Wolfgang Tiefensee.",data/txt/17194.txt,speech,
2100351,194,17,0,Zuruf von der FDP,von der FDP,von-der-fdp,176,"Ach, den gibt es auch noch?",data/txt/17194.txt,poi,fdp
2100352,194,17,0,,,,177,"Wolfgang Tiefensee (SPD):

Sehr verehrter Herr Minister, in den letzten 22 Jahren gab es eine positive Entwicklung im Osten; wir haben viel erreicht. Der Bericht belegt aber, dass der Trend stagniert und ein Negativtrend droht.

Erstes Schlüsselthema: Wirtschaftskraft. Sind Sie mit mir einer Meinung, dass die Absenkung der Förderung der regionalen Wirtschaftsstruktur durch die Bundes-regierung kontraproduktiv ist?

Zweites Schlüsselthema: Arbeitslosigkeit. Die Langzeitarbeitslosigkeit verfestigt sich. Sind Sie mit mir einer Meinung, dass die Kürzung der Gelder für die Arbeitsämter kontraproduktiv ist?

Drittes Schlüsselthema: Lohn. Es gibt nach wie vor eine Schere zwischen Ost und West. Sind Sie mit mir -einer Meinung, dass wir bei vielen außertariflichen -Arbeitsverhältnissen dringend einen Mindestlohn brauchen?

Viertes Schlüsselthema: Die Investitionen des Mittelstands in Forschung und Entwicklung liegen deutlich -unter Westniveau. Sind Sie mit mir einer Meinung, dass ein Nichtvollzug der steuerlichen Entlastung von Investitionen in Forschung und Entwicklung durch die Bundesrepublik für die Entwicklung Ostdeutschlands kon-traproduktiv ist?

Dr. Hans-Peter Friedrich, Bundesminister des Innern:

Herr Tiefensee, zunächst einmal glaube ich, dass die Gefahr von Rückschlägen - das heißt, dass es zu einer Vergrößerung der Lücke zwischen Ost und West kommen wird - nicht gegeben ist. Es kam in den letzten -Monaten durchaus zu einer unterschiedlichen Entwicklung - allerdings in ganz Deutschland - in den strukturstarken Gebieten und den strukturschwachen -Regionen; das wirkt sich natürlich auch in den neuen Ländern aus. Was die Angleichung der Wirtschaftskraft angeht, so glaube ich allerdings, dass wir auf ganzer -Linie weiterhin auf einem guten Weg sind.

Die Unterschiede bzw. die Schwankungen mögen auch dadurch zustande kommen, dass wir in 2008 in den alten Ländern einen stärkeren Einbruch der Wirtschaft hatten als in den neuen Ländern; der Aufholprozess dort ist entsprechend ausgeprägter. Das mag die Prozentzahlen im Einzelnen erklären.

Zu Ihren Fragen:

Erstens. Wir sind dabei, die Förderung des Arbeitsmarktes mit sehr gezielten Programmen weiter voranzutreiben.

Zweitens. Ich bin nicht der Meinung, dass Mindestlöhne, wie Sie sie sich vorstellen - Sie fordern gesetzliche Mindestlöhne -, geeignet sind, irgendwelche wirtschaftlichen oder gesellschaftlichen Fragestellungen zu beantworten.

Drittens. Wir werden weiterhin fünf Sechstel der Mittel, die für die Gemeinschaftsaufgabe Verbesserung der regionalen Wirtschaftsstruktur zur Verfügung stehen, in den neuen Ländern investieren. Ich glaube, dass das eine wichtige Investition ist.

Viertens. Wir erhöhen die Innovationskraft in den neuen Ländern mit den Programmen, die zurzeit laufen. Es gibt ein neues, sehr umfangreiches Programm des Forschungsministeriums. Somit stärken wir Forschung und Entwicklung und fördern neue Investitionen in den neuen Ländern.

Vizepräsident Dr. Hermann Otto Solms:

Vielen Dank. - Der nächste Fragesteller ist Frank Tempel.

Frank Tempel (DIE LINKE):

Herr Minister, inwiefern erachten Sie es als politische Kultur, dass ein solcher Bericht beispielsweise der Schweriner Zeitung früher vorliegt als den Berichterstattern im Deutschen Bundestag?

Sie sprachen soeben von den großen Anstrengungen, die auf dem Arbeitsmarkt unternommen werden. Nach unserer Einschätzung wird eher viel Kraft darauf verwendet, möglichst viele Programme auslaufen zu lassen. Wie sinnvoll ist es, die Investitionszulage, von der gerade die Kommunen im Osten profitiert haben, bis 2013 auslaufen zu lassen?

Dr. Hans-Peter Friedrich, Bundesminister des Innern:

Ich kann Ihnen zunächst einmal sagen, dass wir immer wieder sehr gezielt entsprechende Programme auf den Weg bringen. Natürlich kommt es auch vor, dass Programme auslaufen. Das gilt vor allem für die Bereiche, in denen wir keine originäre Zuständigkeit haben und wo wir befristete Pilotprojekte auf den Weg bringen. Das Auslaufen von solchen Programmen wird aber durch eine Vielzahl neuer Programme überkompensiert, die aufgrund neuer Herausforderungen und neuer Fragestellungen aufgelegt werden.

Zur Herausgabe des Berichts oder von Teilen des Berichts an die Schweriner Zeitung kann ich Ihnen nichts sagen. Ich weiß nämlich nicht, wie diese Zeitung da rangekommen sein könnte. Ob das, was dort zitiert wird - mir liegt die Zeitungsmeldung leider nicht vor -, dem entspricht, was im Bericht steht, kann ich Ihnen auch nicht bestätigen.

Vizepräsident Dr. Hermann Otto Solms:

Vielen Dank, Herr Minister. - Die nächste Frage stellt der Kollege Arnold Vaatz.

Arnold Vaatz (CDU/CSU):

Sehr geehrter Herr Minister, ich bin erst einmal sehr dankbar, dass Sie klargestellt haben, dass der geringere Anteil der ostdeutschen Wirtschaft an der gesamtdeutschen Wirtschaft im Vergleich zum Vorjahr - der Anstieg betrug rund 2 Prozent - darauf zurückzuführen ist, dass der Einbruch bei der letzten Wirtschaftskrise in Ostdeutschland nicht so stark war und dass aus diesem Grund die Konsolidierung nicht mit der Geschwindigkeit vorangegangen ist wie im Westen. Alle Zahlen einschließlich der verbesserten Arbeitslosenstatistik zeigen, dass es in Ostdeutschland insgesamt ein Wachstum gegeben hat. Allerdings ist das Tempo unter Berücksichtigung des vorausgegangenen Einbruchs nicht so hoch wie das im Westen. Es ist gut, dass Sie das klargestellt haben.

Ich habe zwei Fragen. Meine erste Frage lautet: Sie haben in Ihrem Bericht großen Wert darauf gelegt, die demografische Entwicklung darzulegen. Diese Entwicklung ist in der Tat sehr besorgniserregend. Können Sie sich Maßnahmen vorstellen, die auf Landes- und Gemeindeebene, aber auch auf Bundesebene ergriffen werden, um der demografischen Entwicklung entgegenzutreten?

Meine zweite Frage lautet: Wie beurteilen Sie den infrastrukturellen Unterschied, also die Infrastrukturdichte im Osten im Vergleich zur Infrastrukturdichte im Westen? Ich meine damit nicht nur Verkehrswege, sondern auch die wirtschaftliche Infrastruktur.

Dr. Hans-Peter Friedrich, Bundesminister des Innern:

Es gibt sicherlich bei der Infrastruktur nach wie vor Nachholbedarf. Da sind einige Projekte auf dem Weg, für die der Etat des Bundesverkehrsministers eine entsprechende Ausfinanzierung vorsieht. Was die Infrastruktur im Allgemeinen einschließlich der Forschungsinfrastruktur angeht, haben wir als Bundesregierung, glaube ich, sehr viel geleistet. Wir sorgen dafür, dass der Forschungsstandort in den neuen Ländern enorm gestärkt wird. Das ist ein sehr wichtiger und zentraler Punkt.

Zur demografischen Entwicklung. Wir werden am 4. Oktober auf einem großen Demografiegipfel im Kanzleramt offiziell neun Arbeitsgruppen starten. In all diesen Arbeitsgruppen, die sich mit neun zentralen und unterschiedlichen Handlungsfeldern der Demografie-politik der Bundesregierung befassen, werden die Interessen der neuen Länder vertreten sein. Dies ist deswegen besonders sinnvoll und notwendig, weil es in den neuen Ländern viele Erfahrungen, kreative Ideen und eine enorme Innovationsfähigkeit gibt, wenn es um das Problem der demografischen Entwicklung geht. Wir wollen diese Erfahrungen einbeziehen und versuchen, zusammen mit den Landesregierungen und den Kommunen - es gab bereits einen ersten Onlinedemografiekongress - Antworten zu finden, die der spezifischen Lage vor Ort gerecht werden.",data/txt/17194.txt,speech,
2100353,194,17,0,Arnold Vaatz [CDU/CSU],Arnold Vaatz [CDU/CSU],arnold-vaatz-cdu-csu,178,Vielen Dank!,data/txt/17194.txt,poi,cducsu
