id,sitzung,wahlperiode,in_writing,speaker,speaker_cleaned,speaker_fp,sequence,text,filename,type,speaker_party
2100175,194,17,0,,,,0,"Vizepräsident Dr. Hermann Otto Solms:

Guten Tag, liebe Kolleginnen und Kollegen! Die Sitzung ist eröffnet.

Interfraktionell ist vereinbart, die heutige Tages-ordnung um die Beratung der Unterrichtung durch die Bundesregierung zur Ratifizierung des Vertrages vom 2. Februar 2012 zur Einrichtung des Europäischen Stabilitätsmechanismus auf Drucksache 17/10767 zu erweitern und diese jetzt gleich als Zusatzpunkt 1 mit einer Debattendauer von einer halben Stunde aufzurufen. - Sind Sie damit einverstanden? - Ich sehe keinen Widerspruch. Dann können wir so verfahren.

Ich rufe somit den soeben aufgesetzten Zusatzpunkt 1 auf:

Beratung der Unterrichtung durch die Bundesregierung

Ratifizierung des Vertrages vom 2. Februar 2012 zur Einrichtung des Europäischen Stabilitätsmechanismus

- Drucksache 17/10767 -

Es ist vereinbart, die Debattendauer auf eine halbe Stunde zu begrenzen. - Auch dazu gibt es keinen Widerspruch. Dann ist so beschlossen.

Ich eröffne die Aussprache und erteile als erstem Redner dem Parlamentarischen Staatssekretär Steffen Kampeter das Wort.

Steffen Kampeter, Parl. Staatssekretär beim Bundesminister der Finanzen:

Herr Präsident! Meine sehr verehrten Damen und Herren! Wir haben heute einen wichtigen Schritt getan, um den ESM als einen robusten Krisenmechanismus schnellstmöglich in Gang zu setzen und damit ein wichtiges Instrument der Krisenbekämpfung zur Hand zu haben. Denn die Bundesregierung hat heute in ihrer Kabinettssitzung beschlossen, wie Deutschland zusammen mit unseren europäischen Partnern die Maßgaben erfüllen wird, die das Bundesverfassungsgericht uns in seinem Urteil zu ESM- und Fiskalvertrag vorgegeben hat, bevor Deutschland durch Hinterlegung der Ratifikationsurkunde den ESM-Vertrag nunmehr mit den anderen Partnern in Kraft setzen darf.

Lassen Sie mich dazu kurz rekapitulieren: Das Bundesverfassungsgericht hatte im September über Anträge zu entscheiden, die den ESM-Vertrag wie auch den Fiskalvertrag endgültig stoppen wollten und damit Deutschland in dieser Krise hätten handlungsunfähig werden lassen. Das Bundesverfassungsgericht hat - nach intensiver mündlicher Verhandlung - in seinem Urteil vom 12. September 2012 sowohl den Fiskalvertrag als auch den ESM-Vertrag grundsätzlich gebilligt und für verfassungskonform erklärt. Dies ist ein gutes Signal für die europäische Integration.",data/txt/17194.txt,speech,
2100176,194,17,0,,,,1,"Beifall bei der CDU/CSU, der FDP und dem BÜNDNIS 90/DIE GRÜNEN sowie bei Abgeordneten der SPD",data/txt/17194.txt,poi,
2100177,194,17,0,,,,2,"Entgegen der Auffassung der Kläger hat das Bundesverfassungsgericht - bei der im einstweiligen Verfahren erfolgten summarischen Prüfung - bestätigt, dass der ESM-Vertrag nach der gemeinsamen Lesart von Bundestag und Bundesregierung nicht die Budgetrechte verletzt. Lassen Sie mich auch betonen: Das Gericht hat auch das ESM-Finanzierungsgesetz bestätigt und festgestellt, dass die umfangreichen und europaweit sicherlich außergewöhnlichen, weil beispielhaften Beteiligungsrechte, die das deutsche Parlament beim laufenden Betrieb des ESM haben wird, ausreichende Einwirkungs- und Steuerungsmöglichkeiten des Bundestages garantieren.

Entgegen allen Vorbehalten hat das Bundesverfassungsgericht auch die Ansicht der Bundesregierung und des Bundestages bestätigt, dass der ESM keine Haftungsautomatismen begründet und die Zahlungsverpflichtungen nach sinnvoller und wahrscheinlicher Auslegung des Vertragswerks stets auf den von Bundestag und Bundesrat in den Umsetzungsgesetzen genehmigten Anteil am Stammkapital begrenzt sind. Das, meine sehr verehrten Damen und Herren, ist sicherlich auch ein Signal für mehr Rechtsfrieden und mehr Entspanntheit in der Debatte um ESM und Fiskalpakt gewesen.",data/txt/17194.txt,speech,
2100178,194,17,0,,,,3,Beifall bei der FDP sowie bei Abgeordneten der CDU/CSU,data/txt/17194.txt,poi,
2100179,194,17,0,,,,4,"In den Hausaufgaben, die das Bundesverfassungsgericht uns als Gesetzgeber und Bundesregierung aufgegeben hat, bevor wir dann den ESM in Kraft setzen können, hat es uns weder vorgegeben, den ESM-Vertrag zu ändern, noch, die entsprechenden Vorschriften neu zu verhandeln.

Es fordert lediglich in zwei Punkten interpretative bzw. Rechtssicherheit schaffende Erklärungen. Dass der Vertrag folgendermaßen interpretiert werden sollte, ist auch Auffassung der Bundesregierung, wie wir in diesem Verfahren betont haben:

Erstens. Wir sollen sicherstellen, dass unsere Haftung stets auf unseren Anteil am genehmigten Stammkapital begrenzt ist. Dies gilt insbesondere für alle Fälle des Kapitalabrufs, und eine Änderung darf nur mit Zustimmung des deutschen Vertreters im ESM erfolgen.

Wir haben zweitens sicherzustellen, dass die Regelungen des ESM-Vertrags zu Immunitäten, zur Unverletzlichkeit der Archive und zu den beruflichen Schweigepflichten - weder in Deutschland noch in irgendeinem anderen Land - der notwendigen und umfassenden parlamentarischen Kontrolle nicht entgegenstehen.

Meine sehr verehrten Damen und Herren, beides haben wir getan. Bereits bei der Euro-Gruppensitzung in Zypern am vorvergangenen Freitag haben wir über die Botschaft aus Karlsruhe gesprochen. Wie erwartet, -bestand und besteht zwischen den Signatarstaaten der Verträge inhaltlich ohnehin Einigkeit über die vom Bundesverfassungsgericht vorgegebene Auslegung des Vertrags. Insofern wurde schnell Einvernehmen darüber hergestellt, dass wir die Vorgaben unseres Gerichts durch eine gemeinsame verbindliche Auslegungserklärung umsetzen.

Wir haben dann in der vergangenen Woche den Text der Erklärung und das genaue Verfahren zügig ausverhandelt und natürlich umfassend rechtlich prüfen lassen. Heute Nachmittag werden wir nun die Botschafter bitten, die gemeinsame Erklärung, die exakt die inhaltlichen Punkte, die das Bundesverfassungsgericht vorgegeben hat, völkerrechtlich verbindlich festschreibt, für ihre Staaten rechtsverbindlich anzunehmen. Zusätzlich erklären wir - wie auch unsere Vertragspartner - eindeutig, dass diese Auslegung eine wesentliche Grundlage dafür darstellt, dass wir uns an diesen Vertrag gebunden fühlen.

Diese Erklärung wird dann dem Ratssekretariat als Depositar, das heißt als Verwahrer des ESM-Vertrags, notifiziert. Zusätzlich wird Deutschland bei der erst im Anschluss daran erfolgenden Hinterlegung der Ratifikationsurkunde noch einmal explizit auf diese gemeinsame Erklärung Bezug nehmen und damit ihre Bedeutung für die Bundesrepublik Deutschland unterstreichen.

Meine sehr verehrten Damen und Herren, liebe Kolleginnen und Kollegen, die Erklärung wird durch dieses Verfahren rechtsverbindlich - entgegen irgendwelchen anderen Auffassungen handelt es sich eben nicht nur um eine politische, sondern um eine rechtsverbindliche Erklärung - und ist zukünftig zwingend von den ESM-Vertragsparteien, von den ESM-Gremien und im etwaigen Streitfall auch vom EuGH als zum Vertrag zugehörig heranzuziehen.

Es herrscht völliges Einvernehmen in der Bundesregierung, dass wir damit die Vorgaben des Bundesverfassungsgerichts vollumfänglich und rechtssicher umsetzen. Eine erneute Ratifizierung der Erklärung oder sonstige verfassungsrechtliche Zustimmungserfordernisse für Bundestag und Bundesrat löst diese Erklärung nicht aus. Denn sie ändert ja den ESM-Vertrag gerade nicht, sondern sie bestätigt das, was wir wollen, nämlich den Inhalt, den Bundestag und Bundesrat ihm ohnehin beim Gesetzgebungsverfahren durch Erklärung hier im Deutschen Bundestag, aber auch durch die Texte gegeben haben.

Lassen Sie mich, Herr Präsident, meine sehr verehrten Damen und Herren, zum Abschluss auch darauf hinweisen, dass es uns damit zusammen mit unseren europäischen Partnern gelungen ist, Handlungsfähigkeit auf europäischer Ebene zu beweisen und besonders schnell grünes Licht für den ESM zu schaffen. Gerade angesichts der oftmals schwerfälligen, weil sehr förmlichen Prozesse im Bereich des Völkerrechts ist das ausdrücklich zu erwähnen.

Wenn wir dann den ESM in den nächsten Tagen in Kraft setzen, haben wir ein wesentliches Instrument zur Überwindung der Krise im Euro-Raum eingerichtet und können damit in diesem nach wie vor unruhigen Markt-umfeld effektiv agieren.

Ich freue mich über die breite Unterstützung für unser Vorgehen, nicht nur aus den eigenen Reihen, also seitens der Koalition, sondern auch aus den Reihen der Opposition. Dieses Miteinander war sicherlich auch ein wichtiges Moment gegenüber dem Verfassungsgericht.",data/txt/17194.txt,speech,
2100180,194,17,0,,,,5,"Beifall bei der CDU/CSU, der FDP und dem BÜNDNIS 90/DIE GRÜNEN sowie bei Abgeordneten der SPD",data/txt/17194.txt,poi,
2100181,194,17,0,,,,6,"Ich glaube, wir tun gut daran, deutlich zu machen, dass der ESM nur ein Teil der Krisenbewältigungsstrategie ist, die wir in Europa umzusetzen haben, und zwar nur der Teil, der im Bereich der europäischen Gesamtverantwortung liegt. Die Staatsschuldenkrise kann und wird nur dadurch zu bekämpfen sein, dass wir für nationale Verantwortung für mehr fiskalische Disziplin, für ausgeglichene Haushalte und für die Steigerung von Wettbewerbsfähigkeit in allen Mitgliedsländern Europas werben. In diesem Sinne wird die Bundesregierung weiterhin daran arbeiten, das gemeinsame Haus Europa stabiler für Deutschland und für Europa zu machen.

Herzlichen Dank.",data/txt/17194.txt,speech,
2100182,194,17,0,,,,7,Beifall bei der CDU/CSU und der FDP,data/txt/17194.txt,poi,
2100183,194,17,0,Petra Merkel [Berlin] [SPD],Petra Merkel [Berlin] [SPD],petra-merkel-berlin-spd,8,Den letzten Satz hätten Sie sich sparen können!,data/txt/17194.txt,poi,spd
2100184,194,17,0,,,,9,"Vizepräsident Dr. Hermann Otto Solms:

Für die SPD-Fraktion spricht jetzt der Kollege Carsten Schneider.",data/txt/17194.txt,speech,
2100185,194,17,0,,,,10,Beifall bei der SPD,data/txt/17194.txt,poi,
2100186,194,17,0,,,,11,"Carsten Schneider (Erfurt) (SPD):

Herr Präsident! Liebe Kolleginnen und Kollegen! Zunächst einmal: Die von der Bundesregierung heute beschlossene Protokollerklärung tragen wir mit und nehmen sie zur Kenntnis. Sie entspricht den Vorgaben, die das Verfassungsgericht gemacht hat. Die SPD-Fraktion hat während der Rativizierungsverfahren zum ESM-Vertrag insbesondere darauf Wert gelegt, dass die Gremien des ESM gegenüber dem Bundestag auskunftspflichtig sind. Unseren Anträgen ist die Koalition gefolgt. Es ist gut, dass wir dies jetzt hier noch einmal klarstellen.

Der entscheidende Punkt ist allerdings: Sie, sehr geehrter Herr Staatssekretär Kollege Kampeter, haben eben gesagt, die Haftungssumme Deutschlands sei damit klar begrenzt; der ESM sei nur ein Teil der Strategie zur Lösung der europäischen Krise. Ich sehe sie als Finanzkrise an;",data/txt/17194.txt,speech,
2100187,194,17,0,,,,12,Beifall bei der SPD sowie bei Abgeordneten der LINKEN und des BÜNDNISSES 90/DIE GRÜNEN,data/txt/17194.txt,poi,
2100188,194,17,0,,,,13,"Sie haben sie als Staatsschuldenkrise bezeichnet. Damit widersprechen Sie Ihrem Finanzminister; aber das Recht auf freie Meinung soll auch in der Bundesregierung gelten, selbst wenn Sie in diesem Fall falschliegen.

Interessant ist bei diesem entscheidenden Punkt nun, worüber Sie nicht gesprochen haben. Es geht um einen Sachverhalt, der auch noch im Hauptsacheverfahren eine Rolle spielen wird, nämlich die unbegrenzten Anleihekäufe der Europäischen Zentralbank. Wenn Sie hier den Eindruck erwecken, als wäre die Haftung Deutschlands auf die Summe begrenzt, die im ESM-Vertrag festgelegt ist, dann, sehr geehrter Kollege Kampeter, führen Sie die Öffentlichkeit an der Nase herum. Die Haftungssumme ist deutlich höher. Ich finde, dass der Deutsche Bundestag darüber reden muss, weil es wichtig ist, politische Akzeptanz dafür zu erreichen. Das Versteckspiel, auf der einen Seite hier im Bundestag möglichst geringe Haftungssummen zu beschließen, um die Öffentlichkeit nicht zu verunsichern und Ihre Koalition zusammenzuhalten, und auf der anderen Seite über die Bilanz der EZB die Verluste von Banken zu sozialisieren, ist nicht akzeptabel. Deswegen sage ich Ihnen ganz klar: Diese Entscheidungen gehören in den Deutschen Bundestag.",data/txt/17194.txt,speech,
2100189,194,17,0,Norbert Barthle [CDU/CSU],Norbert Barthle [CDU/CSU],norbert-barthle-cdu-csu,14,Das steht im Gesetz!,data/txt/17194.txt,poi,cducsu
2100190,194,17,0,,,,15,"Wenn es um die Haftungsrisiken geht, die zwischen den Steuerzahlern verteilt werden, muss der Deutsche Bundestag darüber entscheiden. Das ist in einer Demokratie grundsätzlich die Voraussetzung.",data/txt/17194.txt,speech,
2100191,194,17,0,Norbert Barthle [CDU/CSU],Norbert Barthle [CDU/CSU],norbert-barthle-cdu-csu,16,Das steht so im Gesetz!,data/txt/17194.txt,poi,cducsu
2100192,194,17,0,,,,17,"- Herr Kollege Barthle, vielleicht glauben Sie zwar nicht mir, aber dem Bundesbankpräsidenten, der Ihrer Regierung durchaus nahestand. In einem Interview in der Neuen Zürcher Zeitung von heute, in dem es um dieses Staatsanleihenaufkaufprogramm geht, das Sie hier mit keinem Wort erwähnt haben, sagte er:

Es gibt aus meiner Sicht einige Gründe, die gegen das Programm sprechen. Dazu zählen einerseits sicher stabilitätspolitische Prinzipien und die Frage, ob die Notenbank hierzu demokratisch legitimiert ist.

Das sehe ich in der Tat genauso. Dann führt er fort - das ist der entscheidende Punkt; passen Sie auf! -:

Das Programm verteilt Haftungsrisiken zwischen den Steuerzahlern der Euro-Zone um. Das dürfen nur die Parlamente, und diese haben mit den Rettungsschirmen ja auch die passenden Instrumente zur Hand.

Punkt.",data/txt/17194.txt,speech,
2100193,194,17,0,,,,18,Beifall bei der SPD,data/txt/17194.txt,poi,
2100194,194,17,0,,,,19,Herr Weidmann spricht Wahrheit; er ist der Chef der Deutschen Bundesbank. Ich frage mich nur: Was sagt die Koalition dazu?,data/txt/17194.txt,speech,
2100195,194,17,0,Bettina Hagedorn [SPD],Bettina Hagedorn [SPD],bettina-hagedorn-spd,20,Ja!,data/txt/17194.txt,poi,spd
2100196,194,17,0,,,,21,"Alles, was ich mitbekommen habe, Herr Staatssekretär, ist, dass der Chef Ihres Hauses, der Bundesfinanzminister Schäuble, Herrn Weidmann einen Maulkorb verpasst hat, dass er in einem Interview mit der Bild am Sonntag dem Bundesbankpräsidenten angeraten hat, doch lieber zu schweigen, als in Deutschland die Wahrheit zu sagen. Das ist mittlerweile die Politik der Bundesregierung.",data/txt/17194.txt,speech,
2100197,194,17,0,Jürgen Trittin [BÜNDNIS 90/DIE GRÜNEN],Jürgen Trittin [BÜNDNIS 90/DIE GRÜNEN],jurgen-trittin-bundnis-90-die-grunen,22,"Nein, das war ein guter Rat von Herrn Schäuble!",data/txt/17194.txt,poi,gruene
2100198,194,17,0,,,,23,"- Herr Trittin, wir haben da eine grundsätzlich andere Auffassung; das ist richtig.",data/txt/17194.txt,speech,
2100199,194,17,0,Otto Fricke [FDP],Otto Fricke [FDP],otto-fricke-fdp,24,Was hat das denn noch mit dem Thema zu tun?,data/txt/17194.txt,poi,fdp
2100200,194,17,0,,,,25,"- Das hat mit dem Thema Haftungssumme zu tun. Ich kann verstehen, lieber Kollege Fricke, dass Sie über das entscheidende Thema nicht sprechen wollen. Aber ich finde, dass der Deutsche Bundestag der richtige Ort ist, um über die Frage von Haftungsrisiken und über die Frage, wer hier was bezahlt, zu reden. Man muss darüber reden; das darf nicht totgeschwiegen werden.",data/txt/17194.txt,speech,
2100201,194,17,0,,,,26,Beifall bei der SPD,data/txt/17194.txt,poi,
2100202,194,17,0,,,,27,"Sie drücken sich darum. Ich finde das nicht akzeptabel.

Die entscheidende Frage ist: Wer kommt im Endeffekt für die Kosten auf? - Ja, wir sind für die Stabilisierung der Euro-Zone. Ja, wir sind als Sozialdemokraten bereit, dabei Verantwortung zu übernehmen. Ja, wir sind dazu bereit, auch zu sagen, was es kostet. Es darf aber nicht über die Bilanz der europäischen Notenbank laufen, die dazu gezwungen wird, weil Sie nicht bereit sind, zu handeln. Das ist sozial ungerecht; denn das führt dazu, dass diejenigen, die viel Geld haben, es letztendlich behalten, und die kleinen Leute alles bezahlen. Das ist nicht akzeptabel.",data/txt/17194.txt,speech,
2100203,194,17,0,,,,28,Beifall bei Abgeordneten der SPD sowie des Abg. Dr. Dietmar Bartsch [DIE LINKE],data/txt/17194.txt,poi,
2100204,194,17,0,,,,29,"Ich hätte mir gewünscht, dass der Bundestag in solch einer entscheidenden Frage eine klare Position hat. Eine Debatte darüber findet nicht statt. Deswegen nutze ich die heutige Gelegenheit, um es einmal deutlich zu sagen, entgegen den Äußerungen aus Ihrer Koalition zu diesem Punkt.",data/txt/17194.txt,speech,
2100205,194,17,0,,,,30,Zurufe von der FDP,data/txt/17194.txt,poi,
2100206,194,17,0,,,,31,"- Wir werden ja bei den einzelnen Hilfsanträgen von Staaten darüber sprechen.

Wissen Sie, ich finde es bemerkenswert, wenn der Präsident der Deutschen Bundesbank als die einzige Chance, die er noch hat, um Ihnen an dieser Stelle ein Warnzeichen zu geben - entgegen den Äußerungen, die Sie hier immer wieder machen -, die Neue Zürcher Zeitung nutzt. Ich zitiere als letztes noch eine Stelle, in der er auf den Aspekt der Haftungsrisiken eingeht, die Sie angeblich negieren. Ich zitiere:

Zum Beispiel verteilt die SNB

- das ist die Schweizerische Notenbank -

mit ihrer Massnahme keine Risiken zwischen Steuerzahlern verschiedener Länder um, das Euro-System hingegen schon.

Ich würde gerne wissen, ob Sie das so sehen oder nicht, sehr geehrter Herr Staatssekretär. Das ist eine relevante Frage, wenn es um die haushaltspolitische Gesamtverantwortung des Deutschen Bundestages geht. Darauf müssen Sie einmal eine Antwort geben. Sie können das doch nicht totschweigen, als gäbe es das nicht. Dabei macht doch die EZB, weil Sie sich nicht einigen können, das Geschäft, und der Bundestag hat nichts zu sagen. Das ist undemokratisch, nicht legitimiert und führt letztendlich dazu, dass Haftungsrisiken vergemeinschaftet werden und diejenigen, die die Krise verursacht haben, eben nicht an den Kosten beteiligt werden.",data/txt/17194.txt,speech,
2100207,194,17,0,Bartholomäus Kalb [CDU/CSU],Bartholomäus Kalb [CDU/CSU],bartholomaus-kalb-cdu-csu,32,Die Schweizerische Zentralbank ist aber auch nicht für die 17 Länder zuständig!,data/txt/17194.txt,poi,cducsu
2100208,194,17,0,,,,33,"Wir haben unsere Zustimmung im Bundestag zur Finanzierung dieser Lasten davon abhängig gemacht, dass eine Finanztransaktionsteuer eingeführt wird. Wir erwarten, dass dazu noch im Oktober ein klarer Fahrplan auf den Tisch kommt.",data/txt/17194.txt,speech,
2100209,194,17,0,,,,34,Beifall bei der SPD,data/txt/17194.txt,poi,
2100210,194,17,0,,,,35,"Es ist entscheidend, dass die Zusagen, die die Regierung gegeben hat, auch tatsächlich umgesetzt werden. Nicht die kleinen Leute sollten die Kosten der Krise bezahlen, sondern diejenigen, die sie verursacht haben.

Vielen Dank.",data/txt/17194.txt,speech,
2100211,194,17,0,,,,36,Beifall bei der SPD sowie bei Abgeordneten des BÜNDNISSES 90/DIE GRÜNEN,data/txt/17194.txt,poi,
2100212,194,17,0,,,,37,"Vizepräsident Dr. Hermann Otto Solms:

Für die FDP-Fraktion spricht jetzt der Kollege Otto Fricke.",data/txt/17194.txt,speech,
2100213,194,17,0,,,,38,Beifall bei der FDP und der CDU/CSU,data/txt/17194.txt,poi,
2100214,194,17,0,,,,39,"Otto Fricke (FDP):

Sehr geehrter Herr Präsident! Meine sehr geehrten Damen und Herren! Nach einer solchen Rede muss man immer aufpassen, dass man sein Gemüt unter Kontrolle hält. Das will ich deutlich sagen, Kollege Schneider.",data/txt/17194.txt,speech,
2100215,194,17,0,Dr. Diether Dehm [DIE LINKE],Dr. Diether Dehm [DIE LINKE],diether-dehm-die-linke,40,"Da sind Sie aber nichts Gutes gewohnt, Herr Fricke!",data/txt/17194.txt,poi,linke
2100216,194,17,0,,,,41,Weiterer Zuruf des Abg. Manuel Sarrazin [BÜNDNIS 90/DIE GRÜNEN],data/txt/17194.txt,poi,
2100217,194,17,0,,,,42,"- Dazu gehört auch, dass man einfach einmal zuhört, so wie wir das eben leider tun mussten.

Lieber Kollege Schneider, bei aller Kameradschaft, die wir im Haushaltsausschuss haben:",data/txt/17194.txt,speech,
2100218,194,17,0,Dr. Peter Danckert [SPD],Dr. Peter Danckert [SPD],peter-danckert-spd,43,Es gibt keine -Kameradschaft!,data/txt/17194.txt,poi,spd
2100219,194,17,0,,,,44,"Was Sie hier gemacht haben, war europarechtlich und verfassungsrechtlich gesehen nichts anderes als weitere Brandstifterei; nichts anderes haben Sie hier gemacht.",data/txt/17194.txt,speech,
2100220,194,17,0,,,,45,Beifall bei der FDP und der CDU/CSU,data/txt/17194.txt,poi,
2100221,194,17,0,,,,46,"Sie versuchen, Dinge nach vorne zu ziehen, die mit der Frage, über die wir hier eine Debatte zu führen vereinbart haben, nichts, aber auch gar nichts zu tun haben.",data/txt/17194.txt,speech,
2100222,194,17,0,Dr. Diether Dehm [DIE LINKE],Dr. Diether Dehm [DIE LINKE],diether-dehm-die-linke,47,Sie haben weniger als Ihr Gemüt unter Kontrolle!,data/txt/17194.txt,poi,linke
2100223,194,17,0,,,,48,"Die Punkte, die Sie angesprochen haben, sind sicherlich diskussionswürdig,",data/txt/17194.txt,speech,
2100224,194,17,0,Zurufe von der SPD,e von der SPD,e-spd,49,Aha!,data/txt/17194.txt,poi,spd
2100225,194,17,0,,,,50,"aber unsere Aufgabe hier - und das wäre auch Ihre Aufgabe gewesen - ist es, für Entscheidungen, die dieses Parlament getroffen hat, für Entscheidungen, die das Bundesverfassungsgericht getroffen hat, Vertrauen beim Bürger zu erzeugen. Sie versuchen allerdings, durch Misstrauen plumpe, primitive Politik zu machen. Das kann ich am heutigen Tag nur ausdrücklich ablehnen.",data/txt/17194.txt,speech,
2100226,194,17,0,,,,51,Beifall bei der FDP und der CDU/CSU,data/txt/17194.txt,poi,
2100227,194,17,0,,,,52,"Meine Damen und Herren, ich will versuchen, es ein wenig klarzustellen: Der Weg, der jetzt von der Bundesregierung gewählt worden ist und den das Parlament zur Kenntnis nehmen wird, ist ein Weg, der nach meiner Meinung elegant dafür gesorgt hat, dass Gesamteuropa sagt: Was der Bundestag beschlossen hat und was die Fraktionen vorbereitet haben, ist genau das, was wir wollen. Es gibt keinen anderen Interpretationsraum.

Ich muss ehrlich sagen - vor Gericht und auf hoher See ist man in Gottes Hand -: Vor der Entscheidung des Bundesverfassungsgerichtes habe ich angesichts der vorherigen Entscheidungen gedacht: Mal sehen, was an unserem Gesetz noch zu korrigieren ist.

Ich finde es erstens gut und wichtig, festzuhalten, dass das Bundesverfassungsgericht in einer einmaligen Entscheidung, auch im Verfahren mit einer Anhörung usw., dafür gesorgt hat, schlichtweg klarzumachen: Das Gesetz, das der Gesetzgeber gemacht hat, ist so in Ordnung. - Das sollten wir auch für den Bürger festhalten.

Wir sollten auch ein Zweites festhalten, Herr Kollege Schneider, nämlich dass es nicht, wie von vielen anderen behauptet - auch Sie haben eben versucht, das nebenbei so zu verkaufen -, irgendwie eine Obergrenze gibt, die lart pour lart, wie man will, aufgehoben werden kann, sondern dass dieses Gesetz eine feste Obergrenze vorsieht. Ich hätte von Ihnen erwartet, dass auch Sie sagen, dass das Gericht uns in dieser Auffassung bestätigt hat, und einmal feststellen, dass das eine gute Entscheidung war.

Sie hingegen machen etwas anderes. Dazu möchte ich nun etwas sagen. Sie sagen nämlich: Jetzt sehe ich, die Koalition hat bei der Gesetzgebung, bei der Parlamentsbeteiligung ordentliche Arbeit geleistet, mit allen Schwierigkeiten, die wir hatten, weil wir Neuland betreten haben.",data/txt/17194.txt,speech,
2100228,194,17,0,Manuel Sarrazin [BÜNDNIS 90/DIE GRÜNEN],Manuel Sarrazin [BÜNDNIS 90/DIE GRÜNEN],manuel-sarrazin-bundnis-90-die-grunen,53,Da haben wir Sie aber schon ziemlich stoßen müssen! Ohne uns hätten Sie es wieder verhunzt!,data/txt/17194.txt,poi,gruene
2100229,194,17,0,,,,54,"- Leute, ob ohne euch oder mit euch,",data/txt/17194.txt,speech,
2100230,194,17,0,Priska Hinz [Herborn] [BÜNDNIS 90/DIE GRÜNEN],Priska Hinz [Herborn] [BÜNDNIS 90/DIE GRÜNEN],priska-hinz-herborn-bundnis-90-die-grunen,55,Das ist der Unterschied!,data/txt/17194.txt,poi,gruene
2100231,194,17,0,,,,56,"ich sage ganz klar: Für mich als Europäer, der stabile Finanzen will und der die Risiken für den Euro begrenzen will, ist nachher nicht entscheidend, wer was wo wie gemacht hat, sondern für mich ist es entscheidend, dass wir am Ende Gesetze haben, auf die die Bürger vertrauen können. Wenn ihr daraus ein parteipolitisches Spiel machen wollt, dann macht es meinetwegen. Ihr werdet damit eurer Aufgabe und eurer Pflicht nicht gerecht.",data/txt/17194.txt,speech,
2100232,194,17,0,,,,57,Beifall bei der FDP sowie bei Abgeordneten der CDU/CSU,data/txt/17194.txt,poi,
2100233,194,17,0,,,,58,"Beim Umgang mit dem Urteil des Bundesverfassungsgerichts ist aber noch etwas Weiteres ganz wichtig - Kollege Schneider, auch das zu sagen haben Sie vermieden -: die klare Absage an jegliche Möglichkeit der Einführung von Euro-Bonds oder Altschuldentilgungsfonds. Die ausdrückliche Aussage des Bundesverfassungsgerichts lautet - ich will sie gerne zitieren, auch, weil das einige nicht so gerne hören -:

Es ist insoweit auch dem Bundestag als Gesetzgeber verwehrt, dauerhafte völkervertragsrechtliche Mechanismen zu etablieren, die auf eine Haftungsübernahme für Willensentscheidungen anderer Staaten hinauslaufen, vor allem wenn sie mit schwer kalkulierbaren Folgewirkungen verbunden sind.",data/txt/17194.txt,speech,
2100234,194,17,0,Jürgen Trittin [BÜNDNIS 90/DIE GRÜNEN],Jürgen Trittin [BÜNDNIS 90/DIE GRÜNEN],jurgen-trittin-bundnis-90-die-grunen,59,Das ist keine Absage für diese Instrumente!,data/txt/17194.txt,poi,gruene
