id,sitzung,wahlperiode,in_writing,speaker,speaker_cleaned,speaker_fp,sequence,text,filename,type,speaker_party
2680680,207,17,0,Präsident Dr. Norbert Lammert,Dr. Norbert Lammert,norbert-lammert,0,"Nehmen Sie bitte Platz.

Guten Morgen, liebe Kolleginnen und Kollegen! Ich eröffne unsere Plenarsitzung.

Ich möchte zu Beginn unserer Kollegin Heidemarie Wieczorek-Zeul zu ihrem besonders runden Geburtstag gratulieren, den sie heute hier im Deutschen Bundestag begeht.",data/txt/17207.txt,chair,
2680681,207,17,0,,,,1,Beifall,data/txt/17207.txt,poi,
2680682,207,17,0,Präsident Dr. Norbert Lammert,Dr. Norbert Lammert,norbert-lammert,2,"Herzliche Glückwünsche und alle guten Wünsche für die nächsten Jahre!

Liebe Kolleginnen und Kollegen, auf der Ehrentribüne haben der Präsident des Parlaments der Republik Kasachstan, Herr Nurlan Nigmatulin, und seine Delegation Platz genommen. Im Namen aller Kolleginnen und Kollegen des Deutschen Bundestages begrüße ich Sie herzlich.",data/txt/17207.txt,chair,
2680683,207,17,0,,,,3,Beifall,data/txt/17207.txt,poi,
2680684,207,17,0,Präsident Dr. Norbert Lammert,Dr. Norbert Lammert,norbert-lammert,4,"Für Ihren Aufenthalt in Berlin, in Deutschland und für die Gespräche mit vielen Mitgliedern des Hauses, insbesondere aber für die weitere parlamentarische Entwicklung Ihres Landes wünschen wir Ihnen alles Gute und viel Erfolg.

Wir setzen unsere Haushaltsberatungen - Tagesordnungspunkt I - fort:

a)	Zweite Beratung des von der Bundesregierung eingebrachten Entwurfs eines Gesetzes über die Feststellung des Bundeshaushaltsplans für das Haushaltsjahr 2013 (Haushaltsgesetz 2013)

- Drucksachen 17/10200, 17/10202 -

b)	Beratung der Beschlussempfehlung des Haushaltsausschusses (8. Ausschuss) zu der Unterrichtung durch die Bundesregierung

Finanzplan des Bundes 2012 bis 2016

- Drucksachen 17/10201, 17/10202, 17/10826 -

Berichterstattung:

Abgeordnete Norbert Barthle

Carsten Schneider (Erfurt)

Otto Fricke

Dr. Gesine Lötzsch

Priska Hinz (Herborn)

Ich rufe den Tagesordnungspunkt I.9 auf:

Einzelplan 04

Bundeskanzlerin und Bundeskanzleramt

- Drucksachen 17/10804, 17/10823 -

Berichterstattung:

Abgeordnete Norbert Barthle

Rüdiger Kruse

Petra Merkel (Berlin)

Dr. h. c. Jürgen Koppelin

Dr. Gesine Lötzsch

Priska Hinz (Herborn)

Dr. Tobias Lindner

Wir werden über den Einzelplan 04 nach Abschluss der Debatte namentlich abstimmen. Zu diesem Einzelplan liegt ein Änderungsantrag der Fraktion Die Linke vor. Außerdem haben die Fraktionen Die Linke und Bündnis 90/Die Grünen je einen Entschließungsantrag eingebracht, über die wir am Freitag nach der Schlussabstimmung abstimmen werden.

Nach einer interfraktionellen Vereinbarung sind für die Aussprache dreieinhalb Stunden vorgesehen. Darf ich dazu Ihr Einvernehmen feststellen? - Das ist offensichtlich der Fall. Dann ist das so beschlossen.

Ich eröffne die Aussprache und erteile das Wort zunächst dem Kollegen Peer Steinbrück für die SPD-Fraktion.",data/txt/17207.txt,chair,
2680685,207,17,0,,,,5,Beifall bei der SPD,data/txt/17207.txt,poi,
2680686,207,17,0,Präsident Dr. Norbert Lammert,Dr. Norbert Lammert,norbert-lammert,6,,data/txt/17207.txt,chair,
2680687,207,17,0,Peer Steinbrück (SPD),Peer Steinbrück,peer-steinbruck,7,"Sehr geehrter Herr Präsident! Liebe Kolleginnen und Kollegen! Ohne Zweifel: Deutschland steht im europäischen Vergleich zu vielen unserer Partner innerhalb der Europäischen Währungsunion und der Europäischen Union deutlich besser da. Das hat mehrere Gründe. Wir haben dafür Sorge getragen, dass wir eine industrielle Wertschöpfungskette erhalten, im Gegensatz zu vielen anderen Ländern. Wir haben es mit einem sehr tüchtigen Mittelstand zu tun. Viele große deutsche Unternehmen haben sich restrukturiert. Das dreisäulige Kreditwesen hat sich gerade in schwierigen Zeiten und mit Blick auf die Finanzierung des deutschen Mittelstandes bewährt. Das duale Ausbildungssystem, das berufliche Ausbildungssystem in Deutschland wird von vielen beneidet. Wir haben es mit einer exzellenten Facharbeiterschaft und mit einer starken und sehr bewährten Sozialpartnerschaft zu tun. Das ist die gute Nachricht für unser Land.",data/txt/17207.txt,speech,spd
2680688,207,17,0,,,,8,Beifall bei der SPD,data/txt/17207.txt,poi,
2680689,207,17,0,Peer Steinbrück (SPD),Peer Steinbrück,peer-steinbruck,9,Die schlechte Nachricht ist: Diese vergleichsweise gute Entwicklung hat mit der Arbeit dieser Bundesregierung in den letzten drei Jahren wenig zu tun.,data/txt/17207.txt,speech,spd
2680690,207,17,0,,,,10,Beifall bei der SPD,data/txt/17207.txt,poi,
2680691,207,17,0,,,,11,Lachen bei Abgeordneten der CDU/CSU und der FDP,data/txt/17207.txt,poi,
2680692,207,17,0,Volker Kauder [CDU/CSU],Volker Kauder,volker-kauder,12,Aber mit Ihnen auch nicht!,data/txt/17207.txt,poi,cducsu
2680693,207,17,0,Peer Steinbrück (SPD),Peer Steinbrück,peer-steinbruck,13,"Wir sind Alice im Wunderland, nicht wegen, sondern trotz dieser schwarz-gelben Bundesregierung.",data/txt/17207.txt,speech,spd
2680694,207,17,0,,,,14,Beifall bei der SPD und dem BÜNDNIS 90/DIE GRÜNEN,data/txt/17207.txt,poi,
2680695,207,17,0,Zuruf von der CDU/CSU,von der CDU/CSU,von-der-cdu-csu,15,Ha! Ha! Ha!,data/txt/17207.txt,poi,cducsu
2680696,207,17,0,Peer Steinbrück (SPD),Peer Steinbrück,peer-steinbruck,16,"Während eine von Gerhard Schröder geführte rot-grüne Bundesregierung mit mutigen, auch mit umstrittenen Reformen Deutschland modernisiert hat, während eine Große Koalition mit maßgeblichen Beiträgen der SPD für eine sehr kluge Antikrisenpolitik gesorgt hat, die Konjunktur und Beschäftigung in Deutschland stabilisiert hat, stellt sich die Frage, welche nennenswerten Initiativen die schwarz-gelbe Bundesregierung, die Koalition in den letzten drei Jahren für Wachstum und Beschäftigung in Deutschland ergriffen hat.",data/txt/17207.txt,speech,spd
2680697,207,17,0,,,,17,Beifall bei der SPD sowie bei Abgeordneten des BÜNDNISSES 90/DIE GRÜNEN,data/txt/17207.txt,poi,
2680698,207,17,0,Hermann Gröhe [CDU/CSU],Hermann Gröhe,hermann-grohe,18,Sie waren nie da!,data/txt/17207.txt,poi,cducsu
2680699,207,17,0,Peer Steinbrück (SPD),Peer Steinbrück,peer-steinbruck,19,"Ja - Herr Gröhe -, dann schauen Sie doch einmal mit mir in das bundestagsinterne Recherchesystem; ich stelle Ihnen das anheim. Ich habe das gemacht. Ich habe zum Beispiel nach Gesetzesinitiativen zur Förderung von Wachstum und Beschäftigung gesucht. Dabei bin ich darauf gestoßen, dass es eine große leere Kiste ist, die man da findet.",data/txt/17207.txt,speech,spd
2680700,207,17,0,,,,20,Heiterkeit bei der SPD,data/txt/17207.txt,poi,
2680701,207,17,0,Peer Steinbrück (SPD),Peer Steinbrück,peer-steinbruck,21,"Sucht man beispielsweise unter dem Stichwort Wirtschaft, bekommt man elf Treffer, und zwar von einem Gesetz zur Änderung der Gewerbeordnung über ein Gesetz zur Einführung eines Zulassungsverfahrens für Bewachungsunternehmen auf Seeschiffen",data/txt/17207.txt,speech,spd
2680702,207,17,0,Renate Künast [BÜNDNIS 90/DIE GRÜNEN],Renate Künast,renate-kunast,22,Oh ja! Das ist wichtig!,data/txt/17207.txt,poi,gruene
2680703,207,17,0,Peer Steinbrück (SPD),Peer Steinbrück,peer-steinbruck,23,bis zu einem Gesetz zur Änderung des Beherbergungsstatistikgesetzes.,data/txt/17207.txt,speech,spd
2680704,207,17,0,,,,24,Heiterkeit bei der SPD,data/txt/17207.txt,poi,
2680705,207,17,0,Peer Steinbrück (SPD),Peer Steinbrück,peer-steinbruck,25,"Dann habe ich mir die Mühe gemacht, mit einem anderen Stichwort zu suchen - ich habe gedacht, da werde ich garantiert fündig -, und zwar mit dem Stichwort Mittelstand. Was habe ich gefunden? Null Treffer in diesem bundestagsinternen Recherchesystem! Null, gar nichts, kein einschlägiges Vorhaben für den deutschen Mittelstand seit drei Jahren!",data/txt/17207.txt,speech,spd
2680706,207,17,0,,,,26,Beifall bei der SPD sowie bei Abgeordneten des BÜNDNISSES 90/DIE GRÜNEN,data/txt/17207.txt,poi,
2680707,207,17,0,Peer Steinbrück (SPD),Peer Steinbrück,peer-steinbruck,27,"Zum Schluss habe ich das Suchwort Wachstum -eingegeben. Tatsächlich habe ich zu meiner gelinden Überraschung einen Treffer gehabt, nämlich das berühmt-berüchtigte Wachstumsbeschleunigungsgesetz vom 4. Dezember 2009, mit dem Sie die Hoteliers versorgt haben, mit dem Sie die Erbschaft- und Schenkungsteuer gesenkt haben",data/txt/17207.txt,speech,spd
2680708,207,17,0,Stefan Müller [Erlangen] [CDU/CSU],Stefan Müller,stefan-muller,28,"Ja, ja! Und was ist mit der Entlastung der Familien? Die Hälfte vergessen Sie natürlich wieder! Das war klar!",data/txt/17207.txt,poi,cducsu
2680709,207,17,0,Peer Steinbrück (SPD),Peer Steinbrück,peer-steinbruck,29,"und mit dem Sie die Umstrukturierung von Unternehmen im Bereich der Grunderwerbsteuer geregelt haben. Donnerwetter, was Sie in drei Jahren unter diesen drei Stichworten alles auf den Weg gebracht haben!",data/txt/17207.txt,speech,spd
2680710,207,17,0,,,,30,Beifall bei der SPD und dem BÜNDNIS 90/DIE GRÜNEN,data/txt/17207.txt,poi,
2680711,207,17,0,Peer Steinbrück (SPD),Peer Steinbrück,peer-steinbruck,31,"All das steht in einem, wie ich finde, ganz merkwürdigen Gegensatz zu Ihrer dröhnenden Selbstbeweihräucherung. Und kommen Sie mir nicht mit der Absenkung des Beitragssatzes zur Arbeitslosenversicherung und zur Rentenversicherung! Bei der Arbeitslosenversicherung haben Sie den Spielraum preisgegeben, den Sie in schlechteren Zeiten für die Reaktivierung des Kurzarbeitergeldes brauchen.",data/txt/17207.txt,speech,spd
2680712,207,17,0,,,,32,Beifall bei der SPD sowie bei Abgeordneten des BÜNDNISSES 90/DIE GRÜNEN,data/txt/17207.txt,poi,
2680713,207,17,0,Peer Steinbrück (SPD),Peer Steinbrück,peer-steinbruck,33,"Bei der Rentenversicherung haben Sie - gleichermaßen zur Kritik von Arbeitnehmern und Arbeitgebern - sträflich versäumt, eine Demografiereserve anzulegen, die wir angesichts der Altersentwicklung unserer Gesellschaft dringend brauchen, um sehr sprunghafte Steigerungen zulasten von Arbeitgebern und Arbeitnehmern zu vermeiden.",data/txt/17207.txt,speech,spd
2680714,207,17,0,,,,34,Beifall bei der SPD,data/txt/17207.txt,poi,
2680715,207,17,0,Peer Steinbrück (SPD),Peer Steinbrück,peer-steinbruck,35,"Diese Bundesregierung hat dieses Land weder im Hier und Jetzt gestaltet, noch hat sie für die Zukunft vorgesorgt. Nichts macht das deutlicher als zum Beispiel der Vergleich zwischen dem Koalitionsausschuss der Großen Koalition am 5. Januar 2009, in dem unter maßgeblicher Handschrift der SPD Schritte zur Bewältigung der damaligen Herausforderungen unternommen wurden, und zwar mit einer Kurzarbeitergeldregelung, mit einem kommunalen Investitionsprogramm, mit einer Abwrackprämie für Automobile und mit einer zusätzlichen Förderung der öffentlichen Infrastruktur, und Ihrem Koalitionsausschuss vom 4. November dieses Jahres. Welch ein Unterschied mit Blick auf die Qualität und die Bedeutung der Themen, über die dort diskutiert worden ist!",data/txt/17207.txt,speech,spd
2680716,207,17,0,,,,36,Beifall bei der SPD sowie des Abg. Dr. Frithjof Schmidt [BÜNDNIS 90/DIE GRÜNEN],data/txt/17207.txt,poi,
2680717,207,17,0,Peer Steinbrück (SPD),Peer Steinbrück,peer-steinbruck,37,"In diesem Koalitionsausschuss haben Sie sich mit keiner einzigen Frage beschäftigt, die den Bürgerinnen und Bürgern im Augenblick unter den Nägeln brennt. Stattdessen Sendepause und Handlungsunfähigkeit: zur Spaltung des Arbeitsmarktes mit Niedrigstlöhnen, zur gleichen Bezahlung von Frauen und Männern, zur Energiewende mit drohenden Strompreiserhöhungen sowohl für private Haushalte als auch für Industrieunternehmen, zur Undurchlässigkeit und Unterfinanzierung unseres Bildungssystems, zur ungerechten steuerlichen Behandlung von -Alleinerziehenden, insbesondere Frauen, zu Geschiedenen, die gleichermaßen ihre Kinder betreuen, zu eingetragenen gleichgeschlechtlichen Lebenspartnerschaften oder zum nach wie vor skandalösen Ehegattensplitting. Nichts dazu!",data/txt/17207.txt,speech,spd
2680718,207,17,0,,,,38,Beifall bei der SPD sowie bei Abgeordneten des BÜNDNISSES 90/DIE GRÜNEN,data/txt/17207.txt,poi,
2680719,207,17,0,Peer Steinbrück (SPD),Peer Steinbrück,peer-steinbruck,39,"Keiner dieser Punkte - nicht ein einziger! - und vor allen Dingen kein konzises Krisenmanagement in Absprache mit Frankreich zur augenblicklichen Lage in Europa standen auf Ihrer Tagesordnung. Tatsächlich, Herr Kauder, haben wir von Ihnen eher gewisse Maßregelungen Frankreichs gehört, wo doch eine bessere Verabredung und Vorbereitung der jetzt anstehenden Sitzungen sehr viel besser gewesen wäre.",data/txt/17207.txt,speech,spd
2680720,207,17,0,,,,40,Beifall bei der SPD,data/txt/17207.txt,poi,
2680721,207,17,0,Peer Steinbrück (SPD),Peer Steinbrück,peer-steinbruck,41,"Herr Brüderle karikierte sich einmal mehr selbst mit dem Wort vom großen Sprung nach vorn als Ergebnis dieses Koalitionsausschusses. Autosuggestion, lieber Herr Brüderle, ist auch eine politische Kunstform; das gebe ich zu.",data/txt/17207.txt,speech,spd
2680722,207,17,0,,,,42,Heiterkeit und Beifall bei Abgeordneten der SPD,data/txt/17207.txt,poi,
2680723,207,17,0,Otto Fricke [FDP],Otto Fricke,otto-fricke,43,Wissen Sie das aus Erfahrung?,data/txt/17207.txt,poi,fdp
2680724,207,17,0,Peer Steinbrück (SPD),Peer Steinbrück,peer-steinbruck,44,"Diese Koalition kämpft nur mit und für sich selbst, aber sie kümmert sich nicht um die konkreten Probleme dieses Landes und seiner Bürgerinnen und Bürger. Wer alle Kraft braucht, um die Koalition zusammenzuhalten - statt unser Land -, der sollte in die Rehabilitation.",data/txt/17207.txt,speech,spd
2680725,207,17,0,,,,45,Beifall bei der SPD sowie bei Abgeordneten des BÜNDNISSES 90/DIE GRÜNEN,data/txt/17207.txt,poi,
2680726,207,17,0,Peer Steinbrück (SPD),Peer Steinbrück,peer-steinbruck,46,"Frau Bundeskanzlerin, wir haben im Schloss Bellevue bereits einen Präsidenten. Ich will damit sagen: Sie sind nicht eine über Ihrem Kabinett schwebende Präsidentin, die mit den Niederungen der innenpolitischen Herausforderungen nichts zu tun hat

,",data/txt/17207.txt,speech,spd
2680727,207,17,0,,,,47,Beifall bei der SPD und dem BÜNDNIS 90/DIE GRÜNEN sowie bei Abgeordneten der LINKEN,data/txt/17207.txt,poi,
2680728,207,17,0,Zurufe von der CDU/CSU,e von der CDU/CSU,e-cdu-csu,48,Oh!,data/txt/17207.txt,poi,cducsu
2680729,207,17,0,Peer Steinbrück (SPD),Peer Steinbrück,peer-steinbruck,49,"sondern Sie sind die Chefin einer Regierung, für deren Handwerk und Qualität in erster Linie Sie verantwortlich sind.",data/txt/17207.txt,speech,spd
2680730,207,17,0,,,,50,Beifall bei der SPD und dem BÜNDNIS 90/DIE GRÜNEN,data/txt/17207.txt,poi,
2680731,207,17,0,Peer Steinbrück (SPD),Peer Steinbrück,peer-steinbruck,51,"Deshalb ist auch Ihnen der Vorwurf zu machen, dass Sie die gute Zeit nicht genutzt haben und Vorsorge für angespannte Zeiten nicht getroffen haben.

Dabei hat Ihre Koalition schlichtweg mehr Glück als Verstand: Gegenüber der ersten schwarz-gelben Finanzplanung für den Zeitraum 2010/2013 haben sich die Steuereinnahmen deutlich günstiger entwickelt, haben sich die Zinsausgaben deutlich günstiger entwickelt, haben sich die Arbeitsmarktausgaben deutlich günstiger entwickelt. Das dürfte Sie in einer Größenordnung von 130 Milliarden Euro entlastet haben.

Darüber hinaus kann der Bundesfinanzminister in einer Art Eldorado deutsche Staatsanleihen zu einem Nahezu-Null-Zins platzieren, weil viele Deutschland als sicheren Hafen suchen, in dem sie ankern wollen - eine fantastische Situation für einen Bundesfinanzminister, die ich gerne gehabt hätte.",data/txt/17207.txt,speech,spd
2680732,207,17,0,Norbert Barthle [CDU/CSU],Norbert Barthle,norbert-barthle,52,Das setzt Vertrauen voraus!,data/txt/17207.txt,poi,cducsu
2680733,207,17,0,Peer Steinbrück (SPD),Peer Steinbrück,peer-steinbruck,53,"Der Versicherungskonzern Allianz rechnet Ihnen vor, dass sich im deutschen Staatshaushalt jährlich eine Zinsersparnis von über 10 Milliarden Euro ergibt, weil in der Krise in Europa alle diesen sicheren Hafen ansteuern und deshalb deutsche Staatsanleihen, sogar mit Verlust, kaufen. Das ist eine fantastische Lage.

Jenseits des jährlichen haushaltspolitischen Rituals - mit der Erfolgspropaganda auf der einen Seite des Hauses und den vielen Belegen, dass das alles nicht der Fall ist, auf der anderen Seite des Hauses - bleibt nüchtern festzustellen: Nie zuvor war die haushaltspolitische Ausgangslage für eine ehrgeizige Konsolidierung und eine zügige Rückführung der Neuverschuldung in Deutschland so günstig wie heute.",data/txt/17207.txt,speech,spd
2680734,207,17,0,,,,54,Beifall bei der SPD sowie bei Abgeordneten des BÜNDNISSES 90/DIE GRÜNEN,data/txt/17207.txt,poi,
2680735,207,17,0,Peer Steinbrück (SPD),Peer Steinbrück,peer-steinbruck,55,"Das haben Sie nicht genutzt. Sie haben - das entspricht Ihrer Mentalität - Einzelinteressen bedient, wofür die Beschlüsse des Koalitionsausschusses vom 4. November beispielhaft stehen.

Lenken Sie mir nicht ab - ich denke an die gestrigen Beiträge, verehrter Herr Schäuble -, indem Sie ankündigen, dass Sie das strukturelle Defizit einige Jahre vor 2016 erreichen wollen. Sie könnten bereits in der Finanzplanung für 2014 die Neuverschuldung insgesamt auf null senken - wenn Sie denn wollten.",data/txt/17207.txt,speech,spd
2680736,207,17,0,,,,56,Beifall bei der SPD sowie bei Abgeordneten des BÜNDNISSES 90/DIE GRÜNEN,data/txt/17207.txt,poi,
2680737,207,17,0,Peer Steinbrück (SPD),Peer Steinbrück,peer-steinbruck,57,"2013 wird nach vielen Prognosen ein wirtschaftlich schlechtes, einige sagen sogar: ein für weite Teile der Währungsunion und der Europäischen Union hochpro-blematisches Jahr. Das wird auf Deutschland abfärben. Obwohl die Wolken am Horizont immer dunkler werden und die Konjunktur sich erkennbar eintrübt, sorgen Sie mit diesem Haushalt nicht vor.

Die Selbstbedienung beim Gesundheitsfonds und bei der KfW ist nicht nur haushaltspolitisch unseriös, sie ist in der Sache hanebüchen.",data/txt/17207.txt,speech,spd
2680738,207,17,0,,,,58,Beifall bei der SPD sowie bei Abgeordneten des BÜNDNISSES 90/DIE GRÜNEN,data/txt/17207.txt,poi,
2680739,207,17,0,Peer Steinbrück (SPD),Peer Steinbrück,peer-steinbruck,59,"Für 2013 sollen zu den ohnehin vorgesehenen Kürzungen des Bundeszuschusses von 2 Milliarden Euro 0,5 Milliarden Euro hinzukommen, für 2014 weitere 2 Milliarden Euro. Statt hier angesichts eines demografischen Wandels, der sich mit mathematischer Sicherheit voraussagen lässt, Vorsorge zu betreiben, machen Sie rechte Tasche, linke Tasche. Der Gesundheitsfonds wird zum Sonderkonto für Wahlgeschenke, die Sie am 4. November zu verteilen beschlossen haben.",data/txt/17207.txt,speech,spd
2680740,207,17,0,,,,60,Beifall bei der SPD,data/txt/17207.txt,poi,
2680741,207,17,0,Peer Steinbrück (SPD),Peer Steinbrück,peer-steinbruck,61,Es wird noch schlimmer: Als eine Neuauflage der Panzerknackerbande,data/txt/17207.txt,speech,spd
2680742,207,17,0,,,,62,Heiterkeit bei der SPD,data/txt/17207.txt,poi,
2680743,207,17,0,Peer Steinbrück (SPD),Peer Steinbrück,peer-steinbruck,63,"begeht diese Koalition einen Bankraub von 1 Milliarde Euro bei der Kreditanstalt für Wiederaufbau. Die Staatsbank muss herhalten, um Haushaltslöcher zu stopfen, Haushaltslöcher, die bei der aktuellen Einnahmesituation eigentlich gar nicht entstehen dürften. Die KfW, meine Damen und Herren von der Koalition, ist eine Förderbank,",data/txt/17207.txt,speech,spd
2680744,207,17,0,Jürgen Trittin [BÜNDNIS 90/DIE GRÜNEN],Jürgen Trittin,jurgen-trittin,64,Wen fördern die denn?,data/txt/17207.txt,poi,gruene
2680745,207,17,0,Peer Steinbrück (SPD),Peer Steinbrück,peer-steinbruck,65,"die aus ihren Reserven Investitionsprogramme gestalten soll. Sie gestaltet Zukunft und Fortschritt in diesem Land mit Programmen, die wir angesichts der sich abschwächenden Konjunktur vielleicht dringender denn je benötigen.",data/txt/17207.txt,speech,spd
2680746,207,17,0,,,,66,Beifall bei der SPD sowie bei Abgeordneten des BÜNDNISSES 90/DIE GRÜNEN,data/txt/17207.txt,poi,
2680747,207,17,0,Peer Steinbrück (SPD),Peer Steinbrück,peer-steinbruck,67,"Und Sie plündern diese Bank! Dass sich Schwarz-Gelb nun sogar bei Investitionsmitteln bedient, um Leistungen wie das Betreuungsgeld gegenzufinanzieren, das belegt einmal mehr: Das ist Politik von gestern und wird auf Kosten der Zukunft bezahlt.",data/txt/17207.txt,speech,spd
2680748,207,17,0,,,,68,Beifall bei der SPD sowie bei Abgeordneten des BÜNDNISSES 90/DIE GRÜNEN,data/txt/17207.txt,poi,
2680749,207,17,0,Peer Steinbrück (SPD),Peer Steinbrück,peer-steinbruck,69,"Diese Bundesregierung tut nichts, um den erkennbaren Fliehkräften in unserer Gesellschaft Einhalt zu gebieten. Es sind keine kraftvollen Initiativen erkennbar, um Deutschland wirtschaftlich in der Champions League zu halten.

Was ist mit dem gemeinsamen Fehler, den wir mit dem Kooperationsverbot im Grundgesetz gemacht haben, und der Notwendigkeit, das Bildungssystem in Deutschland zu reformieren? Welche Antworten hat die Bundesregierung auf die steigenden Energiepreise, auf die steigenden Belastungen von privaten Haushalten und Industriebetrieben? Welche Antworten haben Sie zur dramatischen Finanzlage der Kommunen, zur Unter-finanzierung von Bildung, zu den steigenden Mieten und wenig bezahlbarem Wohnraum und zur dramatischen Spaltung des Arbeitsmarktes? Welche Antworten liefern Sie der deutschen Öffentlichkeit?",data/txt/17207.txt,speech,spd
2680750,207,17,0,Zurufe von der SPD,e von der SPD,e-spd,70,Keine!,data/txt/17207.txt,poi,spd
2680751,207,17,0,Peer Steinbrück (SPD),Peer Steinbrück,peer-steinbruck,71,"Keine.

Sie ignorieren sträflich die Drift in der Einkommens- und Vermögensverteilung. Die Schere zwischen Arm und Reich in Deutschland nimmt deutlich zu. Ich empfehle Ihnen, dazu das sehr lesenswerte Buch Der Preis der Ungleichheit des US-Ökonomen und Nobelpreisträgers Joseph Stiglitz zu lesen. Der Preis der Ungleichheit bestehe darin, so schreibt er, dass eine Nation nicht mehr in der Lage sei, das Bestmögliche aus den Fähigkeiten ihrer Bürgerinnen und Bürger zu machen. Weiter heißt es, die vermögenden, teilweise durchaus nur noch ihr persönliches Interesse wahrnehmenden Eliten würden Infrastruktur, Bildung und Innovation kaputtsparen. Genau dieses Risiko lastet auch auf der Bundesrepublik Deutschland.",data/txt/17207.txt,speech,spd
2680752,207,17,0,,,,72,Beifall bei der SPD,data/txt/17207.txt,poi,
2680753,207,17,0,Peer Steinbrück (SPD),Peer Steinbrück,peer-steinbruck,73,"Ich stelle Ihnen diese Lektüre anheim.

Sie ignorieren ebenso die Unterschiede in der Bezahlung von Frauen und Männern. Frauen verdienen in -diesem Land durchschnittlich 23 Prozent weniger als Männer. Wo ist Ihre Initiative für ein Entgeltgleichheitsgesetz, das mit dieser Ungerechtigkeit aufräumt?",data/txt/17207.txt,speech,spd
2680754,207,17,0,,,,74,Beifall bei der SPD und dem BÜNDNIS 90/DIE GRÜNEN,data/txt/17207.txt,poi,
2680755,207,17,0,Peer Steinbrück (SPD),Peer Steinbrück,peer-steinbruck,75,"Frauen stoßen bei der Gestaltung ihrer Karriere nach wie vor an gläserne Decken. Was tun Sie dagegen? Sie streiten über eine sogenannte Flexi-Quote.

Sie gaukeln mit Ihrem Gesetzentwurf zur kalten Progression den Bürgern einen Befreiungsschlag vor, der zwar für den Einzelnen vernachlässigbare Verteilungs-effekte hat, wohl aber ernste Belastungen für alle Gebietskörperschaften in der Bundesrepublik Deutschland hervorruft. Niedrigstverdiener haben von der Abschaffung der kalten Progression allenfalls eine Entlastung von knapp 2 Euro, mehr nicht. Ich sage Ihnen an dieser Stelle: Ja, selbstverständlich wird die SPD, auch auf Länderebene, die Erhöhung des steuerfreien Minimums mittragen. Wenn Sie einen Vorschlag machen würden, der den inflationsbedingten Staubsaugereffekt vornehmlich bei unteren und mittleren Einkommen beseitigen würde, und dies mit dem Vorschlag einer Gegenfinanzierung über einen erhöhten Spitzensteuersatz verbinden würden, dann würden wir in der SPD gemeinsam aufhorchen.",data/txt/17207.txt,speech,spd
2680756,207,17,0,,,,76,Beifall bei der SPD sowie bei Abgeordneten des BÜNDNISSES 90/DIE GRÜNEN,data/txt/17207.txt,poi,
2680757,207,17,0,Peer Steinbrück (SPD),Peer Steinbrück,peer-steinbruck,77,"Die ungeahnten Folgen des chaotischen Ausstiegs aus dem Ausstieg des Ausstiegs aus der Kernenergie muss ich Ihnen nicht länger vorhalten. Diese sind nämlich so offensichtlich, dass Sie es inzwischen mit einer entsprechenden Kritik nicht nur von der SPD, den Grünen und den Gewerkschaften, sondern auch von vielen Unternehmern und Wirtschaftsverbänden zu tun haben. Dieser Ausstieg aus dem Ausstieg des Ausstiegs aus der Kernenergie ist jenes Projekt, das Sie mit großem Aplomb als Energiewende bezeichnen.

Besser als eine Ethikkommission, Frau Bundeskanzlerin, wäre damals eine Expertenkommission gewesen, die sich mit den Erzeugungskapazitäten, mit Kosten- und Preisgerüsten, mit den technischen Voraussetzungen für ein immer dezentraleres Energieversorgungssystem und mit den infrastrukturellen Notwendigkeiten beschäftigt und Ihnen die Vorlage für einen Masterplan geliefert hätte.",data/txt/17207.txt,speech,spd
2680758,207,17,0,Thomas Oppermann [SPD],Thomas Oppermann,thomas-oppermann,78,So ist es!,data/txt/17207.txt,poi,spd
2680759,207,17,0,Peer Steinbrück (SPD),Peer Steinbrück,peer-steinbruck,79,"Von einem solchen Masterplan kann bei Ihnen keine Rede sein, sondern Sie lassen das alles im Streit der Zuständigkeiten Ihrer Ressorts laufen und stimmen es mit den Ländern zu spät ab. Jede Frittenbude in Deutschland wird besser gemanagt als die Energiewende in diesem Land.",data/txt/17207.txt,speech,spd
