id,sitzung,wahlperiode,in_writing,speaker,speaker_cleaned,speaker_fp,sequence,text,filename,type,speaker_party
2681880,207,17,0,Bernhard Brinkmann (Hildesheim) (SPD),Bernhard Brinkmann,bernhard-brinkmann,1200,"Ihre pauschale Aussage, lieber Herr Fricke, und die Ihres Fraktionsvorsitzenden, Herrn Brüderle, wir würden immer nur mehr Geld ausgeben wollen, stimmt also zumindest für diesen Bereich nicht. Diesen Vorwurf weise ich hier in aller Deutlichkeit zurück.",data/txt/17207.txt,speech,spd
2681881,207,17,0,,,,1201,Beifall bei der SPD,data/txt/17207.txt,poi,
2681882,207,17,0,Bernhard Brinkmann (Hildesheim) (SPD),Bernhard Brinkmann,bernhard-brinkmann,1202,"Wenn man sich die Struktur des Zivilpersonals noch einmal intensiv anschaut - dabei ist noch nicht alles umgesetzt, was mit der Reform von Verteidigungsminister Struck beschlossen worden ist -, dann wird man feststellen: Die bestehenden Anforderungen sind mit den 55 000 Mitarbeitern, wie von der Koalition vorgesehen, nicht zu leisten. Wir als SPD-Fraktion haben daher beantragt, die Zahl der Zivilbeschäftigten von 75 000 nicht auf 55 000 zu reduzieren, sondern nur auf 62 500. Dieser Antrag ist ebenfalls von der Koalition abgelehnt worden. Dass wir damit aber nicht ganz falsch liegen, kann man schon daran erkennen, dass Sie in der Bereinigungssitzung einen Antrag eingebracht haben, der die Versetzung des Personals in andere Ministerien regelt. Wo dabei etwas eingespart wird, ist mir bis heute schleierhaft geblieben.

Lassen Sie mich zum Schluss meinen Dank an die Soldatinnen und Soldaten im Auslandseinsatz, aber auch hier im Land richten. Sie verrichten einen gefährlichen Dienst. Jede Soldatin und jeder Soldat setzt sich an ihrem bzw. seinem Ort für unser Land ein. Die Soldatinnen und Soldaten inklusive der zivilen Mitarbeiterinnen und Mitarbeiter und auch die Reservisten haben die Anerkennung des Parlaments verdient.",data/txt/17207.txt,speech,spd
2681883,207,17,0,,,,1203,"Beifall bei der SPD, der CDU/CSU, der FDP und dem BÜNDNIS 90/DIE GRÜNEN",data/txt/17207.txt,poi,
2681884,207,17,0,Bernhard Brinkmann (Hildesheim) (SPD),Bernhard Brinkmann,bernhard-brinkmann,1204,Vielen Dank für Ihre Aufmerksamkeit.,data/txt/17207.txt,speech,spd
2681885,207,17,0,,,,1205,Beifall bei der SPD,data/txt/17207.txt,poi,
2681886,207,17,0,Bernhard Brinkmann (Hildesheim) (SPD),Bernhard Brinkmann,bernhard-brinkmann,1206,,data/txt/17207.txt,speech,spd
2681887,207,17,0,Vizepräsidentin Petra Pau,Petra Pau,petra-pau,1207,Das Wort hat der Kollege Klaus-Peter Willsch für die Unionsfraktion.,data/txt/17207.txt,chair,
2681888,207,17,0,Klaus-Peter Willsch (CDU/CSU),Klaus-Peter Willsch,klaus-peter-willsch,1208,"Frau Präsidentin! Meine sehr verehrten Damen und Herren! Liebe Kollegen! Lassen Sie mich mit einem Dank beginnen. Unsere sehr intensive Diskussion des Einzelplans ist durch Ihr Haus begleitet worden. Herr Minister de Maizière, ich möchte Ihnen und Ihrem Ministerium für die harmonischen und effizienten Beratungen ganz herzlich danken. Unseren Bitten um Auskunft wurde, so wie wir uns das vorgestellt haben, prompt und umfangreich nachgekommen. Die Zusammenarbeit ist exzellent.

Ich will an die erste Lesung anknüpfen. Damals hatte ich mich bei den Berichterstattern insgesamt für die gute Zusammenarbeit bedankt. Der Kollege Jürgen Koppelin rief dazwischen, dass das natürlich an der Qualität des Hauptberichterstatters liegt. Jürgen, das will ich sehr gerne konzedieren. Ganz herzlichen Dank für die Zusammenarbeit! Ich will das aber auch zum Anlass nehmen, Bernhard Brinkmann für die Zusammenarbeit zu danken. Beide, Bernhard Brinkmann und Jürgen Koppelin, haben aus eigenem Entschluss klargestellt, dass sie nicht mehr für den nächsten Bundestag kandidieren und deshalb natürlich auch keine Berichterstattung für den Einzelplan 14 mehr wahrnehmen werden. Ganz herzlichen Dank für die Zusammenarbeit! Jürgen Koppelin hat das seit 1994 gemacht. Er ist im Jahr der Wiedervereinigung in den Bundestag gekommen und war in der Folge für sechs Verteidigungsminister Berichterstatter bzw. Hauptberichterstatter für den Verteidigungsetat. Das ist eine beachtliche Leistung. Vielen Dank für diese Zusammenarbeit, ich denke, im Namen aller.",data/txt/17207.txt,speech,cducsu
2681889,207,17,0,,,,1209,Beifall bei der CDU/CSU und der FDP sowie bei Abgeordneten der SPD und des BÜNDNISSES 90/DIE GRÜNEN,data/txt/17207.txt,poi,
2681890,207,17,0,Klaus-Peter Willsch (CDU/CSU),Klaus-Peter Willsch,klaus-peter-willsch,1210,"Es ist angesprochen worden: Wir befinden uns im größten Wandlungsprozess, im größten Prozess der Umstrukturierung der Bundeswehr. Dabei sind innerhalb der Truppe täglich erhebliche Veränderungen im Hause zu spüren und zu verkraften. Dass so etwas Unsicherheit mit sich bringt, Kollege Brinkmann, und sich zunächst auch in Umfragen niederschlägt, halte ich für nachvollziehbar und natürlich. Ich habe aber den Eindruck, dass das Wichtigste, was seitens der Führung des Hauses zu tun war, die klare Definition der Terminvorgaben war, wann was geschieht, wann welche Entscheidung getroffen wird, wer wann wie endgültig eingeplant wird und welche Standorte in welchem Umfang erhalten bleiben. Dadurch, dass das Punkt für Punkt abgearbeitet wird, besteht für die Soldaten Klarheit, wie der Prozess abläuft. Das ist der wichtigste Punkt bei diesem Umbau, und den setzt das Haus nach unserer Auffassung hervorragend um.",data/txt/17207.txt,speech,cducsu
2681891,207,17,0,,,,1211,Beifall des Abg. Ernst-Reinhard Beck [Reutlingen] [CDU/CSU],data/txt/17207.txt,poi,
2681892,207,17,0,Klaus-Peter Willsch (CDU/CSU),Klaus-Peter Willsch,klaus-peter-willsch,1212,"Die Diskussion über die Einsparvorgabe von 8,3 Milliarden Euro im Bereich des Einzelplans 14 können wir gerne führen. Denn so, wie Sie es dargestellt haben, lieber Kollege Brinkmann, nämlich dass alles absehbar war, trifft nicht zu. Wir haben die Einsparvorgabe im Rahmen der Regierungsklausur bekommen - ein Jahr später wurde eine Verlängerung bis 2015 gewährt -, und sie ist im Rahmen der Finanzplanung eindeutig dargestellt. Natürlich ist eine Bereinigung nötig, um Effekte, die separat zu betrachten sind, zu berücksichtigen. Die Tarifsteigerung wie auch die Wiedergewährung des Weihnachtsgeldes",data/txt/17207.txt,speech,cducsu
2681893,207,17,0,Bernhard Brinkmann [Hildesheim] [SPD],Bernhard Brinkmann,bernhard-brinkmann,1213,Das kommt doch jedes Jahr wieder!,data/txt/17207.txt,poi,spd
2681894,207,17,0,Klaus-Peter Willsch (CDU/CSU),Klaus-Peter Willsch,klaus-peter-willsch,1214,"ist vom Finanzminister im gesamten Bundeshaushalt einbezogen worden. Insofern muss man die Finanzplanung um einen solchen Posten bereinigen, um den Saldo ermitteln zu können.",data/txt/17207.txt,speech,cducsu
2681895,207,17,0,Bernhard Brinkmann [Hildesheim] [SPD],Bernhard Brinkmann,bernhard-brinkmann,1215,"Weihnachten ist jedes Jahr, nicht nur alle fünf Jahre!",data/txt/17207.txt,poi,spd
2681896,207,17,0,Klaus-Peter Willsch (CDU/CSU),Klaus-Peter Willsch,klaus-peter-willsch,1216,"Das Gleiche gilt für das Thema BImA. Das sollte man vielleicht für die Öffentlichkeit und die Kameraden auf der Tribüne ansprechen, damit das auch verstanden wird: Dadurch, dass wir die Liegenschaften alle miteinander der Bundesanstalt für Immobilienaufgaben unterstellen, haben wir eine Bilanzverlängerung erfahren. Wir hatten mehr Ausgaben für diesen Bereich und müssen Miete zahlen. Das ist aber sozusagen ergebnisneutral und muss saldiert werden, wenn man den wirklichen Effekt errechnen möchte. Ich glaube, dass wir uns auch hier mit dem, was wir auf den Weg gebracht haben, sehen lassen können.

Ich will noch eine kurze Bemerkung zu dem Antrag der Linken machen. Sie fordern im Wesentlichen: Wir schaffen alles ab, was wir an Waffen haben, und stellen die Rüstungsindustrie dann um. - Sie wollen also Konversion. Das kann man zwar so sehen; aber wir sehen das anders. Wir glauben, dass es die erste und vornehmste Pflicht eines Staates ist, die Freiheit und Sicherheit eines Landes nach außen zu sichern. Dafür brauchen wir eine Armee, und sie muss einsatzfähig sein. Wir sehen gerade heute an dem Antrag der Türkei, dass wir keinesfalls in einer sich auf einen ewigen Frieden hin entwickelnden Welt leben, sondern dass es notwendig ist und bleibt, die Freiheit und Sicherheit des Staatsterrito-riums sicherstellen und Bündnisverpflichtungen erfüllen zu können. Deshalb braucht man gar nicht weiter auf den Antrag der Linken einzugehen.",data/txt/17207.txt,speech,cducsu
2681897,207,17,0,Christine Buchholz [DIE LINKE],Christine Buchholz,christine-buchholz,1217,Das ist auch gut so!,data/txt/17207.txt,poi,linke
2681898,207,17,0,Klaus-Peter Willsch (CDU/CSU),Klaus-Peter Willsch,klaus-peter-willsch,1218,"- Sie haben ein völlig anderes Weltbild. Bleiben Sie ruhig dabei. Wir müssen uns nicht weiter darüber auseinandersetzen.

Angesichts der Diskussion, die wir heute schon beim Einzelplan des Auswärtigen Amtes geführt haben, nämlich wie wir mit dem Begehren der Türkei, sie bei der Sicherung der Grenze zu Syrien zu unterstützen, umgehen, muss die SPD, so glaube ich, noch einmal darüber nachdenken, was sie in ihrem Strategiepapier niedergelegt hat. Darin geht es im Wesentlichen um die Weiterentwicklung hin zu einer europäischen Armee, die Waffen gemeinsam entwickelt und beschafft. Da muss jedoch noch ein Satz hinzukommen: Es geht auch um eine Armee, die unter gemeinsam festzulegenden Bedingungen eingesetzt werden kann. Hinter die Frage, ob wir es auf europäischer Ebene hinbekommen, ein so weitreichendes Mandat durch das Parlament, wie es in Deutschland der Fall ist, festzulegen, mache ich etliche Fragezeichen. Das ist ein noch offener Punkt in Ihrem Antrag.

Ich will noch einige Kleinigkeiten ansprechen, die wir in Einzelanträgen aufgegriffen und als Koalition im Rahmen der Haushaltsberatungen umgesetzt haben. Angesichts der Tatsache, dass die Einsparvorgabe, wie ich dargelegt habe, eingehalten wurde, war für zusätzliche Einsparungen nicht mehr viel Luft. Wir haben uns darauf konzentriert, einige Akzente zu setzen. Wir legen Wert darauf, dass der leichte Unterstützungshubschrauber für die Spezialkräfte jetzt angeschafft wird. Wir haben entsprechende Signale vom Haus bekommen. Wir haben das Kapital für die Härtefallstiftung für die Opfer von Kriegseinsätzen und anderen militärischen Einsätzen um 3 Millionen Euro erhöht. Dabei ist anzumerken, dass alle Stiftungen momentan ein Problem mit der derzeitigen Zinslage haben.

Wir haben festgestellt, dass wir beim Thema Infanterist der Zukunft stolz darauf sein können, dass unsere Industrie dieses System entwickelt hat, das sich im Einsatz bewährt. Unsere Partnerarmeen sind geradezu neidisch auf die Ausstattung unserer Soldaten. Es ist ganz wichtig, dass die weitere Einführung nach Plan verläuft. Wir müssen unseren Soldaten die Gewissheit geben, dass wir sie bestens vorbereitet und ausgerüstet in einen Einsatz schicken, damit sie ihren Auftrag erfüllen können und im Feld überleben.

Die Ereignisse in Mali bereiten uns große Sorgen. Ich kann aber meine Ausführungen abkürzen, weil darüber schon im Rahmen der Debatte über den Einzelplan des Auswärtigen Amtes diskutiert wurde. Wir können es nicht zulassen, auch nicht in Mali, dass sich der Terror erneut einer staatlichen Struktur bemächtigt und sich in einem Staat festsetzt. Deshalb halten wir es für richtig, dass Mali geholfen wird.

Ich will abschließend noch kurz das Thema Rüstungsexport streifen, weil dieses Thema auch von der Bundeskanzlerin kürzlich bei der Bundeswehrtagung in Strausberg angesprochen worden ist. Bei allen Diskussionen, die wir darüber führen, sollten alle, die es ernst mit der Landesverteidigung meinen - die Linken lassen wir -einmal außen vor -, noch einmal nachdenken. Wenn wir nicht auf der ganzen Welt intervenieren wollen, dann müssen wir befreundete Länder und Partner ertüchtigen, damit sie die militärische Sicherung selbst durchführen können. Dazu gehört natürlich, dass wir ihnen als Lieferant zur Verfügung stehen und ihnen mit der Lieferung von Waffen und Systemen zur Seite stehen. Ein weiterer Effekt ist, dass es uns nur so möglich sein wird, dass wir im eigenen Lande eine wehrtechnische Industrie erhalten, die sich weiter an der Spitze der technologischen Entwicklung befindet. Unser eigener Markt ist viel zu klein. Deshalb halte ich prinzipielle Diskussionen -darüber für nicht angezeigt. Über Details kann man sich immer unterhalten; aber wir sollten versuchen, den relativ breiten Konsens, den wir insgesamt in Fragen der Verteidigungspolitik im ganzen Hause haben, auch auf dieses Technologiefeld auszudehnen.

Ich bedanke mich für die Aufmerksamkeit und wünsche der Debatte weiterhin einen guten Verlauf.",data/txt/17207.txt,speech,cducsu
2681899,207,17,0,,,,1219,Beifall bei der CDU/CSU und der FDP,data/txt/17207.txt,poi,
2681900,207,17,0,Klaus-Peter Willsch (CDU/CSU),Klaus-Peter Willsch,klaus-peter-willsch,1220,,data/txt/17207.txt,speech,cducsu
2681901,207,17,0,Vizepräsidentin Petra Pau,Petra Pau,petra-pau,1221,Das Wort hat die Kollegin Inge Höger für die Fraktion Die Linke.,data/txt/17207.txt,chair,
2681902,207,17,0,,,,1222,Beifall bei der LINKEN,data/txt/17207.txt,poi,
2681903,207,17,0,Vizepräsidentin Petra Pau,Petra Pau,petra-pau,1223,,data/txt/17207.txt,chair,
2681904,207,17,0,Inge Höger (DIE LINKE),Inge Höger,inge-hoger,1224,"Frau Präsidentin! Meine Damen und Herren!

Krieg ist kein Gesellschaftsspiel,  Nur die bedingungslose Abkehr vom Krieg überhaupt kann da helfen.",data/txt/17207.txt,speech,linke
2681905,207,17,0,,,,1225,Beifall bei der LINKEN,data/txt/17207.txt,poi,
2681906,207,17,0,Inge Höger (DIE LINKE),Inge Höger,inge-hoger,1226,"Das sagte niemand anderes als Albert Einstein nach dem Zweiten Weltkrieg. Dies sollte uns auch heute noch Verpflichtung sein. Leider erleben wir in Deutschland in den letzten 20 Jahren das genaue Gegenteil, nämlich eine Militarisierung der Außenpolitik. Die jüngste Bundeswehrreform hat das Ganze noch befeuert. Inzwischen werden Auslandseinsätze endgültig zum wesentlichen Aufgabenfeld der Bundeswehr erklärt. Das ist aus Sicht der Linken ein ganz gefährlicher Irrweg.",data/txt/17207.txt,speech,linke
2681907,207,17,0,,,,1227,Beifall bei der LINKEN,data/txt/17207.txt,poi,
2681908,207,17,0,Inge Höger (DIE LINKE),Inge Höger,inge-hoger,1228,"Im Rahmen von Haushaltskürzungen wurde bereits 2010 erklärt - Herr Willsch erwähnte es eben -, dass auch die Bundeswehr sparen solle, nämlich 8,3 Milliarden Euro. Die Umsetzung wurde bis heute Jahr für Jahr verschoben, immer auf das nächste Jahr. Auch in diesem Haushalt finden wir nichts, was auch nur annähernd mit Sparen zu tun hat. Stattdessen wurde der Militäretat -erneut um 1,6 Milliarden Euro erhöht. Betrachtet man einen längeren Zeitraum, ist die Steigerung noch sehr viel deutlicher. Für 2012 sind Militärausgaben in Höhe von 33,3 Milliarden Euro eingeplant; im Jahr 2000 waren es noch 10 Milliarden Euro weniger. Das entspricht einer Steigerung von über 40 Prozent in zwölf Jahren. Nach den etwas ehrlicheren NATO-Zahlen plant die Bundesregierung im nächsten Jahr Militärausgaben in Höhe von 37 Milliarden Euro. Dieses Geld würde dringend für Bildung und Soziales oder Entwicklungshilfe gebraucht.",data/txt/17207.txt,speech,linke
2681909,207,17,0,,,,1229,Beifall bei der LINKEN,data/txt/17207.txt,poi,
2681910,207,17,0,Otto Fricke [FDP],Otto Fricke,otto-fricke,1230,Das haben Sie schon bei Hartz IV verbraucht!,data/txt/17207.txt,poi,fdp
2681911,207,17,0,Inge Höger (DIE LINKE),Inge Höger,inge-hoger,1231,Die Steigerungen lassen sich nicht mit steigenden Personalausgaben und Kosten für die Altersversorgung begründen. Im Jahr 2000 wurden mit 23 Milliarden Euro circa 300 000 Soldaten und 600 Bundeswehrstandorte -finanziert. Heute wird für eine deutlich kleinere Armee mit 190 000 Soldaten und 390 Standorten deutlich mehr Geld gezahlt. Leider hat diese Verkleinerung der Bundeswehr nichts mit Friedenspolitik zu tun; sonst würden wir das sehr begrüßen. Wir erleben aber das genaue Gegenteil. Zukünftig sollen Auslandseinsätze die Priorität haben. Statt bisher circa 7 000 sollen mehr als 10 000 Soldatinnen und Soldaten für Auslandseinsätze zur Verfügung stehen. Genau diese Kriegs- und Besatzungseinsätze machen die Bundeswehr so teuer.,data/txt/17207.txt,speech,linke
2681912,207,17,0,,,,1232,Beifall bei der LINKEN,data/txt/17207.txt,poi,
2681913,207,17,0,Inge Höger (DIE LINKE),Inge Höger,inge-hoger,1233,"Ich halte wenig von der europäischen Rüstungs-agentur. Es wäre besser, diese Institution abzuschaffen. Sie sollte durch eine Abrüstungsagentur ersetzt werden. Die europäische Rüstungsagentur hat aber interessante Zahlen gesammelt. Sie hat dokumentiert: Die Zusatz-kosten für die Kriegs- und Besatzungseinsätze für jeden eingesetzten Soldaten haben sich allein in den vier Jahren von 2006 bis 2010 in etwa verdoppelt. Auch hier -waren nicht die Personalkosten die wesentlichen Preistreiber. Es waren die immer teurere Ausrüstung, die -entsprechend steigenden Wartungskosten, der höhere Munitions- und Treibstoffverbrauch.",data/txt/17207.txt,speech,linke
2681914,207,17,0,Otto Fricke [FDP],Otto Fricke,otto-fricke,1234,Sie haben aber schon den Einzelplan 60 mit berücksichtigt?,data/txt/17207.txt,poi,fdp
2681915,207,17,0,Inge Höger (DIE LINKE),Inge Höger,inge-hoger,1235,- Das ist alles im Einzelplan 14.,data/txt/17207.txt,speech,linke
2681916,207,17,0,Otto Fricke [FDP],Otto Fricke,otto-fricke,1236,Eben nicht! Das ist nicht alles im Einzelplan 14!,data/txt/17207.txt,poi,fdp
2681917,207,17,0,Inge Höger (DIE LINKE),Inge Höger,inge-hoger,1237,,data/txt/17207.txt,speech,linke
2681918,207,17,0,Die deutsche Militärpolitik produziert zahlreiche Verliererinnen und Verlierer,Die deutsche Militärpolitik produziert zahlreiche Verliererinnen und Verlierer,die-deutsche-militarpolitik-produziert-zahlreiche-verliererinnen-und-verlierer,1238,,data/txt/17207.txt,speech,
2681919,207,17,0,Ernst-Reinhard Beck [Reutlingen] [CDU/CSU],Ernst-Reinhard Beck,ernst-reinhard-beck,1239,"Sicherheit, nicht Verlierer!",data/txt/17207.txt,poi,cducsu
2681920,207,17,0,Die deutsche Militärpolitik produziert zahlreiche Verliererinnen und Verlierer,Die deutsche Militärpolitik produziert zahlreiche Verliererinnen und Verlierer,die-deutsche-militarpolitik-produziert-zahlreiche-verliererinnen-und-verlierer,1240,"die Menschen in den Einsatzgebieten, die Soldaten, die für diese Politik verheizt werden, aber auch die Steuerzahlerinnen und Steuerzahler, die diesen Wahnsinn -bezahlen müssen. Gleichzeitig produziert diese Politik aber auch Gewinner: Die Rüstungsindustrie profitiert massiv von der intensiveren und stärker technisierten Kriegsführung. Wenn zukünftig verstärkt Drohnen und weiteres Hightechkriegsgerät auch von der Bundeswehr beschafft und eingesetzt werden, sind weitere Kosten-explosionen zu befürchten. Statt immer neue Waffen zu beschaffen, fordert die Linke Frieden durch Abrüstung.",data/txt/17207.txt,speech,
2681921,207,17,0,,,,1241,Beifall bei der LINKEN,data/txt/17207.txt,poi,
2681922,207,17,0,Die deutsche Militärpolitik produziert zahlreiche Verliererinnen und Verlierer,Die deutsche Militärpolitik produziert zahlreiche Verliererinnen und Verlierer,die-deutsche-militarpolitik-produziert-zahlreiche-verliererinnen-und-verlierer,1242,"Die Rüstungsproduktion für deutsche Streitkräfte und der Rüstungsexport hängen eng zusammen. Export macht die deutsche Kriegsführung preiswerter, da die Stückkosten für neues Kriegsgerät sinken. Der Ruf nach deutscher Kriegsbeteiligung in aller Welt, egal ob humanitär oder mit anderen Lügen begründet, fördert auch die entsprechende Rüstungsproduktion und den Rüstungs-export. So kann die Rüstungsindustrie weitere Profite machen. Auf der Gegenseite entstehen neue Krisen und Spannungen in aller Welt. Die neuesten Rüstungsexportzahlen sind erschreckend. Im letzten Jahr wurden deutsche Rüstungsexporte in Höhe von 5,4 Milliarden Euro genehmigt. 42 Prozent der Kriegswaffen werden in Länder außerhalb von EU und NATO exportiert. Ich bin -erschrocken über die Rechtfertigung solcher Genehmigungen. Kanzlerin Merkel erklärte im letzten Jahr:

Wir müssen die Staaten, die bereit sind, sich zu -engagieren, auch dazu befähigen. Ich sage ausdrücklich: Das schließt auch den Export von Waffen mit ein.

Diese Merkel-Doktrin stützt sich entweder auf deutsche Soldaten oder auf deutsche Waffen. Dies hat katastrophale Konsequenzen. Gerade in der Nahostregion brauchen wir nicht noch mehr Waffen. Wir brauchen Abrüstungsinitiativen und eine Rückkehr der Diplomatie.",data/txt/17207.txt,speech,
2681923,207,17,0,,,,1243,Beifall bei der LINKEN,data/txt/17207.txt,poi,
2681924,207,17,0,Die deutsche Militärpolitik produziert zahlreiche Verliererinnen und Verlierer,Die deutsche Militärpolitik produziert zahlreiche Verliererinnen und Verlierer,die-deutsche-militarpolitik-produziert-zahlreiche-verliererinnen-und-verlierer,1244,"Deutsche Waffen kommen auf dem Umweg über die Golfstaaten in den syrischen Bürgerkrieg. Deutsche Waffen befähigen die saudische Armee, bei Protesten in Bahrain zu intervenieren. Deutsche Waffen bestärken die israelische Regierung in ihrer Politik, die in erster Linie auf militärische Stärke setzt. Die verheerenden Folgen sehen wir zurzeit in Gaza. Wer andere Länder aufrüstet, der ist auch verantwortlich für die katastrophalen Konsequenzen, die sich ergeben, wenn Öl ins Feuer gekippt wird.

Die Linke fordert eine Rückkehr zu einer Politik der Deeskalation und Versöhnung. Wir fordern ein Ende der Auslandseinsätze der Bundeswehr, den sofortigen -Abzug aus Afghanistan und einen Ausstieg aus der R-üstungsproduktion sowie ein Ende der Rüstungs-exporte. Frieden lässt sich nicht herbeibomben.",data/txt/17207.txt,speech,
2681925,207,17,0,,,,1245,Beifall bei der LINKEN,data/txt/17207.txt,poi,
2681926,207,17,0,Zuruf von der SPD,von der SPD,von-der-spd,1246,Jedes Jahr die gleiche Rede!,data/txt/17207.txt,poi,spd
2681927,207,17,0,Die deutsche Militärpolitik produziert zahlreiche Verliererinnen und Verlierer,Die deutsche Militärpolitik produziert zahlreiche Verliererinnen und Verlierer,die-deutsche-militarpolitik-produziert-zahlreiche-verliererinnen-und-verlierer,1247,,data/txt/17207.txt,speech,
2681928,207,17,0,Vizepräsidentin Petra Pau,Petra Pau,petra-pau,1248,Für die FDP-Fraktion hat nun der Kollege Dr. h. c. Jürgen Koppelin das Wort.,data/txt/17207.txt,chair,
2681929,207,17,0,,,,1249,Beifall bei der FDP sowie bei Abgeordneten der CDU/CSU,data/txt/17207.txt,poi,
2681930,207,17,0,Vizepräsidentin Petra Pau,Petra Pau,petra-pau,1250,,data/txt/17207.txt,chair,
2681931,207,17,0,Dr. h. c. Jürgen Koppelin (FDP),Dr. h. c. Jürgen Koppelin,jurgen-koppelin,1251,"Frau Präsidentin! Liebe Kolleginnen und Kollegen! Ich darf als Hauptberichterstatter den Dank an meine Mitberichterstatter weitergeben. Ich sage ausdrücklich: Ich schließe die Kollegin Lötzsch - sie ist heute, glaube ich, nicht da - in diesen Dank mit ein. Wir haben in diesem Team eine ganz hervorragende Zusammenarbeit an den Tag gelegt; das muss ich sagen.",data/txt/17207.txt,speech,fdp
2681932,207,17,0,Bernhard Brinkmann [Hildesheim] [SPD],Bernhard Brinkmann,bernhard-brinkmann,1252,Auf hohem Niveau!,data/txt/17207.txt,poi,spd
2681933,207,17,0,Dr. h. c. Jürgen Koppelin (FDP),Dr. h. c. Jürgen Koppelin,jurgen-koppelin,1253,"Kollege Brinkmann, da wir beide aus diesem Hause ausscheiden wollen, können wir jetzt besonders viel Lob verteilen.

Kollegin Höger, es wäre vielleicht ganz gut, wenn Sie außer dem Neuen Deutschland noch einige andere -Zeitungen lesen würden.",data/txt/17207.txt,speech,fdp
2681934,207,17,0,,,,1254,Heiterkeit und Beifall bei Abgeordneten der FDP und der CDU/CSU,data/txt/17207.txt,poi,
2681935,207,17,0,Dr. h. c. Jürgen Koppelin (FDP),Dr. h. c. Jürgen Koppelin,jurgen-koppelin,1255,"Vielleicht bekämen Sie dann ein anderes Bild.

Liebe Kolleginnen und Kollegen, durch die Debatte heute zog sich - der Außenminister und die Bundeskanzlerin haben dazu Stellung genommen - die Anforderung von Patriot-Raketen und NATO-Unterstützung seitens der Türkei. Ich finde, das bewegt schon. Genauso hat mich übrigens damals, in der Zeit der rot-grünen -Koalition, bewegt, dass wir Israel Patriot-Raketen zur Verfügung gestellt haben. Das geschah allerdings ohne Personal und ohne Parlamentsbeteiligung; das will ich ausdrücklich sagen. Dass wir diese Raketen zur Verfügung gestellt haben, habe ich für selbstverständlich gehalten. Auch jetzt halte ich es für selbstverständlich, dass wir unserem NATO-Partner Türkei helfen.",data/txt/17207.txt,speech,fdp
2681936,207,17,0,Elke Hoff [FDP],Elke Hoff,elke-hoff,1256,Ja!,data/txt/17207.txt,poi,fdp
2681937,207,17,0,Dr. h. c. Jürgen Koppelin (FDP),Dr. h. c. Jürgen Koppelin,jurgen-koppelin,1257,"Warum erwähne ich das? Ich erwähne es auch, weil sich manche in den letzten Tagen, wie ich finde, sehr vorlaut geäußert haben, und zwar bevor die Anforderung aus der Türkei überhaupt vorlag. Wenn ich das sage, schaue ich ein bisschen auf einen Kollegen von den -Grünen, der im hinteren Bereich sitzt.",data/txt/17207.txt,speech,fdp
2681938,207,17,0,,,,1258,Zuruf des Abg. Omid Nouripour [BÜNDNIS 90/DIE GRÜNEN],data/txt/17207.txt,poi,
