id,sitzung,wahlperiode,in_writing,speaker,speaker_cleaned,speaker_fp,sequence,text,filename,type,speaker_party
2681359,207,17,0,Gerda Hasselfeldt (CDU/CSU),Gerda Hasselfeldt,gerda-hasselfeldt,679,"In einer Zeit, in der sich weltwirtschaftlich so vieles verändert hat und schwieriger geworden ist, in so einer Zeit muss man genau prüfen, ob die Maßnahmen, die man vorschlägt, nicht das Erreichte wieder kaputt machen. Ich will nur einige Dinge nennen, die nicht nur nicht geeignet sind, sondern das Erreichte mit Sicherheit kaputt machen würden.

Sie schlagen unter anderem die Erhöhung des Spitzensteuersatzes vor, sogar noch als Kompensation für die Abschaffung der kalten Progression; das ist vorhin schon angesprochen worden. Meine Damen und Herren, wie kann man nur so etwas machen wollen! Sie sind doch eine Partei, die sich auf die Fahne geschrieben hat, für die Arbeitnehmer, für die kleinen Leute da zu sein.",data/txt/17207.txt,speech,cducsu
2681360,207,17,0,Joachim Poß [SPD],Joachim Poß,joachim-poß,680,Wie stark ist denn die kalte Progression? Legen Sie dazu doch einmal etwas vor!,data/txt/17207.txt,poi,spd
2681361,207,17,0,Gerda Hasselfeldt (CDU/CSU),Gerda Hasselfeldt,gerda-hasselfeldt,681,"Vor diesem Hintergrund verstehe ich aber nicht, warum man über ein Jahr lang im Bundesrat eine Regelung blockiert, die zur Entlastung dieser kleinen Leute, der Arbeitnehmer, der fleißigen Menschen führt, denen die Früchte ihrer Arbeit zurzeit nicht gegönnt werden, weil die Lohn- bzw. Gehaltserhöhungen durch die Progres--sions- und Inflationswirkung zunichtegemacht werden. Wie man zum Abstellen dieser Ungerechtigkeit, was wir mit unserem schon beschlossenen Gesetz vorsehen, sagen kann: Nein, das wollen wir als Arbeitnehmerpartei nicht, das müssen Sie dem Volk wirklich einmal erklären. Ich kapiere das nicht.",data/txt/17207.txt,speech,cducsu
2681362,207,17,0,,,,682,Beifall bei der CDU/CSU und der FDP,data/txt/17207.txt,poi,
2681363,207,17,0,Joachim Poß [SPD],Joachim Poß,joachim-poß,683,Das hat Herr Steinbrück erklärt!,data/txt/17207.txt,poi,spd
2681364,207,17,0,Gerda Hasselfeldt (CDU/CSU),Gerda Hasselfeldt,gerda-hasselfeldt,684,"Wenn Sie wenigstens einen Vorschlag machen würden, der vernünftig wäre, dann würde mir das noch eingehen. Aber mit einer Erhöhung des Spitzensteuersatzes treffen Sie gerade die Leistungsbereiten, die Leistungsfähigen, die Arbeitnehmer und die Unternehmer. 80 Prozent unserer Unternehmen sind mittelständisch organisiert und bezahlen Einkommensteuer. 80 Prozent! Sie stellen Arbeitsplätze zur Verfügung. Wie die Erhöhung des Spitzensteuersatzes zum Arbeiten, zu neuen Investitionen sowie zur Schaffung von neuen Arbeitsplätzen motivieren soll, verstehe ich nicht. Es wird eben nicht motiviert. Mit diesem Vorhaben machen Sie jeden Investitionsmotor von Anfang an kaputt. Sie blockieren jede weitere Leistungsbereitschaft und produzieren damit zusätzliche Arbeitslose. So wollen Sie Verantwortung wahrnehmen.",data/txt/17207.txt,speech,cducsu
2681365,207,17,0,,,,685,Beifall bei der CDU/CSU und der FDP,data/txt/17207.txt,poi,
2681366,207,17,0,,,,686,Zurufe der Abg. Joachim Poß [SPD] und Matthias W. Birkwald [DIE LINKE],data/txt/17207.txt,poi,
2681367,207,17,0,Gerda Hasselfeldt (CDU/CSU),Gerda Hasselfeldt,gerda-hasselfeldt,687,"Ähnlich verhält es sich bei Ihren Vorstellungen zur Einführung einer Vermögensteuer, zur Erhöhung der Erbschaftsteuer, zu einer Vermögensabgabe usw. Mit Verlaub: Das sind Vorschläge aus der Mottenkiste. Teilweise haben Sie die alle schon probiert. Sie sind lediglich dazu geeignet, Neiddebatten zu führen. Aber sie sind in der jetzigen Phase nicht geeignet, Wachstum und Beschäftigung zu halten bzw. auch noch zu verbessern. Mit diesen Vorstellungen zerstören Sie das, was aufgebaut wurde, vom Kern her. Sie verstehen unter Konsolidierung nichts anderes als maßlose Steuererhöhungen, als Abkassieren von denjenigen Menschen, die leistungsfähig und leistungsbereit sind.",data/txt/17207.txt,speech,cducsu
2681368,207,17,0,,,,688,Beifall bei der CDU/CSU und der FDP,data/txt/17207.txt,poi,
2681369,207,17,0,Gerda Hasselfeldt (CDU/CSU),Gerda Hasselfeldt,gerda-hasselfeldt,689,"Dieser Kurs, meine lieben Kolleginnen und Kollegen, ist ein völlig anderer als der Kurs, den wir bisher gefahren sind und den wir auch weiterhin fahren werden.

Kollege Dr. Solms hat es angesprochen: Wir haben zu Beginn dieser Legislaturperiode stark darauf gesetzt, Wachstum und Beschäftigung zu fördern. Dies ist gelungen. Wir sind Vorbild mit unserer Politik der Haushaltskonsolidierung, mit unserer nachhaltigen Finanzpolitik, mit unserer wachstumsorientierten Politik in ganz Europa und darüber hinaus. Das, meine lieben Freunde, sollten wir auch künftig bleiben.",data/txt/17207.txt,speech,cducsu
2681370,207,17,0,,,,690,Beifall bei der CDU/CSU und der FDP,data/txt/17207.txt,poi,
2681371,207,17,0,Gerda Hasselfeldt (CDU/CSU),Gerda Hasselfeldt,gerda-hasselfeldt,691,,data/txt/17207.txt,speech,cducsu
2681372,207,17,0,Vizepräsidentin Petra Pau,Petra Pau,petra-pau,692,Das Wort hat der Kollege Axel Schäfer für die SPD-Fraktion.,data/txt/17207.txt,chair,
2681373,207,17,0,,,,693,Beifall bei der SPD,data/txt/17207.txt,poi,
2681374,207,17,0,Vizepräsidentin Petra Pau,Petra Pau,petra-pau,694,,data/txt/17207.txt,chair,
2681375,207,17,0,Axel Schäfer (Bochum) (SPD),Axel Schäfer,axel-schafer,695,"Frau Präsidentin! Liebe Kolleginnen und Kollegen! Zuerst einmal möchte ich dem Kollegen Schäuble gratulieren. Nein, nicht zu dem Haushalt; denn dazu haben wir doch eine ganze Menge berechtigte Kritik. Ich möchte ihm dazu gratulieren, dass er fast auf den Tag genau seit 40 Jahren Mitglied des Deutschen Bundestages ist - eine sicherlich außergewöhnliche Leistung. Ich glaube, er hat in vielen Bereichen Bedeutendes geleistet. Als Sozialdemokrat war ich natürlich mit einer Reihe seiner Positionen nicht einverstanden. Aber darauf kommt es nicht an. Er hat sicherlich Bleibendes geleistet mit seiner Grundsatzrede zum Thema Hauptstadt - Berlin oder Bonn?,",data/txt/17207.txt,speech,spd
2681376,207,17,0,,,,696,Beifall bei Abgeordneten der CDU/CSU sowie der Abg. Krista Sager [BÜNDNIS 90/DIE GRÜNEN],data/txt/17207.txt,poi,
2681377,207,17,0,Axel Schäfer (Bochum) (SPD),Axel Schäfer,axel-schafer,697,"die ich in jedem einzelnen Wort unterstütze und die dazu beigetragen hat, dass wir hier sitzen.",data/txt/17207.txt,speech,spd
2681378,207,17,0,,,,698,"Beifall bei Abgeordneten der SPD, der CDU/CSU und der FDP",data/txt/17207.txt,poi,
2681379,207,17,0,Axel Schäfer (Bochum) (SPD),Axel Schäfer,axel-schafer,699,"Was ansonsten die Situation dieser Regierung anbelangt: Das kann man fast überhaupt nicht weiter dramatisieren. Für jemanden, der sehr oft und sehr lange in -Europa unterwegs ist, sind die Fakten ernüchternd, manchmal auch erschlagend. Ich habe in den letzten 30 Jahren bei meinen Gesprächen noch nie erlebt, dass eine deutsche Bundesregierung in so vielen europäischen Hauptstädten ein solch schlechtes Image hatte wie die aktuelle. Ich habe das nicht einmal erlebt unter Helmut Kohl, der ja durchaus ein paar umstrittene Sachen gemacht hatte, und auch unter Gerhard Schröder nicht. Als europapolitischer Koordinator bin ich oft in der Situation, dass ich sagen muss: Moment, bei Frau Merkel gilt dieses und jenes.",data/txt/17207.txt,speech,spd
2681380,207,17,0,Alexander Ulrich [DIE LINKE],Alexander Ulrich,alexander-ulrich,700,Sie haben auch immer zugestimmt!,data/txt/17207.txt,poi,linke
2681381,207,17,0,Axel Schäfer (Bochum) (SPD),Axel Schäfer,axel-schafer,701,"Die mittlerweile vorhandene Kritik ist schlecht für das Ansehen unseres Landes. Das muss einfach einmal deutlich ausgesprochen werden. Unser Ansehen ist schlecht, weil teilweise nicht klar ist, welcher Regierungskurs gefahren wird, was man als nächste Maßnahme ergreift und wo und wie lange man zu seinen eigenen Vorschlägen steht, und weil aus der Mitte dieser schwarz-gelben Koalition viele Länder durch eine maßlose Rhetorik, die mit der Realität, zum Beispiel in Griechenland, nichts mehr zu tun hat, beschämt und auch beschädigt worden sind.",data/txt/17207.txt,speech,spd
2681382,207,17,0,,,,702,Beifall bei Abgeordneten der SPD,data/txt/17207.txt,poi,
2681383,207,17,0,Axel Schäfer (Bochum) (SPD),Axel Schäfer,axel-schafer,703,"Liebe Kolleginnen und Kollegen, es gibt einen fundamentalen Unterschied zwischen der Kanzlerin und dem künftigen Kanzler Peer Steinbrück.",data/txt/17207.txt,speech,spd
2681384,207,17,0,,,,704,Lachen bei Abgeordneten der CDU/CSU,data/txt/17207.txt,poi,
2681385,207,17,0,Heinz-Peter Haustein [FDP],Heinz-Peter Haustein,heinz-peter-haustein,705,Abwarten!,data/txt/17207.txt,poi,fdp
2681386,207,17,0,Axel Schäfer (Bochum) (SPD),Axel Schäfer,axel-schafer,706,- Hören Sie einmal genau zu!,data/txt/17207.txt,speech,spd
2681387,207,17,0,Rainer Brüderle [FDP],Rainer Brüderle,rainer-bruderle,707,Wo ist er denn? Gar nicht da!,data/txt/17207.txt,poi,fdp
2681388,207,17,0,Norbert Barthle [CDU/CSU],Norbert Barthle,norbert-barthle,708,Er hält einen Vortrag!,data/txt/17207.txt,poi,cducsu
2681389,207,17,0,Axel Schäfer (Bochum) (SPD),Axel Schäfer,axel-schafer,709,"Er hat bezogen auf die Große Koalition gesagt - das ist der Unterschied -: Bezüglich des damals beschlossenen Kooperationsverbots in der Bildung ist Selbstkritik nötig. Sie waren dagegen weder in Bezug auf die Entspannungspolitik von 1972 noch sonst bis heute irgendwann einmal in der Lage, zu sagen: Jawohl, da haben wir politische Fehler gemacht; die müssen wir korrigieren. Die Bürgerinnen und Bürger werden bei der Wahl im September 2013 die Möglichkeit haben, Ihre Fehler zu korrigieren.",data/txt/17207.txt,speech,spd
2681390,207,17,0,,,,710,Beifall bei der SPD,data/txt/17207.txt,poi,
2681391,207,17,0,Rainer Brüderle [FDP],Rainer Brüderle,rainer-bruderle,711,Wo ist denn Ihr Kandidat?,data/txt/17207.txt,poi,fdp
2681392,207,17,0,Axel Schäfer (Bochum) (SPD),Axel Schäfer,axel-schafer,712,"Liebe Kolleginnen und Kollegen, es ist doch ganz einfach, das auszusprechen, was notwendig ist, damit die Bürgerinnen und Bürger unsere jetzige Situation in Europa verstehen, aber das wird nicht getan.

Erstens. Wir müssen immer wieder wiederholen: Es kann uns in Deutschland nur gutgehen, wenn es den anderen Ländern nicht schlecht geht. Das ist die Grundlage überhaupt!

Zweitens. Da wir in Deutschland die wirtschaftlichen Gewinner der Einigung sind, ist es richtig, dass wir als Nettozahler einen adäquaten und ansehnlichen finanziellen Beitrag leisten.

Drittens. Wir dürfen nicht nur so tun, als wüssten wir von allem den Preis, sondern wir müssen auch deutlich machen, was der Wert dieser Gemeinschaft ist.

Genau diese Grundhaltung ist bei Ihnen nicht vorhanden. Das ist eine der Ursachen dafür, dass wir die aktuellen Schwierigkeiten in Europa haben.",data/txt/17207.txt,speech,spd
2681393,207,17,0,,,,713,Beifall bei der SPD,data/txt/17207.txt,poi,
2681394,207,17,0,Axel Schäfer (Bochum) (SPD),Axel Schäfer,axel-schafer,714,"Was ich zu Wert und Preis gesagt habe, wird sich in den nächsten Tagen beweisen; denn Ihre Politik, die substanziell und essenziell darin besteht, das Parlament eher zu schwächen und das Intergouvernementale zu stärken, wird sich schon an diesem Wochenende rächen. Sie werden sehen: Wir werden keinen mittelfristigen Finanzrahmen hinbekommen, der vom Europäischen Parlament mitgetragen wird.

Ich kann die Kolleginnen und Kollegen dort nur ermutigen - gerade auch bei Liberalen und Christdemokraten gibt es da viel Kritik -, zu diesem MFR Nein zu sagen, weil er genau das nicht ermöglicht, was wir in Europa brauchen: Wachstum, Beschäftigung, Nachhaltigkeit. All das, was versprochen ist, kann nämlich mit diesem Mittelfristigen Finanzrahmen nicht gehalten werden.",data/txt/17207.txt,speech,spd
2681395,207,17,0,,,,715,Beifall bei der SPD,data/txt/17207.txt,poi,
2681396,207,17,0,Axel Schäfer (Bochum) (SPD),Axel Schäfer,axel-schafer,716,"Mit Erlaubnis der Frau Präsidentin zitiere ich einmal, was das Auswärtige Amt gerade dazu geschrieben hat: In den Weisungen des Auswärtigen Amtes für den Ständigen Vertreter Deutschlands bei der EU vom 15. November heißt es: Die Kürzungsvorschläge im Bereich 1b, also wirtschaftliche, soziale und territoriale Kohäsion, sind nicht ausreichend. Das heißt, es soll noch mehr gekürzt werden. Das heißt auch, dass es noch weniger Mittel für das geben soll, was nötig ist: Förderung der Beschäftigung, Bekämpfung der Jugendarbeitslosigkeit und Fortschritte bei der Nachhaltigkeit in Europa. Das ist in der Praxis die Politik dieser Bundesregierung in Europa. Darum wird es gehen.

Ich sage Ihnen auch, liebe Kolleginnen und Kollegen: Wir als SPD befinden uns heute in einer sehr entspannten Situation. Deshalb konnte Kollege Solms sagen: Wenn Sie nächstes Jahr an die Regierung kommen, bedenken Sie dies und das. - Wir haben jetzt schon in der Debatte erlebt, dass Sozialdemokratinnen und Sozialdemokraten und Grüne in den zentralen Fragen sehr nahe beieinander sind. Der Parteitag von Bündnis 90/Die Grünen hat gezeigt, dass es ein hohes Maß an Geschlossenheit gibt. Die Nominierung von Peer Steinbrück auf dem SPD-Parteitag am 9. Dezember wird dieses Maß an Geschlossenheit noch einmal in besonderer Weise verdeutlichen.",data/txt/17207.txt,speech,spd
2681397,207,17,0,,,,717,Lachen der Abg. Dr. Gesine Lötzsch (DIE LINKE,data/txt/17207.txt,poi,
2681398,207,17,0,Axel Schäfer (Bochum) (SPD),Axel Schäfer,axel-schafer,718,"Ich bin davon überzeugt: Es gibt bei uns die Entschlossenheit, Sie im nächsten Jahr abzulösen. Das werden wir machen. Dafür werden wir werben.

Glück auf!",data/txt/17207.txt,speech,spd
2681399,207,17,0,,,,719,Beifall bei der SPD sowie bei Abgeordneten des BÜNDNISSES 90/DIE GRÜNEN,data/txt/17207.txt,poi,
2681400,207,17,0,Rainer Brüderle [FDP],Rainer Brüderle,rainer-bruderle,720,Wo ist denn der Kandidat? Wo ist denn Herr Steinbrück?,data/txt/17207.txt,poi,fdp
2681401,207,17,0,Axel Schäfer (Bochum) (SPD),Axel Schäfer,axel-schafer,721,,data/txt/17207.txt,speech,spd
2681402,207,17,0,Vizepräsidentin Petra Pau,Petra Pau,petra-pau,722,Für die Unionsfraktion spricht nun der Kollege Rüdiger Kruse.,data/txt/17207.txt,chair,
2681403,207,17,0,,,,723,Beifall bei der CDU/CSU,data/txt/17207.txt,poi,
2681404,207,17,0,Vizepräsidentin Petra Pau,Petra Pau,petra-pau,724,,data/txt/17207.txt,chair,
2681405,207,17,0,Rüdiger Kruse (CDU/CSU),Rüdiger Kruse,rudiger-kruse,725,"Frau Präsidentin! Meine sehr geehrten Damen und Herren! Herr Kollege Schäfer, in der Generaldebatte darf man generell so ziemlich alles sagen und machen. Sie haben eine Ermutigungsrede für einen Parteitag gehalten. Das scheinen Sie nötig zu haben. Ich will mich gar nicht einmischen und Stellung beziehen, ob Ihre Prognose richtig ist. Auch ich glaube, Steinbrück wird Kanzlerkandidat; darin stimmen wir überein. Auch in Ihrer Beurteilung von Wolfgang Schäuble stimmen wir überein.

Sie haben dann ein paar Ausführungen zu unseren Nachbarn gemacht und dazu, wie man denen helfen soll, damit es ihnen wieder gutgeht. Das ist alles richtig. Nur: Wenn Sie einen Ertrinkenden retten wollen, dann müssen Sie selber schwimmen können. Wenn Sie dazu beitragen, dass die Arme und Beine des Rettungsschwimmers immer stärker gefesselt werden, dann wissen Sie genau, welches Schicksal ihm droht. In diese Richtung gehen Ihre Politikvorschläge.

Sie haben eben auf große Gemeinsamkeit zwischen Rot und Grün hingewiesen. Mein Part am Ende der Debatte ist es immer, auf das Thema Kultur zu kommen, weil das ja die Spitze der Bewegung ist. Weil es eine Haushaltsdebatte ist, kann man einmal schauen: Wie hat sich denn diese Gemeinschaft von Rot-Grün ausgewirkt? Wir wissen, der damalige Kanzler hatte viele Künstlerfreunde und war in dieser Richtung wirklich interessiert. Er hat sich auch einen schöngeistigen Staatsminister für Kultur besorgt. Wie haben sich denn damals die Haushalte für Kultur entwickelt? Rot-Grün hat in seiner Zeit, vom Anfang bis zum Ende, den Etat für Kultur verändert: um 10 Millionen Euro nach unten.",data/txt/17207.txt,speech,cducsu
2681406,207,17,0,Norbert Barthle [CDU/CSU],Norbert Barthle,norbert-barthle,726,Nach unten!,data/txt/17207.txt,poi,cducsu
2681407,207,17,0,Rüdiger Kruse (CDU/CSU),Rüdiger Kruse,rudiger-kruse,727,"Okay. Was hat denn Schwarz-Rot gemacht? In den vier Jahren Schwarz-Rot wurde der Etat über die Jahre verändert: um 80 Millionen Euro nach oben. Okay, Schwarz wirkt. Was hat Schwarz-Gelb in den letzten Jahren gemacht? Schwarz-Gelb hat auch den Etat verändert: um 134 Millionen Euro nach oben.",data/txt/17207.txt,speech,cducsu
2681408,207,17,0,,,,728,Beifall bei der CDU/CSU und der FDP,data/txt/17207.txt,poi,
2681409,207,17,0,Rüdiger Kruse (CDU/CSU),Rüdiger Kruse,rudiger-kruse,729,"Was kann man an dieser Farbenlehre sehen? Rot-Grün bringt gar nichts und ist für die Kultur kontraproduktiv. Das Einzige, was es bringt, sind schöngeistige Reden und Beileidsbekundungen für die schlechte Situation der Kultur. Je höher der Anteil von Schwarz wird, desto besser geht es der Kultur.

Jetzt könnte man nach Schwarz-Gelb sagen: Probieren wir einmal eine Runde Schwarz pur aus.",data/txt/17207.txt,speech,cducsu
2681410,207,17,0,Norbert Barthle [CDU/CSU],Norbert Barthle,norbert-barthle,730,Das wäre gut für die Kultur!,data/txt/17207.txt,poi,cducsu
2681411,207,17,0,Rüdiger Kruse (CDU/CSU),Rüdiger Kruse,rudiger-kruse,731,"Auch damit habe ich kein Problem. Ich muss aber nach den Beratungen sagen, dass sich die Koalitionäre der christlich-liberalen Koalition wirklich vorgenommen haben, im Zusammenspiel in diesen Jahren substanziell etwas zu leisten und substanziell die Kultur in diesem Lande zu stärken. Das ist uns gelungen. Ich freue mich auch über die gute Zusammenarbeit mit Jürgen Koppelin, die in langen und manchmal auch sehr streitvollen Gesprächen sehr gute Ergebnisse gezeigt hat.",data/txt/17207.txt,speech,cducsu
2681412,207,17,0,,,,732,Beifall bei der CDU/CSU und der FDP,data/txt/17207.txt,poi,
2681413,207,17,0,Rüdiger Kruse (CDU/CSU),Rüdiger Kruse,rudiger-kruse,733,"Es ist ja in Europa im Augenblick nicht selbstverständlich, dass Kulturetats erhöht werden. In Frankreich - ich weiß nicht, ob das an den grün-roten Vorlieben für Hollande liegt; Sie besuchen ihn auch zu oft; sein Rating wird jedes Mal schlechter -",data/txt/17207.txt,speech,cducsu
2681414,207,17,0,,,,734,Heiterkeit der Abg. Wolfgang Zöller [CDU/CSU] und Norbert Barthle [CDU/CSU],data/txt/17207.txt,poi,
2681415,207,17,0,Rüdiger Kruse (CDU/CSU),Rüdiger Kruse,rudiger-kruse,735,"wurde der Kulturetat zusammengestrichen, natürlich hauptsächlich bei den Projekten, die die Vorgängerregierung auf den Weg gebracht hat.

Es gibt ja die Grundvermutung, alle Künstler seien links, was natürlich Quatsch ist, aber bleiben wir erst einmal dabei. Zur Szene der Kulturschaffenden gehören sicherlich nicht überwiegend Mitglieder meiner Partei. Stellen Sie sich einmal vor, wir wären auf die Idee gekommen, alle diese Einrichtungen dichtzumachen. Aber es gibt einen kulturpolitischen Ansatz, dessen Vertreter so denken. Dieser Ansatz kommt von den Rändern der politischen Gesellschaft, die dazu neigen, Kultur in Sklavenhaft zu nehmen und sie als Verkündungsinstrument zu missbrauchen. Das tun Bürgerliche nicht, und es gibt nur eine bürgerliche Regierung.",data/txt/17207.txt,speech,cducsu
2681416,207,17,0,,,,736,Beifall bei der CDU/CSU sowie bei Abgeordneten der FDP,data/txt/17207.txt,poi,
2681417,207,17,0,Rüdiger Kruse (CDU/CSU),Rüdiger Kruse,rudiger-kruse,737,"Die christlich-liberale Regierung hat dort Akzente gesetzt, wo wir nationale wie internationale Bedeutung und Innovationen sehen. Ich glaube auch, dass das die Aufgabe des Bundes ist. Es ist den Kommunen oftmals schwergefallen, Kulturprojekte weiter zu fördern. Oftmals wird auch, so verkehrt es ist, zuerst bei der Kultur gespart. Wir werden so nicht verfahren, sondern wir halten an unserer Linie fest. Das ist uns auch gut gelungen.

Die Mittel für die Filmförderung sind um 10 Millionen Euro auf 70 Millionen Euro gestiegen. Das ist ein Bereich, in dem sich Kultur sehr direkt mit der Wirtschaft trifft.

Wir haben in der Musikwirtschaft, ausgehend von entsprechenden Initiativen, ein ähnliches Programm im Aufbau. Ich sage nicht, in welcher Höhe, damit jetzt niemand in die Luft springt. Aber auch hier kann Deutschland von einem reinen Import- zu einem Exportland werden.

All das, was wir für den Denkmalschutz tun, wirkt in der Fläche und kommt damit allen zugute, weil es keine schwarzen, grünen, gelben oder roten Denkmäler gibt. Es geht uns dabei natürlich nicht um tote Steine: Wir fordern immer Nutzungskonzepte und richten uns auch sehr explizit an die Lebenden, die heutigen Künstler und Kulturaktiven, wie es heute so schön heißt; denn den Begriff Kulturschaffende mag ich nicht.",data/txt/17207.txt,speech,cducsu
2681418,207,17,0,Volker Kauder [CDU/CSU],Volker Kauder,volker-kauder,738,Wie heißt das?,data/txt/17207.txt,poi,cducsu
2681419,207,17,0,Rüdiger Kruse (CDU/CSU),Rüdiger Kruse,rudiger-kruse,739,"- Kulturaktive hat Wolfgang Börnsen neulich gesagt. Dieses Wort fand ich sehr schön.

Auf jeden Fall können wir eines feststellen: Wo immer sich der Künstler selber verortet - am besten geht es ihm unter einer bürgerlichen christlich-liberalen Regierung.",data/txt/17207.txt,speech,cducsu
2681420,207,17,0,,,,740,Beifall bei der CDU/CSU sowie bei Abgeordneten der FDP,data/txt/17207.txt,poi,
2681421,207,17,0,Rüdiger Kruse (CDU/CSU),Rüdiger Kruse,rudiger-kruse,741,,data/txt/17207.txt,speech,cducsu
2681422,207,17,0,Vizepräsidentin Petra Pau,Petra Pau,petra-pau,742,Das Wort hat der Kollege Siegmund Ehrmann für die SPD-Fraktion.,data/txt/17207.txt,chair,
2681423,207,17,0,,,,743,Beifall bei der SPD,data/txt/17207.txt,poi,
2681424,207,17,0,Vizepräsidentin Petra Pau,Petra Pau,petra-pau,744,,data/txt/17207.txt,chair,
2681425,207,17,0,Siegmund Ehrmann (SPD),Siegmund Ehrmann,siegmund-ehrmann,745,"Frau Präsidentin! Meine sehr geehrten Damen und Herren! Eigentlich sollte Petra Merkel, unsere Haushälterin, zu diesem Einzelplan sprechen. Sie ist aber kurzfristig erkrankt, und ich erlaube mir, ihr von dieser Stelle aus die besten Genesungswünsche zu übermitteln.",data/txt/17207.txt,speech,spd
2681426,207,17,0,,,,746,Beifall,data/txt/17207.txt,poi,
2681427,207,17,0,Siegmund Ehrmann (SPD),Siegmund Ehrmann,siegmund-ehrmann,747,"Diesen Kulturhaushalt, der jetzt nach den Beratungen sowohl im Ausschuss für Kultur und Medien als auch im Haushaltsausschuss vorliegt, bewerte ich als einen Kulturhaushalt der Ambivalenz. Herr Kruse, es war ein bisschen selbstgefällig, wie Sie das alles geschildert haben.",data/txt/17207.txt,speech,spd
2681428,207,17,0,Axel Schäfer [Bochum] [SPD],Axel Schäfer,axel-schafer,748,Sehr wahr!,data/txt/17207.txt,poi,spd
2681429,207,17,0,Siegmund Ehrmann (SPD),Siegmund Ehrmann,siegmund-ehrmann,749,"In der Tat haben wir einen Aufwuchs von 100 Millionen Euro insgesamt in diesen Beratungen erreicht. Punktuell decken sich die Positionsverbesserungen bei einzelnen Etatposten auch mit den Vorstellungen der Sozialdemokratie, zum Beispiel bei der Kulturstiftung des Bundes und der Deutschen Akademie für Sprache und Dichtung, aber auch, was den Aufwuchs bei der Stiftung Aufarbeitung angeht.

Es reicht aber nicht, Herr Kruse, wenn es einen kul-turaffinen Haushälter gibt. Die Kulturgruppe im Ausschuss für Kultur und Medien hat sich der inhaltlichen Debatte völlig verweigert. Das, was in den Haushalt eingestellt wurde, ist nicht inhaltlich begründet worden. Im Gegenteil, es wurde blind abgestimmt, und es wurde ganz allein Ihnen überlassen. Das war eine Ein-Mann-Show, die dafür gesorgt hat, dass diese Positionen vom Haushaltsausschuss im Haushalt verankert worden sind.

Dabei ist Kulturpolitik nicht alleine Ressortpolitik. Wir sollten bestimmte Dinge in Zusammenhang bringen. Die Mittel für die Goethe-Institute sind um 2,5 Millionen Euro gekürzt worden. Zudem sind im Etat des -Auswärtigen Amtes 5 Millionen Euro an Mitteln für Sprachförderung gesperrt worden. Zeitgleich wird im Kulturetat verankert, dass ein sudetendeutsches Museum errichtet werden soll und dass der Stiftung Flucht, Vertreibung, Versöhnung zusätzliche Mittel zur Verfügung gestellt werden,",data/txt/17207.txt,speech,spd
2681430,207,17,0,,,,750,Zuruf der Abg. Dr. Lukrezia Jochimsen [DIE LINKE],data/txt/17207.txt,poi,
2681431,207,17,0,Siegmund Ehrmann (SPD),Siegmund Ehrmann,siegmund-ehrmann,751,obwohl es in der letzten Wahlperiode keinen entsprechenden Mittelabfluss gab. Was für Bilder nach innen und nach außen transportieren Sie mit diesen Aktivitäten?,data/txt/17207.txt,speech,spd
2681432,207,17,0,,,,752,Beifall bei der SPD sowie bei Abgeordneten des BÜNDNISSES 90/DIE GRÜNEN und der Abg. Dr. Lukrezia Jochimsen [DIE LINKE],data/txt/17207.txt,poi,
