id,sitzung,wahlperiode,in_writing,speaker,speaker_cleaned,speaker_fp,sequence,text,filename,type,speaker_party
2682425,207,17,0,Weiterer Zuruf von der FDP,von der FDP,von-der-fdp,1745,Strengt euch mal an!,data/txt/17207.txt,poi,fdp
2682426,207,17,0,Dr. Sascha Raabe (SPD),Dr. Sascha Raabe,sascha-raabe,1746,"Ständig werden uns neue Konzepte präsentiert. In der Chefetage des BMZ wird so viel heiße Luft produziert, dass man schon Angst vor Wüstenbildung haben muss. Dazu passt, dass Sie uns neulich ein entwicklungspolitisches Weißbuch vorgelegt haben, in dessen zehn Hauptbotschaften auf der ersten Seite Sie eigentlich nur sich selbst feiern. Die Begriffe Hunger und Armut tauchen in dieser Gliederung kein einziges Mal auf.

Ich kann nur sagen: Wir Sozialdemokraten haben eine Strategie vorgelegt, in der die Bekämpfung von Hunger und Armut an allererster Stelle steht. Sie hingegen machen in erster Linie Außenwirtschaftsförderung. Sie haben eine Ressortvereinbarung mit dem Auswärtigen Amt geschlossen, die angeblich zu einer besseren Abstimmung und mehr Effizienz - Sie nehmen ja immer das Wort Effizienz in den Mund - führten sollte. Dann werfen Sie Ihrem ehemaligen besten Freund Westerwelle aber vor:

Es kann nicht sein, dass Menschen in der von Krisen geschüttelten Region am Horn von Afrika unter der Untätigkeit des Auswärtigen Amtes leiden.

Das kommt dabei heraus, wenn man die Kernzuständigkeit des BMZ, nämlich humanitäre Hilfe zu leisten, auslagert, um einen Kuhhandel zu machen. Anschließend klagen Sie öffentlich in der Presse Westerwelles Untätigkeit an. Da kann natürlich eine Männerfreundschaft schon einmal auf der Strecke bleiben. Noch schlimmer ist aber, dass Zehntausende Flüchtlinge in der Krisen-region am Horn von Afrika darunter leiden.",data/txt/17207.txt,speech,spd
2682427,207,17,0,Vizepräsidentin Katrin Göring-Eckardt,Katrin Göring-Eckardt,katrin-goring-eckardt,1747,Herr Raabe!,data/txt/17207.txt,chair,
2682428,207,17,0,Dr. Sascha Raabe (SPD),Dr. Sascha Raabe,sascha-raabe,1748,"Ich komme zum Schluss. - Ich kann Ihnen nur sagen, liebe Kolleginnen und Kollegen von der Koalition: Wenn Sie heute so abstimmen, wie Sie abstimmen wollen, dann müssen Sie den Menschen erklären, warum Sie an diesem trüben Novembertag das 0,7-Prozent-Ziel zu Grabe getragen haben. Ich appelliere an Ihr Gewissen: Stimmen Sie dem nicht zu!",data/txt/17207.txt,speech,spd
2682429,207,17,0,,,,1749,Beifall bei der SPD sowie bei Abgeordneten des BÜNDNISSES 90/DIE GRÜNEN,data/txt/17207.txt,poi,
2682430,207,17,0,Dr. Sascha Raabe (SPD),Dr. Sascha Raabe,sascha-raabe,1750,,data/txt/17207.txt,speech,spd
2682431,207,17,0,Vizepräsidentin Katrin Göring-Eckardt,Katrin Göring-Eckardt,katrin-goring-eckardt,1751,Johannes Selle hat jetzt das Wort für die CDU/CSU-Fraktion.,data/txt/17207.txt,chair,
2682432,207,17,0,,,,1752,Beifall bei der CDU/CSU und der FDP,data/txt/17207.txt,poi,
2682433,207,17,0,Vizepräsidentin Katrin Göring-Eckardt,Katrin Göring-Eckardt,katrin-goring-eckardt,1753,,data/txt/17207.txt,chair,
2682434,207,17,0,Johannes Selle (CDU/CSU),Johannes Selle,johannes-selle,1754,"Frau Präsidentin! Liebe Kollegen! Das Ziel der wirtschaftlichen Zusammenarbeit und Entwicklung ist es, allen Menschen ein menschenwürdiges Leben zu ermöglichen. Das ist eine ehrenvolle Aufgabe, die aber riesengroß ist und die durch Bevölkerungswachstum, Klimaveränderungen und Ressourcenverknappung wächst. Zusätzlich erfordern Naturkatastrophen wie Überschwemmungen und Dürren unsere Hilfe. Dort, wo Not herrscht, muss auch in Zukunft schnell geholfen werden. Deutschland hat auf die Hungersnot in Ostafrika zum Beispiel unmittelbar mit Hilfen in Höhe von 33,5 Millionen Euro reagiert - zusätzlich zu den Leistungen im Rahmen unserer multilateralen Zusammenarbeit.

Die Millenniumsentwicklungsziele zu erreichen, wird wohl leider nicht ganz gelingen. Gerade bei Hunger und Unterernährung sind die Zahlen - erst von 20 Prozent auf 16 Prozent gefallen und jetzt wieder auf 19 Prozent gestiegen - ganz wesentlich verursacht durch die steigenden Lebensmittelpreise.

Wir werden zunehmend damit konfrontiert, durch fehlende Entwicklung verursachte kriegerische Auseinandersetzungen und terroristische Bedrohungen zu bewältigen. Ich darf an Mali, Sudan, Südsudan und ganz aktuell an Kongo erinnern. Deshalb ist es wichtig, dass wir in unserer Entwicklungszusammenarbeit Konfliktprävention fördern und vor allem in fragilen Staaten mit unserem Engagement nicht nachlassen.",data/txt/17207.txt,speech,cducsu
2682435,207,17,0,,,,1755,Zuruf der Abg. Dr. Bärbel Kofler [SPD],data/txt/17207.txt,poi,
2682436,207,17,0,Johannes Selle (CDU/CSU),Johannes Selle,johannes-selle,1756,"Aus meiner Sicht ist es an der Zeit, dem Gedanken eines stärkeren, dauerhaften Engagements in einem Land näherzutreten. Dadurch könnte langfristig der Verwaltungsaufbau und damit eine gute Regierungsführung schneller vorangebracht werden. Der Südsudan zum Beispiel braucht das. Ganzheitliche Konzepte fehlen einfach. Zudem würden die Zivilgesellschaft und die Wirtschaft in Deutschland viel stärker motiviert.

Mit Minister Niebel hat es einen Paradigmenwechsel gegeben.",data/txt/17207.txt,speech,cducsu
2682437,207,17,0,Zuruf von der SPD,von der SPD,von-der-spd,1757,"Ja, das stimmt!",data/txt/17207.txt,poi,spd
2682438,207,17,0,Johannes Selle (CDU/CSU),Johannes Selle,johannes-selle,1758,"Die Entwicklungszusammenarbeit hat ihre Wirksamkeit im Inland erhöht. Die Vorfeldreform, an der sich die Vorgängerin des Ministers elf Jahre lang erfolglos versucht hat,",data/txt/17207.txt,speech,cducsu
2682439,207,17,0,Dr. Rainer Stinner [FDP],Dr. Rainer Stinner,rainer-stinner,1759,Das kann man -sagen!,data/txt/17207.txt,poi,fdp
2682440,207,17,0,Johannes Selle (CDU/CSU),Johannes Selle,johannes-selle,1760,ist eine große Erfolgsgeschichte.,data/txt/17207.txt,speech,cducsu
2682441,207,17,0,,,,1761,Beifall bei Abgeordneten der CDU/CSU und der FDP,data/txt/17207.txt,poi,
2682442,207,17,0,Johannes Selle (CDU/CSU),Johannes Selle,johannes-selle,1762,"Die Integration von WZ-Referenten an den deutschen Botschaften kommt voran und wird von unseren Partnern sehr geschätzt. Für den Umgang mit fragilen Staaten wurde ein schlüssiges und anerkanntes Konzept vorgelegt.

Wenn Jobs wichtig für die Bekämpfung der Armut sind, dann heißt das, die Wirtschaft einzubeziehen. Nachhaltige Beschäftigung und selbsttragender Aufschwung brauchen Arbeitsplätze im produzierenden Gewerbe. Die Förderung der Privatwirtschaft in Entwicklungsländern hat eine größere Bedeutung bekommen. 90 Prozent aller neugeschaffenen Stellen entstehen nämlich durch privatwirtschaftliche Initiativen.",data/txt/17207.txt,speech,cducsu
2682443,207,17,0,,,,1763,Beifall bei Abgeordneten der FDP,data/txt/17207.txt,poi,
2682444,207,17,0,Johannes Selle (CDU/CSU),Johannes Selle,johannes-selle,1764,"Der Privatsektor ist Wachstumsmotor, so Staats-sekretärin Gudrun Kopp. In dieser Linie steht auch der Haushaltsentwurf der Regierung mit einer Erhöhung von 37,5 Millionen Euro gegenüber dem Vorjahr auf insgesamt 6,4 Milliarden Euro.",data/txt/17207.txt,speech,cducsu
2682445,207,17,0,Dr. Bärbel Kofler [SPD],Dr. Bärbel Kofler,barbel-kofler,1765,"Also das ist ja jetzt wirklich Makulatur! Reden Sie doch über das, worüber wir heute abstimmen!",data/txt/17207.txt,poi,spd
2682446,207,17,0,Johannes Selle (CDU/CSU),Johannes Selle,johannes-selle,1766,"Wir Entwicklungspolitiker wünschen uns mehr, aber wir stehen in der Verpflichtung, den Haushalt zu konsolidieren. Das ist auch für die wirtschaftliche Zusammenarbeit sehr wichtig, damit wir weiter helfen können.

Alle wesentlichen Positionen im Haushalt steigen nach diesem Entwurf. Ich rede dabei von den Positionen, deren Mittel an Institutionen gehen, die direkt für die Menschen arbeiten.",data/txt/17207.txt,speech,cducsu
2682447,207,17,0,Dr. Bärbel Kofler [SPD],Dr. Bärbel Kofler,barbel-kofler,1767,Haben Sie die -falsche Rede dabei?,data/txt/17207.txt,poi,spd
2682448,207,17,0,Johannes Selle (CDU/CSU),Johannes Selle,johannes-selle,1768,"Der Ansatz für den Europäischen Entwicklungsfonds betrug 838 Millionen Euro. Wegen fehlender sinnvoller Projekte meldete die Kommission einen um 144 Millionen Euro geringeren Bedarf an. Niemand hat bisher hinterfragt, warum der Europäische Entwicklungsfonds seine Ziele wiederholt nicht erreicht hat. Daran hat auch die Opposition keine Kritik geübt. Wir hätten das nicht benötigte Geld gerne in andere Projekte gesteckt. Dazu haben wir auch Vorschläge vorbereitet.

Entwicklung, Hilfe und Arbeit zugunsten der Schwächsten in der Welt: Das ist unsere tägliche Beschäftigung und wird dadurch zu einer Angelegenheit des Herzens, weil wir eben so dicht dran sind. Im Haushaltsausschuss wurden nun Tatsachen geschaffen.",data/txt/17207.txt,speech,cducsu
2682449,207,17,0,Dr. Bärbel Kofler [SPD],Dr. Bärbel Kofler,barbel-kofler,1769,"Ja, leider!",data/txt/17207.txt,poi,spd
2682450,207,17,0,Johannes Selle (CDU/CSU),Johannes Selle,johannes-selle,1770,"Von den 144 Millionen Euro wurden 22,9 Millionen Euro dem Einzelplan 23 für die Verstärkung der Projekte belassen. 121 Millionen Euro wurden zur Reduzierung der Kreditaufnahme verwendet. Das mag vor dem Hintergrund der Verschuldung plausibel erscheinen, wäre von den Entwicklungspolitikern aber nicht unterstützt worden. Im weiteren parlamentarischen Verfahren ist aber eine Änderung nicht so einfach möglich.

Die Projekte, die im Entwurf des Haushaltes vorgesehen waren, haben darunter nicht gelitten. Die Mittel dafür wurden teilweise erhöht. Das darf man auch einmal sagen. Ich möchte auch auf die Gefahr hinweisen, dass der Europäische Entwicklungsfonds die Gelder, die er nicht gebraucht hat, noch einfordern kann, wie es in der Finanzierungsvereinbarung steht.",data/txt/17207.txt,speech,cducsu
2682451,207,17,0,"Noch einige Worte zu den Anträgen, über die heute abgestimmt werden muss","Noch einige Worte zu den Anträgen, über die heute abgestimmt werden muss",noch-einige-worte-zu-den-antragen-uber-die-heute-abgestimmt-werden-muss,1771,"Die SPD verlangt ganz locker 1,4 Milliarden Euro mehr",data/txt/17207.txt,speech,
2682452,207,17,0,,,,1772,Beifall bei Abgeordneten der SPD,data/txt/17207.txt,poi,
2682453,207,17,0,"Noch einige Worte zu den Anträgen, über die heute abgestimmt werden muss","Noch einige Worte zu den Anträgen, über die heute abgestimmt werden muss",noch-einige-worte-zu-den-antragen-uber-die-heute-abgestimmt-werden-muss,1773,"und legt natürlich keine Gegenfinanzierung vor, obwohl Kollege Steinbrück gerade heute früh eine Nullverschuldung für möglich hielt.",data/txt/17207.txt,speech,
2682454,207,17,0,Dr. Bärbel Kofler [SPD],Dr. Bärbel Kofler,barbel-kofler,1774,Da stimmt nicht einmal die Summe!,data/txt/17207.txt,poi,spd
2682455,207,17,0,"Noch einige Worte zu den Anträgen, über die heute abgestimmt werden muss","Noch einige Worte zu den Anträgen, über die heute abgestimmt werden muss",noch-einige-worte-zu-den-antragen-uber-die-heute-abgestimmt-werden-muss,1775,"Das ist im Vergleich zu den gut 2,25 Milliarden Euro, die die Linken in ihren Anträgen fordern,",data/txt/17207.txt,speech,
2682456,207,17,0,,,,1776,Beifall bei Abgeordneten der LINKEN,data/txt/17207.txt,poi,
2682457,207,17,0,"Noch einige Worte zu den Anträgen, über die heute abgestimmt werden muss","Noch einige Worte zu den Anträgen, über die heute abgestimmt werden muss",noch-einige-worte-zu-den-antragen-uber-die-heute-abgestimmt-werden-muss,1777,"bescheiden. Vielleicht gilt auch hier der Satz: Je weiter weg von einer Regierungsbeteiligung man ist, desto leichter fallen die Forderungen.",data/txt/17207.txt,speech,
2682458,207,17,0,,,,1778,Beifall bei Abgeordneten der CDU/CSU,data/txt/17207.txt,poi,
2682459,207,17,0,"Noch einige Worte zu den Anträgen, über die heute abgestimmt werden muss","Noch einige Worte zu den Anträgen, über die heute abgestimmt werden muss",noch-einige-worte-zu-den-antragen-uber-die-heute-abgestimmt-werden-muss,1779,"Für Ausgaben von 2,25 Milliarden Euro reichen der Linken eineinhalb Seiten. Wenn man die Mittel für die Schwerpunkte addiert, die nach Ihrer Meinung mehr Unterstützung benötigen, dann sieht man, dass 800 Millionen Euro gar nicht untersetzt sind, nach dem Motto: Das Ministerium wird die restlichen Gelder schon vernünftig einsetzen. - Meine Kollegen von den Linken, diese eineinhalb Seiten sprechen ganze Bände, wie seriös Sie mit der knappen Ressource Steuergeld umgehen.

Aber auch die nicht untersetzten Forderungen der SPD sind groß genug, dass man annehmen kann, dass sie ebenfalls nicht mit einer Regierungsbeteiligung rechnet.",data/txt/17207.txt,speech,
2682460,207,17,0,,,,1780,Beifall bei Abgeordneten der CDU/CSU,data/txt/17207.txt,poi,
2682461,207,17,0,"Noch einige Worte zu den Anträgen, über die heute abgestimmt werden muss","Noch einige Worte zu den Anträgen, über die heute abgestimmt werden muss",noch-einige-worte-zu-den-antragen-uber-die-heute-abgestimmt-werden-muss,1781,"Bleibt der Antrag der Grünen, der es zwar in sich hat, aber aufgrund der Zustimmung im Haushaltsausschuss in einem ganz anderen Licht erscheint. Der Antrag trifft auch den Nerv der Unionsabgeordneten, die als Fach-politiker von dem Beschluss im Haushaltsausschuss überrascht wurden. Ich habe die Initiative unterstützt, das 0,7-Prozent-Ziel verstärkt anzustreben.",data/txt/17207.txt,speech,
2682462,207,17,0,Dr. Bärbel Kofler [SPD],Dr. Bärbel Kofler,barbel-kofler,1782,Wie winden Sie sich jetzt da raus?,data/txt/17207.txt,poi,spd
2682463,207,17,0,"Noch einige Worte zu den Anträgen, über die heute abgestimmt werden muss","Noch einige Worte zu den Anträgen, über die heute abgestimmt werden muss",noch-einige-worte-zu-den-antragen-uber-die-heute-abgestimmt-werden-muss,1783,"Wir wollen nicht die Union , hat Ihr Vorsitzender auf dem Parteitag der Grünen unter Beifall gerufen,",data/txt/17207.txt,speech,
2682464,207,17,0,Dr. Christian Ruck [CDU/CSU],Dr. Christian Ruck,christian-ruck,1784,"Ja, das war ein Fehler!",data/txt/17207.txt,poi,cducsu
2682465,207,17,0,"Noch einige Worte zu den Anträgen, über die heute abgestimmt werden muss","Noch einige Worte zu den Anträgen, über die heute abgestimmt werden muss",noch-einige-worte-zu-den-antragen-uber-die-heute-abgestimmt-werden-muss,1785,"den Sie anschließend wiedergewählt haben. Was Sie heute wollen, ist aber, unser gemeinsames Ziel politisch auszunutzen. Ich mag mich aber nicht auf diesen klebrigen Fliegenfänger setzen.",data/txt/17207.txt,speech,
2682466,207,17,0,,,,1786,Beifall bei Abgeordneten der CDU/CSU,data/txt/17207.txt,poi,
2682467,207,17,0,Claudia Roth [Augsburg] [BÜNDNIS 90/DIE GRÜNEN],Claudia Roth,claudia-roth,1787,Aber ich habe das nicht gesagt!,data/txt/17207.txt,poi,gruene
2682468,207,17,0,"Noch einige Worte zu den Anträgen, über die heute abgestimmt werden muss","Noch einige Worte zu den Anträgen, über die heute abgestimmt werden muss",noch-einige-worte-zu-den-antragen-uber-die-heute-abgestimmt-werden-muss,1788,"Dass wir mit einem Anteil am Gesamthaushalt von 2 Prozent mit über 10 Prozent zum Sparen im Gesamthaushalt beitragen, macht uns nicht glücklich. Ich und meine Kollegen geben das Ziel nicht auf, für eine effiziente Entwicklungszusammenarbeit die dafür nötigen Mittel aufzubringen. Dabei wissen wir die Kanzlerin an unserer Seite. Für die nächsten Beratungen sind wir jedenfalls sensibilisiert.",data/txt/17207.txt,speech,
2682469,207,17,0,,,,1789,Beifall bei der CDU/CSU und der FDP,data/txt/17207.txt,poi,
2682470,207,17,0,"Noch einige Worte zu den Anträgen, über die heute abgestimmt werden muss","Noch einige Worte zu den Anträgen, über die heute abgestimmt werden muss",noch-einige-worte-zu-den-antragen-uber-die-heute-abgestimmt-werden-muss,1790,,data/txt/17207.txt,speech,
2682471,207,17,0,Vizepräsidentin Katrin Göring-Eckardt,Katrin Göring-Eckardt,katrin-goring-eckardt,1791,Für die Fraktion Die Linke hat das Wort der Kollege Niema Movassat.,data/txt/17207.txt,chair,
2682472,207,17,0,,,,1792,Beifall bei der LINKEN,data/txt/17207.txt,poi,
2682473,207,17,0,Vizepräsidentin Katrin Göring-Eckardt,Katrin Göring-Eckardt,katrin-goring-eckardt,1793,,data/txt/17207.txt,chair,
2682474,207,17,0,Niema Movassat (DIE LINKE),Niema Movassat,niema-movassat,1794,"Frau Präsidentin! Meine Damen und Herren! Herr Niebel, ich bin guter Dinge, dass dies heute der letzte entwicklungspolitische Haushalt unter Ihrer Verantwortung ist, den wir uns antun müssen. Ihre Bilanz als Entwicklungsminister ist verheerend.",data/txt/17207.txt,speech,linke
2682475,207,17,0,,,,1795,Beifall bei der LINKEN sowie bei Abgeordneten der SPD,data/txt/17207.txt,poi,
2682476,207,17,0,Otto Fricke [FDP],Otto Fricke,otto-fricke,1796,"Das ist falsch, Herr Kollege!",data/txt/17207.txt,poi,fdp
2682477,207,17,0,Niema Movassat (DIE LINKE),Niema Movassat,niema-movassat,1797,"Sie haben in Ihrem Koalitionsvertrag geschrieben, dass Sie 0,7 Prozent des Bruttonationaleinkommens für Entwicklungszusammenarbeit aufbringen wollen. Damit wollten Sie ein vor über 40 Jahren abgegebenes völkerrechtlich verbindliches Versprechen einlösen. Aber seit Ihrem Amtsantritt dümpelt die deutsche Entwicklungshilfequote bei mageren 0,4 Prozent oder weniger herum. Das zeigt, wie viel Ihnen Entwicklungszusammenarbeit praktisch wert ist: so gut wie nichts.",data/txt/17207.txt,speech,linke
2682478,207,17,0,,,,1798,Beifall bei der LINKEN,data/txt/17207.txt,poi,
2682479,207,17,0,Niema Movassat (DIE LINKE),Niema Movassat,niema-movassat,1799,"Um wie versprochen die 0,7 Prozent bis 2015 zu schaffen, bräuchten wir eine Steigerung des Entwicklungshaushalts von etwa 2 Milliarden Euro pro Jahr. Deshalb, Herr Selle, haben wir diesen Antrag hier eingebracht. Machbar ist das. Wer 33,3 Milliarden Euro für den Verteidigungshaushalt ausgibt wie diese Regierung, aber nur 6,3 Milliarden Euro für Entwicklung, setzt falsche Prioritäten. Mit einem Bruchteil des Geldes, das Sie für Rüstung und Krieg ausgeben, ließen sich Armut und Elend auf dieser Welt bekämpfen.",data/txt/17207.txt,speech,linke
2682480,207,17,0,,,,1800,Beifall bei der LINKEN,data/txt/17207.txt,poi,
2682481,207,17,0,Niema Movassat (DIE LINKE),Niema Movassat,niema-movassat,1801,"Nun soll das Volumen des Entwicklungshaushalts sogar noch schrumpfen. Das besonders Pikante ist, dass Sie diese Haushaltskürzungen laut Presseberichten Ihrem Parteikollegen Koppelin zu verdanken haben, der Sie damit offensichtlich schwächen möchte. Da stimmt dann wohl bei der FDP der Satz: Die Steigerung von Feind ist Parteifreund.",data/txt/17207.txt,speech,linke
2682482,207,17,0,,,,1802,Heiterkeit bei Abgeordneten der LINKEN,data/txt/17207.txt,poi,
2682483,207,17,0,Niema Movassat (DIE LINKE),Niema Movassat,niema-movassat,1803,"Eines Ihrer Ziele war die Fusion der staatlichen technischen Entwicklungszusammenarbeit. Sie haben dafür GTZ, DED und InWEnt zur GIZ, Gesellschaft für Internationale Zusammenarbeit, zusammengefügt. Damit sollte die Entwicklungsarbeit effektiver werden. Die Idee war gut, die Realität ist ein Trauerspiel. Viele Beschäftigte sind frustriert. Laut der jüngsten Mitarbeiterbefragung ist fast die Hälfte der GIZ-Belegschaft mit dem Fusionsprozess und der Arbeit des Vorstands unzufrieden. Da Sie, Herr Niebel, das Projekt immer als Chefsache behandelt haben, ist das auch für Sie ein vernichtendes Urteil.",data/txt/17207.txt,speech,linke
2682484,207,17,0,,,,1804,Beifall bei der LINKEN,data/txt/17207.txt,poi,
2682485,207,17,0,Niema Movassat (DIE LINKE),Niema Movassat,niema-movassat,1805,"Verheerend ist auch die politische Umorientierung, die Sie in der GIZ vorantreiben. Sie bauen das Unternehmen zu einem weltweiten Dienstleistungsunternehmen für Aufgaben aller Art um. Die Kernaufgabe der Entwicklungspolitik, die Armutsreduzierung, fällt dabei hinten runter. Im neuen Leitbild der GIZ steht dazu kein Wort mehr.

Während für uns im globalen Norden eine ausreichende Ernährung, fließend Wasser und Strom meist selbstverständlich sind, kämpfen unzählige Menschen im Süden täglich ums nackte Überleben. 1,4 Milliarden Menschen weltweit leben in extremer Armut. Die Teller bleiben leer, Schulen sind unerreichbar, sauberes Wasser ist Luxusgut. Angesichts dessen ist Armutsbekämpfung wichtiger denn je.",data/txt/17207.txt,speech,linke
2682486,207,17,0,,,,1806,Beifall bei der LINKEN,data/txt/17207.txt,poi,
2682487,207,17,0,Niema Movassat (DIE LINKE),Niema Movassat,niema-movassat,1807,"Stattdessen bietet die GIZ Dienstleistungen an, die mit Menschenrechten und Entwicklungszusammenarbeit nichts zu tun haben. So bildet die GIZ saudische Grenzpolizisten aus. Ich frage Sie, Herr Niebel: Ist Saudi-Arabien, in dem Frauen gesteinigt, Menschen zur Bestrafung Gliedmaßen abgehackt werden, ein Beispiel für Menschenrechte und Rechtsstaatlichkeit? Wir als Linke sagen klar Nein.",data/txt/17207.txt,speech,linke
2682488,207,17,0,,,,1808,Beifall bei der LINKEN,data/txt/17207.txt,poi,
2682489,207,17,0,Dr. Christian Ruck [CDU/CSU],Dr. Christian Ruck,christian-ruck,1809,Sie zahlen dafür!,data/txt/17207.txt,poi,cducsu
2682490,207,17,0,Niema Movassat (DIE LINKE),Niema Movassat,niema-movassat,1810,"Für Sie ist Entwicklungspolitik nichts anderes als Außenwirtschaftsförderung im Interesse deutscher Unternehmen. Diese profitieren von Ihrem Kurs, nicht kleine und mittelständische Unternehmen in den Ländern des Südens.",data/txt/17207.txt,speech,linke
2682491,207,17,0,,,,1811,Beifall bei Abgeordneten der LINKEN,data/txt/17207.txt,poi,
2682492,207,17,0,Niema Movassat (DIE LINKE),Niema Movassat,niema-movassat,1812,"Dazu passen auch Ihre Renditeerwartungen. Vor kurzem sprachen Sie im Entwicklungsausschuss davon, dass jeder Euro in der Entwicklungszusammenarbeit zu einer Erhöhung des deutschen Exports um 3 bis 4 Euro führt. Aus 1 Euro mach 4 Euro, 300 Prozent Rendite: Da erblasst ja selbst ein Herr Ackermann vor Neid.",data/txt/17207.txt,speech,linke
2682493,207,17,0,,,,1813,Heiterkeit und Beifall bei der LINKEN,data/txt/17207.txt,poi,
2682494,207,17,0,Niema Movassat (DIE LINKE),Niema Movassat,niema-movassat,1814,"Herr Niebel, Ihnen fällt Ihr eigener ideologischer Widerspruch nicht einmal mehr auf. Ich dachte, Liberale lehnen Subventionen für Unternehmen ab.

Nun bauen Sie zum Beispiel mit öffentlich-privaten Partnerschaften das Entwicklungsministerium zu einem Förderinstitut für deutsche Unternehmen um. Mit liberaler Lehre hat das nichts zu tun.",data/txt/17207.txt,speech,linke
2682495,207,17,0,,,,1815,Beifall bei der LINKEN,data/txt/17207.txt,poi,
2682496,207,17,0,Niema Movassat (DIE LINKE),Niema Movassat,niema-movassat,1816,"Aber all das ist letztlich nur die Spitze des Eisbergs. Wir brauchen eine grundlegend andere entwicklungs-politische Strategie. Die globale soziale Ungerechtigkeit muss beendet werden.

Heute besitzen weltweit 63 000 Menschen ein Vermögen von 40 Billionen Dollar. Das ist mehr als die Hälfte des jährlichen Bruttoinlandsprodukts aller Staaten auf der Welt zusammengenommen. 63 000 Menschen - das sind gerade einmal 0,00009 Prozent der Weltbevölkerung.",data/txt/17207.txt,speech,linke
2682497,207,17,0,Georg Schirmbeck [CDU/CSU],Georg Schirmbeck,georg-schirmbeck,1817,Haben Sie sich vielleicht um zwei Nullen vertan?,data/txt/17207.txt,poi,cducsu
2682498,207,17,0,Niema Movassat (DIE LINKE),Niema Movassat,niema-movassat,1818,"Gleichzeitig hat die Hälfte der Menschheit keinerlei Vermögen. Gleichzeitig verhungert alle fünf Sekunden ein Kind. Überall auf der Welt sterben Menschen an Hunger, ob in Guatemala, Kongo oder Indien.

Auf der einen Seite gibt es grenzenlosen Reichtum, auf der anderen Seite ungeheure Armut. Bei einer gerechten Verteilung des weltweiten Reichtums müsste heute niemand mehr an Hunger und Armut sterben.",data/txt/17207.txt,speech,linke
2682499,207,17,0,,,,1819,Beifall bei der LINKEN,data/txt/17207.txt,poi,
2682500,207,17,0,Niema Movassat (DIE LINKE),Niema Movassat,niema-movassat,1820,"Deshalb müssen wir umverteilen - in Deutschland und weltweit. Das wäre tatsächliche Entwicklungspolitik.

Danke für die Aufmerksamkeit.",data/txt/17207.txt,speech,linke
2682501,207,17,0,,,,1821,Beifall bei der LINKEN,data/txt/17207.txt,poi,
2682502,207,17,0,Niema Movassat (DIE LINKE),Niema Movassat,niema-movassat,1822,,data/txt/17207.txt,speech,linke
2682503,207,17,0,Vizepräsidentin Katrin Göring-Eckardt,Katrin Göring-Eckardt,katrin-goring-eckardt,1823,Thilo Hoppe hat jetzt das Wort für die Fraktion Bündnis 90/Die Grünen.,data/txt/17207.txt,chair,
