id,sitzung,wahlperiode,in_writing,speaker,speaker_cleaned,speaker_fp,sequence,text,filename,type,speaker_party
2705613,218,17,0,Heidemarie Wieczorek-Zeul (SPD),Heidemarie Wieczorek-Zeul,heidemarie-wieczorek-zeul,342,"Währenddessen hat die Bundesregierung, wie so häufig, nur geredet.

Worum geht es, und was ist für die Zukunft notwendig? Es geht darum, die ECOWAS-Mission, also die Mission der Gemeinschaft der westafrikanischen Staaten, zu unterstützen, auch durch Deutschland - dazu bedarf es eines Mandats -, und dazu beizutragen, dass diese Regionalorganisation, die in ihrem Bereich bisher gute Arbeit geleistet hat, zu einem regionalen kollektiven Sicherheitssystem weiterentwickelt wird, um die transnationalen Konflikte gemeinsam, grenzüberschreitend einhegen zu können.

Ferner geht es um die Unterstützung der heute vom malischen Parlament abgesegneten Roadmap, also des Plans für die Perspektiven. Die Roadmap hat das Ziel, die nationale Integrität des Landes zu sichern bzw. wiederherzustellen. Dazu gehört laut Beschluss - laut der Roadmap - vor allem der Dialog zur nationalen Versöhnung mit den Gruppen, die dazu bereit sind. Zu diesem Zweck ist eine Kommission des nationalen Dialogs einzurichten. Das ist für Februar 2013 vorgesehen. Das Ziel muss endlich eine stärkere Dezentralisierung sein. Die Forderung der Tuareg nach stärkerer Beachtung und Selbstbestimmung muss ernst genommen und darf nicht missachtet werden.

Die Bundesregierung und die internationale Gemeinschaft müssen sich auch fragen: Welche Rolle spielt eigentlich Saudi-Arabien in dieser Region,",data/txt/17218.txt,speech,spd
2705614,218,17,0,,,,343,Beifall bei der SPD und dem BÜNDNIS 90/DIE GRÜNEN,data/txt/17218.txt,poi,
2705615,218,17,0,Heidemarie Wieczorek-Zeul (SPD),Heidemarie Wieczorek-Zeul,heidemarie-wieczorek-zeul,344,"das grenzüberschreitend den Wahhabismus fördert? Es ist nicht sehr kohärent von der internationalen Gemeinschaft und der Bundesregierung, Saudi-Arabien Waffen und Panzer zu liefern",data/txt/17218.txt,speech,spd
2705616,218,17,0,,,,345,Beifall der Abg. Dr. Sascha Raabe [SPD] und Wolfgang Gehrcke [DIE LINKE],data/txt/17218.txt,poi,
2705617,218,17,0,Heidemarie Wieczorek-Zeul (SPD),Heidemarie Wieczorek-Zeul,heidemarie-wieczorek-zeul,346,"und sich auf der anderen Seite, in Bezug auf Mali, über die Auswirkungen zu beklagen.

Die Verhältnisse im Süden müssen parallel zum Militäreinsatz geklärt werden. Es geht um die Wiederherstellung von Rechtsstaatlichkeit und die Vorbereitung von Wahlen. Natürlich geht es auch um Anschub für die Wirtschaft; denn die jungen Leute, die in Mali, auch im Süden, auf die Straße gehen, brauchen Perspektiven und Chancen. Dazu sollte auch die Entwicklungszusammenarbeit Deutschlands eingesetzt werden.

Vor allem geht es natürlich um Hilfen für die geflüchtete Bevölkerung. Allein aus dem Norden Malis sind 400 000 Menschen geflüchtet.",data/txt/17218.txt,speech,spd
2705618,218,17,0,Vizepräsidentin Katrin Göring-Eckardt,Katrin Göring-Eckardt,katrin-goring-eckardt,347,"Frau Kollegin, Ihre Redezeit ist zu Ende.",data/txt/17218.txt,chair,
2705619,218,17,0,Heidemarie Wieczorek-Zeul (SPD),Heidemarie Wieczorek-Zeul,heidemarie-wieczorek-zeul,348,"Frau Präsidentin, ich sehe es. Dies ist mein letzter Satz. - Die humanitären Hilfsorganisationen müssen unterstützt werden. Sie müssen unabhängig handeln können, wie das heute auch die Ärzte ohne Grenzen gefordert haben.

Vielen Dank.",data/txt/17218.txt,speech,spd
2705620,218,17,0,,,,349,Beifall bei der SPD und dem BÜNDNIS 90/DIE GRÜNEN,data/txt/17218.txt,poi,
2705621,218,17,0,Heidemarie Wieczorek-Zeul (SPD),Heidemarie Wieczorek-Zeul,heidemarie-wieczorek-zeul,350,,data/txt/17218.txt,speech,spd
2705622,218,17,0,Vizepräsidentin Katrin Göring-Eckardt,Katrin Göring-Eckardt,katrin-goring-eckardt,351,Für die CDU/CSU-Fraktion hat der Kollege Dr. Andreas Schockenhoff das Wort.,data/txt/17218.txt,chair,
2705623,218,17,0,,,,352,Beifall bei der CDU/CSU und der FDP,data/txt/17218.txt,poi,
2705624,218,17,0,Vizepräsidentin Katrin Göring-Eckardt,Katrin Göring-Eckardt,katrin-goring-eckardt,353,,data/txt/17218.txt,chair,
2705625,218,17,0,Dr. Andreas Schockenhoff (CDU/CSU),Dr. Andreas Schockenhoff,andreas-schockenhoff,354,"Frau Präsidentin! Liebe Kolleginnen und Kollegen! Deutschland hat ein vitales Interesse daran, dass der Südrand der Sahara nicht zu einem sicheren Rückzugsgebiet für Terroristen wird. Die CDU/CSU-Bundestagsfraktion begrüßt daher den französischen Einsatz gegen islamistische Extremisten in Mali. Es war richtig, zügig gegen den Vormarsch der islamistischen Kämpfer in den Süden Malis vorzugehen. Nur wenn die militanten Islamisten aufgehalten werden können, kann überhaupt wieder ein politischer Prozess in Mali in Gang kommen. Ein erfolgreicher Vormarsch dieser Kräfte in den Süden hätte ihrem Terror in ganz Mali und darüber hinaus in der ganzen Region Vorschub geleistet.

Die Sicherheit Europas ist schon jetzt durch den Zerfall der staatlichen Ordnung im Norden Malis und der Sahara betroffen. Das Geiseldrama an der algerisch-libyschen Grenze zeigt, dass eine Sicherheitsbedrohung für den gesamten Sahelraum und für europäische Bürger in der Region besteht. Zudem begünstigt die wachsende organisierte Kriminalität Drogen- und Menschenhandel in Richtung Europa.

In den Resolutionen 2071 und 2085 hat der UN-Sicherheitsrat festgestellt, dass die Lage in Mali den Weltfrieden und die internationale Sicherheit bedroht. Er hat daher Zwangsmaßnahmen nach Kapitel VII der VN-Charta autorisiert. Das französische Eingreifen erfolgte auf Bitten der malischen Regierung und wird von der Bevölkerung als Befreiung vom radikal-islamistischen Joch einhellig begrüßt. Frankreich verteidigt in Mali also keineswegs ausschließlich französische, sondern afrikanische und europäische Interessen. Wir danken den französischen Soldatinnen und Soldaten, die im Interesse der Sicherheit Europas in diesen gefährlichen Kampfeinsatz gegangen sind und ihr Leben riskieren.",data/txt/17218.txt,speech,cducsu
2705626,218,17,0,,,,355,Beifall des Abg. Dr. Franz Josef Jung [CDU/CSU],data/txt/17218.txt,poi,
2705627,218,17,0,Dr. Andreas Schockenhoff (CDU/CSU),Dr. Andreas Schockenhoff,andreas-schockenhoff,356,"Es ist richtig, dass die Bundesregierung den französischen Einsatz gegen islamistische Extremisten in Mali zumindest logistisch unterstützt. Bundespräsident Gauck hat es auf den Punkt gebracht - ich zitiere -:

[Wir] dürfen  bei aller berechtigten Debatte über Art und Umfang unseres Engagements nicht aus den Augen verlieren, was verteidigt werden soll: ein friedliches und sicheres Europa, ein Ort der Freiheit und der Herrschaft des Rechts. Es liegt im nationalen Interesse, unsere Sicherheit, unseren Wohlstand und unseren Frieden supranational zu sichern. Dafür braucht es Solidarität  nicht nur im Geiste, sondern auch Gemeinsamkeit im Handeln.

So weit der Bundespräsident.

Langfristig muss die malische Regierung in die Lage versetzt werden, die Nordhälfte des Landes eigenständig zu kontrollieren. Die EU muss deshalb zügig ihre bereits geplante Mission zur Ausbildung und Befähigung der malischen Streitkräfte beginnen. Die CDU/CSU unterstützt eine deutsche Beteiligung an der EU-Ausbildungsmission.

Es ist folgerichtig, dass die Bundesregierung auch Ausrüstungshilfe leisten will. Allerdings muss ein politischer Prozess in Mali gewährleisten, dass ein von der EU ertüchtigtes Militär demokratisch zivil kontrolliert wird. Eine schnelle Rückkehr zur verfassungsmäßigen Ordnung in Mali, einschließlich Wahlen, sowie ein Dialog mit verhandlungsbereiten Gruppierungen im Norden sind daher dringlich. Bis malische Streitkräfte ihre Stabilisierungsaufgabe erfüllen können, sind die Nachbarländer Malis gefragt, den Norden Malis militärisch zu kontrollieren und eine Rückkehr der militanten Islamisten zu verhindern. Präsident Hollande hat dies gestern ebenfalls gefordert. Wir begrüßen daher die Entscheidung der westafrikanischen Wirtschaftsgemeinschaft, die geplante Stabilisierungsgruppe weiter zu verstärken.

Im Februar werden wir über die deutsche Beteiligung an der Ausbildungsmission in Mali entscheiden. Morgen entscheiden wir über die Verlängerung des ISAF-Mandats. Vor Weihnachten haben wir die Stationierung von Patriot-Abwehrsystemen an der türkisch-syrischen Grenze beschlossen. Wir beschließen hier im Bundestag - es ist längst schon Routine - regelmäßig die Verlängerung von Mandaten.

Die kurze Abfolge unserer Mandatsdebatten zeigt, wie wichtig eine regelmäßige sicherheitspolitische Debatte ist. Die sicherheitspolitischen Herausforderungen und Fragen unserer Zeit sind von einer solchen Vielfalt und Komplexität geprägt, dass sie einer verstärkten Aufmerksamkeit des Deutschen Bundestages bedürfen.",data/txt/17218.txt,speech,cducsu
2705628,218,17,0,,,,357,Beifall bei Abgeordneten der CDU/CSU,data/txt/17218.txt,poi,
2705629,218,17,0,Dr. Andreas Schockenhoff (CDU/CSU),Dr. Andreas Schockenhoff,andreas-schockenhoff,358,"Wir halten daher die Einführung einer regelmäßigen Generaldebatte zur sicherheitspolitischen Lage Deutschlands für notwendig, um unsere Sicherheitsinteressen einer breiteren deutschen Öffentlichkeit zu vermitteln und Fragen und Sorgen der Bevölkerung besser aufgreifen zu können. Das sollten wir unabhängig von Mali auch einmal ganz offen miteinander diskutieren.

Vielen Dank für Ihre Aufmerksamkeit.",data/txt/17218.txt,speech,cducsu
2705630,218,17,0,,,,359,Beifall bei der CDU/CSU und der FDP,data/txt/17218.txt,poi,
2705631,218,17,0,Dr. Andreas Schockenhoff (CDU/CSU),Dr. Andreas Schockenhoff,andreas-schockenhoff,360,,data/txt/17218.txt,speech,cducsu
2705632,218,17,0,Vizepräsidentin Katrin Göring-Eckardt,Katrin Göring-Eckardt,katrin-goring-eckardt,361,Der Kollege Wolfgang Gehrcke hat für die Fraktion Die Linke das Wort.,data/txt/17218.txt,chair,
2705633,218,17,0,,,,362,Beifall bei der LINKEN,data/txt/17218.txt,poi,
2705634,218,17,0,Vizepräsidentin Katrin Göring-Eckardt,Katrin Göring-Eckardt,katrin-goring-eckardt,363,,data/txt/17218.txt,chair,
2705635,218,17,0,Wolfgang Gehrcke (DIE LINKE),Wolfgang Gehrcke,wolfgang-gehrcke,364,"Herzlichen Dank, Frau Präsidentin. - Werte Kolleginnen und Kollegen! Gerade nach der Aufzählung des Kollegen Schockenhoff - von der türkisch-syrischen Grenze über Afghanistan bis in verschiedenste Teile der Welt - sollten wir uns hier auch gegenseitig vor einer Illusion bewahren, nämlich dass Militärinterventionen Stabilität und Demokratie sichern können. Oftmals ist genau das Gegenteil der Fall.",data/txt/17218.txt,speech,linke
2705636,218,17,0,,,,365,Beifall bei der LINKEN,data/txt/17218.txt,poi,
2705637,218,17,0,Wolfgang Gehrcke (DIE LINKE),Wolfgang Gehrcke,wolfgang-gehrcke,366,"Ich möchte auch, dass wir uns vor einer weiteren Illusion bewahren: Es gibt keine sauberen Kriege, auch in Mali nicht. Ich finde die Bilder von der Herrschaft der Terroristen - darüber wird zu reden sein - entsetzlich. Ich finde aber die Bilder vom Einmarsch der Armee, die man sieht, ebenso entsetzlich. Es gibt keine sauberen Kriege. Kriege sind immer Dreck und Blut und Vernichtung. Auch das sollte man in dieser Situation hier einmal aussprechen.",data/txt/17218.txt,speech,linke
2705638,218,17,0,,,,367,Beifall bei der LINKEN,data/txt/17218.txt,poi,
2705639,218,17,0,Wolfgang Gehrcke (DIE LINKE),Wolfgang Gehrcke,wolfgang-gehrcke,368,"Was man jetzt als Deutscher Bundestag empfehlen sollte und worüber wir uns, glaube ich, viel mehr den Kopf zerbrechen müssen, ist: Es muss jetzt zu politischen Gesprächen und politischen Lösungen kommen. Das steht jetzt im Vordergrund.

Wenn wir davon geredet haben, dass man die Situation nicht nur in Mali, sondern auf dem gesamten afrikanischen Kontinent ernst nehmen muss, so gehört auch die Selbstkritik dazu, dass wir offensichtlich über lange Zeit die Situation nicht ernst genommen haben und dass immer erst gehandelt wird, wenn das Kind in den Brunnen gefallen ist, und dann mit dem Militär.

Ich möchte eine weitere Lehre dazupacken: Frieden schließt man mit seinen Feinden. Über zehn Jahre hat es gedauert, bis man begriffen hat, dass man in Afghanistan mit den Taliban verhandeln muss. Was wäre aus Südafrika geworden, wenn man nicht mit seinen Feinden Frieden geschlossen hätte? Frieden schließt man mit seinen Feinden. Deswegen muss man jetzt auch in Mali die Initiative ergreifen, um mit den Feinden in Verhandlungen zu Lösungen zu kommen.",data/txt/17218.txt,speech,linke
2705640,218,17,0,,,,369,Beifall bei der LINKEN,data/txt/17218.txt,poi,
2705641,218,17,0,Zuruf von der CDU/CSU,von der CDU/CSU,von-der-cdu-csu,370,Dummes Zeug!,data/txt/17218.txt,poi,cducsu
2705642,218,17,0,Wolfgang Gehrcke (DIE LINKE),Wolfgang Gehrcke,wolfgang-gehrcke,371,"Eine nationale Aussöhnung wäre das Beste, was wir in Gang bringen könnten.

Mit einem weiteren Gedanken möchte ich an die Überlegung anknüpfen, dass Mali eine entwickelte Zivilgesellschaft hat. Ich teile völlig, was Sie hierzu ausgeführt haben, Kollegin Wieczorek-Zeul. Mali hat eine entwickelte Zivilgesellschaft. Es muss doch das Ziel sein, mit dieser entwickelten Zivilgesellschaft auch in solchen Situationen zu kooperieren und genau diese entwickelte Zivilgesellschaft zu stabilisieren; denn wir brauchen Sicherheit für die Bevölkerung.

Wir müssen auch eine Frage beantworten. In Mali werden Dschihadisten mit Bomben bzw. vom Militär angegriffen. Die gleichen Dschihadisten werden in Syrien von den Verbündeten der Bundesregierung, von Saudi-Arabien und anderen, mit Geld und Waffen versorgt. Erklären Sie einmal, warum Sie hier so handeln und dort so handeln!",data/txt/17218.txt,speech,linke
2705643,218,17,0,,,,372,Beifall bei der LINKEN,data/txt/17218.txt,poi,
2705644,218,17,0,Wolfgang Gehrcke (DIE LINKE),Wolfgang Gehrcke,wolfgang-gehrcke,373,"Eine vernünftige Politik muss doch anders laufen. Ich glaube, es ist richtig, dass nicht alles, was in Mali passiert ist, eine Reaktion auf das Vorgehen gegen den libyschen Staat ist. Aber die Zerschlagung von Libyen, die Destabilisierung von Libyen hat auch Auswirkungen auf die Situation in Mali gehabt. Beantworten Sie doch einmal die Frage: Wenn die Terroristen, die dort geschlagen werden, gehen, wenn sie nach Mauretanien, an die Grenze zu Algerien gehen, wird mit dem Krieg gegen den Terror ein Konfliktfeld in das nächste Konfliktfeld übergeführt. Das kann doch keine vernünftige politische Lösung sein. Wir müssen endlich eine Politik entwickeln, die den Terror dadurch schlägt, dass man ihm die Grundlage entzieht, und das heißt Schaffung kultureller Vielfalt und wirtschaftlichen Ausgleichs. So müsste eine vernünftige Politik sein.",data/txt/17218.txt,speech,linke
2705645,218,17,0,,,,374,Beifall bei der LINKEN,data/txt/17218.txt,poi,
2705646,218,17,0,Wolfgang Gehrcke (DIE LINKE),Wolfgang Gehrcke,wolfgang-gehrcke,375,"Ich möchte ganz ehrlich und offen sagen: Mir geht es auf den Keks, wenn die Freundschaft mit Frankreich - die ich sicherlich viel mehr verinnerlicht habe als viele von Ihnen - benutzt wird, um Druck auf die Bundes-regierung auszuüben - sie taucht ja schon ab -, mit noch mehr Militär an der Seite Frankreichs zu agieren. Das gleiche Argument, die Freundschaft mit  - in der Vergangenheit war es die Freundschaft mit den USA -, hat uns in den Krieg in Afghanistan getrieben. Ich möchte nicht, dass Deutschland mit dem Argument der Freundschaft mit Frankreich in eine andere militärische Auseinandersetzung getrieben wird;",data/txt/17218.txt,speech,linke
2705647,218,17,0,,,,376,Beifall bei der LINKEN,data/txt/17218.txt,poi,
2705648,218,17,0,Wolfgang Gehrcke (DIE LINKE),Wolfgang Gehrcke,wolfgang-gehrcke,377,"so sieht es übrigens auch die Friedensbewegung in Frankreich, mit der ich sehr eng kooperiere. Auch die Friedensbewegung in Frankreich sagt: Wir wollen, dass die französischen Truppen rasch zurückgezogen werden. - Das sollten wir unterstützen. Es ist möglich, sie rasch zurückzuziehen.

Ich will Ihnen ehrlich sagen, Herr Minister: Sie werden nicht darum herumkommen, die Entscheidung, zwei Transall-Maschinen ohne Mandat des Bundestages zur Verfügung zu stellen - morgen werden es ja vielleicht schon drei oder mehr sein -, zu rechtfertigen. Das war eine rechtswidrige Entscheidung, die dieses Parlament nicht hinnehmen kann;",data/txt/17218.txt,speech,linke
2705649,218,17,0,,,,378,Beifall bei der LINKEN,data/txt/17218.txt,poi,
2705650,218,17,0,Wolfgang Gehrcke (DIE LINKE),Wolfgang Gehrcke,wolfgang-gehrcke,379,"darüber werden wir uns auseinandersetzen müssen. Sie könnten ja das Mandat, das Sie für die Ausbildungsmission haben wollen, damit verbinden, dass Sie nachträglich ein Mandat für diese Entscheidung beantragen. Dann würden Sie zumindest eingestehen, dass Sie falsch gehandelt haben. Aber so viel Courage hat diese Regierung nicht, weder so noch so.

Ich möchte abschließend einen Gedanken äußern, der mir wichtig ist - das ist, verehrte Frau Präsidentin, mein Schlussgedanke -: Ist es so unnormal, sich die Frage zu stellen: Geht es Frankreich und anderen Ländern wirklich um Menschenrechte - was ich ja hoffe -, oder geht es ihnen in Nachfolge der alten Kolonialmacht nicht vielmehr um wirtschaftliche Interessen,",data/txt/17218.txt,speech,linke
2705651,218,17,0,Zurufe von der CDU/CSU,e von der CDU/CSU,e-cdu-csu,380,Oh! Oh!,data/txt/17218.txt,poi,cducsu
2705652,218,17,0,,,,381,So ein Quatsch!,data/txt/17218.txt,poi,
2705653,218,17,0,,,,382,Nicht das schon wieder!,data/txt/17218.txt,poi,
2705654,218,17,0,Wolfgang Gehrcke (DIE LINKE),Wolfgang Gehrcke,wolfgang-gehrcke,383,um Uran und anderes?,data/txt/17218.txt,speech,linke
2705655,218,17,0,Vizepräsidentin Katrin Göring-Eckardt,Katrin Göring-Eckardt,katrin-goring-eckardt,384,Herr Kollege?,data/txt/17218.txt,chair,
2705656,218,17,0,Wolfgang Gehrcke (DIE LINKE),Wolfgang Gehrcke,wolfgang-gehrcke,385,"Ich komme zum Schluss. - Wenden Sie es doch einmal positiv: Wenn im Kampf um Uran eine Stärkung der Menschenrechte herauskommt, reicht mir das nicht aus, aber immerhin. Es geht auch hier um wirtschaftliche Interessen; Sie kommen nicht darum herum, das einzugestehen.

Danke sehr.",data/txt/17218.txt,speech,linke
2705657,218,17,0,,,,386,Beifall bei der LINKEN,data/txt/17218.txt,poi,
2705658,218,17,0,Wolfgang Gehrcke (DIE LINKE),Wolfgang Gehrcke,wolfgang-gehrcke,387,,data/txt/17218.txt,speech,linke
2705659,218,17,0,Vizepräsidentin Katrin Göring-Eckardt,Katrin Göring-Eckardt,katrin-goring-eckardt,388,Jetzt hat Kerstin Müller das Wort für Bündnis 90/Die Grünen.,data/txt/17218.txt,chair,
2705660,218,17,0,Kerstin Müller (Köln) (BÜNDNIS 90/DIE GRÜNEN),Kerstin Müller,kerstin-muller,389,"Frau Präsidentin! Liebe Kolleginnen und Kollegen! Bereits vor einem Jahr, als Islamisten und verbündete Tuareg den Norden Malis an sich rissen, war es eigentlich für jeden, auch für uns, sichtbar: Mali steckt in einer schweren Krise. In unserer Nachbarschaft, in Afrika, droht ein weiterer failed state mit neuen Rückzugsräumen für islamistische Terroristen - Sie alle haben das bereits erwähnt -, die die Region mit Terror überziehen und im Norden des Landes einen menschenverachtenden Scharia-Staat installieren wollten und wollen.

Aber erst jetzt, ein ganzes Jahr später - das, finde ich, gehört zur Selbstkritik dazu -, diskutieren wir, und zwar aufgrund der bereits laufenden französischen Intervention, darüber, was zu tun ist. Das zeigt erst einmal - Herr Stinner, Sie haben es, wenn ich richtig zugehört habe, erwähnt -, dass die internationale Gemeinschaft sehr, sehr spät dran ist und erst dann als Feuerwehr kommt, wenn das Haus bereits lichterloh brennt. Das, liebe Kolleginnen und Kollegen, ist falsch und muss sich ändern. Das trifft übrigens nicht nur auf die Europäische Union, sondern auch auf diese Bundesregierung zu. Auch Sie haben nicht früher gehandelt.",data/txt/17218.txt,speech,gruene
2705661,218,17,0,,,,390,Beifall beim BÜNDNIS 90/DIE GRÜNEN sowie bei Abgeordneten der SPD,data/txt/17218.txt,poi,
2705662,218,17,0,Kerstin Müller (Köln) (BÜNDNIS 90/DIE GRÜNEN),Kerstin Müller,kerstin-muller,391,"Ich erwähne das, weil wir morgen die entsprechende Debatte führen.

Wir Grüne haben bereits im September letzten Jahres in einem Antrag auf die Entwicklung in Mali hingewiesen. Der Unterausschuss Zivile Krisenprävention und vernetzte Sicherheit hat über dieses Thema bereits vor einem Dreivierteljahr intensiv diskutiert. Wir haben gefordert, rechtzeitig vor Ausbruch einer Krise präventiv tätig zu werden. Davon wollte man aber nichts wissen. Wichtiger waren damals andere Krisenherde; es gibt ja viele. Ich hoffe auf eine rege Beteiligung an der morgigen Debatte, in der es um die langfristigen und nachhaltigen Strategien für diese Region geht.",data/txt/17218.txt,speech,gruene
2705663,218,17,0,,,,392,Beifall beim BÜNDNIS 90/DIE GRÜNEN sowie bei Abgeordneten der SPD,data/txt/17218.txt,poi,
2705664,218,17,0,Kerstin Müller (Köln) (BÜNDNIS 90/DIE GRÜNEN),Kerstin Müller,kerstin-muller,393,"Für meine Fraktion sage ich: Vor dem Hintergrund der Geschehnisse war die französische Intervention eine erforderliche Notoperation, weil die Islamisten bereits auf die Hauptstadt Bamako zumarschierten. Aber ich sage auch: Sie bleibt hochriskant. Auch die Franzosen wissen: Eine Intervention der Franzosen in dieser Region kann auf die Dschihadisten in aller Welt wie ein Brandbeschleuniger wirken. Deshalb ist es nicht nur im französischen, sondern auch im europäischen Interesse, dass diese Intervention ganz schnell erstens multilateral eingebettet wird und zweitens ein afrikanisches Gesicht erhält. Ich halte das für zentral. Insofern sind die drei Transall-Maschinen, mit denen wir Unterstützung leisten, das Mindeste, was man machen muss, um die -ECOWAS langfristig in den Stand zu setzen, hier zu übernehmen.

Es muss generell darum gehen, die Afrikaner so zu stärken, dass sie künftig selbst in der Lage sind, solche Krisen zu meistern. Wir sprechen seit einiger Zeit von African Ownership. Leider ist da nicht viel passiert. Ich erinnere mich an Gespräche mit Vertretern der -ECOWAS - nicht erst jetzt, sondern schon im letzten und vorletzten Jahr -, in denen sie immer wieder beklagt haben: Warum werden wir nicht vernünftig ausgebildet? Warum bekommen wir von der Europäischen Union und auch von Deutschland nicht mehr Unterstützung?

Herr Westerwelle, ich hatte kürzlich ein Gespräch mit dem Chef des KAIPTC, des Kofi Annan International Peacekeeping Training Centre. Dieses Peacekeeping Training Centre wurde ursprünglich mit deutschen Mitteln aufgebaut. Sie haben vor kurzem die Mittel für dieses Peacekeeping Training Centre gekürzt. Dort werden aber Soldaten ausgebildet für die ECOWAS.

Wenn wir wollen, dass es langfristig nicht mehr nur eine französische Afrikapolitik gibt, sondern eine europäische, dann muss diese Afrikapolitik auch afrikanisch werden, dann müssen wir alles tun, damit die ECOWAS, die Afrikanische Union und die anderen Regionalorganisationen in die Lage versetzt werden, eine Sicherheits-architektur aufzubauen.",data/txt/17218.txt,speech,gruene
2705665,218,17,0,,,,394,Beifall beim BÜNDNIS 90/DIE GRÜNEN sowie bei Abgeordneten der SPD,data/txt/17218.txt,poi,
2705666,218,17,0,Kerstin Müller (Köln) (BÜNDNIS 90/DIE GRÜNEN),Kerstin Müller,kerstin-muller,395,"Wir müssen nicht nur Sicherheit aufbauen, wir brauchen auch nachhaltige politische Stabilität, und zwar nicht nur für Mali, sondern für die ganze Sahelregion. Die geplante EU-Ausbildungsmission ist richtig. Voraussetzung ist aber, dass es auch einen politischen Prozess gibt. Die Ausbildungsmission allein wird die Region nicht stabilisieren. Insofern ist zu begrüßen, dass jetzt eine Roadmap vorgelegt wird.

Ich glaube - damit will ich mich noch einmal an das Entwicklungsministerium wenden -, dass es wichtig ist, jetzt, wo es eine Übergangsregierung gibt, die Mittel schnell zu deblockieren, damit Staatlichkeit aufgebaut werden kann. Es geht dabei nicht nur um humanitäre Hilfe, sondern es geht um wesentlich mehr. Die Franzosen haben zu Recht gesagt, sie wollen nicht bleiben, und das ist auch richtig. Aber wenn Mali übernehmen will, dann braucht es richtige, nachhaltige staatliche Strukturen, und dafür braucht Mali finanzielle Mittel.",data/txt/17218.txt,speech,gruene
2705667,218,17,0,,,,396,Beifall beim BÜNDNIS 90/DIE GRÜNEN sowie bei Abgeordneten der SPD,data/txt/17218.txt,poi,
2705668,218,17,0,Kerstin Müller (Köln) (BÜNDNIS 90/DIE GRÜNEN),Kerstin Müller,kerstin-muller,397,"Ich will zuletzt noch ansprechen, dass ich absolut wichtig finde, dass im Zentrum der Ausbildung die Menschenrechte und das humanitäre Völkerrecht stehen. Es sind Racheakte und auch Gewalt zu befürchten; man liest ja schon von dem einen oder anderen Racheakt. Das könnte die ethnische Spaltung in Mali noch vertiefen. Es braucht genau das Gegenteil: einen organisierten politischen Dialogprozess, auch mit den Tuareg, die immer noch einer Lösung ihres politischen Problems harren.

Es gibt da einen zaghaften Ansatz mit den sehr ehrenwerten GIZ-Mitarbeitern. Ich glaube, wir müssen hier mehr tun. Wir haben in Deutschland eine krisenpräventive Struktur aufgebaut, ein Netzwerk ziviler Krisenprävention. Aber es ist so, wie die Zeit vorige Woche schrieb: Das ist so etwas wie eine dritte Reservetruppe und nicht die erste Mannschaft. - Wir müssen das jetzt mobilisieren. Wir brauchen eine Sahelstrategie, die nachhaltige politische Stabilität in der Sahelregion schafft und wirklich auch einmal benennt, was die Schwächen der bisherigen Politik waren. Nur mit einer solchen Sahelstrategie wird man dauerhafte Stabilität schaffen können.

Vielen Dank.",data/txt/17218.txt,speech,gruene
