id,sitzung,wahlperiode,in_writing,speaker,speaker_cleaned,speaker_fp,sequence,text,filename,type,speaker_party
2705271,218,17,0,Vizepräsidentin Petra Pau,Petra Pau,petra-pau,0,"Die Sitzung ist eröffnet.

Nehmen Sie bitte Platz, liebe Kolleginnen und Kollegen! Auch wenn es nach der bewegenden Stunde vor unserer heutigen Parlamentssitzung schwerfällt, zur parlamentarischen Tagesordnung überzugehen, werden wir genau dies jetzt tun.

Ich rufe den Tagesordnungspunkt 1 auf:

Befragung der Bundesregierung

Die Bundesregierung hat als Thema der heutigen Kabinettssitzung mitgeteilt: 14. Kinder- und Jugend-bericht - Bericht über die Lebenssituation junger Menschen und die Bestrebungen und Leistungen der Kinder- und Jugendhilfe in Deutschland.

Das Wort für den einleitenden fünfminütigen Bericht hat die Bundesministerin für Familie, Senioren, Frauen und Jugend, Frau Dr. Kristina Schröder. Bitte, Frau Ministerin.",data/txt/17218.txt,chair,
2705272,218,17,0,"Dr. Kristina Schröder, Bundesministerin für Familie, Senioren, Frauen und Jugend",Dr. Kristina Schröder,kristina-schroder,1,"Frau Präsidentin! Liebe Kolleginnen und Kollegen! In familiärer Atmosphäre darf ich Ihnen darüber berichten, dass wir heute im Kabinett die Ergebnisse des 14. Kinder- und Jugendberichtes und die Stellungnahme der Bundesregierung beraten haben. Mein herzlicher Dank geht erst einmal an die Kommission für die Ausarbeitung des Sachverständigengutachtens. Der Bericht samt Stellungnahme wird dem Deutschen Bundestag und dem Bundesrat zur Beratung zugeleitet werden. Worum geht es in dem Bericht?

Erstens. Der Bericht widmet sich ausführlich dem Verhältnis zwischen privater und öffentlicher Verantwortung für das Aufwachsen von Kindern und Jugendlichen. Er unterstreicht, dass Familie natürlich der erste zentrale Ort für die Entwicklung von Kindern und Jugendlichen ist und bleibt und dass deswegen die Unterstützung der Eltern in ihrer Erziehungsverantwortung so wichtig ist. Deshalb gehören hierzu Maßnahmen, die Eltern Zeit für Verantwortung geben, etwa Elterngeld und Elternzeit, aber auch familienbewusste Arbeitszeiten. Eltern in ihrer Erziehungsverantwortung zu unterstützen, heißt aber auch, dort Hilfe zu leisten, wo sie ihrer Verantwortung allein nicht gerecht werden können.

Hier kommen wir zu einer Grundthese des Berichtes, die besagt: In den letzten Jahren haben wir eindeutig eine Zunahme der öffentlichen Verantwortung festzustellen, ohne - so die These des Berichts - dass deswegen die familiäre Verantwortung zurückgehen würde. Die beiden Bereiche sind also nicht wie kommunizierende Röhren zu verstehen, sondern oft befähigt erst die öffentliche Verantwortung die Eltern, der familiären Verantwortung nachkommen zu können. Besonders schön kann man das an dem Beispiel der Frühen Hilfen deutlich machen, die wir im Rahmen des Bundeskinderschutzgesetzes deutlich ausgebaut haben, durch die Eltern schon während der Schwangerschaft und im ersten Jahr nach der Geburt durch Familienhebammen unterstützt werden. Diese Unterstützung durch Familienhebammen führt gerade dazu, dass familiäre Verantwortung auch gelebt werden kann.

Zweiter Schwerpunkt des Berichtes ist die Bildung als Schlüssel für faire Chancen. Öffentliche Angebote zur frühkindlichen Bildung haben deutlich zugenommen. Der Besuch von Kitas für unter Dreijährige ist in vielen Familien eine neue Normalität. Sie wissen, dass der Bund hier seiner Verantwortung gerecht wird und für diesen Bereich bis zum Jahr 2014 insgesamt 5,4 Milliarden Euro zur Verfügung gestellt hat.

In diesem Zusammenhang fand ich einen Punkt sehr interessant, auch wenn er in erster Linie die Länder mit ihrer Verantwortung für die Schulpolitik betrifft, nämlich die Aussage, die im Bericht zum Thema Ganztagsangebote gemacht wird. Wir alle wissen ja, dass es ein originäres familienpolitisches Thema ist, gerade in der Grundschulzeit gute Betreuung zu haben. Hier stellt der Bericht fest, dass inzwischen immerhin die Hälfte aller Schulen in irgendeiner Form Ganztagsangebote macht und bereits ein gutes Drittel der Kinder in Deutschland an diesen Ganztagsangeboten teilnehmen.

Ein dritter Eckpunkt des Berichtes ist die Bedeutung der neuen Medien. Damit widmet sich erstmals ein Kinder- und Jugendbericht der Bundesregierung diesem Thema. Verkürzt kann man sagen: Noch vor zehn Jahren war eindeutig das Fernsehen das Leitmedium von Kindern und Jugendlichen. Jetzt, nach zehn Jahren, ist es von Handys und von Smartphones eindeutig abgelöst, und auch das Internet ist inzwischen praktisch allen Jugendlichen zugänglich. Es ist auch nicht mehr so, dass der Zugang schichtspezifisch ist, inzwischen ist er überall verbreitet. In Bezug auf das Wie der Nutzung gibt es allerdings immer noch schichtspezifische Unterschiede. Aber eines stellt der Bericht fest: Für all die Befürchtungen, die mit der Entwicklung der neuen Medien ein-hergegangen sind - Abhängigkeit, Verrohung oder Verschuldung -, gibt es empirisch keine Anhaltspunkte.

Der Bericht macht insgesamt sehr deutlich, dass sich das Leben von Kindern und Jugendlichen - er blickt ja erstmals auch auf junge Erwachsene - deutlich geändert hat. Die öffentliche Verantwortung hat deutlich zugenommen. Hier wurde auf Bedürfnisse und Wünsche von Eltern reagiert. Entsprechend kann man sagen, dass sich durch diese politischen Maßnahmen in den letzten Jahren die Chancen sehr vieler Kinder und Jugendlicher verbessert haben.

Herzlichen Dank.",data/txt/17218.txt,speech,
2705273,218,17,0,Vizepräsidentin Petra Pau,Petra Pau,petra-pau,2,"Vielen Dank, Frau Ministerin. - Ich bitte zunächst, Fragen zu dem Themenbereich zu stellen, über den soeben berichtet wurde. Das Wort hat die Kollegin Katja Dörner.",data/txt/17218.txt,chair,
2705274,218,17,0,Katja Dörner (BÜNDNIS 90/DIE GRÜNEN),Katja Dörner,katja-dorner,3,"Vielen Dank, Frau Ministerin, für Ihre Ausführungen. - Ich würde gerne wissen, was im Kinder- und Jugendbericht zum Thema Kinderrechte ins Grundgesetz ausgeführt wird. Gedenken Sie, aus den Empfehlungen - sollte der Bericht welche enthalten - entsprechende Konsequenzen zu ziehen?",data/txt/17218.txt,speech,gruene
2705275,218,17,0,"Dr. Kristina Schröder, Bundesministerin für Familie, Senioren, Frauen und Jugend",Dr. Kristina Schröder,kristina-schroder,4,"Das, worauf Sie, Frau Dörner, so nett anspielen, bestätige ich Ihnen gerne. Im Kinder- und Jugendbericht wird sich dafür ausgesprochen, die Kinderrechte ins Grundgesetz aufzunehmen. Er führt die uns wohl bekannten Argumente an - die ja auch gewichtig sind -, aber es gibt eben auch gewichtige Gegenargumente, die weiterhin die Position der Bundesregierung bestimmen. Dieser Position liegt vor allen Dingen die Überlegung zugrunde, dass die im Grundgesetz festgelegten Rechte für alle Menschen gelten. Wir sollten deshalb nicht so tun, als gäbe es eine Einschränkung für Kinder.",data/txt/17218.txt,speech,
2705276,218,17,0,Vizepräsidentin Petra Pau,Petra Pau,petra-pau,5,Die nächste Frage stellt die Kollegin Marlene Rupprecht.,data/txt/17218.txt,chair,
2705277,218,17,0,Marlene Rupprecht (Tuchenbach) (SPD),Marlene Rupprecht,marlene-rupprecht,6,"Vielen Dank, Frau Präsidentin. - Frau Ministerin, im 11. Kinder- und Jugendbericht wurde erstmals die öffentliche Verantwortung für das Aufwachsen von Kindern deutlich angesprochen. Das war ein Novum. Denn bis zu diesem Zeitpunkt war das Aufwachsen von Kindern eine private bzw. familiäre Angelegenheit; das heißt, das war in erster Linie Aufgabe der Familie, erst in zweiter Linie - bei Defiziten - wurde das Aufgabe des Staates. Im jetzt vorliegenden Bericht wird die öffentliche Verantwortung eindeutig bejaht, und zwar nicht ent- oder weder, und es geht auch nicht um eine Addition, sondern eigentlich um eine Potenzierung all der Fähigkeiten, die in der Gesellschaft vorhanden sein müssen, damit Menschen gut aufwachsen. Laut Bericht ist Voraussetzung dafür, dass eine Verschränkung stattfindet.

In diesem Zusammenhang denke ich unter anderem an das Kinderschutzgesetz, bei dem es uns auf Bundesebene nicht einmal gelungen ist, die unterschiedlichen Akteure, zum Beispiel aus dem Gesundheitsbereich, so aktiv einzubinden, dass sie sagen: Ja, es ist auch ein Teil von uns. - Wenn wir das also nicht im SGB V unterbringen können, könnten wir es aber vielleicht in einem Präventionsgesetz oder wo auch immer unterbringen.

Lassen Sie mich den Bereich der Inklusion ansprechen. Bei der Inklusion haben wir manchmal das Problem, dass sie nur für Kinder mit Behinderung gilt, obwohl sie eigentlich für alle gelten soll. Meine Frage ist: Wie wollen Sie eine Verschränkung gewährleisten, weg von der Versäulung, hin zu einem inklusiven Ansatz in der Kinder- und Jugendhilfe unter Einbeziehung aller Ressorts einschließlich der föderalen Strukturen und des Privatsektors? Das ist ja wirklich eine Herkulesaufgabe. Ich würde gerne wissen, welche ersten Schritte geplant sind.

Das Thema Kinderrechte ins Grundgesetz hat ja Frau Dörner eben schon angesprochen; dem schließe ich mich an.",data/txt/17218.txt,speech,spd
2705278,218,17,0,Vizepräsidentin Petra Pau,Petra Pau,petra-pau,7,"Frau Ministerin, bevor Sie antworten, mache ich vorsorglich darauf aufmerksam - das gilt für Fragende wie Antwortende bei diesem Tagesordnungspunkt -, dass wir uns auf eine Fragezeit und eine Antwortzeit von jeweils einer Minute geeinigt haben. Es gibt Unterstützung durch eine Anzeige. Das heißt, wenn das Licht rot leuchtet, ist diese Minute tatsächlich abgelaufen. Ich bitte das im weiteren Verlauf der Fragestunde zu beachten. - Bitte, Frau Ministerin.",data/txt/17218.txt,chair,
2705279,218,17,0,Marlene Rupprecht [Tuchenbach] [SPD],Marlene Rupprecht,marlene-rupprecht,8,"Ich habe den Hinweis verstanden, Frau Präsidentin!",data/txt/17218.txt,poi,spd
2705280,218,17,0,Vizepräsidentin Petra Pau,Petra Pau,petra-pau,9,,data/txt/17218.txt,chair,
2705281,218,17,0,"Dr. Kristina Schröder, Bundesministerin für Familie, Senioren, Frauen und Jugend",Dr. Kristina Schröder,kristina-schroder,10,"Liebe Frau Kollegin Rupprecht, das, was Sie gerade skizziert haben, ist in der Tat eine große Aufgabe. Zuerst möchte ich auf Ihre Andeutungen zum Kinderschutzgesetz eingehen. Ich lege schon Wert darauf, dass gerade das Kinderschutzgesetz vor Ort für die entsprechende Zusammenarbeit sorgt. Insbesondere die Familienhebammen - das ist ja der Witz dabei - fungieren quasi als Lotse zwischen den unterschiedlichen Hilfesystemen. Wir müssen jetzt schauen, wie das in der Praxis läuft. Ich glaube aber, dass wir uns darüber einig sind, dass das an sich ein sehr guter Ansatz ist.

Die Kommission beschreibt aber in der Tat verschiedene Schnittstellenproblematiken, die es auf den unterschiedlichen Ebenen nach wie vor gibt. Insbesondere im Bereich der Kinder- und Jugendhilfe haben wir diese Probleme. Wenn es um behinderte Kinder geht, ist es besonders problematisch, dass es hinsichtlich der Zuständigkeiten keine klare Abgrenzung zwischen den verschiedenen Bereichen des SGB gibt. Ich nenne als Beispiel die schwierige Unterscheidung zwischen seelischer und geistiger Behinderung.

Sie wissen, dass wir eine Kommission eingesetzt haben, die an der sogenannten großen Lösung arbeitet. Wir sind uns sicherlich einig, Frau Rupprecht, dass diese große Lösung richtig ist und wir an deren Umsetzung arbeiten müssen. Sie wissen aber auch, dass die Hauptkrux bei dieser großen Lösung darin besteht, dass Finanzströme auf verschiedenen Ebenen neu geordnet werden müssen. Das ist zwar schwierig, aber es ist richtig, das zu tun.",data/txt/17218.txt,speech,
2705282,218,17,0,Vizepräsidentin Petra Pau,Petra Pau,petra-pau,11,Das Wort zur nächsten Frage hat die Kollegin Diana Golze.,data/txt/17218.txt,chair,
2705283,218,17,0,Diana Golze (DIE LINKE),Diana Golze,diana-golze,12,"Vielen Dank. - Sehr geehrte Frau Ministerin, der neue Kinder- und Jugendbericht kommt ja zu der Feststellung, dass es dem Sozialstaat bislang nicht gelungen ist, herkunftsbedingte Nachteile von Kindern und Jugendlichen aufzufangen bzw. abzubauen. Im Gegenteil: Es wird festgestellt, dass es eher zu einer weiteren Ungleichbehandlung von Kindern und Jugendlichen gekommen ist. Der Bericht empfiehlt, die Kinder- und Jugendhilfe zu befähigen, solche Ungleichbehandlungen abzubauen und herkunftsbedingte Nachteile zu verringern. Ich frage deshalb auch vor dem Hintergrund des jüngst beschlossenen Betreuungsgeldes, welche Maßnahmen die Bundesregierung ergreifen will, um dieser Empfehlung des Berichts nachzukommen und benachteiligte Kinder und Jugendliche zu fördern und ihre Chancen zu verbessern.",data/txt/17218.txt,speech,linke
2705284,218,17,0,"Dr. Kristina Schröder, Bundesministerin für Familie, Senioren, Frauen und Jugend",Dr. Kristina Schröder,kristina-schroder,13,"Die Argumentation in dem Bericht ist sehr differenziert, Frau Kollegin. Man kann nicht sagen, dass der Bericht pauschal urteilt, dass es mehr Armut gibt und sich die Chancen verschlechtert haben. Ein solches Pauschalurteil wäre nicht richtig. Vielmehr stellt der Bericht fest, dass es, wenn man den relativen Einkommensbegriff, der ja auch seine Tücken hat, zugrunde legt, bei Kindern zwischen ein und zehn Jahren einen ganz leichten Rückgang der Kinderarmut gibt. Bei den Jugendlichen und jungen Erwachsenen wird allerdings eine leichte Erhöhung festgestellt. Insofern kann man nicht sagen, dass der Bericht pauschal sagt, dass sich die Chancen von Kindern und Jugendlichen verschlechtert haben.

Sie haben dann das Betreuungsgeld angesprochen. Darüber können wir uns wahrscheinlich ewig streiten. Ich will dazu nur Folgendes sagen: Ich finde, dass das Betreuungsgeld ein weiterer Baustein ist, der belegt, dass der Staat entsprechend der Tendenz, die ich eingangs skizziert habe, umfassend dazu steht, dass auch er eine Verantwortung für ganz junge Kinder hat. Gerade weil der Staat diese Verantwortung wahrnehmen will, wollen wir allen Eltern von ein- und zweijährigen Kindern eine Wahlmöglichkeit geben, sodass sie entweder ein Sachangebot in Form eines Kitaplatzes in Anspruch nehmen oder eine Unterstützung in bar entgegennehmen können, um die Betreuung selbst zu organisieren. Gerade damit sagt der Staat indirekt: Wir fühlen uns für die Betreuung von allen ein- und zweijährigen Kindern zuständig. Das ist etwas Neues. Das gab es in Deutschland so noch nicht.",data/txt/17218.txt,speech,
2705285,218,17,0,Manfred Grund [CDU/CSU],Manfred Grund,manfred-grund,14,Sehr gut!,data/txt/17218.txt,poi,cducsu
2705286,218,17,0,"Dr. Kristina Schröder, Bundesministerin für Familie, Senioren, Frauen und Jugend",Dr. Kristina Schröder,kristina-schroder,15,,data/txt/17218.txt,speech,
2705287,218,17,0,Vizepräsidentin Petra Pau,Petra Pau,petra-pau,16,Der Kollege Peter Tauber hat das Wort zur nächsten Frage.,data/txt/17218.txt,chair,
2705288,218,17,0,Dr. Peter Tauber (CDU/CSU),Dr. Peter Tauber,peter-tauber,17,"Frau Präsidentin, Ihr wunderbarer Hinweis auf den digitalen Countdown, der sowohl für Fragen als auch Antworten gilt, führt mich zu dem Themenkomplex, zu dem ich eine Frage stellen möchte. - Frau Ministerin, der Bericht weist auf, dass es bereichsübergreifend fachliche Herausforderungen gibt. Zu diesen gehört laut dem Bericht auch die digitale Ungleichheit.

Jetzt haben Sie uns in Ihren Eingangsausführungen kurz umrissen, dass die sorgenvollen Vorhersagen hinsichtlich der Digitalisierung unseres Alltags im Hinblick auf Kinder und Jugendliche zum Teil so nicht eingetreten sind. Das ist zunächst einmal eine sehr positive und schöne Nachricht. Vielleicht ist es auch so, dass der eine oder andere, der mit Kindern oder Jugendlichen arbeitet, mit der Digitalisierung noch nicht so vertraut ist und daher aus Unkenntnis so sorgenvoll argumentiert. Jedenfalls kommt der Bericht zu diesem Ergebnis.

Meine Frage lautet: Welche speziellen Herausforderungen und welchen konkreten Einfluss durch die neuen Medien sehen Sie bezüglich des Aufwachsens von Kindern und Jugendlichen, und wo entstehen dadurch vielleicht Handlungsfelder für die Politik?",data/txt/17218.txt,speech,cducsu
2705289,218,17,0,"Dr. Kristina Schröder, Bundesministerin für Familie, Senioren, Frauen und Jugend",Dr. Kristina Schröder,kristina-schroder,18,"In der Tat war mir wichtig, dass wir im Bericht bezüglich der neuen Medien nicht immer nur die Risiken betonen - dazu neigt die Politik ja gelegentlich -, sondern dass wir vor allen Dingen auch die Chancen in den Mittelpunkt stellen. Wenn man sich anschaut, welche Auswirkungen die Nutzung von neuen Medien auf Kinder und Jugendliche hat, kann man erst einmal ein positives Fazit ziehen, insbesondere hinsichtlich des Schriftverständnisses. Denn neue Medien haben dazu beigetragen, dass Kinder und Jugendliche wieder mehr schriftlich miteinander kommunizieren. Vor 15 Jahren gab es als schriftliche Form der Kommunikation quasi nur den Brief. Dass man sich untereinander Briefe schreibt, ist auch damals relativ selten vorgekommen. Die Kommunikation via E-Mail kann von daher schriftliche Ausdrucksformen positiv trainieren, genauso auch die Kommunikation via soziale Netzwerke.

Damit kommen wir jetzt aber zu der Problematik, die Sie angedeutet haben. In der Tat: Insbesondere bei der Art und Weise, wie soziale Netzwerke und auch das -Internet allgemein genutzt werden, gibt es starke schichtspezifische Unterschiede und übrigens auch starke Unterschiede zwischen Jungs und Mädels. Beispielsweise gibt es bei der Nutzung von Computerspielen einerseits einen schichtspezifischen Zusammenhang, andererseits auch einen geschlechtsspezifischen; denn sie werden vor allem von Jungen sehr stark genutzt. In diesem Bereich gibt es in der Tat Probleme. Da kann dann das Internet sogar als Verstärker von sozialen Ungleichheiten wirken. Deswegen sind wir sehr froh, dass sich der Bericht diesem Thema widmet.",data/txt/17218.txt,speech,
2705290,218,17,0,Vizepräsidentin Petra Pau,Petra Pau,petra-pau,19,Das Wort hat der Kollege Ulrich Schneider.,data/txt/17218.txt,chair,
2705291,218,17,0,Ulrich Schneider (BÜNDNIS 90/DIE GRÜNEN),Ulrich Schneider,ulrich-schneider,20,"Frau Ministerin, ich möchte zur eigenständigen Jugendpolitik nachfragen. Das ist ja ein Thema, das uns hier immer wieder beschäftigt und das Sie und die Bundesregierung sich auf die Fahnen geschrieben haben. Steht in dem Bericht konkret etwas zur Entwicklung der eigenständigen Jugendpolitik, und wenn ja, gibt es Ableitungen, die Sie daraus ziehen, und wenn nein, kann man vielleicht unkonkret Ideen daraus ableiten, wie man die eigenständige Jugendpolitik weiterentwickeln sollte?",data/txt/17218.txt,speech,gruene
2705292,218,17,0,"Dr. Kristina Schröder, Bundesministerin für Familie, Senioren, Frauen und Jugend",Dr. Kristina Schröder,kristina-schroder,21,"Der Bericht widmet sich selbstverständlich diesem Thema. Erst einmal: In dem Bericht steht, dass der Ansatz der Bundesregierung, den Versuch zu unternehmen, gemeinsam mit zivilgesellschaftlichen Akteuren eine eigenständige Jugendpolitik zu entwickeln, richtig ist. In dem Bericht wird auch festgestellt, dass Jugendpolitik bisher zu oft zu problemgruppenzentriert war und genau deswegen zu sehr abgeleitet bzw. zu wenig eigenständig war. Daher wird der Prozess, den die Bundesregierung mit der Allianz für die Jugend gestartet hat, als richtig bezeichnet.

Im Bericht wird auch darauf hingewiesen, dass es vor allen Dingen darum geht, Partizipationsformen für Jugendliche zu finden. Wir arbeiten beispielsweise gerade gemeinsam mit den kommunalen Spitzenverbänden zusammen, um solche Partizipationsmöglichkeiten zu finden und vor Ort entsprechende Handreichungen zu bieten. Wenn es um konkrete Vorhaben, zum Beispiel Bauprojekte, vor Ort geht, dann sollten die, die davon besonders betroffen sind, angemessen beteiligt werden.",data/txt/17218.txt,speech,
2705293,218,17,0,Vizepräsidentin Petra Pau,Petra Pau,petra-pau,22,Die nächste Frage stellt die Kollegin Heidrun Dittrich.,data/txt/17218.txt,chair,
2705294,218,17,0,Heidrun Dittrich (DIE LINKE),Heidrun Dittrich,heidrun-dittrich,23,"Frau Ministerin, vom 11. bis zum 13. Kinder- und Jugendbericht gibt es eine Debatte über die Fachlichkeit und die Personalausstattung der Jugendämter. Welche Maßnahmen konnten denn ergriffen werden, um das Personal aufzustocken? Und: Sehen Sie einen Zusammenhang zwischen mehr Personal und besserem Kinderschutz?

Hier gibt es ja einen Zusammenhang mit dem Volksbegehren in Niedersachsen, bei dem eine dritte Erzieherin in Kindergartengruppen gefordert wird. Wenn Gruppen mit 24 Kindern eine dritte Erziehungskraft hätten oder wenn die Gruppen insgesamt kleiner wären, könnten die Kinder besser betreut werden. Sehen Sie einen Zusammenhang zwischen den aktuellen Forderungen der Betroffenen und den Maßnahmen, die in den Kinder- und Jugendberichten angemahnt werden?",data/txt/17218.txt,speech,linke
2705295,218,17,0,"Dr. Kristina Schröder, Bundesministerin für Familie, Senioren, Frauen und Jugend",Dr. Kristina Schröder,kristina-schroder,24,"Frau Kollegin Dittrich, Sie haben - wenn ich das jetzt richtig verstanden habe - zwei Themen angesprochen, und zwar einmal das Thema Jugendämter. In der Tat ist es in Einzelfällen natürlich eine Frage, ob die Jugendämter in den Kommunen adäquat ausgestattet sind. Allerdings ist dies in Deutschland ausgesprochen unterschiedlich. Ich würde mich vor der monokausalen Annahme hüten, eine bessere Ausstattung führe automatisch sofort zu einer besseren Arbeit der Jugendämter. Aufgrund dessen, was ich von der Arbeit der Jugendämter mitbekomme, kann ich nur sagen: Man geht dort einer sehr verantwortungsvollen und auch einer sehr schwierigen Tätigkeit nach. Wie so oft, ist es so: Wenn die Jugendämter gut funktionieren, nimmt keiner es wahr. Passieren aber Fehler, die vielleicht auch trotz wohlüberdachter Erwägungen passieren, dann werden sie schnell durch die Medien gezogen. Deswegen sollten wir, glaube ich, erst einmal Respekt vor dieser Arbeit zum Ausdruck bringen.

Der zweite Themenkomplex, den Sie angesprochen haben, war die Frage: Wie sieht es mit Erziehern in Kitas aus? In der Tat gibt es auf die Frage, wie die Relation von Kindern und Erziehern sein sollte, die eindeutige Antwort, dass möglichst kleine Relationen besser für die kindliche Entwicklung sind. Deswegen arbeiten wir ja auch daran, mehr Personal für die Kitas zu finden. Aber Sie wissen auch, dass dies eindeutig eine Aufgabe der Länder und Kommunen ist. Ich habe in der Diskussion über den Ausbau der Kinderbetreuung sehr deutlich gemacht, dass ich es nicht für vertretbar halte, um den Ausbau zu schaffen, an pädagogischen Standards zu drehen; und dazu gehört ganz entscheidend die Relation von Kindern und Erziehern.",data/txt/17218.txt,speech,
2705296,218,17,0,Vizepräsidentin Petra Pau,Petra Pau,petra-pau,25,Der Kollege Sönke Rix hat das Wort.,data/txt/17218.txt,chair,
2705297,218,17,0,Sönke Rix (SPD),Sönke Rix,sonke-rix,26,"Vielen Dank, Frau Präsidentin. - Vielen Dank, Frau Ministerin, für den Bericht. Dem Vernehmen nach wird als Schlussfolgerung im Bericht eine eigenständige Jugendpolitik gefordert und auch gesagt, es wäre schön, wenn da genauso viel Kraft hineingesteckt werden könnte wie in die Kinderpolitik, weil - so ist in dem Bericht dem Vernehmen nach gesagt worden - man da an vielen Stellen etwas erreicht hat. Sie haben davon gesprochen, dass die Allianz für Jugend angestoßen worden ist. Nun ist die Legislaturperiode nicht mehr so lang. Meine Frage ist: Gibt es ein oder zwei konkrete inhaltliche Fragestellungen in der Jugendpolitik als Schlussfolgerungen aus dem Bericht, die Sie aufgreifen könnten, um daraus noch etwas zu machen?",data/txt/17218.txt,speech,spd
2705298,218,17,0,"Dr. Kristina Schröder, Bundesministerin für Familie, Senioren, Frauen und Jugend",Dr. Kristina Schröder,kristina-schroder,27,"Wenn Sie nach konkreten jugendpolitischen Schlussfolgerungen fragen, so möchte ich zunächst darauf hinweisen, dass ich eine bereits genannt habe. Das ist das Thema Partizipation von Jugendlichen. Ich halte dies für ein sehr entscheidendes Thema, zum einen, um unsere Umwelt so zu gestalten, wie es den Bedürfnissen entspricht, zum anderen, weil dies auch etwas mit Demokratielernen zu tun hat.

Das Zweite ist: Der Bericht widmet sich auch ausführlich der Frage, wie die Programme im Zuge der Initiative JUGEND STÄRKEN, die wir entwickelt haben, wirken und funktionieren. Er kommt zu dem Schluss, dass es richtig ist, dass wir so zielgenau gerade da ansetzen, wo beispielsweise Schulabschlüsse versäumt worden sind oder wo besondere Hemmnisse bei der Integration in den Arbeitsmarkt bestehen. Deshalb ist für mich die Schlussfolgerung, hier mit den Programmen im Zuge der Initiative JUGEND STÄRKEN - auch in Ergänzung zu den Programmen des BMAS - einen eigenen Schwerpunkt zu setzen.",data/txt/17218.txt,speech,
2705299,218,17,0,Vizepräsidentin Petra Pau,Petra Pau,petra-pau,28,Die nächste Frage stellt die Kollegin Ewa Klamt.,data/txt/17218.txt,chair,
2705300,218,17,0,Ewa Klamt (CDU/CSU),Ewa Klamt,ewa-klamt,29,"Vielen Dank. - Frau Ministerin, wir alle wissen, dass Eltern ab dem 1. August 2013 einen Rechtsanspruch auf einen Krippenplatz haben. Wie schätzt die Kommission den Stand zum Ausbau der Tagesbetreuung für unter Dreijährige ein?",data/txt/17218.txt,speech,cducsu
