id,sitzung,wahlperiode,in_writing,speaker,speaker_cleaned,speaker_fp,sequence,text,filename,type,speaker_party
2705556,218,17,0,"Gudrun Kopp, Parl. Staatssekretärin beim Bundesminister für wirtschaftliche Zusammenarbeit und Entwicklung",Gudrun Kopp,gudrun-kopp,285,"Vielen Dank, Frau Präsidentin. - Herr Kollege Raabe, Ihre mehrteilige Frage beantworte ich Ihnen wie folgt: Für die Afrika-Initiative des BMZ hat der Verein gemeinsam mit der Bundeszentrale für politische Bildung, bpb, Ende 2010 ein Konzept entwickelt, um neues zivilgesellschaftliches Engagement zu generieren. Hierfür haben Verein und bpb einen Zuwendungsantrag gestellt. Im September 2011 nahm die Leitung des BMZ das Konzept an.

Wir haben mitgeteilt: Da der Antrag gemeinsam von der Bundeszentrale für politische Bildung und dem Verein als den Autoren mit der Bitte um Zuwendung eingereicht wurde, kommt hier nicht das Vergaberecht zur Anwendung, sondern das Zuwendungsrecht.",data/txt/17218.txt,speech,
2705557,218,17,0,Vizepräsidentin Katrin Göring-Eckardt,Katrin Göring-Eckardt,katrin-goring-eckardt,286,"Herr Raabe, Sie haben eine Nachfrage? - Bitte.",data/txt/17218.txt,chair,
2705558,218,17,0,Dr. Sascha Raabe (SPD),Dr. Sascha Raabe,sascha-raabe,287,"In der Tat gab es bei Ausschreibungen des Ministeriums bei anderen Personalentscheidungen Auseinandersetzungen, was das Thema Vetternwirtschaft angeht. Darum ging es mir nicht in der Frage, Frau Staatssekretärin.

Auch wenn es ein Zuwendungsverfahren ist: Wie sind Sie ausgerechnet auf diesen Verein gekommen, der bis dahin in der Szene relativ unbekannt gewesen ist? Es ist doch sehr fraglich, ob er über die notwendigen Strukturen verfügt. Sie hatten gesagt, dass das ein Konzept gewesen sei, das mit der Bundeszentrale für politische Bildung entwickelt wurde.

Wie bewerten Sie den Umstand, Frau Staatssekretärin, dass die KfW und die GIZ, denen man dieses Konzept angetragen hatte, gesagt haben, dass die Nachhaltigkeit des Vorhabens sehr begrenzt sei? Das Gesamturteil dazu lautete:

Insgesamt wird empfohlen, von einer Förderung dieses Vorschlags mit den Mitteln der deutschen Entwicklungszusammenarbeit abzusehen.",data/txt/17218.txt,speech,spd
2705559,218,17,0,"Gudrun Kopp, Parl. Staatssekretärin beim Bundesminister für wirtschaftliche Zusammenarbeit und Entwicklung",Gudrun Kopp,gudrun-kopp,288,"Herr Kollege Raabe, ich will zunächst einmal ausdrücklich Ihre eben gemachte Aussage von mir weisen, bei Personalentscheidungen sei Vetternwirtschaft im Spiel. Wir kennen dieses Thema leider, auch die Debatte hierzu im Plenum. Aber ich will diesen Vorwurf ausdrücklich zurückweisen und sagen: Wir haben Personal nach Recht und Gesetz und vor allen Dingen nach Befähigung ausgewählt. Das dürfte überhaupt keine Frage sein.

Jetzt zu dem Verein. Ich teile Ihre Einschätzung überhaupt nicht. Es ist ein junger Verein; das ist richtig. Dieser junge Verein - ich muss Ihnen einmal kurz die Historie erläutern - setzt sich zusammen aus einer Initiative, die auf dem Stipendiatenprogrmm Go Africa  Go Germany  beruht. Der Verein wurde im Jahre 2009 auf Anraten des damaligen Staatssekretärs im BMZ, Herrn Stather, zur Durchführung des deutsch-afrikanischen Stipendiatenprogramms gegründet. Das war die Grundlage. Das ist also ein Verein, der über hervorragende Erfahrungen verfügt und lange tätig war. Ich möchte Sie daran erinnern, dass dieser Stipendiatenaustausch auch Teil der Partnership with Africa war unter der Schirmherrschaft von Altbundespräsident Köhler, der auch jetzt immer noch in internationalen Gremien für Afrika aktiv ist.

Der Verein Go Africa  Go Germany  hat am 8. Dezember 2009 seine Anmeldung beim Amtsgericht Potsdam eingereicht. Am 22. September 2010 erfolgte die Eintragung im Vereinsregister beim Amtsgericht Potsdam. Am 5. Mai gab es bei der Durchführung des deutsch-afrikanischen Stipendiatenprogramms einen Kooperationsvertrag mit der Bundeszentrale für politische Bildung. 2011 war dieses Teil der Zukunftsinitiative des Afrika-Konzepts, das das Kabinett verabschiedet hat.

Dann hat sich der Verein entschieden, eine Namensänderung vorzunehmen. Er hieß dann nicht mehr Go -Africa  Go Germany , sondern Stiftung Partnerschaft mit Afrika e. V. Die Zielsetzung, um die es dem Verein ging, wurde mit diesem Namen klarer. Klarer wurde auch die Anlehnung an die Initiative des von mir eben erwähnten Altbundespräsidenten Köhler.",data/txt/17218.txt,speech,
2705560,218,17,0,Vizepräsidentin Katrin Göring-Eckardt,Katrin Göring-Eckardt,katrin-goring-eckardt,289,Herr Raabe hat das Wort zu einer zweiten Nachfrage.,data/txt/17218.txt,chair,
2705561,218,17,0,Dr. Sascha Raabe (SPD),Dr. Sascha Raabe,sascha-raabe,290,"Frau Staatssekretärin, ich möchte niemandem, der sich für Afrika engagiert, seinen guten Willen absprechen, bestimmt auch nicht den Initiatoren dieser Initiative. Weil man hier von 8 Millionen Euro Steuergeldern spricht, die aufgebracht werden müssen und die natürlich vor Ort in Afrika eingesetzt werden könnten, muss man sich natürlich auch fragen, ob der Aufwand den Ertrag rechtfertigt und welches die Zielsetzung des Ganzen ist. Es gab im Jahre 2011 schon einmal den Versuch vonseiten des Ministers, mit Steuergeldern in Millionenhöhe eine Mittelstandsoffensive zu starten. Dazu hieß es in -einem Schreiben an die Durchführungsorganisation: Hauptsache, der politische Ertrag für Niebel und Rösler ist hoch; das rechtfertigt bereits alle Mittel.

Wenn Sie das Konzept, das den Menschen in Afrika hilft, ernst meinen, dann frage ich Sie, wie Sie zu der Aussage von Experten des Auswärtigen Amtes stehen, die laut einer Spiegel-Meldung sagen, dass sie vor Ort überhaupt nicht eingebunden worden seien.

Wir praktizieren genau das, was wir ansonsten in Sachen Guter Regierungsführung bei anderen kritisieren.

So schimpft ein hochrangiger Diplomat. Da scheint es doch eher auf die Werbewirksamkeit kurz vor dem Wahlkampf in Deutschland anzukommen als darauf, tatsächlich den Menschen in Afrika zu helfen, wenn ich das Zitat der Botschafter ernst nehme.",data/txt/17218.txt,speech,spd
2705562,218,17,0,"Gudrun Kopp, Parl. Staatssekretärin beim Bundesminister für wirtschaftliche Zusammenarbeit und Entwicklung",Gudrun Kopp,gudrun-kopp,291,"Ich hoffe, Herr Kollege Raabe, ich kann Sie davon überzeugen, meinen Aussagen Glauben zu schenken und nicht einem Zeitungsartikel. Insofern möchte ich Ihnen zunächst Folgendes sagen:

Sie sprachen eben mit Selbstverständlichkeit von einem Mitteleinsatz in Höhe von 8 Millionen Euro. Diese Zuwendung von 8 Millionen Euro entbehrt jeder Grundlage; dies ist nicht der Fall. Der Verein hat das Geld auch nicht bekommen. Wir haben den Artikel natürlich auch gelesen und haben uns überlegt, wie man zu einer solchen Äußerung kommt. Wir können uns dies nur dadurch erklären, dass es sich um eine Verwechslung handelt. Aber noch einmal: Dieser von mir eben genannte hochgeschätzte Verein hat keine 8 Millionen Euro bekommen.

Jetzt zu dem gesamten Ansatz. Für die wirtschaftliche Zusammenarbeit und die Entwicklungszusammenarbeit gilt: Das Verständnis für Menschen in Entwicklungsländern auch mit Rückwirkung aus Deutschland muss man in aller Breite schaffen, also in die Mitte der Gesellschaft holen. Das ist unser Ansatz. Mit einer solchen Afrika-Initiative, übrigens auf drei Jahre angelegt, die sich zurzeit in einer Pilotphase befindet, die bis Ende März läuft - dann werden wir mehr darüber sagen können -, wird ein Graswurzelansatz verfolgt, mit dem Partnerschaftlichkeit zwischen Afrika und Deutschland gepflegt werden soll. Das ist das Neue daran, nämlich über Schulen, Hochschulen und Vereine einen deutsch-afrikanischen Peer-to-Peer-Ansatz zu verfolgen.

Das klare Ziel ist nicht, viel Geld auszugeben, sondern mit so wenig Geld wie möglich die größtmögliche Wirkung zu erzeugen. Die Verständigung Afrikas mit Deutschland und der Zivilgesellschaft in Deutschland ist das Ansinnen.",data/txt/17218.txt,speech,
2705563,218,17,0,Vizepräsidentin Katrin Göring-Eckardt,Katrin Göring-Eckardt,katrin-goring-eckardt,292,Frau Hänsel hat eine Nachfrage.,data/txt/17218.txt,chair,
2705564,218,17,0,Heike Hänsel (DIE LINKE),Heike Hänsel,heike-hansel,293,"Danke schön. - Ich würde gerne nachhaken, Frau Staatssekretärin: Wie hoch ist der Etat für die Afrika-Initiative? Denn Sie haben gesagt, die Zahlen stimmten nicht.

Ich möchte auch wissen, welche Partner in den Ländern Afrikas konkret in die Entwicklung der Afrika-Initiative eingebunden waren. Welche Graswurzelinitiativen aus welchen Ländern haben Sie im Vorfeld der Planung des Afrika-Tages konkret beteiligt?",data/txt/17218.txt,speech,linke
2705565,218,17,0,"Gudrun Kopp, Parl. Staatssekretärin beim Bundesminister für wirtschaftliche Zusammenarbeit und Entwicklung",Gudrun Kopp,gudrun-kopp,294,"Zunächst zu dem Finanzvolumen der gesamten Initiative: Dabei geht es um einen Ansatz von etwa 1,6 Millionen Euro. Der Verein bekommt 1,1 Millionen Euro, von denen auch Personal bezahlt wird.

Zu der Frage, wie viele Länder wir einbinden: Wir sind in der Pilotphase, beim Aufbau dieses Projektes, das übrigens bei uns im Haus aufgebaut und uns als Leitung 2011 vorgelegt wurde. Es ist ein sehr innovativer Ansatz, bei dem wir mit so wenig Geld wie möglich entsprechende Strukturen aufbauen. Natürlich - das ist gar keine Frage - muss auch eine Rechnungslegung stattfinden. Wir haben Partnerländer in Afrika, die bei dieser Initiative mitmachen.

Ich habe eben schon die Schulen angesprochen. Es gibt etliche, die schon mitmachen. Wir haben in den wenigen Monaten, seit die Pilotphase läuft, schon etwa 1 400 Menschen erreicht. An verschiedenen Symposien und Veranstaltungen haben 700 Personen teilgenommen. Ich finde, das kann sich sehen lassen.

Noch einmal: Die Konzeption läuft. Selbstverständlich bilden wir Partnerschaften und binden afrikanische Länder mit ein, die sich dieser Initiative anschließen möchten. Genau darauf zielt das Vorhaben auch: Wir wollen keine deutsche Initiative, sondern eine deutsch-afrikanische.",data/txt/17218.txt,speech,
2705566,218,17,0,Heike Hänsel [DIE LINKE],Heike Hänsel,heike-hansel,295,Nur mal eine nennen! Nur mal eine Organisation!,data/txt/17218.txt,poi,linke
2705567,218,17,0,"Gudrun Kopp, Parl. Staatssekretärin beim Bundesminister für wirtschaftliche Zusammenarbeit und Entwicklung",Gudrun Kopp,gudrun-kopp,296,,data/txt/17218.txt,speech,
2705568,218,17,0,Vizepräsidentin Katrin Göring-Eckardt,Katrin Göring-Eckardt,katrin-goring-eckardt,297,Jetzt hat Frau Roth das Wort.,data/txt/17218.txt,chair,
2705569,218,17,0,Karin Roth (Esslingen) (SPD),Karin Roth,karin-roth,298,"Frau Staatssekretärin, ich glaube, es gibt niemanden im Saal, der eine Afrika-Initiative nicht unterstützen würde, die zum Ausdruck bringt, dass man die Verständigung zwischen Afrika und Europa - nicht nur Deutschland - für gut hält. Die spannende Frage ist: In welcher Weise, mit welchen Mitteln und welcher Wirkung geschieht das? Die Wirksamkeit ist schließlich immer das große Thema des Ministeriums.",data/txt/17218.txt,speech,spd
2705570,218,17,0,"Gudrun Kopp, Parl. Staatssekretärin beim Bundesminister für wirtschaftliche Zusammenarbeit und Entwicklung",Gudrun Kopp,gudrun-kopp,299,Richtig.,data/txt/17218.txt,speech,
2705571,218,17,0,Karin Roth (Esslingen) (SPD),Karin Roth,karin-roth,300,"Insofern haben wir das Recht, genauer nachzufragen.

Wenn Sie sagen, die 8 Millionen Euro seien nicht richtig, es seien nur 1,1 Millionen Euro, dann ist die Frage, ob das jährlich, über die drei Jahre oder für das gesamte Projekt gilt. Oder sind es 1,6 Millionen Euro für die Organisationen in Afrika? Wir hätten es gerne ein bisschen genauer, auch hinsichtlich der Wirksamkeitsüberprüfung. Denn wenn man keine Ziele setzt, hat man am Ende auch keine Wirksamkeit nachzuweisen.

Die Frage ist also: Was wollen Sie in Afrika und auch in Deutschland erreichen? Dabei bringt auch die Bundeszentrale für politische Bildung finanzielle Beiträge ein. Die Frage ist also vor allen Dingen auch: Was bringt sie an Beiträgen ein, um von Synergieeffekten reden zu können?

Wir hätten doch gerne ein bisschen mehr gewusst. Ich kann Kollegin Hänsel gut verstehen und möchte an ihre Fragen anknüpfen: Welche Länder in Afrika haben Sie als Schwerpunkt ausgewählt? Welche Organisationen in Deutschland außer dieser Durchführungsorganisation sind mit angesprochen?",data/txt/17218.txt,speech,spd
2705572,218,17,0,"Gudrun Kopp, Parl. Staatssekretärin beim Bundesminister für wirtschaftliche Zusammenarbeit und Entwicklung",Gudrun Kopp,gudrun-kopp,301,"Frau Roth, ich muss mich korrigieren, glaube ich. Ich habe eben etwas durcheinandergebracht. Bitte streichen Sie die 1,6 Millionen Euro aus Ihrem Gedächtnis. Es hat einen Zuwendungsbescheid an die Stiftung mit einem Volumen von 1,148 Millionen Euro gegeben - es ist noch mehr, aber auf die anderen Stellen möchte ich jetzt nicht näher eingehen -, und zwar für den Zeitraum von September 2012 bis März 2013. Das ist genau die Pilotphase, in der wir uns jetzt befinden. Alle weiteren Schritte und alle weiteren Finanzaufwendungen werden erst danach feststehen. Wir sind jetzt in der Aufbauphase. Ich bitte um Entschuldigung, dass ich die Zahlen durcheinandergebracht habe.

Noch einmal zu der Afrika-Initiative. Ich finde es sehr gut, dass Sie selber bestätigt haben, wie wertvoll ein solcher Austausch und auch eine solche Initiative sind. Wir haben oft im AwZ über die Förderung des Austausches von Stipendiaten debattiert, um Kulturen zueinanderzubringen und Grundlagen für gegenseitiges Verständnis zu legen. Ursprünglich lief der Stipendiatenaustausch über das BMI. Aber das BMI wollte nicht mehr fördern und hat auf uns, das BMZ, verwiesen, weil dieser -Austausch in besonderer Weise entwicklungsrelevant ist. Wir finden das hervorragend und möchten ihn gerne integrieren. Wie ich Ihnen eben sagte, ist das Teil dieser Initiative bzw. dieses Vereins. Darauf wird sehr viel Wert gelegt. Die Grundlagen dieses Austauschs sind schon 2007 vom damaligen Staatssekretär gelegt worden. Ich finde, es handelt sich um eine hervorragende Initiative, die es wert ist, weiterhin gefördert zu werden.",data/txt/17218.txt,speech,
2705573,218,17,0,Vizepräsidentin Katrin Göring-Eckardt,Katrin Göring-Eckardt,katrin-goring-eckardt,302,"Ich rufe die Frage 24 des Kollegen Raabe auf:

Welche Konsequenzen zieht der Bundesminister Dirk Niebel aus dem offenbar negativen Ergebnis des Gutachtens der Firma PricewaterhouseCoopers, das der Stiftung Partnerschaft mit Afrika e. V. eine ordnungsgemäße finanzielle -Abwicklung des 8-Millionen-Euro-Zuschusses für die Umsetzung der BMZ-Afrika-Initiative abspricht?",data/txt/17218.txt,chair,
2705574,218,17,0,"Gudrun Kopp, Parl. Staatssekretärin beim Bundesminister für wirtschaftliche Zusammenarbeit und Entwicklung",Gudrun Kopp,gudrun-kopp,303,"Herr Kollege Raabe, die Studie sieht Nachholbedarf bei der kaufmännischen Ausstattung der Stiftung. Der Grund des angesprochenen Nachholbedarfs war, dass es sich bei der Stiftung um eine Ausgründung aus der -Bundeszentrale für politische Bildung handelt, mit dem Ziel, das gemeinsame Stipendiatenprogramm der Bundeszentrale und des BMZ von zwei Partnern zu finanzieren. Dabei wurde im Rahmen eines Kooperations-vertrags der wirtschaftliche Teil in der Bundeszentrale abgewickelt. Für das neue Programm musste dieser kaufmännische Teil neu eingestellt werden, was in das Gutachten noch nicht eingegangen ist. Die Bewertung in dem von Ihnen genannten Gutachten stammt nicht aus dem BMZ, sondern von außen. Es handelt sich nicht um 8 Millionen Euro. Inzwischen ist der Verein der Forderung nach-gekommen und hat die Strukturen - Buchhaltungssystem, Controllingsystem und Organisationsstrukturen - nachgewiesen. Es gibt seit gestern Abend eine zweite Studie, in der das genau dargelegt wird.",data/txt/17218.txt,speech,
2705575,218,17,0,Vizepräsidentin Katrin Göring-Eckardt,Katrin Göring-Eckardt,katrin-goring-eckardt,304,Haben Sie eine Nachfrage? - Bitte schön.,data/txt/17218.txt,chair,
2705576,218,17,0,Dr. Sascha Raabe (SPD),Dr. Sascha Raabe,sascha-raabe,305,"Frau Staatssekretärin, Sie betonen immer wieder, dass es sich nicht um 8 Millionen Euro handelt. Nun hatten Sie sich auf Nachfrage meiner Kollegin Roth korrigiert und eingeräumt, dass bis März 2013 1,148 Millionen Euro nur für die Pilotphase aufgewendet werden. -Können Sie denn ausschließen, dass man über die geplanten drei Jahre, in denen die Aktionen stattfinden, nicht doch in die Nähe von 8 Millionen Euro kommt? Denn das tragen Sie immer als Gegenargument vor.

Setzen Sie das einmal in Relation zu dem Effekt, den die deutsche Millenniumskampagne hatte, für die wir nur einige Hunderttausend Euro Zuschuss pro Jahr gebraucht hatten und die eine super erfolgreiche Kampagne war, in der gemeinsam mit der Zivilgesellschaft und den Kommunen Verständnis für Afrika und die Millenniumsentwicklungsziele geweckt worden ist. Damals hatten Sie gesagt - ich erinnere mich noch gut an den Antrag, weitere Mittel zur Verfügung zu stellen, den wir gestellt hatten -, das Geld werde gestrichen, weil die Mittel in Höhe von einigen Hunderttausend Euro nicht verfügbar seien.

Es passt nicht zusammen, wenn auf der einen Seite ein paar Hunderttausend Euro, die nötig wären, um -Bewusstsein zu schaffen, abgelehnt werden, auf der anderen Seite aber auf einmal die Millionen sprudeln. Das müssen Sie mir erklären.",data/txt/17218.txt,speech,spd
2705577,218,17,0,"Gudrun Kopp, Parl. Staatssekretärin beim Bundesminister für wirtschaftliche Zusammenarbeit und Entwicklung",Gudrun Kopp,gudrun-kopp,306,"Noch einmal: Da sprudeln keine Millionen. Ich wehre mich dagegen, dass hier die Zahl von 8 Millionen Euro in den Raum gestellt wird, die in einem Magazin zu -lesen war, die aber jeder Grundlage entbehrt und offenbar auf einer Verwechslung basiert. Es gibt jetzt im Haus keine verlässliche Schätzung. Mir ist wichtig, das zu -betonen. Der eben von mir genannte Betrag für die -Pilotphase beläuft sich auf 1,1 Millionen Euro. Das ist richtig.

Wir haben eine breite Palette von zivilen Akteuren, von Kommunen und Ländern, die eigene Projekte haben, welche in der Regel sehr wertvoll sind. Man muss immer den Einzelfall betrachten. Eines aber dürfen Sie ganz sicher annehmen: Wir achten sehr genau auf den effizienten und effektiven Mitteleinsatz. Das sind wir uns selber schuldig. Sie wissen selber, dass eine Konsolidierung des gesamten Bundeshaushalts erfolgen muss. Kein Ressort erlaubt es sich, hier über die Stränge zu schlagen, wir schon gar nicht.

Die Projekte sind so angelegt, dass sie die Bildung voranbringen, und zwar in den afrikanischen Partner-ländern und in Deutschland. Es geht darum, voneinander zu lernen und mehr übereinander zu wissen. Ich glaube, es handelt sich um eine hervorragende Initiative. Ein Stipendiatenaustausch prägt junge Menschen für ihr Leben. Ich muss nicht länger ausführen, warum das eine gute Grundlage für ein künftiges Wirken im Beruf, aber auch im Privatbereich ist.",data/txt/17218.txt,speech,
2705578,218,17,0,Vizepräsidentin Katrin Göring-Eckardt,Katrin Göring-Eckardt,katrin-goring-eckardt,307,"Sie haben eine zweite Nachfrage, Herr Raabe? - Bitte.",data/txt/17218.txt,chair,
2705579,218,17,0,Dr. Sascha Raabe (SPD),Dr. Sascha Raabe,sascha-raabe,308,"Frau Staatssekretärin, dass es sich hier nicht um -Peanuts handelt, sieht man daran, dass dieses Gutachten von einer renommierten Wirtschaftsprüfungsgesellschaft erstellt worden ist. Es enthält nun einmal negative Bewertungen. Ich erinnere mich, dass in vergleichbaren Fällen - es geht nicht um die gute Absicht - der Minister gehandelt hat. Ich erinnere an den Global Fund. Wenn in irgendeinem Prüfungsbericht negative Bewertungen waren, hat er erst einmal sofort die Auszahlung der Mittel gestoppt. Im jetzigen Fall verwundert es schon, dass Sie so lapidar von Kleinigkeiten sprechen. Wir wollen -diesen Bericht haben. Ich hoffe, dass Sie uns zusagen können, uns den Bericht der Wirtschaftsprüfungsgesellschaft vorzulegen. Dann werden wir sicherlich entsprechende Nachfragen haben.

Ansonsten drängt sich der Eindruck auf, dass für den ersten deutschen Entwicklungstag, der in 16 Städten, unter anderem in Heidelberg, also im Wahlkreis des Ministers, geplant ist, viel Geld - kurz vor der Bundestagswahl - ausgegeben werden soll. Wir stellen schon die Frage, ob das den Menschen in Afrika hilft oder ob das nicht jetzt kurz vor der Bundestagswahl Wahlwerbung ist. Um Afrika zu helfen, unterstützen wir gerne alle Maßnahmen, aber wir unterstützen nicht, dass ausgerechnet einige Monate vor der Bundestagswahl mit -einem Millionenaufwand der Minister ins rechte Licht gerückt werden soll.",data/txt/17218.txt,speech,spd
2705580,218,17,0,"Gudrun Kopp, Parl. Staatssekretärin beim Bundesminister für wirtschaftliche Zusammenarbeit und Entwicklung",Gudrun Kopp,gudrun-kopp,309,"Ich kann mich daran erinnern, Herr Kollege Raabe, dass bei einer Frage vorhin auch danach gefragt wurde, was so kurz vor der Wahl aufgetischt werde. Es kann doch nicht sein, dass wir als BMZ oder als Bundesregierung gar nichts mehr machen und die Hände in den Schoß legen, nur weil im September die Bundestagswahl ist. Wir haben natürlich unsere Aufgaben zu erfüllen. Das ist völlig klar. Den Wahlrhythmus lassen Sie bitte außen vor.

Wir haben verschiedentlich bewiesen, dass es dem BMZ um effiziente Strukturen geht, um gute Regierungsführung, die wir auch selber gezeigt haben, indem wir die größte Strukturreform auf den Weg gebracht haben, die es je im BMZ gegeben hat. Ich möchte Sie nur bitten, wirklich wertzuschätzen, was wir an dieser Stelle geleistet haben.

Zu den beiden Studien. Die erste Studie, in Auftrag gegeben von der GIZ, und die zweite, von der ich eben gesprochen habe - in Auftrag gegeben vom BMZ -, -kosten 5 000 Euro. In der ersten Studie ist nicht berücksichtigt worden, dass sich der Verein gerade neu strukturiert hat und dass das, was im ersten Gutachten gefordert wurde, nämlich der Aufbau von Finanzstrukturen, Organisationsstrukturen, Kontrollsystemen - ich habe das eben genannt -, selbstverständlich vorgesehen war; nur war es noch nicht auf dem Weg. Das ging in der Kürze der Zeit nicht. Das Ganze steht jetzt. Es gibt jetzt ordnungsgemäße Strukturen, so wie es ohnehin vorgesehen war, und das steht auch so in der zweiten Studie.

Ich hätte Ihnen diese Studien gerne bereits zugeleitet, gar keine Frage; ich habe noch gestern Abend an das -renommierte Institut geschrieben und darum gebeten, dass wir das weiterreichen dürfen, weil in einem Passus dieses Gutachtens steht, dass wir, bevor wir es weiter-geben, ausdrücklich um Erlaubnis bitten müssen. Die Bitte ist bereits auf dem Weg. Sie bekommen die Unterlagen so schnell wie irgend möglich nach Genehmigung.",data/txt/17218.txt,speech,
2705581,218,17,0,Vizepräsidentin Katrin Göring-Eckardt,Katrin Göring-Eckardt,katrin-goring-eckardt,310,"Frau Hänsel, bitte.",data/txt/17218.txt,chair,
2705582,218,17,0,Heike Hänsel (DIE LINKE),Heike Hänsel,heike-hansel,311,"Frau Staatssekretärin, bei den enormen Geldern, die Sie da einsetzen, drängt sich dieser Verdacht natürlich schon auf; das möchte ich noch einmal sagen. Allein für die Pilotphase sind es über 1 Million Euro. Aufgrund von Etatkürzungen haben wir derzeit das Problem, dass kleine Initiativen zu wenig Geld haben. Bei mir in Tübingen haben wir ein Jahr lang ein ASA-Austauschprogramm geplant. Da ging es um 4 000 Euro Flugkosten. Weil entsprechende Mittel gestrichen wurden und eine Gruppe aus Kolumbien jetzt nicht kommen kann, fällt das Austauschprojekt flach - wegen 4 000 Euro! Sie geben in einer Pilotphase 1 Million Euro für eine sehr zweifelhafte und sehr einseitige Kampagne aus. Dabei drängt sich vielen der Verdacht auf: Es wird kein Entwicklungshilfetag, sondern eher ein Niebel-Tag bundesweit organisiert, unter anderem in Herrn Niebels Wahlkreis. Deshalb meine Nachfrage: Wo sehen Sie eigentlich den Wert der entwicklungspolitischen Bildung in dieser Kampagne?

Seit Jahren kämpfen wir darum, dass die Mittel für entwicklungspolitische Bildung erhöht werden. Bei der letzten Etatberatung gab es darüber noch einmal Auseinandersetzungen. Seit Jahren kämpfen die Organisationen dafür, dass die Arbeit, die sie machen, ausgebaut werden kann, Stichwort Promotoren-Programm usw.. Dafür gibt es kein Geld. Aber für Ihre Initiative haben Sie Millionen Euro.",data/txt/17218.txt,speech,linke
