id,sitzung,wahlperiode,in_writing,speaker,speaker_cleaned,speaker_fp,sequence,text,filename,type,speaker_party
2705389,218,17,0,"Katherina Reiche, Parl. Staatssekretärin beim Bundesminister für Umwelt, Naturschutz und Reaktorsicherheit",Katherina Reiche,katherina-reiche,118,"Dem Minister geht es vor allem um einen politischen Schulterschluss. Wir haben eine existierende und gut funktionierende Agentur für die weltweite Förderung und Unterstützung der erneuerbaren Energien, die IRENA. Sie ist ja maßgeblich auf deutsche Initiative hin entstanden und hat sich, wie wir finden, hervorragend entwickelt.

Hier geht es um ein zusätzliches politisches Momentum. Wie es so üblich ist, werden befreundete und auch unterstützende Staaten gefragt und angesprochen. Ziel ist es, auch solche Staaten wie China mit ins Boot zu holen, die sich zwar nicht in ein Klimaschutzabkommen einbinden lassen mögen, auf der anderen Seite aber ganz klar ihre Unterstützung für Erneuerbare-Energien-Ziele, auch im neuen Fünfjahrplan, dokumentiert haben. Hier ein politisches Momentum zu nutzen, ist Ziel der Initiative des Ministers.

Zu den Staaten - ich habe eben schon einige er-wähnt -: In der Tat waren beim Abendessen acht Staatsvertreter dabei. Ich finde jetzt die komplette Liste nicht. Auf jeden Fall waren Frankreich, Großbritannien, Marokko, Tonga, Südafrika dabei. Die fehlenden drei Namen liefere ich Ihnen nach.",data/txt/17218.txt,speech,
2705390,218,17,0,Vizepräsidentin Petra Pau,Petra Pau,petra-pau,119,Die nächste Nachfrage stellt der Kollege Miersch.,data/txt/17218.txt,chair,
2705391,218,17,0,Dr. Matthias Miersch (SPD),Dr. Matthias Miersch,matthias-miersch,120,"Frau Staatssekretärin, Sie haben eben die eigentliche Frage des Kollegen Kelber nicht beantwortet. Er hat Sie mit der Beschlussfassung des Parlamentarischen Beirats für nachhaltige Entwicklung konfrontiert, der sich über alle Fraktionsgrenzen hinweg dafür ausgesprochen hat, Hermesbürgschaften künftig nicht mehr für den Bau von Atomanlagen im Ausland bereitzustellen. Das wäre nämlich ein offenkundiger Widerspruch beispielsweise zu dem, was ein Klub der Energiewendestaaten tut. Insofern meine Frage, verbunden mit meiner Bitte, diese zu beantworten - auch Herr Kelber hat diese Frage eben gestellt -: Wie steht die Bundesregierung zu diesem Beschluss des Parlamentarischen Beirats für nachhaltige Entwicklung?",data/txt/17218.txt,speech,spd
2705392,218,17,0,"Katherina Reiche, Parl. Staatssekretärin beim Bundesminister für Umwelt, Naturschutz und Reaktorsicherheit",Katherina Reiche,katherina-reiche,121,"Die Bundesregierung hat ihre Haltung klar bekräftigt, dass sie die Einschätzung des Parlamentarischen Beirates an dieser Stelle nicht teilt. Ich sehe allerdings keinen Widerspruch, einen Klub der Energiewendestaaten zu unterstützen und damit einen Klub von Staaten, die die erneuerbaren Energien fördern, zu initiieren. An dieser Stelle hat der Minister eine ganz klare Auffassung ge-äußert und ist auf internationaler Ebene initiativ.",data/txt/17218.txt,speech,
2705393,218,17,0,Vizepräsidentin Petra Pau,Petra Pau,petra-pau,122,"Ich bitte darum, mir die weiteren Nachfragewünsche so rechtzeitig zu signalisieren, dass ich nicht schon die nächste schriftlich eingereichte Frage aufrufe.",data/txt/17218.txt,chair,
2705394,218,17,0,Ulrich Kelber [SPD],Ulrich Kelber,ulrich-kelber,123,Es kommt immer auf die Antworten an!,data/txt/17218.txt,poi,spd
2705395,218,17,0,Vizepräsidentin Petra Pau,Petra Pau,petra-pau,124,Die nächste Nachfrage stellt die Kollegin Kotting-Uhl.,data/txt/17218.txt,chair,
2705396,218,17,0,Sylvia Kotting-Uhl (BÜNDNIS 90/DIE GRÜNEN),Sylvia Kotting-Uhl,sylvia-kotting-uhl,125,"Entschuldigung, Frau Präsidentin. - Ich war jetzt doch etwas konsterniert über die Feststellung, die Bundesregierung habe ihre Haltung klar bekräftigt. Denn wir haben heute Vormittag im Umweltausschuss von der Bundesregierung gehört, dass Stellungnahmen dazu noch nicht abgegeben worden seien, dass das Zitat von Bundeswirtschaftsminister Rösler, das man bei Spiegel Online finden konnte und das das bestätigt, was Sie jetzt sagen, nicht freigegeben gewesen sei und dass auch der Parlamentarische Beirat noch keine Stellungnahme der Bundesregierung bekommen habe. Insofern würde mich jetzt interessieren: Wo ist diese Stellungnahme bisher bekräftigt worden?",data/txt/17218.txt,speech,gruene
2705397,218,17,0,"Katherina Reiche, Parl. Staatssekretärin beim Bundesminister für Umwelt, Naturschutz und Reaktorsicherheit",Katherina Reiche,katherina-reiche,126,"Frau Kollegin Kotting-Uhl, mir ist keine Änderung der bisherigen Praxis der Bundesregierung bekannt. Ich kann an dieser Stelle keine andere Praxis verkünden, obwohl dies Herr Kollege Miersch vermutlich gerne gehört hätte.",data/txt/17218.txt,speech,
2705398,218,17,0,Vizepräsidentin Petra Pau,Petra Pau,petra-pau,127,Auch der Kollege Frank Schwabe hat noch eine Nachfrage.,data/txt/17218.txt,chair,
2705399,218,17,0,Frank Schwabe (SPD),Frank Schwabe,frank-schwabe,128,"Frau Staatssekretärin, ich habe eine Nachfrage zu demselben Thema. Wir alle waren heute Morgen im Ausschuss anwesend; deswegen kommen jetzt die spontanen Nachfragen. Da hat Ihre Kollegin Staatssekretärin deutlich gemacht, es gebe noch keine abgestimmte Haltung. Das, was in den Medien zu lesen gewesen sei, sei unabgestimmt gewesen und man ringe noch um eine Haltung. Sie sagen jetzt: Es gibt eine klare Haltung. - Das ist ein offensichtlicher Widerspruch. Deswegen frage ich Sie noch einmal: Gibt es eine Haltung der Bundesregierung zu der Frage, ob wir Hermesbürgschaften für Brasilien, aber auch für andere Länder im Bereich der Atomtechnologie bereitstellen?",data/txt/17218.txt,speech,spd
2705400,218,17,0,"Katherina Reiche, Parl. Staatssekretärin beim Bundesminister für Umwelt, Naturschutz und Reaktorsicherheit",Katherina Reiche,katherina-reiche,129,"Ich sehe keinen Widerspruch zwischen der Auffassung, dass eine Haltung abgestimmt werden soll, und der generellen Aussage, dass mir nicht bekannt ist, dass eine solche verändert werden soll. Wenn Sie jetzt einen Widerspruch konstruieren wollen, dann können Sie dies tun; aber ich sehe ihn nicht.",data/txt/17218.txt,speech,
2705401,218,17,0,Vizepräsidentin Petra Pau,Petra Pau,petra-pau,130,"Damit kommen wir zur Frage 14 des Kollegen Ulrich Kelber:

Was genau soll der Unterschied zwischen dem Klub der Energiewendestaaten und IRENA sein, und welche ersten Schritte des Klubs sind geplant?

Bitte, Frau Staatssekretärin.",data/txt/17218.txt,chair,
2705402,218,17,0,"Katherina Reiche, Parl. Staatssekretärin beim Bundesminister für Umwelt, Naturschutz und Reaktorsicherheit",Katherina Reiche,katherina-reiche,131,"In Abu Dhabi, Herr Kollege Kelber, hat Minister Altmaier im Rahmen seiner Teilnahme an der jährlichen Versammlung von IRENA informelle Konsultationen mit verschiedenen Vorreiterstaaten geführt und die Idee eines solchen Klubs diskutiert. Nun sind weitere Konsultationen mit möglichen teilnehmenden Staaten geplant. Im Anschluss daran wird über die nächsten Schritte beraten.

Die Frage der Zusammensetzung und der Treffen der neuen Initiative wird derzeit noch konsultiert. Eine endgültige Entscheidung von Minister Altmaier zum Konzept, insbesondere mit welchen Vorreiterstaaten bei dieser Initiative zusammengearbeitet wird, steht noch aus. Ich bitte daher um Verständnis, dass das Konzept dem Parlament erst nach der Entscheidung von Minister Altmaier vorgelegt werden kann. Der Zeitpunkt, zu dem er diese Entscheidung fällen kann, hängt stark vom Verlauf der informellen Konsultationen ab und kann momentan nicht genau festgelegt werden.",data/txt/17218.txt,speech,
2705403,218,17,0,Vizepräsidentin Petra Pau,Petra Pau,petra-pau,132,Sie haben das Wort zur ersten Nachfrage.,data/txt/17218.txt,chair,
2705404,218,17,0,Ulrich Kelber (SPD),Ulrich Kelber,ulrich-kelber,133,"Ich habe zur Kenntnis genommen, dass der Bundesminister die Gründung einer neuen internationalen Organisation vorgeschlagen hat, ohne ein Konzept dafür zu haben, was diese internationale Organisation eigentlich tun soll. Das mag jeder selbst bewerten.

Das war eine Veranstaltung der Internationalen Agentur für erneuerbare Energien. Diese ist auf Betreiben meines leider 2010 verstorbenen Kollegen Hermann Scheer, also auf deutsche Initiative hin, gegründet worden - sie ist heute äußerst erfolgreich und hat weit über 100 Mitgliedstaaten - mit der Aufgabe, die Energiewende durch den Ausbau erneuerbarer Energien und Ablöseszenarien mittels erneuerbarer Energien voranzutreiben. Wenn das Ministerium jetzt einen Klub der Energiewendestaaten starten will, im Rahmen dessen bei einem solchen Ausbau und bei entsprechenden Ablösestrategien ein enger Schulterschluss passieren soll, müssten Sie doch in der Lage sein, uns hier und heute einen einzigen, einen klitzekleinen Unterschied zwischen der Aufgabenstellung des Klubs der Energiewendestaaten und der Aufgabenstellung der von Deutschland ins Leben gerufenen Internationalen Agentur für erneuerbare Energien, deren Mitglieder ja die Staaten sind, zu nennen.",data/txt/17218.txt,speech,spd
2705405,218,17,0,"Katherina Reiche, Parl. Staatssekretärin beim Bundesminister für Umwelt, Naturschutz und Reaktorsicherheit",Katherina Reiche,katherina-reiche,134,"Herr Kollege Kelber, das liegt daran, dass Sie mir -offenbar nicht zuhören. Es handelt sich nicht um eine -eigenständige Organisation, sondern um einen politischen Zusammenschluss von interessierten Staaten, nicht um eine formelle Organisation mit Sitz, Struktur, Sekretariat und dergleichen.

Dafür gibt es die IRENA. Sie wird von uns unterstützt. Wir haben deutlich gemacht, wie sehr wir die Arbeit der IRENA schätzen. Wie Sie wissen, läuft das IRENA Innovations- und Technologiezentrum in Bonn sehr gut. Wir haben nichts daran zu kritisieren. Ganz im Gegenteil: Wir freuen uns darüber, dass dies so gut gelingt. Aber auch Sie, Herr Kollege Kelber, werden, glaube ich, den Unterschied kennen zwischen einer Institution und einem politischen Zusammenschluss, einem politischen Momentum, bei dem es darum geht, auf politischer Ebene noch mehr Rückenwind für den Ausbau erneuerbarer Energien zu bekommen.",data/txt/17218.txt,speech,
2705406,218,17,0,Vizepräsidentin Petra Pau,Petra Pau,petra-pau,135,Sie haben das Wort zu einer zweiten Nachfrage.,data/txt/17218.txt,chair,
2705407,218,17,0,Ulrich Kelber (SPD),Ulrich Kelber,ulrich-kelber,136,Meine zweite Frage ist sehr leicht zu beantworten.,data/txt/17218.txt,speech,spd
2705408,218,17,0,,,,137,Heiterkeit bei der SPD und der LINKEN,data/txt/17218.txt,poi,
2705409,218,17,0,Ulrich Kelber (SPD),Ulrich Kelber,ulrich-kelber,138,"Gibt es außer der Pressemitteilung darüber, dass der Minister einen Klub der Energiewendestaaten einrichten will, irgendein weiteres Dokument des Ministeriums zum Klub der Energiewendestaaten?",data/txt/17218.txt,speech,spd
2705410,218,17,0,"Katherina Reiche, Parl. Staatssekretärin beim Bundesminister für Umwelt, Naturschutz und Reaktorsicherheit",Katherina Reiche,katherina-reiche,139,"Es gibt informelle Konsultationen, und informelle Konsultationen haben es an sich, dass man sich informell austauscht.",data/txt/17218.txt,speech,
2705411,218,17,0,Vizepräsidentin Petra Pau,Petra Pau,petra-pau,140,Der Kollege Ott stellt die nächste Nachfrage.,data/txt/17218.txt,chair,
2705412,218,17,0,Dr. Hermann E. Ott (BÜNDNIS 90/DIE GRÜNEN),Dr. Hermann E. Ott,hermann-ott,141,"Vielen Dank, Frau Präsidentin. - Frau Staatssekretärin, Sie wissen vielleicht, dass ich ein großer Fan dieser Klubidee bin.",data/txt/17218.txt,speech,gruene
2705413,218,17,0,"Katherina Reiche, Parl. Staatssekretärin beim Bundesminister für Umwelt, Naturschutz und Reaktorsicherheit",Katherina Reiche,katherina-reiche,142,"Es ist schön, dass Sie das feststellen. Da haben wir ja schon mal einen in der Opposition.",data/txt/17218.txt,speech,
2705414,218,17,0,Dr. Hermann E. Ott (BÜNDNIS 90/DIE GRÜNEN),Dr. Hermann E. Ott,hermann-ott,143,"Ich würde sogar sagen, dass ich wahrscheinlich der Erste war, der diese Idee in diesem Hause vertreten hat.",data/txt/17218.txt,speech,gruene
2705415,218,17,0,Ulrich Kelber [SPD],Ulrich Kelber,ulrich-kelber,144,Der einzige Fan außer dem Minister!,data/txt/17218.txt,poi,spd
2705416,218,17,0,Dr. Hermann E. Ott (BÜNDNIS 90/DIE GRÜNEN),Dr. Hermann E. Ott,hermann-ott,145,,data/txt/17218.txt,speech,gruene
2705417,218,17,0,"Katherina Reiche, Parl. Staatssekretärin beim Bundesminister für Umwelt, Naturschutz und Reaktorsicherheit",Katherina Reiche,katherina-reiche,146,"Oh, jetzt begeben Sie sich aufs Glatteis, Herr Kollege.",data/txt/17218.txt,speech,
2705418,218,17,0,Dr. Hermann E. Ott (BÜNDNIS 90/DIE GRÜNEN),Dr. Hermann E. Ott,hermann-ott,147,"Der Hintergrund meiner Idee ist, dass das bisherige Vorgehen im Rahmen des Klimaregimes nicht erfolgversprechend ist, weil einzelne Staaten, vor allem große wie die USA, China und Indien, den Prozess sozusagen ins Unendliche blockieren können, und dass es deshalb gut sein kann, die Vorreiter in einem Klub zu versammeln. - So weit, so gut.",data/txt/17218.txt,speech,gruene
2705419,218,17,0,"Aber deshalb noch einmal die Frage, die der Kollege Kelber gerade mit größter Intensität zu stellen versucht hat","Aber deshalb noch einmal die Frage, die der Kollege Kelber gerade mit größter Intensität zu stellen versucht hat",aber-deshalb-noch-einmal-die-frage-die-der-kollege-kelber-gerade-mit-großter-intensitat-zu-stellen-versucht-hat,148,,data/txt/17218.txt,speech,
2705420,218,17,0,Ulrich Kelber [SPD],Ulrich Kelber,ulrich-kelber,149,Ich habe sie gestellt! Sie wurde nicht beantwortet!,data/txt/17218.txt,poi,spd
2705421,218,17,0,"Aber deshalb noch einmal die Frage, die der Kollege Kelber gerade mit größter Intensität zu stellen versucht hat","Aber deshalb noch einmal die Frage, die der Kollege Kelber gerade mit größter Intensität zu stellen versucht hat",aber-deshalb-noch-einmal-die-frage-die-der-kollege-kelber-gerade-mit-großter-intensitat-zu-stellen-versucht-hat,150,"Was ist denn der Sinn und Zweck dieses Energiewendeklubs? Was ist der Mehrwert, und wie soll dieser Klub einen Schub für die internationalen Klimaverhandlungen erzeugen?",data/txt/17218.txt,speech,
2705422,218,17,0,"Katherina Reiche, Parl. Staatssekretärin beim Bundesminister für Umwelt, Naturschutz und Reaktorsicherheit",Katherina Reiche,katherina-reiche,151,"Es sollen neue politische Akzente gesetzt werden. Herr Kollege, Sie haben angesprochen und sehr richtig eingeschätzt, dass die Klimaverhandlungen auf internationaler Ebene sehr zäh geworden sind. Die Überlegung ist: Neben der bestehenden Struktur IRENA, in der anerkennenswerterweise mittlerweile auch die USA Mitglied sind - IRENA ist eine der wenigen internationalen Organisationen, denen die USA in den letzten Jahren überhaupt beigetreten sind -, braucht es ein zusätzliches politisches Momentum. Die IRENA leistet hervorragende Arbeit, wenn es darum geht, Informationen zu sammeln, Programme zu bündeln, Technologieausbreitung zu unterstützen. Dennoch braucht es in Staaten auch immer einen politischen Hebel und eine politische Willensbildung darüber, ein Stück voranzugehen. Die Idee, über ein Bekenntnis zu erneuerbaren Energien im Klimaschutzbereich voranzukommen, ist sicherlich mit Anlass für die Gründung dieses Klubs.

Aber noch einmal: Auch auf informellem Wege wollen wir herausfinden, was andere Staaten bewegt, wie ihre Strategien sind. Darüber der Öffentlichkeit schon alles zu berichten, wäre vielleicht nicht ganz fair. Insofern bleibe ich bei meiner Aussage, dass die Konsultationen informell sind, aber auch weiter nach vorn gebracht werden.",data/txt/17218.txt,speech,
2705423,218,17,0,Vizepräsidentin Petra Pau,Petra Pau,petra-pau,152,Der Kollege Schwabe stellt eine weitere Nachfrage.,data/txt/17218.txt,chair,
2705424,218,17,0,Frank Schwabe (SPD),Frank Schwabe,frank-schwabe,153,"Frau Staatssekretärin, es ist ja unsere Aufgabe, zu hinterfragen, was die Regierung tut. Das, was Sie uns vorstellen, sind informelle Gespräche. Informelle Gespräche kann man natürlich mit jedem andauernd immer wieder führen. Die Frage ist doch bloß: Muss man das dann in der Öffentlichkeit groß als Klub der Energiewendestaaten ankündigen? Wenn man nachfragt, bekommt man nämlich zur Antwort: Es gibt kein Konzept, nicht einmal ein einfaches Papier, auf dem man sehen könnte, wie das Ganze vonstattengeht.

Also frage ich Sie: Möchten Sie vielleicht dem Eindruck entgegentreten, dass dieser Begriff Klub der Energiewendestaaten am Ende ein aufgeblasener Ballon, ein großes Wortspiel ist, das aber nicht hinterlegt ist, weil Herr Altmaier so versucht hat, sein 10Punkte-Programm, das er im letzten Sommer vorgestellt hat, aufzublasen?",data/txt/17218.txt,speech,spd
2705425,218,17,0,"Katherina Reiche, Parl. Staatssekretärin beim Bundesminister für Umwelt, Naturschutz und Reaktorsicherheit",Katherina Reiche,katherina-reiche,154,"Das 10-Punkte-Programm von Minister Altmaier enthält für die internationale Ebene in der Tat auch die Idee eines Klubs der Energiewendestaaten. Noch einmal: Es geht nicht darum, Strukturen zu duplizieren, sondern darum, ein politisches Momentum zu kreieren. Auf internationaler Ebene, auch bei Klimaschutzverhandlungen, werden verschiedene informelle Runden gegründet, um ein bestimmtes politisches Momentum zu erzeugen. Ich finde, gerade für Sie, der Sie sich auch in diesem Metier bewegen, dürften solche Runden, auch solche Impulsrunden, überhaupt nichts Unbekanntes sein. Insofern verstehe ich nicht, dass Sie, im Gegensatz zu Herrn Kollegen Ott, offenbar nicht hinter dieser Idee stehen.",data/txt/17218.txt,speech,
2705426,218,17,0,Ulrich Kelber [SPD],Ulrich Kelber,ulrich-kelber,155,Ich mache doch nicht als Erstes eine Pressemitteilung! Das ist doch peinlich!,data/txt/17218.txt,poi,spd
2705427,218,17,0,"Katherina Reiche, Parl. Staatssekretärin beim Bundesminister für Umwelt, Naturschutz und Reaktorsicherheit",Katherina Reiche,katherina-reiche,156,"Die Umsetzung einer solchen Idee braucht Zeit. Wir werden die internationalen Treffen und Zwischentreffen nutzen, um weiter für diese Idee zu werben und zu konsultieren.",data/txt/17218.txt,speech,
2705428,218,17,0,Vizepräsidentin Petra Pau,Petra Pau,petra-pau,157,"Wir kommen zur Frage 15 des Kollegen Dr. Hermann Ott:

Welche Schritte plant die Bundesregierung nach der versuchten Gründung des seit dem Sommer 2012 geplanten Klubs der Energiewendestaaten am Rande der IRENA-Jahrestagung in Abu Dhabi, um die geplante Allianz ins Leben zu rufen, und wann ist mit der Vorlage eines Konzeptes zu rechnen, das dem Ausschuss für Umwelt, Naturschutz und Reaktorsicherheit des Deutschen Bundestages für Mitte Januar 2013 versprochen wurde?

Wir haben gerade gelernt, dass der Kollege Ott Fan dieser Idee ist. - Frau Staatssekretärin.",data/txt/17218.txt,chair,
2705429,218,17,0,"Katherina Reiche, Parl. Staatssekretärin beim Bundesminister für Umwelt, Naturschutz und Reaktorsicherheit",Katherina Reiche,katherina-reiche,158,"Herr Kollege Ott, in Abu Dhabi hat Minister Altmaier im Rahmen seiner Teilnahme an der jährlichen Versammlung von IRENA informelle Konsultationen mit verschiedenen Vorreiterstaaten geführt und die Idee eines solchen Klubs diskutiert. Nun sind zunächst weitere Konsultationen mit möglichen teilnehmenden Staaten - das hatten wir schon - geplant. Im Anschluss daran werden die nächsten Schritte beraten.

Die Zusammensetzung und die Treffen der neuen Initiative werden derzeit noch konsultiert. Eine endgültige Entscheidung von Minister Altmaier - das doppelt sich mit der Antwort auf die Frage des Kollegen Kelber - zum Konzept und dazu, mit welchen Vorreiterstaaten in dieser Initiative zusammengearbeitet wird, steht noch aus. Ich bitte daher um Ihr Verständnis, dass das Konzept dem Parlament erst nach der Entscheidung von Minister Altmaier vorgelegt werden kann. Wie gesagt, der Zeitpunkt hängt vom weiteren Verlauf der Konsultationen ab.",data/txt/17218.txt,speech,
2705430,218,17,0,Vizepräsidentin Petra Pau,Petra Pau,petra-pau,159,Sie haben das Wort zu einer ersten Nachfrage.,data/txt/17218.txt,chair,
2705431,218,17,0,Dr. Hermann E. Ott (BÜNDNIS 90/DIE GRÜNEN),Dr. Hermann E. Ott,hermann-ott,160,"Wie gut, dass der Kollege Kelber und ich an dieser Idee genauso brennend interessiert sind.

Ich möchte noch einmal klarstellen, dass es nicht dieser Energiewendeklub ist, der mich begeistert, sondern die Idee, dass es außerhalb des Klimaregimes Vorreiterallianzen geben muss, um die Klimapolitik voranzubringen, damit wir die geringe Zeit, die uns noch bleibt, um die Wende überhaupt herbeizuführen, nutzen.

Meine Nachfrage: Sie vertrösten uns wieder, indem Sie sagen, es müssten noch Entscheidungen getroffen werden. Es drängt sich doch ein wenig der Eindruck auf, dass eine große Wahlkampfblase ins Leben gerufen worden ist: Bis zum Herbst soll gar nicht viel passieren, das Ganze kann aber immer sozusagen wie eine Monstranz vor sich her getragen werden, nach dem Motto: Wir wollten es ja.

Ich frage Sie noch einmal - Herr Kollege Schwabe hat es schon angesprochen -: Wollen Sie dem nicht mit etwas mehr Substanz entgegentreten?",data/txt/17218.txt,speech,gruene
2705432,218,17,0,"Katherina Reiche, Parl. Staatssekretärin beim Bundesminister für Umwelt, Naturschutz und Reaktorsicherheit",Katherina Reiche,katherina-reiche,161,"Das Etablieren von internationalen Gesprächsrunden und internationalen Foren beansprucht erstens Zeit. Zweitens ist Klimaschutz völlig unabhängig und interessiert sich nicht für Wahlen. Andere Länder - seien es Entwicklungs-, Schwellen- oder Industrieländer - gucken nicht nach Deutschland und fragen nach Wahlen. Sie schauen danach, welche Dinge wir bereit sind, in den internationalen Prozess einzubringen.

Auch IRENA wurde zu einem Zeitpunkt aufgebaut, in dem man über Wahlkampf hätte sprechen können. Sie entwickelte sich von einer Idee hin zu Strukturen. Auch IRENA ist nicht über Nacht gekommen. Insofern bitte ich Sie um Geduld für das laufende Verfahren. Ich meine, es lohnt sich jede Initiative, die uns bei dem Vorhaben voranbringt, zu mehr internationalem Klimaschutz und mehr Zusammenarbeit beim Ausbau der erneuerbaren Energien zu kommen.",data/txt/17218.txt,speech,
2705433,218,17,0,Vizepräsidentin Petra Pau,Petra Pau,petra-pau,162,Sie haben die Möglichkeit zu einer zweiten Nachfrage.,data/txt/17218.txt,chair,
2705434,218,17,0,Dr. Hermann E. Ott (BÜNDNIS 90/DIE GRÜNEN),Dr. Hermann E. Ott,hermann-ott,163,"Damit können wir die nächste Frage dazu auch fallen lassen; denn wir haben das Thema erschöpfend behandelt.

Wenn es nun nicht der Klub der Energiewendestaaten ist, der das Ganze reißen soll, so frage ich: Welche konkreten Maßnahmen plant die Bundesregierung in Bezug auf die Klimapolitik für das nächste halbe Jahr?",data/txt/17218.txt,speech,gruene
2705435,218,17,0,"Katherina Reiche, Parl. Staatssekretärin beim Bundesminister für Umwelt, Naturschutz und Reaktorsicherheit",Katherina Reiche,katherina-reiche,164,Ich muss präzise nachfragen: auf internationaler oder auf nationaler Ebene?,data/txt/17218.txt,speech,
2705436,218,17,0,Dr. Hermann E. Ott (BÜNDNIS 90/DIE GRÜNEN),Dr. Hermann E. Ott,hermann-ott,165,"Zur europäischen Ebene, zum Emissionshandel, kommen wir gleich. Jetzt meine ich die internationale Ebene.",data/txt/17218.txt,speech,gruene
2705437,218,17,0,"Katherina Reiche, Parl. Staatssekretärin beim Bundesminister für Umwelt, Naturschutz und Reaktorsicherheit",Katherina Reiche,katherina-reiche,166,"Wir sind dabei, das Programm, das in diesem Jahr ansteht, abzuarbeiten. Wir haben uns auf einen Fahrplan geeinigt. Bis zur Konferenz in Polen müssen wir ein Arbeitsprogramm vorlegen. Hier gilt es, viele Gespräche zu führen. Diese werden wir weiter fortsetzen. Der Klub der Energiewendestaaten wäre ein weiterer Beitrag. Im Übrigen sind wir, wenn es darum geht, erneuerbare Energien voranzubringen und uns auf europäischer Ebene zu etablieren, auf einem guten Weg.",data/txt/17218.txt,speech,
2705438,218,17,0,Vizepräsidentin Petra Pau,Petra Pau,petra-pau,167,Der Kollege Krischer hat noch eine Nachfrage zur Frage 15 bzw. zur Beantwortung derselben.,data/txt/17218.txt,chair,
2705439,218,17,0,Oliver Krischer (BÜNDNIS 90/DIE GRÜNEN),Oliver Krischer,oliver-krischer,168,"Frau Staatssekretärin, herzlichen Dank für Ihre Antwort, die mich zu der Frage veranlasst: Welche konkreten Maßnahmen plant die Bundesregierung im Zuge der nationalen Energiepolitik? Was steht diesbezüglich noch auf der Agenda? Womit können wir jenseits des hier inzwischen fast humoristisch behandelten Energiewendeklubs auf internationaler Ebene rechnen?",data/txt/17218.txt,speech,gruene
2705440,218,17,0,"Katherina Reiche, Parl. Staatssekretärin beim Bundesminister für Umwelt, Naturschutz und Reaktorsicherheit",Katherina Reiche,katherina-reiche,169,"Herr Kollege Krischer, wir haben eine Reihe von Vorhaben. Wir haben unsere Ziele auf nationaler und europäischer Ebene weiterhin zu erfüllen. Der Minister hat jetzt den Vorschlag einer Novelle zum Erneuerbaren-Energien-Gesetz unterbreitet; die Ministerpräsidenten haben sich dazu mit der Bundeskanzlerin verabredet. Wir werden den Netzausbau weiter beschleunigen. Wir werden für mehr Bürgerakzeptanz sorgen. Verschiedene Foren arbeiten daran und liefern Ergebnisse.

Ich finde allerdings, dass dieses Thema den Rahmen der heutigen Fragestunde sprengt. Das gilt im Übrigen auch für die Frage zuvor; denn der Inhalt dieser Frage war nicht Gegenstand der schriftlich eingereichten Frage. Insofern müsste ich sie gar nicht beantworten.",data/txt/17218.txt,speech,
2705441,218,17,0,,,,170,Lachen des Abg. Ulrich Kelber [SPD],data/txt/17218.txt,poi,
