id,sitzung,wahlperiode,in_writing,speaker,speaker_cleaned,speaker_fp,sequence,text,filename,type,speaker_party
2174865,239,17,0,,,,70,"Den Agenturmeldungen ist zu entnehmen, dass das Thema Fracking auf der ursprünglichen Kabinettstagesordnung von heute gestanden haben soll, es aber wieder heruntergenommen worden sein soll. Können Sie uns die Pläne der Bundesregierung wenigstens skizzenhaft beschreiben? Ich gehe nicht davon aus, dass es Pläne gibt, die 17. Legislaturperiode zu verlängern, sodass wir nur noch begrenzte Sitzungszeit zur Verfügung haben. Wie sieht der Beratungsablauf aus? Befasst sich das -Kabinett noch in dieser Legislaturperiode mit einem Gesetzentwurf zum Thema Fracking, und, wenn ja, wann?

Ursula Heinen-Esser, Parl. Staatssekretärin beim Bundesminister für Umwelt, Naturschutz und Reaktorsicherheit:

Sie wissen, dass die betroffenen Gemeinden und Kommunen, Bundestagskollegen und Landesregierungen, insbesondere die nordrhein-westfälische Landes-regierung, immer wieder Vorschläge einbringen, was verändert werden kann. Das betrifft zum Beispiel - ich glaube, es würde zu weit führen, wenn ich Ihnen jetzt alle Eckpunkte nennen würde, um die es geht - die -Änderung des Wasserhaushaltsgesetzes - das ist Ihnen bekannt - und vor allen Dingen auch - das ist uns auch ganz besonders wichtig - die Änderung der UVP-Verordnung Bergbau. Das sind die beiden großen Bereiche.

Über eine Einbringung kann ich Ihnen zum jetzigen Zeitpunkt leider nichts sagen.

Präsident Dr. Norbert Lammert:

Kollege Lenkert.

Ralph Lenkert (DIE LINKE):

Frau Staatssekretärin, Ihnen ist sicherlich bekannt, dass Mineralwasserbrunnen oftmals nicht in einem Trinkwasserschutzgebiet liegen. Wie planen Sie, sicherzustellen, dass Einzugsgebiete von Mineralwasserbrunnen zukünftig vor Fracking geschützt sind?

Ursula Heinen-Esser, Parl. Staatssekretärin beim Bundesminister für Umwelt, Naturschutz und Reaktorsicherheit:

Wir haben ein generelles Verbot der Tiefbohrung sowie der untertägigen Ablagerungen in Wasserschutz- und Heilwasserschutzgebieten geplant.

Präsident Dr. Norbert Lammert:

Kollegin Vogt.

Ute Vogt (SPD):

Frau Staatssekretärin, nachdem Sie uns Einblicke in den derzeit stattfindenden Meinungsfindungsprozess in den Koalitionsfraktionen gegeben haben, will ich eine Nachfrage in Bezug auf den Bodensee stellen. Der Bodensee ist ja nicht nur als See für diejenigen spannend, die in der Region leben und ihn nutzen, sondern er ist vor allem auch ein großes Trinkwasserreservoir für weite Teile des Landes Baden-Württemberg. Da die -Koalition sich noch im Meinungsfindungsprozess befindet, möchte ich fragen, ob die Bundesregierung und insbesondere das Bundesumweltministerium für sich schon sagen können, dass sie ein generelles Verbot von -Fracking-Bohrungen im Bereich dieser Trinkwasserressource für denkbar halten.

Ursula Heinen-Esser, Parl. Staatssekretärin beim Bundesminister für Umwelt, Naturschutz und Reaktorsicherheit:

Ja, ich halte das für denkbar.

Präsident Dr. Norbert Lammert:

Kollegin Flachsbarth.

Dr. Maria Flachsbarth (CDU/CSU):

Frau Staatssekretärin, eben wurde der Vertreter einer niedersächsischen Kommune genannt, der besorgt sei, dass die Bundesregierung die betroffenen Kommunen alleine lassen würde. Könnten Sie mir bestätigen, dass in den letzten 20 bis 30 Jahren in Niedersachsen circa 20 Prozent des deutschen Erdgasverbrauchs gefördert wurden, und zwar unter Einhaltung rechtlicher Rahmenbedingungen? Wir müssen aber an der derzeitigen gesetzlichen Situation dringend arbeiten; das ist auch mein unbedingtes Verständnis als Umweltpolitikerin.

Könnten Sie mir ferner bestätigen, dass zumindest Vertreterinnen und Vertreter der Regierungsfraktionen in sehr engem Kontakt mit Ihrem Haus und dem Bundeswirtschaftsministerium stehen, um eine tatsächliche -Verbesserung der derzeitigen rechtlichen Situation herbeizuführen, insbesondere in Bezug auf den Umweltschutz, den Wasserschutz und den Bodenschutz?

Ursula Heinen-Esser, Parl. Staatssekretärin beim Bundesminister für Umwelt, Naturschutz und Reaktorsicherheit:

Kollegin Flachsbarth, das kann ich bestätigen. Das ist das zentrale Anliegen, weshalb wir hier zu neuen gesetzlichen Regelungen kommen sollten, weshalb Veränderungen notwendig sind. Wenn die Hürde Bundestag genommen ist, wird die Hürde Bundesrat zu nehmen sein. Dort wird die Unterstützung der rot-grünen Länder notwendig sein, um einen entsprechenden Gesetzentwurf durchzubringen.

Präsident Dr. Norbert Lammert:

Ich rufe die Frage 11 des Kollegen Bollmann auf:

Mit welchen Maßnahmen will die Bundesregierung die zunehmende Meeresverschmutzung, insbesondere durch -Plastikmüll, wie vom Bundesminister für Umwelt, Naturschutz und Reaktorsicherheit, Peter Altmaier, anlässlich der Berliner Internationalen Konferenz zur Verhinderung von Meeresmüll in europäischen Meeren angekündigt, konkret bekämpfen?

Ursula Heinen-Esser, Parl. Staatssekretärin beim Bundesminister für Umwelt, Naturschutz und Reaktorsicherheit:

Aus Sicht der Bundesregierung, Kollege Bollmann, ist eine geordnete Abfallwirtschaft von der sicheren Erfassung über die hochwertige Verwertung bis hin zur umweltgerechten Beseitigung das zentrale Element zur Reduzierung der Meeresverschmutzung vom Lande aus. In Deutschland haben wir auf diesem Gebiet viel erreicht und damit auch die Verschmutzung der Meere durch Abfälle vom Lande aus weitestgehend minimiert.

Die Bundesregierung hält alle Aktionsebenen - national, regional, EU-weit und global - sowie alle Aktivitäten - Regierungshandeln, NGO-Aktivitäten, Maßnahmen des privaten Sektors - für gleichermaßen bedeutsam. Nur durch vertikale und horizontale Integration aller Aktivitäten kann eine erfolgreiche Bekämpfung des Problems Meeresmüll erfolgen. Die Bundesregierung wird daher weiterhin auf nationaler, europäischer und internationaler Ebene zur Förderung der Kreislaufwirtschaft und zur Stärkung des Kunststoffrecyclings beitragen.

In Bezug auf die Umsetzung der Meeresstrategie-Rahmenrichtlinie der EU wird sich die Bundesregierung weiterhin durch aktive Mitarbeit bei den Facharbeiten, unter anderem durch einen Kovorsitz in einer einschlägigen technischen Facharbeitsgruppe, engagieren. Das Engagement auf regionaler Ebene im Rahmen der regionalen Meeresschutzkooperation, insbesondere mit Blick auf die nun zu erarbeitenden regionalen Aktionspläne, ist für uns eines der Herzstücke einer erfolgreichen Bottom-up-Politik zur Verhinderung der Meeresvermüllung weltweit. Auch hier wird die Bundesregierung ihr Engagement fortsetzen.

Auf nationaler Ebene wird Bundesumweltminister Altmaier einen Runden Tisch Meeresmüll einberufen, der regionale Lösungen für unsere Küsten erarbeitet. Am geplanten Runden Tisch, der möglichst noch in diesem Sommer stattfinden soll, sollen nach Ansicht der Bundesregierung unter anderem Inselbürgermeister, Vertreter der Tourismusindustrie, der Fischerei, der Schifffahrt, der Hafenbetreiber und der Umweltverbände teilnehmen. Die Fragestellung lautet: Was kann konkret vor Ort gemacht werden?

Präsident Dr. Norbert Lammert:

Nachfragen?

Gerd Bollmann (SPD):

Es gab ja im Vorfeld dieser Konferenz aus den Reihen der Opposition den einen oder anderen Vorschlag zu Plastiktüten und zu anderem. Für diese Vorschläge zeigte sich die Bundesregierung nicht besonders empfänglich. Deshalb meine Frage: Herr Altmaier hat auf der Konferenz gesagt, dass er dies nun bekämpfen will. Wie stellt er sich das konkret vor?

Ursula Heinen-Esser, Parl. Staatssekretärin beim Bundesminister für Umwelt, Naturschutz und Reaktorsicherheit:

Wir haben hinsichtlich der Plastiktragetaschen gesagt, dass der deutsche Beitrag dazu nicht mehr sehr gesteigert werden kann. Das wissen Sie, Kollege Bollmann; Sie beschäftigen sich ja schon lange mit diesem Thema. Plastiktragetaschen machen bei uns weniger als 1 Prozent des gesamten Kunststoffverbrauchs aus. Im Lebensmittelhandel beispielsweise muss man Plastiktragetaschen kostenpflichtig erwerben. Wir haben das Thema Plastiktragetaschen in Deutschland also sehr gut gelöst.

Bundesumweltminister Altmaier - das habe ich hier gerade vorgetragen - plant jetzt einen Runden Tisch zum Thema Meeresmüll, bei dem potenzielle Verursacher und unmittelbar Betroffene aus wesentlichen Bereichen, in denen wir national Einfluss nehmen können, mit an Bord sind.

Präsident Dr. Norbert Lammert:

Weitere Zusatzfragen? - Nein.

Dann rufe ich die Frage 12 des Kollegen Bollmann auf:

Mit welchen Maßnahmen will die Bundesregierung die leichte Austauschbarkeit von Batterien und Akkumulatoren für die Verbraucherinnen und Verbraucher garantieren?

Ursula Heinen-Esser, Parl. Staatssekretärin beim Bundesminister für Umwelt, Naturschutz und Reaktorsicherheit:

Augenblick, ich hatte jetzt mit Nachfragen gerechnet.

Präsident Dr. Norbert Lammert:

Man muss hier immer mit Überraschungen rechnen, Frau Staatssekretärin.",data/txt/17239.txt,speech,
2174866,239,17,0,"Hans-Joachim Otto, Parl. Staatssekretär","Hans-Joachim Otto, Parl. Staatssekretär",hans-joachim-otto-parl-staatssekretar,71,Man muss mit allem rechnen!,data/txt/17239.txt,poi,
2174867,239,17,0,,,,72,"Ursula Heinen-Esser, Parl. Staatssekretärin beim Bundesminister für Umwelt, Naturschutz und Reaktorsicherheit:

Danke, Herr Präsident, dessen war ich mir so nicht bewusst. - Jetzt geht es um Batterien und Akkumulatoren. Auf nationaler Ebene, Kollege Bollmann, sind derzeit keine Maßnahmen im Hinblick auf die Gewährleistung einer leichten Austauschbarkeit von Batterien und Akkumulatoren aus Elektro- und Elektronikgeräten geplant; denn Anforderungen an das Produktdesign sind aus binnenmarktrechtlichen Gründen nur EU-weit möglich und sinnvoll. Die EG-Ökodesign-Richtlinie bietet hierfür eine geeignete Rechtsgrundlage. Die Bundesregierung hat sich im Konsultationsprozess zum neuen Arbeitsprogramm der Ökodesign-Richtlinie dafür eingesetzt, dass die Entnehmbarkeit von Batterien und Akkumulatoren als produktgruppenübergreifende Anforderung untersucht wird und die Vor- und Nachteile einer entsprechenden Regelung geprüft und abgewogen werden. Die EU-Kommission kam dieser Forderung bislang nicht nach.

Im Februar 2013 wurden für Computer und Notebooks jedoch Ökodesign-Anforderungen beschlossen, die bezüglich der Akkumulatoren zumindest verbindliche Verbraucherinformationen einführen werden. Demnach muss ab Mitte 2014 bei neu in Verkehr gebrachten Notebooks auch auf der Verpackung deutlich kenntlich gemacht werden, falls der Akkumulator des Geräts vom Verbraucher nicht ausgetauscht werden kann. Darüber hinaus müssen die technische Dokumentation und frei zugängliche Internetseiten Auskunft über die minimale Anzahl der Ladezyklen des Akkumulators geben.

Die Frage der Entnehmbarkeit von Batterien ist zudem Gegenstand der aktuellen Beratungen in Brüssel zur Änderung der Batterierichtlinie. Die Batterierichtlinie macht in ihrem Art. 11 Vorgaben für die problemlose Entnehmbarkeit von Batterien, schreibt jedoch nicht vor, für wen diese leicht entnehmbar sein müssen. Der Berichterstatter beim Europäischen Parlament hat zuletzt einen Kompromiss vorgeschlagen, nach dem eine Entnehmbarkeit durch den Endnutzer oder durch vom Hersteller unabhängiges Fachpersonal möglich sein muss. Zudem sollen den Produkten Anleitungen beigefügt werden, wie die Verbraucher oder die unabhängigen Fachleute die Batterien oder Akkumulatoren sicher entnehmen können. Diese Kompromissvorschläge sind Grundlage für die weiteren Verhandlungen mit der Europäischen Union.

Gerd Bollmann (SPD):

Vielen Dank für die ausführliche Antwort, Frau Staatssekretärin. - Nur eine Zusatzfrage: Heute Abend um kurz vor 23 Uhr werden wir im ZDF wieder einen Film zu diesem Themenbereich sehen können, und man wird wieder nicht nur die Frage stellen, inwieweit es tatsächlich zutrifft, dass in Gebrauchsgegenstände ganz bewusst Dinge eingebaut werden, die zulasten der Haltbarkeit gehen, sondern auch, inwieweit es zutrifft, dass Gebrauchsgegenstände bewusst so konstruiert werden, dass eine Austauschbarkeit überhaupt nicht möglich ist. Sollte nachweisbar sein, dass dies bewusst so gehandhabt wird, gedenken Sie dann irgendwelche Schritte dagegen zu unternehmen?

Ursula Heinen-Esser, Parl. Staatssekretärin beim Bundesminister für Umwelt, Naturschutz und Reaktorsicherheit:

Es ist ja so, dass eine Fraktion des Deutschen Bundestages eine recht spannende Studie zu diesem Thema veröffentlicht hat. Ihre Ergebnisse belegen die These, dass manche Geräte so konstruiert werden, dass ihre Haltbarkeit eine bestimmte Dauer nicht übersteigt. Wir nehmen dieses Thema sehr ernst und setzen uns immer wieder, auch im Rahmen der aktuellen Verhandlungen zur Ökodesign-Richtlinie, für eine Verbesserung der Reparaturfähigkeit ein. Ich hoffe, dass wir im Rahmen der aktuellen Beratungen zu einem Erfolg kommen werden.",data/txt/17239.txt,speech,
2174868,239,17,0,Gerd Bollmann [SPD],Gerd Bollmann [SPD],gerd-bollmann-spd,73,Danke!,data/txt/17239.txt,poi,spd
2174869,239,17,0,,,,74,"Präsident Dr. Norbert Lammert:

Kollege Lenkert.

Ralph Lenkert (DIE LINKE):

Frau Staatssekretärin, eine andere Fraktion des Deutschen Bundestages hat den Antrag eingebracht, die Nutzbarkeit von Batterien und Akkumulatoren zu verlängern und die Austauschbarkeit zu regeln, nämlich meine Fraktion. Ich stelle Ihnen die Frage: Wieso versuchen Sie nicht, den von uns vorgeschlagenen Weg zu gehen und über die Abfallwirtschaft eine nationale Lösung zu finden? Die Bundesrepublik ist einer der größten Märkte in der Europäischen Union. Wenn die Bundesrepublik im Rahmen der Erfassung des Sondermülls - Batterien würde ich im Prinzip hier einstufen - die Vorgabe machen würde, sicherzustellen, dass Sondermüll getrennt und sauber erfasst werden muss, dann hätten wir die gesetzliche Möglichkeit, diesen Missstand zu beseitigen. Ich frage Sie, warum die Bundesregierung diesen Weg nicht geht.

Ursula Heinen-Esser, Parl. Staatssekretärin beim Bundesminister für Umwelt, Naturschutz und Reaktorsicherheit:

Die Bundesregierung wird erst einmal eine neue Datengrundlage schaffen. Das Umweltbundesamt hat ein entsprechendes Forschungsvorhaben ausgeschrieben, in dessen Rahmen das Thema Haltbarkeit von Produkten erforscht werden soll.

Präsident Dr. Norbert Lammert:

Die Fragen 13 und 14 der Kollegin Sylvia Kotting-Uhl werden schriftlich beantwortet.

Ich rufe nun die Frage 15 der Kollegin Vogt auf:

Treffen Berichte in den Medien, so zum Beispiel in der tageszeitung vom 30. März 2013 zu, wonach sich die Inbetriebnahme des Endlagers Schacht Konrad von 2019 auf mindestens 2021 verzögert, und welche Gründe sind hierfür verantwortlich?

Ursula Heinen-Esser, Parl. Staatssekretärin beim Bundesminister für Umwelt, Naturschutz und Reaktorsicherheit:

Kollegin Ute Vogt, ja, das stimmt. Aufgrund neuer Befunde eines Berichts der Deutschen Gesellschaft zum Bau und Betrieb von Endlagern für Abfallstoffe zur Statik des Mauerwerks im Schacht Konrad 1 zeichnet sich ein erheblicher Sanierungsbedarf ab. Im Schacht Konrad 1 sind aus Gründen der Herstellung der Standsicherheit zusätzliche Maßnahmen zur Sanierung des Mauerwerks erforderlich, da sonst der Nachweis einer ausreichenden Statik des Mauerwerks nicht geführt werden könne. Der sich abzeichnende Sanierungsbedarf lässt nach derzeitigem Kenntnisstand den Abschluss der Errichtung des Endlagers nicht vor dem Jahr 2021 erwarten.

Präsident Dr. Norbert Lammert:

Bitte schön.

Ute Vogt (SPD):

Gibt es aufseiten des Bundesumweltministeriums Ideen, wie man das Ganze beschleunigen kann? Das Volumen für den Abfall, der dort gelagert werden soll, wird ja schon früher gebraucht.

Ursula Heinen-Esser, Parl. Staatssekretärin beim Bundesminister für Umwelt, Naturschutz und Reaktorsicherheit:

Wie man das beschleunigt, können wir als Bundesumweltministerium nicht vorgeben; wir sind keine Techniker oder Ingenieure. Wir wissen das Vorhaben beim Bundesamt für Strahlenschutz in sehr guten Händen. Dass jetzt Sanierungsbedarf aufgetaucht ist, ist sehr unglücklich. Es wird alles darangesetzt, dass die erforderlichen Baumaßnahmen so schnell wie möglich durchgeführt werden. Es ist ja genauso in unserem Interesse, dass Schacht Konrad möglichst schnell fertiggestellt wird.

Ute Vogt (SPD):

Haben Sie schon einen Überblick oder eine Schätzung, was die erforderliche Sanierung an zusätzlichen Kosten verursachen wird?

Ursula Heinen-Esser, Parl. Staatssekretärin beim Bundesminister für Umwelt, Naturschutz und Reaktorsicherheit:

Frau Vogt, genau diese Frage habe ich auch gestellt in Vorbereitung auf die heutige Fragestunde. - Wir können noch nicht sagen, in welchem Rahmen sich die Kosten bewegen werden. Wir sind zurzeit dabei, die finanziellen Auswirkungen zu prüfen. Ich bin gern bereit, Ihnen das, sobald die Zahlen vorliegen, schriftlich zukommen zu lassen oder im Ausschuss noch einmal einen gesonderten Bericht dazu abzugeben.

Präsident Dr. Norbert Lammert:

Kollege Lenkert.

Ralph Lenkert (DIE LINKE):

Frau Staatssekretärin, ich habe eben etwas überrascht vernommen, dass schon bevor Schacht Konrad überhaupt in Betrieb geht, Sanierungsmaßnahmen notwendig geworden sind. Jetzt soll Schacht Konrad ja für mehrere Zehntausend, Hunderttausend Jahre Standsicherheit für die eingelagerten radioaktiven Abfälle gewährleisten. Wenn jetzt schon nach wenigen Jahren Sanierungsmaßnahmen erforderlich werden, woher nehmen Sie dann die Sicherheit, dass nach Abschluss der Sanierungsmaßnahmen die Standsicherheit für diese unvorstellbar langen Zeiträume gewährleistet werden kann?

Ursula Heinen-Esser, Parl. Staatssekretärin beim Bundesminister für Umwelt, Naturschutz und Reaktorsicherheit:

Kollege Lenkert, ich denke, es ist gut, dass wir nicht nach Inbetriebnahme des Endlagers, sondern schon zum jetzigen Zeitpunkt ermessen können, wo es in Schacht Konrad Nachbesserungsbedarf gibt. So müssen wir jetzt alle nötigen Standsicherungsmaßnahmen, beispielsweise für die Schachtförderanlage Süd in Schacht Konrad 1 durch Verfüllung der Mauerwerksfugen, durchführen.

Präsident Dr. Norbert Lammert:

Ich rufe die Frage 16 auf:

Welche Auswirkungen hat eine weitere Verzögerung der Inbetriebnahme auf den Rückbau der stillgelegten Atomkraftwerke und die Lagerung des Atommülls in den Zwischenlagern, und welche Maßnahmen plant die Bundesregierung, um eine rechtzeitige Inbetriebnahme zu gewährleisten?

Ursula Heinen-Esser, Parl. Staatssekretärin beim Bundesminister für Umwelt, Naturschutz und Reaktorsicherheit:

Kollegin Vogt, auch die Bundesregierung sieht einen faktischen Zusammenhang zwischen der Inbetriebnahme des Endlagers Schacht Konrad und den jeweiligen Fortschritten beim Abbau stillgelegter Kernkraftwerke. Allerdings ist die Erteilung einer Genehmigung zur Stilllegung oder zum Abbau eines Kernkraftwerks oder von Kernkraftwerksteilen nicht von der Annahmebereitschaft eines Endlagers abhängig. Es ist Aufgabe der Betreiber, sicherzustellen, dass die im Zusammenhang mit dem Abbau anfallenden radioaktiven Abfälle bis zur Abgabe an das Endlager gegebenenfalls in einem Zwischenlager sicher aufbewahrt werden. Die Prüfungen und Bewertungen zum Sachverhalt in Schacht Konrad und zu den terminlichen und finanziellen Auswirkungen werden bis Ende 2013 abgeschlossen sein.

Ute Vogt (SPD):

Dann stimmt die Bundesregierung der Annahme zu, dass es dadurch wahrscheinlich zu einer Verlängerung der Genehmigungen für den Betrieb der Zwischenlager kommen muss oder gegebenenfalls zur Eröffnung eines weiteren, neuen Zwischenlagers?

Ursula Heinen-Esser, Parl. Staatssekretärin beim Bundesminister für Umwelt, Naturschutz und Reaktorsicherheit:

Das lässt sich zum jetzigen Zeitpunkt noch nicht sagen. Ich verweise noch einmal auf etwa Ende des Jahres. Bis dahin werden wir genau überblicken, welche zeitlichen Verzögerungen bei der Inbetriebnahme von Schacht Konrad zu erwarten sind.

Ute Vogt (SPD):

Dann möchte ich fragen, ob die Bundesregierung bereit ist, dem Umweltausschuss in der nächsten Sitzung einen ausführlichen Bericht dazu vorzulegen?

Ursula Heinen-Esser, Parl. Staatssekretärin beim Bundesminister für Umwelt, Naturschutz und Reaktorsicherheit:

Die Bundesregierung ist gerne dazu bereit.",data/txt/17239.txt,speech,
2174870,239,17,0,Ute Vogt [SPD],Ute Vogt [SPD],ute-vogt-spd,75,Danke schön!,data/txt/17239.txt,poi,spd
