id,sitzung,wahlperiode,in_writing,speaker,speaker_cleaned,speaker_fp,sequence,text,filename,type,speaker_party
2174975,239,17,0,Stephan Kühn [BÜNDNIS 90/DIE GRÜNEN],Stephan Kühn [BÜNDNIS 90/DIE GRÜNEN],stephan-kuhn-bundnis-90-die-grunen,180,Natürlich gibts das!,data/txt/17239.txt,poi,gruene
2174976,239,17,0,Zuruf von der LINKEN,von der LINKEN,von-der-linken,181,Natürlich gibt es ihn!,data/txt/17239.txt,poi,linke
2174977,239,17,0,,,,182,"Denn sonst gäbe es in Österreich, wo es ein Tempolimit von 130 gibt, weniger Unfallopfer. Aber die Zahl der Verkehrsopfer im Bereich der Autobahnen ist in Österreich im Verhältnis höher als in Deutschland. Alle Zahlen für Deutschland zeigen, dass die wenigen Unfälle auf Autobahnen meist bei Geschwindigkeiten unter 120 passieren. Insofern gibt es im Hinblick auf die Verkehrssicherheit ein paar mehr Erklärungsfaktoren: Es geht um die Infrastruktur, das Alter von Fahrzeugen, den Faktor Mensch und vor allem um den technischen Fortschritt, der dafür gesorgt hat, dass die Unfallzahlen zurückgehen. Es hat daher relativ wenig Sinn, ein Element einzeln anzuschauen.

Die von Ihnen angestoßene Debatte zeigt uns relativ eindeutig: Die Genossen - Sie haben auch nichts anderes gesagt - wollen eigentlich ein Tempolimit; das ist Ihre Beschlusslage. Sie wollen es zusammen mit den Grünen einführen.",data/txt/17239.txt,speech,
2174978,239,17,0,Florian Pronold [SPD],Florian Pronold [SPD],florian-pronold-spd,183,Selbst Herr Storjohann hat es korrekter wiedergegeben!,data/txt/17239.txt,poi,spd
2174979,239,17,0,,,,184,"Das ist wahrscheinlich der Klartext, von dem Herr Steinbrück immer redet, meine lieben Kollegen.",data/txt/17239.txt,speech,
2174980,239,17,0,,,,185,Beifall bei der FDP und der CDU/CSU,data/txt/17239.txt,poi,
2174981,239,17,0,,,,186,"Die Diskussion um ein Tempolimit auf Autobahnen ist eine Symboldiskussion. Es geht Ihnen um eine Bevormundungspolitik. Exakt das Gleiche gilt für das Tempolimit, das Sie für geschlossene Ortschaften fordern.",data/txt/17239.txt,speech,
2174982,239,17,0,Florian Pronold [SPD],Florian Pronold [SPD],florian-pronold-spd,187,"Sie wissen nicht, was Ihre eigene Kanzlerin will!",data/txt/17239.txt,poi,spd
2174983,239,17,0,,,,188,"Das Fazit der Debatte ist ganz klar: Wenn die SPD nicht einmal beim Tempolimit eine gemeinsame Linie findet - ich habe immer noch nicht verstanden, was Ihre Linie ist -,",data/txt/17239.txt,speech,
2174984,239,17,0,Johannes Kahrs [SPD],Johannes Kahrs [SPD],johannes-kahrs-spd,189,"Das liegt daran, dass Sie nicht lesen können!",data/txt/17239.txt,poi,spd
2174985,239,17,0,,,,190,wie wollen Sie dann die anderen wichtigen Probleme des Landes angehen?,data/txt/17239.txt,speech,
2174986,239,17,0,,,,191,Beifall bei Abgeordneten der FDP sowie des Abg. Ulrich Lange [CDU/CSU],data/txt/17239.txt,poi,
2174987,239,17,0,,,,192,"Sie können nicht regieren; Gabriel und Steinbrück können es nicht. Ihre Politik bringt die Wähler auf 180.

Vielen Dank.",data/txt/17239.txt,speech,
2174988,239,17,0,,,,193,Beifall bei der FDP und der CDU/CSU,data/txt/17239.txt,poi,
2174989,239,17,0,Florian Pronold [SPD],Florian Pronold [SPD],florian-pronold-spd,194,Das war jetzt ein Gag!,data/txt/17239.txt,poi,spd
2174990,239,17,0,,,,195,"Vizepräsident Eduard Oswald:

Vielen Dank, Herr Kollege Luksic. - Jetzt ist der nächste Redner für die Fraktion Die Linke unser Kollege Herbert Behrens. Bitte schön, Kollege Herbert Behrens.",data/txt/17239.txt,speech,
2174991,239,17,0,,,,196,Beifall bei der LINKEN,data/txt/17239.txt,poi,
2174992,239,17,0,,,,197,"Herbert Behrens (DIE LINKE):

Herr Präsident! Liebe Kolleginnen und Kollegen! Der Vorsitzende der SPD unterstützt in der Frage eines -Tempolimits auf Autobahnen das Wahlprogramm der Grünen, aber auch den Entwurf unseres Wahlprogramms, das wir noch beschließen werden,",data/txt/17239.txt,speech,
2174993,239,17,0,,,,198,Heiterkeit des Abg. Florian Pronold [SPD],data/txt/17239.txt,poi,
2174994,239,17,0,,,,199,und fordert Tempo 120 auf Autobahnen.,data/txt/17239.txt,speech,
2174995,239,17,0,Zuruf von der CDU/CSU,von der CDU/CSU,von-der-cdu-csu,200,Die Koalition steht!,data/txt/17239.txt,poi,cducsu
2174996,239,17,0,,,,201,Heiterkeit bei der CDU/CSU sowie bei Abgeordneten der FDP,data/txt/17239.txt,poi,
2174997,239,17,0,,,,202,Der Kanzlerkandidat der SPD unterstützt hingegen lieber das Wahlprogramm der CDU und sagt: Es darf jetzt auf keinen Fall eine Debatte über ein Tempolimit geben. - Es wird wohl auch nicht zu einem Tempolimit kommen.,data/txt/17239.txt,speech,
2174998,239,17,0,Zuruf von der FDP,von der FDP,von-der-fdp,203,Sehr gute Zusammenfassung!,data/txt/17239.txt,poi,fdp
2174999,239,17,0,,,,204,"Das ist natürlich eine Steilvorlage für die Koalition - das ist klar -, und wir hören, wie genüsslich dieser Widerspruch innerhalb der SPD hier in der Aktuellen Stunde zelebriert wird. Aber nach dem Ende dieser Debatte wird dieses Thema vermutlich wieder in der Versenkung verschwinden, und das will ich nicht zulassen.",data/txt/17239.txt,speech,
2175000,239,17,0,,,,205,Beifall bei Abgeordneten der LINKEN,data/txt/17239.txt,poi,
2175001,239,17,0,,,,206,"Ich fordere die Regierungsfraktionen und auch die SPD-Fraktion auf, sich der Frage der Schaffung von mehr Verkehrssicherheit auf allen Straßen zuzuwenden. Diese Frage gehört auch in den Wahlkampf. Warum? Die Tatsache, dass es auf Deutschlands Straßen viele Verkehrsopfer gibt, die durch zu schnelles Fahren zu Tode kommen oder lebenslang mit den Folgen ihrer -Verletzungen leben müssen, zwingt uns dazu, jeden -Vorschlag zu prüfen, der darauf abzielt, mehr Verkehrssicherheit zu erreichen.",data/txt/17239.txt,speech,
2175002,239,17,0,,,,207,Beifall bei der LINKEN und dem BÜNDNIS 90/DIE GRÜNEN,data/txt/17239.txt,poi,
2175003,239,17,0,,,,208,"Wir müssen endlich mehr für den Schutz der Verkehrsteilnehmer tun, unabhängig davon, ob sie im Auto, auf dem Fahrrad oder zu Fuß unterwegs sind. Wir brauchen eine Diskussion und eine richtige Beschlussfassung zur Frage: Wie gehen wir mit den Geschwindigkeiten um? Ich finde es schlimm, wie die Regierungsfraktionen - das hat sich eben in Ihren Redebeiträgen, aber auch in den letzten Tagen in Ihren Pressemitteilungen und Statements gezeigt - gegen einen Vorschlag polemisieren, der darauf zielt, die Zahl der Unfalltoten auf deutschen -Autobahnen erheblich zu reduzieren.",data/txt/17239.txt,speech,
2175004,239,17,0,,,,209,Beifall bei der LINKEN und dem BÜNDNIS 90/DIE GRÜNEN,data/txt/17239.txt,poi,
2175005,239,17,0,,,,210,"An dieser Stelle ist Wahlkampfgetöse völlig unangebracht.

Vor allem der angeschlagene Ton muss für die Unfallopfer und deren Angehörige unerträglich sein. Wenn der FDP-Generalsekretär Patrick Döring",data/txt/17239.txt,speech,
2175006,239,17,0,Patrick Döring [FDP],Patrick Döring [FDP],patrick-doring-fdp,211,Anwesend!,data/txt/17239.txt,poi,fdp
2175007,239,17,0,,,,212,"in der Bild am Sonntag behauptet, die Oppositionsparteien wollten den Menschen ihr Weltbild aufzwingen und ihnen das Autofahren vermiesen,",data/txt/17239.txt,speech,
2175008,239,17,0,,,,213,Beifall des Abg. Oliver Luksic [FDP],data/txt/17239.txt,poi,
2175009,239,17,0,Patrick Döring [FDP],Patrick Döring [FDP],patrick-doring-fdp,214,So ist es!,data/txt/17239.txt,poi,fdp
2175010,239,17,0,,,,215,"und die entsprechende Programmatik als Gegenprogramm zu einer Republik freier Bürger bezeichnet, dann unterschreitet er damit selbst das Niveau der Bild-Zeitung.",data/txt/17239.txt,speech,
2175011,239,17,0,,,,216,Beifall bei der LINKEN und dem BÜNDNIS 90/DIE GRÜNEN,data/txt/17239.txt,poi,
2175012,239,17,0,,,,217,"Um jetzt Sachlichkeit in die Debatte zu bringen, die ich sowohl in der Presseberichterstattung als auch teilweise hier in der Debatte vermisst habe, möchte ich mich an die Fakten halten. Wir reden über ein verkehrspolitisches Relikt, das in anderen Ländern der Welt eigentlich schon längst verschwunden und überwunden ist. Deutschland ist neben Afghanistan, Bhutan, Haiti, Nepal und Somalia das einzige Land, in dem die Höchstgeschwindigkeit nicht gedeckelt ist. Auch wenn Autobahnen im Vergleich zu Landstraßen als sicherer gelten, so müssen wir doch sehen, dass 42 Prozent aller schweren Unfälle auf Autobahnen Geschwindigkeitsunfälle sind. Ein Tempolimit wäre ein viel effektiverer Beitrag für mehr Verkehrssicherheit, Herr Storjohann, als -Ramsauers vermurkste Punktereform, über die wir morgen zu diskutieren haben.",data/txt/17239.txt,speech,
2175013,239,17,0,,,,218,Beifall bei der LINKEN und dem BÜNDNIS 90/DIE GRÜNEN sowie bei Abgeordneten der SPD,data/txt/17239.txt,poi,
2175014,239,17,0,,,,219,"Ein Tempolimit führt zu flüssigerem Verkehr - das stellen wir als Autofahrerinnen und Autofahrer sicherlich fest - und weniger Staus, die aufgrund hoher Geschwindigkeitsunterschiede entstehen. Durch Raserei entstehen vielfach gefährliche Situationen. Ein Tempo-limit würde Unfälle vermeiden. Faktisch ist es schon heute so, dass auf 98 Prozent aller deutschen Straßen Tempolimits gelten - das sagen auch die Verkehrs-verbände -, auf 40 Prozent der bundesdeutschen Autobahnen gibt es ebenfalls Geschwindigkeitsbeschränkungen; darauf wurde ja schon hingewiesen.

In den vergangenen Jahren sind noch weitere Argumente hinzugekommen als die der Verkehrssicherheit. Gerade an Autobahntrassen ist die Lärmbelastung für Bürgerinnen und Bürger extrem hoch. Sie fordern Lärmschutz und Lärmschutzwände, die sie aber nicht bekommen, weil sie nicht an Neubaustrecken wohnen, sondern an alten Strecken.

Auch nicht neu sind die Argumente, die aus Umweltschutzgründen für eine Reduzierung der Geschwindigkeit auf Autobahnen sprechen. Die Fachverbände weisen darauf hin, dass eine Reduzierung der Geschwindigkeit auf 120 Kilometer pro Stunde den CO2-Ausstoß um 9 Prozent senken würde; das entspräche ungefähr 3,4 Millionen Tonnen CO2, das ist mehr, als der gesamte Schienenverkehr in Deutschland verursacht.

Die Debatte über ein generelles Tempolimit ist schon alt, damit hat Herr Steinbrück durchaus recht. Doch -bislang ist diese Idee an der Lobbyarbeit der mächtigen Autokonzerne gescheitert. Auch Rot-Grün hat vor ihnen gekuscht, obwohl es eine Mehrheit für die Einführung eines Tempolimits gab. Sie haben das Thema umschifft und es gar nicht erst auf die Tagesordnung gesetzt.

Alle Argumente liegen auf dem Tisch. Nehmen wir diese Argumente ernst und knicken nicht gleich wieder ein, nur weil uns Gegenwind ins Gesicht pustet. Liebe Kolleginnen und Kollegen von der SPD, Sie haben den Wählerinnen und Wählern auch in dieser Frage noch einiges zu erklären. Wenn Sie schon mal beim Erklären sind, dann erklären Sie doch auch die Position der SPD zur Rente erst mit 67! Oder hat der Kanzlerkandidat seinen Schattenminister möglicherweise schon korrigiert?",data/txt/17239.txt,speech,
2175015,239,17,0,,,,220,Beifall bei der LINKEN,data/txt/17239.txt,poi,
2175016,239,17,0,Dr. Stefan Ruppert [FDP],Dr. Stefan Ruppert [FDP],stefan-ruppert-fdp,221,"Ihr müsst das in jeder Rede unterbringen, oder?",data/txt/17239.txt,poi,fdp
2175017,239,17,0,,,,222,"Vizepräsident Eduard Oswald:

Nächster Redner in unserer Aktuellen Stunde ist für die Fraktion Bündnis 90/Die Grünen unser Kollege Stephan Kühn. Bitte schön, Herr Kollege Stephan Kühn.",data/txt/17239.txt,speech,
2175018,239,17,0,Johannes Kahrs [SPD],Johannes Kahrs [SPD],johannes-kahrs-spd,223,Netter Kerl!,data/txt/17239.txt,poi,spd
2175019,239,17,0,,,,224,"Stephan Kühn (BÜNDNIS 90/DIE GRÜNEN):

Sehr geehrter Herr Präsident! Meine Damen und Herren! Würden in Deutschland in einem Jahr zwei voll-besetzte Linienflugzeuge mit 400 Personen abstürzen - was hätten wir für eine Debatte über die Sicherheit im Luftverkehr. Wenn aber 400 Menschen ihr Leben auf deutschen Autobahnen lassen und 28 000 Menschen zum Teil schwer verletzt werden, fällt Schwarz-Gelb nur ein, zu sagen, dass wir bereits ein hohes Sicherheits-niveau auf Autobahnen haben. Wir finden: Jeder Verkehrstote und jeder Verkehrsverletzte ist einer zu viel.",data/txt/17239.txt,speech,
2175020,239,17,0,,,,225,Beifall beim BÜNDNIS 90/DIE GRÜNEN und bei der LINKEN sowie bei Abgeordneten der SPD,data/txt/17239.txt,poi,
2175021,239,17,0,,,,226,"In diesem Zusammenhang kann ich die Albernheiten in dem einen oder anderen Debattenbeitrag nur wenig nachvollziehen.

Tempo 120 würde die Sicherheit auf deutschen Autobahnen deutlich verbessern; denn das Ziel muss sein: Keiner kommt um, alle kommen an. Das ist die Vision von Vision Zero. Diese Philosophie teilt übrigens auch der Wissenschaftliche Beirat des BMVBS, also die Fachleute. Sie haben nämlich gesagt: Deutschland braucht ein Tempolimit. - Der Einzige, der das offensichtlich nicht wahrhaben will und auf die Meinung des fachlichen Beirats nicht viel gibt, ist der Minister selber.",data/txt/17239.txt,speech,
2175022,239,17,0,Zuruf von der CDU/CSU,von der CDU/CSU,von-der-cdu-csu,227,Steinbrück!,data/txt/17239.txt,poi,cducsu
2175023,239,17,0,,,,228,"Alle Fakten sprechen für ein Tempolimit. Es wurde schon gesagt: Wir sind weltweit fast das einzige Land, auf dessen Autobahnen kein generelles Tempolimit gilt. Nur in Deutschland darf per Gesetz gerast werden. Wir finden: Damit muss Schluss sein!",data/txt/17239.txt,speech,
2175024,239,17,0,,,,229,Beifall beim BÜNDNIS 90/DIE GRÜNEN,data/txt/17239.txt,poi,
2175025,239,17,0,,,,230,"Kommen wir zu den Fakten, Herr Kollege Luksic. Die Einführung von Tempo 130, in dem Fall auf der -Autobahn A 24 zwischen dem Dreieck Havelland und dem Dreieck Wittstock/Dosse, hat innerhalb von kürzester Zeit zu einer erheblichen Verkehrsverbesserung geführt: Halbierung der Unfallzahlen und minus 60 Prozent bei Verletzten bzw. Getöteten. Die Fakten belegen klar, dass eine Verbesserung der Verkehrssicherheit mit der Einführung eines Tempolimits einhergeht.

Tempolimit reduziert Verkehrslärm. Durch Tempo-limit - das ist schon gesagt worden - können die CO2-Emissionen reduziert werden, aber nicht nur die, sondern auch die Kohlenmonoxid- und Stickstoffbelastung kann bis zu 28 Prozent gemindert werden. Auch das ist ein Argument für ein Tempolimit.

Auch die Kapazität der Autobahnen spielt eine Rolle. Es gibt an vielen Stellen im Autobahnnetz Staus. Die Strecken sind überlastet. Wir wissen, dass ein generelles Tempolimit die Kapazität der Autobahnen erhöht,",data/txt/17239.txt,speech,
2175026,239,17,0,Oliver Luksic [FDP],Oliver Luksic [FDP],oliver-luksic-fdp,231,Quatsch!,data/txt/17239.txt,poi,fdp
2175027,239,17,0,,,,232,"weil das Geschwindigkeitsniveau homogener ist. So passen mehr Fahrzeuge auf die Autobahn, und deshalb geht es flüssiger voran.",data/txt/17239.txt,speech,
2175028,239,17,0,,,,233,Beifall beim BÜNDNIS 90/DIE GRÜNEN,data/txt/17239.txt,poi,
2175029,239,17,0,,,,234,"Ähnlich ist es bei der Frage der Standards. Es wird immer pauschal behauptet, die Krötentunnel und die Wildbrücken würden den Autobahnbau verteuern. Alles Unfug! Grund sind die hohen Standards, die notwendig sind, weil hohe Geschwindigkeiten gefahren werden.",data/txt/17239.txt,speech,
2175030,239,17,0,Oliver Luksic [FDP],Oliver Luksic [FDP],oliver-luksic-fdp,235,Quatsch!,data/txt/17239.txt,poi,fdp
2175031,239,17,0,,,,236,"Wenn diese hohen Geschwindigkeiten nicht erlaubt wären, könnten die beim Autobahnbau eingesparten Mittel für die Verkehrssicherheitsarbeit verwendet werden.

Tempo 120 würde auch das Aggressionspotenzial auf Autobahnen reduzieren. Alle kämen entspannter ans Ziel. Gerade die älteren Verkehrsteilnehmer sagen zunehmend, dass sie sich auf den deutschen Autobahnen nicht mehr sicher fühlen. Wer rasen will, kann das tun: auf dem Lausitzring, auf dem Nürburgring oder auf dem Hockenheimring. Nach meinem Kenntnisstand haben alle drei Rennstrecken wirtschaftliche Probleme; vielleicht könnte man ihnen damit sogar helfen.",data/txt/17239.txt,speech,
2175032,239,17,0,,,,237,Beifall beim BÜNDNIS 90/DIE GRÜNEN,data/txt/17239.txt,poi,
2175033,239,17,0,,,,238,"Diese Bundesregierung hat außer Appellen und Werbekampagnen nichts getan, um die Unfallursache Nummer eins, Fahren mit nicht angepasster Geschwindigkeit, wirksam zu bekämpfen. Nichts ist passiert! Kein substanzieller Beitrag! Das nationale Verkehrssicherheitsprogramm ist nichts anderes als ein Papiertiger; denn er leistet in der Praxis keinen Beitrag zu mehr Verkehrs-sicherheit.

Da wir in der Debatte gemerkt haben, dass Sie von der Koalition sachlichen Argumenten nur in begrenztem Maße offen gegenüberstehen,",data/txt/17239.txt,speech,
2175034,239,17,0,Oliver Luksic [FDP],Oliver Luksic [FDP],oliver-luksic-fdp,239,Sie haben ja keine -Argumente! Das ist das Problem!,data/txt/17239.txt,poi,fdp
2175035,239,17,0,,,,240,"sage ich Ihnen: Helfen Sie doch wenigstens Ihrem Minister, der jetzt sogar an der Debatte teilnimmt! Mit Tempo 120 können alle im Auto entspannt und stressfrei seine CD Adagio im Auto mit Klavierkonzerten von Mozart hören.",data/txt/17239.txt,speech,
2175036,239,17,0,Petra Müller [Aachen] [FDP],Petra Müller [Aachen] [FDP],petra-muller-aachen-fdp,241,Was haben Sie für ein Bild von einem älteren Menschen! Das ist doch nicht wahr!,data/txt/17239.txt,poi,fdp
2175037,239,17,0,,,,242,"Dieses Argument für Tempo 120 müsste bei Ihnen doch tragen. Wir sind uns sicher: Freie Fahrt für Raser war gestern.

Herzlichen Dank für die Aufmerksamkeit.",data/txt/17239.txt,speech,
2175038,239,17,0,,,,243,Beifall beim BÜNDNIS 90/DIE GRÜNEN,data/txt/17239.txt,poi,
2175039,239,17,0,,,,244,"Vizepräsident Eduard Oswald:

Vielen Dank. - Nächste Rednerin für die Fraktion von CDU und CSU ist unsere Kollegin Frau Daniela Ludwig. Bitte schön, Frau Kollegin Daniela Ludwig.",data/txt/17239.txt,speech,
2175040,239,17,0,,,,245,Beifall bei der CDU/CSU und der FDP,data/txt/17239.txt,poi,
2175041,239,17,0,,,,246,"Daniela Ludwig (CDU/CSU):

Herr Präsident! Meine sehr verehrten Kolleginnen und Kollegen! Liebe Zuschauer auf den Tribünen! Herr Pronold, Sie haben auf das Jahr 1995 und Frau Merkel zurückgegriffen. Das kann ich auch. Ich gehe noch ein Jahr weiter zurück: Herr Schröder, damals noch Ministerpräsident von Niedersachsen, wurde im Spiegel gefragt, was er denn als Autoministerpräsident von einem Tempolimit halte.",data/txt/17239.txt,speech,
2175042,239,17,0,Johannes Kahrs [SPD],Johannes Kahrs [SPD],johannes-kahrs-spd,247,Guter Mann übrigens! Sehr gut!,data/txt/17239.txt,poi,spd
2175043,239,17,0,,,,248,"Er sagte: Ganz schlecht, schädlich für die Autokonjunktur. - Sie finden den Aufhänger Ihrer Rede - Frau Merkel/1995 - wahrscheinlich extrem originell. Ich fand das gähnend langweilig und würde gerne zur Sache reden;",data/txt/17239.txt,speech,
2175044,239,17,0,Florian Pronold [SPD],Florian Pronold [SPD],florian-pronold-spd,249,Sie sitzen im Glashaus und werfen mit Steinen!,data/txt/17239.txt,poi,spd
2175045,239,17,0,,,,250,"denn die Sache ist ernst genug und ernst zu nehmen.

Herr Kühn hat mir und meinen Kollegen mit einem Satz definitiv aus der Seele gesprochen - damit bin ich bei der Sache und beim Ernst der Sache -: Jeder Verkehrstote ist tatsächlich einer zu viel und jeder Verletzte auch. Wir glauben aber im Gegensatz zu Ihnen",data/txt/17239.txt,speech,
2175046,239,17,0,Bärbel Höhn [BÜNDNIS 90/DIE GRÜNEN],Bärbel Höhn [BÜNDNIS 90/DIE GRÜNEN],barbel-hohn-bundnis-90-die-grunen,251,"Je schneller man fährt, desto weniger Tote, oder was meinen Sie?",data/txt/17239.txt,poi,gruene
2175047,239,17,0,,,,252,"- wenn Sie mich ausreden lassen, erkläre ich es Ihnen, Frau Höhn; immer gern -, dass ein generelles Tempolimit auf allen Autobahnen, für jeden Autobahnkilometer in dieser Republik nicht zielführend ist. Warum? Die Zahlen sind schon genannt worden - ich nenne sie aber gerne noch einmal, weil ich glaube, dass sie uns bei der Erkenntnisfindung helfen können -: Auf 40 Prozent der deutschen Autobahnen gibt es bereits ein Tempolimit, weil es aus Lärmschutzgründen notwendig ist oder weil es Sicherheitsgründe dafür gibt. Sie haben Autobahnabschnitte genannt, auf denen die Zahl der Verkehrstoten gesunken ist, nachdem ein Tempolimit eingeführt wurde. Dazu kann man den Straßenverkehrsbehörden nur gratulieren; denn das zeigt, dass sie die richtigen Abschnitte ausgewählt haben.",data/txt/17239.txt,speech,
2175048,239,17,0,,,,253,Beifall bei der CDU/CSU und der FDP,data/txt/17239.txt,poi,
2175049,239,17,0,,,,254,"Im Gesetz steht, dass der Autofahrer um eine angemessene Fahrweise gebeten wird, und zwar so oder so. Auch bei einem Tempolimit muss er sich angemessen verhalten und überlegen, ob er situationsbedingt vielleicht noch langsamer fahren muss als vorgeschrieben. Auch das verhindert Unfälle.

Man muss auch sagen: Dort, wo am meisten Verkehr ist, nämlich auf den Autobahnen - ein Verkehrszuwachs von 31,6 Prozent in den letzten Jahren -, kommen im Vergleich weniger Menschen bei Unfällen zu Tode, wenn auch immer noch zu viele; denn am schlimmsten ist es auf den Landstraßen.",data/txt/17239.txt,speech,
2175050,239,17,0,Bärbel Höhn [BÜNDNIS 90/DIE GRÜNEN],Bärbel Höhn [BÜNDNIS 90/DIE GRÜNEN],barbel-hohn-bundnis-90-die-grunen,255,Sie haben doch gesagt: Jeder Tote ist einer zu viel!,data/txt/17239.txt,poi,gruene
2175051,239,17,0,,,,256,"Auf den Landstraßen haben wir aber schon ein Tempo-limit. Der Grund für die vielen Verkehrsunfälle auf Landstraßen ist nicht, dass dort, wie Sie so schön sagen, gerast wird, sondern zum Beispiel, dass Bäume am Straßenrand stehen.",data/txt/17239.txt,speech,
2175052,239,17,0,Petra Müller [Aachen] [FDP],Petra Müller [Aachen] [FDP],petra-muller-aachen-fdp,257,Oder schlecht ausgebaute Straßen in SPD-geführten Bundesländern!,data/txt/17239.txt,poi,fdp
2175053,239,17,0,,,,258,"Eine nasse Fahrbahn, schlechter Asphalt, schlecht ausgebaute Straßen und hügelige bzw. bergige Straßenverläufe führen häufig zu Unfällen, egal wie schnell oder langsam man fährt.",data/txt/17239.txt,speech,
2175054,239,17,0,Bärbel Höhn [BÜNDNIS 90/DIE GRÜNEN],Bärbel Höhn [BÜNDNIS 90/DIE GRÜNEN],barbel-hohn-bundnis-90-die-grunen,259,"Ist jeder Tote einer zu viel, ja oder nein?",data/txt/17239.txt,poi,gruene
2175055,239,17,0,,,,260,"- Selbstverständlich. Aber Sie reden doch letztlich am Problem vorbei. Schauen Sie sich die Zahlen an! Die Zahlen aus Österreich sind oft genannt worden. Es gibt noch ein anderes Land mit einem sehr strikten Tempo-limit und mit dennoch vielen Verkehrstoten auf den Highways, nämlich die Vereinigten Staaten. Auch da hilft das generelle Tempolimit nicht, um die Zahl der Verkehrstoten deutlich zu verringern. Also müssen wir uns fragen: Ist ein generelles Tempolimit richtig, ja oder nein? Ich sage Ihnen für unsere Koalition: Nein, es ist nicht richtig.",data/txt/17239.txt,speech,
2175056,239,17,0,,,,261,Beifall bei der CDU/CSU und der FDP,data/txt/17239.txt,poi,
2175057,239,17,0,,,,262,"Ich will jetzt nicht wieder die Vergangenheit bemühen und sagen, dass Sie es doch längst hätten einführen können. Wissen Sie, an den Folgen Ihrer fatalen Verkehrs-politik knabbern wir noch heute. Da müssen wir uns nur den teilweise schlechten Zustand der Infrastruktur anschauen.",data/txt/17239.txt,speech,
2175058,239,17,0,,,,263,Beifall bei der CDU/CSU und der FDP,data/txt/17239.txt,poi,
2175059,239,17,0,Oliver Luksic [FDP],Oliver Luksic [FDP],oliver-luksic-fdp,264,In der Tat!,data/txt/17239.txt,poi,fdp
2175060,239,17,0,Johannes Kahrs [SPD],Johannes Kahrs [SPD],johannes-kahrs-spd,265,Da wäre ich an Ihrer Stelle ganz ruhig!,data/txt/17239.txt,poi,spd
2175061,239,17,0,,,,266,"Die Situation ist immer noch schwierig. Wir baden immer noch die Sünden aus, die uns ein gewisser ostdeutscher Verkehrsminister leider Gottes hinterlassen hat; wir kümmern uns um seine unerledigte Arbeit.",data/txt/17239.txt,speech,
2175062,239,17,0,Florian Pronold [SPD],Florian Pronold [SPD],florian-pronold-spd,267,"Entschuldigung! Sie haben 1,5 Milliarden Euro jedes Jahr im Verkehrsbereich eingenommen und nichts zurückgegeben! Sie sind zuständig dafür! Nach vier Jahren Regierungszeit immer noch die Schuld auf andere zu schieben, ist billig!",data/txt/17239.txt,poi,spd
2175063,239,17,0,,,,268,"Das regt mich viel mehr auf als die Debatte, ob Herr Steinbrück für oder gegen was auch immer ist. Das interessiert mich nicht.",data/txt/17239.txt,speech,
2175064,239,17,0,Christian Lange [Backnang] [SPD],Christian Lange [Backnang] [SPD],christian-lange-backnang-spd,269,"Warum beantragen Sie eigentlich diese Aktuelle Stunde, wenn Sie sich darüber aufregen?",data/txt/17239.txt,poi,spd
2175065,239,17,0,,,,270,"Vielmehr ist dies eine gute Gelegenheit, hier noch einmal darzustellen, dass Sie für alles Mögliche in Ihrer Regierungszeit Geld hatten, nur nicht für die Infrastruktur.",data/txt/17239.txt,speech,
2175066,239,17,0,,,,271,Beifall bei der CDU/CSU und der FDP,data/txt/17239.txt,poi,
2175067,239,17,0,,,,272,"Der große Teil des Landes, insbesondere der westliche Teil, leidet nach wie vor unter den fürchterlichen Folgen dieser Politik. Das ist das Schlimme.",data/txt/17239.txt,speech,
2175068,239,17,0,Florian Pronold [SPD],Florian Pronold [SPD],florian-pronold-spd,273,"Wenn das Thema Sie so aufregt, warum haben Sie es dann beantragt? Reden wir doch über den Zustand der Infrastruktur! Warum keine Aktuelle Stunde dazu?",data/txt/17239.txt,poi,spd
2175069,239,17,0,,,,274,Ich kann nur sagen: Leute wie Sie machen hoffentlich nie mehr Verkehrspolitik und sind hoffentlich nie mehr in der Regierungsverantwortung für dieses Land. Das kann ich wirklich nur hoffen.,data/txt/17239.txt,speech,
2175070,239,17,0,,,,275,Beifall bei der CDU/CSU und der FDP,data/txt/17239.txt,poi,
