id,sitzung,wahlperiode,in_writing,speaker,speaker_cleaned,speaker_fp,sequence,text,filename,type,speaker_party
2771229,3,18,0,Präsident Dr. Norbert Lammert,Dr. Norbert Lammert,norbert-lammert,0,"Die Sitzung ist eröffnet.

Liebe Kolleginnen und Kollegen! Bevor wir in unsere Tagesordnung eintreten, bitte ich Sie, sich von den Plätzen zu erheben.

Der Deutsche Bundestag trauert um sein ehemaliges Mitglied Dieter-Julius Cronenberg, der heute vor einer Woche, am 21. November, gestorben ist. Dieter-Julius Cronenberg war fast zwei Jahrzehnte lang unser Kollege. Er gehörte dem Deutschen Bundestag von 1976 bis 1994 an. Seine politische Heimat fand er in der FDP, in der er sich ab 1961 engagierte, zunächst auf kommunaler Ebene, dann als Mitglied des Bundestages in Bonn.

Verantwortung hat Dieter-Julius Cronenberg früh übernommen - nicht nur politisch, sondern auch als Unternehmer. Er führte in Arnsberg ein mittelständisches Familienunternehmen, das inzwischen auf eine über 300-jährige Geschichte zurückblicken kann. Er war sich dabei immer bewusst, dass unternehmerischer Erfolg zugleich auch bedeutet, soziale und gesellschaftliche Verantwortung für die Menschen, für die Stadt und für das Land zu übernehmen, in dem das Unternehmen erfolgreich agieren kann.

Vielleicht erklärt sich aus dieser Einstellung heraus auch sein ausgeprägtes Interesse an Themen wie der Sozialpolitik, insbesondere der Alterssicherung. An den Rentenreformen der damaligen Zeit hat er maßgeblich mitgewirkt. Gerade auf diesen Gebieten war er ein anerkannter Experte seiner Fraktion und ein bei den Kolleginnen und Kollegen der anderen Fraktionen geschätzter Fachmann. Mit dieser Fachkompetenz hat er zu vielen sozialpolitischen Entscheidungen für unser Land beigetragen.

Fast zehn Jahre lang war Dieter-Julius Cronenberg Vizepräsident des Deutschen Bundestages. Dieses hohe Amt füllte er souverän und überparteilich aus. Er stellte seine große Erfahrung in den Dienst unseres Parlamentes. Ihm gebühren unser Respekt und unsere Dankbarkeit für alles, was er in diesem Haus, für dieses Parlament und für unsere Demokratie über viele Jahre hinweg geleistet hat.

Wir werden ihm ein ehrendes Andenken bewahren.

Seiner Witwe, seinen Kindern und allen Angehörigen spreche ich im Namen des ganzen Hauses unsere Anteilnahme aus.

Ich danke Ihnen.

Liebe Kolleginnen und Kollegen, ich möchte Ihnen mitteilen, dass interfraktionell vereinbart worden ist, den Antrag der Fraktion Bündnis 90/Die Grünen mit dem Titel Einsetzung von Ausschüssen als Zusatzpunkt 1 aufzunehmen, zusammen mit Tagesordnungspunkt 1 aufzurufen und diesen damit verbundenen Tagesordnungspunkt mit einer Redezeit von jeweils fünf Minuten pro Fraktion zu debattieren.

Nach dem Tagesordnungspunkt 6 soll darüber hinaus als Zusatzpunkt 2 eine vereinbarte Debatte zum vorläufigen Atomabkommen mit dem Iran im Umfang von 30 Minuten stattfinden.

Schließlich soll der Tagesordnungspunkt 13 abgesetzt und stattdessen der Antrag der Fraktion Bündnis 90/Die Grünen mit dem Titel Operation Active Endeavour beenden als Zusatzpunkt 3 aufgerufen werden.

Sind Sie damit einverstanden? - Ich sehe keinen Widerspruch. Dann ist das so beschlossen.

Wir kommen damit zu Tagesordnungspunkt 1 mit dem gerade vereinbarten Zusatzpunkt 1:

1	Beratung des Antrags der Fraktionen der CDU/CSU und SPD

Einsetzung eines Hauptausschusses

- Drucksache 18/101 -

ZP 1	Beratung des Antrags der Fraktion BÜNDNIS 90/DIE GRÜNEN

Einsetzung von Ausschüssen

- Drucksache 18/102 -

Interfraktionell ist eine Diskussionsrunde mit Beiträgen von jeweils fünf Minuten vereinbart worden. - Darüber besteht offenkundig Einvernehmen, also können wir so verfahren.

Ich erteile das Wort dem Kollegen Michael Grosse-Brömer für die CDU/CSU-Fraktion.",data/txt/18003.txt,chair,
2771230,3,18,0,,,,1,Beifall bei der CDU/CSU,data/txt/18003.txt,poi,
2771231,3,18,0,Präsident Dr. Norbert Lammert,Dr. Norbert Lammert,norbert-lammert,2,,data/txt/18003.txt,chair,
2771232,3,18,0,Michael Grosse-Brömer (CDU/CSU),Michael Grosse-Brömer,michael-grosse-bromer,3,"Sehr geehrter Herr Präsident! Liebe Kolleginnen und Kollegen! Seit Bestehen der Bundesrepublik Deutschland gibt es nach Bundestagswahlen einen Zeitraum, in dem sich die Regierung bildet. Wenn es keine absoluten Mehrheiten gibt, dann werden Koalitionen gebildet. Diese Koalitionen müssen vorbereitet sein. Mal ist die Aufgabe einfach, mal ist sie schwieriger. Wenn man nicht von Anfang an füreinander vorgesehen ist, ist sie nicht einfach.",data/txt/18003.txt,speech,cducsu
2771233,3,18,0,,,,4,Heiterkeit bei Abgeordneten der SPD und des BÜNDNISSES 90/DIE GRÜNEN,data/txt/18003.txt,poi,
2771234,3,18,0,Michael Grosse-Brömer (CDU/CSU),Michael Grosse-Brömer,michael-grosse-bromer,5,"Manchmal dauert es deshalb auch länger.

Es war aber schon immer so, dass dieser Zeitraum abgewartet wurde. Wenn man es klug macht - so wie wir -, dann macht man zwischendurch Plenarsitzungen, damit das Parlament handlungsfähig ist. So findet heute eine Fragestunde statt, damit die Kontrolle der Regierung durch das Parlament funktioniert. Insofern haben wir uns fortentwickelt. Wir sind in den letzten Jahrzehnten besser geworden. Der Parlamentarismus hat in dieser Zeit gewonnen.",data/txt/18003.txt,speech,cducsu
2771235,3,18,0,Zuruf von der LINKEN,von der LINKEN,von-der-linken,6,Ach herrje!,data/txt/18003.txt,poi,linke
2771236,3,18,0,Michael Grosse-Brömer (CDU/CSU),Michael Grosse-Brömer,michael-grosse-bromer,7,"Jetzt gibt es Kritik - wahrscheinlich musste man länger darüber nachdenken, um überhaupt einen Kritikpunkt zu finden -: Die Grünen und die Linken wollen nun schon partout alle Ausschüsse bilden. Das hat es noch nie gegeben.",data/txt/18003.txt,speech,cducsu
2771237,3,18,0,,,,8,Beifall bei Abgeordneten der LINKEN und des BÜNDNISSES 90/DIE GRÜNEN,data/txt/18003.txt,poi,
2771238,3,18,0,Michael Grosse-Brömer (CDU/CSU),Michael Grosse-Brömer,michael-grosse-bromer,9,- Die Linke will es gar nicht mehr; das ist gut.,data/txt/18003.txt,speech,cducsu
2771239,3,18,0,Zuruf von der LINKEN,von der LINKEN,von-der-linken,10,Doch!,data/txt/18003.txt,poi,linke
2771240,3,18,0,Michael Grosse-Brömer (CDU/CSU),Michael Grosse-Brömer,michael-grosse-bromer,11,"Klüger zu werden, ist ein Bestreben, das man nie aufgeben sollte.",data/txt/18003.txt,speech,cducsu
2771241,3,18,0,,,,12,Lachen bei Abgeordneten der CDU/CSU,data/txt/18003.txt,poi,
2771242,3,18,0,Michael Grosse-Brömer (CDU/CSU),Michael Grosse-Brömer,michael-grosse-bromer,13,Es liegt heute jedenfalls ein Antrag der Linken,data/txt/18003.txt,speech,cducsu
2771243,3,18,0,Dr. Petra Sitte [DIE LINKE],Dr. Petra Sitte,petra-sitte,14,"Nein, das ist ja falsch!",data/txt/18003.txt,poi,linke
2771244,3,18,0,Michael Grosse-Brömer (CDU/CSU),Michael Grosse-Brömer,michael-grosse-bromer,15,"- Pardon! -, der Grünen vor, alle Ausschüsse einzusetzen, wohlwissend - ich glaube, jedes Mitglied der Fraktion der Grünen weiß das -, dass die Ausschussbildung natürlich von der Ressortzuschneidung und natürlich auch von der personellen Ausstattung der Bundesregierung in all ihren Facetten abhängig ist.",data/txt/18003.txt,speech,cducsu
2771245,3,18,0,Dr. Anton Hofreiter [BÜNDNIS 90/DIE GRÜNEN],Dr. Anton Hofreiter,anton-hofreiter,16,Ach! Wie ist sie denn?,data/txt/18003.txt,poi,gruene
2771246,3,18,0,Michael Grosse-Brömer (CDU/CSU),Michael Grosse-Brömer,michael-grosse-bromer,17,"Insofern ist der heute vorliegende Antrag, alle Ausschüsse zu bilden, jenseits jeglicher Parlamentspraxis.",data/txt/18003.txt,speech,cducsu
2771247,3,18,0,,,,18,Beifall bei der CDU/CSU,data/txt/18003.txt,poi,
2771248,3,18,0,Katrin Göring-Eckardt [BÜNDNIS 90/DIE GRÜNEN],Katrin Göring-Eckardt,katrin-goring-eckardt,19,Was? Das Einsetzen von Ausschüssen jenseits jeglicher Parlamentspraxis?,data/txt/18003.txt,poi,gruene
2771249,3,18,0,Michael Grosse-Brömer (CDU/CSU),Michael Grosse-Brömer,michael-grosse-bromer,20,"Es gibt allerdings eine gute Lösung, um noch besser zu werden und die Ausschussarbeit trotzdem in der Zwischenzeit zu ermöglichen. Um nichts anderes geht es. Um den Zeitraum zu überbrücken, bis die Regierung gebildet ist, wollen wir heute einen Hauptausschuss einsetzen. Einen solchen Ausschuss gab es bisher nicht. Es wird ihn aber geben, damit der Parlamentarismus, damit die parlamentarische Arbeit, damit die Ausschussarbeit besser als in den letzten Jahrzehnten organisiert und durchgeführt werden können.

Deswegen ist unser Vorschlag, einen Hauptausschuss einzusetzen, eine wesentlich bessere Lösung, als - das ist ja ein bisschen althergebracht - die Einsetzung aller Ausschüsse zu beantragen, wo Sie doch selbst wissen, dass dies zum aktuellen Zeitpunkt gar nicht geht.",data/txt/18003.txt,speech,cducsu
2771250,3,18,0,,,,21,Beifall bei der CDU/CSU sowie bei Abgeordneten der SPD,data/txt/18003.txt,poi,
2771251,3,18,0,Michael Grosse-Brömer (CDU/CSU),Michael Grosse-Brömer,michael-grosse-bromer,22,"Ich will Ihnen abschließend Folgendes sagen: Dieser Hauptausschuss ermöglicht allen Fraktionen die effiziente Mitarbeit bei der Gesetzesvorbereitung. Wir sollten daher im Interesse der Handlungsfähigkeit dieses Parlamentes, die sich bereits verbessert hat, die aber durch den Hauptausschuss noch besser werden kann, dem Wege der Vernunft folgen und nicht jetzt schon verfrühten oppositionellen Reflexen verfallen. Frau Haßelmann, noch können Sie den Antrag zurückziehen. Zustimmen werden wir ihm nicht; denn auch in der Sache ist das, was Sie da wollen, nicht begründbar.

Herzlichen Dank.",data/txt/18003.txt,speech,cducsu
2771252,3,18,0,,,,23,Beifall bei der CDU/CSU sowie bei Abgeordneten der SPD,data/txt/18003.txt,poi,
2771253,3,18,0,Michael Grosse-Brömer (CDU/CSU),Michael Grosse-Brömer,michael-grosse-bromer,24,,data/txt/18003.txt,speech,cducsu
2771254,3,18,0,Präsident Dr. Norbert Lammert,Dr. Norbert Lammert,norbert-lammert,25,Das Wort hat nun die Kollegin Petra Sitte für die Fraktion Die Linke.,data/txt/18003.txt,chair,
2771255,3,18,0,,,,26,Beifall bei der LINKEN,data/txt/18003.txt,poi,
2771256,3,18,0,Präsident Dr. Norbert Lammert,Dr. Norbert Lammert,norbert-lammert,27,,data/txt/18003.txt,chair,
2771257,3,18,0,Dr. Petra Sitte (DIE LINKE),Dr. Petra Sitte,petra-sitte,28,"Herr Präsident! Meine Damen und Herren! Im Kern streiten wir uns immer noch darüber, dass der Bundestag auch in der Phase der Bildung von Koalitionen und Regierungen verhandlungsfähig sein muss. Die Koalitionsverhandlungen dauern an. Die SPD muss ihre Mitgliederbefragung über die Bühne bekommen und dergleichen mehr.",data/txt/18003.txt,speech,linke
2771258,3,18,0,Christine Lambrecht [SPD],Christine Lambrecht,christine-lambrecht,29,Wir wollen sie befragen!,data/txt/18003.txt,poi,spd
2771259,3,18,0,Dr. Petra Sitte (DIE LINKE),Dr. Petra Sitte,petra-sitte,30,"Im Wesentlichen geht es aber darum, dass der Bundestag auch in dieser Phase seinen Aufgaben nachkommen muss.",data/txt/18003.txt,speech,linke
2771260,3,18,0,,,,31,Beifall bei der LINKEN sowie bei Abgeordneten des BÜNDNISSES 90/DIE GRÜNEN,data/txt/18003.txt,poi,
2771261,3,18,0,Michael Grosse-Brömer [CDU/CSU],Michael Grosse-Brömer,michael-grosse-bromer,32,Was machen wir denn hier?,data/txt/18003.txt,poi,cducsu
2771262,3,18,0,Dr. Petra Sitte (DIE LINKE),Dr. Petra Sitte,petra-sitte,33,"Das ist zum einen Gesetzgebung, und das ist zum anderen natürlich Regierungskontrolle. Auch eine geschäftsführend amtierende Bundesregierung will kontrolliert werden. Frau Bundeskanzlerin hatte ja in der ersten Sitzung ausdrücklich zugestimmt. Wir sind uns ausnahmsweise in diesem Punkt einig.",data/txt/18003.txt,speech,linke
2771263,3,18,0,Volker Kauder [CDU/CSU],Volker Kauder,volker-kauder,34,Sauber! Beifall!,data/txt/18003.txt,poi,cducsu
2771264,3,18,0,Dr. Petra Sitte (DIE LINKE),Dr. Petra Sitte,petra-sitte,35,"Nun ist allerdings die Frage der Umsetzung strittig. Das haben wir eben schon gemerkt. Herr Grosse-Brömer hat da ein bisschen was durcheinandergeworfen. Es gab schon einen Antrag der Linken. Wir hatten darin beantragt, die Ausschüsse einzusetzen, die im Grundgesetz als ständige Ausschüsse vorgesehen sind.",data/txt/18003.txt,speech,linke
2771265,3,18,0,,,,36,Beifall bei der LINKEN,data/txt/18003.txt,poi,
2771266,3,18,0,Dr. Petra Sitte (DIE LINKE),Dr. Petra Sitte,petra-sitte,37,"Wir hatten darin außerdem beantragt, die Ausschüsse einzusetzen, die nach dem Haushaltsgesetz und nach der Geschäftsordnung des Bundestages vorgesehen sind. Das sind unter anderem der Petitionsausschuss, der Auswärtige Ausschuss, der Verteidigungsausschuss und der Europaausschuss. Die Einsetzung von Innen-, Rechts- und Finanzausschuss hatten wir ebenfalls beantragt, weil diese Ausschüsse seit mindestens der dritten Legislaturperiode in genau diesem Zuschnitt existieren und weil sie damit als quasi ständige Ausschüsse die Neubildung der Regierung und auch die Neubildung der Ausschüsse im Bundestag überdauert hätten. Deshalb ist der Antrag rechtskonform.",data/txt/18003.txt,speech,linke
2771267,3,18,0,,,,38,Beifall bei der LINKEN,data/txt/18003.txt,poi,
2771268,3,18,0,Dr. Petra Sitte (DIE LINKE),Dr. Petra Sitte,petra-sitte,39,"Nun wird seitens der SPD und der Union die Einsetzung eines Hauptausschusses beantragt. Wir haben überhaupt nichts dagegen, wenn Sie sich bemühen, dass der Bundestag arbeitsfähig wird, aber es muss rechtskonform geschehen. Dieser Hauptausschuss, so wie Sie ihn in Ihrem Einsetzungsantrag vorsehen, ist grundgesetzwidrig. Deshalb werden wir diesem Antrag auch nicht zustimmen.",data/txt/18003.txt,speech,linke
2771269,3,18,0,,,,40,Beifall bei der LINKEN sowie bei Abgeordneten des BÜNDNISSES 90/DIE GRÜNEN,data/txt/18003.txt,poi,
2771270,3,18,0,Dr. Petra Sitte (DIE LINKE),Dr. Petra Sitte,petra-sitte,41,"Erstens. Er taucht weder im Grundgesetz noch in der Geschäftsordnung des Bundestages auf.

Zweitens. Er ist singulär. Unsere Geschäftsordnung und das Grundgesetz sehen ausdrücklich vor, dass ständige Ausschüsse - Mehrzahl wohlgemerkt - einzusetzen sind.

Drittens. Er ist aber auch kein Sonderausschuss, weil er sich nicht um einzelne Fragen kümmert, wie es die Geschäftsordnung vorsieht. An den Hauptausschuss sollen vielmehr viele Gesetzesvorlagen und Anträge überwiesen werden. Wir sehen das ja schon an der heutigen Tagesordnung.

Viertens. Es ist auch kein ständiger Ausschuss, denn er soll mit der endgültigen Konstituierung der Ausschüsse wieder aufgelöst werden. Das haben Sie ja bereits gesagt.

Das sind schon einmal vier Gründe, um dem Antrag auf Einsetzung dieses Ausschusses nicht zuzustimmen.",data/txt/18003.txt,speech,linke
2771271,3,18,0,,,,42,Beifall bei der LINKEN,data/txt/18003.txt,poi,
2771272,3,18,0,Dr. Petra Sitte (DIE LINKE),Dr. Petra Sitte,petra-sitte,43,"Fünftens. Besonders gravierend ist für uns allerdings, dass dem Hauptausschuss Aufgaben zugewiesen werden, die ihm gemäß Grundgesetz gar keinen Spielraum lassen. Verteidigungsfragen sind im Verteidigungsausschuss zu behandeln. Haushaltsfragen sind im Haushaltsausschuss zu behandeln und nicht in einem Hauptausschuss.

Sechstens. Der Hauptausschuss verstößt allerdings auch - meine Kollegin hatte vorhin schon einen entsprechenden Einwurf gemacht - gegen die Ausübung des freien Mandats. Nach § 57 der Geschäftsordnung steht jedem Abgeordneten eine Mitarbeit in mindestens einem Ausschuss zu. Das Grundgesetz spricht hierbei von gleichen Rechten und Pflichten. Wenn aber gemäß Ihrem Einsetzungsverfahren nur 15 Prozent der Abgeordneten mitwirken können, dann bleiben 85 Prozent außen vor.",data/txt/18003.txt,speech,linke
2771273,3,18,0,Michael Grosse-Brömer [CDU/CSU],Michael Grosse-Brömer,michael-grosse-bromer,44,Für zwei Wochen!,data/txt/18003.txt,poi,cducsu
2771274,3,18,0,Dr. Petra Sitte (DIE LINKE),Dr. Petra Sitte,petra-sitte,45,"Nach unserem Antrag wären immerhin 592 Abgeordnete in die Situation gekommen, hier mitzuwirken.

Dies sind zwei weitere Gründe für die Ablehnung des Antrags.",data/txt/18003.txt,speech,linke
2771275,3,18,0,,,,46,Beifall bei der LINKEN,data/txt/18003.txt,poi,
2771276,3,18,0,Dr. Petra Sitte (DIE LINKE),Dr. Petra Sitte,petra-sitte,47,"Nun stellen die Bündnisgrünen einen Antrag, der so aussieht, als könnte er rechtskonform sein. Sie beantragen nämlich nichts anderes, als alle Ausschüsse der 17. Wahlperiode einzusetzen. Das Problem ist,",data/txt/18003.txt,speech,linke
2771277,3,18,0,Michael Grosse-Brömer [CDU/CSU],Michael Grosse-Brömer,michael-grosse-bromer,48,Rechtswidrig!,data/txt/18003.txt,poi,cducsu
2771278,3,18,0,Dr. Petra Sitte (DIE LINKE),Dr. Petra Sitte,petra-sitte,49,"dass auch dies keine ständigen Ausschüsse sind. Die Grünen sagen ja selbst, dass sie sich selbst auflösen sollen, sobald der endgültige Zuschnitt der Ausschüsse feststeht. Aufgrund dieses Punktes ist auch dieser Antrag nicht rechtskonform.",data/txt/18003.txt,speech,linke
2771279,3,18,0,,,,50,Beifall bei Abgeordneten der LINKEN,data/txt/18003.txt,poi,
2771280,3,18,0,Dr. Petra Sitte (DIE LINKE),Dr. Petra Sitte,petra-sitte,51,"Dieser Antrag hat mich auch deshalb ein wenig gewundert, weil in der Runde der Parlamentarischen Geschäftsführer vonseiten der Grünen gesagt wurde: Die Gesetzentwürfe des Bundesrates sollten wir im Hauptausschuss beraten. - Okay, Sie müssen klären, welcher Widerspruch sich hier zeigt.",data/txt/18003.txt,speech,linke
2771281,3,18,0,Michael Grosse-Brömer [CDU/CSU],Michael Grosse-Brömer,michael-grosse-bromer,52,Sehr gut!,data/txt/18003.txt,poi,cducsu
2771282,3,18,0,Dr. Petra Sitte (DIE LINKE),Dr. Petra Sitte,petra-sitte,53,"Fakt ist: Hätten Sie in der letzten Bundestagssitzung unserem Antrag zugestimmt, dann wäre der Bundestag längst arbeitsfähig, und er wäre es demokratisch und rechtskonform.

Danke.",data/txt/18003.txt,speech,linke
2771283,3,18,0,,,,54,Beifall bei der LINKEN,data/txt/18003.txt,poi,
2771284,3,18,0,Dr. Petra Sitte (DIE LINKE),Dr. Petra Sitte,petra-sitte,55,,data/txt/18003.txt,speech,linke
2771285,3,18,0,Präsident Dr. Norbert Lammert,Dr. Norbert Lammert,norbert-lammert,56,Thomas Oppermann ist der nächste Redner für die SPD-Fraktion.,data/txt/18003.txt,chair,
2771286,3,18,0,,,,57,Beifall bei der SPD,data/txt/18003.txt,poi,
2771287,3,18,0,Präsident Dr. Norbert Lammert,Dr. Norbert Lammert,norbert-lammert,58,,data/txt/18003.txt,chair,
2771288,3,18,0,Thomas Oppermann (SPD),Thomas Oppermann,thomas-oppermann,59,Herr Präsident! Meine Damen und Herren! Heute ist der 28. November.,data/txt/18003.txt,speech,spd
2771289,3,18,0,Zurufe vom BÜNDNIS 90/DIE GRÜNEN,e vom BÜNDNIS 90/DIE GRÜNEN,e-vom-bundnis-90-die-grunen,60,Ach!,data/txt/18003.txt,poi,gruene
2771290,3,18,0,Thomas Oppermann (SPD),Thomas Oppermann,thomas-oppermann,61,"Gestern sind erfolgreich die Koalitionsverhandlungen zwischen CDU/CSU und SPD abgeschlossen worden. Bei normalem Verlauf der Dinge würde am morgigen Freitag ein kleiner oder ein großer Parteitag über den Koalitionsvertrag debattieren und entscheiden, und wir könnten dann am Montag mit der Wahl der Bundeskanzlerin die Regierungsbildung einleiten und noch im Laufe der Woche die Ausschüsse festlegen und konstituieren. Dass es diesmal anders läuft, liegt nicht nur an den sehr aufwendigen Sondierungsgesprächen, die den Koalitionsverhandlungen vorangegangen sind, sondern auch daran, dass die SPD sich entschieden hat, über diesen Koalitionsvertrag ihre Mitglieder entscheiden zu lassen.",data/txt/18003.txt,speech,spd
2771291,3,18,0,,,,62,Beifall bei der SPD sowie des Abg. Volker Kauder [CDU/CSU],data/txt/18003.txt,poi,
2771292,3,18,0,Thomas Oppermann (SPD),Thomas Oppermann,thomas-oppermann,63,"Ich möchte bei Ihnen allen, Kollegen und Kolleginnen, um Verständnis dafür werben, dass wir ein solches demokratisches Experiment eingehen. Das hat bisher noch keine Partei so gemacht. Ich meine, das ist kein Rückschlag für unsere Demokratie, sondern das ist eher eine Bereicherung für unsere Demokratie.",data/txt/18003.txt,speech,spd
2771293,3,18,0,,,,64,Beifall bei der SPD,data/txt/18003.txt,poi,
2771294,3,18,0,Thomas Oppermann (SPD),Thomas Oppermann,thomas-oppermann,65,"Einen Parteitag mit 500 oder 600 Delegierten kann man an einem Wochenende durchführen. Wenn aber 470 000 Mitglieder der SPD diese Entscheidung treffen sollen, dann brauchen wir dafür zwei Wochen. Das sind zwei Wochen für mehr innerparteiliche Demokratie.",data/txt/18003.txt,speech,spd
2771295,3,18,0,,,,66,Beifall bei der SPD,data/txt/18003.txt,poi,
2771296,3,18,0,Katrin Göring-Eckardt [BÜNDNIS 90/DIE GRÜNEN],Katrin Göring-Eckardt,katrin-goring-eckardt,67,Deswegen kann man doch nicht das Parlament lahmlegen!,data/txt/18003.txt,poi,gruene
2771297,3,18,0,Thomas Oppermann (SPD),Thomas Oppermann,thomas-oppermann,68,"- Frau Göring-Eckardt, vielleicht läuft das Ganze ja sogar so gut, dass Sie am Ende in vergleichbaren Situationen auch einmal Ihre Mitglieder entscheiden lassen wollen.",data/txt/18003.txt,speech,spd
2771298,3,18,0,,,,69,Beifall bei der SPD,data/txt/18003.txt,poi,
2771299,3,18,0,Thomas Oppermann (SPD),Thomas Oppermann,thomas-oppermann,70,"Vielleicht gibt es demnächst schon in Hessen eine Gelegenheit, Ihre Mitglieder zur dortigen Koalition zu befragen.",data/txt/18003.txt,speech,spd
2771300,3,18,0,,,,71,Beifall bei der SPD,data/txt/18003.txt,poi,
2771301,3,18,0,Katrin Göring-Eckardt [BÜNDNIS 90/DIE GRÜNEN],Katrin Göring-Eckardt,katrin-goring-eckardt,72,Sie können doch nicht das Parlament lahmlegen!,data/txt/18003.txt,poi,gruene
2771302,3,18,0,Thomas Oppermann (SPD),Thomas Oppermann,thomas-oppermann,73,"Jetzt für eine Übergangszeit von nur zwei Wochen insgesamt 22 Ausschüsse mit 683 Mitgliedern bilden zu müssen, stellt aus meiner Sicht einen unverhältnismäßigen Aufwand dar; denn in zwei Wochen müssten wir das wieder komplett neu organisieren. Es liegen in der Tat Gesetzentwürfe vor, aber diese kann auch der Hauptausschuss kompetent beraten.

Sie von den Grünen haben ja noch keinen einzigen Gesetzentwurf eingebracht, der beraten werden könnte. Die Linken haben immerhin einige Gesetzentwürfe vorgelegt; das muss man ja einmal feststellen.",data/txt/18003.txt,speech,spd
2771303,3,18,0,Michael Grosse-Brömer [CDU/CSU],Michael Grosse-Brömer,michael-grosse-bromer,74,Das stimmt!,data/txt/18003.txt,poi,cducsu
2771304,3,18,0,Thomas Oppermann (SPD),Thomas Oppermann,thomas-oppermann,75,"Der Hauptausschuss ist natürlich nicht grundgesetzwidrig. Das ist ein Ausschuss, in dem das Parlament jetzt für einen kurzen Zeitraum entscheidet, wie es seine Arbeit organisiert.",data/txt/18003.txt,speech,spd
2771305,3,18,0,Volker Kauder [CDU/CSU],Volker Kauder,volker-kauder,76,Sehr gut!,data/txt/18003.txt,poi,cducsu
2771306,3,18,0,Thomas Oppermann (SPD),Thomas Oppermann,thomas-oppermann,77,"Im Grundgesetz ist vorgesehen, dass das Parlament autonom ist, wenn es darum geht, seine eigene Arbeit zu regeln. Von dieser Autonomie machen wir jetzt Gebrauch.",data/txt/18003.txt,speech,spd
2771307,3,18,0,,,,78,Beifall bei der SPD sowie bei Abgeordneten der CDU/CSU,data/txt/18003.txt,poi,
2771308,3,18,0,Thomas Oppermann (SPD),Thomas Oppermann,thomas-oppermann,79,"Ich finde es gut, dass wir das Präsidium mit der Leitung des Hauptausschusses beauftragen,",data/txt/18003.txt,speech,spd
2771309,3,18,0,Katrin Göring-Eckardt [BÜNDNIS 90/DIE GRÜNEN],Katrin Göring-Eckardt,katrin-goring-eckardt,80,Stimmt! Da sind so viele drin!,data/txt/18003.txt,poi,gruene
2771310,3,18,0,Thomas Oppermann (SPD),Thomas Oppermann,thomas-oppermann,81,"nicht nur, weil dann mit der Person unseres Präsidenten auch eine kompetente Leitung des Hauptausschusses gewährleistet ist, sondern auch, weil die Vizepräsidenten der Parteien, die hier im Bundestag möglicherweise Oppositionsfraktionen sein werden, an der Leitung dieses Hauptausschusses beteiligt werden.

Wir haben in den Koalitionsverhandlungen zwischen Union und SPD auch geklärt, dass wir die Minderheitenrechte in diesem Parlament zur Geltung bringen wollen. Eine starke Demokratie braucht eine handlungsfähige Opposition. Das werden wir in Gesprächen mit allen Fraktionen in diesem Bundestag sicherstellen.

Seien Sie bitte so einsichtig und vernünftig, uns die nächsten zwei Wochen mit dem Hauptausschuss leben zu lassen. Wir können zusagen, dass wir die Ausschüsse noch in diesem Jahr, noch vor Weihnachten, exakt definieren und einsetzen,",data/txt/18003.txt,speech,spd
2771311,3,18,0,,,,82,Zurufe vom BÜNDNIS 90/DIE GRÜNEN,data/txt/18003.txt,poi,
2771312,3,18,0,Thomas Oppermann (SPD),Thomas Oppermann,thomas-oppermann,83,"sodass sie dann im nächsten Jahr ihre Arbeit beginnen können.

Vielen Dank.",data/txt/18003.txt,speech,spd
2771313,3,18,0,,,,84,Beifall bei der SPD sowie bei Abgeordneten der CDU/CSU,data/txt/18003.txt,poi,
2771314,3,18,0,Thomas Oppermann (SPD),Thomas Oppermann,thomas-oppermann,85,,data/txt/18003.txt,speech,spd
2771315,3,18,0,Präsident Dr. Norbert Lammert,Dr. Norbert Lammert,norbert-lammert,86,Zum Schluss dieser Runde spricht die Kollegin Britta Haßelmann für die Fraktion Bündnis 90/Die Grünen.,data/txt/18003.txt,chair,
2771316,3,18,0,Britta Haßelmann (BÜNDNIS 90/DIE GRÜNEN),Britta Haßelmann,britta-haßelmann,87,"Sehr geehrter Herr Präsident! Sehr geehrte Kolleginnen und Kollegen! Meine Damen und Herren! Lieber Thomas Oppermann, ich glaube, in Sachen Basisdemokratie brauchen die Grünen keine Belehrungen der SPD.",data/txt/18003.txt,speech,gruene
2771317,3,18,0,,,,88,Beifall beim BÜNDNIS 90/DIE GRÜNEN,data/txt/18003.txt,poi,
2771318,3,18,0,,,,89,Lachen der Abg. Christine Lambrecht [SPD],data/txt/18003.txt,poi,
