id,sitzung,wahlperiode,in_writing,speaker,speaker_cleaned,speaker_fp,sequence,text,filename,type,speaker_party
2771714,3,18,0,Max Straubinger (CDU/CSU),Max Straubinger,max-straubinger,485,"Frau Präsidentin! Werte Kolleginnen und Kollegen! Wir haben heute einen Gesetzentwurf der Linken zu beraten. Ich bin versucht, zu sagen: Es geht in der 18. Legislaturperiode so weiter, wie die 17. Legislaturperiode beendet worden ist. Herr Birkwald, Ihre Rede war letztendlich dieselbe wie immer. Es hat sich nichts geändert.",data/txt/18003.txt,speech,cducsu
2771715,3,18,0,Matthias W. Birkwald [DIE LINKE],Matthias W. Birkwald,matthias-birkwald,486,Doch! Wir haben Vorschläge gemacht!,data/txt/18003.txt,poi,linke
2771716,3,18,0,Max Straubinger (CDU/CSU),Max Straubinger,max-straubinger,487,"- Nein, es hat sich nichts geändert; denn Sie sind immer noch im rentenpolitischen Nirwana.",data/txt/18003.txt,speech,cducsu
2771717,3,18,0,Dr. Matthias Zimmer [CDU/CSU],Dr. Matthias Zimmer,matthias-zimmer,488,Da kommt er auch nicht mehr raus!,data/txt/18003.txt,poi,cducsu
2771718,3,18,0,Max Straubinger (CDU/CSU),Max Straubinger,max-straubinger,489,"- Da kommt er nicht mehr heraus. Ganz genau, Herr Kollege Zimmer.",data/txt/18003.txt,speech,cducsu
2771719,3,18,0,,,,490,Beifall bei Abgeordneten der CDU/CSU,data/txt/18003.txt,poi,
2771720,3,18,0,Max Straubinger (CDU/CSU),Max Straubinger,max-straubinger,491,"Auf der einen Seite vorzuwerfen, dass die SPD dem Sparwahn der Union erlegen wäre, gleichzeitig aber zu sagen, wir würden Weihnachtsgeschenke verteilen, wie es gerade auch der Kollege Kurth getan hat, ist widersprüchlich. Sie tadeln uns, weil wir notwendige Verbesserungen in der Rentenversicherung vornehmen, und bezeichnen das als Weihnachtsgeschenk; Sie selbst aber stellen Anträge für eine abschlagsfreie EM-Rente und für die Aufhebung des Nachhaltigkeitsfaktors. Sie geißeln uns dafür, dass wir den Beitragssatz nicht senken, sind aber eigentlich dafür, dass der Beitragssatz nicht gesenkt wird.",data/txt/18003.txt,speech,cducsu
2771721,3,18,0,Matthias W. Birkwald [DIE LINKE],Matthias W. Birkwald,matthias-birkwald,492,"Jetzt verwechseln Sie aber alles! Das waren wir, und das mit dem Beitragssatz war der Kollege Kurth! Sie bringen alles durcheinander, Herr Kollege!",data/txt/18003.txt,poi,linke
2771722,3,18,0,Max Straubinger (CDU/CSU),Max Straubinger,max-straubinger,493,"Also, Herr Kollege Kurth, irgendwo sollte das, was Sie hier als rentenpolitisches Konzept darlegen, zusammenpassen.",data/txt/18003.txt,speech,cducsu
2771723,3,18,0,,,,494,Beifall bei Abgeordneten der CDU/CSU,data/txt/18003.txt,poi,
2771724,3,18,0,Max Straubinger (CDU/CSU),Max Straubinger,max-straubinger,495,"So zeigt sich sehr deutlich, dass die Linke und die Grünen in diesem Haus in keinster Weise positive Vorstellungen von der Zukunft der Alterssicherung der Menschen haben.",data/txt/18003.txt,speech,cducsu
2771725,3,18,0,,,,496,Beifall des Abg. Thomas Stritzl [CDU/CSU],data/txt/18003.txt,poi,
2771726,3,18,0,Max Straubinger (CDU/CSU),Max Straubinger,max-straubinger,497,"Zur Alterssicherung der Menschen besagt ein OECD-Bericht, der morgen veröffentlicht wird - Herr Kollege Birkwald, Sie haben ihn hier bemüht -, klar und deutlich, dass die Nachhaltigkeit der deutschen Rentenversicherung die beste im Vergleich mit allen anderen Rentenversicherungssystemen der OECD-Länder ist, und zwar aufgrund der Maßnahmen, die wir in der Vergangenheit ergriffen haben: einmal der Erhöhung des Renteneintrittsalters auf 67 bis zum Jahr 2029 - die Frau Ministerin hat es dargelegt - und darüber hinaus der Einführung des Nachhaltigkeitsfaktors. Das heißt, die Menschen in Deutschland können sich auf die Stabilität unseres Rentenversicherungssystems verlassen. Das ist die beste Auszeichnung, vor allen Dingen auch für die Bürgerinnen und Bürger.",data/txt/18003.txt,speech,cducsu
2771727,3,18,0,,,,498,Beifall bei Abgeordneten der CDU/CSU,data/txt/18003.txt,poi,
2771728,3,18,0,Max Straubinger (CDU/CSU),Max Straubinger,max-straubinger,499,"Auf der anderen Seite gilt es, dieses verlässliche Rentenversicherungssystem, das wir für die Bürgerinnen und Bürger über Jahrzehnte hinweg geschaffen haben, im Sinne der Gerechtigkeitsfrage weiterzuentwickeln. Diese Frage lösen wir, indem wir die Pläne für eine Mütterrente umsetzen, wie wir, CDU/CSU, es im Wahlkampf hervorgehoben haben. Damit gewähren wir ab dem 1. Juli nächsten Jahres, nicht schon ab Weihnachten, einen zusätzlichen Rentenpunkt. Viele Mütter in Deutschland verbessern somit ihre Rentenanwartschaften bzw. erhalten höhere aktive Renten. Ich bin der Meinung, das ist im besten Sinne des Gebots des Gerechtigkeitsausgleichs, der aus folgendem Grund erforderlich wurde: Für Kinder, die vor 1992 geboren worden sind, wird nur ein Rentenpunkt angerechnet, und für die nach 1992 geborenen werden drei Rentenpunkte zugrunde gelegt. Wir haben dies hier dargelegt. Ich bin dankbar, dass sich die zukünftigen Koalitionsfraktionen darauf geeinigt haben.",data/txt/18003.txt,speech,cducsu
2771729,3,18,0,,,,500,Beifall bei Abgeordneten der CDU/CSU,data/txt/18003.txt,poi,
2771730,3,18,0,Max Straubinger (CDU/CSU),Max Straubinger,max-straubinger,501,,data/txt/18003.txt,speech,cducsu
2771731,3,18,0,Vizepräsidentin Edelgard Bulmahn,Edelgard Bulmahn,edelgard-bulmahn,502,"Herr Kollege Straubinger, lassen Sie eine Zwischenfrage des Kollegen Birkwald zu?",data/txt/18003.txt,chair,
2771732,3,18,0,Max Straubinger (CDU/CSU),Max Straubinger,max-straubinger,503,"Ja, sehr gerne, natürlich. Das verlängert meine Redezeit.",data/txt/18003.txt,speech,cducsu
2771733,3,18,0,Dr. Petra Sitte [DIE LINKE],Dr. Petra Sitte,petra-sitte,504,"Das werden wir sehen, ob sich das lohnt!",data/txt/18003.txt,poi,linke
2771734,3,18,0,Max Straubinger (CDU/CSU),Max Straubinger,max-straubinger,505,"- Ja, sicherlich.",data/txt/18003.txt,speech,cducsu
2771735,3,18,0,Matthias W. Birkwald (DIE LINKE),Matthias W. Birkwald,matthias-birkwald,506,"Vielen Dank, Frau Präsidentin und Herr Kollege Straubinger, dass Sie diese Zwischenfrage zulassen. - Herr Kollege Straubinger, Sie haben eben insinuiert, dass der OECD-Bericht von der Rentenversicherung in Deutschland schwärmt, vor allen Dingen haben Sie insinuiert, dass Geringverdienende eine auskömmliche Rente hätten. Das Gegenteil ist der Fall. Das können Sie in allen Zeitungen lesen. Ich zitiere jetzt einmal aus Ihrer Lieblingszeitung; das ist die Bild.",data/txt/18003.txt,speech,linke
2771736,3,18,0,Max Straubinger (CDU/CSU),Max Straubinger,max-straubinger,507,Die kenne ich gar nicht.,data/txt/18003.txt,speech,cducsu
2771737,3,18,0,Matthias W. Birkwald (DIE LINKE),Matthias W. Birkwald,matthias-birkwald,508,,data/txt/18003.txt,speech,linke
2771738,3,18,0,Selbst in der Bild heißt es unter der Überschrift Feuer unterm Dach,Selbst in der Bild heißt es unter der Überschrift Feuer unterm Dach,selbst-in-der-bild-heißt-es-unter-der-uberschrift-feuer-unterm-dach,509,"Die Warnungen werden lauter, und sie kommen nicht mehr nur aus Deutschland: Hunderttausenden Geringverdienern droht im Alter der Absturz in die Armut.   Deutschland, eine Wirtschafts-Weltmacht, aber bei der Altersversorgung fast Entwicklungsland - das passt nicht zusammen.

So die Bild-Zeitung.

Die Kollegin, die bei der OECD zuständig ist, sagt, dass das Altersgeld von Geringverdienenden in Deutschland so niedrig sei wie in kaum einem anderen OECD-Land. Geringverdienende haben in Deutschland im Schnitt netto 55 Prozent ihrer Bezüge, und in 27 OECD-Ländern liegt der Durchschnitt bei 82 Prozent.

Also deutlich ist - das gilt auch für die Kollegin Ferner -: Heute stellt sich das Rentenversicherungssystem in Deutschland so dar, dass Geringverdienende sehr schlecht abgesichert sind. Deswegen brauchen wir eine solidarische Mindestrente, die den Namen auch verdient und von der Menschen im Alter armutsfrei leben können. Wir brauchen nicht irgendwelche Geschichten, die deutlich niedriger liegen. Ich bitte Sie, zur Kenntnis zu nehmen: Die OECD hat das Gegenteil von dem gesagt, was Sie hier behauptet haben.

Herzlichen Dank.",data/txt/18003.txt,speech,
2771739,3,18,0,,,,510,Beifall bei der LINKEN,data/txt/18003.txt,poi,
2771740,3,18,0,Selbst in der Bild heißt es unter der Überschrift Feuer unterm Dach,Selbst in der Bild heißt es unter der Überschrift Feuer unterm Dach,selbst-in-der-bild-heißt-es-unter-der-uberschrift-feuer-unterm-dach,511,,data/txt/18003.txt,speech,
2771741,3,18,0,Max Straubinger (CDU/CSU),Max Straubinger,max-straubinger,512,"Lieber Herr Kollege Birkwald, ich möchte Ihnen entgegensetzen - das kann dann die Bild-Zeitung auch schreiben -: In Deutschland gibt es Altersarmut nur in sehr, sehr begrenztem Maß: Nur 2,6 Prozent sind auf Grundsicherung im Alter und bei Erwerbsminderung angewiesen.",data/txt/18003.txt,speech,cducsu
2771742,3,18,0,Dr. Petra Sitte [DIE LINKE],Dr. Petra Sitte,petra-sitte,513,Die müssen alle in meinem Wahlkreis wohnen!,data/txt/18003.txt,poi,linke
2771743,3,18,0,Max Straubinger (CDU/CSU),Max Straubinger,max-straubinger,514,"Das zeigt sehr deutlich, dass die Alterssicherungssysteme greifen. Sie ruhen ja auf drei Säulen. Sie reden immer nur von der gesetzlichen Rentenversicherung. Es gibt da auch noch die betriebliche Altersversorgung.",data/txt/18003.txt,speech,cducsu
2771744,3,18,0,Matthias W. Birkwald [DIE LINKE],Matthias W. Birkwald,matthias-birkwald,515,Die ist doch schon im Keller!,data/txt/18003.txt,poi,linke
2771745,3,18,0,Max Straubinger (CDU/CSU),Max Straubinger,max-straubinger,516,"Genauso gibt es die private kapitalgedeckte Zusatzversorgung, die Sie aus ideologischen Gründen immer ablehnen, die aber unter dem Gesichtspunkt der Generationengerechtigkeit eine verbesserte Situation herbeiführt.",data/txt/18003.txt,speech,cducsu
2771746,3,18,0,,,,517,Widerspruch der Abg. Elke Ferner [SPD],data/txt/18003.txt,poi,
2771747,3,18,0,Max Straubinger (CDU/CSU),Max Straubinger,max-straubinger,518,"- Natürlich, Frau Ferner! - Im Alter wird ein ausreichendes Einkommen erzielt, wobei dies nicht allein die nachfolgende Generation zu leisten hat, weil vorher ja ein Ansparvorgang stattgefunden hat. Bei der Rentenversicherung haben wir ein Umlagesystem. Das bedeutet, dass die im Erwerbsleben Stehenden für die Rentenleistungen aus der gesetzlichen Rentenversicherung aufzukommen haben, während im anderen Fall ein Ansparvorgang stattfindet.",data/txt/18003.txt,speech,cducsu
2771748,3,18,0,Matthias W. Birkwald [DIE LINKE],Matthias W. Birkwald,matthias-birkwald,519,Sagen Sie was zur OECD!,data/txt/18003.txt,poi,linke
2771749,3,18,0,Max Straubinger (CDU/CSU),Max Straubinger,max-straubinger,520,"90 Millionen Lebensversicherungsverträge und ausgeklügelte Altersversicherungssysteme in unseren Industriebetrieben in Deutschland sorgen dafür, dass im Alter eine gute Grundlage gegeben ist.",data/txt/18003.txt,speech,cducsu
2771750,3,18,0,Matthias W. Birkwald [DIE LINKE],Matthias W. Birkwald,matthias-birkwald,521,Keine Antwort auf die Frage zur OECD-Studie!,data/txt/18003.txt,poi,linke
2771751,3,18,0,Max Straubinger (CDU/CSU),Max Straubinger,max-straubinger,522,"Im OECD-Bericht wird dies alles nicht ausreichend berücksichtigt, Herr Kollege Birkwald.",data/txt/18003.txt,speech,cducsu
2771752,3,18,0,,,,523,Beifall bei Abgeordneten der CDU/CSU,data/txt/18003.txt,poi,
2771753,3,18,0,,,,524,Abg. Matthias W. Birkwald [DIE LINKE] nimmt Platz,data/txt/18003.txt,poi,
2771754,3,18,0,Max Straubinger (CDU/CSU),Max Straubinger,max-straubinger,525,"Darüber hinaus kommt natürlich noch hinzu - bleiben Sie bitte noch stehen, Herr Kollege; ich bin noch nicht fertig -, dass Folgendes in die Waagschale gelegt werden muss: Sie hantieren immer mit Prozentsätzen.",data/txt/18003.txt,speech,cducsu
2771755,3,18,0,Vizepräsidentin Edelgard Bulmahn,Edelgard Bulmahn,edelgard-bulmahn,526,"Herr Kollege Birkwald, das ist schon noch eine Antwort. Stehen Sie bitte wieder auf!",data/txt/18003.txt,chair,
2771756,3,18,0,,,,527,Matthias W. Birkwald [DIE LINKE] erhebt sich wieder von seinem Platz,data/txt/18003.txt,poi,
2771757,3,18,0,Matthias W. Birkwald [DIE LINKE],Matthias W. Birkwald,matthias-birkwald,528,Er antwortet ja nicht!,data/txt/18003.txt,poi,linke
2771758,3,18,0,,,,529,Weitere Zurufe von der LINKEN,data/txt/18003.txt,poi,
2771759,3,18,0,Vizepräsidentin Edelgard Bulmahn,Edelgard Bulmahn,edelgard-bulmahn,530,,data/txt/18003.txt,chair,
2771760,3,18,0,Max Straubinger (CDU/CSU),Max Straubinger,max-straubinger,531,Aber mir sind 56 Prozent von einem relativ hohen Durchschnittsgehalt - das ist die Grundlage des OECD-Berichts - lieber als ein höherer Prozentsatz von einem sehr niedrigen Verdienst in anderen Ländern.,data/txt/18003.txt,speech,cducsu
2771761,3,18,0,,,,532,Beifall bei der CDU/CSU,data/txt/18003.txt,poi,
2771762,3,18,0,Max Straubinger (CDU/CSU),Max Straubinger,max-straubinger,533,"In Deutschland geht es den Menschen im Alter also weit besser als in vielen anderen Ländern. Das ist letztendlich das Wichtigste für unsere Menschen.

Werte Damen und Herren, wir nehmen Verbesserungen vor. Das gilt auch in der Frage der Anerkennung von langjährigen Beitragszahlungen. Das war schon Grundlage bei der Umsetzung der Rente mit 67, wo wir darauf gedrängt haben, dass Menschen, die 45 Jahre Beiträge gezahlt haben, ab dem 65. Lebensjahr - das gilt in der Umsetzung seit 2002 - ohne Abschlag in Rente gehen können. Es ist ein guter Kompromiss gefunden worden - es ist ein gelungener Kompromiss -, dass jetzt bei 45 Jahren Beitragszahlungsdauer bereits ab einem Alter von 63 Jahren - dann ansteigend - abschlagsfrei in Rente gegangen werden kann. Das ist angemessen für die Menschen, die in der gesetzlichen Rentenversicherung besonders langjährig versichert waren. Wir stehen dazu, und ich glaube, dass dies ein wichtiger Punkt ist.

Ein Letztes noch. Gerade beim Übergang von der Erwerbstätigkeit in den Ruhestand gibt es derzeit einen sehr starken Bruch. Wenn jemand vorzeitig Rente in Anspruch nimmt, kann er nur ein geringfügiges Beschäftigungsverhältnis eingehen. Viele angehende Rentnerinnen und Rentner wollen aber sozusagen gleitend in den Ruhestand wechseln. Deshalb ist es richtig, wenn wir die Hinzuverdienstmöglichkeiten bei vorzeitiger Inanspruchnahme von Rentenleistungen ausweiten. Das haben wir im Koalitionsvertrag vereinbart.

Ich glaube, das sind sehr viele positive Punkte. Ich nehme an, dass auch die SPD-Mitglieder, die ja zur Abstimmung aufgerufen sind, dem zustimmen können und dass wir dementsprechend eine zukunftsorientierte Renten- und Sozialpolitik für unser Land gestalten können.

In diesem Sinne herzlichen Dank für die Aufmerksamkeit.",data/txt/18003.txt,speech,cducsu
2771763,3,18,0,,,,534,Beifall bei der CDU/CSU sowie bei Abgeordneten der SPD,data/txt/18003.txt,poi,
2771764,3,18,0,Max Straubinger (CDU/CSU),Max Straubinger,max-straubinger,535,,data/txt/18003.txt,speech,cducsu
2771765,3,18,0,Vizepräsidentin Edelgard Bulmahn,Edelgard Bulmahn,edelgard-bulmahn,536,Jetzt spricht der Kollege Peter Weiß.,data/txt/18003.txt,chair,
2771766,3,18,0,,,,537,Beifall bei der CDU/CSU,data/txt/18003.txt,poi,
2771767,3,18,0,Vizepräsidentin Edelgard Bulmahn,Edelgard Bulmahn,edelgard-bulmahn,538,,data/txt/18003.txt,chair,
2771768,3,18,0,Peter Weiß (Emmendingen) (CDU/CSU),Peter Weiß,peter-weiß,539,"Frau Präsidentin! Verehrte Kolleginnen und Kollegen! Lassen Sie uns zum Abschluss dieser Debatte doch einmal zurückschauen, woher wir kommen. Vor vier Jahren hatten wir einen Rentenversicherungsbeitrag von 19,9 Prozent. Diesen haben wir in den vergangenen vier Jahren um insgesamt 1 Prozentpunkt auf heute 18,9 Prozent absenken können.",data/txt/18003.txt,speech,cducsu
2771769,3,18,0,Matthias W. Birkwald [DIE LINKE],Matthias W. Birkwald,matthias-birkwald,540,Das war auch schon ein Fehler!,data/txt/18003.txt,poi,linke
2771770,3,18,0,Peter Weiß (Emmendingen) (CDU/CSU),Peter Weiß,peter-weiß,541,"Wir werden in dieser Legislaturperiode, so alle Prognosen, diesen Beitrag weiter stabil bei 18,9 Prozent halten können.

Gleichzeitig werden wir zum Ende dieses Jahres in der gesetzlichen Rentenversicherung voraussichtlich eine Rücklage - sprich: ein Guthaben - von über 31 Milliarden Euro haben, die höchste Rücklage seit über zwanzig Jahren. Man kann überall, in jeder Debatte, ein Haar in der Suppe finden; aber ich meine, wir können eigentlich doch stolz darauf sein, dass wir in der Rentenversicherung einen relativ niedrigen Beitrag und gleichzeitig die höchsten Rücklagen seit über zwanzig Jahren haben.",data/txt/18003.txt,speech,cducsu
2771771,3,18,0,,,,542,Beifall bei der CDU/CSU sowie bei Abgeordneten der SPD,data/txt/18003.txt,poi,
2771772,3,18,0,Markus Kurth [BÜNDNIS 90/DIE GRÜNEN],Markus Kurth,markus-kurth,543,Nicht mehr lange!,data/txt/18003.txt,poi,gruene
2771773,3,18,0,Peter Weiß (Emmendingen) (CDU/CSU),Peter Weiß,peter-weiß,544,"Das verdanken wir einer gut laufenden Wirtschaft, gut laufenden Unternehmen und einer wachsenden Zahl von Arbeitnehmerinnen und Arbeitnehmern, die mit einem guten Lohn auch gute Sozialversicherungsbeiträge bezahlen. Wenn es ein Ziel zu Beginn einer neuen Legislaturperiode gibt, das uns einen sollte, dann sollte es das sein, diese gute Entwicklung auf dem Arbeitsmarkt, in der Wirtschaft weiter zu beflügeln, damit unsere Rentenversicherung, der Kern des deutschen Sozialstaates, auch in Zukunft gut finanziert ist, nicht ins Minus läuft und trotzdem die Beiträge für die Arbeitnehmerinnen und Arbeitnehmer und die Unternehmen stabil bleiben. Das muss unser gemeinsames Ziel sein.",data/txt/18003.txt,speech,cducsu
2771774,3,18,0,,,,545,Beifall bei der CDU/CSU sowie bei Abgeordneten der SPD,data/txt/18003.txt,poi,
2771775,3,18,0,Matthias W. Birkwald [DIE LINKE],Matthias W. Birkwald,matthias-birkwald,546,Im Datenreport von gestern steht das Gegenteil!,data/txt/18003.txt,poi,linke
2771776,3,18,0,Peter Weiß (Emmendingen) (CDU/CSU),Peter Weiß,peter-weiß,547,"Verehrte Kolleginnen und Kollegen, ich finde es richtig und auch notwendig, dass wir in einer solch guten Situation, in der wir uns befinden, die Handlungsmöglichkeiten nutzen, um allfällig notwendige Reformen im Rentenrecht durchzuführen. Dazu gehört, dass wir die Leistung derjenigen, die die Zukunft der Rentenversicherung gewährleisten, indem sie Kinder großziehen, in der Rente besser bewerten. Dafür war es höchste Zeit. Wir haben verabredet, das jetzt endlich zu machen.",data/txt/18003.txt,speech,cducsu
2771777,3,18,0,,,,548,Beifall bei der CDU/CSU sowie bei Abgeordneten der SPD,data/txt/18003.txt,poi,
2771778,3,18,0,Markus Kurth [BÜNDNIS 90/DIE GRÜNEN],Markus Kurth,markus-kurth,549,"Machen Sie es mit Steuergeldern, nicht mit Beitragsgeldern!",data/txt/18003.txt,poi,gruene
2771779,3,18,0,Peter Weiß (Emmendingen) (CDU/CSU),Peter Weiß,peter-weiß,550,"Der zweite Punkt. Gerade Menschen, die wegen Krankheit oder einem Unfall vorzeitig aus dem Erwerbsleben ausscheiden müssen und die liebend gerne länger gearbeitet hätten, sind heute in der Gefahr, dass sie mit der Erwerbsminderungsrente, die sie erhalten, nicht auskommen können.",data/txt/18003.txt,speech,cducsu
2771780,3,18,0,Matthias W. Birkwald [DIE LINKE],Matthias W. Birkwald,matthias-birkwald,551,Das stimmt!,data/txt/18003.txt,poi,linke
2771781,3,18,0,Peter Weiß (Emmendingen) (CDU/CSU),Peter Weiß,peter-weiß,552,"Bereits 10 Prozent der Rentner in Deutschland, die Erwerbsminderungsrente erhalten, müssen ergänzend Grundsicherung beziehen. Deswegen ist es richtig, dass wir die Handlungsmöglichkeiten nutzen, durch ein besseres Berechnungsverfahren dafür zu sorgen, dass auch jemand, der vorzeitig wegen Krankheit oder Unfall aus dem Erwerbsleben ausscheiden muss, eine Rente erhält, die ihn möglichst nicht dazu zwingt, um zusätzliche staatliche Stütze anstehen zu müssen.",data/txt/18003.txt,speech,cducsu
2771782,3,18,0,Matthias W. Birkwald [DIE LINKE],Matthias W. Birkwald,matthias-birkwald,553,"Dann müssen Sie die Abschläge streichen, sonst kriegen Sie es nicht hin!",data/txt/18003.txt,poi,linke
2771783,3,18,0,Peter Weiß (Emmendingen) (CDU/CSU),Peter Weiß,peter-weiß,554,,data/txt/18003.txt,speech,cducsu
2771784,3,18,0,Vizepräsidentin Edelgard Bulmahn,Edelgard Bulmahn,edelgard-bulmahn,555,"Herr Kollege Weiß, gestatten Sie eine Zwischenfrage der Kollegin Andreae?",data/txt/18003.txt,chair,
2771785,3,18,0,Peter Weiß (Emmendingen) (CDU/CSU),Peter Weiß,peter-weiß,556,"Ja, bitte schön.",data/txt/18003.txt,speech,cducsu
2771786,3,18,0,Kerstin Andreae (BÜNDNIS 90/DIE GRÜNEN),Kerstin Andreae,kerstin-andreae,557,"Herr Kollege Weiß, Sie haben vorhin davon gesprochen, dass die Beitragssätze bei 18,9 Prozent stabil gehalten werden können und die Rentenkasse mit 31 Milliarden Euro voll ist. Sie sagten, es wäre jetzt an der Zeit, die Mütterrente einzuführen. Sie wissen, dass, wenn Sie die Mütterrente aus der Rentenkasse und damit aus den Beiträgen der Beitragszahler finanzieren, die 31 Milliarden Euro schmelzen werden; denn Sie werden jedes Jahr 6 bis 7 Milliarden Euro für die Mütterrente ausgeben müssen. Die Mütterrente ist definitiv eine versicherungsfremde Leistung. Sie hat mit den Beiträgen in die Rentenkasse nichts zu tun. Wenn Sie die Mütterrente wollen, dann müssen Sie sie - das ist zwingend logisch - über Steuermittel finanzieren.

Ich möchte Sie noch auf ein Zitat aus einer Rede von Ihnen von vor einem Jahr hinweisen:

Wenn ich die Rücklage aber verjubeln will,

- das haben Sie gesagt -

dann habe ich für die Rentenversicherung nichts gewonnen, sondern werde sie auf alle Zeit mit höheren Belastungen versehen und künftig immer höhere Beiträge der Beitragszahlerinnen und Beitragszahler erheben müssen.

Erklären Sie mir, warum Sie nicht in der Lage sind, zu sagen: Die Mütterrente muss zwingend logisch aus Steuermitteln finanziert werden und hat mit den Beitragszahlungen in die Rentenkasse nichts zu tun!",data/txt/18003.txt,speech,gruene
2771787,3,18,0,,,,558,Beifall beim BÜNDNIS 90/DIE GRÜNEN sowie bei Abgeordneten der LINKEN,data/txt/18003.txt,poi,
2771788,3,18,0,Kerstin Andreae (BÜNDNIS 90/DIE GRÜNEN),Kerstin Andreae,kerstin-andreae,559,,data/txt/18003.txt,speech,gruene
2771789,3,18,0,Peter Weiß (Emmendingen) (CDU/CSU),Peter Weiß,peter-weiß,560,"Frau Kollegin Andreae, Frau Bundesministerin von der Leyen hat in ihrer Rede bereits darauf hingewiesen, dass die gesetzliche Rentenversicherung schon heute in einem hohen Maß, nämlich zu einem Drittel ihrer Ausgaben, aus Steuermitteln finanziert ist.",data/txt/18003.txt,speech,cducsu
2771790,3,18,0,Bettina Hagedorn [SPD],Bettina Hagedorn,bettina-hagedorn,561,So ist es!,data/txt/18003.txt,poi,spd
2771791,3,18,0,Peter Weiß (Emmendingen) (CDU/CSU),Peter Weiß,peter-weiß,562,"Das heißt, die Beiträge der Beitragszahlerinnen und Beitragszahler bestreiten nur zwei Drittel der jährlichen Ausgaben; ein Drittel kommt aus den Steuermitteln.",data/txt/18003.txt,speech,cducsu
2771792,3,18,0,Katrin Göring-Eckardt [BÜNDNIS 90/DIE GRÜNEN],Katrin Göring-Eckardt,katrin-goring-eckardt,563,Dann ist es ja kein Problem!,data/txt/18003.txt,poi,gruene
2771793,3,18,0,Elke Ferner [SPD],Elke Ferner,elke-ferner,564,"Das ist doch eine Milchbubenrechnung, die Sie hier machen!",data/txt/18003.txt,poi,spd
2771794,3,18,0,Peter Weiß (Emmendingen) (CDU/CSU),Peter Weiß,peter-weiß,565,"- Frau Ferner, dieser Betrag ist mehr als das, was wir für sogenannte versicherungsfremde Leistungen aus der Rentenversicherung ausgeben.

Ich komme zu einem zweiten Punkt und möchte das, was die Frau Ministerin bereits vorgetragen hat, wiederholen: Es ist verabredet, dass ein zusätzlicher Bundeszuschuss in Höhe von 2 Milliarden Euro hinzukommen soll, um den Beitrag des Bundes zur Stabilisierung des Rentenniveaus und zur Stabilisierung des Rentenbeitragssatzes auch in Zukunft zu gewährleisten.",data/txt/18003.txt,speech,cducsu
2771795,3,18,0,Kerstin Andreae [BÜNDNIS 90/DIE GRÜNEN],Kerstin Andreae,kerstin-andreae,566,Wo kommen die her?,data/txt/18003.txt,poi,gruene
2771796,3,18,0,Peter Weiß (Emmendingen) (CDU/CSU),Peter Weiß,peter-weiß,567,"Ich finde: Zusammengerechnet ist es eine großartige Leistung, die wir aus dem Steueraufkommen erbringen. Das macht es uns möglich, die Leistungen so auszugestalten, wie wir es im Koalitionsvertrag miteinander verabredet haben.",data/txt/18003.txt,speech,cducsu
2771797,3,18,0,Kerstin Andreae [BÜNDNIS 90/DIE GRÜNEN],Kerstin Andreae,kerstin-andreae,568,Das ist doch nicht ehrlich!,data/txt/18003.txt,poi,gruene
2771798,3,18,0,Peter Weiß (Emmendingen) (CDU/CSU),Peter Weiß,peter-weiß,569,"Weil wir hier über den Beitragssatz diskutieren und weil Sie, Frau Kollegin Andreae, sich als mittelstandspolitische Sprecherin der Grünen gern bei Unternehmen in unserem Lande aufhalten,",data/txt/18003.txt,speech,cducsu
2771799,3,18,0,Kerstin Andreae [BÜNDNIS 90/DIE GRÜNEN],Kerstin Andreae,kerstin-andreae,570,Das sollten Sie auch mal machen!,data/txt/18003.txt,poi,gruene
2771800,3,18,0,Peter Weiß (Emmendingen) (CDU/CSU),Peter Weiß,peter-weiß,571,"möchte ich eines sagen: Für die Unternehmer in unserem Land ist eine Beitragssatzstabilität das Allerwichtigste, sodass sie wissen: Ich muss nicht mit Sprüngen nach unten oder nach oben rechnen, sondern kann stabil kalkulieren.",data/txt/18003.txt,speech,cducsu
2771801,3,18,0,,,,572,Beifall bei der CDU/CSU,data/txt/18003.txt,poi,
2771802,3,18,0,Peter Weiß (Emmendingen) (CDU/CSU),Peter Weiß,peter-weiß,573,"Würden wir den Beitragssatz jetzt senken, dann wäre klar, dass er in wenigen Jahren wieder deutlich nach oben gehen würde. Deswegen ist alles, was wir tun, einem Ziel verpflichtet: der Beitragssatzstabilität für die Unternehmen und für die Arbeitnehmerinnen und Arbeitnehmer in Deutschland.",data/txt/18003.txt,speech,cducsu
