id,sitzung,wahlperiode,in_writing,speaker,speaker_cleaned,speaker_fp,sequence,text,filename,type,speaker_party
2198168,3,18,0,,,,480,"Wir werden in dieser Legislaturperiode, so alle Prognosen, diesen Beitrag weiter stabil bei 18,9 Prozent halten können.

Gleichzeitig werden wir zum Ende dieses Jahres in der gesetzlichen Rentenversicherung voraussichtlich eine Rücklage - sprich: ein Guthaben - von über 31 Milliarden Euro haben, die höchste Rücklage seit über zwanzig Jahren. Man kann überall, in jeder Debatte, ein Haar in der Suppe finden; aber ich meine, wir können eigentlich doch stolz darauf sein, dass wir in der Rentenversicherung einen relativ niedrigen Beitrag und gleichzeitig die höchsten Rücklagen seit über zwanzig Jahren haben.",data/txt/18003.txt,speech,
2198169,3,18,0,,,,481,Beifall bei der CDU/CSU sowie bei Abgeordneten der SPD,data/txt/18003.txt,poi,
2198170,3,18,0,Markus Kurth [BÜNDNIS 90/DIE GRÜNEN],Markus Kurth [BÜNDNIS 90/DIE GRÜNEN],markus-kurth-bundnis-90-die-grunen,482,Nicht mehr lange!,data/txt/18003.txt,poi,gruene
2198171,3,18,0,,,,483,"Das verdanken wir einer gut laufenden Wirtschaft, gut laufenden Unternehmen und einer wachsenden Zahl von Arbeitnehmerinnen und Arbeitnehmern, die mit einem guten Lohn auch gute Sozialversicherungsbeiträge bezahlen. Wenn es ein Ziel zu Beginn einer neuen Legislaturperiode gibt, das uns einen sollte, dann sollte es das sein, diese gute Entwicklung auf dem Arbeitsmarkt, in der Wirtschaft weiter zu beflügeln, damit unsere Rentenversicherung, der Kern des deutschen Sozialstaates, auch in Zukunft gut finanziert ist, nicht ins Minus läuft und trotzdem die Beiträge für die Arbeitnehmerinnen und Arbeitnehmer und die Unternehmen stabil bleiben. Das muss unser gemeinsames Ziel sein.",data/txt/18003.txt,speech,
2198172,3,18,0,,,,484,Beifall bei der CDU/CSU sowie bei Abgeordneten der SPD,data/txt/18003.txt,poi,
2198173,3,18,0,Matthias W. Birkwald [DIE LINKE],Matthias W. Birkwald [DIE LINKE],matthias-birkwald-die-linke,485,Im Datenreport von gestern steht das Gegenteil!,data/txt/18003.txt,poi,linke
2198174,3,18,0,,,,486,"Verehrte Kolleginnen und Kollegen, ich finde es richtig und auch notwendig, dass wir in einer solch guten Situation, in der wir uns befinden, die Handlungsmöglichkeiten nutzen, um allfällig notwendige Reformen im Rentenrecht durchzuführen. Dazu gehört, dass wir die Leistung derjenigen, die die Zukunft der Rentenversicherung gewährleisten, indem sie Kinder großziehen, in der Rente besser bewerten. Dafür war es höchste Zeit. Wir haben verabredet, das jetzt endlich zu machen.",data/txt/18003.txt,speech,
2198175,3,18,0,,,,487,Beifall bei der CDU/CSU sowie bei Abgeordneten der SPD,data/txt/18003.txt,poi,
2198176,3,18,0,Markus Kurth [BÜNDNIS 90/DIE GRÜNEN],Markus Kurth [BÜNDNIS 90/DIE GRÜNEN],markus-kurth-bundnis-90-die-grunen,488,"Machen Sie es mit Steuergeldern, nicht mit Beitragsgeldern!",data/txt/18003.txt,poi,gruene
2198177,3,18,0,,,,489,"Der zweite Punkt. Gerade Menschen, die wegen Krankheit oder einem Unfall vorzeitig aus dem Erwerbsleben ausscheiden müssen und die liebend gerne länger gearbeitet hätten, sind heute in der Gefahr, dass sie mit der Erwerbsminderungsrente, die sie erhalten, nicht auskommen können.",data/txt/18003.txt,speech,
2198178,3,18,0,Matthias W. Birkwald [DIE LINKE],Matthias W. Birkwald [DIE LINKE],matthias-birkwald-die-linke,490,Das stimmt!,data/txt/18003.txt,poi,linke
2198179,3,18,0,,,,491,"Bereits 10 Prozent der Rentner in Deutschland, die Erwerbsminderungsrente erhalten, müssen ergänzend Grundsicherung beziehen. Deswegen ist es richtig, dass wir die Handlungsmöglichkeiten nutzen, durch ein besseres Berechnungsverfahren dafür zu sorgen, dass auch jemand, der vorzeitig wegen Krankheit oder Unfall aus dem Erwerbsleben ausscheiden muss, eine Rente erhält, die ihn möglichst nicht dazu zwingt, um zusätzliche staatliche Stütze anstehen zu müssen.",data/txt/18003.txt,speech,
2198180,3,18,0,Matthias W. Birkwald [DIE LINKE],Matthias W. Birkwald [DIE LINKE],matthias-birkwald-die-linke,492,"Dann müssen Sie die Abschläge streichen, sonst kriegen Sie es nicht hin!",data/txt/18003.txt,poi,linke
2198181,3,18,0,,,,493,"Vizepräsidentin Edelgard Bulmahn:

Herr Kollege Weiß, gestatten Sie eine Zwischenfrage der Kollegin Andreae?

Peter Weiß (Emmendingen) (CDU/CSU):

Ja, bitte schön.

Kerstin Andreae (BÜNDNIS 90/DIE GRÜNEN):

Herr Kollege Weiß, Sie haben vorhin davon gesprochen, dass die Beitragssätze bei 18,9 Prozent stabil gehalten werden können und die Rentenkasse mit 31 Milliarden Euro voll ist. Sie sagten, es wäre jetzt an der Zeit, die Mütterrente einzuführen. Sie wissen, dass, wenn Sie die Mütterrente aus der Rentenkasse und damit aus den Beiträgen der Beitragszahler finanzieren, die 31 Milliarden Euro schmelzen werden; denn Sie werden jedes Jahr 6 bis 7 Milliarden Euro für die Mütterrente ausgeben müssen. Die Mütterrente ist definitiv eine versicherungsfremde Leistung. Sie hat mit den Beiträgen in die Rentenkasse nichts zu tun. Wenn Sie die Mütterrente wollen, dann müssen Sie sie - das ist zwingend logisch - über Steuermittel finanzieren.

Ich möchte Sie noch auf ein Zitat aus einer Rede von Ihnen von vor einem Jahr hinweisen:

Wenn ich die Rücklage aber verjubeln will,

- das haben Sie gesagt -

dann habe ich für die Rentenversicherung nichts gewonnen, sondern werde sie auf alle Zeit mit höheren Belastungen versehen und künftig immer höhere Beiträge der Beitragszahlerinnen und Beitragszahler erheben müssen.

Erklären Sie mir, warum Sie nicht in der Lage sind, zu sagen: Die Mütterrente muss zwingend logisch aus Steuermitteln finanziert werden und hat mit den Beitragszahlungen in die Rentenkasse nichts zu tun!",data/txt/18003.txt,speech,
2198182,3,18,0,,,,494,Beifall beim BÜNDNIS 90/DIE GRÜNEN sowie bei Abgeordneten der LINKEN,data/txt/18003.txt,poi,
2198183,3,18,0,,,,495,"Peter Weiß (Emmendingen) (CDU/CSU):

Frau Kollegin Andreae, Frau Bundesministerin von der Leyen hat in ihrer Rede bereits darauf hingewiesen, dass die gesetzliche Rentenversicherung schon heute in einem hohen Maß, nämlich zu einem Drittel ihrer Ausgaben, aus Steuermitteln finanziert ist.",data/txt/18003.txt,speech,
2198184,3,18,0,Bettina Hagedorn [SPD],Bettina Hagedorn [SPD],bettina-hagedorn-spd,496,So ist es!,data/txt/18003.txt,poi,spd
2198185,3,18,0,,,,497,"Das heißt, die Beiträge der Beitragszahlerinnen und Beitragszahler bestreiten nur zwei Drittel der jährlichen Ausgaben; ein Drittel kommt aus den Steuermitteln.",data/txt/18003.txt,speech,
2198186,3,18,0,Katrin Göring-Eckardt [BÜNDNIS 90/DIE GRÜNEN],Katrin Göring-Eckardt [BÜNDNIS 90/DIE GRÜNEN],katrin-goring-eckardt-bundnis-90-die-grunen,498,Dann ist es ja kein Problem!,data/txt/18003.txt,poi,gruene
2198187,3,18,0,Elke Ferner [SPD],Elke Ferner [SPD],elke-ferner-spd,499,"Das ist doch eine Milchbubenrechnung, die Sie hier machen!",data/txt/18003.txt,poi,spd
2198188,3,18,0,,,,500,"- Frau Ferner, dieser Betrag ist mehr als das, was wir für sogenannte versicherungsfremde Leistungen aus der Rentenversicherung ausgeben.

Ich komme zu einem zweiten Punkt und möchte das, was die Frau Ministerin bereits vorgetragen hat, wiederholen: Es ist verabredet, dass ein zusätzlicher Bundeszuschuss in Höhe von 2 Milliarden Euro hinzukommen soll, um den Beitrag des Bundes zur Stabilisierung des Rentenniveaus und zur Stabilisierung des Rentenbeitragssatzes auch in Zukunft zu gewährleisten.",data/txt/18003.txt,speech,
2198189,3,18,0,Kerstin Andreae [BÜNDNIS 90/DIE GRÜNEN],Kerstin Andreae [BÜNDNIS 90/DIE GRÜNEN],kerstin-andreae-bundnis-90-die-grunen,501,Wo kommen die her?,data/txt/18003.txt,poi,gruene
2198190,3,18,0,,,,502,"Ich finde: Zusammengerechnet ist es eine großartige Leistung, die wir aus dem Steueraufkommen erbringen. Das macht es uns möglich, die Leistungen so auszugestalten, wie wir es im Koalitionsvertrag miteinander verabredet haben.",data/txt/18003.txt,speech,
2198191,3,18,0,Kerstin Andreae [BÜNDNIS 90/DIE GRÜNEN],Kerstin Andreae [BÜNDNIS 90/DIE GRÜNEN],kerstin-andreae-bundnis-90-die-grunen,503,Das ist doch nicht ehrlich!,data/txt/18003.txt,poi,gruene
2198192,3,18,0,,,,504,"Weil wir hier über den Beitragssatz diskutieren und weil Sie, Frau Kollegin Andreae, sich als mittelstandspolitische Sprecherin der Grünen gern bei Unternehmen in unserem Lande aufhalten,",data/txt/18003.txt,speech,
2198193,3,18,0,Kerstin Andreae [BÜNDNIS 90/DIE GRÜNEN],Kerstin Andreae [BÜNDNIS 90/DIE GRÜNEN],kerstin-andreae-bundnis-90-die-grunen,505,Das sollten Sie auch mal machen!,data/txt/18003.txt,poi,gruene
2198194,3,18,0,,,,506,"möchte ich eines sagen: Für die Unternehmer in unserem Land ist eine Beitragssatzstabilität das Allerwichtigste, sodass sie wissen: Ich muss nicht mit Sprüngen nach unten oder nach oben rechnen, sondern kann stabil kalkulieren.",data/txt/18003.txt,speech,
2198195,3,18,0,,,,507,Beifall bei der CDU/CSU,data/txt/18003.txt,poi,
2198196,3,18,0,,,,508,"Würden wir den Beitragssatz jetzt senken, dann wäre klar, dass er in wenigen Jahren wieder deutlich nach oben gehen würde. Deswegen ist alles, was wir tun, einem Ziel verpflichtet: der Beitragssatzstabilität für die Unternehmen und für die Arbeitnehmerinnen und Arbeitnehmer in Deutschland.",data/txt/18003.txt,speech,
2198197,3,18,0,,,,509,Beifall bei der CDU/CSU,data/txt/18003.txt,poi,
2198198,3,18,0,Matthias W. Birkwald [DIE LINKE],Matthias W. Birkwald [DIE LINKE],matthias-birkwald-die-linke,510,Sie reden anders als in der vorigen Legislatur!,data/txt/18003.txt,poi,linke
2198199,3,18,0,,,,511,"Unsere Bundeskanzlerin hat gestern bei der Vorstellung des Koalitionsvertrages erklärt, dass es bei erfolgreicher Umsetzung dieses Koalitionsvertrages eine gute Chance gibt, dass es uns in vier Jahren, also 2017, besser gehen wird als heute. Diese Botschaft gilt uneingeschränkt auch für die Rentenpolitik. Ja, wir wollen für stabile Beiträge, eine ausreichende Finanzierung, Rücklagen in der Rentenversicherung und dort, wo es notwendig ist, für rentenpolitische Verbesserungen sorgen, damit es den Menschen 2017 besser geht als heute.

Vielen Dank.",data/txt/18003.txt,speech,
2198200,3,18,0,,,,512,Beifall bei der CDU/CSU sowie bei Abgeordneten der SPD,data/txt/18003.txt,poi,
2198201,3,18,0,,,,513,"Vizepräsidentin Edelgard Bulmahn:

Liebe Kolleginnen und Kollegen, damit schließe ich die Aussprache.

Interfraktionell wird die Überweisung des Gesetzentwurfs auf Drucksache 18/52 an den Hauptausschuss vorgeschlagen. Gibt es dazu anderweitige Vorschläge? - Das ist nicht der Fall. Dann ist die Überweisung so beschlossen.

Ich rufe den Tagesordnungspunkt 5 auf:

Beratung des Antrags der Abgeordneten Oliver Krischer, Bärbel Höhn, Annalena Baerbock, weiterer Abgeordneter und der Fraktion BÜNDNIS 90/DIE GRÜNEN

Klimakonferenz in Warschau - Ohne deutsche Vorreiterrolle kein internationaler Klimaschutz

- Drucksache 18/96 -

Nach einer interfraktionellen Vereinbarung sind für die Aussprache 38 Minuten vorgesehen. - Ich höre dazu keinen Widerspruch. Dann ist das so beschlossen.

Ich rufe die erste Rednerin in dieser Runde auf: Das ist Annalena Baerbock. Sie haben das Wort!

Annalena Baerbock (BÜNDNIS 90/DIE GRÜNEN):

Sehr geehrte Frau Präsidentin! Sehr geehrte Kolleginnen und Kollegen! 5 200 Tote und 3,5 Millionen vertriebene Philippinerinnen und Philippiner - die Mahnung an die Staaten der Welt vor der Weltklimakonferenz hätte nicht mächtiger ausfallen können. Doch trotz aller Solidaritätsbekundungen verdeutlichten die Staaten in Warschau, welch niedrigen Stellenwert sie dem Klimaschutz mittlerweile einräumen.

Die - ohnehin als technische COP angesetzte - Klimakonferenz war geprägt von einer Ambitionslosigkeit der Staaten, die ihresgleichen sucht. Japan und Australien kippten schon vorab ihre Klimaambitionen. Der Gastgeber Polen veranstaltete parallel zur Weltklimakonferenz einen Kohlegipfel, und Sie, Herr Altmaier, verdeutlichten mit Ihrer Stippvisite, welche Priorität der Klimawandel bei Ihnen hat. Sie haben lieber abends mit Maybrit Illner auf dem Sofa geplaudert, anstatt mit den Chinesen ernsthaft über CO2-Reduktionsziele zu diskutieren.",data/txt/18003.txt,speech,
2198202,3,18,0,,,,514,Beifall beim BÜNDNIS 90/DIE GRÜNEN,data/txt/18003.txt,poi,
2198203,3,18,0,,,,515,"In Ihrer Rede erwähnten Sie ganz kurz: Wir sind wieder da im Klimaschutz. Ich fragte mich angesichts dessen, dass Deutschland in Warschau beim Klimaindex gerade auf den beschämenden 19. Platz zurückgestuft wurde, was Sie mit da eigentlich meinten. Der Koalitionsvertrag gibt darauf jetzt eine Antwort. Mit da war nicht die Vorreiterschaft im internationalen Klimaschutz gemeint, mit da war gemeint: Wir sind wieder da im Kohlezeitalter in Deutschland.",data/txt/18003.txt,speech,
2198204,3,18,0,,,,516,Beifall beim BÜNDNIS 90/DIE GRÜNEN,data/txt/18003.txt,poi,
2198205,3,18,0,,,,517,"Von dem so wichtigen Klimaschutzgesetz, das Sie, liebe Kolleginnen und Kollegen von der SPD, in mehreren Bundesländern gemeinsam mit den Grünen mittragen, findet sich keine Spur mehr im Koalitionsvertrag. Stattdessen heißt es in Ihrem Vertrag, die Braunkohle, also der Klimakiller Nummer eins, spiele nach wie vor eine bedeutende Rolle und konventionelle Kraftwerke seien auf absehbare Zeit unverzichtbar. Mit Blick auf den Fahrplan für ein neues Klimaabkommen in Paris 2015, für den sich die EU in Warschau zu Recht sehr starkgemacht hat, kann man angesichts dieser Vorhaben nur hoffen, dass Ihr Koalitionsvertrag nicht so schnell ins Englische übersetzt wird. Denn erklären Sie mir bitte einmal, wie Sie die Entwicklungsländer dazu bewegen wollen, in den nächsten Monaten ambitionierte Reduktionsziele auf den Tisch zu legen, wenn Deutschland selber weiter Klimakiller - wie bei mir in Brandenburg das Kraftwerk Jänschwalde, das mehr CO2 ausstößt als 26 afrikanische Staaten zusammen - langfristig am Netz halten will, sehr verehrte Damen und Herren von der SPD und der CDU/CSU.",data/txt/18003.txt,speech,
2198206,3,18,0,,,,518,Beifall beim BÜNDNIS 90/DIE GRÜNEN und bei der LINKEN,data/txt/18003.txt,poi,
2198207,3,18,0,,,,519,"Ihr Koalitionsvertrag mag Schritte in die richtige Richtung enthalten. Man muss aber ganz klar sagen: Für die Energiewende und die internationale Klimapolitik ist er ein Desaster. Während in Warschau eines der wirklich positiven Signale war, dass vor Ort die erneuerbaren Energien weiter ausgebaut werden, dass mittlerweile 70 Prozent der weltweiten Investitionen der Energieindustrie in Erneuerbare gehen, deckeln Sie den Ausbau der erneuerbaren Energien in Deutschland. Die Beschränkung des Ökostromanteils auf 45 Prozent bis 2025 und bis 60 Prozent bis 2030 halbiert das heutige Ausbautempo. Ich frage Sie sehr direkt, liebe Kolleginnen und Kollegen von SPD und CDU/CSU: Ist Ihnen eigentlich klar, dass Ihre Pläne zur Windhöffigkeit bedeuten, dass in Zukunft südlich von Hannover so gut wie kein neues Windrad mehr gebaut werden kann? Ich frage auch Sie, lieber Herr Altmaier, wie Sie mit solchen Plänen, die den Erneuerbaren die Flügel stutzen und dem Klimaschutz Made in Germany eine Absage erteilen, in den nächsten Monaten international ernsthaft für ambitionierte Ziele werben wollen.

Eine für ein neues Klimaschutzabkommen so wichtige Vorreiterschaft hieße, über 80 Prozent der Bevölkerung in unserem Land, die für die Energiewende stehen, und Millionen von Menschen, die die Energiewende mit eigenen Solaranlagen auf ihren Dächern tagtäglich vorantreiben, nicht weiter vor den Kopf zu stoßen. Vorreiter sein hieße, die Warnungen der direkt vom Klimawandel betroffenen Entwicklungsländer ernst zu nehmen und den jüngst veröffentlichten Sachstandsbericht des IPCC mit Maßnahmen zu untermauern. Vorreiter sein hieße, Mindestwirkungsgrade für fossile Kraftwerke festzusetzen und den Aufschluss neuer Tagebaue durch eine Novelle zum Bergrecht auszuschließen. Vorreiter sein hieße, sich auf europäischer Ebene bis zum Frühjahrsgipfel der EU für ernsthafte und ambitionierte CO2-Reduktionsziele von mindestens 55 Prozent bis 2030 einzusetzen.",data/txt/18003.txt,speech,
2198208,3,18,0,,,,520,Beifall beim BÜNDNIS 90/DIE GRÜNEN,data/txt/18003.txt,poi,
2198209,3,18,0,,,,521,"Vorreiter sein hieße auch, meine sehr verehrten Damen und Herren, den Emissionshandel wieder zu einem scharfen Schwert des Klimaschutzes zu machen, indem wir eine Preisuntergrenze für CO2-Zertifikate einführen und für eine dauerhafte Marktverknappung sorgen.

Vizepräsidentin Edelgard Bulmahn:

Liebe Kollegin Baerbock, es gibt den Wunsch einer Zwischenfrage aus den Reihen der CDU/CSU. Lassen Sie sie zu?

Annalena Baerbock (BÜNDNIS 90/DIE GRÜNEN):

Ja, fragen Sie ruhig.

Vizepräsidentin Edelgard Bulmahn:

Die Kollegin Baerbock lässt die Frage zu.",data/txt/18003.txt,speech,
2198210,3,18,0,,,,522,Beifall beim BÜNDNIS 90/DIE GRÜNEN,data/txt/18003.txt,poi,
2198211,3,18,0,,,,523,"Bitte, Herr Kollege.

Dr. Philipp Lengsfeld (CDU/CSU):

Frau Präsidentin! - Liebe Kollegin Baerbock, vielen Dank, dass ich eine Zwischenfrage stellen darf. Ich hätte sie auch am Ende der Rede stellen können. Da es aber meine erste Zwischenfrage ist, stelle ich sie jetzt direkt.

Annalena Baerbock (BÜNDNIS 90/DIE GRÜNEN):

Dies ist auch meine erste Rede; das trifft sich gut.",data/txt/18003.txt,speech,
2198212,3,18,0,,,,524,Heiterkeit,data/txt/18003.txt,poi,
2198213,3,18,0,,,,525,Beifall beim BÜNDNIS 90/DIE GRÜNEN,data/txt/18003.txt,poi,
2198214,3,18,0,,,,526,"Dr. Philipp Lengsfeld (CDU/CSU):

Sie haben in Ihrer sehr emotionalen Rede auf die schreckliche Katastrophe auf den Philippinen abgehoben. Ihnen ist aber schon klar - das meine ich jetzt ohne Zynismus -, dass der Taifun und seine schrecklichen Auswirkungen auf den Philippinen, wenn überhaupt, nur sehr peripher etwas mit dem Klimawandel zu tun haben.",data/txt/18003.txt,speech,
2198215,3,18,0,,,,527,Lachen beim BÜNDNIS 90/DIE GRÜNEN,data/txt/18003.txt,poi,
2198216,3,18,0,,,,528,"Ich beziehe mich dabei auf einen Fachartikel, der vor einiger Zeit im Tagesspiegel erschienen ist und in dem sehr deutlich ausgeführt wurde, dass die jahrzehntelange Entwaldung kombiniert mit dem massiven Bevölkerungsanstieg mit sehr hoher Wahrscheinlichkeit die Hauptursache für die schreckliche Dimension dieser Katastrophe auf den Philippinen ist. Ich finde - das wäre meine Frage -, wir sollten in dieser Diskussion zu einer etwas sachlicheren Betrachtung solcher Ereignisse kommen; denn es kann nicht sein, dass jeder Taifun - Taifune wird es auch in der Zukunft immer wieder geben; das ist ein Stück weit eine Zwangsläufigkeit - die Debatte befördert und damit Diskussionen, die wir auf einer sachlichen und wirtschaftlich relevanten Basis führen müssen, ein Stück weit übertüncht werden.

Vielen Dank.

Annalena Baerbock (BÜNDNIS 90/DIE GRÜNEN):

Vielen Dank für Ihre Frage. - Ich hätte nicht gedacht, dass Sie den Koalitionsvertrag noch übertreffen können. Darin wird ja anerkannt, dass der Klimawandel vom Menschen gemacht ist. Das erkennt ja nicht nur die Bundesregierung, sondern, wie ich glaube, so gut wie jeder in diesem Land an. Wenn Sie das nicht anerkennen, dann gehören Sie zu einer deutlichen Minderheit.",data/txt/18003.txt,speech,
2198217,3,18,0,,,,529,Beifall beim BÜNDNIS 90/DIE GRÜNEN und bei der LINKEN,data/txt/18003.txt,poi,
2198218,3,18,0,,,,530,"Natürlich kann man nie sagen, ob ein einzelner Taifun vom Klimawandel verursacht ist. Aber die Erderwärmung und vor allen Dingen die Erwärmung der Meere führen dazu - lesen Sie das einmal genau nach -, dass sich die Wirbelstürme weltweit, nicht nur auf den Philippinen, sondern auch bei uns, verschärft haben. Ich glaube, es gibt doch fachliche Studien, die das untermauern.

Sie haben die Entwaldung angesprochen, die ich zum Ende meiner Rede ohnehin erwähnt hätte. Wir sind ja in Warschau zum Glück dazu gekommen, dass das Wiederaufforstungsprogramm REDD+ auf den Weg gebracht wurde, dass Mittel bereitgestellt werden und dass wir uns weltweit für eine Eindämmung der Abholzung von Tropenwäldern einsetzen. Ein schöner Nebeneffekt war - dafür sind solche internationalen Konferenzen ja auch immer gut -, dass indigene Völker jetzt erstmalig international anerkannt werden, womit ihr Schutz einhergeht. In diesem Sinne war, glaube ich, der Taifun eine sehr gute Mahnung, sowohl in Richtung Klimawandel als auch bezogen auf die Entwaldung, die global gerade stattfindet.",data/txt/18003.txt,speech,
2198219,3,18,0,,,,531,Beifall beim BÜNDNIS 90/DIE GRÜNEN sowie bei Abgeordneten der SPD und der LINKEN,data/txt/18003.txt,poi,
2198220,3,18,0,,,,532,"Zum Schluss ist mir eines wahnsinnig wichtig: Ich glaube, alle, die gesehen haben, dass die Preise im Emissionshandel durch das Backloading eben nicht nach oben gegangen sind, dass wir immer noch bei 5 Euro pro Tonne CO2 kreisen, obwohl wir eigentlich Preise von 25 bis 30 Euro pro Tonne bräuchten, haben verstanden, dass wir dringend etwas tun müssen. Einige der Forderungen, gerade auch von anderen internationalen Delegationen, lauteten ja, dass die EU hier endlich handeln muss. Daher fordern wir Sie in unserem Antrag dazu auf, sich in Vorbereitung des Frühjahrsgipfels auf EU-Ebene dafür einzusetzen, dass wir den Emissionshandel wieder zu dem machen, was er eigentlich sein sollte: ein scharfes Schwert im Klimaschutz, das zu einer dauerhaften Marktverknappung beim Emissionshandel führt.",data/txt/18003.txt,speech,
2198221,3,18,0,,,,533,Beifall beim BÜNDNIS 90/DIE GRÜNEN,data/txt/18003.txt,poi,
2198222,3,18,0,,,,534,"Vizepräsidentin Edelgard Bulmahn:

Frau Kollegin, Sie müssen zum Schluss kommen.

Annalena Baerbock (BÜNDNIS 90/DIE GRÜNEN):

In diesem Sinne möchte ich bei Ihnen, liebe Parlamentarierinnen und Parlamentarier, dafür werben, dass wir heute trotz dieses Koalitionsvertrages als Parlament deutlich machen, dass Deutschland den Klimaschutz in Zukunft nicht ersatzlos streichen will, sondern dass wir mit ambitionierten Schritten auf dem Weg nach Paris voranschreiten. Dafür brauchen wir ambitionierte Maßnahmen vonseiten Deutschlands und von der EU. Stimmen Sie bitte deshalb unserem Antrag zu!

Herzlichen Dank.",data/txt/18003.txt,speech,
2198223,3,18,0,,,,535,Beifall beim BÜNDNIS 90/DIE GRÜNEN und bei der LINKEN,data/txt/18003.txt,poi,
2198224,3,18,0,,,,536,"Vizepräsidentin Edelgard Bulmahn:

Dies war die erste Rede der Kollegin Baerbock, gleich mit einer Zwischenfrage. Herzlichen Glückwunsch!",data/txt/18003.txt,speech,
2198225,3,18,0,,,,537,Beifall,data/txt/18003.txt,poi,
2198226,3,18,0,,,,538,"Jetzt spricht der Bundesminister Altmaier.

Peter Altmaier, Bundesminister für Umwelt, Naturschutz und Reaktorsicherheit:

Frau Präsidentin! Meine sehr verehrten Damen und Herren! Frau Kollegin Baerbock, auch ich gratuliere Ihnen herzlich zu Ihrer Jungfernrede und wünsche Ihnen eine gute und interessante Arbeit im Deutschen Bundestag.",data/txt/18003.txt,speech,
2198227,3,18,0,,,,539,Beifall bei Abgeordneten der CDU/CSU,data/txt/18003.txt,poi,
