id,sitzung,wahlperiode,in_writing,speaker,speaker_cleaned,speaker_fp,sequence,text,filename,type,speaker_party
2772233,3,18,0,Dennoch lassen sich nach meinem Dafürhalten erste Schlussfolgerungen für die zukünftige Außenpolitik ziehen,Dennoch lassen sich nach meinem Dafürhalten erste Schlussfolgerungen für die zukünftige Außenpolitik ziehen,dennoch-lassen-sich-nach-meinem-dafurhalten-erste-schlussfolgerungen-fur-die-zukunftige-außenpolitik-ziehen,1004,"Wenn man vom zweiten Erfahrungsschatz spricht, geht es darum, aus den Erfahrungen der Entspannungspolitik zu lernen. Wir brauchen heute, in Zeiten neuer Spannungen, eine Entspannungspolitik - darüber haben wir, glaube ich, keine unterschiedlichen Auffassungen -, indem wir Realitäten zwar anerkennen, uns aber nicht mit ihnen abfinden. Das ist sozusagen der Kern von Wandel durch Annäherung. Ich glaube, dass dieser Erfahrungsschatz durchaus Wirkung entfaltet, insbesondere dann, wenn Europa darum gebeten wird, an der Bearbeitung internationaler Krisen mitzuarbeiten.

Der andere Aspekt in dieser Frage ist nach meinem Dafürhalten, dass die Umbrüche in der arabischen Welt durchaus Instabilitäten aufzeigen, wahrscheinlich auch für die nächsten Jahrzehnte, auch auf Europa bezogen. Aber die dortigen Machthaber wissen auch - ich glaube, einige sind klug genug -: Sie brauchen Wandel, Wandel im Äußeren und Wandel im Inneren. Das sollten wir nicht nur zur Kenntnis nehmen, sondern auch unterstützen.

Zur zweiten Anmerkung, die ich machen will. In der Europäischen Union können wir gemeinsam zum Nutzen vieler etwas erreichen. Ich finde, auch das wird durch das Zwischenübereinkommen mit dem Iran deutlich. Die Europäische Union hat mit ihrer vielgescholtenen Gemeinsamen Außen- und Sicherheitspolitik bewiesen, dass Europa durchaus in der Lage ist, Instrumente aus dem historischen Erfahrungsschatz anzubieten und sie zum Nutzen aller einzusetzen. Es waren Deutschland, Großbritannien und Frankreich, die 2003 diese Initiative gestartet haben. Ich danke allen Bundesregierungen und den Diplomatinnen und Diplomaten, dass sie so nachhaltig und so beharrlich an der Erreichung dieses Zieles gearbeitet haben. Ich danke natürlich auch der amtierenden Bundesregierung und Ihnen, Herr Bundesaußenminister.

Darüber hinaus sollen hier aber auch Lady Ashton und der im Aufbau befindliche Europäische Auswärtige Dienst genannt werden; denn deren aktuelles Handeln ist ein Bravourstück auf dem Weg zu einer Herausbildung einer zukünftigen europäischen Gemeinsamen Außen- und Sicherheitspolitik. Ich bin froh, dass hierüber im Parlament sozusagen Gemeinsamkeit besteht; schließlich haben wir in den vergangenen Jahren durchaus den einen oder anderen Außenminister in Europa erlebt, der nicht immer Gutes über Lady Ashton gesagt hat.

Im Rahmen meiner zweiten Anmerkung will ich auch den Deutschen Bundestag erwähnen. Ich glaube, jetzt kommt es auch auf uns an, darauf, dass wir unsere Arbeit machen. Wenn ich es richtig beobachte, dann könnten die Parlamente im Iran und offensichtlich auch in den USA - der Kongress auf der einen, die Madschlis auf der anderen Seite - einer erfolgreichen Umsetzung des Abkommens möglicherweise den einen oder anderen Stein in den Weg legen. Ich finde, wir Parlamentarierinnen und Parlamentarier können eine Menge zur Vertrauensbildung beitragen. Deswegen wäre ich froh, wenn vonseiten des deutschen Parlamentes Initiativen ausgingen, auch die Parlamentarierinnen und Parlamentarier im Iran von diesem wichtigen Abkommen zu überzeugen.

Ein weiterer Punkt. Es wird möglicherweise dazu kommen, dass die Internationale Atomenergie-Organisation, die ja im Zusammenhang mit der Überprüfung des Iran wertvolle, aber zusätzliche Arbeit leisten müssen wird, mehr Finanzmittel braucht. Auch das muss vonseiten des Deutschen Bundestages positiv beantwortet werden.

Zum dritten Punkt, den ich gerne ansprechen möchte. Wir haben gesehen, dass die USA und Russland weiterhin unerlässliche Partner für die Bewältigung internationaler Konflikte sind. Ich finde, das eröffnet neue Chancen für die Genfer Konferenz über Syrien und im Zusammenhang mit dem israelisch-palästinensischen Konflikt.

Deswegen sollten, wenn es denn gelingt, zwischen den USA und Russland zumindest bei internationalen Krisen neues Vertrauen aufzubauen, gerade vonseiten der Europäischen Union, aber auch vonseiten seiner Mitgliedsländer weitere Initiativen für eine gute Zusammenarbeit mit Russland ausgehen. Es sollten aber auch durchaus offene Worte über das, was uns hinsichtlich der Außenpolitik der Russischen Föderation nicht passt, gesagt werden. Europa ist aufgerufen, dieses Momentum einer Zusammenarbeit zwischen Russland und den USA bei weiteren internationalen Krisen zu befördern.

Europa sollte in diesem Zusammenhang aber auch die Volksrepublik China an ihre wachsende Verantwortung erinnern. Sie ist Teil der Sechsergruppe gewesen; sie profitiert immer noch sehr stark von den Erfolgen, wobei sie sich sozusagen in der zweiten oder dritten Reihe aufhält. Die Volksrepublik China wird in Zukunft mehr Verantwortung tragen müssen. Ich glaube, Europa muss das verlangen.

Der vierte Aspekt. Die Zwischenvereinbarung könnte ein Bindeglied für weitere Initiativen im Nahen und Mittleren Osten sein. Es ist sinnvoll, auch vor dem Hintergrund des europäischen Erfahrungsschatzes, an den Aufbau regionaler Sicherheitssysteme zu erinnern, um Spannungen abzubauen und Vertrauen zu schaffen, sowie Abrüstung und Rüstungskontrolle als Instrument für diese Vertrauensbildung zu beschreiben. Insbesondere dürfen auch von Deutschland aus keine Rüstungsexporte in Spannungsgebiete erfolgen.",data/txt/18003.txt,speech,
2772234,3,18,0,,,,1005,Beifall bei der SPD sowie bei Abgeordneten der LINKEN und des BÜNDNISSES 90/DIE GRÜNEN,data/txt/18003.txt,poi,
2772235,3,18,0,Agnieszka Brugger [BÜNDNIS 90/DIE GRÜNEN],Agnieszka Brugger,agnieszka-brugger,1006,Können wir Sie beim Wort nehmen?,data/txt/18003.txt,poi,gruene
2772236,3,18,0,Dennoch lassen sich nach meinem Dafürhalten erste Schlussfolgerungen für die zukünftige Außenpolitik ziehen,Dennoch lassen sich nach meinem Dafürhalten erste Schlussfolgerungen für die zukünftige Außenpolitik ziehen,dennoch-lassen-sich-nach-meinem-dafurhalten-erste-schlussfolgerungen-fur-die-zukunftige-außenpolitik-ziehen,1007,"Es gibt einen weiteren Aspekt - er ist eben angesprochen worden; das ist mein fünfter Punkt -: Trotz aller Enttäuschung, dass es kein konkretes Datum im Hinblick auf die Schaffung einer massenvernichtungswaffenfreien Zone im Nahen und Mittleren Osten gibt, müssen wir weiter daran arbeiten. In der Fragestunde haben wir gehört, dass die Bundesregierung hier weiterhin alles Notwendige unternehmen wird.

Eines will ich deutlich machen: Wir können nicht immer nur sagen: Wir können etwas einbringen, sondern müssen auch zur Kenntnis nehmen, wenn es positive Signale in dieser Region gibt. Ich finde, der Appell vonseiten des Iran und der Türkei an die syrischen Gewaltakteure, eine Waffenruhe zur Genfer Konferenz zu vereinbaren, ist nicht nur wichtig, sondern unerlässlich, auch wenn es ein nur kleiner Erfolg ist. Europa sollte das würdigen. Deswegen bin ich der Meinung: Der Iran gehört mit an den Verhandlungstisch in Genf, wenn es um die Frage der Beendigung des Bürgerkrieges in Syrien geht.",data/txt/18003.txt,speech,
2772237,3,18,0,,,,1008,Beifall bei Abgeordneten der LINKEN und des BÜNDNISSES 90/DIE GRÜNEN,data/txt/18003.txt,poi,
2772238,3,18,0,Dennoch lassen sich nach meinem Dafürhalten erste Schlussfolgerungen für die zukünftige Außenpolitik ziehen,Dennoch lassen sich nach meinem Dafürhalten erste Schlussfolgerungen für die zukünftige Außenpolitik ziehen,dennoch-lassen-sich-nach-meinem-dafurhalten-erste-schlussfolgerungen-fur-die-zukunftige-außenpolitik-ziehen,1009,"Eine Verhaltensänderung des Iran ist mit Sicherheit Teil äußeren, aber auch inneren Wandels. Deswegen will ich auch hier noch einmal deutlich sagen: Wir vom Deutschen Bundestag kritisieren und werden immer wieder darauf hinweisen, dass es Menschenrechtsverletzungen im Iran gibt. Es ist an der iranischen Regierung, die jetzige Chance, wo der außenpolitische Druck möglicherweise geringer wird, zu nutzen, um im Inneren zu einem Wandel beizutragen. Auch das war immer der Ansatzpunkt einer Entspannungspolitik. Ich finde, das gehört mit dazu.

Möglicherweise, auch wenn das auf den ersten Blick nicht so erscheint, könnte die Situation der Instabilität im Nahen und Mittleren Osten zu einem Umdenken im iranischen politischen System beigetragen haben. Es könnte dazu geführt haben, dass geglaubt wird, dass ein Regimesturz nicht mehr auf der Tagesordnung steht. Es ist glaubhaft, was Präsident Obama gesagt hat; denn Präsident Obama ist eben nicht an weiteren Instabilitäten interessiert.

Wir sollten dieses kleine Fenster des Umdenkens durchaus nutzen, um Initiativen voranzubringen. Deswegen - das ist der sechste Punkt - glaube ich, dass wir in Europa gehalten sind, mit gutem Vorbild voranzugehen. Wir müssen für Rüstungskontrolle und Abrüstung, für konventionelle Abrüstung, nukleare Abrüstung und viele andere Dinge mehr eintreten. Wir müssen insbesondere die Vertrauensbildung und die Maxime, die Präsident Obama eingeführt hat, nämlich dass Respekt in den internationalen Beziehungen wichtig ist, voranbringen.

Zum Abschluss, meine lieben Kolleginnen und Kollegen, möchte ich mich gerne bei Ihnen persönlich, Herr Bundesaußenminister, für die faire und gute Zusammenarbeit im Auswärtigen Ausschuss bedanken. Alles Gute!",data/txt/18003.txt,speech,
2772239,3,18,0,,,,1010,Beifall im ganzen Hause,data/txt/18003.txt,poi,
2772240,3,18,0,Dennoch lassen sich nach meinem Dafürhalten erste Schlussfolgerungen für die zukünftige Außenpolitik ziehen,Dennoch lassen sich nach meinem Dafürhalten erste Schlussfolgerungen für die zukünftige Außenpolitik ziehen,dennoch-lassen-sich-nach-meinem-dafurhalten-erste-schlussfolgerungen-fur-die-zukunftige-außenpolitik-ziehen,1011,,data/txt/18003.txt,speech,
2772241,3,18,0,Vizepräsident Peter Hintze,Peter Hintze,peter-hintze,1012,"Ich erteile als Nächstem das Wort dem Kollegen Jan van Aken, Fraktion Die Linke.",data/txt/18003.txt,chair,
2772242,3,18,0,,,,1013,Beifall bei der LINKEN,data/txt/18003.txt,poi,
2772243,3,18,0,Vizepräsident Peter Hintze,Peter Hintze,peter-hintze,1014,,data/txt/18003.txt,chair,
2772244,3,18,0,Jan van Aken (DIE LINKE),Jan van Aken,jan-van-aken,1015,"Herr Präsident! Meine Damen und Herren! Herr Westerwelle, das fand ich gut. Ich kann Ihnen eigentlich in fast allen Punkten zustimmen.",data/txt/18003.txt,speech,linke
2772245,3,18,0,,,,1016,Heiterkeit,data/txt/18003.txt,poi,
2772246,3,18,0,"Dr. Guido Westerwelle, Bundesminister",Dr. Guido Westerwelle,guido-westerwelle,1017,"Das ist sogar auf den letzten Metern zu viel, Herr Kollege!",data/txt/18003.txt,poi,
2772247,3,18,0,Jan van Aken (DIE LINKE),Jan van Aken,jan-van-aken,1018,"- In einem Punkt stimme ich nicht mit Ihnen überein; aber ansonsten kann ich wirklich fast alles teilen, was Sie gesagt haben. Denn ich kann mich von Herzen richtig über diese Einigung mit dem Iran freuen. Machen wir uns nichts vor: Das heißt doch, dass erstens die Kriegsgefahr im Mittleren Osten tatsächlich ein kleines bisschen geringer und dass zweitens die Gefahr eines nuklear bewaffneten Iran tatsächlich deutlich geringer geworden ist. Das sind zwei gute Nachrichten.",data/txt/18003.txt,speech,linke
2772248,3,18,0,,,,1019,Beifall bei der LINKEN sowie bei Abgeordneten der SPD und des BÜNDNISSES 90/DIE GRÜNEN,data/txt/18003.txt,poi,
2772249,3,18,0,Jan van Aken (DIE LINKE),Jan van Aken,jan-van-aken,1020,"Das ist auch ein Erfolg der Diplomatie. Ich fand es sehr gut, dass Sie das ausdrücklich betont haben. Es ist auch ein Erfolg der europäischen Diplomatie, der Diplomatie von Frau Ashton; das müssen wir hier ganz deutlich sagen. Danke auch an Herrn Mützenich dafür, dass er das gesagt hat. Wir müssen Frau Ashton von hier aus ein großes Lob aussprechen.",data/txt/18003.txt,speech,linke
2772250,3,18,0,,,,1021,"Beifall bei Abgeordneten der LINKEN, der SPD und des BÜNDNISSES 90/DIE GRÜNEN",data/txt/18003.txt,poi,
2772251,3,18,0,Jan van Aken (DIE LINKE),Jan van Aken,jan-van-aken,1022,"Eines möchte ich vorwegsagen - vielleicht gibt es da einen Dissens -: Ich halte es für völlig absurd, jetzt so zu tun, als ob es die harten Sanktionen waren, die den Iran an den Verhandlungstisch bewegt haben. Ich halte das für völlig absurd. Das können Sie gleich vergessen. Denn auch vor einem Jahr waren die Sanktionen gegen den Iran hammerhart. Auch vor einem Jahr war die Wirtschaftslage in Teheran völlig desolat, und trotzdem hat es vor einem Jahr keine Einigung gegeben.

Es ist völlig klar: Mit noch so harten Sanktionen erzeugen Sie bei dieser Frage, die für den Iran eine Frage der nationalen Souveränität ist, überhaupt keinen Druck, um irgendeine Lösung herbeizuführen. Diese Lösung ist erst durch zwei Wahlen möglich geworden. Die eine war die Wiederwahl von Obama in den USA, der in der zweiten Amtszeit eine ganz andere Flexibilität hat. Die zweite war die Wahl des neuen iranischen Präsidenten Rohani, der zeitgleich mit Obama zum ersten Mal seit Jahren offensichtlich kompromiss- und verhandlungsbereiter ist, als es in den Jahren zuvor der Fall war.",data/txt/18003.txt,speech,linke
2772252,3,18,0,,,,1023,Beifall bei Abgeordneten der LINKEN,data/txt/18003.txt,poi,
2772253,3,18,0,Jan van Aken (DIE LINKE),Jan van Aken,jan-van-aken,1024,"Wenn alle Hardliner gewesen wären und weiter nach harten Sanktionen gerufen hätten, dann hätte es diese Einigung nicht gegeben. Dies ist eine ganz klare Ansage an Herrn Mißfelder von der CDU, der immer wieder einem militärischen Angriff auf Iran das Wort geredet hat. Wenn Herr Mißfelder in Genf mit am Verhandlungstisch gesessen hätte, dann hätte es diese Einigung nicht gegeben. Ich bin froh, dass er nicht dabei war. Ich hoffe, er wird auch in Zukunft nicht dabei sein.",data/txt/18003.txt,speech,linke
2772254,3,18,0,,,,1025,Beifall bei der LINKEN,data/txt/18003.txt,poi,
2772255,3,18,0,Jan van Aken (DIE LINKE),Jan van Aken,jan-van-aken,1026,"Diese Einigung im Atomstreit zeigt eines ganz deutlich: Zwang funktioniert in der Außenpolitik nur ganz, ganz selten. Beim zivilen iranischen Atomprogramm funktioniert es noch viel weniger. Denn es ist innerhalb des Iran die zentrale Frage der nationalen Souveränität. Ein noch so moderater Präsident im Iran könnte niemals an diese Frage herangehen, könnte nicht auf Druck von außen reagieren. Das funktioniert nicht, zumal - auch das hat Herr Westerwelle richtigerweise gesagt - der Iran nach dem Atomwaffensperrvertrag ein Recht auf ein ziviles Atomprogramm hat. Er hat sogar das Recht auf Urananreicherung. Ich persönlich finde das falsch. Von mir aus könnten wir schon heute einen weltweiten Atomausstieg beschließen. Aber das ist eine völlig andere Debatte.",data/txt/18003.txt,speech,linke
2772256,3,18,0,,,,1027,Beifall bei der LINKEN sowie bei Abgeordneten des BÜNDNISSES 90/DIE GRÜNEN,data/txt/18003.txt,poi,
2772257,3,18,0,Jan van Aken (DIE LINKE),Jan van Aken,jan-van-aken,1028,"Die Einigung in Genf ist gut, weil sie ausgeglichen ist, weil beide Seiten zwar kleine, aber doch gleich lange Schritte aufeinander zugegangen sind.",data/txt/18003.txt,speech,linke
2772258,3,18,0,,,,1029,Beifall des Abg. Wolfgang Gehrcke [DIE LINKE],data/txt/18003.txt,poi,
2772259,3,18,0,Jan van Aken (DIE LINKE),Jan van Aken,jan-van-aken,1030,"Auf der einen Seite darf die Urananreicherung im Iran weitergehen, aber nur eingeschränkt und nicht mehr mit einem Anreicherungsgrad von 20 Prozent. Zudem gibt es einen Baustopp an den wichtigsten Anlagen, nicht nur am Schwerwasserreaktor, sondern auch an den Urananreicherungsanlagen. Auf der anderen Seite werden die Sanktionen etwas gelockert. Das ist für mich ein tragfähiges Fundament für künftige Schritte.

Aus meiner Sicht gibt es jetzt vier Dinge, die wir tun sollten - das richtet sich natürlich mehr an Herrn Steinmeier als an Herrn Westerwelle; es ist in die Zukunft gedacht -:

Erstens. Das ist ganz wichtig: Ruhe bewahren. Machen wir uns nichts vor: Es gibt genug Kräfte, die diese Einigung nicht wollen. Es sind die Hardliner in Teheran, die jede Art der Verhandlung mit dem Erzfeind USA ablehnen. Es sind die Hardliner in Washington, die natürlich jede Art der Einigung mit dem Erzfeind Iran ablehnen. Und dann gibt es die unheilige Allianz zwischen Israel und den Golfstaaten, die das Abkommen am liebsten torpedieren würden. Wir werden Provokationen erleben. Ich kann den 5+1-Staaten immer wieder nur sagen: Ruhe bewahren, sich nicht provozieren lassen und den Geist von Genf aufrechterhalten. Das wird in den nächsten sechs Monaten das Wichtigste sein.

Zweitens. Sie sollten unbedingt und sofort in den Ländern der Region für die Einigung werben. Ganz vorn ist hier natürlich Israel. Werben Sie in Israel dafür, dass diese Einigung mehr Sicherheit für Israel bedeutet und nicht weniger. Auch das ist eine Aufgabe für einen künftigen deutschen Außenminister.",data/txt/18003.txt,speech,linke
2772260,3,18,0,,,,1031,Beifall bei der LINKEN,data/txt/18003.txt,poi,
2772261,3,18,0,Jan van Aken (DIE LINKE),Jan van Aken,jan-van-aken,1032,"Drittens. Die versprochenen und beschlossenen Sanktionserleichterungen müssen so schnell wie möglich und so großzügig wie möglich umgesetzt werden. Ich habe es hier schon mehrfach gesagt: Es kostet nicht viel, auch einmal zwei, drei Schritte in Vorleistung zu gehen. Es geht dabei doch um Folgendes - das ist übrigens der Dissens, den wir haben, Herr Westerwelle -: Es geht darum, Vertrauen auf beiden Seiten wiederherzustellen. Es geht nicht nur darum, dass der Westen Vertrauen in den Iran haben muss. Auch umgekehrt gibt es dort ein berechtigtes Misstrauen. Vertrauen muss auf beiden Seiten hergestellt werden. Dabei würde es helfen - ich komme damit zum Schluss -, in den nächsten Wochen und Monaten die Sanktionserleichterungen sehr großzügig durchzusetzen.

Viertens und letztens. Wir sollten jetzt diese Chance nutzen, den Iran auch auf anderen Feldern einzubinden. Herr Mützenich hat es bereits gesagt: Dabei geht es zum Beispiel um Syrien. Aber auch der EU-Menschenrechtsdialog mit dem Iran könnte wieder aufgenommen werden. Dann könnten wir verhindern, dass die dramatische Menschenrechtslage im Iran zugunsten des Atomstreits vernachlässigt wird.",data/txt/18003.txt,speech,linke
2772262,3,18,0,,,,1033,Beifall bei der LINKEN,data/txt/18003.txt,poi,
2772263,3,18,0,Jan van Aken (DIE LINKE),Jan van Aken,jan-van-aken,1034,"Im Übrigen bin ich der Meinung, dass Deutschland keine Waffen mehr exportieren sollte. Das gilt natürlich auch für den Iran, das gilt aber für alle Länder in dieser Region, auch für Israel und die Golfstaaten.

Danke schön.",data/txt/18003.txt,speech,linke
2772264,3,18,0,,,,1035,Beifall bei der LINKEN sowie des Abg. Peter Meiwald [BÜNDNIS 90/DIE GRÜNEN],data/txt/18003.txt,poi,
2772265,3,18,0,Jan van Aken (DIE LINKE),Jan van Aken,jan-van-aken,1036,,data/txt/18003.txt,speech,linke
2772266,3,18,0,Vizepräsident Peter Hintze,Peter Hintze,peter-hintze,1037,"Nächste Rednerin ist die Kollegin Agnieszka Brugger, Bündnis 90/Die Grünen. - Bitte schön.",data/txt/18003.txt,chair,
2772267,3,18,0,Agnieszka Brugger (BÜNDNIS 90/DIE GRÜNEN),Agnieszka Brugger,agnieszka-brugger,1038,"Herr Präsident! Meine Damen und Herren! Eine große Chance mit Risiken und vor allem auch ein Erfolg der Diplomatie, allerdings mit offenem Ausgang - so lässt sich meiner Meinung nach das Übergangsabkommen, das die fünf Vetomächte der Vereinten Nationen und Deutschland mit dem Iran in Genf verhandelt haben, am besten beschreiben. Der Iran verpflichtet sich, Teile seines Atomprogramms auszusetzen und mehr Inspektionen seiner Anlagen zuzulassen. Im Gegenzug soll ein Teil der Sanktionen gelockert und sollen vorerst keine weiteren verhängt werden.

Gemischt und sehr unterschiedlich wurde dieses Abkommen anschließend bewertet. Ich stehe immer noch unter dem Eindruck, dass Sie sich, Herr Außenminister Westerwelle, so einig mit dem Kollegen van Aken sind. Ich finde, das ist ein ganz besonderer Moment, und das zeigt auch, dass es hier einen großen Zuspruch für dieses Verhandlungsergebnis gibt.",data/txt/18003.txt,speech,gruene
2772268,3,18,0,,,,1039,"Heiterkeit und Beifall bei Abgeordneten des BÜNDNISSES 90/DIE GRÜNEN, der SPD und der LINKEN",data/txt/18003.txt,poi,
2772269,3,18,0,Agnieszka Brugger (BÜNDNIS 90/DIE GRÜNEN),Agnieszka Brugger,agnieszka-brugger,1040,"Sie haben das Abkommen einen Wendepunkt genannt. US-Außenminister Kerry twitterte, es sei ein erster Schritt, die Welt sicherer zu machen. Der israelische Ministerpräsident Netanjahu hat das Abkommen hingegen deutlich kritisiert. Allerdings zeigt die Debatte in Israel nicht nur sehr nachvollziehbare Sorgen über das iranische Atomprogramm, sondern auch sehr unterschiedliche Ansichten und Bewertungen dieses Abkommens.

Nach Jahren der Eskalation und des eisigen Stillstands, nach Jahren der mehr als berechtigten Sorge, dass der Iran in Zukunft über Atomwaffen verfügen könnte, ist nun eine erste Vereinbarung getroffen worden, die allen Seiten, wie ich finde, durchaus große Zugeständnisse abverlangt. Das ist ein großer Erfolg.",data/txt/18003.txt,speech,gruene
2772270,3,18,0,,,,1041,Beifall beim BÜNDNIS 90/DIE GRÜNEN,data/txt/18003.txt,poi,
2772271,3,18,0,Agnieszka Brugger (BÜNDNIS 90/DIE GRÜNEN),Agnieszka Brugger,agnieszka-brugger,1042,"Ziel muss es jetzt sein, diesen Weg der Verhandlungen weiter zu beschreiten und die Vereinbarung zügig und schnell umzusetzen, um anschließend, nach den vereinbarten sechs Monaten, in denen Transparenz geschaffen und Vertrauen erworben werden muss, ein belastbares und verbindlicheres Abkommen zu erreichen. Wie diese sechs Monate genutzt werden und wie die Umsetzung dieser Vereinbarung ausfällt, wird dabei nicht nur für die Entwicklung der nächsten Wochen und Monate, sondern für Jahre ausschlaggebend sein.

Es liegt jetzt an der neuen Regierung in Teheran, der internationalen Gemeinschaft glaubhaft zu beweisen, dass sie ernsthaft an einer langfristigen und tragbaren Lösung des Atomkonflikts interessiert ist. Dazu muss der Iran nun schnell und transparent seine Vertrauenswürdigkeit unter Beweis stellen. Die Hochanreicherung von Uran auf 20 Prozent muss gestoppt und die bestehenden Vorräte müssen in höchstens 5-prozentig angereichertes Uran umgewandelt werden. Auch die Aktivitäten um den Schwerwasserreaktor Arak müssen gestoppt und die Kontrolle durch die Internationale Atomenergie-Organisation uneingeschränkt ermöglicht werden. Denn nur durch die zügige und anhaltende Umsetzung dieser Vereinbarung kann der Iran die bestehenden Zweifel, dass es sich um bloße Lippenbekenntnisse handeln könnte, langsam aus dem Weg räumen.

Ziel der auferlegten Sanktionen war es, den Iran an den Verhandlungstisch zu bringen. Das ist gelungen. Nun muss die internationale Gemeinschaft im Gegenzug aber auch bereit sein, die Sanktionen zu lockern, wenn die iranische Seite ihren Verpflichtungen nachkommt. Dabei sollten vor allem die Sanktionen im Fokus stehen, die die Zivilbevölkerung treffen. Absolut kontraproduktiv sind an dieser Stelle die Stimmen der Republikaner aus den USA, die in der aktuellen Situation eine Verschärfung der Sanktionen fordern. Das würde ein automatisches Ende dieses Erfolges, ein automatisches Ende der Verhandlungen und Gespräche bedeuten.

Meine Damen und Herren, wir sollten aber auch nicht in allzu große Euphorie verfallen. Denn es ist zu früh, von einer wirklichen Lösung des Atomkonflikts zu sprechen, weil in diesen sechs Monaten viel passieren kann, zum Guten, aber eben auch zum Schlechten. Trotz des berechtigten Aufatmens aufgrund dieser Einigung muss eines klar sein: Sie ist kein Anlass, die erschreckende Rhetorik des iranischen Regimes gegenüber Israel oder die nach wie vor krassen und eklatanten Menschenrechtsverletzungen im Iran oder die verheerende Rolle, die der Iran im blutigen Syrien-Konflikt spielt, auszublenden.

Es ist aber auch klar: Das Übergangsabkommen ist eben doch ein großer Erfolg der Diplomatie. Wer das bestreitet, muss sich klarmachen, dass die Alternativen, die auf dem Tisch lagen - mit dieser Formulierung wurde ja immer wieder über einen Militärschlag gesprochen -, in ihren Auswirkungen katastrophal gewesen wären. Auf der einen Seite hätte nicht toleriert werden können, dass der Iran sein Atomprogramm in vollem Umfang weiterbetreibt, während immer schärfere Sanktionen die Zivilbevölkerung treffen. Auf der anderen Seite hätte eine militärische Eskalation dieses Konflikts unberechenbare Folgen für eine Region gehabt, die ohnehin schon durch zahlreiche Krisen und Konflikte destabilisiert ist.

Die Einigung ist bei allen berechtigten Zweifeln und Unwägbarkeiten durchaus ein Anlass, Hoffnung zu fassen, dass vielleicht ein Anfang gemacht wurde, diesen Konflikt auf diplomatischem Wege zu bearbeiten und irgendwann vielleicht wirklich lösen zu können.

Wir sollten alles dafür tun, diesen Weg entschieden weiter zu beschreiten.",data/txt/18003.txt,speech,gruene
2772272,3,18,0,,,,1043,Beifall beim BÜNDNIS 90/DIE GRÜNEN sowie bei Abgeordneten der SPD und des Abg. Stefan Liebich (DIE LINKE,data/txt/18003.txt,poi,
2772273,3,18,0,Agnieszka Brugger (BÜNDNIS 90/DIE GRÜNEN),Agnieszka Brugger,agnieszka-brugger,1044,,data/txt/18003.txt,speech,gruene
2772274,3,18,0,Vizepräsident Peter Hintze,Peter Hintze,peter-hintze,1045,"Vielen Dank, Frau Kollegin. - Als Nächster hat der Kollege Dr. Andreas Schockenhoff von der CDU/CSU-Fraktion das Wort.",data/txt/18003.txt,chair,
