id,sitzung,wahlperiode,in_writing,speaker,speaker_cleaned,speaker_fp,sequence,text,filename,type,speaker_party
2198768,3,18,0,,,,1080,"Haben Sie das Gefühl, dass die Führungen der Gewerkschaften keine Ahnung mehr von den arbeitenden Menschen in diesem Land haben? Wollen Sie die Gewerkschaftsbewegung in diesem Land diffamieren? Oder geht es Ihnen - das will ich Ihnen gar nicht unterstellen, weil Sie ein überzeugter Gewerkschafter sind - tatsächlich um das, was ich vorhin gesagt habe, nämlich darum, solch eine billige Aktion zu machen, die mit der Lebensrealität aber nichts zu tun hat?",data/txt/18003.txt,speech,
2198769,3,18,0,,,,1081,Beifall bei Abgeordneten der SPD,data/txt/18003.txt,poi,
2198770,3,18,0,,,,1082,"Nachdem wir eben etwas über Philosophie gehört haben, sage ich Ihnen: Es gibt einen Maßstab für gute Politik, den Max Weber geprägt hat. Danach sind die drei Eigenschaften guter Politik die Bereitschaft, Verantwortung zu übernehmen - das tun wir mit dieser Regelung, für die Menschen, die sie brauchen -, eine leidenschaftliche Überzeugung - in dieser Regelung steckt die sozialdemokratische Leidenschaft, dafür zu sorgen, dass Menschen, die hart arbeiten, davon leben können, die Leidenschaft, das Leben der Menschen konkret zu verbessern, die jetzt unter Armutslöhnen zu leiden haben - sowie das notwendige Augenmaß im politischen Handeln. Augenmaß umfasst auch die Fähigkeit zu guten Kompromissen in der Demokratie.",data/txt/18003.txt,speech,
2198771,3,18,0,,,,1083,Beifall bei Abgeordneten der SPD,data/txt/18003.txt,poi,
2198772,3,18,0,,,,1084,"Herr Kollege Ernst, ich spreche Ihnen eines nicht ab, nämlich dass Sie eine leidenschaftliche Überzeugung haben; das ist auch in Ordnung. Was Ihnen fehlt, ist jede Fähigkeit zur Übernahme von Verantwortung und jede Fähigkeit, das richtige Augenmaß für einen politischen Kompromiss zu finden. Das ist der Grund, warum Sie in der Opposition bleiben.",data/txt/18003.txt,speech,
2198773,3,18,0,,,,1085,Beifall bei der SPD,data/txt/18003.txt,poi,
2198774,3,18,0,,,,1086,"Frau Präsidentin, meine Damen und Herren, die Sozialdemokraten haben Wort gehalten: Es wird den gesetzlichen Mindestlohn geben. Wir sorgen dafür, dass Menschen, die hart arbeiten, von der Arbeit leben können. Wir sorgen dafür, dass vor allen Dingen eines in diesem Land wieder nach vorne kommt - denn unser Ziel ist nicht, dass Menschen vom Mindestlohn leben müssen; unser Ziel ist, dass die Menschen wieder anständige Löhne bekommen -: Mit der Regelung, die wir gefunden haben, stärken wir die Tarifbindung, also das, was die soziale Marktwirtschaft in diesem Land einmal ausgemacht hat, gerade auch in den Bereichen Ostdeutschlands, in denen sie nicht mehr Realität ist. Deshalb sage ich Ihnen: Wir sind stolz auf das, was wir durchgesetzt haben.

Herzlichen Dank.",data/txt/18003.txt,speech,
2198775,3,18,0,,,,1087,Beifall bei der SPD,data/txt/18003.txt,poi,
2198776,3,18,0,,,,1088,"Vizepräsidentin Claudia Roth:

Danke, Herr Kollege Hubertus Heil. - Ich gebe Michael Schlecht von den Linken das Wort zu einer Kurzintervention.

Michael Schlecht (DIE LINKE):

Herr Kollege Heil, ein Missverständnis muss man vielleicht gleich ausräumen: Ein Mindestlohn von 8,50 Euro ist natürlich ein Fortschritt, auch wenn die Linke meint, dass ein Mindestlohn von mindestens 10 Euro, eher noch mehr - vor allen Dingen in der Zeitachse, die hier angedacht ist -, notwendig ist. - Ich sage das nur, um diesen Punkt einmal klarzustellen.

Viel wichtiger ist aber ein Punkt, auf den Sie jetzt nicht eingegangen sind und den Frau Pothmer schon thematisiert hat. Was sagen Sie eigentlich den Mitgliedern Ihrer Partei dazu, dass es zwar einen Mindestlohn von 8,50 Euro zum 1. Januar 2015 geben wird, aber in der Koalitionsvereinbarung festgelegt ist, dass der Mindestlohn von 8,50 Euro für mindestens drei Jahre festgeschrieben bleibt und möglichst erst Anfang 2018 korrigiert werden kann? Dabei ist vollkommen offen, wie der Mechanismus ausgestaltet wird, der regelt, ob es dann wirklich einmal mehr wird. Was sagen Sie, wenn das Mitglied fragt, warum Sie sich darauf eingelassen haben, dass dort drei Jahre nichts passiert?

Ich war 20 Jahre lang Tarifpolitiker. Ich hätte nie einen Tarifabschluss getroffen, bei dem man sich für drei Jahre festlegt, und zwar im Lichte einer unabsehbaren Inflation. Wenn Inflation stattfindet, dann sind die 8,50 Euro im Jahr 2018 vermutlich nur noch so viel wert wie heute 7,50 Euro.

Was sagen Sie Ihrem Mitglied, wenn es Sie fragt: Warum trefft ihr diese Festlegung für drei Jahre, wenn es gleichzeitig im Deutschen Bundestag eine Mehrheit dafür gäbe, einen Mindestlohn von 8,50 Euro zum 1. Januar 2015 ohne eine derartige Festlegung zu vereinbaren? Das ist doch wirklich ein großer Unterschied.",data/txt/18003.txt,speech,
2198777,3,18,0,,,,1089,Beifall bei der LINKEN,data/txt/18003.txt,poi,
2198778,3,18,0,,,,1090,"Vizepräsidentin Claudia Roth:

Hubertus Heil hat die Möglichkeit zu einer Antwort.

Hubertus Heil (Peine) (SPD):

Lieber Kollege Schlecht, auch Sie waren und sind in der Gewerkschaftsbewegung aktiv. Ich finde es ein bisschen schade, dass Sie nicht auf den Einwand eingegangen sind, dass beispielsweise die Führung sämtlicher Gewerkschaften des DGB unsere Vereinbarung unterstützt.

Aber ich will Ihre Frage beantworten. Sie haben mich gefragt, was ich meinen Mitgliedern sagen würde. Erstens. Da ich meine Mitglieder kenne - in der Sozialdemokratie sind verantwortliche Menschen -, weiß ich, dass sie eines wissen: In Deutschland gibt es derzeit 1 Million Menschen, die weniger als 5 Euro in der Stunde verdienen. Mit der Regelung, die wir gefunden haben,",data/txt/18003.txt,speech,
2198779,3,18,0,Brigitte Pothmer [BÜNDNIS 90/DIE GRÜNEN],Brigitte Pothmer [BÜNDNIS 90/DIE GRÜNEN],brigitte-pothmer-bundnis-90-die-grunen,1091,"Auch die Tarifparteien, lieber Hubertus!",data/txt/18003.txt,poi,gruene
2198780,3,18,0,,,,1092,verbessern wir ab dem 1. Januar 2015 die Lebenssituation dieser Menschen auf einen Schlag. Darauf sind wir Sozialdemokraten stolz.,data/txt/18003.txt,speech,
2198781,3,18,0,,,,1093,Beifall bei der SPD,data/txt/18003.txt,poi,
2198782,3,18,0,,,,1094,"Zweitens. Ja, diese Übergangszeit ist ein Kompromiss, und zwar, wie ich finde, kein fauler, sondern ein angemessener. Wenn wir alleine auf der Welt wären, würden wir das vielleicht anders machen, das sage ich auch; aber der Kompromiss führt dazu, dass die Tarifbindung in unserem Land gestärkt wird.

Es stimmt übrigens schlicht und ergreifend nicht, dass alle Tarifverträge bis zum 31. Dezember 2016 laufen; es gibt auch einige, die vorher auslaufen. Wir bekommen den Mindestlohn vor allen Dingen in den Bereichen, in denen wir ihn dringend brauchen: in den weißen Flecken nicht tarifgebundener Bereiche. Ich glaube - korrigiert mich, liebe Kollegen -, in Ostdeutschland arbeiten mittlerweile 40 Prozent der Beschäftigten in Bereichen, die keine Tarifbindung mehr haben. Wir sorgen dafür, dass auch sie zum 1. Januar 2015 auf einen Schlag den gesetzlichen Mindestlohn von 8,50 Euro bekommen.

Meine Antwort an Sie - Sie haben gefragt, wie meine Mitglieder das finden - ist deshalb: Meine Mitglieder wissen, dass wir das Leben von Millionen von Menschen zum 1. Januar 2015 konkret verbessern. Sie wissen, dass ein flächendeckender gesetzlicher Mindestlohn kommt, dass es keine regionale Differenzierung mehr gibt und dass ab 2017 für ganz Deutschland endgültig der gesetzliche Mindestlohn von 8,50 Euro eingeführt wird.

Frau Kollegin Pothmer, in diesem Zusammenhang möchte ich darauf hinweisen: Die Low Pay Commission wird dafür sorgen, dass die 8,50 Euro nicht das letzte Wort sind, sondern dass es im Laufe der Geschichte natürlich Anpassungen geben wird. Auf diese Leistung für die Menschen sind wir, wie gesagt, stolz.

Herzlichen Dank.",data/txt/18003.txt,speech,
2198783,3,18,0,,,,1095,Beifall bei der SPD,data/txt/18003.txt,poi,
2198784,3,18,0,,,,1096,"Vizepräsidentin Claudia Roth:

Danke, Herr Kollege. - Als letzten Redner in dieser spannenden Debatte rufe ich Paul Lehrieder von der CDU/CSU auf. Sie haben das Wort.",data/txt/18003.txt,speech,
2198785,3,18,0,,,,1097,Beifall bei der CDU/CSU,data/txt/18003.txt,poi,
2198786,3,18,0,,,,1098,"Paul Lehrieder (CDU/CSU):

Sehr geehrte Frau Präsidentin! Sehr geehrte Damen und Herren! Mir ging es wie meinen Vorrednern. Als der Gesetzentwurf der Linkspartei eingebracht wurde, war mir völlig klar: Wir diskutieren über einen Mindestlohn von 10 Euro. Nichts anderes habe ich in den letzten Monaten hier in diesem Hohen Haus von Ihnen, Herr Klaus Ernst, und den Mitgliedern Ihrer Partei vernommen.

Jetzt lese ich in Ihrem Gesetzentwurf in § 4:

Der Mindestlohn beläuft sich auf mindestens 8,50 Euro brutto

Sie haben bereits erklärt, dass Sie - Copy and Paste - einen SPD-Antrag zugrunde gelegt haben. Aber bitte schön: Dann müssen Sie auch die Begründung überarbeiten.",data/txt/18003.txt,speech,
2198787,3,18,0,Jörn Wunderlich [DIE LINKE],Jörn Wunderlich [DIE LINKE],jorn-wunderlich-die-linke,1099,"Das ist der Kompromiss! Das ist das, was die SPD und die Grünen wollen",data/txt/18003.txt,poi,linke
2198788,3,18,0,,,,1100,eigentlich! Sagen sie!,data/txt/18003.txt,poi,
2198789,3,18,0,,,,1101,"Im dritten Absatz Ihrer Begründung schreiben Sie:

Besonders betroffen von Stundenlöhnen unter 10 Euro sind in Deutschland Frauen.

Wenn Sie also schon Anträge abschreiben, passen Sie wenigstens die Begründung an; sonst sieht man, welche Lohnhöhe diese Leistung wert ist.",data/txt/18003.txt,speech,
2198790,3,18,0,,,,1102,Heiterkeit und Beifall bei Abgeordneten der CDU/CSU und der SPD,data/txt/18003.txt,poi,
2198791,3,18,0,,,,1103,"Sehr geehrte Damen und Herren, ich habe das Gefühl - Sie haben sich ja schon ein Stück weit entlarvt -, dass es Ihnen nicht um die Menschen in unserem Land geht. Ihnen haben Sie bis vor wenigen Wochen vorgegaukelt: Unter einem Stundenlohn von 10 Euro ist ein menschenwürdiges Leben nicht möglich. Jetzt kommen Sie, lieber Kollege Klaus Ernst, und sagen: 8,50 Euro reichen auch. Das ist doch Trickserei. - Frau Präsidentin, Herr Kollege Ernst will mir eine Frage stellen.",data/txt/18003.txt,speech,
2198792,3,18,0,,,,1104,Heiterkeit,data/txt/18003.txt,poi,
2198793,3,18,0,,,,1105,"Vizepräsidentin Claudia Roth:

Wollen Sie antworten?

Paul Lehrieder (CDU/CSU):

Ja, natürlich. Das ist abgesprochen, Frau Präsidentin; ich räume es ein.

Vizepräsidentin Claudia Roth:

Ach, abgesprochen? Das könnten Sie mir ja vorher sagen. Dann kann ich mich darauf einstellen. - Herr Kollege Ernst, Sie haben also eine Frage.

Klaus Ernst (DIE LINKE):

Herr Kollege Lehrieder, ich wollte nur darauf hinweisen: 8,50 Euro kommt vor 10 Euro.",data/txt/18003.txt,speech,
2198794,3,18,0,Zurufe von Abgeordneten der CDU/CSU und der SPD,e von Abgeordneten der CDU/CSU und der SPD,e-abgeordneten-der-cdu-csu-und-der-spd,1106,Ah!,data/txt/18003.txt,poi,cducsu:spd
2198795,3,18,0,,,,1107,"Paul Lehrieder (CDU/CSU):

So weit kann ich auch rechnen.",data/txt/18003.txt,speech,
2198796,3,18,0,Anette Kramme [SPD],Anette Kramme [SPD],anette-kramme-spd,1108,Volksschule Sauerland!,data/txt/18003.txt,poi,spd
2198797,3,18,0,,,,1109,"Klaus Ernst (DIE LINKE):

Ja, zur Volksschule müsste er vielleicht noch einmal gehen, dann würde er auch merken, dass es bei der Rente anders ist.

Meine Damen und Herren, ich will noch einmal darauf hinweisen: 8,50 Euro ist eine Höhe, mit der gegenwärtig alle Parteien hier im Deutschen Bundestag einverstanden sind; letztendlich haben alle im Bundesrat einen entsprechenden Antrag gestellt, auch mit Zustimmung unserer Partei, die, wie Sie wissen, Regierungspartei in Brandenburg ist. Das bedeutet, wir hätten für diesen Gesetzentwurf eine Mehrheit, wenn sich jede Partei an das halten würde, was sie bei der Bundestagswahl gesagt hat, und an das, wofür sie selber im Bundesrat gestimmt hat.",data/txt/18003.txt,speech,
2198798,3,18,0,,,,1110,Beifall bei der LINKEN,data/txt/18003.txt,poi,
2198799,3,18,0,,,,1111,"Können Sie mir folgen, wenn ich sage, dass es aus Sicht eines Menschen, der einen Mindestlohn von 10 Euro für richtiger hält, durchaus akzeptabel ist, 8,50 Euro zu fordern, wenn man dafür eine Mehrheit hat, weil ja 8,50 Euro, wie gesagt, vor 10 Euro ist und das deshalb ein richtiger Schritt wäre? Das ist unsere Position, die wir hier eingebracht haben, Herr Lehrieder. Die Bürgerinnen und Bürger in diesem Land fragen sich doch Folgendes: Wenn es im Bundestag jetzt eine Mehrheit dafür gibt, einen Mindestlohn von 8,50 Euro einzuführen, und zwar ohne Ausnahme und nicht erst ab 2017, warum führt man ihn dann nicht einfach ein? Wir haben sie doch deswegen gewählt. - Können Sie sich das vorstellen?

Paul Lehrieder (CDU/CSU):

Lieber Kollege, ich stelle eine Gegenfrage: Wofür stehen Sie jetzt eigentlich? Stehen Sie für einen Mindestlohn von 10 Euro, den Sie noch vor wenigen Wochen für richtig gehalten haben,",data/txt/18003.txt,speech,
2198800,3,18,0,Zurufe von der LINKEN,e von der LINKEN,e-linken,1112,Ja!,data/txt/18003.txt,poi,linke
2198801,3,18,0,,,,1113,"oder ist ein Mindestlohn von 8,50 Euro aus Ihrer Sicht inzwischen ausreichend? Herr Kollege Ernst, ich unterstelle Ihnen schlicht und ergreifend, dass Sie jetzt einen Mindestlohn von 8,50 Euro fordern, um unsere neue Lebensabschnittsgefährtin ein bisschen zu ärgern,",data/txt/18003.txt,speech,
2198802,3,18,0,,,,1114,Heiterkeit und Beifall bei Abgeordneten der CDU/CSU,data/txt/18003.txt,poi,
2198803,3,18,0,,,,1115,"um die SPD ein bisschen in die Bredouille zu bringen, und nicht aus Überzeugung.",data/txt/18003.txt,speech,
2198804,3,18,0,Jörn Wunderlich [DIE LINKE],Jörn Wunderlich [DIE LINKE],jorn-wunderlich-die-linke,1116,Er hat das böse Wort gesagt!,data/txt/18003.txt,poi,linke
2198805,3,18,0,,,,1117,"Lieber Kollege Klaus Ernst, nicht lachen, hören Sie mir lieber zu; das ist wichtig. Wenn es Ihnen um die Menschen gegangen wäre, dann hätten Sie weiterhin 10 Euro gefordert. Ich stelle fest: Die Linkspartei hat das Ziel eines Mindestlohns in Höhe von 10 Euro zumindest vorübergehend aufgegeben - Punkt. Das ist der Erkenntnisgewinn dieses Abends.",data/txt/18003.txt,speech,
2198806,3,18,0,,,,1118,Beifall bei Abgeordneten der CDU/CSU und der SPD,data/txt/18003.txt,poi,
2198807,3,18,0,Klaus Ernst [DIE LINKE],Klaus Ernst [DIE LINKE],klaus-ernst-die-linke,1119,"Nein, das haben wir nicht aufgegeben!",data/txt/18003.txt,poi,linke
2198808,3,18,0,Michael Schlecht [DIE LINKE],Michael Schlecht [DIE LINKE],michael-schlecht-die-linke,1120,Wir wollen 12 Euro!,data/txt/18003.txt,poi,linke
2198809,3,18,0,,,,1121,"Sie können sich setzen, Herr Ernst. Viel mehr gibt es dazu nicht zu sagen.

Ich mache keinen Hehl daraus, dass ich persönlich kein großer Fan eines politisch festgesetzten Mindestlohns bin und gerne bei unserem bisherigen, bewährten Modell geblieben wäre, nach dem die Lohnfindung allein Aufgabe der Tarifpartner war. Nicht mit einem politischen Mindestlohn, sondern mit einer marktwirtschaftlich organisierten Lohnuntergrenze sind wir in den letzten Jahren gut gefahren, wie die arbeitsmarkt- und die sozialpolitische Bilanz der unionsgeführten Bundesregierung ganz deutlich zeigt. Wir haben es trotz Krise geschafft, die Arbeitslosigkeit zu halbieren. Wir haben es sogar geschafft, sie unter die 3-Millionen-Marke zu bringen.",data/txt/18003.txt,speech,
2198810,3,18,0,Beate Müller-Gemmeke [BÜNDNIS 90/DIE GRÜNEN],Beate Müller-Gemmeke [BÜNDNIS 90/DIE GRÜNEN],beate-muller-gemmeke-bundnis-90-die-grunen,1122,Das hat nicht die Politik geschafft!,data/txt/18003.txt,poi,gruene
2198811,3,18,0,,,,1123,"- Auch die Politik, Frau Kollegin Müller-Gemmeke.

Klar ist allerdings auch, dass man in einer Koalition Kompromisse eingehen muss, insbesondere dann, wenn die Vorstellungen sehr weit auseinanderliegen, wie das bei der Festsetzung von Lohnuntergrenzen der Fall war. Ich denke, wir haben mit dem gestern präsentierten Koalitionsvertrag von CDU, CSU und SPD einen guten und vor allem fairen Kompromiss gefunden, mit dem wir dafür Sorge tragen, dass es den Menschen in unserem Land besser geht und neue Chancen entstehen. Wir haben zur Kenntnis genommen, dass ein flächendeckender gesetzlicher Mindestlohn eine Herzensangelegenheit unseres Partners ist. Unter Führung unserer Arbeitsministerin Frau von der Leyen haben wir mit der sogenannten Low Pay Commission, der Lohnfindungskommission - ich möchte ein gutes deutsches Wort dafür benutzen -, eine Möglichkeit zur Stärkung der Tarifvertragsparteien gefunden. Zum 1. Januar 2015 soll es einen flächendeckenden gesetzlichen Mindestlohn in Höhe von 8,50 Euro geben. Die Höhe des jeweiligen Mindestlohns wird von einer Kommission bestehend aus jeweils drei Vertretern von Gewerkschaften - das sollte Sie freuen, Herr Ernst - und Arbeitgebern plus einem Vorsitzenden in regelmäßigen Abständen geprüft, gegebenenfalls angepasst und sodann mittels einer Rechtsverordnung staatlich erstreckt und somit allgemeinverbindlich. Jede Partei kann zusätzlich einen wissenschaftlichen Berater für die Mindestlohnkommission benennen, der jedoch kein Stimmrecht erhalten wird. Mit seinem Sachverstand soll er die Arbeit der Lohnfindungskommission begleiten.

Ich sage aber auch ganz deutlich, dass durch die Einführung eines Mindestlohns keine Arbeitsplätze verloren gehen dürfen. Hierfür hat sich die Union mit aller Kraft eingesetzt, und das wird sie auch zukünftig tun. Frau Nahles, Sie haben ausgeführt, dass wir eine Regelung wollen, die allen Menschen nutzt. Dabei müssen wir auch an die denken, die möglicherweise durchs Raster fallen, wenn der Mindestlohn zu schnell eingeführt wird und deswegen in manchen Regionen oder Branchen tatsächlich Arbeitsplätze vernichtet werden. Wir sollten deswegen genau hinsehen, wenn wir in das Gesetzgebungsverfahren einsteigen. Ich bitte in diesem Zusammenhang um die konstruktive Mitwirkung der Freunde von der Linkspartei. Mal sehen, was Sie da Gutes einbringen können.",data/txt/18003.txt,speech,
2198812,3,18,0,Jörn Wunderlich [DIE LINKE],Jörn Wunderlich [DIE LINKE],jorn-wunderlich-die-linke,1124,"Das war jetzt ein Angebot, oder? Das habe ich jedenfalls so verstanden!",data/txt/18003.txt,poi,linke
2198813,3,18,0,,,,1125,"Im Rahmen des Gesetzgebungsverfahrens werden wir einige Aspekte zu berücksichtigen haben:

Die Einführung eines bundesweiten Mindestlohns ohne regionale Ausnahmen bereitet mir insbesondere mit Blick auf die ostdeutschen Länder große Sorgen. Meiner Ansicht nach besteht die Gefahr, dass zahlreiche Arbeitsplätze wegfallen. Denn in den neuen Bundesländern arbeitet bekanntermaßen ein Viertel der Menschen für weniger als 8,50 Euro pro Stunde; im Westen sind es lediglich 12 Prozent.

Auch bei unserer europaweit gelobten dualen Ausbildung müssen wir ganz genau hinschauen. Da Lehrlinge derzeit im Schnitt zwischen 670 und 740 Euro im Monat verdienen, sehe ich die Gefahr, dass Schulabgänger sich zunächst kurzfristig einen Mindestlohnjob suchen, bei dem sie pro Stunde mehr als das Doppelte verdienen, statt eine Ausbildung zu beginnen. Auch dieses Risiko, diese Gefahr sollten wir in der Gesetzgebung berücksichtigen. Wir sollten darüber nachdenken und uns insofern hier auch ehrlich machen.

Schwierigkeiten können sich auch im Bereich der Werkverträge oder bei den sogenannten Niedriglöhnern ergeben, die nicht zu einem festen Stundenlohn arbeiten. Hier besteht die Gefahr, dass der Mindestlohn umgangen wird und die Schwarzarbeit zunimmt.

Durch den nun erstmalig kommenden einheitlichen flächendeckenden gesetzlichen Mindestlohn verlieren die Tarifparteien - dies wurde bereits angesprochen - bedauerlicherweise an Einfluss. Das sollte auch Ihnen Sorge machen.",data/txt/18003.txt,speech,
2198814,3,18,0,Klaus Ernst [DIE LINKE],Klaus Ernst [DIE LINKE],klaus-ernst-die-linke,1126,Einfach immer noch mehr Sorgen!,data/txt/18003.txt,poi,linke
2198815,3,18,0,,,,1127,"Allerdings konnten wir in den Verhandlungen erreichen, dass es den Tarifpartnern bis Ende 2016 weiterhin möglich ist, Übergangsfristen festzulegen, und dass derzeit geltende Tarifverträge bis dahin fortgelten. Das heißt konkret, dass die Tarifpartner bis zur endgültigen Einführung des Mindestlohns auch Abschlüsse vereinbaren können, die unter 8,50 Euro liegen. Von den Vorrednern wurde bereits darauf hingewiesen.

Unsere neue Vizepräsidentin gibt mir ein Zeichen, dass ich allmählich zum Ende kommen muss. - Ich bitte alle Wohlmeinenden, alle, denen es um die Menschen im Land geht, beim anstehenden Gesetzgebungsverfahren konstruktiv mitzuwirken. Wir werden schon etwas Gescheites herauskriegen. Herr Ernst, Frau Nahles, das werden wir schon hinbekommen.

Herzlichen Dank.",data/txt/18003.txt,speech,
2198816,3,18,0,,,,1128,Beifall bei der CDU/CSU sowie bei Abgeordneten der SPD,data/txt/18003.txt,poi,
2198817,3,18,0,,,,1129,"Vizepräsidentin Claudia Roth:

Danke schön, Herr Kollege.

Ich schließe damit die Aussprache. Interfraktionell wird Überweisung des Gesetzentwurfs auf Drucksache 18/6 an den Hauptausschuss vorgeschlagen. Gibt es dazu andere Vorschläge? - Ich sehe und höre nichts. Das ist also nicht der Fall. Damit ist die Überweisung zur großen Freude der Kollegen bei der Linkspartei so beschlossen.

Ich rufe die Tagesordnungspunkte 10 a und 10 b auf:

a)	Beratung des Antrags der Abgeordneten Dr. Gerhard Schick, Kerstin Andreae, Annalena Baerbock, weiterer Abgeordneter und der Fraktion BÜNDNIS 90/DIE GRÜNEN

Risiko und Haftung zusammenführen - Gläubigerbeteiligung nach EZB-Bankentest sicherstellen

- Drucksache 18/97 -

b)	Beratung des Antrags der Abgeordneten Dr. Gerhard Schick, Kerstin Andreae, Annalena Baerbock, weiterer Abgeordneter und der Fraktion BÜNDNIS 90/DIE GRÜNEN

Gemeinsam die Haftung der Steuerzahlerinnen und Steuerzahler beenden - Für einen einheitlichen europäischen Restrukturierungsmechanismus

- Drucksache 18/98 -

Nach einer interfraktionellen Vereinbarung sind für die Aussprache 38 Minuten vorgesehen. - Ich höre einiges, aber dazu keinen Widerspruch. Dann ist das so beschlossen.

Ich gebe das Wort Dr. Gerhard Schick von Bündnis 90/Die Grünen.

Dr. Gerhard Schick (BÜNDNIS 90/DIE GRÜNEN):

Liebe Frau Präsidentin! Liebe Kolleginnen und Kollegen! Meine Fraktion Bündnis 90/Die Grünen hat diesen Tagesordnungspunkt heute beantragt, weil auf europäischer Ebene gerade ein Thema von enormer Wichtigkeit verhandelt wird und wir uns als deutsches Parlament - Regierungsbildung hin oder her - dringend damit beschäftigen müssen.",data/txt/18003.txt,speech,
2198818,3,18,0,,,,1130,Beifall beim BÜNDNIS 90/DIE GRÜNEN,data/txt/18003.txt,poi,
2198819,3,18,0,,,,1131,"Ich zitiere Yves Mersch, Mitglied des Direktoriums der Europäischen Zentralbank: Das Projekt Bankenunion ist das vielleicht größte und wichtigste seit Gründung der Europäischen Währungsunion. - Ich finde, das kann man genau so sagen. Denn es geht um nicht mehr und nicht weniger als den Schutz der Steuerzahler vor erneuten Milliardenrisiken in Form der Übernahme von Bankschulden, die eigentlich mit dem Steuerzahler nichts zu tun haben sollten.

Über fünf Jahre nach der Lehman-Pleite ist es immer noch nicht gesichert, dass, wenn eine Bank wackelt, nicht der Steuerzahler in die Pflicht genommen wird. Daran muss sich endlich etwas ändern. Wir in Deutschland haben das bei der Commerzbank, der IKB und der Hypo Real Estate erlebt, und das gilt auch in Europa. Unsere Fraktion hat einmal nachrechnen lassen, wie viel Steuerzahlergeld umsonst - besser gesagt: fälschlicherweise - aufgewendet wurde, um Bankschulden in Europa zu übernehmen. Das Ergebnis: Allein bei sieben Bankenrettungen hätten über 35 Milliarden Euro Steuergelder in Zypern, in Spanien und in Griechenland gespart werden können. Spanien hätte wahrscheinlich kein Rettungsprogramm gebraucht. Wir wollen, dass das nicht noch einmal vorkommt.",data/txt/18003.txt,speech,
2198820,3,18,0,,,,1132,Beifall beim BÜNDNIS 90/DIE GRÜNEN,data/txt/18003.txt,poi,
2198821,3,18,0,,,,1133,"Die Europäische Union hat das ja auch erkannt. Seit Mitte 2012 stehen das Projekt Bankenunion und das Thema Bankenabwicklung fest auf der Agenda. Während hier die Regierungsbildung stattfindet, während hier das Parlament noch gar nicht richtig arbeitsfähig ist, verhandelt der Bundesfinanzminister auf europäischer Ebene natürlich weiter über dieses Projekt. Insbesondere an zwei Punkten gilt es jetzt nachzusteuern, weil er da auf dem falschen Pfad ist, und das kann teuer kommen.

Wir haben zwei Anträge eingebracht, die genau diese zwei Punkte behandeln.

Der erste Aspekt ist folgender: Wir brauchen eine Trennung zwischen Banken und Nationalstaaten, weil diese Verknüpfung dazu geführt hat, dass, wenn eine Bank wackelt, die Schulden auf den Staat übertragen werden. So weit sind sich eigentlich alle einig. Doch im Koalitionsvertrag findet man dazu nur wackelige Formulierungen wie: Künftig soll da etwas gemacht werden oder: Perspektivisch soll es einen Restrukturierungsfonds geben, und man versteckt sich erneut hinter rechtlichen Fragestellungen. De facto heißt das: Deutschland steht beim wichtigen Projekt eines europäischen Abwicklungsfonds, den die Banken finanzieren, auf der Bremse. Das ist falsch.",data/txt/18003.txt,speech,
2198822,3,18,0,,,,1134,Beifall beim BÜNDNIS 90/DIE GRÜNEN,data/txt/18003.txt,poi,
