id,sitzung,wahlperiode,in_writing,speaker,speaker_cleaned,speaker_fp,sequence,text,filename,type,speaker_party
2772748,3,18,0,Paul Lehrieder (CDU/CSU),Paul Lehrieder,paul-lehrieder,1519,"- Auch die Politik, Frau Kollegin Müller-Gemmeke.

Klar ist allerdings auch, dass man in einer Koalition Kompromisse eingehen muss, insbesondere dann, wenn die Vorstellungen sehr weit auseinanderliegen, wie das bei der Festsetzung von Lohnuntergrenzen der Fall war. Ich denke, wir haben mit dem gestern präsentierten Koalitionsvertrag von CDU, CSU und SPD einen guten und vor allem fairen Kompromiss gefunden, mit dem wir dafür Sorge tragen, dass es den Menschen in unserem Land besser geht und neue Chancen entstehen. Wir haben zur Kenntnis genommen, dass ein flächendeckender gesetzlicher Mindestlohn eine Herzensangelegenheit unseres Partners ist. Unter Führung unserer Arbeitsministerin Frau von der Leyen haben wir mit der sogenannten Low Pay Commission, der Lohnfindungskommission - ich möchte ein gutes deutsches Wort dafür benutzen -, eine Möglichkeit zur Stärkung der Tarifvertragsparteien gefunden. Zum 1. Januar 2015 soll es einen flächendeckenden gesetzlichen Mindestlohn in Höhe von 8,50 Euro geben. Die Höhe des jeweiligen Mindestlohns wird von einer Kommission bestehend aus jeweils drei Vertretern von Gewerkschaften - das sollte Sie freuen, Herr Ernst - und Arbeitgebern plus einem Vorsitzenden in regelmäßigen Abständen geprüft, gegebenenfalls angepasst und sodann mittels einer Rechtsverordnung staatlich erstreckt und somit allgemeinverbindlich. Jede Partei kann zusätzlich einen wissenschaftlichen Berater für die Mindestlohnkommission benennen, der jedoch kein Stimmrecht erhalten wird. Mit seinem Sachverstand soll er die Arbeit der Lohnfindungskommission begleiten.

Ich sage aber auch ganz deutlich, dass durch die Einführung eines Mindestlohns keine Arbeitsplätze verloren gehen dürfen. Hierfür hat sich die Union mit aller Kraft eingesetzt, und das wird sie auch zukünftig tun. Frau Nahles, Sie haben ausgeführt, dass wir eine Regelung wollen, die allen Menschen nutzt. Dabei müssen wir auch an die denken, die möglicherweise durchs Raster fallen, wenn der Mindestlohn zu schnell eingeführt wird und deswegen in manchen Regionen oder Branchen tatsächlich Arbeitsplätze vernichtet werden. Wir sollten deswegen genau hinsehen, wenn wir in das Gesetzgebungsverfahren einsteigen. Ich bitte in diesem Zusammenhang um die konstruktive Mitwirkung der Freunde von der Linkspartei. Mal sehen, was Sie da Gutes einbringen können.",data/txt/18003.txt,speech,cducsu
2772749,3,18,0,Jörn Wunderlich [DIE LINKE],Jörn Wunderlich,jorn-wunderlich,1520,"Das war jetzt ein Angebot, oder? Das habe ich jedenfalls so verstanden!",data/txt/18003.txt,poi,linke
2772750,3,18,0,Paul Lehrieder (CDU/CSU),Paul Lehrieder,paul-lehrieder,1521,"Im Rahmen des Gesetzgebungsverfahrens werden wir einige Aspekte zu berücksichtigen haben:

Die Einführung eines bundesweiten Mindestlohns ohne regionale Ausnahmen bereitet mir insbesondere mit Blick auf die ostdeutschen Länder große Sorgen. Meiner Ansicht nach besteht die Gefahr, dass zahlreiche Arbeitsplätze wegfallen. Denn in den neuen Bundesländern arbeitet bekanntermaßen ein Viertel der Menschen für weniger als 8,50 Euro pro Stunde; im Westen sind es lediglich 12 Prozent.

Auch bei unserer europaweit gelobten dualen Ausbildung müssen wir ganz genau hinschauen. Da Lehrlinge derzeit im Schnitt zwischen 670 und 740 Euro im Monat verdienen, sehe ich die Gefahr, dass Schulabgänger sich zunächst kurzfristig einen Mindestlohnjob suchen, bei dem sie pro Stunde mehr als das Doppelte verdienen, statt eine Ausbildung zu beginnen. Auch dieses Risiko, diese Gefahr sollten wir in der Gesetzgebung berücksichtigen. Wir sollten darüber nachdenken und uns insofern hier auch ehrlich machen.

Schwierigkeiten können sich auch im Bereich der Werkverträge oder bei den sogenannten Niedriglöhnern ergeben, die nicht zu einem festen Stundenlohn arbeiten. Hier besteht die Gefahr, dass der Mindestlohn umgangen wird und die Schwarzarbeit zunimmt.

Durch den nun erstmalig kommenden einheitlichen flächendeckenden gesetzlichen Mindestlohn verlieren die Tarifparteien - dies wurde bereits angesprochen - bedauerlicherweise an Einfluss. Das sollte auch Ihnen Sorge machen.",data/txt/18003.txt,speech,cducsu
2772751,3,18,0,Klaus Ernst [DIE LINKE],Klaus Ernst,klaus-ernst,1522,Einfach immer noch mehr Sorgen!,data/txt/18003.txt,poi,linke
2772752,3,18,0,Paul Lehrieder (CDU/CSU),Paul Lehrieder,paul-lehrieder,1523,"Allerdings konnten wir in den Verhandlungen erreichen, dass es den Tarifpartnern bis Ende 2016 weiterhin möglich ist, Übergangsfristen festzulegen, und dass derzeit geltende Tarifverträge bis dahin fortgelten. Das heißt konkret, dass die Tarifpartner bis zur endgültigen Einführung des Mindestlohns auch Abschlüsse vereinbaren können, die unter 8,50 Euro liegen. Von den Vorrednern wurde bereits darauf hingewiesen.

Unsere neue Vizepräsidentin gibt mir ein Zeichen, dass ich allmählich zum Ende kommen muss. - Ich bitte alle Wohlmeinenden, alle, denen es um die Menschen im Land geht, beim anstehenden Gesetzgebungsverfahren konstruktiv mitzuwirken. Wir werden schon etwas Gescheites herauskriegen. Herr Ernst, Frau Nahles, das werden wir schon hinbekommen.

Herzlichen Dank.",data/txt/18003.txt,speech,cducsu
2772753,3,18,0,,,,1524,Beifall bei der CDU/CSU sowie bei Abgeordneten der SPD,data/txt/18003.txt,poi,
2772754,3,18,0,Paul Lehrieder (CDU/CSU),Paul Lehrieder,paul-lehrieder,1525,,data/txt/18003.txt,speech,cducsu
2772755,3,18,0,Vizepräsidentin Claudia Roth,Claudia Roth,claudia-roth,1526,"Danke schön, Herr Kollege.

Ich schließe damit die Aussprache. Interfraktionell wird Überweisung des Gesetzentwurfs auf Drucksache 18/6 an den Hauptausschuss vorgeschlagen. Gibt es dazu andere Vorschläge? - Ich sehe und höre nichts. Das ist also nicht der Fall. Damit ist die Überweisung zur großen Freude der Kollegen bei der Linkspartei so beschlossen.

Ich rufe die Tagesordnungspunkte 10 a und 10 b auf:

a)	Beratung des Antrags der Abgeordneten Dr. Gerhard Schick, Kerstin Andreae, Annalena Baerbock, weiterer Abgeordneter und der Fraktion BÜNDNIS 90/DIE GRÜNEN

Risiko und Haftung zusammenführen - Gläubigerbeteiligung nach EZB-Bankentest sicherstellen

- Drucksache 18/97 -

b)	Beratung des Antrags der Abgeordneten Dr. Gerhard Schick, Kerstin Andreae, Annalena Baerbock, weiterer Abgeordneter und der Fraktion BÜNDNIS 90/DIE GRÜNEN

Gemeinsam die Haftung der Steuerzahlerinnen und Steuerzahler beenden - Für einen einheitlichen europäischen Restrukturierungsmechanismus

- Drucksache 18/98 -

Nach einer interfraktionellen Vereinbarung sind für die Aussprache 38 Minuten vorgesehen. - Ich höre einiges, aber dazu keinen Widerspruch. Dann ist das so beschlossen.

Ich gebe das Wort Dr. Gerhard Schick von Bündnis 90/Die Grünen.",data/txt/18003.txt,chair,
2772756,3,18,0,Dr. Gerhard Schick (BÜNDNIS 90/DIE GRÜNEN),Dr. Gerhard Schick,gerhard-schick,1527,"Liebe Frau Präsidentin! Liebe Kolleginnen und Kollegen! Meine Fraktion Bündnis 90/Die Grünen hat diesen Tagesordnungspunkt heute beantragt, weil auf europäischer Ebene gerade ein Thema von enormer Wichtigkeit verhandelt wird und wir uns als deutsches Parlament - Regierungsbildung hin oder her - dringend damit beschäftigen müssen.",data/txt/18003.txt,speech,gruene
2772757,3,18,0,,,,1528,Beifall beim BÜNDNIS 90/DIE GRÜNEN,data/txt/18003.txt,poi,
2772758,3,18,0,Dr. Gerhard Schick (BÜNDNIS 90/DIE GRÜNEN),Dr. Gerhard Schick,gerhard-schick,1529,"Ich zitiere Yves Mersch, Mitglied des Direktoriums der Europäischen Zentralbank: Das Projekt Bankenunion ist das vielleicht größte und wichtigste seit Gründung der Europäischen Währungsunion. - Ich finde, das kann man genau so sagen. Denn es geht um nicht mehr und nicht weniger als den Schutz der Steuerzahler vor erneuten Milliardenrisiken in Form der Übernahme von Bankschulden, die eigentlich mit dem Steuerzahler nichts zu tun haben sollten.

Über fünf Jahre nach der Lehman-Pleite ist es immer noch nicht gesichert, dass, wenn eine Bank wackelt, nicht der Steuerzahler in die Pflicht genommen wird. Daran muss sich endlich etwas ändern. Wir in Deutschland haben das bei der Commerzbank, der IKB und der Hypo Real Estate erlebt, und das gilt auch in Europa. Unsere Fraktion hat einmal nachrechnen lassen, wie viel Steuerzahlergeld umsonst - besser gesagt: fälschlicherweise - aufgewendet wurde, um Bankschulden in Europa zu übernehmen. Das Ergebnis: Allein bei sieben Bankenrettungen hätten über 35 Milliarden Euro Steuergelder in Zypern, in Spanien und in Griechenland gespart werden können. Spanien hätte wahrscheinlich kein Rettungsprogramm gebraucht. Wir wollen, dass das nicht noch einmal vorkommt.",data/txt/18003.txt,speech,gruene
2772759,3,18,0,,,,1530,Beifall beim BÜNDNIS 90/DIE GRÜNEN,data/txt/18003.txt,poi,
2772760,3,18,0,Dr. Gerhard Schick (BÜNDNIS 90/DIE GRÜNEN),Dr. Gerhard Schick,gerhard-schick,1531,"Die Europäische Union hat das ja auch erkannt. Seit Mitte 2012 stehen das Projekt Bankenunion und das Thema Bankenabwicklung fest auf der Agenda. Während hier die Regierungsbildung stattfindet, während hier das Parlament noch gar nicht richtig arbeitsfähig ist, verhandelt der Bundesfinanzminister auf europäischer Ebene natürlich weiter über dieses Projekt. Insbesondere an zwei Punkten gilt es jetzt nachzusteuern, weil er da auf dem falschen Pfad ist, und das kann teuer kommen.

Wir haben zwei Anträge eingebracht, die genau diese zwei Punkte behandeln.

Der erste Aspekt ist folgender: Wir brauchen eine Trennung zwischen Banken und Nationalstaaten, weil diese Verknüpfung dazu geführt hat, dass, wenn eine Bank wackelt, die Schulden auf den Staat übertragen werden. So weit sind sich eigentlich alle einig. Doch im Koalitionsvertrag findet man dazu nur wackelige Formulierungen wie: Künftig soll da etwas gemacht werden oder: Perspektivisch soll es einen Restrukturierungsfonds geben, und man versteckt sich erneut hinter rechtlichen Fragestellungen. De facto heißt das: Deutschland steht beim wichtigen Projekt eines europäischen Abwicklungsfonds, den die Banken finanzieren, auf der Bremse. Das ist falsch.",data/txt/18003.txt,speech,gruene
2772761,3,18,0,,,,1532,Beifall beim BÜNDNIS 90/DIE GRÜNEN,data/txt/18003.txt,poi,
2772762,3,18,0,Dr. Gerhard Schick (BÜNDNIS 90/DIE GRÜNEN),Dr. Gerhard Schick,gerhard-schick,1533,"Zweitens ist es falsch, dass die Entscheidung über die Abwicklung einer Bank nach dem Vorschlag des Bundesfinanzministers von den nationalen Regierungen zu treffen ist. Man muss doch daraus lernen, dass genau diese Art von Verhandlungen zwischen den Regierungen in der Vergangenheit erst zu diesen Milliardenlasten geführt haben. Wir brauchen endlich eine Institution in Europa, deren klarer gesetzlicher Auftrag es ist, den Steuerzahler vor neuen Lasten, die aus der Bankenrettung resultieren, zu schützen.",data/txt/18003.txt,speech,gruene
2772763,3,18,0,,,,1534,Beifall beim BÜNDNIS 90/DIE GRÜNEN,data/txt/18003.txt,poi,
2772764,3,18,0,Dr. Gerhard Schick (BÜNDNIS 90/DIE GRÜNEN),Dr. Gerhard Schick,gerhard-schick,1535,"Es ist Eile geboten, jetzt den Steuerzahler zu schützen. Denn aufgrund des Stresstests der Europäischen Zentralbank wird sich schon sehr bald die Frage stellen: Was machen wir, wenn neuer Kapitalbedarf besteht? - Der Ministerrat, der Ecofin, hat unter Mitwirkung der noch amtierenden Bundesregierung vor zwei Wochen die Risiken für den Steuerzahler ganz nebenbei deutlich erhöht.",data/txt/18003.txt,speech,gruene
2772765,3,18,0,Dr. h. c. Hans Michelbach [CDU/CSU],Dr. h. c. Hans Michelbach,hans-michelbach,1536,Ach ja? Wie denn?,data/txt/18003.txt,poi,cducsu
2772766,3,18,0,Dr. Gerhard Schick (BÜNDNIS 90/DIE GRÜNEN),Dr. Gerhard Schick,gerhard-schick,1537,"Noch im Sommer dieses Jahres sagte uns Staatssekretär Steffen im Rahmen einer Beratung im Finanzausschuss, bevor der Steuerzahler in die Pflicht genommen werde, müssten erst einmal mindestens 8 Prozent der Bilanzsumme von den Gläubigern getragen werden.",data/txt/18003.txt,speech,gruene
2772767,3,18,0,Ralph Brinkhaus [CDU/CSU],Ralph Brinkhaus,ralph-brinkhaus,1538,"Ja, und? Das geht doch!",data/txt/18003.txt,poi,cducsu
2772768,3,18,0,Dr. Gerhard Schick (BÜNDNIS 90/DIE GRÜNEN),Dr. Gerhard Schick,gerhard-schick,1539,In dem neuen Ecofin-Beschluss ist dieser Punkt nicht mehr enthalten.,data/txt/18003.txt,speech,gruene
2772769,3,18,0,Ralph Brinkhaus [CDU/CSU],Ralph Brinkhaus,ralph-brinkhaus,1540,Das ist doch eine klare Konditionalität! Das kann man doch festlegen! Bauen Sie hier doch nicht so einen Popanz auf!,data/txt/18003.txt,poi,cducsu
2772770,3,18,0,Dr. Gerhard Schick (BÜNDNIS 90/DIE GRÜNEN),Dr. Gerhard Schick,gerhard-schick,1541,"An genau dieser Stelle haken wir ein und sagen: Hier muss nachgesteuert werden. Es muss sichergestellt werden, dass als Erstes die Gläubiger zahlen müssen und nicht wieder auf den Steuerzahler Rekurs genommen wird. - Wenn man hinterher jammert, ist es zu spät. Jetzt ist es an der Zeit, die Bedingungen richtig festzulegen, damit nicht erneut die Steuerzahlerinnen und Steuerzahler in Europa in die Pflicht genommen werden. Das ist unser Ziel.

Danke schön.",data/txt/18003.txt,speech,gruene
2772771,3,18,0,,,,1542,Beifall beim BÜNDNIS 90/DIE GRÜNEN sowie bei Abgeordneten der LINKEN,data/txt/18003.txt,poi,
2772772,3,18,0,Dr. Gerhard Schick (BÜNDNIS 90/DIE GRÜNEN),Dr. Gerhard Schick,gerhard-schick,1543,,data/txt/18003.txt,speech,gruene
2772773,3,18,0,Vizepräsidentin Claudia Roth,Claudia Roth,claudia-roth,1544,"Danke schön, Herr Kollege. Sie haben Ihre Redezeit gar nicht ausgeschöpft; das kenne ich sonst anders. -",data/txt/18003.txt,chair,
2772774,3,18,0,Manfred Zöllmer [SPD],Manfred Zöllmer,manfred-zollmer,1545,Die Anträge sind ja auch sehr dünn!,data/txt/18003.txt,poi,spd
2772775,3,18,0,Vizepräsidentin Claudia Roth,Claudia Roth,claudia-roth,1546,Nächster Redner ist Ralph Brinkhaus für die CDU/CSU.,data/txt/18003.txt,chair,
2772776,3,18,0,,,,1547,Beifall bei Abgeordneten der CDU/CSU,data/txt/18003.txt,poi,
2772777,3,18,0,Vizepräsidentin Claudia Roth,Claudia Roth,claudia-roth,1548,,data/txt/18003.txt,chair,
2772778,3,18,0,Ralph Brinkhaus (CDU/CSU),Ralph Brinkhaus,ralph-brinkhaus,1549,"Frau Bundestagspräsidentin! Vielleicht geht die Redezeit, die nicht ausgenutzt wird, ja an Sie über. Aber ich glaube, das ist nicht der Fall.

Herr Schick, Sie haben ganz richtig gesagt, dass der Zweck dieser Debatte wahrscheinlich nicht Ihre Anträge sind - sie halte ich nämlich für überflüssig -, sondern die Tatsache ist, dass sich die Welt zwischen Bundestagswahl und Koalitionsbildung weitergedreht hat. Während sich die Welt weitergedreht hat, haben sich auch die Finanzmärkte weitergedreht. Auch die europäische Gesetzgebung hat sich weitergedreht. Das heißt, es sind wichtige Entscheidungen getroffen worden. Wir sind bei dem für den Verbraucherschutz so wichtigen Thema MiFID weitergekommen. Wir sind bei dem für die Versicherungen so wichtigen Projekt Solvency weitergekommen. Wir sind bei der zweiten Etappe im Hinblick auf die Bankenunion auf der Zielgeraden. Insofern ist es gut und richtig, dass sich der Deutsche Bundestag hier und heute zu diesem Thema positioniert.",data/txt/18003.txt,speech,cducsu
2772779,3,18,0,Dr. Gerhard Schick [BÜNDNIS 90/DIE GRÜNEN],Dr. Gerhard Schick,gerhard-schick,1550,Danke für die Zustimmung!,data/txt/18003.txt,poi,gruene
2772780,3,18,0,Ralph Brinkhaus (CDU/CSU),Ralph Brinkhaus,ralph-brinkhaus,1551,"Wenn man in die 17. Legislaturperiode zurückblickt und sich die letzten vier Jahre vor Augen führt, stellt man fest: Wir haben mehr als 30 Gesetze und Initiativen auf den Weg gebracht, um die Finanzmärkte zwar nicht zu bändigen, sie aber ein wenig sicherer zu machen. Wir haben dafür gesorgt, dass die Finanzinstitutionen weniger Risiken eingehen. Wir haben dafür gesorgt, dass die Risikotragfähigkeit steigt. Wir haben dafür gesorgt, dass wir, zumindest auf nationaler Ebene, vernünftige Aufsichtsstrukturen bekommen. Wir haben einen Restrukturierungsmechanismus erarbeitet. Wir haben ziemlich viel für den Verbraucherschutz getan.

Meine Damen und Herren, wenn Sie sich ansehen, was im Koalitionsvertrag niedergelegt ist, stellen Sie fest, dass dieser Weg weitergegangen wird und sich eigentlich gar nicht schrecklich viel geändert hat. Wir werden damit leben müssen, dass unsere - wie hat es Paul Lehrieder eben genannt? - neue Lebensgefährtin - ich hoffe nicht, dass sie unsere neue Lebensrestbegleiterin ist -",data/txt/18003.txt,speech,cducsu
2772781,3,18,0,,,,1552,Heiterkeit bei Abgeordneten der CDU/CSU,data/txt/18003.txt,poi,
2772782,3,18,0,Klaus-Peter Flosbach [CDU/CSU],Klaus-Peter Flosbach,klaus-peter-flosbach,1553,Lebensabschnittspartnerin!,data/txt/18003.txt,poi,cducsu
2772783,3,18,0,Joachim Poß [SPD],Joachim Poß,joachim-poß,1554,"Nein! Nicht Lebensgefährtin, sondern Lebensabschnittsbegleiterin",data/txt/18003.txt,poi,spd
2772784,3,18,0,,,,1555,das ist auch schon verdammt viel!,data/txt/18003.txt,poi,
2772785,3,18,0,Ralph Brinkhaus (CDU/CSU),Ralph Brinkhaus,ralph-brinkhaus,1556,"- unsere Lebensabschnittsbegleiterin, genau - sicherlich auch beim Thema Bankenregulierung einige sozialdemokratische Akzente mit einbringen wird. Das heißt, die Regelungen werden ein bisschen anders ausgestaltet. Aber die Grundlinie wird gleich bleiben. In der letzten Legislaturperiode haben wir ja erkannt, dass die Unterschiede nicht so groß waren, und das ist auch gut so.

Im Rahmen der Regulierung haben wir festgestellt, dass der nationale Gesetzgeber an Grenzen stößt. Wir haben das festgestellt, als wir in einem nationalen Alleingang Leerverkäufe verboten haben; wir waren froh, dass man das auf europäischer Ebene nachvollzogen hat. Wir haben das festgestellt, als wir als eines der ersten Länder den Hochfrequenzhandel reguliert haben; es ist gut, dass das auch in der MiFID nachvollzogen wird. Wir haben das festgestellt, als wir als eines der ersten Länder ein Trennbankengesetz auf den Weg gebracht haben. Ich glaube, das wird unter Berücksichtigung der Liikanen-Vorschläge auf europäischer Ebene noch viel wirkmächtiger.

Wir haben festgestellt, meine Damen und Herren, dass das Restrukturierungsgesetz, das wir gemacht haben, bestenfalls für größere national tätige Banken reicht, aber nicht für international tätige Banken.",data/txt/18003.txt,speech,cducsu
2772786,3,18,0,Dr. Gerhard Schick [BÜNDNIS 90/DIE GRÜNEN],Dr. Gerhard Schick,gerhard-schick,1557,Inzwischen geben Sie es zu! Damals haben Sie mir noch widersprochen!,data/txt/18003.txt,poi,gruene
2772787,3,18,0,Ralph Brinkhaus (CDU/CSU),Ralph Brinkhaus,ralph-brinkhaus,1558,"Das ist auch ganz normal, meine Damen und Herren: weil Finanzmärkte an nationalen Grenzen nicht haltmachen. Die meisten Finanzinstitutionen agieren überregional und über nationale Grenzen hinweg. Selbst Finanzinstitutionen, die innerhalb nationaler Grenzen arbeiten, haben ein Schadenspotenzial, das über Landesgrenzen hinausreicht. Wir haben das in Spanien gesehen: Die Caixas - wahrlich nicht große Institute - hatten die Welt mit Produkten beglückt, die Schwierigkeiten machten. Das führte dazu, dass Spanien unter den ESM-Schirm schlüpfen musste.

Insofern ist es gut und richtig, zu sagen: Wir haben gelernt, wir brauchen internationale Regeln. - Die Regeln, die wir in den letzten vier Jahren eingeführt haben, waren gar nicht so schlecht. Wir brauchen aber auch internationale Aufsichtsstrukturen, und wir brauchen internationale Problemlösungsmechanismen. Das war genau der Punkt, an dem der Gipfel vom 29. Juni 2012 - es waren die Morgenstunden des 29. Juni 2012 - angesetzt hat mit dem Bekenntnis: Ja, wir brauchen eine Bankenunion.

Wir stehen zu dieser Bankenunion. Diese Bankenunion wird einen Überwachungsmechanismus, einen Aufsichtsmechanismus, und einen Abwicklungsmechanismus umfassen. Wir werden uns im Rahmen der Bankenunion auch noch mit einer dritten Säule beschäftigen müssen, nämlich einer harmonisierten Einlagensicherung.

Bei dem gemeinsamen Aufsichtsmechanismus sind wir sehr weit gekommen: Die Europäische Zentralbank wird das übernehmen; sie wird Mitte nächsten Jahres an den Start gehen. Es laufen schon jetzt vorbereitende Aktionen, Belastungstests; das ist auch gut und richtig so.

Es war nicht ganz einfach, das zu verhandeln, Herr Schick. Es gab große Probleme bei der Trennung der Geldpolitik von der Aufsichtspolitik im Rahmen der Europäischen Zentralbank. Wir waren auch nicht ganz einverstanden mit dem Vorschlag von Herrn Barnier, dass sich die europäische Aufsicht bis in die kleinsten Verästelungen des deutschen Finanzsystems erstrecken soll, dass die europäische Aufsichtsbehörde auch auf Sparkassen, Volksbanken und kleine Privatbanken direkten Zugriff bekommen soll. Wir haben uns erfolgreich dagegen gewehrt. Ich glaube, wir sind uns darin einig, dass dies im Interesse der Menschen in Deutschland und im Interesse des Wirtschaftsstandorts Deutschland war.",data/txt/18003.txt,speech,cducsu
2772788,3,18,0,,,,1559,Beifall bei Abgeordneten der CDU/CSU,data/txt/18003.txt,poi,
2772789,3,18,0,Ralph Brinkhaus (CDU/CSU),Ralph Brinkhaus,ralph-brinkhaus,1560,"Jetzt sind wir in der zweiten Etappe; da geht es um den Abwicklungsmechanismus. Es gibt eine große Übereinstimmung: Wir brauchen Abwicklungsregeln, wir brauchen Abwicklungsinstitutionen, und wir brauchen Geld für die Abwicklung, einen Abwicklungsfonds.

Wir sind uns bei den Abwicklungsregeln einig, dass wir eine Haftungskaskade brauchen. Wir wollen, dass zuerst die Eigentümer der Finanzinstitutionen haften. Wir wollen, dass danach die Gläubiger - diejenigen, die diesen Finanzinstitutionen Geld gegeben haben; Ausnahme: Kleinanleger - haften. Wir wollen, dass dann ein von Banken gefütterter Fonds für die ganze Sache haftet. Jetzt kommen wir zu einem Punkt, an dem wir unterschiedliche Vorstellungen haben: Wir wollen, dass die Nationalstaaten in der Verpflichtung bleiben, sich um ihre Banken zu kümmern.",data/txt/18003.txt,speech,cducsu
2772790,3,18,0,Dr. Gerhard Schick [BÜNDNIS 90/DIE GRÜNEN],Dr. Gerhard Schick,gerhard-schick,1561,Und damit der Steuerzahler!,data/txt/18003.txt,poi,gruene
2772791,3,18,0,Ralph Brinkhaus (CDU/CSU),Ralph Brinkhaus,ralph-brinkhaus,1562,"Erst wenn das passiert ist, soll der europäische Steuerzahler eingreifen; das ist uns ganz wichtig.

An diesem Punkt gibt es einen Bruch, an dem wir momentan verhandeln. Sie sagen, die Nationalstaaten müssten aus der Haftungskaskade herausgenommen werden, weil, wenn wir eine europäische Regulierung haben, auch eine europäische Verantwortung besteht, also auch europäische Haftung nötig ist. Ich will Ihnen drei Beispiele nennen, die diesen Gedanken widerlegen: Der Erfolg einer Bank hängt nicht allein davon ab, ob die Regulierung erfolgreich ist. Wenn es, wie in Griechenland, keine funktionierende Administration gibt, dann schadet das den lokalen Banken und erhöht das Insolvenzrisiko. Wenn, wie bei den Immobilien in Spanien, zugelassen wird, dass Blasen entstehen, dann schwächt das die Banken. Es gibt also eine nationale Verantwortung. Wenn, wie in Frankreich, eine verfehlte Steuer- und Haushaltspolitik gemacht wird, dann schwächt das die dortigen Banken und führt dazu, dass Risiken entstehen. Deswegen, meine Damen und Herren, ist es wichtig, dass wir die Nationalstaaten bei der Rettung bzw. Abwicklung von Banken nicht komplett aus der Verantwortung entlassen.",data/txt/18003.txt,speech,cducsu
2772792,3,18,0,,,,1563,Beifall bei Abgeordneten der CDU/CSU,data/txt/18003.txt,poi,
2772793,3,18,0,Ralph Brinkhaus (CDU/CSU),Ralph Brinkhaus,ralph-brinkhaus,1564,"Sie haben behauptet, wir würden uns bei unserer Ablehnung eines europäischen Abwicklungsfonds hinter rechtlichen Begründungen verschanzen. Rechtlich, das hört sich für die Öffentlichkeit technisch an, so als ob jemand das Richtige wolle, ihm aber irgendwelche Leute mit rechtlichen Bedenken einen Strich durch die Rechnung machten. Fakt ist: Für einen gemeinsamen europäischen Abwicklungsfonds fehlt uns in den europäischen Verträgen momentan die Rechtsgrundlage. Jetzt kann man sagen: Das ist nicht schlimm; aber wir haben hier in Deutschland andere Erfahrungen gemacht. Wir haben einige Kollegen hier im Haus - es gibt da auch einige Professoren -, die alle Regelungen gerne daraufhin überprüfen, ob sie auch im Einklang mit dem Recht stehen. Sehen Sie es uns also bitte nach, dass wir beim Thema europäischer Abwicklungsfonds sehr vorsichtig sind und sagen: Solange wir dafür keine Rechtsgrundlage haben, brauchen wir ein System aus verschiedenen nationalen Fonds, die einander ergänzen.

Wir haben aber noch ein weiteres Problem mit dieser Bankenunion. Als diese Veranstaltung am 29. Juni 2012 zu Ende war, haben einige Staatschefs aus südeuropäischen Ländern und auch der von Irland gesagt: Prima, ich muss jetzt nur ganz schnell unterschreiben, dass ich mich einem Aufsichtsmechanismus unterwerfe, dann habe ich eine Restmülldeponie für alle meine mit den Banken verbundenen Probleme gefunden. Alles, was ich früher in die Bankenrefinanzierung gesteckt und wofür ich Schulden gemacht habe, kann ich jetzt dorthin verlagern. Dann habe ich genug frisches Geld zur Verfügung, um meine unterkapitalisierten Banken zu stärken, und dann habe ich gegebenenfalls auch Geld, um die Abwicklung von Banken zu organisieren.

Genau das wollen wir nicht. Wir wollen eine Bankenunion, die nach vorne gerichtet ist und in die saubere Banken aufgenommen werden. Deswegen ist es auch wichtig, dass jetzt der Belastungstest erfolgt, bevor wir damit starten. Das halte ich für gut und richtig.",data/txt/18003.txt,speech,cducsu
