id,sitzung,wahlperiode,in_writing,speaker,speaker_cleaned,speaker_fp,sequence,text,filename,type,speaker_party
2198407,3,18,0,,,,719,"Vizepräsident Peter Hintze:

Nächste Rednerin ist die Kollegin Agnieszka Brugger, Bündnis 90/Die Grünen. - Bitte schön.

Agnieszka Brugger (BÜNDNIS 90/DIE GRÜNEN):

Herr Präsident! Meine Damen und Herren! Eine große Chance mit Risiken und vor allem auch ein Erfolg der Diplomatie, allerdings mit offenem Ausgang - so lässt sich meiner Meinung nach das Übergangsabkommen, das die fünf Vetomächte der Vereinten Nationen und Deutschland mit dem Iran in Genf verhandelt haben, am besten beschreiben. Der Iran verpflichtet sich, Teile seines Atomprogramms auszusetzen und mehr Inspektionen seiner Anlagen zuzulassen. Im Gegenzug soll ein Teil der Sanktionen gelockert und sollen vorerst keine weiteren verhängt werden.

Gemischt und sehr unterschiedlich wurde dieses Abkommen anschließend bewertet. Ich stehe immer noch unter dem Eindruck, dass Sie sich, Herr Außenminister Westerwelle, so einig mit dem Kollegen van Aken sind. Ich finde, das ist ein ganz besonderer Moment, und das zeigt auch, dass es hier einen großen Zuspruch für dieses Verhandlungsergebnis gibt.",data/txt/18003.txt,speech,
2198408,3,18,0,,,,720,"Heiterkeit und Beifall bei Abgeordneten des BÜNDNISSES 90/DIE GRÜNEN, der SPD und der LINKEN",data/txt/18003.txt,poi,
2198409,3,18,0,,,,721,"Sie haben das Abkommen einen Wendepunkt genannt. US-Außenminister Kerry twitterte, es sei ein erster Schritt, die Welt sicherer zu machen. Der israelische Ministerpräsident Netanjahu hat das Abkommen hingegen deutlich kritisiert. Allerdings zeigt die Debatte in Israel nicht nur sehr nachvollziehbare Sorgen über das iranische Atomprogramm, sondern auch sehr unterschiedliche Ansichten und Bewertungen dieses Abkommens.

Nach Jahren der Eskalation und des eisigen Stillstands, nach Jahren der mehr als berechtigten Sorge, dass der Iran in Zukunft über Atomwaffen verfügen könnte, ist nun eine erste Vereinbarung getroffen worden, die allen Seiten, wie ich finde, durchaus große Zugeständnisse abverlangt. Das ist ein großer Erfolg.",data/txt/18003.txt,speech,
2198410,3,18,0,,,,722,Beifall beim BÜNDNIS 90/DIE GRÜNEN,data/txt/18003.txt,poi,
2198411,3,18,0,,,,723,"Ziel muss es jetzt sein, diesen Weg der Verhandlungen weiter zu beschreiten und die Vereinbarung zügig und schnell umzusetzen, um anschließend, nach den vereinbarten sechs Monaten, in denen Transparenz geschaffen und Vertrauen erworben werden muss, ein belastbares und verbindlicheres Abkommen zu erreichen. Wie diese sechs Monate genutzt werden und wie die Umsetzung dieser Vereinbarung ausfällt, wird dabei nicht nur für die Entwicklung der nächsten Wochen und Monate, sondern für Jahre ausschlaggebend sein.

Es liegt jetzt an der neuen Regierung in Teheran, der internationalen Gemeinschaft glaubhaft zu beweisen, dass sie ernsthaft an einer langfristigen und tragbaren Lösung des Atomkonflikts interessiert ist. Dazu muss der Iran nun schnell und transparent seine Vertrauenswürdigkeit unter Beweis stellen. Die Hochanreicherung von Uran auf 20 Prozent muss gestoppt und die bestehenden Vorräte müssen in höchstens 5-prozentig angereichertes Uran umgewandelt werden. Auch die Aktivitäten um den Schwerwasserreaktor Arak müssen gestoppt und die Kontrolle durch die Internationale Atomenergie-Organisation uneingeschränkt ermöglicht werden. Denn nur durch die zügige und anhaltende Umsetzung dieser Vereinbarung kann der Iran die bestehenden Zweifel, dass es sich um bloße Lippenbekenntnisse handeln könnte, langsam aus dem Weg räumen.

Ziel der auferlegten Sanktionen war es, den Iran an den Verhandlungstisch zu bringen. Das ist gelungen. Nun muss die internationale Gemeinschaft im Gegenzug aber auch bereit sein, die Sanktionen zu lockern, wenn die iranische Seite ihren Verpflichtungen nachkommt. Dabei sollten vor allem die Sanktionen im Fokus stehen, die die Zivilbevölkerung treffen. Absolut kontraproduktiv sind an dieser Stelle die Stimmen der Republikaner aus den USA, die in der aktuellen Situation eine Verschärfung der Sanktionen fordern. Das würde ein automatisches Ende dieses Erfolges, ein automatisches Ende der Verhandlungen und Gespräche bedeuten.

Meine Damen und Herren, wir sollten aber auch nicht in allzu große Euphorie verfallen. Denn es ist zu früh, von einer wirklichen Lösung des Atomkonflikts zu sprechen, weil in diesen sechs Monaten viel passieren kann, zum Guten, aber eben auch zum Schlechten. Trotz des berechtigten Aufatmens aufgrund dieser Einigung muss eines klar sein: Sie ist kein Anlass, die erschreckende Rhetorik des iranischen Regimes gegenüber Israel oder die nach wie vor krassen und eklatanten Menschenrechtsverletzungen im Iran oder die verheerende Rolle, die der Iran im blutigen Syrien-Konflikt spielt, auszublenden.

Es ist aber auch klar: Das Übergangsabkommen ist eben doch ein großer Erfolg der Diplomatie. Wer das bestreitet, muss sich klarmachen, dass die Alternativen, die auf dem Tisch lagen - mit dieser Formulierung wurde ja immer wieder über einen Militärschlag gesprochen -, in ihren Auswirkungen katastrophal gewesen wären. Auf der einen Seite hätte nicht toleriert werden können, dass der Iran sein Atomprogramm in vollem Umfang weiterbetreibt, während immer schärfere Sanktionen die Zivilbevölkerung treffen. Auf der anderen Seite hätte eine militärische Eskalation dieses Konflikts unberechenbare Folgen für eine Region gehabt, die ohnehin schon durch zahlreiche Krisen und Konflikte destabilisiert ist.

Die Einigung ist bei allen berechtigten Zweifeln und Unwägbarkeiten durchaus ein Anlass, Hoffnung zu fassen, dass vielleicht ein Anfang gemacht wurde, diesen Konflikt auf diplomatischem Wege zu bearbeiten und irgendwann vielleicht wirklich lösen zu können.

Wir sollten alles dafür tun, diesen Weg entschieden weiter zu beschreiten.",data/txt/18003.txt,speech,
2198412,3,18,0,,,,724,Beifall beim BÜNDNIS 90/DIE GRÜNEN sowie bei Abgeordneten der SPD und des Abg. Stefan Liebich (DIE LINKE,data/txt/18003.txt,poi,
2198413,3,18,0,,,,725,"Vizepräsident Peter Hintze:

Vielen Dank, Frau Kollegin. - Als Nächster hat der Kollege Dr. Andreas Schockenhoff von der CDU/CSU-Fraktion das Wort.",data/txt/18003.txt,speech,
2198414,3,18,0,,,,726,Beifall bei der CDU/CSU,data/txt/18003.txt,poi,
2198415,3,18,0,,,,727,"Dr. Andreas Schockenhoff (CDU/CSU):

Herr Präsident! Liebe Kolleginnen und Kollegen! Seit 2002, als bis dahin geheime iranische Nuklearanlagen und Beschaffungsaktivitäten aufgedeckt wurden, besteht der Verdacht, dass der Iran ein geheimes Atomwaffenprogramm betreibt. Noch hat der Iran wohl keine Atomwaffen, aber die IAEO zeigt sich in ihren Berichten seit fast zehn Jahren immer besorgter über den möglichen militärischen Charakter des iranischen Nuklearprogramms. Der UN-Sicherheitsrat hat Teheran in zahlreichen Resolutionen zur Klärung der offenen Fragen aufgefordert und seit 2006 mehrere Sanktionsresolutionen verabschiedet. Deutschland und die fünf ständigen Sicherheitsratsmitglieder setzen seit Jahren mit großer Geduld auf eine diplomatische Lösung des Konflikts. Der Iran hat aber bisher nur auf Zeit gespielt.

Die nun in Genf getroffene Vereinbarung bedeutet erstmals eine politische Einigung über erste Schritte zur Lösung des Konflikts. Das begrüßen wir außerordentlich. Der Verhandlungsansatz, der auf Kooperationsangebote und gezielte Sanktionen setzt, hat sich als richtig erwiesen und zu Bewegung in den zuvor festgefahrenen Verhandlungen geführt. Es hat sich auch als richtig erwiesen, alle Optionen auf dem Tisch zu belassen.

Der Iran hat einer langen Liste konkreter Forderungen zugestimmt. Sie sind, wie es die Frankfurter Allgemeine Zeitung richtig beschrieben hat, das größte Bremsmanöver , seit das iranische Atomprogramm den Kinderschuhen entwachsen ist. Das Sanktionsregime bleibt im Kern intakt, und Teheran hat unter den Bedingungen dieses Interimsabkommens nicht die Möglichkeit, heimlich die Entwicklung umfassender nuklearer Kapazitäten voranzutreiben. Teheran muss nun der IAEO den unbegrenzten Zugang zu den Nuklearanlagen ermöglichen. Aber der Außenminister hat zu Recht gesagt: Die Genfer Übergangslösung ist noch kein Endzustand.

Der Iran ist jetzt aufgefordert, nicht nur die Auflagen von Genf zu erfüllen, sondern auch die nächsten Monate zu nutzen, um eine substanzielle Lösung des Gesamtkonfliktes zu ermöglichen. Der Iran muss, gemäß den Forderungen aus verschiedenen UN-Resolutionen, endlich den ausschließlich friedlichen Charakter seines Nuklearprogramms nachprüfbar unter Beweis stellen.

Wir nehmen die israelischen Besorgnisse hinsichtlich dieser ersten Vereinbarung, aber auch die der unmittelbaren Nachbarn des Iran sehr ernst. Israel kann die Gefahr seiner möglichen nuklearen Vernichtung durch den Iran nicht ignorieren. Auch die neue Koalition bekennt sich zu unserer besonderen Verantwortung gegenüber Israel. Das Existenzrecht und die Sicherheit Israels sind für uns nicht verhandelbar.",data/txt/18003.txt,speech,
2198416,3,18,0,,,,728,Beifall bei der CDU/CSU sowie bei Abgeordneten der SPD und des BÜNDNISSES 90/DIE GRÜNEN,data/txt/18003.txt,poi,
2198417,3,18,0,,,,729,"Denn, liebe Kolleginnen und Kollegen, es bleibt dabei: Ein nuklear bewaffneter Iran wäre eine Gefahr für die gesamte Region und darüber hinaus. Den weltweiten Bemühungen um Abrüstung und Nonproliferation würde ein schwerer Schaden zugefügt. Ein nukleares Wettrüsten wäre die Folge: Saudi-Arabien, Ägypten und auch die Türkei haben schon erkennen lassen, dass sie sich bei einer atomaren Bewaffnung des Iran zum nuklearen Nachrüsten gezwungen sähen.

Niemand spricht dem Iran das Recht auf die zivile Nutzung der Atomenergie ab. Der Iran hat aber nach seinen Verpflichtungen aus dem Nichtverbreitungsvertrag kein Recht auf eine nukleare Bewaffnung. Eine iranische Atombombe würde eine erhebliche Gefährdung des Weltfriedens bedeuten und auch uns bedrohen. Schon jetzt verfügt Teheran über Langstreckenraketen, die Europa erreichen können. Wir müssen deshalb auch in Zukunft verhindern, dass der Iran die Fähigkeit hat, Atomwaffen herzustellen. Bis dahin halten wir - auch die neue Koalition - an unserem doppelten Ansatz fest: Verhandlungen und Sanktionsdruck. Herr Präsident, liebe Kolleginnen und Kollegen, Außenminister Westerwelle hat sich in den vergangenen vier Jahren mit Verve für eine diplomatische Lösung des Konfliktes eingesetzt. Herr Minister, die Vereinbarung von Genf ist auch Ihr Erfolg. Dafür, für Ihren Dienst für unser Land und für die stets gute und kollegiale Zusammenarbeit möchte ich Ihnen im Namen der CDU/CSU-Fraktion unseren ganz besonderen Dank aussprechen.",data/txt/18003.txt,speech,
2198418,3,18,0,,,,730,Beifall bei der CDU/CSU sowie bei Abgeordneten der SPD und des BÜNDNISSES 90/DIE GRÜNEN,data/txt/18003.txt,poi,
2198419,3,18,0,,,,731,"Vizepräsident Johannes Singhammer:

Nächster Redner ist der Kollege Thomas Silberhorn von der CDU/CSU.",data/txt/18003.txt,speech,
2198420,3,18,0,,,,732,Beifall bei der CDU/CSU,data/txt/18003.txt,poi,
2198421,3,18,0,,,,733,"Thomas Silberhorn (CDU/CSU):

Herr Präsident! Liebe Kolleginnen und Kollegen! Das Interimsabkommen mit dem Iran bringt Bewegung in den Atomstreit: zum ersten Mal seit 2004 mit einem substanziellen Fortschritt. Das ist nicht nur ein erfolgreicher Zwischenschritt für alle Beteiligten, es ist insbesondere auch ein Verhandlungserfolg der Europäischen Union à la bonne heure.

So stelle ich mir europäische Integration vor: dass wir in den wichtigen Fragen erfolgreich sind. Wenn wir den Menschen erklären wollen, warum europäische Integration wichtig ist, dann ist es notwendig, dass die Europäische Union die wichtigen Dinge anpackt und löst und uns nicht mit Belanglosigkeiten behelligt. Das ist ein gutes Beispiel für Integration.

Ich will hinzufügen, dass sich auch das Format, in dem verhandelt worden ist, bewährt hat und entwicklungsfähig ist. Ich weiß nicht, wie viele Koalitionsverträge es in den letzten Jahren gegeben hat, in denen steht, dass wir einen europäischen Sitz im Sicherheitsrat der Vereinten Nationen anstreben und auch als Deutsche bereit sind, enger mitzuarbeiten. Dieses Format der fünf ständigen Mitglieder des Sicherheitsrates plus Deutschland wird den Gegebenheiten in besonderem Maße gerecht, und weil es sich hier bewährt hat, glaube ich, dass es ein Format ist, das sich ausbauen lässt.

Meine Damen und Herren, dieses Interimsabkommen ist eine Chance für die internationale Gemeinschaft genauso wie für den Iran. Wir wissen nicht, wann der Iran die Schwelle zur Atomwaffenfähigkeit überschritten hätte. Aber es hätte in einem Zeitraum von sechs Monaten, auf den dieses Interimsabkommen ausgelegt ist, durchaus der Fall sein können. Dann wären wir vor einer völlig veränderten Situation gestanden. Jetzt haben wir zumindest eine Atempause.

Das Interimsabkommen ist auch eine Chance für den Iran, jetzt einen Kurswechsel vorzunehmen, wenngleich klar ist: Es ist ein erster Schritt, und der Weg zu einer dauerhaften Lösung ist noch weit. Darüber sind sich die Verhandlungsparteien übrigens völlig im Klaren gewesen; denn in dem Text ist noch nicht einmal von einem ersten Schritt die Rede, sondern von Elementen eines ersten Schrittes. Das zeigt, dass man sich völlig im Klaren darüber ist, was noch zu tun ist.

Eine Lehre kann man aus dem bisherigen Verhandlungsprozess ziehen: Die Sanktionen der internationalen Gemeinschaft haben gewirkt. Die Sanktionen sind ein wirksames Instrument, wenn sie entschlossen von allen durchgesetzt werden. Auch das ist eine wichtige Botschaft an alle ständigen Mitglieder des Sicherheitsrates. Dieses Instrument hat seine Wirkung gezeigt. Wenn nun einzelne Sanktionen suspendiert werden und wenn eingefrorene Gelder durch die USA ausgezahlt werden, dann ist es wichtig, darauf hinzuweisen, dass diese Leistungen nur Zug um Zug gegen die Umsetzung dieses Interimsabkommens erfolgen können.

Es muss klar sein, dass Sanktionen sofort wieder verschärft werden müssen, wenn die Umsetzung dieses Abkommens nicht vorankommt. Deswegen ist es notwendig, dass diese Inspektionen täglich durchgeführt werden. Dass überhaupt umfassende Inspektionen vereinbart worden sind, ist ein wichtiger Verhandlungsfortschritt; denn anderenfalls hätte man gar nicht feststellen können, wann der Iran die Schwelle zur Atomwaffenfähigkeit überschreitet.

Die internationale Gemeinschaft hat gleichwohl erhebliche Vorleistungen erbracht. Ich darf daran erinnern, dass noch im Jahr 2004 selbst die Uranumwandlung verboten worden war. Jetzt ist auch eine - zeitlich nachgelagerte - Anreicherung bis zu 5 Prozent zulässig, aber immerhin gibt es die klare Verpflichtung, dass über 5 Prozent angereichertes Uran zu verflüssigen oder zu oxidieren ist. Dieser Abbau der Vorräte bedeutet, dass das Interimsabkommen mehr ist als eine bloße Stillstandsverpflichtung. Es kann eine Vertrauensbasis für eine dauerhafte Lösung bieten, wenngleich man natürlich feststellen muss, dass grundsätzlich alle Schritte reversibel sein können. Wir können nicht ausschließen, dass sich der Iran wieder anders entscheidet, aber wir können darauf hinwirken, dass die Sanktionen in einem solchen Fall sofort wieder verschärft werden.

Ich kann insofern die Skepsis mancher Beteiligter und mancher Dritter nachvollziehen. Dieses Abkommen bietet aber dennoch Anlass zu verhaltenem Optimismus. Es kann Vertrauen wachsen, wenn dieses Interimsabkommen jetzt umgesetzt wird und wenn die Verhandlungen für eine dauerhafte Lösung zügig fortgesetzt werden. Dabei werden die Fragen zum Schwerwasserreaktor in Arak ebenso wie mögliche militärische Testversuche in Parchin Gegenstand der Verhandlungen sein müssen.

Wir müssen - damit will ich schließen - die Bedenken Israels gleichwohl ernst nehmen. Ich teile nicht die Bewertung, dass dieses Zwischenabkommen ein historischer Fehler ist. Aber der Iran hat die Weltöffentlichkeit nun einmal oft genug enttäuscht. Deswegen ist es jetzt Sache des Iran, den Nachweis zu erbringen, dass hier kein taktischer Zeitgewinn erzielt worden ist, sondern es um eine ernsthafte Lösung dieses Problems geht. Immerhin bietet dieses Interimsabkommen die Chance, die Verschwörungstheoretiker zu widerlegen, die glauben machen wollen, dass alle es darauf angelegt haben, den Iran zu isolieren.

Es gibt eine Lösung. Es gibt keinen Konflikt, der hoffungslos und ohne Lösung wäre. Deswegen müssen wir die iranische Öffentlichkeit, insbesondere die junge Generation dieses Landes einbeziehen. Sie muss eine Perspektive erhalten. Wir müssen auf wirtschaftliche Entspannung achten und es der iranischen Führung ermöglichen, sichtbare Ergebnisse vorzuweisen und zu zeigen, dass sie es besser macht als die Vorgängerregierung in diesem Land.

Vielen Dank.",data/txt/18003.txt,speech,
2198422,3,18,0,,,,734,Beifall bei der CDU/CSU,data/txt/18003.txt,poi,
2198423,3,18,0,,,,735,"Vizepräsident Johannes Singhammer:

Nach diesem Beitrag vom Kollegen Silberhorn schließe ich die Aussprache.

Ich rufe den Tagesordnungspunkt 7 auf:

Beratung des Antrags der Bundesregierung

Fortsetzung der Beteiligung bewaffneter deutscher Streitkräfte an der AU/UN-Hybrid-Operation in Darfur (UNAMID) auf Grundlage der Resolution 1769 (2007) des Sicherheitsrates der Vereinten Nationen vom 31. Juli 2007 und folgender Resolutionen, zuletzt 2113 (2013) vom 30. Juli 2013

- Drucksache 18/72 -

Ich weise darauf hin, dass wir später über diesen Antrag namentlich abstimmen werden.

Nach einer interfraktionellen Vereinbarung sind für die Aussprache 38 Minuten vorgesehen. - Ich höre keinen Widerspruch. Dann ist das so beschlossen.

Ich eröffne die Aussprache. Erster Redner ist Kollege Philipp Mißfelder, CDU/CSU.",data/txt/18003.txt,speech,
2198424,3,18,0,,,,736,Beifall bei der CDU/CSU,data/txt/18003.txt,poi,
2198425,3,18,0,,,,737,"Philipp Mißfelder (CDU/CSU):

Herr Präsident! Eigentlich wollte auch ich dem Bundesaußenminister danken, aber er ist leider nicht mehr anwesend. Der Kollege Schockenhoff hat ihm ja schon ausführlich gedankt. Im Namen der Arbeitsgruppe Auswärtiges der CDU/CSU-Fraktion möchte ich dem Bundesaußenminister aber dennoch dafür danken, dass er während seines vierjährigen Wirkens Deutschland als Friedensmacht positioniert hat. Ich möchte ihm für sein Engagement in diesem Bereich danken. Auch im Namen von Andreas Schockenhoff möchte ich das für unsere Fraktion betonen. Dieses Lob kann man ihm ja vielleicht überbringen.

Meine Damen und Herren, wir beraten jetzt über ein Mandat - das ist ähnlich wie heute Vormittag bei der Debatte über den Einsatz im Südsudan -, das wenig Aufmerksamkeit findet, aber einen sehr ernsten Hintergrund hat. Wir sehen, dass die Lage im Sudan insgesamt nicht stabil ist. Trotz der Bemühungen des Internationalen Strafgerichtshofs in Den Haag stehen wir einer sehr großen Herausforderung gegenüber. Bei dem Machthaber im Sudan handelt es sich um jemanden, der des Völkermords angeklagt ist und mit internationalem Haftbefehl gesucht wird. Allein die Tatsache, dass das Töten im Land weitergeht, sollte uns besorgen. Nach Angaben der sudanesischen Ärztevereinigung haben die Sicherheitskräfte im September und Anfang Oktober mehr als 200 Menschen getötet. Insgesamt 800 Menschen sollen verhaftet worden sein.

Zum Hintergrund: Es wird zum Teil von einer Arabellion gesprochen, also von einem Vorgang, der mit dem arabischen Frühling vergleichbar ist. Allerdings sind die Hintergründe in diesem vom Krieg zerriebenen Land natürlich ganz anders als in Nordafrika, weswegen man diesen Vergleich nicht so einfach führen kann. Es wird dort mit großer Brutalität vorgegangen. Seitens offizieller Stellen gibt es nahezu täglich Meldungen, die uns zeigen, dass die Menschenrechte nicht ernst genommen werden und man auch nicht an einer friedlichen Kooperation mit der Opposition interessiert ist.

Der Informationsminister des Landes hat zum Beispiel vor ein paar Tagen zur Kenntnis gegeben, dass die Bilder, die uns aus dem Sudan erreicht haben, eigentlich aus Ägypten stammen würden und dass die Bilder von Opfern Fälschungen seien. Allein das zeigt, dass die Regierung im Land selbst nicht in der Lage ist, auf diplomatische Art und Weise mit uns umzugehen, sondern dass hier gelogen wird und dass die Öffentlichkeit getäuscht wird, um das Töten im eigenen Land zu vertuschen.

Die wirtschaftliche Situation ist spektakulär negativ. Der Staat hat kein Geld, die Inflation ist hoch, und die Armee, deren Angehörige immer unzufriedener werden, verschlingt enorm viel Geld. In Ländern, die sich in einem Konflikt befinden, ist es häufig so, dass sich die Armee einen Großteil der Ressourcen des Landes einverleibt.

Nach der Unabhängigkeit des Südsudan, über den wir heute Vormittag diskutiert haben, hat sich die Situation verschärft. Im Grunde müssten beide Länder kooperieren; denn der Süden hat das Öl, und der Norden hat die Pipelines und die Durchleitungswege. Trotzdem ist es nicht möglich, ein vernünftiges Verhältnis auszubalancieren, bei dem beide Länder von den wirtschaftlichen Vorteilen des Ölexports profitieren.

Vorhin in der Diskussion ist schon über den wachsenden Einfluss Chinas gesprochen worden. Auch an dieser Stelle möchte ich darauf hinweisen, dass natürlich andere aufstrebende Mächte in der Region präsent sind und an der Lösung dieser Konflikte nicht immer unbedingt konstruktiv mitwirken. Umso mehr befürworte ich unseren militärischen Beitrag, den wir an dieser Stelle leisten. Ich möchte auch darauf hinweisen, dass er sich breit einbettet in ein ziviles Engagement, das wir massiv vorantreiben.

Die humanitäre Lage ist aber trotz des zivilen Engagements dermaßen schlecht, dass eine militärische Präsenz vonnöten ist. Unkontrollierte Waffenströme sorgen für einen permanenten Nachschub für alle Milizen, für alle Regierungstruppen, die dort aktiv sind.",data/txt/18003.txt,speech,
2198426,3,18,0,,,,738,Zuruf der Abg. Christine Buchholz [DIE LINKE],data/txt/18003.txt,poi,
2198427,3,18,0,,,,739,"- Schön, dass Sie es reinrufen. - Deshalb bin ich froh, dass wir hinsichtlich der Waffenexporte eine tragfähige Lösung gefunden haben. Ich glaube, dass der Deutsche Bundestag gut daran tut, die Waffenexporte, die aus unserem Land herausgehen, stärker im Blick zu haben. Das stellen wir mit der Koalitionsvereinbarung, die wir jetzt auf den Weg bringen, sicher.",data/txt/18003.txt,speech,
2198428,3,18,0,,,,740,Beifall bei der CDU/CSU,data/txt/18003.txt,poi,
2198429,3,18,0,Kathrin Vogler [DIE LINKE],Kathrin Vogler [DIE LINKE],kathrin-vogler-die-linke,741,Legendenbildung schon vor der Unterschrift!,data/txt/18003.txt,poi,linke
2198430,3,18,0,,,,742,"Ich möchte der Bundeswehr danken, die in dieser schwierigen Mission einen wichtigen Beitrag leistet. Die Situation dort ist nicht ungefährlich. Wir sind mit einer geringen Zahl Soldaten dort im Einsatz. Die maximale Obergrenze des Mandats beträgt 50 Personen. Aktuell sind neun Deutsche im Hauptquartier von UNAMID eingesetzt. Wir haben vor ein paar Wochen erlebt, dass nigerianische Soldaten, die zur internationalen Schutztruppe gehören, getötet wurden. Allein dieser spektakuläre Angriff auf vier Soldaten aus Nigeria zeigt, dass die Situation keineswegs harmlos ist, sondern brandgefährlich.

Viele Leute vergessen, dass seit 2003 nach UNO-Schätzung insgesamt 300 000 Menschen getötet worden sind. Es handelt sich also um eine große Katastrophe. Deshalb werbe ich dafür, dass wir unsere Bemühungen, unter anderem zur Setzung von internationalen Normen im Rahmen des Internationalen Strafgerichtshofs, vorantreiben. Zur Durchsetzung des internationalen Rechts müssen wir diese UNO-Mission notwendigerweise unterstützen. Ich bitte Sie daher im Namen meiner Fraktion um Zustimmung.

Herzlichen Dank.",data/txt/18003.txt,speech,
2198431,3,18,0,,,,743,Beifall bei der CDU/CSU sowie bei Abgeordneten der SPD,data/txt/18003.txt,poi,
2198432,3,18,0,,,,744,"Vizepräsident Johannes Singhammer:

Nächster Redner ist der Kollege Rainer Arnold, SPD.",data/txt/18003.txt,speech,
2198433,3,18,0,,,,745,Beifall bei der SPD,data/txt/18003.txt,poi,
2198434,3,18,0,,,,746,"Rainer Arnold (SPD):

Herr Präsident! Liebe Kolleginnen und Kollegen! Wir diskutieren jedes Jahr über die Verlängerung des Mandates, und manche fragen sich: Wir haben 10, 11, in der Spitze 13 Soldaten dort gehabt, muss das wirklich sein?",data/txt/18003.txt,speech,
2198435,3,18,0,Claudia Roth [Augsburg] [BÜNDNIS 90/DIE GRÜNEN],Claudia Roth [Augsburg] [BÜNDNIS 90/DIE GRÜNEN],claudia-roth-augsburg-bundnis-90-die-grunen,747,Ja!,data/txt/18003.txt,poi,gruene
