id,sitzung,wahlperiode,in_writing,speaker,speaker_cleaned,speaker_fp,sequence,text,filename,type,speaker_party
2795942,22,18,0,"Gabriele Lösekrug-Möller, Parl. Staatssekretärin bei der Bundesministerin für Arbeit und Soziales",Gabriele Lösekrug-Möller,gabriele-losekrug-moller,194,"Sehr gerne. - Das ist jetzt ein anderer Themenschwerpunkt.

Verehrte Kollegin Pothmer, ich beantworte Ihre Frage wie folgt: Die Zahl der schwerbehinderten Arbeitslosen hat von 2010 auf 2013 um rund 2 Prozent auf etwa 178 600 zugenommen, während die Arbeitslosigkeit insgesamt in diesem Zeitraum um 9 Prozent gesunken ist. Der Anteil der schwerbehinderten akademisch ausgebildeten Arbeitslosen an allen akademisch ausgebildeten Arbeitslosen hat sich von 3,5 Prozent auf 3,9 Prozent erhöht.

Da die Darlegung der Entwicklung der Zahlen schwerbehinderter Arbeitsloser und schwerbehinderter arbeitsloser Akademikerinnen und Akademiker seit 2010 im Vergleich zum allgemeinen Trend auf dem Arbeitsmarkt für jedes Jahr getrennt nach Rechtskreisen - so haben Sie Ihre Frage ja auch formuliert - den hier zur Verfügung stehenden Zeitrahmen sprengen würde, möchte ich Ihnen gern die entsprechende von der Bundesagentur für Arbeit erstellte Tabelle zusenden. Ich habe sie dabei. Sie ist sehr schwer vorzulesen, schon gar nicht in der mir zustehenden Zeit. Frau Präsidentin, Ihre Vorgängerin in der Sitzungsleitung hatte mich da ganz hart ermahnt.

Die Entwicklung der Arbeitslosigkeit schwerbehinderter Menschen ist stark von statistischen Effekten geprägt. Nachdem Ende 2007 Regelungen zum erleichterten Leistungsbezug für die Altersgruppe „58 Jahre und älter“ ausliefen, ist die Zahl arbeitsloser schwerbehinderter Menschen in dieser Altersgruppe erheblich gestiegen. Nach Angaben der Bundesagentur für Arbeit stieg ihre Zahl von rund 9 300 im Jahr 2008 auf rund 45 400 im Dezember 2013. Damit lag der Anteil dieser Altersgruppe an allen arbeitslos gemeldeten schwerbehinderten Menschen Ende 2013 bei rund 26 Prozent. Bei arbeitslosen schwerbehinderten Akademikerinnen und Akademikern war der Anteil mit rund 37 Prozent sogar deutlich höher.

Zwar haben Lebensältere ein geringeres Risiko als Jüngere, arbeitslos zu werden, zugleich aber - das wissen wir aus dem allgemeinen Arbeitsmarkt - schlechtere Chancen, die Arbeitslosigkeit durch Aufnahme einer Beschäftigung wieder zu beenden.

Bei der Kombination „Schwerbehinderung und höheres Lebensalter“ gestaltet sich eine Beschäftigungsaufnahme zum Teil noch schwieriger. Gerade diese Kombination ist aber für die Arbeitslosigkeit schwerbehinderter Menschen prägend.

Oftmals ist auch aufgrund von Vorbehalten und fehlenden Erfahrungen im Umgang mit behinderten Menschen ein zurückhaltendes Einstellungsverhalten bei Arbeitgebern festzustellen. Hier besteht aus Sicht der Bundesregierung nach wie vor großer Handlungsbedarf. Aufklärung oder, wie es die UN-Behindertenrechtskonvention bezeichnet, Bewusstseinsbildung sind wichtige Voraussetzungen, um Vorbehalte abzubauen und mehr Beschäftigung schwerbehinderter Menschen zu realisieren. Auch das ist ein zentrales Ziel der vom Bundesministerium für Arbeit und Soziales im Oktober 2013 zusammen mit den maßgeblichen Arbeitsmarktpartnern gestalteten Inklusionsinitiative für Ausbildung und Beschäftigung.",data/txt/18022.txt,speech,
2795943,22,18,0,Vizepräsidentin Petra Pau,Petra Pau,petra-pau,195,"Ich vermag mir gar nicht auszumalen, was es noch an Zeit gekostet hätte, wenn Sie die Tabelle mit vorgetragen hätten.",data/txt/18022.txt,chair,
2795944,22,18,0,,,,196,Heiterkeit,data/txt/18022.txt,poi,
2795945,22,18,0,Vizepräsidentin Petra Pau,Petra Pau,petra-pau,197,"Frau Pothmer, Sie haben das Wort zur ersten Nachfrage.",data/txt/18022.txt,chair,
2795946,22,18,0,Brigitte Pothmer (BÜNDNIS 90/DIE GRÜNEN),Brigitte Pothmer,brigitte-pothmer,198,"Frau Staatssekretärin, zunächst einmal herzlichen Dank für Ihre Rücksichtnahme auf das Publikum, aber auch auf Sie selbst. Ich begrüße das.

Auch wenn Sie nicht alle Zahlen en détail vorgetragen haben, ist deutlich geworden, dass der Rückgang der Arbeitslosigkeit im Allgemeinen und der Anstieg der Arbeitslosigkeit im Besonderen bei behinderten Akademikerinnen und Akademikern wie eine Schere auseinandergehen. Als einen Grund haben Sie statistische Effekte genannt, zum Beispiel die 58er-Regelung. Diese Regelung betrifft nun nicht nur Menschen mit Behinderung, sondern alle arbeitslosen Menschen. Sie kann also keine Erklärung dafür sein; es können also nicht nur statistische Effekte sein, die dieses Auseinandergehen verursacht haben. Insofern noch einmal die Frage: Können Sie die Gründe, warum die Schere so exorbitant auseinandergeht, deutlicher erläutern?",data/txt/18022.txt,speech,gruene
2795947,22,18,0,"Gabriele Lösekrug-Möller, Parl. Staatssekretärin bei der Bundesministerin für Arbeit und Soziales",Gabriele Lösekrug-Möller,gabriele-losekrug-moller,199,"Frau Kollegin Pothmer, das tue ich gerne. Ich glaube, dieser Effekt ist allerdings nicht unerheblich; von daher möchte ich noch einmal auf ihn verweisen. Ich will gerne schauen, ob wir Ihnen genauere Zahlen dazu liefern können. Von diesem Effekt sind meines Erachtens die Menschen mit Behinderung überproportional betroffen.

Es ist so - ich will mich gerne wiederholen -, dass wir einen dringenden Handlungsauftrag sehen, zumal immer mehr Jahrgänge hochqualifizierter Menschen mit Behinderung auf den Arbeitsmarkt kommen. Deshalb ist es erklärtes Ziel der Bundesregierung, genau hier initiativ zu werden.

Ich habe beschrieben, dass wir es besonders wichtig finden, den Vorbehalten entgegenzutreten, die diese Personengruppe in keiner Weise verdient; vielmehr sollten wir ermunternd und unterstützend darauf hinwirken, dass diese Menschen einen Platz im ersten Arbeitsmarkt finden.",data/txt/18022.txt,speech,
2795948,22,18,0,Vizepräsidentin Petra Pau,Petra Pau,petra-pau,200,"Frau Pothmer, Sie haben das Wort zu einer zweiten Nachfrage.",data/txt/18022.txt,chair,
2795949,22,18,0,Brigitte Pothmer (BÜNDNIS 90/DIE GRÜNEN),Brigitte Pothmer,brigitte-pothmer,201,"Nehmen Sie mir es nicht übel, Frau Staatssekretärin: Angesichts der Dramatik, die sich in diesen Zahlen zeigt, scheint mir das Vorhaben, für mehr Aufklärung zu sorgen, dem Problem wohl nicht ganz angemessen. Es gibt ja eine ganze Reihe von Vorschlägen, auch aus den Behindertenverbänden. Darin wird zum Beispiel deutlich hervorgehoben, dass sich die Bundesagentur für Arbeit in Bezug auf die Beratung von behinderten Menschen sehr stark auf die Akquirierung von Arbeitsplätzen und nur noch sehr wenig auf die Betreuung von behinderten Menschen konzentriert. Das hat sehr viel damit zu tun, dass für die Statistik der Bundesagentur für Arbeit zählt, wenn ein Arbeitsloser einen Arbeitsplatz erhalten hat. Berücksichtigt wird dabei überhaupt nicht mehr die Frage, wie lange die jeweilige Person ihren Arbeitsplatz behalten konnte.

Menschen mit Behinderung brauchen nicht nur einen Arbeitsplatz. Wenn sie einen Arbeitsplatz bekommen haben, brauchen sie darüber hinaus Unterstützung und Begleitung. Von Behindertenverbänden wird kontinuierlich angemahnt, dass das nicht der Fall ist. Haben Sie vor, da etwas zu verändern?",data/txt/18022.txt,speech,gruene
2795950,22,18,0,"Gabriele Lösekrug-Möller, Parl. Staatssekretärin bei der Bundesministerin für Arbeit und Soziales",Gabriele Lösekrug-Möller,gabriele-losekrug-moller,202,"Frau Kollegin Pothmer, auch mir ist bekannt, dass Behindertenverbände darauf hinweisen. Ich will gerne aufgreifen, dass wir das auch mit der Bundesagentur für Arbeit erörtern. Ich teile aber nicht automatisch Ihre Einschätzung, dass es da sozusagen einen Mangel an Engagement gibt. Das will ich hier ganz deutlich sagen. Ich will aber der festen Meinung Ausdruck verleihen, dass die Bundesregierung wirklich bereit ist, sich genau um diese Personengruppe zu kümmern und da viel zu tun. Insofern danke ich für Ihre Frage.

Sie zielte im Übrigen - wenn ich das noch ergänzen darf; die Zeit reicht dafür ja auch noch - im Grunde genommen schon auf die nächste Frage, die ich gleich zu beantworten gedenke.",data/txt/18022.txt,speech,
2795951,22,18,0,Vizepräsidentin Petra Pau,Petra Pau,petra-pau,203,Zuerst hat aber die Kollegin Rüffer eine Nachfrage.,data/txt/18022.txt,chair,
2795952,22,18,0,Corinna Rüffer (BÜNDNIS 90/DIE GRÜNEN),Corinna Rüffer,corinna-ruffer,204,"Ich kann an die Frage von Frau Pothmer anschließen; das passt dazu. - Sie haben in Ihrem Koalitionsvertrag festgelegt, dass die Qualifizierung von Mitarbeitern im Jobcenter sozusagen als Problemfeld gesehen wird. Meine Frage ist mit Blick auf die Beratung von Menschen mit Behinderung und speziell mit Blick auf die Beratung des in der Frage benannten Personenkreises: Wann können wir mit einer Lösung rechnen und in welchem Umfang?",data/txt/18022.txt,speech,gruene
2795953,22,18,0,"Gabriele Lösekrug-Möller, Parl. Staatssekretärin bei der Bundesministerin für Arbeit und Soziales",Gabriele Lösekrug-Möller,gabriele-losekrug-moller,205,"Ich antworte gern, liebe Kollegin Rüffer. - Grundsätzlich sind wir daran interessiert, dass Mitarbeiter und Mitarbeiterinnen auf dem bestmöglichen Qualifikationsstand sind. Das ist eine Daueraufgabe. Wir haben dies noch einmal besonders hervorgehoben - Sie haben das zu Recht zitiert und richtig zitiert -, weil wir wissen, dass eine maximale Qualifizierung auch zu hohen Arbeitserfolgen in der Vermittlung führt. Das gilt übrigens nicht nur für die Zielgruppe, über die wir gerade sprechen, sondern das gilt grundsätzlich.

Wenn Sie danach fragen, wann wir dazu Ergebnisse haben werden, will ich Ihnen sagen: Wir sehen das im Mittelpunkt der Aufgaben der nächsten Zeit. Sobald wir Ergebnisse haben, werden wir das Plenum, aber ganz sicher den Fachausschuss Arbeit und Soziales unterrichten.",data/txt/18022.txt,speech,
2795954,22,18,0,Vizepräsidentin Petra Pau,Petra Pau,petra-pau,206,"Herzlichen Dank, Frau Staatssekretärin.

Kollegin Rüffer, als Hinweis für die Zukunft: Wir bleiben im Allgemeinen stehen, wenn wir bei der Beantwortung von Fragen im Gespräch mit Personen auf der Regierungsbank sind.

Ich rufe die Frage 42 der Kollegin Pothmer auf:

Welche Schlüsse zieht die Bundesregierung aus der Einschätzung des Deutschen Vereins der Blinden und Sehbehinderten in Studium und Beruf e. V., DVBS, hinsichtlich des Reformbedarfs bei der Arbeitsvermittlung schwerbehinderter Menschen und hinsichtlich der Rolle der Vermittlungsstelle für besonders betroffene schwerbehinderte Akademikerinnen und Akademiker in der Zentralen Auslands- und Fachvermittlung, wie Dr. Heinz Willi Bach sie in seinem Beitrag in der Zeitschrift horus (Ausgabe 1/2014) darlegt (www.dvbs-on line.de/horus/2014-1-5347.htm), und welche konkreten Maßnahmen plant die Bundesregierung zur Verbesserung der Vermittlung schwerbehinderter Arbeitsloser und schwerbehinderter arbeitsloser Akademikerinnen und Akademiker?

Bitte, Frau Staatssekretärin.",data/txt/18022.txt,chair,
2795955,22,18,0,"Gabriele Lösekrug-Möller, Parl. Staatssekretärin bei der Bundesministerin für Arbeit und Soziales",Gabriele Lösekrug-Möller,gabriele-losekrug-moller,207,"Frau Präsidentin! Liebe Frau Pothmer, die Bundesregierung sieht keinen Reformbedarf hinsichtlich der Rolle des Arbeitgeberservice für schwerbehinderte Akademiker der Zentralen Auslands- und Fachvermittlung der Bundesagentur für Arbeit; abgekürzt heißt die AG: SBZAV. Ich glaube, es ist besser, das auszusprechen.

Der Arbeitgeberservice für schwerbehinderte Akademiker ist eine konsequente Weiterentwicklung der üblichen Praxis, arbeitgeber- und arbeitnehmerbezogene Prozesse strikt zu trennen. Die Weiterentwicklung ist angezeigt, um für diese Zielgruppe überregional zusätzliche Arbeitsmöglichkeiten, insbesondere im öffentlichen Sektor, zu erschließen.

Der Arbeitgeberservice führt seine Vermittlungsaktivitäten einerseits bewerberorientiert durch. Das heißt, es werden, vom Kunden, also vom Arbeitnehmer, ausgehend, Beschäftigungsmöglichkeiten gesucht. Dies erfolgt auf Basis vorhandener Stellenangebote. Es werden andererseits Arbeitgeber initiativ angesprochen, um geeignete Stellen zu akquirieren. Auf dieser Grundlage werden Informationsveranstaltungen oder Gruppenberatungen für schwerbehinderte Akademiker und Akademikerinnen sowie Stellen-Matchings organisiert, um so direkt für Bewerberinnen und Bewerber aktiv zu werden. Bezogen auf die Vermittlung wird der Arbeitgeberservice also für beide Marktseiten tätig. Das ist die Besonderheit, die wir hier vorfinden.

Der Service ist ausschließlich auf Personen ausgerichtet, die nach Art oder Schwere ihrer Behinderung im Arbeitsleben besonders betroffen sind. Konkret handelt es sich um den Personenkreis besonders betroffener schwerbehinderter Akademikerinnen und Akademiker im Sinne des § 72 Abs. 1 Nr. 1 Neuntes Buch Sozialgesetzbuch.

Darüber hinaus wird der Arbeitgeberservice aufgrund eines Vermittlungsauftrags der Agenturen für Arbeit und der Jobcenter tätig. Das heißt, Arbeitsagenturen oder Jobcenter entscheiden einzelfallbezogen über seine Einschaltung.

Der vom Deutschen Verein der Blinden und Sehbehinderten in Studium und Beruf hergestellte Zusammenhang, die Arbeitslosigkeit schwerbehinderter Menschen sei wegen eines Konstruktionsfehlers des Arbeitgeberservice angestiegen, lässt sich vor diesem Hintergrund nicht herstellen. Die Bundesagentur für Arbeit erbringt ihre Dienstleistungen - Beratung, Vermittlung, Förderung - auch für schwerbehinderte Arbeitslose sowie für schwerbehinderte arbeitslose Akademikerinnen und Akademiker auf Grundlage des Zweiten, Dritten und Neunten Buchs Sozialgesetzbuch. Dabei haben Arbeitsagenturen und Jobcenter umfangreiche Fördermöglichkeiten.

Darüber hinaus hat das Bundesministerium Programme initiiert, die die Teilhabe schwerbehinderter Menschen am Arbeitsleben verbessern sollen. Über die „Initiative Inklusion“ habe ich ja bereits heute Auskunft gegeben. Sie wird in Verantwortung der Länder durchgeführt und umfasst - ich will noch eine Zahl nachschieben - ein Mittelvolumen von 140 Millionen Euro, finanziert - wir sprachen auch darüber - aus der Ausgleichsabgabe.

Wir haben Ende 2013 ein neues Programm zur intensivierten Eingliederung und Beratung mit einer Laufzeit von 2014 bis 2016 aufgelegt; es wird mit 50 Millionen, auch aus Mitteln des Ausgleichsfonds, finanziert. Damit sollen Konzepte gefördert werden, die bereits bestehende Förderinstrumente und Maßnahmen ergänzen und die berufliche Integration verstärken und anregen. Die ZAV plant, hier ein Konzept zur Unterstützung der Vermittlung schwerbehinderter Akademikerinnen und Akademiker einzureichen.",data/txt/18022.txt,speech,
2795956,22,18,0,Vizepräsidentin Petra Pau,Petra Pau,petra-pau,208,"Ich möchte die Bitte meiner Vorgängerin hier vorne noch einmal wiederholen, doch in der verabredeten Antwortzeit zu bleiben, damit noch möglichst viele Nachfragen stellen können.

Sie, Frau Pothmer, haben das Wort zur ersten Nachfrage.",data/txt/18022.txt,chair,
2795957,22,18,0,Brigitte Pothmer (BÜNDNIS 90/DIE GRÜNEN),Brigitte Pothmer,brigitte-pothmer,209,"Frau Staatssekretärin, die Behindertenverbände berichten immer wieder, dass insbesondere Arbeitgeber, aber auch die Arbeitnehmerinnen und Arbeitnehmer Probleme mit der Sonderausstattung haben, die für manche behinderte Menschen notwendig ist, dass diese Sonderausstattung erst sehr spät zur Verfügung gestellt wird. Welche Möglichkeit sieht die Bundesregierung, da Einfluss zu nehmen und diesen Prozess zu beschleunigen?",data/txt/18022.txt,speech,gruene
2795958,22,18,0,"Gabriele Lösekrug-Möller, Parl. Staatssekretärin bei der Bundesministerin für Arbeit und Soziales",Gabriele Lösekrug-Möller,gabriele-losekrug-moller,210,"Ich versuche, Zeit aufzuholen. - Es ist denkbar, dass das in Einzelfällen unter dem Optimum bleibt. Mir sind jetzt aber keine Einzelfälle bekannt. Deshalb kann ich darauf nicht antworten.",data/txt/18022.txt,speech,
2795959,22,18,0,Vizepräsidentin Petra Pau,Petra Pau,petra-pau,211,Ihre zweite Nachfrage.,data/txt/18022.txt,chair,
2795960,22,18,0,Brigitte Pothmer (BÜNDNIS 90/DIE GRÜNEN),Brigitte Pothmer,brigitte-pothmer,212,"Neben dem Problem der schlechten oder verspäteten Ausstattung für Sonderarbeitsplätze wird immer wieder auch bemängelt, dass der Verwaltungsaufwand, insbesondere für Arbeitgeber, exorbitant hoch sei. Denkt die Bundesregierung darüber nach, da Vereinfachungen vorzunehmen?",data/txt/18022.txt,speech,gruene
2795961,22,18,0,"Gabriele Lösekrug-Möller, Parl. Staatssekretärin bei der Bundesministerin für Arbeit und Soziales",Gabriele Lösekrug-Möller,gabriele-losekrug-moller,213,"Die Bundesregierung ist nicht der Meinung, dass der Verwaltungsaufwand exorbitant hoch ist. Wir haben als Bundesregierung - so haben wir heute in der Befragung der Bundesregierung gehört - ein großes Interesse an Entbürokratisierung und Vereinfachung. Ich bin der festen Überzeugung, dass auch dieser Bereich dabei betrachtet und untersucht wird. Sofern da Vereinfachungen möglich erscheinen, werden sie ganz sicher vorgenommen.",data/txt/18022.txt,speech,
2795962,22,18,0,Vizepräsidentin Petra Pau,Petra Pau,petra-pau,214,Der Kollege Kurth hat das Wort zu einer Nachfrage.,data/txt/18022.txt,chair,
2795963,22,18,0,Markus Kurth (BÜNDNIS 90/DIE GRÜNEN),Markus Kurth,markus-kurth,215,"Wo es nun um das Thema Vermittlung geht, bietet es sich an, noch einmal nach den sogenannten Integrationsfachdiensten zu fragen. Diese Integrationsfachdienste hat ja der Gesetzgeber 2001 eingerichtet, damit Arbeitgeber und auch Bewerber im Vorfeld beraten werden können, Bewerber vermittelt und danach auch betreut werden können. Das sollte eine ganzheitliche Leistung sein; so hat es sich der Gesetzgeber jedenfalls vorgestellt.

Nun hat die vergangene Bundesregierung den Teilbereich der Vermittlung aus diesen Diensten einfach herausgebrochen und durch Ausschreibungsverfahren vergeben. Das hatte zum Ergebnis eine zum Teil zersplitterte Leistungslandschaft. Das hat die damalige Opposition kritisiert, und zwar vehement. Plant die jetzige Bundesregierung, diese Fehlentscheidung der vergangenen Regierung wieder zurückzunehmen bzw. zu korrigieren und die Integrationsfachdienste wieder zu dem zu machen, was der Gesetzgeber ursprünglich wollte?",data/txt/18022.txt,speech,gruene
2795964,22,18,0,"Gabriele Lösekrug-Möller, Parl. Staatssekretärin bei der Bundesministerin für Arbeit und Soziales",Gabriele Lösekrug-Möller,gabriele-losekrug-moller,216,"Herr Kollege Kurth, die amtierende Bundesregierung sieht davon ab, Entscheidungen der vorangegangenen Bundesregierung zu bewerten. Deshalb antworte ich Ihnen: Sollte es zu Schwierigkeiten gekommen sein, wird die jetzige Bundesregierung ganz sicher mit einem entsprechenden Problembewusstsein auch diese Fragestellung betrachten. Sollte es erforderlich sein, hier Lösungen zu finden, dann werden sie - da bin ich mir ziemlich sicher - gesucht werden. Ich will Ihnen aber sagen, dass ich erst einmal Ihre Vermutung, dass es negative Auswirkungen gibt, so nicht bestätigen kann.",data/txt/18022.txt,speech,
2795965,22,18,0,Vizepräsidentin Petra Pau,Petra Pau,petra-pau,217,"Die Fragen 43 und 44 des Kollegen Dr. Wolfgang Strengmann-Kuhn, 45 und 46 der Kollegin Sabine Zimmermann (Zwickau) sowie 47 und 48 der Kollegin Azize Tank zum Geschäftsbereich des Bundesministeriums für Arbeit und Soziales werden schriftlich beantwortet. - Vielen Dank, Frau Staatssekretärin.

Wir kommen zum Geschäftsbereich des Bundesministeriums für Ernährung und Landwirtschaft. Die Frage 49 der Kollegin Bärbel Höhn, die Fragen 50 und 51 der Kollegin Dr. Kirsten Tackmann sowie 52 und 53 des Kollegen Harald Ebner werden ebenfalls schriftlich beantwortet.

Dasselbe gilt für die Frage 54 des Kollegen Omid Nouripour aus dem Geschäftsbereich des Bundesministeriums der Verteidigung.

Der Geschäftsbereich des Bundesministeriums für Familie, Senioren, Frauen und Jugend ist als Nächstes an der Reihe. Zur Beantwortung der Fragen steht die Parlamentarische Staatssekretärin Caren Marks zur Verfügung.

Die Frage 55 der Kollegin Tabea Rößner soll schriftlich beantwortet werden.

Ich rufe die Frage 56 der Kollegin Corinna Rüffer auf:

Wann wird die Bundesregierung das in der UN-Behindertenrechtskonvention verankerte Recht auf angemessene Vorkehrungen als Diskriminierungstatbestand in das Allgemeine Gleichbehandlungsgesetz aufnehmen, und wie begründet sie es, falls sie keine entsprechende Änderung plant?

Bitte, Frau Staatssekretärin.",data/txt/18022.txt,chair,
2795966,22,18,0,"Caren Marks, Parl. Staatssekretärin bei der Bundesministerin für Familie, Senioren, Frauen und Jugend",Caren Marks,caren-marks,218,"Frau Präsidentin! Meine sehr verehrten Kolleginnen und Kollegen! Sehr geehrte Frau Kollegin Rüffer, Ihre Frage beantworte ich gerne, und zwar wie folgt: Um die Behindertenrechtskonvention umzusetzen, hat die Bundesregierung in der letzten Legislaturperiode einen Nationalen Aktionsplan verabschiedet, der in der laufenden Legislaturperiode weiterentwickelt wird. Dieser sieht auch eine Evaluierung des Behindertengleichstellungsgesetzes vor. Im Rahmen dieser zurzeit stattfindenden Evaluierung wird im Lichte der UN-Behindertenrechtskonvention auch geprüft, ob es bezüglich des Begriffs „angemessene Vorkehrungen“ gegebenenfalls Handlungsbedarf gibt. Es ist derzeit nicht auszuschließen, dass sich aus dem Ergebnis dieser Prüfung auch Auswirkungen zum Beispiel auf das Allgemeine Gleichbehandlungsgesetz ergeben können.",data/txt/18022.txt,speech,
2795967,22,18,0,Vizepräsidentin Petra Pau,Petra Pau,petra-pau,219,Sie haben das Wort zur ersten Nachfrage.,data/txt/18022.txt,chair,
2795968,22,18,0,Corinna Rüffer (BÜNDNIS 90/DIE GRÜNEN),Corinna Rüffer,corinna-ruffer,220,"Gerne. - Ich bin etwas verwundert, weil die Antwort auf die Frage sehr vorsichtig ausgefallen ist. Die Monitoring-Stelle zur Umsetzung der Behindertenrechtskonvention am Deutschen Institut für Menschenrechte schreibt - ich zitiere -: „Solange es Barrierefreiheit nicht gibt, helfen nur angemessene Vorkehrungen.“ Das ist sehr eindeutig. Wie bewerten Sie diese Aussage, und sehen Sie jetzt vielleicht doch einen dringenderen Handlungsbedarf?",data/txt/18022.txt,speech,gruene
2795969,22,18,0,"Caren Marks, Parl. Staatssekretärin bei der Bundesministerin für Familie, Senioren, Frauen und Jugend",Caren Marks,caren-marks,221,"Sehr geehrte Frau Kollegin Rüffer, ich kann mich an dieser Stelle nur wiederholen: Wir warten die Evaluierung ab. Wir werden sie auswerten und dann in der Bundesregierung zu einem Ergebnis kommen, das Auswirkungen auf das Allgemeine Gleichbehandlungsgesetz haben könnte.",data/txt/18022.txt,speech,
2795970,22,18,0,Vizepräsidentin Petra Pau,Petra Pau,petra-pau,222,Sie haben das Wort zu einer zweiten Nachfrage.,data/txt/18022.txt,chair,
2795971,22,18,0,Corinna Rüffer (BÜNDNIS 90/DIE GRÜNEN),Corinna Rüffer,corinna-ruffer,223,"Das AGG enthält keine Umsetzungsvorschrift zu Art. 5 der Richtlinie aus 2000/78/EG vom 27. November 2000, nach der Arbeitgeberinnen und Arbeitgeber verpflichtet werden sollen, angemessene Vorkehrungen für Menschen mit Behinderungen zu gewährleisten, um ihre Gleichberechtigung sicherzustellen. Wie bewerten Sie das? Was haben Sie im Hinblick auf diesen Mangel vor?",data/txt/18022.txt,speech,gruene
2795972,22,18,0,"Caren Marks, Parl. Staatssekretärin bei der Bundesministerin für Familie, Senioren, Frauen und Jugend",Caren Marks,caren-marks,224,"Den Aspekt, den Sie angesprochen haben, Frau Kollegin, werden wir ganz gezielt angehen. Wir werden das AGG in der jetzigen Ausgestaltung daraufhin prüfen. Es kann durchaus sein, dass wir Handlungsbedarf sehen. Das wird dann innerhalb der Bundesregierung abzustimmen sein.",data/txt/18022.txt,speech,
2795973,22,18,0,Vizepräsidentin Petra Pau,Petra Pau,petra-pau,225,"Wir kommen zur Frage 57 der Kollegin Corinna Rüffer:

Welche Position vertritt die Bundesregierung zum vorliegenden Entwurf der Fünften Antidiskriminierungsrichtlinie der EU, und welche Alternativen zum Schutz von Menschen mit Behinderungen sieht sie, falls sie den Entwurf weiterhin grundsätzlich ablehnt (vergleiche zum Beispiel Koalitionsvertrag zwischen CDU, CSU und SPD, Seite 13)?

Bitte, Frau Staatssekretärin.",data/txt/18022.txt,chair,
2795974,22,18,0,"Caren Marks, Parl. Staatssekretärin bei der Bundesministerin für Familie, Senioren, Frauen und Jugend",Caren Marks,caren-marks,226,"Diese Frage kann ich in wenigen Sekunden beantworten. Frau Kollegin Rüffer, ich kann Ihnen bezüglich dieser Frage nur mitteilen, dass innerhalb der Bundesregierung die Meinungsbildung zur Fünften Antidiskriminierungsrichtlinie noch nicht abgeschlossen ist.",data/txt/18022.txt,speech,
2795975,22,18,0,Vizepräsidentin Petra Pau,Petra Pau,petra-pau,227,Sie haben das Wort zur Nachfrage.,data/txt/18022.txt,chair,
2795976,22,18,0,Corinna Rüffer (BÜNDNIS 90/DIE GRÜNEN),Corinna Rüffer,corinna-ruffer,228,Wie beurteilt die Bundesregierung in diesem Zusammenhang den von der EU-Kommission geplanten Rechtsakt zur Barrierefreiheit von Waren und Dienstleistungen?,data/txt/18022.txt,speech,gruene
2795977,22,18,0,"Caren Marks, Parl. Staatssekretärin bei der Bundesministerin für Familie, Senioren, Frauen und Jugend",Caren Marks,caren-marks,229,"Auch das wird grundsätzlich geprüft. Wie gesagt: Die Frage, ob es Handlungsbedarf gibt, ist in der Regierung, wenn es darum geht, wie die Antidiskriminierungsrichtlinie weiter ausgestaltet wird, noch nicht abschließend beantwortet.",data/txt/18022.txt,speech,
2795978,22,18,0,Vizepräsidentin Petra Pau,Petra Pau,petra-pau,230,Sie haben das Wort zu einer zweiten Nachfrage.,data/txt/18022.txt,chair,
