id,sitzung,wahlperiode,in_writing,speaker,speaker_cleaned,speaker_fp,sequence,text,filename,type,speaker_party
2795748,22,18,0,Vizepräsidentin Ulla Schmidt,Ulla Schmidt,ulla-schmidt,0,"Einen schönen guten Tag! Bitte nehmen Sie Platz. Die Sitzung ist eröffnet.

Ich rufe den Tagesordnungspunkt 1 auf:

Befragung der Bundesregierung

Die Bundesregierung hat als Thema der heutigen Kabinettssitzung mitgeteilt: Bericht der Bundesregierung 2013 nach § 7 des Gesetzes zur Einsetzung eines Nationalen Normenkontrollrates.

Das Wort für den einleitenden fünfminütigen Bericht hat der Staatsminister bei der Bundeskanzlerin Dr. Helge Braun. - Bitte schön.",data/txt/18022.txt,chair,
2795749,22,18,0,"Dr. Helge Braun, Staatsminister bei der Bundeskanzlerin",Dr. Helge Braun,helge-braun,1,"Vielen Dank. - Frau Präsidentin! Liebe Kolleginnen und Kollegen! Das Bundeskabinett hat heute den Bericht zum Bürokratieabbau 2013 behandelt und beschlossen. Das Gesetz zur Einsetzung eines Nationalen Normenkontrollrates verpflichtet uns, jährlich einen solchen Bericht abzugeben.

Wenn Sie sich den Bericht ansehen, stellen Sie fest, dass sich seit 2006, als wir das Thema Bürokratieabbau institutionell auf den Weg gebracht haben, vieles verändert hat. Wir haben zahlreiche Verfahren etabliert. Dazu gehören die Einsetzung des Normenkontrollrates und die damit verbundene Bewertung aller neuen Gesetzesvorhaben. Hinzu kommt, dass wir - diese Regelung ist seit März 2013 in Kraft - alle neuen Gesetzesvorhaben nach Ablauf von zwei Jahren einer Ex-post-Evaluierung unterwerfen. Wir wollen uns schrittweise alle Gesetzesvorhaben ansehen, bei denen wir davon ausgehen, dass sie einen Erfüllungsaufwand von über 1 Million Euro bedeuten. Auf diese Weise wollen wir auch in der Bestandsgesetzgebung vermeidbare Bürokratiekosten identifizieren und nach Möglichkeit beseitigen.

Im Bericht sind viele Zahlen zu finden. Das liegt zum Beispiel daran, dass wir in den letzten Jahren den Bürokratiekostenindex eingeführt haben, der die Bürokratiekosten im engeren Sinne erfasst. Der Bürokratiekostenindex lag im Jahr 2012 bei einem Wert von 100,27, im Jahr 2013 bei 100,31. Das ist eine Steigerung um 0,04. Das heißt, die Bürokratiekosten sind im Wesentlichen konstant geblieben; es hat nur eine kleine Steigerung der laufenden Belastungen gegeben.

Wenn wir uns anschauen, was das in absoluten Zahlen heißt und wie sich die Entwicklung des Erfüllungsaufwands auf die Wirtschaft, die Verwaltung und die Bürgerinnen und Bürger auswirkt, stellen wir fest, dass die Wirtschaft im Jahr 2013 eine Zunahme ihres laufenden Erfüllungsaufwands um 1,6 Milliarden Euro, die Verwaltung um 245 Millionen Euro und die Bürgerinnen und Bürger um 472 Millionen Euro zu verzeichnen hatten.

Wenn man sich ansieht, welcher der größte Brocken innerhalb des Ganzen ist, dann stellt man fest, dass die Energieeinsparverordnung die größten Kosten verursacht hat. Man muss allerdings dazusagen, dass zum Erfüllungsaufwand nicht nur die Bürokratiekosten, sondern auch die Investitions- und Maßnahmenkosten, die durch dieses Gesetzgebungsverfahren entstehen, gehören. Das heißt, dass zum Beispiel die Kosten, die sich durch die energetische Sanierung von Gebäuden für die Wirtschaft ergeben, in die Berechnung einfließen. Die Energieeinsparungen, die wir dadurch erzielen wollen, und der politische Zweck dieser Gesetzgebung stehen also den Kosten gegenüber.

In Zukunft wollen wir uns den verschiedenen Lebensbereichen der Bürgerinnen und Bürger und der Wirtschaft auch in Form eines Lebenslagenmodells nähern. Auf diese Weise wollen wir überprüfen, wie sich Lebenslagen, in denen die Bürger in besonderem Maße mit Bürokratie konfrontiert werden, zum Beispiel beim Kauf eines Autos, bei einer Geburt oder im Falle eines Nachlasses, auswirken und wie man die Bürokratie in solchen Lebenslagen durch das Zusammenspiel unterschiedlicher Rechtsakte reduzieren kann.

Sie finden in dem Bericht auch zahlreiche Beispiele aus dem Bereich der Pflegeleistungen und anderer Sozialleistungen. Hier haben wir Projekte auf den Weg gebracht, mit denen Vereinfachungen bei der Gesetzgebung erreicht werden sollen. Einige Projekte sind im Jahre 2013 abgeschlossen worden; andere, die besonders erfolgreich waren, werden im Jahr 2014 fortgesetzt.

Insofern kann man resümieren, dass es bei einer im Jahr 2013 im Wesentlichen auf unverändertem Niveau fortgesetzten Belastung von Bürgern, Verwaltung und Wirtschaft mit Bürokratie noch zahlreiche Projekte gibt, mit denen wir etwas verändern wollen. Aber natürlich gibt es auch neue Regelungsvorhaben, die den Bürokratieaufwand möglicherweise erhöhen. Die Bundesregierung wird im Mai ein Arbeitsprogramm verabschieden, mit dem wir weitere Projekte mit dem Ziel des Bürokratieabbaus auf den Weg bringen.",data/txt/18022.txt,speech,
2795750,22,18,0,Vizepräsidentin Ulla Schmidt,Ulla Schmidt,ulla-schmidt,2,"Ich bitte, zunächst Fragen zu dem Themenbereich zu stellen, über den gerade berichtet wurde. Es hat sich der Kollege Grund gemeldet. Bitte schön.",data/txt/18022.txt,chair,
2795751,22,18,0,Manfred Grund (CDU/CSU),Manfred Grund,manfred-grund,3,"Vielen Dank, Herr Staatsminister, für Ihren Bericht über die Arbeit des Normenkontrollrates und über die Einsparungen, die für die Verwaltung, die Bürger und die Wirtschaft damit verbunden sind. Wie muss man sich das konkret vorstellen? Wie nimmt der Normenkontrollrat Einfluss auf ein Gesetzgebungsverfahren oder auf dessen Ergebnis? Wie fließt dies wiederum in das Gesetzgebungsverfahren ein? Also: Wie sieht die Arbeit eigentlich konkret aus?",data/txt/18022.txt,speech,cducsu
2795752,22,18,0,"Dr. Helge Braun, Staatsminister bei der Bundeskanzlerin",Dr. Helge Braun,helge-braun,4,"Vielen Dank. - Die Bundesregierung hat Empfehlungen für die einzelnen Ressorts herausgegeben. Jedes Ressort muss jetzt bereits bei der Erstellung eines Gesetzgebungsverfahrens den Erfüllungsaufwand konkret beziffern und diesen bei der Vorlage des Gesetzestextes transparent machen. Darüber hinaus wird der Erfüllungsaufwand vor der Verabschiedung im Kabinett und zukünftig auch nach der Verabschiedung im Bundestag nachberechnet, sodass für jeden, der im Deutschen Bundestag eine Entscheidung trifft, aber auch für die Bevölkerung transparent wird, wie hoch der Erfüllungsaufwand des jeweiligen Gesetzes ist. In der nächsten Woche werden wir für den Deutschen Bundestag, die Mitarbeiterinnen und Mitarbeiter der Abgeordneten wie auch die Verwaltung, eine Veranstaltung durchführen, in der der Normenkontrollrat, das Statistische Bundesamt und das Bundeskanzleramt über die verschiedenen Berichts- und Mitteilungsformen informieren, damit Sie als Abgeordnete diese Informationen in die Beratungen des Gesetzgebungsverfahrens und in Ihre Entscheidung einbeziehen können.",data/txt/18022.txt,speech,
2795753,22,18,0,Vizepräsidentin Ulla Schmidt,Ulla Schmidt,ulla-schmidt,5,Vielen Dank. - Jetzt eine Frage des Kollegen Dr. Gambke.,data/txt/18022.txt,chair,
2795754,22,18,0,Dr. Thomas Gambke (BÜNDNIS 90/DIE GRÜNEN),Dr. Thomas Gambke,thomas-gambke,6,"Vielen Dank, Frau Präsidentin. - Herr Staatsminister, Sie haben in Ihren Ausführungen davon gesprochen, dass Bürokratie aufgebaut worden ist. Ich fand die einleitenden Worte bemerkenswert; denn Sie haben die Verfahren beschrieben, die wir gehabt haben. Ich als Mittelstandsbeauftragter meiner Fraktion sage: Bürokratieaufbau ist im Moment das Thema des Mittelstands. Sie selber haben darauf hingewiesen, dass zu über 60 Prozent die Unternehmen betroffen sind.

Nun zu meiner Frage. Wir hatten 2007 das Ziel, die Bürokratiekosten um 25 Prozent zu senken. Wie Sie eben ausgeführt haben, hatten wir leider im letzten Jahr einen Anstieg der Bürokratiekosten in Höhe von 1,5 Milliarden Euro. Hinzu kommt ein Erfüllungsaufwand, also ein Umstellungsaufwand, in Höhe von 4 Milliarden Euro. Das ist eine erhebliche Summe. Meine Frage an Sie: Hat die Bundesregierung sich mit der Frage befasst, wie jetzt neue Ziele gesetzt werden können? Wie lauten diese quantitativen Ziele, und für welchen Zeitraum gelten sie?",data/txt/18022.txt,speech,gruene
2795755,22,18,0,"Dr. Helge Braun, Staatsminister bei der Bundeskanzlerin",Dr. Helge Braun,helge-braun,7,"Vielen Dank. - Sie haben richtig darauf hingewiesen, dass wir in den vergangenen Jahren den Erfüllungsaufwand für die Wirtschaft um 25 Prozent reduziert haben. Das war eine große Anstrengung. Zu der Reduzierung haben zwei Bereiche maßgeblich beigetragen: Der eine ist der Bereich der Bilanzierungsregeln bei den Unternehmen, in dem eine Entlastung von über 2 Milliarden Euro stattgefunden hat. Der andere ist der Bereich der elektronischen Rechnungsstellung, wo ein Teil der Entlastung der Wirtschaft zwar frühzeitig mit der Gesetzgebung bilanziert worden ist; aber die Entlastungwirkung hält in dem Maße an, wie die elektronische Rechnungsstellung in der Realität der Unternehmen ankommt. Das heißt, es gibt durch das Projekt der Reduzierung der Kosten aus gesetzlichen Informationspflichten um 25 Prozent bis heute Entlastungswirkungen.

Wenn man in die Zukunft schaut, muss man mit Blick auf diejenigen, die sich mit Bürokratieabbau beschäftigen, eines sehr deutlich sagen: Man kann natürlich immer überlegen, ob ein Gesetz den jeweiligen Erfüllungsaufwand rechtfertigt. So hat der Deutsche Bundestag die von der Bundesregierung novellierte Energieeinsparverordnung befürwortet, weil wir Klimaziele und politische Ziele erfüllen wollen und das Ganze in der Sache für richtig halten. Dem Erfüllungsaufwand stehen - ganz abgesehen von den ökologischen Zielen - ökonomische Vorteile durch Energieeinsparung gegenüber. Insofern ist es die Aufgabe derer, die sich mit dem Bürokratieabbau beschäftigen, nicht alle Regelungen der Zukunft generell infrage zu stellen, sondern zu schauen: Kann man den politisch erwünschten Zweck möglicherweise einfacher erreichen? Nach dem deutlichen Abbau der Bürokratie in der Anfangszeit lautet die Aufgabe jetzt, in laufenden Gesetzgebungsverfahren den Zuwachs an Bürokratie nach Möglichkeit zu verhindern oder zu begrenzen. Neue Projekte, mit denen wir den Bürokratieaufwand der Unternehmen, deren Zukunft uns natürlich am Herzen liegt, deutlich reduzieren wollen, werden wir dann in dem neuen Arbeitsprogramm der Bundesregierung vorstellen.",data/txt/18022.txt,speech,
2795756,22,18,0,Vizepräsidentin Ulla Schmidt,Ulla Schmidt,ulla-schmidt,8,"Vielen Dank, Herr Staatsminister. - Ich sehe keine weiteren Fragen zu diesem Themenbereich.",data/txt/18022.txt,chair,
2795757,22,18,0,Dr. Thomas Gambke [BÜNDNIS 90/DIE GRÜNEN],Dr. Thomas Gambke,thomas-gambke,9,Doch!,data/txt/18022.txt,poi,gruene
2795758,22,18,0,Vizepräsidentin Ulla Schmidt,Ulla Schmidt,ulla-schmidt,10,- Herr Dr. Gambke.,data/txt/18022.txt,chair,
2795759,22,18,0,Dr. Thomas Gambke (BÜNDNIS 90/DIE GRÜNEN),Dr. Thomas Gambke,thomas-gambke,11,"Ich habe noch eine Frage. Ich stelle aber zunächst fest, dass Sie meine Frage nach einem neuen quantitativen Ziel nicht beantwortet haben.

Zu meiner Frage. Wir haben uns im Zusammenhang mit dem Wachstumsbeschleunigungsgesetz auch mit dem Thema der Hotelsteuer beschäftigt; unter diesem Stichwort ging es um den verminderten Mehrwertsteuersatz für Übernachtungen. Wir wussten im Vorfeld, dass das zu erheblichen Bürokratiekosten führt, sowohl für die Gewerbetreibenden, also die Hotels, als auch für die Bürger. Das konnte dadurch umgangen werden, dass die Koalitionsfraktionen und nicht die Regierung dieses Gesetz eingebracht haben. Plant die Bundesregierung eine Ausweitung des Auftrags des Normenkontrollrates auf Gesetzentwürfe der Fraktionen, um in Zukunft zu verhindern, dass Fraktionen den schönen Beschluss, Gesetze nach ihren Bürokratiekosten zu bewerten, umgehen können?",data/txt/18022.txt,speech,gruene
2795760,22,18,0,"Dr. Helge Braun, Staatsminister bei der Bundeskanzlerin",Dr. Helge Braun,helge-braun,12,"Der Normenkontrollrat ist ein Gremium zur Unterstützung der Bundesregierung. Natürlich kontrolliert nicht die Bundesregierung den Bundestag, sondern umgekehrt. Aber ich habe eben angedeutet, dass wir - das ist sicherlich in Ihrem Sinne - beabsichtigen, in Zukunft den Erfüllungsaufwand von Gesetzen nach der endgültigen Verabschiedung nochmals zu berechnen, um transparent zu machen, welche Belastungen durch das rechtskräftige Gesetz tatsächlich für die Bürgerinnen und Bürger, die Wirtschaft und die Verwaltung entstehen.",data/txt/18022.txt,speech,
2795761,22,18,0,Vizepräsidentin Ulla Schmidt,Ulla Schmidt,ulla-schmidt,13,"Vielen Dank. - Gibt es Fragen zu anderen Themen der heutigen Kabinettssitzung? - Ich sehe, das ist nicht der Fall. Damit beenden wir den Bereich der Themen der heutigen Kabinettssitzung.

Gibt es darüber hinaus weitere Fragen an die Bundesregierung? -",data/txt/18022.txt,chair,
2795762,22,18,0,Jörn Wunderlich [DIE LINKE],Jörn Wunderlich,jorn-wunderlich,14,Da gibt es viele!,data/txt/18022.txt,poi,linke
2795763,22,18,0,Vizepräsidentin Ulla Schmidt,Ulla Schmidt,ulla-schmidt,15,"Ich sehe, das ist auch nicht der Fall.

Dann unterbreche ich die Sitzung bis zur Fragestunde um 13.35 Uhr.",data/txt/18022.txt,chair,
2795764,22,18,0,,,,16,Unterbrechung von 13.13 bis 13.35 Uhr,data/txt/18022.txt,poi,
2795765,22,18,0,Vizepräsidentin Ulla Schmidt,Ulla Schmidt,ulla-schmidt,17,,data/txt/18022.txt,chair,
2795766,22,18,0,Vizepräsidentin Ulla Schmidt,Ulla Schmidt,ulla-schmidt,18,"Liebe Kolleginnen und Kollegen! Die unterbrochene Sitzung wird fortgesetzt.

Ich rufe den Tagesordnungspunkt 2 auf:

Fragestunde

Drucksachen 18/814, 18/835

Zu Beginn der Fragestunde rufe ich gemäß Nr. 10 der Richtlinien für die Fragestunde die dringlichen Fragen auf Drucksache 18/835 auf.

Für den Geschäftsbereich des Auswärtigen Amts beantwortet heute der Staatsminister Michael Roth die Fragen.

Ich rufe die dringliche Frage 1 des Abgeordneten Hunko auf:

Welche Auswirkungen erwartet die Bundesregierung angesichts des Ausgangs der Volksabstimmung über einen Anschluss der Krim an Russland auf die Sicherheitslage in Deutschland und durch die in diesem Zusammenhang verhängten bzw. geplanten Sanktionen gegen Russland auf die wirtschaftliche Entwicklung in Deutschland, die Stabilität der Euro-Zone bzw. die Volkswirtschaften der Europäischen Union?

Herr Staatsminister Roth, bitte schön.",data/txt/18022.txt,chair,
2795767,22,18,0,"Michael Roth, Staatsminister im Auswärtigen Amt",Michael Roth,michael-roth,19,"Vielen Dank, Frau Präsidentin! - Lieber Herr Kollege Hunko, ich will noch einmal daran erinnern, dass sich die Europäische Union bei ihren Maßnahmen und Sanktionen auf ein dreistufiges Verfahren verständigt hat. Gemäß dem jüngsten Beschluss vom 17. März 2014 greift nun die Stufe 2, das heißt, gegen 21 Personen aus der Ukraine und aus Russland sind Einreiseverbote ausgesprochen worden, und deren Vermögen wurden eingefroren.

Die Bundesregierung sieht derzeit weder Beeinträchtigungen der Sicherheitslage in Deutschland noch nennenswerte Auswirkungen auf die wirtschaftliche Entwicklung in Deutschland, in der Euro-Zone oder in der Europäischen Union.",data/txt/18022.txt,speech,
2795768,22,18,0,Vizepräsidentin Ulla Schmidt,Ulla Schmidt,ulla-schmidt,20,Herr Kollege Hunko.,data/txt/18022.txt,chair,
2795769,22,18,0,Andrej Hunko (DIE LINKE),Andrej Hunko,andrej-hunko,21,"Vielen Dank. - Herr Kollege Roth, in der letzten Woche waren Außenminister von Staaten, die gerade aus der Krise herausgekommen sind oder bei denen es den Anschein hat, dass sie jetzt aus der Krise herauskommen, zu Besuch hier im Bundestag, und sie haben diese Sorgen ebenfalls geäußert. Würden Sie auch ausschließen, dass es Auswirkungen auf die Stabilität in der Euro-Zone haben könnte, wenn es nach den jetzt umgesetzten Sanktionen zu einer Sanktionsspirale käme und der Konflikt über diese Sanktionen weiter eskalieren würde, oder wäre das eine reale Gefahr?",data/txt/18022.txt,speech,linke
2795770,22,18,0,"Michael Roth, Staatsminister im Auswärtigen Amt",Michael Roth,michael-roth,22,"Es gibt keinen Sanktionsautomatismus, Herr Kollege Hunko. Die Bundesregierung und die Europäische Union insgesamt sind nach wie vor zuvörderst um eine diplomatisch-politische Lösung bemüht. Wir wollen deeskalieren und nicht eskalieren.

Der nächste Europäische Rat am morgigen Donnerstag wird im Lichte der jüngsten Entwicklung auf der Krim, aber auch vor dem Hintergrund der russischen Entscheidung, sich die Krim einzuverleiben, über weitere Schritte nachdenken. Es gibt derzeit aber noch keinerlei konkrete Überlegungen, Wirtschaftssanktionen auszusprechen. Ich müsste hier also spekulieren, und das möchte ich nicht.",data/txt/18022.txt,speech,
2795771,22,18,0,Vizepräsidentin Ulla Schmidt,Ulla Schmidt,ulla-schmidt,23,Zu einer weiteren Nachfrage hat der Kollege Gehrcke das Wort.,data/txt/18022.txt,chair,
2795772,22,18,0,Wolfgang Gehrcke (DIE LINKE),Wolfgang Gehrcke,wolfgang-gehrcke,24,"Schönen Dank. - Herr Staatsminister, ich möchte Sie gerne fragen, ob aus Ihrer Sicht eine Aufkündigung der Zusammenarbeit mit Russland bei der Vernichtung der syrischen Chemiewaffen und Auswirkungen auf die Verhandlungen mit dem Iran über das Atomprogramm in dem Sanktionskatalog vorgesehen sind und wie sich die Bundesregierung dazu verhält.",data/txt/18022.txt,speech,linke
2795773,22,18,0,"Michael Roth, Staatsminister im Auswärtigen Amt",Michael Roth,michael-roth,25,"Es gibt eine klare Priorität der Bundesregierung - daran arbeiten wir Tag und Nacht -, nämlich auf politischem Wege und auf diplomatischem Wege zur Deeskalation beizutragen. Wir haben auch das Ziel, dass - unabhängig von weiteren Maßnahmen - die Gesprächskanäle mit Russland offen gehalten werden. Ich habe den Eindruck, dass diese Position innerhalb der Europäischen Union auf große Zustimmung stößt.

Im Übrigen wissen Sie, dass wir für die Lösung von einer Reihe von internationalen Problemen - Sie haben einige angesprochen - weiterhin auf Russland angewiesen sind. Unabhängig davon gibt es aber ein klares, deutliches Signal der Bundesregierung und der Europäischen Union: Was Russland bezüglich der Krim getan hat, verstößt gegen das Völkerrecht und ist absolut inakzeptabel.",data/txt/18022.txt,speech,
2795774,22,18,0,Vizepräsidentin Ulla Schmidt,Ulla Schmidt,ulla-schmidt,26,"Kollege Krischer hat jetzt Gelegenheit, eine weitere Frage zu stellen.",data/txt/18022.txt,chair,
2795775,22,18,0,Oliver Krischer (BÜNDNIS 90/DIE GRÜNEN),Oliver Krischer,oliver-krischer,27,"Herzlichen Dank, Frau Präsidentin. - Herr Staatsminister, es hat in der vergangenen Woche und in der Woche davor zwei große Geschäfte von deutschen Unternehmen gegeben: zum einen die Transaktion der Firma Wintershall, die im Rahmen eines Asset-Tauschs Gasspeicheranteile an Gazprom verkauft hat, und zum anderen die Entscheidung von RWE, ihre Öl- und Gasfördertochter an einen russischen Investor zu verkaufen, und zwar zu einem überraschend hohen Kaufpreis und - wenn man die gesamte Verhandlungsdauer dieses Kaufs betrachtet - zu einem interessanten Zeitpunkt.

Meine Frage ist: Welche Position hat die Bundesregierung zu diesem Thema, und erachtet sie es als notwendig, in irgendeiner Weise bei diesen Geschäften einzugreifen, zu prüfen, zu handeln?",data/txt/18022.txt,speech,gruene
2795776,22,18,0,"Michael Roth, Staatsminister im Auswärtigen Amt",Michael Roth,michael-roth,28,"Unabhängig davon, wie wir zu solchen wirtschaftlichen Entscheidungen der Privatwirtschaft stehen, gibt es für die Bundesregierung derzeit keine Möglichkeiten, einzugreifen.",data/txt/18022.txt,speech,
2795777,22,18,0,Vizepräsidentin Ulla Schmidt,Ulla Schmidt,ulla-schmidt,29,Frau Kollegin Keul.,data/txt/18022.txt,chair,
2795778,22,18,0,Katja Keul (BÜNDNIS 90/DIE GRÜNEN),Katja Keul,katja-keul,30,"Vielen Dank. - Wenn wir jetzt über Sanktionen oder Einschränkungen im Handel sprechen, dann ist der erste Bereich, der mir dazu einfällt, der Bereich der Rüstungsexporte. Jetzt frage ich: Gedenkt die Bundesregierung die Lieferung eines gesamten Gefechtsübungszentrums nach Russland durch die Firma Rheinmetall zu stoppen? Ist dieses Geschäft möglicherweise durch eine Hermesbürgschaft abgesichert? Wie wird das dann in der Praxis abgewickelt?",data/txt/18022.txt,speech,gruene
2795779,22,18,0,"Michael Roth, Staatsminister im Auswärtigen Amt",Michael Roth,michael-roth,31,"Liebe Frau Kollegin, auch wenn in der Öffentlichkeit immer wieder anderes behauptet wird: Faktisch werden bereits jetzt keinerlei Ausfuhrgenehmigungen für Rüstungsgüter nach Russland mehr erteilt. Das gilt insbesondere auch für Dual-use-Güter mit einem militärischen Verwendungszweck. Darüber hinaus hat die Bundesregierung eine Überprüfung der bislang schon erteilten Ausfuhrgenehmigungen eingeleitet und wird dann, wenn dies erforderlich ist, die entsprechenden Schritte einleiten. Das gilt auch für die konkreten Fälle, die Sie eben benannt haben.",data/txt/18022.txt,speech,
2795780,22,18,0,Vizepräsidentin Ulla Schmidt,Ulla Schmidt,ulla-schmidt,32,Frau Kollegin Beck.,data/txt/18022.txt,chair,
2795781,22,18,0,Marieluise Beck (Bremen) (BÜNDNIS 90/DIE GRÜNEN),Marieluise Beck,marieluise-beck,33,"Herr Staatsminister, angesichts des hohen Tempos der Veränderungen in der Ukraine, mit denen kaum jemand gerechnet hat, und der sich daraus ergebenden Tatsache, dass wir die handelnden Personen und Parteien oft nicht wirklich gut kennen, möchte ich Sie fragen, wie die Bundesregierung die Übergangsregierung in Kiew und die Beteiligung der Partei Swoboda daran einschätzt. Haben wir es dort mit faschistischen Kräften und einer Regierung zu tun, der faschistische Parteien angehören?",data/txt/18022.txt,speech,gruene
2795782,22,18,0,"Michael Roth, Staatsminister im Auswärtigen Amt",Michael Roth,michael-roth,34,"Vielen Dank, Frau Kollegin. - Die Bundesregierung hat wie die Europäische Union insgesamt ein Interesse an einer möglichst inklusiven Regierung, die möglichst alle gesellschaftlichen Kräfte, die der Rechtsstaatlichkeit und der Demokratie verpflichtet sind, einbezieht. Ich weiß, dass es insbesondere in Deutschland eine kontroverse Diskussion über die Rolle von Swoboda gibt. Diese Partei ist an der Regierung beteiligt und stellt zwei Minister. Nach den uns vorliegenden Erkenntnissen möchte ich nicht von einer faschistischen Partei sprechen. Es ist zweifellos eine rechtspopulistische, nationalistische Partei, aber es ist keine faschistische, eindeutig antisemitische Partei. Im Übrigen - das wissen Sie; da teilt die Bundesregierung die Auffassung des Bundestages - ist es deutsche Tradition: Wir verabscheuen und verurteilen den Antisemitismus überall. Wir setzen uns auch in der Ukraine für eine Aufklärung der Gewalttaten auf dem Maidan, aber auch anderswo ein. Swoboda ist nach unseren Erkenntnissen - auch nach den Gesprächen mit der Zivilgesellschaft in der Ukraine, insbesondere mit den Vertretern der jüdischen Gemeinde - zwar eine rechtspopulistische und nationalistische, aber keine faschistische Partei.",data/txt/18022.txt,speech,
2795783,22,18,0,Vizepräsidentin Ulla Schmidt,Ulla Schmidt,ulla-schmidt,35,Herr Dr. Neu.,data/txt/18022.txt,chair,
2795784,22,18,0,Dr. Alexander S. Neu (DIE LINKE),Dr. Alexander S. Neu,alexander-neu,36,"Herr Staatsminister, der Kollege Gehrcke hatte gerade eine Frage gestellt, die Sie etwas unpräzise beantwortet haben. Es geht darum, ob angesichts des Instrumentenköfferchens, in denen die gerade ausgearbeiteten Sanktionen enthalten sind, auch der Abzug aus Afghanistan, bei dem Russland eine Rolle spielen wird, und der Iran Thema sind. Ja oder nein?

Danke.",data/txt/18022.txt,speech,linke
2795785,22,18,0,"Michael Roth, Staatsminister im Auswärtigen Amt",Michael Roth,michael-roth,37,"Herr Kollege Neu, wir befinden uns derzeit noch in der Stufe 2 des sogenannten Sanktionsmechanismus. Die Stufe 3, die Sie ansprechen, ist überhaupt noch nicht im Gespräch. Wir befinden uns hier im spekulativen Bereich. Es bedürfte dafür auch eines gesonderten Beschlusses des Europäischen Rates.

Derzeit investieren wir unsere gesamte Kraft, unser Engagement, aber auch unsere Kreativität darauf, weitere Sanktionen zu verhindern. Ich habe auch den Eindruck, dass es darüber in der Europäischen Union eine intensive Diskussion gibt. Denn wir müssen uns die Frage stellen, wer welchen Preis für welche Sanktion zahlt und ob wir das, was wir uns wünschen, mit den entsprechenden Sanktionen wirklich erzielen können. Insofern kann ich Ihnen noch nichts Konkretes sagen, weil es diese konkrete Diskussion noch nicht gibt.

Einen Instrumentenkoffer mit Sanktionen, den Sie angesprochen haben, gibt es weder bei der Bundesregierung noch bei der Europäischen Union.",data/txt/18022.txt,speech,
2795786,22,18,0,Vizepräsidentin Ulla Schmidt,Ulla Schmidt,ulla-schmidt,38,Herr Kollege Petzold.,data/txt/18022.txt,chair,
2795787,22,18,0,Harald Petzold (Havelland) (DIE LINKE),Harald Petzold,harald-petzold,39,"Herr Staatsminister, habe ich Sie richtig verstanden, dass es innerhalb der Bundesregierung noch gar keine Vorstellung über die Stufe 3 gibt?",data/txt/18022.txt,speech,linke
2795788,22,18,0,"Michael Roth, Staatsminister im Auswärtigen Amt",Michael Roth,michael-roth,40,"Es gibt selbstverständlich eine Reihe von Überlegungen, aber es gibt noch keine Beschlüsse. Über die würde ich Sie dann informieren, wenn sie anstehen. Derzeit haben wir eine klare Priorisierung. Wir wollen unter allen Umständen vermeiden, dass es zu einer weiteren Eskalation kommt. Denn die sogenannte dritte Stufe greift erst dann, wenn die Eskalationsspirale sich weiterdreht. Ich meine, dass es derzeit noch ein Fenster für diplomatische Bemühungen gibt.",data/txt/18022.txt,speech,
