id,sitzung,wahlperiode,in_writing,speaker,speaker_cleaned,speaker_fp,sequence,text,filename,type,speaker_party
2796148,22,18,0,Gegenruf des Abg. Dr. Peter Ramsauer [CDU/CSU],Dr. Peter Ramsauer,peter-ramsauer,400,Er ist doch nicht Mitglied der Bundesregierung! Was soll denn der Blödsinn?,data/txt/18022.txt,poi,cducsu
2796149,22,18,0,Steffen Kanitz (CDU/CSU),Steffen Kanitz,steffen-kanitz,401,"Das gilt auch für die Ausgleichsregelung für stromintensive Unternehmen. Dort müssen wir darauf achten, unsere Wettbewerbsfähigkeit nicht zu gefährden. Auch hier habe ich Vertrauen in unseren Energieminister, der die nationalen Interessen unseres Industriestandortes Deutschland verantwortungsvoll vertritt.

Wo würden wir denn heute mit einem grünen Umweltminister stehen?",data/txt/18022.txt,speech,cducsu
2796150,22,18,0,Oliver Krischer [BÜNDNIS 90/DIE GRÜNEN],Oliver Krischer,oliver-krischer,402,Weit besser!,data/txt/18022.txt,poi,gruene
2796151,22,18,0,Katrin Göring-Eckardt [BÜNDNIS 90/DIE GRÜNEN],Katrin Göring-Eckardt,katrin-goring-eckardt,403,Definitiv besser!,data/txt/18022.txt,poi,gruene
2796152,22,18,0,Steffi Lemke [BÜNDNIS 90/DIE GRÜNEN],Steffi Lemke,steffi-lemke,404,Das nennt sich Eigentor!,data/txt/18022.txt,poi,gruene
2796153,22,18,0,Steffen Kanitz (CDU/CSU),Steffen Kanitz,steffen-kanitz,405,"Sie hätten die Ausnahmen doch längst kampflos aufgegeben. Auch wenn Sie es nicht wahrhaben wollen: Auch die EU-Kommission sieht mittlerweile ein, dass es sich bei einem Großteil der Ausnahmeregelungen nicht um eine ungerechtfertigte Subvention handelt, sondern dass wir hier in Deutschland für Wettbewerbsgleichheit im europäischen Kontext sorgen.",data/txt/18022.txt,speech,cducsu
2796154,22,18,0,,,,406,Beifall bei der CDU/CSU,data/txt/18022.txt,poi,
2796155,22,18,0,Oliver Krischer [BÜNDNIS 90/DIE GRÜNEN],Oliver Krischer,oliver-krischer,407,Was hat das mit Atomkraft zu tun?,data/txt/18022.txt,poi,gruene
2796156,22,18,0,Steffen Kanitz (CDU/CSU),Steffen Kanitz,steffen-kanitz,408,"Spinnen wir diesen irrwitzigen Gedanken - zugegebenermaßen: das fällt mir schwer - einer Verantwortung der Grünen für die Energiewende doch einmal weiter. Sie wollen 100 Prozent erneuerbare Energien, Sie wollen den Ausstieg aus Kohle, Sie wollen den Ausstieg aus Öl, und Sie wollen weiterhin eine hohe Förderung des Staates einzelner Erzeugungstechnologien, ohne diese zu hinterfragen. Meine Damen und Herren von den Grünen, Ihre Vorstellungen der Energiewende führen zu explodierenden Kosten.",data/txt/18022.txt,speech,cducsu
2796157,22,18,0,Sylvia Kotting-Uhl [BÜNDNIS 90/DIE GRÜNEN],Sylvia Kotting-Uhl,sylvia-kotting-uhl,409,Ihre Ausnahmen führen zu explodierenden Kosten!,data/txt/18022.txt,poi,gruene
2796158,22,18,0,Steffen Kanitz (CDU/CSU),Steffen Kanitz,steffen-kanitz,410,"Das ist übrigens der Grund, warum die Menschen uns - uns! - diese Aufgabe anvertrauen, nicht Ihnen.",data/txt/18022.txt,speech,cducsu
2796159,22,18,0,,,,411,Beifall bei der CDU/CSU,data/txt/18022.txt,poi,
2796160,22,18,0,Katrin Göring-Eckardt [BÜNDNIS 90/DIE GRÜNEN],Katrin Göring-Eckardt,katrin-goring-eckardt,412,In den letzten acht Jahre ist das schon schief gelaufen! Da sind nämlich die Preise gestiegen!,data/txt/18022.txt,poi,gruene
2796161,22,18,0,Steffen Kanitz (CDU/CSU),Steffen Kanitz,steffen-kanitz,413,Ihre Widersprüchlichkeit zeigt sich auch an der Umsetzung der Energiewende vor Ort. Einerseits unterstützen Sie das Ende der Kernenergie. Aber neue hocheffiziente Kraftwerke wie die in Datteln verteufeln Sie und arbeiten aktiv gegen die Fertigstellung.,data/txt/18022.txt,speech,cducsu
2796162,22,18,0,Katrin Göring-Eckardt [BÜNDNIS 90/DIE GRÜNEN],Katrin Göring-Eckardt,katrin-goring-eckardt,414,In Ihrer Regierungszeit sind die Preise gestiegen!,data/txt/18022.txt,poi,gruene
2796163,22,18,0,Steffen Kanitz (CDU/CSU),Steffen Kanitz,steffen-kanitz,415,"Um den ehemaligen Umweltminister Jürgen Trittin, der anwesend ist, zu zitieren: Wer mit uns koalieren will, muss sich darauf einstellen, dass diese Investition - nämlich Datteln IV - nicht zu Ende geführt wird. - Meine Damen und Herren von den Grünen, hören Sie endlich damit auf, die Energiewende in Sonntagsreden zu propagieren und vor Ort zu sabotieren.",data/txt/18022.txt,speech,cducsu
2796164,22,18,0,,,,416,Beifall bei Abgeordneten der CDU/CSU,data/txt/18022.txt,poi,
2796165,22,18,0,Oliver Krischer [BÜNDNIS 90/DIE GRÜNEN],Oliver Krischer,oliver-krischer,417,Was hat das denn mit der Energiewende zu tun?,data/txt/18022.txt,poi,gruene
2796166,22,18,0,Steffen Kanitz (CDU/CSU),Steffen Kanitz,steffen-kanitz,418,"Dafür, dass sich die grüne Opposition über die erfolgreiche Politik der Bundesregierung ärgert, habe ich Verständnis, aber kein Mitleid. Wir forcieren den Ausstieg und machen weiter mit der Energiewende. Der größte Garant für eine umweltfreundliche Energieversorgung, die sicher und bezahlbar ist, bleibt eine Regierungsverantwortung von CDU und CSU.

Vielen Dank.",data/txt/18022.txt,speech,cducsu
2796167,22,18,0,,,,419,Beifall bei der CDU/CSU,data/txt/18022.txt,poi,
2796168,22,18,0,Steffen Kanitz (CDU/CSU),Steffen Kanitz,steffen-kanitz,420,,data/txt/18022.txt,speech,cducsu
2796169,22,18,0,Vizepräsidentin Petra Pau,Petra Pau,petra-pau,421,Das Wort hat die Kollegin Eva Bulling-Schröter für die Fraktion Die Linke.,data/txt/18022.txt,chair,
2796170,22,18,0,,,,422,Beifall bei der LINKEN,data/txt/18022.txt,poi,
2796171,22,18,0,Vizepräsidentin Petra Pau,Petra Pau,petra-pau,423,,data/txt/18022.txt,chair,
2796172,22,18,0,Eva Bulling-Schröter (DIE LINKE),Eva Bulling-Schröter,eva-bulling-schroter,424,"Frau Präsidentin! Liebe Kolleginnen und Kollegen! Ich habe am Sonntagabend das Interview gelesen und gedacht: Ich bin einfach baff! - Dann habe ich gedacht: Irgendwo habe ich das schon gelesen. Ich habe dann überlegt und verstanden, wo ich das gelesen habe: bei der Vereinigung der Bayerischen Wirtschaft.",data/txt/18022.txt,speech,linke
2796173,22,18,0,Dr. Peter Ramsauer [CDU/CSU],Dr. Peter Ramsauer,peter-ramsauer,425,"Eine gute Adresse, die bayerische Wirtschaft!",data/txt/18022.txt,poi,cducsu
2796174,22,18,0,Eva Bulling-Schröter (DIE LINKE),Eva Bulling-Schröter,eva-bulling-schroter,426,"Vorher wurde hier über soziale Strompreise gesprochen. Ich möchte das mit dem, was im Interview steht, in einen Zusammenhang bringen. Agenda 2010: Super! Wenn die Regierung etwas anderes macht, ist das ein Verrat an Schröders Erbe. Keinen Schluck mehr aus der Pulle der Sozialleistungen. Der Mindestlohn ist eher schlecht. Vor ihm wird gewarnt, weil das Auswirkungen auf das ganze Gefüge hat und weil das Ganze nicht der Beschäftigung dient. Rente mit 63 Jahren und Mütterrente sind eigentlich auch schädlich für den Wettbewerb und für den Standort Deutschland.",data/txt/18022.txt,speech,linke
2796175,22,18,0,Dr. Georg Nüßlein [CDU/CSU],Dr. Georg Nüßlein,georg-nußlein,427,Was man an so einem Interview alles diskutieren kann!,data/txt/18022.txt,poi,cducsu
2796176,22,18,0,Eva Bulling-Schröter (DIE LINKE),Eva Bulling-Schröter,eva-bulling-schroter,428,"Dann geht es um Strompreise: Wettbewerbsfähigkeit über alles. Dann kommt der Satz: Wir müssen entscheiden, ob wir uns die Energiewende so leisten können und wollen.",data/txt/18022.txt,speech,linke
2796177,22,18,0,Sylvia Kotting-Uhl [BÜNDNIS 90/DIE GRÜNEN],Sylvia Kotting-Uhl,sylvia-kotting-uhl,429,"Ja, „wollen“!",data/txt/18022.txt,poi,gruene
2796178,22,18,0,Eva Bulling-Schröter (DIE LINKE),Eva Bulling-Schröter,eva-bulling-schroter,430,"Wir müssen entscheiden. - Wen er damit meint, sagt er nicht: sich, die CSU, die Unternehmen, die Konzerne oder Otto Normalverbraucher. „Wer die Preise wieder senken will, der muss zurück zur Atomkraft.“ So steht es wortwörtlich im Spiegel.

Hier wurde von alten Reflexen gesprochen. Es stimmt: Das sind die alten Reflexe der CSU, die da wieder zum Vorschein kommen.",data/txt/18022.txt,speech,linke
2796179,22,18,0,,,,431,Beifall bei der LINKEN und dem BÜNDNIS 90/DIE GRÜNEN,data/txt/18022.txt,poi,
2796180,22,18,0,Dr. Georg Nüßlein [CDU/CSU],Dr. Georg Nüßlein,georg-nußlein,432,"Nein, nein!",data/txt/18022.txt,poi,cducsu
2796181,22,18,0,Eva Bulling-Schröter (DIE LINKE),Eva Bulling-Schröter,eva-bulling-schroter,433,"Komischerweise ist das Interview erst am Montag veröffentlicht worden, nicht an dem Wochenende davor; denn am Sonntag waren Kommunalwahlen in Bayern.

Jetzt reden wir einmal über die Kosten der Atomkraft in Deutschland. Von 1950 bis 2010 wurde sie mit circa 198 Milliarden Euro subventioniert. Das hat das Forum Ökologisch-Soziale Marktwirtschaft schon vor Jahren errechnet. Darin enthalten sind Steuervergünstigen, die Stilllegung von Meilern, Forschung inklusive Kernfusionsforschung und die Mitgliedschaft in internationalen Organisationen wie Euratom. Würde man die Kosten konventioneller Energie, also Kohle und Atomkraft, nach der Methode des Erneuerbare-Energien-Gesetzes in Form einer Umlage von den Stromverbrauchern bezahlen lassen, hätte diese Energieumlage im Jahre 2012 umgerechnet 10,2 Cent pro Kilowattstunde betragen.

Müssten die Betreiber von Atomkraftwerken eine Haftpflichtversicherung abschließen, wenn sie denn eine bekämen, müssten sie für jedes Atomkraftwerk 72 Milliarden Euro jährlich bezahlen. Das haben Finanzmathematiker der Versicherungsbranche ausgerechnet. Derzeit ist die Haftpflicht der Betreiber auf knapp 250 Millionen Euro begrenzt. Ein weiterer Vorteil der Atombranche: Wenn etwas passiert, bezahlen es natürlich die Verbraucher und die Steuerzahler; das ist klar.",data/txt/18022.txt,speech,linke
2796182,22,18,0,Auch Professor Hirschhausen vom Deutschen Institut für Wirtschaftsforschung konstatiert,Auch Professor Hirschhausen vom Deutschen Institut für Wirtschaftsforschung konstatiert,auch-professor-hirschhausen-vom-deutschen-institut-fur-wirtschaftsforschung-konstatiert,434,"Atomkraft ist noch nie wettbewerbsfähig gewesen und wird es auch nie sein … Weder in Europa, noch an einem anderen Ort dieser Welt ist jemals ein Atomkraftwerk unter marktwirtschaftlichen Bedingungen gebaut worden. … Übliche Kostenschätzungen für Atomkraft beinhalten oft nicht den Rückbau der Anlagen sowie die Endlagerung …, ganz zu schweigen von den enormen Kosten möglicher Großunfälle wie in Fukushima oder Tschernobyl.

- Darüber haben wir heute im Umweltausschuss Berichte gehört. Sie waren erschütternd. -

… Das finanzielle Risiko wird vom Staat, also uns allen getragen.

Ende 2016 läuft die Brennelementesteuer aus. Dann werden die Atomkraftwerke noch mehr zu Gelddruckmaschinen, und die Gewinne werden natürlich nicht umverteilt, sondern die kassieren die großen Konzerne.

Jetzt reden wir noch über die Störfälle in deutschen AKW. 2013 gab es in deutschen AKW 52 Störfälle. Das ist jede Woche einer. Ich zähle sie Ihnen auf. Brokdorf: 6, Grafenrheinfeld: 3, Grohnde: 3, Gundremmingen B: 3, Isar 2: 5, Emsland: 3, Neckar 2: 9, Philippsburg 2: 20. Das sind insgesamt 52 Störfälle. Erklären Sie bitte einmal den Menschen, dass ihr Strom vielleicht billiger wird, dass sie aber eventuell einen Störfall in Kauf nehmen müssen! Reden wir auch über Isar 2 in Ohu, das zurzeit heruntergefahren wird. Es gibt wieder einmal große Probleme, und die Menschen sind wieder verunsichert.

Und dann wollen Sie in Gundremmingen in Bayern die Kapazitäten hochfahren.",data/txt/18022.txt,speech,
2796183,22,18,0,Sylvia Kotting-Uhl [BÜNDNIS 90/DIE GRÜNEN],Sylvia Kotting-Uhl,sylvia-kotting-uhl,435,Das ist vom Tisch! Gott sei Dank!,data/txt/18022.txt,poi,gruene
2796184,22,18,0,Dr. Georg Nüßlein [CDU/CSU],Dr. Georg Nüßlein,georg-nußlein,436,"Vom Tisch! Sie reden von alten Zeiten, Frau Kollegin!",data/txt/18022.txt,poi,cducsu
2796185,22,18,0,Auch Professor Hirschhausen vom Deutschen Institut für Wirtschaftsforschung konstatiert,Auch Professor Hirschhausen vom Deutschen Institut für Wirtschaftsforschung konstatiert,auch-professor-hirschhausen-vom-deutschen-institut-fur-wirtschaftsforschung-konstatiert,437,"Es gibt genug Studien darüber, dass das Kernkraftwerk das nicht aushält. Ich halte diese Politik für verantwortungslos, und ich bitte Sie und hoffe, dass Sie sich an die Koalitionsvereinbarung und zumindest an das Gesetz zum Atomausstieg 2022 halten.

Ich kann Ihnen nur sagen: Die Demonstrationen beginnen. Am Samstag gibt es die ersten.",data/txt/18022.txt,speech,
2796186,22,18,0,Dr. Georg Nüßlein [CDU/CSU],Dr. Georg Nüßlein,georg-nußlein,438,Aber hoffentlich mal die letzten!,data/txt/18022.txt,poi,cducsu
2796187,22,18,0,Auch Professor Hirschhausen vom Deutschen Institut für Wirtschaftsforschung konstatiert,Auch Professor Hirschhausen vom Deutschen Institut für Wirtschaftsforschung konstatiert,auch-professor-hirschhausen-vom-deutschen-institut-fur-wirtschaftsforschung-konstatiert,439,"- Das werden nicht die letzten sein. Das beginnt jetzt erst, auch in Ihrem Gebiet. - Wir stehen dahinter. Wir unterstützen diese Initiativen, und wir sagen: Atomausstieg möglichst schnell! Wir müssen die Menschen vor solchen Ideen bewahren.",data/txt/18022.txt,speech,
2796188,22,18,0,,,,440,Beifall bei der LINKEN,data/txt/18022.txt,poi,
2796189,22,18,0,Auch Professor Hirschhausen vom Deutschen Institut für Wirtschaftsforschung konstatiert,Auch Professor Hirschhausen vom Deutschen Institut für Wirtschaftsforschung konstatiert,auch-professor-hirschhausen-vom-deutschen-institut-fur-wirtschaftsforschung-konstatiert,441,,data/txt/18022.txt,speech,
2796190,22,18,0,Vizepräsidentin Petra Pau,Petra Pau,petra-pau,442,Das Wort hat die Kollegin Hiltrud Lotze für die SPD-Fraktion.,data/txt/18022.txt,chair,
2796191,22,18,0,,,,443,Beifall bei der SPD,data/txt/18022.txt,poi,
2796192,22,18,0,Vizepräsidentin Petra Pau,Petra Pau,petra-pau,444,,data/txt/18022.txt,chair,
2796193,22,18,0,Hiltrud Lotze (SPD),Hiltrud Lotze,hiltrud-lotze,445,"Sehr geehrte Frau Präsidentin! Liebe Kolleginnen und Kollegen! Ich komme aus dem Wahlkreis Lüchow-Dannenberg - Lüneburg. In Lüchow-Dannenberg liegt Gorleben, und in Gorleben befindet sich das oberirdische - ich betone ausdrücklich: das oberirdische - Transportbehälterlager für hochradioaktiven Atommüll. In den Jahren 1995 bis 2011 sind dort 113 Castorbehälter abgestellt worden. Sie stehen schön aufgereiht in einer ebenerdigen Halle aus Stahlbeton mit einem Dach aus Betonplatten. Im Volksmund wird sie Kartoffelscheune genannt. Das gibt einen Hinweis darauf, dass das auf Dauer nicht die richtige Behausung für die Castorbehälter ist.

In dieser Halle zu stehen, ist ein besonderes Erlebnis. Ich empfehle das allen. Man sieht diesen Behältern nicht an, welche tödliche Gefahr sich in ihnen verbirgt. Man riecht nichts. Man schmeckt nichts. Aber man spürt die Hitze, die von den Brennelementen ausgeht.

Die Region Lüchow-Dannenberg trägt seit mehr als drei Jahrzehnten die größten Lasten aus der umstrittenen Nutzung der Atomenergie in Deutschland. Die Menschen dort haben das Hü und Hott über die Atompolitik gründlich satt. Sie sind auch zermürbt von dem jahrelangen Prozess, den sie dort erlebt haben, den Castortransporten und der strahlenden Gefahr, die sie vor der Haustür haben.

Die Menschen dort sind aber mittlerweile Fachleute geworden. Sie kennen die tödlichen Risiken, die von der unbeherrschbaren Technik der Atomkraft ausgehen. Sie kennen die Bilder und die Schilderungen aus Tschernobyl und Fukushima. Einige sind persönlich dort gewesen und haben sich einen Eindruck verschafft. In jedem Sommer kommen krebskranke Kinder aus Tschernobyl und der umliegenden Region nach Lüneburg und Lüchow-Dannenberg, um sich in Deutschland für einige kurze Wochen zu erholen. Nicht nur in meinem Wahlkreis, aber ganz besonders dort schütteln die Menschen deswegen in diesen Tagen verwundert den Kopf, sind erschrocken oder - das gibt es auch - fühlen sich in ihrem Misstrauen der Politik gegenüber bestätigt, wenn sie in der Zeitung lesen - übrigens nur wenige Tage nach dem Jahrestag von Fukushima -, dass in der Politik über eine Renaissance der Atomkraft nachgedacht wird.",data/txt/18022.txt,speech,spd
2796194,22,18,0,Dr. Georg Nüßlein [CDU/CSU],Dr. Georg Nüßlein,georg-nußlein,446,Wer tut das denn?,data/txt/18022.txt,poi,cducsu
2796195,22,18,0,Hiltrud Lotze (SPD),Hiltrud Lotze,hiltrud-lotze,447,"Ich muss es so formulieren: Für mich, die ich da schon vorbelastet bin, ist es schon starker Tobak, wenn solche Überlegungen aus den Reihen unseres Koalitionspartners kommen.",data/txt/18022.txt,speech,spd
2796196,22,18,0,,,,448,Beifall bei der SPD und dem BÜNDNIS 90/DIE GRÜNEN sowie bei Abgeordneten der LINKEN,data/txt/18022.txt,poi,
2796197,22,18,0,Hiltrud Lotze (SPD),Hiltrud Lotze,hiltrud-lotze,449,"Im Koalitionsvertrag, für den ich im Übrigen vehement geworben habe, steht wortwörtlich:

Wir wollen die Entwicklung zu einer Energieversorgung ohne Atomenergie und mit stetig wachsendem Anteil erneuerbarer Energien konsequent und planvoll fortführen.

Ich denke, das gilt ohne Wenn und Aber, auch für Bayern und die CSU.",data/txt/18022.txt,speech,spd
2796198,22,18,0,,,,450,Beifall bei der SPD,data/txt/18022.txt,poi,
2796199,22,18,0,Sylvia Kotting-Uhl [BÜNDNIS 90/DIE GRÜNEN],Sylvia Kotting-Uhl,sylvia-kotting-uhl,451,Bei Bayern ist das immer so eine Sache!,data/txt/18022.txt,poi,gruene
2796200,22,18,0,Hiltrud Lotze (SPD),Hiltrud Lotze,hiltrud-lotze,452,"Wir haben im Übrigen - das wurde schon erwähnt - auch die Endlagerfrage noch nicht gelöst. Daher verbietet es sich, darüber nachzudenken, die Atomkraft weiter zu nutzen und so weiteren Atommüll anzuhäufen, ganz abgesehen - darauf habe ich eben schon versucht hinzuweisen - von den Gefahren, die von dieser Technik ausgehen, und den verheerenden Auswirkungen auf Mensch und Natur im Fall eines Unfalls.

Die Überlegungen, Herr Ramsauer, die Sie angestellt haben, befeuern vielleicht die Debatte - das merken wir hier auch -, aber sie sind das falsche Signal. Ich empfinde es so, dass sie Misstrauen säen, und das ausgerechnet in einer Phase, in der die Endlagersuchkommission ihre Arbeit beginnen soll und wir besonderes Vertrauen schaffen müssen, Vertrauen in die Verlässlichkeit von politischen Beschlüssen, Vertrauen in die handelnden Personen. Stattdessen wird hier ohne Not Vertrauen verspielt.",data/txt/18022.txt,speech,spd
2796201,22,18,0,,,,453,Beifall bei der SPD und dem BÜNDNIS 90/DIE GRÜNEN,data/txt/18022.txt,poi,
2796202,22,18,0,Hiltrud Lotze (SPD),Hiltrud Lotze,hiltrud-lotze,454,"Schade auch, Herr Ramsauer, dass Sie heute nicht die Gelegenheit nutzen konnten, an der Sitzung des Umweltausschusses teilzunehmen. Wir hatten eine öffentliche Anhörung.",data/txt/18022.txt,speech,spd
2796203,22,18,0,Dr. Peter Ramsauer [CDU/CSU],Dr. Peter Ramsauer,peter-ramsauer,455,Ich hatte keine Einladung!,data/txt/18022.txt,poi,cducsu
2796204,22,18,0,Hiltrud Lotze (SPD),Hiltrud Lotze,hiltrud-lotze,456,"- Es tut mir leid, aber ich vermute, Ihr Büro wusste, dass diese Sitzung stattfindet.",data/txt/18022.txt,speech,spd
2796205,22,18,0,,,,457,Beifall bei Abgeordneten der SPD und des BÜNDNISSES 90/DIE GRÜNEN,data/txt/18022.txt,poi,
2796206,22,18,0,Steffi Lemke [BÜNDNIS 90/DIE GRÜNEN],Steffi Lemke,steffi-lemke,458,Er hätte sich am Rednerpult entschuldigen können!,data/txt/18022.txt,poi,gruene
2796207,22,18,0,Hiltrud Lotze (SPD),Hiltrud Lotze,hiltrud-lotze,459,"Aber ich glaube, dass die Sitzung aufgezeichnet wurde. Sie können es sich also noch nachträglich anschauen.

Es wäre sicherlich sehr informativ gewesen, dort zuzuhören. Wir haben uns über Tschernobyl und Fukushima informiert. Wir haben vom ehemaligen japanischen Ministerpräsidenten gehört, dass die hochentwickelte und technisierte Nation Japan die Probleme in Fukushima selbst drei Jahre nach dem Unfall nicht in den Griff bekommt. Herr Professor Kusnezow aus Russland hat uns die Probleme und die Situation in Tschernobyl und Russland geschildert und gesagt, er verneige sich vor uns - das fand ich sehr beeindruckend -, weil wir den Atomausstieg besiegelt haben, und Deutschland sei in diesem Prozess eine Lokomotive.",data/txt/18022.txt,speech,spd
2796208,22,18,0,Dr. Peter Ramsauer [CDU/CSU],Dr. Peter Ramsauer,peter-ramsauer,460,Da haben die Russen wieder recht!,data/txt/18022.txt,poi,cducsu
2796209,22,18,0,Hiltrud Lotze (SPD),Hiltrud Lotze,hiltrud-lotze,461,"Ich bin froh, dass wir, die SPD, ein Teil dieser Regierung und damit ein Garant dafür sind, dass wir nicht wieder den Ausstieg aus dem Ausstieg proben. Ich bin froh, dass wir mit Sigmar Gabriel einen Minister haben, der die Energiewende mit Hochdruck vorantreibt. Ich bin mir ganz sicher, dass unsere Kanzlerin aus ehrlicher und tiefer Überzeugung hinter der Energiewende und dem Atomausstieg steht",data/txt/18022.txt,speech,spd
2796210,22,18,0,Dr. Georg Nüßlein [CDU/CSU],Dr. Georg Nüßlein,georg-nußlein,462,So ist das!,data/txt/18022.txt,poi,cducsu
2796211,22,18,0,Oliver Krischer [BÜNDNIS 90/DIE GRÜNEN],Oliver Krischer,oliver-krischer,463,Pfeifen im Walde!,data/txt/18022.txt,poi,gruene
2796212,22,18,0,Hiltrud Lotze (SPD),Hiltrud Lotze,hiltrud-lotze,464,"und nicht erneut versucht, eine Volte zu schlagen. Ich bin mir auch ganz sicher, dass Sie, liebe Kolleginnen und Kollegen von der CSU, Ihre Glaubwürdigkeit in dieser Frage nicht verlieren wollen und natürlich genauso wie wir zum Atomausstieg stehen.",data/txt/18022.txt,speech,spd
2796213,22,18,0,,,,465,Beifall bei der SPD sowie bei Abgeordneten des BÜNDNISSES 90/DIE GRÜNEN,data/txt/18022.txt,poi,
2796214,22,18,0,Hiltrud Lotze (SPD),Hiltrud Lotze,hiltrud-lotze,466,"Liebe Kolleginnen und Kollegen, es ist schon mehrfach in der heutigen Debatte gesagt worden: Der Ausstieg ist beschlossen. Für mich als Sozialdemokratin und als Abgeordnete aus dem Wahlkreis, in dem Gorleben liegt, ist unumstößlich, dass wir nie wieder zur Atomkraft zurückkehren und dass diese Koalition für den endgültigen Ausstieg steht. Ich möchte appellieren, dass wir unsere Energie ab heute noch viel stärker darauf verwenden, für das Gelingen der Energiewende zu arbeiten, weil das ein Beitrag dazu ist, eine bezahlbare, sichere und ökologisch vernünftige Energieversorgung in der Zukunft zu haben.

Vielen Dank.",data/txt/18022.txt,speech,spd
2796215,22,18,0,,,,467,Beifall bei der SPD sowie bei Abgeordneten des BÜNDNISSES 90/DIE GRÜNEN,data/txt/18022.txt,poi,
2796216,22,18,0,Hiltrud Lotze (SPD),Hiltrud Lotze,hiltrud-lotze,468,,data/txt/18022.txt,speech,spd
2796217,22,18,0,Vizepräsidentin Petra Pau,Petra Pau,petra-pau,469,"Kollegin Lotze, das war Ihre erste Rede im Deutschen Bundestag. Wir wünschen Ihnen natürlich viel Erfolg für Ihre Arbeit.

Wenn ich noch einen persönlichen Wunsch, auch im Namen meiner Präsidiumskollegen, anschließen darf: Achten Sie bitte beim nächsten Mal durchaus auch auf die Zeichen für die Redezeit.",data/txt/18022.txt,chair,
2796218,22,18,0,Hiltrud Lotze [SPD],Hiltrud Lotze,hiltrud-lotze,470,Die habe ich nicht mitbekommen!,data/txt/18022.txt,poi,spd
2796219,22,18,0,Vizepräsidentin Petra Pau,Petra Pau,petra-pau,471,"- Genau; es ist mir schon klar, dass das beim ersten Mal so ist, aber ich bitte, in Zukunft darauf zu achten.",data/txt/18022.txt,chair,
2796220,22,18,0,,,,472,Beifall,data/txt/18022.txt,poi,
2796221,22,18,0,Vizepräsidentin Petra Pau,Petra Pau,petra-pau,473,Für die CDU/CSU-Fraktion hat nun der Kollege Christian Haase das Wort.,data/txt/18022.txt,chair,
2796222,22,18,0,,,,474,Beifall bei der CDU/CSU,data/txt/18022.txt,poi,
2796223,22,18,0,Vizepräsidentin Petra Pau,Petra Pau,petra-pau,475,,data/txt/18022.txt,chair,
2796224,22,18,0,Christian Haase (CDU/CSU),Christian Haase,christian-haase,476,"Sehr geehrte Frau Präsidentin! Meine sehr geehrten Damen und Herren! Frau Präsidentin, ich werde es wahrscheinlich nicht schaffen, die Zeit jetzt wieder hereinzuholen, aber ich will mich bemühen.

Die Energiewende in Deutschland kann nur Erfolg haben, wenn das Zieldreieck von Versorgungssicherheit, Nachhaltigkeit und Bezahlbarkeit eingehalten wird. Was bezahlbar ist, dafür haben die knapp 41 Millionen Privathaushalte in Deutschland ein sehr sicheres Gespür, und darauf sollte die Politik hören.

Wenn Sie, liebe Oppositionskollegen von den Grünen - ich sehe, Sie sind noch zu neunt; so wichtig scheint die Debatte für Sie heute nicht zu sein -,",data/txt/18022.txt,speech,cducsu
2796225,22,18,0,Sylvia Kotting-Uhl [BÜNDNIS 90/DIE GRÜNEN],Sylvia Kotting-Uhl,sylvia-kotting-uhl,477,Prozentual mehr als Sie!,data/txt/18022.txt,poi,gruene
2796226,22,18,0,Christian Haase (CDU/CSU),Christian Haase,christian-haase,478,"einmal ein Ohr für die Bürgerinnen und Bürger in unserem Land hätten,

dann wüssten Sie, dass es bei der Energiewende vor allem auf die Akzeptanz in der Bevölkerung ankommt. Genau hierauf hat der Kollege Ramsauer hingewiesen. Er hat auf die Risiken hingewiesen, die das Zieldreieck gefährden könnten. Die Gefahren sind real, und es wäre töricht, sie aus ideologischen Gründen nicht zu bedenken.",data/txt/18022.txt,speech,cducsu
2796227,22,18,0,,,,479,Beifall bei der CDU/CSU,data/txt/18022.txt,poi,
2796228,22,18,0,Christian Haase (CDU/CSU),Christian Haase,christian-haase,480,"Wir haben im Augenblick in der Bevölkerung eine Zustimmung von 89 Prozent zur Energiewende. Doch diese Stimmung kann auch kippen, wenn der Strom zum Luxusgut wird, wenn Unternehmen Arbeitsplätze ins Ausland verlagern oder wenn Stromausfälle das private und öffentliche Leben beeinträchtigen.",data/txt/18022.txt,speech,cducsu
2796229,22,18,0,Sylvia Kotting-Uhl [BÜNDNIS 90/DIE GRÜNEN],Sylvia Kotting-Uhl,sylvia-kotting-uhl,481,Das kann man alles herbeireden!,data/txt/18022.txt,poi,gruene
