id,sitzung,wahlperiode,in_writing,speaker,speaker_cleaned,speaker_fp,sequence,text,filename,type,speaker_party
2817948,37,18,0,,,,349,"Vizepräsident Peter Hintze:

Die Aussprache ist damit beendet.

Es gibt eine Reihe von Erklärungen nach § 31 der Geschäftsordnung, die wir zu Protokoll nehmen.

Wir kommen nun zur Abstimmung über den von der Bundesregierung eingebrachten Entwurf eines Gesetzes über Leistungsverbesserungen in der gesetzlichen Rentenversicherung. Der Ausschuss für Arbeit und Soziales empfiehlt unter Buchstabe a seiner Beschlussempfehlung auf Drucksache 18/1489, den Gesetzentwurf der Bundesregierung auf Drucksache 18/909 in der Ausschussfassung anzunehmen. Hierzu liegen drei Änderungsanträge der Fraktion Die Linke vor. Die antragstellende Fraktion wünscht jeweils namentliche Abstimmung. Nach diesen drei namentlichen Abstimmungen unterbreche ich die Sitzung bis zum Vorliegen der Ergebnisse. Anschließend erfolgen die namentliche Schlussabstimmung und weitere einfache Abstimmungen.

Wir kommen damit zur ersten namentlichen Abstimmung, und zwar über den Änderungsantrag auf Druck-sache 18/1495. Ich bitte die Schriftführerinnen und Schriftführer, die vorgesehenen Plätze einzunehmen. - Sind die Plätze an den Urnen besetzt? - Das ist der Fall. Dann eröffne ich die namentliche Abstimmung über den ersten Änderungsantrag.

Ist noch ein Mitglied des Hauses anwesend, das seine Stimme nicht abgegeben hat? - Das ist nicht der Fall. Dann schließe ich die Abstimmung und bitte die Schriftführerinnen und Schriftführer, mit der Auszählung zu beginnen. Das Ergebnis der namentlichen Abstimmung wird Ihnen später bekannt gegeben.

Wir kommen damit zur zweiten namentlichen Abstimmung, und zwar über den Änderungsantrag auf Drucksache 18/1496. Sind die Plätze an den Urnen besetzt? - Das ist der Fall. Ich eröffne die Abstimmung über den zweiten Änderungsantrag.

Ist noch ein Mitglied des Hauses anwesend, das seine Stimme nicht abgegeben hat? - Das ist nicht der Fall. Dann schließe ich die Abstimmung und bitte die Schriftführerinnen und Schriftführer, mit der Auszählung zu beginnen. Das Ergebnis der Abstimmung wird Ihnen später bekannt gegeben.

Wir kommen damit zur dritten namentlichen Abstimmung, und zwar über den Änderungsantrag auf Drucksache 18/1497. Sind die Plätze an den Urnen besetzt? - Das ist der Fall. Ich eröffne die namentliche Abstimmung über den dritten Änderungsantrag. Gibt es noch ein Mitglied des Hauses, das seine Stimme nicht abgegeben hat?  - Das ist nicht der Fall. Dann schließe ich diese Abstimmung.

Bis zum Vorliegen der Ergebnisse der namentlichen Abstimmungen unterbreche ich die Sitzung. Ich empfehle aber, im Bereich des Plenarsaals zu bleiben.",data/txt/18037.txt,speech,
2817949,37,18,0,,,,350,Unterbrechung von 12.20 bis 12.28 Uhr,data/txt/18037.txt,poi,
