id,sitzung,wahlperiode,in_writing,speaker,speaker_cleaned,speaker_fp,sequence,text,filename,type,speaker_party
2818239,37,18,0,,,,640,"Kein Gesetz verlässt den Bundestag so, wie es hineingekommen ist.

Kurzum: Das Gesetzgebungsverfahren, wie wir es kennen, bietet ein hohes Maß an thematischer Tiefe und Flexibilität. Ein solch ausdifferenziertes und umfassendes Verfahren kann ein Plebiszit nicht bieten. Denn bei einer Volksabstimmung - das haben Sie richtig wiedergegeben; Kollege Brandt hat es hier schon dargestellt - geht es letztlich immer nur um die Frage: ja oder nein, schwarz oder weiß?",data/txt/18037.txt,speech,
2818240,37,18,0,Halina Wawzyniak [DIE LINKE],Halina Wawzyniak,halina-wawzyniak,641,Oder Enthaltung!,data/txt/18037.txt,poi,linke
2818241,37,18,0,,,,642,"Ein Ja, aber ist nicht vorgesehen, und Farbnuancen gibt es nicht.

Die Gesetzgebung ist oftmals aber sehr vielschichtig und muss eine kaum überschaubare Vernetzung mit anderen Regelungsbereichen berücksichtigen. Volksentscheide erlauben eine solch detailreiche Abstimmung nicht. Die unangemessene Verkürzung vieler Sachthemen könnte leicht zu populistisch beeinflussten Ergebnissen führen, Ergebnissen, bei denen die notwendigen Kompromisse der parlamentarischen Diskussion auf der Strecke bleiben. Es besteht die Gefahr, dass nicht auf Grundlage von sachlichen Erwägungen entschieden wird, sondern dass sich Tür und Tor für Stimmungen und Emotionen öffnen.",data/txt/18037.txt,speech,
2818242,37,18,0,Halina Wawzyniak [DIE LINKE],Halina Wawzyniak,halina-wawzyniak,643,Das passiert hier nie!,data/txt/18037.txt,poi,linke
2818243,37,18,0,,,,644,"Wir wären jedoch schlecht beraten, wenn wir uns in wichtigen Sachfragen von Stimmungen und vor allem von Stimmungsmachern leiten lassen würden.",data/txt/18037.txt,speech,
2818244,37,18,0,Dr. Konstantin von Notz [BÜNDNIS 90/DIE GRÜNEN],Dr. Konstantin von Notz,konstantin-notz,645,Wie in Bayern!,data/txt/18037.txt,poi,gruene
2818245,37,18,0,,,,646,"Ich bin davon überzeugt: Dies würde insbesondere auch - das dürfte Sie besonders interessieren - zulasten von Minderheiten und gesellschaftlich benachteiligten Gruppen gehen. Hinzu kommt: Bei einem Volksentscheid kann die größere Finanzkraft - das ist wieder ein Argument von Herrn Brandt; das erwähne ich, um Sie zu erfreuen - bestimmter Akteure den Ausschlag hinsichtlich Erfolg oder Misserfolg geben: ein größeres Werbebudget für eine bessere Präsenz in den Medien, Abmahnwellen und juristische Spielchen durch Anwälte zur Einschüchterung des politischen Gegners, um nur einige Aspekte zu nennen. In der Welt der Volksentscheide gilt oftmals das Recht des Stärkeren und nicht unbedingt das des besseren Arguments.",data/txt/18037.txt,speech,
2818246,37,18,0,,,,647,Beifall bei der CDU/CSU,data/txt/18037.txt,poi,
2818247,37,18,0,Halina Wawzyniak [DIE LINKE],Halina Wawzyniak,halina-wawzyniak,648,Aber hier auch nicht! Hier gelten die besseren Argumente auch nicht! Das sieht man ja gerade wieder!,data/txt/18037.txt,poi,linke
2818248,37,18,0,,,,649,"Sie werden jetzt vermutlich einwenden, dass man mit kommunalen Formen der Bürgerbeteiligung bisher keine schlechten Erfahrungen gemacht hat. Das mag sein. Allerdings lassen sich Volksentscheide auf diesen Ebenen nur schlecht mit solchen auf der Bundesebene vergleichen. In einem kommunalen Kontext sind die politischen Fragen zumeist überschaubarer.",data/txt/18037.txt,speech,
2818249,37,18,0,Halina Wawzyniak [DIE LINKE],Halina Wawzyniak,halina-wawzyniak,650,"Ja, ja, schon klar!",data/txt/18037.txt,poi,linke
2818250,37,18,0,,,,651,"Sie können einfacher überblickt werden. Auf Bundesebene sähe das anders aus, auch deshalb, weil dort viele Sachfragen eine europäische oder internationale Dimension haben.

Liebe Kolleginnen und Kollegen, wir Abgeordnete sind von den Bürgern gewählt und dazu berufen, das Volk zu vertreten. Dafür stellen wir uns alle vier Jahre zur Wahl. Der Bürger befindet mit seiner Stimme darüber, ob wir seine Interessen überzeugend vertreten haben oder eben nicht. Nicht zuletzt aufgrund von namentlichen Abstimmungen können jede Wählerin und jeder Wähler nachvollziehen, ob wir unsere Aufgabe in ihrem bzw. seinem Sinne erledigt haben.

Ich bin der Meinung, dass in den letzten Jahren vor allem die Möglichkeiten des Internets die Teilhabe der Bürger an politischen Prozessen verbessert haben. Es bieten sich zahlreiche Foren und Plätze, sich in den Gesetzgebungsprozess einzubringen.",data/txt/18037.txt,speech,
2818251,37,18,0,Halina Wawzyniak [DIE LINKE],Halina Wawzyniak,halina-wawzyniak,652,"Aber nicht, um mitzuentscheiden!",data/txt/18037.txt,poi,linke
2818252,37,18,0,,,,653,"Genannt seien hier etwa die Onlinepetition, soziale Netzwerke und Partizipationsplattformen Dritter. Für die Bürger war es noch nie so einfach, sich politisch zu beteiligen und ihre Meinung auch auf Bundesebene kundzutun.",data/txt/18037.txt,speech,
2818253,37,18,0,Halina Wawzyniak [DIE LINKE],Halina Wawzyniak,halina-wawzyniak,654,Aber sie können nicht mitentscheiden!,data/txt/18037.txt,poi,linke
2818254,37,18,0,,,,655,"Schließen möchte ich mit einem Verweis auf die Festrede von Navid Kermani heute Morgen in der Feierstunde. Sie können sich sicherlich vorstellen, dass mir nicht alle Passagen dieser Rede gefallen haben.",data/txt/18037.txt,speech,
2818255,37,18,0,Dr. Konstantin von Notz [BÜNDNIS 90/DIE GRÜNEN],Dr. Konstantin von Notz,konstantin-notz,656,Was?,data/txt/18037.txt,poi,gruene
2818256,37,18,0,Özcan Mutlu [BÜNDNIS 90/DIE GRÜNEN],Özcan Mutlu,ozcan-mutlu,657,Warum nicht?,data/txt/18037.txt,poi,gruene
2818257,37,18,0,,,,658,"Aber die Passage, die ich jetzt mit Ihrer Erlaubnis, Frau Präsidentin, zitieren möchte, hat mir schon gefallen; denn er hat gesagt - ich zitiere -:

Das Interesse der Öffentlichkeit am Grundgesetz war aus heutiger Sicht beschämend gering, die Zustimmung innerhalb der Bevölkerung marginal. Befragt, wann für sie die beste Zeit gewesen sei, entschieden sich noch 1951 in einer repräsentativen Umfrage 45 Prozent der Deutschen für das Kaiserreich, 7 Prozent für die Weimarer Republik

- da ist sie dann doch einmal, die Weimarer Republik -,",data/txt/18037.txt,speech,
2818258,37,18,0,Dr. Konstantin von Notz [BÜNDNIS 90/DIE GRÜNEN],Dr. Konstantin von Notz,konstantin-notz,659,Das wäre aber nicht abstimmungsfähig!,data/txt/18037.txt,poi,gruene
2818259,37,18,0,,,,660,"42 Prozent für die Zeit des Nationalsozialismus und nur 2 Prozent für die Bundesrepublik.  Wie froh müssen wir sein, dass am Anfang der Bundesrepublik Politiker standen, die ihr Handeln nicht nach Umfragen, sondern nach ihren Überzeugungen ausrichteten.

Herzlichen Dank.",data/txt/18037.txt,speech,
2818260,37,18,0,,,,661,Beifall bei der CDU/CSU sowie bei Abgeordneten der SPD,data/txt/18037.txt,poi,
2818261,37,18,0,Özcan Mutlu [BÜNDNIS 90/DIE GRÜNEN],Özcan Mutlu,ozcan-mutlu,662,Bayern hat das Grundgesetz 1949 abgelehnt!,data/txt/18037.txt,poi,gruene
2818262,37,18,0,Halina Wawzyniak [DIE LINKE],Halina Wawzyniak,halina-wawzyniak,663,Da hat er recht!,data/txt/18037.txt,poi,linke
2818263,37,18,0,Dr. Konstantin von Notz [BÜNDNIS 90/DIE GRÜNEN],Dr. Konstantin von Notz,konstantin-notz,664,"Ja, da hat er recht!",data/txt/18037.txt,poi,gruene
2818264,37,18,0,,,,665,"Vizepräsidentin Claudia Roth:

Ja, wo er recht hat, hat er recht. - Vielen Dank, Herr Kollege.

Es gab mehrere Zwischenrufe in Bezug auf Bayern vom Kollegen Konstantin von Notz, der weit weg von Bayern, in Schleswig-Holstein, lebt. Ich glaube, Herr von Notz, ich kann Ihnen im Namen all meiner bayerischen Kollegen versichern, dass wir eine recht lebendige Demokratie bei uns haben, die auch ziemlich direkt ist.",data/txt/18037.txt,speech,
2818265,37,18,0,,,,666,"Beifall bei Abgeordneten der CDU/CSU, der SPD und des BÜNDNISSES 90/DIE GRÜNEN",data/txt/18037.txt,poi,
2818266,37,18,0,Michael Grosse-Brömer [CDU/CSU],Michael Grosse-Brömer,michael-grosse-bromer,667,In Festzelten!,data/txt/18037.txt,poi,cducsu
2818267,37,18,0,,,,668,"Der nächste Redner in der Debatte: Özcan Mutlu, Bündnis 90/Die Grünen.

Özcan Mutlu (BÜNDNIS 90/DIE GRÜNEN):

Frau Präsidentin! Meine Damen und Herren! Liebe Frau Wawzyniak, wir nehmen Ihr Gesprächsangebot gerne an.",data/txt/18037.txt,speech,
2818268,37,18,0,,,,669,Beifall bei der LINKEN,data/txt/18037.txt,poi,
2818269,37,18,0,Halina Wawzyniak [DIE LINKE],Halina Wawzyniak,halina-wawzyniak,670,Danke!,data/txt/18037.txt,poi,linke
2818270,37,18,0,,,,671,"Bündnis 90/Die Grünen ist nämlich die Partei, die sich seit ihrer Gründung konsequent für die Stärkung und die Erweiterung der direkten Demokratie in Deutschland eingesetzt hat und sich auch weiter dafür einsetzen wird. So haben wir seit 2002 in mehreren Anläufen in diesem Hohen Hause für eine Mehrheit geworben, damit das Grundgesetz geändert werden kann und bundesweite Volksentscheide möglich werden.",data/txt/18037.txt,speech,
2818271,37,18,0,,,,672,Beifall beim BÜNDNIS 90/DIE GRÜNEN,data/txt/18037.txt,poi,
2818272,37,18,0,,,,673,"Unser letzter Anlauf ist an der Mehrheit von CDU/CSU und FDP, um nicht zu sagen: an der Verweigerung dieser Parteien, leider gescheitert. So wird es vermutlich auch Ihrem Gesetzentwurf ergehen. Ich bin auf die Debatten im Ausschuss gespannt.

Meine Damen und Herren, auch wenn es Teile des Hohen Hauses wohl immer noch nicht wahrhaben wollen: Die Ergänzung unserer parlamentarischen Demokratie durch direktdemokratische Entscheidungsmöglichkeiten ist auf kommunaler wie auf Landesebene eine Erfolgsstory, ein Erfolgsmodell. Ich bin mir ziemlich sicher: Sie wird bei richtiger Ausgestaltung auch auf Bundesebene ein Erfolgsmodell werden.

Weil wir hier verschiedene Kollegen gehört haben, sei mir an dieser Stelle noch folgende Randbemerkung erlaubt: Gerade diejenigen, die hier am lautesten immer wieder gegen Plebiszite argumentieren und die gegen die Schaffung von Volksentscheiden auf Bundesebene sind, gerade diese verstehen es am besten, auf kommunaler Ebene und auf Landesebene Volksentscheide zu nutzen und sie für ihre parteipolitischen Zwecke zu instrumentalisieren.",data/txt/18037.txt,speech,
2818273,37,18,0,Michael Frieser [CDU/CSU],Michael Frieser,michael-frieser,674,Falsch!,data/txt/18037.txt,poi,cducsu
2818274,37,18,0,,,,675,"Als Berliner Abgeordneter kann ich Ihnen da gerne zwei Beispiele nennen:

Ich erinnere an den Volksentscheid gegen die Schließung des Flughafens Tempelhof,",data/txt/18037.txt,speech,
2818275,37,18,0,Michael Frieser [CDU/CSU],Michael Frieser,michael-frieser,676,Ah!,data/txt/18037.txt,poi,cducsu
2818276,37,18,0,,,,677,"wo die CDU Berlin an vorderster Front marschiert ist, obwohl sie immer gegen Volksentscheide war.",data/txt/18037.txt,speech,
2818277,37,18,0,Renate Künast [BÜNDNIS 90/DIE GRÜNEN],Renate Künast,renate-kunast,678,"Was, die haben Volksentscheide gemacht?",data/txt/18037.txt,poi,gruene
2818278,37,18,0,,,,679,Das andere Beispiel aus Berlin ist die Einführung des Schulfachs Ethik; auch da hat die CDU mit erhobener Fahne an vorderster Front im Rahmen eines Volksentscheids gegen die Einführung dieses Schulfachs gekämpft.,data/txt/18037.txt,speech,
2818279,37,18,0,Renate Künast [BÜNDNIS 90/DIE GRÜNEN],Renate Künast,renate-kunast,680,Hört! Hört!,data/txt/18037.txt,poi,gruene
2818280,37,18,0,Halina Wawzyniak [DIE LINKE],Halina Wawzyniak,halina-wawzyniak,681,Die haben eine Fahne?,data/txt/18037.txt,poi,linke
2818281,37,18,0,Dr. Tim Ostermann [CDU/CSU],Dr. Tim Ostermann,tim-ostermann,682,Weil sie recht hat!,data/txt/18037.txt,poi,cducsu
2818282,37,18,0,,,,683,"Kollege Ostermann hat das Stichwort Stimmungsmacher in den Raum gestellt. Da sage ich: Schaut nach Bayern! Ein Schelm, wer Böses dabei denkt.",data/txt/18037.txt,speech,
2818283,37,18,0,Dr. Tim Ostermann [CDU/CSU],Dr. Tim Ostermann,tim-ostermann,684,Von Bayern lernen heißt siegen lernen!,data/txt/18037.txt,poi,cducsu
2818284,37,18,0,Renate Künast [BÜNDNIS 90/DIE GRÜNEN],Renate Künast,renate-kunast,685,Herr Seehofer will keine Konkurrenz!,data/txt/18037.txt,poi,gruene
2818285,37,18,0,,,,686,"Meine Damen und Herren, uns ist bewusst, dass eine Entscheidung noch Zeit braucht, und wir werden weiter an diesem dicken Brett bohren, vielleicht auch mit den Linken, vielleicht auch mit den Sozialdemokraten. Dennoch können wir - da muss ich die Freude leider schon stoppen - dem Gesetzentwurf der Linken in der vorliegenden Form nicht zustimmen.",data/txt/18037.txt,speech,
2818286,37,18,0,Michael Frieser [CDU/CSU],Michael Frieser,michael-frieser,687,Oh!,data/txt/18037.txt,poi,cducsu
2818287,37,18,0,,,,688,"Wir lehnen die von Ihnen vorgeschlagene Regelung ab, dass vertragliche Grundlagen der Europäischen Union, die das Grundgesetz ändern, zukünftig per Volksabstimmung angenommen werden müssen. Diese Regelung kann durchaus europafeindlich wirken und birgt die Gefahr, parteipolitisch instrumentalisiert zu werden.",data/txt/18037.txt,speech,
2818288,37,18,0,Halina Wawzyniak [DIE LINKE],Halina Wawzyniak,halina-wawzyniak,689,Hä? -Verstehe ich nicht!,data/txt/18037.txt,poi,linke
2818289,37,18,0,,,,690,Zugleich ist dieser Gesetzentwurf für mich - auch wenn Sie das jetzt nicht gerne hören - irgendwie auch ein Ausdruck des Fremdelns der Linken mit der Europäischen Union.,data/txt/18037.txt,speech,
2818290,37,18,0,Michael Frieser [CDU/CSU],Michael Frieser,michael-frieser,691,Das ist sehr vorsichtig formuliert!,data/txt/18037.txt,poi,cducsu
2818291,37,18,0,Halina Wawzyniak [DIE LINKE],Halina Wawzyniak,halina-wawzyniak,692,Das müssen Sie noch einmal erklären!,data/txt/18037.txt,poi,linke
2818292,37,18,0,,,,693,- In der Rede haben Sie nichts dazu gesagt; aber ich lese das aus Ihrem Gesetzentwurf.,data/txt/18037.txt,speech,
2818293,37,18,0,,,,694,Beifall bei Abgeordneten des BÜNDNISSES 90/DIE GRÜNEN,data/txt/18037.txt,poi,
2818294,37,18,0,,,,695,Dieses Gefühl teilen wir ganz und gar nicht. Wir Grüne sind eine entschieden proeuropäische Partei.,data/txt/18037.txt,speech,
2818295,37,18,0,Halina Wawzyniak [DIE LINKE],Halina Wawzyniak,halina-wawzyniak,696,Wir auch!,data/txt/18037.txt,poi,linke
2818296,37,18,0,,,,697,"Wir finden es richtig, dass das Grundgesetz - wir haben heute den 65. Jahrestag seines Inkrafttretens gefeiert - die Verankerung Deutschlands und die immer tiefere Integration Europas substanziell festschreibt. Die Europaoffenheit unseres Grundgesetzes, der darin festgeschriebene Auftrag der europäischen Integration, das ist keine Schwäche, sondern eine Stärke unseres Grundgesetzes.",data/txt/18037.txt,speech,
2818297,37,18,0,Halina Wawzyniak [DIE LINKE],Halina Wawzyniak,halina-wawzyniak,698,Sehen wir auch so!,data/txt/18037.txt,poi,linke
2818298,37,18,0,,,,699,"- Das ist sehr schön; dann werden wir ja sehen, was Sie in den Ausschussberatungen sagen.

Deshalb können wir dem Gesetzentwurf der Linken in dieser Form nicht zustimmen. Wir finden sehr wohl, dass europäische Angelegenheiten auch europäisch - von allen Bürgerinnen und Bürgern Europas - entschieden werden müssen. Wir Grüne wollen die Bürgerinnen und Bürger in Europa - und auch in Deutschland selbstverständlich - stärken. Wir wollen mit dem Ziel einer weiteren Demokratisierung Europas die Institutionen Europas und die Entscheidungsrechte des Europäischen Parlaments stärken, statt sie durch nationale Vorbehalte einzuschränken.",data/txt/18037.txt,speech,
2818299,37,18,0,,,,700,Beifall der Abg. Anja Hajduk [BÜNDNIS 90/DIE GRÜNEN],data/txt/18037.txt,poi,
2818300,37,18,0,,,,701,"In unseren Augen ist der Konflikt zwischen den Elementen direkter Demokratie und den Werten und Zielen einer proeuropäischen Politik nur auflösbar, wenn und indem wir mit aller Konsequenz daran arbeiten, die Entscheidungsprozesse auf europäischer Ebene weiter zu demokratisieren und zu festigen.

Vizepräsidentin Claudia Roth:

Denken Sie an Ihre Redezeit!

Özcan Mutlu (BÜNDNIS 90/DIE GRÜNEN):

Ich denke an meine Redezeit.",data/txt/18037.txt,speech,
2818301,37,18,0,Michael Grosse-Brömer [CDU/CSU],Michael Grosse-Brömer,michael-grosse-bromer,702,Zu -wenig!,data/txt/18037.txt,poi,cducsu
2818302,37,18,0,,,,703,"Ich hoffe, ich konnte ein wenig deutlich machen, Frau Präsidentin, liebe Linke,",data/txt/18037.txt,speech,
2818303,37,18,0,,,,704,Heiterkeit,data/txt/18037.txt,poi,
2818304,37,18,0,,,,705,"wie wichtig uns diese Punkte sind und was wir als schädlich für die weitere Entwicklung Europas ansehen.

Ein letzter Satz sei mir erlaubt,",data/txt/18037.txt,speech,
2818305,37,18,0,Michael Grosse-Brömer [CDU/CSU],Michael Grosse-Brömer,michael-grosse-bromer,706,Da werden die Satzzeichen plötzlich ganz wichtig!,data/txt/18037.txt,poi,cducsu
2818306,37,18,0,,,,707,"weil ich Berliner bin: Am Sonntag wählt Berlin nicht nur das Europäische Parlament, in Berlin steht auch ein Volksentscheid an. Das ist eine exzellente Gelegenheit, zu zeigen, wie gut direkte Demokratie funktionieren kann. Als Berliner Abgeordneter wünsche ich mir, dass viele Berlinerinnen und Berliner am Sonntag zur Wahl gehen -

Vizepräsidentin Claudia Roth:

Das wünschen wir auch - und dass Sie jetzt zum Ende kommen.

Özcan Mutlu (BÜNDNIS 90/DIE GRÜNEN):

- und sich für die nachhaltige Zukunft des Tempelhofer Feldes einsetzen.

Danke sehr, Frau Präsidentin.",data/txt/18037.txt,speech,
2818307,37,18,0,,,,708,Beifall bei Abgeordneten des BÜNDNISSES 90/DIE GRÜNEN und der LINKEN,data/txt/18037.txt,poi,
2818308,37,18,0,,,,709,"Vizepräsidentin Claudia Roth:

Danke, Herr Kollege. - Nächster Redner: Dr. Lars Castellucci für die SPD.",data/txt/18037.txt,speech,
2818309,37,18,0,,,,710,Beifall bei der SPD sowie bei Abgeordneten der CDU/CSU,data/txt/18037.txt,poi,
2818310,37,18,0,,,,711,"Dr. Lars Castellucci (SPD):

Frau Präsidentin! Werte Kollegen! Kolleginnen! Meine Damen und Herren! Das ist ein guter Tag, um über Demokratie zu sprechen; denn wir haben noch ein weiteres Geburtstagskind",data/txt/18037.txt,speech,
2818311,37,18,0,Michael Grosse-Brömer [CDU/CSU],Michael Grosse-Brömer,michael-grosse-bromer,712,Das Grundgesetz!,data/txt/18037.txt,poi,cducsu
2818312,37,18,0,,,,713,"- neben dem Grundgesetz -, nämlich die SPD. Sie wird heute 151 Jahre alt.",data/txt/18037.txt,speech,
2818313,37,18,0,Zurufe von der SPD,e von der SPD,e-spd,714,Ganz schön jung!,data/txt/18037.txt,poi,spd
2818314,37,18,0,,,,715,Das sieht man ihr aber nicht an!,data/txt/18037.txt,poi,
2818315,37,18,0,Michael Frieser [CDU/CSU],Michael Frieser,michael-frieser,716,Knapp vor der Rente!,data/txt/18037.txt,poi,cducsu
2818316,37,18,0,Michael Grosse-Brömer [CDU/CSU],Michael Grosse-Brömer,michael-grosse-bromer,717,Jetzt verstehe ich die Rente mit 63!,data/txt/18037.txt,poi,cducsu
2818317,37,18,0,,,,718,"Ich gehe davon aus, dass wir jetzt nicht singen, Frau Präsidentin.",data/txt/18037.txt,speech,
2818318,37,18,0,,,,719,Heiterkeit bei Abgeordneten der SPD und der CDU/CSU,data/txt/18037.txt,poi,
2818319,37,18,0,,,,720,"Vizepräsidentin Claudia Roth:

Was müssten wir denn dann jetzt singen? - Das tun wir jetzt aber nicht; nein, das lassen wir.

Dr. Lars Castellucci (SPD):

Das üben wir noch.

Vizepräsidentin Claudia Roth:

Brüder, zur Sonne, zur Freiheit, und die Frauen putzen die Fenster. - Nein, Entschuldigung.

Dr. Lars Castellucci (SPD):

Gut. - Die Geschichte der SPD ist eine Demokratisierungsgeschichte: Die Arbeiterbewegung hat einst das allgemeine, freie und gleiche Wahlrecht erkämpft, später kam das Frauenwahlrecht dazu.

Willy Brandt ist heute schon sehr oft zitiert worden: Wir wollen mehr Demokratie wagen. Das ist nicht nur unsere Geschichte, sondern auch unser Auftrag. Deshalb unterstützen wir als Sozialdemokratinnen und Sozialdemokraten auch, dass es mehr Mitwirkungsmöglichkeiten für die Menschen in Deutschland geben soll. Wir sind für die Einführung von Volksinitiativen, Volksbegehren und Volksentscheiden auf Bundesebene.",data/txt/18037.txt,speech,
2818320,37,18,0,,,,721,Beifall der Abg. Halina Wawzyniak [DIE LINKE],data/txt/18037.txt,poi,
2818321,37,18,0,,,,722,"Wir wollen auch das Wahlalter auf 16 Jahre senken, wir wollen die Menschen direkter in die vielfältigen Formen der Bürgerbeteiligungsverfahren einbeziehen, und wir wollen auch, dass Gruppen, die heute noch nicht wählen können, die Möglichkeit dazu erhalten. Denken wir zum Beispiel an die Menschen mit ausländischem Pass. Wir glauben, dass die generelle Hinnahme der Mehrstaatlichkeit ein geeigneter Schlüssel sein kann, um hier Schritte nach vorne zu gehen. Im Koalitionsvertrag haben wir uns daneben immerhin vorgenommen, dass wir für diejenigen, die umfassend betreut werden, die rechtlichen Hemmnisse zur Ausübung des Wahlrechts abbauen wollen. Wir müssen miteinander besprechen, wie das gehen kann.

Demokratie ist also ein sehr wichtiges Thema. Deswegen ist es auch grundsätzlich sehr gut, dass wir heute diese Debatte führen.",data/txt/18037.txt,speech,
2818322,37,18,0,,,,723,Beifall bei der SPD sowie bei Abgeordneten der LINKEN,data/txt/18037.txt,poi,
2818323,37,18,0,,,,724,"Gleichzeitig handelt es sich ja um eine Übung, die schon eine gewisse Wiederholung kennt, weil leider mit der Union nichts zu machen ist.",data/txt/18037.txt,speech,
2818324,37,18,0,Dr. Tim Ostermann [CDU/CSU],Dr. Tim Ostermann,tim-ostermann,725,Was?,data/txt/18037.txt,poi,cducsu
2818325,37,18,0,Michael Grosse-Brömer [CDU/CSU],Michael Grosse-Brömer,michael-grosse-bromer,726,Mit uns ist viel gelungen!,data/txt/18037.txt,poi,cducsu
2818326,37,18,0,,,,727,Auch in den Koalitionsverhandlungen haben wir daran nichts ändern können.,data/txt/18037.txt,speech,
2818327,37,18,0,Michael Grosse-Brömer [CDU/CSU],Michael Grosse-Brömer,michael-grosse-bromer,728,Was wir heute schon alles gemeinsam gemacht haben!,data/txt/18037.txt,poi,cducsu
2818328,37,18,0,Richard Pitterle [DIE LINKE],Richard Pitterle,richard-pitterle,729,Die Betonung liegt auf nichts!,data/txt/18037.txt,poi,linke
2818329,37,18,0,,,,730,"Heute war ja schon einmal von Carlo Schmid, einem unserer Verfassungsväter, die Rede. Carlo Schmid berichtet in seinen Memoiren von einer Begegnung mit Adenauer. Adenauer sagte ihm - ich zitiere -:

Was uns beide unterscheidet

- also Schmid und Adenauer -:

Sie glauben an den Menschen, ich glaube nicht an den Menschen und habe nie an den Menschen geglaubt.",data/txt/18037.txt,speech,
2818330,37,18,0,Michael Grosse-Brömer [CDU/CSU],Michael Grosse-Brömer,michael-grosse-bromer,731,Wer soll das gesagt haben?,data/txt/18037.txt,poi,cducsu
2818331,37,18,0,,,,732,"Das ist zwar etwas entfernt von einem christlichen Menschenbild, aber man kann bei der Biografie des Altkanzlers vielleicht Respekt vor dieser Meinung haben. Man sollte möglicherweise aber nicht bei Adenauer stehen bleiben.

Wir haben heute wirklich viel Grund dazu, die Beteiligungsmöglichkeiten der Menschen auszuweiten, und, anders als Herr Ostermann gesagt hat - man findet immer die Umfrage, die man gebrauchen kann -, wünschen sich die Menschen auch die Beteiligungsmöglichkeiten.",data/txt/18037.txt,speech,
2818332,37,18,0,,,,733,Beifall bei Abgeordneten der SPD und der LINKEN,data/txt/18037.txt,poi,
2818333,37,18,0,Michael Frieser [CDU/CSU],Michael Frieser,michael-frieser,734,Wieder Applaus von der falschen Seite!,data/txt/18037.txt,poi,cducsu
2818334,37,18,0,,,,735,"Nach einer Umfrage der Bertelsmann-Stiftung sind es 80 Prozent.

Passen Sie jetzt einmal auf: Es gibt sogar Hinweise, dass Ihre Wählerinnen und Wähler das nicht nur wollen, sondern dass sie bei diesen direkten Verfahren sogar verstärkt zur Abstimmung gehen würden, womit Sie einen weiteren Hebel in der Hand hätten, Ihre Politik durchzusetzen.",data/txt/18037.txt,speech,
2818335,37,18,0,Michael Frieser [CDU/CSU],Michael Frieser,michael-frieser,736,Schauen Sie nach Bayern!,data/txt/18037.txt,poi,cducsu
2818336,37,18,0,,,,737,"Das habe ich Ihnen jetzt natürlich nicht verraten, aber vielleicht gibt Ihnen das zu denken.

Es ist sicherlich falsch, von einer Krise der Demokratie zu sprechen. Wir haben heute zu Recht darauf hingewiesen, dass sich die repräsentative Demokratie bewährt hat. Gleichzeitig bangen wir alle und fragen uns, wie hoch die Wahlbeteiligung am Sonntag werden wird.",data/txt/18037.txt,speech,
2818337,37,18,0,Stephan Mayer [Altötting] [CDU/CSU],Stephan Mayer,stephan-mayer,738,Das ist bei Volksentscheiden nicht besser!,data/txt/18037.txt,poi,cducsu
2818338,37,18,0,,,,739,"Die Mitgliederzahlen der Parteien sinken. Deswegen sind wir gut beraten, zu überlegen, wie wir die Demokratie lebendig halten und mehr Menschen für sie begeistern können.

Verehrte Kollegen von den Linken, an dieser Stelle möchte ich einen Punkt aus Ihrem Antrag herausgreifen, bei dem ich glaube, dass Sie damit dem Wunsch, Begeisterung auszulösen, zuwiderhandeln.

Sie schlagen vor, dass, wenn es einen Volksentscheid gibt, jede Fraktion im Deutschen Bundestag ihren Vorschlag gleichzeitig auch zur Abstimmung stellen kann.",data/txt/18037.txt,speech,
2818339,37,18,0,Halina Wawzyniak [DIE LINKE],Halina Wawzyniak,halina-wawzyniak,740,Das können wir verhandeln!,data/txt/18037.txt,poi,linke
2818340,37,18,0,,,,741,"Damit leisten Sie der direkten Demokratie einen Bärendienst. In Wahrheit werden damit die Rechte von Parlamentsfraktionen ausgeweitet, und das ist eigentlich das Gegenteil von mehr Beteiligung der Bürgerinnen und Bürger.",data/txt/18037.txt,speech,
2818341,37,18,0,Halina Wawzyniak [DIE LINKE],Halina Wawzyniak,halina-wawzyniak,742,Verhandelbar! Das können wir verhandeln!,data/txt/18037.txt,poi,linke
