id,sitzung,wahlperiode,in_writing,speaker,speaker_cleaned,speaker_fp,sequence,text,filename,type,speaker_party
2818042,37,18,0,,,,443,"Sie haben noch etwas anderes vor: Sie wollen Ausschreibungen einführen und in Zukunft die Vergütungshöhe per Ausschreibung ermitteln. Ich habe kein Problem damit, dass man Modellversuche durchführt und prüft, wie man die Förderung der Erneuerbaren effizienter gestalten kann.

Aber Sie sehen vor, dass die Ermittlung der Förderhöhe über Ausschreibungen ab 1. Januar 2017 für alle verbindlich gelten soll. Dabei haben Sie selber überhaupt keine Vorstellung, wie das Ganze funktionieren soll.",data/txt/18037.txt,speech,
2818043,37,18,0,Thomas Bareiß [CDU/CSU],Thomas Bareiß,thomas-bareiß,444,Deshalb machen wir das Modell! Deshalb machen wir die Pilotprojekte!,data/txt/18037.txt,poi,cducsu
2818044,37,18,0,,,,445,"Es gibt europaweit nur negative Erfahrungen. Es gibt keine positiven Erfahrungen. In anderen Ländern ist entweder nichts mehr gebaut worden oder es ist teurer geworden. Es ist gescheitert.

Das macht keinen Sinn. Damit machen Sie die Bürger-energie, die dezentrale Energiewende, kaputt. Die vielen Menschen, die sich engagieren wollen, können mit diesem Modell nicht klarkommen. Sie können gerne einen Versuch machen; aber Sie sollten sich nicht hinter der EU-Kommission verstecken und darauf verweisen, dass sie uns zu diesen Ausschreibungen verpflichte. Nutzen Sie lieber die vorhandenen Spielräume! Das ist eine Chance und eine Perspektive.",data/txt/18037.txt,speech,
2818045,37,18,0,,,,446,Beifall beim BÜNDNIS 90/DIE GRÜNEN,data/txt/18037.txt,poi,
2818046,37,18,0,,,,447,"Dass wir überhaupt noch einen Ausbau der erneuerbaren Energien haben, nämlich in der Windenergie - denn die PV- und die Biomasseförderung stellen Sie ganz ab, im Fall der PV über die Eigenstromregelung -, haben wir überwiegend den rot-grün geführten Ländern zu verdanken, die durchgesetzt haben, dass der Ausbau weitergehen kann.

Aber dann haben Sie natürlich das Nächste vor. Jetzt kommen Sie mit der Lex Seehofer, die vorsieht, dass 2 000 Meter Abstand zur nächstgelegenen Wohnbebauung eingehalten werden.",data/txt/18037.txt,speech,
2818047,37,18,0,Max Straubinger [CDU/CSU],Max Straubinger,max-straubinger,448,"Wollen Sie die Menschen nicht schützen, Herr Krischer?",data/txt/18037.txt,poi,cducsu
2818048,37,18,0,,,,449,"Das wollen Sie einführen. Sie haben dazu eine Sachverständigenanhörung im Umweltausschuss des Bundestages durchgeführt, aber Sie haben keinen einzigen Sachverständigen gefunden, der Ihre Position unterstützt. Sie mussten drei Antiwind-Bürgerinitiativen einladen, die ganz steile Thesen vertreten. Ich appelliere an Ihren Anstand: Lassen Sie diesen Unsinn! Hören Sie damit auf! Verzichten Sie auf die Lex Seehofer!",data/txt/18037.txt,speech,
2818049,37,18,0,,,,450,Beifall beim BÜNDNIS 90/DIE GRÜNEN sowie bei Abgeordneten der LINKEN,data/txt/18037.txt,poi,
2818050,37,18,0,,,,451,"Vizepräsidentin Claudia Roth:

Herr Kollege, kommen Sie bitte zum Schluss.

Oliver Krischer (BÜNDNIS 90/DIE GRÜNEN):

Ich komme zum Schluss. - Der Entwurf der EEG-Novelle mit der Besonderen Ausgleichsregelung, die Sie vorlegen, bremst den Ausbau der erneuerbaren Energien. Er schadet dem Klimaschutz und sichert das Geschäftsmodell der Großkraftwerke. Er vernichtet Arbeitsplätze in der Branche der Erneuerbaren. Er ist ungerecht gegenüber Privatverbrauchern und Handwerk. Er ist kompliziert, und er ist das Gegenteil von kosteneffizient. Und er würgt dem Bürger Energie ab. Kurzum: Er ist ein Anschlag auf die Energiewende.

Danke schön.",data/txt/18037.txt,speech,
2818051,37,18,0,,,,452,Beifall beim BÜNDNIS 90/DIE GRÜNEN sowie bei Abgeordneten der LINKEN,data/txt/18037.txt,poi,
2818052,37,18,0,,,,453,"Vizepräsidentin Claudia Roth:

Und es war jetzt überzogen, was die Zeit angeht. Das haben Sie aber auch gemacht, Herr Pfeiffer. Ich bin ja sehr gerecht.

Nächster Redner in der Debatte ist Johann Saathoff für die SPD.",data/txt/18037.txt,speech,
2818053,37,18,0,,,,454,Beifall bei der SPD sowie bei Abgeordneten der CDU/CSU,data/txt/18037.txt,poi,
2818054,37,18,0,,,,455,"Johann Saathoff (SPD):

Sehr geehrte Frau Präsidentin! Liebe Kolleginnen und Kollegen! Lieber Kollege Krischer, herzlichen Glückwunsch zu Ihrer Rede zum Erneuerbare-Energien-Gesetz. Ich habe es während Ihrer Rede noch einmal nachgelesen: In dem Gesetzentwurf, über den wir heute debattieren, ist ganz wenig von dem enthalten, was Sie heute angesprochen haben.",data/txt/18037.txt,speech,
2818055,37,18,0,Thomas Bareiß [CDU/CSU],Thomas Bareiß,thomas-bareiß,456,Genau! Thema verfehlt!,data/txt/18037.txt,poi,cducsu
2818056,37,18,0,Oliver Krischer [BÜNDNIS 90/DIE GRÜNEN],Oliver Krischer,oliver-krischer,457,Ich habe eine ganze Menge dazu gesagt!,data/txt/18037.txt,poi,gruene
2818057,37,18,0,,,,458,"Deswegen herzlichen Glückwunsch zur EEG-Rede!

Auf das Thema Enercon möchte ich ganz besonders eingehen; denn Enercon befindet sich in meinem Wahlkreis. Sie können sicher sein, dass ich mit den Mitarbeitern intensive Gespräche führe.",data/txt/18037.txt,speech,
2818058,37,18,0,Oliver Krischer [BÜNDNIS 90/DIE GRÜNEN],Oliver Krischer,oliver-krischer,459,Und sind sie begeistert von dem Gesetzentwurf? Was sagen sie denn?,data/txt/18037.txt,poi,gruene
2818059,37,18,0,,,,460,"Fragen Sie dort nach, welche Auswirkungen es hätte, wenn die Stahl- oder Kupferpreise erhöht würden!

Liebe Kolleginnen und Kollegen, für Betriebe, die besonders viel Strom bei der Herstellung ihrer Produkte benötigen und im internationalen Wettbewerb stehen, stellt die Energie einen bedeutenden Kostenfaktor dar. Diese Unternehmen stehen häufig im Wettbewerb mit Betrieben in anderen Ländern, die zum Teil deutlich niedrigere Stromkosten haben, weil deren Regierungen sich noch nicht auf den Weg der erneuerbaren Energien gemacht haben. In dem vorliegenden Gesetzentwurf geht es um die internationale Wettbewerbsfähigkeit unserer Unternehmen unter Berücksichtigung des Wettbewerbsfaktors Stromkosten.

Darüber hinaus muss das am Ende beschlossene Gesetz auch mit den neuen Umwelt- und Energiebeihilfeleitlinien in Einklang stehen, die die Europäische Kommission am 9. April dieses Jahres beschlossen hat. Deshalb prüft die Kommission auch parallel zu unserem Gesetzgebungsverfahren den hier diskutierten Gesetzentwurf. Etwaige Änderungsanträge müssten noch in Brüssel notifiziert werden.

Würde die Besondere Ausgleichsregelung nicht mehr greifen, hätte dies schwerwiegende Folgen für die Menschen in Deutschland. Viele Arbeitsplätze wären durch drohende Schließungen und Abwanderung insbesondere der produzierenden Betriebe bedroht. Das hätte auch unmittelbar zur Folge, dass die dringend notwendige Akzeptanz der Bürgerinnen und Bürger bei der Energiewende durch den Verlust ihrer Existenzgrundlage nicht mehr gegeben wäre.",data/txt/18037.txt,speech,
2818060,37,18,0,,,,461,Beifall bei der SPD sowie bei Abgeordneten der CDU/CSU,data/txt/18037.txt,poi,
2818061,37,18,0,,,,462,"Die Abwanderung der Betriebe würde in Länder erfolgen, die sich noch nicht auf den Weg der Erneuerbaren gemacht haben, die also nicht Klimaziele in ihr jeweiliges Leit- und Wertebild aufgenommen haben. Der Anreiz zu klimafreundlichem Verhalten anderer Nationen würde also unterdrückt, wenn wir die stromintensiven Betriebe in unserem Land nicht durch die Besondere Ausgleichsregelung international wettbewerbsfähig machen würden.

Zum Dritten stellt dieses Gesetz sicher, dass die begünstigten Unternehmen trotz der Begünstigung einen eigenen Beitrag zur Förderung der erneuerbaren Energien leisten; Kollege Pfeiffer hat darauf gerade hingewiesen.

Weiterhin wird durch die Erhöhung der Eingangsschwelle im Gesetz sichergestellt, dass der sonst zu erwartende weitere Anstieg der Anzahl der privilegierten Unternehmen sowie des Entlastungsvolumens begrenzt wird.

Letztlich soll im Gesetz normiert werden, dass die Unternehmen ein zertifiziertes Energie- und Umweltmanagementsystem betreiben. Es wird also sichergestellt, dass diese Unternehmen die Energieeffizienz deutlich stärker in den Fokus nehmen. Ich würde mich freuen, wenn wir zusätzlich die Umsetzung der aus dem Umweltmanagementsystem gewonnenen Erkenntnisse sicherstellen könnten.

Es ist gut, dass nun auch auf europäischer Ebene Klarheit darüber besteht, welche Branchen als stromkosten- und handelsintensiv einzustufen sind. Damit ist ein großer Beitrag zur Planungssicherheit der betroffenen Betriebe geleistet. Allerdings finde ich es in der Diskussion nicht redlich, so zu tun, als seien alle Betriebe der 68 Branchen automatisch von der EEG-Umlage befreit. Man suggeriert damit, die privaten Verbraucher müssten ihren Beitrag zur Energiewende leisten, während die Industrie fein raus sei. Dem ist definitiv nicht so. Mit dem Gesetz, über dessen Entwurf wir heute erstmalig beraten, wird die Industrie keinesfalls aus den Kosten der Energiewende entlassen. Sie soll vielmehr weiterhin angemessen an den Kosten beteiligt werden, ohne dass sie nachhaltig im Wettbewerb geschädigt und damit in der Existenz bedroht wird.

Die Zugehörigkeit zu den Branchen ist zunächst einmal die Voraussetzung, überhaupt einen Antrag stellen zu dürfen, als stromintensiver Betrieb anerkannt zu werden. Weiterhin ist Voraussetzung, dass die Betriebe einen Mindestanteil von Stromkosten an ihrer Bruttowertschöpfung zu Faktorkosten als Eintrittsschwelle aufweisen. Die Eintrittsschwelle wird schrittweise angehoben, um dem Anstieg der EEG-Umlage Rechnung zu tragen und dafür zu sorgen, dass sich der Kreis der privilegierten Unternehmen nicht weiter vergrößert. Unser Ziel ist es, dass wir die Eingangsschwelle in Zukunft nicht weiter anheben müssen, dass also die EEG-Umlage nicht weiter steigt. Es gibt allerdings Kritik: Die Schwelle sei nicht deutlich genug erhöht worden. Ich halte diese Kritik für unberechtigt. Diese Anpassung ist mit Augenmaß sorgsam gewählt, um das Kind nicht mit dem Bade auszuschütten, oder wie wir Ostfriesen sagen: Man sallt Pullstock neet wieder setten, as man springen kann.

Vizepräsidentin Claudia Roth:

Was wollen Sie uns damit sagen?

Johann Saathoff (SPD):

Frau Präsidentin, ich gebe die Übersetzung zu Protokoll.

Vizepräsidentin Claudia Roth:

Gut. Danke.

Johann Saathoff (SPD):

Wichtig ist in diesem Zusammenhang der Begriff Faktorkosten, also quasi alle Kosten, die zur Produktion eines Produkts erforderlich sind, und damit auch die Kosten für zum Beispiel Leiharbeitsverträge, die sonst nicht eingerechnet wurden. Mit diesem Gesetz wird also sichergestellt, dass die Betriebe nicht mehr - wie geschehen - Personal aus Arbeitsverträgen entlassen und über Leiharbeitsverträge wieder beschäftigen, um den Anteil der Stromkosten an der Bruttowertschöpfung über die Eintrittsschwelle zu heben und so privilegiert zu sein. Dieser falsche Anreiz ist durch dieses Gesetz endlich gestoppt.",data/txt/18037.txt,speech,
2818062,37,18,0,,,,463,Beifall bei der SPD,data/txt/18037.txt,poi,
2818063,37,18,0,Oliver Krischer [BÜNDNIS 90/DIE GRÜNEN],Oliver Krischer,oliver-krischer,464,Nein!,data/txt/18037.txt,poi,gruene
2818064,37,18,0,,,,465,"Weiterhin leisten nun auch die privilegierten Unternehmen ihren Beitrag zur Energiewende, nämlich grundsätzlich 15 Prozent der EEG-Umlage. Diese Belastung wird nur bei ganz wenigen Betrieben auf 4 Prozent bzw. 0,5 Prozent der Bruttowertschöpfung begrenzt.",data/txt/18037.txt,speech,
2818065,37,18,0,Oliver Krischer [BÜNDNIS 90/DIE GRÜNEN],Oliver Krischer,oliver-krischer,466,Das ist eine Benachteiligung der kleinen Unternehmen!,data/txt/18037.txt,poi,gruene
2818066,37,18,0,,,,467,"Darüber hinaus ist künftig von jeder Abnahmestelle für die erste Gigawattstunde die EEG-Umlage in voller Höhe zu zahlen und weiterhin eine Mindestumlage in Höhe von 0,1 Cent für jede weitere Kilowattstunde, um den Grundbetrag der privilegierten Unternehmen für das EEG-Konto sicherzustellen. In diesem Rahmen könnten wir uns allerdings noch einmal Gedanken über die Härtefallregelung machen.

Der vorliegende Gesetzentwurf, den wir nun in den Ausschüssen zu beraten haben, stellt einen Schritt in die richtige Richtung dar und wird ein wichtiger Faktor bei der Sicherstellung der internationalen Wettbewerbsfähigkeit unserer Unternehmen sowie im Sinne unserer Arbeitnehmerinnen und Arbeitnehmer sein.

Herzlichen Dank.",data/txt/18037.txt,speech,
2818067,37,18,0,,,,468,Beifall bei der SPD und der CDU/CSU,data/txt/18037.txt,poi,
2818068,37,18,0,,,,469,"Vizepräsidentin Claudia Roth:

Vielen Dank, Herr Kollege. Sie denken an die Übersetzung.",data/txt/18037.txt,speech,
2818069,37,18,0,Johann Saathoff [SPD],Johann Saathoff,johann-saathoff,470,Sehr gerne!,data/txt/18037.txt,poi,spd
2818070,37,18,0,,,,471,Nächste Rednerin in der Debatte ist Caren Lay für die Linke.,data/txt/18037.txt,speech,
2818071,37,18,0,,,,472,Beifall bei der LINKEN,data/txt/18037.txt,poi,
2818072,37,18,0,,,,473,"Caren Lay (DIE LINKE):

Frau Präsidentin! Meine sehr verehrten Damen und Herren! Es verwundert mich natürlich nicht, dass die Union auch heute das Ausmaß der Industrierabatte verteidigt; das war schon in der letzten Legislaturperiode so. Wir haben nichts anderes erwartet.",data/txt/18037.txt,speech,
2818073,37,18,0,Thomas Bareiß [CDU/CSU],Thomas Bareiß,thomas-bareiß,474,Wir stehen für Arbeitsplätze!,data/txt/18037.txt,poi,cducsu
2818074,37,18,0,,,,475,"Dass die SPD in dieser Legislaturperiode mit einer solchen Vehemenz in diesen Chor einstimmt, verwundert mich schon sehr. Denn von welcher Seite haben Sie Applaus für diesen Gesetzentwurf bekommen? Das war der Applaus von den Chefetagen der Industrie. Dort haben regelrecht die Sektkorken geknallt. Ich muss mich wundern. Dass Sie so viel Applaus",data/txt/18037.txt,speech,
2818075,37,18,0,Thomas Bareiß [CDU/CSU],Thomas Bareiß,thomas-bareiß,476,Von den Gewerkschaften!,data/txt/18037.txt,poi,cducsu
2818076,37,18,0,,,,477,"nur von der Wirtschaftsseite bekommen, während sich die Bürgerinnen und Bürger, wie ich finde zu Recht, beschweren und übrigens auch das Gros der Medien in der Berichterstattung die zusätzliche Belastung beklagt, sollte Ihnen wirklich zu denken geben.",data/txt/18037.txt,speech,
2818077,37,18,0,,,,478,Beifall bei der LINKEN sowie bei Abgeordneten des BÜNDNISSES 90/DIE GRÜNEN,data/txt/18037.txt,poi,
2818078,37,18,0,,,,479,"Es ist meiner Aufmerksamkeit nicht entgangen, dass sowohl Herr Gabriel als auch Herr Tiefensee und die anderen Redner der Koalition versuchen, den Eindruck zu verwischen, es gehe ihnen nur um die Industrieinteressen. Sie tun so, als ob es ihnen auch um die Interessen der Verbraucherinnen und Verbraucher ginge. Dazu muss ich sagen: Außer dieser Beteuerung habe ich kein einziges Argument gehört, das mich davon überzeugt.",data/txt/18037.txt,speech,
2818079,37,18,0,Thomas Bareiß [CDU/CSU],Thomas Bareiß,thomas-bareiß,480,1 Million Arbeitsplätze!,data/txt/18037.txt,poi,cducsu
2818080,37,18,0,,,,481,"Schauen wir uns die Fakten doch einmal an. Erstens. Das Entlastungsvolumen der Industrie soll bei gut 5 Milliarden Euro bleiben. Wir reden dabei nur über die Stromrechnung. Es sind aber noch Entlastungen im Bundeshaushalt versteckt, über die wir überhaupt noch nicht gesprochen haben. Zweitens. Die Anzahl der Branchen, die entlastet werden sollen, steigt sogar an. Lag die Zahl bisher faktisch bei 168 Branchen, so soll sie jetzt auf 219 festgelegt werden. Wenn man weiß, dass in Deutschland insgesamt nur 246 Branchen gezählt werden, dann kann man ausrechnen, dass faktisch ein Großteil der Branchen prinzipiell Entlastungen beantragen kann.

Mit diesem Vorgang hat Sigmar Gabriel dafür gesorgt, dass er Gerhard Schröder den Ruf als Genosse der Bosse abspenstig gemacht hat. Ich habe noch nicht gehört, dass Sie dem entgegengewirkt haben. Am Ende ist er auch noch stolz darauf. Ich finde, auch das sollte der SPD zu denken geben.",data/txt/18037.txt,speech,
2818081,37,18,0,,,,482,Beifall bei Abgeordneten der LINKEN sowie des Abg. Oliver Krischer [BÜNDNIS 90/DIE GRÜNEN],data/txt/18037.txt,poi,
2818082,37,18,0,,,,483,"Vizepräsidentin Claudia Roth:

Frau Kollegin Lay, erlauben Sie eine Zwischenbemerkung oder eine Zwischenfrage von Herrn Tiefensee?

Caren Lay (DIE LINKE):

Ja, sehr gerne.

Vizepräsidentin Claudia Roth:

Herr Tiefensee.

Wolfgang Tiefensee (SPD):

Frau Lay, vielen Dank, dass Sie die Frage zulassen. Sie haben gerade die Summe der Branchen erwähnt, die in den Listen 1 und 2 des Gesetzes zur Reform der Besonderen Ausgleichsregelung zu finden sind. Ist es so, dass Sie wider besseres Wissen oder weil Sie es nicht anders wissen die Liste 1 und die Liste 2 in eins fügen? Denn Sie könnten wissen, dass wir 68 Branchen und nicht über 200 entlasten. Die Liste 2 umfasst die Möglichkeit für einzelne Unternehmen einer dieser Branchen, eine Entlastung zu beantragen; sie umfasst nicht die Möglichkeit für die gesamte Branche.

Wir müssen also auch für die Öffentlichkeit deutlich zwischen der Liste 1 mit 68 Branchen und der Liste 2 unterscheiden, aufgrund welcher nicht die Branche befreit ist, sondern möglicherweise einzelne Unternehmen, die einer solchen Branche angehören. Ist Ihnen dieser Unterschied bekannt, und, wenn ja, warum vermengen Sie in Ihrer Rede diese beiden Listen und suggerieren somit eine größere Anzahl von befreiten Branchen?

Caren Lay (DIE LINKE):

Mir ist dieser Unterschied durchaus bekannt. Ich bedanke mich für die Zwischenfrage, weil ich dadurch auf diesen Umstand und die Liste 2 noch einmal eingehen kann. In der Tat steckt darin kein Automatismus, aber immerhin die Möglichkeit, eine Befreiung zu beantragen. Wenn ich mir die Liste 2 ansehe, wundere ich mich an mancher Stelle, was alles, zu Ihrem Stolz oder auch zu Ihrer Begeisterung, in die Liste hineinverhandelt wurde. Es ist schon von dem Kollegen Krischer erwähnt worden, welche Branchen dort aufgeführt sind.

Ich habe mir notiert: Auf Liste 2, Nummer 212, ist eine potenzielle Entlastung für Fantasieschmuckunternehmen vorgesehen. Man kann dafür privat eine Affinität haben, aber dass eine solche Firma potenziell eine Belastung beantragen kann, halte ich einfach nur für lächerlich. Es gibt noch andere Stellen, bei denen für mich der Spaß aufhört. Auf der Liste 2 ist auch eine mögliche Entlastung von Herstellern von militärischen Kampffahrzeugen vorgesehen. Wenn ich es richtig verstehe, geht es um die Panzerproduktion. Wenn es am Ende dazu kommt, dass die Bürger mit ihrer Stromrechnung noch das Geschäft mit dem Krieg subventionieren, dann kann ich dem einfach nicht zustimmen, und da bleibe ich auch bei meiner Kritik.",data/txt/18037.txt,speech,
2818083,37,18,0,,,,484,Beifall bei der LINKEN und dem BÜNDNIS 90/DIE GRÜNEN,data/txt/18037.txt,poi,
2818084,37,18,0,Dr. Joachim Pfeiffer [CDU/CSU],Dr. Joachim Pfeiffer,joachim-pfeiffer,485,Das ist an Dummheit nicht zu überbieten!,data/txt/18037.txt,poi,cducsu
2818085,37,18,0,,,,486,"Ich will auf den Vorwurf eingehen, der uns in dieser Debatte, auch gerade vorhin wieder, gemacht wurde, nämlich die Linke sei industriefeindlich und uns lägen die Arbeitsplätze nicht am Herzen. Ich will Sie wirklich darum bitten, den Antrag zu lesen, den wir vorgelegt haben. Herr Krischer, ich verstehe gar nicht, warum wir uns gegenseitig einen mitgeben müssen. Als wir das letzte Mal auf der Grundlage von Anträgen darüber debattiert haben, waren die ersten beiden Kriterien, die Linke und Grüne vorgeschlagen haben, identisch.",data/txt/18037.txt,speech,
2818086,37,18,0,Oliver Krischer [BÜNDNIS 90/DIE GRÜNEN],Oliver Krischer,oliver-krischer,487,Dann haben wir einen Ansatz!,data/txt/18037.txt,poi,gruene
2818087,37,18,0,,,,488,"Also, die Firmen sollten tatsächlich im internationalen Wettbewerb stehen und tatsächlich energieintensiv sein. Die EU hatte ursprünglich 15 Branchen festgelegt. Dazu stehen wir, und dazu stehen auch die Umweltverbände.

Das heißt, auch nach unserer Vorstellung könnten Stahl-, Chemie- und Grundstoffindustrie von der EEG-Umlage entsprechend entlastet werden; das will ich hier klipp und klar sagen. Das jetzt geplante Ausmaß der Ausweitung der Befreiung von der EEG-Umlage finde ich wirklich unerhört. Zu argumentieren, es gehe Ihnen hier nur um den Erhalt der Arbeitsplätze in Deutschland, und kein einziges Wort zu all den Arbeitsplätzen zu verlieren, die im Bereich der erneuerbaren Energien schon verloren gegangen sind, finde ich ebenfalls wirklich unerhört.",data/txt/18037.txt,speech,
2818088,37,18,0,,,,489,Beifall bei der LINKEN,data/txt/18037.txt,poi,
2818089,37,18,0,,,,490,"Ich bin zuletzt von einem Redner der SPD gefragt worden, ob ich bereit sei, mit ihm in seinen Wahlkreis im Ruhrgebiet zu fahren, wo die Stahlindustrie beheimatet ist. Ich habe geantwortet: Erstens, ja, sehr gerne, und, zweitens, auch wir als Linke wollen die Stahlindustrie entlasten. Umgekehrt bitte ich Sie alle, einmal in meinen Wahlkreis in der Lausitz zu kommen. Die Situation dort ist folgendermaßen: Alle drei Solarfirmen, die sich dort angesiedelt und gut bezahlte Arbeitsplätze geschaffen hatten,",data/txt/18037.txt,speech,
2818090,37,18,0,Thomas Bareiß [CDU/CSU],Thomas Bareiß,thomas-bareiß,491,Subventionierte!,data/txt/18037.txt,poi,cducsu
2818091,37,18,0,,,,492,sind durch die Politik in der letzten Legislaturperiode eingegangen. Auch diese Wahrheit gehört zu dieser Debatte.,data/txt/18037.txt,speech,
2818092,37,18,0,,,,493,Beifall bei der LINKEN und dem BÜNDNIS 90/DIE GRÜNEN,data/txt/18037.txt,poi,
2818093,37,18,0,,,,494,"Meine Damen und Herren, ich komme zum Schluss. Mit diesem Gesetzentwurf hat Sigmar Gabriel den Bürgerinnen und Bürgern, aber auch seiner Partei keinen großen Gefallen getan. Die Industrierabatte werden am Ende das für die SPD, was die Hoteliersteuer für die FDP war. Ich kann Sie nur auffordern: Ziehen Sie diesen Gesetzentwurf zurück!

Vielen Dank.",data/txt/18037.txt,speech,
2818094,37,18,0,,,,495,Beifall bei der LINKEN sowie des Abg. Christian Kühn [Tübingen] [BÜNDNIS 90/DIE GRÜNEN],data/txt/18037.txt,poi,
2818095,37,18,0,,,,496,"Vizepräsidentin Claudia Roth:

Danke, Frau Kollegin Lay. - Nächster Redner in dieser Debatte ist Thomas Bareiß, CDU/CSU-Fraktion.",data/txt/18037.txt,speech,
2818096,37,18,0,,,,497,Beifall bei Abgeordneten der CDU/CSU und der SPD,data/txt/18037.txt,poi,
2818097,37,18,0,,,,498,"Thomas Bareiß (CDU/CSU):

Frau Präsidentin! Meine sehr verehrten Damen! Meine Herren! Nach den Reden der Opposition, der Linken und der Grünen, muss ich schon präzisieren, worum es heute geht: Es geht heute darum, dass wir mit diesem Gesetz langfristig über 1 Million Arbeitsplätze sichern werden. Wir versuchen, mit der Besonderen Ausgleichsregelung für die Branchen, die angesprochen worden sind, langfristig innovative und gute Arbeit zu sichern. Die Umsetzung aller Vorschläge, die Sie, Frau Lay, eingebracht haben, sorgt dafür, dass diese Arbeitsplätze gefährdet werden; deswegen sind wir gegen Ihre Vorschläge. Wir versuchen, hier eine ordentliche, gute Industriepolitik für unser Land zu machen.",data/txt/18037.txt,speech,
2818098,37,18,0,,,,499,Beifall bei der CDU/CSU sowie bei Abgeordneten der SPD,data/txt/18037.txt,poi,
2818099,37,18,0,Oliver Krischer [BÜNDNIS 90/DIE GRÜNEN],Oliver Krischer,oliver-krischer,500,Sie versuchen es!,data/txt/18037.txt,poi,gruene
2818100,37,18,0,,,,501,"Hier wird ständig von Befreiung gesprochen. In den Reden hier wird der Eindruck suggeriert, dass wir bestimmte Unternehmen und Branchen von der EEG-Umlage komplett befreien. Auch das ist falsch; darauf möchte ich zu Beginn meiner Rede hinweisen. Das Gegenteil ist wahr. Durch die Verabschiedung des jetzt vorliegenden Gesetzentwurfs schaffen wir es, die begünstigten rund 2 000 Unternehmen in die Bezahlung der Energiewende einzubinden; mit der neuen Ausgleichsregelung steigt der Beitrag der begünstigten Unternehmen von bisher 300 Millionen Euro um etwa 4 Millionen Euro. Auch das zeigt, dass sich hier keiner aus dem Staub macht, sondern dass jeder seinen Beitrag leistet, diese Energiewende zu meistern.",data/txt/18037.txt,speech,
2818101,37,18,0,,,,502,Zuruf des Abg. Oliver Krischer [BÜNDNIS 90/DIE GRÜNEN],data/txt/18037.txt,poi,
2818102,37,18,0,,,,503,"- Lieber Oliver Krischer, du sprichst hier immer von Privilegien, die wir verteilen. Noch einmal: Diese Industrievergünstigungen wurden damals von Rot-Grün unter dem Umweltminister Jürgen Trittin eingeführt.",data/txt/18037.txt,speech,
2818103,37,18,0,Oliver Krischer [BÜNDNIS 90/DIE GRÜNEN],Oliver Krischer,oliver-krischer,504,Das war gut und richtig!,data/txt/18037.txt,poi,gruene
2818104,37,18,0,,,,505,"Der große Unterschied ist, dass damals nur wenige Großkonzerne von diesen Privilegien profitiert haben. Schwarz-Gelb hat es geschafft, den industriellen Mittelstand in den Kreis der Privilegierten aufzunehmen. Wir haben dafür gesorgt, dass diejenigen von der EEG-Umlage profitieren, die diese Vergünstigung wirklich brauchen.",data/txt/18037.txt,speech,
2818105,37,18,0,,,,506,Beifall bei der CDU/CSU,data/txt/18037.txt,poi,
2818106,37,18,0,,,,507,"Der Kollege Saathoff hat es schon gesagt: Wir sprechen heute nicht über Fragen des Zubaus im Bereich der erneuerbaren Energien, und das, obwohl das ein interessantes Thema wäre, liebe Frau Lay; auch Sie haben darauf Bezug genommen. Ich möchte noch einmal sagen: Wir hatten in den letzten vier Jahren einen Zubau im Bereich der erneuerbaren Energien, den keiner, auch niemand in diesem Parlament, vorhergesehen hat. Gerade im Bereich der Solarbranche, die vorhin beschrieben worden ist, gab es jedes Jahr einen Zubau von über 8 000 Megawatt.",data/txt/18037.txt,speech,
