id,sitzung,wahlperiode,in_writing,speaker,speaker_cleaned,speaker_fp,sequence,text,filename,type,speaker_party
2262013,57,18,0,,,,619,Beifall beim BÜNDNIS 90/DIE GRÜNEN sowie der Abg. Eva Bulling-Schröter [DIE LINKE],data/txt/18057.txt,poi,
2262014,57,18,0,,,,620,"Wenn Sie das Ganze so umsetzen, wie es derzeit -angedacht ist, dann ist die entscheidende Frage, was innerhalb des einen Drittels der internationalen Kohle-finanzierung alles erfasst wird. Sie haben eben ausführlich dargestellt, dass Sie keine Kohlekraftwerke mehr finanzieren wollen. Dann ist immer noch nicht die Frage geklärt: Was ist mit der Kohleinfrastruktur? Auf meine schriftliche Frage antwortete das Ministerium, nein, Kohleinfrastruktur sei auch nicht mit erfasst, sondern nur die Kohlekraftwerke. Kohleminen, wie zum Beispiel in Kolubara in Serbien, seien gar nicht erfasst, weil die Förderung in dieser Region nur als Maßnahme zum Schutz der Umwelt diene.

Wenn Sie sich weiter so verhalten, dann sind wir - das kann ich Ihnen garantieren, Herr Schwabe - beim Klimaschutz nicht mehr im oberen Drittel, sondern ganz weit unten. Das wäre wirklich fatal für Deutschland und für die Welt insgesamt.

Vielen Dank.",data/txt/18057.txt,speech,
2262015,57,18,0,,,,621,Beifall beim BÜNDNIS 90/DIE GRÜNEN,data/txt/18057.txt,poi,
2262016,57,18,0,,,,622,"Vizepräsidentin Edelgard Bulmahn:

Der Kollege Pronold erhält das Wort zu einer Kurz-intervention.

Florian Pronold (SPD):

Sehr geehrte Frau Baerbock, ich weiß nicht, in welchem Ausschuss Sie gestern waren. Ich war offensichtlich in einem anderen.

Erste Bemerkung. Sie haben gestern im Ausschuss behauptet, die Bundesregierung würde sich weigern, Ihre gestellten Fragen anschließend in der Fragestunde zu beantworten. Der Punkt war: Sie waren anschließend in der Fragestunde gar nicht da, um die Antworten entgegenzunehmen.",data/txt/18057.txt,speech,
2262017,57,18,0,Ute Vogt [SPD],Ute Vogt [SPD],ute-vogt-spd,623,Ui!,data/txt/18057.txt,poi,spd
2262018,57,18,0,Ulrich Petzold [CDU/CSU],Ulrich Petzold [CDU/CSU],ulrich-petzold-cdu-csu,624,Oh!,data/txt/18057.txt,poi,cducsu
2262019,57,18,0,Annalena Baerbock [BÜNDNIS 90/DIE GRÜNEN],Annalena Baerbock [BÜNDNIS 90/DIE GRÜNEN],annalena-baerbock-bundnis-90-die-grunen,625,Das wurde abgesetzt!,data/txt/18057.txt,poi,gruene
2262020,57,18,0,,,,626,"Der zweite Punkt ist: Sie haben hier behauptet, ich hätte keine Antwort auf die Frage gegeben, wie sich die Bundesregierung verhalten werde für den Fall, dass die Klimaverhandlungen scheitern. Ich habe Ihnen als Antwort gegeben, dass wir im Ausschuss über ein informelles Vorgespräch berichten und es Ziel der Bundesregierung ist, die Klimaverhandlungen zum Erfolg zu führen, wir aber nicht öffentlich darüber sinnieren, was passiert, wenn sie scheitern. Wir sind nämlich ins Gelingen verliebt. Wir wollen hier, im Deutschen Bundestag, keine Schaufensterpolitik betreiben, sondern wir wollen den Klimaschutz voranbringen.",data/txt/18057.txt,speech,
2262021,57,18,0,,,,627,Beifall bei der SPD sowie bei Abgeordneten der CDU/CSU,data/txt/18057.txt,poi,
2262022,57,18,0,,,,628,"Vizepräsidentin Edelgard Bulmahn:

Frau Kollegin Baerbock, Sie haben die Möglichkeit zur Erwiderung.

Annalena Baerbock (BÜNDNIS 90/DIE GRÜNEN):

Herr Pronold, wir schätzen uns ja sehr. Aber man muss den Tatsachen schon ins Auge sehen:

Zum einen zur Sitzung gestern im Umweltausschuss: Mehrere Mitglieder des Umweltausschusses sind hier; sie können gerne nachher Stellung dazu nehmen, wie Ihre Antwort war. Meine konkrete Frage war: Wie steht die Bundesregierung politisch - ich habe unterstrichen: politisch und nicht auf Arbeitsebene - zu den Formulierungen im derzeitigen Textentwurf hinsichtlich der 2030-Ziele, nach denen das Ganze nicht national, also domestic, geregelt wird, und wie steht sie dazu, dass at least nicht drinsteht? Und ich habe gefragt, wie sie gegebenenfalls zur Absenkung des Erneuerbaren-Ziels auf 27 Prozent steht. Darauf haben Sie nicht geantwortet. Mehrere Personen waren Zeugen.

Der zweite Punkt ist das Veto. Natürlich können Sie sagen: Wir wollen kein Veto einlegen. - Das wäre eine Antwort gewesen. Meine Frage war: Werden Sie das in den nächsten Wochen machen, ja oder nein?

Die Fragestunde, von der ich gesprochen habe, fand in der letzten Sitzungswoche statt. Es ging um das Thema KfW. Sie können sich sicher gut daran erinnern. Frau Zypries war auch anwesend; wir haben auch Frau Zypries befragt. Auch in dieser Fragestunde gab es keine Antwort auf die Frage, wie es mit der KfW-Finanzierung aussieht.

Zur gestrigen Fragestunde - in diesem Zusammenhang können wir gerne noch eine Runde um die Frage drehen, wie das mit dem Fragerecht im Deutschen Bundestag aussieht, mit dem Recht, die Bundesregierung zu befragen -: Wir hatten eine Reihe von Fragen zur 2030-Strategie - das ist für uns ein sehr wichtiges Thema - und zum informellen Ratstreffen gestellt. Diese Fragen wurden mit Hinweis auf die Geschäftsordnung abgesetzt; denn heute findet ja eine Debatte darüber statt. Wir haben dagegen ein Veto eingelegt. Aber die Geschäftsordnung ist so, wie sie ist. Die Bundesregierung möchte das derzeit ja nicht ändern; wir diskutieren das ja gerade mit Ihnen. Wäre es anders, hätten wir Gelegenheit gehabt, uns ausführlich darüber auszutauschen. In diesem Format heute ist das ja leider nicht möglich. Wir haben gestern fast zehn Fragen zu diesem Thema eingereicht, die leider alle nicht behandelt wurden.",data/txt/18057.txt,speech,
2262023,57,18,0,,,,629,Beifall beim BÜNDNIS 90/DIE GRÜNEN und bei der LINKEN,data/txt/18057.txt,poi,
2262024,57,18,0,,,,630,"Vizepräsidentin Edelgard Bulmahn:

Als nächster Redner in der Debatte hat der Kollege Andreas Jung das Wort.",data/txt/18057.txt,speech,
2262025,57,18,0,,,,631,Beifall bei der CDU/CSU,data/txt/18057.txt,poi,
2262026,57,18,0,,,,632,"Ich bitte die Kolleginnen und Kollegen, sich an die Redezeit zu halten. Ich war bisher sehr großzügig; aber wir müssen wirklich ein bisschen in der Redezeit bleiben. - Herr Kollege Jung, ich gehe davon aus, Sie werden sie einhalten. Das werden Sie schaffen. Die Kollegen, die danach sprechen, halten sich bitte auch an die Redezeit.

Andreas Jung (CDU/CSU):

Frau Präsidentin, ich setze auf Ihre fortgesetzte Großzügigkeit.",data/txt/18057.txt,speech,
2262027,57,18,0,,,,633,Heiterkeit,data/txt/18057.txt,poi,
2262028,57,18,0,,,,634,Liebe Kolleginnen und Kollegen! In dieser Debatte war einiges an Polemik im Spiel.,data/txt/18057.txt,speech,
2262029,57,18,0,Steffi Lemke [BÜNDNIS 90/DIE GRÜNEN],Steffi Lemke [BÜNDNIS 90/DIE GRÜNEN],steffi-lemke-bundnis-90-die-grunen,635,"Leidenschaft, nicht Polemik!",data/txt/18057.txt,poi,gruene
2262030,57,18,0,,,,636,"Ich kann und will nicht auf alles eingehen; aber, Frau Bulling-Schröter, eines will ich doch sagen: Es gehört ein gerüttelt Maß an Fantasie dazu, um umstrittene Äußerungen von designierten EU-Kommissaren mit der Klimapolitik der Bundesregierung in Zusammenhang zu bringen.",data/txt/18057.txt,speech,
2262031,57,18,0,,,,637,Beifall bei der SPD sowie bei Abgeordneten der CDU/CSU,data/txt/18057.txt,poi,
2262032,57,18,0,,,,638,"Vor allem will ich eines nicht im Raum stehen lassen, weil ich das für ein gefährliches Spiel halte: Ich meine die Tatsache, dass Sie hier die Haushaltskonsolidierung und die Klimapolitik gegeneinander ausspielen und dabei die schwarze Null infrage stellen. Beides gehört zusammen, wenn man das Thema Nachhaltigkeit ernst nimmt. Bei der Haushaltskonsolidierung geht es darum, dass wir mit der Schuldenmacherei Schluss machen. Wir sagen: Wir dürfen künftigen Generationen keine Lasten aufbürden, und wir dürfen ihren Handlungsspielraum nicht beschneiden. Wir müssen im Sinne der kommenden Generationen handeln und wirtschaften. Das gehört genauso zur Nachhaltigkeit wie Klima-, Umwelt- und Naturschutz. Das ist die Linie der Bundesregierung und in besonderer Weise die Linie der Union. Deshalb will ich das nicht so im Raum stehen lassen.",data/txt/18057.txt,speech,
2262033,57,18,0,,,,639,Beifall bei der CDU/CSU,data/txt/18057.txt,poi,
2262034,57,18,0,Marie-Luise Dött [CDU/CSU],Marie-Luise Dött [CDU/CSU],marie-luise-dott-cdu-csu,640,Das muss endlich mal gesagt werden!,data/txt/18057.txt,poi,cducsu
2262035,57,18,0,,,,641,"Ich will an das anknüpfen, was die Bundesumweltministerin dargestellt hat: Deutschland hat in der Klimapolitik international immer eine aktive Rolle gespielt, und diese Rolle nehmen wir weiter wahr. Wir alle spüren auf den internationalen Konferenzen, dass man auf uns setzt, dass man auf unsere Vorreiterrolle setzt. Es gilt in der Tat, daran anzuknüpfen. Es stehen wichtige Entscheidungen, wichtige Schritte bevor. Da ist zum Beispiel der Europäische Rat im Oktober dieses Jahres. Auf diesem geht es darum, ehrgeizige Ziele im Rahmen der Zieltrias zu formulieren, insbesondere ein ambitioniertes Reduktionsziel zu definieren und dann in die internationale Debatte einzubringen, um zu zeigen: Wir in Europa gehen auf dem Weg weiter, den wir bisher beschritten haben, und wir wollen andere mitnehmen.

Das ist die Politik der Bundesregierung, und es ist speziell auch die Politik der Kanzlerin, die in diesem Jahr angekündigt hat, dass sich Deutschland mit 750 Millionen Euro am Green Climate Fund, also an dem Fonds, mit dem Klimaschutz in Entwicklungsländern vorangebracht werden soll, beteiligt. Wir vertrauen und setzen darauf, dass die Bundesregierung die G-7-Präsidentschaft nutzt, um Klimaschutz vor dem wichtigen Gipfel im Jahre 2015 in Paris zum Thema zu machen. Wir erinnern uns: Es war die Bundeskanzlerin, die im Rahmen der G 7 im Jahr 2007 in Heiligendamm Klimaschutz in den Mittelpunkt des internationalen Interesses und der internationalen Aufmerksamkeit gerückt hat. Daran wird jetzt angeknüpft. Auf diesem Weg unterstützen wir die Bundesregierung, die Umweltministerin und unsere Bundeskanzlerin.",data/txt/18057.txt,speech,
2262036,57,18,0,,,,642,Beifall bei der CDU/CSU sowie bei Abgeordneten der SPD,data/txt/18057.txt,poi,
2262037,57,18,0,,,,643,"Natürlich hängt unsere Glaubwürdigkeit in diesem Prozess davon ab, dass unsere CO2-Emissionen sinken und nicht steigen; das ist völlig unbestritten. Deshalb unterstützen wir auch die Aktivitäten für ein Aktionsprogramm Klimaschutz. Wir haben in den letzten Jahren bei unserem Vorhaben, Treibhausgasemissionen zu reduzieren, viel erreicht. Jetzt müssen wir schauen, dass sich keine Lücke auftut zwischen unseren Zielen und dem, was wir erreichen. Daran hängt unser Gewicht auch auf der internationalen Ebene. Deshalb muss jetzt noch mehr passieren; es muss noch etwas in die Waagschale.

Ich finde, dass es richtig ist, zu fragen: Woran genau liegt es eigentlich, dass wir im Moment steigende CO2-Emissionen haben? Es liegt eben nicht - diesen Eindruck wollen die Grünen in ihrem Antrag erwecken - an einem Abbremsen des Ausbaus der erneuerbaren Energien. Das Gegenteil ist richtig: In den ersten neun Monaten dieses Jahres ist es erstmals so, dass erneuerbare Energien die Braunkohle im deutschen Strommix überholt haben. Ökostrom ist Herbstmeister. Darüber können wir uns gemeinsam freuen.",data/txt/18057.txt,speech,
2262038,57,18,0,,,,644,Beifall bei der CDU/CSU und der SPD sowie der Abg. Annalena Baerbock [BÜNDNIS 90/DIE GRÜNEN],data/txt/18057.txt,poi,
2262039,57,18,0,,,,645,"Zweitens ist es richtig, dass Kohlekraftwerke effiziente Gaskraftwerke aus dem Markt drängen, weil die Zertifikatspreise beim europäischen Emissionshandel ein sehr niedriges Niveau erreicht haben. Ich finde, wir sollten unsere gemeinsamen Bemühungen darauf richten, dass es innerhalb der EU mehr Druck für Klimaschutz gibt, dass es dort noch vor 2020 eine ehrgeizige Reform gibt. Ich freue mich, dass die Bundesregierung eine zwischen den zuständigen Ministerien, also dem Ministerium für Wirtschaft und Energie sowie dem Umweltministerium, abgestimmte Position dazu hat und dass wir in Brüssel darauf drängen und sagen: Da muss jetzt etwas passieren, sonst werden wir als Europäer und auch wir als Deutsche unsere Ziele nicht erreichen können. Daher lautet die Einladung: Unterstützen Sie uns bei diesem Vorhaben und bei all diesen Gesprächen, die - Sie haben es berichtet - geführt werden.",data/txt/18057.txt,speech,
2262040,57,18,0,,,,646,Beifall bei der CDU/CSU sowie des Abg. Frank Schwabe [SPD],data/txt/18057.txt,poi,
2262041,57,18,0,,,,647,"Bei dem, was wir jetzt national machen können, ist mir wichtig, dass wir - Georg Nüßlein hat es angesprochen - Klimaschutz und Wirtschaftswachstum nicht gegeneinander ausspielen, sondern dass wir beides zusammenbringen. Nicholas Stern war diese Woche in Berlin. Wir hatten auch in der Unionsfraktion die Gelegenheit, ein Gespräch mit ihm zu führen. Seine Botschaft als ehemaliger Chefökonom der Weltbank und die seiner Gruppierung lautet in dem neuen Bericht: Es geht. Wir können beides zusammenbringen. Klimaschutz und Wirtschaftswachstum bedingen sich gegenseitig und stehen nicht im Widerspruch.

In diesem Zusammenhang sehen wir einen besonderen Schlüssel bei der Energieeffizienz. Wir haben uns vorgenommen - Stichwort Nationaler Energieeffizienz-Aktionsplan -, mehr Strom einzusparen und mit Strom effizienter umzugehen. Das ist gut für die Umwelt, und es ist wirtschaftlich. Deshalb ist es richtig, dass wir da mehr tun.

Ich bin der Meinung, dass eines wieder auf die Tagesordnung muss: die steuerliche Förderung energetischer Sanierung, die steuerliche Förderung der Gebäudesanierung. Denn viele von uns glauben, dass dies ein besonders guter Anreiz ist, um hier voranzukommen.",data/txt/18057.txt,speech,
2262042,57,18,0,,,,648,Beifall des Abg. Christian Kühn [Tübingen] [BÜNDNIS 90/DIE GRÜNEN],data/txt/18057.txt,poi,
2262043,57,18,0,,,,649,"Herr Hofreiter, ich bitte Sie und Ihre Kolleginnen und Kollegen der Grünen, hier mitzuhelfen. Dies haben wir in der letzten Legislaturperiode im Deutschen Bundestag beschlossen. Es wird jedoch von den Ländern blockiert. Von daher bitte ich Sie, Ihre grünen Kollegen in den Ländern, den grünen Ministerpräsidenten von Baden-Württemberg und die grünen Minister in den Ländern davon zu überzeugen, mitzumachen,",data/txt/18057.txt,speech,
2262044,57,18,0,Oliver Krischer [BÜNDNIS 90/DIE GRÜNEN],Oliver Krischer [BÜNDNIS 90/DIE GRÜNEN],oliver-krischer-bundnis-90-die-grunen,650,"Was ist mit den Sozialdemokraten, mit den Christdemokraten in den Ländern? Die blockieren das genauso! Haben Sie einen Vorschlag? Wir haben einen Vorschlag eingebracht!",data/txt/18057.txt,poi,gruene
2262045,57,18,0,,,,651,"damit wir hier einen neuen Anlauf unternehmen und beim Thema Energieeffizienz endlich vorankommen können. Die Aufgabenverteilung kann doch nicht sein, dass die einen laute Forderungen erheben und die anderen es bezahlen. Wenn die Energiewende ein Gemeinschaftswerk ist, dann müssen alle mitmachen. Das wäre richtig und gut.",data/txt/18057.txt,speech,
2262046,57,18,0,,,,652,Beifall bei der CDU/CSU,data/txt/18057.txt,poi,
2262047,57,18,0,,,,653,"Vizepräsidentin Edelgard Bulmahn:

Herr Jung, lassen Sie eine Zwischenfrage des Kollegen Kühn von den Grünen zu?

Andreas Jung (CDU/CSU):

Gerne.

Christian Kühn (Tübingen) (BÜNDNIS 90/DIE GRÜNEN):

Danke, Herr Jung, dass Sie die Zwischenfrage zulassen. - Meine Zwischenfrage bezieht sich natürlich auf die steuerliche Förderung. Wir Grünen sind es, die das Thema der steuerlichen Förderung und der steuerlichen Absetzbarkeit der Kosten der energetischen Sanierung in dieser Legislaturperiode erneut in den Deutschen Bundestag eingebracht haben. Die Große Koalition hat jedoch dagegen gestimmt. In Wahrheit ist es doch so, dass sich diejenigen in der Unionsfraktion, die dafür sind, nicht gegen Schäuble durchsetzen können und es daher nicht erneut auf die Tagesordnung setzen können.

Eines kann ich Ihnen sagen: Sie brauchen Winfried Kretschmann nicht katholischer zu machen, als er ist. Winfried Kretschmann und der baden-württembergische Umweltminister Franz Untersteller setzen sich vehement für die steuerliche Absetzbarkeit bei der energetischen Sanierung ein. Das Land Baden-Württemberg ist ein Vorreiterland. Wir beide kommen aus Baden-Württemberg und wissen, wie groß die Herausforderung in der Wärmetechnologie ist. Ich erwarte da ganz klar, dass diese Bundesregierung mehr macht.

Deswegen frage ich Sie: Wie wollen Sie die Forderung, die Sie gerade erhoben haben, hier in den parlamentarischen Betrieb einbringen?",data/txt/18057.txt,speech,
2262048,57,18,0,,,,654,Beifall beim BÜNDNIS 90/DIE GRÜNEN,data/txt/18057.txt,poi,
2262049,57,18,0,,,,655,"Andreas Jung (CDU/CSU):

Bleiben wir doch bei den Fakten. Die Fakten sind, dass die steuerliche Förderung der energetischen Sanierung nicht an Bundesfinanzminister Wolfgang Schäuble gescheitert ist. Der hat sie nämlich mit vorgeschlagen; der hat sie mit unterstützt.",data/txt/18057.txt,speech,
2262050,57,18,0,Oliver Krischer [BÜNDNIS 90/DIE GRÜNEN],Oliver Krischer [BÜNDNIS 90/DIE GRÜNEN],oliver-krischer-bundnis-90-die-grunen,656,Machen Sie doch mal einen neuen Vorschlag!,data/txt/18057.txt,poi,gruene
2262051,57,18,0,,,,657,"Wir haben dies hier gemeinsam beschlossen. Wir haben es nicht nur diskutiert, wir haben dies hier im Deutschen Bundestag beschlossen. Am Ende ist es daran gescheitert, dass die Länder nicht mitgemacht haben.",data/txt/18057.txt,speech,
2262052,57,18,0,Zuruf von der CDU/CSU,von der CDU/CSU,von-der-cdu-csu,658,Ganz genau!,data/txt/18057.txt,poi,cducsu
2262053,57,18,0,,,,659,"Die Voraussetzung ist doch, dass wir es gemeinsam machen. Jeder muss dazu eine Schippe beitragen, weil es ein Gemeinschaftswerk ist.

Ich zweifele doch nicht an der katholischen Haltung von Herrn Kretschmann, aber ich zweifele an dem Abstimmungsverhalten. Und das Abstimmungsverhalten war so, dass die Länder - leider auch mein Land Baden-Württemberg - dagegen gestimmt haben.",data/txt/18057.txt,speech,
2262054,57,18,0,Oliver Krischer [BÜNDNIS 90/DIE GRÜNEN],Oliver Krischer [BÜNDNIS 90/DIE GRÜNEN],oliver-krischer-bundnis-90-die-grunen,660,"Bayern hat dagegen gestimmt, Sachsen, Niedersachsen, CDU-regiert, auch!",data/txt/18057.txt,poi,gruene
2262055,57,18,0,,,,661,"Wenn Sie uns jetzt hier im Deutschen Bundestag mitteilen, dass Baden-Württemberg seine Haltung geändert hat und Baden-Württemberg beim nächsten Mal, wenn das Ganze zur Abstimmung steht, sagt, man sei nicht nur dafür, sondern auch dazu bereit, selber etwas dazu beizutragen, weil es sehr wichtig sei, dann wird es sicherlich gelingen, dass wir gemeinsam dieses wichtige Vorhaben umsetzen und bei der Energieeffizienz vorankommen.",data/txt/18057.txt,speech,
2262056,57,18,0,,,,662,Beifall bei der CDU/CSU sowie der Abg. Ute Vogt [SPD],data/txt/18057.txt,poi,
2262057,57,18,0,,,,663,"Das ist ein wichtiger Punkt, aber nicht der einzige Punkt. Das Aktionsprogramm für Energieeffizienz muss weitere Bestandteile haben. Wir müssen deutlich machen, dass das Gebäudesanierungsprogramm verstetigt wird, dass es vereinfacht wird, dass es gut möglich ist, hierfür Zuschüsse zu bekommen.

Ferner müssen wir den Gebäudeenergieausweis noch einmal unter die Lupe nehmen und der Frage nachgehen, wie wir ihn noch aussagekräftiger machen. Gemeinsam mit einer Beratungsoffensive, auch gemeinsam mit regionalen Sanierungsnetzwerken können wir hier etwas in Gang bringen, was am Ende nicht nur der Umwelt und dem Klima, sondern auch dem Handwerk und dem Mittelstand nutzt.

Vizepräsidentin Edelgard Bulmahn:

Wollen Sie eine Zwischenfrage der Abgeordneten Paus von den Grünen zulassen?

Andreas Jung (CDU/CSU):

Das trägt ja nicht zuletzt zur Verlängerung meiner Redezeit bei; deshalb gerne.

Lisa Paus (BÜNDNIS 90/DIE GRÜNEN):

Herr Jung, da Sie und ich wissen, dass die steuerliche Förderung der energetischen Gebäudesanierung nicht an den Grünen, sondern an der SPD gescheitert ist, und Sie jetzt mit der SPD eine Große Koalition bilden, frage ich Sie - Sie haben dieses Thema jetzt aufgeworfen -, ob ich Sie richtig verstehe, dass Sie hier heute ankündigen, dass es in dieser Legislaturperiode noch einmal einen Gesetzentwurf von CDU und SPD zur steuerlichen Förderung der energetischen Sanierung geben wird. Und könnten Sie mir nach Möglichkeit sogar ein Datum - vielleicht nächstes Jahr - nennen?

Andreas Jung (CDU/CSU):

Ich bedanke mich zunächst einmal für Ihr Zutrauen: Sie glauben ja, dass es mir möglich ist, konkrete Vorhaben der Bundesregierung anzukündigen. Ich bin jedoch nur ein Abgeordneter einer Regierungsfraktion.",data/txt/18057.txt,speech,
2262058,57,18,0,Oliver Krischer [BÜNDNIS 90/DIE GRÜNEN],Oliver Krischer [BÜNDNIS 90/DIE GRÜNEN],oliver-krischer-bundnis-90-die-grunen,664,Jetzt werden Sie aber nicht pimpelig! Den Bundesrat hier kritisieren und dann das! Das ist doch unglaublich!,data/txt/18057.txt,poi,gruene
2262059,57,18,0,,,,665,"Zweitens. Wenn Sie sagen, dieses Vorhaben sei nicht an den Grünen gescheitert, sondern an der SPD, dann muss ich Ihnen sagen: So genau kenne ich das Innenleben der rot-grünen Landesregierungen nicht, dass ich nachvollziehen könnte, an wem dieses Vorhaben im Einzelnen gescheitert ist.",data/txt/18057.txt,speech,
2262060,57,18,0,Oliver Krischer [BÜNDNIS 90/DIE GRÜNEN],Oliver Krischer [BÜNDNIS 90/DIE GRÜNEN],oliver-krischer-bundnis-90-die-grunen,666,In Berlin regiert meines Wissens kein Grüner!,data/txt/18057.txt,poi,gruene
2262061,57,18,0,,,,667,Das war im Übrigen auch gar nicht mein Thema. Ich hatte vorher gesagt: Es ist an den Ländern gescheitert.,data/txt/18057.txt,speech,
2262062,57,18,0,Oliver Krischer [BÜNDNIS 90/DIE GRÜNEN],Oliver Krischer [BÜNDNIS 90/DIE GRÜNEN],oliver-krischer-bundnis-90-die-grunen,668,"Wie ist das mit Bayern? Herr Jung, wieso hat Bayern dagegen gestimmt?",data/txt/18057.txt,poi,gruene
2262063,57,18,0,,,,669,"Deshalb sollten wir dazu kommen, zu fragen, wie wir gemeinsam weiterkommen.

Ich hatte vorher gesagt: Es geht jetzt gar nicht darum, ein Datum festzulegen, sondern es geht um den Prozess. In dem Moment, in dem die Länder sagen: Wir sind bereit, hier mitzumachen und das Ganze mitzufinanzieren, werden wir - da bin ich sicher - dieses Vorhaben gemeinsam beschließen können.",data/txt/18057.txt,speech,
2262064,57,18,0,Oliver Krischer [BÜNDNIS 90/DIE GRÜNEN],Oliver Krischer [BÜNDNIS 90/DIE GRÜNEN],oliver-krischer-bundnis-90-die-grunen,670,Das sagen alle Grünen in den Ländern!,data/txt/18057.txt,poi,gruene
2262065,57,18,0,,,,671,"Wir haben das hier schon beschlossen. Jetzt liegt der Ball bei den Ländern. Wenn diese zustimmen, können wir das gemeinsam machen.",data/txt/18057.txt,speech,
2262066,57,18,0,,,,672,Beifall bei der CDU/CSU sowie der Abg. Ute Vogt [SPD],data/txt/18057.txt,poi,
2262067,57,18,0,,,,673,"Mein letzter Punkt richtet sich an uns alle: im Bund, in den Ländern und in den Kommunen. Wenn wir uns erhoffen, dass private Hausbesitzer und gewerbliche Gebäudeeigentümer ihre Gebäude sanieren, dann müssen wir selber mit gutem Beispiel vorangehen. Die Sanierungsquote bei öffentlichen Gebäuden ist zu gering und bleibt hinter den Erwartungen und hinter den Zielen zurück. Wir müssen diese Quote mindestens verdoppeln. Das ist eine besondere Herausforderung für uns alle: Das, was wir von anderen erwarten, müssen wir auch selber machen.",data/txt/18057.txt,speech,
2262068,57,18,0,,,,674,Beifall des Abg. Klaus Mindrup [SPD],data/txt/18057.txt,poi,
2262069,57,18,0,,,,675,"Deshalb muss dieser Punkt in dem Programm enthalten sein. Dann bin ich sicher, dass wir für Energieeffizienz etwas erreichen. Dann bin ich sicher, dass wir insgesamt mit dem Aktionsprogramm Klimaschutz vorankommen.

In diesen Bereich gehört auch - das ist angesprochen worden - das Thema Verkehr, nachhaltige Mobilität und Elektromobilität. Nachdem die entsprechenden Modelle auf dem Markt sind, ist das für uns das Signal: Jetzt geht es los. Jetzt müssen wir voranschreiten. Wir müssen gerade auch Unternehmen ermuntern und einen Anreiz dazu geben, ihren Fuhrpark umzurüsten. Es gibt also ein ganzes Paket, das wir zu diskutieren haben. Es muss etwas passieren.

Vielen Dank für die Zusammenarbeit.",data/txt/18057.txt,speech,
2262070,57,18,0,,,,676,Beifall bei der CDU/CSU und der SPD,data/txt/18057.txt,poi,
2262071,57,18,0,,,,677,"Vizepräsidentin Edelgard Bulmahn:

Liebe Kolleginnen und Kollegen, jetzt hat die Kollegin Eva Bulling-Schröter zu einer Kurzintervention das Wort.

Eva Bulling-Schröter (DIE LINKE):

Danke schön, Frau Präsidentin. - Kollege Jung, Sie haben die Linke kritisiert und gesagt: Die Einsparungen im Zusammenhang mit der schwarzen Null können nicht mit klimarelevanten Maßnahmen verrechnet werden. - Die Linke ist nicht für maßlose Verschuldung, um das zunächst einmal klarzustellen.",data/txt/18057.txt,speech,
2262072,57,18,0,Carsten Müller [Braunschweig] [CDU/CSU],Carsten Müller [Braunschweig] [CDU/CSU],carsten-muller-braunschweig-cdu-csu,678,Seit wann das denn nicht?,data/txt/18057.txt,poi,cducsu
