id,sitzung,wahlperiode,in_writing,speaker,speaker_cleaned,speaker_fp,sequence,text,filename,type,speaker_party
2262498,57,18,0,,,,1104,"Ich rufe den Tagesordnungspunkt 8 auf:

Wahl eines Mitglieds des Parlamentarischen Kontrollgremiums gemäß Artikel 45 d des Grundgesetzes

Drucksache 18/2743

Die Fraktion der SPD schlägt auf Drucksache 18/2743 den Kollegen Uli Grötsch vor.

Liebe Kolleginnen und Kollegen, bevor wir zur Wahl kommen, bitte ich um Ihre Aufmerksamkeit für einige Hinweise zum Wahlverfahren. Nach § 2 Absatz 3 des Gesetzes über die parlamentarische Kontrolle nachrichtendienstlicher Tätigkeit des Bundes ist gewählt, wer die Stimmen der Mehrheit der Mitglieder des Bundestages auf sich vereint, das heißt, wer mindestens 316 Stimmen erhält.

Die Wahl erfolgt mit Stimmkarte und Wahlausweis. Die Wahl ist offen. Sie können Ihre Stimmkarte also an Ihrem Platz ankreuzen. Den Wahlausweis können Sie, soweit noch nicht geschehen, Ihrem Stimmkartenfach in der Lobby entnehmen. Bitte beachten Sie, dass der Wahlausweis Ihren Namen trägt. Die Stimmkarten wurden im Saal verteilt. Sollten Sie keine Stimmkarte haben, besteht jetzt noch die Möglichkeit, diese von den Plenar-assistenten zu erhalten. Wer noch keine Stimmkarte hat, den bitte ich um ein Handzeichen.

Gültig sind nur Stimmkarten mit einem Kreuz bei ja, nein oder enthalte mich. Ungültig sind demzufolge Stimmkarten, bei denen kein Kreuz gemacht oder mehr als ein Kreuz gemacht wurde oder ein anderer Name oder sonstige Zusätze vermerkt sind.

Bevor Sie die Stimmkarte in die Wahlurnen werfen, übergeben Sie bitte den Schriftführerinnen und Schriftführern an den Urnen Ihren Wahlausweis. Ich mache darauf aufmerksam, dass die gültige Teilnahme an der Wahl nur dann sichergestellt ist, wenn Sie Ihren Wahlausweis abgegeben haben. Das ist gleichzeitig ein Nachweis, dass Sie teilgenommen haben.

Ich bitte die Schriftführerinnen und Schriftführer, die vorgesehenen Plätze einzunehmen. - Sind alle Plätze an den Urnen besetzt? - Das ist der Fall. Ich eröffne die Wahl.

Ist noch ein Mitglied des Hauses anwesend, das seine Stimme nicht abgegeben hat? - Ich sehe, das ist nicht der Fall. Dann schließen wir die Abstimmung.

Ich schließe die Wahl und bitte die Schriftführerinnen und Schriftführer, mit der Auszählung zu beginnen. Das Ergebnis der Wahl wird Ihnen später bekannt gegeben.1

Ich rufe den Tagesordnungspunkt 11 auf:

Erste Beratung des von den Fraktionen CDU/CSU, SPD, DIE LINKE und BÜNDNIS 90/DIE GRÜNEN eingebrachten Entwurfs eines Neunten Gesetzes zur Änderung des Bundesverfassungsgerichtsgesetzes (9. BVerfGGÄndG)

Drucksache 18/2737

Überweisungsvorschlag:

Ausschuss für Recht und Verbraucherschutz (f)

Innenausschuss

Nach einer interfraktionellen Vereinbarung sind für die Aussprache 38 Minuten vorgesehen. - Ich höre keinen Widerspruch. Dann ist das so beschlossen.

Ich bitte jetzt alle, Platz zu nehmen, die der Debatte folgen wollen. - Dann rufe ich Dr. Matthias Bartke, SPD-Fraktion, auf.

Dr. Matthias Bartke (SPD):

Sehr geehrte Frau Präsidentin! Liebe Kolleginnen und Kollegen! Sehr geehrte Zuschauerinnen und Zuschauer auf der Tribüne! Wir diskutieren heute über das Wahlverfahren für die Richter des Bundesverfassungsgerichts, des höchsten Gerichts unseres Landes. Ich persönlich erinnere mich noch, dass ich als junger Student im ersten Semester Jura davon träumte, einmal Richter an diesem Gericht zu sein. Das Beeindruckende am Bundesverfassungsgericht sind nicht nur seine rechtliche Kompetenz und seine weitreichenden Befugnisse. Nein, das Beeindruckende ist vielmehr seine Aura, eine Aura, die vor allem begründet wird durch seine Unabhängigkeit. Obwohl das Bundesverfassungsgericht häufig hoch politische Entscheidungen zu treffen hat, wird es von der Bevölkerung doch als eine absolut neutrale Instanz wahrgenommen, die nur der Sache verpflichtet ist. Das Bundesverfassungsgericht erfreut sich bei den Bürgern einer Wertschätzung, wie sie allenfalls noch vom Bundespräsidenten erreicht wird. Die Gründe hierfür sind: Das Gericht hat in der Regel wenig Tendenz, Zeitgeistströmungen nachzugeben. Es fällt seine Entscheidungen in überzeugender Überparteilichkeit und Sachorientierung. Die Entscheidungsfindung erfolgt unter hoher Transparenz.

Zu dieser hohen Transparenz und Überparteilichkeit mag der Wahlmodus, mit dem die Richter bisher gewählt wurden, nicht recht passen. In unserem Grundgesetz heißt es in Artikel 94:

Die Mitglieder des Bundesverfassungsgerichtes werden je zur Hälfte vom Bundestage und vom Bundesrate gewählt.

Eigentlich eine ziemlich klare Vorschrift, sollte man meinen. Im Bundesrat werden die Richter auch tatsächlich vom Bundesrat gewählt. Für den Bundestag ist das Wahlverfahren aber im Bundesverfassungsgerichtsgesetz geregelt. Das besagt in § 6, dass nicht das Plenum des Bundestages die Richterinnen und Richter wählt, sondern ein vom Bundestag gewählter Wahlausschuss. Es handelt sich hier also um eine indirekte Wahl. Diese Regelung hat seit ihrer Einführung in der Vergangenheit viel Kritik erfahren. Der Präsident des Bundesverfassungsgerichts, Andreas Voßkuhle, hat einmal dazu ausgeführt:

Die vielerorts als Ämterschacher empfundene Rekrutierung der Richter des Bundesverfassungsgerichts stößt seit jeher auf vehemente Kritik. Die Konzentration der eigentlichen Entscheidung in der Hand weniger Parteifürsten, die weitgehende Verengung des potenziellen Kandidatenkreises auf Parteimitglieder und Sympathisanten sowie die mangelnde Transparenz und Nichtöffentlichkeit des Verfahrens lassen sich in der Tat mit der im Grundgesetz angelegten Konzeption des Bundesverfassungsgerichts als professionalisiertem Rechtsprechungsorgan nur schwer in Einklang bringen.

Diese Kritik von Gerichtspräsident Voßkuhle steht pars pro toto für viele Kritiker. Gerügt wird vor allem die mangelnde Transparenz, die als Geschacher empfunden wird. Gewünscht wird ein transparenteres Verfahren, das dann eine höhere demokratische Legitimation des Gerichts bewirkt.",data/txt/18057.txt,speech,
2262499,57,18,0,,,,1105,Beifall bei Abgeordneten der SPD,data/txt/18057.txt,poi,
2262500,57,18,0,,,,1106,"Das Bundesverfassungsgericht selbst hat 2012 die indirekte Wahl seiner Mitglieder allerdings als verfassungskonform eingestuft. Die Rechtfertigung hierfür sieht es in der Abwägung zu dem verfolgten gesetzgeberischen Ziel. Durch die indirekte Wahl sollen das Ansehen des Gerichts und das Vertrauen in seine Unabhängigkeit gefestigt und damit seine Funktionsfähigkeit gesichert werden. Ohne dem Gericht zu nahe treten zu wollen: Ich finde, man hat schon einleuchtendere Begründungen gehört. Das gilt insbesondere, weil das Gericht in seinem Urteil zur Euro-Rettung selbst darauf bestanden hat, dass für Entscheidungen von erheblicher Tragweite ein Plenarvorbehalt gilt, dass diese also vom Bundestag in öffentlicher Sitzung zu beschließen sind. Entscheidungen über die Besetzung von Richterstellen des Bundesverfassungsgerichts dürften ohne Zweifel Entscheidungen von solch erheblicher Tragweite sein. Der Bundestagspräsident, Herr Lammert, hat in einem Artikel in der FAZ zu diesem Urteil den prägnanten Satz formuliert: Die schlichte Begründung verblüfft. Man mag hinzufügen: Wohl wahr! Selbst Befürworter der derzeitigen indirekten Wahl geben zu, dass zumindest verfassungspolitisch eine Asymmetrie zwischen der hohen Bedeutung der Wahl der Verfassungsrichter und der Delegation dieser Wahl in einen Ausschuss besteht. Hinzu kommt, dass der Wortlaut des Artikels 94 eben doch recht eindeutig ist. Da ist vom Bundestage die Rede und nicht von einem Ausschuss des Bundestages.

Artikel 63 des Grundgesetzes regelt die Wahl der Kanzlerin. Auch sie wird vom Bundestage gewählt. Niemand käme ernsthaft auf die Idee, die Kanzlerin durch einen Wahlausschuss wählen zu lassen.",data/txt/18057.txt,speech,
2262501,57,18,0,Uli Grötsch [SPD],Uli Grötsch [SPD],uli-grotsch-spd,1107,Rechtsausschuss!,data/txt/18057.txt,poi,spd
2262502,57,18,0,,,,1108,"Rechtlich ist das vergleichbar. Auch der Wehrbeauftragte des Bundestages und der Präsident des Bundesrechnungshofes werden vom Bundestag in einer Plenarsitzung gewählt. Bei ihnen gibt es noch nicht einmal einen Verfassungsauftrag mit einem entsprechenden Plenarvorbehalt.

Es sind jeweils nur einfachgesetzliche Handlungsaufträge.

Das Bundesverfassungsgericht sagt in seinem vorhin zitierten Beschluss aus 2012 zur Richterwahl aber auch recht deutlich, dass der Gesetzgeber nicht gehindert ist, andere Modalitäten für die Wahl der Mitglieder des Gerichts zu finden. Meine Damen und Herren, das mag man getrost als einen deutlichen Hinweis an den Gesetzgeber werten. Man könnte auch von einem Wink mit dem Zaunpfahl sprechen.

Diesem Hinweis kommen wir nun nach. Ihnen liegt ein gemeinsamer Gesetzentwurf aller im Bundestag vertretenen Parteien vor. Es ist ein Antrag auf Änderung von § 6 Bundesverfassungsgerichtsgesetz, der dem Wortlaut und vor allem dem Geist des Artikels 94 deutlich gerechter wird als die bisherige Regelung.

Die hohe Unabhängigkeit, die das Bundesverfassungsgericht auszeichnet und die maßgeblich zu seiner hohen Reputation führt, darf nicht durch ein Zerreden der Kandidaten für das höchste Richteramt beschädigt werden. Aus diesem Grunde ist es richtig, dass in dem Gesetzentwurf die Kompetenz für die Richterauswahl weiterhin beim Wahlausschuss liegt. Der Ausschuss soll auswählen und bestimmen, welche Person dem Bundestag für das höchste Richteramt vorgeschlagen wird.

Im Gegensatz zur jetzigen Rechtslage soll es aber künftig so sein, dass der Wahlausschuss nur ein Vorschlagsrecht erhält. Die Wahl selbst erfolgt dann durch das Bundestagsplenum - oder eben auch nicht. Denn es ist eine Zweidrittelmehrheit der anwesenden Abgeordneten, mindestens aber der Mehrheit der Mitglieder des Bundestages erforderlich. Das, meine Damen und Herren, ist schon eine ganz erhebliche Hürde. Durch diese Regelung - Zweidrittelmehrheit der Abstimmenden, mindestens aber die Mehrheit der Mitglieder des Bundestages - soll eine hohe Präsenz der abstimmenden Abgeordneten sichergestellt werden. Die einzelnen Richter sollen damit eine höchstmögliche parlamentarische Legitimation erfahren.

Die Richterwahl durch das Plenum des Bundestages stärkt ganz ohne Zweifel das demokratische Rückgrat des Gerichtes. Von entscheidender Bedeutung ist aber, dass der Bundestag die zu berufenden Richterinnen und Richter des Bundesverfassungsgerichtes ohne Aussprache wählt. Grund hierfür ist, dass die Richter nicht in einer öffentlichen Aussprache zerredet werden sollen. Die offene parlamentarische Debatte über Mängel und Vorzüge der einzelnen Bewerber wäre der sicherste Weg, ihr Ansehen zu beschädigen. Hierdurch würden sie einer parteipolitischen Wertung und Zuordnung unterzogen, die sie gerade nicht haben.

Das Bundesverfassungsgericht zieht seine hohe moralische Autorität maßgeblich aus seiner Politikferne, und das, meine Damen und Herren, soll auch so bleiben.

Das geradezu gegenteilige Modell haben die USA: Die Richter des US-Supreme-Court werden vom US-Präsidenten nominiert, müssen aber vom Senat bestätigt werden. Diese Bestätigungsverfahren erfolgen über öffentliche Hearings der jeweiligen Richter, die im absoluten Scheinwerferlicht stattfinden. Man spricht auch martialisch vom Richtergrillen oder von Entscheidungsschlachten. Dabei spielt Geld übrigens eine nicht unerhebliche Rolle. Das führt in den USA dazu, dass der Fachöffentlichkeit bei jedem Richter in aller Regel klar ist, wo er politisch steht und wie er einzuordnen ist. Das deutsche System ist aus gutem Grund anders und deutlich konsensualer.

Meine Damen und Herren, mit dem vorliegenden Entwurf eines Gesetzes zur Änderung des Bundesverfassungsgerichtsgesetzes steht eine Regelung zur Abstimmung, die die unbestrittenen Vorzüge einer diskreten, vorgeschalteten Vorauswahl mit der abschließenden formellen Wahl durch den Bundestag verbindet. Mit ihr ist gewährleistet, dass weiterhin akzeptable und auf Ausgleich bedachte Persönlichkeiten als Richter für das Bundesverfassungsgericht gefunden und bestellt werden.

Meine Damen und Herren, ich bin der festen Überzeugung: Mit der Verabschiedung dieses Gesetzentwurfes aller Fraktionen werden wir unseren Rechtsstaat noch etwas besser machen.

Ich danke Ihnen.

Vizepräsidentin Ulla Schmidt:

Vielen Dank. - Für die Fraktion Die Linke erhält jetzt Halina Wawzyniak das Wort.",data/txt/18057.txt,speech,
2262503,57,18,0,,,,1109,Beifall bei der LINKEN,data/txt/18057.txt,poi,
2262504,57,18,0,,,,1110,"Halina Wawzyniak (DIE LINKE):

Frau Präsidentin! Meine sehr geehrten Kolleginnen und Kollegen! Mit dem vorgelegten Gesetzentwurf aller Fraktionen - das ist schon gesagt worden - soll die Wahl der Richterinnen und Richter des Bundesverfassungsgerichts vom Richterwahlausschuss und dem Bundesrat auch auf das Plenum des Bundestages übertragen werden. Das stellt die Legitimation der Richterinnen und Richter auf eine breitere Grundlage. Dies ist ein Mehr an Demokratie. Wir finden das gut, und deshalb sind wir selbstverständlich mit dabei.",data/txt/18057.txt,speech,
2262505,57,18,0,,,,1111,Beifall bei der LINKEN,data/txt/18057.txt,poi,
2262506,57,18,0,,,,1112,"Zumindest in der Theorie wird diese Entscheidung dazu führen, dass die Entscheidung über Bundesverfassungsgerichtsrichterinnen und -richter nicht mehr einfach einem Richterwahlausschuss überlassen bleibt. Nun ist es so, dass der eine oder andere - ich nehme mich persönlich da gar nicht aus - in der Lage ist, sich nach der Entscheidung von Richterinnen und Richtern ein Urteil zu bilden. Wir glauben, dass es möglich ist, dass man sich, bevor man Richterinnen und Richter wählt, ein Urteil über dieselben bildet. Deswegen ist das, finden wir, eine gute Idee.

Wir finden aber - da besteht ein kleiner Dissens zum Vorredner -, dass es nicht zwingend ist, dass der Wahlausschuss einen Vorschlag unterbreitet. Man kann darüber nachdenken, ob man nicht weitergehen kann und ob nicht tatsächlich das Plenum insgesamt über Vorschläge, die vorliegen, entscheiden kann. Wir würden uns wünschen, dass wir in diesen Gesetzentwurf so etwas wie eine Befristung oder Überprüfung dieser Regelung schreiben. Vielleicht kann man irgendwann weitergehen.",data/txt/18057.txt,speech,
2262507,57,18,0,,,,1113,Beifall bei der LINKEN,data/txt/18057.txt,poi,
2262508,57,18,0,,,,1114,"Wir glauben aber auch, dass der Vorschlag, den wir hier gemeinsam unterbreiten, ein Anlass sein kann, eine weiter gehende Debatte zu führen. Ich finde, dass man eine ergebnisoffene Debatte - wenn ich ergebnisoffen sage, meine ich tatsächlich auch ergebnisoffen - führen kann, zum Beispiel ob es wirklich sinnvoll ist und hilfreich sein kann, wenn man Laienrichterinnen und Laienrichter in ein Verfassungsgericht schickt. Ich bin noch nicht entschieden, ich bin unsicher. Ich weiß, dass es das in einigen Bundesländern gibt. Ich finde, das kann man einfach einmal evaluieren.

Wir sollten darüber nachdenken, ob es sinnvoll und angemessen ist - darüber sprechen wir heute Abend noch -, eine Karenzzeit einzuführen, in der aktive Politikerinnen und Politiker nicht in das Bundesverfassungsgericht wechseln dürfen. Es gab Fälle, in denen unmittelbar nach dem Ausscheiden aus dem politischen Amt in das Bundesverfassungsgericht gewechselt wurde. Das ist vielleicht nicht ganz so prima.

Wir finden, dass man darüber nachdenken muss - das habe ich schon angedeutet -, ob man nicht möglicherweise das Vorschlagsrecht etwas verbreitert. Wenn man schon dabei bleibt, dass der Richterwahlausschuss dem Plenum einen Vorschlag unterbreitet, sollte man vielleicht überlegen, ob es auch anderen Institutionen als Fraktionen, Landesregierungen oder der Bundesregierung möglich sein soll, dem Richterwahlausschuss Wahlvorschläge zu unterbreiten.

Da wir in dem eigentlichen Punkt einig sind, nämlich dass wir im Plenum die Bundesverfassungsrichterinnen und -richter wählen lassen wollen, sollten wir uns vielleicht doch die Zeit nehmen, den einen oder anderen Punkt, den ich hier angesprochen habe, zu debattieren und zu überlegen, ob man nicht auch an anderen Stellen etwas machen muss. Das muss nicht gleich in diesem Gesetz sein, das kann auch in einem weiteren Gesetz erfolgen. Ich würde mir wünschen, dass wir diese Debatte führen.

Ich will noch einen letzten Punkt ansprechen. Wir sollten darüber diskutieren, ob es wirklich überzeugend ist, dass das Bundesverfassungsgericht mit einstimmigem Beschluss unzulässige und offensichtlich unbegründete Anträge ohne Begründung ablehnen kann. Ich weiß, diese Begründungspflicht ist mit erheblichem Arbeitsaufwand verbunden, aber ich glaube auch, dass die Bürgerinnen und Bürger einen Anspruch darauf haben, wenigstens ansatzweise zu erfahren, warum mit ihrer Beschwerde so oder so umgegangen worden ist.

Letztendlich glaube ich, dass wir diese konkrete Regelung relativ unproblematisch und ohne großes Gezänk über die Bühne bringen. Ich will aber noch ausdrücklich darum bitten, dass wir die anderen Punkte - vielleicht haben auch Sie noch Themen - diskutieren und die Debatte nutzen, um über eine weitere Demokratisierung des Bundesverfassungsgerichts in Ruhe zu sprechen.

Danke schön.",data/txt/18057.txt,speech,
2262509,57,18,0,,,,1115,Beifall bei der LINKEN,data/txt/18057.txt,poi,
2262510,57,18,0,,,,1116,"Vizepräsidentin Ulla Schmidt:

Vielen Dank. - Ich gebe Ihnen jetzt das Ergebnis der Wahl eines Mitglieds des Parlamentarischen Kontrollgremiums gemäß Artikel 45 d des Grundgesetzes bekannt. Abgegebene Stimmen 569. Ungültige Stimmen 1. Gültige Stimmen 568. Mit Ja haben gestimmt 544, mit Nein haben gestimmt 6, Enthaltungen 18. Der Abgeordnete Uli Grötsch hat damit 544 Stimmen erhalten. Die erforderliche Mehrheit von mindestens 316 Stimmen wurde erreicht. - Vielen Dank.2",data/txt/18057.txt,speech,
2262511,57,18,0,,,,1117,Beifall im ganzen Hause,data/txt/18057.txt,poi,
2262512,57,18,0,,,,1118,Für die CDU/CSU-Fraktion hat jetzt Dr. Stephan Harbarth das Wort.,data/txt/18057.txt,speech,
2262513,57,18,0,,,,1119,Beifall bei der CDU/CSU sowie des Abg. Dr. Matthias Bartke [SPD],data/txt/18057.txt,poi,
2262514,57,18,0,,,,1120,"Dr. Stephan Harbarth (CDU/CSU):

Frau Präsidentin! Meine Damen und Herren Kollegen! Meine sehr geehrten Damen und Herren auf der Zuschauertribüne! Wir beraten heute den Entwurf des Neunten Gesetzes zur Änderung des Bundesverfassungsgerichtsgesetzes in erster Lesung. Artikel 94 des Grundgesetzes formuliert:

Die Mitglieder des Bundesverfassungsgerichtes werden je zur Hälfte vom Bundestage und vom Bundesrate gewählt.

Der Bundesrat setzt diese Vorgabe der Verfassung seit vielen Jahren dadurch um, dass dort das Plenum entscheidet. Im Bundestag entscheidet der Wahlausschuss.

Ich möchte vorab zunächst einmal all den Kolleginnen und Kollegen - ich selbst gehöre nicht dazu -, die dem Wahlausschuss angehören, sehr herzlich danksagen. Es geht heute nicht darum, ein Misstrauen gegen den Wahlausschuss zum Ausdruck zu bringen, sondern es geht darum, eine verfassungspolitische Neujustierung vorzunehmen. Aber all denen, die in den vergangenen Jahren dort sehr besonnen, gut und engagiert gewirkt haben, zunächst einmal vielen herzlichen Dank!",data/txt/18057.txt,speech,
2262515,57,18,0,,,,1121,Beifall bei der CDU/CSU sowie bei Abgeordneten der SPD,data/txt/18057.txt,poi,
2262516,57,18,0,,,,1122,"Wir haben die Entscheidung des Bundesverfassungsgerichts aus dem Jahr 2012, dass die bisherige Praxis der Wahl der Verfassungsrichter durch den Wahlausschuss grundgesetzkonform sei. Unstrittig ist dies unter Staatsrechtlern nicht. Der derzeit amtierende Präsident des Bundesverfassungsgerichts ist vorhin bereits zitiert worden. Erlauben Sie mir, dass ich eine andere Passage seiner Grundgesetzkommentierung zitiere. Er formuliert dort:

Von nicht unerheblichen Teilen der Literatur wird diese Regelung zu Recht für verfassungswidrig gehalten. Da die Verfassung selbst an verschiedenen Stellen  zwischen dem Bundestag und den Ausschüssen differenziert, kann Art. 94 Abs. 1 S. 2 nur dahingehend verstanden werden, dass dem Plenum der Abgeordneten die Wahl der Richter vorbehalten sein soll. Eine weitergehende Kompetenzdelegation des Parlaments auf Teile seiner selbst widerspricht darüber hinaus der Bedeutung dieser Entscheidung und damit dem Erfordernis funktionsadäquater demokratischer Legitimation.

So die Ausführungen des derzeit amtierenden Präsidenten des Bundesverfassungsgerichts.

Jenseits der verfassungsrechtlichen Frage, ob man die bisherige Praxis für rechtskonform oder für verfassungswidrig hält, ist es aus meiner Sicht verfassungspolitisch richtig, künftig die Verfassungsrichter durch das Plenum des Deutschen Bundestages wählen zu lassen. Das Bundesverfassungsgericht hat immer wieder zutreffend - auch im Hinblick auf das Neunergremium im Rahmen der Euro-Rettung - darauf hingewiesen, dass Entscheidungen von erheblicher Tragweite grundsätzlich im Plenum zu treffen sind. Das ist nicht nur verfassungsrechtlich richtig, das ist auch verfassungspolitisch überzeugend. Wenn ich mir insgesamt anschaue, welche Wahlakte das Plenum des Deutschen Bundestages vorzunehmen hat - dazu gehören etwa die Wahl des Wehrbeauftragten, die Wahl des Präsidenten des Bundesrechnungshofs und die Wahl des Bundesbeauftragten für den Datenschutz -, dann muss ich bei allem Respekt vor diesen Ämtern sagen: Die Wahl eines Verfassungsrichters ist nicht minder wichtig, und deshalb wäre es unstimmig, die Entscheidung über die Wahl von Verfassungsrichtern dauerhaft beim Wahlausschuss zu belassen.

Das folgt verfassungspolitisch für mich insbesondere aus der Kompetenz des Bundesverfassungsgerichts, Gesetze des Deutschen Bundestages als verfassungswidrig zu verwerfen. Ein Senat des Bundesverfassungsgerichts bestehend aus acht Richtern kann mit fünf zu drei Richterstimmen beschließen, dass ein Gesetz, das der Deutsche Bundestag einstimmig mit dem Votum von 631 Abgeordneten beschlossen hat, verfassungswidrig ist. Wenn der Deutsche Bundestag ein Gesetz beschließt, dann beschließt er das ja nicht nur deshalb, weil er es politisch für zweckmäßig hält, sondern auch deshalb, weil die Abgeordneten der Überzeugung sind, dass das entsprechende Gesetz verfassungskonform ist. Deshalb halte ich es für richtig, wenn fünf Verfassungsrichter in Karlsruhe die Möglichkeit haben, das Votum von im Extremfall 631 Abgeordneten, die für ein Gesetz gestimmt haben, zu überspielen, das Gesetz also als grundgesetzwidrig zu verwerfen, dass diese Richter wenigstens unmittelbar vom Deutschen Bundestag gewählt worden sind, der seinerseits vom deutschen Volk in unmittelbarer und direkter Wahl gewählt wurde.",data/txt/18057.txt,speech,
2262517,57,18,0,,,,1123,Beifall bei der CDU/CSU sowie bei Abgeordneten der SPD,data/txt/18057.txt,poi,
2262518,57,18,0,,,,1124,"Verfassungspolitisch spricht aus unserer Sicht viel dafür, Frau Kollegin Wawzyniak - wir sind in der weiteren Gesetzesberatung für den Diskurs offen -, dass man die Wahl der Richter ohne Aussprache vornimmt. Das ist insbesondere deshalb naheliegend, weil wir die Sorge haben, dass Kandidaten hier im Plenum zerredet werden. Wir finden es auch gut - jetzt komme ich auf Ihren Punkt zurück -, wenn ein Vorschlag des Wahlausschusses gemacht wird und dann über diesen Vorschlag des Wahlausschusses abgestimmt wird, weil damit die Vorzüge beider Systeme miteinander kombiniert werden können.

Ich möchte klarmachen, dass es um den Ausgleich von möglichen verfassungsrechtlichen bzw. verfassungspolitischen Defiziten geht und nicht um einen Kompetenzzuwachs für Karlsruhe. Der Umstand, dass Verfassungsrichter künftig mit Zweidrittelmehrheit direkt vom Deutschen Bundestag gewählt werden, macht sie selbstverständlich nicht zu Ersatzgesetzgebern, sondern belässt sie in der Position, die sie bisher haben.

Wir bekommen ein Mehr an Transparenz, ein Mehr an öffentlicher Debatte. Das mag dem einen gefallen, das mag dem anderen nicht gefallen. Ich finde, die Bereitschaft, auch eine kritische Diskussion über die eigene Person auszuhalten, sollte nicht nur von denen verlangt werden, die sich in einem wichtigen öffentlichen Amt um eine vierjährige oder fünfjährige Amtszeit bewerben, sondern auch von denen, die sich um eine zwölfjährige Amtszeit bewerben.",data/txt/18057.txt,speech,
2262519,57,18,0,Margaret Horb [CDU/CSU],Margaret Horb [CDU/CSU],margaret-horb-cdu-csu,1125,Genau!,data/txt/18057.txt,poi,cducsu
2262520,57,18,0,,,,1126,"Wichtig ist, dass die Debatten dann mit Vernunft und mit Stil geführt werden. Hier werden wir alle gefordert sein.

In diesem Sinne wird diese Gesetzesänderung gerade für uns eine Verpflichtung sein, in der praktischen Umsetzung von dem neuen Verfahren weise Gebrauch zu machen.

Vielen herzlichen Dank.",data/txt/18057.txt,speech,
2262521,57,18,0,,,,1127,Beifall bei der CDU/CSU und der SPD,data/txt/18057.txt,poi,
2262522,57,18,0,,,,1128,"Vizepräsidentin Ulla Schmidt:

Nächste Rednerin ist Renate Künast, Bündnis 90/Die Grünen.

Renate Künast (BÜNDNIS 90/DIE GRÜNEN):

Frau Präsidentin! Meine Damen und Herren! Liebe Vorrednerin und liebe Vorredner! Herr Bartke war der Erste, der den jetzigen Verfassungsgerichtspräsidenten, zitiert hat, der noch als Herr Professor Voßkuhle in einer Kommentierung ausgeführt hat, dass es nach dem Wortlaut des Grundgesetzes wohl richtig sei, dass der Bundestag und nicht eine vom Bundestag bestimmte Kommission wählt. Das finde ich auch richtig.

Ich will nur hinzufügen - Herr Harbarth und andere haben das auch angesprochen -: Es ist eigentlich noch viel putziger.",data/txt/18057.txt,speech,
