id,sitzung,wahlperiode,in_writing,speaker,speaker_cleaned,speaker_fp,sequence,text,filename,type,speaker_party
2262868,57,18,0,,,,1474,"Wir alle sollten uns deshalb so gut funktionierender Behörden und Dienststellen in unserem Land glücklich schätzen. Das ist ein unschätzbarer Standortvorteil für Deutschland, was wir im Vergleich mit unseren EU-Nachbarn und vor allem angesichts bei uns bewältigter Krisen auch immer wieder merken.

In Zahlen ausgedrückt ist der Gesetzesinhalt - wie schon in den Jahren zuvor - die lineare Anhebung der Dienst- und Versorgungsbezüge in zwei Schritten: in einem ersten Schritt, rückwirkend zum 1. März 2014, um 2,8 Prozent und im zweiten Schritt zum 1. März 2015 um 2,2 Prozent. Für die Grundgehälter gilt eine Erhöhung um mindestens 90 Euro.

Bei den Anwärtergrundbeträgen gehen wir ebenfalls in zwei Schritten vor und erhöhen diese in einem ersten Schritt um 40 Euro, rückwirkend zum 1. März 2014, und in einem zweiten Schritt zum 1. März nächsten Jahres um weitere 20 Euro.

Bereits in der letzten Wahlperiode wurde der Tarifabschluss entsprechend auf die Beamtenbesoldung übertragen. Wir gehen diesen Weg nun weiter und setzen damit ein klares Signal für die Attraktivität und Zukunftsfähigkeit unseres öffentlichen Dienstes und damit auch unseres Staates.

Mit dem heute zur Debatte stehenden Gesetz kommen wir unserer Verantwortung nach und erfüllen mit der Übertragung der Tarifergebnisse - neben einer Anpassung der Besoldung an die wirtschaftlichen Verhältnisse der Gegenwart - noch eine weitere Funktion: Wir begegnen den Auswirkungen des Demografiewandels, der dem öffentlichen Dienst in Zukunft erhebliche Probleme bereiten wird, wenn wir nicht gegensteuern.

Der Wettbewerb um die besten Köpfe in unserem Land ist längst in vollem Gange, und dieser ist angesichts einer sich stetig verändernden Altersstruktur und einer zurückgehenden Zahl an Kindern eine der größten Herausforderungen für unseren öffentlichen Dienst. Es ist ein offenes Geheimnis, dass eine Abwanderung der Fachkräfte in die Privatwirtschaft droht. Dies ist kein fernes Zukunftsszenario, sondern bereits jetzt spürbar. Das wird mir auch von allen Seiten berichtet.

Der Bund als Dienstherr von rund einer halben Million Beschäftigten im öffentlichen Dienst auf Bundesebene berücksichtigt bereits jetzt diese Herausforderungen. Der öffentliche Dienst in Deutschland ist in zweifacher Hinsicht vom demografischen Wandel betroffen. Zum einen sind der immer stärker umkämpfte Arbeitsmarkt und die Gewinnung geeigneten Nachwuchses für die unterschiedlichsten Aufgaben der Verwaltung zu nennen. Zum anderen muss der öffentliche Dienst aber auch den älter werdenden Beschäftigten gerecht werden. Eine demografiegerechte Personalpolitik ist daher für alle Ebenen der Verwaltung von stets wachsender Bedeutung. Das schließt - trotz aller haushaltspolitisch gebotenen Sparmaßnahmen - eine aufgabengerechte Personalausstattung bei Verwaltung, Polizei, Justiz und auch Bundeswehr ein.

Mit der kontinuierlichen Übertragung der Tarifergebnisse setzen wir ein richtiges Signal für die Bundesbeamten und auch die zukünftigen Arbeitskräfte. Wir zeigen, dass die Teilhabe unserer Beamten am wirtschaftlichen Erfolg unseres Landes einen wichtigen Stellenwert hat.

Eine gute Ausbildung und verlässliche Arbeitsbedingungen bei ansprechender Absicherung sind die Stärken des öffentlichen Dienstes. Nur durch den Ausbau dieser Stärken können wir mit der Privatwirtschaft in Konkurrenz treten und qualifizierte, motivierte Arbeitnehmer für den öffentlichen Dienst begeistern und dem Fachkräftemangel entgegentreten.

Schon in der vorangegangenen Wahlperiode haben wir daher entsprechende Anreize und klare Akzente gesetzt. Seit 2012 wird die Sonderzahlung - auch als Weihnachtsgeld bekannt - wieder gewährt. Mit dem Fachkräftegewinnungsgesetz haben wir eine Reihe von positiven Maßnahmen auf den Weg gebracht, wie zum Beispiel den Personalgewinnungszuschlag, die Anerkennung von Erfahrungszeiten, von Wehrdienst- und Freiwilligendienstzeiten, von Kinderbetreuungs- und Pflegezeiten oder die Einführung einer Verpflichtungsprämie für polizeiliche Auslandsverwendungen. Wir haben den Eintritt in den Ruhestand flexibler gestaltet, gleiche Rechte für Lebenspartnerschaften und die Familienpflegezeit im Beamtenrecht umgesetzt. Wir haben die Vergütungen von Professoren verbessert, das Leistungsprinzip gestärkt und die Portabilität von Versorgungsanwartschaften geschaffen.

Alles das waren in nur vier Jahren beachtliche Verbesserungen für den öffentlichen Dienst insgesamt, die - an dieser Stelle zu erwähnen - auch noch einmal deutlich das Engagement der Bundesregierung hervorheben. Auf dieser großartigen Erfolgsbilanz baut die heutige Übernahme der Tarifergebnisse auf und setzt sie fort.

Mit dem vorliegenden Gesetzentwurf der Bundesregierung senden wir auch ein klares Signal an die Bundesländer. Die inhaltsgleiche Übertragung der Tarifergebnisse wird auf Länderebene immer noch von Bundesland zu Bundesland unterschiedlich gehandhabt. Auch die Länder werden den Fachkräftemangel zu spüren bekommen, wenn sie nicht gleichzeitig handeln. Ich kann nur alle Landesregierungen von hier aus dazu aufrufen, die Chance zum Handeln nicht zu verpassen.",data/txt/18057.txt,speech,
2262869,57,18,0,,,,1475,Beifall bei der CDU/CSU sowie bei Abgeordneten der SPD,data/txt/18057.txt,poi,
2262870,57,18,0,,,,1476,"Dem Bund kommt in dieser Hinsicht eine Vorbildfunktion zu, welche wir aus meiner Sicht voll und ganz erfüllen. Das zeigt nicht zuletzt der heute vorliegende Gesetzentwurf.

Die nunmehr im Gesetzentwurf vorgesehenen Verbesserungen bei der Besoldung sind allesamt sehr gute Vorschläge, weshalb ich keine Änderungen am Gesetzentwurf beabsichtige, der unser aller Unterstützung verdient.

Herzlichen Dank.",data/txt/18057.txt,speech,
2262871,57,18,0,,,,1477,Beifall bei der CDU/CSU und der SPD,data/txt/18057.txt,poi,
2262872,57,18,0,,,,1478,"Vizepräsidentin Petra Pau:

Für die Fraktion Die Linke hat der Kollege Frank Tempel das Wort.",data/txt/18057.txt,speech,
2262873,57,18,0,,,,1479,Beifall bei der LINKEN,data/txt/18057.txt,poi,
2262874,57,18,0,,,,1480,"Frank Tempel (DIE LINKE):

Danke schön. - Sehr geehrte Frau Präsidentin! Sehr geehrte Damen und Herren! Mehr Geld für Beamte ist die häufig vereinfachte Aussage dessen, was wir heute hier beschließen wollen. Es geht, wie gesagt, um eine Entgelterhöhung um 3 Prozent, mindestens aber 90 Euro, rückwirkend zum 1. März dieses Jahres, und eine weitere Erhöhung um 2,4 Prozent zum 1. März 2015.

Wie der Kollege Veith richtig gesagt hat, soll die Besoldungs- und Versorgungsanpassung dazu führen, dass die Dienst- und Versorgungsbezüge im Bund an die Entwicklung der allgemeinen wirtschaftlichen und finanziellen Lage angepasst werden. Das ist also ein ganz normaler Vorgang. Tarifbeschäftigte haben ihren Tarifstreit, Beamte haben das nicht. Dementsprechend verlassen sich Beamtinnen und Beamte natürlich darauf, dass die zuständigen Parlamente rechtzeitig die entsprechenden Gesetze erlassen. Für Bundesbeamte sind wir hier zuständig.

Grundlage für die Erhöhung ist der Tarifbeschluss für die Tarifbeschäftigten des öffentlichen Dienstes des Bundes vom 1. April dieses Jahres, welcher zeitnah und inhaltsgleich übernommen werden soll. Bei der Gelegenheit möchte ich alle, die gerade zuhören, auf etwas hinweisen: Auch dieses Mal ist die Erhöhung um 0,2 Prozent gemindert worden. Diese 0,2 Prozent werden einer Versorgungsrücklage zugeführt. Das heißt, bei jeder Umsetzung eines Tarifergebnisses leisten Beamte einen Beitrag zur Finanzierung ihrer Altersversorgung. Das muss der Fairness halber einmal erwähnt werden; denn viele wissen das nicht.

Dass das Tarifergebnis ansonsten zeitnah und inhaltsgleich übernommen wird, betrachte ich eigentlich als Selbstverständlichkeit. Ich begrüße es ausdrücklich, dass es der Bund und die Bundesregierung auch so sehen; das hat schon eine gewisse Tradition. In den Ländern gibt es manchmal etwas mehr Diskussionsbedarf.

Der Deutsche Beamtenbund wertet die zügige Umsetzung des Gesetzes dementsprechend als Zeichen der Wertschätzung des Dienstherren für seine Beamtinnen und Beamten und erkennt hier ein wichtiges Signal. Wenn ich die Ausführungen des Kollegen Veith richtig verstanden habe, dann sieht er darin auch ein Signal, ein Signal, sich hier einmal richtig für die Arbeit feiern zu lassen. Mir sind die Ergebnisse der Arbeit aber, ehrlich gesagt, etwas zu dünn, um eine Feierstimmung aufkommen zu lassen.",data/txt/18057.txt,speech,
2262875,57,18,0,,,,1481,Beifall bei der LINKEN sowie der Abg. Irene Mihalic [BÜNDNIS 90/DIE GRÜNEN],data/txt/18057.txt,poi,
2262876,57,18,0,,,,1482,Zuruf von der CDU/CSU,data/txt/18057.txt,poi,
2262877,57,18,0,,,,1483,"- Sie konnten jetzt nicht erwarten, dass ich Sie fünf Minuten lobe. So weit wollen wir heute nicht gehen.",data/txt/18057.txt,speech,
2262878,57,18,0,,,,1484,Beifall der Abg. Kathrin Vogler [DIE LINKE],data/txt/18057.txt,poi,
2262879,57,18,0,,,,1485,"Es ist bekannt, dass sich die Linke immer wieder kritisch mit einigen Aufgabenfeldern der Beamten ausei-nandersetzt, etwa bei der Bundeswehr, bei der Polizei, beim Zoll usw., wo es ja Beamte gibt. Das heißt, dass wir die Bundeswehr nicht unbedingt als Friedensbringer in Afghanistan sehen. Sie kennen auch unser Streitthema Polizei und Bürgerrechte; da geht es zum Beispiel um die Vorratsdatenspeicherung, die Kennzeichnungspflicht für Polizeibeamte und die Forderung nach einem unabhängigen Polizeibeauftragten. Darüber streiten wir miteinander. Aber bei all diesen Diskussionen ist für die Linke immer eines klar: Menschen, die ihren Dienst im Staatsauftrag versehen, haben das Recht und den Anspruch auf ein ordentliches finanzielles Auskommen,",data/txt/18057.txt,speech,
2262880,57,18,0,,,,1486,Beifall bei der LINKEN,data/txt/18057.txt,poi,
2262881,57,18,0,,,,1487,"auf zumutbare Arbeitsbedingungen und auf eine angemessene Ausstattung im Dienst, um ihre Arbeit tatsächlich ausführen zu können.",data/txt/18057.txt,speech,
2262882,57,18,0,,,,1488,Beifall bei der LINKEN,data/txt/18057.txt,poi,
2262883,57,18,0,,,,1489,"Wenn man die Arbeit dieser Menschen wirklich wertschätzen will, dann kann man ihnen nicht immer wieder neue Aufgaben übertragen, ohne das bisherige Aufgabenfeld einer gründlichen Analyse unterzogen zu haben.

Als ehemaliger Polizeibeamter möchte ich das ein wenig am Beispiel der Bundespolizei verdeutlichen. In Pressemeldungen vom 24. August dieses Jahres - das ist also relativ aktuell - wurde ausgeführt, dass die Bundespolizei nach derzeitigem Stand rechnerisch zahlungsunfähig sei.

Das muss man sich einmal genau anhören. Der Innenausschuss hat sich bis heute nicht damit beschäftigt, genauer gesagt, eine Information der Bundesregierung an den Innenausschuss hat es bis heute zu solch einer Meldung nicht gegeben. Das wurde immer wieder hinausgeschoben. Ist das Wertschätzung der Beschäftigten?

Bundespolizisten und ihre Personalvertreter berichten uns immer wieder von unhaltbaren baulichen Zuständen in den Dienststellen, von defekten Sanitäranlagen, von verschimmelten Räumen. Allerdings stecken Neubau und Sanierung sehr häufig im Investitionsstau fest, auf welcher Autobahn auch immer. Meinen Sie das vielleicht mit Wertschätzung?

Ich habe noch ein Beispiel. Bundesbeamte haben ihren Dienst eigentlich mit dem Laufbahnprinzip begonnen. Jahr für Jahr reden wir aber über einen Beförderungsstau.",data/txt/18057.txt,speech,
2262884,57,18,0,Armin Schuster [Weil am Rhein] [CDU/CSU],Armin Schuster [Weil am Rhein] [CDU/CSU],armin-schuster-weil-am-rhein-cdu-csu,1490,Aber nicht bei der Polizei! Beim Bund!,data/txt/18057.txt,poi,cducsu
2262885,57,18,0,,,,1491,"So ist es normal, dass zum Beispiel Bundesbeamte im mittleren Dienst trotz guter Beurteilung häufig nicht darauf vertrauen können, das Endamt ihrer Laufbahn überhaupt zu erreichen. Beförderungsstau ist nach wie vor ein aktuelles Thema, auch beim Bund. Reden Sie einfach einmal mit den Vertretern der Bundespolizeigewerkschaft,",data/txt/18057.txt,speech,
2262886,57,18,0,Clemens Binninger [CDU/CSU],Clemens Binninger [CDU/CSU],clemens-binninger-cdu-csu,1492,Machen wir ja!,data/txt/18057.txt,poi,cducsu
2262887,57,18,0,,,,1493,"dann wird man Ihnen das bestätigen.

Meine Damen und Herren, wenn ich Menschen und ihre Arbeit wertschätzen will, dann würde ich das nicht gerade dadurch zeigen wollen, dass sie mit immer weniger Ressourcen noch mehr Aufgaben übernehmen. Ich bleibe auch gleich bei der Bundespolizei, weil Sie diesbezüglich wohl Zweifel haben. Die Lücke, die der Stellenabbau gerissen hat, wird von den Personalvertretern mittlerweile auf 800 Stellen beziffert. Diese Lücke ist nicht geschlossen worden, im Gegenteil: Jetzt soll zum Beispiel die Bundespolizei auch noch die Bewachung der Bundesbank übernehmen. Allein dafür werden weitere 200 Stellen benötigt. So geht das seit Jahren, und das ist alles andere als eine Wertschätzung der Arbeit der Bediensteten. Sie sind bereits lange an der Leistungsgrenze angekommen. Der Gipfel der Peinlichkeit war, dass zu Beginn dieses Jahres Beamte, die in den Ruhestand gehen wollten, in einem Schreiben überredet werden sollten, noch einige Monate an den Dienst dranzuhängen, um Personalfehlbestände auszugleichen.

Bei all diesen Fragen wird die Linke der Bundesregierung und der Regierungskoalition weiter kräftig auf die Füße treten, an der Seite der Beschäftigten stehen. Das ist unsere Variante der Wertschätzung.",data/txt/18057.txt,speech,
2262888,57,18,0,,,,1494,Beifall bei der LINKEN sowie der Abg. Irene Mihalic [BÜNDNIS 90/DIE GRÜNEN],data/txt/18057.txt,poi,
2262889,57,18,0,,,,1495,"Vizepräsidentin Petra Pau:

Der Kollege Matthias Schmidt hat für die SPD-Fraktion das Wort.",data/txt/18057.txt,speech,
2262890,57,18,0,,,,1496,Beifall bei der SPD sowie des Abg. Clemens Binninger [CDU/CSU],data/txt/18057.txt,poi,
2262891,57,18,0,,,,1497,"Matthias Schmidt (Berlin) (SPD):

Frau Präsidentin! Meine sehr geehrten Damen und Herren auf den Zuschauertribünen! Liebe Kolleginnen und Kollegen! Nicht geschenkt, sondern verdient, das war das Motto, das wir hier im Sommer für das Rentenpaket gefunden hatten. Das Rentenpaket ist seit 1. Juli 2014 in Kraft, und es erfreut sich großer Beliebtheit. Dieses Motto könnte auch als Leitmotiv für das heutige Gesetz dienen, das Bundesbesoldungs- und -versorgungsanpassungsgesetz.

Wir werten und würdigen mit dem heutigen Gesetz die Leistungen des öffentlichen Dienstes in Deutschland. Der öffentliche Dienst ist organisatorisch zweigeteilt. Wir haben auf der einen Seite die Beamten und auf der anderen Seite die Tarifbeschäftigten. Die Tarifbeschäftigten waren früher noch einmal untergliedert in Arbeiter und Angestellte. Diese Gruppen sind inzwischen zusammengefasst. Wesentlich bei den privatrechtlichen Arbeitsverhältnissen ist, dass Arbeitgeber und Arbeitnehmer die Gehälter selbst aushandeln und in Tarifverträgen festschreiben können.

Im öffentlich-rechtlichen Dienst- und Treueverhältnis der Beamten gibt es das nicht. Deswegen braucht es ein Gesetz, um die Besoldung und die Versorgung festzusetzen. Es ist sehr gute Übung, dass der Bundesinnenminister versucht, das Ergebnis der Tarifverhandlungen des öffentlichen Dienstes zeit- und inhaltsgleich zu übernehmen und auf die Beamtinnen und Beamten zu übertragen. In der Vergangenheit ist das in einigen Fällen nicht gelungen, damals jeweils aus guten Gründen. Aber dieses Mal ist es wieder gelungen, dass die Vorlage dies vorsieht. Dafür herzlichen Dank!",data/txt/18057.txt,speech,
2262892,57,18,0,,,,1498,Beifall bei der SPD,data/txt/18057.txt,poi,
2262893,57,18,0,,,,1499,"Im Ergebnis können also die Bundesbeamtinnen und -beamten eine Erhöhung ihrer Bezüge um 2,8 Prozent ab 1. März 2014 erwarten. Diejenigen in den unteren Einkommensklassen können mindestens 90 Euro pro Monat mehr erwarten. Im Gesetzentwurf ist ein Beispiel angeführt: Ein Beamter in der Besoldungsgruppe A 3 bekommt demnach dann 4,5 Prozent mehr. Ich finde, es ist ein besonders gutes Ergebnis, dass man auch an die kleinen Leute gedacht hat.

Im kommenden Jahr werden alle Beamtinnen und Beamten ab 1. März nochmals 2,2 Prozent mehr bekommen. Kollege Tempel sprach eben davon, dass sie 3 Prozent bzw. 2,4 Prozent mehr bekommen. Das ist zwar richtig, aber zur Wahrheit gehört - er hat es selbst auch gesagt -, dass wir diese Erhöhungsbeträge um 0,2 Prozentpunkte reduziert haben, um die Versorgungsrücklage zu stärken. Auch dies sollte hier im Haus erwähnt werden.

Die Anwärterbezüge - das sind die Gehälter für die Nachwuchsbeamten - steigen zum 1. März 2014 um 40 Euro und ein Jahr später um weitere 20 Euro. Auch dies empfinden wir als gutes Signal in Bezug auf die Nachwuchsgewinnung, insbesondere vor dem Hintergrund des demografischen Wandels.",data/txt/18057.txt,speech,
2262894,57,18,0,,,,1500,Beifall bei der SPD sowie des Abg. Clemens Binninger [CDU/CSU],data/txt/18057.txt,poi,
2262895,57,18,0,,,,1501,"Von diesem Gesetzentwurf, den wir heute beschließen wollen, werden insgesamt knapp 500 000 aktive Beamte und gut 600 000 Versorgungsempfänger, landläufig als Pensionäre bezeichnet, profitieren. Dass man von aktiven Beamten spricht, dass man allein schon diese Unterscheidung treffen muss und sie aktive Beamte nennt - dabei geht es doch nur um diejenigen, die arbeiten -, insinuiert, es gäbe auch inaktive Beamte. Jeder von uns kennt auch böse Sprüche über die Beamten. Die sind im Großen und Ganzen aber nicht gerechtfertigt. Schon Kurt Tucholsky hat vor vielen Jahren von dem Schicksal der Deutschen geschrieben, die vor einem Schalter stehen müssen, während das eigentliche Ideal bei der Berufswahl jedoch darin bestanden hätte, hinter diesem Schalter zu sitzen. Solche oder ähnlich ironische Kommentare gibt es viele. Wir kennen sie alle auch aus der Praxis. Aber wir wissen: Der Spott war schon damals falsch, und er ist es heute erst recht; denn ohne unsere Beamtinnen und Beamten liefe an vielen Stellen in unserer Demokratie sehr wenig. Der öffentliche Dienst ist eine wesentliche Säule unserer Demokratie.",data/txt/18057.txt,speech,
2262896,57,18,0,,,,1502,Beifall bei der SPD sowie bei Abgeordneten der CDU/CSU,data/txt/18057.txt,poi,
2262897,57,18,0,,,,1503,"Er steht jeden Tag Millionen von Menschen zur Verfügung. In Behörden beraten seine Angehörigen Bürgerinnen und Bürger und bearbeiten wahre Fluten von Akten. In Schulen leisten sie echte Zukunftsarbeit an den Kleinsten, und in den Gerichten bringen sie das zur Anwendung, was vorher durch den Gesetzgeber, also durch uns, entschieden wurde. Es sind die Beamtinnen und Beamten, die sich für uns als Polizistinnen und Polizisten in jeder Stadt und Kommune im Einsatz befinden. Liebe Kolleginnen und Kollegen, Sie wissen alle, dass dies oft mit Risiken einhergeht. Viele Fußballspiele und Demonstrationen laufen nicht ohne physische und psychische Blessuren für die Dienerinnen und Diener des Staates ab. Außerhalb unserer Grenzen - die Kollegen haben schon darauf hingewiesen - sind es Soldatinnen und Soldaten, die in gefährlicher, oft lebensgefährlicher Mission für uns ihren Einsatz leisten.

Im Alltag gibt es aber noch viel mehr. Auch hier im Saal werden wir immer wieder von Beamtinnen und Beamten unterstützt. Es geht hinter den Reihen der Bundesregierung los. Dort sitzen die Beamtinnen und Beamte aus den Ministerien, die die Bundesregierung unterstützen. Um das Rednerpult sitzen viele, die uns unterstützen. Es sind die Saaldiener, die zu uns kommen, wenn wir eine kleine Hilfe brauchen. Das sind immer wieder gute Beispiele. Die Beamtinnen und Beamten repräsentieren in vielfacher Weise unseren Staat und leisten überaus viel für unsere Gesellschaft. Das verdient Respekt und Anerkennung.",data/txt/18057.txt,speech,
2262898,57,18,0,,,,1504,Beifall bei der SPD und der CDU/CSU sowie bei Abgeordneten des BÜNDNISSES 90/DIE GRÜNEN,data/txt/18057.txt,poi,
2262899,57,18,0,,,,1505,"Nun mag manch ein Zuhörer sagen: Die öffentliche Hand ist ja auch ein guter und attraktiver Arbeitgeber. - Das stimmt auch. Noch immer profitiert der öffentliche Dienst davon, dass die Menschen mit ihm einen planbaren beruflichen Werdegang und eine sichere berufliche Existenz verbinden, und das auch zu Recht. Allerdings darf das nicht darüber hinwegtäuschen, dass auch hier längst Erscheinungsformen Einzug gehalten haben, die diese Sicherheit begrenzen. Leiharbeit und Befristungen gehören zu den prägnanten Varianten, die inzwischen auch in der Personalpolitik der öffentlichen Verwaltung Anwendung finden. Wir sind uns hoffentlich in diesem Hause einig: Der öffentliche Dienst muss mit guter Arbeit seine Attraktivität bewahren. Das gilt besonders vor dem Hintergrund der demografischen Entwicklung.

Zur Attraktivität zählt auch eine gute Bezahlung. Da ist es nur folgerichtig, dass die Ergebnisse der Tarifverhandlungen auf die Bundesbeamtinnen und Bundesbeamten zeit- und inhaltsgleich übertragen werden. Lassen Sie mich ausdrücklich sagen: Es ist nicht geschenkt, sondern verdient.",data/txt/18057.txt,speech,
2262900,57,18,0,,,,1506,Beifall bei der SPD sowie bei Abgeordneten der CDU/CSU und des Abg. Frank Tempel [DIE LINKE],data/txt/18057.txt,poi,
2262901,57,18,0,,,,1507,"Was Beamtinnen und Beamte leisten, habe ich Ihnen gerade in Auszügen geschildert. Sie haben Anspruch auf Teilhabe am wirtschaftlichen Erfolg unserer Gesellschaft. Der vorliegende Gesetzentwurf zollt diesem Anspruch Rechnung.

Wenn es auch für die betroffenen Beamtinnen und Beamten quasi eine Selbstverständlichkeit ist, dass das Tarifergebnis eins zu eins übertragen wird, so ist es dies aus Sicht von Bundestag und Bundesregierung eben nicht. Darum danke ich sehr dem Herrn Bundesinnenminister, dass er in Zusammenarbeit mit dem Finanzminister diese Gesetzesvorlage ermöglicht hat. Wie gesagt: Es ist verdient und nicht geschenkt. Gleichwohl kostet dieses Gesetz den Bundeshaushalt in den kommenden drei Jahren über 2,5 Milliarden Euro - gut angelegtes Geld, wie ich finde.

Da dieses Gesetz nicht nur die sogenannten aktiven Beamten, sondern auch die Versorgungsempfänger betrifft, möchte ich die Gelegenheit nutzen, auch ein anderes Thema anzusprechen. Es gibt nämlich längst Diskussionen, auch andere Beschlüsse aus dem eingangs erwähnten Rentenpaket auf Beamtinnen und Beamte zu übertragen: die abschlagsfreie Rente nach 45 Beitragsjahren und die Mütterrente.

Herr Staatssekretär, ich kenne die Meinung Ihres Hauses zu dieser Thematik, und ich respektiere diese auch sehr. Gleichwohl wird hier zu Recht der Gerechtigkeitsaspekt zwischen Beschäftigten der Privatwirtschaft und der öffentlichen Hand aufgeworfen. Was wollte man auch moralisch gegen diese Bewertung sagen? Uns ist aber bewusst: Eine Entscheidung ist hier nicht so einfach. Es gibt systemische Unterschiede, eine wirkungsgleiche Übertragung ist kompliziert, und viele Aspekte müssen Berücksichtigung finden.

Ich habe Verständnis für die Argumente des Ministeriums und verstehe das Anliegen, dieses erst einmal intensiv prüfen zu wollen. Dennoch, liebe Kolleginnen und Kollegen, sollten wir uns in diesem Haus auch dieser Frage widmen, sowohl in den Fraktionen als auch in der Zusammenarbeit mit der Regierung. Ich freue mich auf die Diskussion mit Ihnen.

Vielen herzlichen Dank.",data/txt/18057.txt,speech,
2262902,57,18,0,,,,1508,Beifall bei der SPD und der CDU/CSU,data/txt/18057.txt,poi,
2262903,57,18,0,,,,1509,"Vizepräsidentin Petra Pau:

Das Wort hat die Kollegin Irene Mihalic für die Fraktion Bündnis 90/Die Grünen.

Irene Mihalic (BÜNDNIS 90/DIE GRÜNEN):

Frau Präsidentin! Liebe Kolleginnen! Liebe Kollegen! Natürlich ist die Übernahme des Tarifabschlusses zu begrüßen. Das haben wir alle in der ersten Lesung einhellig getan. Es ist völlig richtig, dass die Beamtinnen und Beamten im öffentlichen Dienst eine wertvolle und anspruchsvolle Arbeit für die Allgemeinheit leisten, die selbstverständlich unser aller Wertschätzung verdient.

Aber es stellt sich natürlich die Frage: Reicht das denn eigentlich aus? Ich meine, dass die Wertschätzung anspruchsvoller Arbeit nicht nur eine finanzielle Frage ist. Wenn Sie von der Koalition sich jetzt dafür feiern, dass die Bezüge um 2,8 Prozent bzw. in einem weiteren Schritt um 2,2 Prozent steigen, dann zeigt das eigentlich nur, dass Sie keine Ideen haben, mit den personellen Herausforderungen im öffentlichen Dienst umzugehen.",data/txt/18057.txt,speech,
2262904,57,18,0,Oswin Veith [CDU/CSU],Oswin Veith [CDU/CSU],oswin-veith-cdu-csu,1510,Das ist doch Quatsch!,data/txt/18057.txt,poi,cducsu
2262905,57,18,0,,,,1511,"Herr Schmidt, mit mehr Geld allein ist es eben nicht getan. Sie haben vorhin angesprochen, dass der Staat für viele Menschen vom Prinzip her ein attraktiver Arbeitgeber ist, vor allem ein attraktiver Arbeitgeber für gutes Personal. Aber ich bin mir sicher, dass das in der Form, wie Sie das geschildert haben, nicht mehr zutrifft. Denn wir müssen schlicht anerkennen, dass sich der Staat in einem ziemlichen Konkurrenzkampf mit der Wirtschaft um die besten Köpfe befindet,",data/txt/18057.txt,speech,
2262906,57,18,0,Oswin Veith [CDU/CSU],Oswin Veith [CDU/CSU],oswin-veith-cdu-csu,1512,Das wissen wir!,data/txt/18057.txt,poi,cducsu
