id,sitzung,wahlperiode,in_writing,speaker,speaker_cleaned,speaker_fp,sequence,text,filename,type,speaker_party
2265075,60,18,0,,,,503,"und es auch darum ging, dass vor 15 Jahren - ich glaube, das ist ein sehr gutes und richtiges Argument - unsere Industrie schlechtgeredet wurde, dass man sagte, das habe keine Zukunft mehr, und dass es allen Unkenrufen zum Trotz richtig war, an der Industrie festzuhalten. Aber man darf der Industrie jetzt nicht signalisieren: Auch in den nächsten 15 Jahren wird es einfach so weitergehen, ihr braucht euch nicht zu wandeln. - Das hielte ich für gefährlich. Deshalb wünsche ich mir, dass wir der Industrie ganz klar sagen: Ihr müsst loslaufen.

Wir müssen, wenn es Kritik an Google gibt - die ja in einer ganzen Reihe von Fällen auch berechtigt ist; das Thema Kartellrecht zum Beispiel verfolgt die Europäische Union genau -, höllisch aufpassen, dass aus Kritik an Google keine Kritik, keine Verweigerung des digitalen Wandels wird. Damit würden wir nur einem schaden: uns selbst.

Herr Bundeswirtschaftsminister, Sie haben zu Recht über die Factory gesprochen - das ist eine tolle Einrichtung hier in Berlin, ein Leuchtturm der Gründungsintensität -, Sie haben zu Recht darüber gesprochen, dass jetzt auch die Wirtschaft dran ist: dass die DAX-Unternehmen in Start-ups investieren müssen. Aber wir dürfen nicht nur darüber reden, wir brauchen jetzt auch eine konkrete Agenda dafür, wie das passieren soll. Wir müssen auch darüber nachdenken: Wie groß sollte der Anteil des Staates sein - wie auch der Unternehmen -, zu dem bei Start-ups eingekauft wird? In Frankreich diskutiert man über eine Quote: dass der Staat mindestens 2 Prozent seiner Einkaufsleistungen bei Start-ups bezieht. Das ist vielleicht sehr statisch; aber ich glaube, es ist sehr wichtig, dass wir hier konkret werden.

Und ich würde mir wünschen, dass wir die Gründer auch stärker ins Schaufenster stellen. Herr Gabriel, Sie haben Eric Schmidt eingeladen in Ihre Veranstaltung Wirtschaft für morgen. Ich finde, es ist eine exzellente Idee, eine Veranstaltungsreihe Wirtschaft für morgen durchzuführen. Aber wenn Sie über digitale Wirtschaft sprechen, warum laden Sie als Ersten Eric Schmidt ein? Warum laden Sie nicht Malte Siewert, Kolja Hebenstreit oder Ijad Madisch ein?",data/txt/18060.txt,speech,
2265076,60,18,0,,,,504,Beifall bei Abgeordneten der CDU/CSU,data/txt/18060.txt,poi,
2265077,60,18,0,,,,505,"Um einmal drei Gründer zu nennen, die von Deutschland aus globale Unternehmen aufgebaut haben, von Düsseldorf und Berlin aus.

Ich glaube, in diesem Zusammenhang - Sie haben eine Initiative genannt: die Factory - ist auch wichtig, was Simon Schäfer, ein guter Netzwerker in dem Bereich, sagt: Wir brauchen in der Europäischen Union nicht nur eine Definition, was kleine und mittelständische Unternehmen sind, wir brauchen auch eine Definition, was Start-ups sind. Wir müssen denjenigen, die hier innovative Firmen aufbauen, Erleichterungen geben, insbesondere was die Bürokratie betrifft.

Ein ganz wichtiges Thema ist auch: Wie ist eigentlich unsere Kultur im Umgang mit den Veränderungen, die da kommen? Da komme ich auf das Thema Datenschutz zu sprechen. Ich glaube, dass Datenschutz eine zentrale Herausforderung ist für die Gründung neuer Unternehmen, aber auch für die Wettbewerbsfähigkeit unserer bestehenden.

Ich nenne Ihnen mal ein ganz konkretes Beispiel: Mit Google war bei der Wirtschaft für morgen zuletzt ein Unternehmen zu Gast, das an vielen Technologien für das selbstfahrende Auto arbeitet. Sie wissen, welche Bedeutung die Automobilwirtschaft für Deutschland hat. Sie wissen auch, dass in zehn Jahren das selbstfahrende Auto das zentrale Wettbewerbsmittel sein wird. Jetzt nehmen die meisten Szenarien an, dass dieses selbstfahrende Auto in zehn Jahren noch nicht wird fahren können, sondern dass der Fahrer an bestimmten Stellen wird übernehmen müssen. Dann muss das Auto aber wissen: Was macht denn der Fahrer? Ist der Fahrer aktiv und wachsam,",data/txt/18060.txt,speech,
2265078,60,18,0,Britta Haßelmann [BÜNDNIS 90/DIE GRÜNEN],Britta Haßelmann [BÜNDNIS 90/DIE GRÜNEN],britta-haßelmann-bundnis-90-die-grunen,506,Was macht denn eigentlich die CDU/CSU? Das interessiert uns mehr als das selbstfahrende Auto!,data/txt/18060.txt,poi,gruene
2265079,60,18,0,,,,507,"oder schaut er aus dem Fenster, liest ein Buch oder schläft sogar? Das lässt sich bei den bisherigen Fahrzeugen einfach herausfinden, weil der Fahrer ja lenkt und schaltet und bremst - beim selbstfahrenden Auto tut er nichts mehr davon; also brauchen Sie eine Kamera im Auto, mit der das Auto feststellt: Ist der Fahrer eigentlich wach oder schläft er?

Mit der Diskussion, die wir über Datenschutz führen, schüren wir ein Klima der Angst. Wenn eine oberste Bundesbehörde als Werbemittel kleine Aufkleber verteilt, die man auf seine Handykamera kleben soll, sind wir, glaube ich, momentan nicht die Treiber des richtigen kulturellen Wandels, sondern haben hier eher ein Problem.",data/txt/18060.txt,speech,
2265080,60,18,0,,,,508,Zuruf der CDU/CSU,data/txt/18060.txt,poi,
2265081,60,18,0,,,,509,Zuruf des Abg. Dr. Konstantin von Notz [BÜNDNIS 90/DIE GRÜNEN],data/txt/18060.txt,poi,
2265082,60,18,0,,,,510,"Deshalb ist es mir persönlich, ist es uns als Union sehr wichtig, dass wir mit der europäischen Datenschutz-Grundverordnung einen Rahmen schaffen, der nicht nur die berechtigten Datenschutzinteressen der Bürger berücksichtigt, sondern auch die Innovationsfähigkeit unserer Wirtschaft nicht einengt; das ist wichtig.",data/txt/18060.txt,speech,
2265083,60,18,0,,,,511,Beifall bei der CDU/CSU,data/txt/18060.txt,poi,
2265084,60,18,0,,,,512,"Der Kollege von Notz hat sich sehr darüber beschwert, dass die Digitalpolitik in diesem Hause nicht das nötige Gewicht hätte.",data/txt/18060.txt,speech,
2265085,60,18,0,Dr. Konstantin von Notz [BÜNDNIS 90/DIE GRÜNEN],Dr. Konstantin von Notz [BÜNDNIS 90/DIE GRÜNEN],konstantin-notz-bundnis-90-die-grunen,513,Zu Recht!,data/txt/18060.txt,poi,gruene
2265086,60,18,0,,,,514,"- Lieber Konstantin, ich stimme dir bei einigen Thesen zu - bei dieser liegst du falsch. Schauen wir einmal zurück, wie wir vor fünf Jahren dagestanden haben: Damals hat sich gerade einmal ein Unterausschuss des Kulturausschusses mit Digitalpolitik befasst. Wir hatten die Enquete-Kommission Internet und digitale Gesellschaft. Wir haben es geschafft, einen vollwertigen Ausschuss dazu einzurichten. Die Bundeskanzlerin hat den Schwerpunkt ihrer Haushaltsrede auf das Thema Digitalpolitik gelegt. Und: Wir bewerben uns mit Günther Oettinger für den Posten des Digitalkommissars in der Europäischen Union.",data/txt/18060.txt,speech,
2265087,60,18,0,,,,515,Beifall bei der CDU/CSU,data/txt/18060.txt,poi,
2265088,60,18,0,,,,516,Lachen bei der LINKEN und dem BÜNDNIS 90/DIE GRÜNEN,data/txt/18060.txt,poi,
2265089,60,18,0,Britta Haßelmann [BÜNDNIS 90/DIE GRÜNEN],Britta Haßelmann [BÜNDNIS 90/DIE GRÜNEN],britta-haßelmann-bundnis-90-die-grunen,517,Das ist ganz schlecht!,data/txt/18060.txt,poi,gruene
2265090,60,18,0,,,,518,"- Frau Kollegin, wenn Sie das nicht begriffen haben, müssen Sie nachsitzen.",data/txt/18060.txt,speech,
2265091,60,18,0,,,,519,Beifall bei der CDU/CSU sowie bei Abgeordneten der SPD,data/txt/18060.txt,poi,
2265092,60,18,0,,,,520,Die Bundeskanzlerin hat uns klar gesagt: Gerade für die Wettbewerbsfähigkeit der deutschen Wirtschaft ist dieses Ressort für digitale Wirtschaft in der Europäischen Kommission das entscheidende.,data/txt/18060.txt,speech,
2265093,60,18,0,Britta Haßelmann [BÜNDNIS 90/DIE GRÜNEN],Britta Haßelmann [BÜNDNIS 90/DIE GRÜNEN],britta-haßelmann-bundnis-90-die-grunen,521,Aber nicht Günther Oettinger!,data/txt/18060.txt,poi,gruene
2265094,60,18,0,,,,522,"Wenn Sie glauben, dass es besser wäre, die Digitalpolitik in Europa von irgendwelchen Briten, Spaniern oder sonst wem machen zu lassen, dann haben Sie bei diesem Thema noch einiges aufzuholen.",data/txt/18060.txt,speech,
2265095,60,18,0,Renate Künast [BÜNDNIS 90/DIE GRÜNEN],Renate Künast [BÜNDNIS 90/DIE GRÜNEN],renate-kunast-bundnis-90-die-grunen,523,Was heißt denn irgendwelchen?,data/txt/18060.txt,poi,gruene
2265096,60,18,0,,,,524,"Ich finde es gut, dass es die Digitale Agenda gibt. Ich glaube, das ist der Schritt in die richtige Richtung. Wir werden noch sehr viel zu arbeiten haben. Wir werden noch sehr viele Innovationen sehen, und wir werden diese gemeinsam gestalten.

Vielen Dank.",data/txt/18060.txt,speech,
2265097,60,18,0,,,,525,Beifall bei der CDU/CSU und der SPD,data/txt/18060.txt,poi,
2265098,60,18,0,,,,526,"Vizepräsident Johannes Singhammer:

Nächster Redner ist für die Fraktion Die Linke der Kollege Herbert Behrens.",data/txt/18060.txt,speech,
2265099,60,18,0,,,,527,Beifall bei der LINKEN,data/txt/18060.txt,poi,
2265100,60,18,0,,,,528,"Herbert Behrens (DIE LINKE):

Herr Präsident! Liebe Kolleginnen und Kollegen! Blühende Landschaften in der digitalen Welt von morgen, schneller Internetzugang, Telemedizin, Automatisierung der Produktion und kreative Start-ups,",data/txt/18060.txt,speech,
2265101,60,18,0,Jens Koeppen [CDU/CSU],Jens Koeppen [CDU/CSU],jens-koeppen-cdu-csu,529,Wird es geben!,data/txt/18060.txt,poi,cducsu
2265102,60,18,0,,,,530,"Deutschland in der Führungsrolle: Mit diesen Versprechen, mit viel Pathos vorgetragen, versucht die Bundesregierung, uns ihre Digitale Agenda zu verkaufen. Eine wirkliche Agenda sieht anders aus; das hat meine Kollegin Wawzyniak bereits dargestellt.",data/txt/18060.txt,speech,
2265103,60,18,0,,,,531,Beifall bei der LINKEN,data/txt/18060.txt,poi,
2265104,60,18,0,,,,532,"Die Digitalisierung wird das Leben der Menschen stark verändern; das ist inzwischen ein Allgemeinplatz. Genau aus diesem Grunde gibt es heute schon viele Menschen, die sich an der Gestaltung der digitalen Gesellschaft aktiv beteiligen und sich damit beschäftigen. Diese waren aber bei der Formulierung der Digitalen Agenda überhaupt nicht gefragt. Stattdessen haben drei Ministerien über Monate zusammengesessen, um auf 40 Seiten zusammenzuschreiben, was in einer Großen Koalition möglich ist. Eine bürokratische Kopfgeburt, wie es in einem Kommentar hieß; dem stimme ich zu.",data/txt/18060.txt,speech,
2265105,60,18,0,,,,533,Beifall bei der LINKEN,data/txt/18060.txt,poi,
2265106,60,18,0,,,,534,"Im internationalen Vergleich befindet sich Deutschland bei der Versorgung mit schnellem Internetzugang im Hintertreffen. Aktuell haben weniger als 4 Prozent einen schnellen Glasfaseranschluss. Dieser ist aber nötig, um in der Zukunft nicht bei geringen Bandbreiten hängenzubleiben. 50 Megabit sollen es bis 2018 flächendeckend sein. Das sind aber Downloadgeschwindigkeiten. Das heißt, Videos online ansehen und jede andere Art von privatem Konsum können wir damit gut machen. Aber Sie sprechen in Ihrer Digitalen Agenda selbst von einer netzbasierten, maßgeschneiderten Produktion, von einer Industrie 4.0. Dafür brauchen wir aber mehr Bandbreite, viel mehr Brandbreite.",data/txt/18060.txt,speech,
2265107,60,18,0,,,,535,Beifall bei der LINKEN,data/txt/18060.txt,poi,
2265108,60,18,0,,,,536,"Diese Bandbreite werden Sie mit Ihrem Energiemix aus optimierten Kupferkabeln und neuen Funkfrequenzen für mobiles Internet stabil nicht erreichen. Eine Netz-infrastruktur von morgen braucht ein Glasfasernetz.

Finnland macht es vor: Bis 2015 sollen alle Finnen einen Zugang zu einem Anschluss mit 100 Megabit haben. Weitere Breitbandvorbilder sind die anderen skandinavischen Länder, die EU-Länder Osteuropas, aber auch Südkorea. Diese Länder nehmen aber auch das notwendige Geld in die Hand, oder sie gehen innovative Wege, indem Kommunen und Genossenschaften eigene Glasfasernetze betreiben. Die Bundesregierung dagegen setzt auf das alte neoliberale Konzept, den Privatinvestoren und Telekommunikationsunternehmen den Breitbandausbau schmackhaft zu machen. Ich sage noch einmal: Die Breitbandversorgung ist eine öffentliche Infrastrukturaufgabe.",data/txt/18060.txt,speech,
2265109,60,18,0,,,,537,Beifall bei der LINKEN sowie bei Abgeordneten des BÜNDNISSES 90/DIE GRÜNEN,data/txt/18060.txt,poi,
2265110,60,18,0,,,,538,"Wer auf marktgetriebenen Ausbau setzt - so steht es in Ihrem Papier -, wer Rahmenbedingungen durch optimale Anreize für den Ausbau durch den Markt schaffen will, der hat sich bereits heute von seinem Ziel verabschiedet, einen schnellen Internetzugang für alle zu ermöglichen.

Was sind denn das für optimale Anreize? Sollen die Telekommunikationsunternehmen also doch Spezialdienste mit höherer Qualität zu höheren Preisen anbieten dürfen? Das ist das Aus für Netzneutralität. Dazu können sich auch einmal die Minister äußern.",data/txt/18060.txt,speech,
2265111,60,18,0,,,,539,Beifall bei der LINKEN sowie der Abg. Tabea Rößner [BÜNDNIS 90/DIE GRÜNEN],data/txt/18060.txt,poi,
2265112,60,18,0,,,,540,"Keine Ihrer Finanzierungsideen ist seriös. Eine Premiumförderung Netzausbau bieten Sie an; Größenordnung: Fragezeichen. Das digitale Antennenfernsehen soll zwei Jahre früher umgestellt werden und die frei werdenden Frequenzen für mobiles Internet genutzt werden; Ertrag: ungewiss.

Der Zeitplan ist heute schon Makulatur. Sicher sind allerdings die Kosten für die Bürger, die vorzeitig ihre alten Receiver durch neue ersetzen müssen. Sicher sind auch erhebliche Kosten für Kultureinrichtungen und beispielsweise auch für Hochschulen sowie für Leute, die für ihre Arbeit Drahtlosmikrofone brauchen.",data/txt/18060.txt,speech,
2265113,60,18,0,Martin Dörmann [SPD],Martin Dörmann [SPD],martin-dormann-spd,541,Das werden wir alles lösen!,data/txt/18060.txt,poi,spd
2265114,60,18,0,,,,542,"Nachdem ihnen bereits 2010 die 800er-Frequenzen abhandengekommen sind, steht nun der Verlust der 700er-Frequenzen bevor.

Sehr geehrte Damen und Herren von der Koalition, wenn die digitale Infrastruktur nichts taugt, dann können wir uns alle Zukunftspläne abschminken - Sie auch. Die Linke fordert deshalb öffentliche Investitionen statt Privatisierung. Das ist solide und innovativ, das ist Politik für eine digitale Gesellschaft.

Vielen Dank.",data/txt/18060.txt,speech,
2265115,60,18,0,,,,543,Beifall bei der LINKEN,data/txt/18060.txt,poi,
2265116,60,18,0,,,,544,"Vizepräsident Johannes Singhammer:

Für die Sozialdemokraten spricht jetzt der Kollege Lars Klingbeil.",data/txt/18060.txt,speech,
2265117,60,18,0,,,,545,Beifall bei der SPD und der CDU/CSU,data/txt/18060.txt,poi,
2265118,60,18,0,,,,546,"Lars Klingbeil (SPD):

Herr Präsident! Liebe Kolleginnen und Kollegen! Sehr geehrte Damen und Herren! Die Große Koalition hat in ihrem Koalitionsvertrag schon in der Präambel auf das Thema der Digitalisierung und die riesige Herausforderung hingewiesen. Dort sind die drei großen Herausforderungen der Zukunft beschrieben: der demografische Wandel, die Frage der Energiewende und die Digitalisierung unserer Gesellschaft. Schon früh wurde hier also festgelegt, dass es eine der großen Aufgaben ist, um die sich diese Koalition kümmern will.

Wir alle wissen, dass die Digitalisierung einen enormen Wandel für unsere Gesellschaft bedeutet und alle gesellschaftlichen Bereiche durchdringt. Wir reden über andere Bildungspolitik, über andere Verkehrspolitik, über Wirtschaftspolitik, über Arbeitsmarktpolitik. Alle diese Bereiche verändern sich durch die Digitalisierung.

Es geht dabei nicht um die Frage, ob die Digitalisierung schlecht oder gut ist, sondern es geht um die Frage, wie wir sie politisch gestalten. Das ist die große Aufgabe. Ich bin der Bundesregierung dankbar, dass sie mit der Digitalen Agenda einen Entwurf vorgelegt hat, was in den nächsten drei Jahren passieren wird, welche Aufgaben wir gemeinsam angehen wollen. Als Parlament werden wir natürlich an vielen Stellen schauen, wie wir bei der Umsetzung dieser Digitalen Agenda behilflich sein können, wie wir vielleicht den einen oder anderen Aspekt noch in die Diskussion einbringen. Aber es ist ein guter Start, den wir in diesem Themenfeld machen.",data/txt/18060.txt,speech,
2265119,60,18,0,,,,547,Beifall bei der SPD sowie bei Abgeordneten der CDU/CSU,data/txt/18060.txt,poi,
2265120,60,18,0,,,,548,"Ich will einmal auf das eingehen, was ich hier von der Opposition erlebe: Das ist Meckern am laufenden Band.",data/txt/18060.txt,speech,
2265121,60,18,0,,,,549,Beifall bei der SPD und der CDU/CSU,data/txt/18060.txt,poi,
2265122,60,18,0,Sören Bartol [SPD],Sören Bartol [SPD],soren-bartol-spd,550,Jeden Tag! Immer nur meckern!,data/txt/18060.txt,poi,spd
2265123,60,18,0,Dr. Konstantin von Notz [BÜNDNIS 90/DIE GRÜNEN],Dr. Konstantin von Notz [BÜNDNIS 90/DIE GRÜNEN],konstantin-notz-bundnis-90-die-grunen,551,"Die konstruktivste Opposition seit Jahrzehnten, Lars, seit Jahrzehnten!",data/txt/18060.txt,poi,gruene
2265124,60,18,0,,,,552,"Ich wünsche mir ja eine Opposition, die stark ist und den Finger immer wieder in die richtige Wunde legt, aber ich will einmal historisch aufarbeiten,",data/txt/18060.txt,speech,
2265125,60,18,0,Dr. Konstantin von Notz [BÜNDNIS 90/DIE GRÜNEN],Dr. Konstantin von Notz [BÜNDNIS 90/DIE GRÜNEN],konstantin-notz-bundnis-90-die-grunen,553,Bitte!,data/txt/18060.txt,poi,gruene
2265126,60,18,0,,,,554,was in den letzten Wochen im Bereich der Digitalisierungspolitik passiert ist.,data/txt/18060.txt,speech,
2265127,60,18,0,Zuruf von der LINKEN,von der LINKEN,von-der-linken,555,Da bin ich ja gespannt!,data/txt/18060.txt,poi,linke
2265128,60,18,0,,,,556,"Da wurde uns nicht zugetraut, dass wir mit der Großen Koalition im Koalitionsvertrag das Thema verankern. Da wurde gemeckert. Dann wurde gesehen: Da ist aber vieles in diesen Koalitionsvertrag hineingekommen.",data/txt/18060.txt,speech,
2265129,60,18,0,Dr. Konstantin von Notz [BÜNDNIS 90/DIE GRÜNEN],Dr. Konstantin von Notz [BÜNDNIS 90/DIE GRÜNEN],konstantin-notz-bundnis-90-die-grunen,557,Papier ist geduldig!,data/txt/18060.txt,poi,gruene
2265130,60,18,0,,,,558,"Dann hieß es, wir bekämen in diesem Bundestag keinen Ausschuss hin. Dann haben wir gesehen: Der Ausschuss kommt. Dann wurde gemeckert, dass dieser Ausschuss keine Federführung bekommen wird. Dann hat der Ausschuss die Federführung bekommen.",data/txt/18060.txt,speech,
2265131,60,18,0,Dieter Janecek [BÜNDNIS 90/DIE GRÜNEN],Dieter Janecek [BÜNDNIS 90/DIE GRÜNEN],dieter-janecek-bundnis-90-die-grunen,559,Jetzt wieder nicht!,data/txt/18060.txt,poi,gruene
2265132,60,18,0,,,,560,"Dann wurde gemeckert, dass die Digitale Agenda der Bundesregierung nicht kommt. Auch die liegt heute vor und wird diskutiert. Ich würde gern einmal über Inhalte diskutieren. Das, was ich erlebe, ist aber Meckern am laufenden Band. Das reicht nicht, liebe Kollegen von der Opposition.",data/txt/18060.txt,speech,
2265133,60,18,0,,,,561,Beifall bei der SPD und der CDU/CSU,data/txt/18060.txt,poi,
2265134,60,18,0,,,,562,"Vizepräsident Johannes Singhammer:

Herr Kollege Klingbeil, gestatten Sie eine Zwischenfrage der Kollegin Rößner?

Lars Klingbeil (SPD):

Sehr gern.

Tabea Rößner (BÜNDNIS 90/DIE GRÜNEN):

Vielen Dank. - Kollege Klingbeil, Sie haben ihn angesprochen, der Kollege Jarzombek eben auch, den -Ausschuss Digitale Agenda, der eingerichtet wurde. Ich verstehe nicht ganz - vielleicht können Sie mir das erklären -, dass der Ausschuss Digitale Agenda nicht federführend für unseren Antrag zur Digitalen Agenda zuständig ist, sondern jetzt der Wirtschaftsausschuss federführend sein soll. Das verstehe ich nicht. Vielleicht können Sie mir das erklären, wenn Sie immer diesen Ausschuss als so besonders herausstellen.",data/txt/18060.txt,speech,
2265135,60,18,0,,,,563,Beifall beim BÜNDNIS 90/DIE GRÜNEN und bei der LINKEN,data/txt/18060.txt,poi,
2265136,60,18,0,Dr. Petra Sitte [DIE LINKE],Dr. Petra Sitte [DIE LINKE],petra-sitte-die-linke,564,Immer diese Meckerei!,data/txt/18060.txt,poi,linke
2265137,60,18,0,,,,565,"Lars Klingbeil (SPD):

Das Entscheidende, liebe Kollegin, ist, dass der Ausschuss Digitale Agenda federführend für die Digitale Agenda zuständig sein wird,",data/txt/18060.txt,speech,
2265138,60,18,0,Dr. Konstantin von Notz [BÜNDNIS 90/DIE GRÜNEN],Dr. Konstantin von Notz [BÜNDNIS 90/DIE GRÜNEN],konstantin-notz-bundnis-90-die-grunen,566,Worüber sprechen wir denn heute?,data/txt/18060.txt,poi,gruene
2265139,60,18,0,,,,567,"dass wir uns in dem Ausschuss mit der Digitalen Agenda, mit dem Maßnahmenpaket der Bundesregierung, auseinandersetzen werden, dass wir all diese Themen jetzt im Ausschuss behandeln und dass wir sowohl das Controlling als auch die Frage der Zeitplanung in diesem Ausschuss behandeln können.",data/txt/18060.txt,speech,
2265140,60,18,0,Dr. Konstantin von Notz [BÜNDNIS 90/DIE GRÜNEN],Dr. Konstantin von Notz [BÜNDNIS 90/DIE GRÜNEN],konstantin-notz-bundnis-90-die-grunen,568,Schön wärs!,data/txt/18060.txt,poi,gruene
2265141,60,18,0,,,,569,Das ist das Entscheidende in der Diskussion heute. Das ist auch fest so verankert.,data/txt/18060.txt,speech,
2265142,60,18,0,,,,570,Beifall bei der SPD und der CDU/CSU,data/txt/18060.txt,poi,
2265143,60,18,0,,,,571,"Lieber Konstantin von Notz, was ich zum Meckern noch sagen will: Wenn dann hier der Bundeswirtschaftsminister dafür kritisiert wird, dass er sich mit Google anlegt",data/txt/18060.txt,speech,
2265144,60,18,0,Dr. Konstantin von Notz [BÜNDNIS 90/DIE GRÜNEN],Dr. Konstantin von Notz [BÜNDNIS 90/DIE GRÜNEN],konstantin-notz-bundnis-90-die-grunen,572,Das war etwas differenzierter!,data/txt/18060.txt,poi,gruene
2265145,60,18,0,,,,573,"und die Frage von neuen Monopol- und Machtstrukturen im Internet thematisiert,",data/txt/18060.txt,speech,
2265146,60,18,0,Dr. Konstantin von Notz [BÜNDNIS 90/DIE GRÜNEN],Dr. Konstantin von Notz [BÜNDNIS 90/DIE GRÜNEN],konstantin-notz-bundnis-90-die-grunen,574,"Der wollte Google zerschlagen, Lars!",data/txt/18060.txt,poi,gruene
2265147,60,18,0,,,,575,"und diese Kritik von den Grünen kommt, dann wundert mich das an dieser Stelle schon sehr. Ich hätte dabei Unterstützung erwartet. Von uns hat er sie jedenfalls.",data/txt/18060.txt,speech,
2265148,60,18,0,,,,576,Beifall bei der SPD sowie bei Abgeordneten der CDU/CSU,data/txt/18060.txt,poi,
2265149,60,18,0,,,,577,"Liebe Kolleginnen und Kollegen, ich möchte vier Punkte nennen, die für uns Sozialdemokraten in der Diskussion und in der Digitalen Agenda sehr wichtig sind. Der erste Punkt ist heute schon oft angesprochen worden, nämlich der Breitbandausbau. Das ist die Grundlage für alle Maßnahmen, die wir diskutieren und die in der Digitalen Agenda vorgesehen sind. Wir müssen verhindern, dass es in Deutschland zu einer digitalen Spaltung kommt. Minister Dobrindt hat vorhin eindrucksvoll beschrieben, welche Maßnahmen er vorhat. Ich betone ausdrücklich: Der Weg der Netzallianz ist der richtige.

Diese Große Koalition wird sich am Erfolg des Breitbandausbaus messen lassen müssen. Ich komme aus der Lüneburger Heide. Dort gibt es noch genügend Flecken, die nicht mit ausreichend schnellem Internet versorgt sind.",data/txt/18060.txt,speech,
2265150,60,18,0,Dr. Konstantin von Notz [BÜNDNIS 90/DIE GRÜNEN],Dr. Konstantin von Notz [BÜNDNIS 90/DIE GRÜNEN],konstantin-notz-bundnis-90-die-grunen,578,Dobrindt ist schuld!,data/txt/18060.txt,poi,gruene
2265151,60,18,0,,,,579,"Wir müssen für eine Gleichwertigkeit der Lebensverhältnisse sorgen. Das ist unsere Aufgabe. Ich würde mich freuen, wenn dies das ganze Haus gemeinsam anpackt.",data/txt/18060.txt,speech,
2265152,60,18,0,,,,580,Beifall bei der SPD sowie bei Abgeordneten der CDU/CSU,data/txt/18060.txt,poi,
2265153,60,18,0,Dr. Konstantin von Notz [BÜNDNIS 90/DIE GRÜNEN],Dr. Konstantin von Notz [BÜNDNIS 90/DIE GRÜNEN],konstantin-notz-bundnis-90-die-grunen,581,"Ja, bitte!",data/txt/18060.txt,poi,gruene
2265154,60,18,0,,,,582,"Vizepräsident Johannes Singhammer:

Herr Kollege Klingbeil, gestatten Sie eine weitere Zwischenfrage der Kollegin Wawzyniak?

Lars Klingbeil (SPD):

Sehr gerne.

Halina Wawzyniak (DIE LINKE):

Herr Kollege Klingbeil, Sie haben gerade gesagt, der Weg der Netzallianz zum Breitbandausbau ist der richtige. Entnehme ich daraus, dass Sie den Vorschlag der Netzallianz, aus Qualitätsklassen Qualitätsmerkmale zu machen und das dann zum Breitbandausbau zu nutzen, teilen? Und wie verträgt sich das mit der mir bisher bekannten Position der Sozialdemokratie, die Netzneutralität gesetzlich festzuschreiben?",data/txt/18060.txt,speech,
2265155,60,18,0,,,,583,Beifall bei der LINKEN und beim BÜNDNISSES 90/DIE GRÜNEN,data/txt/18060.txt,poi,
2265156,60,18,0,,,,584,"Lars Klingbeil (SPD):

Liebe Kollegin Wawzyniak, Sie kennen meine persönliche Position.",data/txt/18060.txt,speech,
2265157,60,18,0,Dr. Konstantin von Notz [BÜNDNIS 90/DIE GRÜNEN],Dr. Konstantin von Notz [BÜNDNIS 90/DIE GRÜNEN],konstantin-notz-bundnis-90-die-grunen,585,Das ist nicht die des Wirtschaftsministeriums!,data/txt/18060.txt,poi,gruene
2265158,60,18,0,,,,586,"Sie kennen auch die Position, die im Koalitionsvertrag steht. Der Kollege Bartol hat darauf hingewiesen: Wir werden die Netzneutralität gesetzlich verankern. Ich habe selbst neulich auf einer Podiumsdiskussion mit ihm zusammen gesagt, dass mir die Position des Europäischen Parlamentes sehr angenehm ist und dass wir versuchen wollen, in diese Richtung zu gehen. Aber das stellt nicht infrage, dass der Weg, den Minister Dobrindt mit der Netzallianz geht, nämlich alle Akteure an einen Tisch zu holen und die Frage der privaten und der öffentlichen Finanzierung und die Frage der Regulierung zu klären, der richtige Weg ist.",data/txt/18060.txt,speech,
