id,sitzung,wahlperiode,in_writing,speaker,speaker_cleaned,speaker_fp,sequence,text,filename,type,speaker_party
2266107,60,18,0,,,,1535,"Und doch ist die Realität des Jahres 2014 noch schlimmer: Der Umzug eines Steuerpflichtigen von einem Bundesland in ein anderes stellt die Finanzämter hier und heute noch immer vor Herausforderungen unvorstellbaren Ausmaßes. Die elektronischen Daten werden nämlich nicht einfach überspielt, sondern es gehen auch im 21. Jahrhundert zumeist ausschließlich Papierakten auf die Reise.",data/txt/18060.txt,speech,
2266108,60,18,0,Margaret Horb [CDU/CSU],Margaret Horb [CDU/CSU],margaret-horb-cdu-csu,1536,Das stimmt nicht!,data/txt/18060.txt,poi,cducsu
2266109,60,18,0,,,,1537,"Das neu zuständige Finanzamt muss dann mühsam alle noch relevanten Steuerbescheide der Altjahre per Hand in den PC bringen. Sind noch Einsprüche offen oder Rückstände einzufordern, müssen zusätzlich noch die Buchungskonten des Steuerpflichtigen mit den Altdaten gefüttert werden. Wir brauchen endlich eine bundesweit einheitliche Software, um solchen Koordinationsproblemen ein Ende zu machen, meine Damen und Herren.",data/txt/18060.txt,speech,
2266110,60,18,0,,,,1538,Beifall beim BÜNDNIS 90/DIE GRÜNEN sowie der Abg. Ingrid Arndt-Brauer [SPD],data/txt/18060.txt,poi,
2266111,60,18,0,,,,1539,Abg. Dr. Jens Zimmermann [SPD] meldet sich zu einer Zwischenfrage,data/txt/18060.txt,poi,
2266112,60,18,0,,,,1540,"Wie sieht es aus bei den Betriebsprüfungen? Deutschland 2014 heißt, dass große internationale Konzerne in zentralen Steuerabteilungen Bataillone von Steuerberatern und Anwälten beschäftigen. Ihnen gegenüber sitzen im Zweifel vielleicht zwei Betriebsprüfer, die selbstverständlich auch dann, wenn das Unternehmen mehrere Betriebsstätten hat, unabhängig von den Finanzbeamten im anderen Bundesland und jeweils in Eigenregie, die Bilanzierungs- und Steuerehrlichkeit prüfen und auswerten. Kein Wunder, dass Unternehmen in Deutschland im Durchschnitt nur alle 44 Jahre geprüft werden - die -Finanzämter in Deutschland sind einfach hoffnungslos unterlegen.",data/txt/18060.txt,speech,
2266113,60,18,0,,,,1541,Beifall bei Abgeordneten des BÜNDNISSES 90/DIE GRÜNEN,data/txt/18060.txt,poi,
2266114,60,18,0,,,,1542,"Weitere Aufgaben kommen: Die OECD erarbeitet im Moment Vorschläge, wie sich die Steuervermeidungsstrategien der Konzerne stoppen lassen. Wir fordern deshalb eine neu zu schaffende Spezialeinheit, die personell und technisch auf Augenhöhe mit den Steuerabteilungen der Konzerne zu bringen ist und dann für sämtliche -Steuerangelegenheiten dieser Großkonzerne und von Einkommensmillionären zuständig sein soll.",data/txt/18060.txt,speech,
2266115,60,18,0,,,,1543,Beifall beim BÜNDNIS 90/DIE GRÜNEN,data/txt/18060.txt,poi,
2266116,60,18,0,,,,1544,"Vizepräsident Peter Hintze:

Frau Kollegin, da gibt es den Herzenswunsch des Kollegen Zimmermann nach einer Zwischenfrage. Möchten Sie die gestatten? - Ich halte auch die Uhr an.

Lisa Paus (BÜNDNIS 90/DIE GRÜNEN):

Bitte schön.

Dr. Jens Zimmermann (SPD):

Vielen Dank, Frau Kollegin, dass Sie die Zwischenfrage zulassen. Sie haben Hessen angesprochen. Das hat mich jetzt dazu veranlasst, auch länger die Hand zu heben.

Ich weiß, das ist nicht unter Regierungsbeteiligung Ihrer Partei in Hessen passiert; aber die Steuerverwaltung und vor allem die Steuerfahndung in Hessen haben ja leider eine wenig rühmliche Vergangenheit. Ich möchte Sie fragen, ob Ihnen bekannt ist, was man in Hessen bereit ist zu tun, um die Steuerfahnder, die damals - man muss es ja so sagen - für verrückt erklärt wurden, zu rehabilitieren.",data/txt/18060.txt,speech,
2266117,60,18,0,Ingrid Arndt-Brauer [SPD],Ingrid Arndt-Brauer [SPD],ingrid-arndt-brauer-spd,1545,Das ist jetzt eine interessante Frage!,data/txt/18060.txt,poi,spd
2266118,60,18,0,Markus Kurth [BÜNDNIS 90/DIE GRÜNEN],Markus Kurth [BÜNDNIS 90/DIE GRÜNEN],markus-kurth-bundnis-90-die-grunen,1546,Nebenkriegsschauplatz! Das hat mit dem Thema nichts zu tun!,data/txt/18060.txt,poi,gruene
2266119,60,18,0,,,,1547,"- Das ist überhaupt kein Nebenkriegsschauplatz.

Lisa Paus (BÜNDNIS 90/DIE GRÜNEN):

Sie haben völlig recht: Dieser Fall ist unsäglich. Zum Glück haben die betroffenen Steuerbeamten inzwischen vor Gericht Recht bekommen. Ich teile Ihre Auffassung, dass sie sich großen Respekt verdient haben.",data/txt/18060.txt,speech,
2266120,60,18,0,,,,1548,Beifall beim BÜNDNIS 90/DIE GRÜNEN und bei der SPD sowie bei Abgeordneten der CDU/CSU und der LINKEN,data/txt/18060.txt,poi,
2266121,60,18,0,,,,1549,"Ich war gerade dabei, auszuführen, dass wir eine Spezialeinheit brauchen, die den Steuerabteilungen großer Konzerne und den Steuerberatern von Einkommensmillionären tatsächlich auf Augenhöhe begegnen kann. Nur so können wir sicherstellen, dass auch leistungsfähige Gruppen angemessen an der Finanzierung des Gemeinwesens beteiligt werden. Dadurch würde übrigens auch der Austausch mit ausländischen Steuerverwaltungen erleichtert, da diese dann nur noch mit einer statt mit 16 Behörden zusammenarbeiten müssten. Eine solche neue Abteilung macht gerade jetzt Sinn, wo die OECD neue Vorschläge erarbeitet, wie wir die Steuervermeidungsstrategien der Konzerne endlich stoppen können.

Ich fasse zusammen: Das Thema Bundessteuerverwaltung muss bei den Verhandlungen über die Bund-Länder-Finanzbeziehungen zurück auf den Verhandlungstisch. Erste Schritte, die mindestens gegangen werden müssten, sind: Aufstellung einer Spezialeinheit für den Umgang mit Großkonzernen und Einkommensmillionären. Der unterschiedliche Zustand der Verwaltungen muss endlich transparent gemacht werden und durch bundeseinheitliche Zielvereinbarungen kontrolliert werden. Und wir brauchen endlich eine einheitliche Software.

Ich freue mich auf die Debatte, damit wir hier endlich vorwärtskommen.",data/txt/18060.txt,speech,
2266122,60,18,0,,,,1550,Beifall beim BÜNDNIS 90/DIE GRÜNEN sowie bei Abgeordneten der LINKEN,data/txt/18060.txt,poi,
2266123,60,18,0,,,,1551,"Vizepräsident Peter Hintze:

Als nächster Rednerin erteile ich das Wort der Abgeordneten Margaret Horb, CDU/CSU-Fraktion.",data/txt/18060.txt,speech,
2266124,60,18,0,,,,1552,Beifall bei der CDU/CSU,data/txt/18060.txt,poi,
2266125,60,18,0,,,,1553,"Margaret Horb (CDU/CSU):

Sehr geehrter Herr Präsident! Sehr geehrte Kolleginnen und Kollegen! Meine sehr verehrten Damen und Herren! Immer wenn die Gründung einer Föderalismuskommission ansteht oder eine tagt, steht das Thema Bundessteuerverwaltung auf der Agenda. Heute beglücken uns die Grünen mit einer Debatte zu diesem Thema.

Die Diskussion ist wichtig, gerade auch im Kontext der Föderalismuskommission; denn die Steuerverwaltung ist der Maschinenraum unseres Finanzsystems. Da ist es nicht so glamourös wie beim Captain, der oben auf der Brücke steht, das Schiff lenkt und beim Captains Dinner mit den Gästen plaudert. Aber ohne die Mannschaft im Maschinenraum fährt kein Schiff der Welt. Und ohne eine funktionierende, effiziente Steuerverwaltung funktioniert kein Staat der Welt. Ich finde die Diskussion, die wir heute führen, deshalb gut und richtig. Von dem vorliegenden Antrag der lieben Kollegen und Kolleginnen der Grünen kann ich das leider nicht behaupten.",data/txt/18060.txt,speech,
2266126,60,18,0,,,,1554,Beifall bei Abgeordneten der CDU/CSU,data/txt/18060.txt,poi,
2266127,60,18,0,,,,1555,"Da ist zunächst der Titel: Für eine Bundessteuerverwaltung - Gleiche Grundsätze von Flensburg bis zum Bodensee. Ihre Geografiekenntnisse in allen Ehren, aber gleiche Grundsätze gibt es bereits. Die Abgabenordnung gilt überall in Deutschland gleichermaßen.",data/txt/18060.txt,speech,
2266128,60,18,0,Dr. Gerhard Schick [BÜNDNIS 90/DIE GRÜNEN],Dr. Gerhard Schick [BÜNDNIS 90/DIE GRÜNEN],gerhard-schick-bundnis-90-die-grunen,1556,Auf dem Papier!,data/txt/18060.txt,poi,gruene
2266129,60,18,0,,,,1557,"Die Steuerverwaltung ist Ländersache. Die Steuergesetze sind überall gleich, in Flensburg wie am Bodensee.

Kommen wir aber zum Steuervollzug; denn darum geht es Ihnen ja. Da schreiben Sie in Ihrem Antrag ernsthaft - ich zitiere wörtlich -:

Es kann aber nicht sein, dass die Höhe der Steuerzahlung vom Wohnort abhängt, weil in einem Land geprüft und im anderen weggesehen wird.

Ist Ihnen eigentlich klar, was Sie damit sagen? Ich selbst komme aus der Finanzverwaltung. Wenn ich so etwas lese, dann werde ich sauer, und zwar richtig sauer.",data/txt/18060.txt,speech,
2266130,60,18,0,Dr. Gerhard Schick [BÜNDNIS 90/DIE GRÜNEN],Dr. Gerhard Schick [BÜNDNIS 90/DIE GRÜNEN],gerhard-schick-bundnis-90-die-grunen,1558,Das hat der Bundesrechnungshof geschrieben!,data/txt/18060.txt,poi,gruene
2266131,60,18,0,,,,1559,"Ich kenne keinen Mitarbeiter, keine Mitarbeiterin, keinen Sachbearbeiter und keinen Betriebsprüfer in der Finanzverwaltung, der bei Steuererklärungen und prüfungen wegsieht. Hier sind wir auch ganz schnell im Bereich von Straftaten. Wenn Sie einzelnen Bundesländern unterstellen, dass sie ihre Steuerverwaltungen extra schlecht ausstatten, um Standortvorteile zu generieren, dann müssen Sie das auch belegen.",data/txt/18060.txt,speech,
2266132,60,18,0,,,,1560,Beifall bei der CDU/CSU,data/txt/18060.txt,poi,
2266133,60,18,0,,,,1561,"Wo wir gerade bei den Ländern sind, liebe Kollegen und Kolleginnen der Grünen: Lassen Sie mich Ihnen vorlesen, was Ihr grüner Ministerpräsident Kretschmann von einer Bundessteuerverwaltung hält. Ich zitiere aus dem Mannheimer Morgen:

Würde man die Gesetzgebung in diese Richtung ändern, sei der Kern des Föderalismus betroffen, so der Regierungschef. Denn durch die komplette Übertragung der Steuerverwaltung nach Berlin könnten die Länder über den Bundesrat keine Gesetzesinitiative des Bundes mehr beeinflussen. Das ist aus Gesichtspunkten des Föderalismus keine gute Position, stellte Kretschmann klar und ergänzte barsch: Es gibt keinen Anlass, diese Diskussion jetzt weiterzuführen.",data/txt/18060.txt,speech,
2266134,60,18,0,Dr. Mathias Middelberg [CDU/CSU],Dr. Mathias Middelberg [CDU/CSU],mathias-middelberg-cdu-csu,1562,Sehr richtig!,data/txt/18060.txt,poi,cducsu
2266135,60,18,0,Heinz Wiese [Ehingen] [CDU/CSU],Heinz Wiese [Ehingen] [CDU/CSU],heinz-wiese-ehingen-cdu-csu,1563,Hört! Hört!,data/txt/18060.txt,poi,cducsu
2266136,60,18,0,,,,1564,"Das ist doch eine klare Abfuhr. Was zeigt uns das? Das zeigt, dass sich die Grünen auf Bundesebene nicht mit ihrem eigenen Ministerpräsidenten abstimmen. Aber das kennen wir ja schon. Wir sehen daran aber auch, dass es bei den Ländern oft eine ganz andere Interessenlage als beim Bund gibt. Gerade die großen Bundesländer achten hier sehr genau auf ihre Eigenständigkeit.

Ich komme noch einmal auf mein Bild vom Anfang meiner Rede zurück. Wenn unsere Steuerverwaltung der Maschinenraum ist, dann wollen Sie mit Ihrem Antrag den ganzen Schiffsmotor auswechseln. Das ist nicht realistisch. Das heißt aber nicht, dass der Motor nicht in die Inspektion muss. Wir haben einigen Wartungsbedarf. Nationale und internationale Entwicklungen stellen unser Steuersystem vor neue Herausforderungen, neue Pflichten und Aufgaben. Danach handeln wir.

Im Koalitionsvertrag haben wir die Stärkung des Bundeszentralamtes für Steuern vereinbart. Wir werden die Steuerfahndungen der Länder stärker unterstützen. Die Bekämpfung von Steuerhinterziehung muss oberste Priorität haben. Dafür brauchen wir auch eine stärkere Einbindung des Bundes.

Das gilt besonders für den Bereich Umsatzsteuerbetrug. Auch wenn prominente Hinterziehungsfälle bei der Einkommensteuer medial immer besonders viel Aufmerksamkeit erregen: Das meiste Geld wird bei der Mehrwertsteuer hinterzogen. Hier entstehen der öffentlichen Hand die meisten Verluste. Hier reden wir auch über organisierte Kriminalität. Diese Form der Steuerhinterziehung ist natürlich länderübergreifend, ja, sie agiert europaweit, sie agiert weltweit. Deshalb macht eine Kontrolle und Bekämpfung auf Bundesebene Sinn.

Es macht ebenso Sinn, dass Betriebsprüfungen - insbesondere bei Großunternehmen - auf Bundesebene stattfinden, sei es in alleiniger Zuständigkeit oder in Zusammenarbeit mit den Ländern. Um die Fälle für die Bundesbetriebsprüfung auswählen zu können, braucht das Bundeszentralamt aber auch die notwendigen Daten.

Damit sind wir bei dem Punkt IT. Der zunehmende Einsatz elektronischer Programme in der Steuerverwaltung ist sinnvoll und notwendig, und das ist Fakt. In einer digitalen und globalisierten Welt muss die Steuerverwaltung digital arbeiten. In diesem Bereich wird eine ganze Reihe von Projekten gerade umgesetzt, läuft bereits oder ist in Planung. Ich selbst habe im Finanzamt mit diesen Programmen gearbeitet und kenne den Nutzen und die Probleme. Ich weiß auch um manches Schönreden von Zahlen, Evaluierungen und wissenschaftlichen Studien. Nur, dadurch erledigt sich keine einzige Steuererklärung oder Steuerprüfung. Fakt ist: Wir brauchen eine funktionierende EDV, und wir brauchen den Dialog mit den Praktikern.

Nehmen wir ein ganz besonders anschauliches Beispiel, das sind die ESt-4B-Mitteilungen. Das sind Mitteilungen über Einkünfte, an denen mehrere Personen beteiligt sind, beispielsweise über Beteiligungen an GmbHs, Fonds oder Ähnlichem. Diese Mitteilungen werden in Papierform an das Finanzamt geschickt, das für den Bezieher der Einkünfte zuständig ist. Diese Mitteilungen und auch jede Korrekturmitteilung werden zum Teil durch ganz Deutschland geschickt - per Post oder Kurier - und dann im Finanzamt händisch erfasst und verarbeitet. Dieses Verfahren ist unglaublich personalintensiv und fehleranfällig. Daher braucht es hier eine elektronische Lösung, und zwar dringend. Das ist nur ein Beispiel. Wir müssen im Zuge der Bund-Länder-Verhandlungen in das Thema Modernisierung der IT frischen und starken Wind bringen.

Liebe Kolleginnen und Kollegen, wir Abgeordnete haben aber auch noch eine ganz andere Verantwortung: Steuervollzug und Steuergesetzgebung gehen Hand in Hand. Gesetze müssen auch praxistauglich sein. Darauf müssen wir als Abgeordnete achten. Die Verhandlungen zwischen Bund und Ländern bieten die Chance, wichtige Teile unseres Motors Steuervollzug zu erneuern, zu reparieren und zu justieren. Das werden wir in den kommenden Monaten auch intensiv tun - mit Sorgfalt, mit Weitblick und ohne Polemik.

Herzlichen Dank.",data/txt/18060.txt,speech,
2266137,60,18,0,,,,1565,Beifall bei der CDU/CSU und der SPD,data/txt/18060.txt,poi,
2266138,60,18,0,,,,1566,"Vizepräsident Peter Hintze:

Als nächstem Redner erteile ich dem Abgeordneten Richard Pitterle, Fraktion Die Linke, das Wort.",data/txt/18060.txt,speech,
2266139,60,18,0,,,,1567,Beifall bei der LINKEN,data/txt/18060.txt,poi,
2266140,60,18,0,,,,1568,"Richard Pitterle (DIE LINKE):

Sehr geehrter Herr Präsident! Sehr geehrte Damen und Herren! Sehr geehrte Frau Kollegin Horb, um bei Ihrem Beispiel zu bleiben: Wir sitzen hier in der Tat auf dem Deck. Der Maschinenraum ist aber leider auf 16 Boote verteilt, auf die wir von unserem Deck aus keinen Einfluss haben. Ich glaube, das ist das Problem.",data/txt/18060.txt,speech,
2266141,60,18,0,,,,1569,Beifall bei der LINKEN und dem BÜNDNIS 90/DIE GRÜNEN,data/txt/18060.txt,poi,
2266142,60,18,0,,,,1570,"Im Juli 2010 hat die OECD, die Organisation für wirtschaftliche Zusammenarbeit und Entwicklung, den Zustand der Steuerprüfung in Deutschland scharf kritisiert und gefordert, die Steuerprüfung zu verschärfen und vor allem die Banken härter zu kontrollieren. So ließen sich Einnahmen um viele, viele Milliarden Euro im Jahr erhöhen. Jeffrey Owens, der Leiter der Steuerabteilung der OECD, sagte zutreffend - ich zitiere -: Investitionen in die Steuerverwaltung sind Investitionen mit hohen Renditen.

Aber was ist zwischen Juli 2010 und Oktober 2014 passiert, meine Damen und Herren von der Regierungskoalition? Es ist in diesem Bereich rein gar nichts passiert, um die Situation zu ändern. Das ist leider die bittere Wahrheit.",data/txt/18060.txt,speech,
2266143,60,18,0,,,,1571,Beifall bei der LINKEN,data/txt/18060.txt,poi,
2266144,60,18,0,,,,1572,"Die Steuergesetze gelten zwar für alle, aber das heißt noch lange nicht, dass auch alle in Deutschland gleichermaßen die anfallenden Steuern zahlen. Es kommt darauf an, in welchem Bundesland man wohnt; denn es gibt große Unterschiede beim Steuervollzug. Wenn die Bundesländer zum einen die Kosten für die Besteuerung zu tragen haben, aber von den zusätzlich eingetriebenen Steuereinnahmen aus Betriebsprüfung und Steuerfahndung kaum etwas behalten dürfen - es war von 10 Prozent die Rede -, ist es nicht verwunderlich, dass sich einige Länder kostenbewusst verhalten und ihr Interesse an intensiven Prüfungen von Steuererklärungen, an Betriebsprüfungen und an Steuerfahndungen eher gering ist.

Zum anderen hat der Abbau vieler Stellen in der Finanzverwaltung dazu geführt, dass Steuererklärungen, insbesondere von reichen Selbstständigen und Unternehmen, wenn überhaupt, nur unzureichend geprüft werden können. Dabei muss sich die Finanzverwaltung meist auf die Angaben der Steuerpflichtigen verlassen, ohne sie weiter zu überprüfen.

Bundesweit fehlen nach Angaben der Steuergewerkschaft 15 000 Beschäftigte in der Steuerverwaltung. Seit langem fordert die Linke eine Aufstockung der Zahl der Sachbearbeiter, Betriebsprüfer und Steuerfahnder, um zu einer gerechteren Steuererhebung zu kommen, sodass alle Steuerzahlerinnen und Steuerzahler entsprechend ihrer Leistungsfähigkeit besteuert werden.",data/txt/18060.txt,speech,
2266145,60,18,0,,,,1573,Beifall bei der LINKEN sowie der Abg. Lisa Paus [BÜNDNIS 90/DIE GRÜNEN],data/txt/18060.txt,poi,
2266146,60,18,0,,,,1574,"Steuervollzug ist zwar Ländersache, aber wer führt die Regierungen in den Bundesländern - mit Ausnahme Baden-Württembergs - an? Entweder die CDU, die CSU oder die SPD. Die Regierungsparteien CDU, CSU und SPD hätten es somit in der Hand, dort für eine bessere Umsetzung und Durchsetzung der vom Bund und damit von uns erlassenen Steuergesetze zu sorgen. Sie tun es nicht, und das ist schlecht für das gesamte Land.

Eine weitere Ursache für die Steuerungerechtigkeit innerhalb Deutschlands liegt in der ineffizienten Steuerverwaltung. Sie ist auf die 16 Länder bzw., wie gesagt, auf 16 Boote verteilt. Das heißt, es gibt unterschiedliche Datenverarbeitungssysteme, unterschiedliche Personalausstattung und unterschiedliche Interessen. Außerdem wird von einzelnen Bundesländern - Stichwort Bayern - laxer Steuervollzug gezielt als Wettbewerbsvorteil zur Ansiedlung von Unternehmen eingesetzt.",data/txt/18060.txt,speech,
2266147,60,18,0,Margaret Horb [CDU/CSU],Margaret Horb [CDU/CSU],margaret-horb-cdu-csu,1575,"Herr Pitterle, das ist eine Unterstellung!",data/txt/18060.txt,poi,cducsu
2266148,60,18,0,,,,1576,Das ist doch nicht zu fassen.,data/txt/18060.txt,speech,
2266149,60,18,0,,,,1577,Beifall bei der LINKEN,data/txt/18060.txt,poi,
2266150,60,18,0,,,,1578,"Ein erster Schritt zu mehr Steuergerechtigkeit innerhalb Deutschlands wäre eine stärkere Zuständigkeit des Bundes beim Steuervollzug hin zu einer Bundessteuerverwaltung. Das fordern Die Linke und die Grünen seit mehr als zehn Jahren.

Meine Damen und Herren, der beste Weg zur Steuergerechtigkeit in Deutschland sind eine einheitliche Durchsetzung der Steuergesetze bundesweit - insbesondere der Steuererhebung -, ein einheitlich funktionierendes Datenverarbeitungssystem in den Finanzverwaltungen, eine ausreichende personelle Ausstattung in den Finanzämtern, einschließlich Betriebsprüfungen, sowie Steuerfahndungen.

Wir brauchen eine bundesweit einheitlich handelnde, leistungsfähige Finanzverwaltung, erheblich erweiterte Zuständigkeiten des Bundes sowie die von unserer Fraktion vorgeschlagene Bundesfinanzpolizei. Denn nur so können Steuerumgehung besser bekämpft und Steuerhinterziehung und Steuerbetrug besser verfolgt werden.

Die Linke wird diesem guten Antrag der Grünen zustimmen. Tun Sie es auch, meine Damen und Herren der Regierungskoalition!",data/txt/18060.txt,speech,
2266151,60,18,0,,,,1579,Beifall bei der LINKEN und dem BÜNDNIS 90/DIE GRÜNEN,data/txt/18060.txt,poi,
2266152,60,18,0,,,,1580,"Vizepräsident Peter Hintze:

Als nächstem Redner erteile ich das Wort dem Abgeordneten Andreas Schwarz, SPD-Fraktion.",data/txt/18060.txt,speech,
2266153,60,18,0,,,,1581,Beifall bei der SPD sowie bei Abgeordneten der CDU/CSU,data/txt/18060.txt,poi,
2266154,60,18,0,,,,1582,"Andreas Schwarz (SPD):

Sehr geehrter Herr Präsident! Liebe Kolleginnen und Kollegen! Meine Damen und Herren! Jedes Jahr gehen unserem Land Milliarden an Steuereinnahmen verloren, weil es Menschen, aber manchmal auch Unternehmen gibt, die Steuern hinterziehen oder Steuerumgehungsstrategien nutzen und damit die Allgemeinheit schädigen. Alles, was dazu beiträgt, dass dem Staat die Finanzmittel zufließen, die ihm auch zustehen und die er dringend braucht, findet selbstverständlich die volle Unterstützung der SPD-Bundestagsfraktion.",data/txt/18060.txt,speech,
2266155,60,18,0,,,,1583,Beifall bei der SPD sowie bei Abgeordneten des BÜNDNISSES 90/DIE GRÜNEN,data/txt/18060.txt,poi,
2266156,60,18,0,,,,1584,"Der vorliegende Antrag der Grünen ist somit ein interessanter Vorschlag, über den wir natürlich gerne diskutieren. In unserem Leitmotiv für die Verhandlungen über die Neuordnung der Bund-Länder-Finanzbeziehungen setzen wir uns als SPD-Fraktion für eine stärkere Koordinierung und Vereinheitlichung der Steuerverwaltung ein, um, wie wir formuliert haben, einen Standortwettbewerb zu vermeiden und einen gerechten Steuervollzug zu erreichen.",data/txt/18060.txt,speech,
2266157,60,18,0,,,,1585,Beifall bei der SPD,data/txt/18060.txt,poi,
2266158,60,18,0,,,,1586,"Lassen Sie uns konstruktiv darüber streiten, wie die Steuerverwaltung effizienter gestaltet werden kann. Die SPD-Fraktion ist auf jeden Fall dabei. Aber das Ergebnis steht am Ende eines solchen Diskussionsprozesses fest und nicht am Anfang. Deshalb bin ich der Überzeugung, dass es überhaupt keinen Sinn macht, den derzeitigen Verhandlungen über die Neuordnung der Finanzbeziehungen zwischen Bund und Ländern vorzugreifen, indem wir jetzt etwas beschließen, obwohl überhaupt noch nicht feststehen kann, wie das Ergebnis der Verhandlungen zwischen Bund und Ländern am Ende tatsächlich aussieht.",data/txt/18060.txt,speech,
2266159,60,18,0,,,,1587,Beifall bei der SPD sowie bei Abgeordneten der CDU/CSU,data/txt/18060.txt,poi,
2266160,60,18,0,,,,1588,"Ich unterstreiche aber, dass wir es begrüßen würden, wenn in den Bund-Länder-Verhandlungen mehr Effizienz in der Steuerverwaltung erreicht werden könnte. Aber, meine lieben Kolleginnen und Kollegen der Grünen, machen wir uns doch nichts vor: Die Signale der Länder sind momentan nicht sehr ermutigend. Oder haben Sie, liebe Kolleginnen und Kollegen von den Grünen, die Antwort auf die Zitate der Kollegin Horb, aus denen hervorgeht, wie Ihr Ministerpräsident in Baden-Württemberg über eine einheitliche Bundessteuerverwaltung denkt? Sie könnten abschließend noch Ihre politischen Freudinnen und Freunde aus dem schwarz-grün regierten Hessen ansprechen und fragen, wie sie den Sachverhalt einschätzen und - in unserem Sinne - um Unterstützung bitten.",data/txt/18060.txt,speech,
2266161,60,18,0,Ingrid Arndt-Brauer [SPD],Ingrid Arndt-Brauer [SPD],ingrid-arndt-brauer-spd,1589,Genau!,data/txt/18060.txt,poi,spd
2266162,60,18,0,,,,1590,"Ich bin mir aber nicht sicher, ob Ihnen Ihre eigenen Parteifreundinnen und -freunde diesen Gefallen tun würden. Ich weiß aber, dass der Finanzminister Nobert Walter-Borjans in Nordrhein-Westfalen bereits fleißig neue Betriebsprüferinnen und -prüfer einstellt. Das ist der richtige Weg.",data/txt/18060.txt,speech,
2266163,60,18,0,,,,1591,Beifall bei der SPD,data/txt/18060.txt,poi,
2266164,60,18,0,,,,1592,"Die Steuerverwaltungen müssen endlich personell in die Lage versetzt werden, ihren Aufgaben gerecht zu werden. Vielerorts ist das leider nicht so. Herr Eigenthaler von der Deutschen Steuer-Gewerkschaft hat vor zwei Jahren gesagt - ich zitiere -:

Wenn der Steuerzahler weiß, dass das Finanzamt nicht so gut besetzt ist, dann wird er lockerer. Und viele Fälle können gar nicht bearbeitet werden. Unterm Strich sind die Südländer Bayern und Baden-Württemberg hinsichtlich der Personalstärke am unteren Ende der Skala.

Seit in Baden-Württemberg Nils Schmid Finanzminister ist, wird hier konsequent gegengesteuert. Über mein Heimatland Bayern kann ich das leider noch nicht sagen. Auf eine Anfrage der bayerischen SPD-Landtagsfraktion Ende Februar 2014 teilte das bayerische Finanzministerium mit, dass es nach der Personalverteilungsberechnung zum 31. Dezember 2013 16 600 Stellen in den Finanzämtern des Freistaats gab. Die Iststärke hingegen wurde mit 14 791,25 Vollzeitkräften angegeben. Wie soll eine Verwaltung effizient arbeiten, wenn von 16 600 Stellen fast 2 000 unbesetzt sind? Bei fast 2 000 unbesetzten Stellen verschenkt der Freistaat Bayern viel Geld, das nachher für die Erfüllung staatlicher Aufgaben fehlt.

Bayern ist dringend aufgerufen, seine Finanzverwaltung effizienter zu machen.",data/txt/18060.txt,speech,
2266165,60,18,0,,,,1593,Beifall bei der SPD sowie bei Abgeordneten der LINKEN und des BÜNDNISSES 90/DIE GRÜNEN,data/txt/18060.txt,poi,
