id,sitzung,wahlperiode,in_writing,speaker,speaker_cleaned,speaker_fp,sequence,text,filename,type,speaker_party
2893455,91,18,0,Steffen Bilger (CDU/CSU),Steffen Bilger,steffen-bilger,2109,"Zuerst freue ich mich aber, dass sich, anders als bei der Pkw-Maut, ein Großteil des Hauses durchaus darin einig ist, dass die Elektromobilität im Individualverkehr vorangebracht werden sollte.Nur Teile der Linken - Kollege Lutze, Sie haben gerade den Bezug zum Schienenverkehr angesprochen - haben immer noch nicht verstanden, dass Elektromobilität eben nicht auf die Schiene begrenzt ist.

Bei der Elektromobilität geht es für uns in Deutschland darum, Leitmarkt und Leitanbieter für elektrisch betriebene Autos zu sein. Nicht nur für Deutschland, sondern für ganz Europa ist die Entwicklung der Elek-tromobilität eine der bedeutenden Zukunftsfragen. Die EU-Verkehrskommissarin hat es gestern noch einmal verdeutlicht: Es geht um Umweltaspekte, um weniger Abhängigkeit vom Öl, um Arbeitsplätze und um die Zukunft unserer Automobilindustrie.",data/txt/18091.txt,speech,cducsu
2893456,91,18,0,,,,2110,Beifall bei der CDU/CSU und der SPD,data/txt/18091.txt,poi,
2893457,91,18,0,Steffen Bilger (CDU/CSU),Steffen Bilger,steffen-bilger,2111,"Eine der häufig genannten Fragen, wenn wir über Elektromobilität sprechen - gerade wurde es schon erwähnt - ist ja die nach der Herkunft des Stroms für die Elektroautos. Darüber haben wir kürzlich auch im Verkehrsausschuss diskutiert. Natürlich wollen wir alle regenerativen Strom für Elektrofahrzeuge. Ich glaube, wir können sagen: Das ist Konsens in Deutschland. Aber für viele ist die Frage nach der Herkunft des Stroms gar nicht die entscheidende. Wenn wir an Stadtbewohner denken, die unter Lärm und Abgasen leiden, dann dürften Aspekte wie mehr Ruhe oder weniger Emissionen entscheidender sein als die Frage nach der Herkunft des Stroms. Daher: Wer auch immer solche Bedenken in den Vordergrund stellt, hat nicht verstanden, worauf es wirklich ankommt.",data/txt/18091.txt,speech,cducsu
2893458,91,18,0,,,,2112,Beifall des Abg. Andreas Rimkus [SPD],data/txt/18091.txt,poi,
2893459,91,18,0,Steffen Bilger (CDU/CSU),Steffen Bilger,steffen-bilger,2113,,data/txt/18091.txt,speech,cducsu
2893460,91,18,0,Vizepräsidentin Ulla Schmidt,Ulla Schmidt,ulla-schmidt,2114,"Herr Kollege Bilger, gestatten Sie eine Zwischenfrage der Kollegin Leidig?",data/txt/18091.txt,chair,
2893461,91,18,0,Steffen Bilger (CDU/CSU),Steffen Bilger,steffen-bilger,2115,Sehr gerne.,data/txt/18091.txt,speech,cducsu
2893462,91,18,0,Vizepräsidentin Ulla Schmidt,Ulla Schmidt,ulla-schmidt,2116,"Bitte schön, Frau Kollegin.",data/txt/18091.txt,chair,
2893463,91,18,0,Zuruf von der CDU/CSU,von der CDU/CSU,von-der-cdu-csu,2117,Jetzt kommt Stuttgart 21!,data/txt/18091.txt,poi,cducsu
2893464,91,18,0,Vizepräsidentin Ulla Schmidt,Ulla Schmidt,ulla-schmidt,2118,,data/txt/18091.txt,chair,
2893465,91,18,0,Sabine Leidig (DIE LINKE),Sabine Leidig,sabine-leidig,2119,"Sie haben die Lärm- und Schmutzbelastung der Einwohnerinnen und Einwohner der Städte angesprochen und suggeriert, dass sich durch Ihr Elektromobilitätsgesetz daran etwas ändern würde. Ich erinnere mich, dass es in der letzten Wahlperiode das Ziel des damaligen Verkehrsministers Ramsauer war, bis zum Jahr 2020 den Anteil der elektrischen Autos in Deutschland auf 2 Prozent zu erhöhen. Zugleich sind die Verkehrsprognosen davon ausgegangen, dass die Zahl der Automobile um 3 Prozent steigt. Nun habe ich keinerlei Information darüber, dass sich daran etwas ändern soll. Gehen Sie ernsthaft davon aus, dass ein Anteil solcher leisen Autos von 2 Prozent - im besten Falle - die Situation der Bewohnerinnen und Bewohner in einer vielbefahrenen Straße nachhaltig erleichtert, wenn gleichzeitig der Anteil herkömmlicher Fahrzeuge unverändert bei 98 Prozent liegt?",data/txt/18091.txt,speech,linke
2893466,91,18,0,Steffen Bilger (CDU/CSU),Steffen Bilger,steffen-bilger,2120,"Frau Kollegin Leidig, genau das stört mich an der Art und Weise, wie Sie über solche Themen diskutieren: immer das Negative in den Mittelpunkt stellen, immer das Haar in der Suppe suchen, anstatt, wie ich es gerade gesagt habe, einmal die Chancen zu sehen. Es geht um die Zukunft der Mobilität, und die Zukunft der Mobilität wird ganz entscheidend von der Elektromobilität abhängen. Da geht es eben sehr wohl um weniger Lärm und um weniger Abgase in unseren Städten. Das sollten Sie endlich einmal zur Kenntnis nehmen.",data/txt/18091.txt,speech,cducsu
2893467,91,18,0,,,,2121,Beifall bei der CDU/CSU sowie bei Abgeordneten der SPD und des Abg. Matthias Gastel [BÜNDNIS 90/DIE GRÜNEN],data/txt/18091.txt,poi,
2893468,91,18,0,Jutta Krellmann [DIE LINKE],Jutta Krellmann,jutta-krellmann,2122,Was ist das für eine Antwort?,data/txt/18091.txt,poi,linke
2893469,91,18,0,Steffen Bilger (CDU/CSU),Steffen Bilger,steffen-bilger,2123,"Ich habe es gerade schon gesagt: Es drängt sich der Eindruck auf, dass viele immer das Haar in der Suppe suchen. Es kann nicht sein, dass wir jeder Zukunftstechnologie nur mit Skepsis begegnen, immer die - vielleicht bestehenden - Nachteile und Risiken überhöhen und die Vorteile und Chancen nicht sehen. Umso mehr bin ich dankbar für konstruktive Beiträge, wozu ich ausdrücklich den Antrag der Grünen zähle.",data/txt/18091.txt,speech,cducsu
2893470,91,18,0,Zurufe von der SPD,e von der SPD,e-spd,2124,Oh!,data/txt/18091.txt,poi,spd
2893471,91,18,0,Steffen Bilger (CDU/CSU),Steffen Bilger,steffen-bilger,2125,Denn bei vielem sind wir uns einig. So brauchen wir in der Tat eine Elektroautobeschaffungsoffensive der Bundesregierung und anderer staatlicher Ebenen. Auch bei den innerstädtischen Lieferverkehren müssen wir weiterkommen. Das alles unterstützen wir ausdrücklich.,data/txt/18091.txt,speech,cducsu
2893472,91,18,0,,,,2126,Beifall des Abg. Matthias Gastel [BÜNDNIS 90/DIE GRÜNEN],data/txt/18091.txt,poi,
2893473,91,18,0,Steffen Bilger (CDU/CSU),Steffen Bilger,steffen-bilger,2127,"Wir brauchen außerdem mehr öffentliche Ladeinfrastruktur. Die Erkenntnisse der vergangenen Jahre zeigen, dass hier noch viel Potenzial für die Umsetzung innovativer Ideen vorhanden ist, weshalb es nicht richtig wäre, sich beim Ausbau der Ladeinfrastruktur schon heute für die eine Lösung zu entscheiden. Klar ist aber: Wir brauchen ein flächendeckendes Ladenetz in ganz Deutschland.",data/txt/18091.txt,speech,cducsu
2893474,91,18,0,,,,2128,Beifall bei Abgeordneten der CDU/CSU und der SPD,data/txt/18091.txt,poi,
2893475,91,18,0,Steffen Bilger (CDU/CSU),Steffen Bilger,steffen-bilger,2129,"Dass wir von Kaufanreizen für Elektroautos, die -vorhin ja schon angesprochen wurden, nicht viel halten, haben wir in den letzten Jahren hinreichend deutlich -gemacht. Diese Forderung der Grünen lehnen wir ab.

Unser Weg war - wenn wir jetzt Zwischenbilanz ziehen - richtig. Wir setzen auf Unterstützung bei Forschung und Entwicklung sowie bei der Anwendung der Elektromobilität. Kaufanreize sind unseres Erachtens in anderen Ländern eher verpufft. Wichtiger sind zum gegenwärtigen Zeitpunkt andere Maßnahmen. In diesem Zusammenhang muss ich die Grünen erneut kritisieren. Ich verstehe nicht, weshalb sie Sonderabschreibungen mit der Begründung ablehnen, dass diese den Privatleuten nicht nutzen würden. Das ist natürlich einerseits richtig, andererseits erwarten wir den Anstieg bei der Elek-tromobilität jetzt noch nicht so sehr bei den Privatleuten, sondern im Wesentlichen bei den Flotten, seien es Taxis, Pflegedienste oder Lieferwagen.",data/txt/18091.txt,speech,cducsu
2893476,91,18,0,Stephan Kühn [Dresden] [BÜNDNIS 90/DIE GRÜNEN],Stephan Kühn,stephan-kuhn,2130,"Wir haben es nicht abgelehnt, sondern wir warten darauf, dass es kommt!",data/txt/18091.txt,poi,gruene
2893477,91,18,0,Steffen Bilger (CDU/CSU),Steffen Bilger,steffen-bilger,2131,"- Abgelehnt haben Sie es sehr wohl, nämlich bei unserer Diskussion im Verkehrsausschuss. Das hat mich etwas verwundert.

Es geht ja in der Tat nicht nur um die Flotten, sondern auch um die Privatleute. Auch in diesem Bereich können wir etwas tun. Im Koalitionsvertrag ist es nieder-geschrieben: Wir wollen ein KfW-Programm zur -Anschaffung besonders umweltfreundlicher Fahrzeuge auflegen. - Also, beide Gruppen, Privatleute wie Dienstwagenkäufer, profitieren von unseren Maßnahmen zur Förderung der Elektromobilität.

In den Medien und in der Öffentlichkeit - es wurde gerade auch schon in mehreren Redebeiträgen erwähnt - ist ja viel über die Nutzung von Busspuren - dies wird durch das Elektromobilitätsgesetz ermöglicht, wenn sich die Kommunen dafür entscheiden - diskutiert worden. Der Antrag der Grünen spricht sich dagegen aus. Ich muss, wie auch schon im Ausschuss, noch einmal deutlich sagen: Ich kann die ganze Aufregung nicht verstehen. In der Tat entscheidet jede Kommune vor Ort selbst. Natürlich gibt es jetzt viele negative Stellungnahmen von den Kommunen. Aber ich setze auf einen Wett-bewerb der innovativen Kommunen. Dann werden wir sehen, wie es sich im Laufe der Jahre entwickelt. Die Kommunen haben die Möglichkeit, sich für die Förderung der Elektromobilität und, wenn es Sinn macht, auch für die Nutzung von Busspuren durch Elektrofahrzeuge zu entscheiden.

Andreas Rimkus hat es gesagt: Das Gesetz wird auf Anregung des Bundesrates nur bis 2026 Bestand haben. Das ist ein relativ kurzer Zeitraum, aber bei der Elektromobilität wird sich in diesem Zeitraum sicher viel tun. Andere Punkte, die im Elektromobilitätsgesetz geregelt sind, hat Norbert Barthle bereits angesprochen. Wir haben hier erste wichtige Maßnahmen unternommen.

Ich komme zum Schluss. Einen Punkt will ich noch besonders hervorheben: Elektroautos sind, wie bereits gesagt, gerade in städtischen Bereichen die perfekten Lieferfahrzeuge. Deswegen war es auch richtig, zu ermöglichen, dass Kleinlaster, die durch schwere Batterien über die sonst zulässigen 3,5 Tonnen kommen, trotzdem mit dem normalen Führerschein der Klasse B gefahren werden dürfen. Ich will an dieser Stelle dem Bundes-verkehrsministerium, der EU-Kommission und den Kollegen im Bundestag, die sich hierfür eingesetzt haben, ausdrücklich danken. Diese Regelung wird helfen, mehr Elektromobilität im Bereich der Lieferverkehre zu bekommen.",data/txt/18091.txt,speech,cducsu
2893478,91,18,0,,,,2132,Beifall bei der CDU/CSU und der SPD,data/txt/18091.txt,poi,
2893479,91,18,0,Steffen Bilger (CDU/CSU),Steffen Bilger,steffen-bilger,2133,,data/txt/18091.txt,speech,cducsu
2893480,91,18,0,Vizepräsidentin Ulla Schmidt,Ulla Schmidt,ulla-schmidt,2134,"Herr Kollege, Sie hatten versprochen, zum Schluss zu kommen.",data/txt/18091.txt,chair,
2893481,91,18,0,Steffen Bilger (CDU/CSU),Steffen Bilger,steffen-bilger,2135,Das will ich gerade tun.,data/txt/18091.txt,speech,cducsu
2893482,91,18,0,Vizepräsidentin Ulla Schmidt,Ulla Schmidt,ulla-schmidt,2136,Danke.,data/txt/18091.txt,chair,
2893483,91,18,0,Steffen Bilger (CDU/CSU),Steffen Bilger,steffen-bilger,2137,"Ich bitte Sie um Zustimmung zu unserem Gesetzentwurf. Die Öffentlichkeit bitte ich darum, unser Elektromobilitätsgesetz positiv zu begleiten. Die Bedenkenträger sollten unsere gemeinsamen Ziele nicht aus dem Blick verlieren und die Chancen in den Mittelpunkt stellen.

Herzlichen Dank an alle, die auch im Parlamentskreis Elektromobilität gemeinsam an der Förderung der Elek-tromobilität arbeiten.",data/txt/18091.txt,speech,cducsu
2893484,91,18,0,,,,2138,Beifall bei der CDU/CSU und der SPD,data/txt/18091.txt,poi,
2893485,91,18,0,Steffen Bilger (CDU/CSU),Steffen Bilger,steffen-bilger,2139,,data/txt/18091.txt,speech,cducsu
2893486,91,18,0,Vizepräsidentin Ulla Schmidt,Ulla Schmidt,ulla-schmidt,2140,Vielen Dank. - Für die Bundesregierung spricht jetzt die Parlamentarische Staatssekretärin Rita Schwarzelühr-Sutter.,data/txt/18091.txt,chair,
2893487,91,18,0,,,,2141,Beifall bei der SPD sowie bei Abgeordneten der CDU/CSU,data/txt/18091.txt,poi,
2893488,91,18,0,Vizepräsidentin Ulla Schmidt,Ulla Schmidt,ulla-schmidt,2142,,data/txt/18091.txt,chair,
2893489,91,18,0,"Rita Schwarzelühr-Sutter, Parl. Staatssekretärin bei der Bundesministerin für Umwelt, Naturschutz, Bau und Reaktorsicherheit",Rita Schwarzelühr-Sutter,rita-schwarzeluhr-sutter,2143,"Sehr geehrte Frau Präsidentin! Sehr geehrte Damen und Herren! Für das Umweltministerium ist es wichtig, dass der Verkehrssektor mehr und mehr elektrifiziert wird. Denn der Verkehrssektor ist verantwortlich für circa ein Fünftel der Treibhausgasemissionen. Das ist auch, wenn man den Trend betrachtet, der Sektor, in dem die Treibhausgasemissionen kaum abgenommen haben. Hier besteht also Handlungsbedarf. Daneben haben wir natürlich auch eine hohe Feinstaubbelastung, und auch der Lärm in den Städten trägt nicht unbedingt zur Lebensqualität der Menschen bei.

Die Bundesregierung fördert Elektromobilität. Herr Lutze, Sie haben das Gasauto angesprochen. Sie haben vergessen, dass das Gas bis 2018 steuerbegünstigt ist. Es wird auch darüber hinaus steuerlich gefördert, bzw. wir diskutieren darüber, wie die Förderung nach 2018 aussehen wird.",data/txt/18091.txt,speech,
2893490,91,18,0,,,,2144,Beifall bei der SPD sowie bei Abgeordneten der CDU/CSU,data/txt/18091.txt,poi,
2893491,91,18,0,"Rita Schwarzelühr-Sutter, Parl. Staatssekretärin bei der Bundesministerin für Umwelt, Naturschutz, Bau und Reaktorsicherheit",Rita Schwarzelühr-Sutter,rita-schwarzeluhr-sutter,2145,"Sie sind auch nicht ganz auf dem aktuellen Stand, was den Energiebereich anbelangt. Der Anteil der erneuerbaren Energien beträgt fast 28 Prozent, während der Anteil der Atomkraft bei ungefähr 15 bis 16 Prozent liegt. Heute ist sowieso ein guter Tag, weil die erneuerbaren Energien die Braunkohle überholt haben.

Außerdem fördert die Bundesregierung neben den Maßnahmen im Rahmen des guten Elektromobilitätsgesetzes Elektrobusse mit einem reinen Elektroantrieb und solche mit einem Plug-in-Hybrid-Antrieb, und zwar mit einem Investitionskostenzuschuss von bis zu 35 Prozent. Das heißt, wir setzen nicht nur auf individuelle Mobilität, sondern wir setzen insgesamt auf Elektromobilität; denn das ist für unser Klima wichtig. Die Kommunen vor Ort können entscheiden, wie sie dies intelligent miteinander verknüpfen. Die Städte, die besonders durch Feinstaub belastet sind, sollten sich gut überlegen, für welchen Mix sie sich entscheiden, welche Busse in ihren Städten -fahren sollen und wie sie die Mobilität tatsächlich organisieren.

Es ist wichtig, dass wir für die Verbraucher einen zusätzlichen Nutzen schaffen und die Elektromobilität attraktiver machen. Dazu gehören natürlich auch Plug-in-Hybridfahrzeuge, also von außen aufladbare Autos mit einem Elektro- und einem herkömmlichen Antrieb. Ich komme vom Land; da ist das nicht so ganz einfach. Da gibt es keine S-Bahn und keine U-Bahn, sondern da muss man mit dem Auto mehrere Kilometer bis zum nächsten Ort fahren. 80 Prozent der Tage im Jahr fahren die Autonutzer übrigens nur 40 Kilometer. Vor diesem Hintergrund bieten gerade Plug-in-Hybridfahrzeuge eine gewisse Sicherheit: Man weiß, dass man nicht liegen bleibt. Insofern ist es gerechtfertigt, das Elektromobilitätsgesetz so auszugestalten, dass Elektromobilität für die Autofahrerinnen und Autofahrer attraktiver wird.

Alltagstauglichkeit und Umweltnutzen sind für uns bei diesem Gesetz Kernanliegen. Es geht darum, einen zusätzlichen Anreiz für Elektromobilität zu setzen. Zusammen mit Elektrobussen und in Zukunft vielleicht auch Hybridlokomotiven ist dieses Gesetz ein sinnvoller Beitrag zum Klimaschutz, zum Aktionsprogramm -Klimaschutz und auf dem Weg nach Paris.

Herzlichen Dank.",data/txt/18091.txt,speech,
2893492,91,18,0,,,,2146,Beifall bei der SPD und der CDU/CSU,data/txt/18091.txt,poi,
2893493,91,18,0,"Rita Schwarzelühr-Sutter, Parl. Staatssekretärin bei der Bundesministerin für Umwelt, Naturschutz, Bau und Reaktorsicherheit",Rita Schwarzelühr-Sutter,rita-schwarzeluhr-sutter,2147,,data/txt/18091.txt,speech,
2893494,91,18,0,Vizepräsidentin Ulla Schmidt,Ulla Schmidt,ulla-schmidt,2148,"Vielen Dank. - Nächster Redner ist Carsten Müller, CDU/CSU-Fraktion.",data/txt/18091.txt,chair,
2893495,91,18,0,,,,2149,Beifall bei der CDU/CSU,data/txt/18091.txt,poi,
2893496,91,18,0,Vizepräsidentin Ulla Schmidt,Ulla Schmidt,ulla-schmidt,2150,,data/txt/18091.txt,chair,
2893497,91,18,0,Carsten Müller (Braunschweig) (CDU/CSU),Carsten Müller,carsten-muller,2151,"Frau Präsidentin! Meine sehr geehrten Damen und Herren! Die Frau Staatssekretärin hat den aus meiner Sicht zentralen Dreiklang eben schon betont: Klimaschutz, Energiewende, Elektromobilität. Unter dieser Überschrift diskutieren wir heute. Ich finde, es ist außergewöhnlich begrüßenswert, dass wir heute mit dem EMobilitätsgesetz vernünftige und verlässliche Anreize setzen und geeignete Rahmenbedingungen schaffen. Die Umsetzung geschieht dann durch die konkrete Politik vor Ort.",data/txt/18091.txt,speech,cducsu
2893498,91,18,0,Oliver Krischer [BÜNDNIS 90/DIE GRÜNEN],Oliver Krischer,oliver-krischer,2152,"Ja, wo denn?",data/txt/18091.txt,poi,gruene
2893499,91,18,0,Carsten Müller (Braunschweig) (CDU/CSU),Carsten Müller,carsten-muller,2153,"Herr Krischer, ich will Ihnen eines sagen - das finde ich bei den Grünen richtig schade; das ist mir allerdings auch bei Herrn Lutze aufgefallen -: Wir reden hier über ein großes Thema.",data/txt/18091.txt,speech,cducsu
2893500,91,18,0,,,,2154,Beifall des Abg. Andreas Rimkus [SPD],data/txt/18091.txt,poi,
2893501,91,18,0,Matthias Gastel [BÜNDNIS 90/DIE GRÜNEN],Matthias Gastel,matthias-gastel,2155,"Ja, aber über einen kleinen Gesetzentwurf!",data/txt/18091.txt,poi,gruene
2893502,91,18,0,Carsten Müller (Braunschweig) (CDU/CSU),Carsten Müller,carsten-muller,2156,"Aber die Grünen und die Linken kommen leider über Beiträge, die in kleinteiligster Kritik und in Gemäkel enden, nicht hinaus. Das ist wirklich schade.",data/txt/18091.txt,speech,cducsu
2893503,91,18,0,,,,2157,Beifall bei der CDU/CSU und der SPD,data/txt/18091.txt,poi,
2893504,91,18,0,Carsten Müller (Braunschweig) (CDU/CSU),Carsten Müller,carsten-muller,2158,"Menschenskinder, machen Sie mal ein bisschen konstruktiv mit!",data/txt/18091.txt,speech,cducsu
2893505,91,18,0,Oliver Krischer [BÜNDNIS 90/DIE GRÜNEN],Oliver Krischer,oliver-krischer,2159,Es steht in dem Gesetzentwurf doch nichts drin! Dann machen Sie mal konkrete Vorschläge!,data/txt/18091.txt,poi,gruene
2893506,91,18,0,Carsten Müller (Braunschweig) (CDU/CSU),Carsten Müller,carsten-muller,2160,- Melden Sie sich doch. Dann bekomme ich wenigstens ein bisschen mehr Redezeit und kann Ihnen das erklären.,data/txt/18091.txt,speech,cducsu
2893507,91,18,0,Heiterkeit bei Abgeordneten der CDU/CSU und der SPD Oliver Krischer [BÜNDNIS 90/DIE GRÜNEN],Heiterkeit bei Abgeordneten der CDU/CSU und der SPD Oliver Krischer,heiterkeit-bei-abgeordneten-der-cdu-csu-und-der-spd-oliver-krischer,2161,Von wegen!,data/txt/18091.txt,poi,cducsu:gruene:spd
2893508,91,18,0,Carsten Müller (Braunschweig) (CDU/CSU),Carsten Müller,carsten-muller,2162,"- Sie scheinen es noch nicht verstanden zu haben. Ich würde es Ihnen gerne erklären.

Das EmoG ist genau der richtige Weg in genau der richtigen Dosierung und genau der richtigen Schrittgröße.",data/txt/18091.txt,speech,cducsu
2893509,91,18,0,Oliver Krischer [BÜNDNIS 90/DIE GRÜNEN],Oliver Krischer,oliver-krischer,2163,Das ist eine Lachnummer!,data/txt/18091.txt,poi,gruene
2893510,91,18,0,Carsten Müller (Braunschweig) (CDU/CSU),Carsten Müller,carsten-muller,2164,"Aber es ist eben nur einer von vielen Schritten, den die Bundesregierung macht, um E-Mobilität zu unterstützen. Ich will gleich einige zentrale Vorhaben nennen, allerdings auch auf den Antrag der Grünen rekurrieren; da bin ich bei der Bewertung nämlich ein bisschen zurückhaltender als mein Freund und Fraktionskollege Steffen Bilger.

Ganz ehrlich: Wenn man sich Ihren Forderungskatalog anschaut, dann muss man sagen: Der Spaß hört im Grunde schon beim ersten Punkt auf. Wie einfallslos ist es denn, dieses große Thema mit dummem Geld, mit einfachen Ankaufszuschüssen angehen zu wollen?",data/txt/18091.txt,speech,cducsu
2893511,91,18,0,Matthias Gastel [BÜNDNIS 90/DIE GRÜNEN],Matthias Gastel,matthias-gastel,2165,"Es wirkt! Das ist aber das, was wirken würde!",data/txt/18091.txt,poi,gruene
2893512,91,18,0,Carsten Müller (Braunschweig) (CDU/CSU),Carsten Müller,carsten-muller,2166,"Das ist doch über alle Maßen kurz gesprungen. Ich empfehle Ihnen, Herr Kollege, sich die Zahlen aus anderen Ländern geben zu lassen; sie zahlen zum Teil abenteuerlich hohe Ankaufsprämien. Schauen Sie sich bitte auch einmal das Preisgefüge bei E-Mobilen an. Bei E-Mobilen liegen die Verkaufspreise in genau den Ländern, die diese Prämie zahlen, nämlich in Frankreich, in Nor-wegen, in den Niederlanden und in Festlandchina, signifikant über den Preisen, die in Deutschland gefordert werden. Das zeigt, dass Sie mit Ihrer Idee schlechterdings deutlich zu kurz springen.",data/txt/18091.txt,speech,cducsu
2893513,91,18,0,,,,2167,Beifall bei der CDU/CSU sowie bei Abgeordneten der SPD,data/txt/18091.txt,poi,
2893514,91,18,0,Carsten Müller (Braunschweig) (CDU/CSU),Carsten Müller,carsten-muller,2168,Ich will durchaus sagen: Es gibt auch einige nicht vollkommen unvernünftige Ideen.,data/txt/18091.txt,speech,cducsu
2893515,91,18,0,Oliver Krischer [BÜNDNIS 90/DIE GRÜNEN],Oliver Krischer,oliver-krischer,2169,Aha!,data/txt/18091.txt,poi,gruene
2893516,91,18,0,Carsten Müller (Braunschweig) (CDU/CSU),Carsten Müller,carsten-muller,2170,"Sie können sich sicher sein, dass wir sie weiterverfolgen.",data/txt/18091.txt,speech,cducsu
2893517,91,18,0,Oliver Krischer [BÜNDNIS 90/DIE GRÜNEN],Oliver Krischer,oliver-krischer,2171,Oh! War das ein Lob?,data/txt/18091.txt,poi,gruene
2893518,91,18,0,Carsten Müller (Braunschweig) (CDU/CSU),Carsten Müller,carsten-muller,2172,"Ein öffentliches Beschaffungsprogramm für E-Mobile ist eine wichtige Sache, die vorangetrieben werden muss; das gilt übrigens nicht nur für die Bundesministerien, sondern auch für die nachgeordneten Behörden. Ich finde, es ist auch eine vernünftige Idee, darüber nachzudenken, inwieweit man mit klugen Programmen dazu beitragen kann, dass auch andere staatliche Ebenen, also Länder und Kommunen, E-Mobile in viel größerem Umfang beschaffen, auch dann, wenn sie nicht in den Schaufensterregionen zu finden sind.

Meine Damen und Herren, ich will ein weiteres Thema aufgreifen. Ich betrachte das Thema EmoG, wie gesagt, als einen Schritt, der in eine Vielzahl von Maßnahmen zur Förderung der E-Mobilität eingebettet ist. Frau Staatssekretärin Schwarzelühr-Sutter hat vorhin gesagt, die Bundesregierung habe im Grunde genommen Ihre Forderungen bereits antizipiert. Sie fördert - wir haben das jüngst besprochen - die Beschaffung von hy-bridangetriebenen Bussen und von Plug-in-Bussen. Sie fördert im Übrigen auch die Anschaffung von vollelek-trisch angetriebenen Bussen.

Es gibt ein besonders interessantes Vorhaben, bei dem vollelektrisch angetriebene Busse mit einer meines Erachtens sehr klugen Erweiterung ausgestattet werden, nämlich mit der Möglichkeit, sie induktiv zu laden. Das finde ich außergewöhnlich interessant. Das geht auch, was die Frage der Aufladung angeht, deutlich über das hinaus, was Sie mit Ihrem Antrag fordern.

Meine Damen und Herren, schauen wir uns einmal verschiedene technische Neuerungen an. Ich greife einmal so banale Dinge wie ein ferngesteuertes Spielzeugauto, eine Fernsehfernbedienung und ein Telefon heraus. Da ging man zunächst zu einer remote-möglichen Bedienung über, und im nächsten Schritt war das Kabel weg. Deswegen bin ich davon überzeugt, dass - deswegen warne ich auch vor einem zu euphorischen und unüberlegten Ausbau der Ladesäulen - wir künftig die Fahrzeuge viel mehr induktiv aufladen werden. Das wird das E-Mobil dann wirklich interessant machen.

Das Thema Sonder-AfA ist angesprochen worden. Das halte ich deswegen für ein kluges Instrument,",data/txt/18091.txt,speech,cducsu
2893519,91,18,0,,,,2173,Beifall des Abg. Andreas Rimkus [SPD],data/txt/18091.txt,poi,
2893520,91,18,0,Carsten Müller (Braunschweig) (CDU/CSU),Carsten Müller,carsten-muller,2174,"weil wir damit auch die Zweitverwendung in den Blick nehmen, also die private Verwendung. Das haben Sie offensichtlich noch gar nicht bedacht.

Ich will noch einen letzten, mir sehr wichtigen Gesichtspunkt anführen. Wir beschließen heute das EmoG. Das ist ein großer und richtiger Schritt.",data/txt/18091.txt,speech,cducsu
2893521,91,18,0,Matthias Gastel [BÜNDNIS 90/DIE GRÜNEN],Matthias Gastel,matthias-gastel,2175,Ein winziger Schritt!,data/txt/18091.txt,poi,gruene
2893522,91,18,0,Carsten Müller (Braunschweig) (CDU/CSU),Carsten Müller,carsten-muller,2176,"Wir müssen uns aber auch noch um andere wichtige Themen kümmern. Wenn wir bedenken, dass etwa 30 bis 40 Prozent der Wertschöpfung bei einem E-Mobil auf die Infrastruktur des Fahrzeugs, wie beispielsweise auf Batterien, entfallen, dann müssen wir uns in Deutschland sehr bald Gedanken darüber machen, wie wir es schaffen können, die Batteriezellfertigung wieder in Deutschland anzusiedeln und qualitativ hochwertige, ökologisch vertretbare und kompetitive Produkte im Bereich der Batteriezellen zu fertigen. Hierfür sind erhebliche Anstrengungen erforderlich. Da ist das Geld wesentlich besser eingesetzt als bei den von Ihnen vorgeschlagenen Kauf-anreizen.

Wir machen heute einen ersten Schritt. Weitere werden folgen.

Ich bedanke mich für die Aufmerksamkeit.",data/txt/18091.txt,speech,cducsu
2893523,91,18,0,,,,2177,Beifall bei der CDU/CSU und der SPD,data/txt/18091.txt,poi,
