id,sitzung,wahlperiode,in_writing,speaker,speaker_cleaned,speaker_fp,sequence,text,filename,type,speaker_party
2892747,91,18,0,Sabine Zimmermann (Zwickau) (DIE LINKE),Sabine Zimmermann,sabine-zimmermann,1401,"Viele Frauen sind wegen zu niedriger Verdienste arm. Zusätzlich steigt die Armutsgefährdung stark mit der zunehmenden Teilzeitbeschäftigung.

Hören Sie gut zu, meine Damen und Herren, das sind die Fakten. Ich weiß, diese Fakten gefallen gerade Ihnen von der CDU/CSU nicht, denn sie passen nicht in Ihr Bild von einer schönen Arbeitswelt: Zwischen 2001 und 2014 ist die Zahl der vollzeitbeschäftigten Frauen um 925 000 auf 7,5 Millionen zurückgegangen. Gleichzeitig stieg die Zahl der teilzeitbeschäftigten Frauen um 2,5 Millionen auf 6,3 Millionen. Hinzu kommen noch 3,4 Millionen Frauen, die ausschließlich einen Minijob haben.

Ich weiß, gerade die Kollegen von CDU und CSU werden mir gleich erklären, dass die meisten Frauen freiwillig auf Vollzeit verzichten. Das ist blanker Unsinn. Wie soll denn eine alleinerziehende Mutter angesichts schlechter Kinderbetreuungsmöglichkeiten regelmäßig in den Abendstunden oder am Wochenende in der Kranken- oder Altenpflege arbeiten? Wenn in frauentypischen Berufen mit einem hohen Anteil an Teilzeit-beschäftigung wie zum Beispiel im Einzelhandel, in der Gastronomie oder aber auch in der Pflege kaum Chancen auf eine Vollzeitbeschäftigung bestehen, wird angesichts der Realitäten der Wunsch nicht mehr ausgesprochen.

Für viel zu viele Frauen ist es ein täglicher Kampf, mit ihrem Lohn über die Runden zu kommen. Keine Bundesregierung hat bislang wirklich etwas dafür getan, dass Frauen bessere Chancen auf existenzsichernde Beschäftigung bekommen. Die Linke sagt: Das ist beschämend.",data/txt/18091.txt,speech,linke
2892748,91,18,0,,,,1402,Beifall bei der LINKEN,data/txt/18091.txt,poi,
2892749,91,18,0,Sabine Zimmermann (Zwickau) (DIE LINKE),Sabine Zimmermann,sabine-zimmermann,1403,"Die Probleme werden von Ihnen kleingeredet und relativiert. Es wird beschwichtigt, und als Krönung wird auch noch behauptet, die Frauen seien selbst schuld, weil sie sich bei der Berufswahl für einen typischen Frauenberuf entschieden haben. Dieser Schwachsinn muss endlich ein Ende haben.",data/txt/18091.txt,speech,linke
2892750,91,18,0,,,,1404,Beifall bei der LINKEN sowie des Abg. Dr. Wolfgang Strengmann-Kuhn [BÜNDNIS 90/DIE GRÜNEN],data/txt/18091.txt,poi,
2892751,91,18,0,Sabine Zimmermann (Zwickau) (DIE LINKE),Sabine Zimmermann,sabine-zimmermann,1405,"Meine Damen hier in diesem Hause, es ist an der Zeit, dass wir fraktionsübergreifend gegen die Diskriminierung von Frauen in der Arbeitswelt vorgehen. Wir brauchen endlich eine verbindliche Entgeltgleichheit in den Unternehmen.

Frau Ministerin Schwesig, die heute leider nicht anwesend sein kann, kann ich nur sagen: Nehmen Sie alle Arbeitgeber in die Pflicht. Appelle und bloße Informationspflichten reichen nicht aus. Gesetzliche Verpflichtungen müssen her.",data/txt/18091.txt,speech,linke
2892752,91,18,0,,,,1406,Beifall bei der LINKEN,data/txt/18091.txt,poi,
2892753,91,18,0,Sabine Zimmermann (Zwickau) (DIE LINKE),Sabine Zimmermann,sabine-zimmermann,1407,Wir brauchen bessere Kinderbetreuungsmöglichkeiten. Minijobs müssen in sozialversicherungspflichtige Beschäftigung überführt werden. 45 Jahre Minijob ergeben einen Rentenanspruch von höchstens 198 Euro. Das kann doch nicht wirklich ihr Ernst sein.,data/txt/18091.txt,speech,linke
2892754,91,18,0,,,,1408,Beifall bei der LINKEN,data/txt/18091.txt,poi,
2892755,91,18,0,Sabine Zimmermann (Zwickau) (DIE LINKE),Sabine Zimmermann,sabine-zimmermann,1409,"Wundert es wirklich irgendjemanden in diesem Hause, dass die Renten von Frauen fast 60 Prozent unter denen der Männer liegen?

Zum Schluss will ich der Großen Koalition sagen: Die Zeit der Versprechungen und der Ausflüchte ist vorbei. Mir hat gestern eine Kollegin aus Zwickau gesagt: Es muss etwas passieren, es reicht uns jetzt.

Danke.",data/txt/18091.txt,speech,linke
2892756,91,18,0,,,,1410,Beifall bei der LINKEN,data/txt/18091.txt,poi,
2892757,91,18,0,Sabine Zimmermann (Zwickau) (DIE LINKE),Sabine Zimmermann,sabine-zimmermann,1411,,data/txt/18091.txt,speech,linke
2892758,91,18,0,Vizepräsident Johannes Singhammer,Johannes Singhammer,johannes-singhammer,1412,Für die CDU/CSU spricht jetzt die Kollegin Dr. Astrid Freudenstein.,data/txt/18091.txt,chair,
2892759,91,18,0,,,,1413,Beifall bei der CDU/CSU,data/txt/18091.txt,poi,
2892760,91,18,0,Vizepräsident Johannes Singhammer,Johannes Singhammer,johannes-singhammer,1414,,data/txt/18091.txt,chair,
2892761,91,18,0,Dr. Astrid Freudenstein (CDU/CSU),Dr. Astrid Freudenstein,astrid-freudenstein,1415,"Herr Präsident! Meine Damen und Herren! Liebe Kolleginnen! Liebe Kollegen! Wir brauchen gar nicht drum herumzureden: Wenn Frauen für genau die gleiche Arbeit, für eine gleichwertige Arbeit weniger Geld bekommen als Männer, dann ist das ungerecht, und wenn Frauen in unserem Land überproportional häufig von Armut und Altersarmut betroffen sind, kann uns das nicht in Ruhe lassen.

Frauen verdienen im Schnitt 22 Prozent weniger als Männer. Dieses sogenannte Gender Pay Gap lässt sich allerdings aufteilen: 15 Prozent Unterschied lassen sich erklären - ich werde Ihnen das tatsächlich wieder erklären -, 7 Prozent lassen sich aber tatsächlich durch nichts so recht erklären. Diese 7 Prozent sind die eigentliche Ungerechtigkeit. Das ist Diskriminierung von Frauen, die schlicht und ergreifend schon jetzt verboten ist.",data/txt/18091.txt,speech,cducsu
2892762,91,18,0,,,,1416,Beifall bei der CDU/CSU,data/txt/18091.txt,poi,
2892763,91,18,0,Dr. Astrid Freudenstein (CDU/CSU),Dr. Astrid Freudenstein,astrid-freudenstein,1417,"Ich will jetzt aber auch über diese 15 Prozent sprechen, die Sie vielleicht als Skandal betrachten, ich aber nicht. Punkt eins: Frauen kriegen Kinder. Punkt zwei: Frauen wählen nach wie vor Berufe, die nicht besonders gut bezahlt sind,",data/txt/18091.txt,speech,cducsu
2892764,91,18,0,Elke Ferner [SPD],Elke Ferner,elke-ferner,1418,Dafür kriege ich doch keine schlechtere Bezahlung!,data/txt/18091.txt,poi,spd
2892765,91,18,0,Dr. Astrid Freudenstein (CDU/CSU),Dr. Astrid Freudenstein,astrid-freudenstein,1419,"und sie erreichen seltener gut bezahlte Führungspositionen. Punkt drei: Viele Frauen arbeiten Teilzeit, und es werden immer mehr.",data/txt/18091.txt,speech,cducsu
2892766,91,18,0,Dr. Wolfgang Strengmann-Kuhn [BÜNDNIS 90/DIE GRÜNEN],Dr. Wolfgang Strengmann-Kuhn,wolfgang-strengmann-kuhn,1420,"Das ist kein Grund, dass sie einen geringeren Stundenlohn bekommen!",data/txt/18091.txt,poi,gruene
2892767,91,18,0,Dr. Astrid Freudenstein (CDU/CSU),Dr. Astrid Freudenstein,astrid-freudenstein,1421,"Zu allen drei Punkten will ich etwas sagen.

Erstens: zur Teilzeit. Wenn wir uns die Zahlen des Statistischen Bundesamtes anschauen, stellen wir fest: Inzwischen sind drei von vier Frauen erwerbstätig. Das ist so viel wie nie zuvor. Das ist eine ausgesprochen gute Nachricht.",data/txt/18091.txt,speech,cducsu
2892768,91,18,0,,,,1422,Beifall bei Abgeordneten der CDU/CSU,data/txt/18091.txt,poi,
2892769,91,18,0,Dr. Astrid Freudenstein (CDU/CSU),Dr. Astrid Freudenstein,astrid-freudenstein,1423,"In Bayern ist im Übrigen die Erwerbsquote von Frauen in Westdeutschland am höchsten und mit am höchsten in Deutschland. Die Zahl der vollzeitbeschäftigten Frauen geht aber gleichzeitig zurück. Von den Frauen, die erwerbstätig sind, arbeitet inzwischen nicht einmal mehr jede zweite Vollzeit. Trotzdem sind es in der Gesamtheit so viele wie nie zuvor.

Warum, meinen Sie, ist das so? Es gibt Frauen, die einfach keine Vollzeitstelle bekommen, obwohl sie eine wollen. Dies ist gerade im Osten der Fall. Dies sind allerdings nur 14 Prozent. Die allermeisten erwerbstätigen Frauen arbeiten Teilzeit, weil sie Teilzeit arbeiten wollen. Warum wollen sie Teilzeit arbeiten?

Das führt mich zum zweiten Punkt: Frauen bekommen Kinder. Es gibt viele Frauen, die sich allein um die Kinder kümmern müssen. Es gibt aber auch sehr viele Frauen, die sich ausgesprochen gerne um ihre Kinder kümmern.",data/txt/18091.txt,speech,cducsu
2892770,91,18,0,Dr. Wolfgang Strengmann-Kuhn [BÜNDNIS 90/DIE GRÜNEN],Dr. Wolfgang Strengmann-Kuhn,wolfgang-strengmann-kuhn,1424,Männer gibt es auch!,data/txt/18091.txt,poi,gruene
2892771,91,18,0,Dr. Astrid Freudenstein (CDU/CSU),Dr. Astrid Freudenstein,astrid-freudenstein,1425,"Sie wollen Zeit mit ihren Kindern verbringen. Sie wollen daheim sein, wenn das Kind aus der Schule kommt.",data/txt/18091.txt,speech,cducsu
2892772,91,18,0,,,,1426,Beifall bei der CDU/CSU,data/txt/18091.txt,poi,
2892773,91,18,0,Dr. Astrid Freudenstein (CDU/CSU),Dr. Astrid Freudenstein,astrid-freudenstein,1427,"Sie wollen daheim sein, wenn die ersten Zähne wachsen. Sie wollen daheim sein, wenn die Zähne wieder herausfallen.",data/txt/18091.txt,speech,cducsu
2892774,91,18,0,Dr. Wolfgang Strengmann-Kuhn [BÜNDNIS 90/DIE GRÜNEN],Dr. Wolfgang Strengmann-Kuhn,wolfgang-strengmann-kuhn,1428,Wir Männer auch!,data/txt/18091.txt,poi,gruene
2892775,91,18,0,Dr. Astrid Freudenstein (CDU/CSU),Dr. Astrid Freudenstein,astrid-freudenstein,1429,"Ich kann das gut verstehen. Manche wollen auch dann noch daheim sein, wenn das Kind den ersten Liebeskummer hat. Ich kann das verstehen. Für all das braucht man Zeit. Diese Zeit nehmen sich Frauen. Sie wollen sehr häufig eine Teilzeitstelle. Sie nehmen sie, wenn sie Anspruch darauf haben oder wenn sie es sich leisten können.

Drittens. Frauen sind viel häufiger als Männer in Branchen beschäftigt, in denen schlecht bezahlt wird. Sie erreichen dort auch seltener gut bezahlte Führungspositionen. An der Berufswahl von Frauen können wir nur in sehr begrenztem Maße etwas ändern. Wir können aufklären und Frauen und Mädchen auf Berufe hinweisen, die bisher als typisch männlich erachtet wurden. Aber Fakt ist auch: Frauen gehen trotz all unserer Appelle und aller Aufklärung lieber ins Büro als in die Autofabrik, auch wenn sie wissen, dass in der Metall- und Elektroindustrie ganz ordentlich bezahlt werden würde. Frauen studieren trotz unserer Appelle lieber Medienwissenschaften als Maschinenbau, obwohl sie wissen, dass sie als Pressesprecherin oder Journalistin nicht reich werden.

Ich halte es auch nicht für eine weibliche Schwäche, wenn Frauen bei der Berufswahl nicht in erster Linie an das Geld denken.",data/txt/18091.txt,speech,cducsu
2892776,91,18,0,Steffi Lemke [BÜNDNIS 90/DIE GRÜNEN],Steffi Lemke,steffi-lemke,1430,"Und Mädchen spielen immer mit Puppen, oder wie?",data/txt/18091.txt,poi,gruene
2892777,91,18,0,Dr. Astrid Freudenstein (CDU/CSU),Dr. Astrid Freudenstein,astrid-freudenstein,1431,"Tatsache ist auch, dass wenige Frauen in Führungspositionen sind. Aber eine Führungsposition verlangt eben auch vollen Einsatz: am Abend und auch am Wochenende. Es werden Umzüge und Dienstreisen verlangt.",data/txt/18091.txt,speech,cducsu
2892778,91,18,0,,,,1432,Zurufe von der LINKEN,data/txt/18091.txt,poi,
2892779,91,18,0,Dr. Astrid Freudenstein (CDU/CSU),Dr. Astrid Freudenstein,astrid-freudenstein,1433,"Damit wären wir wieder beim Punkt Familie angekommen. Viele Frauen wollen das nicht. Sie wollen sich nicht ganz für den Beruf opfern. Sie fühlen sich dann am glücklichsten, wenn sie Familie und Beruf unter einen Hut bringen können.",data/txt/18091.txt,speech,cducsu
2892780,91,18,0,,,,1434,Beifall bei der CDU/CSU,data/txt/18091.txt,poi,
2892781,91,18,0,,,,1435,Zurufe von der SPD und der LINKEN,data/txt/18091.txt,poi,
2892782,91,18,0,Dr. Astrid Freudenstein (CDU/CSU),Dr. Astrid Freudenstein,astrid-freudenstein,1436,"Deshalb sollten wir uns in dieser Debatte zu Recht fragen, was wir mit dem Appell „Mehr Frauen in mehr Arbeit“ meinen. Wollen wir damit den Fachkräftemangel bekämpfen? Das wäre legitim. Wollen wir unsere Sozialsysteme stabilisieren? Das fände ich auch legitim. Oder meinen Sie vielleicht tatsächlich, dass Frauen nur durch Erwerbsarbeit emanzipiert sein können? Dem würde ich widersprechen.",data/txt/18091.txt,speech,cducsu
2892783,91,18,0,,,,1437,Beifall bei der CDU/CSU,data/txt/18091.txt,poi,
2892784,91,18,0,Dr. Astrid Freudenstein (CDU/CSU),Dr. Astrid Freudenstein,astrid-freudenstein,1438,"Wenn sich Frauen für einen Beruf entscheiden, wenn sie Kinder bekommen, wenn sie beruflich kürzertreten, dann tun sie das in aller Regel, ohne sich um Fachkräftemangel, Stabilisierung von Sozialsystemen und emanzipatorische Ideologien zu kümmern. Ich finde das auch in Ordnung. Sie tun es aus freiem Willen. Wir müssen -respektieren, dass Frauen heute ihr Leben so leben, wie sie es leben wollen.

Herzlichen Dank.",data/txt/18091.txt,speech,cducsu
2892785,91,18,0,,,,1439,Beifall bei der CDU/CSU,data/txt/18091.txt,poi,
2892786,91,18,0,Elke Ferner [SPD],Elke Ferner,elke-ferner,1440,Können sie aber nicht!,data/txt/18091.txt,poi,spd
2892787,91,18,0,Dr. Astrid Freudenstein (CDU/CSU),Dr. Astrid Freudenstein,astrid-freudenstein,1441,,data/txt/18091.txt,speech,cducsu
2892788,91,18,0,Vizepräsident Johannes Singhammer,Johannes Singhammer,johannes-singhammer,1442,Für Bündnis 90/Die Grünen spricht jetzt die Kollegin Ulle Schauws.,data/txt/18091.txt,chair,
2892789,91,18,0,Ulle Schauws (BÜNDNIS 90/DIE GRÜNEN),Ulle Schauws,ulle-schauws,1443,"Sehr geehrter Herr Präsident! Meine Damen und Herren! Liebe Kolleginnen und Kollegen! Am Sonntag ist der Internationale Frauentag. Es ist ein Anlass, einen Blick darauf zu werfen, was sich in Sachen Gleichstellung getan hat und was sich hoffentlich noch verbessern wird.

Frau Kollegin, zu den „emanzipatorischen Ideologien“: Hier muss sich zwingend noch einiges verbessern, vor allen Dingen auf der rechten Seite des Hauses.",data/txt/18091.txt,speech,gruene
2892790,91,18,0,,,,1444,Beifall beim BÜNDNIS 90/DIE GRÜNEN und bei der LINKEN sowie bei Abgeordneten der SPD,data/txt/18091.txt,poi,
2892791,91,18,0,Ulle Schauws (BÜNDNIS 90/DIE GRÜNEN),Ulle Schauws,ulle-schauws,1445,"Dass sich Frauen und Männer gerne um Kinder kümmern, steht außer Frage. Aber darum geht es hier nicht. Es zeigt, dass Sie diese Debatte immer noch nicht verstanden haben.",data/txt/18091.txt,speech,gruene
2892792,91,18,0,,,,1446,Beifall beim BÜNDNIS 90/DIE GRÜNEN und bei der LINKEN,data/txt/18091.txt,poi,
2892793,91,18,0,Ulle Schauws (BÜNDNIS 90/DIE GRÜNEN),Ulle Schauws,ulle-schauws,1447,"Auf dem Arbeitsmarkt sieht es ja tatsächlich erst einmal nicht schlecht aus: 18 Millionen Frauen sind erwerbstätig; ihr Erwerbsanteil ist nach den Zahlen des DIW auf 46 Prozent, auf einen neuen Höchststand, geklettert. Aber heißt das tatsächlich, dass die wirtschaftliche Unabhängigkeit der Frauen, die Möglichkeit zur eigenständigen Existenzsicherung, gestiegen ist? Nein, das heißt es eben nicht; da trügt der Schein. Zwar stimmt, dass die Zahl der Frauen, die in Teilzeit arbeiten, ebenfalls gestiegen ist, von 2,5 Millionen im Jahr 2001 auf 6,3 Millionen im Jahr 2014; das ist eindeutig zu begrüßen. Aber es ist alarmierend - darum geht es hier -, dass trotz der höheren Zahl der beschäftigten Frauen der Anteil des von ihnen geleisteten Arbeitsvolumens seit 1991 nur um gut 4 Prozentpunkte gestiegen ist. Das heißt, dass zwar mehr Frauen arbeiten, aber weniger Stunden. Hieran, meine Damen und Herren, zeigt sich eines ganz klar: Es besteht weiterhin eine Unwucht im System, und zwar zuungunsten von Frauen.",data/txt/18091.txt,speech,gruene
2892794,91,18,0,,,,1448,Beifall beim BÜNDNIS 90/DIE GRÜNEN sowie bei Abgeordneten der SPD und der LINKEN,data/txt/18091.txt,poi,
2892795,91,18,0,Ulle Schauws (BÜNDNIS 90/DIE GRÜNEN),Ulle Schauws,ulle-schauws,1449,"Frauen arbeiten Teilzeit, aber nicht immer weil sie sich das so ausgesucht haben, sondern weil sie sonst Familie und Beruf nicht vereinbaren können. Sie sind immer noch diejenigen, die das Mehr an Familienarbeit leisten. Sie bezahlen dafür mit beruflichen und finanziellen Nachteilen bis hin zur Altersarmut. Auf der anderen Seite wollen inzwischen eben auch Männer beruflich kürzertreten und sich um die Familie kümmern; aber es gibt für die Männer kaum Möglichkeiten, das zu tun. Das Modell einer partnerschaftlichen Aufteilung leben in der Tat nur sehr wenige Paare.

Wir Grüne wünschen uns eine Gesellschaft, in der wir allen Eltern ermöglichen, sich um ihre Kinder zu kümmern und gleichzeitig ihrem Beruf nachzugehen, ohne existenzielle Nachteile - also echte Wahlfreiheit und Selbstbestimmung.",data/txt/18091.txt,speech,gruene
2892796,91,18,0,,,,1450,Beifall beim BÜNDNIS 90/DIE GRÜNEN sowie bei Abgeordneten der SPD,data/txt/18091.txt,poi,
2892797,91,18,0,Ulle Schauws (BÜNDNIS 90/DIE GRÜNEN),Ulle Schauws,ulle-schauws,1451,Hier würde Frauen genauso wie Männern ein Recht auf Rückkehr in Vollzeit entscheidend helfen.,data/txt/18091.txt,speech,gruene
2892798,91,18,0,Kerstin Griese [SPD],Kerstin Griese,kerstin-griese,1452,Deshalb machen wir es!,data/txt/18091.txt,poi,spd
2892799,91,18,0,Ulle Schauws (BÜNDNIS 90/DIE GRÜNEN),Ulle Schauws,ulle-schauws,1453,"Dann müssten die Männer nicht mehr befürchten, in der Teilzeitfalle hängen zu bleiben, die Frauen ebenso wenig.

Liebe Kolleginnen und Kollegen, Teilzeit hat eben auch Nebenwirkungen. Kurzfristig ermöglicht sie vielleicht eine bessere Vereinbarkeit von Beruf und Familie; langfristig allerdings können wir sehen, dass damit die Lohnschere auseinandergeht. Denn Teilzeit heißt: langfristig schlechtere Bezahlung, fast keine Aufstiegschancen und wenig Rente. Die Statistiken zeigen auch: Teilzeit wird schnell zur Sackgasse für Frauen, insbesondere bei den üblichen Modellen wie halben Stellen oder Minijobs. Eigenständige Existenzsicherung ist für Frauen so jedenfalls nicht möglich, insbesondere nicht für alleinerziehende. Deshalb sage ich: Es braucht mehr vollzeitnahe Teilzeit, orientiert an plus/minus 30 Stunden. Das wäre für Frauen und Männer attraktiv und eine echte Option.",data/txt/18091.txt,speech,gruene
2892800,91,18,0,,,,1454,Beifall beim BÜNDNIS 90/DIE GRÜNEN und bei der LINKEN sowie bei Abgeordneten der SPD,data/txt/18091.txt,poi,
2892801,91,18,0,Ulle Schauws (BÜNDNIS 90/DIE GRÜNEN),Ulle Schauws,ulle-schauws,1455,"Zum Problem der Teilzeit kommt noch eines hinzu - die Kollegin hat es gerade schon genannt -, nämlich das Problem der schlechteren Bezahlung. Das Gender Pay Gap von 22 Prozent ist für Frauen in Deutschland immer noch Realität, und das ist und bleibt schlicht ein Skandal.",data/txt/18091.txt,speech,gruene
2892802,91,18,0,,,,1456,Beifall beim BÜNDNIS 90/DIE GRÜNEN sowie bei Abgeordneten der LINKEN und der Abg. Elke Ferner [SPD],data/txt/18091.txt,poi,
2892803,91,18,0,Ulle Schauws (BÜNDNIS 90/DIE GRÜNEN),Ulle Schauws,ulle-schauws,1457,"Der Unterschied ist insbesondere deshalb so groß, weil die sogenannten Frauenberufe besonders schlecht bezahlt werden. Wer jetzt argumentiert, dass Frauen in den falschen Branchen wie dem Gesundheits- oder dem Sozialwesen arbeiten, dem sage ich: Gerade die Beschäftigung in diesen Branchen ist wichtig. Sie sollte angemessener bezahlt werden,",data/txt/18091.txt,speech,gruene
2892804,91,18,0,,,,1458,Beifall der Abg. Katja Dörner [BÜNDNIS 90/DIE GRÜNEN] und Kerstin Griese [SPD],data/txt/18091.txt,poi,
2892805,91,18,0,Ulle Schauws (BÜNDNIS 90/DIE GRÜNEN),Ulle Schauws,ulle-schauws,1459,"und das nicht zuletzt, damit die sogenannten Frauenberufe für Männer attraktiver werden. Dann brauchen wir auch nicht über eine Männerquote zu reden.",data/txt/18091.txt,speech,gruene
2892806,91,18,0,,,,1460,Beifall beim BÜNDNIS 90/DIE GRÜNEN und bei der LINKEN,data/txt/18091.txt,poi,
2892807,91,18,0,Ulle Schauws (BÜNDNIS 90/DIE GRÜNEN),Ulle Schauws,ulle-schauws,1461,"Liebe Kolleginnen und Kollegen, das DIW rechnet in Zukunft mit einer steigenden Erwerbsbeteiligung von Frauen; das ist gut. Es ist auch gut, das als Frauenpolitikerin zu hören. Aber wir müssen dafür sorgen, dass Frauen von ihrer Arbeit leben können, eine ausreichende Rente im Alter erhalten. Von der Bundesregierung erwarte ich deswegen Vorschläge für andere Arbeitszeitmodelle -",data/txt/18091.txt,speech,gruene
2892808,91,18,0,Kerstin Griese [SPD],Kerstin Griese,kerstin-griese,1462,Das machen wir doch!,data/txt/18091.txt,poi,spd
2892809,91,18,0,Ulle Schauws (BÜNDNIS 90/DIE GRÜNEN),Ulle Schauws,ulle-schauws,1463,"flexibler, familienfreundlicher und vollzeitnah. Kümmern Sie sich endlich um den Abbau der Erwerbshindernisse wie des Ehegattensplittings! Kümmern Sie sich um einen ambitionierten Ausbau der Kinderbetreuung und eine stärkere Unterstützung der Alleinerziehenden! Wir erwarten von Ihnen Lösungen und kein elendes Gezerre um eine Kindergelderhöhung um 6 oder 10 Euro.",data/txt/18091.txt,speech,gruene
2892810,91,18,0,,,,1464,Beifall beim BÜNDNIS 90/DIE GRÜNEN,data/txt/18091.txt,poi,
2892811,91,18,0,Ulle Schauws (BÜNDNIS 90/DIE GRÜNEN),Ulle Schauws,ulle-schauws,1465,"Uns Grünen kommt es auf die Rahmenbedingungen an, darauf, dass Wahlfreiheit und Selbstbestimmung hinsichtlich der Lebens- und Arbeitsform für alle, für Frauen wie Männer, eine Selbstverständlichkeit werden.

Vielen Dank.",data/txt/18091.txt,speech,gruene
2892812,91,18,0,,,,1466,Beifall beim BÜNDNIS 90/DIE GRÜNEN,data/txt/18091.txt,poi,
2892813,91,18,0,Ulle Schauws (BÜNDNIS 90/DIE GRÜNEN),Ulle Schauws,ulle-schauws,1467,,data/txt/18091.txt,speech,gruene
2892814,91,18,0,Vizepräsident Johannes Singhammer,Johannes Singhammer,johannes-singhammer,1468,Für die SPD spricht jetzt die Kollegin Elke Ferner.,data/txt/18091.txt,chair,
2892815,91,18,0,,,,1469,Beifall bei der SPD sowie bei Abgeordneten der CDU/CSU,data/txt/18091.txt,poi,
2892816,91,18,0,Vizepräsident Johannes Singhammer,Johannes Singhammer,johannes-singhammer,1470,,data/txt/18091.txt,chair,
2892817,91,18,0,Elke Ferner (SPD),Elke Ferner,elke-ferner,1471,"Herr Präsident! Liebe Kollegen und Kolleginnen! Die Arbeitsmarktzahlen sind der beste Indikator dafür, wie es um die Gleichstellung von Frauen und Männern in unserer Gesellschaft bestellt ist. Die Zahlen sind, ehrlich gesagt, ernüchternd. Ich finde nicht - das möchte ich ausdrücklich sagen -, dass das irgendwie alleine Sache der Frauen ist, weil sie so viel Teilzeit arbeiten wollen; denn die Situation hat strukturelle Ursachen, und an diese Ursachen müssen wir ran.",data/txt/18091.txt,speech,spd
2892818,91,18,0,,,,1472,Beifall bei der SPD sowie bei Abgeordneten der LINKEN und des BÜNDNISSES 90/DIE GRÜNEN,data/txt/18091.txt,poi,
2892819,91,18,0,Elke Ferner (SPD),Elke Ferner,elke-ferner,1473,"Mittlerweile liegt der Teilzeitanteil bei den erwerbstätigen Frauen bei über 50 Prozent, das heißt, mehr als die Hälfte aller erwerbstätigen Frauen hat meist kein eigenständiges, existenzsicherndes Einkommen. Häufig sind sie auf das Zusatzeinkommen des Partners angewiesen. Das hat zur Folge, dass Lohnersatzleistungen in der Regel nicht existenzsichernd sind, und das hat vor allen Dingen zur Folge, dass im Alter die eigene Rente nicht zum Leben ausreicht. Das darf man nicht einfach so -hinnehmen. Wir müssen diese Spaltung auf dem Arbeitsmarkt überwinden. Wir müssen den Wunsch der Beschäftigten und die Wirklichkeit zusammenführen.",data/txt/18091.txt,speech,spd
2892820,91,18,0,,,,1474,Beifall bei der SPD sowie bei Abgeordneten des BÜNDNISSES 90/DIE GRÜNEN,data/txt/18091.txt,poi,
2892821,91,18,0,Elke Ferner (SPD),Elke Ferner,elke-ferner,1475,"Es ist mitnichten so, Frau Kollegin Freudenstein, dass Frauen, die in Teilzeit arbeiten, genau die Arbeitszeit haben, die sie wollen. Aus den Zeitstudien und aus anderen Untersuchungen wissen wir, dass die teilzeitbeschäftigten Frauen ihre Arbeitszeit eigentlich Richtung vollzeitnahe Erwerbstätigkeit aufstocken wollen, also 30 Stunden plus ein bisschen und nicht 20 Stunden und ein bisschen weniger.

Wir wissen, dass auch die jungen Väter ihre Arbeitszeit reduzieren wollen. 60 Prozent der jungen Paare möchten gerne partnerschaftlich für die Familie, für Kinder und für pflegebedürftige Angehörige, da sein. Gleichzeitig möchten sie nicht darauf verzichten, ihrem Job nachzugehen und Karriere zu machen. Aber dieser Wunsch geht mit der Wirklichkeit nicht zusammen. Deshalb ist es ein bisschen billig, zu sagen: Die Frauen wollen das. Ich sage: Nein, die meisten Frauen wollen das eben nicht!",data/txt/18091.txt,speech,spd
2892822,91,18,0,,,,1476,Beifall bei der SPD sowie bei Abgeordneten der LINKEN und des BÜNDNISSES 90/DIE GRÜNEN,data/txt/18091.txt,poi,
2892823,91,18,0,Elke Ferner (SPD),Elke Ferner,elke-ferner,1477,"Wir brauchen Verbesserungen in diesem Bereich. Deshalb haben wir bereits in dieser Wahlperiode Verbesserungen eingeleitet. Mit dem Elterngeld Plus haben wir das Elterngeld um Partnerschaftlichkeitskomponenten erweitert. Wir haben bei der Familienpflegezeit und bei der Pflegezeit deutliche Verbesserungen für die Vereinbarkeit von Familie und Pflege getroffen.

Was jetzt noch fehlt, das sind weitere Schritte hin zu einer echten Familienarbeitszeit.",data/txt/18091.txt,speech,spd
2892824,91,18,0,,,,1478,Beifall bei der SPD sowie bei Abgeordneten der CDU/CSU,data/txt/18091.txt,poi,
2892825,91,18,0,Elke Ferner (SPD),Elke Ferner,elke-ferner,1479,"Als Manuela Schwesig diesen Vorschlag letztes Jahr in die Debatte eingebracht hat, ist er in Teilen belächelt worden, aber mittlerweile sind Arbeitgeberverbände, Gewerkschaften usw. an ihrer Seite. Wir als SPD-Fraktion werden weiter für eine Familienarbeitszeit kämpfen, die es Männern wie Frauen ermöglicht, ihre Arbeitszeit aufgrund familiärer Verpflichtungen zu reduzieren und gleichzeitig ihrem Job nachgehen zu können und keine Karriereeinbußen und keine finanziellen Einbußen hinnehmen zu müssen, nur weil man - oder besser gesagt: „frau“ - Teilzeit arbeitet.",data/txt/18091.txt,speech,spd
