id,sitzung,wahlperiode,in_writing,speaker,speaker_cleaned,speaker_fp,sequence,text,filename,type,speaker_party
2891945,91,18,0,Vizepräsident Peter Hintze,Peter Hintze,peter-hintze,599,"Wir kommen nun zur Abstimmung über den Entschließungsantrag der Fraktion Bündnis 90/Die Grünen auf Drucksache 18/4226. Wer stimmt für diesen Entschließungsantrag von Bündnis 90/Die Grünen? - Wer stimmt dagegen? - Wer enthält sich? - Der Entschließungsantrag ist mit den Stimmen der CDU/CSU-Fraktion und der SPD-Fraktion bei Enthaltung der Fraktion Die Linke und Zustimmung der Fraktion Bündnis 90/Die Grünen abgelehnt.

Wir kommen nun zum Tagesordnungspunkt 4 b. Beschlussempfehlung des Ausschusses für Umwelt, Naturschutz, Bau und Reaktorsicherheit zu dem Antrag der Fraktion Die Linke mit dem Titel „Mietenanstieg stoppen, soziale Wohnungswirtschaft entwickeln und dauerhaft sichern“. Der Ausschuss empfiehlt in seiner Beschlussempfehlung auf Drucksache 18/4219, den Antrag der Fraktion Die Linke auf Drucksache 18/504 abzulehnen. Wer stimmt für die Beschlussempfehlung? - Wer stimmt dagegen? - Wer enthält sich? - Die Beschlussempfehlung ist mit den Stimmen der CDU/CSU-Fraktion und der SPD-Fraktion bei Enthaltung der Fraktion Bündnis 90/Die Grünen und Gegenstimmen der Fraktion Die Linke angenommen.

Ich rufe nun den Tagesordnungspunkt 5 auf:

Beratung des Antrags der Abgeordneten Klaus Ernst, Jutta Krellmann, Susanna Karawanskij, weiterer Abgeordneter und der Fraktion DIE LINKE

Mindestlohn sichern - Umgehungen verhindern

Drucksache 18/4183

Überweisungsvorschlag:

Ausschuss für Arbeit und Soziales (f)

Finanzausschuss

Ausschuss für Wirtschaft und Energie

Nach einer interfraktionellen Vereinbarung sind für die Aussprache 60 Minuten vorgesehen. Gibt es dazu Widerspruch? - Ich sehe keinen Widerspruch. Dann ist so beschlossen.

Ich eröffne die Aussprache. Als erstem Redner erteile ich das Wort dem Abgeordneten Klaus Ernst, Fraktion Die Linke.",data/txt/18091.txt,chair,
2891946,91,18,0,,,,600,Beifall bei der LINKEN,data/txt/18091.txt,poi,
2891947,91,18,0,Vizepräsident Peter Hintze,Peter Hintze,peter-hintze,601,,data/txt/18091.txt,chair,
2891948,91,18,0,Klaus Ernst (DIE LINKE),Klaus Ernst,klaus-ernst,602,"Herr Präsident! Meine sehr verehrten Damen und Herren! Dass sich gerade einige von der CDU vom Acker machen, ist symptomatisch für dieses Thema. Ich habe den Eindruck: Das gilt auch für das, was Sie selbst im Parlament beschlossen haben. Es war ein unheimliches Gewürge, bis dieser Mindestlohn zustande kam. Es hat fast ein Jahrzehnt gedauert, ein Jahrzehnt, in dem Sie für die niedrigsten Löhne in dieser Republik mitverantwortlich waren. Jetzt haben Sie ein Gesetz gemacht. Ich sage Ihnen: Getraut habe ich Ihnen bei diesem Thema nie. Aber was wir jetzt erleben, ist schon ein seltener Vorgang. Sie haben all dem zugestimmt, was jetzt Gesetz ist, sabotieren aber nun den Mindestlohn und demontieren die Ministerin, die dafür verantwortlich ist. Das ist ein unglaublicher Vorgang.",data/txt/18091.txt,speech,linke
2891949,91,18,0,,,,603,Beifall bei der LINKEN,data/txt/18091.txt,poi,
2891950,91,18,0,Klaus Ernst (DIE LINKE),Klaus Ernst,klaus-ernst,604,"Mit Ihnen als Koalitionspartner braucht man wirklich keine Feinde mehr. Sie behaupten, das sei ein bürokratisches Monster, weil Arbeitszeiten erfasst werden müssen. Das muss man sich auf der Zunge zergehen lassen: Weil Arbeitszeiten erfasst werden, handelt es sich hierbei um ein bürokratisches Monster. Wie soll denn eine Abrechnung auf Stundenlohnbasis überhaupt sinnvoll stattfinden, wenn die Arbeitszeit nicht erfasst wird? Wie soll das gehen? Wenn die Aufzeichnungspflicht im Zusammenhang mit Arbeitszeiten nicht eingehalten wird, ist ein Mindestlohn nicht kontrollierbar. Offensichtlich ist das Ihr Interesse. Das soll natürlich nur bei Löhnen gelten.

Stellen Sie sich einmal vor, Sie fahren mit dem Auto zur Tankstelle, aber es wird nicht erfasst, wie viele Liter Sie in den Tank hineinschütten. Jeder wird sagen: Das ist blanker Unsinn. - Zu meinen bayerischen Freunden: Wenn Sie im Biergarten ein paar Maß Bier trinken, aber die Kellnerin nicht erfasst, wie viel Bier Sie getrunken haben, ist eine Abrechnung nicht möglich.",data/txt/18091.txt,speech,linke
2891951,91,18,0,,,,605,"Beifall bei der LINKEN, der SPD und dem BÜNDNIS 90/DIE GRÜNEN",data/txt/18091.txt,poi,
2891952,91,18,0,Klaus Ernst (DIE LINKE),Klaus Ernst,klaus-ernst,606,"Ich habe den Eindruck: Ihre Kampagne gegen den Mindestlohn haben Sie nach fünf Maß Bier gemacht, so ein Unfug ist das.",data/txt/18091.txt,speech,linke
2891953,91,18,0,,,,607,Beifall bei der LINKEN und dem BÜNDNIS 90/DIE GRÜNEN,data/txt/18091.txt,poi,
2891954,91,18,0,Klaus Ernst (DIE LINKE),Klaus Ernst,klaus-ernst,608,"Zum Thema Bürokratiemonster: Die Deutsche Zoll- und Finanzgewerkschaft - ich weiß nicht, ob Sie wissen, wer das ist; das sind die, die kontrollieren sollen, was wir hier an Gesetzen machen - sagt: Ausnahmeregelungen erzeugen die Bürokratie. - Ich möchte gleich noch aus dem Magazin dieser Gewerkschaft zitieren. Ihr Vorsitzender Dewes hatte bei der Anhörung zum Mindestlohn im Jahre 2014 gesagt, je mehr Ausnahmen das Mindestlohngesetz vorsehe, desto aufwendiger werde die Kontrolle. Wenn Sie jetzt bürokratischen Unfug kritisieren, dann müssten Sie Ihre Ausnahmeregelungen kritisieren. Sie sind für die schwierige Kontrolle bei diesem Thema verantwortlich.",data/txt/18091.txt,speech,linke
2891955,91,18,0,,,,609,Beifall bei der LINKEN und dem BÜNDNIS 90/DIE GRÜNEN,data/txt/18091.txt,poi,
2891956,91,18,0,Klaus Ernst (DIE LINKE),Klaus Ernst,klaus-ernst,610,"Für die Kontrolleure sind die Ausnahmeregelungen nicht nachvollziehbar. Ich möchte aus dem Magazin des BDZ zitieren:

Für den BDZ war und ist es dabei nicht nachvollziehbar, warum für mobile Tätigkeiten ohne sachliche Begründung Ausnahmetatbestände geschaffen wurden. Besonders in den für Schwarzarbeit anfälligen Branchen wie dem Transport- oder Taxigewerbe ist es für wirksame Kontrollen entscheidend, Beginn, Ende und Dauer der täglichen Arbeitszeit festzuhalten.

So weit die Kontrolleure.

Wenn Sie diese Dokumentationspflichten aufweichen wollen, dann stellen Sie sich vor diejenigen, die an diesem Gesetz nicht interessiert sind und sich auch nicht um die Einhaltung dieses Gesetzes kümmern. Sie stellen sich vor diejenigen, die in dieser Frage ein höchstes Maß an krimineller Energie haben.",data/txt/18091.txt,speech,linke
2891957,91,18,0,,,,611,Beifall bei der LINKEN,data/txt/18091.txt,poi,
2891958,91,18,0,Klaus Ernst (DIE LINKE),Klaus Ernst,klaus-ernst,612,"Im Übrigen wissen Sie selber, dass eine Reihe dessen, was Sie kritisieren, schon lange gilt. Arbeitszeiten müssen in vielen Bereichen schon immer erfasst werden. Wie wollen Sie überhaupt Überstunden erfassen, wenn Sie nicht wissen, was die Regelarbeitszeit ist? Wie wollen Sie das machen? Das ist vollkommener Unsinn.

Der zweite Akt der Sabotage ist das, was Sie mit dem Personal machen. Die Zuständigen sagen: Wir brauchen 2 500 zusätzliche Personalstellen. - Sie machen in dieser Frage viel zu wenig. Wir wissen, dass in diesem Bereich viel Personal fehlt. Am deutlichsten wird Ihre Haltung am Beispiel des sehr geschätzten Michael Fuchs; er ist leider heute nicht da. Es tut mir wirklich leid, dass er jetzt nicht mitkriegt, wie ich zitiere, was er selber gesagt hat. Wissen Sie, was Herr Fuchs gesagt hat? Ich habe es kaum glauben können. Er hat gesagt:

Überall fehlen Polizisten. Aber wir stellen jetzt 1 600 Zöllner ein, um den Unternehmen … auf die Finger zu schauen. Das versteht doch kein Mensch!

Was glauben Sie eigentlich, was die in der Finanzkontrolle Schwarzarbeit Tätigen über so etwas denken? Das ist ihre Arbeit. Sie haben doch den Eindruck, dass die Politik überhaupt nicht daran interessiert ist, dass kontrolliert wird, wenn solche Aussagen von einem stellvertretenden Vorsitzenden der CDU/CSU-Fraktion kommen. Er sollte sich schämen und sich bei den Damen und Herren für den Unsinn, den er erzählt hat, entschuldigen.",data/txt/18091.txt,speech,linke
2891959,91,18,0,,,,613,Beifall bei der LINKEN sowie bei Abgeordneten des BÜNDNISSES 90/DIE GRÜNEN,data/txt/18091.txt,poi,
2891960,91,18,0,Klaus Ernst (DIE LINKE),Klaus Ernst,klaus-ernst,614,"Es geht hier nicht um ein Bürokratiemonster, sondern es geht um die Existenzgrundlage von Menschen, die von diesem Lohn leben müssen. Notwendig sind nicht weniger Kontrollen, sondern mehr Überprüfung und weniger Ausnahmeregelungen, so wie wir es in unserem Antrag fordern.

Ich danke Ihnen fürs Zuhören.",data/txt/18091.txt,speech,linke
2891961,91,18,0,,,,615,Beifall bei der LINKEN sowie bei Abgeordneten des BÜNDNISSES 90/DIE GRÜNEN und des Abg. Bernd Rützel [SPD],data/txt/18091.txt,poi,
2891962,91,18,0,Klaus Ernst (DIE LINKE),Klaus Ernst,klaus-ernst,616,,data/txt/18091.txt,speech,linke
2891963,91,18,0,Vizepräsident Peter Hintze,Peter Hintze,peter-hintze,617,"Als nächstem Redner erteile ich das Wort dem Abgeordneten Professor Dr. Matthias Zimmer, CDU/CSU-Fraktion.",data/txt/18091.txt,chair,
2891964,91,18,0,,,,618,Beifall bei der CDU/CSU sowie bei Abgeordneten der SPD,data/txt/18091.txt,poi,
2891965,91,18,0,Vizepräsident Peter Hintze,Peter Hintze,peter-hintze,619,,data/txt/18091.txt,chair,
2891966,91,18,0,Dr. Matthias Zimmer (CDU/CSU),Dr. Matthias Zimmer,matthias-zimmer,620,"Herr Präsident! Meine Damen und Herren! Die Hoffnung des letzten Sommers, dass wir uns parlamentarisch zum letzten Mal mit dem Mindestlohn beschäftigen müssen, hat offensichtlich getrogen.",data/txt/18091.txt,speech,cducsu
2891967,91,18,0,Brigitte Pothmer [BÜNDNIS 90/DIE GRÜNEN],Brigitte Pothmer,brigitte-pothmer,621,Das liegt an Ihnen!,data/txt/18091.txt,poi,gruene
2891968,91,18,0,Dr. Matthias Zimmer (CDU/CSU),Dr. Matthias Zimmer,matthias-zimmer,622,"Zumindest kann man den Antrag der Linken jetzt zum Anlass nehmen, auf das eine oder andere hinzuweisen, das in der Debatte der letzten Wochen und Monate eine Rolle gespielt hat. Ich will das in zehn Punkten tun.

Erster Punkt. Der Mindestlohn gilt seit dem 1. Januar 2015. Das ist auch gut so. Wir hören gleichzeitig, dass sich der positive Trend auf dem Arbeitsmarkt weiter fortsetzt.",data/txt/18091.txt,speech,cducsu
2891969,91,18,0,,,,623,"Beifall bei Abgeordneten der CDU/CSU, der SPD und des BÜNDNISSES 90/DIE GRÜNEN",data/txt/18091.txt,poi,
2891970,91,18,0,Dr. Matthias Zimmer (CDU/CSU),Dr. Matthias Zimmer,matthias-zimmer,624,"Das hatten einige Ökonomen anders vorhergesagt und von bis zu 1,2 Millionen mehr Arbeitslosen gesprochen. Ich weiß nicht, ob das schlechte Ökonomie oder nur besonderes Pech beim Nachdenken war.",data/txt/18091.txt,speech,cducsu
2891971,91,18,0,,,,625,Beifall bei Abgeordneten der SPD und des BÜNDNISSES 90/DIE GRÜNEN,data/txt/18091.txt,poi,
2891972,91,18,0,Brigitte Pothmer [BÜNDNIS 90/DIE GRÜNEN],Brigitte Pothmer,brigitte-pothmer,626,Das war Voodoo-Ökonomie!,data/txt/18091.txt,poi,gruene
2891973,91,18,0,Dr. Matthias Zimmer (CDU/CSU),Dr. Matthias Zimmer,matthias-zimmer,627,"Aber es fällt schon auf: Das kommt immer aus der gleichen Ecke.

Zweiter Punkt. Es hat in den letzten Wochen einige Debatten über die Verordnung der Ministerin gegeben. Das eine oder andere kann man an dieser Stelle vielleicht richtigstellen. Der Mindestlohn ist ja mit überwältigend großer Mehrheit hier im Deutschen Bundestag angenommen worden.",data/txt/18091.txt,speech,cducsu
2891974,91,18,0,Kerstin Griese [SPD],Kerstin Griese,kerstin-griese,628,Nur von euch nicht!,data/txt/18091.txt,poi,spd
2891975,91,18,0,Dr. Matthias Zimmer (CDU/CSU),Dr. Matthias Zimmer,matthias-zimmer,629,"Die Verordnung der Ministerin schränkt den Geltungsbereich des Mindestlohns ein, sie weitet ihn nicht aus;",data/txt/18091.txt,speech,cducsu
2891976,91,18,0,,,,630,Beifall bei Abgeordneten der SPD,data/txt/18091.txt,poi,
2891977,91,18,0,Dr. Matthias Zimmer (CDU/CSU),Dr. Matthias Zimmer,matthias-zimmer,631,"ich finde, das kann man an dieser Stelle richtigstellen. Man kann die Verordnung streichen. Aber dann würde sich die Überprüfung als problematisch erweisen, weil sehr viel mehr Arbeitsverhältnisse von einer Überprüfung betroffen wären. Wir wollen aber die Problembereiche in den Fokus nehmen. Das leistet zunächst einmal die Verordnung der Ministerin.

Dritter Punkt. Man hört, das Mindestlohngesetz sei ein Bürokratiemonster.",data/txt/18091.txt,speech,cducsu
2891978,91,18,0,Brigitte Pothmer [BÜNDNIS 90/DIE GRÜNEN],Brigitte Pothmer,brigitte-pothmer,632,"Ja, von wem hört man das denn? Können Sie nicht mal Ross und Reiter nennen?",data/txt/18091.txt,poi,gruene
2891979,91,18,0,Dr. Matthias Zimmer (CDU/CSU),Dr. Matthias Zimmer,matthias-zimmer,633,"Richtig ist: Beginn, Ende und Dauer der täglichen Arbeitszeit müssen erfasst werden. Das ist pragmatisch, schnell und unproblematisch.",data/txt/18091.txt,speech,cducsu
2891980,91,18,0,Kerstin Griese [SPD],Kerstin Griese,kerstin-griese,634,"Ja, genau!",data/txt/18091.txt,poi,spd
2891981,91,18,0,Dr. Matthias Zimmer (CDU/CSU),Dr. Matthias Zimmer,matthias-zimmer,635,"Monster, meine Damen und Herren, sehen anders aus.",data/txt/18091.txt,speech,cducsu
2891982,91,18,0,,,,636,Beifall bei Abgeordneten der SPD und der LINKEN,data/txt/18091.txt,poi,
2891983,91,18,0,Dr. Matthias Zimmer (CDU/CSU),Dr. Matthias Zimmer,matthias-zimmer,637,"Oder - um es deutlich zu sagen -: Um ein solches Monster zu erlegen, braucht man keinen Wolf Biermann. Es reicht schon der kleine Bruder des heiligen Georg.",data/txt/18091.txt,speech,cducsu
2891984,91,18,0,,,,638,Beifall der Abg. Daniela Kolbe [SPD],data/txt/18091.txt,poi,
2891985,91,18,0,Dr. Matthias Zimmer (CDU/CSU),Dr. Matthias Zimmer,matthias-zimmer,639,"Ich glaube, durch die permanente Verwendung von Superlativen verdirbt man sich die Preise.",data/txt/18091.txt,speech,cducsu
2891986,91,18,0,,,,640,Beifall bei der SPD sowie bei Abgeordneten der LINKEN und des BÜNDNISSES 90/DIE GRÜNEN und des Abg. Karl Schiewerling [CDU/CSU],data/txt/18091.txt,poi,
2891987,91,18,0,Dr. Matthias Zimmer (CDU/CSU),Dr. Matthias Zimmer,matthias-zimmer,641,"Vierter Punkt. Ich höre, es ist die Summe der Vorschriften, die die Wirtschaft belastet. Das mag sein. Der Chef der Arbeitsagentur Weise hat darauf hingewiesen - ich zitiere -:

Bürokratisch heißt auch rechtsstaatlich. …",data/txt/18091.txt,speech,cducsu
2891988,91,18,0,Klaus Ernst [DIE LINKE],Klaus Ernst,klaus-ernst,642,Richtig!,data/txt/18091.txt,poi,linke
2891989,91,18,0,Dr. Matthias Zimmer (CDU/CSU),Dr. Matthias Zimmer,matthias-zimmer,643,"Es ist für die Wettbewerbsfähigkeit von Unternehmen sehr wichtig, dass man klare Regeln hat.

Ich glaube, im Wettbewerb ist ein zusätzliches Stück Berechenbarkeit entstanden. Das finde ich in Ordnung.

Fünfter Punkt. Wir wissen um die Befindlichkeit von kleinen und mittelständischen Unternehmen. Sie sind auch durch die dauernden Mahnungen des DGB, dass bis zu 500 000 Euro Bußgeld verhängt werden können, aufgeschreckt worden. Das ist bei groben Verstößen durchaus gerechtfertigt. Aber man muss auch deutlich sagen: Die Unternehmen sind weder zu doof noch zu kriminell.",data/txt/18091.txt,speech,cducsu
2891990,91,18,0,,,,644,Beifall bei Abgeordneten der CDU/CSU,data/txt/18091.txt,poi,
2891991,91,18,0,Peter Weiß [Emmendingen] [CDU/CSU],Peter Weiß,peter-weiß,645,Genau! Das sind ja keine Gauner!,data/txt/18091.txt,poi,cducsu
2891992,91,18,0,Dr. Matthias Zimmer (CDU/CSU),Dr. Matthias Zimmer,matthias-zimmer,646,"Ich glaube, viele sind durch unterschiedliche, zum Teil dubiose Auskünfte von berufener oder unberufener Seite eher verunsichert. Deswegen ist es gut, dass sich der Zoll zunächst einmal auch als Unterstützer dieser Unternehmen versteht, dass er diese Unternehmen berät und wir nicht sofort mit der Keule der Strafe vorgehen, wenn noch Rechtsunsicherheit herrscht. Ich glaube, das ist auch im Sinne dieses Gesetzes.",data/txt/18091.txt,speech,cducsu
2891993,91,18,0,,,,647,Beifall bei der CDU/CSU,data/txt/18091.txt,poi,
2891994,91,18,0,Dr. Matthias Zimmer (CDU/CSU),Dr. Matthias Zimmer,matthias-zimmer,648,"Sechster Punkt. Wir haben immer gesagt, der Mindestlohn soll praxistauglich sein. Er soll auch zielscharf sein. Ich begrüße ausdrücklich die Initiative des Parlamentskreises Mittelstand - wir haben sie übernommen -, dass man durchaus noch einmal darüber nachdenken sollte, ob man die Dokumentation der täglichen Arbeitszeiten - das ist der einzige Punkt, in dem ich Ihnen wirklich recht gebe, Herr Kollege Ernst; er ist natürlich wichtig - nicht anders leisten kann, und zwar entweder dadurch, dass sie vertraglich festgelegt sind und man lediglich Abweichungen notiert, wie es heute schon üblich ist, oder dadurch, dass es Einsatzpläne gibt, aus denen ganz genau hervorgeht, wie die Arbeitszeit gestaltet ist. Ich glaube, für die Kontrollzwecke des Zolls reicht das völlig aus. Daher sollte es auch für unsere Zwecke im Hinblick auf den Mindestlohn genügen.",data/txt/18091.txt,speech,cducsu
2891995,91,18,0,,,,649,Beifall bei Abgeordneten der CDU/CSU und der SPD,data/txt/18091.txt,poi,
2891996,91,18,0,Dr. Matthias Zimmer (CDU/CSU),Dr. Matthias Zimmer,matthias-zimmer,650,"Siebter Punkt. An der einen oder anderen Stelle gibt es sicherlich Abgrenzungsprobleme. Wir haben im Ausschussbericht festgehalten: Wir wollen, dass der Mindestlohn für Sport und Ehrenamt nicht gilt, nämlich dort, wo nicht der Gelderwerb im Mittelpunkt steht, sondern das Ehrenamt. Ich begrüße ausdrücklich, dass die Ministerin an dieser Stelle mit dem Deutschen Fußballbund und dem Deutschen Olympischen Sportbund zu einer Regelung gekommen ist. Ich glaube, wir müssen an der einen oder anderen Stelle noch einmal überlegen, wie wir eine trennscharfe Abgrenzung zum Ehrenamt hinbekommen können. Denn eines wollen wir ja nicht: Wir wollen mit dem Mindestlohn nicht das Ehrenamt kaputtmachen. Ich glaube, das liegt in niemandes Interesse.

Achter Punkt. Wir wollen bei alldem natürlich Acht geben, dass der Mindestlohn und die zugrundeliegende Intention nicht unterlaufen werden. Wir wollen einen robusten Mindestlohn. Wir wollen auch einen Mindestlohn, der den wirtschaftlichen Gepflogenheiten und der wirtschaftlichen Realität Rechnung trägt.

Deswegen hat es mich, ehrlich gesagt, schon ein bisschen erstaunt, dass der Vorsitzende der Mindestlohnkommission gesagt hat: Den Mindestlohn legen wir nachlaufend zu Tarifentwicklungen fest. - Das haben wir ausdrücklich so nicht gewollt. Ich denke, darauf muss man Herrn Voscherau in aller Deutlichkeit hinweisen.",data/txt/18091.txt,speech,cducsu
2891997,91,18,0,,,,651,Beifall bei der CDU/CSU,data/txt/18091.txt,poi,
2891998,91,18,0,Dr. Matthias Zimmer (CDU/CSU),Dr. Matthias Zimmer,matthias-zimmer,652,"Neunter Punkt. Heribert Prantl hat gesagt, der Mindestlohn zähle zu den größten sozialpolitischen Errungenschaften in der Nachkriegszeit. Eine so große Münze würde ich vielleicht nicht nehmen.",data/txt/18091.txt,speech,cducsu
2891999,91,18,0,Zuruf von der LINKEN,von der LINKEN,von-der-linken,653,Oh doch!,data/txt/18091.txt,poi,linke
2892000,91,18,0,Zurufe von der SPD,e von der SPD,e-spd,654,Doch!,data/txt/18091.txt,poi,spd
2892001,91,18,0,,,,655,Heiterkeit bei der SPD,data/txt/18091.txt,poi,
2892002,91,18,0,Dr. Matthias Zimmer (CDU/CSU),Dr. Matthias Zimmer,matthias-zimmer,656,"- Ich finde es schön, dass Sie sich damit schon zufrieden geben.",data/txt/18091.txt,speech,cducsu
2892003,91,18,0,Matthias W. Birkwald [DIE LINKE],Matthias W. Birkwald,matthias-birkwald,657,"Nein, nein, nein! 10 Euro!",data/txt/18091.txt,poi,linke
2892004,91,18,0,Dr. Matthias Zimmer (CDU/CSU),Dr. Matthias Zimmer,matthias-zimmer,658,"Ich könnte einige größere sozialpolitische Errungenschaften nennen, die alle von der Union initiiert wurden. Aber gut.

Der Mindestlohn ist ein lernendes System. Wir haben nie gesagt, dass all das, was wir jetzt in das Gesetz -hineingeschrieben haben, in Stein gemeißelt ist, oder dass die Verordnung in Stein gemeißelt ist und die Regelungen somit für alle Ewigkeiten gelten.",data/txt/18091.txt,speech,cducsu
2892005,91,18,0,Jutta Krellmann [DIE LINKE],Jutta Krellmann,jutta-krellmann,659,Mit der heißen Nadel gestrickt!,data/txt/18091.txt,poi,linke
2892006,91,18,0,Dr. Matthias Zimmer (CDU/CSU),Dr. Matthias Zimmer,matthias-zimmer,660,"Deswegen ist es gut, dass wir uns das eine oder andere nach Ostern noch einmal genauer anschauen und auf die Praxistauglichkeit hin untersuchen.

Damit komme ich zum zehnten Punkt. Wenn wir sagen, dass wir das auf die Praxistauglichkeit hin untersuchen wollen, ist damit der Grund angegeben, lieber Kollege Ernst, warum wir Ihren Antrag ablehnen wollen und werden. Ihr Antrag entwirft nämlich ein Bild von einem rigiden, starren und wenig praktikablen Mindestlohn. Ich bin froh, dass diese Koalition das nicht so gemacht hat, sich stattdessen an den Lebensumständen orientiert und die Prinzipien nicht über die Lebenswirklichkeit stellt.

Herzlichen Dank.",data/txt/18091.txt,speech,cducsu
2892007,91,18,0,,,,661,Beifall bei der CDU/CSU und der SPD,data/txt/18091.txt,poi,
2892008,91,18,0,Dr. Matthias Zimmer (CDU/CSU),Dr. Matthias Zimmer,matthias-zimmer,662,,data/txt/18091.txt,speech,cducsu
2892009,91,18,0,Vizepräsident Peter Hintze,Peter Hintze,peter-hintze,663,"Als nächster Rednerin erteile ich das Wort der Abgeordneten Brigitte Pothmer, Fraktion Bündnis 90/Die Grünen.",data/txt/18091.txt,chair,
2892010,91,18,0,Brigitte Pothmer (BÜNDNIS 90/DIE GRÜNEN),Brigitte Pothmer,brigitte-pothmer,664,"Herr Präsident! Meine Damen und Herren! Lieber Herr Zimmer, das war jetzt eine Rede an Ihre eigene Fraktion.",data/txt/18091.txt,speech,gruene
2892011,91,18,0,,,,665,Beifall beim BÜNDNIS 90/DIE GRÜNEN und bei der LINKEN,data/txt/18091.txt,poi,
2892012,91,18,0,Brigitte Pothmer (BÜNDNIS 90/DIE GRÜNEN),Brigitte Pothmer,brigitte-pothmer,666,"In den letzten Wochen habe ich nicht den Eindruck gewonnen, dass Ihre Kollegen, die vor den Mikrofonen auftreten, mit Argumenten zu überzeugen sind. Dabei geht es in dieser Auseinandersetzung doch gar nicht um die Frage, ob man bei einem Projekt dieser Größenordnung vielleicht an der einen oder anderen Stelle auch nachbessern muss. Nur, ich kann Ihnen sagen: Ihr Arbeitgeberflügel hat die Rolle des ehrlichen Sachwalters bei dieser Aufgabe vollkommen verspielt.",data/txt/18091.txt,speech,gruene
2892013,91,18,0,,,,667,Beifall beim BÜNDNIS 90/DIE GRÜNEN und bei der LINKEN sowie bei Abgeordneten der SPD,data/txt/18091.txt,poi,
2892014,91,18,0,Brigitte Pothmer (BÜNDNIS 90/DIE GRÜNEN),Brigitte Pothmer,brigitte-pothmer,668,"Wer sich mit Schlag Neujahr, noch bevor das Silvesterfeuerwerk verdampft ist, hinstellt und schon sagt, die Aufzeichnungspflicht sei ein bürokratisches Monster und müsse weg, der ist nicht seriös.

Dann frage ich im Übrigen auch: Wie kommt das eigentlich? Sie haben das doch selbst beschlossen. Das Regelwerk zu diesem Mindestlohn ist Ihr Regelwerk, und zwar inklusive der Dokumentationspflicht.

Ich will Ihnen mal was sagen: Das, was Sie hier aufführen, ist wirklich ein durchsichtiges Schmierentheater. Hier im Parlament reden die weichgespülten Sozialpolitiker, und vor den Mikrofonen treten die Falken auf und vertreten ihre Position. Warum spricht heute nicht Herr Linnemann? Herr Linnemann, melden Sie sich zu Wort!",data/txt/18091.txt,speech,gruene
2892015,91,18,0,,,,669,Beifall beim BÜNDNIS 90/DIE GRÜNEN und bei der LINKEN,data/txt/18091.txt,poi,
2892016,91,18,0,Brigitte Pothmer (BÜNDNIS 90/DIE GRÜNEN),Brigitte Pothmer,brigitte-pothmer,670,"Wo ist Herr von Stetten? Wo ist Herr Fuchs? Kämpfen Sie doch einmal mit offenem Visier, und lesen nicht nebenbei den Pressespiegel, während hier die Auseinandersetzung läuft!",data/txt/18091.txt,speech,gruene
2892017,91,18,0,,,,671,Beifall beim BÜNDNIS 90/DIE GRÜNEN und bei der LINKEN,data/txt/18091.txt,poi,
2892018,91,18,0,Brigitte Pothmer (BÜNDNIS 90/DIE GRÜNEN),Brigitte Pothmer,brigitte-pothmer,672,"Ihnen geht es um etwas ganz anderes: Sie instrumentalisieren die Dokumentationspflicht, um den Mindestlohn auszuhebeln. Sie gehen vor nach dem Motto: Wenn wir schon einen Stundenlohn von 8,50 Euro akzeptieren mussten, dann werden wir bestimmen, wie lange eine Stunde dauert. - Nur, dann ist das kein Mindestlohn mehr. So geht das gar nicht.",data/txt/18091.txt,speech,gruene
2892019,91,18,0,,,,673,Beifall beim BÜNDNIS 90/DIE GRÜNEN und bei der LINKEN,data/txt/18091.txt,poi,
2892020,91,18,0,Brigitte Pothmer (BÜNDNIS 90/DIE GRÜNEN),Brigitte Pothmer,brigitte-pothmer,674,"Der Versuch, die Minijobs komplett aus der Dokumentationspflicht herauszunehmen, führt tatsächlich dazu, dass Sie die Minijobs zur mindestlohnfreien Zone machen. Das ist genau der Bereich, von dem wir genau wissen, dass dort ganz schön „gechincht“ wird und Arbeitnehmerrechte nicht durchgesetzt werden.",data/txt/18091.txt,speech,gruene
2892021,91,18,0,Dr. Matthias Zimmer [CDU/CSU],Dr. Matthias Zimmer,matthias-zimmer,675,Was?,data/txt/18091.txt,poi,cducsu
2892022,91,18,0,Weiterer Zuruf von der CDU/CSU,von der CDU/CSU,von-der-cdu-csu,676,„Gechincht“?,data/txt/18091.txt,poi,cducsu
2892023,91,18,0,Katja Mast [SPD],Katja Mast,katja-mast,677,Was ist „gechincht“?,data/txt/18091.txt,poi,spd
2892024,91,18,0,Brigitte Pothmer (BÜNDNIS 90/DIE GRÜNEN),Brigitte Pothmer,brigitte-pothmer,678,"Wenn Sie die Minijobs von der Dokumentationspflicht ausnehmen, dann können Sie den Mindestlohn in diesem Bereich gleich einkassieren.

Ich will es hier ganz deutlich sagen: Ich will gar nicht alle Arbeitgeber unter Generalverdacht stellen,",data/txt/18091.txt,speech,gruene
2892025,91,18,0,Zuruf von der CDU/CSU,von der CDU/CSU,von-der-cdu-csu,679,Gott sei Dank!,data/txt/18091.txt,poi,cducsu
