id,sitzung,wahlperiode,in_writing,speaker,speaker_cleaned,speaker_fp,sequence,text,filename,type,speaker_party
2907822,102,18,0,Präsident Dr. Norbert Lammert,Dr. Norbert Lammert,norbert-lammert,0,"Nehmen Sie bitte Platz. Die Sitzung ist eröffnet.

Liebe Kolleginnen und Kollegen, ich begrüße Sie herzlich und rufe gleich Tagesordnungspunkt 1 auf:

Befragung der Bundesregierung

Die Bundesregierung hat als Thema der heutigen Kabinettssitzung mitgeteilt: Bundesbericht Energieforschung 2015.

Dazu erhält der Bundesminister für Wirtschaft und Energie, Sigmar Gabriel, sofort das Wort für einen kurzen einleitenden Bericht.

Wenn es absehbar Fragen über diesen Bericht hinaus gibt, wäre ich ganz dankbar, wenn ich vorher einen Hinweis bekommen könnte; denn dann kann man diese vorher thematisch etwas sortieren, damit wir nicht ständig hin und her springen.

Bitte schön, Herr Minister.",data/txt/18102.txt,chair,
2907823,102,18,0,"Sigmar Gabriel, Bundesminister für Wirtschaft und Energie",Sigmar Gabriel,sigmar-gabriel,1,"Herr Präsident! Liebe Kolleginnen und Kollegen! Das Kabinett hat heute den Bundesbericht Energieforschung 2015 verabschiedet. Dieser Bericht schafft Transparenz in der öffentlichen Förderung der Energieforschung in Deutschland, und er dokumentiert unsere Ausrichtung der Energieforschung an den Notwendigkeiten der Energiewende.

Unser langfristiges Ziel bis 2050 ist es, den Primärenergieverbrauch zu halbieren und den Anteil erneuer-barer Energien am Bruttoendenergieverbrauch auf 60 Prozent zu steigern. Gleichzeitig wollen wir die Wettbewerbsfähigkeit unseres Industrielandes, unserer Unternehmen sichern, zum Klimaschutz beitragen, aber auch Versorgungssicherheit erhalten und neue Beschäftigungsmöglichkeiten schaffen, um die Energiewende zu einem Exportschlager zu machen. Das alles gelingt nur mit raschem technischen Fortschritt. Dafür brauchen wir Forschung und Entwicklung. Wir müssen den Wirkungsgrad und die Systemintelligenz der erneuerbaren Energien weiter erhöhen. Wir müssen auch effizienter werden bei der Bereitstellung, Verteilung und vor allem bei der Nutzung von Energie. Wir müssen vorankommen bei der Entwicklung intelligenter Netze und technologisch wie wirtschaftlich tragfähiger Speicherlösungen, und wir wollen natürlich die energiebedingten Treibhausgasemissionen weiter reduzieren.

All das geht nicht ohne Forschung und ohne Offenheit gegenüber technologischer Innovation. Die Bundesregierung hat daher die Energieforschung neu aufgestellt und aufgewertet. Im vergangenen Jahr haben wir 819 Millionen Euro dafür aufgewendet, neue Technologien für die Energieversorgung zu erforschen und bestehende weiterzuentwickeln. Meine Damen und Herren, das ist mehr als eine Verdopplung innerhalb der letzten zehn Jahre. Fast drei Viertel dieser Mittel, 74 Prozent, flossen in die Bereiche, die für den Erfolg der Energiewende besonders wichtig sind: in die Energieeffizienz und in die erneuerbaren Energien. Wir haben die einzelnen Felder der Energieforschungspolitik noch enger miteinander verzahnt. Das ist ein Synergieeffekt, der unmittelbar mit der Zusammenführung der Forschung im Wirtschaftsministerium zusammenhängt. Vorher gab es eine Aufteilung zwischen Wirtschafts- und Umweltministerium.

Zusammenarbeit und das Denken in systemischen Zusammenhängen sind entscheidend, um bei den Netzen, den Speichern und vor allen Dingen bei der effizienteren Energienutzung in Gebäuden voranzukommen. Deshalb bauen wir auch die Forschungszusammenarbeit mit den Bundesländern und auf europäischer Ebene aus. Zudem setzen wir auf flexible Förderung. Die Projektförderung ist hierfür das geeignete Instrument. Sie hat nunmehr einen Anteil von 63 Prozent erreicht, 515 Millionen Euro. 2011 waren es noch deutlich weniger, nämlich 57 Prozent. Dabei geht es um sehr vielfältige und spannende Projekte. In einem Monat zum Beispiel wird das Informationssystem EnArgus an den Start gehen. Es erfasst die vielseitigen Energieforschungsaktivitäten und stellt Einzelprojekte transparent dar. Zu den 2 400 laufenden Projekten gehören solche wie AmpaCity in Essen, bei dem das weltweit längste supraleitende Kabel verlegt und ins Stromnetz integriert wurde. Dazu gehören innovative Techniken, die die Schallemissionen von Offshore-Windenergieanlagen verringern und so zum Artenschutz im Meer beitragen. Weiter gehört dazu beispielsweise die Erprobung sogenannter virtueller Kraftwerke, also Kombikraftwerke.

Auch der wichtigen Frage, wie man die Energieeffizienz in der Industrie erhöhen kann, wird in Forschungsprojekten nachgegangen. Zum Beispiel wird in der neuen ETA-Fabrik an der TU Darmstadt erstmals eine gesamte Fertigungskette der Metallverarbeitung energetisch optimiert. Dort wird eine Energieeinsparung um bis zu 40 Prozent erwartet. Getragen wird das Projekt von rund 20 Industriepartnern und Forschungsinstituten. Es ist damit hervorragend in Industrie, Forschung und Lehre eingebunden.

Solche Vernetzungen wollen wir weiterentwickeln. Dafür haben wir beispielsweise Forschungsnetzwerke ins Leben gerufen, die in ausgewählten Bereichen - Stromnetze, Gebäudeeffizienz und Energiesystemanalyse - als Schnittstelle zwischen Forschung, Praxis und auch Politik dienen.

Unser Ziel ist es, die Anwendungsorientierung der Energieforschung zu stärken. Wir wollen die Basis für neue marktreife Lösungen und Produkte schaffen. - Das, meine Damen und Herren, als kurze Einführung.

Vielen Dank für Ihre Aufmerksamkeit.",data/txt/18102.txt,speech,
2907824,102,18,0,Präsident Dr. Norbert Lammert,Dr. Norbert Lammert,norbert-lammert,2,Die erste Nachfrage kommt vom Kollegen Röspel.,data/txt/18102.txt,chair,
2907825,102,18,0,René Röspel (SPD),René Röspel,rene-rospel,3,"Vielen Dank, Herr Minister. - Wenn es darum geht, bei der Energiewende die erneuerbaren Energien stärker auszubauen und einzubinden, wird es eine große Herausforderung sein, diese trotz des ungleichmäßigen Eingangs zu nutzen. Dabei geht es beispielsweise darum, wie man den tagsüber produzierten Photovoltaik- oder Solarstrom zu anderen Zeiten nutzen kann, in denen er stärker gebraucht wird, aber nicht mehr zur Verfügung steht. Meine Fragen lauten also: Inwieweit spielt das Thema Energiespeicherung innerhalb des Energieforschungsberichts eine Rolle? Wie kann die Speicherforschung ausgebaut werden?",data/txt/18102.txt,speech,spd
2907826,102,18,0,Präsident Dr. Norbert Lammert,Dr. Norbert Lammert,norbert-lammert,4,Herr Minister.,data/txt/18102.txt,chair,
2907827,102,18,0,"Sigmar Gabriel, Bundesminister für Wirtschaft und Energie",Sigmar Gabriel,sigmar-gabriel,5,"Herr Kollege Röspel, Speicherung ist eines der zentralen Themen. Wir sind noch längst nicht an dem Punkt, wo die unterschiedlichen Speichermöglichkeiten wirtschaftlich vertretbar eingesetzt werden können. Dafür brauchen wir noch eine ganze Reihe an Forschungs- und auch Demonstrationsvorhaben. Ein bisschen wird auch die Entscheidung über den neuen Strommarkt einen Beitrag dazu leisten. Denn wir müssen, glaube ich, auch marktgetriebene Anreize schaffen, wenn es um die Frage geht, ob beispielsweise eine Kraftwerkskapazität genutzt werden muss, um Lastspitzen auszugleichen, oder ob Speicher oder ein Demand-Side-Management, also die Anpassung der Nachfrage, genutzt werden können. Das muss am Ende über den Preis am Markt entschieden werden. Da erwarten wir auch noch einmal einen Schub für Speichertechnologien. Wir müssen aber auch noch eine ganze Reihe von Forschungs- und Entwicklungsvorhaben voranbringen, damit wir hier letztlich zu marktfähigen Speicherkapazitäten kommen. Man sagt immer so, dass man dafür etwa 70 bis 80 Prozent erneuerbare Energien am Strommarktspeicher verfügbar haben muss. Davon sind wir noch ein Stück weit entfernt.",data/txt/18102.txt,speech,
2907828,102,18,0,Präsident Dr. Norbert Lammert,Dr. Norbert Lammert,norbert-lammert,6,Kollege Lenkert.,data/txt/18102.txt,chair,
2907829,102,18,0,Ralph Lenkert (DIE LINKE),Ralph Lenkert,ralph-lenkert,7,"Herr Minister, ich möchte Sie fragen, ob Sie im Rahmen des Energieforschungsprogramms auch ein -Forschungsprojekt aufgelegt haben, mit dem die Bundesnetzagentur befähigt werden wird, in Zukunft selbstständig Berechnungen des Stromübertragungsnetzes durchzuführen. Die derzeitige Situation ist folgende: Die Berechnungsprogramme wurden von den Netzbetreibern entwickelt. Von den Netzbetreibern wird mittels dieser Programme ermittelt, welchen Netzausbaubedarf es gibt. Die Netzbetreiber erhalten entsprechend dem Netzausbaubedarf für 40 Prozent ihrer Investitionssumme eine garantierte Rendite von 9 Prozent - und das in der heutigen Zeit. Die Bundesnetzagentur überprüft mit den Programmen der Netzbetreiber, ob diese Berechnungen richtig sind. Da ist natürlich ein gewisser Interessenkonflikt nachvollziehbar. Der führte zu 26 000 Einwendungen beim Netzentwicklungsplan.

Ich frage Sie, ob Sie diesem Missstand, dass man nicht unabhängig nachrechnen kann, durch ein Forschungsprogramm begegnen wollen, das die Bundesnetzagentur zukünftig in die Lage versetzen wird, selbstständig mit einem unabhängig entwickelten Programm die Angaben der Netzbetreiber überprüfen zu können.",data/txt/18102.txt,speech,linke
2907830,102,18,0,"Sigmar Gabriel, Bundesminister für Wirtschaft und Energie",Sigmar Gabriel,sigmar-gabriel,8,"Die Bundesnetzagentur kann die Angaben der Netzbetreiber unabhängig überprüfen. Sie checkt sie auch gegen mit in Europa entwickelten Programmen zur Berechnung existierender Kapazitäten, der Entwicklung der Netze, der Grenzkuppelstellen und von vielem anderen mehr. Ich halte es nicht für sinnvoll, diejenigen aus der Verantwortung für die Entwicklung der Netze zu entlassen, die sie als Übertragungsnetzbetreiber letztlich finanzieren müssen.",data/txt/18102.txt,speech,
2907831,102,18,0,,,,9,Zuruf des Abg. Ralph Lenkert [DIE LINKE],data/txt/18102.txt,poi,
2907832,102,18,0,"Sigmar Gabriel, Bundesminister für Wirtschaft und Energie",Sigmar Gabriel,sigmar-gabriel,10,"- Natürlich müssen sie investieren. Sie bekommen dann über die Netzentgelte aber eine Refinanzierung ihrer Investition. So läuft das.

Ich glaube, dass es richtig ist, dass die Übertragungsnetzbetreiber diese Berechnungen vorlegen müssen. Unsere Behörde muss in der Lage sein, die Richtigkeit der Angaben zu überprüfen, um festzustellen und nachzuprüfen, ob es objektivierbare Kriterien zum Beispiel für die ausgewählten Korridore und die als notwendig erachteten Leitungen gibt. Das kann die Behörde. Dafür hat sie die Kapazitäten. Beim Thema Netze gibt es ganz andere Forschungsaufgaben, die Sie im Energieforschungsbericht auch wiederfinden.",data/txt/18102.txt,speech,
2907833,102,18,0,Präsident Dr. Norbert Lammert,Dr. Norbert Lammert,norbert-lammert,11,Frau Kotting-Uhl.,data/txt/18102.txt,chair,
2907834,102,18,0,Sylvia Kotting-Uhl (BÜNDNIS 90/DIE GRÜNEN),Sylvia Kotting-Uhl,sylvia-kotting-uhl,12,"Herr Minister, ich habe eine Frage zur Energieforschung. Der Bericht, den wir vorhin bekommen haben, enthält ein klares Bekenntnis zum ITER. Im deutschen Energieforschungsprogramm sind für 2014 für die Kernfusionsforschung 138 Millionen Euro jenseits der Kosten von ITER aufgeführt. Das sind immerhin 25 Prozent dessen, was für Energieeffizienz und erneuerbare Energien eingestellt wird. Das ist also nicht zu vernachlässigen.

Im neuen Bericht führen Sie die Fusionsforschung unter „alle infrage kommenden Konzepte für eine zukünftige Energieversorgung“ auf. Ich möchte Sie daher fragen, wie das zu dem Bekenntnis zur Energiewende passt, von der wir wissen, dass wir völlig andere Strukturen und einen völlig anderen Netzausbau als bei der bisherigen sehr zentralen Stromversorgung brauchen. Die Kernfusion wäre eine Rückkehr zur absoluten zentralen Stromversorgung. Wie passt das zusammen? Wie soll das funktionieren, wenn im Jahr 2050 doch hoffentlich eine andere Stromversorgung und eine andere Energieversorgungsstruktur in Deutschland aufgebaut sein werden?",data/txt/18102.txt,speech,gruene
2907835,102,18,0,"Sigmar Gabriel, Bundesminister für Wirtschaft und Energie",Sigmar Gabriel,sigmar-gabriel,13,"Frau Kollegin Kotting-Uhl, wir sind bei dem Thema ITER an völkerrechtliche Verträge gebunden. Diese sind übrigens noch zu rot-grünen Zeiten verhandelt und dann - ich glaube, das war 2006 - vom Forschungsministerium und Finanzministerium endgültig verabschiedet worden. Wir haben 2017 zum ersten Mal die Möglichkeit, aus dem Programm auszusteigen. Ich finde, Sie haben gerade kluge Argumente genannt, warum man das ins Auge fassen sollte.",data/txt/18102.txt,speech,
2907836,102,18,0,Präsident Dr. Norbert Lammert,Dr. Norbert Lammert,norbert-lammert,14,Kollege Diaby.,data/txt/18102.txt,chair,
2907837,102,18,0,Dr. Karamba Diaby (SPD),Dr. Karamba Diaby,karamba-diaby,15,"Herr Bundesminister, Sie haben die europäischen Dimensionen und die Zusammenarbeit angesprochen. Wir wissen, dass im Bereich Forschung internationale Zusammenarbeit eine ganz große Rolle spielt. Deshalb meine Frage: Welche internationalen Kooperationen wurden im Jahr 2014 im Bereich Energieforschung unterstützt?",data/txt/18102.txt,speech,spd
2907838,102,18,0,"Sigmar Gabriel, Bundesminister für Wirtschaft und Energie",Sigmar Gabriel,sigmar-gabriel,16,"Ich kann jetzt nicht aus dem Kopf sagen, welche konkreten Kooperationsvorhaben darin enthalten sind. Das liefern wir aber gerne nach.",data/txt/18102.txt,speech,
2907839,102,18,0,Präsident Dr. Norbert Lammert,Dr. Norbert Lammert,norbert-lammert,17,Kollege Krischer.,data/txt/18102.txt,chair,
2907840,102,18,0,Dr. Joachim Pfeiffer [CDU/CSU],Dr. Joachim Pfeiffer,joachim-pfeiffer,18,Es geht jetzt aber nicht um TTIP!,data/txt/18102.txt,poi,cducsu
2907841,102,18,0,Präsident Dr. Norbert Lammert,Dr. Norbert Lammert,norbert-lammert,19,,data/txt/18102.txt,chair,
2907842,102,18,0,Oliver Krischer (BÜNDNIS 90/DIE GRÜNEN),Oliver Krischer,oliver-krischer,20,"Herr Kollege Pfeiffer, wir hätten eben im Wirtschaftsausschuss gerne eine Aussage von Ihnen dazu gehört. Aber das passiert ja leider nie. Sie sprechen im Wirtschaftsausschuss leider nicht dazu.",data/txt/18102.txt,speech,gruene
2907843,102,18,0,Präsident Dr. Norbert Lammert,Dr. Norbert Lammert,norbert-lammert,21,Mit „Regierungsbefragung“ ist eigentlich nicht die Auseinandersetzung zwischen den Fraktionen gemeint.,data/txt/18102.txt,chair,
2907844,102,18,0,Oliver Krischer (BÜNDNIS 90/DIE GRÜNEN),Oliver Krischer,oliver-krischer,22,Der Kollege hat aber eben eine Bemerkung gemacht.,data/txt/18102.txt,speech,gruene
2907845,102,18,0,Michaela Noll [CDU/CSU],Michaela Noll,michaela-noll,23,Das war nur eine Spitze!,data/txt/18102.txt,poi,cducsu
2907846,102,18,0,Oliver Krischer (BÜNDNIS 90/DIE GRÜNEN),Oliver Krischer,oliver-krischer,24,"Herr Bundesminister, nun zum Thema Energieforschung. Kollegin Kotting-Uhl hat gefragt, was wir für die Fusionsforschung ausgeben. Im Jahr 2014 waren es 138 Millionen Euro. Das ist ein Anteil von round about 25 Prozent. Das ist nicht alles für ITER vorgesehen. Das ist auch nicht alles völkerrechtlich verpflichtend. Das heißt, wir sind in einem ganz erheblichen Umfang auch darüber hinaus tätig.

Ich habe mit großem Interesse zur Kenntnis genommen, dass Sie Wohlwollen demgegenüber hegen, 2017 aus ITER auszusteigen. Meine Frage ist: Ist die Bundesregierung denn bereit, schon vorher oder auch jetzt schon Maßnahmen einzuleiten, um die darüber hinausgehenden Forschungsaktivitäten in diesem Bereich zu reduzieren?",data/txt/18102.txt,speech,gruene
2907847,102,18,0,"Sigmar Gabriel, Bundesminister für Wirtschaft und Energie",Sigmar Gabriel,sigmar-gabriel,25,"Ich kann nur davon abraten, die darüber hinausgehenden Forschungsbereiche zu reduzieren, weil es sich um Endlagerforschung handelt.",data/txt/18102.txt,speech,
2907848,102,18,0,Oliver Krischer [BÜNDNIS 90/DIE GRÜNEN],Oliver Krischer,oliver-krischer,26,"Fusionsforschung, nicht Endlagerforschung!",data/txt/18102.txt,poi,gruene
2907849,102,18,0,"Sigmar Gabriel, Bundesminister für Wirtschaft und Energie",Sigmar Gabriel,sigmar-gabriel,27,"- Vielleicht gibt es jetzt ein Missverständnis. Uns geht es darum, dass wir im Wesentlichen die Bereiche der Forschung fortsetzen müssen - ich glaube, da sind wir auch nicht auseinander -, die nukleare Sicherheit zum Ziel hat. Wir werden selbst nach dem Abschalten von Kernkraftwerken zur Stromproduktion weiter Nuklearanlagen, zum Beispiel im Forschungsbereich, und die Endlagerforschung haben.",data/txt/18102.txt,speech,
2907850,102,18,0,Oliver Krischer [BÜNDNIS 90/DIE GRÜNEN],Oliver Krischer,oliver-krischer,28,Davon spreche ich nicht!,data/txt/18102.txt,poi,gruene
2907851,102,18,0,"Sigmar Gabriel, Bundesminister für Wirtschaft und Energie",Sigmar Gabriel,sigmar-gabriel,29,"- Durch Ihre Zwischenrufe merke ich, dass Sie den Teil meinen, der die Kernfusionsforschung selbst betrifft.",data/txt/18102.txt,speech,
2907852,102,18,0,Oliver Krischer [BÜNDNIS 90/DIE GRÜNEN],Oliver Krischer,oliver-krischer,30,Genau!,data/txt/18102.txt,poi,gruene
2907853,102,18,0,"Sigmar Gabriel, Bundesminister für Wirtschaft und Energie",Sigmar Gabriel,sigmar-gabriel,31,"Wir sind jedoch in Projekte eingebunden, bei denen wir nicht einfach aussteigen können.",data/txt/18102.txt,speech,
2907854,102,18,0,Dr. Joachim Pfeiffer [CDU/CSU],Dr. Joachim Pfeiffer,joachim-pfeiffer,32,Wir wollen das auch gar nicht!,data/txt/18102.txt,poi,cducsu
2907855,102,18,0,"Sigmar Gabriel, Bundesminister für Wirtschaft und Energie",Sigmar Gabriel,sigmar-gabriel,33,"- Die Nachfragen des Abgeordneten Krischer und von Frau Kotting-Uhl weisen auf Folgendes hin: Welchen Sinn macht es eigentlich, eine höchst zentrale Form der Energieversorgung weiterzuentwickeln, wenn man davon ausgehen muss, dass dafür bei all den Programmen, die diese, die letzte und die vorletzte Bundesregierung zur Energiewende beschlossen haben, kein Raum mehr ist, jedenfalls dann nicht, wenn man diese Projekte ernst nimmt? Das ist eine durchaus berechtigte Frage.

Wir sind in diese Projekte eingebunden. Jetzt einseitig auszuscheiden, ist für uns nicht möglich. Wir haben uns in einem völkerrechtlichen Vertrag gebunden. Wir sind durch Projekte gebunden. Ich glaube, dass wir diese zu Ende führen müssen. Ich persönlich bin allerdings der Auffassung, dass wir ab 2017 die Möglichkeit nutzen müssen, die Gelder für die Forschung zu verwenden, -deren Ergebnisse die Bundesrepublik Deutschland am Ende sinnvoll nutzen kann. Das wird bei der Kernfu-sionsforschung nach meinem Eindruck nicht mehr möglich sein, jedenfalls dann nicht, wenn wir die Energiewende konsequent zu Ende führen.",data/txt/18102.txt,speech,
2907856,102,18,0,Präsident Dr. Norbert Lammert,Dr. Norbert Lammert,norbert-lammert,34,Frau Bulling-Schröter.,data/txt/18102.txt,chair,
2907857,102,18,0,Eva Bulling-Schröter (DIE LINKE),Eva Bulling-Schröter,eva-bulling-schroter,35,"Danke schön. - Sehr geehrter Herr Minister, die Chefin der Internationalen Energieagentur, Frau Maria van der Hoeven, hat diese Woche erklärt, dass wir die Forschungsmittel verdreifachen müssten, um saubere Technologien zu entwickeln, und zwar im regenerativen Bereich, vermute ich - ich hoffe nicht, dass sie damit die Atomforschung gemeint hat -, und so die Klimaschutzziele zu erreichen. Wir wissen, wie brisant dieses ganze Thema ist.

Ich frage Sie: Inwieweit sind Sie bereit, eine Ausweitung der Mittel zu forcieren? Ist da etwas geplant? Inwieweit würden Sie sich da einbringen? Teilen Sie die Meinung der Chefin der IEA?",data/txt/18102.txt,speech,linke
2907858,102,18,0,"Sigmar Gabriel, Bundesminister für Wirtschaft und Energie",Sigmar Gabriel,sigmar-gabriel,36,"Sie müssen mir erst gestatten, zu fragen, ob diese Forderung sich nur auf Deutschland oder auf die internationale Energiepolitik bezieht.",data/txt/18102.txt,speech,
2907859,102,18,0,Eva Bulling-Schröter (DIE LINKE),Eva Bulling-Schröter,eva-bulling-schroter,37,Auf die internationale Energiepolitik natürlich. Aber Deutschland ist ja ein Teil davon.,data/txt/18102.txt,speech,linke
2907860,102,18,0,"Sigmar Gabriel, Bundesminister für Wirtschaft und Energie",Sigmar Gabriel,sigmar-gabriel,38,"Dass es in der internationalen Energiepolitik wünschenswert wäre, dass andere Staaten ähnlich handeln wie wir, unterstreiche ich. In Deutschland, finde ich, haben wir auf diesem Gebiet eine Menge getan. Ich habe es schon gesagt: Der Forschungsetat wurde fast verdoppelt.

Übrigens beziehen sich die Zahlen in diesem Energieforschungsbericht auf das Jahr 2014. Das liegt daran, dass wir bei Drucklegung des Energieforschungsberichts die alte mittelfristige Finanzplanung als Grundlage nehmen mussten. Schauen Sie sich an, wie die mittelfristige Finanzplanung bis 2019 aussieht: Die Mittel steigen an, und zwar auf über 1 Milliarde Euro. Also, wir steigern unsere Ausgaben in diesem Bereich; aber die Chefin der Internationalen Energieagentur hat mit ihrer Meinung völlig recht, dass andere Staaten das genauso machen sollten.",data/txt/18102.txt,speech,
2907861,102,18,0,Präsident Dr. Norbert Lammert,Dr. Norbert Lammert,norbert-lammert,39,Herr Röspel.,data/txt/18102.txt,chair,
2907862,102,18,0,René Röspel (SPD),René Röspel,rene-rospel,40,"Für eine erfolgreiche Energiewende werden die privaten Haushalte eine zentrale Rolle spielen, was Effizienz, aber eben auch die Steuerung der Nachfrage anbelangt. Meine Frage ist, ob es geplant ist, Forschungsmittel in diesem Bereich, Umgang mit Energie und Effizienz in privaten Haushalten, verstärkt einzusetzen. Den Wirtschaftsminister möchte ich gerne fragen, ob überlegt wird, Einführungsprogramme hinterherzuschieben.",data/txt/18102.txt,speech,spd
2907863,102,18,0,"Sigmar Gabriel, Bundesminister für Wirtschaft und Energie",Sigmar Gabriel,sigmar-gabriel,41,"Diese Programme gibt es schon. Wir in der Koalition haben im Nationalen Aktionsplan Energieeffizienz für die kommenden Jahre gerade 1,2 Milliarden Euro zur Steigerung der Energieeffizienz zur Verfügung gestellt. Davon ist ein großer Teil für private Haushalte vorgesehen, etwa die Erhöhung der Mittel für das Marktanreizprogramm, für das Austauschprogramm für veraltete Kessel, für die Heizungstechnik, und zwar von der Beratung bis zum Zuschuss. Insofern tun wir schon das, wonach Sie gefragt haben. Gleichzeitig haben Sie völlig recht: Auch in der Energieforschung muss in diesem Bereich, auch was die Konsum- und Nachfrageseite angeht, noch mehr passieren.

Übrigens diskutieren wir häufig über Industrie 4.0. Wenn es einen Anwendungsbereich gibt, in dem Sie das real sehen können und in dem man in den kommenden Jahren die Entwicklung des Internets der Dinge erleben kann, dann ist es der Bereich der Energieproduktion, der Energienachfrage und vor allen Dingen der Energieverteilung. Das wird ohne intelligente Systemtechnik und Smart Grids nicht gehen. Da spielt das, was Sie angesprochen haben, eine zentrale Rolle.",data/txt/18102.txt,speech,
2907864,102,18,0,Präsident Dr. Norbert Lammert,Dr. Norbert Lammert,norbert-lammert,42,Kollege Rossmann.,data/txt/18102.txt,chair,
2907865,102,18,0,Dr. Ernst Dieter Rossmann (SPD),Dr. Ernst Dieter Rossmann,ernst-dieter-rossmann,43,"Herr Minister, als Abgeordneter für die einzige deutsche Hochseeinsel Helgoland muss ich Sie zu Ihrer Einschätzung, was Offshore angeht, fragen, speziell zu dem Beitrag, den Sie über das Forschungsprogramm für die gute Einbindung ökologischer und anderer Belange von Offshore geleistet haben. Generell habe ich noch die Frage, wie Sie die weitere Offshoreentwicklung einschätzen.",data/txt/18102.txt,speech,spd
2907866,102,18,0,"Sigmar Gabriel, Bundesminister für Wirtschaft und Energie",Sigmar Gabriel,sigmar-gabriel,44,"Herr Kollege Rossmann, wir haben gerade am letzten Wochenende erleben können, dass sich die frühere Entscheidung, in Forschung zu investieren, die schon unter meinem Amtsvorgänger als Bundesumweltminister, nämlich Jürgen Trittin, getroffen wurde, sehr gelohnt hat. Wir haben damals die Forschungsplattform Alpha Ventus mit großen Schwierigkeiten in Gang bekommen.

Wir können jetzt, round about zehn Jahre später, sehen, dass wir den Durchbruch in der Industrialisierung bei Offshore erleben. Dafür war die Forschung die zentrale Voraussetzung. Sie ist auch noch nicht zu Ende. Wir werden in Europa über Standardisierungen reden müssen, um den Industrialisierungsgrad immer mehr zu erhöhen. Industrialisierung heißt nichts anderes, als dass eine höhere Anzahl von Projekten, die standardisiert sind, realisiert wird, um die dadurch entstehenden Preisvorteile den Kunden anbieten zu können.

In dieser Phase sind wir jetzt. Wir haben gerade das Projekt DanTysk von Vattenfall an der deutsch-dänischen Grenze eröffnen können. Das ist ein gewaltiger Park mit 80 Anlagen. Der nächste ist schon in Planung. Das zeigt, dass sich die Forschungsaktivitäten gelohnt haben. Sie kommen aus Schleswig-Holstein.",data/txt/18102.txt,speech,
2907867,102,18,0,Dr. Ernst Dieter Rossmann [SPD],Dr. Ernst Dieter Rossmann,ernst-dieter-rossmann,45,Helgoland ist etwas weiter weg im Meer!,data/txt/18102.txt,poi,spd
2907868,102,18,0,"Sigmar Gabriel, Bundesminister für Wirtschaft und Energie",Sigmar Gabriel,sigmar-gabriel,46,,data/txt/18102.txt,speech,
2907869,102,18,0,Präsident Dr. Norbert Lammert,Dr. Norbert Lammert,norbert-lammert,47,"Herr Minister, achten Sie bitte auf die Zeit.",data/txt/18102.txt,chair,
2907870,102,18,0,"Sigmar Gabriel, Bundesminister für Wirtschaft und Energie",Sigmar Gabriel,sigmar-gabriel,48,Dann höre ich jetzt auf.,data/txt/18102.txt,speech,
2907871,102,18,0,Präsident Dr. Norbert Lammert,Dr. Norbert Lammert,norbert-lammert,49,Das wird alles in Echtzeit übertragen.,data/txt/18102.txt,chair,
