id,sitzung,wahlperiode,in_writing,speaker,speaker_cleaned,speaker_fp,sequence,text,filename,type,speaker_party
2908228,102,18,0,Martina Renner (DIE LINKE),Martina Renner,martina-renner,406,"Wir alle kennen die Spione, und wir sprechen es aus: Das sind die NSA und der Bundesnachrichtendienst Hand in Hand.",data/txt/18102.txt,speech,linke
2908229,102,18,0,,,,407,Beifall bei Abgeordneten der LINKEN,data/txt/18102.txt,poi,
2908230,102,18,0,Volker Kauder [CDU/CSU],Volker Kauder,volker-kauder,408,Und Russland?,data/txt/18102.txt,poi,cducsu
2908231,102,18,0,Martina Renner (DIE LINKE),Martina Renner,martina-renner,409,"Die Massenüberwachung, die wir als Ausschuss festgestellt haben, zum Beispiel durch den Abgriff der Telekommunikationsdaten bei der Deutschen Telekom in Frankfurt, hat ebenso wie die politische und wirtschaftliche Spionage nichts, aber auch rein gar nichts mit den postulierten Zielen der Geheimdienste zu tun. Diese Praxis, die wir untersuchen, ist illegal und demokratieschädigend.",data/txt/18102.txt,speech,linke
2908232,102,18,0,,,,410,Beifall bei der LINKEN,data/txt/18102.txt,poi,
2908233,102,18,0,Thomas Strobl [Heilbronn] [CDU/CSU],Thomas Strobl,thomas-strobl,411,Martinas Märchenstunde!,data/txt/18102.txt,poi,cducsu
2908234,102,18,0,Martina Renner (DIE LINKE),Martina Renner,martina-renner,412,"Warum wissen wir überhaupt davon? Warum hat sich der Untersuchungsausschuss auf den Weg gemacht? Wir wissen davon, weil Edward Snowden den Mut hatte, die Welt über die Massenausspähung durch die NSA zu informieren. Er hat den Stein ins Rollen gebracht. Doch bis heute verweigern Sie dem Kronzeugen im NSA-Untersuchungsausschuss eine Aussage hier in Berlin.",data/txt/18102.txt,speech,linke
2908235,102,18,0,,,,413,Beifall bei Abgeordneten der LINKEN,data/txt/18102.txt,poi,
2908236,102,18,0,Michael Grosse-Brömer [CDU/CSU],Michael Grosse-Brömer,michael-grosse-bromer,414,Das ist auch richtig so!,data/txt/18102.txt,poi,cducsu
2908237,102,18,0,Karin Binder [DIE LINKE],Karin Binder,karin-binder,415,Kein Interesse an Aufklärung!,data/txt/18102.txt,poi,linke
2908238,102,18,0,Martina Renner (DIE LINKE),Martina Renner,martina-renner,416,"Seit diesen Enthüllungen in 2013 beschäftigt uns alle die Frage - die muss uns als Parlament interessieren -, inwieweit der BND an dieser Praxis der NSA, der Massenüberwachung und Spionage, beteiligt war und ist. Natürlich ist damit untrennbar die Frage verbunden, ob der BND dabei seinen gesetzlichen Rahmen verlassen hat.

Seit knapp zehn Tagen erfahren wir nun aus den Medien, dass dieses Ausspähen und Überwachen gezielt gegen europäische Partner, gegen europäische Industrieunternehmen mit deutscher Beteiligung und gegen befreundete Regierungen gerichtet war und dass das Bundeskanzleramt über diese Praxis des BND seit mehr als fünf Jahren informiert gewesen ist und nicht erst seit 2015. In diesem Punkt muss ich dem Kollegen Christian Flisek leider widersprechen.

Momentan steht im Raum, dass der Bundesrepublik die NSA offenbar nähersteht als der Élysée-Palast, das Europaparlament oder unser Nachbarland Österreich. Damit beginnt der zweite Teil der Affäre. Die Bundesregierung und allen voran der jetzige Bundesinnenminister und langjährige Staatsminister im Bundeskanzleramt Thomas de Maizière versprechen jeden Tag eine Aufklärung der Öffentlichkeit. Doch passiert ist bislang nichts - nichts, was auch nur annährend das Wort Aufklärung verdienen würde.

An dieser Stelle möchte ich auf zwei eklatante Beispiele abstellen. Seit mehr als zwei Wochen warten wir auf die Liste der Spionageziele. Was ist passiert? Nichts! Stattdessen fragt die Bundesregierung in den USA um Erlaubnis, hier ihrer Pflicht gegenüber dem Parlament nachzukommen. Es kann nicht sein, dass BND und NSA, die hier möglicherweise Straftaten begangen haben, nun selbst entscheiden dürfen, welche Informationen über ihr Handeln sie dem Ausschuss übergeben, der das untersuchen soll. Solange diese Liste zurückgehalten wird, werden, so sagen wir, die Spione geschützt und die parlamentarische Aufklärung sabotiert.",data/txt/18102.txt,speech,linke
2908239,102,18,0,,,,417,Beifall bei der LINKEN sowie bei Abgeordneten des BÜNDNISSES 90/DIE GRÜNEN,data/txt/18102.txt,poi,
2908240,102,18,0,Martina Renner (DIE LINKE),Martina Renner,martina-renner,418,"Ich möchte an dieser Stelle ganz deutlich sagen: Wer jetzt meint, die Aufklärung könnte beim BND stehen bleiben und dass wir nicht nach den Verantwortlichen im Bundeskanzleramt fragen, dass wir nicht fragen, was dort wann gewusst wurde, wer diese Spionage zugelassen und nicht unterbunden hat, wer die europäischen Partner nicht informiert hat, der täuscht sich. Das werden wir als Untersuchungsausschuss fragen. Falls in den nächsten Stunden und Tagen klar wird, dass die von uns als Opposition gemeinsam vorgelegten Beweisanträge abgelehnt werden bzw. die Listen zu den Spionagezielen der NSA nicht vorgelegt werden, dann müssen wir sagen: Das ist nicht nur eine Blockade der Arbeit, sondern das ist der Versuch der Verschleppung. Es steht im Raum, dass wir die entsprechenden Zeugen aus dem Bundeskanzleramt möglicherweise erst im Sommer oder sogar erst nach der parlamentarischen Sommerpause hören werden. Das ist nicht das, was die Öffentlichkeit derzeit erwartet.",data/txt/18102.txt,speech,linke
2908241,102,18,0,Michael Grosse-Brömer [CDU/CSU],Michael Grosse-Brömer,michael-grosse-bromer,419,Sie haben selbst die Reihenfolge beschlossen!,data/txt/18102.txt,poi,cducsu
2908242,102,18,0,Martina Renner (DIE LINKE),Martina Renner,martina-renner,420,,data/txt/18102.txt,speech,linke
2908243,102,18,0,Vizepräsidentin Edelgard Bulmahn,Edelgard Bulmahn,edelgard-bulmahn,421,"Frau Kollegin, Sie müssen zum Schluss kommen. Sie haben Ihre Redezeit schon deutlich überzogen.",data/txt/18102.txt,chair,
2908244,102,18,0,Martina Renner (DIE LINKE),Martina Renner,martina-renner,422,"Ich komme zum Schluss. - Ich denke, Sie haben jetzt allen Anlass, diesen Skandal nicht weiter auszusitzen.",data/txt/18102.txt,speech,linke
2908245,102,18,0,Volker Kauder [CDU/CSU],Volker Kauder,volker-kauder,423,Jetzt ist gut! Welchen Skandal?,data/txt/18102.txt,poi,cducsu
2908246,102,18,0,Martina Renner (DIE LINKE),Martina Renner,martina-renner,424,"Ansonsten werden diejenigen, die das tun, den Stuhl riskieren, auf dem sie gerade erst Platz genommen haben.

Danke.",data/txt/18102.txt,speech,linke
2908247,102,18,0,,,,425,Beifall bei der LINKEN sowie bei Abgeordneten des BÜNDNISSES 90/DIE GRÜNEN,data/txt/18102.txt,poi,
2908248,102,18,0,Thomas Strobl [Heilbronn] [CDU/CSU],Thomas Strobl,thomas-strobl,426,Jetzt geht es auf den Stuhl zurück!,data/txt/18102.txt,poi,cducsu
2908249,102,18,0,Martina Renner (DIE LINKE),Martina Renner,martina-renner,427,,data/txt/18102.txt,speech,linke
2908250,102,18,0,Vizepräsidentin Edelgard Bulmahn,Edelgard Bulmahn,edelgard-bulmahn,428,Als nächste Rednerin hat die Kollegin Susanne Mittag von der SPD-Fraktion das Wort.,data/txt/18102.txt,chair,
2908251,102,18,0,,,,429,Beifall bei der SPD sowie bei Abgeordneten der CDU/CSU,data/txt/18102.txt,poi,
2908252,102,18,0,Vizepräsidentin Edelgard Bulmahn,Edelgard Bulmahn,edelgard-bulmahn,430,,data/txt/18102.txt,chair,
2908253,102,18,0,Susanne Mittag (SPD),Susanne Mittag,susanne-mittag,431,"Sehr geehrte Frau Präsidentin! Liebe Kolleginnen und Kollegen! Liebe Zuschauer! Das Thema ist sehr interessant; das ist sehr schön. Ich bin froh, dass diese Aktuelle Stunde von der SPD- und der CDU/CSU-Fraktion beantragt worden ist, um über die Kooperationen von BND und NSA in Deutschland zu sprechen.",data/txt/18102.txt,speech,spd
2908254,102,18,0,Jürgen Trittin [BÜNDNIS 90/DIE GRÜNEN],Jürgen Trittin,jurgen-trittin,432,Wieso spricht eigentlich Sigmar nicht?,data/txt/18102.txt,poi,gruene
2908255,102,18,0,Susanne Mittag (SPD),Susanne Mittag,susanne-mittag,433,"Denn die Vorwürfe, die dem BND und auch dem Bundeskanzleramt in den letzten Tagen gemacht wurden, sind erheblich und erreichen zumindest in der Öffentlichkeit - deswegen ist der Zuspruch so groß - immer neue Dimensionen.

Aber die Presseberichte lenken die öffentliche Aufmerksamkeit auch endlich wieder vermehrt auf den NSA-Untersuchungsausschuss. Hoffentlich hilft uns diese öffentliche Resonanz bei der Durchsetzung unserer Beweisbeschlüsse im Ausschuss. Das sind inzwischen fast 300. Wir sind ja nicht untätig geblieben. Ich denke, seit einigen Tagen mehren sich offene Fragen, und damit steigt auch die Zahl der Beweisbeschlüsse. Aber schnelle Schlussfolgerungen, wie sie in den letzten Tagen geäußert wurden, helfen bei der wichtigen Aufklärungsarbeit des Untersuchungsausschusses nicht wirklich weiter.",data/txt/18102.txt,speech,spd
2908256,102,18,0,,,,434,Beifall bei Abgeordneten der SPD und der CDU/CSU,data/txt/18102.txt,poi,
2908257,102,18,0,Thomas Strobl [Heilbronn] [CDU/CSU],Thomas Strobl,thomas-strobl,435,Sehr richtig!,data/txt/18102.txt,poi,cducsu
2908258,102,18,0,Susanne Mittag (SPD),Susanne Mittag,susanne-mittag,436,"Wir als Untersuchungsausschuss haben einen klar definierten Untersuchungsauftrag und klare Forderungen, um einen hochproblematischen Sachverhalt zu klären, sowohl öffentlich als auch nicht öffentlich. Dabei geht es nicht um Hörensagen, Schlussfolgerungen, Empfindungen oder Ähnliches, sondern es geht um belastende und entlastende Momente. Diese zu bekommen - das haben wir gemerkt -, wird wohl nicht ganz einfach sein. Das haben wir schon gemerkt, als wir schwarze Seiten, blaue Seiten und sogar gar keine Seiten in den Akten hatten. Es gibt externe Orte zum Lesen. Konsultationen ohne Ergebnis hatten wir auch schon. Es wird also nicht aufhören. Aber wir werden die Beweise bekommen. Sie sind unverzichtbar, so unangenehm es vielleicht für den einen oder anderen auch werden könnte.",data/txt/18102.txt,speech,spd
2908259,102,18,0,,,,437,Beifall bei der SPD,data/txt/18102.txt,poi,
2908260,102,18,0,Susanne Mittag (SPD),Susanne Mittag,susanne-mittag,438,"Eine sachliche öffentliche Diskussion kann da nur hilfreich sein. Ich betone: sachlich.

Es müssten jetzt alle Fakten auf den Tisch, und dann müssen die Zeugen befragt werden; so herum wird ein Schuh daraus. Einige werden wir eventuell erneut vernehmen müssen; da ist, denke ich, die Belehrung vor der Aussage wohl nicht komplett angekommen.",data/txt/18102.txt,speech,spd
2908261,102,18,0,,,,439,Heiterkeit bei Abgeordneten der SPD,data/txt/18102.txt,poi,
2908262,102,18,0,Susanne Mittag (SPD),Susanne Mittag,susanne-mittag,440,"Erst dann ist es sinnvoll, Konsequenzen zu fordern: organisatorisch oder rechtlich oder personell. Nur so bleiben der Ausschuss, das Parlament und die Politik glaubwürdig. Auch eine Regierung ist nur so glaubwürdig, wie sie mit eigenen Mängeln umgehen kann.

Die in den vergangenen beiden Wochen aufgeworfenen Fragen zeigen nur die Richtigkeit und Wichtigkeit des NSA-Untersuchungsausschusses. Denn erst durch die Beweisbeschlüsse dieses Ausschusses - es waren nicht die Grünen alleine - scheint sowohl dem BND als auch dem Kanzleramt die Brisanz der von den USA eingesteuerten Selektoren bewusst geworden zu sein. Die aufgeworfenen Fragen bestätigen auch die Richtigkeit und Wichtigkeit unserer im Ausschuss beschlossenen Vorgehensweise. Nur noch einmal zur Erinnerung: Erst kehren wir vor der eigenen Tür, also beim BND und bei dessen Kontrolle. Da scheinen wir mit der parlamentarischen Aufarbeitung offenbar noch lange nicht fertig zu sein.

Aber - vielleicht geht das in der einen oder anderen Diskussion unter -: Die Aufgabe des BND ist unter anderem die Unterstützung der Bundesregierung bei ihren sicherheits- und außenpolitischen Entscheidungen durch Bereitstellung von Erkenntnissen über das Ausland. Manchmal habe ich in dieser Diskussion das Gefühl, das wird ein bisschen vermischt.

Eine weitere Aufgabe ist die informatorische Unterstützung der Bundeswehr bei ihren Auslandseinsätzen. Es ist schon erwähnt worden: Die Bundeswehr ist in 14 Ländern im Einsatz. Das Stichwort lautet hier „Schutz der Truppe vor terroristischen Anschlägen“; das hat das eine oder andere Mal ja offensichtlich geklappt.

Hinzu kommt die Aufgabe, Informationen in Krisen oder bei Entführungen deutscher Staatsangehöriger bereitzustellen. Zurzeit gibt es mehrere Entführungsfälle. Darüber wird nicht öffentlich diskutiert - das ist auch richtig so -; aber das ist wichtig.

Es waren die Entwicklungen nach dem 11. September 2001, die zum Memorandum of Agreement mit der NSA geführt haben. Der Rahmen dieses Agreements ist klar definiert und nachvollziehbar. Wir müssen nun klären, ob und inwieweit sich beim BND im Laufe der Jahre ein gewisses Eigenleben und/oder ein großzügiges Interpretieren der rechtlichen und vertraglichen Rahmen breitgemacht hat - um es einmal milde auszudrücken. Das ist unsere Aufgabe. Wir müssen außerdem klären, ob und wann bei offenkundigen Verstößen des ausländischen Partners Meldungen an die BND-Spitze und das Kanzleramt gegangen sind und welche Folgen dies für die weitere Zusammenarbeit hatte. Ganz besonders interessant sind natürlich die Fragen: Wann und mit welchen Folgen?

Die Aufklärungsarbeit des Ausschusses wird sich dann in einem weiteren Schritt mit den USA und mit Großbritannien und deren Nachrichtendiensten beschäftigen; da sind wir nämlich noch gar nicht angekommen. Es geht um die Fragen: Was haben diese explizit in Deutschland unternommen, um, so wie es Edward Snowden nahelegt, ein engmaschiges Spionagenetz anzulegen, um die weltweite Kommunikation - Stichwort „full take“ - überwachen zu können? Bei all dem müssen wir noch klären, was zutrifft.

Diese Aufklärungsarbeit ist die Aufgabe, der wir nun schon seit über einem Jahr jeden Donnerstag in jeder Plenarwoche bis spät in die Nacht nachgehen. Die polizeiliche Ermittlungsarbeit hat als Grundlage die sieben goldenen W - der eine oder andere Polizist wird sie kennen -: Wer hat wann wo was wie mit wem warum gemacht? Das ist die Grundlage der Ermittlungsarbeit. So werden auch wir weiter vorgehen.",data/txt/18102.txt,speech,spd
2908263,102,18,0,,,,441,Beifall bei der SPD sowie bei Abgeordneten der CDU/CSU,data/txt/18102.txt,poi,
2908264,102,18,0,Susanne Mittag (SPD),Susanne Mittag,susanne-mittag,442,"Dazu gehören Sachbeweise, und die brauchen wir bis morgen - es ist nun einmal so -, und zwar in Form von Selektorenlisten. Sie sind wichtig; denn sie sind Sachbeweise. Auch wenn ich mich da wiederhole: Die Selek-torenlisten sind elementar für die Aufklärung. Erste -Zeugenbefragungen dazu haben wir letzte Woche beschlossen; da haben wir unseren Plan schon geändert.

Im vergangenen Jahr und bis heute war die Zusammenarbeit im NSA-Untersuchungsausschuss - um auch einmal etwas Positives zu sagen - über die Fraktionsgrenzen hinweg sehr kooperativ und kollegial. Auch wenn es hier und da und bei der einen oder anderen Frage unterschiedliche Meinungen gab, hat uns bisher immer der gemeinsame Aufklärungswille gute Lösungen für die Arbeit des Ausschusses finden lassen. Das wünsche ich mir bei aller Aufgeregtheit der letzten Tage auch weiterhin.

Eins ist klar: Nur wenn wir - als vom Bundestag einstimmig eingesetzter Untersuchungsausschuss - zusammenarbeiten, können wir unserem Auftrag gerecht -werden. Denn die Widerstände gegen unseren Aufklärungsauftrag sind auf beiden Seiten des Atlantiks gewaltig. Diese Widerstände gilt es zu überwinden. Da sind wir auf einem guten Weg. Als selbstbewusstes Parlament werden wir zusammen einen Weg finden, um sowohl berechtigten Geheimhaltungsinteressen -",data/txt/18102.txt,speech,spd
2908265,102,18,0,Vizepräsidentin Edelgard Bulmahn,Edelgard Bulmahn,edelgard-bulmahn,443,"Frau Kollegin, ich muss auch Sie ermahnen.",data/txt/18102.txt,chair,
2908266,102,18,0,Susanne Mittag (SPD),Susanne Mittag,susanne-mittag,444,"- ja; ich komme zu meinem letzten Satz - als auch dem öffentlichen und unserem eigenen parlamentarischen Anspruch auf Aufklärung gerecht zu werden. Ich denke, das bekommen wir hin.

Herzlichen Dank.",data/txt/18102.txt,speech,spd
2908267,102,18,0,,,,445,Beifall bei der SPD sowie bei Abgeordneten der CDU/CSU,data/txt/18102.txt,poi,
2908268,102,18,0,Susanne Mittag (SPD),Susanne Mittag,susanne-mittag,446,,data/txt/18102.txt,speech,spd
2908269,102,18,0,Vizepräsidentin Edelgard Bulmahn,Edelgard Bulmahn,edelgard-bulmahn,447,Als nächster Redner hat Hans-Christian Ströbele vom Bündnis 90/Die Grünen das Wort.,data/txt/18102.txt,chair,
2908270,102,18,0,Hans-Christian Ströbele (BÜNDNIS 90/DIE GRÜNEN),Hans-Christian Ströbele,hans-christian-strobele,448,"Danke. - Frau Präsidentin! Liebe Kolleginnen und Kollegen! Wir reden heute über Fehler im Kanzleramt. Der Meinung, dass es diese Fehler gab, war ja auch Herr Mayer. Deshalb bedauere ich außerordentlich, dass die Chefin des Kanzleramtes nicht hier ist und dass ihr Platz frei ist.",data/txt/18102.txt,speech,gruene
2908271,102,18,0,,,,449,Beifall beim BÜNDNIS 90/DIE GRÜNEN sowie bei Abgeordneten der LINKEN,data/txt/18102.txt,poi,
2908272,102,18,0,Thomas Strobl [Heilbronn] [CDU/CSU],Thomas Strobl,thomas-strobl,450,Der Chef des Kanzleramts sitzt da! Herr Altmaier ist da!,data/txt/18102.txt,poi,cducsu
2908273,102,18,0,,,,451,Weitere Zurufe von der CDU/CSU,data/txt/18102.txt,poi,
2908274,102,18,0,Hans-Christian Ströbele (BÜNDNIS 90/DIE GRÜNEN),Hans-Christian Ströbele,hans-christian-strobele,452,- Ist er jetzt der Chef?,data/txt/18102.txt,speech,gruene
2908275,102,18,0,,,,453,Lachen bei der CDU/CSU,data/txt/18102.txt,poi,
2908276,102,18,0,Michael Grosse-Brömer [CDU/CSU],Michael Grosse-Brömer,michael-grosse-bromer,454,Das sind Grundbegriffe!,data/txt/18102.txt,poi,cducsu
2908277,102,18,0,Hans-Christian Ströbele (BÜNDNIS 90/DIE GRÜNEN),Hans-Christian Ströbele,hans-christian-strobele,455,- Na gut. Das können Sie der Kanzlerin schonend beibringen.,data/txt/18102.txt,speech,gruene
2908278,102,18,0,Thomas Strobl [Heilbronn] [CDU/CSU],Thomas Strobl,thomas-strobl,456,"Wir machen mal einen kleinen Kurs Staatskunde, Herr Kollege Ströbele!",data/txt/18102.txt,poi,cducsu
2908279,102,18,0,,,,457,Weitere Zurufe von der CDU/CSU,data/txt/18102.txt,poi,
2908280,102,18,0,Hans-Christian Ströbele (BÜNDNIS 90/DIE GRÜNEN),Hans-Christian Ströbele,hans-christian-strobele,458,"Ich hätte nämlich erwartet, dass die Kanzlerin sich als Erstes einmal hier an dieses Pult stellt und definitiv gegenüber dem Parlament, gegenüber der Öffentlichkeit erklärt, dass ihre Aussage im Wahlkampf 2013, dass es keinerlei Wirtschaftsausspähung, keinerlei Wirtschaftsspionage in Deutschland durch die NSA gibt, falsch war. Diese Aussage war falsch, und sie muss sofort korrigiert werden.",data/txt/18102.txt,speech,gruene
2908281,102,18,0,,,,459,Beifall beim BÜNDNIS 90/DIE GRÜNEN sowie bei Abgeordneten der LINKEN,data/txt/18102.txt,poi,
2908282,102,18,0,Thomas Strobl [Heilbronn] [CDU/CSU],Thomas Strobl,thomas-strobl,460,Dafür haben Sie keinen Beleg!,data/txt/18102.txt,poi,cducsu
2908283,102,18,0,Michael Grosse-Brömer [CDU/CSU],Michael Grosse-Brömer,michael-grosse-bromer,461,Können Sie es mal erklären?,data/txt/18102.txt,poi,cducsu
2908284,102,18,0,Hans-Christian Ströbele (BÜNDNIS 90/DIE GRÜNEN),Hans-Christian Ströbele,hans-christian-strobele,462,"Ich will einmal versuchen, nicht für die Ahnungslosen, die Herr Mayer hier genannt hat, sondern für die, die Ahnung haben, die Themen zu sortieren. Es geht hier nicht um Daten über terroristische Anschläge.",data/txt/18102.txt,speech,gruene
2908285,102,18,0,,,,463,Beifall bei Abgeordneten des BÜNDNISSES 90/DIE GRÜNEN,data/txt/18102.txt,poi,
2908286,102,18,0,Hans-Christian Ströbele (BÜNDNIS 90/DIE GRÜNEN),Hans-Christian Ströbele,hans-christian-strobele,464,"Es geht hier auch nicht um Daten von Wirtschaftsunternehmen, deutschen oder europäischen, die möglicherweise Beziehungen zu Waffenhandel haben,",data/txt/18102.txt,speech,gruene
2908287,102,18,0,Thomas Strobl [Heilbronn] [CDU/CSU],Thomas Strobl,thomas-strobl,465,Woher wissen Sie denn das?,data/txt/18102.txt,poi,cducsu
2908288,102,18,0,Hans-Christian Ströbele (BÜNDNIS 90/DIE GRÜNEN),Hans-Christian Ströbele,hans-christian-strobele,466,"zu Drogenhandel, zu Terrorismus oder was auch immer. Es geht hier um Informationen über Personen in Deutschland und in Europa sowie über Firmen in Deutschland und in Europa, die all das nicht haben, sondern die nur in den Fokus der NSA und des Bundesnachrichtendienstes gekommen sind, weil die NSA die Vereinbarung mit dem Bundesnachrichtendienst nicht eingehalten hat. Das, Herr Kollege Mayer, verstößt eklatant gegen deutsches Recht, gegen das deutsche Grundgesetz, und das hat die Bundesregierung zu verantworten. Nur darum geht es.",data/txt/18102.txt,speech,gruene
2908289,102,18,0,,,,467,Beifall beim BÜNDNIS 90/DIE GRÜNEN sowie bei Abgeordneten der LINKEN,data/txt/18102.txt,poi,
2908290,102,18,0,Hans-Christian Ströbele (BÜNDNIS 90/DIE GRÜNEN),Hans-Christian Ströbele,hans-christian-strobele,468,"Dass es nur darum geht, können Sie daraus ersehen, dass diese Selektoren - zum Beispiel „EADS“ oder „Euro-copter“ oder „französische Politiker“ -, die da dauernd durch die Gegend geistern, vom Bundesnachrichtendienst aussortiert und auch nicht wieder hineingenommen wurden, weil sie Ergebnis eklatanter Verstöße gegen die Vereinbarung mit Deutschland waren. So einfach ist das.",data/txt/18102.txt,speech,gruene
2908291,102,18,0,,,,469,Beifall beim BÜNDNIS 90/DIE GRÜNEN,data/txt/18102.txt,poi,
2908292,102,18,0,Hans-Christian Ströbele (BÜNDNIS 90/DIE GRÜNEN),Hans-Christian Ströbele,hans-christian-strobele,470,"Lassen Sie uns darüber reden.

Wir werfen der Bundesregierung nicht vor, dass sie mit den USA zusammenarbeitet, auch nicht, dass sie es im Geheimdienstbereich tut. Ich bin damit seit 15 Jahren oder länger beschäftigt.

(Clemens Binninger [CDU/CSU]: Seit

17 Jahren!)

Wir werfen der Bundesregierung vielmehr vor, dass sie diese Rechtsbrüche - Brüche des deutschen Rechts, des deutschen Grundgesetzes und der Vereinbarungen mit den USA - nicht nur geduldet, toleriert, übersehen, sondern sogar mitgemacht und gefördert hat, und dies, weil der Bundesnachrichtendienst diese Selektoren nicht ausgeschlossen hat.",data/txt/18102.txt,speech,gruene
2908293,102,18,0,Michael Grosse-Brömer [CDU/CSU],Michael Grosse-Brömer,michael-grosse-bromer,471,"Einen Beweis dafür, bitte!",data/txt/18102.txt,poi,cducsu
2908294,102,18,0,Hans-Christian Ströbele (BÜNDNIS 90/DIE GRÜNEN),Hans-Christian Ströbele,hans-christian-strobele,472,"Wir werfen Herrn de Maizière nach wie vor, also auch noch nach der Sitzung vorhin, vor, dass er als zuständiger Chef im Kanzleramt",data/txt/18102.txt,speech,gruene
2908295,102,18,0,Thomas Strobl [Heilbronn] [CDU/CSU],Thomas Strobl,thomas-strobl,473,Also doch „Chef im Kanzleramt“! Er kann es ja doch!,data/txt/18102.txt,poi,cducsu
2908296,102,18,0,Hans-Christian Ströbele (BÜNDNIS 90/DIE GRÜNEN),Hans-Christian Ströbele,hans-christian-strobele,474,"nicht das Notwendige getan hat, um das abzustellen.",data/txt/18102.txt,speech,gruene
2908297,102,18,0,,,,475,Beifall beim BÜNDNIS 90/DIE GRÜNEN sowie bei Abgeordneten der LINKEN,data/txt/18102.txt,poi,
2908298,102,18,0,Hans-Christian Ströbele (BÜNDNIS 90/DIE GRÜNEN),Hans-Christian Ströbele,hans-christian-strobele,476,"Sie haben nämlich vorhin nicht erwähnt, dass dies seit 2005 im Bundesnachrichtendienst bekannt war, dass es spätestens seit 2010, aber auch schon vorher im Kanzleramt hätte bekannt sein müssen.

Sie haben gesagt, es hätten diese Namen - EADS und die anderer Firmen - vorgelegen; sie seien nicht Gegenstand der Vermerke gewesen.",data/txt/18102.txt,speech,gruene
2908299,102,18,0,Clemens Binninger [CDU/CSU],Clemens Binninger,clemens-binninger,477,2010 war er noch nicht im Amt!,data/txt/18102.txt,poi,cducsu
2908300,102,18,0,Michael Grosse-Brömer [CDU/CSU],Michael Grosse-Brömer,michael-grosse-bromer,478,Vorsicht! Namen hat er gar nicht genannt!,data/txt/18102.txt,poi,cducsu
2908301,102,18,0,Hans-Christian Ströbele (BÜNDNIS 90/DIE GRÜNEN),Hans-Christian Ströbele,hans-christian-strobele,479,"Sie haben aber nicht gesagt, dass es in den Vermerken sehr wohl Anhaltspunkte dafür gibt, dass Herr de Maizière hätte tätig werden müssen. Dennoch ist er nicht tätig geworden, weder in seinem Amt noch beim Bundesnachrichtendienst noch gegenüber der NSA und den US-amerikanischen Freunden. Das werfen wir ihm vor.",data/txt/18102.txt,speech,gruene
2908302,102,18,0,,,,480,Beifall beim BÜNDNIS 90/DIE GRÜNEN sowie bei Abgeordneten der LINKEN,data/txt/18102.txt,poi,
2908303,102,18,0,Hans-Christian Ströbele (BÜNDNIS 90/DIE GRÜNEN),Hans-Christian Ströbele,hans-christian-strobele,481,"Herr Mayer, auch Sie sagen, es habe Fehler gegeben. Ja, es hat Fehler gegeben. Aber, Herr Mayer: Diese Fehler sind so schlimm, dass dies organisatorische und personelle Konsequenzen haben muss, sowohl im Bundeskanzleramt als auch im Bundesnachrichtendienst, und zwar erhebliche.",data/txt/18102.txt,speech,gruene
2908304,102,18,0,,,,482,Beifall beim BÜNDNIS 90/DIE GRÜNEN sowie bei Abgeordneten der LINKEN,data/txt/18102.txt,poi,
2908305,102,18,0,Hans-Christian Ströbele (BÜNDNIS 90/DIE GRÜNEN),Hans-Christian Ströbele,hans-christian-strobele,483,,data/txt/18102.txt,speech,gruene
2908306,102,18,0,Vizepräsidentin Edelgard Bulmahn,Edelgard Bulmahn,edelgard-bulmahn,484,Vielen Dank. - Als nächster Redner hat Manfred Grund von der CDU/CSU-Fraktion das Wort.,data/txt/18102.txt,chair,
2908307,102,18,0,,,,485,Beifall bei der CDU/CSU,data/txt/18102.txt,poi,
2908308,102,18,0,Vizepräsidentin Edelgard Bulmahn,Edelgard Bulmahn,edelgard-bulmahn,486,,data/txt/18102.txt,chair,
